body,author_fullname,author.name,controversiality,created,downs,fullname,id,is_root,link_author,link_id,link_permalink,link_title,permalink,score,subreddit_name_prefixed,total_awards_received,ups
Posted - https://www.reddit.com/r/baltimore/comments/ttxs62/update_a_little_under_three_weeks_ago_i_posted_to/,t2_13vbx6et,Captainxray,0,1648837564.0,0,t1_i30jmq1,i30jmq1,False,Captainxray,t3_tcl4n1,https://www.reddit.com/r/baltimore/comments/tcl4n1/does_anyone_have_any_experience_with_homeless/,Does anyone have any experience with homeless shelters in Baltimore?,/r/baltimore/comments/tcl4n1/does_anyone_have_any_experience_with_homeless/i30jmq1/,2,r/baltimore,0,2
Groundwork kitchen in pigtown! Super cool mission and it helps the Baltimore community! Win win! Plus the space is 🤩. Good luck!,t2_eha7de7i,skateordye_33,0,1648837172.0,0,t1_i30io1w,i30io1w,True,edgar__allan__bro,t3_ttr74c,https://www.reddit.com/r/baltimore/comments/ttr74c/where_are_the_best_places_in_baltimore_for/,Where are the best places in Baltimore for throwing corporate events?,/r/baltimore/comments/ttr74c/where_are_the_best_places_in_baltimore_for/i30io1w/,1,r/baltimore,0,1
">With this mindset, shouldn’t the city be against any new entertainment opening up?

No, they should just be against paying any private for-profit entertainment business's overhead for them with tax dollars.

If a city stopped funding stadiums, the void in entertainment would be filled just fine with other businesses that pay their own overhead and the city would have more money for other things. The problem is the nature of the NFL, people are attached to their football teams and private owners control them and can pick up and leave if you don't pay them to be here.",t2_84rw0dwq,hop_mantis,0,1648836818.0,0,t1_i30hsue,i30hsue,False,7thtrumpetsoonplease,t3_tthurg,https://www.reddit.com/r/baltimore/comments/tthurg/why_do_taxpayers_fund_sports_stadiums/,Why do taxpayers fund sports stadiums?,/r/baltimore/comments/tthurg/why_do_taxpayers_fund_sports_stadiums/i30hsue/,3,r/baltimore,0,3
NLB is incredible. Seriously a gem!,t2_bhilfghx,PulsatingOrb,0,1648836633.0,0,t1_i30hcjh,i30hcjh,True,WhoGunnaCheckMeBoo,t3_ttfdnx,https://www.reddit.com/r/baltimore/comments/ttfdnx/two_years_after_opening_in_old_goucher_no_land/,"Two Years After Opening in Old Goucher, No Land Beyond to Celebrate Debut",/r/baltimore/comments/ttfdnx/two_years_after_opening_in_old_goucher_no_land/i30hcjh/,2,r/baltimore,0,2
"No I know, but he's usually pretty precise with his language.",t2_bx6iu,z3mcs,1,1648836481.0,0,t1_i30gz94,i30gz94,False,JonWilso,t3_ttv6vr,https://www.reddit.com/r/baltimore/comments/ttv6vr/justin_fenton_on_twitter_breaking_after_insisting/,"Justin Fenton on Twitter - Breaking: After insisting on a speedy trial, Marilyn Mosby's attorneys have asked for her May 2 federal trial to be postponed to SEPTEMBER",/r/baltimore/comments/ttv6vr/justin_fenton_on_twitter_breaking_after_insisting/i30gz94/,1,r/baltimore,0,1
The Engineers Club is pretty spectacular: https://www.esb.org/club/scripts/section/section.asp?NS=WED,t2_1ysonhyl,WouldYouPunchGod,0,1648836447.0,0,t1_i30gwae,i30gwae,True,edgar__allan__bro,t3_ttr74c,https://www.reddit.com/r/baltimore/comments/ttr74c/where_are_the_best_places_in_baltimore_for/,Where are the best places in Baltimore for throwing corporate events?,/r/baltimore/comments/ttr74c/where_are_the_best_places_in_baltimore_for/i30gwae/,9,r/baltimore,0,9
While on the topic of tattoos does anyone in Baltimore specialize in pixelated 8bit style tattoos?,t2_1z4f6lez,BronzeEast,0,1648836227.0,0,t1_i30gclm,i30gclm,True,Bon_Bagner,t3_ttpi8n,https://www.reddit.com/r/baltimore/comments/ttpi8n/tattoo_question/,Tattoo question 😤,/r/baltimore/comments/ttpi8n/tattoo_question/i30gclm/,1,r/baltimore,0,1
He got mugged coming back from Mt Vernon and just moved to NYC and was assaulted within 1.5 days after getting super intoxicated and sitting on someone’s corner. I need to go to Alanon. This is my SO…,t2_a849a,Trailmagic,0,1648836211.0,0,t1_i30gb54,i30gb54,False,Trailmagic,t3_t8eyek,https://www.reddit.com/r/baltimore/comments/t8eyek/friend_is_lost_and_drunk_downtown_can_anyone_id/,Friend is lost and drunk downtown. Can anyone ID the building behind him? Has purple vertical lights,/r/baltimore/comments/t8eyek/friend_is_lost_and_drunk_downtown_can_anyone_id/i30gb54/,1,r/baltimore,0,1
Nice! Thanks,t2_51ek1amh,physicallyatherapist,0,1648835866.0,0,t1_i30fgpz,i30fgpz,False,7thtrumpetsoonplease,t3_tthurg,https://www.reddit.com/r/baltimore/comments/tthurg/why_do_taxpayers_fund_sports_stadiums/,Why do taxpayers fund sports stadiums?,/r/baltimore/comments/tthurg/why_do_taxpayers_fund_sports_stadiums/i30fgpz/,1,r/baltimore,0,1
"The same baltimore cops that ran a racketeering ring?

No, I don't suspect they're here to help.",t2_1685il,PoopIsAlwaysSunny,1,1648835698.0,0,t1_i30f1m4,i30f1m4,False,goodnewsonly3702,t3_ttvv75,https://www.reddit.com/r/baltimore/comments/ttvv75/harford_county_baltimore_drug_dealer_pleads/,Harford County: Baltimore drug dealer pleads guilty to giving cocaine fentanyl to fatal overdose victim,/r/baltimore/comments/ttvv75/harford_county_baltimore_drug_dealer_pleads/i30f1m4/,4,r/baltimore,0,4
"I went to a charity chili cook-off last fall at Camden Yards. It was the entire length of the Eutaw St promenade with a stage on one end and access to the bars on the balcony overlooking center field. Good times. 

I also stumbled into the Under Armour holiday party at Power Plant. Free drinks and food at participating bars and restaurants.",t2_j4cr0ww,Armistarphoto,0,1648835669.0,0,t1_i30eyyo,i30eyyo,True,edgar__allan__bro,t3_ttr74c,https://www.reddit.com/r/baltimore/comments/ttr74c/where_are_the_best_places_in_baltimore_for/,Where are the best places in Baltimore for throwing corporate events?,/r/baltimore/comments/ttr74c/where_are_the_best_places_in_baltimore_for/i30eyyo/,2,r/baltimore,0,2
Do you mean Marilyn Mosby decides how it works?  Dang. If cops went after dealers the city be a lot safer. A lot of people die from drugs.,t2_iuentkmg,goodnewsonly3702,1,1648835167.0,0,t1_i30dp62,i30dp62,False,goodnewsonly3702,t3_ttvv75,https://www.reddit.com/r/baltimore/comments/ttvv75/harford_county_baltimore_drug_dealer_pleads/,Harford County: Baltimore drug dealer pleads guilty to giving cocaine fentanyl to fatal overdose victim,/r/baltimore/comments/ttvv75/harford_county_baltimore_drug_dealer_pleads/i30dp62/,0,r/baltimore,0,0
Mosby,t2_dhtpnh9q,FullEntologist,1,1648835001.0,0,t1_i30dacy,i30dacy,False,goodnewsonly3702,t3_ttvv75,https://www.reddit.com/r/baltimore/comments/ttvv75/harford_county_baltimore_drug_dealer_pleads/,Harford County: Baltimore drug dealer pleads guilty to giving cocaine fentanyl to fatal overdose victim,/r/baltimore/comments/ttvv75/harford_county_baltimore_drug_dealer_pleads/i30dacy/,0,r/baltimore,0,0
"Making Moves LLC, the owner/ operator is my best friend. He has done a handful of out of state moves over the past couple years. Surely he will give you a quote. I will DM his name and phone number.",t2_153v44,ezduzit24,0,1648834590.0,0,t1_i30c8zi,i30c8zi,True,MSteds728,t3_ttqmvx,https://www.reddit.com/r/baltimore/comments/ttqmvx/out_of_state_moving_company_recs/,Out of State Moving Company Recs,/r/baltimore/comments/ttqmvx/out_of_state_moving_company_recs/i30c8zi/,2,r/baltimore,0,2
"In Baltimore City, the primary IS the election.",t2_4s7yi,bobcat7781,0,1648833927.0,0,t1_i30ajzr,i30ajzr,False,JonWilso,t3_ttv6vr,https://www.reddit.com/r/baltimore/comments/ttv6vr/justin_fenton_on_twitter_breaking_after_insisting/,"Justin Fenton on Twitter - Breaking: After insisting on a speedy trial, Marilyn Mosby's attorneys have asked for her May 2 federal trial to be postponed to SEPTEMBER",/r/baltimore/comments/ttv6vr/justin_fenton_on_twitter_breaking_after_insisting/i30ajzr/,55,r/baltimore,0,55
"People love their sports teams and don't want them to move. Which they will, if they think.they can get a better deal elsewhere, as Baltimore well knows. It's the owner's putting city governments again each other to see who will give them the best deal. Much like Amazon did when building their new headquarters. As long as some cities are willing to play the game, it won't end. I don't see a way of making that change, though I personally don't care if they stay or go.",t2_1f8lli44,ziggy3610,0,1648833918.0,0,t1_i30aj6p,i30aj6p,True,7thtrumpetsoonplease,t3_tthurg,https://www.reddit.com/r/baltimore/comments/tthurg/why_do_taxpayers_fund_sports_stadiums/,Why do taxpayers fund sports stadiums?,/r/baltimore/comments/tthurg/why_do_taxpayers_fund_sports_stadiums/i30aj6p/,4,r/baltimore,0,4
"hello! i lived in charles village for 3/4 years at towson, and do not drive. i biked most days, however i'm not an avg cyclist and don't mind the sketchy ride with traffic up greenmount, nor riding in inclement weather. its about a 25' bike ride and entirely uphill, but there's showers on the ground floor of the college of liberal arts, so you won't be too musty for your first class.

there's the [collegetown shuttle](https://baltimorecollegetown.org/shuttle/schedule/), which has stops @ hopkins homewood, and multiple at/in towson - it's really reliable, and i used it when i for whatever couldn't bike, or was going to be staying in towson later than 10p.

there's also 2 public bus lines - the Red and the 55 - they pick up on greenmount and charles streets respectively, and your results may vary between on-time accuracies. the 55 is a longer route, however it doesn't make stops in sketchier parts of the city. the Red drops you off like literally across from Stephens Hall, while the 55 drops you off at West Village. i took these buses in emergencies only, and was always late.

apartments on 33rd or university were the cheapest when i was looking, plus easy access to the shuttle. i recommend housing groups on facebook, or walking around the neighborhood if you can - because there are often ""For Rent"" signs in windows that do not come up online",t2_asxgl,bOhsohard,0,1648833416.0,0,t1_i3097t3,i3097t3,True,Living_Yesterday_480,t3_tttems,https://www.reddit.com/r/baltimore/comments/tttems/ideas_on_where_to_live_for_prospective_students/,Ideas on where to live for prospective students at Hopkins AND Towson University?,/r/baltimore/comments/tttems/ideas_on_where_to_live_for_prospective_students/i3097t3/,7,r/baltimore,0,7
Harford county police put a drug dealer in prison. Is this some thing Baltimore cops can do? People od around my hood a lot. There’s lots of addicts and dealers. Baltimore cops don’t do any thing. A man od by Saint Agnes hospital. He was on the bus stop bench. I saw him. The cops didn’t help him. They didn’t look for his phone or any thing. They stood round laughing til the ambulance came. If cops searched his phone maybe they could arrest the dealer. Is there a reason they don’t do that in Baltimore? They did it in Harford. Maybe this is a way fo get crime down.,t2_iuentkmg,goodnewsonly3702,0,1648833332.0,0,t1_i309011,i309011,True,goodnewsonly3702,t3_ttvv75,https://www.reddit.com/r/baltimore/comments/ttvv75/harford_county_baltimore_drug_dealer_pleads/,Harford County: Baltimore drug dealer pleads guilty to giving cocaine fentanyl to fatal overdose victim,/r/baltimore/comments/ttvv75/harford_county_baltimore_drug_dealer_pleads/i309011/,-5,r/baltimore,0,-5
Sagamore Pendry Hotel - best in the city.,t2_8dtwisce,Devoted_2My_Hotwife,0,1648833315.0,0,t1_i308yij,i308yij,True,edgar__allan__bro,t3_ttr74c,https://www.reddit.com/r/baltimore/comments/ttr74c/where_are_the_best_places_in_baltimore_for/,Where are the best places in Baltimore for throwing corporate events?,/r/baltimore/comments/ttr74c/where_are_the_best_places_in_baltimore_for/i308yij/,0,r/baltimore,0,0
"No prob, I also feel the need to express just a small amount of caution though. As with any scene in any city, there are people out there that’ll seek to take advantage of you especially if you happen to be a woman. Last year there was a pretty big exposure of some musicians and workers within the art scene for doing stuff ranging from kinda shitty (cheating, getting into fights etc.) to entirely fucked up (drugging women, rape). 

In my own experience I’ve made a few friends in the art scene as I am mostly a spectator, in that I don’t create much, I just attend shows and buy stuff if I have the cash. But with all that said, I’d recommend coming to events with a friend or something, as I would with any city you’re trying to jump into. There’s great people and also bad people masquerading as great people. So I’d come in with a knowledge of what your comfort zone is in regards to other people and know when you wanna bounce if something isn’t for you.

I also notice you go to JHU, and I’ve been out of there for like 5 years but there was a kinda burgeoning thing going on there before I graduated. Did that die out? If so that’s a real shame; there were interesting and motivated people making music and art for a minute.",t2_az8qr,DistortedAudio,0,1648833253.0,0,t1_i308sso,i308sso,False,Wooden_Anxiety5426,t3_tt5qea,https://www.reddit.com/r/baltimore/comments/tt5qea/underground_music_scene/,Underground Music Scene?,/r/baltimore/comments/tt5qea/underground_music_scene/i308sso/,3,r/baltimore,0,3
Lithuanian Hall,t2_bzi6v,OTTER887,0,1648832871.0,0,t1_i307tkf,i307tkf,True,edgar__allan__bro,t3_ttr74c,https://www.reddit.com/r/baltimore/comments/ttr74c/where_are_the_best_places_in_baltimore_for/,Where are the best places in Baltimore for throwing corporate events?,/r/baltimore/comments/ttr74c/where_are_the_best_places_in_baltimore_for/i307tkf/,1,r/baltimore,0,1
I've been trying to get an appointment from artists who specialize in a certain style since August. A lot of places are backed up,t2_fqn83,ghoulinpajamas,0,1648832523.0,0,t1_i306x25,i306x25,False,Bon_Bagner,t3_ttpi8n,https://www.reddit.com/r/baltimore/comments/ttpi8n/tattoo_question/,Tattoo question 😤,/r/baltimore/comments/ttpi8n/tattoo_question/i306x25/,1,r/baltimore,0,1
🤡,t2_bhilfghx,PulsatingOrb,0,1648832409.0,0,t1_i306mbf,i306mbf,True,JonWilso,t3_ttv6vr,https://www.reddit.com/r/baltimore/comments/ttv6vr/justin_fenton_on_twitter_breaking_after_insisting/,"Justin Fenton on Twitter - Breaking: After insisting on a speedy trial, Marilyn Mosby's attorneys have asked for her May 2 federal trial to be postponed to SEPTEMBER",/r/baltimore/comments/ttv6vr/justin_fenton_on_twitter_breaking_after_insisting/i306mbf/,7,r/baltimore,0,7
"Don't know if they'll let me do a new post, but I'll see what I can do! Thanks for checkin' in.",t2_13vbx6et,Captainxray,0,1648832396.0,0,t1_i306l3c,i306l3c,False,Captainxray,t3_tcl4n1,https://www.reddit.com/r/baltimore/comments/tcl4n1/does_anyone_have_any_experience_with_homeless/,Does anyone have any experience with homeless shelters in Baltimore?,/r/baltimore/comments/tcl4n1/does_anyone_have_any_experience_with_homeless/i306l3c/,2,r/baltimore,0,2
"""Upon further consideration and reflection, Ms. Mosby agrees (with the judge to move the trial)"".  Uh huh. lol.  Just resign yo.  Nick too.  I don't get why Justin is saying September would be after the election?  Unless he means the primary (July 19). He must mean the primary. Hanna's still waiting in the general, so.",t2_bx6iu,z3mcs,0,1648832183.0,0,t1_i3060og,i3060og,True,JonWilso,t3_ttv6vr,https://www.reddit.com/r/baltimore/comments/ttv6vr/justin_fenton_on_twitter_breaking_after_insisting/,"Justin Fenton on Twitter - Breaking: After insisting on a speedy trial, Marilyn Mosby's attorneys have asked for her May 2 federal trial to be postponed to SEPTEMBER",/r/baltimore/comments/ttv6vr/justin_fenton_on_twitter_breaking_after_insisting/i3060og/,9,r/baltimore,0,9
Sent you a message,t2_75oiq,shepdashep,0,1648832136.0,0,t1_i305w2a,i305w2a,True,nevermoredoor,t3_tt7cs6,https://www.reddit.com/r/baltimore/comments/tt7cs6/free_tickets_x2_for_actors_w_social_station_metro/,Free tickets (x2) for ACTORS w/ Social Station @ Metro Gallery TONIGHT,/r/baltimore/comments/tt7cs6/free_tickets_x2_for_actors_w_social_station_metro/i305w2a/,1,r/baltimore,0,1
"[""Rumor has it"" is wrong, lol](https://elections.maryland.gov/elections/2022/primary_candidates/gen_cand_lists_2022_3_by_county_3.html)",t2_bx6iu,z3mcs,0,1648832072.0,0,t1_i305pws,i305pws,False,GovernorOfReddit,t3_ttaonm,https://www.reddit.com/r/baltimore/comments/ttaonm/governor_hogan_endorses_thiru_for_states_attorney/,Governor Hogan endorses Thiru for States Attorney,/r/baltimore/comments/ttaonm/governor_hogan_endorses_thiru_for_states_attorney/i305pws/,2,r/baltimore,0,2
"[Follow-up Tweet from Justin Fenton at the Baltimore Banner](https://twitter.com/justin_fenton/status/1509924754324660226)

>The court just reaffirmed the trial date in an amended scheduling order two days ago. But in their request, Mosby's attorneys say Judge Griggsby floated the idea of moving the trial to September and that they now agree",t2_bx6iu,z3mcs,0,1648831904.0,0,t1_i305adk,i305adk,True,JonWilso,t3_ttv6vr,https://www.reddit.com/r/baltimore/comments/ttv6vr/justin_fenton_on_twitter_breaking_after_insisting/,"Justin Fenton on Twitter - Breaking: After insisting on a speedy trial, Marilyn Mosby's attorneys have asked for her May 2 federal trial to be postponed to SEPTEMBER",/r/baltimore/comments/ttv6vr/justin_fenton_on_twitter_breaking_after_insisting/i305adk/,1,r/baltimore,0,1
Then you clearly don’t drive through the city much,t2_1685il,PoopIsAlwaysSunny,0,1648831626.0,0,t1_i304kfw,i304kfw,False,[deleted],t3_ttsv3j,https://www.reddit.com/r/baltimore/comments/ttsv3j/scweegee_kids_are_the_best/,scweegee kids are the best,/r/baltimore/comments/ttsv3j/scweegee_kids_are_the_best/i304kfw/,1,r/baltimore,0,1
"Yes! Stumbled across this place when I first moved here glad to see it's finally ""Opening""!",t2_3dtbk,Honeyblade,0,1648831586.0,0,t1_i304gnx,i304gnx,True,WhoGunnaCheckMeBoo,t3_ttfdnx,https://www.reddit.com/r/baltimore/comments/ttfdnx/two_years_after_opening_in_old_goucher_no_land/,"Two Years After Opening in Old Goucher, No Land Beyond to Celebrate Debut",/r/baltimore/comments/ttfdnx/two_years_after_opening_in_old_goucher_no_land/i304gnx/,3,r/baltimore,0,3
"The campuses are 4 miles apart.  There’s decent bike infrastructure on Roland and University between the two. The apartment complexes nearby are Rodgers Forge Apartments near Towson. University West, Carolina, Hopkins House, Rotunda… I mean there’s a ton near Hopkins.  Just look on Apartment finder.",t2_h14ac,winnower8,0,1648830842.0,0,t1_i302k0j,i302k0j,True,Living_Yesterday_480,t3_tttems,https://www.reddit.com/r/baltimore/comments/tttems/ideas_on_where_to_live_for_prospective_students/,Ideas on where to live for prospective students at Hopkins AND Towson University?,/r/baltimore/comments/tttems/ideas_on_where_to_live_for_prospective_students/i302k0j/,2,r/baltimore,0,2
"Do an overlay of the various shuttle maps. The Collegetown shuttle runs up to Towson through at least Charles Village, and the JHU shuttles will run from JHH/BPSH to Homewood. Not sure how much overlap there is on the routes, but that's the obvious place to start.",t2_e7uaw,todareistobmore,0,1648830323.0,0,t1_i30189g,i30189g,True,Living_Yesterday_480,t3_tttems,https://www.reddit.com/r/baltimore/comments/tttems/ideas_on_where_to_live_for_prospective_students/,Ideas on where to live for prospective students at Hopkins AND Towson University?,/r/baltimore/comments/tttems/ideas_on_where_to_live_for_prospective_students/i30189g/,3,r/baltimore,0,3
"My girlfriend and I were in the same boat but luckily we have a car so she's able to make the short drive to TU. I would recommend living near Homewood. It will give you access to the shuttles, the convince of stores if you want to grab a bite to eat late at night, the safety/peace of mind that the rest of the city can't offer, and also allow for access to the 51 for you get to Towson.",t2_2g2fxwaj,shonenmishka,0,1648830179.0,0,t1_i300uzx,i300uzx,True,Living_Yesterday_480,t3_tttems,https://www.reddit.com/r/baltimore/comments/tttems/ideas_on_where_to_live_for_prospective_students/,Ideas on where to live for prospective students at Hopkins AND Towson University?,/r/baltimore/comments/tttems/ideas_on_where_to_live_for_prospective_students/i300uzx/,3,r/baltimore,0,3
"This place has many private rooms and a wide allowance of acceptable events. [https://baltimoreplayhouse.com/](https://baltimoreplayhouse.com/)

Peabody Library",t2_9di5k,Otto_Von_Bisquick,0,1648829983.0,0,t1_i300cws,i300cws,True,edgar__allan__bro,t3_ttr74c,https://www.reddit.com/r/baltimore/comments/ttr74c/where_are_the_best_places_in_baltimore_for/,Where are the best places in Baltimore for throwing corporate events?,/r/baltimore/comments/ttr74c/where_are_the_best_places_in_baltimore_for/i300cws/,5,r/baltimore,0,5
Love this place and excited to attend on Saturday but can we just drop in? Was a little confused with the schedule.,t2_7umt1,llamalobster,0,1648829882.0,0,t1_i3003f8,i3003f8,True,WhoGunnaCheckMeBoo,t3_ttfdnx,https://www.reddit.com/r/baltimore/comments/ttfdnx/two_years_after_opening_in_old_goucher_no_land/,"Two Years After Opening in Old Goucher, No Land Beyond to Celebrate Debut",/r/baltimore/comments/ttfdnx/two_years_after_opening_in_old_goucher_no_land/i3003f8/,2,r/baltimore,0,2
"If you’re looking to volunteer you could find a neighborhood association in an area that is a bit more blighted. 

Usually there’s some really nice people doing work like cleaning up trash/green spaces etc, who currently won’t turn down extra volunteers, even if you don’t live there.",t2_dgigptg4,fre_d_dy,0,1648829846.0,0,t1_i30004f,i30004f,False,AutoModerator,t3_ttn239,https://www.reddit.com/r/baltimore/comments/ttn239/monthly_rbaltimore_chat_april_2022/,Monthly r/Baltimore Chat - - April 2022,/r/baltimore/comments/ttn239/monthly_rbaltimore_chat_april_2022/i30004f/,3,r/baltimore,0,3
Also check out the 21st floor of the World Trade Center. They have two large areas to rent for corporate events and big affairs. Windows from the floor to the ceiling overlooking the harbor and city. I got married there. You would need to provide the entertainment but that view definitely sets the stage.,t2_t3827,Kraqrjack,0,1648829800.0,0,t1_i2zzvyu,i2zzvyu,True,edgar__allan__bro,t3_ttr74c,https://www.reddit.com/r/baltimore/comments/ttr74c/where_are_the_best_places_in_baltimore_for/,Where are the best places in Baltimore for throwing corporate events?,/r/baltimore/comments/ttr74c/where_are_the_best_places_in_baltimore_for/i2zzvyu/,5,r/baltimore,0,5
"I believe the NSA museum is still closed since covid, could be wrong though.

A cool place to check out could be Crabtowne, its a seafood/pinball arcade.

About 10 minute drive from the airport.",t2_7g6h8,Shento,0,1648829725.0,0,t1_i2zzp3p,i2zzp3p,False,WeShineUnderOneSun,t3_tqo3ry,https://www.reddit.com/r/baltimore/comments/tqo3ry/whats_up_baltimore_im_a_rhode_islander_spending_5/,Whats up Baltimore!! I'm a Rhode Islander spending 5 hours during a layover at the airport. What do you recommend I do for that 5 hours?,/r/baltimore/comments/tqo3ry/whats_up_baltimore_im_a_rhode_islander_spending_5/i2zzp3p/,1,r/baltimore,0,1
Tax return szn is always busier lol,t2_be6ss,Bon_Bagner,0,1648829338.0,0,t1_i2zyq4k,i2zyq4k,False,Bon_Bagner,t3_ttpi8n,https://www.reddit.com/r/baltimore/comments/ttpi8n/tattoo_question/,Tattoo question 😤,/r/baltimore/comments/ttpi8n/tattoo_question/i2zyq4k/,1,r/baltimore,0,1
La Barrita! Traditional Argentinan steakhouse nestled in a charming corner rowhome. Cant beat it and you dont have to deal with the stuffiness of fancy steakhouses,t2_157veh,jondhi23,0,1648829102.0,0,t1_i2zy4oi,i2zy4oi,True,PoppaloFlava,t3_ttf0hx,https://www.reddit.com/r/baltimore/comments/ttf0hx/birthday_steak_dinner_and_martini/,Birthday steak dinner and martini,/r/baltimore/comments/ttf0hx/birthday_steak_dinner_and_martini/i2zy4oi/,2,r/baltimore,0,2
cool place but I don't think it's quite big enough?,t2_t6ayt,wbruce098,0,1648829096.0,0,t1_i2zy43z,i2zy43z,False,edgar__allan__bro,t3_ttr74c,https://www.reddit.com/r/baltimore/comments/ttr74c/where_are_the_best_places_in_baltimore_for/,Where are the best places in Baltimore for throwing corporate events?,/r/baltimore/comments/ttr74c/where_are_the_best_places_in_baltimore_for/i2zy43z/,1,r/baltimore,0,1
I get that. Chick-fil-A is a guilty pleasure of mine too. I’m just noting the reason for the downvotes for those who might have questions. It’s just extra tough when some of us have black friends who have been treated like garbage in their establishment. Even Chick-fil-a doesn’t kick the gays out!,t2_o9pg2,noahsense,0,1648829092.0,0,t1_i2zy3s2,i2zy3s2,False,PoppaloFlava,t3_ttf0hx,https://www.reddit.com/r/baltimore/comments/ttf0hx/birthday_steak_dinner_and_martini/,Birthday steak dinner and martini,/r/baltimore/comments/ttf0hx/birthday_steak_dinner_and_martini/i2zy3s2/,2,r/baltimore,0,2
Always need more! <3,t2_dzinj,kiarrith,0,1648828915.0,0,t1_i2zxnp3,i2zxnp3,False,locker1313,t3_tt6np2,https://www.reddit.com/r/baltimore/comments/tt6np2/baltimore_fishbowl_blacksmiths_platinum_amala_set/,"Baltimore Fishbowl | Blacksmiths, Platinum Amala set to join Lexington Market -",/r/baltimore/comments/tt6np2/baltimore_fishbowl_blacksmiths_platinum_amala_set/i2zxnp3/,2,r/baltimore,0,2
Museum of Industry. Went there for a cocktail hour and reception for a wedding. It was a very nice venue.,t2_2jodpj32,murthivelli123,0,1648828911.0,0,t1_i2zxndw,i2zxndw,True,edgar__allan__bro,t3_ttr74c,https://www.reddit.com/r/baltimore/comments/ttr74c/where_are_the_best_places_in_baltimore_for/,Where are the best places in Baltimore for throwing corporate events?,/r/baltimore/comments/ttr74c/where_are_the_best_places_in_baltimore_for/i2zxndw/,17,r/baltimore,0,17
