body,author_fullname,author.name,controversiality,created,downs,fullname,id,is_root,link_author,link_id,link_permalink,link_title,permalink,score,subreddit_name_prefixed,total_awards_received,ups
Not all Baltimore hospitals are bad. Maybe that’s why you are getting downvotes,t2_341jcpni,sdawg1611,0,1649009674.0,0,t1_i3925kj,i3925kj,False,YggdrasilsLeaf,t3_tv309f,https://www.reddit.com/r/baltimore/comments/tv309f/anyone_know_what_the_deal_is_with_gbmc_lately_had/,"Anyone know what the deal is with GBMC lately? Had a super bad experience yesterday, like a “would qualify for a malpractice suit as well as breaking multiple HIPPAA laws” kinda experience.",/r/baltimore/comments/tv309f/anyone_know_what_the_deal_is_with_gbmc_lately_had/i3925kj/,1,r/baltimore,0,1
"Bro I've lived all over the country 🤣 sorry you're stuck in Baltimore and are pimping it out for likes on reddit. Fucking dumb ass. You really tried to lie and say dealer's sell needles as ""new ones"" as if they keep ""old ones"" on themselves to sell. 😭😭😭 you're a fucking idiot. You're a perfect example of gentrification. This shit is cool to you and it's sad",t2_7jlmkiny,Dogfood60aGhmu,0,1649009639.0,0,t1_i3922jy,i3922jy,False,w3tterisb3tter,t3_tuszfc,https://www.reddit.com/r/baltimore/comments/tuszfc/witt_baltimore_i_see_them_all_over_the_sidewalk_i/,"WITT Baltimore? I see them all over the sidewalk. I assume nefarious activities, but can't identify what.",/r/baltimore/comments/tuszfc/witt_baltimore_i_see_them_all_over_the_sidewalk_i/i3922jy/,1,r/baltimore,0,1
I’m sorry you’re in a position to experience all that. I know it really brought my neighborhood down.,t2_iuentkmg,goodnewsonly3702,0,1649009559.0,0,t1_i391vdd,i391vdd,False,w3tterisb3tter,t3_tuszfc,https://www.reddit.com/r/baltimore/comments/tuszfc/witt_baltimore_i_see_them_all_over_the_sidewalk_i/,"WITT Baltimore? I see them all over the sidewalk. I assume nefarious activities, but can't identify what.",/r/baltimore/comments/tuszfc/witt_baltimore_i_see_them_all_over_the_sidewalk_i/i391vdd/,1,r/baltimore,0,1
Where would you go in Baltimore or EC for Sundubu-jjigae and/or kimchi fried rice?,t2_137fz9,drillpublisher,0,1649009378.0,0,t1_i391f5n,i391f5n,False,zqwu8391,t3_tulfr0,https://www.reddit.com/r/baltimore/comments/tulfr0/best_restaurant_food_youd_drive_to_the_suburbs_for/,Best restaurant / food you’d drive to the suburbs for?,/r/baltimore/comments/tulfr0/best_restaurant_food_youd_drive_to_the_suburbs_for/i391f5n/,1,r/baltimore,0,1
"Bro they do not be doing that shit. ""New ones for new needles"" you think drug dealers pass out needles?  😭😭😭 that's how I know you're lying",t2_7jlmkiny,Dogfood60aGhmu,0,1649008284.0,0,t1_i38ypt4,i38ypt4,False,w3tterisb3tter,t3_tuszfc,https://www.reddit.com/r/baltimore/comments/tuszfc/witt_baltimore_i_see_them_all_over_the_sidewalk_i/,"WITT Baltimore? I see them all over the sidewalk. I assume nefarious activities, but can't identify what.",/r/baltimore/comments/tuszfc/witt_baltimore_i_see_them_all_over_the_sidewalk_i/i38ypt4/,1,r/baltimore,0,1
I appreciate the recommendations! I’m totally checking those out. Thank you ❤️,t2_3rjr5y9p,wendywinehouse,0,1649008073.0,0,t1_i38y767,i38y767,False,wendywinehouse,t3_tvdup0,https://www.reddit.com/r/baltimore/comments/tvdup0/yesterday_i_took_my_dog_to_the_patterson_dog_park/,Yesterday I took my dog to the Patterson Dog Park and unfortunately he was attacked.,/r/baltimore/comments/tvdup0/yesterday_i_took_my_dog_to_the_patterson_dog_park/i38y767/,1,r/baltimore,0,1
Baltimore Brew is pretty good.,t2_f48cwd9x,BMoreOnTheWater,0,1649008054.0,0,t1_i38y5h6,i38y5h6,False,WhoGunnaCheckMeBoo,t3_tv925x,https://www.reddit.com/r/baltimore/comments/tv925x/kite_festival_in_patterson_park_yesterday/,Kite Festival in Patterson Park yesterday,/r/baltimore/comments/tv925x/kite_festival_in_patterson_park_yesterday/i38y5h6/,1,r/baltimore,0,1
"There’s a Facebook group for both Patterson Park/Canton Neighbors and that would definitely be the place to post this. 

I’d also recommend joining the FB group Barktimore where you’ll find a lot of local city dog owners. 

I’m sorry this happened to your pup. Hopefully the owner gets in contact with you!",t2_4phv5u1,ashalottagreyjoy,0,1649007937.0,0,t1_i38xv42,i38xv42,True,wendywinehouse,t3_tvdup0,https://www.reddit.com/r/baltimore/comments/tvdup0/yesterday_i_took_my_dog_to_the_patterson_dog_park/,Yesterday I took my dog to the Patterson Dog Park and unfortunately he was attacked.,/r/baltimore/comments/tvdup0/yesterday_i_took_my_dog_to_the_patterson_dog_park/i38xv42/,3,r/baltimore,0,3
[ShareBaby](https://www.google.com/url?sa=t&source=web&rct=j&url=https://www.sharebaby.org/&ved=2ahUKEwiPlp3atvj2AhUBZjUKHUwFC_0QFnoECBAQAQ&usg=AOvVaw37JcsCPiJSlZk4xQNDnlKr),t2_amwku,BackJurden,0,1649007280.0,0,t1_i38w8mm,i38w8mm,True,wickjest,t3_tv9wpt,https://www.reddit.com/r/baltimore/comments/tv9wpt/suggestion_donate_toddler_clothestoys/,Suggestion donate toddler clothes/toys,/r/baltimore/comments/tv9wpt/suggestion_donate_toddler_clothestoys/i38w8mm/,1,r/baltimore,0,1
Is there a thing I can follow that lets me know about these kinds of things? :O I just found out that I missed out on restaurant week by about a month.,t2_145vin,blankitty,0,1649006011.0,0,t1_i38t43a,i38t43a,True,WhoGunnaCheckMeBoo,t3_tv925x,https://www.reddit.com/r/baltimore/comments/tv925x/kite_festival_in_patterson_park_yesterday/,Kite Festival in Patterson Park yesterday,/r/baltimore/comments/tv925x/kite_festival_in_patterson_park_yesterday/i38t43a/,4,r/baltimore,0,4
"I think the majority of ""new development"" is actually just tear downs and rebuilds of older homes. Yes, there is also some brand new construction in waterfront communities, but most land that can be built on already has been.",t2_ppp4g,rockybalBOHa,0,1649005988.0,0,t1_i38t22l,i38t22l,False,BMoreOnTheWater,t3_tumurs,https://www.reddit.com/r/baltimore/comments/tumurs/waterfront_properties_in_baltimore_and_harford/,Waterfront Properties in Baltimore and Harford Counties are Being Swept Up by New Development,/r/baltimore/comments/tumurs/waterfront_properties_in_baltimore_and_harford/i38t22l/,1,r/baltimore,0,1
Personal experience?,t2_l9f6v3hv,OhioStickyThing,0,1649005846.0,0,t1_i38sprq,i38sprq,False,w3tterisb3tter,t3_tuszfc,https://www.reddit.com/r/baltimore/comments/tuszfc/witt_baltimore_i_see_them_all_over_the_sidewalk_i/,"WITT Baltimore? I see them all over the sidewalk. I assume nefarious activities, but can't identify what.",/r/baltimore/comments/tuszfc/witt_baltimore_i_see_them_all_over_the_sidewalk_i/i38sprq/,1,r/baltimore,0,1
"https://imgur.com/a/H8yyCyb

Link to dog image",t2_3rjr5y9p,wendywinehouse,0,1649005649.0,0,t1_i38s8os,i38s8os,True,wendywinehouse,t3_tvdup0,https://www.reddit.com/r/baltimore/comments/tvdup0/yesterday_i_took_my_dog_to_the_patterson_dog_park/,Yesterday I took my dog to the Patterson Dog Park and unfortunately he was attacked.,/r/baltimore/comments/tvdup0/yesterday_i_took_my_dog_to_the_patterson_dog_park/i38s8os/,1,r/baltimore,0,1
"Hello! I would like to extend a call to arms for our small Beach House (the band) r/place effort. If anyone would like to help us, head over to r/beachhouse to find out what we're planning.

We're just looking for hands to help our small community.",t2_o25xp,RGB3x3,0,1649005148.0,0,t1_i38r15h,i38r15h,True,AutoModerator,t3_ttn239,https://www.reddit.com/r/baltimore/comments/ttn239/monthly_rbaltimore_chat_april_2022/,Monthly r/Baltimore Chat - - April 2022,/r/baltimore/comments/ttn239/monthly_rbaltimore_chat_april_2022/i38r15h/,1,r/baltimore,0,1
MtVernon…are you new to the city ?,t2_hgpzr67,TheRainbowpill93,0,1649005133.0,0,t1_i38qzxy,i38qzxy,False,under_zealouss,t3_tuwglt,https://www.reddit.com/r/baltimore/comments/tuwglt/anyone_know_what_i_just_witnessed_outside_my/,Anyone know what I just witnessed outside my window?,/r/baltimore/comments/tuwglt/anyone_know_what_i_just_witnessed_outside_my/i38qzxy/,1,r/baltimore,0,1
"I remember sitting in the ER at St Josephs for hours with a broken foot. 

I finally had enough, left and went over to GBMC.

At GBMC I was in the door and back out in less that 90 minutes.

I recall a time in my life where I would not have had the choice to walk out of one facility and into another down the street. This is one of the reasons I cannot advocate for socialized medical systems.",t2_8o5wsmyv,harcosparky,0,1649004485.0,0,t1_i38pfmz,i38pfmz,True,YggdrasilsLeaf,t3_tv309f,https://www.reddit.com/r/baltimore/comments/tv309f/anyone_know_what_the_deal_is_with_gbmc_lately_had/,"Anyone know what the deal is with GBMC lately? Had a super bad experience yesterday, like a “would qualify for a malpractice suit as well as breaking multiple HIPPAA laws” kinda experience.",/r/baltimore/comments/tv309f/anyone_know_what_the_deal_is_with_gbmc_lately_had/i38pfmz/,1,r/baltimore,0,1
"Having lived un a totally "" Socialized medicine "" I can tell you it won't be a ""boon for all of us"".

I am glad to be out from under that system, because under it I had no choice.

.",t2_8o5wsmyv,harcosparky,0,1649004315.0,0,t1_i38p0wp,i38p0wp,True,YggdrasilsLeaf,t3_tv309f,https://www.reddit.com/r/baltimore/comments/tv309f/anyone_know_what_the_deal_is_with_gbmc_lately_had/,"Anyone know what the deal is with GBMC lately? Had a super bad experience yesterday, like a “would qualify for a malpractice suit as well as breaking multiple HIPPAA laws” kinda experience.",/r/baltimore/comments/tv309f/anyone_know_what_the_deal_is_with_gbmc_lately_had/i38p0wp/,1,r/baltimore,0,1
Still didn’t say where lol,t2_5z0rn,disc0ndown,0,1649003414.0,0,t1_i38mu6k,i38mu6k,False,The_Waxies_Dargle,t3_tuate3,https://www.reddit.com/r/baltimore/comments/tuate3/wtf_is_going_on_out_there/,WTF is going on out there???,/r/baltimore/comments/tuate3/wtf_is_going_on_out_there/i38mu6k/,2,r/baltimore,0,2
"got a source on it being permanent? As someone who runs it all the time, this would be great.",t2_8dm49,Baltimore_Happenings,0,1649002957.0,0,t1_i38lqzj,i38lqzj,False,trillgully,t3_tuxjcb,https://www.reddit.com/r/baltimore/comments/tuxjcb/does_anyone_know_how_long_harford_road_is/,Does anyone know how long Harford Road is supposed to be closed off? It’s been at least 3 years,/r/baltimore/comments/tuxjcb/does_anyone_know_how_long_harford_road_is/i38lqzj/,1,r/baltimore,0,1
"https://www.marylandmatters.org/2022/04/01/with-scant-enthusiasm-lawmakers-approve-marijuana-legalization-bills/

Additional information in this article, including the information that people can grow up to 2 plants per household. I don't know how this jibes with the 1.5oz possession limit (it doesn't).",t2_32igj,yoric,0,1649002527.0,0,t1_i38kpgf,i38kpgf,True,ThusSpokeZara,t3_tuuafd,https://www.reddit.com/r/baltimore/comments/tuuafd/maryland_voters_will_decide_on_recreational/,Maryland Voters Will Decide On Recreational Marijuana Legalization This Year,/r/baltimore/comments/tuuafd/maryland_voters_will_decide_on_recreational/i38kpgf/,3,r/baltimore,0,3
"https://www.marylandmatters.org/2022/04/01/with-scant-enthusiasm-lawmakers-approve-marijuana-legalization-bills/

I think this is the article you're talking about. Since the current SA isn't prosecuting cannabis possession charges it wouldn't be an issue for an actual home grower, but someone in the legislature needs to talk to a (non-corporate) cannabis grower to figure out these numbers.",t2_32igj,yoric,0,1649002399.0,0,t1_i38ke9q,i38ke9q,False,ThusSpokeZara,t3_tuuafd,https://www.reddit.com/r/baltimore/comments/tuuafd/maryland_voters_will_decide_on_recreational/,Maryland Voters Will Decide On Recreational Marijuana Legalization This Year,/r/baltimore/comments/tuuafd/maryland_voters_will_decide_on_recreational/i38ke9q/,1,r/baltimore,0,1
"I remember going to an Os game the year before they moved, sat behind a supporting column. I was like 6 so it didn’t really matter. But I remember the experience more than anything about the game that’s for sure. Different times.",t2_c2ip5mkp,4me2nonotu,0,1649002314.0,0,t1_i38k6xc,i38k6xc,True,PauloVersa,t3_tv95zn,https://www.reddit.com/r/baltimore/comments/tv95zn/ranking_the_cfls_american_expansion_stadiums/,Ranking the CFL's American Expansion Stadiums,/r/baltimore/comments/tv95zn/ranking_the_cfls_american_expansion_stadiums/i38k6xc/,2,r/baltimore,0,2
"I read this article but some of it didn't make sense to me.  I am not familiar with what is going on in HarCo.  But in Baltimore County, I don't see the new development.  Yes,  there is a condo building in Bowleys Quarters that replaced an old marina.   Are there other major developments that I am unaware of?

The author talks about  family that bought a home in Chase for 215k and it is estimated that they could list it for 750k.  But the house burned down and they had to rebuild.   Surely that cost more than they could have gotten from any insurance payout.  So it's not as simple as 750k-215k = 535k profit.",t2_ejyjcmzw,nameisinusetryagain,0,1649002189.0,0,t1_i38jw1k,i38jw1k,True,BMoreOnTheWater,t3_tumurs,https://www.reddit.com/r/baltimore/comments/tumurs/waterfront_properties_in_baltimore_and_harford/,Waterfront Properties in Baltimore and Harford Counties are Being Swept Up by New Development,/r/baltimore/comments/tumurs/waterfront_properties_in_baltimore_and_harford/i38jw1k/,1,r/baltimore,0,1
I love a good pun!,t2_78wq9j1k,Accurate-Lecture7473,0,1649001939.0,0,t1_i38jap8,i38jap8,True,GrittyMcGrittyface,t3_tvc6mf,https://www.reddit.com/r/baltimore/comments/tvc6mf/wbal_with_the_news_beet_at_the_baltimore_farmers/,WBAL with the news beet at the Baltimore Farmer's Market,/r/baltimore/comments/tvc6mf/wbal_with_the_news_beet_at_the_baltimore_farmers/i38jap8/,3,r/baltimore,0,3
Punny!,t2_42dtvy81,Crlady,0,1649001620.0,0,t1_i38ij98,i38ij98,True,GrittyMcGrittyface,t3_tvc6mf,https://www.reddit.com/r/baltimore/comments/tvc6mf/wbal_with_the_news_beet_at_the_baltimore_farmers/,WBAL with the news beet at the Baltimore Farmer's Market,/r/baltimore/comments/tvc6mf/wbal_with_the_news_beet_at_the_baltimore_farmers/i38ij98/,3,r/baltimore,0,3
"GBMC is a not-for-profit hospital, FWIW. Maryland has no for-profit hospitals and Good Sam is not a charity hospital. Its status is the same as GBMC. Not for profit doesn't mean they can't make a profit, of course. If you are going to malign a hospital, at least get your terms correct. You can make a complaint about any hospital by contacting the Office of Health Care Quality, part of the Md DOH. It's at https:/health.maryland.gov/OHCQ.",t2_dqhl1,Anne314,0,1649000443.0,0,t1_i38fqn5,i38fqn5,True,YggdrasilsLeaf,t3_tv309f,https://www.reddit.com/r/baltimore/comments/tv309f/anyone_know_what_the_deal_is_with_gbmc_lately_had/,"Anyone know what the deal is with GBMC lately? Had a super bad experience yesterday, like a “would qualify for a malpractice suit as well as breaking multiple HIPPAA laws” kinda experience.",/r/baltimore/comments/tv309f/anyone_know_what_the_deal_is_with_gbmc_lately_had/i38fqn5/,9,r/baltimore,0,9
The Maryland assessor commenting below confirmed that it is true.,t2_7ku876by,protomolocular,0,1649000391.0,0,t1_i38fm8k,i38fm8k,False,protomolocular,t3_tux6dh,https://www.reddit.com/r/baltimore/comments/tux6dh/property_tax_and_homestead_credit_question/,Property tax and homestead credit question.,/r/baltimore/comments/tux6dh/property_tax_and_homestead_credit_question/i38fm8k/,2,r/baltimore,0,2
"Ok now I feel really old - but I have some great memories of this team. They tried to call themselves at first the Baltimore CFL Colts but the Irsay Colts got an injunction against it, iirc. So for their first year they were just the Baltimore CFL football club. That’s why in the picture the end zone just says Baltimore, not a team nickname. I went to one of their games with my dad and it was an amazing experience — remember this is before tha Ravens came and all the anger and pain at losing the colts was still fairly fresh. The Baltimore Colts marching band played and the fans would chant C-O-L-T-S COLTS over the PA announcer who was using the court-ordered “Baltimore cfl football club” name.",t2_hbsfpo3b,fairlyobservant,0,1649000323.0,0,t1_i38fgmg,i38fgmg,True,PauloVersa,t3_tv95zn,https://www.reddit.com/r/baltimore/comments/tv95zn/ranking_the_cfls_american_expansion_stadiums/,Ranking the CFL's American Expansion Stadiums,/r/baltimore/comments/tv95zn/ranking_the_cfls_american_expansion_stadiums/i38fgmg/,2,r/baltimore,0,2
What neighborhood is that? I’ve never seen houses like those in the city.,t2_6ju646xl,novice_nickk,0,1649000099.0,0,t1_i38exva,i38exva,True,under_zealouss,t3_tuwglt,https://www.reddit.com/r/baltimore/comments/tuwglt/anyone_know_what_i_just_witnessed_outside_my/,Anyone know what I just witnessed outside my window?,/r/baltimore/comments/tuwglt/anyone_know_what_i_just_witnessed_outside_my/i38exva/,1,r/baltimore,0,1
"iirc that's a federal law, not state. Actions by the state wouldn't matter.",t2_dg05ud1s,ElectricalRow2573,0,1648999894.0,0,t1_i38egld,i38egld,False,ThusSpokeZara,t3_tuuafd,https://www.reddit.com/r/baltimore/comments/tuuafd/maryland_voters_will_decide_on_recreational/,Maryland Voters Will Decide On Recreational Marijuana Legalization This Year,/r/baltimore/comments/tuuafd/maryland_voters_will_decide_on_recreational/i38egld/,2,r/baltimore,0,2
The protest that left city hall went up on 83 and held hands and stopped traffic so police were diverting off to chase st,t2_ch1fi2zn,Exotic-Row6075,0,1648999636.0,0,t1_i38dv25,i38dv25,True,under_zealouss,t3_tuwglt,https://www.reddit.com/r/baltimore/comments/tuwglt/anyone_know_what_i_just_witnessed_outside_my/,Anyone know what I just witnessed outside my window?,/r/baltimore/comments/tuwglt/anyone_know_what_i_just_witnessed_outside_my/i38dv25/,1,r/baltimore,0,1
"And they are going to put some much red tape, taxation, and ""equity"" onto it that it will not even be close in terms of being able to compete with the current illegal market.",t2_4uqn5kle,BJJBean,0,1648999588.0,0,t1_i38dr4y,i38dr4y,False,ThusSpokeZara,t3_tuuafd,https://www.reddit.com/r/baltimore/comments/tuuafd/maryland_voters_will_decide_on_recreational/,Maryland Voters Will Decide On Recreational Marijuana Legalization This Year,/r/baltimore/comments/tuuafd/maryland_voters_will_decide_on_recreational/i38dr4y/,2,r/baltimore,0,2
No different company,t2_6wsplawe,WhoGunnaCheckMeBoo,0,1648999500.0,0,t1_i38djud,i38djud,False,WhoGunnaCheckMeBoo,t3_ttpdr2,https://www.reddit.com/r/baltimore/comments/ttpdr2/chasen_cos_acquires_1_calvert_plaza_in_downtown/,Chasen Cos. acquires 1 Calvert Plaza in downtown Baltimore for 173-unit apartment conversion,/r/baltimore/comments/ttpdr2/chasen_cos_acquires_1_calvert_plaza_in_downtown/i38djud/,1,r/baltimore,0,1
Shot an armed car jacker that was trying to run them over while they where trying to serve him a warrant,t2_74bwy,spitfire7rp,0,1648999381.0,0,t1_i38da77,i38da77,False,under_zealouss,t3_tuwglt,https://www.reddit.com/r/baltimore/comments/tuwglt/anyone_know_what_i_just_witnessed_outside_my/,Anyone know what I just witnessed outside my window?,/r/baltimore/comments/tuwglt/anyone_know_what_i_just_witnessed_outside_my/i38da77/,4,r/baltimore,0,4
Pretty sure that place closed.,t2_2ns599u9,texasyardie,0,1648998867.0,0,t1_i38c3xh,i38c3xh,False,pumaslides27,t3_tupwfo,https://www.reddit.com/r/baltimore/comments/tupwfo/any_arcades_that_are_also_bars_no_casinos/,Any arcades that are also bars? ( no casinos),/r/baltimore/comments/tupwfo/any_arcades_that_are_also_bars_no_casinos/i38c3xh/,1,r/baltimore,0,1
400 is on the low end for a handgun.,t2_dkbt5ts5,Guts_And_Black_Stuff,0,1648998846.0,0,t1_i38c273,i38c273,False,z3mcs,t3_tu21u1,https://www.reddit.com/r/baltimore/comments/tu21u1/baltimore_banners_justin_fenton_there_have_been/,"[Baltimore Banner's Justin Fenton] ""There have been 135 reported carjackings in Baltimore this year, compared to 81 at this time last year - an increase of 67 percent. It's a nationwide trend""",/r/baltimore/comments/tu21u1/baltimore_banners_justin_fenton_there_have_been/i38c273/,1,r/baltimore,0,1
Thanks for the follow up. Anecdotal evidence (like above) can't be trusted.,t2_62ds0t9v,SnooRevelations979,0,1648998640.0,0,t1_i38bljt,i38bljt,False,SnooRevelations979,t3_sytwg8,https://www.reddit.com/r/baltimore/comments/sytwg8/the_four_stages_of_baltimore_shock/,The Four Stages of Baltimore Shock,/r/baltimore/comments/sytwg8/the_four_stages_of_baltimore_shock/i38bljt/,1,r/baltimore,0,1
I believe this bill also contains provisions to vacate those convictions,t2_9na5d,raptortooth,0,1648998628.0,0,t1_i38bklx,i38bklx,False,ThusSpokeZara,t3_tuuafd,https://www.reddit.com/r/baltimore/comments/tuuafd/maryland_voters_will_decide_on_recreational/,Maryland Voters Will Decide On Recreational Marijuana Legalization This Year,/r/baltimore/comments/tuuafd/maryland_voters_will_decide_on_recreational/i38bklx/,1,r/baltimore,0,1
I get down voted every where. I called out a Twitter bully from my neighborhood. She has her trolls brigade me in every sub. What ever. At least she hasn’t figured out where I live yet. She gets every one in the neighborhood fined.,t2_iuentkmg,goodnewsonly3702,0,1648998428.0,0,t1_i38b4c7,i38b4c7,False,YggdrasilsLeaf,t3_tv309f,https://www.reddit.com/r/baltimore/comments/tv309f/anyone_know_what_the_deal_is_with_gbmc_lately_had/,"Anyone know what the deal is with GBMC lately? Had a super bad experience yesterday, like a “would qualify for a malpractice suit as well as breaking multiple HIPPAA laws” kinda experience.",/r/baltimore/comments/tv309f/anyone_know_what_the_deal_is_with_gbmc_lately_had/i38b4c7/,1,r/baltimore,0,1
Maybe they're from out of state like me!,t2_52gm1,jimmyjone,0,1648998324.0,0,t1_i38avz1,i38avz1,False,jimmyjone,t3_tu8jgl,https://www.reddit.com/r/baltimore/comments/tu8jgl/just_moved_to_mt_washington_and_need_a_traffic/,Just moved to Mt Washington and need a traffic lesson,/r/baltimore/comments/tu8jgl/just_moved_to_mt_washington_and_need_a_traffic/i38avz1/,1,r/baltimore,0,1
Yup! That one and Smith & Pimlico.,t2_52gm1,jimmyjone,0,1648998305.0,0,t1_i38aufi,i38aufi,False,jimmyjone,t3_tu8jgl,https://www.reddit.com/r/baltimore/comments/tu8jgl/just_moved_to_mt_washington_and_need_a_traffic/,Just moved to Mt Washington and need a traffic lesson,/r/baltimore/comments/tu8jgl/just_moved_to_mt_washington_and_need_a_traffic/i38aufi/,1,r/baltimore,0,1
Thanks! I've been to Reading Terminal twice so far and I've barely scratched the surface. Appreciate the recommendations.,t2_5pguz,sllewgh,0,1648998209.0,0,t1_i38amin,i38amin,False,zqwu8391,t3_tulfr0,https://www.reddit.com/r/baltimore/comments/tulfr0/best_restaurant_food_youd_drive_to_the_suburbs_for/,Best restaurant / food you’d drive to the suburbs for?,/r/baltimore/comments/tulfr0/best_restaurant_food_youd_drive_to_the_suburbs_for/i38amin/,1,r/baltimore,0,1
"The Montebello loop closure is permanent, and that's a hell of a good thing. That loop is full of cyclists, pedestrians, kids running around, etc. It's a beautiful thing. People need spaces where they don't have to worry about being run over.",t2_437m4v31,yeaughourdt,0,1648998149.0,0,t1_i38ahll,i38ahll,False,trillgully,t3_tuxjcb,https://www.reddit.com/r/baltimore/comments/tuxjcb/does_anyone_know_how_long_harford_road_is/,Does anyone know how long Harford Road is supposed to be closed off? It’s been at least 3 years,/r/baltimore/comments/tuxjcb/does_anyone_know_how_long_harford_road_is/i38ahll/,4,r/baltimore,0,4
"That's your opinion. I've had both, and I've got mine.",t2_5pguz,sllewgh,0,1648998096.0,0,t1_i38ad9a,i38ad9a,False,zqwu8391,t3_tulfr0,https://www.reddit.com/r/baltimore/comments/tulfr0/best_restaurant_food_youd_drive_to_the_suburbs_for/,Best restaurant / food you’d drive to the suburbs for?,/r/baltimore/comments/tulfr0/best_restaurant_food_youd_drive_to_the_suburbs_for/i38ad9a/,1,r/baltimore,0,1
"Rope Walk in Fed Hill has air hockey and a couple arcade games, though you’ll have to battle at your own risk with the typical Fed Hill crowds",t2_300h3mbz,AdmralSnackbar,0,1648998096.0,0,t1_i38ad8v,i38ad8v,True,pumaslides27,t3_tupwfo,https://www.reddit.com/r/baltimore/comments/tupwfo/any_arcades_that_are_also_bars_no_casinos/,Any arcades that are also bars? ( no casinos),/r/baltimore/comments/tupwfo/any_arcades_that_are_also_bars_no_casinos/i38ad8v/,2,r/baltimore,0,2
"Not sure why you're downvoted here, I've seen Union Memorial do the same thing.",t2_3ylzx,bmore,0,1648997992.0,0,t1_i38a4nm,i38a4nm,False,YggdrasilsLeaf,t3_tv309f,https://www.reddit.com/r/baltimore/comments/tv309f/anyone_know_what_the_deal_is_with_gbmc_lately_had/,"Anyone know what the deal is with GBMC lately? Had a super bad experience yesterday, like a “would qualify for a malpractice suit as well as breaking multiple HIPPAA laws” kinda experience.",/r/baltimore/comments/tv309f/anyone_know_what_the_deal_is_with_gbmc_lately_had/i38a4nm/,3,r/baltimore,0,3
I already decided over 20 years ago,t2_dkbt5ts5,Guts_And_Black_Stuff,0,1648997897.0,0,t1_i389x3x,i389x3x,True,ThusSpokeZara,t3_tuuafd,https://www.reddit.com/r/baltimore/comments/tuuafd/maryland_voters_will_decide_on_recreational/,Maryland Voters Will Decide On Recreational Marijuana Legalization This Year,/r/baltimore/comments/tuuafd/maryland_voters_will_decide_on_recreational/i389x3x/,3,r/baltimore,0,3
"Those are those things that Pookie eats from New Jack.

Beam me up Scotty.",t2_fhfkma0l,Historical-Fun-2960,0,1648997887.0,0,t1_i389w8b,i389w8b,True,w3tterisb3tter,t3_tuszfc,https://www.reddit.com/r/baltimore/comments/tuszfc/witt_baltimore_i_see_them_all_over_the_sidewalk_i/,"WITT Baltimore? I see them all over the sidewalk. I assume nefarious activities, but can't identify what.",/r/baltimore/comments/tuszfc/witt_baltimore_i_see_them_all_over_the_sidewalk_i/i389w8b/,1,r/baltimore,0,1
