body,author_fullname,author.name,controversiality,created,downs,fullname,id,is_root,link_author,link_id,link_permalink,link_title,permalink,score,subreddit_name_prefixed,total_awards_received,ups
"I’d stay deep enough to pick an option when the light turns green, because it’s possible the left turner might need to wait for oncoming traffic",t2_a0h36,moderndukes,0,1648942377.0,0,t1_i35ykrc,i35ykrc,True,jimmyjone,t3_tu8jgl,https://www.reddit.com/r/baltimore/comments/tu8jgl/just_moved_to_mt_washington_and_need_a_traffic/,Just moved to Mt Washington and need a traffic lesson,/r/baltimore/comments/tu8jgl/just_moved_to_mt_washington_and_need_a_traffic/i35ykrc/,2,r/baltimore,0,2
"As you don't have cable, odds are that you'll be able to stream it off the major local media websites. They'll have a ""State of The City"" banner or something.  WBAL, WMAR, WJZ & WBFF.",t2_bx6iu,z3mcs,0,1648942358.0,0,t1_i35yjev,i35yjev,False,SEARCHFORWHATISGOOD,t3_tuunuu,https://www.reddit.com/r/baltimore/comments/tuunuu/mayors_state_of_the_city_address_on_tuesday/,Mayor's State of the City address on Tuesday,/r/baltimore/comments/tuunuu/mayors_state_of_the_city_address_on_tuesday/i35yjev/,2,r/baltimore,0,2
"If you pick Federal Hill (which I’d recommend for what you’re looking for in an area), I would say to still possibly look into taking the bus (like the free Circulator) up to Penn Station to get to DC rather than Camden Line (despite it being closer to your home). Penn Line + Amtrak make for a more reliable and quicker trip down to DC, plus you’d have backup trains with Amtrak in case you run late / work weekends/nights.

Mt Vernon, Old Goucher, and Remington would also be decent suggestions with their closeness to Penn Station and access to the Jones Falls Trail",t2_a0h36,moderndukes,0,1648942222.0,0,t1_i35y9j1,i35y9j1,True,Own_Conference_9391,t3_tuhzli,https://www.reddit.com/r/baltimore/comments/tuhzli/neighborhood_recommendations_runner_dc_commuter/,Neighborhood recommendations: runner & DC commuter,/r/baltimore/comments/tuhzli/neighborhood_recommendations_runner_dc_commuter/i35y9j1/,1,r/baltimore,0,1
Thanks so much. I don't have cable but will check it out through the online options you mentioned.,t2_ukl1e,SEARCHFORWHATISGOOD,0,1648941968.0,0,t1_i35xqrj,i35xqrj,False,SEARCHFORWHATISGOOD,t3_tuunuu,https://www.reddit.com/r/baltimore/comments/tuunuu/mayors_state_of_the_city_address_on_tuesday/,Mayor's State of the City address on Tuesday,/r/baltimore/comments/tuunuu/mayors_state_of_the_city_address_on_tuesday/i35xqrj/,1,r/baltimore,0,1
"Crossing it from Reservoir Hill isn’t bad. Getting down to Penn Station from Hampden, however, is a bit of a trek if walking",t2_a0h36,moderndukes,0,1648941919.0,0,t1_i35xn9s,i35xn9s,False,Own_Conference_9391,t3_tuhzli,https://www.reddit.com/r/baltimore/comments/tuhzli/neighborhood_recommendations_runner_dc_commuter/,Neighborhood recommendations: runner & DC commuter,/r/baltimore/comments/tuhzli/neighborhood_recommendations_runner_dc_commuter/i35xn9s/,3,r/baltimore,0,3
There’s one of these coming up soon at the Ottobar that I was gonna check out!,t2_3zh2py10,SlightGrass,0,1648941883.0,0,t1_i35xko1,i35xko1,True,modernshorties,t3_tuqk7z,https://www.reddit.com/r/baltimore/comments/tuqk7z/anyone_going_to_taylor_swift_night_at_rams_head/,Anyone going to Taylor Swift Night at Rams Head Live tonight?,/r/baltimore/comments/tuqk7z/anyone_going_to_taylor_swift_night_at_rams_head/i35xko1/,1,r/baltimore,0,1
A legend! RIP,t2_3zh2py10,SlightGrass,0,1648941820.0,0,t1_i35xg33,i35xg33,True,bigbabygeesus,t3_tuv2w3,https://www.reddit.com/r/baltimore/comments/tuv2w3/rip_to_one_of_baltimores_greatest_we_love_you_cj/,"RIP to one of Baltimore’s greatest, we love you CJ.",/r/baltimore/comments/tuv2w3/rip_to_one_of_baltimores_greatest_we_love_you_cj/i35xg33/,2,r/baltimore,0,2
Corner Stable in cockeysville had some of the best ribs around.,t2_8tr0a8v,fuckmethisburns,0,1648941708.0,0,t1_i35x7ql,i35x7ql,True,zqwu8391,t3_tulfr0,https://www.reddit.com/r/baltimore/comments/tulfr0/best_restaurant_food_youd_drive_to_the_suburbs_for/,Best restaurant / food you’d drive to the suburbs for?,/r/baltimore/comments/tulfr0/best_restaurant_food_youd_drive_to_the_suburbs_for/i35x7ql/,7,r/baltimore,0,7
"Papa's is third best behind G&M and kokos...

Woodstock Inn. ROFL I used to drink there in the nineties when it was a run down redneck bar that didn't even serve food!",t2_8tr0a8v,fuckmethisburns,0,1648941608.0,0,t1_i35x0ex,i35x0ex,False,zqwu8391,t3_tulfr0,https://www.reddit.com/r/baltimore/comments/tulfr0/best_restaurant_food_youd_drive_to_the_suburbs_for/,Best restaurant / food you’d drive to the suburbs for?,/r/baltimore/comments/tulfr0/best_restaurant_food_youd_drive_to_the_suburbs_for/i35x0ex/,-1,r/baltimore,0,-1
Good location to get a bunch of catalytic converters!,t2_h0jqwb61,LurkerNumber44,0,1648941480.0,0,t1_i35wqw2,i35wqw2,True,modernshorties,t3_tuqk7z,https://www.reddit.com/r/baltimore/comments/tuqk7z/anyone_going_to_taylor_swift_night_at_rams_head/,Anyone going to Taylor Swift Night at Rams Head Live tonight?,/r/baltimore/comments/tuqk7z/anyone_going_to_taylor_swift_night_at_rams_head/i35wqw2/,6,r/baltimore,0,6
"I was on the right track, but wrong drug.",t2_55vtswzq,Unusual-Thanks-2959,0,1648941414.0,0,t1_i35wm00,i35wm00,False,w3tterisb3tter,t3_tuszfc,https://www.reddit.com/r/baltimore/comments/tuszfc/witt_baltimore_i_see_them_all_over_the_sidewalk_i/,"WITT Baltimore? I see them all over the sidewalk. I assume nefarious activities, but can't identify what.",/r/baltimore/comments/tuszfc/witt_baltimore_i_see_them_all_over_the_sidewalk_i/i35wm00/,2,r/baltimore,0,2
100% correlation to high school graduates in Baltimore that can't actually read.,t2_h0jqwb61,LurkerNumber44,0,1648941411.0,0,t1_i35wlsh,i35wlsh,True,w3tterisb3tter,t3_tuszfc,https://www.reddit.com/r/baltimore/comments/tuszfc/witt_baltimore_i_see_them_all_over_the_sidewalk_i/,"WITT Baltimore? I see them all over the sidewalk. I assume nefarious activities, but can't identify what.",/r/baltimore/comments/tuszfc/witt_baltimore_i_see_them_all_over_the_sidewalk_i/i35wlsh/,3,r/baltimore,0,3
Such strange timing; took my dogs to St Mary’s park for a quick walk today and saw a couple on the ground and wondered the same thing.,t2_e5szln3o,Due-Net-88,0,1648941349.0,0,t1_i35wh7p,i35wh7p,True,w3tterisb3tter,t3_tuszfc,https://www.reddit.com/r/baltimore/comments/tuszfc/witt_baltimore_i_see_them_all_over_the_sidewalk_i/,"WITT Baltimore? I see them all over the sidewalk. I assume nefarious activities, but can't identify what.",/r/baltimore/comments/tuszfc/witt_baltimore_i_see_them_all_over_the_sidewalk_i/i35wh7p/,2,r/baltimore,0,2
"it's incredible food, but the service is awful.  Especially take out.",t2_78xsy,islander1,0,1648941183.0,0,t1_i35w4u9,i35w4u9,False,zqwu8391,t3_tulfr0,https://www.reddit.com/r/baltimore/comments/tulfr0/best_restaurant_food_youd_drive_to_the_suburbs_for/,Best restaurant / food you’d drive to the suburbs for?,/r/baltimore/comments/tulfr0/best_restaurant_food_youd_drive_to_the_suburbs_for/i35w4u9/,1,r/baltimore,0,1
"I’m glad, that you just used to be.",t2_2q32vz74,Ipeteverydogisee,0,1648941150.0,0,t1_i35w2cu,i35w2cu,False,w3tterisb3tter,t3_tuszfc,https://www.reddit.com/r/baltimore/comments/tuszfc/witt_baltimore_i_see_them_all_over_the_sidewalk_i/,"WITT Baltimore? I see them all over the sidewalk. I assume nefarious activities, but can't identify what.",/r/baltimore/comments/tuszfc/witt_baltimore_i_see_them_all_over_the_sidewalk_i/i35w2cu/,11,r/baltimore,0,11
"Taco Love Grill, in White Marsh.  


Lib's Grill (and Liberatore's for that matter) in Perry Hall.",t2_78xsy,islander1,0,1648941135.0,0,t1_i35w19q,i35w19q,True,zqwu8391,t3_tulfr0,https://www.reddit.com/r/baltimore/comments/tulfr0/best_restaurant_food_youd_drive_to_the_suburbs_for/,Best restaurant / food you’d drive to the suburbs for?,/r/baltimore/comments/tulfr0/best_restaurant_food_youd_drive_to_the_suburbs_for/i35w19q/,1,r/baltimore,0,1
Yup. Just be careful picking them up. When we did clean ups with scouts we kept empty laundry detergent bottles to put needles and drug stuff in. Always wear gloves.,t2_iuentkmg,goodnewsonly3702,0,1648940995.0,0,t1_i35vqt4,i35vqt4,False,w3tterisb3tter,t3_tuszfc,https://www.reddit.com/r/baltimore/comments/tuszfc/witt_baltimore_i_see_them_all_over_the_sidewalk_i/,"WITT Baltimore? I see them all over the sidewalk. I assume nefarious activities, but can't identify what.",/r/baltimore/comments/tuszfc/witt_baltimore_i_see_them_all_over_the_sidewalk_i/i35vqt4/,15,r/baltimore,0,15
Who is he?  Sorry for your loss.,t2_jemcx,DeliMcPickles,0,1648940933.0,0,t1_i35vm54,i35vm54,True,bigbabygeesus,t3_tuv2w3,https://www.reddit.com/r/baltimore/comments/tuv2w3/rip_to_one_of_baltimores_greatest_we_love_you_cj/,"RIP to one of Baltimore’s greatest, we love you CJ.",/r/baltimore/comments/tuv2w3/rip_to_one_of_baltimores_greatest_we_love_you_cj/i35vm54/,1,r/baltimore,0,1
I currently live in OH and while I can't say I've made the trip JUST for Spice and Dice it is definitely a contributing factor.,t2_9tuum,Beardmaster76,0,1648940929.0,0,t1_i35vlw9,i35vlw9,False,zqwu8391,t3_tulfr0,https://www.reddit.com/r/baltimore/comments/tulfr0/best_restaurant_food_youd_drive_to_the_suburbs_for/,Best restaurant / food you’d drive to the suburbs for?,/r/baltimore/comments/tulfr0/best_restaurant_food_youd_drive_to_the_suburbs_for/i35vlw9/,4,r/baltimore,0,4
Jake’s Grill on Falls Rd in Cockeysville is the best pit beef I’ve ever had!,t2_3xf2j,downwithlevers,0,1648940909.0,0,t1_i35vkfl,i35vkfl,True,zqwu8391,t3_tulfr0,https://www.reddit.com/r/baltimore/comments/tulfr0/best_restaurant_food_youd_drive_to_the_suburbs_for/,Best restaurant / food you’d drive to the suburbs for?,/r/baltimore/comments/tulfr0/best_restaurant_food_youd_drive_to_the_suburbs_for/i35vkfl/,2,r/baltimore,0,2
Damn that takes me back. Haven’t been there since like 2002ish. Great memories of growing up.,t2_3xf2j,downwithlevers,0,1648940858.0,0,t1_i35vgqb,i35vgqb,False,zqwu8391,t3_tulfr0,https://www.reddit.com/r/baltimore/comments/tulfr0/best_restaurant_food_youd_drive_to_the_suburbs_for/,Best restaurant / food you’d drive to the suburbs for?,/r/baltimore/comments/tulfr0/best_restaurant_food_youd_drive_to_the_suburbs_for/i35vgqb/,1,r/baltimore,0,1
You will be fine!,t2_ee8prnu4,Moi_Sunshine,0,1648940334.0,0,t1_i35udv8,i35udv8,True,Dry_Lychee_6533,t3_tuojh8,https://www.reddit.com/r/baltimore/comments/tuojh8/baltimore_street_area/,Baltimore Street Area,/r/baltimore/comments/tuojh8/baltimore_street_area/i35udv8/,10,r/baltimore,0,10
The only thing I miss about working in Columbia,t2_17i83z,TonyDanza888,0,1648940057.0,0,t1_i35tthl,i35tthl,False,zqwu8391,t3_tulfr0,https://www.reddit.com/r/baltimore/comments/tulfr0/best_restaurant_food_youd_drive_to_the_suburbs_for/,Best restaurant / food you’d drive to the suburbs for?,/r/baltimore/comments/tulfr0/best_restaurant_food_youd_drive_to_the_suburbs_for/i35tthl/,2,r/baltimore,0,2
"I found this gem on Reddit before so I am going to share it here for others to discover - Patowmack Farms. It is VERY expensive and about an hour away, but the most incredible restaurant experience we’ve ever had, and we are still talking it! Currently saving up to go back in fall ha! Definitely a TREAT. Never been to anything like it. You’re welcome!",t2_25rzf37u,JessLevelsUp,0,1648939751.0,0,t1_i35t71y,i35t71y,True,zqwu8391,t3_tulfr0,https://www.reddit.com/r/baltimore/comments/tulfr0/best_restaurant_food_youd_drive_to_the_suburbs_for/,Best restaurant / food you’d drive to the suburbs for?,/r/baltimore/comments/tulfr0/best_restaurant_food_youd_drive_to_the_suburbs_for/i35t71y/,3,r/baltimore,0,3
*Hampden has entered the chat*,t2_j7oon,bookoocash,0,1648939732.0,0,t1_i35t5nc,i35t5nc,False,w3tterisb3tter,t3_tuszfc,https://www.reddit.com/r/baltimore/comments/tuszfc/witt_baltimore_i_see_them_all_over_the_sidewalk_i/,"WITT Baltimore? I see them all over the sidewalk. I assume nefarious activities, but can't identify what.",/r/baltimore/comments/tuszfc/witt_baltimore_i_see_them_all_over_the_sidewalk_i/i35t5nc/,34,r/baltimore,0,34
"I did try John's Roast Pork when I was last there, but honestly The Real Thing has substantially better cheesesteaks. I'll definitely give the donuts a try, though!",t2_5pguz,sllewgh,0,1648939611.0,0,t1_i35swjq,i35swjq,False,zqwu8391,t3_tulfr0,https://www.reddit.com/r/baltimore/comments/tulfr0/best_restaurant_food_youd_drive_to_the_suburbs_for/,Best restaurant / food you’d drive to the suburbs for?,/r/baltimore/comments/tulfr0/best_restaurant_food_youd_drive_to_the_suburbs_for/i35swjq/,0,r/baltimore,0,0
My son called them “tiny flashlights” when he was wee.,t2_78wq9j1k,Accurate-Lecture7473,0,1648939394.0,0,t1_i35sgnd,i35sgnd,True,w3tterisb3tter,t3_tuszfc,https://www.reddit.com/r/baltimore/comments/tuszfc/witt_baltimore_i_see_them_all_over_the_sidewalk_i/,"WITT Baltimore? I see them all over the sidewalk. I assume nefarious activities, but can't identify what.",/r/baltimore/comments/tuszfc/witt_baltimore_i_see_them_all_over_the_sidewalk_i/i35sgnd/,0,r/baltimore,0,0
There’s crack and heroin at 7-11. It was just weed when I was growing up. A dirty cop opened a deli right there a few years back. He sells works. Pipes. Razors. Mirrors. Cookers. All that stuff. Ever since that there’s 2 boys with crack and heroin outside the stores. You gotta go to Arbutus for weed now. Ha,t2_iuentkmg,goodnewsonly3702,0,1648939390.0,0,t1_i35sgc8,i35sgc8,False,w3tterisb3tter,t3_tuszfc,https://www.reddit.com/r/baltimore/comments/tuszfc/witt_baltimore_i_see_them_all_over_the_sidewalk_i/,"WITT Baltimore? I see them all over the sidewalk. I assume nefarious activities, but can't identify what.",/r/baltimore/comments/tuszfc/witt_baltimore_i_see_them_all_over_the_sidewalk_i/i35sgc8/,5,r/baltimore,0,5
They should offer to buy the mall property for whatever the original offer for Ann’s was. Prob a low dollar amount in todays terms.,t2_3tgpj,Coffee_nomnom,0,1648939267.0,0,t1_i35s7ab,i35s7ab,False,zqwu8391,t3_tulfr0,https://www.reddit.com/r/baltimore/comments/tulfr0/best_restaurant_food_youd_drive_to_the_suburbs_for/,Best restaurant / food you’d drive to the suburbs for?,/r/baltimore/comments/tulfr0/best_restaurant_food_youd_drive_to_the_suburbs_for/i35s7ab/,3,r/baltimore,0,3
"John's Roast Pork, and while you are up there, Federal Donuts.",t2_4a9ns,threedaysatsea,0,1648939246.0,0,t1_i35s5t7,i35s5t7,False,zqwu8391,t3_tulfr0,https://www.reddit.com/r/baltimore/comments/tulfr0/best_restaurant_food_youd_drive_to_the_suburbs_for/,Best restaurant / food you’d drive to the suburbs for?,/r/baltimore/comments/tulfr0/best_restaurant_food_youd_drive_to_the_suburbs_for/i35s5t7/,3,r/baltimore,0,3
"It'll probably stream on [CharmTV](https://www.charmtvbaltimore.com/live-stream), their [YouTube](https://www.youtube.com/user/TV25BCOCC/videos) or their [facebook](https://www.facebook.com/CharmTVBaltimore/), or his [facebook](https://www.facebook.com/MayorBMScott/). If you have cable, find your CharmTV station on your guide, and they'll likely show it too.  Mine shows it airing at noon (it's supposed to be at 1:00pm) but it'll be on either way I'm sure.",t2_bx6iu,z3mcs,0,1648939208.0,0,t1_i35s2yn,i35s2yn,True,SEARCHFORWHATISGOOD,t3_tuunuu,https://www.reddit.com/r/baltimore/comments/tuunuu/mayors_state_of_the_city_address_on_tuesday/,Mayor's State of the City address on Tuesday,/r/baltimore/comments/tuunuu/mayors_state_of_the_city_address_on_tuesday/i35s2yn/,1,r/baltimore,0,1
"To further this... typically, heroin in named.  Crack is not.",t2_ce0e7,XxCloudSephiroth69xX,0,1648938895.0,0,t1_i35rg3c,i35rg3c,False,w3tterisb3tter,t3_tuszfc,https://www.reddit.com/r/baltimore/comments/tuszfc/witt_baltimore_i_see_them_all_over_the_sidewalk_i/,"WITT Baltimore? I see them all over the sidewalk. I assume nefarious activities, but can't identify what.",/r/baltimore/comments/tuszfc/witt_baltimore_i_see_them_all_over_the_sidewalk_i/i35rg3c/,6,r/baltimore,0,6
Yay! We've tried going a few times during the pandemic but they were always closed. Glad to hear they're back in business!,t2_6of7q,jwuphysics,0,1648938430.0,0,t1_i35qhiw,i35qhiw,True,bubble963,t3_tusadz,https://www.reddit.com/r/baltimore/comments/tusadz/mr_bingsoo_is_back_bubble_tea_and_bingsoomilk/,Mr. Bingsoo is back! Bubble tea and Bingsoo/milk snow in Fells Point.,/r/baltimore/comments/tusadz/mr_bingsoo_is_back_bubble_tea_and_bingsoomilk/i35qhiw/,5,r/baltimore,0,5
I don’t blame people for buying the only homes available when there’s a massive housing shortage. But also much of it isn’t people buying houses to live in. It’s a lot of slumlords and corporations buying houses to rent at exorbitant rates because of the housing shortage,t2_1685il,PoopIsAlwaysSunny,0,1648938302.0,0,t1_i35q877,i35q877,False,BMoreOnTheWater,t3_tumurs,https://www.reddit.com/r/baltimore/comments/tumurs/waterfront_properties_in_baltimore_and_harford/,Waterfront Properties in Baltimore and Harford Counties are Being Swept Up by New Development,/r/baltimore/comments/tumurs/waterfront_properties_in_baltimore_and_harford/i35q877/,4,r/baltimore,0,4
There’s a store on the Avenue in Hampden called The Parisian Flea. They do appraisals on vintage jewelry.,t2_6f81wrpb,wrongseeds,0,1648937991.0,0,t1_i35pktw,i35pktw,True,f11tn88ss,t3_tuto9q,https://www.reddit.com/r/baltimore/comments/tuto9q/antique_jewelry_places/,antique jewelry places,/r/baltimore/comments/tuto9q/antique_jewelry_places/i35pktw/,6,r/baltimore,0,6
They closed once because the owner was ill. I hope this means good things.,t2_3i21s,thejesusfish,0,1648937991.0,0,t1_i35pks3,i35pks3,True,bubble963,t3_tusadz,https://www.reddit.com/r/baltimore/comments/tusadz/mr_bingsoo_is_back_bubble_tea_and_bingsoomilk/,Mr. Bingsoo is back! Bubble tea and Bingsoo/milk snow in Fells Point.,/r/baltimore/comments/tusadz/mr_bingsoo_is_back_bubble_tea_and_bingsoomilk/i35pks3/,5,r/baltimore,0,5
https://www.mentalfloss.com/article/55015/41-brand-names-given-drugs-wire,t2_t8d3u,jupitaur9,0,1648937932.0,0,t1_i35pgft,i35pgft,False,w3tterisb3tter,t3_tuszfc,https://www.reddit.com/r/baltimore/comments/tuszfc/witt_baltimore_i_see_them_all_over_the_sidewalk_i/,"WITT Baltimore? I see them all over the sidewalk. I assume nefarious activities, but can't identify what.",/r/baltimore/comments/tuszfc/witt_baltimore_i_see_them_all_over_the_sidewalk_i/i35pgft/,2,r/baltimore,0,2
Blue tops! Yellow tops! Get ya blue tops!,t2_fkukl6b1,BlackSandraBullock,0,1648937892.0,0,t1_i35pdeu,i35pdeu,True,w3tterisb3tter,t3_tuszfc,https://www.reddit.com/r/baltimore/comments/tuszfc/witt_baltimore_i_see_them_all_over_the_sidewalk_i/,"WITT Baltimore? I see them all over the sidewalk. I assume nefarious activities, but can't identify what.",/r/baltimore/comments/tuszfc/witt_baltimore_i_see_them_all_over_the_sidewalk_i/i35pdeu/,10,r/baltimore,0,10
Buontempo's pizza in Bel Air is the only thing I will go back there for.,t2_5mh6x,robot_butthole,0,1648937886.0,0,t1_i35pczd,i35pczd,True,zqwu8391,t3_tulfr0,https://www.reddit.com/r/baltimore/comments/tulfr0/best_restaurant_food_youd_drive_to_the_suburbs_for/,Best restaurant / food you’d drive to the suburbs for?,/r/baltimore/comments/tulfr0/best_restaurant_food_youd_drive_to_the_suburbs_for/i35pczd/,1,r/baltimore,0,1
The good news is that means your block isnt going to be gentrified this week...,t2_i1ocdt1y,VirtualSentient,0,1648937763.0,0,t1_i35p3wp,i35p3wp,True,w3tterisb3tter,t3_tuszfc,https://www.reddit.com/r/baltimore/comments/tuszfc/witt_baltimore_i_see_them_all_over_the_sidewalk_i/,"WITT Baltimore? I see them all over the sidewalk. I assume nefarious activities, but can't identify what.",/r/baltimore/comments/tuszfc/witt_baltimore_i_see_them_all_over_the_sidewalk_i/i35p3wp/,24,r/baltimore,0,24
Curry and Spice Bar - Owings Mills,t2_fkukl6b1,BlackSandraBullock,0,1648937702.0,0,t1_i35ozgl,i35ozgl,True,zqwu8391,t3_tulfr0,https://www.reddit.com/r/baltimore/comments/tulfr0/best_restaurant_food_youd_drive_to_the_suburbs_for/,Best restaurant / food you’d drive to the suburbs for?,/r/baltimore/comments/tulfr0/best_restaurant_food_youd_drive_to_the_suburbs_for/i35ozgl/,2,r/baltimore,0,2
They are being sarcastic haha,t2_o5g54,HistrionicSlut,0,1648937466.0,0,t1_i35oiai,i35oiai,False,w3tterisb3tter,t3_tuszfc,https://www.reddit.com/r/baltimore/comments/tuszfc/witt_baltimore_i_see_them_all_over_the_sidewalk_i/,"WITT Baltimore? I see them all over the sidewalk. I assume nefarious activities, but can't identify what.",/r/baltimore/comments/tuszfc/witt_baltimore_i_see_them_all_over_the_sidewalk_i/i35oiai/,12,r/baltimore,0,12
That sugar is wild,t2_c7fix,XxNitr0xX,0,1648937104.0,0,t1_i35nrbf,i35nrbf,False,w3tterisb3tter,t3_tuszfc,https://www.reddit.com/r/baltimore/comments/tuszfc/witt_baltimore_i_see_them_all_over_the_sidewalk_i/,"WITT Baltimore? I see them all over the sidewalk. I assume nefarious activities, but can't identify what.",/r/baltimore/comments/tuszfc/witt_baltimore_i_see_them_all_over_the_sidewalk_i/i35nrbf/,9,r/baltimore,0,9
"I went to one of the beer pairing dinners at Guinness, the food is extraordinary.",t2_5jv8p,yarnwhore,0,1648937006.0,0,t1_i35njzy,i35njzy,False,zqwu8391,t3_tulfr0,https://www.reddit.com/r/baltimore/comments/tulfr0/best_restaurant_food_youd_drive_to_the_suburbs_for/,Best restaurant / food you’d drive to the suburbs for?,/r/baltimore/comments/tulfr0/best_restaurant_food_youd_drive_to_the_suburbs_for/i35njzy/,2,r/baltimore,0,2
Our Recipes in Arbutus. They do soul/NOLA style food. Small place with limited hours but the food is fantastic.,t2_ajz9x,CharmedInBaltimore,0,1648936914.0,0,t1_i35nd3w,i35nd3w,True,zqwu8391,t3_tulfr0,https://www.reddit.com/r/baltimore/comments/tulfr0/best_restaurant_food_youd_drive_to_the_suburbs_for/,Best restaurant / food you’d drive to the suburbs for?,/r/baltimore/comments/tulfr0/best_restaurant_food_youd_drive_to_the_suburbs_for/i35nd3w/,5,r/baltimore,0,5
Other commenters pointed out they are more si.ilar to crack vial caps like this https://www.gettyimages.com/photos/crack-vial,t2_14px5x,w3tterisb3tter,0,1648936857.0,0,t1_i35n907,i35n907,False,w3tterisb3tter,t3_tuszfc,https://www.reddit.com/r/baltimore/comments/tuszfc/witt_baltimore_i_see_them_all_over_the_sidewalk_i/,"WITT Baltimore? I see them all over the sidewalk. I assume nefarious activities, but can't identify what.",/r/baltimore/comments/tuszfc/witt_baltimore_i_see_them_all_over_the_sidewalk_i/i35n907/,7,r/baltimore,0,7
"I keed. I keed. 
I joke with you.",t2_50yhzd0t,TatumLaBianca,0,1648936768.0,0,t1_i35n2a5,i35n2a5,False,Dry_Lychee_6533,t3_tuojh8,https://www.reddit.com/r/baltimore/comments/tuojh8/baltimore_street_area/,Baltimore Street Area,/r/baltimore/comments/tuojh8/baltimore_street_area/i35n2a5/,-3,r/baltimore,0,-3
"Excellent, that makes sense cuz I found hella of those little plastic snap caps that are obviously for small amounts of drugs around the same spot as this pick.",t2_14px5x,w3tterisb3tter,0,1648936533.0,0,t1_i35mkrw,i35mkrw,False,w3tterisb3tter,t3_tuszfc,https://www.reddit.com/r/baltimore/comments/tuszfc/witt_baltimore_i_see_them_all_over_the_sidewalk_i/,"WITT Baltimore? I see them all over the sidewalk. I assume nefarious activities, but can't identify what.",/r/baltimore/comments/tuszfc/witt_baltimore_i_see_them_all_over_the_sidewalk_i/i35mkrw/,18,r/baltimore,0,18
"Excellent, that makes sense cuz I found hella of those little plastic snap caps that are obviously for small amounts of drugs around the same spot as this pick.",t2_14px5x,w3tterisb3tter,0,1648936488.0,0,t1_i35mhg6,i35mhg6,False,w3tterisb3tter,t3_tuszfc,https://www.reddit.com/r/baltimore/comments/tuszfc/witt_baltimore_i_see_them_all_over_the_sidewalk_i/,"WITT Baltimore? I see them all over the sidewalk. I assume nefarious activities, but can't identify what.",/r/baltimore/comments/tuszfc/witt_baltimore_i_see_them_all_over_the_sidewalk_i/i35mhg6/,2,r/baltimore,0,2
"Excellent, that makes sense cuz I found hella of those little plastic snap caps that are obviously for small amounts of drugs around the same spot as this pick.",t2_14px5x,w3tterisb3tter,0,1648936477.0,0,t1_i35mgo7,i35mgo7,False,w3tterisb3tter,t3_tuszfc,https://www.reddit.com/r/baltimore/comments/tuszfc/witt_baltimore_i_see_them_all_over_the_sidewalk_i/,"WITT Baltimore? I see them all over the sidewalk. I assume nefarious activities, but can't identify what.",/r/baltimore/comments/tuszfc/witt_baltimore_i_see_them_all_over_the_sidewalk_i/i35mgo7/,4,r/baltimore,0,4
Those are not syringe caps.  They're the tops of crack vials.,t2_ce0e7,XxCloudSephiroth69xX,0,1648936375.0,0,t1_i35m8x5,i35m8x5,True,w3tterisb3tter,t3_tuszfc,https://www.reddit.com/r/baltimore/comments/tuszfc/witt_baltimore_i_see_them_all_over_the_sidewalk_i/,"WITT Baltimore? I see them all over the sidewalk. I assume nefarious activities, but can't identify what.",/r/baltimore/comments/tuszfc/witt_baltimore_i_see_them_all_over_the_sidewalk_i/i35m8x5/,17,r/baltimore,0,17
"seeing a lotta “syringe caps” on here
just to clear it up, these the caps from the vials of coke & dope.

source: i used to be a customer.",t2_quh1v,CastleCrasherOG,0,1648936269.0,0,t1_i35m0ud,i35m0ud,True,w3tterisb3tter,t3_tuszfc,https://www.reddit.com/r/baltimore/comments/tuszfc/witt_baltimore_i_see_them_all_over_the_sidewalk_i/,"WITT Baltimore? I see them all over the sidewalk. I assume nefarious activities, but can't identify what.",/r/baltimore/comments/tuszfc/witt_baltimore_i_see_them_all_over_the_sidewalk_i/i35m0ud/,47,r/baltimore,0,47
TIL. Thank you!,t2_9sl6n,aukuski03,0,1648936246.0,0,t1_i35lz6u,i35lz6u,False,w3tterisb3tter,t3_tuszfc,https://www.reddit.com/r/baltimore/comments/tuszfc/witt_baltimore_i_see_them_all_over_the_sidewalk_i/,"WITT Baltimore? I see them all over the sidewalk. I assume nefarious activities, but can't identify what.",/r/baltimore/comments/tuszfc/witt_baltimore_i_see_them_all_over_the_sidewalk_i/i35lz6u/,6,r/baltimore,0,6
