body,author_fullname,author.name,controversiality,created,downs,fullname,id,is_root,link_author,link_id,link_permalink,link_title,permalink,score,subreddit_name_prefixed,total_awards_received,ups
You don’t like transplants so you’re moving to…DC?,t2_4ua0897,cdbloosh,0,1648906997.0,0,t1_i33v61v,i33v61v,False,sweetness0987,t3_tmmwt4,https://www.reddit.com/r/baltimore/comments/tmmwt4/moving_to_baltimore_soon/,Moving to baltimore soon,/r/baltimore/comments/tmmwt4/moving_to_baltimore_soon/i33v61v/,2,r/baltimore,0,2
r/ColumbiaMD come join us! Although you would need a car to get around here,t2_1e45c196,mcoon2837,0,1648906667.0,0,t1_i33ujbo,i33ujbo,True,Own_Conference_9391,t3_tuhzli,https://www.reddit.com/r/baltimore/comments/tuhzli/neighborhood_recommendations_runner_dc_commuter/,Neighborhood recommendations: runner & DC commuter,/r/baltimore/comments/tuhzli/neighborhood_recommendations_runner_dc_commuter/i33ujbo/,-7,r/baltimore,0,-7
">If I'm the third car there, and see a car signalling to turn left, and another signalling to turn right, which side do I get on if I'm going straight?  

Usually behind the turning driver in the left lane, but if there's a lot of oncoming traffic in the other direction, it's fine to get into the right lane and sneak around the turning car.",t2_jdeoq,baltimorecalling,0,1648906594.0,0,t1_i33uefn,i33uefn,True,jimmyjone,t3_tu8jgl,https://www.reddit.com/r/baltimore/comments/tu8jgl/just_moved_to_mt_washington_and_need_a_traffic/,Just moved to Mt Washington and need a traffic lesson,/r/baltimore/comments/tu8jgl/just_moved_to_mt_washington_and_need_a_traffic/i33uefn/,2,r/baltimore,0,2
*nationwide trend*,t2_9irts,ih8yourstupidface,0,1648906488.0,0,t1_i33u727,i33u727,False,z3mcs,t3_tu21u1,https://www.reddit.com/r/baltimore/comments/tu21u1/baltimore_banners_justin_fenton_there_have_been/,"[Baltimore Banner's Justin Fenton] ""There have been 135 reported carjackings in Baltimore this year, compared to 81 at this time last year - an increase of 67 percent. It's a nationwide trend""",/r/baltimore/comments/tu21u1/baltimore_banners_justin_fenton_there_have_been/i33u727/,7,r/baltimore,0,7
"I second looking into Ridgely's Delight.  So close to the MARC Camden Station, close to the ballpark, lots of good running routes around the stadium area.  

Easy access to the light rail and circulator to get around the area.  

Parking in Ridgely's Delight sucks, so I wouldn't even rush to get a car, especially with relatively easy access to transit.",t2_jdeoq,baltimorecalling,0,1648906471.0,0,t1_i33u5vo,i33u5vo,False,Own_Conference_9391,t3_tuhzli,https://www.reddit.com/r/baltimore/comments/tuhzli/neighborhood_recommendations_runner_dc_commuter/,Neighborhood recommendations: runner & DC commuter,/r/baltimore/comments/tuhzli/neighborhood_recommendations_runner_dc_commuter/i33u5vo/,2,r/baltimore,0,2
Harford actually protects its citizens.,t2_kh1qyscw,ConnectPrimary9601,0,1648906127.0,0,t1_i33tiz1,i33tiz1,True,goodnewsonly3702,t3_ttvv75,https://www.reddit.com/r/baltimore/comments/ttvv75/harford_county_baltimore_drug_dealer_pleads/,Harford County: Baltimore drug dealer pleads guilty to giving cocaine fentanyl to fatal overdose victim,/r/baltimore/comments/ttvv75/harford_county_baltimore_drug_dealer_pleads/i33tiz1/,3,r/baltimore,0,3
"You’ll probably want to look at Ridgely’s Delight, Otterbein, and Federal Hill neighborhoods. All of those are walking distance to Camden Station where you can take the MARC to DC (i.e. Camden Line). If you live in that area you can run on the Inner Harbor (probably Baltimore’s too running spot) and all over the Peninsula area. You’ll also be close to the Gwynn’s Falls Trail, the Middle Branch Trail, and the start of the Jones Falls Trail which you can take up to Druid Hill Park and beyond for long runs. If you have Strava the heat maps can give you an idea of running routes. 

A car in that area would not be necessary but might be helpful. You can get groceries delivered through Amazon (Fresh/Whole Foods) or with Walmart+. The Federal Hill/Riverside area is one of the top spots for going out in Baltimore and there is a great social scene/nightlife. If you do get a car it will open up a lot more places that are great to run like Patapsco State Park (the best park in the state IMO) and you are close to many highways so you can get other places (e.g. NCR Trail) fairly easily. I’m also a serious runner and in the relative be area so let me know if you have any questions.",t2_e34fg,Mirron,0,1648905967.0,0,t1_i33t890,i33t890,True,Own_Conference_9391,t3_tuhzli,https://www.reddit.com/r/baltimore/comments/tuhzli/neighborhood_recommendations_runner_dc_commuter/,Neighborhood recommendations: runner & DC commuter,/r/baltimore/comments/tuhzli/neighborhood_recommendations_runner_dc_commuter/i33t890/,3,r/baltimore,0,3
"1) this is how Baltimore politicians view themselves, as being above the voters/residents

2) Mosby is 100% guaranteed winning the Dem primary. Get used to it.",t2_kh1qyscw,ConnectPrimary9601,0,1648905881.0,0,t1_i33t2io,i33t2io,False,JonWilso,t3_ttv6vr,https://www.reddit.com/r/baltimore/comments/ttv6vr/justin_fenton_on_twitter_breaking_after_insisting/,"Justin Fenton on Twitter - Breaking: After insisting on a speedy trial, Marilyn Mosby's attorneys have asked for her May 2 federal trial to be postponed to SEPTEMBER",/r/baltimore/comments/ttv6vr/justin_fenton_on_twitter_breaking_after_insisting/i33t2io/,3,r/baltimore,0,3
"Lol. Idk. I just never did! I always ran in and around Hampden, Druid, and Mount Vernon. Just never went that way! I should have and didn’t really consider it until about 6 months prior to moving but I was I injured and never got the chance.",t2_9m5gg,IN_YOUR_FACE_SMACK,0,1648905861.0,0,t1_i33t18q,i33t18q,False,Own_Conference_9391,t3_tuhzli,https://www.reddit.com/r/baltimore/comments/tuhzli/neighborhood_recommendations_runner_dc_commuter/,Neighborhood recommendations: runner & DC commuter,/r/baltimore/comments/tuhzli/neighborhood_recommendations_runner_dc_commuter/i33t18q/,1,r/baltimore,0,1
"I’d highly recommend Mt. Vernon. I did the same thing myself (take the Marc to DC twice a week) and being able to walk to the station and not rely on a connection (or getting in a car) made it so much nicer. Also a runner... my favorite route from Mt. Vernon was the path on Falls Rd up to Druid Hill Park, then get in a few laps around the lake. Great views of the city and very few intersections to cross.",t2_1zghvpno,crowsnest102,0,1648905693.0,0,t1_i33sq8c,i33sq8c,True,Own_Conference_9391,t3_tuhzli,https://www.reddit.com/r/baltimore/comments/tuhzli/neighborhood_recommendations_runner_dc_commuter/,Neighborhood recommendations: runner & DC commuter,/r/baltimore/comments/tuhzli/neighborhood_recommendations_runner_dc_commuter/i33sq8c/,12,r/baltimore,0,12
"Your best bet is to stay to the right. Usually left turn lanes are exclusive because they tend to hold up traffic. Right turn lanes generally include straight away traffic because they both flow freely on green. I know the intersection you're talking about, just move with confidence, if you're in the right lane you have right of way.",t2_b74dsni1,baballzya,0,1648905672.0,0,t1_i33sote,i33sote,True,jimmyjone,t3_tu8jgl,https://www.reddit.com/r/baltimore/comments/tu8jgl/just_moved_to_mt_washington_and_need_a_traffic/,Just moved to Mt Washington and need a traffic lesson,/r/baltimore/comments/tu8jgl/just_moved_to_mt_washington_and_need_a_traffic/i33sote/,0,r/baltimore,0,0
"Not sure if it was related but reports of an armed robbery, and multiple gunshots near Lombard in Highlandtown last night around 11:30-12:00.",t2_j8hor,tannerfree,0,1648905659.0,0,t1_i33snz2,i33snz2,True,The_Waxies_Dargle,t3_tuate3,https://www.reddit.com/r/baltimore/comments/tuate3/wtf_is_going_on_out_there/,WTF is going on out there???,/r/baltimore/comments/tuate3/wtf_is_going_on_out_there/i33snz2/,1,r/baltimore,0,1
Y’all are some straight up losers and it just proves my point. Because I said I don’t care for the unfriendly  GENTRIFIERS in Baltimore y’all reported my post as suicidal? Grow the fuck up.,t2_11gh2z,glamsy,0,1648905547.0,0,t1_i33sgpk,i33sgpk,True,sweetness0987,t3_tmmwt4,https://www.reddit.com/r/baltimore/comments/tmmwt4/moving_to_baltimore_soon/,Moving to baltimore soon,/r/baltimore/comments/tmmwt4/moving_to_baltimore_soon/i33sgpk/,-1,r/baltimore,0,-1
"Endorse this but how did you never run north?!Lol. Roland Park is a great area to run. You can go up and down Charles and Roland, and zig zag in between to add extra miles. I love going over to Sherwood gardens area too. I did half marathon training and never went south of Hampden. Just confirms that it’s a great place for running!",t2_abh7ypuu,TaterTotz8,0,1648905444.0,0,t1_i33s9z9,i33s9z9,False,Own_Conference_9391,t3_tuhzli,https://www.reddit.com/r/baltimore/comments/tuhzli/neighborhood_recommendations_runner_dc_commuter/,Neighborhood recommendations: runner & DC commuter,/r/baltimore/comments/tuhzli/neighborhood_recommendations_runner_dc_commuter/i33s9z9/,7,r/baltimore,0,7
"Well thank God that somebody from out of town, for one day, is here to straighten us all out.",t2_4cp8b,ratwing,0,1648905281.0,0,t1_i33rzj3,i33rzj3,False,jimmyjone,t3_tu8jgl,https://www.reddit.com/r/baltimore/comments/tu8jgl/just_moved_to_mt_washington_and_need_a_traffic/,Just moved to Mt Washington and need a traffic lesson,/r/baltimore/comments/tu8jgl/just_moved_to_mt_washington_and_need_a_traffic/i33rzj3/,3,r/baltimore,0,3
"A lot has changed. The feds announced they had recordings of her talking to her retirement plan about withdrawals, for one. Maybe she wants more time to try to defend whatever was said on those calls. Everyone hates thiru lol",t2_341jcpni,sdawg1611,0,1648905266.0,0,t1_i33rymy,i33rymy,False,JonWilso,t3_ttv6vr,https://www.reddit.com/r/baltimore/comments/ttv6vr/justin_fenton_on_twitter_breaking_after_insisting/,"Justin Fenton on Twitter - Breaking: After insisting on a speedy trial, Marilyn Mosby's attorneys have asked for her May 2 federal trial to be postponed to SEPTEMBER",/r/baltimore/comments/ttv6vr/justin_fenton_on_twitter_breaking_after_insisting/i33rymy/,3,r/baltimore,0,3
Baltimore is big dude. Where was this?,t2_ieuaavew,ghhki,0,1648905174.0,0,t1_i33rsrj,i33rsrj,True,The_Waxies_Dargle,t3_tuate3,https://www.reddit.com/r/baltimore/comments/tuate3/wtf_is_going_on_out_there/,WTF is going on out there???,/r/baltimore/comments/tuate3/wtf_is_going_on_out_there/i33rsrj/,17,r/baltimore,0,17
First of all: That’s not technically jaywalking. Also: I just moved here from NYC—literally yesterday. And I can already tell that drivers in Baltimore have zero clue how the concept of pedestrians works 🤦‍♀️,t2_564dsueo,Ok_Ad8609,0,1648905130.0,0,t1_i33rq13,i33rq13,False,jimmyjone,t3_tu8jgl,https://www.reddit.com/r/baltimore/comments/tu8jgl/just_moved_to_mt_washington_and_need_a_traffic/,Just moved to Mt Washington and need a traffic lesson,/r/baltimore/comments/tu8jgl/just_moved_to_mt_washington_and_need_a_traffic/i33rq13/,3,r/baltimore,0,3
"It's a totally reasonable question. This is serious advice: just don't get too hung up on it. And yes, people don't signal that much. 

The other thing that you'll probably find surprising is there's a lot of pedestrians that will jaywalk right up to the edge of a car lane. literally, they get annoyed if you stop or slow down for them, they just want you to go by.",t2_4cp8b,ratwing,0,1648904718.0,0,t1_i33qzxw,i33qzxw,True,jimmyjone,t3_tu8jgl,https://www.reddit.com/r/baltimore/comments/tu8jgl/just_moved_to_mt_washington_and_need_a_traffic/,Just moved to Mt Washington and need a traffic lesson,/r/baltimore/comments/tu8jgl/just_moved_to_mt_washington_and_need_a_traffic/i33qzxw/,3,r/baltimore,0,3
"Last reply, promise. If you have any questions or concerns about running in Baltimore, feel free to DM me.",t2_9m5gg,IN_YOUR_FACE_SMACK,0,1648904551.0,0,t1_i33qpg7,i33qpg7,False,Own_Conference_9391,t3_tuhzli,https://www.reddit.com/r/baltimore/comments/tuhzli/neighborhood_recommendations_runner_dc_commuter/,Neighborhood recommendations: runner & DC commuter,/r/baltimore/comments/tuhzli/neighborhood_recommendations_runner_dc_commuter/i33qpg7/,1,r/baltimore,0,1
"I’m a woman, by the way! Female runners, unite!",t2_9m5gg,IN_YOUR_FACE_SMACK,0,1648904442.0,0,t1_i33qipi,i33qipi,False,Own_Conference_9391,t3_tuhzli,https://www.reddit.com/r/baltimore/comments/tuhzli/neighborhood_recommendations_runner_dc_commuter/,Neighborhood recommendations: runner & DC commuter,/r/baltimore/comments/tuhzli/neighborhood_recommendations_runner_dc_commuter/i33qipi/,1,r/baltimore,0,1
Watch out for the Orthodox and Hasidic Jews that walk their team of kids on the road (smith ave) at night.,t2_6wsplawe,WhoGunnaCheckMeBoo,0,1648904417.0,0,t1_i33qh68,i33qh68,True,jimmyjone,t3_tu8jgl,https://www.reddit.com/r/baltimore/comments/tu8jgl/just_moved_to_mt_washington_and_need_a_traffic/,Just moved to Mt Washington and need a traffic lesson,/r/baltimore/comments/tu8jgl/just_moved_to_mt_washington_and_need_a_traffic/i33qh68/,4,r/baltimore,0,4
"Also, if you’re looking for a place, I know the place I rented will be going back up for rent in a short time. It was in an end row home and was a split. It was nice! If you’re interested, I can see when the listing will be out and send it along.",t2_9m5gg,IN_YOUR_FACE_SMACK,0,1648904397.0,0,t1_i33qfys,i33qfys,False,Own_Conference_9391,t3_tuhzli,https://www.reddit.com/r/baltimore/comments/tuhzli/neighborhood_recommendations_runner_dc_commuter/,Neighborhood recommendations: runner & DC commuter,/r/baltimore/comments/tuhzli/neighborhood_recommendations_runner_dc_commuter/i33qfys/,1,r/baltimore,0,1
"I just moved out of Baltimore and was a runner as well. Hampden was an okay option for running, close enough access to Penn Station, and meeting people. 

I was able to run early morning to early evening in Hampden with no issue. Early morning is easier because there is less people and traffic. You can go to Druid Park, run around Homewood, and all over Hampden. I felt safe enough when I ran. 

As far as access to the Marc, Hampden is a quick drive down 83 (no more than 5 minutes) or you take Falls Road down past the Street Car Museum and you avoid 83 altogether while it dumps you right behind the station. That is, if that part of Falls is open yet (it’s been closed for awhile, opened briefly, then closed back up right when I moved out at the end of February). You can even run down the Jones Falls Trail on Falls and it’ll dump you in Mount Vernon. I even lived in Mount Vernon for a quick second and was able to run around there pretty easily but did limit it to the morning. 

As far as meeting people, Hampden, from my experience, is more families and college-aged to hippies. The Avenue is where it’s at and there always seems to be people out and about. It’s pretty nice. 

I recommend Hampden. It’s calm enough where you can just walk away from the nightlife and have a somewhat suburban feel but still have access to things, even within walking, or running!

By the way, I trained for a half marathon running around Mount Vernon and Hampden. You’ll definitely have access. I did get hurt three times running in the city due to broken sidewalks and tripping on them.",t2_9m5gg,IN_YOUR_FACE_SMACK,0,1648904251.0,0,t1_i33q71m,i33q71m,True,Own_Conference_9391,t3_tuhzli,https://www.reddit.com/r/baltimore/comments/tuhzli/neighborhood_recommendations_runner_dc_commuter/,Neighborhood recommendations: runner & DC commuter,/r/baltimore/comments/tuhzli/neighborhood_recommendations_runner_dc_commuter/i33q71m/,3,r/baltimore,0,3
Mark Brown is a great dude.,t2_f48cwd9x,BMoreOnTheWater,0,1648903803.0,0,t1_i33pg1n,i33pg1n,True,WhoGunnaCheckMeBoo,t3_ttfdnx,https://www.reddit.com/r/baltimore/comments/ttfdnx/two_years_after_opening_in_old_goucher_no_land/,"Two Years After Opening in Old Goucher, No Land Beyond to Celebrate Debut",/r/baltimore/comments/ttfdnx/two_years_after_opening_in_old_goucher_no_land/i33pg1n/,1,r/baltimore,0,1
Yup. Either inside or outside by the pavilion. Can’t beat the views.,t2_f48cwd9x,BMoreOnTheWater,0,1648903727.0,0,t1_i33pbll,i33pbll,False,edgar__allan__bro,t3_ttr74c,https://www.reddit.com/r/baltimore/comments/ttr74c/where_are_the_best_places_in_baltimore_for/,Where are the best places in Baltimore for throwing corporate events?,/r/baltimore/comments/ttr74c/where_are_the_best_places_in_baltimore_for/i33pbll/,1,r/baltimore,0,1
"Agreed as a first step, at least make it so law abiding citizens are permitted after training.",t2_ka3wt,lookatmykwok,0,1648903369.0,0,t1_i33oqfk,i33oqfk,False,z3mcs,t3_tu21u1,https://www.reddit.com/r/baltimore/comments/tu21u1/baltimore_banners_justin_fenton_there_have_been/,"[Baltimore Banner's Justin Fenton] ""There have been 135 reported carjackings in Baltimore this year, compared to 81 at this time last year - an increase of 67 percent. It's a nationwide trend""",/r/baltimore/comments/tu21u1/baltimore_banners_justin_fenton_there_have_been/i33oqfk/,4,r/baltimore,0,4
NYC has one of the lowest homicide rates in the nation. Baltimore has one of the highest globally. This is an inaccurate comparison.,t2_bee319kc,RuinAdventurous1931,0,1648902703.0,0,t1_i33nnqe,i33nnqe,False,JonWilso,t3_sbu0fs,https://www.reddit.com/r/baltimore/comments/sbu0fs/justin_fenton_man_killed_in_fatal_shooting_in/,Justin Fenton - Man killed in fatal shooting in Fells Point last night identified as Little Italy restaurant La Scala’s GM Chesley Patterson,/r/baltimore/comments/sbu0fs/justin_fenton_man_killed_in_fatal_shooting_in/i33nnqe/,1,r/baltimore,0,1
Hearing from others that's what it was.,t2_r06mt,The_Waxies_Dargle,0,1648902510.0,0,t1_i33nd0z,i33nd0z,False,The_Waxies_Dargle,t3_tuate3,https://www.reddit.com/r/baltimore/comments/tuate3/wtf_is_going_on_out_there/,WTF is going on out there???,/r/baltimore/comments/tuate3/wtf_is_going_on_out_there/i33nd0z/,1,r/baltimore,0,1
Allowing average citizens to conceal carry would be a good first step.,t2_l8u9bgl,ResidentKoala,1,1648902088.0,0,t1_i33mp0c,i33mp0c,False,z3mcs,t3_tu21u1,https://www.reddit.com/r/baltimore/comments/tu21u1/baltimore_banners_justin_fenton_there_have_been/,"[Baltimore Banner's Justin Fenton] ""There have been 135 reported carjackings in Baltimore this year, compared to 81 at this time last year - an increase of 67 percent. It's a nationwide trend""",/r/baltimore/comments/tu21u1/baltimore_banners_justin_fenton_there_have_been/i33mp0c/,-10,r/baltimore,0,-10
"I went to a Christmas party there, great venue for gatherings.",t2_9q17hfdb,7thtrumpetsoonplease,0,1648902066.0,0,t1_i33mns6,i33mns6,False,edgar__allan__bro,t3_ttr74c,https://www.reddit.com/r/baltimore/comments/ttr74c/where_are_the_best_places_in_baltimore_for/,Where are the best places in Baltimore for throwing corporate events?,/r/baltimore/comments/ttr74c/where_are_the_best_places_in_baltimore_for/i33mns6/,1,r/baltimore,0,1
"Mosby is going to try to get Judge Judy to oversee the case next, she did well there before.",t2_9q17hfdb,7thtrumpetsoonplease,0,1648901801.0,0,t1_i33m8z5,i33m8z5,True,JonWilso,t3_ttv6vr,https://www.reddit.com/r/baltimore/comments/ttv6vr/justin_fenton_on_twitter_breaking_after_insisting/,"Justin Fenton on Twitter - Breaking: After insisting on a speedy trial, Marilyn Mosby's attorneys have asked for her May 2 federal trial to be postponed to SEPTEMBER",/r/baltimore/comments/ttv6vr/justin_fenton_on_twitter_breaking_after_insisting/i33m8z5/,3,r/baltimore,0,3
maybe it was people showing off their cars in the middle of the roads? doing loops racing etc etc,t2_gofbtcq3,youwantmybiscuits,0,1648901665.0,0,t1_i33m1lr,i33m1lr,True,The_Waxies_Dargle,t3_tuate3,https://www.reddit.com/r/baltimore/comments/tuate3/wtf_is_going_on_out_there/,WTF is going on out there???,/r/baltimore/comments/tuate3/wtf_is_going_on_out_there/i33m1lr/,6,r/baltimore,0,6
"good tip, thanks!",t2_i2ygdqau,bmoreby,0,1648901248.0,0,t1_i33lf4p,i33lf4p,False,AutoModerator,t3_ttn239,https://www.reddit.com/r/baltimore/comments/ttn239/monthly_rbaltimore_chat_april_2022/,Monthly r/Baltimore Chat - - April 2022,/r/baltimore/comments/ttn239/monthly_rbaltimore_chat_april_2022/i33lf4p/,1,r/baltimore,0,1
"UPDATE: No idea what it was. It ended around 1:45. There were multiple explosions, fireworks, what sounded like gunfire and lots of engine revving and dirtbike sounds. Wife said it was going on for like a half hour, but I was drifting in and out of sleep. From our porches you could see dozens of cops blocking roads, and traffic backed up for maybe a quarter of a mile in all directions. And then in like 5 minutes, it was all gone.",t2_r06mt,The_Waxies_Dargle,1,1648901225.0,0,t1_i33ldyz,i33ldyz,True,The_Waxies_Dargle,t3_tuate3,https://www.reddit.com/r/baltimore/comments/tuate3/wtf_is_going_on_out_there/,WTF is going on out there???,/r/baltimore/comments/tuate3/wtf_is_going_on_out_there/i33ldyz/,0,r/baltimore,0,0
"I live near the hospital in Mt Vernon, some cars were going very fast and then the cops went by so...not sure",t2_8bllztgo,wastetide,0,1648901128.0,0,t1_i33l8nq,i33l8nq,True,The_Waxies_Dargle,t3_tuate3,https://www.reddit.com/r/baltimore/comments/tuate3/wtf_is_going_on_out_there/,WTF is going on out there???,/r/baltimore/comments/tuate3/wtf_is_going_on_out_there/i33l8nq/,2,r/baltimore,0,2
The god damned Russians again!,t2_437m4v31,yeaughourdt,0,1648900450.0,0,t1_i33k8n7,i33k8n7,True,The_Waxies_Dargle,t3_tuate3,https://www.reddit.com/r/baltimore/comments/tuate3/wtf_is_going_on_out_there/,WTF is going on out there???,/r/baltimore/comments/tuate3/wtf_is_going_on_out_there/i33k8n7/,2,r/baltimore,0,2
"You will immediately start dissolving and will turn into crab food. It's the MD way...

Or you know nothing will happen since the harbor is doing much better than it has been for years outside of days immediately following rain.",t2_di2bq,jabbadarth,0,1648899574.0,0,t1_i33j04b,i33j04b,False,BMoreOnTheWater,t3_tu6gnd,https://www.reddit.com/r/baltimore/comments/tu6gnd/inner_harbor_kayak_tours_start_up_in_may_through/,Inner Harbor Kayak Tours start up in May (through Waterfront Partnership),/r/baltimore/comments/tu6gnd/inner_harbor_kayak_tours_start_up_in_may_through/i33j04b/,9,r/baltimore,0,9
"Agree 100%. This is how I feel about HIV. I don't put up with it.

Why would I pay $3 on a condom on top of my health insurance to help prevent it. That's basically condoning it.

Same reason why I don't believe in spending money on smoke detectors, that's what home insurance is for.",t2_7xj7zb2j,thenagininini,0,1648899560.0,0,t1_i33izd1,i33izd1,False,z3mcs,t3_tu21u1,https://www.reddit.com/r/baltimore/comments/tu21u1/baltimore_banners_justin_fenton_there_have_been/,"[Baltimore Banner's Justin Fenton] ""There have been 135 reported carjackings in Baltimore this year, compared to 81 at this time last year - an increase of 67 percent. It's a nationwide trend""",/r/baltimore/comments/tu21u1/baltimore_banners_justin_fenton_there_have_been/i33izd1/,16,r/baltimore,0,16
"Wait- there's a part of Baltimore where drivers stop at red lights, and use their turn signals?!",t2_31vi6ixt,NewrytStarcommander,0,1648898420.0,0,t1_i33hf80,i33hf80,True,jimmyjone,t3_tu8jgl,https://www.reddit.com/r/baltimore/comments/tu8jgl/just_moved_to_mt_washington_and_need_a_traffic/,Just moved to Mt Washington and need a traffic lesson,/r/baltimore/comments/tu8jgl/just_moved_to_mt_washington_and_need_a_traffic/i33hf80/,19,r/baltimore,0,19
Yes! There is also Baltimore Community Fridge at North Ave and Calvert [https://www.instagram.com/bmorecommunityfridge/?hl=en](https://www.instagram.com/bmorecommunityfridge/?hl=en),t2_j73oy0v4,brutereasons,0,1648898388.0,0,t1_i33hdnr,i33hdnr,False,Captainxray,t3_ttxs62,https://www.reddit.com/r/baltimore/comments/ttxs62/update_a_little_under_three_weeks_ago_i_posted_to/,"UPDATE: A little under three weeks ago I posted to this sub asking for resources on being homeless. This community came together to help, and it gave me a lot of hope. And saved my life.",/r/baltimore/comments/ttxs62/update_a_little_under_three_weeks_ago_i_posted_to/i33hdnr/,3,r/baltimore,0,3
This can go in the open thread on this https://www.reddit.com/r/baltimore/comments/ttv6vr/justin_fenton_on_twitter_breaking_after_insisting/,t2_bx6iu,z3mcs,0,1648897955.0,0,t1_i33gtq5,i33gtq5,True,Marine1111,t3_tubetv,https://www.reddit.com/r/baltimore/comments/tubetv/feds_response_to_marilyn_mosby_trial_delay/,Feds response to Marilyn Mosby trial delay request - 'They are unprepared',/r/baltimore/comments/tubetv/feds_response_to_marilyn_mosby_trial_delay/i33gtq5/,1,r/baltimore,0,1
I too moved here from the south and just eave when people honk.  I thought they were just bEiNg fRiEnDlY 😃,t2_2vtv3kyq,Ali1558Cat,0,1648897383.0,0,t1_i33g3rd,i33g3rd,True,jimmyjone,t3_tu8jgl,https://www.reddit.com/r/baltimore/comments/tu8jgl/just_moved_to_mt_washington_and_need_a_traffic/,Just moved to Mt Washington and need a traffic lesson,/r/baltimore/comments/tu8jgl/just_moved_to_mt_washington_and_need_a_traffic/i33g3rd/,2,r/baltimore,0,2
I did not downvote you.,t2_ka3wt,lookatmykwok,0,1648896830.0,0,t1_i33fesv,i33fesv,False,z3mcs,t3_tu21u1,https://www.reddit.com/r/baltimore/comments/tu21u1/baltimore_banners_justin_fenton_there_have_been/,"[Baltimore Banner's Justin Fenton] ""There have been 135 reported carjackings in Baltimore this year, compared to 81 at this time last year - an increase of 67 percent. It's a nationwide trend""",/r/baltimore/comments/tu21u1/baltimore_banners_justin_fenton_there_have_been/i33fesv/,1,r/baltimore,0,1
