body,author_fullname,author.name,controversiality,created,downs,fullname,id,is_root,link_author,link_id,link_permalink,link_title,permalink,score,subreddit_name_prefixed,total_awards_received,ups
Where in Crown Heights? What things do you like to do?,t2_d1c7uiyh,rakehellion,0,1648939220.0,0,t1_i35s3v9,i35s3v9,True,user1786257,t3_tukbve,https://www.reddit.com/r/Brooklyn/comments/tukbve/crown_heights_or_clinton_hill_for_a_thirty/,Crown heights or Clinton hill for a thirty something?,/r/Brooklyn/comments/tukbve/crown_heights_or_clinton_hill_for_a_thirty/i35s3v9/,2,r/Brooklyn,0,2
"I would say very hard, in my experience. The only people I know in a long-term month-to-month lease started out with a year-to-year lease, and once they gained the landlord's trust, were allowed to continue to rent month-to-month. There's no real motivation for landlords here to do long-term month-to-month leases.",t2_6rauh,metz270,0,1648939138.0,0,t1_i35rxra,i35rxra,False,Mindless_Badger_311,t3_tuuuiz,https://www.reddit.com/r/Brooklyn/comments/tuuuiz/how_hard_is_it_to_find_a_longterm_month_to_month/,How hard is it to find a long-term month to month lease in NYC?,/r/Brooklyn/comments/tuuuiz/how_hard_is_it_to_find_a_longterm_month_to_month/i35rxra/,4,r/Brooklyn,0,4
"I'd say very common after an initial period of time like that. 

Everyone is different, obviously. 

Make sure to find out how much time is left on the actual lease and what the roommates' expectations are etc.",t2_4ccebejq,Kuntry_Roadz,0,1648939102.0,0,t1_i35rv73,i35rv73,False,Mindless_Badger_311,t3_tuuuiz,https://www.reddit.com/r/Brooklyn/comments/tuuuiz/how_hard_is_it_to_find_a_longterm_month_to_month/,How hard is it to find a long-term month to month lease in NYC?,/r/Brooklyn/comments/tuuuiz/how_hard_is_it_to_find_a_longterm_month_to_month/i35rv73/,5,r/Brooklyn,0,5
"How common are agreements like ""I'll commit to three months and then we'll go month to month thereafter""? 

Really just want to determine how feasible it is that I'll be able to arrange something like that... would rather not move to the city on a short-term sublet and then when I try to arrange a long-term sublet, find that I can't do that",t2_hydupq4e,Mindless_Badger_311,0,1648938960.0,0,t1_i35rkru,i35rkru,False,Mindless_Badger_311,t3_tuuuiz,https://www.reddit.com/r/Brooklyn/comments/tuuuiz/how_hard_is_it_to_find_a_longterm_month_to_month/,How hard is it to find a long-term month to month lease in NYC?,/r/Brooklyn/comments/tuuuiz/how_hard_is_it_to_find_a_longterm_month_to_month/i35rkru/,1,r/Brooklyn,0,1
Most people subletting are going to want some sort of commitment (at least 3 months).,t2_4ccebejq,Kuntry_Roadz,0,1648938780.0,0,t1_i35r7o9,i35r7o9,False,Mindless_Badger_311,t3_tuuuiz,https://www.reddit.com/r/Brooklyn/comments/tuuuiz/how_hard_is_it_to_find_a_longterm_month_to_month/,How hard is it to find a long-term month to month lease in NYC?,/r/Brooklyn/comments/tuuuiz/how_hard_is_it_to_find_a_longterm_month_to_month/i35r7o9/,8,r/Brooklyn,0,8
As a daily driver simply I still don't understand. The only thing I can think of is  bus may have been going too fast not speeding to bring the bus to a stop without sending everyone on board flying forward. Kudos to the driver of the bus,t2_2g3t05j0,kutiket,1,1648938467.0,0,t1_i35qkbd,i35qkbd,True,kutiket,t3_tutsgi,https://www.reddit.com/r/Brooklyn/comments/tutsgi/simply_put_i_just_cant_understand_how_fulton_and/,simply put I just can't understand how @fulton and Bedford,/r/Brooklyn/comments/tutsgi/simply_put_i_just_cant_understand_how_fulton_and/i35qkbd/,1,r/Brooklyn,0,1
How hard is it to find a long-term month to month sublet? I should clarify that I'm not obsessed with finding a month to month lease specifically. It could be a month to month sublet. So long as it's long term. Could even turn into me signing onto a year lease after six months.,t2_hydupq4e,Mindless_Badger_311,0,1648938387.0,0,t1_i35qeax,i35qeax,False,Mindless_Badger_311,t3_tuuuiz,https://www.reddit.com/r/Brooklyn/comments/tuuuiz/how_hard_is_it_to_find_a_longterm_month_to_month/,How hard is it to find a long-term month to month lease in NYC?,/r/Brooklyn/comments/tuuuiz/how_hard_is_it_to_find_a_longterm_month_to_month/i35qeax/,1,r/Brooklyn,0,1
"You can probably find a place to sublet for awhile on Craigslist. I would say month-to-month leases are incredibly rare outside of subletting due to perpetually high demand, so that’s likely your best bet for something short-term.",t2_6rauh,metz270,0,1648938268.0,0,t1_i35q5nv,i35q5nv,True,Mindless_Badger_311,t3_tuuuiz,https://www.reddit.com/r/Brooklyn/comments/tuuuiz/how_hard_is_it_to_find_a_longterm_month_to_month/,How hard is it to find a long-term month to month lease in NYC?,/r/Brooklyn/comments/tuuuiz/how_hard_is_it_to_find_a_longterm_month_to_month/i35q5nv/,20,r/Brooklyn,0,20
Still available?,t2_58xc8n7g,vedAlive,0,1648937733.0,0,t1_i35p1tg,i35p1tg,True,LEG3NDwaitforitDARY,t3_tr1m7w,https://www.reddit.com/r/Brooklyn/comments/tr1m7w/selling_one_bob_moses_ticket_great_hall_avant/,"Selling one Bob Moses ticket (Great Hall @ Avant Gardner) Brooklyn, NY - $70 dollars - April, 2nd :)",/r/Brooklyn/comments/tr1m7w/selling_one_bob_moses_ticket_great_hall_avant/i35p1tg/,1,r/Brooklyn,0,1
"If I lived there, I’d leave it up and put up a second, additional mezuzah that I know has an acceptable klaf. I think that’d be kinda cool.",t2_p72cs,Batshua,0,1648937622.0,0,t1_i35otnl,i35otnl,False,Jazzlike_Expert,t3_ttc15x,https://www.reddit.com/r/Brooklyn/comments/ttc15x/key_holder_outside_of_apartment_door/,Key Holder Outside of Apartment Door,/r/Brooklyn/comments/ttc15x/key_holder_outside_of_apartment_door/i35otnl/,2,r/Brooklyn,0,2
"Yeah I was gonna say I don’t know how kosher that thing is! Still, it’s beautiful if not a stickler (which I’m not).",t2_1bks2yh0,mintyfreshknee,0,1648937529.0,0,t1_i35omv2,i35omv2,False,Jazzlike_Expert,t3_ttc15x,https://www.reddit.com/r/Brooklyn/comments/ttc15x/key_holder_outside_of_apartment_door/,Key Holder Outside of Apartment Door,/r/Brooklyn/comments/ttc15x/key_holder_outside_of_apartment_door/i35omv2/,2,r/Brooklyn,0,2
"If you aren’t commuting to the city every day, Clinton Hill is pretty great. The C train can be a bit of a pain, but the walk (or run) to Prospect is only about a 1.2 miles. I was there 10 years. Totally miss that neighborhood. Yes, there are families, but also tons of bars nearby.",t2_6ulv6wn,j-deaves,0,1648936706.0,0,t1_i35mxmv,i35mxmv,False,user1786257,t3_tukbve,https://www.reddit.com/r/Brooklyn/comments/tukbve/crown_heights_or_clinton_hill_for_a_thirty/,Crown heights or Clinton hill for a thirty something?,/r/Brooklyn/comments/tukbve/crown_heights_or_clinton_hill_for_a_thirty/i35mxmv/,5,r/Brooklyn,0,5
"A certain percentage of drivers are will always intentionally do things for their own benefit that clog traffic and endanger people, unless they’re physically prevented from doing so.

In NYC, a small percentage of drivers being bastards means hundreds of thousands of bastards. 

The only way to prevent this kind of dumbass u-turn is to install medians in places where it happens a lot. Stop asking drivers to be courteous - many just don’t care. Start using concrete to force them to behave.",t2_cpk1bzcp,_Maxolotl,0,1648936696.0,0,t1_i35mwv8,i35mwv8,True,kutiket,t3_tutsgi,https://www.reddit.com/r/Brooklyn/comments/tutsgi/simply_put_i_just_cant_understand_how_fulton_and/,simply put I just can't understand how @fulton and Bedford,/r/Brooklyn/comments/tutsgi/simply_put_i_just_cant_understand_how_fulton_and/i35mwv8/,39,r/Brooklyn,0,39
"Clinton Hill might skew a bit older but idk I think it would be okay personally in Crown Heights. I lived off the Franklin stop as a 30yo (with ""more mature"" taste in nightlife etc) and had no issues finding cool places that didn't feel too crazy.

All this to say - in a vacuum - I'd pick Clinton Hill. But if the apartment in Crown Heights is good, and the price is good, I don't view it as a real step down in any way personally",t2_i5jnmzev,makesupwordsblomp,0,1648936570.0,0,t1_i35mnhu,i35mnhu,True,user1786257,t3_tukbve,https://www.reddit.com/r/Brooklyn/comments/tukbve/crown_heights_or_clinton_hill_for_a_thirty/,Crown heights or Clinton hill for a thirty something?,/r/Brooklyn/comments/tukbve/crown_heights_or_clinton_hill_for_a_thirty/i35mnhu/,4,r/Brooklyn,0,4
"Just saw glassjaw there, it was awesome. Failure is coming thru soon too",t2_49fkv6xq,bpbcory,0,1648936475.0,0,t1_i35mghb,i35mghb,False,mayarudolphofficial,t3_tuio2j,https://www.reddit.com/r/Brooklyn/comments/tuio2j/venues_to_see_punk_metal_emo_shows/,Venues to see punk / metal / emo shows?,/r/Brooklyn/comments/tuio2j/venues_to_see_punk_metal_emo_shows/i35mghb/,3,r/Brooklyn,0,3
"Don't make a U turn in front of a bus. 
Here's the consequence for the bus driver.  Much less work that day and an extra hour pay to fill out an accident report that takes at most 30 minutes.",t2_8skdqudj,Medium-Intern-1539,0,1648936447.0,0,t1_i35mehv,i35mehv,True,kutiket,t3_tutsgi,https://www.reddit.com/r/Brooklyn/comments/tutsgi/simply_put_i_just_cant_understand_how_fulton_and/,simply put I just can't understand how @fulton and Bedford,/r/Brooklyn/comments/tutsgi/simply_put_i_just_cant_understand_how_fulton_and/i35mehv/,8,r/Brooklyn,0,8
https://www.chabad.org/library/article_cdo/aid/310889/jewish/The-Protective-Power-of-Mezuzah.htm,t2_5hc1pvg6,Hungry-Moose,0,1648936360.0,0,t1_i35m7si,i35m7si,False,Jazzlike_Expert,t3_ttc15x,https://www.reddit.com/r/Brooklyn/comments/ttc15x/key_holder_outside_of_apartment_door/,Key Holder Outside of Apartment Door,/r/Brooklyn/comments/ttc15x/key_holder_outside_of_apartment_door/i35m7si/,1,r/Brooklyn,0,1
You don’t see them much south of Lafayette (except for Higgins Hall).,t2_6ulv6wn,j-deaves,0,1648936323.0,0,t1_i35m4xv,i35m4xv,False,user1786257,t3_tukbve,https://www.reddit.com/r/Brooklyn/comments/tukbve/crown_heights_or_clinton_hill_for_a_thirty/,Crown heights or Clinton hill for a thirty something?,/r/Brooklyn/comments/tukbve/crown_heights_or_clinton_hill_for_a_thirty/i35m4xv/,4,r/Brooklyn,0,4
"Simple.  Someone was trying to U-turn possibly to grab that open spot but they didn’t expect the bus to go around them, or the bus driver wasn’t paying attention, or the bus driver didn’t have time to stop when the car made a sudden u-turn.",t2_294nu0in,cruisin5268d,0,1648935497.0,0,t1_i35kegj,i35kegj,True,kutiket,t3_tutsgi,https://www.reddit.com/r/Brooklyn/comments/tutsgi/simply_put_i_just_cant_understand_how_fulton_and/,simply put I just can't understand how @fulton and Bedford,/r/Brooklyn/comments/tutsgi/simply_put_i_just_cant_understand_how_fulton_and/i35kegj/,10,r/Brooklyn,0,10
No one understands. 😄,t2_84qmhakv,TheWeirdoWhisperer,0,1648935293.0,0,t1_i35jz6c,i35jz6c,True,kutiket,t3_tutsgi,https://www.reddit.com/r/Brooklyn/comments/tutsgi/simply_put_i_just_cant_understand_how_fulton_and/,simply put I just can't understand how @fulton and Bedford,/r/Brooklyn/comments/tutsgi/simply_put_i_just_cant_understand_how_fulton_and/i35jz6c/,4,r/Brooklyn,0,4
"Two things that stand out — coming to Grand Army Plaza from angles I’d never seen before, and discovering I could make it from Williamsburg to Barclays in 45 minutes to an hour depending on the route.

One more: all the churches, and the architecture that went into them.  I think it was Lafayette that had a bunch of them",t2_3c535,xwhy,0,1648934586.0,0,t1_i35ihrh,i35ihrh,False,xwhy,t3_tu5arx,https://www.reddit.com/r/Brooklyn/comments/tu5arx/walking_brooklyn_janmar_2022_since_may_2019/,"Walking Brooklyn, Jan-Mar 2022 & since May 2019",/r/Brooklyn/comments/tu5arx/walking_brooklyn_janmar_2022_since_may_2019/i35ihrh/,1,r/Brooklyn,0,1
Why do you think the people you’re supposedly advocating for don’t want that?,t2_11ksl7,AmIBeingInstained,0,1648934580.0,0,t1_i35ihba,i35ihba,False,CurrentJealous8132,t3_ttsdf3,https://www.reddit.com/r/Brooklyn/comments/ttsdf3/12_year_old_murdered/,12 Year old murdered,/r/Brooklyn/comments/ttsdf3/12_year_old_murdered/i35ihba/,0,r/Brooklyn,0,0
Husband and I are both 33 and have been in Crown Heights for 2 years. It’s definitely a good mix with plenty of people in their 30s. And we love the neighborhood. So much to walk to and lots of good food/bars.,t2_eh6u2h8,pizza_party_pants,0,1648934041.0,0,t1_i35hcf4,i35hcf4,True,user1786257,t3_tukbve,https://www.reddit.com/r/Brooklyn/comments/tukbve/crown_heights_or_clinton_hill_for_a_thirty/,Crown heights or Clinton hill for a thirty something?,/r/Brooklyn/comments/tukbve/crown_heights_or_clinton_hill_for_a_thirty/i35hcf4/,2,r/Brooklyn,0,2
Nice. Which was your favorite stretch so far?,t2_8l30j,F0rtysxity,0,1648933870.0,0,t1_i35gzre,i35gzre,True,xwhy,t3_tu5arx,https://www.reddit.com/r/Brooklyn/comments/tu5arx/walking_brooklyn_janmar_2022_since_may_2019/,"Walking Brooklyn, Jan-Mar 2022 & since May 2019",/r/Brooklyn/comments/tu5arx/walking_brooklyn_janmar_2022_since_may_2019/i35gzre/,1,r/Brooklyn,0,1
I'd argue the Pratt crowd is what OP is looking to avoid.,t2_4ccebejq,Kuntry_Roadz,0,1648933735.0,0,t1_i35gpe8,i35gpe8,False,user1786257,t3_tukbve,https://www.reddit.com/r/Brooklyn/comments/tukbve/crown_heights_or_clinton_hill_for_a_thirty/,Crown heights or Clinton hill for a thirty something?,/r/Brooklyn/comments/tukbve/crown_heights_or_clinton_hill_for_a_thirty/i35gpe8/,23,r/Brooklyn,0,23
Whoa right by my quaker meeting. I saw a gigantic man take a shit on the sidewalk on that block roll of toilet paper in hand,t2_r1puol4,xXx_n3w4z4_xXx,0,1648933149.0,0,t1_i35fgqi,i35fgqi,False,judgestinky,t3_tu1qdm,https://www.reddit.com/r/Brooklyn/comments/tu1qdm/would_it_be_a_musical/,would it be a musical?,/r/Brooklyn/comments/tu1qdm/would_it_be_a_musical/i35fgqi/,1,r/Brooklyn,0,1
I’m mid 30s and off Franklin. Love the neighborhood,t2_8ai2r,ROBOT-MAN,0,1648932825.0,0,t1_i35es4y,i35es4y,True,user1786257,t3_tukbve,https://www.reddit.com/r/Brooklyn/comments/tukbve/crown_heights_or_clinton_hill_for_a_thirty/,Crown heights or Clinton hill for a thirty something?,/r/Brooklyn/comments/tukbve/crown_heights_or_clinton_hill_for_a_thirty/i35es4y/,5,r/Brooklyn,0,5
Why don’t they have mommy and daddy put their PAs on it?,t2_h5eofbh7,TonyMoonArt,0,1648932350.0,0,t1_i35ds23,i35ds23,True,Beateam100,t3_tuje8x,https://www.reddit.com/r/Brooklyn/comments/tuje8x/newbie_question_where_can_you_find_meal/,Newbie Question: Where can you find meal prep/personal cook?,/r/Brooklyn/comments/tuje8x/newbie_question_where_can_you_find_meal/i35ds23/,3,r/Brooklyn,0,3
Menzingers and Oso Oso are playing there in May. That's some solid emo.,t2_8dfam,sinkwiththeship,0,1648932245.0,0,t1_i35djuz,i35djuz,False,mayarudolphofficial,t3_tuio2j,https://www.reddit.com/r/Brooklyn/comments/tuio2j/venues_to_see_punk_metal_emo_shows/,Venues to see punk / metal / emo shows?,/r/Brooklyn/comments/tuio2j/venues_to_see_punk_metal_emo_shows/i35djuz/,3,r/Brooklyn,0,3
It's like that tiny beach where Dumbo meets Vinegar Hill. I'd seen a picture of it a long time ago. Never saw it until last year. I don't think of beaches on that side of Brooklyn.,t2_3c535,xwhy,0,1648932201.0,0,t1_i35dgg7,i35dgg7,False,xwhy,t3_tu5arx,https://www.reddit.com/r/Brooklyn/comments/tu5arx/walking_brooklyn_janmar_2022_since_may_2019/,"Walking Brooklyn, Jan-Mar 2022 & since May 2019",/r/Brooklyn/comments/tu5arx/walking_brooklyn_janmar_2022_since_may_2019/i35dgg7/,2,r/Brooklyn,0,2
">It's a common belief in a lot of Jewish communities that a mezuzah will protect against run of the mill evil. 

I've never heard that before, we must be in very different Jewish communities.",t2_xvrsh,SheketBevakaSTFU,0,1648932145.0,0,t1_i35dc3q,i35dc3q,False,Jazzlike_Expert,t3_ttc15x,https://www.reddit.com/r/Brooklyn/comments/ttc15x/key_holder_outside_of_apartment_door/,Key Holder Outside of Apartment Door,/r/Brooklyn/comments/ttc15x/key_holder_outside_of_apartment_door/i35dc3q/,2,r/Brooklyn,0,2
"I'll be down by the Boardwalk in the summer. And I walk around my neighborhood a lot for errands.

Most times I only hit the same streets to get to a bus or train. Barclays is a frequent destination. And occasionally a brewery or two.",t2_3c535,xwhy,0,1648932045.0,0,t1_i35d4c5,i35d4c5,False,xwhy,t3_tu5arx,https://www.reddit.com/r/Brooklyn/comments/tu5arx/walking_brooklyn_janmar_2022_since_may_2019/,"Walking Brooklyn, Jan-Mar 2022 & since May 2019",/r/Brooklyn/comments/tu5arx/walking_brooklyn_janmar_2022_since_may_2019/i35d4c5/,1,r/Brooklyn,0,1
"Allegaeon are playing The Meadows in June - I haven't seen that listed yet.

Rivers of Nihil at The Market Hotel in May

Vitus, Warsaw, Kingsland, Lucky 13",t2_8uwpe,Benzpiece,0,1648931838.0,0,t1_i35coih,i35coih,True,mayarudolphofficial,t3_tuio2j,https://www.reddit.com/r/Brooklyn/comments/tuio2j/venues_to_see_punk_metal_emo_shows/,Venues to see punk / metal / emo shows?,/r/Brooklyn/comments/tuio2j/venues_to_see_punk_metal_emo_shows/i35coih/,4,r/Brooklyn,0,4
"i'm sorry but i've seen 100 shows at St Vitus, and the sound there rivals any small to medium size venue in NYC.  Compared to places like the Kingsland or Lucky 13 or Santos' Party house or Gussy's and Blackthorn51 (which aren't around anymore after COVID), Vitus is in a different stratosphere.",t2_8uwpe,Benzpiece,0,1648931686.0,0,t1_i35ccp4,i35ccp4,False,mayarudolphofficial,t3_tuio2j,https://www.reddit.com/r/Brooklyn/comments/tuio2j/venues_to_see_punk_metal_emo_shows/,Venues to see punk / metal / emo shows?,/r/Brooklyn/comments/tuio2j/venues_to_see_punk_metal_emo_shows/i35ccp4/,6,r/Brooklyn,0,6
This is cool to see! Any streets that particularly stood out or that you’ve purposely returned to?,t2_9k13lud9,ordinarygita,0,1648931537.0,0,t1_i35c16y,i35c16y,True,xwhy,t3_tu5arx,https://www.reddit.com/r/Brooklyn/comments/tu5arx/walking_brooklyn_janmar_2022_since_may_2019/,"Walking Brooklyn, Jan-Mar 2022 & since May 2019",/r/Brooklyn/comments/tu5arx/walking_brooklyn_janmar_2022_since_may_2019/i35c16y/,1,r/Brooklyn,0,1
Positive.  She is a papist.,t2_yxo1c,tanhauser_gates_,0,1648930186.0,0,t1_i35965b,i35965b,False,Jazzlike_Expert,t3_ttc15x,https://www.reddit.com/r/Brooklyn/comments/ttc15x/key_holder_outside_of_apartment_door/,Key Holder Outside of Apartment Door,/r/Brooklyn/comments/ttc15x/key_holder_outside_of_apartment_door/i35965b/,1,r/Brooklyn,0,1
Been in Clinton hill a long time and never had any problems (30s F). Pretty quiet at night and lots of strollers now tbh,t2_k53v04h,xoxofeebzz,0,1648928885.0,0,t1_i356g4g,i356g4g,True,user1786257,t3_tukbve,https://www.reddit.com/r/Brooklyn/comments/tukbve/crown_heights_or_clinton_hill_for_a_thirty/,Crown heights or Clinton hill for a thirty something?,/r/Brooklyn/comments/tukbve/crown_heights_or_clinton_hill_for_a_thirty/i356g4g/,8,r/Brooklyn,0,8
"Years, a lot of years. Pushing a decade soon. Many people think it’s a money laundering scheme, hopefully it comes down soon.",t2_k48uu2ch,LargeAd8706,0,1648928132.0,0,t1_i354vhq,i354vhq,False,LargeAd8706,t3_tublrj,https://www.reddit.com/r/Brooklyn/comments/tublrj/brooklyn_technical_high_school/,Brooklyn Technical High School,/r/Brooklyn/comments/tublrj/brooklyn_technical_high_school/i354vhq/,5,r/Brooklyn,0,5
"Yeah, there’s some thing special about eating a big heavy plate of pierogis before seeing The Sword.",t2_9458y,Yakety_Sax,0,1648927821.0,0,t1_i3548rk,i3548rk,False,mayarudolphofficial,t3_tuio2j,https://www.reddit.com/r/Brooklyn/comments/tuio2j/venues_to_see_punk_metal_emo_shows/,Venues to see punk / metal / emo shows?,/r/Brooklyn/comments/tuio2j/venues_to_see_punk_metal_emo_shows/i3548rk/,7,r/Brooklyn,0,7
@chaoscalendarnyc on Instagram,t2_i5jnmzev,makesupwordsblomp,0,1648927783.0,0,t1_i35466j,i35466j,True,mayarudolphofficial,t3_tuio2j,https://www.reddit.com/r/Brooklyn/comments/tuio2j/venues_to_see_punk_metal_emo_shows/,Venues to see punk / metal / emo shows?,/r/Brooklyn/comments/tuio2j/venues_to_see_punk_metal_emo_shows/i35466j/,1,r/Brooklyn,0,1
Warsaw is a truly amazing venue if you can catch a show there.,t2_kw3fo,XeiB8Afe,0,1648927711.0,0,t1_i354127,i354127,False,mayarudolphofficial,t3_tuio2j,https://www.reddit.com/r/Brooklyn/comments/tuio2j/venues_to_see_punk_metal_emo_shows/,Venues to see punk / metal / emo shows?,/r/Brooklyn/comments/tuio2j/venues_to_see_punk_metal_emo_shows/i354127/,12,r/Brooklyn,0,12
"I don’t disagree with your comment, but I want to add: Before the pandemic, I remember the sound at St Vitus was AWFUL. It’s a terrible representation of live metal shows. (No disrespect to the sound guy who looked like John Snow, though. I don’t know the inside story.)

A lot of bands go through there, though, so we have little choice. I haven’t been back since 2019, though, so it’s possible it’s improved.",t2_kw3fo,XeiB8Afe,1,1648927673.0,0,t1_i353yfa,i353yfa,False,mayarudolphofficial,t3_tuio2j,https://www.reddit.com/r/Brooklyn/comments/tuio2j/venues_to_see_punk_metal_emo_shows/,Venues to see punk / metal / emo shows?,/r/Brooklyn/comments/tuio2j/venues_to_see_punk_metal_emo_shows/i353yfa/,2,r/Brooklyn,0,2
"my boyfriend (30m) is moving here from LA next month, he plays bass and I think he’d be interested! gonna send him this post now.",t2_15fn5va,havarticheese1,0,1648927546.0,0,t1_i353pqg,i353pqg,True,MoodyHumans,t3_tuk67v,https://www.reddit.com/r/Brooklyn/comments/tuk67v/i_play_guitarbassdrumsproduce_all_intermediate/,I play guitar/bass/drums/produce (all intermediate) and would love to jam with some humans!,/r/Brooklyn/comments/tuk67v/i_play_guitarbassdrumsproduce_all_intermediate/i353pqg/,2,r/Brooklyn,0,2
"Elsewhere is a great venue, they have metal shows sometimes.",t2_7tmpuq2p,Professional_Scale66,0,1648927506.0,0,t1_i353mvy,i353mvy,True,mayarudolphofficial,t3_tuio2j,https://www.reddit.com/r/Brooklyn/comments/tuio2j/venues_to_see_punk_metal_emo_shows/,Venues to see punk / metal / emo shows?,/r/Brooklyn/comments/tuio2j/venues_to_see_punk_metal_emo_shows/i353mvy/,1,r/Brooklyn,0,1
"Yep, been having shows again for a bit too.",t2_1mcaibrf,edgykitten,0,1648927448.0,0,t1_i353ivq,i353ivq,False,mayarudolphofficial,t3_tuio2j,https://www.reddit.com/r/Brooklyn/comments/tuio2j/venues_to_see_punk_metal_emo_shows/,Venues to see punk / metal / emo shows?,/r/Brooklyn/comments/tuio2j/venues_to_see_punk_metal_emo_shows/i353ivq/,2,r/Brooklyn,0,2
Not new to ny. Moving back since Covid and new to Brooklyn,t2_5a7nfar2,user1786257,0,1648926561.0,0,t1_i351se8,i351se8,False,user1786257,t3_tukbve,https://www.reddit.com/r/Brooklyn/comments/tukbve/crown_heights_or_clinton_hill_for_a_thirty/,Crown heights or Clinton hill for a thirty something?,/r/Brooklyn/comments/tukbve/crown_heights_or_clinton_hill_for_a_thirty/i351se8/,3,r/Brooklyn,0,3
Thank you for all the input. I’m going to ask for a itemized receipt and speak with a lawyer. Any recommendations for tenant lawyers or legal clinics that would be able to give me insight without running up legal expenses too?,t2_9wa9zz2y,Lopsided_Ad5913,0,1648926544.0,0,t1_i351r9w,i351r9w,True,[deleted],t3_tu1glk,https://www.reddit.com/r/Brooklyn/comments/tu1glk/charged_6000_for_apt_door_replacement/,"Charged $6,000 for apt door replacement",/r/Brooklyn/comments/tu1glk/charged_6000_for_apt_door_replacement/i351r9w/,1,r/Brooklyn,0,1
"If you're new to  living in NYC, I'd say crown heights. Unless you're especially far west or south, Clinton hill is somewhat isolating as it's only by the G, which doesn't go into Manhattan. This makes it somewhat harder to explore the city as a whole.",t2_4aeyx,aunipine,0,1648926402.0,0,t1_i351hap,i351hap,True,user1786257,t3_tukbve,https://www.reddit.com/r/Brooklyn/comments/tukbve/crown_heights_or_clinton_hill_for_a_thirty/,Crown heights or Clinton hill for a thirty something?,/r/Brooklyn/comments/tukbve/crown_heights_or_clinton_hill_for_a_thirty/i351hap/,15,r/Brooklyn,0,15
Followed! Thank you!!,t2_2tckf1q5,mayarudolphofficial,0,1648925605.0,0,t1_i34zwhw,i34zwhw,False,mayarudolphofficial,t3_tuio2j,https://www.reddit.com/r/Brooklyn/comments/tuio2j/venues_to_see_punk_metal_emo_shows/,Venues to see punk / metal / emo shows?,/r/Brooklyn/comments/tuio2j/venues_to_see_punk_metal_emo_shows/i34zwhw/,2,r/Brooklyn,0,2
Market Hotel,t2_nvhzp,unlimitedshredsticks,0,1648923571.0,0,t1_i34vnn0,i34vnn0,True,mayarudolphofficial,t3_tuio2j,https://www.reddit.com/r/Brooklyn/comments/tuio2j/venues_to_see_punk_metal_emo_shows/,Venues to see punk / metal / emo shows?,/r/Brooklyn/comments/tuio2j/venues_to_see_punk_metal_emo_shows/i34vnn0/,2,r/Brooklyn,0,2
>It's an indication that the household is Jewish. Are you sure she wasn't secretly Jewish?,t2_lgdi2wz4,Arbadella,0,1648923456.0,0,t1_i34veqf,i34veqf,False,Jazzlike_Expert,t3_ttc15x,https://www.reddit.com/r/Brooklyn/comments/ttc15x/key_holder_outside_of_apartment_door/,Key Holder Outside of Apartment Door,/r/Brooklyn/comments/ttc15x/key_holder_outside_of_apartment_door/i34veqf/,1,r/Brooklyn,0,1
"Aggressive police work that doesn't lock up people for a joint in their pocket- that's what got all this started. The cops (under Mayor Mike Bloomberg (D) and his PD), would stop under the pretense of looking for weapons and bust people for joints.",t2_axjgeg4h,TangoRad,0,1648923379.0,0,t1_i34v8s2,i34v8s2,False,CurrentJealous8132,t3_ttsdf3,https://www.reddit.com/r/Brooklyn/comments/ttsdf3/12_year_old_murdered/,12 Year old murdered,/r/Brooklyn/comments/ttsdf3/12_year_old_murdered/i34v8s2/,2,r/Brooklyn,0,2
Mid thirties and living off the Franklin stop and I really love it.,t2_85uzx,diegothecat,0,1648922300.0,0,t1_i34susp,i34susp,True,user1786257,t3_tukbve,https://www.reddit.com/r/Brooklyn/comments/tukbve/crown_heights_or_clinton_hill_for_a_thirty/,Crown heights or Clinton hill for a thirty something?,/r/Brooklyn/comments/tukbve/crown_heights_or_clinton_hill_for_a_thirty/i34susp/,16,r/Brooklyn,0,16
