body,author_fullname,author.name,controversiality,created,downs,fullname,id,is_root,link_author,link_id,link_permalink,link_title,permalink,score,subreddit_name_prefixed,total_awards_received,ups
New York Jew here. Nothing wrong with the sandwich you mention.,t2_1bks2yh0,mintyfreshknee,0,1648793706.0,0,t1_i2y9x3h,i2y9x3h,False,Jazzlike_Expert,t3_ttc15x,https://www.reddit.com/r/Brooklyn/comments/ttc15x/key_holder_outside_of_apartment_door/,Key Holder Outside of Apartment Door,/r/Brooklyn/comments/ttc15x/key_holder_outside_of_apartment_door/i2y9x3h/,8,r/Brooklyn,0,8
Oy.,t2_58x94,Vortesian,0,1648793584.0,0,t1_i2y9r3y,i2y9r3y,True,Jazzlike_Expert,t3_ttc15x,https://www.reddit.com/r/Brooklyn/comments/ttc15x/key_holder_outside_of_apartment_door/,Key Holder Outside of Apartment Door,/r/Brooklyn/comments/ttc15x/key_holder_outside_of_apartment_door/i2y9r3y/,11,r/Brooklyn,0,11
Lmfao. Key holder. I am dead. Seven years!!!,t2_1bks2yh0,mintyfreshknee,0,1648793567.0,0,t1_i2y9q7w,i2y9q7w,True,Jazzlike_Expert,t3_ttc15x,https://www.reddit.com/r/Brooklyn/comments/ttc15x/key_holder_outside_of_apartment_door/,Key Holder Outside of Apartment Door,/r/Brooklyn/comments/ttc15x/key_holder_outside_of_apartment_door/i2y9q7w/,13,r/Brooklyn,0,13
"Seriously! Any New Yorker just a little Jewish. Except maybe op, lol.",t2_58x94,Vortesian,0,1648793524.0,0,t1_i2y9o1z,i2y9o1z,False,Jazzlike_Expert,t3_ttc15x,https://www.reddit.com/r/Brooklyn/comments/ttc15x/key_holder_outside_of_apartment_door/,Key Holder Outside of Apartment Door,/r/Brooklyn/comments/ttc15x/key_holder_outside_of_apartment_door/i2y9o1z/,11,r/Brooklyn,0,11
this is the reply i was looking for :'),t2_5ir482f,dr_dang_phd,0,1648791641.0,0,t1_i2y6z4n,i2y6z4n,False,Jazzlike_Expert,t3_ttc15x,https://www.reddit.com/r/Brooklyn/comments/ttc15x/key_holder_outside_of_apartment_door/,Key Holder Outside of Apartment Door,/r/Brooklyn/comments/ttc15x/key_holder_outside_of_apartment_door/i2y6z4n/,3,r/Brooklyn,0,3
I’m obsessed with this post,t2_4snlh6b1,SignalExtension8399,0,1648789929.0,0,t1_i2y4dxw,i2y4dxw,True,Jazzlike_Expert,t3_ttc15x,https://www.reddit.com/r/Brooklyn/comments/ttc15x/key_holder_outside_of_apartment_door/,Key Holder Outside of Apartment Door,/r/Brooklyn/comments/ttc15x/key_holder_outside_of_apartment_door/i2y4dxw/,0,r/Brooklyn,0,0
I remember my apartment’s door viewer was so caked in paint that the flap thing could never be opened. Suuuper annoying!,t2_e6mjr,haileyrose,0,1648789900.0,0,t1_i2y4cbd,i2y4cbd,False,Jazzlike_Expert,t3_ttc15x,https://www.reddit.com/r/Brooklyn/comments/ttc15x/key_holder_outside_of_apartment_door/,Key Holder Outside of Apartment Door,/r/Brooklyn/comments/ttc15x/key_holder_outside_of_apartment_door/i2y4cbd/,6,r/Brooklyn,0,6
"KEST

GAK",t2_xv8s1,varsitymisc,0,1648788811.0,0,t1_i2y2lqk,i2y2lqk,True,Biggary4130,t3_tqnvai,https://www.reddit.com/r/Brooklyn/comments/tqnvai/can_someone_tell_me_who_this_guy_is_and_why_his/,Can someone tell me who this guy is and why his head is all over Brooklyn/Williamsburg?,/r/Brooklyn/comments/tqnvai/can_someone_tell_me_who_this_guy_is_and_why_his/i2y2lqk/,1,r/Brooklyn,0,1
Uber has that option,t2_6bzumcgs,Troy_Ounces,0,1648788754.0,0,t1_i2y2ifa,i2y2ifa,True,psychicsoviet,t3_tt1j8x,https://www.reddit.com/r/Brooklyn/comments/tt1j8x/car_service_with_baby_seat_bedstuy_to_jfk/,Car service with baby seat - Bed-Stuy to JFK,/r/Brooklyn/comments/tt1j8x/car_service_with_baby_seat_bedstuy_to_jfk/i2y2ifa/,0,r/Brooklyn,0,0
Don't forget they corrected the spelling of the bridge back in 2018. It's now Verraz**z**ano Bridge (Two R's and two Z's).,t2_84slh,JRinNYC,0,1648788603.0,0,t1_i2y29gv,i2y29gv,True,Other_World,t3_ttbdnk,https://www.reddit.com/r/Brooklyn/comments/ttbdnk/verrazano_bridge_and_the_belt_parkway_at_sunset/,"Verrazano Bridge, and the Belt Parkway at Sunset. 15 second exposure [4189x2798] [OC]",/r/Brooklyn/comments/ttbdnk/verrazano_bridge_and_the_belt_parkway_at_sunset/i2y29gv/,1,r/Brooklyn,0,1
Holdomor was debunked. Read Kotkin.,t2_6bp9o,dreadyruxpin,0,1648788304.0,0,t1_i2y1rl1,i2y1rl1,False,Patterson9191717,t3_tszip9,https://www.reddit.com/r/Brooklyn/comments/tszip9/brooklyn_starbucks_workers_and_socialists_join/,Brooklyn Starbucks Workers and Socialists Join Forces to Fight Union-Busting,/r/Brooklyn/comments/tszip9/brooklyn_starbucks_workers_and_socialists_join/i2y1rl1/,2,r/Brooklyn,0,2
Agree,t2_fhps4od4,Ok-Attempt-2021,0,1648787547.0,0,t1_i2y0hom,i2y0hom,False,Jazzlike_Expert,t3_ttc15x,https://www.reddit.com/r/Brooklyn/comments/ttc15x/key_holder_outside_of_apartment_door/,Key Holder Outside of Apartment Door,/r/Brooklyn/comments/ttc15x/key_holder_outside_of_apartment_door/i2y0hom/,2,r/Brooklyn,0,2
Took one look and said thats no keyholder that’s a mezuzah,t2_8bl97,thexsoprano,0,1648787062.0,0,t1_i2xznut,i2xznut,False,Jazzlike_Expert,t3_ttc15x,https://www.reddit.com/r/Brooklyn/comments/ttc15x/key_holder_outside_of_apartment_door/,Key Holder Outside of Apartment Door,/r/Brooklyn/comments/ttc15x/key_holder_outside_of_apartment_door/i2xznut/,9,r/Brooklyn,0,9
Not what you posted BUT I have a disabled friend who wants to move to your neighborhood - are there steps to get into the apt? If not- is there a listing I could show him? It’s super hard to find pre war without steps and the new builds are too small for his chair. Thanks OP,t2_4o66b212,happytrees89,0,1648787026.0,0,t1_i2xzln7,i2xzln7,True,Jazzlike_Expert,t3_ttc15x,https://www.reddit.com/r/Brooklyn/comments/ttc15x/key_holder_outside_of_apartment_door/,Key Holder Outside of Apartment Door,/r/Brooklyn/comments/ttc15x/key_holder_outside_of_apartment_door/i2xzln7/,2,r/Brooklyn,0,2
i was told that ashkenazi ppl do it at an angle and sephardic ppl do it straight. or vice versa i don’t remember,t2_10pgms,apersiandawn,0,1648786982.0,0,t1_i2xzizh,i2xzizh,False,Jazzlike_Expert,t3_ttc15x,https://www.reddit.com/r/Brooklyn/comments/ttc15x/key_holder_outside_of_apartment_door/,Key Holder Outside of Apartment Door,/r/Brooklyn/comments/ttc15x/key_holder_outside_of_apartment_door/i2xzizh/,3,r/Brooklyn,0,3
Figured that was the case!,t2_genpf,jammyjamjammy,0,1648786703.0,0,t1_i2xz1gg,i2xz1gg,False,Jazzlike_Expert,t3_ttc15x,https://www.reddit.com/r/Brooklyn/comments/ttc15x/key_holder_outside_of_apartment_door/,Key Holder Outside of Apartment Door,/r/Brooklyn/comments/ttc15x/key_holder_outside_of_apartment_door/i2xz1gg/,1,r/Brooklyn,0,1
"Shit. I knew that, that's a typo, not a mistake.  Corrected, thanks.  
  
(Unedited was 'verkempt')",t2_10vuu0,Jasong222,0,1648786040.0,0,t1_i2xxvo5,i2xxvo5,False,Jazzlike_Expert,t3_ttc15x,https://www.reddit.com/r/Brooklyn/comments/ttc15x/key_holder_outside_of_apartment_door/,Key Holder Outside of Apartment Door,/r/Brooklyn/comments/ttc15x/key_holder_outside_of_apartment_door/i2xxvo5/,3,r/Brooklyn,0,3
"First time I noticed these, my Colombian coworker would rub it and hope for a good tip. He said he was Joosh. We worked in an apartment building in Manhattan. Good times.",t2_9utb2,JamesBongd,0,1648785970.0,0,t1_i2xxrae,i2xxrae,True,Jazzlike_Expert,t3_ttc15x,https://www.reddit.com/r/Brooklyn/comments/ttc15x/key_holder_outside_of_apartment_door/,Key Holder Outside of Apartment Door,/r/Brooklyn/comments/ttc15x/key_holder_outside_of_apartment_door/i2xxrae/,2,r/Brooklyn,0,2
Wait till you find out about the string around manhattan!,t2_9ncfq,BrooklynKnight,0,1648785924.0,0,t1_i2xxobe,i2xxobe,True,Jazzlike_Expert,t3_ttc15x,https://www.reddit.com/r/Brooklyn/comments/ttc15x/key_holder_outside_of_apartment_door/,Key Holder Outside of Apartment Door,/r/Brooklyn/comments/ttc15x/key_holder_outside_of_apartment_door/i2xxobe/,29,r/Brooklyn,0,29
*Verklempt since this thread is clearly going to be educational.,t2_genpf,jammyjamjammy,0,1648785655.0,0,t1_i2xx6sw,i2xx6sw,False,Jazzlike_Expert,t3_ttc15x,https://www.reddit.com/r/Brooklyn/comments/ttc15x/key_holder_outside_of_apartment_door/,Key Holder Outside of Apartment Door,/r/Brooklyn/comments/ttc15x/key_holder_outside_of_apartment_door/i2xx6sw/,6,r/Brooklyn,0,6
"Not a Jew, but my old apartment in the Bronx had one, albeit painted over.",t2_47gy10ti,BxGyrl416,0,1648785139.0,0,t1_i2xw97b,i2xw97b,True,Jazzlike_Expert,t3_ttc15x,https://www.reddit.com/r/Brooklyn/comments/ttc15x/key_holder_outside_of_apartment_door/,Key Holder Outside of Apartment Door,/r/Brooklyn/comments/ttc15x/key_holder_outside_of_apartment_door/i2xw97b/,2,r/Brooklyn,0,2
Psychologist / psychiatrist,t2_gs804y9h,Physical_Tomato_702,0,1648783749.0,0,t1_i2xtmhp,i2xtmhp,False,Puzzled-Tennis-3295,t3_tspcmn,https://www.reddit.com/r/Brooklyn/comments/tspcmn/what_do_you_regularly_spend_your_fun_budget_on_in/,"What do you regularly spend your 'fun' budget on in NYC? I'm thinkin stuff like gym, classes, wellness/self-care, etc. What do you find is really worth spending on?",/r/Brooklyn/comments/tspcmn/what_do_you_regularly_spend_your_fun_budget_on_in/i2xtmhp/,1,r/Brooklyn,0,1
"Yep. Where I live is gods waiting room, I see these   Everywhere! Especially in cemetery Village!!!!",t2_12z7e0,twoshovels,0,1648783685.0,0,t1_i2xti5m,i2xti5m,True,Jazzlike_Expert,t3_ttc15x,https://www.reddit.com/r/Brooklyn/comments/ttc15x/key_holder_outside_of_apartment_door/,Key Holder Outside of Apartment Door,/r/Brooklyn/comments/ttc15x/key_holder_outside_of_apartment_door/i2xti5m/,0,r/Brooklyn,0,0
You’re not Jewish,t2_irg0p,Ickmykwu,0,1648783254.0,0,t1_i2xsod0,i2xsod0,True,Jazzlike_Expert,t3_ttc15x,https://www.reddit.com/r/Brooklyn/comments/ttc15x/key_holder_outside_of_apartment_door/,Key Holder Outside of Apartment Door,/r/Brooklyn/comments/ttc15x/key_holder_outside_of_apartment_door/i2xsod0/,2,r/Brooklyn,0,2
"As a folklorist, this post is amazing.",t2_178458,elbowskneesand,0,1648783157.0,0,t1_i2xshgl,i2xshgl,False,Jazzlike_Expert,t3_ttc15x,https://www.reddit.com/r/Brooklyn/comments/ttc15x/key_holder_outside_of_apartment_door/,Key Holder Outside of Apartment Door,/r/Brooklyn/comments/ttc15x/key_holder_outside_of_apartment_door/i2xshgl/,2,r/Brooklyn,0,2
"Exactly, I’ve lived in NYC since 2006 and don’t recall seeing this anywhere",t2_6iouh,BuddyOGooGoo,1,1648782539.0,0,t1_i2xr9em,i2xr9em,False,Jazzlike_Expert,t3_ttc15x,https://www.reddit.com/r/Brooklyn/comments/ttc15x/key_holder_outside_of_apartment_door/,Key Holder Outside of Apartment Door,/r/Brooklyn/comments/ttc15x/key_holder_outside_of_apartment_door/i2xr9em/,2,r/Brooklyn,0,2
That's probably very accurate,t2_8v1jr,MattJFarrell,0,1648782460.0,0,t1_i2xr3pd,i2xr3pd,False,Jazzlike_Expert,t3_ttc15x,https://www.reddit.com/r/Brooklyn/comments/ttc15x/key_holder_outside_of_apartment_door/,Key Holder Outside of Apartment Door,/r/Brooklyn/comments/ttc15x/key_holder_outside_of_apartment_door/i2xr3pd/,6,r/Brooklyn,0,6
try listings project newsletter even if you don’t find anything u can get an idea of what’s out there,t2_2nluknlh,irlydontfreakingknow,0,1648782384.0,0,t1_i2xqy5h,i2xqy5h,True,parasocial_gf,t3_ttbe18,https://www.reddit.com/r/Brooklyn/comments/ttbe18/25f_seeking_room_for_rentsublease_in_bk/,25F seeking room for rent/sublease in BK,/r/Brooklyn/comments/ttbe18/25f_seeking_room_for_rentsublease_in_bk/i2xqy5h/,1,r/Brooklyn,0,1
i’m dead 😭,t2_2nluknlh,irlydontfreakingknow,0,1648782281.0,0,t1_i2xqqpk,i2xqqpk,True,Jazzlike_Expert,t3_ttc15x,https://www.reddit.com/r/Brooklyn/comments/ttc15x/key_holder_outside_of_apartment_door/,Key Holder Outside of Apartment Door,/r/Brooklyn/comments/ttc15x/key_holder_outside_of_apartment_door/i2xqqpk/,2,r/Brooklyn,0,2
"LOL- same!  I was like “don’t even need to see the pics, I know this ‘key holder’ is a mezuzah”",t2_15lgk1,fairnymama,0,1648781814.0,0,t1_i2xpruh,i2xpruh,False,Jazzlike_Expert,t3_ttc15x,https://www.reddit.com/r/Brooklyn/comments/ttc15x/key_holder_outside_of_apartment_door/,Key Holder Outside of Apartment Door,/r/Brooklyn/comments/ttc15x/key_holder_outside_of_apartment_door/i2xpruh/,6,r/Brooklyn,0,6
There are a few places in Williamsburg that sell legit ones.,t2_3ryyu,electric_sandwich,0,1648781534.0,0,t1_i2xp6oi,i2xp6oi,False,Jazzlike_Expert,t3_ttc15x,https://www.reddit.com/r/Brooklyn/comments/ttc15x/key_holder_outside_of_apartment_door/,Key Holder Outside of Apartment Door,/r/Brooklyn/comments/ttc15x/key_holder_outside_of_apartment_door/i2xp6oi/,9,r/Brooklyn,0,9
"I remember seeing these throughout Maimonides Hospital when I was there during COVID-19, and people would touch them, and then touch/kiss their mouths. I was kinda shocked at that.",t2_12rs05,Gato1980,0,1648781279.0,0,t1_i2xomty,i2xomty,True,Jazzlike_Expert,t3_ttc15x,https://www.reddit.com/r/Brooklyn/comments/ttc15x/key_holder_outside_of_apartment_door/,Key Holder Outside of Apartment Door,/r/Brooklyn/comments/ttc15x/key_holder_outside_of_apartment_door/i2xomty/,5,r/Brooklyn,0,5
"You also would amaze at what you don’t know. 

That’s the point.",t2_3tsad,bottom,0,1648780686.0,0,t1_i2xndnp,i2xndnp,False,Jazzlike_Expert,t3_ttc15x,https://www.reddit.com/r/Brooklyn/comments/ttc15x/key_holder_outside_of_apartment_door/,Key Holder Outside of Apartment Door,/r/Brooklyn/comments/ttc15x/key_holder_outside_of_apartment_door/i2xndnp/,17,r/Brooklyn,0,17
"Holy fucking shit. 

[https://www.socialistalternative.org/category/history/centenary-of-russian-revolution/](https://www.socialistalternative.org/category/history/centenary-of-russian-revolution/)

I wonder how many of these valiant champions of the working class have trust funds vs how many don't denounce political violence?

[https://www.socialistalternative.org/2020/03/20/the-revolutionary-legacy-of-science-for-the-people/](https://www.socialistalternative.org/2020/03/20/the-revolutionary-legacy-of-science-for-the-people/) 

LOL. Lysenokism. 

[https://www.socialistalternative.org/2017/04/09/socialist-food-industry-like/](https://www.socialistalternative.org/2017/04/09/socialist-food-industry-like/) 

>What Would a Socialist Food Industry Look Like?

It would look like every single marxist planned economy food industry looked like. The Holodomor, The Khmer Rouge, the four pests campaign, and famine in dozens of African countries who made the fatal mistake of attempting a marxist economy.",t2_3ryyu,electric_sandwich,1,1648780560.0,0,t1_i2xn3qx,i2xn3qx,True,Patterson9191717,t3_tszip9,https://www.reddit.com/r/Brooklyn/comments/tszip9/brooklyn_starbucks_workers_and_socialists_join/,Brooklyn Starbucks Workers and Socialists Join Forces to Fight Union-Busting,/r/Brooklyn/comments/tszip9/brooklyn_starbucks_workers_and_socialists_join/i2xn3qx/,-1,r/Brooklyn,0,-1
"Thank you for the smile, OP.",t2_8mdzj,shinytwistybouncy,0,1648779650.0,0,t1_i2xl573,i2xl573,True,Jazzlike_Expert,t3_ttc15x,https://www.reddit.com/r/Brooklyn/comments/ttc15x/key_holder_outside_of_apartment_door/,Key Holder Outside of Apartment Door,/r/Brooklyn/comments/ttc15x/key_holder_outside_of_apartment_door/i2xl573/,2,r/Brooklyn,0,2
"Yep, the kosher ones are entirely hand written! My husband actually started taking a course post-HS on how to do it, but quit in the middle.",t2_8mdzj,shinytwistybouncy,0,1648779577.0,0,t1_i2xkzca,i2xkzca,False,Jazzlike_Expert,t3_ttc15x,https://www.reddit.com/r/Brooklyn/comments/ttc15x/key_holder_outside_of_apartment_door/,Key Holder Outside of Apartment Door,/r/Brooklyn/comments/ttc15x/key_holder_outside_of_apartment_door/i2xkzca/,11,r/Brooklyn,0,11
"I've heard two different people refer to ""Mazel Tov Cocktails"" and laughed for about a week each time.",t2_3y98m,squindar,0,1648779516.0,0,t1_i2xkuf6,i2xkuf6,False,Jazzlike_Expert,t3_ttc15x,https://www.reddit.com/r/Brooklyn/comments/ttc15x/key_holder_outside_of_apartment_door/,Key Holder Outside of Apartment Door,/r/Brooklyn/comments/ttc15x/key_holder_outside_of_apartment_door/i2xkuf6/,47,r/Brooklyn,0,47
"Lived here my whole life, never heard of it until this post.",t2_5bi0tziv,pfrank6048,0,1648779475.0,0,t1_i2xkr2x,i2xkr2x,False,Jazzlike_Expert,t3_ttc15x,https://www.reddit.com/r/Brooklyn/comments/ttc15x/key_holder_outside_of_apartment_door/,Key Holder Outside of Apartment Door,/r/Brooklyn/comments/ttc15x/key_holder_outside_of_apartment_door/i2xkr2x/,8,r/Brooklyn,0,8
"Tell me you don't know any Jewish people without telling me you don't know any Jewish people. 

Welp, at least you're learning more about various cultures. Yay Reddit",t2_3shauvi9,ouroborosstruggles,0,1648778882.0,0,t1_i2xjgrs,i2xjgrs,True,Jazzlike_Expert,t3_ttc15x,https://www.reddit.com/r/Brooklyn/comments/ttc15x/key_holder_outside_of_apartment_door/,Key Holder Outside of Apartment Door,/r/Brooklyn/comments/ttc15x/key_holder_outside_of_apartment_door/i2xjgrs/,25,r/Brooklyn,0,25
"Yeah, in a lot of places people realize it's a spiritual protector of the home, and will leave it even long after the Jewish tenants moved on",t2_bm9q05jr,woulditquailu2stop,0,1648778633.0,0,t1_i2xix6u,i2xix6u,False,Jazzlike_Expert,t3_ttc15x,https://www.reddit.com/r/Brooklyn/comments/ttc15x/key_holder_outside_of_apartment_door/,Key Holder Outside of Apartment Door,/r/Brooklyn/comments/ttc15x/key_holder_outside_of_apartment_door/i2xix6u/,60,r/Brooklyn,0,60
“Rugalah. It’s a veg-e-ta-ble.”,t2_3jm94,HonorableJudgeIto,0,1648778553.0,0,t1_i2xiqwp,i2xiqwp,False,Jazzlike_Expert,t3_ttc15x,https://www.reddit.com/r/Brooklyn/comments/ttc15x/key_holder_outside_of_apartment_door/,Key Holder Outside of Apartment Door,/r/Brooklyn/comments/ttc15x/key_holder_outside_of_apartment_door/i2xiqwp/,11,r/Brooklyn,0,11
There's a whole Curb Your Enthusiasm episode about how Larry's father is coming over and he has to scramble to put the Mezuzah by the door or he'll get an earful.,t2_z56b5,tickingboxes,0,1648778308.0,0,t1_i2xi7hn,i2xi7hn,False,Jazzlike_Expert,t3_ttc15x,https://www.reddit.com/r/Brooklyn/comments/ttc15x/key_holder_outside_of_apartment_door/,Key Holder Outside of Apartment Door,/r/Brooklyn/comments/ttc15x/key_holder_outside_of_apartment_door/i2xi7hn/,21,r/Brooklyn,0,21
"There are no stupid questions but I’m just absolutely tickled by this post! I’m a non-Jew, but I guess being a New Yorker means this was always a thing I knew about…I’m so happy you asked this and got your answer. Mazel tov!",t2_6fx92,randomnessish,0,1648778232.0,0,t1_i2xi1fy,i2xi1fy,True,Jazzlike_Expert,t3_ttc15x,https://www.reddit.com/r/Brooklyn/comments/ttc15x/key_holder_outside_of_apartment_door/,Key Holder Outside of Apartment Door,/r/Brooklyn/comments/ttc15x/key_holder_outside_of_apartment_door/i2xi1fy/,10,r/Brooklyn,0,10
"Or Goyland, Ohio... the people who order cinnamon raisin bagels--toasted--with cream cheese.",t2_148kbc,danenyc,1,1648778125.0,0,t1_i2xhste,i2xhste,True,Jazzlike_Expert,t3_ttc15x,https://www.reddit.com/r/Brooklyn/comments/ttc15x/key_holder_outside_of_apartment_door/,Key Holder Outside of Apartment Door,/r/Brooklyn/comments/ttc15x/key_holder_outside_of_apartment_door/i2xhste/,-3,r/Brooklyn,0,-3
Try babyquip.com - you rent from real people!,t2_hkeyj,tdbts,0,1648777985.0,0,t1_i2xhhrk,i2xhhrk,True,coffeequips,t3_ttd7w8,https://www.reddit.com/r/Brooklyn/comments/ttd7w8/borrowing_a_small_pack_play/,Borrowing a small pack & play?,/r/Brooklyn/comments/ttd7w8/borrowing_a_small_pack_play/i2xhhrk/,3,r/Brooklyn,0,3
"Okay, awesome. Yeah I have a HEPA filter in my home but the one I like that filters out the smallest particles was over $200. Kind of a big expense for a two month rental",t2_3mx5tieg,sorrycis,0,1648777603.0,0,t1_i2xgod9,i2xgod9,False,sorrycis,t3_tt0ivn,https://www.reddit.com/r/Brooklyn/comments/tt0ivn/noise_level_close_to_bqe278/,Noise Level Close To BQE/278,/r/Brooklyn/comments/tt0ivn/noise_level_close_to_bqe278/i2xgod9/,1,r/Brooklyn,0,1
boyyyyyyyyy,t2_tfc7s1d,TheLifeOfBaedro,0,1648777425.0,0,t1_i2xge4i,i2xge4i,True,Jazzlike_Expert,t3_ttc15x,https://www.reddit.com/r/Brooklyn/comments/ttc15x/key_holder_outside_of_apartment_door/,Key Holder Outside of Apartment Door,/r/Brooklyn/comments/ttc15x/key_holder_outside_of_apartment_door/i2xge4i/,2,r/Brooklyn,0,2
The chutzpah!,t2_10vuu0,Jasong222,0,1648777282.0,0,t1_i2xg2m8,i2xg2m8,False,Jazzlike_Expert,t3_ttc15x,https://www.reddit.com/r/Brooklyn/comments/ttc15x/key_holder_outside_of_apartment_door/,Key Holder Outside of Apartment Door,/r/Brooklyn/comments/ttc15x/key_holder_outside_of_apartment_door/i2xg2m8/,6,r/Brooklyn,0,6
"Ugh, I'm verklempt",t2_10vuu0,Jasong222,0,1648777242.0,0,t1_i2xfzbd,i2xfzbd,False,Jazzlike_Expert,t3_ttc15x,https://www.reddit.com/r/Brooklyn/comments/ttc15x/key_holder_outside_of_apartment_door/,Key Holder Outside of Apartment Door,/r/Brooklyn/comments/ttc15x/key_holder_outside_of_apartment_door/i2xfzbd/,15,r/Brooklyn,0,15
"As a New Yorker, I’m stupefied.",t2_15ymn7,boerumhill,0,1648776982.0,0,t1_i2xfebz,i2xfebz,False,Jazzlike_Expert,t3_ttc15x,https://www.reddit.com/r/Brooklyn/comments/ttc15x/key_holder_outside_of_apartment_door/,Key Holder Outside of Apartment Door,/r/Brooklyn/comments/ttc15x/key_holder_outside_of_apartment_door/i2xfebz/,12,r/Brooklyn,0,12
"I was imagining something like a portable HEPA filter that cleans the air in your apartment. I don’t know if consumer HEPA filters will filter car exhaust so if you’re concerned, maybe do some research.",t2_nag3j,VeryCozy,0,1648776913.0,0,t1_i2xf8np,i2xf8np,False,sorrycis,t3_tt0ivn,https://www.reddit.com/r/Brooklyn/comments/tt0ivn/noise_level_close_to_bqe278/,Noise Level Close To BQE/278,/r/Brooklyn/comments/tt0ivn/noise_level_close_to_bqe278/i2xf8np/,1,r/Brooklyn,0,1
funny enough I had heard the word but I don't think I had ever seen one until I moved to brooklyn.,t2_k00k3kkk,burner1212333,0,1648776839.0,0,t1_i2xf2gp,i2xf2gp,False,Jazzlike_Expert,t3_ttc15x,https://www.reddit.com/r/Brooklyn/comments/ttc15x/key_holder_outside_of_apartment_door/,Key Holder Outside of Apartment Door,/r/Brooklyn/comments/ttc15x/key_holder_outside_of_apartment_door/i2xf2gp/,3,r/Brooklyn,0,3
Sorry if this is against the rules but could you please send me your landlords info im searching so hard to find an apartment in that area because its closer to work than where I am in fort greene.,t2_6bzumcgs,Troy_Ounces,0,1648776753.0,0,t1_i2xevks,i2xevks,True,Jazzlike_Expert,t3_ttc15x,https://www.reddit.com/r/Brooklyn/comments/ttc15x/key_holder_outside_of_apartment_door/,Key Holder Outside of Apartment Door,/r/Brooklyn/comments/ttc15x/key_holder_outside_of_apartment_door/i2xevks/,5,r/Brooklyn,0,5
"Thank you for this post. We are making a move today (7 blocks, UWS) and it’s been terrible and this whole thread just gave me a great chuckle.",t2_swxrh,GreatExpectations65,0,1648776724.0,0,t1_i2xetav,i2xetav,True,Jazzlike_Expert,t3_ttc15x,https://www.reddit.com/r/Brooklyn/comments/ttc15x/key_holder_outside_of_apartment_door/,Key Holder Outside of Apartment Door,/r/Brooklyn/comments/ttc15x/key_holder_outside_of_apartment_door/i2xetav/,8,r/Brooklyn,0,8
"Someone else mentioned @nastynewyorkers on Instagram, if you have that app. I signed up for a cleanup this Saturday. They want you to register on Humble for the event, for some odd reason",t2_6bzumcgs,Troy_Ounces,0,1648776545.0,0,t1_i2xef7i,i2xef7i,False,Troy_Ounces,t3_tpjwwk,https://www.reddit.com/r/Brooklyn/comments/tpjwwk/volunteer_litter_cleanup_crews/,Volunteer Litter clean-up crews,/r/Brooklyn/comments/tpjwwk/volunteer_litter_cleanup_crews/i2xef7i/,1,r/Brooklyn,0,1
Seriously,t2_3q8z0e17,BlackHeartBrood,0,1648776308.0,0,t1_i2xdw62,i2xdw62,False,Jazzlike_Expert,t3_ttc15x,https://www.reddit.com/r/Brooklyn/comments/ttc15x/key_holder_outside_of_apartment_door/,Key Holder Outside of Apartment Door,/r/Brooklyn/comments/ttc15x/key_holder_outside_of_apartment_door/i2xdw62/,3,r/Brooklyn,0,3
A what?,t2_t2qh8dh,duaadiddy,1,1648775931.0,0,t1_i2xd23b,i2xd23b,False,Jazzlike_Expert,t3_ttc15x,https://www.reddit.com/r/Brooklyn/comments/ttc15x/key_holder_outside_of_apartment_door/,Key Holder Outside of Apartment Door,/r/Brooklyn/comments/ttc15x/key_holder_outside_of_apartment_door/i2xd23b/,3,r/Brooklyn,0,3
It is good.,t2_d0je,Captaintripps,0,1648775784.0,0,t1_i2xcqde,i2xcqde,True,Other_World,t3_ttbdnk,https://www.reddit.com/r/Brooklyn/comments/ttbdnk/verrazano_bridge_and_the_belt_parkway_at_sunset/,"Verrazano Bridge, and the Belt Parkway at Sunset. 15 second exposure [4189x2798] [OC]",/r/Brooklyn/comments/ttbdnk/verrazano_bridge_and_the_belt_parkway_at_sunset/i2xcqde/,2,r/Brooklyn,0,2
r/bestoff plz,t2_7lnud,LennyLongshoes,0,1648775743.0,0,t1_i2xcn3c,i2xcn3c,True,Jazzlike_Expert,t3_ttc15x,https://www.reddit.com/r/Brooklyn/comments/ttc15x/key_holder_outside_of_apartment_door/,Key Holder Outside of Apartment Door,/r/Brooklyn/comments/ttc15x/key_holder_outside_of_apartment_door/i2xcn3c/,8,r/Brooklyn,0,8
They’re probably from Iowa or something.,t2_xq1sn,ohheyitsjuan,0,1648775589.0,0,t1_i2xcav1,i2xcav1,False,Jazzlike_Expert,t3_ttc15x,https://www.reddit.com/r/Brooklyn/comments/ttc15x/key_holder_outside_of_apartment_door/,Key Holder Outside of Apartment Door,/r/Brooklyn/comments/ttc15x/key_holder_outside_of_apartment_door/i2xcav1/,9,r/Brooklyn,0,9
Try the Buy Nothing app,t2_wu8wh,jax1204,0,1648775253.0,0,t1_i2xbjx0,i2xbjx0,True,coffeequips,t3_ttd7w8,https://www.reddit.com/r/Brooklyn/comments/ttd7w8/borrowing_a_small_pack_play/,Borrowing a small pack & play?,/r/Brooklyn/comments/ttd7w8/borrowing_a_small_pack_play/i2xbjx0/,3,r/Brooklyn,0,3
"I think he means ""for a spell"" as in ""for a little while.""",t2_z56b5,tickingboxes,0,1648775242.0,0,t1_i2xbj1g,i2xbj1g,False,Jazzlike_Expert,t3_ttc15x,https://www.reddit.com/r/Brooklyn/comments/ttc15x/key_holder_outside_of_apartment_door/,Key Holder Outside of Apartment Door,/r/Brooklyn/comments/ttc15x/key_holder_outside_of_apartment_door/i2xbj1g/,24,r/Brooklyn,0,24
Try Craig's List or Next Door.,t2_i07txh9s,kind_one1,0,1648774433.0,0,t1_i2x9qpd,i2x9qpd,True,coffeequips,t3_ttd7w8,https://www.reddit.com/r/Brooklyn/comments/ttd7w8/borrowing_a_small_pack_play/,Borrowing a small pack & play?,/r/Brooklyn/comments/ttd7w8/borrowing_a_small_pack_play/i2x9qpd/,3,r/Brooklyn,0,3
