body,author_fullname,author.name,controversiality,created,downs,fullname,id,is_root,link_author,link_id,link_permalink,link_title,permalink,score,subreddit_name_prefixed,total_awards_received,ups
"Oh hell yeah! Saving this, thank you for your service!",t2_l5mjj,alittlelessconvo,0,1649012137.0,0,t1_i3980wu,i3980wu,True,cheesybroccoli,t3_tvd6vq,https://www.reddit.com/r/Brooklyn/comments/tvd6vq/i_made_a_website_to_find_bar_trivia_nights_in/,I made a website to find bar trivia nights in Brooklyn.,/r/Brooklyn/comments/tvd6vq/i_made_a_website_to_find_bar_trivia_nights_in/i3980wu/,1,r/Brooklyn,0,1
Meckleberg in Williamsburg has trivia but not sure what night....i think wednesday.,t2_hp8ypk60,ambushbugger,0,1649012099.0,0,t1_i397xjp,i397xjp,True,cheesybroccoli,t3_tvd6vq,https://www.reddit.com/r/Brooklyn/comments/tvd6vq/i_made_a_website_to_find_bar_trivia_nights_in/,I made a website to find bar trivia nights in Brooklyn.,/r/Brooklyn/comments/tvd6vq/i_made_a_website_to_find_bar_trivia_nights_in/i397xjp/,1,r/Brooklyn,0,1
Thanks for sharing! Looking forward to checking places out!,t2_u2lsj,teammeats,0,1649011578.0,0,t1_i396pck,i396pck,True,cheesybroccoli,t3_tvd6vq,https://www.reddit.com/r/Brooklyn/comments/tvd6vq/i_made_a_website_to_find_bar_trivia_nights_in/,I made a website to find bar trivia nights in Brooklyn.,/r/Brooklyn/comments/tvd6vq/i_made_a_website_to_find_bar_trivia_nights_in/i396pck/,1,r/Brooklyn,0,1
Pete’s candy in Williamsburg does trivia on wednesdays,t2_ko9ib,dortenzio1991,0,1649011411.0,0,t1_i396bbm,i396bbm,True,cheesybroccoli,t3_tvd6vq,https://www.reddit.com/r/Brooklyn/comments/tvd6vq/i_made_a_website_to_find_bar_trivia_nights_in/,I made a website to find bar trivia nights in Brooklyn.,/r/Brooklyn/comments/tvd6vq/i_made_a_website_to_find_bar_trivia_nights_in/i396bbm/,1,r/Brooklyn,0,1
Go away,t2_fp0newa9,BBCaribbean,0,1649011389.0,0,t1_i3969i1,i3969i1,False,BBCaribbean,t3_tvbo1i,https://www.reddit.com/r/Brooklyn/comments/tvbo1i/i_work_as_a_bouncer_does_anyone_know_of_any_jobs/,I work as a bouncer.. Does anyone know of any jobs that pay under the table in Brooklyn?,/r/Brooklyn/comments/tvbo1i/i_work_as_a_bouncer_does_anyone_know_of_any_jobs/i3969i1/,1,r/Brooklyn,0,1
I work for the IRS and I would like to speak with you.,t2_3nu3v,md702,0,1649010554.0,0,t1_i394a0p,i394a0p,True,BBCaribbean,t3_tvbo1i,https://www.reddit.com/r/Brooklyn/comments/tvbo1i/i_work_as_a_bouncer_does_anyone_know_of_any_jobs/,I work as a bouncer.. Does anyone know of any jobs that pay under the table in Brooklyn?,/r/Brooklyn/comments/tvbo1i/i_work_as_a_bouncer_does_anyone_know_of_any_jobs/i394a0p/,1,r/Brooklyn,0,1
Thanks! Very helpful!,t2_9y16r,LifeIsGood42,0,1649010076.0,0,t1_i3934jc,i3934jc,True,cheesybroccoli,t3_tvd6vq,https://www.reddit.com/r/Brooklyn/comments/tvd6vq/i_made_a_website_to_find_bar_trivia_nights_in/,I made a website to find bar trivia nights in Brooklyn.,/r/Brooklyn/comments/tvd6vq/i_made_a_website_to_find_bar_trivia_nights_in/i3934jc/,1,r/Brooklyn,0,1
Bunch of bullshit,t2_8cuvn,Simmangodz,0,1649009552.0,0,t1_i391upi,i391upi,True,Current_Oil6528,t3_tvfgf0,https://www.reddit.com/r/Brooklyn/comments/tvfgf0/new_yorkers_could_become_owners_of_buffalo_bills/,New Yorkers could become owners of Buffalo Bills under new bill,/r/Brooklyn/comments/tvfgf0/new_yorkers_could_become_owners_of_buffalo_bills/i391upi/,1,r/Brooklyn,0,1
Run over the Kosciusko bridge and run around inside Calvary cemetery. Not too dangerous.,t2_494sp,Friendo_Marx,0,1649008456.0,0,t1_i38z53k,i38z53k,True,Classic-Scientist-97,t3_tv83m6,https://www.reddit.com/r/Brooklyn/comments/tv83m6/running_in_brooklyn/,Running in Brooklyn,/r/Brooklyn/comments/tv83m6/running_in_brooklyn/i38z53k/,1,r/Brooklyn,0,1
Thanks! Added.,t2_7logm,cheesybroccoli,0,1649007311.0,0,t1_i38wbdc,i38wbdc,False,cheesybroccoli,t3_tvd6vq,https://www.reddit.com/r/Brooklyn/comments/tvd6vq/i_made_a_website_to_find_bar_trivia_nights_in/,I made a website to find bar trivia nights in Brooklyn.,/r/Brooklyn/comments/tvd6vq/i_made_a_website_to_find_bar_trivia_nights_in/i38wbdc/,2,r/Brooklyn,0,2
i know sycamore bar has trivia! i’ve never been so i don’t know the details,t2_10pgms,apersiandawn,0,1649007229.0,0,t1_i38w43d,i38w43d,True,cheesybroccoli,t3_tvd6vq,https://www.reddit.com/r/Brooklyn/comments/tvd6vq/i_made_a_website_to_find_bar_trivia_nights_in/,I made a website to find bar trivia nights in Brooklyn.,/r/Brooklyn/comments/tvd6vq/i_made_a_website_to_find_bar_trivia_nights_in/i38w43d/,3,r/Brooklyn,0,3
"Perhaps somewhere in crown heights where you can take the Express bus (SB44) to school. There’s nothing really to do around Brooklyn college (very residential) and just north of Brooklyn college, can be a bit rough. Crown heights is the mid point area where there are bars, restaurants and cafes. You can take that same bus north to the beginning of the line and end up in Williamsburg which is fun. Good luck and be safe!",t2_4gygp4lm,Thin_King_7518,0,1649007033.0,0,t1_i38vmpm,i38vmpm,True,Digabunker,t3_tvanfh,https://www.reddit.com/r/Brooklyn/comments/tvanfh/recommended_places_to_live_for_a_female_grad/,Recommended places to live for a female grad student at Brooklyn College?,/r/Brooklyn/comments/tvanfh/recommended_places_to_live_for_a_female_grad/i38vmpm/,2,r/Brooklyn,0,2
"Chelsea market has some good gift baskets!  

https://www.chelseamarketbasket.com/product/Brooklyn-Sweets

https://www.chelseamarketbasket.com/product/Brooklyn-Cutting-Board",t2_56i13g73,pureblood-,0,1649006999.0,0,t1_i38vjoo,i38vjoo,True,shakesamis,t3_tvauc0,https://www.reddit.com/r/Brooklyn/comments/tvauc0/moving_back_ideas/,Moving back ideas,/r/Brooklyn/comments/tvauc0/moving_back_ideas/i38vjoo/,2,r/Brooklyn,0,2
This. Make plans to go places and help her find things and people that interest her.,t2_ylqvuh8,Bklynswim,0,1649006968.0,0,t1_i38vgxd,i38vgxd,False,shakesamis,t3_tvauc0,https://www.reddit.com/r/Brooklyn/comments/tvauc0/moving_back_ideas/,Moving back ideas,/r/Brooklyn/comments/tvauc0/moving_back_ideas/i38vgxd/,2,r/Brooklyn,0,2
I stumbled upon trivia in the basement of Seamores in Dumbo on Thursday’s at 7pm.,t2_4b8pa,abt5000,0,1649006814.0,0,t1_i38v3jl,i38v3jl,True,cheesybroccoli,t3_tvd6vq,https://www.reddit.com/r/Brooklyn/comments/tvd6vq/i_made_a_website_to_find_bar_trivia_nights_in/,I made a website to find bar trivia nights in Brooklyn.,/r/Brooklyn/comments/tvd6vq/i_made_a_website_to_find_bar_trivia_nights_in/i38v3jl/,4,r/Brooklyn,0,4
"It's normal, no worries. I used my passport for everything until I managed to get state specific ID. 

The moment you've got an address, look into the IDNYC - it's useful to have as a proof of residency and ID in general.",t2_e23n4,wordlesser,0,1649006608.0,0,t1_i38ulco,i38ulco,True,Weird-Shower,t3_tvaq02,https://www.reddit.com/r/Brooklyn/comments/tvaq02/landlord_asking_for_copy_of_passport/,Landlord asking for copy of passport,/r/Brooklyn/comments/tvaq02/landlord_asking_for_copy_of_passport/i38ulco/,3,r/Brooklyn,0,3
"This is super cool, thanks for creating it!",t2_8aj08,Sexist_Kangaroo,0,1649006284.0,0,t1_i38tsjx,i38tsjx,True,cheesybroccoli,t3_tvd6vq,https://www.reddit.com/r/Brooklyn/comments/tvd6vq/i_made_a_website_to_find_bar_trivia_nights_in/,I made a website to find bar trivia nights in Brooklyn.,/r/Brooklyn/comments/tvd6vq/i_made_a_website_to_find_bar_trivia_nights_in/i38tsjx/,1,r/Brooklyn,0,1
Op is asking a genuine question and you gotta be a sarcastic prick about it,t2_3kzcvhig,KOD2264,0,1649005943.0,0,t1_i38sy70,i38sy70,False,Weird-Shower,t3_tvaq02,https://www.reddit.com/r/Brooklyn/comments/tvaq02/landlord_asking_for_copy_of_passport/,Landlord asking for copy of passport,/r/Brooklyn/comments/tvaq02/landlord_asking_for_copy_of_passport/i38sy70/,16,r/Brooklyn,0,16
Smfh,t2_6a6iq7ph,SuccessMechanism,0,1649005647.0,0,t1_i38s8hd,i38s8hd,True,kutiket,t3_tutsgi,https://www.reddit.com/r/Brooklyn/comments/tutsgi/simply_put_i_just_cant_understand_how_fulton_and/,simply put I just can't understand how @fulton and Bedford,/r/Brooklyn/comments/tutsgi/simply_put_i_just_cant_understand_how_fulton_and/i38s8hd/,1,r/Brooklyn,0,1
"DUMBO, Brooklyn Heights, Cobble Hill, Carol Gardens…",t2_rmh58m4,dasa2337,0,1649005166.0,0,t1_i38r2sk,i38r2sk,True,craig643,t3_tvbxed,https://www.reddit.com/r/Brooklyn/comments/tvbxed/neighborhood_most_like_bermondsey_london/,Neighborhood Most Like Bermondsey (London),/r/Brooklyn/comments/tvbxed/neighborhood_most_like_bermondsey_london/i38r2sk/,2,r/Brooklyn,0,2
What neighborhood do you reside in?,t2_xcn6q,DontDrinkTooMuch,0,1649004973.0,0,t1_i38qm1c,i38qm1c,True,djb72498,t3_tu70vt,https://www.reddit.com/r/Brooklyn/comments/tu70vt/cool_bars_in_brooklyn/,Cool bars in Brooklyn?,/r/Brooklyn/comments/tu70vt/cool_bars_in_brooklyn/i38qm1c/,1,r/Brooklyn,0,1
Prospect park is highly recommended by me as well,t2_zgrq1,MithrilHero,0,1649004933.0,0,t1_i38qika,i38qika,False,Classic-Scientist-97,t3_tv83m6,https://www.reddit.com/r/Brooklyn/comments/tv83m6/running_in_brooklyn/,Running in Brooklyn,/r/Brooklyn/comments/tv83m6/running_in_brooklyn/i38qika/,3,r/Brooklyn,0,3
Tacos el Rey off Coney Island Avenue near Brighton Beach B/Q,t2_7njmgwr0,StrawberryTickles,0,1649004315.0,0,t1_i38p0we,i38p0we,True,rtillerson,t3_tuu65g,https://www.reddit.com/r/Brooklyn/comments/tuu65g/best_mexican_food_near_coney_island/,Best mexican food near coney island?,/r/Brooklyn/comments/tuu65g/best_mexican_food_near_coney_island/i38p0we/,1,r/Brooklyn,0,1
You’re probably going to want to live in Brooklyn. Brooklyn College is pretty deep in Brooklyn - it’s at the end of the 2 and 5 subway lines. I did student teaching around there while living in UWS and my daily commute was over an hour. I don’t have specific neighborhood recommendations because I don’t know where students who go there live.,t2_7uc57,groudhogday,0,1649004218.0,0,t1_i38os45,i38os45,False,Digabunker,t3_tvanfh,https://www.reddit.com/r/Brooklyn/comments/tvanfh/recommended_places_to_live_for_a_female_grad/,Recommended places to live for a female grad student at Brooklyn College?,/r/Brooklyn/comments/tvanfh/recommended_places_to_live_for_a_female_grad/i38os45/,2,r/Brooklyn,0,2
The brooklyn bridge sucks to run over unless you wake up super early. If you’re interested in running with other people the north brooklyn runners group has group runs every day of the week: https://northbrooklynrunners.org,t2_56vcdzdb,Bird_is_the_w0rd,0,1649003807.0,0,t1_i38ns3h,i38ns3h,True,Classic-Scientist-97,t3_tv83m6,https://www.reddit.com/r/Brooklyn/comments/tv83m6/running_in_brooklyn/,Running in Brooklyn,/r/Brooklyn/comments/tv83m6/running_in_brooklyn/i38ns3h/,1,r/Brooklyn,0,1
"As long as you dont ask anyone from Brooklyn ""how safe is Brooklyn"" you should be fine. If word gets to the street that you asked that,  you'll get shivved daily just for fun.",t2_cc3ju,stevelabny,0,1649003502.0,0,t1_i38n1oe,i38n1oe,True,CollectionRadiant372,t3_tu4kca,https://www.reddit.com/r/Brooklyn/comments/tu4kca/hello_guys_please_tell_me_how_safe_is_brooklyn/,"Hello guys, please tell me how safe is brooklyn ?",/r/Brooklyn/comments/tu4kca/hello_guys_please_tell_me_how_safe_is_brooklyn/i38n1oe/,1,r/Brooklyn,0,1
"From where you're staying, a couple route ideas:

1. Run to and across the Pulaski Bridge to Long Island City. Beautiful run along the western waterfront of LIC, then up to Roosevelt Island Bridge. You can cross the bridge and loop all or some of Roosevelt Island before heading back.

2. (Optionally run through McCarren Park / Domino Park), then over the Williamsburg Bridge. There's a great running path along the entirety of the south + west sides of Manhattan. So, you can swing south to the south point of Manhattan, then up the west side until you cut back across to Williamsburg Bridge. Or, you can go straight west across Manhattan to go a bit further north up the west side highway (Hudson River waterfront).

You can also cross into Manhattan and run along the east river, though there's some construction along certain parts at the moment. You can run the Queensboro Bridge to Central Park, which is fun to experience too.

I second the idea that Prospect Park is an amazing place to run, but IMO your route to get there isn't very fun.",t2_hqbwl,gabergg,0,1649003468.0,0,t1_i38myse,i38myse,True,Classic-Scientist-97,t3_tv83m6,https://www.reddit.com/r/Brooklyn/comments/tv83m6/running_in_brooklyn/,Running in Brooklyn,/r/Brooklyn/comments/tv83m6/running_in_brooklyn/i38myse/,2,r/Brooklyn,0,2
Thanks! Will do!,t2_7logm,cheesybroccoli,0,1649003282.0,0,t1_i38miws,i38miws,False,DenverITGuy,t3_s7ylr5,https://www.reddit.com/r/Brooklyn/comments/s7ylr5/bar_trivia/,Bar Trivia?,/r/Brooklyn/comments/s7ylr5/bar_trivia/i38miws/,1,r/Brooklyn,0,1
Yeah I think my hesitation is the subway situation. I’d be by the c. But it really is such a nice neighborhood,t2_5a7nfar2,user1786257,0,1649003206.0,0,t1_i38mci8,i38mci8,False,user1786257,t3_tukbve,https://www.reddit.com/r/Brooklyn/comments/tukbve/crown_heights_or_clinton_hill_for_a_thirty/,Crown heights or Clinton hill for a thirty something?,/r/Brooklyn/comments/tukbve/crown_heights_or_clinton_hill_for_a_thirty/i38mci8/,1,r/Brooklyn,0,1
Very cool - you might want to add Fine Time bar in Bushwick on Tuesday nights.,t2_8eg46,DenverITGuy,0,1649003045.0,0,t1_i38lyf7,i38lyf7,False,DenverITGuy,t3_s7ylr5,https://www.reddit.com/r/Brooklyn/comments/s7ylr5/bar_trivia/,Bar Trivia?,/r/Brooklyn/comments/s7ylr5/bar_trivia/i38lyf7/,1,r/Brooklyn,0,1
That it happened,t2_1r6csb57,GotPizzaMouth,0,1649002582.0,0,t1_i38ku6k,i38ku6k,False,user1786257,t3_tukbve,https://www.reddit.com/r/Brooklyn/comments/tukbve/crown_heights_or_clinton_hill_for_a_thirty/,Crown heights or Clinton hill for a thirty something?,/r/Brooklyn/comments/tukbve/crown_heights_or_clinton_hill_for_a_thirty/i38ku6k/,1,r/Brooklyn,0,1
"So you’re looking for a neighborhood of converted warehouses, expensive flats, and high end restaurants? Move to DUMBO.",t2_h5eofbh7,TonyMoonArt,0,1649002568.0,0,t1_i38kszt,i38kszt,True,craig643,t3_tvbxed,https://www.reddit.com/r/Brooklyn/comments/tvbxed/neighborhood_most_like_bermondsey_london/,Neighborhood Most Like Bermondsey (London),/r/Brooklyn/comments/tvbxed/neighborhood_most_like_bermondsey_london/i38kszt/,3,r/Brooklyn,0,3
"Thanks for linking my comment!  Hoping to get it out to as many people as possible so we can crowdsource a full list.  I've recently added a lot of bars to it.

Here's a direct link: [brooklyntrivia.wordpress.com](https://brooklyntrivia.wordpress.com)",t2_7logm,cheesybroccoli,0,1649002414.0,0,t1_i38kfka,i38kfka,False,DenverITGuy,t3_s7ylr5,https://www.reddit.com/r/Brooklyn/comments/s7ylr5/bar_trivia/,Bar Trivia?,/r/Brooklyn/comments/s7ylr5/bar_trivia/i38kfka/,1,r/Brooklyn,0,1
"Maybe some Brooklyn cocktail glasses to go with the widow Jane?  Something like this: https://www.uncommongoods.com/product/urban-map-glass?utm_source=google%20surfaces&utm_medium=organic&flow_country=US&gclid=CjwKCAjwi6WSBhA-EiwA6NiokwFWE-XXz27OVqAQPelzYPypRozqFHs88pfIJB3sKpA0BeoLU5FKTBoCTx0QAvD_BwE#234330000046

I also like the idea of maybe getting Nets tickets and making some dinner reservations for the first few months you are in town.",t2_11y0ug,minimalBS,0,1649002404.0,0,t1_i38kep3,i38kep3,True,shakesamis,t3_tvauc0,https://www.reddit.com/r/Brooklyn/comments/tvauc0/moving_back_ideas/,Moving back ideas,/r/Brooklyn/comments/tvauc0/moving_back_ideas/i38kep3/,2,r/Brooklyn,0,2
"It's not normal, ur fucked, your landlord gonna turn u into
 amogus",t2_7yxwmlbv,Naive-Construction-2,0,1649002318.0,0,t1_i38k7au,i38k7au,True,Weird-Shower,t3_tvaq02,https://www.reddit.com/r/Brooklyn/comments/tvaq02/landlord_asking_for_copy_of_passport/,Landlord asking for copy of passport,/r/Brooklyn/comments/tvaq02/landlord_asking_for_copy_of_passport/i38k7au/,-38,r/Brooklyn,0,-38
"Hey there!  I made a website that lists all the Brooklyn Trivia nights sorted by day of the week.  You can use it to find your next trivia night!  
https://brooklyntrivia.wordpress.com/",t2_7logm,cheesybroccoli,0,1649002260.0,0,t1_i38k277,i38k277,True,DenverITGuy,t3_s7ylr5,https://www.reddit.com/r/Brooklyn/comments/s7ylr5/bar_trivia/,Bar Trivia?,/r/Brooklyn/comments/s7ylr5/bar_trivia/i38k277/,2,r/Brooklyn,0,2
"Hey there!  I made a website that lists all the Brooklyn Trivia nights sorted by day of the week.  You can use it to find your next trivia night!  
https://brooklyntrivia.wordpress.com/",t2_7logm,cheesybroccoli,0,1649002177.0,0,t1_i38juzu,i38juzu,False,zardoz_lives,t3_sbnrl2,https://www.reddit.com/r/Brooklyn/comments/sbnrl2/anyone_want_to_start_a_trivia_team/,Anyone want to start a trivia team?,/r/Brooklyn/comments/sbnrl2/anyone_want_to_start_a_trivia_team/i38juzu/,1,r/Brooklyn,0,1
"Hey there!  I made a website that lists all the Brooklyn Trivia nights sorted by day of the week.  You can use it to find your next trivia night!

[https://brooklyntrivia.wordpress.com/](https://brooklyntrivia.wordpress.com/)",t2_7logm,cheesybroccoli,0,1649002106.0,0,t1_i38jox2,i38jox2,True,zardoz_lives,t3_sbnrl2,https://www.reddit.com/r/Brooklyn/comments/sbnrl2/anyone_want_to_start_a_trivia_team/,Anyone want to start a trivia team?,/r/Brooklyn/comments/sbnrl2/anyone_want_to_start_a_trivia_team/i38jox2/,1,r/Brooklyn,0,1
"Hey there!  I made a website that tracks all the Brooklyn trivia nights sorted by day of the week.  Check it out to find your next trivia night.

[https://brooklyntrivia.wordpress.com/](https://brooklyntrivia.wordpress.com/)",t2_7logm,cheesybroccoli,0,1649002022.0,0,t1_i38jhxg,i38jhxg,True,rbromblin,t3_t3oxsl,https://www.reddit.com/r/Brooklyn/comments/t3oxsl/best_bar_trivia/,Best bar trivia?,/r/Brooklyn/comments/t3oxsl/best_bar_trivia/i38jhxg/,1,r/Brooklyn,0,1
Prospect park has a 3.35 mile loop and decent trails off road. Running along the waterfront/Domino park/Brooklyn bridge park is really nice with incredible views of Manhattan. I’d also highly recommend either running to or taking the train to Manhattan and doing a loop of Central Park (~6 miles).,t2_4dqms,feltman,0,1649001364.0,0,t1_i38hx6t,i38hx6t,True,Classic-Scientist-97,t3_tv83m6,https://www.reddit.com/r/Brooklyn/comments/tv83m6/running_in_brooklyn/,Running in Brooklyn,/r/Brooklyn/comments/tv83m6/running_in_brooklyn/i38hx6t/,2,r/Brooklyn,0,2
It’s perfectly safe. Above is a troll.,t2_4dqms,feltman,0,1649001158.0,0,t1_i38hfqc,i38hfqc,False,Classic-Scientist-97,t3_tv83m6,https://www.reddit.com/r/Brooklyn/comments/tv83m6/running_in_brooklyn/,Running in Brooklyn,/r/Brooklyn/comments/tv83m6/running_in_brooklyn/i38hfqc/,3,r/Brooklyn,0,3
"Hey! Same situation here. Not taking over your question, just expanding a little. 

Moving from out of state. Planning on visiting next month to get a feeling for area. Where do most grad students live? Have friends living in Upper East and West sides. Are those too far to commute? Also rents seem higher in those areas. Any help appreciated.",t2_fgtwagv1,bummernametaken,0,1649001074.0,0,t1_i38h8k2,i38h8k2,True,Digabunker,t3_tvanfh,https://www.reddit.com/r/Brooklyn/comments/tvanfh/recommended_places_to_live_for_a_female_grad/,Recommended places to live for a female grad student at Brooklyn College?,/r/Brooklyn/comments/tvanfh/recommended_places_to_live_for_a_female_grad/i38h8k2/,1,r/Brooklyn,0,1
"You'll be in a pretty safe neighborhood in a cool part of town with lots of quiet streets and some scenic industrial areas to run. Of course always keep your eye out for cars/bikes and be considerate to walkers, just like in London.

My personal favorite long run in your neighborhood is to make my way west to Franklin, run south til it turns into Kent Avenue, then run the bridges, taking the Williamsburg Bridge to Chinatown, Manhattan Bridge back to DUMBO, and the Brooklyn Bridge to the financial district, Manhattan Bridge back to Flushing Ave, and head north along the shore til you get home. The bridges segregate pedestrian from bike traffic (signage is clear but generally peds to the south). Depending on when you're running, Brooklyn Bridge can be slow due to tourists; otherwise the bridges give you lots of space and awesome views.",t2_c6w4w,uni-twit,0,1649000937.0,0,t1_i38gwqx,i38gwqx,True,Classic-Scientist-97,t3_tv83m6,https://www.reddit.com/r/Brooklyn/comments/tv83m6/running_in_brooklyn/,Running in Brooklyn,/r/Brooklyn/comments/tv83m6/running_in_brooklyn/i38gwqx/,2,r/Brooklyn,0,2
That’s what I’m starting to think. I would love to be wrong on this!,t2_kw3fo,XeiB8Afe,0,1649000933.0,0,t1_i38gwgg,i38gwgg,False,mayarudolphofficial,t3_tuio2j,https://www.reddit.com/r/Brooklyn/comments/tuio2j/venues_to_see_punk_metal_emo_shows/,Venues to see punk / metal / emo shows?,/r/Brooklyn/comments/tuio2j/venues_to_see_punk_metal_emo_shows/i38gwgg/,2,r/Brooklyn,0,2
"Great 7 mile run:

Start at Peter Lugers, run down Broadway to Kent, turn left and run all the way to Dumbo, over the Manhattan bridge, then turn north and run up LES till Delancey and over the Williamsburg Bridge.

You really get to see NY/BK:

Williamsburg -> Navy Yard -> Dumbo -> Chinatown -> Lower East Side",t2_fl6rv,josephmisiti,0,1649000853.0,0,t1_i38gpjb,i38gpjb,True,Classic-Scientist-97,t3_tv83m6,https://www.reddit.com/r/Brooklyn/comments/tv83m6/running_in_brooklyn/,Running in Brooklyn,/r/Brooklyn/comments/tv83m6/running_in_brooklyn/i38gpjb/,1,r/Brooklyn,0,1
It's normal. You're fine,t2_ld7os,MrGrieves787,0,1649000680.0,0,t1_i38gaot,i38gaot,True,Weird-Shower,t3_tvaq02,https://www.reddit.com/r/Brooklyn/comments/tvaq02/landlord_asking_for_copy_of_passport/,Landlord asking for copy of passport,/r/Brooklyn/comments/tvaq02/landlord_asking_for_copy_of_passport/i38gaot/,16,r/Brooklyn,0,16
"A list of organizations that do her hobbies - ie running or knitting clubs

An atlas obscura scavenger hunt list

A “Brooklyn’s History” type photo atlas coffee table book with historical photos of all the neighborhoods

Tickets to music shows at like Brooklyn Steel, TVEye, or find venues/bars that vibe with whatever music she’s into.

A set of glasses that blur out street trash.",t2_4lukd,l00k1ng1n,0,1649000535.0,0,t1_i38fye8,i38fye8,True,shakesamis,t3_tvauc0,https://www.reddit.com/r/Brooklyn/comments/tvauc0/moving_back_ideas/,Moving back ideas,/r/Brooklyn/comments/tvauc0/moving_back_ideas/i38fye8/,11,r/Brooklyn,0,11
I was really excited to watch a back and forth where this guy pedantically Jewsplains the eruv to another Jew and you ruined that for me.,t2_br9dx,ScoutsOut389,0,1649000052.0,0,t1_i38ety9,i38ety9,False,Jazzlike_Expert,t3_ttc15x,https://www.reddit.com/r/Brooklyn/comments/ttc15x/key_holder_outside_of_apartment_door/,Key Holder Outside of Apartment Door,/r/Brooklyn/comments/ttc15x/key_holder_outside_of_apartment_door/i38ety9/,1,r/Brooklyn,0,1
"So that’s about a 4 mile stretch from Owl’s Head Park to Cesar’s Bay Bazaar (I forget what that’s called now). Between Owl’s Head Park and the Verazzano Bridge you can run directly on the water path - or do the hills on Shore Road and see some of the beautiful homes and foliage along that stretch. There are a few overpasses along the way to get you over the Belt Parkway that runs along there. 

Anyway if you keep going toward what used to be the Bazaar, along the water, the next overpass after the one under the verazzano brings you to Dyker Beach Park which is a nature preserve, golf course, sports complex in Dyker Heights. That’s 2.2 miles in circumference.   

If you don’t do the Dyker Beach Park loop and make it to the Bazaar, you’re almost at Coney Island at that point. I remember it being a few surface roads but pretty easy to navigate these days with smart phones. I kind of love the boardwalk.",t2_3cqg2wt4,wutwutsugabutt,0,1648999441.0,0,t1_i38df3e,i38df3e,False,Classic-Scientist-97,t3_tv83m6,https://www.reddit.com/r/Brooklyn/comments/tv83m6/running_in_brooklyn/,Running in Brooklyn,/r/Brooklyn/comments/tv83m6/running_in_brooklyn/i38df3e/,1,r/Brooklyn,0,1
In what way?,t2_ijae8avf,Classic-Scientist-97,0,1648999432.0,0,t1_i38debq,i38debq,False,Classic-Scientist-97,t3_tv83m6,https://www.reddit.com/r/Brooklyn/comments/tv83m6/running_in_brooklyn/,Running in Brooklyn,/r/Brooklyn/comments/tv83m6/running_in_brooklyn/i38debq/,1,r/Brooklyn,0,1
"Cannoli from Veneiros
Pie from four and twenty blackbirds
Take her to l’industrie or best pizza or Emmy squared

And if she’s anxious about meeting people maybe invite people you know that you think she’d click with?",t2_bd13i,36chamberstreet,0,1648999337.0,0,t1_i38d6lc,i38d6lc,True,shakesamis,t3_tvauc0,https://www.reddit.com/r/Brooklyn/comments/tvauc0/moving_back_ideas/,Moving back ideas,/r/Brooklyn/comments/tvauc0/moving_back_ideas/i38d6lc/,2,r/Brooklyn,0,2
"That’s awesome! In that case, I’d say go for Clinton Hill. It’s a much more peaceful living experience, and central to nearly everything.",t2_4dvnn,NlNTENDO,0,1648999054.0,0,t1_i38cj0j,i38cj0j,False,user1786257,t3_tukbve,https://www.reddit.com/r/Brooklyn/comments/tukbve/crown_heights_or_clinton_hill_for_a_thirty/,Crown heights or Clinton hill for a thirty something?,/r/Brooklyn/comments/tukbve/crown_heights_or_clinton_hill_for_a_thirty/i38cj0j/,1,r/Brooklyn,0,1
"I didn’t say anything about that, that was from the OP.",t2_13bln0,yoitsyaboii,0,1648998352.0,0,t1_i38ay8i,i38ay8i,False,[deleted],t3_tu1glk,https://www.reddit.com/r/Brooklyn/comments/tu1glk/charged_6000_for_apt_door_replacement/,"Charged $6,000 for apt door replacement",/r/Brooklyn/comments/tu1glk/charged_6000_for_apt_door_replacement/i38ay8i/,1,r/Brooklyn,0,1
"It’s common, everyone needs to have some form of I.D.  Most landlords also run background checks and credit checks, it’s legal.",t2_65830zbg,VTX1800F,0,1648998271.0,0,t1_i38arne,i38arne,True,Weird-Shower,t3_tvaq02,https://www.reddit.com/r/Brooklyn/comments/tvaq02/landlord_asking_for_copy_of_passport/,Landlord asking for copy of passport,/r/Brooklyn/comments/tvaq02/landlord_asking_for_copy_of_passport/i38arne/,52,r/Brooklyn,0,52
