body,author_fullname,author.name,controversiality,created,downs,fullname,id,is_root,link_author,link_id,link_permalink,link_title,permalink,score,subreddit_name_prefixed,total_awards_received,ups
This guy must be the CONtractor!!,t2_ekyjup18,Bkgrouch,0,1648861292.0,0,t1_i3207hy,i3207hy,False,[deleted],t3_tu1glk,https://www.reddit.com/r/Brooklyn/comments/tu1glk/charged_6000_for_apt_door_replacement/,"Charged $6,000 for apt door replacement",/r/Brooklyn/comments/tu1glk/charged_6000_for_apt_door_replacement/i3207hy/,9,r/Brooklyn,0,9
"Damn, I should’ve done this for the last 4.5months that I was on maternity leave and all I did was walk 😂",t2_8nf1z,crzyyy,0,1648861126.0,0,t1_i31zvws,i31zvws,True,xwhy,t3_tu5arx,https://www.reddit.com/r/Brooklyn/comments/tu5arx/walking_brooklyn_janmar_2022_since_may_2019/,"Walking Brooklyn, Jan-Mar 2022 & since May 2019",/r/Brooklyn/comments/tu5arx/walking_brooklyn_janmar_2022_since_may_2019/i31zvws/,5,r/Brooklyn,0,5
I build. You should get the name of the old door and find the cost online. My guess is the original door may have been 300 and the labor to install 550ish for standard material. Then call the department of consumer affairs or 311 for info on contractor gouging. There are city rules and regulations for submitting bids that they probably took advantage of.,t2_148kbc,danenyc,0,1648860766.0,0,t1_i31z6gd,i31z6gd,True,[deleted],t3_tu1glk,https://www.reddit.com/r/Brooklyn/comments/tu1glk/charged_6000_for_apt_door_replacement/,"Charged $6,000 for apt door replacement",/r/Brooklyn/comments/tu1glk/charged_6000_for_apt_door_replacement/i31z6gd/,10,r/Brooklyn,0,10
this is an article about unionizing a starbucks lol. you have not read kotkin,t2_8ajj06yo,jockjams2,0,1648860758.0,0,t1_i31z5xy,i31z5xy,False,Patterson9191717,t3_tszip9,https://www.reddit.com/r/Brooklyn/comments/tszip9/brooklyn_starbucks_workers_and_socialists_join/,Brooklyn Starbucks Workers and Socialists Join Forces to Fight Union-Busting,/r/Brooklyn/comments/tszip9/brooklyn_starbucks_workers_and_socialists_join/i31z5xy/,2,r/Brooklyn,0,2
"Oh no. I lived there for a few years but I had to leave because I kept getting shot. It wasn’t so bad when I got shot while I was walking the dog, and I could tolerate it when I got shot while taking my trash out. But when I opened my door and the guy slipping restaurant menus into the railing turned around and shot me in the face I decided enough was enough and moved to Queens.",t2_7kmty,vickeryj,0,1648860662.0,0,t1_i31yz1x,i31yz1x,False,CollectionRadiant372,t3_tu4kca,https://www.reddit.com/r/Brooklyn/comments/tu4kca/hello_guys_please_tell_me_how_safe_is_brooklyn/,"Hello guys, please tell me how safe is brooklyn ?",/r/Brooklyn/comments/tu4kca/hello_guys_please_tell_me_how_safe_is_brooklyn/i31yz1x/,30,r/Brooklyn,1,30
"Meh. I live a few blocks away and have never understood the attraction. The food is mediocre at best. Ample Hills and Brooklyn Ice Cream Factory in Dumbo are both much better quality.

For ice cream in the neighborhood, check out Dolce (relatively new gelato place, originally located in Red Hook) less than a block away.

Flip side, is that Mozz Lab across the street from Farmacy is amazing sandwiches.",t2_911k9,gordo1223,0,1648859640.0,0,t1_i31wyck,i31wyck,False,Wholesome100and7,t3_ttnnod,https://www.reddit.com/r/Brooklyn/comments/ttnnod/best_place_in_brooklyn_to_grab_a_milkshake/,Best place in Brooklyn to grab a milkshake?,/r/Brooklyn/comments/ttnnod/best_place_in_brooklyn_to_grab_a_milkshake/i31wyck/,5,r/Brooklyn,0,5
Crown height,t2_cr9mw48y,CollectionRadiant372,1,1648859623.0,0,t1_i31wx37,i31wx37,False,CollectionRadiant372,t3_tu4kca,https://www.reddit.com/r/Brooklyn/comments/tu4kca/hello_guys_please_tell_me_how_safe_is_brooklyn/,"Hello guys, please tell me how safe is brooklyn ?",/r/Brooklyn/comments/tu4kca/hello_guys_please_tell_me_how_safe_is_brooklyn/i31wx37/,-4,r/Brooklyn,0,-4
Is this happened for real ?? ? You guys are frightening me🥺🥺🥺,t2_cr9mw48y,CollectionRadiant372,0,1648859532.0,0,t1_i31wqn9,i31wqn9,False,CollectionRadiant372,t3_tu4kca,https://www.reddit.com/r/Brooklyn/comments/tu4kca/hello_guys_please_tell_me_how_safe_is_brooklyn/,"Hello guys, please tell me how safe is brooklyn ?",/r/Brooklyn/comments/tu4kca/hello_guys_please_tell_me_how_safe_is_brooklyn/i31wqn9/,1,r/Brooklyn,0,1
You serious ??,t2_cr9mw48y,CollectionRadiant372,1,1648859276.0,0,t1_i31w8id,i31w8id,False,CollectionRadiant372,t3_tu4kca,https://www.reddit.com/r/Brooklyn/comments/tu4kca/hello_guys_please_tell_me_how_safe_is_brooklyn/,"Hello guys, please tell me how safe is brooklyn ?",/r/Brooklyn/comments/tu4kca/hello_guys_please_tell_me_how_safe_is_brooklyn/i31w8id/,-2,r/Brooklyn,0,-2
"No it’s not a troll, it’s a question from someone who never been there! Please answer sincerely !",t2_cr9mw48y,CollectionRadiant372,0,1648859181.0,0,t1_i31w1rv,i31w1rv,False,CollectionRadiant372,t3_tu4kca,https://www.reddit.com/r/Brooklyn/comments/tu4kca/hello_guys_please_tell_me_how_safe_is_brooklyn/,"Hello guys, please tell me how safe is brooklyn ?",/r/Brooklyn/comments/tu4kca/hello_guys_please_tell_me_how_safe_is_brooklyn/i31w1rv/,-7,r/Brooklyn,0,-7
"the father, maybe, the five year old isn’t an adult who can make their own decisions and leave a stove on in the apt and leave the apt, that’s clean gross negligence just like a father having 5 space heaters and 7 children and not paying attention to either.

they would pay that because if they didn’t they would get sued. fuck around with your security if you want to.",t2_85upt9dj,Specialist_Ad_9419,0,1648858808.0,0,t1_i31vayt,i31vayt,False,[deleted],t3_tu1glk,https://www.reddit.com/r/Brooklyn/comments/tu1glk/charged_6000_for_apt_door_replacement/,"Charged $6,000 for apt door replacement",/r/Brooklyn/comments/tu1glk/charged_6000_for_apt_door_replacement/i31vayt/,1,r/Brooklyn,0,1
"THE JOBS AROUD $4500 OR SO DEPENDING ON THE DEPTH OF THE JAMB THE SUB-MATERIALS, THE COMPOSITION OF THE DOOR. WE MAKE/INSTALL STEEL DOORS AND FRAMES HERE IN BROOKLYN. ASLO THERE’S A MORTICE LOCK NOT CHEAP TO INSTALL. ONCE THE DOOR’S BEEN COMPROMISED, THE JAMBS ARE USUALLY SHOT, AS IN NOT ALIGNING AFTER THE BREECH. THE WHOLE SET IS USUALLY REPLACED OR THE JOB’S SHODDY. APPARTMENT DOORS ARE ""CALLED CALOMINE DOORS”, THEY’RE NOT LIKE WOOD YOU CANT MASSAGE A DOOR INTO JAMB BY FITTING.  SOMETIMES THE MANAGEMENT COMPANY WANTS TO MAKE OUT ON THE JOB AS A CONTRACTOR. THEY PROBABLY HATE YOU NOW AFTER PUTTING EVERYONE IN JEOPARDY, AND TRASHING THE BUILDING. GOOD LUCK WITH AN ATTORNEY.",t2_96vp3qsa,ImprovementOne883,0,1648858759.0,0,t1_i31v7ew,i31v7ew,True,[deleted],t3_tu1glk,https://www.reddit.com/r/Brooklyn/comments/tu1glk/charged_6000_for_apt_door_replacement/,"Charged $6,000 for apt door replacement",/r/Brooklyn/comments/tu1glk/charged_6000_for_apt_door_replacement/i31v7ew/,-13,r/Brooklyn,0,-13
6000dollars? Better be a explosive proof door,t2_8vpsyg1e,CodeMunke,0,1648858734.0,0,t1_i31v5mx,i31v5mx,True,[deleted],t3_tu1glk,https://www.reddit.com/r/Brooklyn/comments/tu1glk/charged_6000_for_apt_door_replacement/,"Charged $6,000 for apt door replacement",/r/Brooklyn/comments/tu1glk/charged_6000_for_apt_door_replacement/i31v5mx/,3,r/Brooklyn,0,3
"This is about the level of discourse I expected from a ""socialist"" in the richest city in the richest and freest country on earth.",t2_3ryyu,electric_sandwich,0,1648858609.0,0,t1_i31uwox,i31uwox,False,Patterson9191717,t3_tszip9,https://www.reddit.com/r/Brooklyn/comments/tszip9/brooklyn_starbucks_workers_and_socialists_join/,Brooklyn Starbucks Workers and Socialists Join Forces to Fight Union-Busting,/r/Brooklyn/comments/tszip9/brooklyn_starbucks_workers_and_socialists_join/i31uwox/,1,r/Brooklyn,0,1
This is so awesome!! 🌟,t2_faloz3hg,technicolor-quartz,0,1648858370.0,0,t1_i31ufld,i31ufld,True,xwhy,t3_tu5arx,https://www.reddit.com/r/Brooklyn/comments/tu5arx/walking_brooklyn_janmar_2022_since_may_2019/,"Walking Brooklyn, Jan-Mar 2022 & since May 2019",/r/Brooklyn/comments/tu5arx/walking_brooklyn_janmar_2022_since_may_2019/i31ufld/,5,r/Brooklyn,0,5
"They arent going to be renewing your lease anyway...just tell them to sue you and sort it out in court.

With the estimates from other contractors that show they are ripping you off.",t2_hp8ypk60,ambushbugger,0,1648858075.0,0,t1_i31tug0,i31tug0,True,[deleted],t3_tu1glk,https://www.reddit.com/r/Brooklyn/comments/tu1glk/charged_6000_for_apt_door_replacement/,"Charged $6,000 for apt door replacement",/r/Brooklyn/comments/tu1glk/charged_6000_for_apt_door_replacement/i31tug0/,2,r/Brooklyn,0,2
Also a cop in LI,t2_76qua,Ant-honey,0,1648858021.0,0,t1_i31tqo7,i31tqo7,False,CurrentJealous8132,t3_ttsdf3,https://www.reddit.com/r/Brooklyn/comments/ttsdf3/12_year_old_murdered/,12 Year old murdered,/r/Brooklyn/comments/ttsdf3/12_year_old_murdered/i31tqo7/,3,r/Brooklyn,0,3
Haven't seen Van Leeuwen mentioned yet!,t2_3mowkqgc,jaded_toast,0,1648857765.0,0,t1_i31t86j,i31t86j,True,Wholesome100and7,t3_ttnnod,https://www.reddit.com/r/Brooklyn/comments/ttnnod/best_place_in_brooklyn_to_grab_a_milkshake/,Best place in Brooklyn to grab a milkshake?,/r/Brooklyn/comments/ttnnod/best_place_in_brooklyn_to_grab_a_milkshake/i31t86j/,1,r/Brooklyn,0,1
"Answers to Frequently Asked Questions:

The blank map was pieced together from Google Maps screenshots (which is why Greenpoint was appended later. Oops)

I update this is MS Paint because it's on my machine and does the job.

The colors have no meaning except each is a different route. I gave up on trying to organize them.

I sometimes use Map My Walk when I remember to. I stopped for a while when my old phone couldn't handle it anymore.

Thank you to everyone in r/Brooklyn who has encouraged this for the past 3 years.",t2_3c535,xwhy,0,1648857730.0,0,t1_i31t5o2,i31t5o2,True,xwhy,t3_tu5arx,https://www.reddit.com/r/Brooklyn/comments/tu5arx/walking_brooklyn_janmar_2022_since_may_2019/,"Walking Brooklyn, Jan-Mar 2022 & since May 2019",/r/Brooklyn/comments/tu5arx/walking_brooklyn_janmar_2022_since_may_2019/i31t5o2/,9,r/Brooklyn,0,9
"if the damage assessed cost more than your security deposit you’re losing the whole thing. lmao don’t try and game the system, that’s scamming.

also, it’s not even debatable l, you even said what it would be, it’s totally gross negligence. fire department being “overly” cautious is exactly how they should be. if it turned into a fire, tenant would be responsible for a lot more than just a metal door which aren’t cheap. plus labor which means you need to used a licensed contractor, not just you fixing the lock and thinking it’s okay, the landlord would lose coding on the building if he allowed that, which also brings in the cost of paying for inspection, making sure the door was installed properly.

tenants always just think it’s just a cost of a door and nothing more, a lot more costs associated than just replacing a door and lock lol. 

the landlord not taking the action they took would result in a violation. off of the back of their tenant’s gross negligence.",t2_85upt9dj,Specialist_Ad_9419,1,1648857645.0,0,t1_i31szor,i31szor,False,[deleted],t3_tu1glk,https://www.reddit.com/r/Brooklyn/comments/tu1glk/charged_6000_for_apt_door_replacement/,"Charged $6,000 for apt door replacement",/r/Brooklyn/comments/tu1glk/charged_6000_for_apt_door_replacement/i31szor/,1,r/Brooklyn,0,1
lol,t2_8ajj06yo,jockjams2,0,1648857307.0,0,t1_i31sbp9,i31sbp9,False,Patterson9191717,t3_tszip9,https://www.reddit.com/r/Brooklyn/comments/tszip9/brooklyn_starbucks_workers_and_socialists_join/,Brooklyn Starbucks Workers and Socialists Join Forces to Fight Union-Busting,/r/Brooklyn/comments/tszip9/brooklyn_starbucks_workers_and_socialists_join/i31sbp9/,1,r/Brooklyn,0,1
At least three safes,t2_faloz3hg,technicolor-quartz,0,1648857140.0,0,t1_i31rzv3,i31rzv3,True,CollectionRadiant372,t3_tu4kca,https://www.reddit.com/r/Brooklyn/comments/tu4kca/hello_guys_please_tell_me_how_safe_is_brooklyn/,"Hello guys, please tell me how safe is brooklyn ?",/r/Brooklyn/comments/tu4kca/hello_guys_please_tell_me_how_safe_is_brooklyn/i31rzv3/,7,r/Brooklyn,0,7
"This is reddit, of course I don't know.

This isn't an insurance claim so that isn't relevant. Anyways don't let the landlord strongarm you tenant laws are favorable in NYC.",t2_60uak,Foxtrot56,0,1648857119.0,0,t1_i31ry8n,i31ry8n,False,[deleted],t3_tu1glk,https://www.reddit.com/r/Brooklyn/comments/tu1glk/charged_6000_for_apt_door_replacement/,"Charged $6,000 for apt door replacement",/r/Brooklyn/comments/tu1glk/charged_6000_for_apt_door_replacement/i31ry8n/,1,r/Brooklyn,0,1
"Brooklyn is big, it depends on where you are. You should be fine.

There’s also a 65% chance this is a troll question",t2_5bi0tziv,pfrank6048,0,1648856841.0,0,t1_i31rdv8,i31rdv8,True,CollectionRadiant372,t3_tu4kca,https://www.reddit.com/r/Brooklyn/comments/tu4kca/hello_guys_please_tell_me_how_safe_is_brooklyn/,"Hello guys, please tell me how safe is brooklyn ?",/r/Brooklyn/comments/tu4kca/hello_guys_please_tell_me_how_safe_is_brooklyn/i31rdv8/,12,r/Brooklyn,0,12
Thank you that is really reassuring advice. What would I want to say in the letter?,t2_9wa9zz2y,Lopsided_Ad5913,0,1648856685.0,0,t1_i31r2m3,i31r2m3,False,[deleted],t3_tu1glk,https://www.reddit.com/r/Brooklyn/comments/tu1glk/charged_6000_for_apt_door_replacement/,"Charged $6,000 for apt door replacement",/r/Brooklyn/comments/tu1glk/charged_6000_for_apt_door_replacement/i31r2m3/,4,r/Brooklyn,0,4
"Should pay about $150-$175 for a hollow metal 90 minute fire rated door at that standard size. Door alone. Other things needed maybe $150. Add some labor. 

You’re getting hosed.",t2_63gad09v,ChevyLevy1225,0,1648856655.0,0,t1_i31r0f6,i31r0f6,True,[deleted],t3_tu1glk,https://www.reddit.com/r/Brooklyn/comments/tu1glk/charged_6000_for_apt_door_replacement/,"Charged $6,000 for apt door replacement",/r/Brooklyn/comments/tu1glk/charged_6000_for_apt_door_replacement/i31r0f6/,3,r/Brooklyn,0,3
Brooklyn is kinda big. Where?,t2_bivtzi4p,akohhh,0,1648856432.0,0,t1_i31qkd7,i31qkd7,True,CollectionRadiant372,t3_tu4kca,https://www.reddit.com/r/Brooklyn/comments/tu4kca/hello_guys_please_tell_me_how_safe_is_brooklyn/,"Hello guys, please tell me how safe is brooklyn ?",/r/Brooklyn/comments/tu4kca/hello_guys_please_tell_me_how_safe_is_brooklyn/i31qkd7/,6,r/Brooklyn,0,6
Different people may have different tolerance/expectations. A good rule of thumb is to listen to “Brooklyn Zoo” by ODB really loud and take it from there.,t2_5enkdpd4,thisistheredditor,0,1648856143.0,0,t1_i31pznl,i31pznl,True,CollectionRadiant372,t3_tu4kca,https://www.reddit.com/r/Brooklyn/comments/tu4kca/hello_guys_please_tell_me_how_safe_is_brooklyn/,"Hello guys, please tell me how safe is brooklyn ?",/r/Brooklyn/comments/tu4kca/hello_guys_please_tell_me_how_safe_is_brooklyn/i31pznl/,9,r/Brooklyn,0,9
Don’t come here super dangerous.,t2_dtq4krdu,Expensive-Yam-634,0,1648855985.0,0,t1_i31pny0,i31pny0,True,CollectionRadiant372,t3_tu4kca,https://www.reddit.com/r/Brooklyn/comments/tu4kca/hello_guys_please_tell_me_how_safe_is_brooklyn/,"Hello guys, please tell me how safe is brooklyn ?",/r/Brooklyn/comments/tu4kca/hello_guys_please_tell_me_how_safe_is_brooklyn/i31pny0/,17,r/Brooklyn,0,17
Very safe now that they put a safety net underneath it.,t2_39a4r5dq,djmuaddib,0,1648855847.0,0,t1_i31pdur,i31pdur,True,CollectionRadiant372,t3_tu4kca,https://www.reddit.com/r/Brooklyn/comments/tu4kca/hello_guys_please_tell_me_how_safe_is_brooklyn/,"Hello guys, please tell me how safe is brooklyn ?",/r/Brooklyn/comments/tu4kca/hello_guys_please_tell_me_how_safe_is_brooklyn/i31pdur/,19,r/Brooklyn,0,19
"Do you know this or are you assuming?


Untangling where the responsibility belongs in a rental home fire can be complicated. The fire’s damage requires multiple insurance policies. Understanding the terms of your insurance policy is the key to knowing what to expect in the event of a fire. It’s possible that both your insurance and the insurance purchased by your tenants will pay for different types of damage from the same fire. The breakdown of who pays for fire damage in a rental home may include these parties.

Landlord/Owner’s Insurer

As a property owner, you are responsible for fire damage related to the structure of the building. Your should cover damage to the building, including plumbing, electrical, and even appliances provided with the rental home like a stove and refrigerator. Thus, check your policy to ensure appliance coverage.

Tenant’s Insurer

As a landlord, you are not responsible for your tenants’ possessions. That’s why it’s important for your tenants to purchase a renter’s insurance policy to protect their possessions. Your tenant’s insurer will cover damages to all covered belongings like personal items, furniture, electronics, and clothing. It’s always a good idea to purchase rental insurance with your rental agreements when a tenant moves in.

Renter’s Insurance

If your tenant fails to purchase renter’s insurance, they are responsible for the cost of their damaged belongings. Additionally, if the tenant (or a guest of the tenant) is responsible for starting the fire, they may be responsible for paying the landlord’s deductible on damages to the building.

Landlord Insurance

If your negligence caused the fire, and you have no liability insurance, you’ll be paying out-of-pocket if your tenant decides to sue. Additionally, if your insurance has gaps that leave you without the proper coverage, you may be stuck paying for all the damage yourself.",t2_3tsad,bottom,0,1648855753.0,0,t1_i31p6v8,i31p6v8,False,[deleted],t3_tu1glk,https://www.reddit.com/r/Brooklyn/comments/tu1glk/charged_6000_for_apt_door_replacement/,"Charged $6,000 for apt door replacement",/r/Brooklyn/comments/tu1glk/charged_6000_for_apt_door_replacement/i31p6v8/,3,r/Brooklyn,0,3
"I am currently there. 
Hold on, let me look out the window…


Yup. All clear.

Really nice sunset, too. Subtle but still lovely.",t2_cpk1bzcp,_Maxolotl,0,1648855734.0,0,t1_i31p5ju,i31p5ju,False,CollectionRadiant372,t3_tu4kca,https://www.reddit.com/r/Brooklyn/comments/tu4kca/hello_guys_please_tell_me_how_safe_is_brooklyn/,"Hello guys, please tell me how safe is brooklyn ?",/r/Brooklyn/comments/tu4kca/hello_guys_please_tell_me_how_safe_is_brooklyn/i31p5ju/,19,r/Brooklyn,0,19
I ve heard lots of rumors that is not ..have you ever lived there ?,t2_cr9mw48y,CollectionRadiant372,0,1648855634.0,0,t1_i31oy28,i31oy28,False,CollectionRadiant372,t3_tu4kca,https://www.reddit.com/r/Brooklyn/comments/tu4kca/hello_guys_please_tell_me_how_safe_is_brooklyn/,"Hello guys, please tell me how safe is brooklyn ?",/r/Brooklyn/comments/tu4kca/hello_guys_please_tell_me_how_safe_is_brooklyn/i31oy28/,-6,r/Brooklyn,0,-6
It’s fine.,t2_cpk1bzcp,_Maxolotl,0,1648855354.0,0,t1_i31odf8,i31odf8,True,CollectionRadiant372,t3_tu4kca,https://www.reddit.com/r/Brooklyn/comments/tu4kca/hello_guys_please_tell_me_how_safe_is_brooklyn/,"Hello guys, please tell me how safe is brooklyn ?",/r/Brooklyn/comments/tu4kca/hello_guys_please_tell_me_how_safe_is_brooklyn/i31odf8/,6,r/Brooklyn,0,6
"damage is usually the tenant’s responsibility

it’s like the fdny breaking your car window to get to fire hydrant. same issue. tenant almost had a fire in their apt, fire broke down door, tenant is responsible for damage.",t2_85upt9dj,Specialist_Ad_9419,0,1648854990.0,0,t1_i31nm86,i31nm86,False,[deleted],t3_tu1glk,https://www.reddit.com/r/Brooklyn/comments/tu1glk/charged_6000_for_apt_door_replacement/,"Charged $6,000 for apt door replacement",/r/Brooklyn/comments/tu1glk/charged_6000_for_apt_door_replacement/i31nm86/,2,r/Brooklyn,0,2
"So admitting fault here isn’t terrible… sounds like you admitted to leaving the stove on not prying the door nor repair work nor accepting the bill. 

If I were you I would offer the “generous amount of $500 for good faith” you are here because $6000 sounds like a mistake by a magnitude and you aren’t wrong… 

If I were a scummy landlord with a buddy who works on doors I’d charge $6000 in hopes you’d pay. I hate to say it but most of the time pushing back with a properly worded certified letter and boom you are paying $500 not $6000. Best of luck to you and I really hope for a quick resolution. 

Also you aren’t the first.",t2_13dfb9r6,mountainsandmuggles,0,1648854912.0,0,t1_i31nggn,i31nggn,True,[deleted],t3_tu1glk,https://www.reddit.com/r/Brooklyn/comments/tu1glk/charged_6000_for_apt_door_replacement/,"Charged $6,000 for apt door replacement",/r/Brooklyn/comments/tu1glk/charged_6000_for_apt_door_replacement/i31nggn/,12,r/Brooklyn,0,12
What a wholesome question (user name checks out),t2_erc2ayvi,Far_Cryptographer293,0,1648854624.0,0,t1_i31mv1l,i31mv1l,True,Wholesome100and7,t3_ttnnod,https://www.reddit.com/r/Brooklyn/comments/ttnnod/best_place_in_brooklyn_to_grab_a_milkshake/,Best place in Brooklyn to grab a milkshake?,/r/Brooklyn/comments/ttnnod/best_place_in_brooklyn_to_grab_a_milkshake/i31mv1l/,2,r/Brooklyn,0,2
"I would think unless you received some very specific or custom door that the most you'd expect to pay would be $2k, and that would be considered the typical limit for the apartment complex 'fleecing' markup.

This should have been delivered by a guy with a gun and a mask - you were robbed.",t2_tz9b2,yiannistheman,0,1648854560.0,0,t1_i31mqht,i31mqht,True,[deleted],t3_tu1glk,https://www.reddit.com/r/Brooklyn/comments/tu1glk/charged_6000_for_apt_door_replacement/,"Charged $6,000 for apt door replacement",/r/Brooklyn/comments/tu1glk/charged_6000_for_apt_door_replacement/i31mqht/,4,r/Brooklyn,0,4
">in a lot of places people realize it's a spiritual protector of the home

I mean it's....definitely not that.",t2_xvrsh,SheketBevakaSTFU,0,1648854529.0,0,t1_i31mo6u,i31mo6u,False,Jazzlike_Expert,t3_ttc15x,https://www.reddit.com/r/Brooklyn/comments/ttc15x/key_holder_outside_of_apartment_door/,Key Holder Outside of Apartment Door,/r/Brooklyn/comments/ttc15x/key_holder_outside_of_apartment_door/i31mo6u/,-1,r/Brooklyn,0,-1
what should we be outraged about? it's a tragedy. it's something to be sad about. outrage is for shit we can change.,t2_31336,dredgedskeleton,0,1648854471.0,0,t1_i31mjr7,i31mjr7,False,CurrentJealous8132,t3_ttsdf3,https://www.reddit.com/r/Brooklyn/comments/ttsdf3/12_year_old_murdered/,12 Year old murdered,/r/Brooklyn/comments/ttsdf3/12_year_old_murdered/i31mjr7/,2,r/Brooklyn,0,2
https://www.myjewishlearning.com/article/mezuzah/,t2_e9kgf1hf,Pretty-Ant3355,0,1648854351.0,0,t1_i31mavj,i31mavj,False,Jazzlike_Expert,t3_ttc15x,https://www.reddit.com/r/Brooklyn/comments/ttc15x/key_holder_outside_of_apartment_door/,Key Holder Outside of Apartment Door,/r/Brooklyn/comments/ttc15x/key_holder_outside_of_apartment_door/i31mavj/,1,r/Brooklyn,0,1
"Mezuzah. It contains a portion of the Torah and is installed with a blessing. Its intention is to to be a reminder the house is a dedicated Jewish household. Some folks also think it, for lack of a better word, keeps bad vibes outside.",t2_e9kgf1hf,Pretty-Ant3355,0,1648854245.0,0,t1_i31m357,i31m357,False,Jazzlike_Expert,t3_ttc15x,https://www.reddit.com/r/Brooklyn/comments/ttc15x/key_holder_outside_of_apartment_door/,Key Holder Outside of Apartment Door,/r/Brooklyn/comments/ttc15x/key_holder_outside_of_apartment_door/i31m357/,2,r/Brooklyn,0,2
Absolutely astonished you could live in BROOKLYN for SEVEN YEARS and never learn what a mezuzah is honestly impressive Jew avoidance ability 🤣,t2_e9kgf1hf,Pretty-Ant3355,0,1648853963.0,0,t1_i31li8n,i31li8n,True,Jazzlike_Expert,t3_ttc15x,https://www.reddit.com/r/Brooklyn/comments/ttc15x/key_holder_outside_of_apartment_door/,Key Holder Outside of Apartment Door,/r/Brooklyn/comments/ttc15x/key_holder_outside_of_apartment_door/i31li8n/,2,r/Brooklyn,0,2
Seems kinda high.  Electrical work cost me about 2k via the management company.  Replacing a door for 6k seems like highway robbery,t2_lf5pexw,mr__fete,0,1648853878.0,0,t1_i31lbyc,i31lbyc,True,[deleted],t3_tu1glk,https://www.reddit.com/r/Brooklyn/comments/tu1glk/charged_6000_for_apt_door_replacement/,"Charged $6,000 for apt door replacement",/r/Brooklyn/comments/tu1glk/charged_6000_for_apt_door_replacement/i31lbyc/,4,r/Brooklyn,0,4
"Seconded, this place has great jazz and reggae, with a bunch of world music too. Friends and lovers in bedstuy is straight Caribbean music",t2_h4fj9,White_Phos,0,1648853816.0,0,t1_i31l7ff,i31l7ff,False,steveburk3,t3_ttuy4v,https://www.reddit.com/r/Brooklyn/comments/ttuy4v/best_place_in_brooklyn_for_afrocuban_music/,Best place in Brooklyn for Afro-Cuban music?,/r/Brooklyn/comments/ttuy4v/best_place_in_brooklyn_for_afrocuban_music/i31l7ff/,1,r/Brooklyn,0,1
"I work for a high-end residential GC and we occasionally replace entry doors.

You’re getting absolutely fleeced.

A kalemine (fire rated) metal apartment entry door without the frame, but machined for hardware is a few hundred bucks (these are raw though, not painted). Couple hundred bucks to paint it, the lock sets are like $100 lol

To get a cheap contractor to replace an entry door into an existing frame should be like a grand if it’s nothing fancy. *Maybe* $1,500 inc. installation, etc.

Ask for an itemized bill, get quotes for the exact same thing and talk them down. They’ll probably back off if they see you know what you’re talking about.

They, or whoever’s trying to charge you $6k for this is absolutely ripping you off, or trying to at leadt",t2_13bln0,yoitsyaboii,0,1648853689.0,0,t1_i31kxvx,i31kxvx,True,[deleted],t3_tu1glk,https://www.reddit.com/r/Brooklyn/comments/tu1glk/charged_6000_for_apt_door_replacement/,"Charged $6,000 for apt door replacement",/r/Brooklyn/comments/tu1glk/charged_6000_for_apt_door_replacement/i31kxvx/,57,r/Brooklyn,0,57
