body,author_fullname,author.name,controversiality,created,downs,fullname,id,is_root,link_author,link_id,link_permalink,link_title,permalink,score,subreddit_name_prefixed,total_awards_received,ups
"I did roofing for a summer.  Anyone who chooses to make a career of roofing deserve my respect.  I don't care if you're a cartoon mouse, if you're climbing on roofs everyday, and not spending evert night looking for a different way to make money, you're a lot tougher than I am, and anyone who doesn't see that is a fool.  The thing about fools is they're easily tricked.  If you suspect it would be an issue just send the broiest guy on your crew to talk to them.",t2_ueuyj,AndyMandalore,0,1646939182.0,0,t1_i054q56,i054q56,True,Public_Alternative31,t3_taw03c,https://www.reddit.com/r/BucksCountyPA/comments/taw03c/woman_owned_roofing_companys/,Woman owned roofing company’s,/r/BucksCountyPA/comments/taw03c/woman_owned_roofing_companys/i054q56/,2,r/BucksCountyPA,0,2
Idk it happened throughout the 90s and 2000s,t2_j2v60fpt,Cherrytoss7,0,1646933994.0,0,t1_i04r81c,i04r81c,False,fireside_blather,t3_ta7xda,https://www.reddit.com/r/BucksCountyPA/comments/ta7xda/central_bucks_west_choir_director_molested_2/,"Central Bucks West choir director molested 2 former students, DA says",/r/BucksCountyPA/comments/ta7xda/central_bucks_west_choir_director_molested_2/i04r81c/,1,r/BucksCountyPA,0,1
I would and actually need a roof replacement in warfordsburg if that's still in your coverage area.,t2_a14qkov9,Rugby_engineer07,0,1646931454.0,0,t1_i04kkmg,i04kkmg,True,Public_Alternative31,t3_taw03c,https://www.reddit.com/r/BucksCountyPA/comments/taw03c/woman_owned_roofing_companys/,Woman owned roofing company’s,/r/BucksCountyPA/comments/taw03c/woman_owned_roofing_companys/i04kkmg/,2,r/BucksCountyPA,0,2
Winters was the superintendent then.,t2_czo3afbp,melisma48,0,1646930994.0,0,t1_i04jdn4,i04jdn4,False,fireside_blather,t3_ta7xda,https://www.reddit.com/r/BucksCountyPA/comments/ta7xda/central_bucks_west_choir_director_molested_2/,"Central Bucks West choir director molested 2 former students, DA says",/r/BucksCountyPA/comments/ta7xda/central_bucks_west_choir_director_molested_2/i04jdn4/,1,r/BucksCountyPA,0,1
"As a man, I would hire a qualified woman well before I hired a qualified man.",t2_293ulu92,yodas4skin,1,1646930051.0,0,t1_i04gx6b,i04gx6b,True,Public_Alternative31,t3_taw03c,https://www.reddit.com/r/BucksCountyPA/comments/taw03c/woman_owned_roofing_companys/,Woman owned roofing company’s,/r/BucksCountyPA/comments/taw03c/woman_owned_roofing_companys/i04gx6b/,0,r/BucksCountyPA,0,0
"Sure why not.  Assuming it came with references.  I care about the work, not the gender of the owner.",t2_pin68,D-redditAvenger,0,1646927563.0,0,t1_i04altc,i04altc,True,Public_Alternative31,t3_taw03c,https://www.reddit.com/r/BucksCountyPA/comments/taw03c/woman_owned_roofing_companys/,Woman owned roofing company’s,/r/BucksCountyPA/comments/taw03c/woman_owned_roofing_companys/i04altc/,3,r/BucksCountyPA,0,3
"I had a leak in my roof last year. I called 5 different companies for quotes. 

One tried to tell me I needed a whole new roof. 3 never got back to me with quotes. The last only did because the guy they sent out runs in the same social circles that I do. 

In other words…I don’t care about your gender. I just want someone who won’t ghost me.",t2_2d4zpfy0,EmergencySundae,0,1646927381.0,0,t1_i04a5ec,i04a5ec,True,Public_Alternative31,t3_taw03c,https://www.reddit.com/r/BucksCountyPA/comments/taw03c/woman_owned_roofing_companys/,Woman owned roofing company’s,/r/BucksCountyPA/comments/taw03c/woman_owned_roofing_companys/i04a5ec/,10,r/BucksCountyPA,0,10
Yes don’t care as long as you can clearly communicate you will be in my top 3 choices.,t2_5npkj,tlgraham,0,1646925213.0,0,t1_i044tku,i044tku,True,Public_Alternative31,t3_taw03c,https://www.reddit.com/r/BucksCountyPA/comments/taw03c/woman_owned_roofing_companys/,Woman owned roofing company’s,/r/BucksCountyPA/comments/taw03c/woman_owned_roofing_companys/i044tku/,2,r/BucksCountyPA,0,2
"Absolutely. But as others have said, just showing up when you say you will and then getting back with a quote within a week will put you ahead of 90% of the folks we’ve dealt with lately.

On the entrepreneurial side, what I really want is a single company to take over all of my exterior needs. Charge me some amount per month and keep everything looking great. (Pull weeds, touch up paint, rehang a shutter, power wash the front walk, clean out the gutters, etc.). Then for the bigger items or anything requiring selection (new roof, new mailbox, etc), send me a quote and a timeframe. This would make my life so much easier.

I’d love the same for the house interior too. Maybe a house flipper who can walk through and identify all the things that should be fixed, replaced, repainted, deep cleaned, etc (possibly also with a running list from us) and then make it happen.

It’s exhausting to try to identify all these things and then deal with 30 different contractors who don’t show. I want one or two people I can trust who will do all that mental work, take care of the little stuff, and call in specialists if they need them.",t2_292ol,meara,0,1646923681.0,0,t1_i0417ul,i0417ul,True,Public_Alternative31,t3_taw03c,https://www.reddit.com/r/BucksCountyPA/comments/taw03c/woman_owned_roofing_companys/,Woman owned roofing company’s,/r/BucksCountyPA/comments/taw03c/woman_owned_roofing_companys/i0417ul/,8,r/BucksCountyPA,0,8
Are you looking for local shingles in your area?,t2_x0nm4,mindgame15,0,1646923625.0,0,t1_i04133m,i04133m,True,Public_Alternative31,t3_taw03c,https://www.reddit.com/r/BucksCountyPA/comments/taw03c/woman_owned_roofing_companys/,Woman owned roofing company’s,/r/BucksCountyPA/comments/taw03c/woman_owned_roofing_companys/i04133m/,5,r/BucksCountyPA,0,5
True,t2_bbk02v5o,eMPereb,0,1646923194.0,0,t1_i0403h9,i0403h9,False,fireside_blather,t3_ta7xda,https://www.reddit.com/r/BucksCountyPA/comments/ta7xda/central_bucks_west_choir_director_molested_2/,"Central Bucks West choir director molested 2 former students, DA says",/r/BucksCountyPA/comments/ta7xda/central_bucks_west_choir_director_molested_2/i0403h9/,1,r/BucksCountyPA,0,1
"Fellow Bucks County business owner here. You're asking the wrong audience. 

Reddit, especially this subreddit, is more progressive than the general public at large. I'd welcome a woman into the traditional blue collar space. I'm in printing (blueprints, signs, banners, etc.) and work with contractors all day long and based on conversations I've had, would suggest your roadblock is going to be 'macho-men' homeowners.

However, I can counter by saying that there's a lot of women who run the household in Bucks, so with a really good marketing plan, you could be very successful. Take a look at [Girls Auto Clinic](https://www.girlsautoclinic.com/) in Upper Darby. They were able to garner national attention for leaning hard into gender by creating a 'perceived trust safe-space' for women (and men) to have their vehicles serviced by women and the stigma of being taken advantage of absolutely exists in roofing (and other contractor trades/professions). 

So I think it's certainly possible, but you'll need a super strong business plan with an aggressive marketing plan. The other option you have would be to be low key about being a woman owned business and let your integrity build and take referral work and handle it more organically, like a traditional business plan. But try not to be discouraged if you run into the meat heads and lose a bid because of your gender.

I wish you the best of luck!",t2_331h8,MDKAOD,0,1646923016.0,0,t1_i03zoxv,i03zoxv,True,Public_Alternative31,t3_taw03c,https://www.reddit.com/r/BucksCountyPA/comments/taw03c/woman_owned_roofing_companys/,Woman owned roofing company’s,/r/BucksCountyPA/comments/taw03c/woman_owned_roofing_companys/i03zoxv/,19,r/BucksCountyPA,0,19
[2 posts ago this was already posted.](https://www.reddit.com/r/BucksCountyPA/comments/ta7xda/central_bucks_west_choir_director_molested_2/),t2_139t0a,Thecrawsome,0,1646920690.0,0,t1_i03unnq,i03unnq,True,[deleted],t3_tayr80,https://www.reddit.com/r/BucksCountyPA/comments/tayr80/former_cb_west_choir_director_joseph_ohrt_groped/,Former CB West Choir Director Joseph Ohrt Groped Two of his Former Students. District Allowed him to Change Schools and Continue Teaching.,/r/BucksCountyPA/comments/tayr80/former_cb_west_choir_director_joseph_ohrt_groped/i03unnq/,1,r/BucksCountyPA,0,1
Actually very refreshing to see. I would sure give a woman owned business a shot to bid.  Question is do you have some women workers as well or you just hire men for the actual job.   Not that it makes a difference but interested in seeing if you give an opportunity for woman workers.,t2_ao5avq0h,Tycir1,0,1646919916.0,0,t1_i03t1ez,i03t1ez,True,Public_Alternative31,t3_taw03c,https://www.reddit.com/r/BucksCountyPA/comments/taw03c/woman_owned_roofing_companys/,Woman owned roofing company’s,/r/BucksCountyPA/comments/taw03c/woman_owned_roofing_companys/i03t1ez/,5,r/BucksCountyPA,0,5
Yeah Dr Laws is really on the hook here.,t2_j2v60fpt,Cherrytoss7,0,1646919444.0,0,t1_i03s34b,i03s34b,False,fireside_blather,t3_ta7xda,https://www.reddit.com/r/BucksCountyPA/comments/ta7xda/central_bucks_west_choir_director_molested_2/,"Central Bucks West choir director molested 2 former students, DA says",/r/BucksCountyPA/comments/ta7xda/central_bucks_west_choir_director_molested_2/i03s34b/,1,r/BucksCountyPA,0,1
"My mother is in need of some repairs on her roof in Middlesex county, NJ. Do you travel that far?",t2_fslvodfn,picklesandolives_,0,1646918744.0,0,t1_i03qpwp,i03qpwp,True,Public_Alternative31,t3_taw03c,https://www.reddit.com/r/BucksCountyPA/comments/taw03c/woman_owned_roofing_companys/,Woman owned roofing company’s,/r/BucksCountyPA/comments/taw03c/woman_owned_roofing_companys/i03qpwp/,2,r/BucksCountyPA,0,2
And don't just show up and wander around your property before knocking.,t2_b1wx4lyc,mladydwinter,0,1646917472.0,0,t1_i03od1s,i03od1s,False,Public_Alternative31,t3_taw03c,https://www.reddit.com/r/BucksCountyPA/comments/taw03c/woman_owned_roofing_companys/,Woman owned roofing company’s,/r/BucksCountyPA/comments/taw03c/woman_owned_roofing_companys/i03od1s/,12,r/BucksCountyPA,0,12
Please and thank you.,t2_b1wx4lyc,mladydwinter,0,1646917431.0,0,t1_i03oabg,i03oabg,True,Public_Alternative31,t3_taw03c,https://www.reddit.com/r/BucksCountyPA/comments/taw03c/woman_owned_roofing_companys/,Woman owned roofing company’s,/r/BucksCountyPA/comments/taw03c/woman_owned_roofing_companys/i03oabg/,2,r/BucksCountyPA,0,2
Does anyone know if there's a reopening date planned?,t2_8a68ii6t,c0ldil0cks,0,1646914779.0,0,t1_i03jr74,i03jr74,True,oliver0729,t3_rmfd5i,https://www.reddit.com/r/BucksCountyPA/comments/rmfd5i/anyone_know_true_reason_behind_starbucks_newtown/,Anyone Know True Reason Behind Starbucks Newtown Closing?,/r/BucksCountyPA/comments/rmfd5i/anyone_know_true_reason_behind_starbucks_newtown/i03jr74/,3,r/BucksCountyPA,0,3
"Yes, do you do slate?",t2_48npessa,RDGCompany,0,1646914525.0,0,t1_i03jcnb,i03jcnb,True,Public_Alternative31,t3_taw03c,https://www.reddit.com/r/BucksCountyPA/comments/taw03c/woman_owned_roofing_companys/,Woman owned roofing company’s,/r/BucksCountyPA/comments/taw03c/woman_owned_roofing_companys/i03jcnb/,5,r/BucksCountyPA,0,5
"If they show up on time, already ahead of the game.",t2_5o750xzx,gard-r,0,1646910837.0,0,t1_i03e50q,i03e50q,True,Public_Alternative31,t3_taw03c,https://www.reddit.com/r/BucksCountyPA/comments/taw03c/woman_owned_roofing_companys/,Woman owned roofing company’s,/r/BucksCountyPA/comments/taw03c/woman_owned_roofing_companys/i03e50q/,21,r/BucksCountyPA,0,21
People keep voting against their own interests in the county and go all shocked Pikachu face when they get what they voted for.  It's getting rather old.  How many times do you have to touch a hot stove before it sinks in that you're just going to get burned?,t2_4ar2h,Ghstfce,0,1646896847.0,0,t1_i02x003,i02x003,True,SharkTank215,t3_taidha,https://www.reddit.com/r/BucksCountyPA/comments/taidha/editorial_nancy_santacecilia_should_take_a_minute/,Editorial: Nancy Santacecilia should take a minute,/r/BucksCountyPA/comments/taidha/editorial_nancy_santacecilia_should_take_a_minute/i02x003/,10,r/BucksCountyPA,0,10
"Well, a guy can dream~~~",t2_4i04pvz1,fireside_blather,0,1646882613.0,0,t1_i0293fy,i0293fy,False,fireside_blather,t3_ta7xda,https://www.reddit.com/r/BucksCountyPA/comments/ta7xda/central_bucks_west_choir_director_molested_2/,"Central Bucks West choir director molested 2 former students, DA says",/r/BucksCountyPA/comments/ta7xda/central_bucks_west_choir_director_molested_2/i0293fy/,2,r/BucksCountyPA,0,2
Hahhaaa wrong!,t2_bbk02v5o,eMPereb,0,1646878900.0,0,t1_i0213dl,i0213dl,False,fireside_blather,t3_ta7xda,https://www.reddit.com/r/BucksCountyPA/comments/ta7xda/central_bucks_west_choir_director_molested_2/,"Central Bucks West choir director molested 2 former students, DA says",/r/BucksCountyPA/comments/ta7xda/central_bucks_west_choir_director_molested_2/i0213dl/,1,r/BucksCountyPA,0,1
This is the way😞,t2_bbk02v5o,eMPereb,0,1646878883.0,0,t1_i021232,i021232,False,fireside_blather,t3_ta7xda,https://www.reddit.com/r/BucksCountyPA/comments/ta7xda/central_bucks_west_choir_director_molested_2/,"Central Bucks West choir director molested 2 former students, DA says",/r/BucksCountyPA/comments/ta7xda/central_bucks_west_choir_director_molested_2/i021232/,1,r/BucksCountyPA,0,1
*Two more,t2_64x0j,zvika,0,1646871313.0,0,t1_i01kfyi,i01kfyi,True,fireside_blather,t3_ta7xda,https://www.reddit.com/r/BucksCountyPA/comments/ta7xda/central_bucks_west_choir_director_molested_2/,"Central Bucks West choir director molested 2 former students, DA says",/r/BucksCountyPA/comments/ta7xda/central_bucks_west_choir_director_molested_2/i01kfyi/,1,r/BucksCountyPA,0,1
"This woman, Nancy Santacecelia, is a liar and a coward.",t2_eh1h9jq9,DrSirMadam,0,1646862435.0,0,t1_i00yy2p,i00yy2p,True,SharkTank215,t3_taidha,https://www.reddit.com/r/BucksCountyPA/comments/taidha/editorial_nancy_santacecilia_should_take_a_minute/,Editorial: Nancy Santacecilia should take a minute,/r/BucksCountyPA/comments/taidha/editorial_nancy_santacecilia_should_take_a_minute/i00yy2p/,5,r/BucksCountyPA,0,5
"call LSA in Horsham,pa 
https://lsaweb.com/",t2_63kyznek,Karlando113,0,1646859510.0,0,t1_i00r71k,i00r71k,False,Thecrawsome,t3_t9z1on,https://www.reddit.com/r/BucksCountyPA/comments/t9z1on/ukrainian_translators_needed_at_st_judes/,Ukrainian translators needed at St Jude's!,/r/BucksCountyPA/comments/t9z1on/ukrainian_translators_needed_at_st_judes/i00r71k/,2,r/BucksCountyPA,0,2
We found places for some stuff.  Other stuff will be taken by waste management.,t2_2fad4ts1,gmbjr12,0,1646859508.0,0,t1_i00r6wh,i00r6wh,False,gmbjr12,t3_taaq9g,https://www.reddit.com/r/BucksCountyPA/comments/taaq9g/greendrop_doesnt_ring_doorbells/,Greendrop doesnt ring doorbells,/r/BucksCountyPA/comments/taaq9g/greendrop_doesnt_ring_doorbells/i00r6wh/,1,r/BucksCountyPA,0,1
This reminds me to check the sex offender's registry to see how many more people are on it near me.,t2_fyg8t,RainyReese,0,1646850195.0,0,t1_i003c6c,i003c6c,True,fireside_blather,t3_ta7xda,https://www.reddit.com/r/BucksCountyPA/comments/ta7xda/central_bucks_west_choir_director_molested_2/,"Central Bucks West choir director molested 2 former students, DA says",/r/BucksCountyPA/comments/ta7xda/central_bucks_west_choir_director_molested_2/i003c6c/,2,r/BucksCountyPA,0,2
That's the worst case scenario. Hopefully these administrators will be held accountable for such malfeasance.,t2_4i04pvz1,fireside_blather,0,1646841972.0,0,t1_hzzi7lm,hzzi7lm,False,fireside_blather,t3_ta7xda,https://www.reddit.com/r/BucksCountyPA/comments/ta7xda/central_bucks_west_choir_director_molested_2/,"Central Bucks West choir director molested 2 former students, DA says",/r/BucksCountyPA/comments/ta7xda/central_bucks_west_choir_director_molested_2/hzzi7lm/,7,r/BucksCountyPA,0,7
"The worst part about this is this happened at the elementary school. And the district, fully well knowing this, instead of getting rid of him, moved him on up to the high school. 

CBSD becomes trashier with every passing second, it seems.",t2_88o7n,Zashiony,0,1646841867.0,0,t1_hzzhy4i,hzzhy4i,True,fireside_blather,t3_ta7xda,https://www.reddit.com/r/BucksCountyPA/comments/ta7xda/central_bucks_west_choir_director_molested_2/,"Central Bucks West choir director molested 2 former students, DA says",/r/BucksCountyPA/comments/ta7xda/central_bucks_west_choir_director_molested_2/hzzhy4i/,28,r/BucksCountyPA,0,28
Jesus,t2_e02vlh5m,ndjuka,0,1646837107.0,0,t1_hzz6f0l,hzz6f0l,True,fireside_blather,t3_ta7xda,https://www.reddit.com/r/BucksCountyPA/comments/ta7xda/central_bucks_west_choir_director_molested_2/,"Central Bucks West choir director molested 2 former students, DA says",/r/BucksCountyPA/comments/ta7xda/central_bucks_west_choir_director_molested_2/hzz6f0l/,1,r/BucksCountyPA,0,1
Looks like a typical wanker,t2_2fad4ts1,gmbjr12,0,1646833315.0,0,t1_hzyy9wa,hzyy9wa,True,fireside_blather,t3_ta7xda,https://www.reddit.com/r/BucksCountyPA/comments/ta7xda/central_bucks_west_choir_director_molested_2/,"Central Bucks West choir director molested 2 former students, DA says",/r/BucksCountyPA/comments/ta7xda/central_bucks_west_choir_director_molested_2/hzyy9wa/,5,r/BucksCountyPA,0,5
DM here !!!!   But not for DND. :),t2_ao5avq0h,Tycir1,0,1646828715.0,0,t1_hzyq14n,hzyq14n,True,ploobadoof,t3_t9neen,https://www.reddit.com/r/BucksCountyPA/comments/t9neen/does_anyone_play_dd_in_this_county_where_can_i/,Does anyone play D&D in this county? Where can I find a professional Dungeon Master?,/r/BucksCountyPA/comments/t9neen/does_anyone_play_dd_in_this_county_where_can_i/hzyq14n/,1,r/BucksCountyPA,0,1
Just offered 20k over on 350k. Got beat by someone who threw down 420k.,t2_5xqnh,friedchickenwaffles,0,1646827675.0,0,t1_hzyoewk,hzyoewk,False,LetsEatPhilly,t3_t1fent,https://www.reddit.com/r/BucksCountyPA/comments/t1fent/house_lead_please/,"House lead, please?",/r/BucksCountyPA/comments/t1fent/house_lead_please/hzyoewk/,1,r/BucksCountyPA,0,1
Run for office. Slash the taxes.,t2_5xqnh,friedchickenwaffles,0,1646827407.0,0,t1_hzyo070,hzyo070,False,bontakun82,t3_t3rwmw,https://www.reddit.com/r/BucksCountyPA/comments/t3rwmw/car_eating_pot_holes/,Car eating pot holes,/r/BucksCountyPA/comments/t3rwmw/car_eating_pot_holes/hzyo070/,1,r/BucksCountyPA,0,1
Xposting from /r/Philadelphia.,t2_139t0a,Thecrawsome,0,1646798340.0,0,t1_hzxj191,hzxj191,True,Thecrawsome,t3_t9z1on,https://www.reddit.com/r/BucksCountyPA/comments/t9z1on/ukrainian_translators_needed_at_st_judes/,Ukrainian translators needed at St Jude's!,/r/BucksCountyPA/comments/t9z1on/ukrainian_translators_needed_at_st_judes/hzxj191/,5,r/BucksCountyPA,0,5
I don’t know what the market rate is for a nerd that knows a lot about ogres and pixies. I hope they use Venmo. Imagined this as a Zoom meeting/ Discord  style game group.,t2_9tlbw,ploobadoof,0,1646797891.0,0,t1_hzxi4mp,hzxi4mp,False,ploobadoof,t3_t9neen,https://www.reddit.com/r/BucksCountyPA/comments/t9neen/does_anyone_play_dd_in_this_county_where_can_i/,Does anyone play D&D in this county? Where can I find a professional Dungeon Master?,/r/BucksCountyPA/comments/t9neen/does_anyone_play_dd_in_this_county_where_can_i/hzxi4mp/,1,r/BucksCountyPA,0,1
"How much are you paying?

(Serious question, I might know some people)",t2_6ezex,Shaysdays,0,1646794055.0,0,t1_hzxa1mx,hzxa1mx,True,ploobadoof,t3_t9neen,https://www.reddit.com/r/BucksCountyPA/comments/t9neen/does_anyone_play_dd_in_this_county_where_can_i/,Does anyone play D&D in this county? Where can I find a professional Dungeon Master?,/r/BucksCountyPA/comments/t9neen/does_anyone_play_dd_in_this_county_where_can_i/hzxa1mx/,0,r/BucksCountyPA,0,0
"That sounds awesome.  The next time I'm out east, I may hire hire him just to try his mead.",t2_25szso00,Tim0281,0,1646786768.0,0,t1_hzwtwft,hzwtwft,False,ploobadoof,t3_t9neen,https://www.reddit.com/r/BucksCountyPA/comments/t9neen/does_anyone_play_dd_in_this_county_where_can_i/,Does anyone play D&D in this county? Where can I find a professional Dungeon Master?,/r/BucksCountyPA/comments/t9neen/does_anyone_play_dd_in_this_county_where_can_i/hzwtwft/,0,r/BucksCountyPA,0,0
Please post this on the sticky post for businesses.,t2_139t0a,Thecrawsome,0,1646779123.0,0,t1_hzwchvs,hzwchvs,True,chunt5009,t3_t9nvu8,https://www.reddit.com/r/BucksCountyPA/comments/t9nvu8/looking_for_people_willing_to_work_in_bensalem/,Looking for people willing to work in Bensalem,/r/BucksCountyPA/comments/t9nvu8/looking_for_people_willing_to_work_in_bensalem/hzwchvs/,1,r/BucksCountyPA,0,1
They have DND several times a week. If your interested they have an active discord that would let you get involved.,t2_4srpm8zy,FireballsDontCrit,0,1646778341.0,0,t1_hzwaomz,hzwaomz,False,ploobadoof,t3_t9neen,https://www.reddit.com/r/BucksCountyPA/comments/t9neen/does_anyone_play_dd_in_this_county_where_can_i/,Does anyone play D&D in this county? Where can I find a professional Dungeon Master?,/r/BucksCountyPA/comments/t9neen/does_anyone_play_dd_in_this_county_where_can_i/hzwaomz/,1,r/BucksCountyPA,0,1
How nice!,t2_64x0j,zvika,0,1646777150.0,0,t1_hzw8b0a,hzw8b0a,False,ploobadoof,t3_t9neen,https://www.reddit.com/r/BucksCountyPA/comments/t9neen/does_anyone_play_dd_in_this_county_where_can_i/,Does anyone play D&D in this county? Where can I find a professional Dungeon Master?,/r/BucksCountyPA/comments/t9neen/does_anyone_play_dd_in_this_county_where_can_i/hzw8b0a/,2,r/BucksCountyPA,0,2
They got married 6 months ago. The ceremony was lovely. He even made a dnd joke in his vows.,t2_164qk3,Bronzeshadow,0,1646772612.0,0,t1_hzvxb3q,hzvxb3q,False,ploobadoof,t3_t9neen,https://www.reddit.com/r/BucksCountyPA/comments/t9neen/does_anyone_play_dd_in_this_county_where_can_i/,Does anyone play D&D in this county? Where can I find a professional Dungeon Master?,/r/BucksCountyPA/comments/t9neen/does_anyone_play_dd_in_this_county_where_can_i/hzvxb3q/,2,r/BucksCountyPA,0,2
My friends run one over roll20 and discord. Thats an alternative option as well.,t2_8acko,HaiImLoki,0,1646772440.0,0,t1_hzvwuji,hzvwuji,True,ploobadoof,t3_t9neen,https://www.reddit.com/r/BucksCountyPA/comments/t9neen/does_anyone_play_dd_in_this_county_where_can_i/,Does anyone play D&D in this county? Where can I find a professional Dungeon Master?,/r/BucksCountyPA/comments/t9neen/does_anyone_play_dd_in_this_county_where_can_i/hzvwuji/,0,r/BucksCountyPA,0,0
this would be your best response I think. LFG is an excellent store and I think they do DnD 2nights a week?,t2_8acko,HaiImLoki,0,1646772412.0,0,t1_hzvwrwf,hzvwrwf,False,ploobadoof,t3_t9neen,https://www.reddit.com/r/BucksCountyPA/comments/t9neen/does_anyone_play_dd_in_this_county_where_can_i/,Does anyone play D&D in this county? Where can I find a professional Dungeon Master?,/r/BucksCountyPA/comments/t9neen/does_anyone_play_dd_in_this_county_where_can_i/hzvwrwf/,2,r/BucksCountyPA,0,2
"Sucks for my curiosity, but she sounds like a keeper. Glad y'all had a good time =]",t2_64x0j,zvika,0,1646772218.0,0,t1_hzvw9kc,hzvw9kc,False,ploobadoof,t3_t9neen,https://www.reddit.com/r/BucksCountyPA/comments/t9neen/does_anyone_play_dd_in_this_county_where_can_i/,Does anyone play D&D in this county? Where can I find a professional Dungeon Master?,/r/BucksCountyPA/comments/t9neen/does_anyone_play_dd_in_this_county_where_can_i/hzvw9kc/,1,r/BucksCountyPA,0,1
"Sadly no, the GF pocketed the receipt and told us to just have fun.",t2_164qk3,Bronzeshadow,0,1646771615.0,0,t1_hzvuoez,hzvuoez,False,ploobadoof,t3_t9neen,https://www.reddit.com/r/BucksCountyPA/comments/t9neen/does_anyone_play_dd_in_this_county_where_can_i/,Does anyone play D&D in this county? Where can I find a professional Dungeon Master?,/r/BucksCountyPA/comments/t9neen/does_anyone_play_dd_in_this_county_where_can_i/hzvuoez/,3,r/BucksCountyPA,0,3
That's rad! Any clue how much the guy made on the session?,t2_64x0j,zvika,0,1646771306.0,0,t1_hzvtu98,hzvtu98,False,ploobadoof,t3_t9neen,https://www.reddit.com/r/BucksCountyPA/comments/t9neen/does_anyone_play_dd_in_this_county_where_can_i/,Does anyone play D&D in this county? Where can I find a professional Dungeon Master?,/r/BucksCountyPA/comments/t9neen/does_anyone_play_dd_in_this_county_where_can_i/hzvtu98/,4,r/BucksCountyPA,0,4
There is actually. A buddy of mine's girlfriend hired a professional DM for his birthday. He had a little studio in Philly that he decorated. He was basically a one-man improv theater performance with DnD as his gimmick. He dressed up and gave us homemade mead while he DM'd. It was awesome.,t2_164qk3,Bronzeshadow,0,1646770777.0,0,t1_hzvserv,hzvserv,False,ploobadoof,t3_t9neen,https://www.reddit.com/r/BucksCountyPA/comments/t9neen/does_anyone_play_dd_in_this_county_where_can_i/,Does anyone play D&D in this county? Where can I find a professional Dungeon Master?,/r/BucksCountyPA/comments/t9neen/does_anyone_play_dd_in_this_county_where_can_i/hzvserv/,9,r/BucksCountyPA,0,9
I'm in New Hope and my last group just broke up before covid. I'd be game if you want to run a homebrew style game.,t2_164qk3,Bronzeshadow,0,1646770550.0,0,t1_hzvrtjp,hzvrtjp,True,ploobadoof,t3_t9neen,https://www.reddit.com/r/BucksCountyPA/comments/t9neen/does_anyone_play_dd_in_this_county_where_can_i/,Does anyone play D&D in this county? Where can I find a professional Dungeon Master?,/r/BucksCountyPA/comments/t9neen/does_anyone_play_dd_in_this_county_where_can_i/hzvrtjp/,1,r/BucksCountyPA,0,1
