body,author_fullname,author.name,controversiality,created,downs,fullname,id,is_root,link_author,link_id,link_permalink,link_title,permalink,score,subreddit_name_prefixed,total_awards_received,ups
Is this the time we start talking about the Washington crossing bridge? Or no? No? Okay great,t2_45mtd6hw,Selym00,0,1647528511.0,0,t1_i10w0nu,i10w0nu,True,fuchsyn,t3_te5mdp,https://www.reddit.com/r/BucksCountyPA/comments/te5mdp/second_worst_bridges_in_pa/,Second Worst Bridges in PA,/r/BucksCountyPA/comments/te5mdp/second_worst_bridges_in_pa/i10w0nu/,2,r/BucksCountyPA,0,2
"Aight...

For those wondering, a 302 is apparently slang for ""involuntary commitment"", referencing Section 302 of the PA Mental Health Procedures Act. 

A person can be placed in involuntary commitment for any period of time up to, but not exceeding, 120 hours if they are reasonably believed to be a danger to themselves or others, due to either violent/harmful behaviors or inability to care for themselves. 

-=-=-=-=-=-=-=-=-=-

OP, in the past five months you've posted about a string of incidents that do not sound like the type of things that happen to an adult making reasonable, responsible decisions.

* bedbugs in your home
* getting evicted because of damages resulting from a ""burglary""
* misunderstanding elementary science and persistently defending your ignorance
* asking for help for a ""friend"" who was involuntarily committed to a mental health center because of lies

I am going to strongly advise if you/your friend are being abused and neither law enforcement or medial professionals are picking up on it, you/your friend need to get out of the situation as soon as the 302 is up and consult an attorney. Do not consult random strangers on the Internet. 

-=-=-=-=-=-=-=-=-=-

And, I'm locking this because it does not pertain to Bucks County in violation of rule 1.",t2_98axo,OwlStretcher,0,1647526115.0,0,t1_i10qb3s,i10qb3s,True,PhotographSoggy3401,t3_tga022,https://www.reddit.com/r/BucksCountyPA/comments/tga022/302ed_because_of_husbands_lies_to_police/,302’ed because of husband’s lies to police,/r/BucksCountyPA/comments/tga022/302ed_because_of_husbands_lies_to_police/i10qb3s/,23,r/BucksCountyPA,1,23
Yes it is,t2_9q9z2,Slobotic,0,1647525816.0,0,t1_i10pm87,i10pm87,False,fireside_blather,t3_tfwvea,https://www.reddit.com/r/BucksCountyPA/comments/tfwvea/bucks_co_cop_sentenced_for_sexually_assaulting/,Bucks Co. Cop Sentenced For Sexually Assaulting 11-Year-Old Girl: DA,/r/BucksCountyPA/comments/tfwvea/bucks_co_cop_sentenced_for_sexually_assaulting/i10pm87/,2,r/BucksCountyPA,0,2
"Lots of luck. Mine did this and I was clueless. You only have to stay 72 hours and then you can just leave. They will tell you no but you can and should. They are not allowed to stop you. A 302 is only good for 3 days and if you are determined NOT suicidal or homicidal, they cannot hold you longer.  Contact lawyer if necessary.",t2_9d7ugs02,Werewolf1965,0,1647524165.0,0,t1_i10lxfc,i10lxfc,True,PhotographSoggy3401,t3_tga022,https://www.reddit.com/r/BucksCountyPA/comments/tga022/302ed_because_of_husbands_lies_to_police/,302’ed because of husband’s lies to police,/r/BucksCountyPA/comments/tga022/302ed_because_of_husbands_lies_to_police/i10lxfc/,3,r/BucksCountyPA,0,3
You can just call them but realistically if it goes to court you will just have to testify on behalf of whoever,t2_jgs68,interstat,0,1647523756.0,0,t1_i10l1yt,i10l1yt,False,PhotographSoggy3401,t3_tga022,https://www.reddit.com/r/BucksCountyPA/comments/tga022/302ed_because_of_husbands_lies_to_police/,302’ed because of husband’s lies to police,/r/BucksCountyPA/comments/tga022/302ed_because_of_husbands_lies_to_police/i10l1yt/,3,r/BucksCountyPA,0,3
Elm is the WORST. Used to live around the corner and used that road to travel between Bustleton and Holland almost daily. Anytime i'm back there I don't even risk it anymore. Should get an award for worst road in the state.,t2_x1xb5,justnuclear,0,1647523575.0,0,t1_i10ko5j,i10ko5j,False,bontakun82,t3_t3rwmw,https://www.reddit.com/r/BucksCountyPA/comments/t3rwmw/car_eating_pot_holes/,Car eating pot holes,/r/BucksCountyPA/comments/t3rwmw/car_eating_pot_holes/i10ko5j/,2,r/BucksCountyPA,0,2
How to file a complaint on falsifying to law enforcement authority,t2_9wlz7ztp,PhotographSoggy3401,0,1647523422.0,0,t1_i10kcli,i10kcli,False,PhotographSoggy3401,t3_tga022,https://www.reddit.com/r/BucksCountyPA/comments/tga022/302ed_because_of_husbands_lies_to_police/,302’ed because of husband’s lies to police,/r/BucksCountyPA/comments/tga022/302ed_because_of_husbands_lies_to_police/i10kcli/,-7,r/BucksCountyPA,0,-7
Why would you want an English fry up? This is America!!,t2_ezdubr63,Active-Progress7443,0,1647523349.0,0,t1_i10k75u,i10k75u,True,spectral_tease,t3_tfvvcr,https://www.reddit.com/r/BucksCountyPA/comments/tfvvcr/upper_bucks_anyone_know_of_local_diners_that/,[Upper bucks] anyone know of local diners that offer an English fry up for breakfast?,/r/BucksCountyPA/comments/tfvvcr/upper_bucks_anyone_know_of_local_diners_that/i10k75u/,-4,r/BucksCountyPA,0,-4
What are you asking exactly?,t2_xk0x0,sonofzell,0,1647523329.0,0,t1_i10k5n9,i10k5n9,True,PhotographSoggy3401,t3_tga022,https://www.reddit.com/r/BucksCountyPA/comments/tga022/302ed_because_of_husbands_lies_to_police/,302’ed because of husband’s lies to police,/r/BucksCountyPA/comments/tga022/302ed_because_of_husbands_lies_to_police/i10k5n9/,3,r/BucksCountyPA,0,3
"I recommend the Dubliner, but I know the Black Taxi and Stargazy in Philly also serve an English breakfast.",t2_91fx8gd,crazy-puff,0,1647522057.0,0,t1_i10hkr9,i10hkr9,False,spectral_tease,t3_tfvvcr,https://www.reddit.com/r/BucksCountyPA/comments/tfvvcr/upper_bucks_anyone_know_of_local_diners_that/,[Upper bucks] anyone know of local diners that offer an English fry up for breakfast?,/r/BucksCountyPA/comments/tfvvcr/upper_bucks_anyone_know_of_local_diners_that/i10hkr9/,2,r/BucksCountyPA,0,2
"He was a cop who used his badge to rape an eleven year old girl, and he got one year in jail.  That’s fucked up.",t2_b9a3m,SuggestAPhotoProject,0,1647520713.0,0,t1_i10eziv,i10eziv,False,fireside_blather,t3_tfwvea,https://www.reddit.com/r/BucksCountyPA/comments/tfwvea/bucks_co_cop_sentenced_for_sexually_assaulting/,Bucks Co. Cop Sentenced For Sexually Assaulting 11-Year-Old Girl: DA,/r/BucksCountyPA/comments/tfwvea/bucks_co_cop_sentenced_for_sexually_assaulting/i10eziv/,5,r/BucksCountyPA,0,5
Some of their menus sounded really good!,t2_6gydy,pinkpolo,0,1647515440.0,0,t1_i106bvu,i106bvu,False,spectral_tease,t3_tfvvcr,https://www.reddit.com/r/BucksCountyPA/comments/tfvvcr/upper_bucks_anyone_know_of_local_diners_that/,[Upper bucks] anyone know of local diners that offer an English fry up for breakfast?,/r/BucksCountyPA/comments/tfvvcr/upper_bucks_anyone_know_of_local_diners_that/i106bvu/,1,r/BucksCountyPA,0,1
You’re welcome! Hope they’re good!,t2_6gydy,pinkpolo,0,1647515426.0,0,t1_i106b4v,i106b4v,False,spectral_tease,t3_tfvvcr,https://www.reddit.com/r/BucksCountyPA/comments/tfvvcr/upper_bucks_anyone_know_of_local_diners_that/,[Upper bucks] anyone know of local diners that offer an English fry up for breakfast?,/r/BucksCountyPA/comments/tfvvcr/upper_bucks_anyone_know_of_local_diners_that/i106b4v/,1,r/BucksCountyPA,0,1
What did you order from them that you did not like? I’ve ate at over a 1000 restaurants and at least a dozen Michelin star restaurants. Curly’s is one of few places to eat out here that I crave at least once a month.,t2_ukihj,BestSelf2015,0,1647510693.0,0,t1_i1001yd,i1001yd,False,BestSelf2015,t3_tcof17,https://www.reddit.com/r/BucksCountyPA/comments/tcof17/best_fooddishes_in_bensalem_feastervilletrevose/,"Best Food/Dishes in Bensalem, Feasterville-Trevose, Croydon Area?",/r/BucksCountyPA/comments/tcof17/best_fooddishes_in_bensalem_feastervilletrevose/i1001yd/,1,r/BucksCountyPA,0,1
"Curly’s has the best hush puppies I ever had. The Wed Gravy Brisket Sandwhich is awesome. Buffalo Mac and cheese with sweet and spicy sauce.

People rave about their wings but tried twice and didn’t care about them.

I usually order right at 11:05AM or between 1-2PM and get order within 15 mins. Other times have to wait 60-120 mins as they get super busy especially more so recently after a popular blogger rated them best in PA.",t2_ukihj,BestSelf2015,0,1647510511.0,0,t1_i0zztyz,i0zztyz,False,BestSelf2015,t3_tcof17,https://www.reddit.com/r/BucksCountyPA/comments/tcof17/best_fooddishes_in_bensalem_feastervilletrevose/,"Best Food/Dishes in Bensalem, Feasterville-Trevose, Croydon Area?",/r/BucksCountyPA/comments/tcof17/best_fooddishes_in_bensalem_feastervilletrevose/i0zztyz/,2,r/BucksCountyPA,0,2
I hope some of the people in there already find out about why our friend here is staying with them. Hopefully they have a better idea about justice,t2_nws6b,Riftus,0,1647493940.0,0,t1_i0zf7kg,i0zf7kg,True,fireside_blather,t3_tfwvea,https://www.reddit.com/r/BucksCountyPA/comments/tfwvea/bucks_co_cop_sentenced_for_sexually_assaulting/,Bucks Co. Cop Sentenced For Sexually Assaulting 11-Year-Old Girl: DA,/r/BucksCountyPA/comments/tfwvea/bucks_co_cop_sentenced_for_sexually_assaulting/i0zf7kg/,5,r/BucksCountyPA,0,5
Less than a year?  Maybe chemically castrate him too?,t2_9xqgkf5v,Jagged_hamboner,0,1647490434.0,0,t1_i0z97if,i0z97if,True,fireside_blather,t3_tfwvea,https://www.reddit.com/r/BucksCountyPA/comments/tfwvea/bucks_co_cop_sentenced_for_sexually_assaulting/,Bucks Co. Cop Sentenced For Sexually Assaulting 11-Year-Old Girl: DA,/r/BucksCountyPA/comments/tfwvea/bucks_co_cop_sentenced_for_sexually_assaulting/i0z97if/,4,r/BucksCountyPA,0,4
">Woohoo, thanks!

You're welcome!",t2_ko79fwmf,exclaim_bot,0,1647481418.0,0,t1_i0yqjpa,i0yqjpa,False,spectral_tease,t3_tfvvcr,https://www.reddit.com/r/BucksCountyPA/comments/tfvvcr/upper_bucks_anyone_know_of_local_diners_that/,[Upper bucks] anyone know of local diners that offer an English fry up for breakfast?,/r/BucksCountyPA/comments/tfvvcr/upper_bucks_anyone_know_of_local_diners_that/i0yqjpa/,0,r/BucksCountyPA,0,0
"Woohoo, thanks!",t2_hy2r4sx2,spectral_tease,0,1647481406.0,0,t1_i0yqiq2,i0yqiq2,False,spectral_tease,t3_tfvvcr,https://www.reddit.com/r/BucksCountyPA/comments/tfvvcr/upper_bucks_anyone_know_of_local_diners_that/,[Upper bucks] anyone know of local diners that offer an English fry up for breakfast?,/r/BucksCountyPA/comments/tfvvcr/upper_bucks_anyone_know_of_local_diners_that/i0yqiq2/,3,r/BucksCountyPA,0,3
"> All Day Irish Breakfast 18

> Traditional Irish breakfast with Tommy Moloney’s Irish bacon rashers, breakfast sausages, black & white pudding, two eggs, baked beans, grilled tomatoes & homemade Brown bread

That seems legit. I might have to go to New Hope this weekend.",t2_9q9z2,Slobotic,0,1647481284.0,0,t1_i0yq8zg,i0yq8zg,False,spectral_tease,t3_tfvvcr,https://www.reddit.com/r/BucksCountyPA/comments/tfvvcr/upper_bucks_anyone_know_of_local_diners_that/,[Upper bucks] anyone know of local diners that offer an English fry up for breakfast?,/r/BucksCountyPA/comments/tfvvcr/upper_bucks_anyone_know_of_local_diners_that/i0yq8zg/,5,r/BucksCountyPA,0,5
"I don't favor extreme or sadistic punishment, even for the worst crimes. I just hate to see cops get off easier than civilians. It's so fucking backwards.",t2_9q9z2,Slobotic,0,1647481086.0,0,t1_i0ypt6a,i0ypt6a,False,fireside_blather,t3_tfwvea,https://www.reddit.com/r/BucksCountyPA/comments/tfwvea/bucks_co_cop_sentenced_for_sexually_assaulting/,Bucks Co. Cop Sentenced For Sexually Assaulting 11-Year-Old Girl: DA,/r/BucksCountyPA/comments/tfwvea/bucks_co_cop_sentenced_for_sexually_assaulting/i0ypt6a/,5,r/BucksCountyPA,0,5
He won't be walking into a bar for 364 days.,t2_9q9z2,Slobotic,0,1647480974.0,0,t1_i0ypkaz,i0ypkaz,False,fireside_blather,t3_tfwvea,https://www.reddit.com/r/BucksCountyPA/comments/tfwvea/bucks_co_cop_sentenced_for_sexually_assaulting/,Bucks Co. Cop Sentenced For Sexually Assaulting 11-Year-Old Girl: DA,/r/BucksCountyPA/comments/tfwvea/bucks_co_cop_sentenced_for_sexually_assaulting/i0ypkaz/,4,r/BucksCountyPA,0,4
"Yeah I was being hopeful by referencing the maximum but you're right, he'll realistically do a lot less. 

I'd prefer he be stoned to death but I'm aware that's extreme and I'd be happier with something in between that and less than a year in county prison",t2_n3atx,Staubachlvr17,0,1647480962.0,0,t1_i0ypjbe,i0ypjbe,False,fireside_blather,t3_tfwvea,https://www.reddit.com/r/BucksCountyPA/comments/tfwvea/bucks_co_cop_sentenced_for_sexually_assaulting/,Bucks Co. Cop Sentenced For Sexually Assaulting 11-Year-Old Girl: DA,/r/BucksCountyPA/comments/tfwvea/bucks_co_cop_sentenced_for_sexually_assaulting/i0ypjbe/,7,r/BucksCountyPA,0,7
"> between 364 and 729 days in the Bucks County Correctional Facility.

So that means 364 days, realistically, and the sentence being less than a year keeps him in county rather than state prison.

Not a bad deal. I wonder what someone would get for the same crime if it wasn't also in violation of a sacred public trust. Probably more.",t2_9q9z2,Slobotic,0,1647480827.0,0,t1_i0yp89p,i0yp89p,False,fireside_blather,t3_tfwvea,https://www.reddit.com/r/BucksCountyPA/comments/tfwvea/bucks_co_cop_sentenced_for_sexually_assaulting/,Bucks Co. Cop Sentenced For Sexually Assaulting 11-Year-Old Girl: DA,/r/BucksCountyPA/comments/tfwvea/bucks_co_cop_sentenced_for_sexually_assaulting/i0yp89p/,13,r/BucksCountyPA,0,13
"729 days? That's it for abusing an 11 year old?
That's infuriatingly low",t2_n3atx,Staubachlvr17,0,1647479694.0,0,t1_i0ymozx,i0ymozx,True,fireside_blather,t3_tfwvea,https://www.reddit.com/r/BucksCountyPA/comments/tfwvea/bucks_co_cop_sentenced_for_sexually_assaulting/,Bucks Co. Cop Sentenced For Sexually Assaulting 11-Year-Old Girl: DA,/r/BucksCountyPA/comments/tfwvea/bucks_co_cop_sentenced_for_sexually_assaulting/i0ymozx/,23,r/BucksCountyPA,0,23
"This guy has too many first names. 

Richard Michael Frank walks into the bar. The bar tender says what can I get the 3 of you.",t2_172tey,noblehoax,0,1647477973.0,0,t1_i0yiudg,i0yiudg,True,fireside_blather,t3_tfwvea,https://www.reddit.com/r/BucksCountyPA/comments/tfwvea/bucks_co_cop_sentenced_for_sexually_assaulting/,Bucks Co. Cop Sentenced For Sexually Assaulting 11-Year-Old Girl: DA,/r/BucksCountyPA/comments/tfwvea/bucks_co_cop_sentenced_for_sexually_assaulting/i0yiudg/,17,r/BucksCountyPA,1,17
Will do,t2_hy2r4sx2,spectral_tease,0,1647474687.0,0,t1_i0yboga,i0yboga,False,spectral_tease,t3_tfvvcr,https://www.reddit.com/r/BucksCountyPA/comments/tfvvcr/upper_bucks_anyone_know_of_local_diners_that/,[Upper bucks] anyone know of local diners that offer an English fry up for breakfast?,/r/BucksCountyPA/comments/tfvvcr/upper_bucks_anyone_know_of_local_diners_that/i0yboga/,3,r/BucksCountyPA,0,3
"Thanks, I did and thankfully I know of no place that serves blood pudding",t2_jyx73vcz,Spiritual_Classic639,0,1647474638.0,0,t1_i0ybkfm,i0ybkfm,True,spectral_tease,t3_tfvvcr,https://www.reddit.com/r/BucksCountyPA/comments/tfvvcr/upper_bucks_anyone_know_of_local_diners_that/,[Upper bucks] anyone know of local diners that offer an English fry up for breakfast?,/r/BucksCountyPA/comments/tfvvcr/upper_bucks_anyone_know_of_local_diners_that/i0ybkfm/,-6,r/BucksCountyPA,0,-6
I have never come across any place that serves English or Scottish breakfast so please post if you find a decent place for it.,t2_fyg8t,RainyReese,0,1647474522.0,0,t1_i0ybaq4,i0ybaq4,True,spectral_tease,t3_tfvvcr,https://www.reddit.com/r/BucksCountyPA/comments/tfvvcr/upper_bucks_anyone_know_of_local_diners_that/,[Upper bucks] anyone know of local diners that offer an English fry up for breakfast?,/r/BucksCountyPA/comments/tfvvcr/upper_bucks_anyone_know_of_local_diners_that/i0ybaq4/,4,r/BucksCountyPA,0,4
"I know this B&B does but idk if they do just breakfast. 

https://www.theinnatbowmanshill.com/new-hope/bed-and-breakfast/breakfast.php

Also in new hope: http://www.thedublinernewhope.com/dinein-menu

In Philly: 

victoriafreehouse.com (brunch Saturday and Sunday)


https://thedandelionpub.com/menus/brunch/",t2_6gydy,pinkpolo,0,1647474489.0,0,t1_i0yb7xe,i0yb7xe,True,spectral_tease,t3_tfvvcr,https://www.reddit.com/r/BucksCountyPA/comments/tfvvcr/upper_bucks_anyone_know_of_local_diners_that/,[Upper bucks] anyone know of local diners that offer an English fry up for breakfast?,/r/BucksCountyPA/comments/tfvvcr/upper_bucks_anyone_know_of_local_diners_that/i0yb7xe/,5,r/BucksCountyPA,0,5
Why don’t ya click that link ;),t2_hy2r4sx2,spectral_tease,0,1647474240.0,0,t1_i0yanhv,i0yanhv,False,spectral_tease,t3_tfvvcr,https://www.reddit.com/r/BucksCountyPA/comments/tfvvcr/upper_bucks_anyone_know_of_local_diners_that/,[Upper bucks] anyone know of local diners that offer an English fry up for breakfast?,/r/BucksCountyPA/comments/tfvvcr/upper_bucks_anyone_know_of_local_diners_that/i0yanhv/,7,r/BucksCountyPA,0,7
"Well…um…I might have guessed that what does it consist of, what’s in it?",t2_jyx73vcz,Spiritual_Classic639,0,1647474203.0,0,t1_i0yakgf,i0yakgf,False,spectral_tease,t3_tfvvcr,https://www.reddit.com/r/BucksCountyPA/comments/tfvvcr/upper_bucks_anyone_know_of_local_diners_that/,[Upper bucks] anyone know of local diners that offer an English fry up for breakfast?,/r/BucksCountyPA/comments/tfvvcr/upper_bucks_anyone_know_of_local_diners_that/i0yakgf/,-13,r/BucksCountyPA,0,-13
[it’s an English breakfast dish](https://britishgrubhub.com/what-is-a-full-english-breakfast/),t2_hy2r4sx2,spectral_tease,0,1647474033.0,0,t1_i0ya6bv,i0ya6bv,False,spectral_tease,t3_tfvvcr,https://www.reddit.com/r/BucksCountyPA/comments/tfvvcr/upper_bucks_anyone_know_of_local_diners_that/,[Upper bucks] anyone know of local diners that offer an English fry up for breakfast?,/r/BucksCountyPA/comments/tfvvcr/upper_bucks_anyone_know_of_local_diners_that/i0ya6bv/,6,r/BucksCountyPA,0,6
WTF is an English fry up?,t2_jyx73vcz,Spiritual_Classic639,1,1647473826.0,0,t1_i0y9piz,i0y9piz,True,spectral_tease,t3_tfvvcr,https://www.reddit.com/r/BucksCountyPA/comments/tfvvcr/upper_bucks_anyone_know_of_local_diners_that/,[Upper bucks] anyone know of local diners that offer an English fry up for breakfast?,/r/BucksCountyPA/comments/tfvvcr/upper_bucks_anyone_know_of_local_diners_that/i0y9piz/,1,r/BucksCountyPA,0,1
"I see your point, but I think your point also underscores why we need to push for it long term. Like the article states, even Reagan engaged with Gorbrachev to successfully denuclearize, or scale back significantly, both country's arsenals. Is Putin that partner? No ...",t2_dsvex2y1,Open_Veins_8,0,1647455985.0,0,t1_i0x13dc,i0x13dc,False,Open_Veins_8,t3_tfo1lx,https://www.reddit.com/r/BucksCountyPA/comments/tfo1lx/mychalejko_bucks_county_must_band_together_to_ban/,Mychalejko: Bucks County must band together to ‘Ban the Bomb’,/r/BucksCountyPA/comments/tfo1lx/mychalejko_bucks_county_must_band_together_to_ban/i0x13dc/,-11,r/BucksCountyPA,1,-11
Doesn’t exactly seem like the right time to discuss American nuclear disarmament when a terrorist state is threatening to nuke the world if we interfere in their illegal invasion of a sovereign neighbor who was promised peace when they gave up their own nukes.,t2_6sbf2,bikingwithscissors,0,1647455239.0,0,t1_i0wz6qy,i0wz6qy,True,Open_Veins_8,t3_tfo1lx,https://www.reddit.com/r/BucksCountyPA/comments/tfo1lx/mychalejko_bucks_county_must_band_together_to_ban/,Mychalejko: Bucks County must band together to ‘Ban the Bomb’,/r/BucksCountyPA/comments/tfo1lx/mychalejko_bucks_county_must_band_together_to_ban/i0wz6qy/,20,r/BucksCountyPA,0,20
So?,t2_8fgbz4wg,DyMyKyMyy,0,1647454441.0,0,t1_i0wx57b,i0wx57b,False,ndjuka,t3_tf131r,https://www.reddit.com/r/BucksCountyPA/comments/tf131r/pa_gubernatorial_candidate_gets_the_ole_pennridge/,Pa gubernatorial candidate gets the ole Pennridge bigot endorsement.,/r/BucksCountyPA/comments/tf131r/pa_gubernatorial_candidate_gets_the_ole_pennridge/i0wx57b/,-7,r/BucksCountyPA,0,-7
Based,t2_8fgbz4wg,DyMyKyMyy,0,1647454421.0,0,t1_i0wx3dx,i0wx3dx,False,ndjuka,t3_tf131r,https://www.reddit.com/r/BucksCountyPA/comments/tf131r/pa_gubernatorial_candidate_gets_the_ole_pennridge/,Pa gubernatorial candidate gets the ole Pennridge bigot endorsement.,/r/BucksCountyPA/comments/tf131r/pa_gubernatorial_candidate_gets_the_ole_pennridge/i0wx3dx/,-1,r/BucksCountyPA,0,-1
"There is no bottom, is there?",t2_2b4pnzc0,rexperfection,0,1647449841.0,0,t1_i0wlo4i,i0wlo4i,True,ndjuka,t3_tf131r,https://www.reddit.com/r/BucksCountyPA/comments/tf131r/pa_gubernatorial_candidate_gets_the_ole_pennridge/,Pa gubernatorial candidate gets the ole Pennridge bigot endorsement.,/r/BucksCountyPA/comments/tf131r/pa_gubernatorial_candidate_gets_the_ole_pennridge/i0wlo4i/,4,r/BucksCountyPA,0,4
"You are correct, my error.",t2_3qshdn41,TwoSixtySev3n,0,1647406902.0,0,t1_i0uknti,i0uknti,False,ndjuka,t3_tf131r,https://www.reddit.com/r/BucksCountyPA/comments/tf131r/pa_gubernatorial_candidate_gets_the_ole_pennridge/,Pa gubernatorial candidate gets the ole Pennridge bigot endorsement.,/r/BucksCountyPA/comments/tf131r/pa_gubernatorial_candidate_gets_the_ole_pennridge/i0uknti/,2,r/BucksCountyPA,0,2
I think you mean a Josh Shapiro commercial.  Josh is running for governor.  John Fetterman is running for US Senate.,t2_4cngt,justlurking777,0,1647406756.0,0,t1_i0ukff1,i0ukff1,False,ndjuka,t3_tf131r,https://www.reddit.com/r/BucksCountyPA/comments/tf131r/pa_gubernatorial_candidate_gets_the_ole_pennridge/,Pa gubernatorial candidate gets the ole Pennridge bigot endorsement.,/r/BucksCountyPA/comments/tf131r/pa_gubernatorial_candidate_gets_the_ole_pennridge/i0ukff1/,8,r/BucksCountyPA,0,8
Mmmmmm wood panels and popcorn grid ceilings.  Classy.,t2_qabh0wm,orangesfwr,0,1647394732.0,0,t1_i0twand,i0twand,True,ndjuka,t3_tf131r,https://www.reddit.com/r/BucksCountyPA/comments/tf131r/pa_gubernatorial_candidate_gets_the_ole_pennridge/,Pa gubernatorial candidate gets the ole Pennridge bigot endorsement.,/r/BucksCountyPA/comments/tf131r/pa_gubernatorial_candidate_gets_the_ole_pennridge/i0twand/,8,r/BucksCountyPA,0,8
Go on,t2_cq8se,sirfuzzitoes,0,1647394179.0,0,t1_i0tv0uc,i0tv0uc,False,ndjuka,t3_tf131r,https://www.reddit.com/r/BucksCountyPA/comments/tf131r/pa_gubernatorial_candidate_gets_the_ole_pennridge/,Pa gubernatorial candidate gets the ole Pennridge bigot endorsement.,/r/BucksCountyPA/comments/tf131r/pa_gubernatorial_candidate_gets_the_ole_pennridge/i0tv0uc/,-1,r/BucksCountyPA,0,-1
"By Charcoal they mean ""Charcoal Steaks And Things"" on the corner of Ferry St and River Rd. Excellent breakfast. I've known this place my whole life. Bonus, I know a cook there. He's good. 

Warning: Many people pull out of Charcoal onto Ferry and block the incoming traffic from River Rd. I lived near here and would often nearly hit people head-on who were loading into their cars coming out of the restaurant. This is not the way. 

Also, they use fresh jalapenos. Order Jalapenos at your own risk. (Look up scoville rating of fresh vs tamed)",t2_139t0a,Thecrawsome,0,1647393440.0,0,t1_i0ttc12,i0ttc12,False,chasing_ghosts1031,t3_tdkakh,https://www.reddit.com/r/BucksCountyPA/comments/tdkakh/best_breakfast_place/,Best breakfast place?,/r/BucksCountyPA/comments/tdkakh/best_breakfast_place/i0ttc12/,0,r/BucksCountyPA,0,0
don't know who he is but he has to better than Wolf was,t2_55htnez2,Mudgekeewis,0,1647393330.0,0,t1_i0tt30k,i0tt30k,True,ndjuka,t3_tf131r,https://www.reddit.com/r/BucksCountyPA/comments/tf131r/pa_gubernatorial_candidate_gets_the_ole_pennridge/,Pa gubernatorial candidate gets the ole Pennridge bigot endorsement.,/r/BucksCountyPA/comments/tf131r/pa_gubernatorial_candidate_gets_the_ole_pennridge/i0tt30k/,-22,r/BucksCountyPA,0,-22
I can't with the fucking laughing at himself.  Did he fart during the joke?,t2_o727mc9,RUAfrog,0,1647392225.0,0,t1_i0tqlr3,i0tqlr3,True,ndjuka,t3_tf131r,https://www.reddit.com/r/BucksCountyPA/comments/tf131r/pa_gubernatorial_candidate_gets_the_ole_pennridge/,Pa gubernatorial candidate gets the ole Pennridge bigot endorsement.,/r/BucksCountyPA/comments/tf131r/pa_gubernatorial_candidate_gets_the_ole_pennridge/i0tqlr3/,3,r/BucksCountyPA,0,3
"La Hacienda in Bensalem is some of the best Mexican food in all of Bucks, imo. Musashi in Feasterville has awesome ramen.",t2_sbz3tht,-Fait-Accompli-,0,1647383344.0,0,t1_i0t63is,i0t63is,True,BestSelf2015,t3_tcof17,https://www.reddit.com/r/BucksCountyPA/comments/tcof17/best_fooddishes_in_bensalem_feastervilletrevose/,"Best Food/Dishes in Bensalem, Feasterville-Trevose, Croydon Area?",/r/BucksCountyPA/comments/tcof17/best_fooddishes_in_bensalem_feastervilletrevose/i0t63is/,2,r/BucksCountyPA,0,2
That’s gonna make a good Fetterman commercial in Philly and New Hope.,t2_3qshdn41,TwoSixtySev3n,0,1647381566.0,0,t1_i0t1lxp,i0t1lxp,True,ndjuka,t3_tf131r,https://www.reddit.com/r/BucksCountyPA/comments/tf131r/pa_gubernatorial_candidate_gets_the_ole_pennridge/,Pa gubernatorial candidate gets the ole Pennridge bigot endorsement.,/r/BucksCountyPA/comments/tf131r/pa_gubernatorial_candidate_gets_the_ole_pennridge/i0t1lxp/,16,r/BucksCountyPA,0,16
Fascist,t2_bmkvo,trebordet,0,1647381312.0,0,t1_i0t0xga,i0t0xga,True,ndjuka,t3_tf131r,https://www.reddit.com/r/BucksCountyPA/comments/tf131r/pa_gubernatorial_candidate_gets_the_ole_pennridge/,Pa gubernatorial candidate gets the ole Pennridge bigot endorsement.,/r/BucksCountyPA/comments/tf131r/pa_gubernatorial_candidate_gets_the_ole_pennridge/i0t0xga/,11,r/BucksCountyPA,0,11
"Man I dont know what I just watched, but I didn't like any bit of it",t2_66qbk,Sonnescheint,0,1647381150.0,0,t1_i0t0i4r,i0t0i4r,True,ndjuka,t3_tf131r,https://www.reddit.com/r/BucksCountyPA/comments/tf131r/pa_gubernatorial_candidate_gets_the_ole_pennridge/,Pa gubernatorial candidate gets the ole Pennridge bigot endorsement.,/r/BucksCountyPA/comments/tf131r/pa_gubernatorial_candidate_gets_the_ole_pennridge/i0t0i4r/,14,r/BucksCountyPA,0,14
