body,author_fullname,author.name,controversiality,created,downs,fullname,id,is_root,link_author,link_id,link_permalink,link_title,permalink,score,subreddit_name_prefixed,total_awards_received,ups
This place is garbage and so overpriced.,t2_hphzqaju,Massive_Action2043,0,1649009295.0,0,t1_i3917vp,i3917vp,True,Old-Supermarket-2241,t3_thtbsm,https://www.reddit.com/r/BucksCountyPA/comments/thtbsm/golden_eagle_diner_owner_retiring_turning_over/,"Golden Eagle Diner Owner Retiring, Turning Over Keys To New Operator",/r/BucksCountyPA/comments/thtbsm/golden_eagle_diner_owner_retiring_turning_over/i3917vp/,1,r/BucksCountyPA,0,1
All the taxes stolen can fund this stuff easily.,t2_hphzqaju,Massive_Action2043,0,1649009075.0,0,t1_i390o93,i390o93,True,bladderbunch,t3_tvbn6s,https://www.reddit.com/r/BucksCountyPA/comments/tvbn6s/canal_cleanup_next_weekend/,Canal Cleanup next weekend.,/r/BucksCountyPA/comments/tvbn6s/canal_cleanup_next_weekend/i390o93/,1,r/BucksCountyPA,0,1
"[Yes, there are plenty of opportunities,you can still sign up.](https://www.fodc.org/event/canal-clean-up-day-2022/)

I’ll be between Yardley and Washington Crossing.",t2_3qshdn41,TwoSixtySev3n,0,1649006812.0,0,t1_i38v3ct,i38v3ct,False,bladderbunch,t3_tvbn6s,https://www.reddit.com/r/BucksCountyPA/comments/tvbn6s/canal_cleanup_next_weekend/,Canal Cleanup next weekend.,/r/BucksCountyPA/comments/tvbn6s/canal_cleanup_next_weekend/i38v3ct/,2,r/BucksCountyPA,0,2
"i believe every section along the length has a steward.  if you take gloves and a trash bag, you’ll be helping, any weekend you go.",t2_6cwl3,bladderbunch,0,1649006805.0,0,t1_i38v2pa,i38v2pa,False,bladderbunch,t3_tvbn6s,https://www.reddit.com/r/BucksCountyPA/comments/tvbn6s/canal_cleanup_next_weekend/,Canal Cleanup next weekend.,/r/BucksCountyPA/comments/tvbn6s/canal_cleanup_next_weekend/i38v2pa/,1,r/BucksCountyPA,0,1
Any other sections doing cleanups?  Like up towards Wash Crossing and New Hope?,t2_28pliaqh,BtenaciousD,0,1649003065.0,0,t1_i38m07o,i38m07o,True,bladderbunch,t3_tvbn6s,https://www.reddit.com/r/BucksCountyPA/comments/tvbn6s/canal_cleanup_next_weekend/,Canal Cleanup next weekend.,/r/BucksCountyPA/comments/tvbn6s/canal_cleanup_next_weekend/i38m07o/,1,r/BucksCountyPA,0,1
"u/SuggestAPhotoProject \-- I wholeheartedly agree with your observations on the article. Good use of Primary Sources, but the biased opinion inserted in it will take away credibility for anyone who doesn't agree with the political standpoint of the BC Beacon. I was coming here this morning to share a similar article published by the Levittown Now. https://levittownnow.com/2022/04/02/exclusive-republicans-signatures-forged-on-election-documents-submitted-by-candidate/",t2_7y44k8qm,Old-Supermarket-2241,0,1649002961.0,0,t1_i38lrap,i38lrap,False,Open_Veins_8,t3_tump9h,https://www.reddit.com/r/BucksCountyPA/comments/tump9h/so_much_for_election_integrity_forged_petitions/,So Much for ‘Election Integrity’: Forged Petitions Mar Republican PA01 Congressional Candidate - Bucks County Beacon,/r/BucksCountyPA/comments/tump9h/so_much_for_election_integrity_forged_petitions/i38lrap/,2,r/BucksCountyPA,0,2
"i’ll be in morrisville but if you’re nearby, clean up the canal wherever you are.   whenever you are.",t2_6cwl3,bladderbunch,0,1648999255.0,0,t1_i38czrh,i38czrh,True,bladderbunch,t3_tvbn6s,https://www.reddit.com/r/BucksCountyPA/comments/tvbn6s/canal_cleanup_next_weekend/,Canal Cleanup next weekend.,/r/BucksCountyPA/comments/tvbn6s/canal_cleanup_next_weekend/i38czrh/,1,r/BucksCountyPA,0,1
Tons,t2_4nq1u87,Igotshiptodotoday,0,1648996596.0,0,t1_i3871oy,i3871oy,False,DrFitterWelder420,t3_tuoiwr,https://www.reddit.com/r/BucksCountyPA/comments/tuoiwr/i_need_help_finding_an_state_inspection_and/,I need help finding an state inspection and emissions shop without all the hassle.,/r/BucksCountyPA/comments/tuoiwr/i_need_help_finding_an_state_inspection_and/i3871oy/,2,r/BucksCountyPA,0,2
Dont you have ship to do today?,t2_bs0s12y3,DrFitterWelder420,0,1648996505.0,0,t1_i386uia,i386uia,False,DrFitterWelder420,t3_tuoiwr,https://www.reddit.com/r/BucksCountyPA/comments/tuoiwr/i_need_help_finding_an_state_inspection_and/,I need help finding an state inspection and emissions shop without all the hassle.,/r/BucksCountyPA/comments/tuoiwr/i_need_help_finding_an_state_inspection_and/i386uia/,-1,r/BucksCountyPA,0,-1
No problem but this point is completely lost on the original poster.,t2_4nq1u87,Igotshiptodotoday,0,1648996447.0,0,t1_i386pwi,i386pwi,False,DrFitterWelder420,t3_tuoiwr,https://www.reddit.com/r/BucksCountyPA/comments/tuoiwr/i_need_help_finding_an_state_inspection_and/,I need help finding an state inspection and emissions shop without all the hassle.,/r/BucksCountyPA/comments/tuoiwr/i_need_help_finding_an_state_inspection_and/i386pwi/,3,r/BucksCountyPA,0,3
Thanks captain obvious,t2_bs0s12y3,DrFitterWelder420,0,1648996203.0,0,t1_i3866t2,i3866t2,False,DrFitterWelder420,t3_tuoiwr,https://www.reddit.com/r/BucksCountyPA/comments/tuoiwr/i_need_help_finding_an_state_inspection_and/,I need help finding an state inspection and emissions shop without all the hassle.,/r/BucksCountyPA/comments/tuoiwr/i_need_help_finding_an_state_inspection_and/i3866t2/,-1,r/BucksCountyPA,0,-1
I believe tint laws are different for vehicles with limousine registrations.,t2_4nq1u87,Igotshiptodotoday,0,1648996148.0,0,t1_i3862hx,i3862hx,False,DrFitterWelder420,t3_tuoiwr,https://www.reddit.com/r/BucksCountyPA/comments/tuoiwr/i_need_help_finding_an_state_inspection_and/,I need help finding an state inspection and emissions shop without all the hassle.,/r/BucksCountyPA/comments/tuoiwr/i_need_help_finding_an_state_inspection_and/i3862hx/,1,r/BucksCountyPA,0,1
Dont forget limo drivers,t2_bs0s12y3,DrFitterWelder420,0,1648995989.0,0,t1_i385qdi,i385qdi,False,DrFitterWelder420,t3_tuoiwr,https://www.reddit.com/r/BucksCountyPA/comments/tuoiwr/i_need_help_finding_an_state_inspection_and/,I need help finding an state inspection and emissions shop without all the hassle.,/r/BucksCountyPA/comments/tuoiwr/i_need_help_finding_an_state_inspection_and/i385qdi/,1,r/BucksCountyPA,0,1
"Performing the service is perfectly legal. They have no obligation to care if you choose the car that way. They are aware that is the job of traffic cops and safety inspectors. Not their monkey, not their circus.",t2_4nq1u87,Igotshiptodotoday,0,1648995708.0,0,t1_i3854mz,i3854mz,False,DrFitterWelder420,t3_tuoiwr,https://www.reddit.com/r/BucksCountyPA/comments/tuoiwr/i_need_help_finding_an_state_inspection_and/,I need help finding an state inspection and emissions shop without all the hassle.,/r/BucksCountyPA/comments/tuoiwr/i_need_help_finding_an_state_inspection_and/i3854mz/,2,r/BucksCountyPA,0,2
Ok thanks for that. Still kind of odd they can advertise services that would be deemed illegal.,t2_bs0s12y3,DrFitterWelder420,0,1648992928.0,0,t1_i37zjwu,i37zjwu,False,DrFitterWelder420,t3_tuoiwr,https://www.reddit.com/r/BucksCountyPA/comments/tuoiwr/i_need_help_finding_an_state_inspection_and/,I need help finding an state inspection and emissions shop without all the hassle.,/r/BucksCountyPA/comments/tuoiwr/i_need_help_finding_an_state_inspection_and/i37zjwu/,1,r/BucksCountyPA,0,1
The tint shop did it because you paid them. They are not in the business for advising against bad decisions.,t2_4nq1u87,Igotshiptodotoday,0,1648992844.0,0,t1_i37ze5c,i37ze5c,True,DrFitterWelder420,t3_tuoiwr,https://www.reddit.com/r/BucksCountyPA/comments/tuoiwr/i_need_help_finding_an_state_inspection_and/,I need help finding an state inspection and emissions shop without all the hassle.,/r/BucksCountyPA/comments/tuoiwr/i_need_help_finding_an_state_inspection_and/i37ze5c/,3,r/BucksCountyPA,0,3
"windshield tint? ehh. that’s dumb. i would say find a shop that’s not so main stream cause i’d feel like they would pass u for that. that’s stupid for the tints though. yes you’re not legally allowed but to fail an inspection cause of it.

Also, Idk, but you could try calling this shop, Mr. Auto. Check on google for the number. He’s a cool guy so maybe ask him about the window tint.",t2_hgmfm0nk,AmbitionTemporary356,0,1648992058.0,0,t1_i37xxa1,i37xxa1,True,DrFitterWelder420,t3_tuoiwr,https://www.reddit.com/r/BucksCountyPA/comments/tuoiwr/i_need_help_finding_an_state_inspection_and/,I need help finding an state inspection and emissions shop without all the hassle.,/r/BucksCountyPA/comments/tuoiwr/i_need_help_finding_an_state_inspection_and/i37xxa1/,2,r/BucksCountyPA,0,2
What about the Democrat Steve Irwin doing the same thing?,t2_d23mrgxy,Hoppiness83,0,1648989743.0,0,t1_i37tuwq,i37tuwq,False,Open_Veins_8,t3_tump9h,https://www.reddit.com/r/BucksCountyPA/comments/tump9h/so_much_for_election_integrity_forged_petitions/,So Much for ‘Election Integrity’: Forged Petitions Mar Republican PA01 Congressional Candidate - Bucks County Beacon,/r/BucksCountyPA/comments/tump9h/so_much_for_election_integrity_forged_petitions/i37tuwq/,0,r/BucksCountyPA,0,0
"I have found a pretty decent mechanic at Joe M automotive on 13 in Bristol. Another good one in Philly is Almond St garage in Port Richmond. I haven’t tried to get an inspection on a car with a tinted front windshield, so I don’t know if that would pass.",t2_1uov,topredder,0,1648989209.0,0,t1_i37sz04,i37sz04,True,DrFitterWelder420,t3_tuoiwr,https://www.reddit.com/r/BucksCountyPA/comments/tuoiwr/i_need_help_finding_an_state_inspection_and/,I need help finding an state inspection and emissions shop without all the hassle.,/r/BucksCountyPA/comments/tuoiwr/i_need_help_finding_an_state_inspection_and/i37sz04/,1,r/BucksCountyPA,0,1
Yea,t2_bs0s12y3,DrFitterWelder420,0,1648962407.0,0,t1_i36tw6x,i36tw6x,False,DrFitterWelder420,t3_tuoiwr,https://www.reddit.com/r/BucksCountyPA/comments/tuoiwr/i_need_help_finding_an_state_inspection_and/,I need help finding an state inspection and emissions shop without all the hassle.,/r/BucksCountyPA/comments/tuoiwr/i_need_help_finding_an_state_inspection_and/i36tw6x/,1,r/BucksCountyPA,0,1
You can have a tint if you get a letter from an opthalmologist saying that it is necessary.  This requires a few tests and a lot of complaining.  Definitely more than one office visit.,t2_9qniqx3w,FawltyPython,0,1648957298.0,0,t1_i36l34e,i36l34e,True,DrFitterWelder420,t3_tuoiwr,https://www.reddit.com/r/BucksCountyPA/comments/tuoiwr/i_need_help_finding_an_state_inspection_and/,I need help finding an state inspection and emissions shop without all the hassle.,/r/BucksCountyPA/comments/tuoiwr/i_need_help_finding_an_state_inspection_and/i36l34e/,2,r/BucksCountyPA,0,2
You don’t happen to be near Philly do you?,t2_gimprfnx,This2shallpas,0,1648945557.0,0,t1_i363nk2,i363nk2,True,DrFitterWelder420,t3_tuoiwr,https://www.reddit.com/r/BucksCountyPA/comments/tuoiwr/i_need_help_finding_an_state_inspection_and/,I need help finding an state inspection and emissions shop without all the hassle.,/r/BucksCountyPA/comments/tuoiwr/i_need_help_finding_an_state_inspection_and/i363nk2/,0,r/BucksCountyPA,0,0
"As someone who legitimately and painstakingly collects these signatures from real people, this is infuriating.",t2_qabh0wm,orangesfwr,0,1648944612.0,0,t1_i3630jb,i3630jb,True,Open_Veins_8,t3_tump9h,https://www.reddit.com/r/BucksCountyPA/comments/tump9h/so_much_for_election_integrity_forged_petitions/,So Much for ‘Election Integrity’: Forged Petitions Mar Republican PA01 Congressional Candidate - Bucks County Beacon,/r/BucksCountyPA/comments/tump9h/so_much_for_election_integrity_forged_petitions/i3630jb/,5,r/BucksCountyPA,0,5
Thompson's Auto Service in Penndel is cool to deal with.,t2_29xoovwi,shortythebad,0,1648942261.0,0,t1_i35ycgt,i35ycgt,True,DrFitterWelder420,t3_tuoiwr,https://www.reddit.com/r/BucksCountyPA/comments/tuoiwr/i_need_help_finding_an_state_inspection_and/,I need help finding an state inspection and emissions shop without all the hassle.,/r/BucksCountyPA/comments/tuoiwr/i_need_help_finding_an_state_inspection_and/i35ycgt/,1,r/BucksCountyPA,0,1
And my clutching pearls!,t2_moh8c,2p0s1u7,0,1648941727.0,0,t1_i35x94f,i35x94f,False,Open_Veins_8,t3_tump9h,https://www.reddit.com/r/BucksCountyPA/comments/tump9h/so_much_for_election_integrity_forged_petitions/,So Much for ‘Election Integrity’: Forged Petitions Mar Republican PA01 Congressional Candidate - Bucks County Beacon,/r/BucksCountyPA/comments/tump9h/so_much_for_election_integrity_forged_petitions/i35x94f/,-5,r/BucksCountyPA,0,-5
"Interesting. I keep up on maintenance year round, not just when it’s inspection time. So I’ve definitely had years where I only have to pay for the inspection.",t2_4c9xi,IntoTheMirror,0,1648938997.0,0,t1_i35rngj,i35rngj,False,DrFitterWelder420,t3_tuoiwr,https://www.reddit.com/r/BucksCountyPA/comments/tuoiwr/i_need_help_finding_an_state_inspection_and/,I need help finding an state inspection and emissions shop without all the hassle.,/r/BucksCountyPA/comments/tuoiwr/i_need_help_finding_an_state_inspection_and/i35rngj/,2,r/BucksCountyPA,0,2
Right near there is Miller's. Love that place. Never steered me wrong.,t2_5rk4t,blinkdmb,0,1648936311.0,0,t1_i35m41d,i35m41d,False,DrFitterWelder420,t3_tuoiwr,https://www.reddit.com/r/BucksCountyPA/comments/tuoiwr/i_need_help_finding_an_state_inspection_and/,I need help finding an state inspection and emissions shop without all the hassle.,/r/BucksCountyPA/comments/tuoiwr/i_need_help_finding_an_state_inspection_and/i35m41d/,1,r/BucksCountyPA,0,1
"Windshield tints are illegal, only way you can get stickers if you go to someone in the hood in Philly who won’t give AF and they will charge you more for Inspections.",t2_iz2ia,Holdmypipe,0,1648936217.0,0,t1_i35lwxu,i35lwxu,True,DrFitterWelder420,t3_tuoiwr,https://www.reddit.com/r/BucksCountyPA/comments/tuoiwr/i_need_help_finding_an_state_inspection_and/,I need help finding an state inspection and emissions shop without all the hassle.,/r/BucksCountyPA/comments/tuoiwr/i_need_help_finding_an_state_inspection_and/i35lwxu/,9,r/BucksCountyPA,0,9
"It's technically illegal to tint the windshield of a vehicle used on public roads in Pennsylvania.  Tint shops will do it because they don't care and your money is green.  No inspection station can legally issue stickers to a vehicle with a tinted windshield, period.",t2_bmeuy8w,Stephonius,0,1648936028.0,0,t1_i35lij4,i35lij4,True,DrFitterWelder420,t3_tuoiwr,https://www.reddit.com/r/BucksCountyPA/comments/tuoiwr/i_need_help_finding_an_state_inspection_and/,I need help finding an state inspection and emissions shop without all the hassle.,/r/BucksCountyPA/comments/tuoiwr/i_need_help_finding_an_state_inspection_and/i35lij4/,14,r/BucksCountyPA,0,14
"I completely agree that this lady is a corrupt piece of trash that needs to be charged. As you said, there are plenty of republicans in bucks county that would’ve been happy to sign. 


I’m more speaking to parts of the article like this. 

>	Pruett was yet another Republican carpetbagger – see Mehmet Oz, Carla Sands, David McCormick – hoping to use money, looks, and GOP endorsements to win in 2022. Senator Douglas Mastriano, sometimes described as a “Christian nationalist,” endorsed Pruett. She obviously hoped to run to the right of Fitzpatrick, and try to win the nomination that way. On her LinkedIn page she claims she stands for “election integrity.”


While I agree with the author, this isn’t journalism, it’s judgemental conclusion-drawing, as opposed to objectively presenting the facts and letting the reader judge for themselves and draw their own conclusions.  There was a better way to present this information that would’ve appealed to (and ultimately reached,) a wider audience.  Let’s be honest, it’s probably more important that people on the right read this, but it seems to be written for people on the left. 


At the end of the day, I’m grateful for what the Bucks County Beacon is trying to do, and I just want them to succeed.",t2_b9a3m,SuggestAPhotoProject,0,1648934049.0,0,t1_i35hd2u,i35hd2u,False,Open_Veins_8,t3_tump9h,https://www.reddit.com/r/BucksCountyPA/comments/tump9h/so_much_for_election_integrity_forged_petitions/,So Much for ‘Election Integrity’: Forged Petitions Mar Republican PA01 Congressional Candidate - Bucks County Beacon,/r/BucksCountyPA/comments/tump9h/so_much_for_election_integrity_forged_petitions/i35hd2u/,5,r/BucksCountyPA,0,5
"I wholeheartedly agree that the writer seems to be doing a great job using primary sources and getting first hand accounts, and bringing to light something really important.



I just feel like they could reach a more wide ranging audience with a little less judgment in their writing. For example, the first five words of the title are completely unnecessary.


At the end of the day, I just want this thing to succeed, as it’s nice having another source for local news, especially one as in-depth as this.",t2_b9a3m,SuggestAPhotoProject,0,1648933385.0,0,t1_i35fyuk,i35fyuk,False,Open_Veins_8,t3_tump9h,https://www.reddit.com/r/BucksCountyPA/comments/tump9h/so_much_for_election_integrity_forged_petitions/,So Much for ‘Election Integrity’: Forged Petitions Mar Republican PA01 Congressional Candidate - Bucks County Beacon,/r/BucksCountyPA/comments/tump9h/so_much_for_election_integrity_forged_petitions/i35fyuk/,4,r/BucksCountyPA,0,4
Nice,t2_4u2kq5cw,FrothyBadgerMilk,0,1648931512.0,0,t1_i35bza8,i35bza8,False,DrFitterWelder420,t3_tuoiwr,https://www.reddit.com/r/BucksCountyPA/comments/tuoiwr/i_need_help_finding_an_state_inspection_and/,I need help finding an state inspection and emissions shop without all the hassle.,/r/BucksCountyPA/comments/tuoiwr/i_need_help_finding_an_state_inspection_and/i35bza8/,1,r/BucksCountyPA,0,1
This asshole just called me an asshole!  Fuck you buddy!,t2_o727mc9,RUAfrog,0,1648931275.0,0,t1_i35bh0a,i35bh0a,True,bontakun82,t3_ttzk7g,https://www.reddit.com/r/BucksCountyPA/comments/ttzk7g/walkers_of_tyler_park/,Walkers of Tyler Park,/r/BucksCountyPA/comments/ttzk7g/walkers_of_tyler_park/i35bh0a/,1,r/BucksCountyPA,0,1
"I read the article in full, and I hear the tone you are referring to. However, the writer brings the facts and interviewed many people for the article. I won't let her folksy style get in the way when so many journalists simply publish both-siderisms and call it professional.",t2_h64zf4jj,Series_G,0,1648929435.0,0,t1_i357lf4,i357lf4,False,Open_Veins_8,t3_tump9h,https://www.reddit.com/r/BucksCountyPA/comments/tump9h/so_much_for_election_integrity_forged_petitions/,So Much for ‘Election Integrity’: Forged Petitions Mar Republican PA01 Congressional Candidate - Bucks County Beacon,/r/BucksCountyPA/comments/tump9h/so_much_for_election_integrity_forged_petitions/i357lf4/,8,r/BucksCountyPA,0,8
I don’t see any bias at all. Finding 1000 Republicans to sign isn’t that hard and her people were too lazy and corrupt to do it right.,t2_1vqycx69,berraberragood,0,1648928820.0,0,t1_i356bc2,i356bc2,False,Open_Veins_8,t3_tump9h,https://www.reddit.com/r/BucksCountyPA/comments/tump9h/so_much_for_election_integrity_forged_petitions/,So Much for ‘Election Integrity’: Forged Petitions Mar Republican PA01 Congressional Candidate - Bucks County Beacon,/r/BucksCountyPA/comments/tump9h/so_much_for_election_integrity_forged_petitions/i356bc2/,3,r/BucksCountyPA,0,3
LOL ... she's a Russian (by birth) and doesn't even live in PA01 -- she lives in Drexel Hill which isn't IN (or even NEARBY) to Bucks County.,t2_5qnoiys,AndISoundLikeThis,0,1648925343.0,0,t1_i34zd1w,i34zd1w,True,Open_Veins_8,t3_tump9h,https://www.reddit.com/r/BucksCountyPA/comments/tump9h/so_much_for_election_integrity_forged_petitions/,So Much for ‘Election Integrity’: Forged Petitions Mar Republican PA01 Congressional Candidate - Bucks County Beacon,/r/BucksCountyPA/comments/tump9h/so_much_for_election_integrity_forged_petitions/i34zd1w/,11,r/BucksCountyPA,0,11
Damn.,t2_bs0s12y3,DrFitterWelder420,0,1648923113.0,0,t1_i34unzu,i34unzu,False,DrFitterWelder420,t3_tuoiwr,https://www.reddit.com/r/BucksCountyPA/comments/tuoiwr/i_need_help_finding_an_state_inspection_and/,I need help finding an state inspection and emissions shop without all the hassle.,/r/BucksCountyPA/comments/tuoiwr/i_need_help_finding_an_state_inspection_and/i34unzu/,2,r/BucksCountyPA,0,2
"While I see the point in safety/emission inspections, I have yet to find an honest mechanic in Bucks. The inspection might be $70, but you never leave for under $800. Unless they send out another check, and then all the sudden every mechanic bill is $1500.

Aamco on Veterans Highway in Levittown is the closest I’ve found to straightforward, but that strongly depends on who’s there that day.

Fwiw, my truck hasn’t had stickers since 2019…

EDIT: This thread has been up for 10 hours, and so far we've had more downvotes than suggestions for honest mechanics. Infer from that what you will.",t2_98axo,OwlStretcher,0,1648923047.0,0,t1_i34uiob,i34uiob,True,DrFitterWelder420,t3_tuoiwr,https://www.reddit.com/r/BucksCountyPA/comments/tuoiwr/i_need_help_finding_an_state_inspection_and/,I need help finding an state inspection and emissions shop without all the hassle.,/r/BucksCountyPA/comments/tuoiwr/i_need_help_finding_an_state_inspection_and/i34uiob/,-12,r/BucksCountyPA,0,-12
Wat?,t2_10a4ac,MarquisDeHueberez,0,1648922752.0,0,t1_i34tven,i34tven,False,Open_Veins_8,t3_tump9h,https://www.reddit.com/r/BucksCountyPA/comments/tump9h/so_much_for_election_integrity_forged_petitions/,So Much for ‘Election Integrity’: Forged Petitions Mar Republican PA01 Congressional Candidate - Bucks County Beacon,/r/BucksCountyPA/comments/tump9h/so_much_for_election_integrity_forged_petitions/i34tven/,-1,r/BucksCountyPA,0,-1
"Pennsylvania Election Info

[Register to Vote](https://www.pavoterservices.pa.gov/Pages/VoterRegistrationApplication.aspx)",t2_jpimgrm,election_info_bot,0,1648922449.0,0,t1_i34t6wb,i34t6wb,True,Open_Veins_8,t3_tump9h,https://www.reddit.com/r/BucksCountyPA/comments/tump9h/so_much_for_election_integrity_forged_petitions/,So Much for ‘Election Integrity’: Forged Petitions Mar Republican PA01 Congressional Candidate - Bucks County Beacon,/r/BucksCountyPA/comments/tump9h/so_much_for_election_integrity_forged_petitions/i34t6wb/,5,r/BucksCountyPA,0,5
"It's a tale as old as time. a family torn apart. A feud to span the generations between a father set in his old ways, and the son who thinks he can change the insurance world.",t2_cbp13a6p,Kneedeep_in_Cyanide,0,1648921195.0,0,t1_i34qb0m,i34qb0m,False,BestSelf2015,t3_tte1zu,https://www.reddit.com/r/BucksCountyPA/comments/tte1zu/good_auto_insurance_broker/,Good Auto Insurance Broker?,/r/BucksCountyPA/comments/tte1zu/good_auto_insurance_broker/i34qb0m/,1,r/BucksCountyPA,0,1
Quick! I need a fainting chair!,t2_4i04pvz1,fireside_blather,0,1648920489.0,0,t1_i34onkt,i34onkt,False,Open_Veins_8,t3_tump9h,https://www.reddit.com/r/BucksCountyPA/comments/tump9h/so_much_for_election_integrity_forged_petitions/,So Much for ‘Election Integrity’: Forged Petitions Mar Republican PA01 Congressional Candidate - Bucks County Beacon,/r/BucksCountyPA/comments/tump9h/so_much_for_election_integrity_forged_petitions/i34onkt/,5,r/BucksCountyPA,0,5
This is their way…,t2_bbk02v5o,eMPereb,1,1648920269.0,0,t1_i34o4sz,i34o4sz,False,Open_Veins_8,t3_tump9h,https://www.reddit.com/r/BucksCountyPA/comments/tump9h/so_much_for_election_integrity_forged_petitions/,So Much for ‘Election Integrity’: Forged Petitions Mar Republican PA01 Congressional Candidate - Bucks County Beacon,/r/BucksCountyPA/comments/tump9h/so_much_for_election_integrity_forged_petitions/i34o4sz/,0,r/BucksCountyPA,0,0
"This is an important story, but the obviously biased way in which the article is written will cause a lot of people to write it off as partisan drivel.  Journalistic standards exist for a reason, and the Bucks County Beacon is sorely lacking in this regard.  Their information appears factual, but it definitely comes across more as a political opinion blog than an unbiased source of information. 



That aside, this criminal needs to be charged.",t2_b9a3m,SuggestAPhotoProject,1,1648919771.0,0,t1_i34myl2,i34myl2,True,Open_Veins_8,t3_tump9h,https://www.reddit.com/r/BucksCountyPA/comments/tump9h/so_much_for_election_integrity_forged_petitions/,So Much for ‘Election Integrity’: Forged Petitions Mar Republican PA01 Congressional Candidate - Bucks County Beacon,/r/BucksCountyPA/comments/tump9h/so_much_for_election_integrity_forged_petitions/i34myl2/,4,r/BucksCountyPA,0,4
lol,t2_dsvex2y1,Open_Veins_8,1,1648918218.0,0,t1_i34jc39,i34jc39,False,Open_Veins_8,t3_tump9h,https://www.reddit.com/r/BucksCountyPA/comments/tump9h/so_much_for_election_integrity_forged_petitions/,So Much for ‘Election Integrity’: Forged Petitions Mar Republican PA01 Congressional Candidate - Bucks County Beacon,/r/BucksCountyPA/comments/tump9h/so_much_for_election_integrity_forged_petitions/i34jc39/,-1,r/BucksCountyPA,0,-1
Shocked!!! SHOCKED I SAY!!! Republicans committing election fraud and projecting onto the opposition is unheard of!!!,t2_t5qdi,BogWunder,0,1648917973.0,0,t1_i34irak,i34irak,True,Open_Veins_8,t3_tump9h,https://www.reddit.com/r/BucksCountyPA/comments/tump9h/so_much_for_election_integrity_forged_petitions/,So Much for ‘Election Integrity’: Forged Petitions Mar Republican PA01 Congressional Candidate - Bucks County Beacon,/r/BucksCountyPA/comments/tump9h/so_much_for_election_integrity_forged_petitions/i34irak/,27,r/BucksCountyPA,0,27
