body,author_fullname,author.name,controversiality,created,downs,fullname,id,is_root,link_author,link_id,link_permalink,link_title,permalink,score,subreddit_name_prefixed,total_awards_received,ups
"I agree. I've flown out of here several times to Atlanta. Its far more convenient than the Philly airport, and has been cheaper. Granted, it was on frontier airlines each time, which isn't a top-shelf carrier, but it was fine for a 2 hour domestic flight. It would be nice to have flights to more destinations.",t2_l021iky,junkkser,0,1648052459.0,0,t1_i1t920d,i1t920d,False,fireside_blather,t3_tkwump,https://www.reddit.com/r/BucksCountyPA/comments/tkwump/airport_near_bucks_co_gets_faa_approval_for/,Airport Near Bucks Co Gets FAA Approval For Expansion,/r/BucksCountyPA/comments/tkwump/airport_near_bucks_co_gets_faa_approval_for/i1t920d/,12,r/BucksCountyPA,0,12
this is great.    i fly out of here whenever i can.,t2_6cwl3,bladderbunch,0,1648051650.0,0,t1_i1t6wfm,i1t6wfm,True,fireside_blather,t3_tkwump,https://www.reddit.com/r/BucksCountyPA/comments/tkwump/airport_near_bucks_co_gets_faa_approval_for/,Airport Near Bucks Co Gets FAA Approval For Expansion,/r/BucksCountyPA/comments/tkwump/airport_near_bucks_co_gets_faa_approval_for/i1t6wfm/,10,r/BucksCountyPA,0,10
You gotta make an appointment in advance.,t2_5rk4t,blinkdmb,0,1648045240.0,0,t1_i1sqdn8,i1sqdn8,False,Thecrawsome,t3_tk4ibp,https://www.reddit.com/r/BucksCountyPA/comments/tk4ibp/best_beard_trim_in_lower_bucks/,Best beard trim in lower bucks?,/r/BucksCountyPA/comments/tk4ibp/best_beard_trim_in_lower_bucks/i1sqdn8/,1,r/BucksCountyPA,0,1
"That tells you how long it’s been since I’ve been there. Every time I walked in, I just felt like everyone kind of rolled their eyes. I tip well, so not sure why I just felt so uncomfortable when I walked in",t2_62kgmc4,USMC_Lauer6046,0,1648044969.0,0,t1_i1sppuy,i1sppuy,False,Thecrawsome,t3_tk4ibp,https://www.reddit.com/r/BucksCountyPA/comments/tk4ibp/best_beard_trim_in_lower_bucks/,Best beard trim in lower bucks?,/r/BucksCountyPA/comments/tk4ibp/best_beard_trim_in_lower_bucks/i1sppuy/,2,r/BucksCountyPA,0,2
I don't even think they take walk-ins anymore. Book an appointment online and you'll be good to go.,t2_10l0p7,drum3release,0,1648044810.0,0,t1_i1spc34,i1spc34,False,Thecrawsome,t3_tk4ibp,https://www.reddit.com/r/BucksCountyPA/comments/tk4ibp/best_beard_trim_in_lower_bucks/,Best beard trim in lower bucks?,/r/BucksCountyPA/comments/tk4ibp/best_beard_trim_in_lower_bucks/i1spc34/,1,r/BucksCountyPA,0,1
"Just because I haven’t seen it posted, Sharkeys in Bristol is my go-to. You can book online, and I’ve never left disappointed. It’s built to feel like a 1930’s barbershop, typically with some swing music or jazz playing, old school chairs, and just a comfortable atmosphere.",t2_62kgmc4,USMC_Lauer6046,0,1648044724.0,0,t1_i1sp4mq,i1sp4mq,True,Thecrawsome,t3_tk4ibp,https://www.reddit.com/r/BucksCountyPA/comments/tk4ibp/best_beard_trim_in_lower_bucks/,Best beard trim in lower bucks?,/r/BucksCountyPA/comments/tk4ibp/best_beard_trim_in_lower_bucks/i1sp4mq/,1,r/BucksCountyPA,0,1
Besides having to wait 2 hours if you’re a walk in.. too cliquey for me. Every time I go in there I feel like an outcast.,t2_62kgmc4,USMC_Lauer6046,0,1648044601.0,0,t1_i1sotxm,i1sotxm,False,Thecrawsome,t3_tk4ibp,https://www.reddit.com/r/BucksCountyPA/comments/tk4ibp/best_beard_trim_in_lower_bucks/,Best beard trim in lower bucks?,/r/BucksCountyPA/comments/tk4ibp/best_beard_trim_in_lower_bucks/i1sotxm/,2,r/BucksCountyPA,0,2
Jag's in Morrisville does everything for me.,t2_6cwl3,bladderbunch,0,1648037080.0,0,t1_i1s962w,i1s962w,True,Thecrawsome,t3_tk4ibp,https://www.reddit.com/r/BucksCountyPA/comments/tk4ibp/best_beard_trim_in_lower_bucks/,Best beard trim in lower bucks?,/r/BucksCountyPA/comments/tk4ibp/best_beard_trim_in_lower_bucks/i1s962w/,1,r/BucksCountyPA,0,1
You can pay to have sex with a man in a coal mine??  Sign me up!,t2_a0vo0,harbison215,0,1648006610.0,0,t1_i1r3wdr,i1r3wdr,False,fireside_blather,t3_scvis4,https://www.reddit.com/r/BucksCountyPA/comments/scvis4/bucks_county_becomes_first_in_pennsylvania_to/,Bucks County becomes first in Pennsylvania to adopt ordinance targeting illicit massage parlors,/r/BucksCountyPA/comments/scvis4/bucks_county_becomes_first_in_pennsylvania_to/i1r3wdr/,0,r/BucksCountyPA,0,0
Edgewood Cafe and it’s considered to be in Fairless Hills? My absolute favorite breakfast (their lunch food is good too but the breakfast is where it’s at) in Bucks,t2_1ima62sn,yamiyugis,0,1648001144.0,0,t1_i1qsxw6,i1qsxw6,True,chasing_ghosts1031,t3_tdkakh,https://www.reddit.com/r/BucksCountyPA/comments/tdkakh/best_breakfast_place/,Best breakfast place?,/r/BucksCountyPA/comments/tdkakh/best_breakfast_place/i1qsxw6/,1,r/BucksCountyPA,0,1
"Both my husband and son go here. The owner is a former bartender who dreamed of opening his own barbershop. At least give it a try. They do an excellent job on my husband’s hair, which is really hard to cut (super curly).",t2_v8r90aq,Still7Superbaby7,0,1647998609.0,0,t1_i1qne1a,i1qne1a,False,Thecrawsome,t3_tk4ibp,https://www.reddit.com/r/BucksCountyPA/comments/tk4ibp/best_beard_trim_in_lower_bucks/,Best beard trim in lower bucks?,/r/BucksCountyPA/comments/tk4ibp/best_beard_trim_in_lower_bucks/i1qne1a/,1,r/BucksCountyPA,0,1
Yes please shhhhh. Thank you,t2_g7tmhlh1,Davevan76,0,1647998349.0,0,t1_i1qmtjt,i1qmtjt,False,BucksCountyBeacon,t3_thv9ye,https://www.reddit.com/r/BucksCountyPA/comments/thv9ye/the_gops_war_on_democracy_has_many_battle_fronts/,"The GOP’s war on democracy has many battle fronts. In Pennsylvania, that actually includes the state constitution. Pennsylvania Republicans, who hold majorities in the State House and Senate, apparently despise the practice of checks and balances the judicial, legislative and executive branches",/r/BucksCountyPA/comments/thv9ye/the_gops_war_on_democracy_has_many_battle_fronts/i1qmtjt/,0,r/BucksCountyPA,0,0
"Bucks county is being destroyed. I understand we need housing, but everywhere I look all the fields, farms, and woods are being bought and developed by toll brothers and other developers. It just keeps inching into the more rural townships every year. I swear toll brothers doesn’t know what a tree is either, they just knock them all down",t2_exkpinxy,Steve25000,0,1647986331.0,0,t1_i1pv4ao,i1pv4ao,True,El_Hombre_Molecular,t3_s5lz59,https://www.reddit.com/r/BucksCountyPA/comments/s5lz59/is_bucks_county_becoming_too_developed/,"Is Bucks County Becoming too ""Developed""?",/r/BucksCountyPA/comments/s5lz59/is_bucks_county_becoming_too_developed/i1pv4ao/,1,r/BucksCountyPA,0,1
Fantastic Sams,t2_9ihlo,Stridertherider,0,1647985729.0,0,t1_i1ptmqo,i1ptmqo,True,Thecrawsome,t3_tk4ibp,https://www.reddit.com/r/BucksCountyPA/comments/tk4ibp/best_beard_trim_in_lower_bucks/,Best beard trim in lower bucks?,/r/BucksCountyPA/comments/tk4ibp/best_beard_trim_in_lower_bucks/i1ptmqo/,1,r/BucksCountyPA,0,1
More specifically TyDy cuts,t2_9ihlo,Stridertherider,0,1647985697.0,0,t1_i1ptjsm,i1ptjsm,False,Thecrawsome,t3_tk4ibp,https://www.reddit.com/r/BucksCountyPA/comments/tk4ibp/best_beard_trim_in_lower_bucks/,Best beard trim in lower bucks?,/r/BucksCountyPA/comments/tk4ibp/best_beard_trim_in_lower_bucks/i1ptjsm/,1,r/BucksCountyPA,0,1
Did deaner bring back the invitational?,t2_139t0a,Thecrawsome,0,1647980787.0,0,t1_i1ph5fm,i1ph5fm,False,juzbrowzinthreadz,t3_tjpzu2,https://www.reddit.com/r/BucksCountyPA/comments/tjpzu2/open_mic_music_bars/,Open Mic Music Bars?,/r/BucksCountyPA/comments/tjpzu2/open_mic_music_bars/i1ph5fm/,1,r/BucksCountyPA,0,1
I go here too. They do great,t2_5rk4t,blinkdmb,0,1647978284.0,0,t1_i1panv5,i1panv5,False,Thecrawsome,t3_tk4ibp,https://www.reddit.com/r/BucksCountyPA/comments/tk4ibp/best_beard_trim_in_lower_bucks/,Best beard trim in lower bucks?,/r/BucksCountyPA/comments/tk4ibp/best_beard_trim_in_lower_bucks/i1panv5/,2,r/BucksCountyPA,0,2
"Bearded soldier. https://www.thebarbershopbybeardedsoldier.com/?gclid=Cj0KCQjw5-WRBhCKARIsAAId9FkzchtllS5NlhriFScjx-IyrPa_0c3YIGy1NjLfWLlaHRqCRBGqJTQaAmcxEALw_wcB

They have 2 locations.  They are great.",t2_5rk4t,blinkdmb,0,1647977827.0,0,t1_i1p9h4r,i1p9h4r,True,Thecrawsome,t3_tk4ibp,https://www.reddit.com/r/BucksCountyPA/comments/tk4ibp/best_beard_trim_in_lower_bucks/,Best beard trim in lower bucks?,/r/BucksCountyPA/comments/tk4ibp/best_beard_trim_in_lower_bucks/i1p9h4r/,4,r/BucksCountyPA,0,4
[The barber shop](https://thebarbershopbybeardedsoldier.schedulista.com/) in Levittown is great. My man Austin does a great job every time.,t2_dqgm7,Charirner,0,1647976211.0,0,t1_i1p5brb,i1p5brb,True,Thecrawsome,t3_tk4ibp,https://www.reddit.com/r/BucksCountyPA/comments/tk4ibp/best_beard_trim_in_lower_bucks/,Best beard trim in lower bucks?,/r/BucksCountyPA/comments/tk4ibp/best_beard_trim_in_lower_bucks/i1p5brb/,4,r/BucksCountyPA,0,4
I was just thinking this today too,t2_45mtd6hw,Selym00,0,1647973951.0,0,t1_i1ozjd7,i1ozjd7,True,Thecrawsome,t3_tk4ibp,https://www.reddit.com/r/BucksCountyPA/comments/tk4ibp/best_beard_trim_in_lower_bucks/,Best beard trim in lower bucks?,/r/BucksCountyPA/comments/tk4ibp/best_beard_trim_in_lower_bucks/i1ozjd7/,1,r/BucksCountyPA,0,1
"If you want a man-spa vibe, this is definitely the place. That being said, they did an ok job on my beard. Definitely not the perfect cut, and unfortunately at their price point, it has to be. It was a $50 bill before tip. I haven’t given them a second shot yet.  Then again, I haven’t found anywhere better since I moved here, so…",t2_12y2bq,Jv1856,0,1647973308.0,0,t1_i1oxv5e,i1oxv5e,False,Thecrawsome,t3_tk4ibp,https://www.reddit.com/r/BucksCountyPA/comments/tk4ibp/best_beard_trim_in_lower_bucks/,Best beard trim in lower bucks?,/r/BucksCountyPA/comments/tk4ibp/best_beard_trim_in_lower_bucks/i1oxv5e/,3,r/BucksCountyPA,0,3
Also in New Hope [John and Peters](http://www.johnandpeters.com/) has open mic on Mondays and a local musician jam night on Wednesday.,t2_3qshdn41,TwoSixtySev3n,0,1647972420.0,0,t1_i1ovjls,i1ovjls,True,juzbrowzinthreadz,t3_tjpzu2,https://www.reddit.com/r/BucksCountyPA/comments/tjpzu2/open_mic_music_bars/,Open Mic Music Bars?,/r/BucksCountyPA/comments/tjpzu2/open_mic_music_bars/i1ovjls/,3,r/BucksCountyPA,0,3
"Make your Mark just opened up in willowgrove. I've been to their Ardmore and Manayunk locations. Mark is the owner and does a great job. I haven't seen any of the other barbers at the Willow grove location but if are anything close to the barbers at their other two spots your in good hands. 

Players barbershop in hatboro used to be a great spot but i haven't gone in a few years since the barber i would see left. The other people working there seemed to be pretty solid but i have no experience with them.",t2_4y7yt,frickensweet,0,1647969456.0,0,t1_i1ont5c,i1ont5c,True,Thecrawsome,t3_tk4ibp,https://www.reddit.com/r/BucksCountyPA/comments/tk4ibp/best_beard_trim_in_lower_bucks/,Best beard trim in lower bucks?,/r/BucksCountyPA/comments/tk4ibp/best_beard_trim_in_lower_bucks/i1ont5c/,2,r/BucksCountyPA,0,2
seconded - True Believers,t2_2iykbb13,MickStash,0,1647968670.0,0,t1_i1olqk0,i1olqk0,False,Thecrawsome,t3_tk4ibp,https://www.reddit.com/r/BucksCountyPA/comments/tk4ibp/best_beard_trim_in_lower_bucks/,Best beard trim in lower bucks?,/r/BucksCountyPA/comments/tk4ibp/best_beard_trim_in_lower_bucks/i1olqk0/,3,r/BucksCountyPA,0,3
"Badger & Tortoise in Doylestown, go see Garrett",t2_79t08,gotmewrong66,0,1647968304.0,0,t1_i1okrxe,i1okrxe,True,Thecrawsome,t3_tk4ibp,https://www.reddit.com/r/BucksCountyPA/comments/tk4ibp/best_beard_trim_in_lower_bucks/,Best beard trim in lower bucks?,/r/BucksCountyPA/comments/tk4ibp/best_beard_trim_in_lower_bucks/i1okrxe/,2,r/BucksCountyPA,0,2
Laced in langhorne.,t2_sapr00x,YoCanIGetA10Bag215,0,1647964461.0,0,t1_i1oaqhq,i1oaqhq,True,Thecrawsome,t3_tk4ibp,https://www.reddit.com/r/BucksCountyPA/comments/tk4ibp/best_beard_trim_in_lower_bucks/,Best beard trim in lower bucks?,/r/BucksCountyPA/comments/tk4ibp/best_beard_trim_in_lower_bucks/i1oaqhq/,5,r/BucksCountyPA,0,5
"My beard guy gets me a good even shave and lines up what’s left. Only condition is I have to pay him in beer and hand jobs.

EDIT: I cut my own hair/shave myself",t2_98axo,OwlStretcher,0,1647962764.0,0,t1_i1o6gbn,i1o6gbn,True,Thecrawsome,t3_tk4ibp,https://www.reddit.com/r/BucksCountyPA/comments/tk4ibp/best_beard_trim_in_lower_bucks/,Best beard trim in lower bucks?,/r/BucksCountyPA/comments/tk4ibp/best_beard_trim_in_lower_bucks/i1o6gbn/,22,r/BucksCountyPA,0,22
Miguel’s Riverside in Bristol,t2_a1s5zh0q,oliver0729,0,1647962076.0,0,t1_i1o4q4g,i1o4q4g,True,Thecrawsome,t3_tk4ibp,https://www.reddit.com/r/BucksCountyPA/comments/tk4ibp/best_beard_trim_in_lower_bucks/,Best beard trim in lower bucks?,/r/BucksCountyPA/comments/tk4ibp/best_beard_trim_in_lower_bucks/i1o4q4g/,5,r/BucksCountyPA,0,5
"I just went there got a good haircut but they seem to have a focus on beards as well (no personal experience yet, just started growing mine out)",t2_2gvjh,madmanz123,0,1647960976.0,0,t1_i1o1zy4,i1o1zy4,False,Thecrawsome,t3_tk4ibp,https://www.reddit.com/r/BucksCountyPA/comments/tk4ibp/best_beard_trim_in_lower_bucks/,Best beard trim in lower bucks?,/r/BucksCountyPA/comments/tk4ibp/best_beard_trim_in_lower_bucks/i1o1zy4/,2,r/BucksCountyPA,0,2
True believers in new hope,t2_7hmsy,Rwschultz17,0,1647960575.0,0,t1_i1o105n,i1o105n,True,Thecrawsome,t3_tk4ibp,https://www.reddit.com/r/BucksCountyPA/comments/tk4ibp/best_beard_trim_in_lower_bucks/,Best beard trim in lower bucks?,/r/BucksCountyPA/comments/tk4ibp/best_beard_trim_in_lower_bucks/i1o105n/,6,r/BucksCountyPA,1,6
Handsome Devil in Newtown,t2_t5qdi,BogWunder,0,1647960244.0,0,t1_i1o06nq,i1o06nq,True,Thecrawsome,t3_tk4ibp,https://www.reddit.com/r/BucksCountyPA/comments/tk4ibp/best_beard_trim_in_lower_bucks/,Best beard trim in lower bucks?,/r/BucksCountyPA/comments/tk4ibp/best_beard_trim_in_lower_bucks/i1o06nq/,8,r/BucksCountyPA,0,8
That has not been my experience with either district we are discussing. . I respectfully disagree with your assessment.  I speak from personal experience what a good job Pennsbury does with mainstream supports.,t2_5rk4t,blinkdmb,0,1647960005.0,0,t1_i1nzlv9,i1nzlv9,False,Used-Mode1484,t3_tjbrx7,https://www.reddit.com/r/BucksCountyPA/comments/tjbrx7/pennsbury_or_neshaminy/,Pennsbury or Neshaminy?,/r/BucksCountyPA/comments/tjbrx7/pennsbury_or_neshaminy/i1nzlv9/,2,r/BucksCountyPA,0,2
"""The Churchville Reservoir (Springfield Lake) itself is privately owned by Aqua America, NOT the County of Bucks. Due to it being privately owned, NO public recreational use of the lake is permitted. This includes no fishing, no boating, and no swimming.""

Probably means no running as well. 

https://www.churchvillenaturecenter.org/?job=display\_item&featuretype=userpage&wrapper=normal&id=14&page\_title=Plan+Your+Visit",t2_dsz5vn0l,Opposite-Sea-2688,0,1647959762.0,0,t1_i1nz118,i1nz118,True,Padugan,t3_71wfik,https://www.reddit.com/r/BucksCountyPA/comments/71wfik/whats_the_deal_with_churchville_park/,What's the deal with Churchville Park?,/r/BucksCountyPA/comments/71wfik/whats_the_deal_with_churchville_park/i1nz118/,2,r/BucksCountyPA,0,2
"They really aren't there to hold anyone's hand.  Accommodations are granted based upon specific criteria requiring diagnosis, documentation and compliance with state and federal law.  The difference is in how seriously districts take their responsibility in that regard.  Many of the ""prestige"" districts just shove everyone who doesn't fit into a separate classroom and pass them through the system until they graduate or age out.",t2_bmeuy8w,Stephonius,0,1647959650.0,0,t1_i1nyre8,i1nyre8,False,Used-Mode1484,t3_tjbrx7,https://www.reddit.com/r/BucksCountyPA/comments/tjbrx7/pennsbury_or_neshaminy/,Pennsbury or Neshaminy?,/r/BucksCountyPA/comments/tjbrx7/pennsbury_or_neshaminy/i1nyre8/,1,r/BucksCountyPA,0,1
The Local in Quakertown has a weekly open mic night on Monday from 7-11pm at 201 E Broad St.,t2_4kbjdkc,SpottedEagleSeven,0,1647956910.0,0,t1_i1nseqz,i1nseqz,True,juzbrowzinthreadz,t3_tjpzu2,https://www.reddit.com/r/BucksCountyPA/comments/tjpzu2/open_mic_music_bars/,Open Mic Music Bars?,/r/BucksCountyPA/comments/tjpzu2/open_mic_music_bars/i1nseqz/,3,r/BucksCountyPA,0,3
"I've got an odd combination of experiences from the two districts; my family moved to Yardley from NJ while I was in college so my brother attended Pennsbury, and I currently live with my family in Neshaminy.

My brother had a good experience in Pennsbury, and I think it was a much better opportunity than where we lived previously. One thing I do remember (that others have mentioned) was the ""affluence divide"". This was something we were very familiar with back in the NJ district I grew up in, but some of the stories he had were that it wasn't always as bad on the inside with the kids as the parents made it out to be on the outside.

When my wife and I were looking for our first home we knew we couldn't afford NJ (where we both grew up) so we looked in Bucks where my parents were living. She's a middle school teacher so education was very important to her, and she basically came armed with areas we could live based on the districts. We were basically narrowed down to the Nesh-Penn area of Lower Bucks and found we could get ""more house"" on our budget in Neshaminy. I've currently got two kids at Tawanka and the school, teachers, and administrators have all been awesome. Based on my past experiences I was afraid of that ""affluence gap"" but I've never encountered it, it feels very much like a community and most of the parents I know grew up here.

I'm personally very happy with the decision we made and with Neshaminy so far, but Pennsbury isn't a bad choice. We chose based on what was best for us - we knew Pennsbury scored a bit better, but I've got a house with a big yard for my kids to play in, and we've had great experiences with the district so far so I don't doubt the choice I made.",t2_4dwvkfcq,CptEggman,0,1647956527.0,0,t1_i1nrkcc,i1nrkcc,True,Used-Mode1484,t3_tjbrx7,https://www.reddit.com/r/BucksCountyPA/comments/tjbrx7/pennsbury_or_neshaminy/,Pennsbury or Neshaminy?,/r/BucksCountyPA/comments/tjbrx7/pennsbury_or_neshaminy/i1nrkcc/,2,r/BucksCountyPA,0,2
Check Havana in New Hope. I know they have lots of tribute bands performing and I thought they used to have an open mic night.,t2_6xworv0w,RonPerlmansJaw,0,1647955561.0,0,t1_i1nphfv,i1nphfv,True,juzbrowzinthreadz,t3_tjpzu2,https://www.reddit.com/r/BucksCountyPA/comments/tjpzu2/open_mic_music_bars/,Open Mic Music Bars?,/r/BucksCountyPA/comments/tjpzu2/open_mic_music_bars/i1nphfv/,2,r/BucksCountyPA,0,2
"Sweeneys on Philmont Ave has open mic nights and battle of the bands.

https://www.phillyspecialsaloon.com/entertainment/",t2_bjuyr,ispongeyou,0,1647952569.0,0,t1_i1njjsa,i1njjsa,True,juzbrowzinthreadz,t3_tjpzu2,https://www.reddit.com/r/BucksCountyPA/comments/tjpzu2/open_mic_music_bars/,Open Mic Music Bars?,/r/BucksCountyPA/comments/tjpzu2/open_mic_music_bars/i1njjsa/,2,r/BucksCountyPA,0,2
Times like this I wish I could just get up and move out to Michigan because F/ lower bucks and F/ pa.,t2_jaor14fk,SMYBH665,0,1647951792.0,0,t1_i1ni4sr,i1ni4sr,False,SMYBH665,t3_thvrwk,https://www.reddit.com/r/BucksCountyPA/comments/thvrwk/who_has_faygo/,Who has faygo?,/r/BucksCountyPA/comments/thvrwk/who_has_faygo/i1ni4sr/,2,r/BucksCountyPA,0,2
I wish I was closer to sheetz. But the drive might be worth it :),t2_jaor14fk,SMYBH665,0,1647951674.0,0,t1_i1nhx74,i1nhx74,False,SMYBH665,t3_thvrwk,https://www.reddit.com/r/BucksCountyPA/comments/thvrwk/who_has_faygo/,Who has faygo?,/r/BucksCountyPA/comments/thvrwk/who_has_faygo/i1nhx74/,1,r/BucksCountyPA,0,1
"Before covid, Archie's big heads in Westminster (I think the address is Hatboro) had open mics.  I think they're coming back.",t2_u5x9p,bontakun82,0,1647921089.0,0,t1_i1mda79,i1mda79,True,juzbrowzinthreadz,t3_tjpzu2,https://www.reddit.com/r/BucksCountyPA/comments/tjpzu2/open_mic_music_bars/,Open Mic Music Bars?,/r/BucksCountyPA/comments/tjpzu2/open_mic_music_bars/i1mda79/,2,r/BucksCountyPA,0,2
"NBD you are acting in good faith. Context matters a lot when big stuff is at stake. 

Mods have to make a decision to remove posts or have to spend effort verifying posts without sources, so please provide context next time. Thanks for posting.",t2_139t0a,Thecrawsome,0,1647914761.0,0,t1_i1m0rog,i1m0rog,False,userX97ee2ska11qa,t3_tjcb83,https://www.reddit.com/r/BucksCountyPA/comments/tjcb83/attempted_student_luring_at_phs/,Attempted student luring at PHS,/r/BucksCountyPA/comments/tjcb83/attempted_student_luring_at_phs/i1m0rog/,3,r/BucksCountyPA,0,3
"From my point of view I think that Pennsbury is better; I've heard quite a good amount from others.

I'm in 9th grade and I can't say much though.",t2_6k696nue,Xryphon,0,1647912158.0,0,t1_i1lv1xe,i1lv1xe,False,Used-Mode1484,t3_tjbrx7,https://www.reddit.com/r/BucksCountyPA/comments/tjbrx7/pennsbury_or_neshaminy/,Pennsbury or Neshaminy?,/r/BucksCountyPA/comments/tjbrx7/pennsbury_or_neshaminy/i1lv1xe/,2,r/BucksCountyPA,0,2
The source was an email from the school district. My post was made within 1 minute of the email.,t2_8ddk2a1v,userX97ee2ska11qa,1,1647910306.0,0,t1_i1lqzc8,i1lqzc8,False,userX97ee2ska11qa,t3_tjcb83,https://www.reddit.com/r/BucksCountyPA/comments/tjcb83/attempted_student_luring_at_phs/,Attempted student luring at PHS,/r/BucksCountyPA/comments/tjcb83/attempted_student_luring_at_phs/i1lqzc8/,1,r/BucksCountyPA,0,1
"We originally lived in Council Rock SD and when we moved, we considered anywhere in CR, Lower Makefield/Yardley or Langhorne.  Council Rock was the best of the three districts but they are all good but you'll hear negatives about all of them depending on what exactly someone is focusing on.  

Pennsbury has a very strong divide between the very wealthy and the not so wealthy.  They have the traditional grades for each school level.   At the HS, they have a great prom.  I've heard Pennsbury is the better of the two if you need an IEP.

Neshaminy has different income levels but it's not as distinct as Pennsbury.  Neshaminy has a strong music program elementary through high school.  They start middle school at 5th grade.  It gives more extracurricular options at an earlier age but 5th grade can be young to deal with the earlier start time, changing classes and such.

Both HS have many successful sports teams.    Higher academic rankings between the two high schools changes every few years and/or depending on which ranking system that you are looking at.  

With today's housing market, you are likely to need to bid on numerous houses before you get one so find houses you like and take a chance.  Most likely, you'll be happy with either school district.",t2_i3edz60p,stephypsu,0,1647909851.0,0,t1_i1lpzj2,i1lpzj2,True,Used-Mode1484,t3_tjbrx7,https://www.reddit.com/r/BucksCountyPA/comments/tjbrx7/pennsbury_or_neshaminy/,Pennsbury or Neshaminy?,/r/BucksCountyPA/comments/tjbrx7/pennsbury_or_neshaminy/i1lpzj2/,4,r/BucksCountyPA,0,4
"Since it's such an egregious issue I went and googled it myself but please read the rules, and use common sense and post a source

https://levittownnow.com/2022/03/21/police-probe-possible-attempted-child-luring/",t2_139t0a,Thecrawsome,0,1647908578.0,0,t1_i1ln5jo,i1ln5jo,True,userX97ee2ska11qa,t3_tjcb83,https://www.reddit.com/r/BucksCountyPA/comments/tjcb83/attempted_student_luring_at_phs/,Attempted student luring at PHS,/r/BucksCountyPA/comments/tjcb83/attempted_student_luring_at_phs/i1ln5jo/,1,r/BucksCountyPA,0,1
i go to neshaminy 😎,t2_iw2ks7s8,RepeatAwkward69420,0,1647906166.0,0,t1_i1lhqpn,i1lhqpn,False,Used-Mode1484,t3_tjbrx7,https://www.reddit.com/r/BucksCountyPA/comments/tjbrx7/pennsbury_or_neshaminy/,Pennsbury or Neshaminy?,/r/BucksCountyPA/comments/tjbrx7/pennsbury_or_neshaminy/i1lhqpn/,0,r/BucksCountyPA,0,0
I’m only in 8th grade but I’ve been to both. I went to Herbert Hoover for elementary then I went to Maple Point for middle school. Recently I moved to Pennsbury Charles Boehm middle school. In my opinion I liked Neshaminy more. There curriculum was better. But the teachers at Pennsbury have been nicer. Also Maple Point has more funding.,t2_khwjew7e,hunterfisherday26,0,1647903860.0,0,t1_i1lcg7j,i1lcg7j,True,Used-Mode1484,t3_tjbrx7,https://www.reddit.com/r/BucksCountyPA/comments/tjbrx7/pennsbury_or_neshaminy/,Pennsbury or Neshaminy?,/r/BucksCountyPA/comments/tjbrx7/pennsbury_or_neshaminy/i1lcg7j/,3,r/BucksCountyPA,0,3
Pennsbury,t2_abo2t,twatson215,0,1647903206.0,0,t1_i1laxhc,i1laxhc,True,Used-Mode1484,t3_tjbrx7,https://www.reddit.com/r/BucksCountyPA/comments/tjbrx7/pennsbury_or_neshaminy/,Pennsbury or Neshaminy?,/r/BucksCountyPA/comments/tjbrx7/pennsbury_or_neshaminy/i1laxhc/,2,r/BucksCountyPA,0,2
"Lol. I really got to disagree here. I can't tell you how many IEPs where special needs kids were basically told too bad how sad figure it out yourself. I have been in 3 IEPs for 3 different special Ed students where they were told ""we are not here to hold your hand"" when asking for even the most basic acomidations. .",t2_5rk4t,blinkdmb,0,1647903072.0,0,t1_i1lam89,i1lam89,False,Used-Mode1484,t3_tjbrx7,https://www.reddit.com/r/BucksCountyPA/comments/tjbrx7/pennsbury_or_neshaminy/,Pennsbury or Neshaminy?,/r/BucksCountyPA/comments/tjbrx7/pennsbury_or_neshaminy/i1lam89/,1,r/BucksCountyPA,0,1
I went to Neshaminy and really liked my experience there. My kids are in Pennsbury and they love it and we have been very happy. I don't think you can go wrong either way.,t2_5rk4t,blinkdmb,0,1647902844.0,0,t1_i1la32p,i1la32p,True,Used-Mode1484,t3_tjbrx7,https://www.reddit.com/r/BucksCountyPA/comments/tjbrx7/pennsbury_or_neshaminy/,Pennsbury or Neshaminy?,/r/BucksCountyPA/comments/tjbrx7/pennsbury_or_neshaminy/i1la32p/,5,r/BucksCountyPA,0,5
