body,author_fullname,author.name,controversiality,created,downs,fullname,id,is_root,link_author,link_id,link_permalink,link_title,permalink,score,subreddit_name_prefixed,total_awards_received,ups
"Co-op Records in Peoria, East Peoria and Pekin have it. More choices at East Peoria and Peoria, but Pekin store is okay.",t2_cnxud0wp,MisterJ1962,0,1641181647.0,0,t1_hr11pmr,hr11pmr,True,hotcaulk,t3_rufvdh,https://www.reddit.com/r/centralillinois/comments/rufvdh/where_can_i_buy_decent_kratom/,Where can I buy decent kratom?,/r/centralillinois/comments/rufvdh/where_can_i_buy_decent_kratom/hr11pmr/,1,r/centralillinois,0,1
"Can you buy online?  greenleafkratom .com,   after extensive research they're the only company I buy from.",t2_6ccogyzs,calvinbuddy1972,0,1641163894.0,0,t1_hqzuwq3,hqzuwq3,True,hotcaulk,t3_rufvdh,https://www.reddit.com/r/centralillinois/comments/rufvdh/where_can_i_buy_decent_kratom/,Where can I buy decent kratom?,/r/centralillinois/comments/rufvdh/where_can_i_buy_decent_kratom/hqzuwq3/,1,r/centralillinois,0,1
HappyHippoHerbals.com,t2_i5f982c4,SeedElite,0,1641163367.0,0,t1_hqztkbt,hqztkbt,True,hotcaulk,t3_rufvdh,https://www.reddit.com/r/centralillinois/comments/rufvdh/where_can_i_buy_decent_kratom/,Where can I buy decent kratom?,/r/centralillinois/comments/rufvdh/where_can_i_buy_decent_kratom/hqztkbt/,1,r/centralillinois,0,1
"I like the stuff at Upper Limits. The extracts are good there. Have to be careful with them though, some of them tend to make me sick and its easy to take too much. I like the Gold extract powders from Eversource (i think thats the name of the brand)",t2_31pcnlwf,movie_gremlin,0,1641154509.0,0,t1_hqz6l9b,hqz6l9b,True,hotcaulk,t3_rufvdh,https://www.reddit.com/r/centralillinois/comments/rufvdh/where_can_i_buy_decent_kratom/,Where can I buy decent kratom?,/r/centralillinois/comments/rufvdh/where_can_i_buy_decent_kratom/hqz6l9b/,1,r/centralillinois,0,1
Thanks. I was being a judgemental asshat and just assuming tobacco shop kratom can't be the best option.,t2_5zsbj,hotcaulk,0,1641154048.0,0,t1_hqz5av3,hqz5av3,False,hotcaulk,t3_rufvdh,https://www.reddit.com/r/centralillinois/comments/rufvdh/where_can_i_buy_decent_kratom/,Where can I buy decent kratom?,/r/centralillinois/comments/rufvdh/where_can_i_buy_decent_kratom/hqz5av3/,3,r/centralillinois,0,3
Your best bet is any Tobacco and Accessories shop. Gas station Kratom sucks ass. I work at a tobacco shop south of Peoria and we have a whole wall of it. I’m sure any tobacco shop up by you would have decent brands,t2_1gf2hodl,Muscrave,0,1641152723.0,0,t1_hqz1muv,hqz1muv,True,hotcaulk,t3_rufvdh,https://www.reddit.com/r/centralillinois/comments/rufvdh/where_can_i_buy_decent_kratom/,Where can I buy decent kratom?,/r/centralillinois/comments/rufvdh/where_can_i_buy_decent_kratom/hqz1muv/,5,r/centralillinois,0,5
"By the way, Everyone is highering!!!!",t2_124qq1,robidouix,0,1641008989.0,0,t1_hqrn9q8,hqrn9q8,False,DecaturStatistics,t3_rs7y1d,https://www.reddit.com/r/centralillinois/comments/rs7y1d/updated_decatur_unemployment_figures_released/,"Updated Decatur Unemployment Figures | released December 30, 2021",/r/centralillinois/comments/rs7y1d/updated_decatur_unemployment_figures_released/hqrn9q8/,1,r/centralillinois,0,1
"Ohhhh, thanks!",t2_124qq1,robidouix,0,1641008935.0,0,t1_hqrn5uz,hqrn5uz,False,DecaturStatistics,t3_rs7y1d,https://www.reddit.com/r/centralillinois/comments/rs7y1d/updated_decatur_unemployment_figures_released/,"Updated Decatur Unemployment Figures | released December 30, 2021",/r/centralillinois/comments/rs7y1d/updated_decatur_unemployment_figures_released/hqrn5uz/,1,r/centralillinois,0,1
Ffs=For fucks sake,t2_4kpfe,fourz,0,1640991647.0,0,t1_hqqnaea,hqqnaea,False,DecaturStatistics,t3_rs7y1d,https://www.reddit.com/r/centralillinois/comments/rs7y1d/updated_decatur_unemployment_figures_released/,"Updated Decatur Unemployment Figures | released December 30, 2021",/r/centralillinois/comments/rs7y1d/updated_decatur_unemployment_figures_released/hqqnaea/,1,r/centralillinois,0,1
"The 200 positions lost, for the basic purposes of the calculation are effectively part of the 300 who left the labor force. It breaks down simply to 

number actively seeking work / (number actively seeking work + number of people employed)  = unemployment rate

or better stated

number of unemployed / total labor force = unemployment rate",t2_50pww3a3,DecaturStatistics,0,1640988662.0,0,t1_hqqgodc,hqqgodc,False,DecaturStatistics,t3_rs7y1d,https://www.reddit.com/r/centralillinois/comments/rs7y1d/updated_decatur_unemployment_figures_released/,"Updated Decatur Unemployment Figures | released December 30, 2021",/r/centralillinois/comments/rs7y1d/updated_decatur_unemployment_figures_released/hqqgodc/,1,r/centralillinois,0,1
I am not sure how to gather that information.,t2_50pww3a3,DecaturStatistics,0,1640988251.0,0,t1_hqqfr16,hqqfr16,False,DecaturStatistics,t3_rs7y1d,https://www.reddit.com/r/centralillinois/comments/rs7y1d/updated_decatur_unemployment_figures_released/,"Updated Decatur Unemployment Figures | released December 30, 2021",/r/centralillinois/comments/rs7y1d/updated_decatur_unemployment_figures_released/hqqfr16/,2,r/centralillinois,0,2
"200 positions lost? 300 workers left the workforce? On the surface, you can conclude perhaps that the 300 workers might have been a part of that 200, but it keeps you wondering if the overall jobs lost was actually 100. Statistics was never my strong suit when it comes to reading the data. Having a bigger number next to a smaller number doesn't necessarily means it is greater than the lesser one in statistics.",t2_g1m2s,misspopuri,0,1640986920.0,0,t1_hqqcquq,hqqcquq,True,DecaturStatistics,t3_rs7y1d,https://www.reddit.com/r/centralillinois/comments/rs7y1d/updated_decatur_unemployment_figures_released/,"Updated Decatur Unemployment Figures | released December 30, 2021",/r/centralillinois/comments/rs7y1d/updated_decatur_unemployment_figures_released/hqqcquq/,2,r/centralillinois,0,2
You don't have numbers of businesses who claim they are hiring but actually aren't.,t2_d3hr9lr7,outofroad,0,1640977634.0,0,t1_hqpqtq6,hqpqtq6,False,DecaturStatistics,t3_rs7y1d,https://www.reddit.com/r/centralillinois/comments/rs7y1d/updated_decatur_unemployment_figures_released/,"Updated Decatur Unemployment Figures | released December 30, 2021",/r/centralillinois/comments/rs7y1d/updated_decatur_unemployment_figures_released/hqpqtq6/,2,r/centralillinois,0,2
I am not sure what you mean? I just pull the numbers and share them. They are linked at the beginning of the post for anyone skeptical.,t2_50pww3a3,DecaturStatistics,0,1640977141.0,0,t1_hqppmmj,hqppmmj,False,DecaturStatistics,t3_rs7y1d,https://www.reddit.com/r/centralillinois/comments/rs7y1d/updated_decatur_unemployment_figures_released/,"Updated Decatur Unemployment Figures | released December 30, 2021",/r/centralillinois/comments/rs7y1d/updated_decatur_unemployment_figures_released/hqppmmj/,2,r/centralillinois,0,2
What is ff’s?,t2_124qq1,robidouix,0,1640974711.0,0,t1_hqpjo8d,hqpjo8d,False,DecaturStatistics,t3_rs7y1d,https://www.reddit.com/r/centralillinois/comments/rs7y1d/updated_decatur_unemployment_figures_released/,"Updated Decatur Unemployment Figures | released December 30, 2021",/r/centralillinois/comments/rs7y1d/updated_decatur_unemployment_figures_released/hqpjo8d/,2,r/centralillinois,0,2
You seem easy to exploit.,t2_d3hr9lr7,outofroad,0,1640966694.0,0,t1_hqp00fy,hqp00fy,True,DecaturStatistics,t3_rs7y1d,https://www.reddit.com/r/centralillinois/comments/rs7y1d/updated_decatur_unemployment_figures_released/,"Updated Decatur Unemployment Figures | released December 30, 2021",/r/centralillinois/comments/rs7y1d/updated_decatur_unemployment_figures_released/hqp00fy/,2,r/centralillinois,0,2
Not if they aren't actually hiring ffs. You don't make sense.,t2_d3hr9lr7,outofroad,0,1640966660.0,0,t1_hqozxf5,hqozxf5,False,DecaturStatistics,t3_rs7y1d,https://www.reddit.com/r/centralillinois/comments/rs7y1d/updated_decatur_unemployment_figures_released/,"Updated Decatur Unemployment Figures | released December 30, 2021",/r/centralillinois/comments/rs7y1d/updated_decatur_unemployment_figures_released/hqozxf5/,2,r/centralillinois,0,2
Yup I know all that. With effort unless you are a complete reject or drug user there are plenty of jobs to be had.,t2_124qq1,robidouix,0,1640966622.0,0,t1_hqozu3k,hqozu3k,False,DecaturStatistics,t3_rs7y1d,https://www.reddit.com/r/centralillinois/comments/rs7y1d/updated_decatur_unemployment_figures_released/,"Updated Decatur Unemployment Figures | released December 30, 2021",/r/centralillinois/comments/rs7y1d/updated_decatur_unemployment_figures_released/hqozu3k/,1,r/centralillinois,0,1
"You do know that just being unemployed doesn't get you unemployment payments. There are a lot of unemployed who don't get it. While ON unemployment you have to prove that you not only applied but interviewed at hiring companies in order to collect.They apply for jobs and are told the company isn't actually hiring. They have to have made an effort to hire in order to not pay back the covid money. 
Look it up",t2_d3hr9lr7,outofroad,0,1640962317.0,0,t1_hqoq647,hqoq647,False,DecaturStatistics,t3_rs7y1d,https://www.reddit.com/r/centralillinois/comments/rs7y1d/updated_decatur_unemployment_figures_released/,"Updated Decatur Unemployment Figures | released December 30, 2021",/r/centralillinois/comments/rs7y1d/updated_decatur_unemployment_figures_released/hqoq647/,2,r/centralillinois,0,2
"Ahhhh, huh, um, ?",t2_124qq1,robidouix,0,1640961755.0,0,t1_hqoozsd,hqoozsd,False,DecaturStatistics,t3_rs7y1d,https://www.reddit.com/r/centralillinois/comments/rs7y1d/updated_decatur_unemployment_figures_released/,"Updated Decatur Unemployment Figures | released December 30, 2021",/r/centralillinois/comments/rs7y1d/updated_decatur_unemployment_figures_released/hqoozsd/,1,r/centralillinois,0,1
"They shouldn’t be unemployed, get a job!",t2_124qq1,robidouix,0,1640961680.0,0,t1_hqoou67,hqoou67,False,DecaturStatistics,t3_rs7y1d,https://www.reddit.com/r/centralillinois/comments/rs7y1d/updated_decatur_unemployment_figures_released/,"Updated Decatur Unemployment Figures | released December 30, 2021",/r/centralillinois/comments/rs7y1d/updated_decatur_unemployment_figures_released/hqoou67/,-2,r/centralillinois,0,-2
"Funny, there are tons of people applying for those jobs and finding that they aren't actually hiring. The companies have to pretend to be hiring, and then not hire, in order to not pay back the covid loans. They are stealing our tax dollars while you whine about unemployment.",t2_d3hr9lr7,outofroad,0,1640960922.0,0,t1_hqonao2,hqonao2,False,DecaturStatistics,t3_rs7y1d,https://www.reddit.com/r/centralillinois/comments/rs7y1d/updated_decatur_unemployment_figures_released/,"Updated Decatur Unemployment Figures | released December 30, 2021",/r/centralillinois/comments/rs7y1d/updated_decatur_unemployment_figures_released/hqonao2/,3,r/centralillinois,0,3
"ummm... wtf are you even talking about? i dont think there is anything but the regular unemployment benefits - no extra stuff anymore from pandemic, that was over long ago...  If there is additional anything, i am unaware... Do you just think there shouldn't be any unemployment anymore, or what? unemployment rates are similar to what they were before the pandemic..",t2_ei6sp,Cruserr,0,1640940305.0,0,t1_hqntuf6,hqntuf6,False,DecaturStatistics,t3_rs7y1d,https://www.reddit.com/r/centralillinois/comments/rs7y1d/updated_decatur_unemployment_figures_released/,"Updated Decatur Unemployment Figures | released December 30, 2021",/r/centralillinois/comments/rs7y1d/updated_decatur_unemployment_figures_released/hqntuf6/,3,r/centralillinois,0,3
"WTF, everywhere there are ads and signs for help wanted! Plenty of work if you want it. Shut off the unemployment benefits.",t2_124qq1,robidouix,0,1640911933.0,0,t1_hqmdh1i,hqmdh1i,True,DecaturStatistics,t3_rs7y1d,https://www.reddit.com/r/centralillinois/comments/rs7y1d/updated_decatur_unemployment_figures_released/,"Updated Decatur Unemployment Figures | released December 30, 2021",/r/centralillinois/comments/rs7y1d/updated_decatur_unemployment_figures_released/hqmdh1i/,-1,r/centralillinois,0,-1
Have you tried r/SpringfieldIL,t2_6fheh,RayErwin,0,1640825932.0,0,t1_hqhh6uj,hqhh6uj,True,Hookerwitpenis,t3_rrgd16,https://www.reddit.com/r/centralillinois/comments/rrgd16/home_poker_games/,Home Poker Games,/r/centralillinois/comments/rrgd16/home_poker_games/hqhh6uj/,2,r/centralillinois,0,2
"If they cover the tops of the lights, so the light is focused down, it will help. See if your street department would be on board.",t2_43py7,ThePiemaster,0,1640803046.0,0,t1_hqfvwm3,hqfvwm3,True,SealLionGar,t3_rqzdgj,https://www.reddit.com/r/centralillinois/comments/rqzdgj/about_light_pollution/,About Light Pollution,/r/centralillinois/comments/rqzdgj/about_light_pollution/hqfvwm3/,5,r/centralillinois,0,5
"I used to live in one of the darkest areas of Illinois. We could see the Milky Way. Now living in a city, I can count the stars in the sky. I miss it!",t2_6idh0so1,raisinghellwithtrees,0,1640784527.0,0,t1_hqeo8xv,hqeo8xv,True,SealLionGar,t3_rqzdgj,https://www.reddit.com/r/centralillinois/comments/rqzdgj/about_light_pollution/,About Light Pollution,/r/centralillinois/comments/rqzdgj/about_light_pollution/hqeo8xv/,9,r/centralillinois,0,9
Direct from my ongoing and infallible pessimism.,t2_43py7,ThePiemaster,0,1640707293.0,0,t1_hqag26k,hqag26k,False,great_scott1981,t3_rllkk8,https://www.reddit.com/r/centralillinois/comments/rllkk8/likely_cause_of_boom_heard_around_central/,Likely cause of “Boom” heard around central Illinois earlier - supersonic jet.,/r/centralillinois/comments/rllkk8/likely_cause_of_boom_heard_around_central/hqag26k/,1,r/centralillinois,0,1
They're real. I know,t2_7rqwolqb,George-Iowa66,0,1640581220.0,0,t1_hq423cp,hq423cp,False,ExamIllustrious3394,t3_ljh7zj,https://www.reddit.com/r/centralillinois/comments/ljh7zj/has_anyone_around_peoria_illinois_gotten_pictures/,Has anyone around Peoria Illinois gotten pictures of #BigFoot ? My friend swear he saw him last week walking across the top of a big bluff.,/r/centralillinois/comments/ljh7zj/has_anyone_around_peoria_illinois_gotten_pictures/hq423cp/,1,r/centralillinois,0,1
The guy is psychopathic. He is a direct and present danger to every citizen in Champaign County.,t2_2aftbc52,Rob_Bligidy,0,1640399298.0,0,t1_hpvk0e5,hpvk0e5,True,popularraspberry,t3_rn19os,https://www.reddit.com/r/centralillinois/comments/rn19os/champaign_county_sheriffs_office_knew_norman/,Champaign County Sheriff’s Office knew Norman Meeker had an alcohol problem for a decade. Why did it take a flipped truck and a DUI for Meeker to leave the force?,/r/centralillinois/comments/rn19os/champaign_county_sheriffs_office_knew_norman/hpvk0e5/,2,r/centralillinois,0,2
Damn right they do.,t2_1kxl67,Meatcircus23,0,1640366261.0,0,t1_hptsa3y,hptsa3y,False,popularraspberry,t3_rn19os,https://www.reddit.com/r/centralillinois/comments/rn19os/champaign_county_sheriffs_office_knew_norman/,Champaign County Sheriff’s Office knew Norman Meeker had an alcohol problem for a decade. Why did it take a flipped truck and a DUI for Meeker to leave the force?,/r/centralillinois/comments/rn19os/champaign_county_sheriffs_office_knew_norman/hptsa3y/,2,r/centralillinois,0,2
Black lives matter.,t2_ewcongrq,_MadGasser,0,1640362897.0,0,t1_hptkzzr,hptkzzr,True,popularraspberry,t3_rn19os,https://www.reddit.com/r/centralillinois/comments/rn19os/champaign_county_sheriffs_office_knew_norman/,Champaign County Sheriff’s Office knew Norman Meeker had an alcohol problem for a decade. Why did it take a flipped truck and a DUI for Meeker to leave the force?,/r/centralillinois/comments/rn19os/champaign_county_sheriffs_office_knew_norman/hptkzzr/,4,r/centralillinois,0,4
Because blue lives something something what about the Democrats something something Jesus something else how dare you lives on the line rabble rabble.,t2_5kdu2pcs,neurotactic,0,1640357479.0,0,t1_hpt9uhy,hpt9uhy,True,popularraspberry,t3_rn19os,https://www.reddit.com/r/centralillinois/comments/rn19os/champaign_county_sheriffs_office_knew_norman/,Champaign County Sheriff’s Office knew Norman Meeker had an alcohol problem for a decade. Why did it take a flipped truck and a DUI for Meeker to leave the force?,/r/centralillinois/comments/rn19os/champaign_county_sheriffs_office_knew_norman/hpt9uhy/,7,r/centralillinois,0,7
"Where are you 
I’m interested",t2_4ubpjed3,redtrucktom,0,1640275490.0,0,t1_hpp1uni,hpp1uni,True,femboi_iso_friends,t3_rmiuad,https://www.reddit.com/r/centralillinois/comments/rmiuad/jus_sayin/,Jus sayin’,/r/centralillinois/comments/rmiuad/jus_sayin/hpp1uni/,0,r/centralillinois,0,0
Tell us a bit more about yourself.,t2_n810u,ladyl4dy,0,1640261089.0,0,t1_hpoa3e9,hpoa3e9,True,femboi_iso_friends,t3_rmiuad,https://www.reddit.com/r/centralillinois/comments/rmiuad/jus_sayin/,Jus sayin’,/r/centralillinois/comments/rmiuad/jus_sayin/hpoa3e9/,0,r/centralillinois,0,0
Where do you live? What do you like to do?,t2_ekqgy5t1,Secure-Accident2242,1,1640226542.0,0,t1_hpmxwv3,hpmxwv3,True,femboi_iso_friends,t3_rmiuad,https://www.reddit.com/r/centralillinois/comments/rmiuad/jus_sayin/,Jus sayin’,/r/centralillinois/comments/rmiuad/jus_sayin/hpmxwv3/,1,r/centralillinois,0,1
I actually moved to StL sorry.,t2_9sg58vda,Mursing16557,0,1640219666.0,0,t1_hpmjioz,hpmjioz,False,Mursing16557,t3_m8kq0z,https://www.reddit.com/r/centralillinois/comments/m8kq0z/springfield_looking_to_kill_time_with_nerdy_stuff/,Springfield: Looking to kill time with nerdy stuff,/r/centralillinois/comments/m8kq0z/springfield_looking_to_kill_time_with_nerdy_stuff/hpmjioz/,1,r/centralillinois,0,1
Hi I love dnd and Rpgs… I’m from Springfield hmu,t2_ht01igpt,femboi_iso_friends,0,1640218889.0,0,t1_hpmhvfw,hpmhvfw,True,Mursing16557,t3_m8kq0z,https://www.reddit.com/r/centralillinois/comments/m8kq0z/springfield_looking_to_kill_time_with_nerdy_stuff/,Springfield: Looking to kill time with nerdy stuff,/r/centralillinois/comments/m8kq0z/springfield_looking_to_kill_time_with_nerdy_stuff/hpmhvfw/,1,r/centralillinois,0,1
"No seriously, I’d like to know. Can I have a link with my downvote?",t2_gxph9,Bloodymike,0,1640199718.0,0,t1_hpl8njj,hpl8njj,False,great_scott1981,t3_rllkk8,https://www.reddit.com/r/centralillinois/comments/rllkk8/likely_cause_of_boom_heard_around_central/,Likely cause of “Boom” heard around central Illinois earlier - supersonic jet.,/r/centralillinois/comments/rllkk8/likely_cause_of_boom_heard_around_central/hpl8njj/,2,r/centralillinois,0,2
It higher every time it gets posted.,t2_cjynjbsk,Gernafax,0,1640190953.0,0,t1_hpkmwnd,hpkmwnd,False,great_scott1981,t3_rllkk8,https://www.reddit.com/r/centralillinois/comments/rllkk8/likely_cause_of_boom_heard_around_central/,Likely cause of “Boom” heard around central Illinois earlier - supersonic jet.,/r/centralillinois/comments/rllkk8/likely_cause_of_boom_heard_around_central/hpkmwnd/,1,r/centralillinois,0,1
"Idk maybe it’s the ptsd from explosions that pissed me off. 1,700 was the initial report when the comment was posted.",t2_gxph9,Bloodymike,0,1640182130.0,0,t1_hpk2ps2,hpk2ps2,False,great_scott1981,t3_rllkk8,https://www.reddit.com/r/centralillinois/comments/rllkk8/likely_cause_of_boom_heard_around_central/,Likely cause of “Boom” heard around central Illinois earlier - supersonic jet.,/r/centralillinois/comments/rllkk8/likely_cause_of_boom_heard_around_central/hpk2ps2/,1,r/centralillinois,0,1
Where are you getting that from?,t2_gxph9,Bloodymike,0,1640182040.0,0,t1_hpk2j5v,hpk2j5v,False,great_scott1981,t3_rllkk8,https://www.reddit.com/r/centralillinois/comments/rllkk8/likely_cause_of_boom_heard_around_central/,Likely cause of “Boom” heard around central Illinois earlier - supersonic jet.,/r/centralillinois/comments/rllkk8/likely_cause_of_boom_heard_around_central/hpk2j5v/,1,r/centralillinois,0,1
Flightaware,t2_qxodk,TheGakGuru,0,1640180935.0,0,t1_hpk0cke,hpk0cke,False,great_scott1981,t3_rllkk8,https://www.reddit.com/r/centralillinois/comments/rllkk8/likely_cause_of_boom_heard_around_central/,Likely cause of “Boom” heard around central Illinois earlier - supersonic jet.,/r/centralillinois/comments/rllkk8/likely_cause_of_boom_heard_around_central/hpk0cke/,1,r/centralillinois,0,1
"Well, for one thing, it wasn't 1,700 mph. It was 1,100 mph.

Additionally, the mom driving 20 mph through a Target parking lot is much more dangerous statistically. So you really need to consider why it makes you so mad I guess. There's been no reports of damage, so property damage is a negligible argument. I felt/heard it in Springfield and it confused me for a while, but once I figured out what it was it gave me a sense of awe.

It's not something that happens often nor typically on purpose since it's been banned to fly supersonic over the US, so the pilot either had a good reason or will be severely reprimanded.",t2_qxodk,TheGakGuru,0,1640180699.0,0,t1_hpjzw7c,hpjzw7c,False,great_scott1981,t3_rllkk8,https://www.reddit.com/r/centralillinois/comments/rllkk8/likely_cause_of_boom_heard_around_central/,Likely cause of “Boom” heard around central Illinois earlier - supersonic jet.,/r/centralillinois/comments/rllkk8/likely_cause_of_boom_heard_around_central/hpjzw7c/,3,r/centralillinois,0,3
" Most private jets will be allowed supersonic soon, as long as it's only over the flyover states. Booms will be an hourly occurrence.",t2_43py7,ThePiemaster,0,1640177685.0,0,t1_hpjuoki,hpjuoki,False,great_scott1981,t3_rllkk8,https://www.reddit.com/r/centralillinois/comments/rllkk8/likely_cause_of_boom_heard_around_central/,Likely cause of “Boom” heard around central Illinois earlier - supersonic jet.,/r/centralillinois/comments/rllkk8/likely_cause_of_boom_heard_around_central/hpjuoki/,0,r/centralillinois,0,0
Get this crypto bullcrap out of my good Midwestern subreddit,t2_15rase,lazlopoof,0,1640173661.0,0,t1_hpjol1r,hpjol1r,True,juna9777,t3_rm20t7,https://www.reddit.com/r/centralillinois/comments/rm20t7/thank_you_very_much_for_your_trust_we_could_reach/,Thank you very much for your trust. We could reach a lot of Community members on our different social media channels! 😊😊,/r/centralillinois/comments/rm20t7/thank_you_very_much_for_your_trust_we_could_reach/hpjol1r/,1,r/centralillinois,0,1
Even in NE Iowa in the 60s it wasn't unusual to hear that. We were directly in the flight path for jets from SAC on training runs.,t2_hyazc,drlove57,0,1640170526.0,0,t1_hpjkh4z,hpjkh4z,True,great_scott1981,t3_rllkk8,https://www.reddit.com/r/centralillinois/comments/rllkk8/likely_cause_of_boom_heard_around_central/,Likely cause of “Boom” heard around central Illinois earlier - supersonic jet.,/r/centralillinois/comments/rllkk8/likely_cause_of_boom_heard_around_central/hpjkh4z/,1,r/centralillinois,0,1
"I remember hearing them all the time 25 years ago or so, before it was apparently outlawed to do it over populated areas.",t2_7i8q5g8k,s3v3red_cnc,0,1640164141.0,0,t1_hpjcwlt,hpjcwlt,True,great_scott1981,t3_rllkk8,https://www.reddit.com/r/centralillinois/comments/rllkk8/likely_cause_of_boom_heard_around_central/,Likely cause of “Boom” heard around central Illinois earlier - supersonic jet.,/r/centralillinois/comments/rllkk8/likely_cause_of_boom_heard_around_central/hpjcwlt/,1,r/centralillinois,0,1
It shook my house.,t2_cicl5fkx,megapackid,0,1640159828.0,0,t1_hpj7k8b,hpj7k8b,True,great_scott1981,t3_rllkk8,https://www.reddit.com/r/centralillinois/comments/rllkk8/likely_cause_of_boom_heard_around_central/,Likely cause of “Boom” heard around central Illinois earlier - supersonic jet.,/r/centralillinois/comments/rllkk8/likely_cause_of_boom_heard_around_central/hpj7k8b/,1,r/centralillinois,0,1
"Good point. I saw that too. I live in one of the nicer mobile home communities off Dirksen between clear lake and Sangamon. It shook my house. It’s a mobile home, yes but it’s a big one. There’s a few houses nearby in unincorporated areas that have an obsession with fireworks. At first that’s what I thought it was.",t2_gxph9,Bloodymike,0,1640139068.0,0,t1_hpi6qs9,hpi6qs9,False,great_scott1981,t3_rllkk8,https://www.reddit.com/r/centralillinois/comments/rllkk8/likely_cause_of_boom_heard_around_central/,Likely cause of “Boom” heard around central Illinois earlier - supersonic jet.,/r/centralillinois/comments/rllkk8/likely_cause_of_boom_heard_around_central/hpi6qs9/,2,r/centralillinois,0,2
"We had an aircraft that broke the sound barrier today and yet my capital airport put out an official statement that no aircraft was in the area. That's .....a problem. How am I supposed to trust anything the A.L. airport puts out after this?

I was more pissed about that than anything else. Don't F'ing lie to me.",t2_cycq4,livinitup0,0,1640137471.0,0,t1_hpi37v4,hpi37v4,False,great_scott1981,t3_rllkk8,https://www.reddit.com/r/centralillinois/comments/rllkk8/likely_cause_of_boom_heard_around_central/,Likely cause of “Boom” heard around central Illinois earlier - supersonic jet.,/r/centralillinois/comments/rllkk8/likely_cause_of_boom_heard_around_central/hpi37v4/,1,r/centralillinois,0,1
"My dad used to go backpacking in Shawnee NF in the 70s. It was much more remote back then. He loved telling a story about two military jets that flew right over the tree line above his head. They weren’t supersonic, but they were moving. 

The forest was really quiet. He heard a little sound, which had to be a pressure wave in front of the jets, looked up and then nearly got knocked over by the sound when they passed overhead.",t2_40vwu,explodeder,0,1640133166.0,0,t1_hphtqzv,hphtqzv,False,great_scott1981,t3_rllkk8,https://www.reddit.com/r/centralillinois/comments/rllkk8/likely_cause_of_boom_heard_around_central/,Likely cause of “Boom” heard around central Illinois earlier - supersonic jet.,/r/centralillinois/comments/rllkk8/likely_cause_of_boom_heard_around_central/hphtqzv/,5,r/centralillinois,0,5
