body,author_fullname,author.name,controversiality,created,downs,fullname,id,is_root,link_author,link_id,link_permalink,link_title,permalink,score,subreddit_name_prefixed,total_awards_received,ups
Everyone has their opinion. If I wanted to argue and state how I truly felt I would of. I’m literally just trying to spread love.,t2_e3vdm45j,Impossible_Owl1051,0,1637454627.0,0,t1_hlg87f3,hlg87f3,False,Impossible_Owl1051,t3_qyffpi,https://www.reddit.com/r/centralillinois/comments/qyffpi/you_are_so_loved_doesnt_matter_what_color_you_are/,You are so loved 💗 doesn’t matter what color you are✨ let’s come together as one ! Just spreading a little love! No hate please,/r/centralillinois/comments/qyffpi/you_are_so_loved_doesnt_matter_what_color_you_are/hlg87f3/,-7,r/centralillinois,0,-7
"I’m just going to point out that if a trial defines that someone is “not guilty”, that doesn’t make them “innocent”. Rittenhouse was found “not guilty” of the charges he was being prosecuted for. That does not mean the Justice system said he was innocent.",t2_4rby,TaTonka2000,0,1637454476.0,0,t1_hlg7vos,hlg7vos,False,Impossible_Owl1051,t3_qyffpi,https://www.reddit.com/r/centralillinois/comments/qyffpi/you_are_so_loved_doesnt_matter_what_color_you_are/,You are so loved 💗 doesn’t matter what color you are✨ let’s come together as one ! Just spreading a little love! No hate please,/r/centralillinois/comments/qyffpi/you_are_so_loved_doesnt_matter_what_color_you_are/hlg7vos/,7,r/centralillinois,0,7
"Wait are you trying to say that we’re going through hard because of injustices such as Rittenhouse being found innocent?

If so that has to be one of the worst takes I’ve seen on here.",t2_11yob8me,Kut_Throat1125,1,1637452931.0,0,t1_hlg4le4,hlg4le4,True,Impossible_Owl1051,t3_qyffpi,https://www.reddit.com/r/centralillinois/comments/qyffpi/you_are_so_loved_doesnt_matter_what_color_you_are/,You are so loved 💗 doesn’t matter what color you are✨ let’s come together as one ! Just spreading a little love! No hate please,/r/centralillinois/comments/qyffpi/you_are_so_loved_doesnt_matter_what_color_you_are/hlg4le4/,6,r/centralillinois,0,6
"if oj can murder white people, why can't he? EQUALITY!",t2_5ta6gda8,Disastrous_Review_99,0,1637452026.0,0,t1_hlg2mzu,hlg2mzu,True,Impossible_Owl1051,t3_qyffpi,https://www.reddit.com/r/centralillinois/comments/qyffpi/you_are_so_loved_doesnt_matter_what_color_you_are/,You are so loved 💗 doesn’t matter what color you are✨ let’s come together as one ! Just spreading a little love! No hate please,/r/centralillinois/comments/qyffpi/you_are_so_loved_doesnt_matter_what_color_you_are/hlg2mzu/,-9,r/centralillinois,0,-9
"The only injustice was the trial. Nice framing, it’s almost as good as CNN. Almost.",t2_8eo0r,nojob4acowboy,1,1637447202.0,0,t1_hlfs46z,hlfs46z,True,Impossible_Owl1051,t3_qyffpi,https://www.reddit.com/r/centralillinois/comments/qyffpi/you_are_so_loved_doesnt_matter_what_color_you_are/,You are so loved 💗 doesn’t matter what color you are✨ let’s come together as one ! Just spreading a little love! No hate please,/r/centralillinois/comments/qyffpi/you_are_so_loved_doesnt_matter_what_color_you_are/hlfs46z/,9,r/centralillinois,0,9
I totally agree but this post is just to let everyone remember to be kind to one another. It is easy for us to blame one another so I just thought I’d spread a little positivity and love.,t2_e3vdm45j,Impossible_Owl1051,0,1637444707.0,0,t1_hlfmm3k,hlfmm3k,False,Impossible_Owl1051,t3_qyffpi,https://www.reddit.com/r/centralillinois/comments/qyffpi/you_are_so_loved_doesnt_matter_what_color_you_are/,You are so loved 💗 doesn’t matter what color you are✨ let’s come together as one ! Just spreading a little love! No hate please,/r/centralillinois/comments/qyffpi/you_are_so_loved_doesnt_matter_what_color_you_are/hlfmm3k/,8,r/centralillinois,0,8
Yeah...that single youth is the reason why we are going through hard times...,t2_drw8ba56,notphysically,0,1637444496.0,0,t1_hlfm5ds,hlfm5ds,True,Impossible_Owl1051,t3_qyffpi,https://www.reddit.com/r/centralillinois/comments/qyffpi/you_are_so_loved_doesnt_matter_what_color_you_are/,You are so loved 💗 doesn’t matter what color you are✨ let’s come together as one ! Just spreading a little love! No hate please,/r/centralillinois/comments/qyffpi/you_are_so_loved_doesnt_matter_what_color_you_are/hlfm5ds/,-6,r/centralillinois,0,-6
"You also get access to the lounge in Chicago (and probably other big cities), if memory serves me correctly. That in itself is a much better deal rather than sitting in the general waiting area in Chicago.",t2_f590e1fd,Inevitable_Monk1282,0,1637297067.0,0,t1_hl7tkx7,hl7tkx7,True,catdogwoman,t3_pi1amr,https://www.reddit.com/r/centralillinois/comments/pi1amr/is_business_class_on_the_amtrak_to_chicago_worth/,Is Business class on the Amtrak to Chicago worth the extra $40 to $60?,/r/centralillinois/comments/pi1amr/is_business_class_on_the_amtrak_to_chicago_worth/hl7tkx7/,1,r/centralillinois,0,1
People should ask before they open their mouth about anything they know nothing about.,t2_g5urecz0,Hot_Software_3187,0,1636955336.0,0,t1_hkosno3,hkosno3,True,Hot_Software_3187,t3_qu86un,https://www.reddit.com/r/centralillinois/comments/qu86un/looking_for_couples_to_play_with/,Looking for couples to play with.,/r/centralillinois/comments/qu86un/looking_for_couples_to_play_with/hkosno3/,1,r/centralillinois,0,1
What is kys,t2_g5urecz0,Hot_Software_3187,0,1636955179.0,0,t1_hkoserr,hkoserr,True,Hot_Software_3187,t3_qu86un,https://www.reddit.com/r/centralillinois/comments/qu86un/looking_for_couples_to_play_with/,Looking for couples to play with.,/r/centralillinois/comments/qu86un/looking_for_couples_to_play_with/hkoserr/,1,r/centralillinois,0,1
"Not dirty clothes dude,clean clothes just hadn't put them away yet dude",t2_g5urecz0,Hot_Software_3187,0,1636954817.0,0,t1_hkoru3b,hkoru3b,True,Hot_Software_3187,t3_qu86un,https://www.reddit.com/r/centralillinois/comments/qu86un/looking_for_couples_to_play_with/,Looking for couples to play with.,/r/centralillinois/comments/qu86un/looking_for_couples_to_play_with/hkoru3b/,1,r/centralillinois,0,1
Kys,t2_d2w0jg7t,hgfddj,0,1636951596.0,0,t1_hkomgc0,hkomgc0,True,Hot_Software_3187,t3_qu86un,https://www.reddit.com/r/centralillinois/comments/qu86un/looking_for_couples_to_play_with/,Looking for couples to play with.,/r/centralillinois/comments/qu86un/looking_for_couples_to_play_with/hkomgc0/,2,r/centralillinois,0,2
You're def in the wrong place dude. Gross!! w/ all those dirty clothes in the pic....ewwwww. Nasty.,t2_6ccogyzs,calvinbuddy1972,0,1636951577.0,0,t1_hkomf63,hkomf63,True,Hot_Software_3187,t3_qu86un,https://www.reddit.com/r/centralillinois/comments/qu86un/looking_for_couples_to_play_with/,Looking for couples to play with.,/r/centralillinois/comments/qu86un/looking_for_couples_to_play_with/hkomf63/,5,r/centralillinois,0,5
"I will not elaborate on the various process by which I came to this theory for lack of time,but I am of the belief that the vortex at Cahokia enables the various, not quite human or non corporeal “what-have-yous”,passage between here and there( though I have not been able to fully understand or experience what or where “there” is,or how many “theres” we are talking about.)
I am uncertain about the human consciousness (aka internet conjured) “new” humanoid creatures,but much of what some of our ancestors or elders that have gifts or taught traditions have said for many many generations, is that there are things that walk  between,and those have not changed over the years and span regions and continents with little variation. Anyone who is even mildly sensitive or intuitive will not be able to ignore or avoid this gap in space/time/whatever it is when near said vortex-even if you dont know what is off,your body does,and for some
that is accompanied by sight-. The fact ancestors across cultures took some of this understanding as serious as other human threats or threats of known animal predators by
keeping a healthy fear and respect,as well as attempting to minimize sensationalism,speaks to how we should also approach our quest for understanding that which we have not fully understood or proven.",t2_3yj39rgb,Legitimate-Coffee-25,0,1636762357.0,0,t1_hkecx06,hkecx06,True,Ghoulish-Geek,t3_p8j0ce,https://www.reddit.com/r/centralillinois/comments/p8j0ce/skinwalker_sighting_in_central_il/,Skinwalker Sighting in Central IL,/r/centralillinois/comments/p8j0ce/skinwalker_sighting_in_central_il/hkecx06/,1,r/centralillinois,0,1
It is in conference room 1/2 at Eastland suites,t2_hk5g8,YosarianiLives,0,1636756867.0,0,t1_hke173j,hke173j,False,YosarianiLives,t3_qr2wna,https://www.reddit.com/r/centralillinois/comments/qr2wna/liquid_nitrogen_overclocking_event_bloomington/,liquid nitrogen overclocking event (bloomington),/r/centralillinois/comments/qr2wna/liquid_nitrogen_overclocking_event_bloomington/hke173j/,1,r/centralillinois,0,1
is this in one of the event halls or where is it being hosted there?,t2_aozlu,idontbelieveyouguy,0,1636756210.0,0,t1_hkdzr47,hkdzr47,True,YosarianiLives,t3_qr2wna,https://www.reddit.com/r/centralillinois/comments/qr2wna/liquid_nitrogen_overclocking_event_bloomington/,liquid nitrogen overclocking event (bloomington),/r/centralillinois/comments/qr2wna/liquid_nitrogen_overclocking_event_bloomington/hkdzr47/,1,r/centralillinois,0,1
"home broad is different even than DIA, and DC connections should not be compared with home internet at all. not to mention power and security.",t2_aozlu,idontbelieveyouguy,0,1636755938.0,0,t1_hkdz59n,hkdz59n,False,Maelst0rm,t3_qse4h4,https://www.reddit.com/r/centralillinois/comments/qse4h4/colo_locations/,COLO locations,/r/centralillinois/comments/qse4h4/colo_locations/hkdz59n/,2,r/centralillinois,0,2
"The only a couple places i know around Peoria/Bloomington is [A5 which is now called Pearl Technologies](https://pearltechnology.com/Services/Colocation). there used to be a couple more but i can't seem to figure out that they were called now. honestly i would not colocate anyway it's typically way more expensive than just leasing nice gear from a DC.

i noticed a comment that said you have 7+ TB that's pretty nominal for storage these days. i host most of my stuff [HERE](https://billing.dacentec.com/hostbill/) they also do colocation, rent to own and un-metered connections. if you have any questions let me know!",t2_aozlu,idontbelieveyouguy,0,1636755572.0,0,t1_hkdyc52,hkdyc52,True,Maelst0rm,t3_qse4h4,https://www.reddit.com/r/centralillinois/comments/qse4h4/colo_locations/,COLO locations,/r/centralillinois/comments/qse4h4/colo_locations/hkdyc52/,2,r/centralillinois,0,2
I assume i3 Broadband doesn't service your house? I just got them installed and they're pretty great.,t2_3xv1n,Captain_Quark,0,1636742795.0,0,t1_hkd4pm4,hkd4pm4,True,Maelst0rm,t3_qse4h4,https://www.reddit.com/r/centralillinois/comments/qse4h4/colo_locations/,COLO locations,/r/centralillinois/comments/qse4h4/colo_locations/hkd4pm4/,3,r/centralillinois,0,3
I also have 7+tb of media and that costs a bunch per month to store in the cloud.,t2_f58jn,Maelst0rm,0,1636736691.0,0,t1_hkcprht,hkcprht,False,Maelst0rm,t3_qse4h4,https://www.reddit.com/r/centralillinois/comments/qse4h4/colo_locations/,COLO locations,/r/centralillinois/comments/qse4h4/colo_locations/hkcprht/,1,r/centralillinois,0,1
Do you need colo? Isn't virtual hosting good enough for hosting games and such?,t2_425w,Suppafly,0,1636736553.0,0,t1_hkcpf96,hkcpf96,True,Maelst0rm,t3_qse4h4,https://www.reddit.com/r/centralillinois/comments/qse4h4/colo_locations/,COLO locations,/r/centralillinois/comments/qse4h4/colo_locations/hkcpf96/,1,r/centralillinois,0,1
"Show up any time that works for you, no requirement to stay.",t2_hk5g8,YosarianiLives,0,1636601166.0,0,t1_hk5pzxl,hk5pzxl,False,YosarianiLives,t3_qr2wna,https://www.reddit.com/r/centralillinois/comments/qr2wna/liquid_nitrogen_overclocking_event_bloomington/,liquid nitrogen overclocking event (bloomington),/r/centralillinois/comments/qr2wna/liquid_nitrogen_overclocking_event_bloomington/hk5pzxl/,2,r/centralillinois,0,2
Just pour some cryogenic fluid onto the cpu make it go brrrrrrr,t2_hk5g8,YosarianiLives,0,1636599315.0,0,t1_hk5m0fc,hk5m0fc,False,YosarianiLives,t3_qr2wna,https://www.reddit.com/r/centralillinois/comments/qr2wna/liquid_nitrogen_overclocking_event_bloomington/,liquid nitrogen overclocking event (bloomington),/r/centralillinois/comments/qr2wna/liquid_nitrogen_overclocking_event_bloomington/hk5m0fc/,2,r/centralillinois,0,2
Wait so my liquid cooler is… bruhhhh that’s tight,t2_g9tmhccq,Chaaaals,0,1636599015.0,0,t1_hk5lcdv,hk5lcdv,True,YosarianiLives,t3_qr2wna,https://www.reddit.com/r/centralillinois/comments/qr2wna/liquid_nitrogen_overclocking_event_bloomington/,liquid nitrogen overclocking event (bloomington),/r/centralillinois/comments/qr2wna/liquid_nitrogen_overclocking_event_bloomington/hk5lcdv/,2,r/centralillinois,0,2
Lol I didn't mean that but I meant it sound interesting..but cool yeah..,t2_a1s5ktge,ExamIllustrious3394,0,1636598205.0,0,t1_hk5jjfv,hk5jjfv,False,YosarianiLives,t3_qr2wna,https://www.reddit.com/r/centralillinois/comments/qr2wna/liquid_nitrogen_overclocking_event_bloomington/,liquid nitrogen overclocking event (bloomington),/r/centralillinois/comments/qr2wna/liquid_nitrogen_overclocking_event_bloomington/hk5jjfv/,2,r/centralillinois,0,2
I see what you did there,t2_88t0p,tbare,0,1636594670.0,0,t1_hk5bkon,hk5bkon,False,YosarianiLives,t3_qr2wna,https://www.reddit.com/r/centralillinois/comments/qr2wna/liquid_nitrogen_overclocking_event_bloomington/,liquid nitrogen overclocking event (bloomington),/r/centralillinois/comments/qr2wna/liquid_nitrogen_overclocking_event_bloomington/hk5bkon/,1,r/centralillinois,0,1
Sounds cool,t2_a1s5ktge,ExamIllustrious3394,0,1636582929.0,0,t1_hk4kozl,hk4kozl,True,YosarianiLives,t3_qr2wna,https://www.reddit.com/r/centralillinois/comments/qr2wna/liquid_nitrogen_overclocking_event_bloomington/,liquid nitrogen overclocking event (bloomington),/r/centralillinois/comments/qr2wna/liquid_nitrogen_overclocking_event_bloomington/hk4kozl/,7,r/centralillinois,0,7
The Lincoln Elks course is my favorite hidden golf gem here locally.,t2_8vj7jnhh,Small_Reception4780,0,1636484425.0,0,t1_hjywxq3,hjywxq3,True,zaikanekochan,t3_iel5v0,https://www.reddit.com/r/centralillinois/comments/iel5v0/golf/,Golf,/r/centralillinois/comments/iel5v0/golf/hjywxq3/,2,r/centralillinois,0,2
I posted on there as well,t2_112jta,CrowKing705,0,1636203583.0,0,t1_hjjn85o,hjjn85o,False,[deleted],t3_qngaqm,https://www.reddit.com/r/centralillinois/comments/qngaqm/deleted_by_user/,[deleted by user],/r/centralillinois/comments/qngaqm/deleted_by_user/hjjn85o/,1,r/centralillinois,0,1
Might have more luck on the UIUC subreddit,t2_2t4zywnb,SierraPapaHotel,0,1636166617.0,0,t1_hji4jur,hji4jur,True,[deleted],t3_qngaqm,https://www.reddit.com/r/centralillinois/comments/qngaqm/deleted_by_user/,[deleted by user],/r/centralillinois/comments/qngaqm/deleted_by_user/hji4jur/,2,r/centralillinois,0,2
Link worked for me,t2_2unyvfgu,miss-frizz,0,1636085813.0,0,t1_hjdl3ee,hjdl3ee,True,Camri-Middleton,t3_qmssoo,https://www.reddit.com/r/centralillinois/comments/qmssoo/online_learning_survey/,Online Learning Survey,/r/centralillinois/comments/qmssoo/online_learning_survey/hjdl3ee/,1,r/centralillinois,0,1
Still doesn’t work mate,t2_2wvekajo,Atlastheafterman,0,1636069949.0,0,t1_hjcnmrt,hjcnmrt,False,Camri-Middleton,t3_qmssoo,https://www.reddit.com/r/centralillinois/comments/qmssoo/online_learning_survey/,Online Learning Survey,/r/centralillinois/comments/qmssoo/online_learning_survey/hjcnmrt/,2,r/centralillinois,0,2
">https://maryville.az1.qualtrics.com/jfe/form/SV\_7UthjQs6Er24GEu

https://maryville.az1.qualtrics.com/jfe/form/SV\_7UthjQs6Er24GEu",t2_9xelkt8p,Camri-Middleton,0,1636057679.0,0,t1_hjbtqxd,hjbtqxd,False,Camri-Middleton,t3_qmssoo,https://www.reddit.com/r/centralillinois/comments/qmssoo/online_learning_survey/,Online Learning Survey,/r/centralillinois/comments/qmssoo/online_learning_survey/hjbtqxd/,1,r/centralillinois,0,1
Link isn’t working,t2_3igbky5c,buffalobutt12,0,1636056524.0,0,t1_hjbqrow,hjbqrow,True,Camri-Middleton,t3_qmssoo,https://www.reddit.com/r/centralillinois/comments/qmssoo/online_learning_survey/,Online Learning Survey,/r/centralillinois/comments/qmssoo/online_learning_survey/hjbqrow/,1,r/centralillinois,0,1
"Because salary ranges are sometimes extremely large, and are dependent on education and experience.  Someone with 20 years' experience as a production manager, 20 years' experience in a heavy metal fabrication company, or even both of those is going to likely be offered a larger compensation package than someone who meets the qualifications but doesn't have as much experience.

I usually ask in the interview what the range is.  I've walked out of interviews after hearing the pay range if it wasn't even in the ballpark.",t2_10kypb,Jakebob70,0,1635965917.0,0,t1_hj6nkih,hj6nkih,False,pbrigman00,t3_ql7exe,https://www.reddit.com/r/centralillinois/comments/ql7exe/seeking_a_production_manager_in_morton_il_for_a/,"Seeking a Production Manager in Morton, IL for a heavy metal fabrication company.",/r/centralillinois/comments/ql7exe/seeking_a_production_manager_in_morton_il_for_a/hj6nkih/,2,r/centralillinois,0,2
Just post it. Is it different if your avatar is pink?,t2_9e57c,Fish-x-5,0,1635912224.0,0,t1_hj3vtua,hj3vtua,False,pbrigman00,t3_ql7exe,https://www.reddit.com/r/centralillinois/comments/ql7exe/seeking_a_production_manager_in_morton_il_for_a/,"Seeking a Production Manager in Morton, IL for a heavy metal fabrication company.",/r/centralillinois/comments/ql7exe/seeking_a_production_manager_in_morton_il_for_a/hj3vtua/,6,r/centralillinois,0,6
"Oh I know. I'm just surprised that more workers aren't like you, and that more businesses haven't figured out that they can get more and better applicants if they post wages.",t2_3xv1n,Captain_Quark,0,1635900918.0,0,t1_hj361kh,hj361kh,False,pbrigman00,t3_ql7exe,https://www.reddit.com/r/centralillinois/comments/ql7exe/seeking_a_production_manager_in_morton_il_for_a/,"Seeking a Production Manager in Morton, IL for a heavy metal fabrication company.",/r/centralillinois/comments/ql7exe/seeking_a_production_manager_in_morton_il_for_a/hj361kh/,4,r/centralillinois,0,4
"To keep everyone in the dark, so you can’t compare. I don’t even respond to most ads or emails that don’t quote salary or hourly wage. I’m in software development though, where it’s not uncommon to mention it in a job posting.",t2_cq7qniox,oyoxico,0,1635900759.0,0,t1_hj35nxd,hj35nxd,False,pbrigman00,t3_ql7exe,https://www.reddit.com/r/centralillinois/comments/ql7exe/seeking_a_production_manager_in_morton_il_for_a/,"Seeking a Production Manager in Morton, IL for a heavy metal fabrication company.",/r/centralillinois/comments/ql7exe/seeking_a_production_manager_in_morton_il_for_a/hj35nxd/,6,r/centralillinois,0,6
I don't understand why it's standard not to post salary ranges in job postings.,t2_3xv1n,Captain_Quark,0,1635900168.0,0,t1_hj3494z,hj3494z,True,pbrigman00,t3_ql7exe,https://www.reddit.com/r/centralillinois/comments/ql7exe/seeking_a_production_manager_in_morton_il_for_a/,"Seeking a Production Manager in Morton, IL for a heavy metal fabrication company.",/r/centralillinois/comments/ql7exe/seeking_a_production_manager_in_morton_il_for_a/hj3494z/,10,r/centralillinois,0,10
bold you to assume Chicago works,t2_7omxw703,candyl0ppy,0,1635896034.0,0,t1_hj2u8wm,hj2u8wm,True,JusticeAvenger618,t3_pcvlep,https://www.reddit.com/r/centralillinois/comments/pcvlep/il_is_broken_as_an_utterly_nonfunctioning_state/,IL Is Broken As An Utterly Nonfunctioning State,/r/centralillinois/comments/pcvlep/il_is_broken_as_an_utterly_nonfunctioning_state/hj2u8wm/,1,r/centralillinois,0,1
DMed you. Thanks for the response.,t2_51wgfxck,pbrigman00,0,1635894306.0,0,t1_hj2q222,hj2q222,False,pbrigman00,t3_ql7exe,https://www.reddit.com/r/centralillinois/comments/ql7exe/seeking_a_production_manager_in_morton_il_for_a/,"Seeking a Production Manager in Morton, IL for a heavy metal fabrication company.",/r/centralillinois/comments/ql7exe/seeking_a_production_manager_in_morton_il_for_a/hj2q222/,-3,r/centralillinois,0,-3
What is salary range?,t2_5kl29,jason28,0,1635888315.0,0,t1_hj2b0yc,hj2b0yc,True,pbrigman00,t3_ql7exe,https://www.reddit.com/r/centralillinois/comments/ql7exe/seeking_a_production_manager_in_morton_il_for_a/,"Seeking a Production Manager in Morton, IL for a heavy metal fabrication company.",/r/centralillinois/comments/ql7exe/seeking_a_production_manager_in_morton_il_for_a/hj2b0yc/,7,r/centralillinois,0,7
"Heartland Behavioral- Peoria and Bloomingtón, Elliott Counseling--Champaign/Urbana",t2_3tbriewc,Aromatic_Length_1540,0,1635848635.0,0,t1_hizttko,hizttko,True,[deleted],t3_ppqi8f,https://www.reddit.com/r/centralillinois/comments/ppqi8f/psychiatrists_that_take_health_alliance/,Psychiatrists that take Health Alliance?????,/r/centralillinois/comments/ppqi8f/psychiatrists_that_take_health_alliance/hizttko/,1,r/centralillinois,0,1
Try posting on r/veterinary and a number of veterinary doctors could give ideas,t2_22hbr5ft,pfarnham,0,1635797536.0,0,t1_hixb3y1,hixb3y1,True,wonderfuldisgrace92,t3_qkk0rv,https://www.reddit.com/r/centralillinois/comments/qkk0rv/please_help_my_baby/,Please help my baby,/r/centralillinois/comments/qkk0rv/please_help_my_baby/hixb3y1/,3,r/centralillinois,0,3
"I agree to this, however we don't know anyone that uses oxygen 😔",t2_g3qx43xw,wonderfuldisgrace92,0,1635796910.0,0,t1_hix9jh8,hix9jh8,False,wonderfuldisgrace92,t3_qkk0rv,https://www.reddit.com/r/centralillinois/comments/qkk0rv/please_help_my_baby/,Please help my baby,/r/centralillinois/comments/qkk0rv/please_help_my_baby/hix9jh8/,3,r/centralillinois,0,3
Can you see if if you know anyone who already has oxygen maybe they could lend you one? Man that's really some BS that they can charge so much for service for dogs because the health department will hand them out to people that need them.,t2_a1s5ktge,ExamIllustrious3394,0,1635796460.0,0,t1_hix8f7o,hix8f7o,True,wonderfuldisgrace92,t3_qkk0rv,https://www.reddit.com/r/centralillinois/comments/qkk0rv/please_help_my_baby/,Please help my baby,/r/centralillinois/comments/qkk0rv/please_help_my_baby/hix8f7o/,2,r/centralillinois,0,2
"Try setting up a go fund me. Some vets also offer financing, some with 0% APR. I know VCA does",t2_3igbky5c,buffalobutt12,0,1635792988.0,0,t1_hiwzxbh,hiwzxbh,False,wonderfuldisgrace92,t3_qkk0rv,https://www.reddit.com/r/centralillinois/comments/qkk0rv/please_help_my_baby/,Please help my baby,/r/centralillinois/comments/qkk0rv/please_help_my_baby/hiwzxbh/,4,r/centralillinois,0,4
"He ran into a moving car yesterday after he and his sister got out of the house, we believe he jumped in front of her to protect her as she is not hurt by any means. His paw has stitches, scrapes all over his body, he was struggling through the night with breathing so we took him in and we found out that he has pulmonary contusions and they want him on oxygen but we can't pay it, due to unexpected bills occurring, so we brought him home, called a few other vets talked to them, also my sister talked to her boss in California, we live in Illinois, and got a bunch of advice on how to care for him at home, but his odds of survival are not as good without the oxygen, we are hoping, praying that he can survive this 💙",t2_g3qx43xw,wonderfuldisgrace92,0,1635792629.0,0,t1_hiwz1zw,hiwz1zw,False,wonderfuldisgrace92,t3_qkk0rv,https://www.reddit.com/r/centralillinois/comments/qkk0rv/please_help_my_baby/,Please help my baby,/r/centralillinois/comments/qkk0rv/please_help_my_baby/hiwz1zw/,4,r/centralillinois,0,4
What’s wrong with the pup,t2_3igbky5c,buffalobutt12,0,1635792379.0,0,t1_hiwyg04,hiwyg04,True,wonderfuldisgrace92,t3_qkk0rv,https://www.reddit.com/r/centralillinois/comments/qkk0rv/please_help_my_baby/,Please help my baby,/r/centralillinois/comments/qkk0rv/please_help_my_baby/hiwyg04/,3,r/centralillinois,0,3
"Possibly share and send good vibes his way, thank you for asking 💙",t2_g3qx43xw,wonderfuldisgrace92,0,1635792198.0,0,t1_hiwy008,hiwy008,False,wonderfuldisgrace92,t3_qkk0rv,https://www.reddit.com/r/centralillinois/comments/qkk0rv/please_help_my_baby/,Please help my baby,/r/centralillinois/comments/qkk0rv/please_help_my_baby/hiwy008/,3,r/centralillinois,0,3
I am not a veterinarian or social media influencer. Is there another way I can help?,t2_lj6nc,took_a_bath,0,1635792151.0,0,t1_hiwxvvz,hiwxvvz,True,wonderfuldisgrace92,t3_qkk0rv,https://www.reddit.com/r/centralillinois/comments/qkk0rv/please_help_my_baby/,Please help my baby,/r/centralillinois/comments/qkk0rv/please_help_my_baby/hiwxvvz/,2,r/centralillinois,0,2
"Ok, you’re telling me I’m going to be isolated from people like you and I’m supposed to feel bad about that. 
🤣🤣🤣🤣🤣🤣🤣🤣🤣🤣🤣🤣🤣🤣🤣",t2_c9kkhvcx,starthrower68,0,1635699555.0,0,t1_his70il,his70il,False,[deleted],t3_pplqfv,https://www.reddit.com/r/centralillinois/comments/pplqfv/deleted_by_user/,[deleted by user],/r/centralillinois/comments/pplqfv/deleted_by_user/his70il/,1,r/centralillinois,0,1
Communists believe their exempt from math unless it works in their favor.,t2_c9kkhvcx,starthrower68,0,1635699386.0,0,t1_his6mb0,his6mb0,False,[deleted],t3_pplqfv,https://www.reddit.com/r/centralillinois/comments/pplqfv/deleted_by_user/,[deleted by user],/r/centralillinois/comments/pplqfv/deleted_by_user/his6mb0/,1,r/centralillinois,0,1
Your terms are acceptable.,t2_c9kkhvcx,starthrower68,0,1635698378.0,0,t1_his4amp,his4amp,False,[deleted],t3_pplqfv,https://www.reddit.com/r/centralillinois/comments/pplqfv/deleted_by_user/,[deleted by user],/r/centralillinois/comments/pplqfv/deleted_by_user/his4amp/,1,r/centralillinois,0,1
