body,author_fullname,author.name,controversiality,created,downs,fullname,id,is_root,link_author,link_id,link_permalink,link_title,permalink,score,subreddit_name_prefixed,total_awards_received,ups
I used to let anyone and everyone stop at my property while they kayaked floated down the makinaw river. Then people started showing up and trashing the place and leaving beer cans and tearing up the property. I understand now why the old folks around me are so bitter to strangers,t2_8cuh0p3e,Competitive_Lake_614,0,1648607994.0,0,t1_i2o10mb,i2o10mb,True,The_Not_Visible_Man,t3_tkk54d,https://www.reddit.com/r/centralillinois/comments/tkk54d/the_illinois_supreme_court_is_being_asked_to/,The Illinois Supreme Court is being asked to decide the extent to which property owners can block anyone else from accessing a river that runs through their property.,/r/centralillinois/comments/tkk54d/the_illinois_supreme_court_is_being_asked_to/i2o10mb/,1,r/centralillinois,0,1
"> I thought you could access any water navigatable from the channel of any river.

Which seems to be the case here, so I'm not sure why it's going to Ill Supreme Court, it seems cut and dried in the boaters favor. Honestly, I'm surprised it's got to this point anyway, he should have a easement of necessity since the middle property is the only connection between his two properties.",t2_425w,Suppafly,0,1648570421.0,0,t1_i2kwlu6,i2kwlu6,False,The_Not_Visible_Man,t3_tkk54d,https://www.reddit.com/r/centralillinois/comments/tkk54d/the_illinois_supreme_court_is_being_asked_to/,The Illinois Supreme Court is being asked to decide the extent to which property owners can block anyone else from accessing a river that runs through their property.,/r/centralillinois/comments/tkk54d/the_illinois_supreme_court_is_being_asked_to/i2kwlu6/,2,r/centralillinois,0,2
"Next, you will tell us that they found an honest politician in Illinois!",t2_hraadhv3,GregD1965,0,1648570294.0,0,t1_i2kw9s9,i2kw9s9,True,Justme3899,t3_rgas5b,https://www.reddit.com/r/centralillinois/comments/rgas5b/reported_bigfoot_sighting_in_cass_stirring/,Reported 'Bigfoot' sighting in Cass stirring interest,/r/centralillinois/comments/rgas5b/reported_bigfoot_sighting_in_cass_stirring/i2kw9s9/,1,r/centralillinois,0,1
Guess he was entitled to due process like everyone else. Damn cops....,t2_hraadhv3,GregD1965,0,1648570214.0,0,t1_i2kw282,i2kw282,True,popularraspberry,t3_rn19os,https://www.reddit.com/r/centralillinois/comments/rn19os/champaign_county_sheriffs_office_knew_norman/,Champaign County Sheriff’s Office knew Norman Meeker had an alcohol problem for a decade. Why did it take a flipped truck and a DUI for Meeker to leave the force?,/r/centralillinois/comments/rn19os/champaign_county_sheriffs_office_knew_norman/i2kw282/,1,r/centralillinois,0,1
"Unless the law has changed, I thought you could access any water navigatable from the channel of any river. Once over private land, I think it is illegal to anchor.",t2_hraadhv3,GregD1965,0,1648569945.0,0,t1_i2kvd52,i2kvd52,False,The_Not_Visible_Man,t3_tkk54d,https://www.reddit.com/r/centralillinois/comments/tkk54d/the_illinois_supreme_court_is_being_asked_to/,The Illinois Supreme Court is being asked to decide the extent to which property owners can block anyone else from accessing a river that runs through their property.,/r/centralillinois/comments/tkk54d/the_illinois_supreme_court_is_being_asked_to/i2kvd52/,2,r/centralillinois,0,2
"Psh... who cares about our corrupt, liberal, heathen public school teachers. How about interviewing a real teacher. A god loving parent who keeps their children at home to ""school"" them. THAT is how you get a real education!",t2_f23fzbmn,HillaryIsBathory,0,1648565416.0,0,t1_i2kjs6p,i2kjs6p,True,wannabe_greta_gerwig,t3_tkbk4x,https://www.reddit.com/r/centralillinois/comments/tkbk4x/seeking_currentformer_teachers_student_teachers/,"Seeking current/former teachers, student teachers, subs, administrators, etc.!",/r/centralillinois/comments/tkbk4x/seeking_currentformer_teachers_student_teachers/i2kjs6p/,1,r/centralillinois,0,1
"I've been working on getting BloomingtonWX into searches, but it doesn't seem to appear yet. For now, you can use this link [sites.google.com/view/BloomingtonWX](http://sites.google.com/view/BloomingtonWX)",t2_ewbk3jk9,AJP2222,0,1648485306.0,0,t1_i2gelvy,i2gelvy,False,AJP2222,t3_tpwj32,https://www.reddit.com/r/centralillinois/comments/tpwj32/i_created_a_website_for_emergency_alerts_and/,"I created a website for emergency alerts and weather alerts for Bloomington, which also includes all of De Witt, McLean, Tazewell, and Woodford counties.",/r/centralillinois/comments/tpwj32/i_created_a_website_for_emergency_alerts_and/i2gelvy/,1,r/centralillinois,0,1
So i just google “weather” and it will be on the list?,t2_h0od7q7w,janieih,0,1648484346.0,0,t1_i2gc61d,i2gc61d,True,AJP2222,t3_tpwj32,https://www.reddit.com/r/centralillinois/comments/tpwj32/i_created_a_website_for_emergency_alerts_and/,"I created a website for emergency alerts and weather alerts for Bloomington, which also includes all of De Witt, McLean, Tazewell, and Woodford counties.",/r/centralillinois/comments/tpwj32/i_created_a_website_for_emergency_alerts_and/i2gc61d/,2,r/centralillinois,0,2
OKAY,t2_k1lj005r,Tired_and_True_,0,1648335764.0,0,t1_i28z4m4,i28z4m4,True,OWENSantlerlights,t3_tontua,https://www.reddit.com/r/centralillinois/comments/tontua/owens_antler_chandeliers_in_illinois/,OWENS ANTLER CHANDELIERS IN ILLINOIS,/r/centralillinois/comments/tontua/owens_antler_chandeliers_in_illinois/i28z4m4/,1,r/centralillinois,0,1
Credit Unions for the win.,t2_66eg0,M4hkn0,0,1648267452.0,0,t1_i25ltgr,i25ltgr,False,Alone-Pianist7710,t3_tletlj,https://www.reddit.com/r/centralillinois/comments/tletlj/please_fill_out_the_survey/,Please Fill Out The Survey!,/r/centralillinois/comments/tletlj/please_fill_out_the_survey/i25ltgr/,2,r/centralillinois,0,2
"Troll. 

You know what is intended.",t2_cjynjbsk,Gernafax,0,1648147427.0,0,t1_i1yqmdu,i1yqmdu,False,Alone-Pianist7710,t3_tletlj,https://www.reddit.com/r/centralillinois/comments/tletlj/please_fill_out_the_survey/,Please Fill Out The Survey!,/r/centralillinois/comments/tletlj/please_fill_out_the_survey/i1yqmdu/,1,r/centralillinois,0,1
"No. Banks suck, credit unions for the win.",t2_425w,Suppafly,0,1648147255.0,0,t1_i1yq6ka,i1yq6ka,True,Alone-Pianist7710,t3_tletlj,https://www.reddit.com/r/centralillinois/comments/tletlj/please_fill_out_the_survey/,Please Fill Out The Survey!,/r/centralillinois/comments/tletlj/please_fill_out_the_survey/i1yq6ka/,1,r/centralillinois,0,1
How so? Would love to hear any feedback you may have!,t2_dkein4er,Alone-Pianist7710,0,1648141845.0,0,t1_i1ycb88,i1ycb88,False,Alone-Pianist7710,t3_tletlj,https://www.reddit.com/r/centralillinois/comments/tletlj/please_fill_out_the_survey/,Please Fill Out The Survey!,/r/centralillinois/comments/tletlj/please_fill_out_the_survey/i1ycb88/,2,r/centralillinois,0,2
"Seems very ""Peoria"" centric.",t2_ba2gfsk,Stardog2,0,1648141437.0,0,t1_i1yba3t,i1yba3t,True,Alone-Pianist7710,t3_tletlj,https://www.reddit.com/r/centralillinois/comments/tletlj/please_fill_out_the_survey/,Please Fill Out The Survey!,/r/centralillinois/comments/tletlj/please_fill_out_the_survey/i1yba3t/,3,r/centralillinois,0,3
Glad you got that fixed :),t2_3xv1n,Captain_Quark,0,1648075818.0,0,t1_i1uxypv,i1uxypv,False,Alone-Pianist7710,t3_tletlj,https://www.reddit.com/r/centralillinois/comments/tletlj/please_fill_out_the_survey/,Please Fill Out The Survey!,/r/centralillinois/comments/tletlj/please_fill_out_the_survey/i1uxypv/,0,r/centralillinois,0,0
Central Illinois!,t2_dkein4er,Alone-Pianist7710,0,1648075776.0,0,t1_i1uxv5j,i1uxv5j,False,Alone-Pianist7710,t3_tletlj,https://www.reddit.com/r/centralillinois/comments/tletlj/please_fill_out_the_survey/,Please Fill Out The Survey!,/r/centralillinois/comments/tletlj/please_fill_out_the_survey/i1uxv5j/,3,r/centralillinois,0,3
Do you mean central Illinois? Or is there a town of Central?,t2_3xv1n,Captain_Quark,0,1648075432.0,0,t1_i1ux18g,i1ux18g,True,Alone-Pianist7710,t3_tletlj,https://www.reddit.com/r/centralillinois/comments/tletlj/please_fill_out_the_survey/,Please Fill Out The Survey!,/r/centralillinois/comments/tletlj/please_fill_out_the_survey/i1ux18g/,1,r/centralillinois,0,1
">The Mazon River is designated as non-navigable under Illinois law, meaning it is not wide or deep enough to carry commercial traffic such as barges.

Isn't there a federal law that trumps most state laws about whether things are navigable and whether or not you can access them?",t2_425w,Suppafly,0,1648052351.0,0,t1_i1t8ri5,i1t8ri5,True,The_Not_Visible_Man,t3_tkk54d,https://www.reddit.com/r/centralillinois/comments/tkk54d/the_illinois_supreme_court_is_being_asked_to/,The Illinois Supreme Court is being asked to decide the extent to which property owners can block anyone else from accessing a river that runs through their property.,/r/centralillinois/comments/tkk54d/the_illinois_supreme_court_is_being_asked_to/i1t8ri5/,7,r/centralillinois,0,7
"Personally I think the public property approach to natural land formations is best. If I'm on the bank of your property that's one thing but if I'm on the river, that shouldn't be anyone's right to prevent. Unless there's vandalism or theft, destruction of property or resources, I can't see any reason why people should be allowed to section off parts of a river because they ""own"" it. If those other things are problems, they should be dealt with individually, not have a blanket law just allowing anyone with a section of a river to block access. If it were say entirely on your property (you own the whole river or creek) that I understand and is a little different.",t2_5ak08,ChrisKardonia,0,1648052004.0,0,t1_i1t7udp,i1t7udp,True,The_Not_Visible_Man,t3_tkk54d,https://www.reddit.com/r/centralillinois/comments/tkk54d/the_illinois_supreme_court_is_being_asked_to/,The Illinois Supreme Court is being asked to decide the extent to which property owners can block anyone else from accessing a river that runs through their property.,/r/centralillinois/comments/tkk54d/the_illinois_supreme_court_is_being_asked_to/i1t7udp/,8,r/centralillinois,0,8
You are a religious nut. There’s nothing else to say. You down bad.,t2_6l29wkkh,Sufficient-Milk-6057,0,1648011556.0,0,t1_i1rc8id,i1rc8id,False,welpthishappened1,t3_tkfuaq,https://www.reddit.com/r/centralillinois/comments/tkfuaq/our_lady_of_lourdes_school_in_decatur_just_fired/,Our Lady of Lourdes school in Decatur just fired a teacher for being homosexual,/r/centralillinois/comments/tkfuaq/our_lady_of_lourdes_school_in_decatur_just_fired/i1rc8id/,4,r/centralillinois,0,4
This state fucking sucks. Sure cities like chicago or peoria are fairly progressive/blue but most all the rural smaller towns are real conservative especially if christianity is strong there. I wanna move out of here,t2_d87gnyng,Firetail1710,0,1648008071.0,0,t1_i1r6j44,i1r6j44,True,welpthishappened1,t3_tkfuaq,https://www.reddit.com/r/centralillinois/comments/tkfuaq/our_lady_of_lourdes_school_in_decatur_just_fired/,Our Lady of Lourdes school in Decatur just fired a teacher for being homosexual,/r/centralillinois/comments/tkfuaq/our_lady_of_lourdes_school_in_decatur_just_fired/i1r6j44/,1,r/centralillinois,0,1
"Oh I heard about that!

Poor kid",t2_19bh1hew,DaniTheLovebug,0,1648006834.0,0,t1_i1r4b2u,i1r4b2u,False,welpthishappened1,t3_tkfuaq,https://www.reddit.com/r/centralillinois/comments/tkfuaq/our_lady_of_lourdes_school_in_decatur_just_fired/,Our Lady of Lourdes school in Decatur just fired a teacher for being homosexual,/r/centralillinois/comments/tkfuaq/our_lady_of_lourdes_school_in_decatur_just_fired/i1r4b2u/,2,r/centralillinois,0,2
"He's total seen it for reals! He isn't a troll or nothing he knows about ""sin"" and shit. He also knows a kid who drank coke after eating pop rocks and exploded.",t2_6fheh,RayErwin,0,1648006544.0,0,t1_i1r3rxz,i1r3rxz,False,welpthishappened1,t3_tkfuaq,https://www.reddit.com/r/centralillinois/comments/tkfuaq/our_lady_of_lourdes_school_in_decatur_just_fired/,Our Lady of Lourdes school in Decatur just fired a teacher for being homosexual,/r/centralillinois/comments/tkfuaq/our_lady_of_lourdes_school_in_decatur_just_fired/i1r3rxz/,2,r/centralillinois,0,2
Proof?,t2_19bh1hew,DaniTheLovebug,0,1648004781.0,0,t1_i1r0fdi,i1r0fdi,False,welpthishappened1,t3_tkfuaq,https://www.reddit.com/r/centralillinois/comments/tkfuaq/our_lady_of_lourdes_school_in_decatur_just_fired/,Our Lady of Lourdes school in Decatur just fired a teacher for being homosexual,/r/centralillinois/comments/tkfuaq/our_lady_of_lourdes_school_in_decatur_just_fired/i1r0fdi/,2,r/centralillinois,0,2
Well if we are going based on sin….hooooo boy the Christians have a lot to explain.,t2_19bh1hew,DaniTheLovebug,0,1648004764.0,0,t1_i1r0e7l,i1r0e7l,False,welpthishappened1,t3_tkfuaq,https://www.reddit.com/r/centralillinois/comments/tkfuaq/our_lady_of_lourdes_school_in_decatur_just_fired/,Our Lady of Lourdes school in Decatur just fired a teacher for being homosexual,/r/centralillinois/comments/tkfuaq/our_lady_of_lourdes_school_in_decatur_just_fired/i1r0e7l/,6,r/centralillinois,0,6
Nobody gives a shit about your sky daddy,t2_19bh1hew,DaniTheLovebug,0,1648004736.0,0,t1_i1r0c72,i1r0c72,False,welpthishappened1,t3_tkfuaq,https://www.reddit.com/r/centralillinois/comments/tkfuaq/our_lady_of_lourdes_school_in_decatur_just_fired/,Our Lady of Lourdes school in Decatur just fired a teacher for being homosexual,/r/centralillinois/comments/tkfuaq/our_lady_of_lourdes_school_in_decatur_just_fired/i1r0c72/,5,r/centralillinois,0,5
"From March 14th, just about a week ago. 

https://herald-review.com/news/local/education/watch-now-how-our-lady-of-lourdes-students-united-to-help-community-organizations/article_20cd61a7-bad1-5491-ac86-5292f131a39d.html

What a horrible influence on the children /s",t2_5k2rn,bob101910,0,1648003797.0,0,t1_i1qyh4d,i1qyh4d,True,welpthishappened1,t3_tkfuaq,https://www.reddit.com/r/centralillinois/comments/tkfuaq/our_lady_of_lourdes_school_in_decatur_just_fired/,Our Lady of Lourdes school in Decatur just fired a teacher for being homosexual,/r/centralillinois/comments/tkfuaq/our_lady_of_lourdes_school_in_decatur_just_fired/i1qyh4d/,5,r/centralillinois,0,5
If you make the kids too smart they’ll figure out how to leave though.,t2_bjk8i,no_one_likes_u,0,1648003100.0,0,t1_i1qx1y6,i1qx1y6,False,welpthishappened1,t3_tkfuaq,https://www.reddit.com/r/centralillinois/comments/tkfuaq/our_lady_of_lourdes_school_in_decatur_just_fired/,Our Lady of Lourdes school in Decatur just fired a teacher for being homosexual,/r/centralillinois/comments/tkfuaq/our_lady_of_lourdes_school_in_decatur_just_fired/i1qx1y6/,4,r/centralillinois,0,4
Not surprising. Many faith-based schools in central Illinois have fired staff for the same reasons. It’s common and they don’t hide it.,t2_jsvj0raw,VladyPoopin,0,1648000596.0,0,t1_i1qrrpn,i1qrrpn,True,welpthishappened1,t3_tkfuaq,https://www.reddit.com/r/centralillinois/comments/tkfuaq/our_lady_of_lourdes_school_in_decatur_just_fired/,Our Lady of Lourdes school in Decatur just fired a teacher for being homosexual,/r/centralillinois/comments/tkfuaq/our_lady_of_lourdes_school_in_decatur_just_fired/i1qrrpn/,7,r/centralillinois,0,7
"Sure, Jan",t2_84r9x,cheese_hotdog,0,1648000049.0,0,t1_i1qqkdf,i1qqkdf,False,welpthishappened1,t3_tkfuaq,https://www.reddit.com/r/centralillinois/comments/tkfuaq/our_lady_of_lourdes_school_in_decatur_just_fired/,Our Lady of Lourdes school in Decatur just fired a teacher for being homosexual,/r/centralillinois/comments/tkfuaq/our_lady_of_lourdes_school_in_decatur_just_fired/i1qqkdf/,2,r/centralillinois,0,2
I knew of 2 teachers who were let go because they were seen at local bars drinking alcohol. A lot of these schools have sort of employment contracts that state the employee will abide by the teachings of thr church.,t2_ay1mx,PoppinPMAGs,1,1647999911.0,0,t1_i1qq95l,i1qq95l,False,welpthishappened1,t3_tkfuaq,https://www.reddit.com/r/centralillinois/comments/tkfuaq/our_lady_of_lourdes_school_in_decatur_just_fired/,Our Lady of Lourdes school in Decatur just fired a teacher for being homosexual,/r/centralillinois/comments/tkfuaq/our_lady_of_lourdes_school_in_decatur_just_fired/i1qq95l/,-4,r/centralillinois,0,-4
"Well of course, that's another sin Christians love to punish. Let's see some men being fired for having affairs outside their marriage. Let's see someone get fired for being obese (gluttony). But no, it's only ever the women or lgbtq.",t2_84r9x,cheese_hotdog,0,1647999657.0,0,t1_i1qpowe,i1qpowe,False,welpthishappened1,t3_tkfuaq,https://www.reddit.com/r/centralillinois/comments/tkfuaq/our_lady_of_lourdes_school_in_decatur_just_fired/,Our Lady of Lourdes school in Decatur just fired a teacher for being homosexual,/r/centralillinois/comments/tkfuaq/our_lady_of_lourdes_school_in_decatur_just_fired/i1qpowe/,8,r/centralillinois,0,8
You may be surprised. I've heard of several teachers being let go for being pregnant out of wedlock too.,t2_ay1mx,PoppinPMAGs,0,1647999027.0,0,t1_i1qoav5,i1qoav5,False,welpthishappened1,t3_tkfuaq,https://www.reddit.com/r/centralillinois/comments/tkfuaq/our_lady_of_lourdes_school_in_decatur_just_fired/,Our Lady of Lourdes school in Decatur just fired a teacher for being homosexual,/r/centralillinois/comments/tkfuaq/our_lady_of_lourdes_school_in_decatur_just_fired/i1qoav5/,-18,r/centralillinois,0,-18
"Somehow I doubt they keep that same energy for all ""sins"" which are supposedly all equal in the eyes of the lord, but rarely the Christians who claim to follow him.",t2_84r9x,cheese_hotdog,0,1647998794.0,0,t1_i1qnsg7,i1qnsg7,False,welpthishappened1,t3_tkfuaq,https://www.reddit.com/r/centralillinois/comments/tkfuaq/our_lady_of_lourdes_school_in_decatur_just_fired/,Our Lady of Lourdes school in Decatur just fired a teacher for being homosexual,/r/centralillinois/comments/tkfuaq/our_lady_of_lourdes_school_in_decatur_just_fired/i1qnsg7/,9,r/centralillinois,0,9
🤣 oh well,t2_fg57498k,Head-Rate3189,0,1647998621.0,0,t1_i1qneyw,i1qneyw,True,welpthishappened1,t3_tkfuaq,https://www.reddit.com/r/centralillinois/comments/tkfuaq/our_lady_of_lourdes_school_in_decatur_just_fired/,Our Lady of Lourdes school in Decatur just fired a teacher for being homosexual,/r/centralillinois/comments/tkfuaq/our_lady_of_lourdes_school_in_decatur_just_fired/i1qneyw/,-15,r/centralillinois,0,-15
You think a shithole like Decatur would be more open and tolerant. Like bruh... people ain't lining up to teach or live there,t2_5ta6gda8,Disastrous_Review_99,0,1647997350.0,0,t1_i1qklty,i1qklty,True,welpthishappened1,t3_tkfuaq,https://www.reddit.com/r/centralillinois/comments/tkfuaq/our_lady_of_lourdes_school_in_decatur_just_fired/,Our Lady of Lourdes school in Decatur just fired a teacher for being homosexual,/r/centralillinois/comments/tkfuaq/our_lady_of_lourdes_school_in_decatur_just_fired/i1qklty/,20,r/centralillinois,0,20
And people wonder why Central IL seems to keep falling more behind by the year...the people in power having ass backwards priorities like this is why,t2_ujm31,maroon6798,0,1647997248.0,0,t1_i1qkdr1,i1qkdr1,True,welpthishappened1,t3_tkfuaq,https://www.reddit.com/r/centralillinois/comments/tkfuaq/our_lady_of_lourdes_school_in_decatur_just_fired/,Our Lady of Lourdes school in Decatur just fired a teacher for being homosexual,/r/centralillinois/comments/tkfuaq/our_lady_of_lourdes_school_in_decatur_just_fired/i1qkdr1/,16,r/centralillinois,0,16
Maybe they should check their beliefs then and see if they’re good to teach children,t2_co5u7p1a,Spiritual_Board999,0,1647996567.0,0,t1_i1qivtl,i1qivtl,False,welpthishappened1,t3_tkfuaq,https://www.reddit.com/r/centralillinois/comments/tkfuaq/our_lady_of_lourdes_school_in_decatur_just_fired/,Our Lady of Lourdes school in Decatur just fired a teacher for being homosexual,/r/centralillinois/comments/tkfuaq/our_lady_of_lourdes_school_in_decatur_just_fired/i1qivtl/,9,r/centralillinois,0,9
Link?,t2_6ngdd,JohnnyWall,0,1647996284.0,0,t1_i1qi9bj,i1qi9bj,True,welpthishappened1,t3_tkfuaq,https://www.reddit.com/r/centralillinois/comments/tkfuaq/our_lady_of_lourdes_school_in_decatur_just_fired/,Our Lady of Lourdes school in Decatur just fired a teacher for being homosexual,/r/centralillinois/comments/tkfuaq/our_lady_of_lourdes_school_in_decatur_just_fired/i1qi9bj/,1,r/centralillinois,0,1
*their*,t2_6ngdd,JohnnyWall,0,1647996024.0,0,t1_i1qhoi1,i1qhoi1,False,welpthishappened1,t3_tkfuaq,https://www.reddit.com/r/centralillinois/comments/tkfuaq/our_lady_of_lourdes_school_in_decatur_just_fired/,Our Lady of Lourdes school in Decatur just fired a teacher for being homosexual,/r/centralillinois/comments/tkfuaq/our_lady_of_lourdes_school_in_decatur_just_fired/i1qhoi1/,18,r/centralillinois,0,18
Does it matter what reason they teach their students to hate?,t2_3ltk5,SurlyTurtle,0,1647995384.0,0,t1_i1qg9bk,i1qg9bk,False,welpthishappened1,t3_tkfuaq,https://www.reddit.com/r/centralillinois/comments/tkfuaq/our_lady_of_lourdes_school_in_decatur_just_fired/,Our Lady of Lourdes school in Decatur just fired a teacher for being homosexual,/r/centralillinois/comments/tkfuaq/our_lady_of_lourdes_school_in_decatur_just_fired/i1qg9bk/,9,r/centralillinois,0,9
"Or, thier belief system is that living openly in sin isnt the behavior they want their students subjected to.",t2_ay1mx,PoppinPMAGs,0,1647995320.0,0,t1_i1qg46w,i1qg46w,False,welpthishappened1,t3_tkfuaq,https://www.reddit.com/r/centralillinois/comments/tkfuaq/our_lady_of_lourdes_school_in_decatur_just_fired/,Our Lady of Lourdes school in Decatur just fired a teacher for being homosexual,/r/centralillinois/comments/tkfuaq/our_lady_of_lourdes_school_in_decatur_just_fired/i1qg46w/,-31,r/centralillinois,0,-31
"A ""school"" that teaches hate. FTFY.",t2_3ltk5,SurlyTurtle,0,1647994844.0,0,t1_i1qf1e3,i1qf1e3,False,welpthishappened1,t3_tkfuaq,https://www.reddit.com/r/centralillinois/comments/tkfuaq/our_lady_of_lourdes_school_in_decatur_just_fired/,Our Lady of Lourdes school in Decatur just fired a teacher for being homosexual,/r/centralillinois/comments/tkfuaq/our_lady_of_lourdes_school_in_decatur_just_fired/i1qf1e3/,17,r/centralillinois,0,17
"If this post isn't ironic, you're actually a horrible person lmao",t2_cmm1yy1a,CamdenMWebb,0,1647993537.0,0,t1_i1qc4ok,i1qc4ok,False,welpthishappened1,t3_tkfuaq,https://www.reddit.com/r/centralillinois/comments/tkfuaq/our_lady_of_lourdes_school_in_decatur_just_fired/,Our Lady of Lourdes school in Decatur just fired a teacher for being homosexual,/r/centralillinois/comments/tkfuaq/our_lady_of_lourdes_school_in_decatur_just_fired/i1qc4ok/,23,r/centralillinois,0,23
Wonderful news! A school that stands up for morality and beliefs they hold dear!,t2_ay1mx,PoppinPMAGs,0,1647993410.0,0,t1_i1qbuhl,i1qbuhl,True,welpthishappened1,t3_tkfuaq,https://www.reddit.com/r/centralillinois/comments/tkfuaq/our_lady_of_lourdes_school_in_decatur_just_fired/,Our Lady of Lourdes school in Decatur just fired a teacher for being homosexual,/r/centralillinois/comments/tkfuaq/our_lady_of_lourdes_school_in_decatur_just_fired/i1qbuhl/,-45,r/centralillinois,0,-45
Do people even isten to him anymore?,t2_ip02iwx6,Paddle_Out_SUP,0,1647905169.0,0,t1_i1lfh6i,i1lfh6i,False,IamBob0226,t3_sk0xqz,https://www.reddit.com/r/centralillinois/comments/sk0xqz/hey_city_of_decatur_it_snowed_lets_get_some_plows/,"Hey City of Decatur, it snowed ... Lets get some plows out.",/r/centralillinois/comments/sk0xqz/hey_city_of_decatur_it_snowed_lets_get_some_plows/i1lfh6i/,1,r/centralillinois,0,1
Boy do I miss good late night television. What happened?,t2_bzyh9g3m,leadtorch,0,1647642195.0,0,t1_i17mh1v,i17mh1v,True,Rob_Bligidy,t3_tgnwhx,https://www.reddit.com/r/centralillinois/comments/tgnwhx/illinois_old_timer_on_carson_show_hes_a_hoot/,Illinois Old Timer on Carson Show. He’s a hoot.,/r/centralillinois/comments/tgnwhx/illinois_old_timer_on_carson_show_hes_a_hoot/i17mh1v/,1,r/centralillinois,0,1
"Talk about stale news.  This is moldy, old  garbage.",t2_ihg9o7k3,ToYourCredit,0,1647624550.0,0,t1_i16f79b,i16f79b,True,Rob_Bligidy,t3_tgnwhx,https://www.reddit.com/r/centralillinois/comments/tgnwhx/illinois_old_timer_on_carson_show_hes_a_hoot/,Illinois Old Timer on Carson Show. He’s a hoot.,/r/centralillinois/comments/tgnwhx/illinois_old_timer_on_carson_show_hes_a_hoot/i16f79b/,-6,r/centralillinois,0,-6
"Thanks for sharing, that was fantastic!",t2_1uspvchp,Mazbehere,0,1647619453.0,0,t1_i1621nl,i1621nl,True,Rob_Bligidy,t3_tgnwhx,https://www.reddit.com/r/centralillinois/comments/tgnwhx/illinois_old_timer_on_carson_show_hes_a_hoot/,Illinois Old Timer on Carson Show. He’s a hoot.,/r/centralillinois/comments/tgnwhx/illinois_old_timer_on_carson_show_hes_a_hoot/i1621nl/,2,r/centralillinois,0,2
Kids these days,t2_17drst,jdog1969,1,1647601340.0,0,t1_i14zt4i,i14zt4i,False,Rob_Bligidy,t3_tgnwhx,https://www.reddit.com/r/centralillinois/comments/tgnwhx/illinois_old_timer_on_carson_show_hes_a_hoot/,Illinois Old Timer on Carson Show. He’s a hoot.,/r/centralillinois/comments/tgnwhx/illinois_old_timer_on_carson_show_hes_a_hoot/i14zt4i/,0,r/centralillinois,0,0
"He was sharp for his age, and funny af lmao",t2_1gf2hodl,Muscrave,0,1647582041.0,0,t1_i14c884,i14c884,True,Rob_Bligidy,t3_tgnwhx,https://www.reddit.com/r/centralillinois/comments/tgnwhx/illinois_old_timer_on_carson_show_hes_a_hoot/,Illinois Old Timer on Carson Show. He’s a hoot.,/r/centralillinois/comments/tgnwhx/illinois_old_timer_on_carson_show_hes_a_hoot/i14c884/,3,r/centralillinois,0,3
"Agreed. While it's not a job for me, I appreciate sharing wages rather tha and keeping them secret.",t2_5k2rn,bob101910,0,1647574574.0,0,t1_i13zqjm,i13zqjm,False,Willyt2_2_3,t3_ss1n6z,https://www.reddit.com/r/centralillinois/comments/ss1n6z/kickapoo_adventure_job_opportunity/,Kickapoo Adventure job opportunity,/r/centralillinois/comments/ss1n6z/kickapoo_adventure_job_opportunity/i13zqjm/,1,r/centralillinois,0,1
