body,author_fullname,author.name,controversiality,created,downs,fullname,id,is_root,link_author,link_id,link_permalink,link_title,permalink,score,subreddit_name_prefixed,total_awards_received,ups
"No businesses, big or small, are being closed. No where in Illinois is anyone being prosecuted for not wearing a mask. The Governor has said over and over that he’s relying on people to voluntarily comply, not compulsion. 

Look up your favorite businesses, bars, and restaurants. I’d bet you money they are all getting COVID relief money, no strings attached. They are not suffering. If they are, it’s their own fault. 

Why can’t you be like a normal person and use porn for masterbation fantasies instead of jerking yourself off to imaginary victimhood stories?",t2_cj4rs7dw,06042021001,1,1630367070.0,0,t1_hazri3f,hazri3f,False,[deleted],t3_peq884,https://www.reddit.com/r/centralillinois/comments/peq884/yard_signs_showing_support_governor_pritzker/,Yard signs showing support GOVERNOR Pritzker,/r/centralillinois/comments/peq884/yard_signs_showing_support_governor_pritzker/hazri3f/,-4,r/centralillinois,0,-4
Tell me how do you feel about JB allowing his corporate buddies to keep their stores open while closing down small privately owned businesses. What public health expert said covid only infects people in small businesses,t2_uqtdw2z,pork26,0,1630367044.0,0,t1_hazrg04,hazrg04,False,[deleted],t3_peq884,https://www.reddit.com/r/centralillinois/comments/peq884/yard_signs_showing_support_governor_pritzker/,Yard signs showing support GOVERNOR Pritzker,/r/centralillinois/comments/peq884/yard_signs_showing_support_governor_pritzker/hazrg04/,7,r/centralillinois,0,7
"You need a sign to show your neighborhood how trashy you are? 

Pal, I bet they already know…",t2_cj4rs7dw,06042021001,0,1630366778.0,0,t1_hazqvte,hazqvte,False,[deleted],t3_peq884,https://www.reddit.com/r/centralillinois/comments/peq884/yard_signs_showing_support_governor_pritzker/,Yard signs showing support GOVERNOR Pritzker,/r/centralillinois/comments/peq884/yard_signs_showing_support_governor_pritzker/hazqvte/,3,r/centralillinois,0,3
Do it Cletus. That'll sure teach him to actually listen to public health experts during a literal worldwide public health emergency.,t2_sd5um,FDI_Blap,1,1630361709.0,0,t1_hazfrt2,hazfrt2,False,[deleted],t3_peq884,https://www.reddit.com/r/centralillinois/comments/peq884/yard_signs_showing_support_governor_pritzker/,Yard signs showing support GOVERNOR Pritzker,/r/centralillinois/comments/peq884/yard_signs_showing_support_governor_pritzker/hazfrt2/,4,r/centralillinois,0,4
PS I can go to Champaign or Terra Haute (same distance) to shop and buy gas. Terra Haute sales and gas taxes are cheaper. I screw the Fat man and spend my $ in Terra Haute,t2_uqtdw2z,pork26,1,1630359706.0,0,t1_hazb7z5,hazb7z5,False,[deleted],t3_peq884,https://www.reddit.com/r/centralillinois/comments/peq884/yard_signs_showing_support_governor_pritzker/,Yard signs showing support GOVERNOR Pritzker,/r/centralillinois/comments/peq884/yard_signs_showing_support_governor_pritzker/hazb7z5/,5,r/centralillinois,0,5
"I was thinking about not wanting higher taxes, gun control, homelessness increasing. I got the vax. I am not scared of the covid boogie man. just scared of the fat man closing small businesses but letting the big corporation keep their stores open. After all, covid can tell if it is a JB approved essential store and not infect people in there, but it is free to infect gift shops, bars, gyms and restaurants.",t2_uqtdw2z,pork26,0,1630359504.0,0,t1_hazarc9,hazarc9,False,[deleted],t3_peq884,https://www.reddit.com/r/centralillinois/comments/peq884/yard_signs_showing_support_governor_pritzker/,Yard signs showing support GOVERNOR Pritzker,/r/centralillinois/comments/peq884/yard_signs_showing_support_governor_pritzker/hazarc9/,11,r/centralillinois,0,11
"Shit, thx for the keen eye. I didn't realize they played both sides. #capitalism",t2_ek8kg,sidvictorious,0,1630358460.0,0,t1_haz8ccv,haz8ccv,False,[deleted],t3_peq884,https://www.reddit.com/r/centralillinois/comments/peq884/yard_signs_showing_support_governor_pritzker/,Yard signs showing support GOVERNOR Pritzker,/r/centralillinois/comments/peq884/yard_signs_showing_support_governor_pritzker/haz8ccv/,4,r/centralillinois,0,4
"I see these signs all over my town: [https://www.etsy.com/listing/832123563/thank-you-pritzker-double-sided-yard](https://www.etsy.com/listing/832123563/thank-you-pritzker-double-sided-yard)

Probably lots of others are made as well, but thought I'd list this one to start things off.",t2_98fyy,urbanaprof,1,1630358189.0,0,t1_haz7pcz,haz7pcz,True,[deleted],t3_peq884,https://www.reddit.com/r/centralillinois/comments/peq884/yard_signs_showing_support_governor_pritzker/,Yard signs showing support GOVERNOR Pritzker,/r/centralillinois/comments/peq884/yard_signs_showing_support_governor_pritzker/haz7pcz/,-1,r/centralillinois,0,-1
"That store also appears to sell a bunch of pro-Trump/anti-vax/far right signs as well, so I'd look elsewhere.",t2_4b51l,x0epyon0x,1,1630357802.0,0,t1_haz6so9,haz6so9,False,[deleted],t3_peq884,https://www.reddit.com/r/centralillinois/comments/peq884/yard_signs_showing_support_governor_pritzker/,Yard signs showing support GOVERNOR Pritzker,/r/centralillinois/comments/peq884/yard_signs_showing_support_governor_pritzker/haz6so9/,2,r/centralillinois,0,2
"I want one of those ""Pritzker Sucks"" signs. Can you ask your neighbor where they got theirs? I don't want Pritzker going any further in turning Illinois into California and the other failed leftist states.",t2_uqtdw2z,pork26,1,1630356776.0,0,t1_haz4c93,haz4c93,True,[deleted],t3_peq884,https://www.reddit.com/r/centralillinois/comments/peq884/yard_signs_showing_support_governor_pritzker/,Yard signs showing support GOVERNOR Pritzker,/r/centralillinois/comments/peq884/yard_signs_showing_support_governor_pritzker/haz4c93/,-11,r/centralillinois,0,-11
"I also buy a ton of signs from ""Signs of Justice"" on Etsy, black woman owned business- search and you'll see lots of options.",t2_ek8kg,sidvictorious,0,1630356349.0,0,t1_haz3awb,haz3awb,True,[deleted],t3_peq884,https://www.reddit.com/r/centralillinois/comments/peq884/yard_signs_showing_support_governor_pritzker/,Yard signs showing support GOVERNOR Pritzker,/r/centralillinois/comments/peq884/yard_signs_showing_support_governor_pritzker/haz3awb/,5,r/centralillinois,0,5
"""Thank you Pritzker Double Sided Yard Sign Pro Pritzker Sign | Etsy"" https://www.etsy.com/listing/832123563/thank-you-pritzker-double-sided-yard",t2_ek8kg,sidvictorious,0,1630356302.0,0,t1_haz36rm,haz36rm,True,[deleted],t3_peq884,https://www.reddit.com/r/centralillinois/comments/peq884/yard_signs_showing_support_governor_pritzker/,Yard signs showing support GOVERNOR Pritzker,/r/centralillinois/comments/peq884/yard_signs_showing_support_governor_pritzker/haz36rm/,-6,r/centralillinois,0,-6
"It means you've done your part to end this thing.

Next, everyone else.",t2_vpn412i,WizeAdz,0,1630338769.0,0,t1_haxwsvd,haxwsvd,False,[deleted],t3_pc6nus,https://www.reddit.com/r/centralillinois/comments/pc6nus/governor/,governor,/r/centralillinois/comments/pc6nus/governor/haxwsvd/,1,r/centralillinois,0,1
"Okay, so since I got vaccinated 3 months ago that means it's over now?",t2_8c254,zworkaccount,0,1630335056.0,0,t1_haxo26z,haxo26z,False,[deleted],t3_pc6nus,https://www.reddit.com/r/centralillinois/comments/pc6nus/governor/,governor,/r/centralillinois/comments/pc6nus/governor/haxo26z/,1,r/centralillinois,0,1
This ramp is KNOWN for taking under big trucks! Not the 1st or the last,t2_cb5gqfso,Brittybudz90,0,1630333630.0,0,t1_haxkr3o,haxkr3o,True,Rob_Bligidy,t3_oushwt,https://www.reddit.com/r/centralillinois/comments/oushwt/springfield_scuba_truck/,Springfield scuba truck,/r/centralillinois/comments/oushwt/springfield_scuba_truck/haxkr3o/,1,r/centralillinois,0,1
"I've been loving the noise, thanks!",t2_6idh0so1,raisinghellwithtrees,0,1630327189.0,0,t1_hax7fnp,hax7fnp,True,catdogwoman,t3_pe8c23,https://www.reddit.com/r/centralillinois/comments/pe8c23/the_cicadas_are_in_full_voice_tonight/,The cicadas are in full voice tonight!,/r/centralillinois/comments/pe8c23/the_cicadas_are_in_full_voice_tonight/hax7fnp/,2,r/centralillinois,0,2
"Every evening my toddler says the ""cay-das are singing.""",t2_ek8kg,sidvictorious,0,1630287204.0,0,t1_havjuww,havjuww,True,catdogwoman,t3_pe7rgz,https://www.reddit.com/r/centralillinois/comments/pe7rgz/the_cicadas_are_singing_loudly_tonight_i_noticed/,The cicadas are singing loudly tonight! I noticed dozens of their 'skins' today.,/r/centralillinois/comments/pe7rgz/the_cicadas_are_singing_loudly_tonight_i_noticed/havjuww/,2,r/centralillinois,0,2
It’s fragments of information pulled from government websites compiled together to represent the info in a way that is misleading to each individual study in order to support the political leanings of the website it is on.,t2_lq0la,Burgundy995,0,1630283996.0,0,t1_havd9hz,havd9hz,False,[deleted],t3_pc6nus,https://www.reddit.com/r/centralillinois/comments/pc6nus/governor/,governor,/r/centralillinois/comments/pc6nus/governor/havd9hz/,0,r/centralillinois,0,0
You still looking? My sister in law is in the German Education undergrad program at ISU,t2_tfm96,UNoahGuy,0,1630249497.0,0,t1_hat6j1z,hat6j1z,True,theuofiguy,t3_n4qw24,https://www.reddit.com/r/centralillinois/comments/n4qw24/any_good_tutors_for_learning_german_in_central/,Any good tutors for learning German in Central Illinois?,/r/centralillinois/comments/n4qw24/any_good_tutors_for_learning_german_in_central/hat6j1z/,1,r/centralillinois,0,1
Macomb and WIU are in shambles.,t2_45sklze6,PriorReplacement2,0,1630178052.0,0,t1_hapsnfl,hapsnfl,True,JusticeAvenger618,t3_pcvlep,https://www.reddit.com/r/centralillinois/comments/pcvlep/il_is_broken_as_an_utterly_nonfunctioning_state/,IL Is Broken As An Utterly Nonfunctioning State,/r/centralillinois/comments/pcvlep/il_is_broken_as_an_utterly_nonfunctioning_state/hapsnfl/,1,r/centralillinois,0,1
Actually all the information is pulled from government website like the FDA or the US Patient office.,t2_a1s5ktge,ExamIllustrious3394,0,1630162701.0,0,t1_haot25w,haot25w,False,[deleted],t3_pc6nus,https://www.reddit.com/r/centralillinois/comments/pc6nus/governor/,governor,/r/centralillinois/comments/pc6nus/governor/haot25w/,1,r/centralillinois,0,1
Really an anal probe? Yuck,t2_a1s5ktge,ExamIllustrious3394,0,1630162557.0,0,t1_haospux,haospux,False,JusticeAvenger618,t3_pcvlep,https://www.reddit.com/r/centralillinois/comments/pcvlep/il_is_broken_as_an_utterly_nonfunctioning_state/,IL Is Broken As An Utterly Nonfunctioning State,/r/centralillinois/comments/pcvlep/il_is_broken_as_an_utterly_nonfunctioning_state/haospux/,1,r/centralillinois,0,1
I have been on unemployment in years past. And it did seem like the weekly reporting is a pain. But I bet during the Covid plandemic they got inidated with filings for unemployment. Did you file everything online? Those online databases in state government can be a mess. Especially if you worked at any state agency and tried to use there webform database. Good luck?!,t2_a1s5ktge,ExamIllustrious3394,0,1630162350.0,0,t1_haos9h2,haos9h2,False,JusticeAvenger618,t3_pcvlep,https://www.reddit.com/r/centralillinois/comments/pcvlep/il_is_broken_as_an_utterly_nonfunctioning_state/,IL Is Broken As An Utterly Nonfunctioning State,/r/centralillinois/comments/pcvlep/il_is_broken_as_an_utterly_nonfunctioning_state/haos9h2/,1,r/centralillinois,0,1
"This isn’t a democratic state. Chicago is blue. The vast majority of the rest of the state is red. 

Whatever, doesn’t really matter all that much. The main issue is all politicians, blue and red, love to screw us over. We need to take a stand. I don’t care if you’re republican or democrat, we all agree we should have good roads, functional schools, better fire and police training and equipment, and a better public service department. So get over your petty blue and red and let’s go take back our government.",t2_9za3wbg5,gandy94,0,1630156581.0,0,t1_haog9tr,haog9tr,False,JusticeAvenger618,t3_pcvlep,https://www.reddit.com/r/centralillinois/comments/pcvlep/il_is_broken_as_an_utterly_nonfunctioning_state/,IL Is Broken As An Utterly Nonfunctioning State,/r/centralillinois/comments/pcvlep/il_is_broken_as_an_utterly_nonfunctioning_state/haog9tr/,5,r/centralillinois,0,5
"If we could get the vast majority of people in this mind set, we could really change some things not just in our state, but in our country. Where do you think these shit politicians start? Local judge circuits, school boards, etc etc. Local politics is vastly more important than who the president is.",t2_9za3wbg5,gandy94,0,1630156386.0,0,t1_haofwqs,haofwqs,False,JusticeAvenger618,t3_pcvlep,https://www.reddit.com/r/centralillinois/comments/pcvlep/il_is_broken_as_an_utterly_nonfunctioning_state/,IL Is Broken As An Utterly Nonfunctioning State,/r/centralillinois/comments/pcvlep/il_is_broken_as_an_utterly_nonfunctioning_state/haofwqs/,1,r/centralillinois,0,1
I just appreciate this really level-headed reply; rare on reddit.,t2_fd015,cdubose,0,1630156181.0,0,t1_haofjah,haofjah,False,JusticeAvenger618,t3_pcvlep,https://www.reddit.com/r/centralillinois/comments/pcvlep/il_is_broken_as_an_utterly_nonfunctioning_state/,IL Is Broken As An Utterly Nonfunctioning State,/r/centralillinois/comments/pcvlep/il_is_broken_as_an_utterly_nonfunctioning_state/haofjah/,5,r/centralillinois,0,5
Yeah if you've ever looked at Job Postings in IL - that FOID Program is PERMANENTLY HIRING. The problem seems to be they want angelic saints with zero negative blips in their life to work the jobs. My friend applied in Springfield and was rejected because he had a 7 month gap in work history easily explained by a hospitalized child. He said the anal probe background check they do for those jobs is insane considering it's ultimately a clerical job processing applications.,t2_7cpr80xu,JusticeAvenger618,0,1630150462.0,0,t1_hao65i1,hao65i1,False,JusticeAvenger618,t3_pcvlep,https://www.reddit.com/r/centralillinois/comments/pcvlep/il_is_broken_as_an_utterly_nonfunctioning_state/,IL Is Broken As An Utterly Nonfunctioning State,/r/centralillinois/comments/pcvlep/il_is_broken_as_an_utterly_nonfunctioning_state/hao65i1/,4,r/centralillinois,0,4
"Except I've now lived in Collinsville, Springfield, Quincy, Livingston and Rockford. The streets are janky all over. Potholes that were never fixed LAST WINTER will only grow more deadly THIS Winter. I mean I'm sure it is local but when every ""locality"" is broke and in disrepair - at some point it becomes a STATE IS BROKEN problem. And another thing: for a progressive blue State  - it's HYPER-REPUBLICAN everywhere I have lived. These people have Trump emblazoned on their barns, tractors and pickups. 🙄",t2_7cpr80xu,JusticeAvenger618,0,1630150057.0,0,t1_hao5lp3,hao5lp3,False,JusticeAvenger618,t3_pcvlep,https://www.reddit.com/r/centralillinois/comments/pcvlep/il_is_broken_as_an_utterly_nonfunctioning_state/,IL Is Broken As An Utterly Nonfunctioning State,/r/centralillinois/comments/pcvlep/il_is_broken_as_an_utterly_nonfunctioning_state/hao5lp3/,4,r/centralillinois,0,4
"You’re right. Thank you for bringing that to my attention. I really don’t know what I was thinking.
I guess I just let my frustration take over.
Edit:
Ok, I was embarrassed about my mistake so I did some research. Social Security-disability is federally funded but the field office which determines medical eligibility is actually state ran.
“The DDS, which are fully funded by the federal government, are state agencies and are responsible for developing medical evidence and making the initial determination on whether or not claimant is disabled or blind under the law.”
From SSA website",t2_cycauzet,Plenty_Apple6108,0,1630146894.0,0,t1_hao1e4j,hao1e4j,False,JusticeAvenger618,t3_pcvlep,https://www.reddit.com/r/centralillinois/comments/pcvlep/il_is_broken_as_an_utterly_nonfunctioning_state/,IL Is Broken As An Utterly Nonfunctioning State,/r/centralillinois/comments/pcvlep/il_is_broken_as_an_utterly_nonfunctioning_state/hao1e4j/,5,r/centralillinois,0,5
Kentucky has been processing our FOID cards and they're 6 months behind at a minimum,t2_7tvatrur,Beefsupremeninjalo82,0,1630119538.0,0,t1_han0ztu,han0ztu,True,JusticeAvenger618,t3_pcvlep,https://www.reddit.com/r/centralillinois/comments/pcvlep/il_is_broken_as_an_utterly_nonfunctioning_state/,IL Is Broken As An Utterly Nonfunctioning State,/r/centralillinois/comments/pcvlep/il_is_broken_as_an_utterly_nonfunctioning_state/han0ztu/,2,r/centralillinois,0,2
"Yeah well I'd have to GET UNEMPLOYMENT in order to miss the cut payments. Filed last July. Still playing incompetent games of ""we lost your paperwork again"" and ""we just called u but don't have your phone number."" Like what in the actual hell is wrong with IDES???",t2_7cpr80xu,JusticeAvenger618,1,1630108377.0,0,t1_hamevj0,hamevj0,False,JusticeAvenger618,t3_pcvlep,https://www.reddit.com/r/centralillinois/comments/pcvlep/il_is_broken_as_an_utterly_nonfunctioning_state/,IL Is Broken As An Utterly Nonfunctioning State,/r/centralillinois/comments/pcvlep/il_is_broken_as_an_utterly_nonfunctioning_state/hamevj0/,0,r/centralillinois,0,0
"If you think it's bad here, try moving to a state that's already cut unemployment benefits... 

But no really, IDES is really inefficient. Especially the website. Hey, maybe IDES is hiring! /s",t2_fd015,cdubose,0,1630106954.0,0,t1_hambyu5,hambyu5,True,JusticeAvenger618,t3_pcvlep,https://www.reddit.com/r/centralillinois/comments/pcvlep/il_is_broken_as_an_utterly_nonfunctioning_state/,IL Is Broken As An Utterly Nonfunctioning State,/r/centralillinois/comments/pcvlep/il_is_broken_as_an_utterly_nonfunctioning_state/hambyu5/,15,r/centralillinois,0,15
"People aren't getting vaccinated. Mask mandates are the backup plan.

If you don't like mask mandates, go get vaccinated and get your friends to get vaccinated too.

It's a free country, so you get to choose when the pandemic ends!  Vaccination really is the endgame here.",t2_vpn412i,WizeAdz,0,1630105600.0,0,t1_ham958b,ham958b,False,[deleted],t3_pc6nus,https://www.reddit.com/r/centralillinois/comments/pc6nus/governor/,governor,/r/centralillinois/comments/pc6nus/governor/ham958b/,1,r/centralillinois,0,1
"To quote Conservatives during George W Bush’s reign, “If you don’t love it, leave it.”

Seriously though, it really sucks that IDES is failing you. I hope it gets better.",t2_6k68w,maqij,0,1630104473.0,0,t1_ham6qzb,ham6qzb,True,JusticeAvenger618,t3_pcvlep,https://www.reddit.com/r/centralillinois/comments/pcvlep/il_is_broken_as_an_utterly_nonfunctioning_state/,IL Is Broken As An Utterly Nonfunctioning State,/r/centralillinois/comments/pcvlep/il_is_broken_as_an_utterly_nonfunctioning_state/ham6qzb/,5,r/centralillinois,0,5
"No, it's definitely not the focus of mask mandate",t2_8c254,zworkaccount,0,1630103550.0,0,t1_ham4rql,ham4rql,False,[deleted],t3_pc6nus,https://www.reddit.com/r/centralillinois/comments/pc6nus/governor/,governor,/r/centralillinois/comments/pc6nus/governor/ham4rql/,0,r/centralillinois,0,0
Boo fucking hoo.  Get your vaccine and grow up.,t2_3dmk5ysu,THUNDERBISQUIT,0,1630102367.0,0,t1_ham27ul,ham27ul,True,[deleted],t3_pc6nus,https://www.reddit.com/r/centralillinois/comments/pc6nus/governor/,governor,/r/centralillinois/comments/pc6nus/governor/ham27ul/,1,r/centralillinois,0,1
"Chicago doesn't work either, it just gets all the attention.  Illinois is f*cked.  I'm only here for family.",t2_83zv3,vitalidex,0,1630099197.0,0,t1_halv2y8,halv2y8,True,JusticeAvenger618,t3_pcvlep,https://www.reddit.com/r/centralillinois/comments/pcvlep/il_is_broken_as_an_utterly_nonfunctioning_state/,IL Is Broken As An Utterly Nonfunctioning State,/r/centralillinois/comments/pcvlep/il_is_broken_as_an_utterly_nonfunctioning_state/halv2y8/,14,r/centralillinois,0,14
"And that’s just one department. Try dealing with Social Security! I have been waiting for my hearing since July 2020.
I feel your pain.",t2_cycauzet,Plenty_Apple6108,0,1630098399.0,0,t1_halt8zz,halt8zz,True,JusticeAvenger618,t3_pcvlep,https://www.reddit.com/r/centralillinois/comments/pcvlep/il_is_broken_as_an_utterly_nonfunctioning_state/,IL Is Broken As An Utterly Nonfunctioning State,/r/centralillinois/comments/pcvlep/il_is_broken_as_an_utterly_nonfunctioning_state/halt8zz/,6,r/centralillinois,0,6
Actually I'm pretty sure I had it before it had a name. I had a the symptums in Dec 2019. And none of us have gotten sick since. But thanks for your concern,t2_a1s5ktge,ExamIllustrious3394,0,1630091776.0,0,t1_haldh2q,haldh2q,False,[deleted],t3_pc6nus,https://www.reddit.com/r/centralillinois/comments/pc6nus/governor/,governor,/r/centralillinois/comments/pc6nus/governor/haldh2q/,1,r/centralillinois,0,1
"Getting people vaccinated is the focus.

Have you not actually read anything I wrote?",t2_vpn412i,WizeAdz,0,1630088484.0,0,t1_hal5jef,hal5jef,False,[deleted],t3_pc6nus,https://www.reddit.com/r/centralillinois/comments/pc6nus/governor/,governor,/r/centralillinois/comments/pc6nus/governor/hal5jef/,2,r/centralillinois,0,2
"Nah that’s some crazy conspiracy theory stuff. I recommend listening to medical journals, Heath experts, and the WHO if you’re skeptical of the CDC. I know you’re going on to think I’m full of shit for saying that, but honestly whether we disagree politically or not I’d rather see that you and your family are safe from this virus. The whole situation sucks, no way around it.",t2_lq0la,Burgundy995,0,1630086483.0,0,t1_hal0no5,hal0no5,False,[deleted],t3_pc6nus,https://www.reddit.com/r/centralillinois/comments/pc6nus/governor/,governor,/r/centralillinois/comments/pc6nus/governor/hal0no5/,1,r/centralillinois,0,1
"Check out this link.. it's a slide show about the vaccine and what they have found out so far..
https://dougbillings.us/slide-decks-delta-bioweapon/",t2_a1s5ktge,ExamIllustrious3394,0,1630086174.0,0,t1_hakzvla,hakzvla,False,[deleted],t3_pc6nus,https://www.reddit.com/r/centralillinois/comments/pc6nus/governor/,governor,/r/centralillinois/comments/pc6nus/governor/hakzvla/,1,r/centralillinois,0,1
I think positive incentives are a great idea. They have done some of those. The problem in this specific instance is that the spread has been so severe in the less vaccinated areas of the state that hospitals are almost at capacity. So they had to do something to stop that. From the perspective of the government they’re kind of screwed politically either way. So it makes sense to try to do the thing that will hopefully address the problem as quick as they can.,t2_lq0la,Burgundy995,0,1630085650.0,0,t1_hakyks7,hakyks7,False,[deleted],t3_pc6nus,https://www.reddit.com/r/centralillinois/comments/pc6nus/governor/,governor,/r/centralillinois/comments/pc6nus/governor/hakyks7/,1,r/centralillinois,0,1
"Sure, but the vaccinated are still far more protected than the unvaccinated. Personally, I’d rather see less dangerous infections, therefore the more people that get vaccinated the better the outcome for everyone.",t2_lq0la,Burgundy995,0,1630085392.0,0,t1_hakxxr2,hakxxr2,False,[deleted],t3_pc6nus,https://www.reddit.com/r/centralillinois/comments/pc6nus/governor/,governor,/r/centralillinois/comments/pc6nus/governor/hakxxr2/,1,r/centralillinois,0,1
No problem,t2_a1s5ktge,ExamIllustrious3394,0,1630084838.0,0,t1_hakwj87,hakwj87,False,[deleted],t3_pc6nus,https://www.reddit.com/r/centralillinois/comments/pc6nus/governor/,governor,/r/centralillinois/comments/pc6nus/governor/hakwj87/,0,r/centralillinois,0,0
"Thanks, I'll look through those later today.",t2_3xv1n,Captain_Quark,0,1630084813.0,0,t1_hakwgwz,hakwgwz,False,[deleted],t3_pc6nus,https://www.reddit.com/r/centralillinois/comments/pc6nus/governor/,governor,/r/centralillinois/comments/pc6nus/governor/hakwgwz/,2,r/centralillinois,0,2
I don't really think so I mean it's a virus that will continue to mutate just like the flu.,t2_a1s5ktge,ExamIllustrious3394,0,1630084794.0,0,t1_hakwf6u,hakwf6u,False,[deleted],t3_pc6nus,https://www.reddit.com/r/centralillinois/comments/pc6nus/governor/,governor,/r/centralillinois/comments/pc6nus/governor/hakwf6u/,1,r/centralillinois,0,1
"I can't add screen shots but I will send you the website link and you can look through the slide show presentation I watched the other night by a woman who has worked for Pfizer for 20 years and she went through all the test data to see if there was any side effects. 
https://dougbillings.us/slide-decks-delta-bioweapon/

If you would like me to attach her interview( it 1 1/2 hours long) but very informative. Just let me know and I'll post it too",t2_a1s5ktge,ExamIllustrious3394,0,1630084698.0,0,t1_hakw6kk,hakw6kk,False,[deleted],t3_pc6nus,https://www.reddit.com/r/centralillinois/comments/pc6nus/governor/,governor,/r/centralillinois/comments/pc6nus/governor/hakw6kk/,0,r/centralillinois,0,0
Why not focus on getting people vaccinated? The mask mandate isn't even going to work at this point. It is going to be so poorly enforced it will accomplish nothing. Not to mention that the delta variant is so much more contagious that it even further reduces the effectiveness of cloth masks.,t2_8c254,zworkaccount,0,1630084573.0,0,t1_hakvv6v,hakvv6v,False,[deleted],t3_pc6nus,https://www.reddit.com/r/centralillinois/comments/pc6nus/governor/,governor,/r/centralillinois/comments/pc6nus/governor/hakvv6v/,1,r/centralillinois,0,1
I really don't know what point you are trying to make. Even if 100% of the global population got vaccinated covid is here to stay. It is not comparable to smallpox at all.,t2_8c254,zworkaccount,0,1630084432.0,0,t1_hakvihm,hakvihm,False,[deleted],t3_pc6nus,https://www.reddit.com/r/centralillinois/comments/pc6nus/governor/,governor,/r/centralillinois/comments/pc6nus/governor/hakvihm/,0,r/centralillinois,0,0
