body,author_fullname,author.name,controversiality,created,downs,fullname,id,is_root,link_author,link_id,link_permalink,link_title,permalink,score,subreddit_name_prefixed,total_awards_received,ups
You go Demarcus,t2_e9huzt3i,Comfortable-Heron450,0,1644369880.0,0,t1_hw5x2b9,hw5x2b9,True,615BonJovi,t3_snoygd,https://www.reddit.com/r/Clarksville/comments/snoygd/need_help_moving/,Need help moving ?,/r/Clarksville/comments/snoygd/need_help_moving/hw5x2b9/,3,r/Clarksville,0,3
"Edit: driving here makes me angrier than I've ever been, even when we lived in California. Out there it's a rat race but here it's straight survival",t2_iez86t1u,trailer_parkpretty,0,1644339130.0,0,t1_hw3ofwr,hw3ofwr,False,Bubbly-Experience-67,t3_sfa3hm,https://www.reddit.com/r/Clarksville/comments/sfa3hm/darkness/,Darkness,/r/Clarksville/comments/sfa3hm/darkness/hw3ofwr/,2,r/Clarksville,0,2
"100 percent. My parents moved here last summer and my husband and I decided to travel for a while before we settled. Somehow we also ended up here as he got a job in Nashville. Both of us agree that we felt it the first time we came here and it hasn't changed for either of us since. My mom also agrees. I've seen both of my parents become more depressed since moving in. Thankfully we're buying a house closer to Nash. 
There is a looming darkness in the air. I keep feeling fear and I get shaky and anxious when I leave my house. There is something weird here.",t2_iez86t1u,trailer_parkpretty,0,1644338767.0,0,t1_hw3nfzx,hw3nfzx,True,Bubbly-Experience-67,t3_sfa3hm,https://www.reddit.com/r/Clarksville/comments/sfa3hm/darkness/,Darkness,/r/Clarksville/comments/sfa3hm/darkness/hw3nfzx/,2,r/Clarksville,0,2
"I’m a developer and can read Java, but not good enough to teach it. Clarksville might be a stretch, so you can look for Meetups in Nashville",t2_cemkak08,UseWhatever,0,1644334902.0,0,t1_hw3d5zq,hw3d5zq,True,ReptileChaser,t3_smychk,https://www.reddit.com/r/Clarksville/comments/smychk/coding/,Coding,/r/Clarksville/comments/smychk/coding/hw3d5zq/,1,r/Clarksville,0,1
"**ATTENTION**  
Due to the very short age of your account, this post has been automatically filtered.  
The moderators will be along shortly to make sure this is not spam!  
If more than 24 hours pass without an alert, please message the moderators via modmail!

*I am a bot, and this action was performed automatically. Please [contact the moderators of this subreddit](/message/compose/?to=/r/Clarksville) if you have any questions or concerns.*",t2_6l4z3,AutoModerator,0,1644307520.0,0,t1_hw23pp6,hw23pp6,True,Stevenshemwell420,t3_snexwa,https://www.reddit.com/r/Clarksville/comments/snexwa/craft_cannabis_legal_thc_products/,"Craft cannabis legal THC products flower,wax,edibles and more 373 Dover rd we will deliver for ordered over $50 ! 559 5726060",/r/Clarksville/comments/snexwa/craft_cannabis_legal_thc_products/hw23pp6/,1,r/Clarksville,0,1
Try any major software company as a business/sales development representative. Most companies are hiring like crazy and pay a decent salary to start. The commission potentials are ridiculous and the perks are great too! It’s a grind but definitely has major upside.,t2_rdh4o,breilmeetsworld,0,1644278220.0,0,t1_hw0i9pb,hw0i9pb,True,[deleted],t3_smhtwn,https://www.reddit.com/r/Clarksville/comments/smhtwn/anyone_know_of_any_remote_job_listings_entry/,"Anyone know of any remote job listings - entry level, full time etc. Wife got a new FT job and I am home with our son who is not of school age yet. A remote job would be ideal! Have resume on file if that helps. Thanks in advance",/r/Clarksville/comments/smhtwn/anyone_know_of_any_remote_job_listings_entry/hw0i9pb/,1,r/Clarksville,0,1
"I don't know JAVA, but familiar with JavaScript and a few other languages. Your best bet would to get started online with freecodecamp. Maybe the library has some programs or courses they have access to for card holders?",t2_tw19f,d3fau1t82,0,1644267248.0,0,t1_hvzr3ub,hvzr3ub,True,ReptileChaser,t3_smychk,https://www.reddit.com/r/Clarksville/comments/smychk/coding/,Coding,/r/Clarksville/comments/smychk/coding/hvzr3ub/,4,r/Clarksville,0,4
I go to Matt at 13 Daggers for all my tattoos.,t2_9c5gv8ax,kittykatmomma2,0,1644251802.0,0,t1_hvynerq,hvynerq,True,[deleted],t3_smkng7,https://www.reddit.com/r/Clarksville/comments/smkng7/tattoo/,Tattoo,/r/Clarksville/comments/smkng7/tattoo/hvynerq/,1,r/Clarksville,0,1
The electric flamingo is a small studio with one guy who does everything and he's great! I got my last tattoo done there and I love what he drew up and how quick and easy it was to get it done. I highly recommend him,t2_4i9zl2ms,Sopewaters,0,1644251244.0,0,t1_hvym177,hvym177,True,[deleted],t3_smkng7,https://www.reddit.com/r/Clarksville/comments/smkng7/tattoo/,Tattoo,/r/Clarksville/comments/smkng7/tattoo/hvym177/,2,r/Clarksville,0,2
Check out Sykes/Alpine Access. They are almost always hiring and they send all the equipment you will need once you are hired.,t2_h7f4jkng,Ok-Plane917,0,1644248221.0,0,t1_hvyef98,hvyef98,True,[deleted],t3_smhtwn,https://www.reddit.com/r/Clarksville/comments/smhtwn/anyone_know_of_any_remote_job_listings_entry/,"Anyone know of any remote job listings - entry level, full time etc. Wife got a new FT job and I am home with our son who is not of school age yet. A remote job would be ideal! Have resume on file if that helps. Thanks in advance",/r/Clarksville/comments/smhtwn/anyone_know_of_any_remote_job_listings_entry/hvyef98/,2,r/Clarksville,0,2
death do us part!,t2_9qbbz8pf,DismalReplacement784,0,1644246196.0,0,t1_hvy9jq2,hvy9jq2,True,[deleted],t3_smkng7,https://www.reddit.com/r/Clarksville/comments/smkng7/tattoo/,Tattoo,/r/Clarksville/comments/smkng7/tattoo/hvy9jq2/,1,r/Clarksville,0,1
I have a degree in communications with a focus in sports - not my wisest teenage choice at the time! Have been an electrical apprentice the past few years but the trade field is not for me,t2_7druehek,Revolutionary_Ad_10,0,1644245935.0,0,t1_hvy8xpd,hvy8xpd,False,[deleted],t3_smhtwn,https://www.reddit.com/r/Clarksville/comments/smhtwn/anyone_know_of_any_remote_job_listings_entry/,"Anyone know of any remote job listings - entry level, full time etc. Wife got a new FT job and I am home with our son who is not of school age yet. A remote job would be ideal! Have resume on file if that helps. Thanks in advance",/r/Clarksville/comments/smhtwn/anyone_know_of_any_remote_job_listings_entry/hvy8xpd/,1,r/Clarksville,0,1
"What industry/title are you?

Edit: *Ahem* I also recommend posting job-related items on a clean account",t2_3ieap,MDPhotog,0,1644245802.0,0,t1_hvy8moh,hvy8moh,True,[deleted],t3_smhtwn,https://www.reddit.com/r/Clarksville/comments/smhtwn/anyone_know_of_any_remote_job_listings_entry/,"Anyone know of any remote job listings - entry level, full time etc. Wife got a new FT job and I am home with our son who is not of school age yet. A remote job would be ideal! Have resume on file if that helps. Thanks in advance",/r/Clarksville/comments/smhtwn/anyone_know_of_any_remote_job_listings_entry/hvy8moh/,8,r/Clarksville,0,8
Pintrest can show you alot of options on different websites regarding work from home opportunities. You might have to scroll through to find something to your liking but there is alot on there that can point you in the right directions,t2_7wzj73wz,MajesticSeahors3,0,1644241421.0,0,t1_hvxz3ho,hvxz3ho,True,[deleted],t3_smhtwn,https://www.reddit.com/r/Clarksville/comments/smhtwn/anyone_know_of_any_remote_job_listings_entry/,"Anyone know of any remote job listings - entry level, full time etc. Wife got a new FT job and I am home with our son who is not of school age yet. A remote job would be ideal! Have resume on file if that helps. Thanks in advance",/r/Clarksville/comments/smhtwn/anyone_know_of_any_remote_job_listings_entry/hvxz3ho/,1,r/Clarksville,0,1
"I go to Hermitage in Nashville for mine, Lone Wolf Tattoo. I know the owner personally and they do some truly amazing and unique work.  You can see their work on other social platforms.  The last time I went in with one I had seen in a dream and they made it a reality.",t2_jg5qyqwi,Traveling_Shutterbug,0,1644240867.0,0,t1_hvxxznp,hvxxznp,True,[deleted],t3_smkng7,https://www.reddit.com/r/Clarksville/comments/smkng7/tattoo/,Tattoo,/r/Clarksville/comments/smkng7/tattoo/hvxxznp/,1,r/Clarksville,0,1
100% No Egrets!,t2_h2g5ops3,roundishroch,0,1644227308.0,0,t1_hvxdvj7,hvxdvj7,False,[deleted],t3_smkng7,https://www.reddit.com/r/Clarksville/comments/smkng7/tattoo/,Tattoo,/r/Clarksville/comments/smkng7/tattoo/hvxdvj7/,2,r/Clarksville,0,2
I’ve had good experiences at No Egrets,t2_34ihlnqs,knifeazz,0,1644224276.0,0,t1_hvxa61k,hvxa61k,True,[deleted],t3_smkng7,https://www.reddit.com/r/Clarksville/comments/smkng7/tattoo/,Tattoo,/r/Clarksville/comments/smkng7/tattoo/hvxa61k/,6,r/Clarksville,0,6
"You could try FlexJobs, which has every job style in a variety of industries. Import your resume, set your profile to what you’re interested in (hours per week, industry, etc), and good luck! It’s free to use and easy to bookmark and apply to listings, but there is a subscription that unlocks skill tests and I assume other things. Full disclosure I haven’t tried to get a gig on there myself yet, but I’ve had it enthusiastically recommended to me multiple times and found it easy to set up.",t2_69r5u6ci,Sionnachian,0,1644212056.0,0,t1_hvwsf1f,hvwsf1f,True,[deleted],t3_smhtwn,https://www.reddit.com/r/Clarksville/comments/smhtwn/anyone_know_of_any_remote_job_listings_entry/,"Anyone know of any remote job listings - entry level, full time etc. Wife got a new FT job and I am home with our son who is not of school age yet. A remote job would be ideal! Have resume on file if that helps. Thanks in advance",/r/Clarksville/comments/smhtwn/anyone_know_of_any_remote_job_listings_entry/hvwsf1f/,2,r/Clarksville,0,2
Cash and carry barn has fresh produce and honey,t2_iok8krxn,mscottenn,0,1644207241.0,0,t1_hvwje9l,hvwje9l,True,subtleasabrick7567,t3_sf2jyb,https://www.reddit.com/r/Clarksville/comments/sf2jyb/farmers_market/,Farmers market,/r/Clarksville/comments/sf2jyb/farmers_market/hvwje9l/,3,r/Clarksville,0,3
Keep them Diamond hands!,t2_5w9kld4z,junglegymjessie,0,1644167358.0,0,t1_hvty8dd,hvty8dd,False,junglegymjessie,t3_slkb66,https://www.reddit.com/r/Clarksville/comments/slkb66/pizza_joints_in_the_mall/,Pizza joints in the mall,/r/Clarksville/comments/slkb66/pizza_joints_in_the_mall/hvty8dd/,8,r/Clarksville,0,8
"Thank you for all the responses. As you can tell I have not been in that place for a while as well. My memory may be wrong, it might not have been a Sabarro exactly, but there was a pizza joint there when the food court was down the ""center aisle"" of the mall. Back when it had an arcade.",t2_5w9kld4z,junglegymjessie,0,1644167230.0,0,t1_hvtxwoz,hvtxwoz,True,junglegymjessie,t3_slkb66,https://www.reddit.com/r/Clarksville/comments/slkb66/pizza_joints_in_the_mall/,Pizza joints in the mall,/r/Clarksville/comments/slkb66/pizza_joints_in_the_mall/hvtxwoz/,1,r/Clarksville,0,1
https://www.governorssquare.net/directory-map/,t2_3e6xv,user1484,0,1644166267.0,0,t1_hvtvhps,hvtvhps,True,junglegymjessie,t3_slkb66,https://www.reddit.com/r/Clarksville/comments/slkb66/pizza_joints_in_the_mall/,Pizza joints in the mall,/r/Clarksville/comments/slkb66/pizza_joints_in_the_mall/hvtvhps/,2,r/Clarksville,0,2
There’s been a sign hanging where the pizza place was that says “MexiRican coming soon” for the last few months but I have seen zero changes so who knows how long it’ll be before it actually opens.,t2_9c5gv8ax,kittykatmomma2,0,1644162257.0,0,t1_hvtln2f,hvtln2f,False,junglegymjessie,t3_slkb66,https://www.reddit.com/r/Clarksville/comments/slkb66/pizza_joints_in_the_mall/,Pizza joints in the mall,/r/Clarksville/comments/slkb66/pizza_joints_in_the_mall/hvtln2f/,3,r/Clarksville,0,3
"This is true but we've got to support AMC, even if it's the worst AMC in the country",t2_2hyy28uo,cloud9flyerr,0,1644153624.0,0,t1_hvt3rr7,hvt3rr7,False,junglegymjessie,t3_slkb66,https://www.reddit.com/r/Clarksville/comments/slkb66/pizza_joints_in_the_mall/,Pizza joints in the mall,/r/Clarksville/comments/slkb66/pizza_joints_in_the_mall/hvt3rr7/,8,r/Clarksville,0,8
"Tennessee Election Info

[Register to Vote](https://ovr.govote.tn.gov/Registration/RegistrationDetails/BM)",t2_jpimgrm,election_info_bot,0,1644152752.0,0,t1_hvt2a8k,hvt2a8k,True,[deleted],t3_sl6tis,https://www.reddit.com/r/Clarksville/comments/sl6tis/nukes_soviets_kgb_fort_campbell/,"Nukes, Soviets, KGB & Fort Campbell",/r/Clarksville/comments/sl6tis/nukes_soviets_kgb_fort_campbell/hvt2a8k/,2,r/Clarksville,0,2
Thank you for the verification!,t2_5w9kld4z,junglegymjessie,0,1644134916.0,0,t1_hvsez5f,hvsez5f,True,junglegymjessie,t3_slkb66,https://www.reddit.com/r/Clarksville/comments/slkb66/pizza_joints_in_the_mall/,Pizza joints in the mall,/r/Clarksville/comments/slkb66/pizza_joints_in_the_mall/hvsez5f/,1,r/Clarksville,0,1
I live in Clarksville but have not been in that dump in 7 years. It is the Walmart of malls,t2_e9huzt3i,Comfortable-Heron450,0,1644115413.0,0,t1_hvrw51h,hvrw51h,True,junglegymjessie,t3_slkb66,https://www.reddit.com/r/Clarksville/comments/slkb66/pizza_joints_in_the_mall/,Pizza joints in the mall,/r/Clarksville/comments/slkb66/pizza_joints_in_the_mall/hvrw51h/,3,r/Clarksville,0,3
"Godfather's was there, closed permanently several months ago. It only opened like a year or two ago. I forget what was in that spot previously. I heard a rumor a Mexican place will be going in its place, but idk who or when that will be. I've lived here 7 years and pretty confident there has not been a Sbarro's in that time.",t2_7aoa0,lburwell99,0,1644105339.0,0,t1_hvrae30,hvrae30,True,junglegymjessie,t3_slkb66,https://www.reddit.com/r/Clarksville/comments/slkb66/pizza_joints_in_the_mall/,Pizza joints in the mall,/r/Clarksville/comments/slkb66/pizza_joints_in_the_mall/hvrae30/,9,r/Clarksville,0,9
Great story!! Always love learning the history of my adopted hometown. ☺️ Thank you!,t2_15lgi7,ShabbyBeachNest,0,1644077840.0,0,t1_hvpnhwe,hvpnhwe,True,[deleted],t3_sl6tis,https://www.reddit.com/r/Clarksville/comments/sl6tis/nukes_soviets_kgb_fort_campbell/,"Nukes, Soviets, KGB & Fort Campbell",/r/Clarksville/comments/sl6tis/nukes_soviets_kgb_fort_campbell/hvpnhwe/,1,r/Clarksville,0,1
My kid’s great grandfather worked on that project,t2_hyj8ohe3,RaksBack,0,1644076162.0,0,t1_hvpjfeb,hvpjfeb,True,[deleted],t3_sl6tis,https://www.reddit.com/r/Clarksville/comments/sl6tis/nukes_soviets_kgb_fort_campbell/,"Nukes, Soviets, KGB & Fort Campbell",/r/Clarksville/comments/sl6tis/nukes_soviets_kgb_fort_campbell/hvpjfeb/,1,r/Clarksville,0,1
Love this stuff. Thanks!,t2_1tfn10wh,hellatoasty,0,1644071019.0,0,t1_hvp7z99,hvp7z99,True,[deleted],t3_sl6tis,https://www.reddit.com/r/Clarksville/comments/sl6tis/nukes_soviets_kgb_fort_campbell/,"Nukes, Soviets, KGB & Fort Campbell",/r/Clarksville/comments/sl6tis/nukes_soviets_kgb_fort_campbell/hvp7z99/,1,r/Clarksville,0,1
Florida is the move but depending where - rent is more expensive for a apartment than a house lol.,t2_96o5skrr,AdAlternative2200,0,1644008580.0,0,t1_hvm2j0a,hvm2j0a,False,guntergo2,t3_s6dwq9,https://www.reddit.com/r/Clarksville/comments/s6dwq9/social_stuff/,Social stuff,/r/Clarksville/comments/s6dwq9/social_stuff/hvm2j0a/,1,r/Clarksville,0,1
Yeah exactly. All their friends are in class and parents know how to call school. Who they texting? The seven people they know are here in english class,t2_bf7np,Saint3Love,0,1643982576.0,0,t1_hvk6lz5,hvk6lz5,False,USB-D,t3_r0mp3e,https://www.reddit.com/r/Clarksville/comments/r0mp3e/over_50_students_suspended_for_viral_tiktok_video/,Over 50 students suspended for viral TikTok video at West Creek High in Clarksville,/r/Clarksville/comments/r0mp3e/over_50_students_suspended_for_viral_tiktok_video/hvk6lz5/,1,r/Clarksville,0,1
"Just because it’s viral doesn’t mean it was good. Viral ≠ Good, you potato.",t2_4she6hgs,XXXtrogdorXX,0,1643950066.0,0,t1_hvit4nx,hvit4nx,False,USB-D,t3_r0mp3e,https://www.reddit.com/r/Clarksville/comments/r0mp3e/over_50_students_suspended_for_viral_tiktok_video/,Over 50 students suspended for viral TikTok video at West Creek High in Clarksville,/r/Clarksville/comments/r0mp3e/over_50_students_suspended_for_viral_tiktok_video/hvit4nx/,1,r/Clarksville,0,1
It went viral bozo,t2_7kczhzu2,Greenkash45,0,1643949929.0,0,t1_hvisv3q,hvisv3q,False,USB-D,t3_r0mp3e,https://www.reddit.com/r/Clarksville/comments/r0mp3e/over_50_students_suspended_for_viral_tiktok_video/,Over 50 students suspended for viral TikTok video at West Creek High in Clarksville,/r/Clarksville/comments/r0mp3e/over_50_students_suspended_for_viral_tiktok_video/hvisv3q/,0,r/Clarksville,0,0
Nigga it’s high school oldhead,t2_7kczhzu2,Greenkash45,0,1643949909.0,0,t1_hviston,hviston,False,USB-D,t3_r0mp3e,https://www.reddit.com/r/Clarksville/comments/r0mp3e/over_50_students_suspended_for_viral_tiktok_video/,Over 50 students suspended for viral TikTok video at West Creek High in Clarksville,/r/Clarksville/comments/r0mp3e/over_50_students_suspended_for_viral_tiktok_video/hviston/,0,r/Clarksville,0,0
Greenwood is the worst neighborhood in Clarksville or just South Clarksville,t2_7kczhzu2,Greenkash45,0,1643949659.0,0,t1_hviscg7,hviscg7,True,candicehmusic,t3_ib21io,https://www.reddit.com/r/Clarksville/comments/ib21io/best_worst_neighborhoods/,Best/ Worst Neighborhoods?,/r/Clarksville/comments/ib21io/best_worst_neighborhoods/hviscg7/,1,r/Clarksville,0,1
I'm majoring in English Education !,t2_4i9zl2ms,Sopewaters,0,1643949390.0,0,t1_hvirthp,hvirthp,False,brokowski13,t3_rxr0cy,https://www.reddit.com/r/Clarksville/comments/rxr0cy/any_current_students_or_new_graduates_at_apsu/,Any current students or new graduates at APSU?,/r/Clarksville/comments/rxr0cy/any_current_students_or_new_graduates_at_apsu/hvirthp/,1,r/Clarksville,0,1
What major are you doing?,t2_c33jfqkw,brokowski13,0,1643937635.0,0,t1_hvi222e,hvi222e,False,brokowski13,t3_rxr0cy,https://www.reddit.com/r/Clarksville/comments/rxr0cy/any_current_students_or_new_graduates_at_apsu/,Any current students or new graduates at APSU?,/r/Clarksville/comments/rxr0cy/any_current_students_or_new_graduates_at_apsu/hvi222e/,1,r/Clarksville,0,1
"**ATTENTION**  
Due to the very short age of your account, this post has been automatically filtered.  
The moderators will be along shortly to make sure this is not spam!  
If more than 24 hours pass without an alert, please message the moderators via modmail!

*I am a bot, and this action was performed automatically. Please [contact the moderators of this subreddit](/message/compose/?to=/r/Clarksville) if you have any questions or concerns.*",t2_6l4z3,AutoModerator,0,1643936075.0,0,t1_hvhyhi7,hvhyhi7,True,ColbieRealtor,t3_sjzqap,https://www.reddit.com/r/Clarksville/comments/sjzqap/housing/,Housing,/r/Clarksville/comments/sjzqap/housing/hvhyhi7/,1,r/Clarksville,0,1
[Andrew Ferst ](https://www.instagram.com/andrew.ferst/),t2_is7dafe7,Thirstyfersty,0,1643810684.0,0,t1_hv9ytqz,hv9ytqz,True,guntergo2,t3_se9uvw,https://www.reddit.com/r/Clarksville/comments/se9uvw/good_tattoo_artist/,Good tattoo artist?,/r/Clarksville/comments/se9uvw/good_tattoo_artist/hv9ytqz/,1,r/Clarksville,0,1
"**ATTENTION**  
Due to the very short age of your account, this post has been automatically filtered.  
The moderators will be along shortly to make sure this is not spam!  
If more than 24 hours pass without an alert, please message the moderators via modmail!

*I am a bot, and this action was performed automatically. Please [contact the moderators of this subreddit](/message/compose/?to=/r/Clarksville) if you have any questions or concerns.*",t2_6l4z3,AutoModerator,0,1643810602.0,0,t1_hv9ymyz,hv9ymyz,True,Thirstyfersty,t3_siphlx,https://www.reddit.com/r/Clarksville/comments/siphlx/if_youve_been_searching_for_your_new_tattoo/,If you've been searching for your new tattoo artist here's a few done by Andrew Ferst at visual bodhi on riverside!,/r/Clarksville/comments/siphlx/if_youve_been_searching_for_your_new_tattoo/hv9ymyz/,1,r/Clarksville,0,1
Haha I know how to say no. Just can’t ride anymore around with anything illegal rn,t2_a1hx9e48,guntergo2,0,1643772434.0,0,t1_hv88mho,hv88mho,False,guntergo2,t3_rc1e04,https://www.reddit.com/r/Clarksville/comments/rc1e04/need_ppl_that_are_cool_with_being_bored_in_my/,Need ppl that are cool with being bored in my room with me listening to 🪤 music😂💪🏾,/r/Clarksville/comments/rc1e04/need_ppl_that_are_cool_with_being_bored_in_my/hv88mho/,2,r/Clarksville,0,2
I would kick it with you brother but I’d probably be a bad influence lol,t2_hkic7ov4,Percaholik7,0,1643767750.0,0,t1_hv7xiyk,hv7xiyk,True,guntergo2,t3_rc1e04,https://www.reddit.com/r/Clarksville/comments/rc1e04/need_ppl_that_are_cool_with_being_bored_in_my/,Need ppl that are cool with being bored in my room with me listening to 🪤 music😂💪🏾,/r/Clarksville/comments/rc1e04/need_ppl_that_are_cool_with_being_bored_in_my/hv7xiyk/,1,r/Clarksville,0,1
thats good to hear (-:,t2_1l4voquc,aceflufferel,0,1643737663.0,0,t1_hv5rtev,hv5rtev,False,[deleted],t3_shz04p,https://www.reddit.com/r/Clarksville/comments/shz04p/automotive_tech_apprenticeships/,Automotive tech apprenticeships,/r/Clarksville/comments/shz04p/automotive_tech_apprenticeships/hv5rtev/,1,r/Clarksville,0,1
TCAT has a great program! Lots of hands on work!,t2_c124k6h0,AshleighMegan7,0,1643736111.0,0,t1_hv5nilj,hv5nilj,True,[deleted],t3_shz04p,https://www.reddit.com/r/Clarksville/comments/shz04p/automotive_tech_apprenticeships/,Automotive tech apprenticeships,/r/Clarksville/comments/shz04p/automotive_tech_apprenticeships/hv5nilj/,2,r/Clarksville,0,2
I'm a junior at APSU ! I'm always looking for new friends because it's really hard to meet friends here,t2_4i9zl2ms,Sopewaters,0,1643694215.0,0,t1_hv3k91h,hv3k91h,True,brokowski13,t3_rxr0cy,https://www.reddit.com/r/Clarksville/comments/rxr0cy/any_current_students_or_new_graduates_at_apsu/,Any current students or new graduates at APSU?,/r/Clarksville/comments/rxr0cy/any_current_students_or_new_graduates_at_apsu/hv3k91h/,2,r/Clarksville,0,2
"The electric flamingo, he's one guy who runs his own little shop but he's super cool and I love the piece he did for me!",t2_4i9zl2ms,Sopewaters,0,1643693904.0,0,t1_hv3jq73,hv3jq73,True,guntergo2,t3_se9uvw,https://www.reddit.com/r/Clarksville/comments/se9uvw/good_tattoo_artist/,Good tattoo artist?,/r/Clarksville/comments/se9uvw/good_tattoo_artist/hv3jq73/,3,r/Clarksville,0,3
Which is ironic because we moved on post 😂 Our neighbors (minus one) are super chill and friendly. It’s a totally different feel where we are now as opposed to LP.,t2_42ta6oyl,HeroaDerpina,0,1643597224.0,0,t1_huxyrhk,huxyrhk,False,Bubbly-Experience-67,t3_sfa3hm,https://www.reddit.com/r/Clarksville/comments/sfa3hm/darkness/,Darkness,/r/Clarksville/comments/sfa3hm/darkness/huxyrhk/,1,r/Clarksville,0,1
Good luck my friend,t2_e9huzt3i,Comfortable-Heron450,0,1643589205.0,0,t1_huxep0t,huxep0t,False,Bubbly-Experience-67,t3_sfa3hm,https://www.reddit.com/r/Clarksville/comments/sfa3hm/darkness/,Darkness,/r/Clarksville/comments/sfa3hm/darkness/huxep0t/,4,r/Clarksville,0,4
"Clearly, I’m not the only one feeling this way. And trust , that when I am able to pack my bags and leave this “great community,” I will. But it’s not an option right, now as I stated my reasons. Trust me, my eyes are wide open.",t2_a9sva4rh,Bubbly-Experience-67,0,1643588539.0,0,t1_huxd19u,huxd19u,False,Bubbly-Experience-67,t3_sfa3hm,https://www.reddit.com/r/Clarksville/comments/sfa3hm/darkness/,Darkness,/r/Clarksville/comments/sfa3hm/darkness/huxd19u/,5,r/Clarksville,0,5
"Oh my, yeah, that’s how it always felt living on post, which is why I opted out of living on post, it’s always so much drama.",t2_a9sva4rh,Bubbly-Experience-67,0,1643588398.0,0,t1_huxcoop,huxcoop,False,Bubbly-Experience-67,t3_sfa3hm,https://www.reddit.com/r/Clarksville/comments/sfa3hm/darkness/,Darkness,/r/Clarksville/comments/sfa3hm/darkness/huxcoop/,1,r/Clarksville,0,1
Please pack your bag and leave this great community. I really think you are dark and need to open your eyes.,t2_e9huzt3i,Comfortable-Heron450,0,1643588240.0,0,t1_huxcarp,huxcarp,True,Bubbly-Experience-67,t3_sfa3hm,https://www.reddit.com/r/Clarksville/comments/sfa3hm/darkness/,Darkness,/r/Clarksville/comments/sfa3hm/darkness/huxcarp/,5,r/Clarksville,0,5
"There’s a lot, but the short answer is that the builder is garbage, everyone was in everyone else’s business, parents are letting their kids run wild (many families stopped going to the playground on Mutual because of how awful some of those unsupervised teenagers were acting). As an example, they were setting fires, destroying playground equipment, trying to break into houses (caught on doorbell cams), and one girl (probably about 12 or 13) flashed a bunch of adult men while the playground was packed with kids and their parents.

And the drama. We’ve lived a lot of places, but that neighborhood is legitimately THE most drama filled place we’ve ever been. It was exhausting. 

The neighborhood looks pretty nice from the outside, but the feel changes entirely once you’ve moved in. A lot of people are jumping ship for many of the same reasons. 

The builder is adding a bunch of houses within the next few years. We’ve heard anywhere been 175-300. We wanted out before that happened.",t2_42ta6oyl,HeroaDerpina,0,1643522066.0,0,t1_hutj4ll,hutj4ll,False,Bubbly-Experience-67,t3_sfa3hm,https://www.reddit.com/r/Clarksville/comments/sfa3hm/darkness/,Darkness,/r/Clarksville/comments/sfa3hm/darkness/hutj4ll/,2,r/Clarksville,0,2
