body,author_fullname,author.name,controversiality,created,downs,fullname,id,is_root,link_author,link_id,link_permalink,link_title,permalink,score,subreddit_name_prefixed,total_awards_received,ups
I would recommend Fortera Federal Credit Union over NFCU (I have both).,t2_3e6xv,user1484,0,1648001260.0,0,t1_i1qt6q8,i1qt6q8,True,twattycakes,t3_tk9h15,https://www.reddit.com/r/Clarksville/comments/tk9h15/is_navy_federal_credit_a_union_worth_the_hype_i/,Is Navy Federal Credit a union worth the hype I sometimes see?,/r/Clarksville/comments/tk9h15/is_navy_federal_credit_a_union_worth_the_hype_i/i1qt6q8/,0,r/Clarksville,0,0
"As someone who’s lived in Clarksville their whole life, I second this notion.",t2_bk1r72r4,dzhvnn,0,1647991436.0,0,t1_i1q7c1p,i1q7c1p,False,twattycakes,t3_tk9h15,https://www.reddit.com/r/Clarksville/comments/tk9h15/is_navy_federal_credit_a_union_worth_the_hype_i/,Is Navy Federal Credit a union worth the hype I sometimes see?,/r/Clarksville/comments/tk9h15/is_navy_federal_credit_a_union_worth_the_hype_i/i1q7c1p/,5,r/Clarksville,0,5
"I've used them for a few years and have liked them.  They don't pull some of the bullshit some of the big banks do. (I had one switch what kind of account I had and then charge a bunch of fees.  There was a lawsuit about it, got like $20 from it.)",t2_6ajab,crazyisthenewnormal,0,1647986510.0,0,t1_i1pvkbn,i1pvkbn,True,twattycakes,t3_tk9h15,https://www.reddit.com/r/Clarksville/comments/tk9h15/is_navy_federal_credit_a_union_worth_the_hype_i/,Is Navy Federal Credit a union worth the hype I sometimes see?,/r/Clarksville/comments/tk9h15/is_navy_federal_credit_a_union_worth_the_hype_i/i1pvkbn/,1,r/Clarksville,0,1
"Somewhere between business and “against my will.” I work in Nashville, but I’m fully remote and am wanting to get away from the predatory landlords in Nashville. Price is pushing me out of Davidson, and my partner’s work is keeping me from east of the city. That left clarksville ¯\_(ツ)_/¯  we found something nice in our budget, and decided to just bite the bullet. 

Other than navy fed, I see a lot about fortera",t2_6gv2z,twattycakes,0,1647978289.0,0,t1_i1paoas,i1paoas,False,twattycakes,t3_tk9h15,https://www.reddit.com/r/Clarksville/comments/tk9h15/is_navy_federal_credit_a_union_worth_the_hype_i/,Is Navy Federal Credit a union worth the hype I sometimes see?,/r/Clarksville/comments/tk9h15/is_navy_federal_credit_a_union_worth_the_hype_i/i1paoas/,5,r/Clarksville,0,5
"Why are you moving to Clarksville? (I'm just curious, business, pleasure, or against your will?) 

I personally love Fortera. I love the online app they have. I'm far too poor to request anything like buying a house so I don't know that aspect. But my best friend uses Navy Federal and she had no problem with buying a house through them. As well as refinancing the house.",t2_5zarnxs,OceanRaes,0,1647977173.0,0,t1_i1p7t13,i1p7t13,True,twattycakes,t3_tk9h15,https://www.reddit.com/r/Clarksville/comments/tk9h15/is_navy_federal_credit_a_union_worth_the_hype_i/,Is Navy Federal Credit a union worth the hype I sometimes see?,/r/Clarksville/comments/tk9h15/is_navy_federal_credit_a_union_worth_the_hype_i/i1p7t13/,1,r/Clarksville,0,1
"Here is some real advice, don't move to clarksville.",t2_dtpgzw1w,Ok_Future4957,0,1647975620.0,0,t1_i1p3txu,i1p3txu,True,twattycakes,t3_tk9h15,https://www.reddit.com/r/Clarksville/comments/tk9h15/is_navy_federal_credit_a_union_worth_the_hype_i/,Is Navy Federal Credit a union worth the hype I sometimes see?,/r/Clarksville/comments/tk9h15/is_navy_federal_credit_a_union_worth_the_hype_i/i1p3txu/,9,r/Clarksville,0,9
"People like credit unions. I personally have a Fortera account but for the longest I was worried because there aren’t Fortera banks in Nashville (I live in Nash now).But I recently learned that most credit unions have a shared banking system where they team up with other credit unions. For example I can use Tennessee Credit Union as a bank like Fortera. I’m sure there are some restrictions though. But overall credit unions are best option for banking. 

Not all credit unions work together. Their website should have a shared bank locator.",t2_j5wwb4o6,username-checks-0ut_,0,1647974292.0,0,t1_i1p0euo,i1p0euo,True,twattycakes,t3_tk9h15,https://www.reddit.com/r/Clarksville/comments/tk9h15/is_navy_federal_credit_a_union_worth_the_hype_i/,Is Navy Federal Credit a union worth the hype I sometimes see?,/r/Clarksville/comments/tk9h15/is_navy_federal_credit_a_union_worth_the_hype_i/i1p0euo/,7,r/Clarksville,0,7
I've used them for an issue with my wife's car and liked them.  May have to just starting going there for everything,t2_4ddmh,Umbra29,0,1647962256.0,0,t1_i1o56cf,i1o56cf,False,Umbra29,t3_tje590,https://www.reddit.com/r/Clarksville/comments/tje590/wyatt_johnson_subaru_mechanics/,Wyatt Johnson Subaru mechanics,/r/Clarksville/comments/tje590/wyatt_johnson_subaru_mechanics/i1o56cf/,1,r/Clarksville,0,1
They use to be pretty fair but I fell out of the hobby right before all this scalping. It’s crazy out there,t2_re5iv,Coal_Bee,0,1647961067.0,0,t1_i1o284x,i1o284x,False,knifeazz,t3_tjkcw0,https://www.reddit.com/r/Clarksville/comments/tjkcw0/card_collecting_here_sucks/,Card collecting here sucks.,/r/Clarksville/comments/tjkcw0/card_collecting_here_sucks/i1o284x/,2,r/Clarksville,0,2
Right? That’s exactly what I thought 🤷🏻‍♀️,t2_jcb866bj,Hbananta,0,1647960197.0,0,t1_i1o02ma,i1o02ma,False,Umbra29,t3_tje590,https://www.reddit.com/r/Clarksville/comments/tje590/wyatt_johnson_subaru_mechanics/,Wyatt Johnson Subaru mechanics,/r/Clarksville/comments/tje590/wyatt_johnson_subaru_mechanics/i1o02ma/,2,r/Clarksville,0,2
"I know it isn’t a WRX, but C & S Auto Repair worked on my outback without any problems.",t2_4mzm601v,_rival79,0,1647952484.0,0,t1_i1nje5u,i1nje5u,True,Umbra29,t3_tje590,https://www.reddit.com/r/Clarksville/comments/tje590/wyatt_johnson_subaru_mechanics/,Wyatt Johnson Subaru mechanics,/r/Clarksville/comments/tje590/wyatt_johnson_subaru_mechanics/i1nje5u/,2,r/Clarksville,0,2
Yup that’s the case. I go to Frontline a bit when I get the itch but their prices aren’t the best,t2_34ihlnqs,knifeazz,0,1647951821.0,0,t1_i1ni6ks,i1ni6ks,False,knifeazz,t3_tjkcw0,https://www.reddit.com/r/Clarksville/comments/tjkcw0/card_collecting_here_sucks/,Card collecting here sucks.,/r/Clarksville/comments/tjkcw0/card_collecting_here_sucks/i1ni6ks/,1,r/Clarksville,0,1
Import auto works on fcb,t2_dbu7nq4p,Spin-papa-2891,0,1647949473.0,0,t1_i1ne6nb,i1ne6nb,True,Umbra29,t3_tje590,https://www.reddit.com/r/Clarksville/comments/tje590/wyatt_johnson_subaru_mechanics/,Wyatt Johnson Subaru mechanics,/r/Clarksville/comments/tje590/wyatt_johnson_subaru_mechanics/i1ne6nb/,3,r/Clarksville,0,3
Wtf lol. Rotating tires is not a reactive thing. You don't look at them and say not needed. It's preventative maintenance to try to get the tires to wear more evenly to last longer.,t2_7aoa0,lburwell99,0,1647946920.0,0,t1_i1naddu,i1naddu,False,Umbra29,t3_tje590,https://www.reddit.com/r/Clarksville/comments/tje590/wyatt_johnson_subaru_mechanics/,Wyatt Johnson Subaru mechanics,/r/Clarksville/comments/tje590/wyatt_johnson_subaru_mechanics/i1naddu/,2,r/Clarksville,0,2
I haven’t been in awhile but Frontline Games on 101st is where I use to get all my Pokémon cards until personal life got tight. From what I’ve heard it’s next to impossible to find decent priced cards lately due to the influx of scalpers though,t2_re5iv,Coal_Bee,0,1647939960.0,0,t1_i1n1wd4,i1n1wd4,False,knifeazz,t3_tjkcw0,https://www.reddit.com/r/Clarksville/comments/tjkcw0/card_collecting_here_sucks/,Card collecting here sucks.,/r/Clarksville/comments/tjkcw0/card_collecting_here_sucks/i1n1wd4/,1,r/Clarksville,0,1
I’ve had good work done at the Co Op service center,t2_9s5htrpc,harleybone,0,1647911647.0,0,t1_i1ltxi4,i1ltxi4,True,Umbra29,t3_tje590,https://www.reddit.com/r/Clarksville/comments/tje590/wyatt_johnson_subaru_mechanics/,Wyatt Johnson Subaru mechanics,/r/Clarksville/comments/tje590/wyatt_johnson_subaru_mechanics/i1ltxi4/,2,r/Clarksville,0,2
"I take all my cars to Nashville. Because if the local dealers fucks up my engine/transmission, that dealer is likely not selling the constrained models that bring in people. If a major Nashville dealer fucked up my engine/transmission, I'm getting GM corporate involved and I'm fairly certain they'll start losing C8 allocations if they fuck around with corporate.",t2_izp2k4bz,somethingsmethng102,0,1647910436.0,0,t1_i1lr9vg,i1lr9vg,True,Umbra29,t3_tje590,https://www.reddit.com/r/Clarksville/comments/tje590/wyatt_johnson_subaru_mechanics/,Wyatt Johnson Subaru mechanics,/r/Clarksville/comments/tje590/wyatt_johnson_subaru_mechanics/i1lr9vg/,1,r/Clarksville,0,1
A mechanic at a dealership should know if it's rear or front wheel drive. He's in the wrong on that,t2_3mwkknow,Aviate_Anime,0,1647909284.0,0,t1_i1loqbl,i1loqbl,False,Umbra29,t3_tje590,https://www.reddit.com/r/Clarksville/comments/tje590/wyatt_johnson_subaru_mechanics/,Wyatt Johnson Subaru mechanics,/r/Clarksville/comments/tje590/wyatt_johnson_subaru_mechanics/i1loqbl/,2,r/Clarksville,0,2
The service writer checked with his gauge before it went back and the front was 8/32 and the back was 6/32. He said maybe the mechanic thought the car was front wheel drive but it’s rear wheel drive.,t2_jcb866bj,Hbananta,0,1647908157.0,0,t1_i1lm7mg,i1lm7mg,False,Umbra29,t3_tje590,https://www.reddit.com/r/Clarksville/comments/tje590/wyatt_johnson_subaru_mechanics/,Wyatt Johnson Subaru mechanics,/r/Clarksville/comments/tje590/wyatt_johnson_subaru_mechanics/i1lm7mg/,1,r/Clarksville,0,1
C4 definitely has Pokémon cards. Idk if they are the moat recent sets but they are right on the counter and usually <$5 a pack.,t2_kvbbx,ducktapevoodoo,0,1647906755.0,0,t1_i1lj2r5,i1lj2r5,False,knifeazz,t3_tjkcw0,https://www.reddit.com/r/Clarksville/comments/tjkcw0/card_collecting_here_sucks/,Card collecting here sucks.,/r/Clarksville/comments/tjkcw0/card_collecting_here_sucks/i1lj2r5/,2,r/Clarksville,0,2
Damn that’s great to know. Much appreciated!,t2_34ihlnqs,knifeazz,0,1647905370.0,0,t1_i1lfxtr,i1lfxtr,False,knifeazz,t3_tjkcw0,https://www.reddit.com/r/Clarksville/comments/tjkcw0/card_collecting_here_sucks/,Card collecting here sucks.,/r/Clarksville/comments/tjkcw0/card_collecting_here_sucks/i1lfxtr/,2,r/Clarksville,0,2
"Idk if they'll have Pokemon cards or not but there this show at a church by exit 11. They have been doing it monthly. I've only been once a few months ago. Depends on who shows up and rents a booth. It wasn't a big show. Lots of people with sports cards and some with comics. 

https://www.facebook.com/events/3132351973749039/?sfnsn=mo

I also swear I saw Pokemon cards at a booth here a few months ago looking around for comic. It's a consignment place. Had other toys and stuff, no comics though.

The Upstairs Emporium
(931) 802-8088
https://maps.app.goo.gl/JvFmNrPbxd2FfnDi6

Might also want to check out some other consignment places. There's some smaller places kind of like Miss. Lucille's worth checking out, the Vintage Corner on Ft. Campbell Blvd has a booth right in the middle that has comics and toys, I don't remember if there were cards. There's also Warehouse 41 on Wilma Rudolph.

C4 Entertainment is on Ft. Campbell just into KY. They have a lot of toys, including vintage stuff, and comics. I think they do sports cards so might do Pokemon too. Worth calling them to ask 

These are just places I've explored looking for stuff to fuel my comic collecting hobby that may be worth a look for your hobby. Past that there's places around Nashville worth exploring too.",t2_7aoa0,lburwell99,0,1647904968.0,0,t1_i1lf0lz,i1lf0lz,False,knifeazz,t3_tjkcw0,https://www.reddit.com/r/Clarksville/comments/tjkcw0/card_collecting_here_sucks/,Card collecting here sucks.,/r/Clarksville/comments/tjkcw0/card_collecting_here_sucks/i1lf0lz/,2,r/Clarksville,0,2
"Oh nice, good to know. I collect Pokémon cards.",t2_34ihlnqs,knifeazz,0,1647902580.0,0,t1_i1l9gqw,i1l9gqw,False,knifeazz,t3_tjkcw0,https://www.reddit.com/r/Clarksville/comments/tjkcw0/card_collecting_here_sucks/,Card collecting here sucks.,/r/Clarksville/comments/tjkcw0/card_collecting_here_sucks/i1l9gqw/,1,r/Clarksville,0,1
"Welcome to the fucked up pay situation for a lot of mechanics. Some guys expect gravy jobs they can flag an easy 2.5 or 3 hours on all day long, and get each done in about 45 minutes .

Regardless, i have no idea if that's actually what happened. All i know is that I've seen it before where a lazy mechanic decides that a rotate isn't worth his time since it pays so little (Flat rate). Or who knows, the tires could have indicated the same treadwear front and rear, which would surprise me at 6k miles but, i guess if it's all highway mileage and the tires are a harder compound then it's certainly possible.

If i was still working in that field and I had a vehicle come in for an LOF(Oil change) + Rotate and when I checked the tires with my tread depth gauge and all of the tires read the same amount of wear, I would recommend to not rotate at that time. Now if your drive wheels (lets say front wheel drive since that's the most prevalant nowadays) measure out at like 7/32 and your rears at 8/32, then yeah. Totally rotate them. That's worth doing. But if they're the same wear *or* the fronts  have 8/32 and the rears have 7/32, then realistically from a tire longevity standpoint they shouldn't be rotated. At that point it's just paying me for a job that you don't need done 🤷‍♂️ and i'm not about that life.",t2_3mwkknow,Aviate_Anime,0,1647901824.0,0,t1_i1l7no5,i1l7no5,False,Umbra29,t3_tje590,https://www.reddit.com/r/Clarksville/comments/tje590/wyatt_johnson_subaru_mechanics/,Wyatt Johnson Subaru mechanics,/r/Clarksville/comments/tje590/wyatt_johnson_subaru_mechanics/i1l7no5/,1,r/Clarksville,0,1
"I've seen some basketball at Walgreens a few times this past month, not back by the toys...on a cardboard stand in the middle of the Easter aisle.  Otherwise might want to try the Walmart in Ashland city, haven't been since January but found some blasters back around d the holidays....may have just been right place right time though cause retail is pretty dry round here",t2_cc0ixoih,jailbirdlorraine,0,1647901568.0,0,t1_i1l71tm,i1l71tm,True,knifeazz,t3_tjkcw0,https://www.reddit.com/r/Clarksville/comments/tjkcw0/card_collecting_here_sucks/,Card collecting here sucks.,/r/Clarksville/comments/tjkcw0/card_collecting_here_sucks/i1l71tm/,2,r/Clarksville,0,2
"Wait you’re saying he didn’t do it because it doesn’t pay a lot? They can just choose not to do it if they don’t think they will make enough? That seems like an issue between them, they shouldn’t be allowed to just say I don’t feel like doing this or that…",t2_jcb866bj,Hbananta,0,1647901045.0,0,t1_i1l5sjk,i1l5sjk,False,Umbra29,t3_tje590,https://www.reddit.com/r/Clarksville/comments/tje590/wyatt_johnson_subaru_mechanics/,Wyatt Johnson Subaru mechanics,/r/Clarksville/comments/tje590/wyatt_johnson_subaru_mechanics/i1l5sjk/,1,r/Clarksville,0,1
"That's fair enough, and the service writer was in the wrong there for not properly communicating what was documented on the RO, let alone reading the annotations, before handing you the keys again.

Most of the time tires should be rotated at that interval, atleast in my experience with most OE tires on new vehicles and how they wear. I'll also say that most mechanics hate doing rotates because it pays a miserable 2 or 3 tenths an hour. 🤷‍♂️ I always did em when it was requested, just a bit of info from inside the shop. Best of luck on finding a reputable shop to service your vehicle 🤙",t2_3mwkknow,Aviate_Anime,0,1647900878.0,0,t1_i1l5e6t,i1l5e6t,False,Umbra29,t3_tje590,https://www.reddit.com/r/Clarksville/comments/tje590/wyatt_johnson_subaru_mechanics/,Wyatt Johnson Subaru mechanics,/r/Clarksville/comments/tje590/wyatt_johnson_subaru_mechanics/i1l5e6t/,2,r/Clarksville,0,2
I own Lincoln now because of them and I love it,t2_e9huzt3i,Comfortable-Heron450,0,1647900201.0,0,t1_i1l3t2r,i1l3t2r,False,Umbra29,t3_tje590,https://www.reddit.com/r/Clarksville/comments/tje590/wyatt_johnson_subaru_mechanics/,Wyatt Johnson Subaru mechanics,/r/Clarksville/comments/tje590/wyatt_johnson_subaru_mechanics/i1l3t2r/,1,r/Clarksville,0,1
"I got a million cards. Baseball, Football, Basketball and hockey. You want to buy 70, 80 and 90 cards, let me know",t2_e9huzt3i,Comfortable-Heron450,0,1647899528.0,0,t1_i1l28ix,i1l28ix,True,knifeazz,t3_tjkcw0,https://www.reddit.com/r/Clarksville/comments/tjkcw0/card_collecting_here_sucks/,Card collecting here sucks.,/r/Clarksville/comments/tjkcw0/card_collecting_here_sucks/i1l28ix/,1,r/Clarksville,0,1
"What kind of cards? There's a new card and table top game shop next to Rick's Comics on Madison. I forget the name. I've never gotten into MtG or D&D, but I noticed the place when I went into Rick's a few weeks ago.

Edit: it's called Natural 20 Works. Literally 1 door over from Rick's. Here's the website. I've definitely seen things about D&D and MtG groups in Clarksville. I have a coworker that does D&D I think, I can ask him.

https://www.natural20works.com/",t2_7aoa0,lburwell99,0,1647898868.0,0,t1_i1l0osh,i1l0osh,True,knifeazz,t3_tjkcw0,https://www.reddit.com/r/Clarksville/comments/tjkcw0/card_collecting_here_sucks/,Card collecting here sucks.,/r/Clarksville/comments/tjkcw0/card_collecting_here_sucks/i1l0osh/,2,r/Clarksville,0,2
"Well my car is brand new so the same 6,000 miles on the tires are on the car too, I wanted it done and specifically asked for it beforehand. The disconnect in my case was between the mechanic and service writer, the service writer didn’t see where the mechanic wrote “didn’t need rotated” on the invoice and charged me $30 for it but then I got in the car and drove out of the parking lot and the tire pressure was lower on the same tire as before and higher on the same one as before. He didn’t even adjust my tire pressures so they were all equal. He just wrote in his own words “not doing my job today” 
I’m not saying that the mechanic doesn’t know how to do his job, I’m saying he chose not to on something I specifically asked for. So instead of arguing or having someone mansplain to me I just won’t go back to them and I’ll tell anyone that asks why.",t2_jcb866bj,Hbananta,0,1647898297.0,0,t1_i1kzbua,i1kzbua,False,Umbra29,t3_tje590,https://www.reddit.com/r/Clarksville/comments/tje590/wyatt_johnson_subaru_mechanics/,Wyatt Johnson Subaru mechanics,/r/Clarksville/comments/tje590/wyatt_johnson_subaru_mechanics/i1kzbua/,2,r/Clarksville,0,2
"Just a heads up, I worked there in college. There is like, one mechanic you should let touch your subaru (if they are still there, it has been 4 years or so). He is named Joe (Mexican fella, loved him to death and HIGHLY trained). I would request him and really stress that the car goes to him, no one else touches it. I worked there for about two years in the service department as a porter so any questions, fire away.",t2_16v3hx,Toasted_Potooooooo,0,1647895499.0,0,t1_i1kssql,i1kssql,True,Umbra29,t3_tje590,https://www.reddit.com/r/Clarksville/comments/tje590/wyatt_johnson_subaru_mechanics/,Wyatt Johnson Subaru mechanics,/r/Clarksville/comments/tje590/wyatt_johnson_subaru_mechanics/i1kssql/,3,r/Clarksville,0,3
"Not to be ""that guy"", but i'll preface this by saying I worked as a mechanic at Toyota, Mazda, and an independent shop in the Nashville area... 

Whenever I had a vehicle come in for a service I knew that it did not need/ warrant, I would always bring it up to the service writer before performing it. Most of the time we got happy customers when I told them that they didn't need a rotate, others I was told to do anyways. Most of the time when i said it didn't need an alignment, it was due to the drive wheels already having the tires with the most tread left on them... Just trying to help the customer stretch their tire life.

 Same thing with alignments, if I saw no evidence of uneven wear, no complaints of a pull while driving, and a centered out steering wheel i'd usually get the service writer to talk to the customer about it. And, if at the end of the day the service was requested to still be done, i'd do it. That means I get paid for it, i just don't want people to be out money for no practical reason.

However if you get charged for a service and it wasn't performed, then that's a whole other subject of at best simple negligence or at worst, shady business practices.

Infact i got into a shouting match once with a service writer who wrote up an RO on a vehicle to check the tires for needing an alignment. I went on record, detailing everything i saw of how it didn't need that service. The writer still told the customer the car needed it and I proceeded to fly a bit off the handle (Service writers, like mechanics, are paid by commision).",t2_3mwkknow,Aviate_Anime,0,1647892281.0,0,t1_i1kkm5w,i1kkm5w,False,Umbra29,t3_tje590,https://www.reddit.com/r/Clarksville/comments/tje590/wyatt_johnson_subaru_mechanics/,Wyatt Johnson Subaru mechanics,/r/Clarksville/comments/tje590/wyatt_johnson_subaru_mechanics/i1kkm5w/,3,r/Clarksville,0,3
Use to it in for warranty recall and the computer did work. Took it in twice and the computer was down,t2_e9huzt3i,Comfortable-Heron450,0,1647888245.0,0,t1_i1kaoy0,i1kaoy0,False,Umbra29,t3_tje590,https://www.reddit.com/r/Clarksville/comments/tje590/wyatt_johnson_subaru_mechanics/,Wyatt Johnson Subaru mechanics,/r/Clarksville/comments/tje590/wyatt_johnson_subaru_mechanics/i1kaoy0/,1,r/Clarksville,0,1
T&B Automotive on Kraft. They are awesome.,t2_a0ydo00n,StarfleetGo,0,1647887148.0,0,t1_i1k7wdx,i1k7wdx,True,Umbra29,t3_tje590,https://www.reddit.com/r/Clarksville/comments/tje590/wyatt_johnson_subaru_mechanics/,Wyatt Johnson Subaru mechanics,/r/Clarksville/comments/tje590/wyatt_johnson_subaru_mechanics/i1k7wdx/,2,r/Clarksville,0,2
What happened?,t2_af8oo,edgyusernameguy,0,1647886370.0,0,t1_i1k5vi5,i1k5vi5,False,Umbra29,t3_tje590,https://www.reddit.com/r/Clarksville/comments/tje590/wyatt_johnson_subaru_mechanics/,Wyatt Johnson Subaru mechanics,/r/Clarksville/comments/tje590/wyatt_johnson_subaru_mechanics/i1k5vi5/,1,r/Clarksville,0,1
I gave up on them. No more GMC for me,t2_e9huzt3i,Comfortable-Heron450,0,1647884981.0,0,t1_i1k29ad,i1k29ad,True,Umbra29,t3_tje590,https://www.reddit.com/r/Clarksville/comments/tje590/wyatt_johnson_subaru_mechanics/,Wyatt Johnson Subaru mechanics,/r/Clarksville/comments/tje590/wyatt_johnson_subaru_mechanics/i1k29ad/,2,r/Clarksville,0,2
"Oh 😳 that probably caused the engine to seize. It wouldn’t surprise me if they drained the engine oil and wrote “didn’t need more oil” on the invoice. I’m sorry I’m still pissed that they didn’t rotate my tires because the “mechanic” said they didn’t need them, I feel like the 6,000 previous miles said they do need rotated for even and proper wear but I don’t want to argue with the Subaru “mechanic” 🙄",t2_jcb866bj,Hbananta,0,1647882833.0,0,t1_i1jwr58,i1jwr58,True,Umbra29,t3_tje590,https://www.reddit.com/r/Clarksville/comments/tje590/wyatt_johnson_subaru_mechanics/,Wyatt Johnson Subaru mechanics,/r/Clarksville/comments/tje590/wyatt_johnson_subaru_mechanics/i1jwr58/,1,r/Clarksville,0,1
Yeah.  It's all working now.  Just had an oil leak since november they can't seem to fix,t2_4ddmh,Umbra29,0,1647882570.0,0,t1_i1jw36o,i1jw36o,False,Umbra29,t3_tje590,https://www.reddit.com/r/Clarksville/comments/tje590/wyatt_johnson_subaru_mechanics/,Wyatt Johnson Subaru mechanics,/r/Clarksville/comments/tje590/wyatt_johnson_subaru_mechanics/i1jw36o/,2,r/Clarksville,0,2
Does the transmission still work?,t2_jcb866bj,Hbananta,0,1647882476.0,0,t1_i1jvuk5,i1jvuk5,False,Umbra29,t3_tje590,https://www.reddit.com/r/Clarksville/comments/tje590/wyatt_johnson_subaru_mechanics/,Wyatt Johnson Subaru mechanics,/r/Clarksville/comments/tje590/wyatt_johnson_subaru_mechanics/i1jvuk5/,1,r/Clarksville,0,1
Manual,t2_4ddmh,Umbra29,0,1647882408.0,0,t1_i1jvofo,i1jvofo,False,Umbra29,t3_tje590,https://www.reddit.com/r/Clarksville/comments/tje590/wyatt_johnson_subaru_mechanics/,Wyatt Johnson Subaru mechanics,/r/Clarksville/comments/tje590/wyatt_johnson_subaru_mechanics/i1jvofo/,2,r/Clarksville,0,2
What’s crazier is that your engine seized after a transmission replacement 🤨 is it auto or manual?,t2_jcb866bj,Hbananta,0,1647882355.0,0,t1_i1jvjp8,i1jvjp8,False,Umbra29,t3_tje590,https://www.reddit.com/r/Clarksville/comments/tje590/wyatt_johnson_subaru_mechanics/,Wyatt Johnson Subaru mechanics,/r/Clarksville/comments/tje590/wyatt_johnson_subaru_mechanics/i1jvjp8/,1,r/Clarksville,0,1
That's crazy.  I have yet to hear a good story about them.  After they fix the issue they were already paid to I'm definitely done with them,t2_4ddmh,Umbra29,0,1647882110.0,0,t1_i1jux89,i1jux89,False,Umbra29,t3_tje590,https://www.reddit.com/r/Clarksville/comments/tje590/wyatt_johnson_subaru_mechanics/,Wyatt Johnson Subaru mechanics,/r/Clarksville/comments/tje590/wyatt_johnson_subaru_mechanics/i1jux89/,1,r/Clarksville,0,1
"Yeah I’m probably not going back there. Even getting my car, I had to go to Indiana because they told me in November if I ordered it, then I could have it in February. They don’t seem like they like business very much based on how lazy they seem to be.",t2_jcb866bj,Hbananta,0,1647881855.0,0,t1_i1ju9sc,i1ju9sc,False,Umbra29,t3_tje590,https://www.reddit.com/r/Clarksville/comments/tje590/wyatt_johnson_subaru_mechanics/,Wyatt Johnson Subaru mechanics,/r/Clarksville/comments/tje590/wyatt_johnson_subaru_mechanics/i1ju9sc/,1,r/Clarksville,0,1
