body,author_fullname,author.name,controversiality,created,downs,fullname,id,is_root,link_author,link_id,link_permalink,link_title,permalink,score,subreddit_name_prefixed,total_awards_received,ups
Republican. Shocking,t2_34ihlnqs,knifeazz,0,1649011539.0,0,t1_i396m1z,i396m1z,False,politiphi,t3_tv6dft,https://www.reddit.com/r/Clarksville/comments/tv6dft/mayoral_candidate_wes_golden_was_once_arrested/,Mayoral candidate Wes Golden was once arrested for choking a woman unconscious,/r/Clarksville/comments/tv6dft/mayoral_candidate_wes_golden_was_once_arrested/i396m1z/,1,r/Clarksville,0,1
"All he to say is,"" I love Trump"" and he will get elected.",t2_6iyohez9,Gullible_Ad_3290,0,1649007384.0,0,t1_i38whxk,i38whxk,True,politiphi,t3_tv6dft,https://www.reddit.com/r/Clarksville/comments/tv6dft/mayoral_candidate_wes_golden_was_once_arrested/,Mayoral candidate Wes Golden was once arrested for choking a woman unconscious,/r/Clarksville/comments/tv6dft/mayoral_candidate_wes_golden_was_once_arrested/i38whxk/,1,r/Clarksville,0,1
You’re probably right but we are one step closer to freeing the plant !,t2_jbd71myq,Stevenshemwell420,0,1649006780.0,0,t1_i38v0p2,i38v0p2,False,Stevenshemwell420,t3_tuazqd,https://www.reddit.com/r/Clarksville/comments/tuazqd/house_sends_bill_to_senate_whats_your_thoughts/,House sends bill to senate !what’s your thoughts ?,/r/Clarksville/comments/tuazqd/house_sends_bill_to_senate_whats_your_thoughts/i38v0p2/,1,r/Clarksville,0,1
Thank you! I'll have to call them and ask I guess.,t2_bnq00mc2,CollectorMaster,0,1649002669.0,0,t1_i38l1t8,i38l1t8,False,CollectorMaster,t3_tvazg9,https://www.reddit.com/r/Clarksville/comments/tvazg9/curly_hair_specialist/,curly hair specialist,/r/Clarksville/comments/tvazg9/curly_hair_specialist/i38l1t8/,1,r/Clarksville,0,1
"All the reviews I'm seeing online are about a stylist named Maggie. It's overall good, but there's a review that she did a very poor job.",t2_bnq00mc2,CollectorMaster,0,1649002262.0,0,t1_i38k2br,i38k2br,False,CollectorMaster,t3_tvazg9,https://www.reddit.com/r/Clarksville/comments/tvazg9/curly_hair_specialist/,curly hair specialist,/r/Clarksville/comments/tvazg9/curly_hair_specialist/i38k2br/,1,r/Clarksville,0,1
"I'm sorry, I'm not really sure. I think a curly cut is $50 and if you add dye it's like $80. But those are rough guesses!",t2_5zarnxs,OceanRaes,0,1649002078.0,0,t1_i38jmmm,i38jmmm,False,CollectorMaster,t3_tvazg9,https://www.reddit.com/r/Clarksville/comments/tvazg9/curly_hair_specialist/,curly hair specialist,/r/Clarksville/comments/tvazg9/curly_hair_specialist/i38jmmm/,1,r/Clarksville,0,1
You happen to know their pricing? Is it on the website?,t2_bnq00mc2,CollectorMaster,0,1649001749.0,0,t1_i38iubv,i38iubv,False,CollectorMaster,t3_tvazg9,https://www.reddit.com/r/Clarksville/comments/tvazg9/curly_hair_specialist/,curly hair specialist,/r/Clarksville/comments/tvazg9/curly_hair_specialist/i38iubv/,1,r/Clarksville,0,1
"I think her name is Carly, but she works at The Mirror on Madison Street. My grandma and best friend's mom go to her. Both of them have very curly hair, and they love her.",t2_5zarnxs,OceanRaes,0,1649001669.0,0,t1_i38inig,i38inig,True,CollectorMaster,t3_tvazg9,https://www.reddit.com/r/Clarksville/comments/tvazg9/curly_hair_specialist/,curly hair specialist,/r/Clarksville/comments/tvazg9/curly_hair_specialist/i38inig/,1,r/Clarksville,0,1
"20 years ago... I could understand if it happened more than once or even if there were additional accusations. From what I know there are not any.

 As I said I am not voting for him, but all this BS nowadays about look what so and so did 15-20 years ago is ridiculous.",t2_a0i7dyhu,cypressfunk,0,1648998875.0,0,t1_i38c4kp,i38c4kp,False,politiphi,t3_tv6dft,https://www.reddit.com/r/Clarksville/comments/tv6dft/mayoral_candidate_wes_golden_was_once_arrested/,Mayoral candidate Wes Golden was once arrested for choking a woman unconscious,/r/Clarksville/comments/tv6dft/mayoral_candidate_wes_golden_was_once_arrested/i38c4kp/,-5,r/Clarksville,0,-5
"How many times were you arrested for assault in your 20s? Or anyone you know for that matter? You are right everyone is stupid in their 20s - like getting drunk in public or skipping class or going to a party instead of studying - but choking a person unconscious is on a completely different, unacceptable level.",t2_545zuir1,politiphi,0,1648998492.0,0,t1_i38b9ku,i38b9ku,False,politiphi,t3_tv6dft,https://www.reddit.com/r/Clarksville/comments/tv6dft/mayoral_candidate_wes_golden_was_once_arrested/,Mayoral candidate Wes Golden was once arrested for choking a woman unconscious,/r/Clarksville/comments/tv6dft/mayoral_candidate_wes_golden_was_once_arrested/i38b9ku/,11,r/Clarksville,0,11
How many assault charges would it take for you to not vote for him since one is apparently acceptable?,t2_545zuir1,politiphi,0,1648997781.0,0,t1_i389nqq,i389nqq,False,politiphi,t3_tv6dft,https://www.reddit.com/r/Clarksville/comments/tv6dft/mayoral_candidate_wes_golden_was_once_arrested/,Mayoral candidate Wes Golden was once arrested for choking a woman unconscious,/r/Clarksville/comments/tv6dft/mayoral_candidate_wes_golden_was_once_arrested/i389nqq/,7,r/Clarksville,0,7
"I am not voting for him, but come on.  It was 20 years ago when he was a young adult. Everyone was stupid in their 20's. Unless there is a history of this kind of incident it should have no impact on what is happening today.",t2_a0i7dyhu,cypressfunk,0,1648997613.0,0,t1_i389adv,i389adv,True,politiphi,t3_tv6dft,https://www.reddit.com/r/Clarksville/comments/tv6dft/mayoral_candidate_wes_golden_was_once_arrested/,Mayoral candidate Wes Golden was once arrested for choking a woman unconscious,/r/Clarksville/comments/tv6dft/mayoral_candidate_wes_golden_was_once_arrested/i389adv/,-10,r/Clarksville,0,-10
"Legalize it, but make it illegal to grow more than a single plant in your home. Tax it just like anything else and have it sold only at dispensaries. It's worked in new york just fine.",t2_bnq00mc2,CollectorMaster,0,1648997314.0,0,t1_i388mkd,i388mkd,True,Stevenshemwell420,t3_tuazqd,https://www.reddit.com/r/Clarksville/comments/tuazqd/house_sends_bill_to_senate_whats_your_thoughts/,House sends bill to senate !what’s your thoughts ?,/r/Clarksville/comments/tuazqd/house_sends_bill_to_senate_whats_your_thoughts/i388mkd/,2,r/Clarksville,0,2
Has he had any charges of this nature brought against him since then?,t2_f53ig,DoctaMario,0,1648996612.0,0,t1_i3872zc,i3872zc,True,politiphi,t3_tv6dft,https://www.reddit.com/r/Clarksville/comments/tv6dft/mayoral_candidate_wes_golden_was_once_arrested/,Mayoral candidate Wes Golden was once arrested for choking a woman unconscious,/r/Clarksville/comments/tv6dft/mayoral_candidate_wes_golden_was_once_arrested/i3872zc/,-5,r/Clarksville,0,-5
"Since you couldn't post the link, I went to Clarksvillenow's site and copy pasted the article...

CLARKSVILLE, TN (CLARKSVILLE NOW) – Wes Golden, who last week announced he’s running for county mayor in 2022, has an assault conviction on his record from an incident 19 years ago.


According to court documents obtained by Clarksville Now, Golden was arrested March 4, 2002, on a warrant for aggravated domestic assault.

Clarksville Now reached out to Golden, who said the victim was a woman he had been dating on and off at the time. He said he was out of town when the charges were filed.

According to the arrest warrant, Golden choked her to a “near unconscious state” and hit her in the back of the head multiple times.


The case was settled, and Golden pleaded guilty to a lesser charge of simple assault with a sentence of 11 months and 29 days, suspended on condition of a $25 fine, good behavior, probation and attendance of batterers’ intervention classes.

He said he pleaded guilty after months of back and forth in court to move on and “make it go away.”

Golden said he expected the case to come up when he announced his candidacy, but he hopes people will see him as a changed person.


“I was 20, 21 years old and wasn’t living the best life back then,” Golden said. “The man that I was back then, I wouldn’t have voted for him.”

Golden, who is now the Health and Safety manager for the City of Clarksville, plans to run as a Republican in the Montgomery County mayor’s race.",t2_8ifbm,Donkeyslapper84,0,1648990840.0,0,t1_i37vqhs,i37vqhs,True,politiphi,t3_tv6dft,https://www.reddit.com/r/Clarksville/comments/tv6dft/mayoral_candidate_wes_golden_was_once_arrested/,Mayoral candidate Wes Golden was once arrested for choking a woman unconscious,/r/Clarksville/comments/tv6dft/mayoral_candidate_wes_golden_was_once_arrested/i37vqhs/,8,r/Clarksville,0,8
"Jesus, fuck that guy.",t2_2hyy28uo,cloud9flyerr,0,1648990323.0,0,t1_i37uuac,i37uuac,True,politiphi,t3_tv6dft,https://www.reddit.com/r/Clarksville/comments/tv6dft/mayoral_candidate_wes_golden_was_once_arrested/,Mayoral candidate Wes Golden was once arrested for choking a woman unconscious,/r/Clarksville/comments/tv6dft/mayoral_candidate_wes_golden_was_once_arrested/i37uuac/,3,r/Clarksville,0,3
I wasn't going to vote for him anyways because I received spam texts from his campaign.,t2_w5gb6,deadmhz,0,1648986460.0,0,t1_i37otpz,i37otpz,True,politiphi,t3_tv6dft,https://www.reddit.com/r/Clarksville/comments/tv6dft/mayoral_candidate_wes_golden_was_once_arrested/,Mayoral candidate Wes Golden was once arrested for choking a woman unconscious,/r/Clarksville/comments/tv6dft/mayoral_candidate_wes_golden_was_once_arrested/i37otpz/,5,r/Clarksville,0,5
Re legalize nature. What is the need to control humans? SMDH,t2_jw76enfk,Ignar4Real,0,1648955785.0,0,t1_i36i890,i36i890,True,Stevenshemwell420,t3_tuazqd,https://www.reddit.com/r/Clarksville/comments/tuazqd/house_sends_bill_to_senate_whats_your_thoughts/,House sends bill to senate !what’s your thoughts ?,/r/Clarksville/comments/tuazqd/house_sends_bill_to_senate_whats_your_thoughts/i36i890/,2,r/Clarksville,0,2
"This makes sense on so many levels. Recreational in the same way as alcohol allows for grounds for proper DWI for irresponsible parties, and gives standard freedoms to responsible adults looking for an alternate to liver damage a la alcohol or for alternate medicines.

100% yes, please.",t2_7uf8t,xKaelic,0,1648942547.0,0,t1_i35yxap,i35yxap,True,Stevenshemwell420,t3_tuazqd,https://www.reddit.com/r/Clarksville/comments/tuazqd/house_sends_bill_to_senate_whats_your_thoughts/,House sends bill to senate !what’s your thoughts ?,/r/Clarksville/comments/tuazqd/house_sends_bill_to_senate_whats_your_thoughts/i35yxap/,2,r/Clarksville,0,2
"Security can be a good bit of work. Allied Universal has the Google contract here, it paid around 19/hr for non supervisory guards before G4S got bought out.

Only thing is that you usually have to eat your vegetables and do a crappy 11-15 hour post before they will let you move up to that site.",t2_kezov8ro,Stunning-Annual-2898,0,1648936240.0,0,t1_i35lyod,i35lyod,True,Unusual-Maize3429,t3_ttdeva,https://www.reddit.com/r/Clarksville/comments/ttdeva/jobs/,jobs,/r/Clarksville/comments/ttdeva/jobs/i35lyod/,1,r/Clarksville,0,1
"The Democratic Party is usually in favor of legalizing, and there is even some republican support, possibly enough to get a majority vote to pass.  I’d say this go around is the best chance it’s had to pass in recent years.  Of course, this bill simply decriminalizes it federally, it would still be up to the individual states to legalize it.  Marsha Blackburn remains a black stain on this state and would be the biggest opposition to get through.  If she can be convinced then Tennessee stands a good chance at some form of legalization.",t2_8qlcl,opieonekanobi,0,1648934884.0,0,t1_i35j4h8,i35j4h8,True,Stevenshemwell420,t3_tuazqd,https://www.reddit.com/r/Clarksville/comments/tuazqd/house_sends_bill_to_senate_whats_your_thoughts/,House sends bill to senate !what’s your thoughts ?,/r/Clarksville/comments/tuazqd/house_sends_bill_to_senate_whats_your_thoughts/i35j4h8/,3,r/Clarksville,0,3
I admit it. I read the text before I saw the map. I went from irritated to laughing in two seconds. Well played,t2_d8bseszf,HEMATarget,1,1648930346.0,0,t1_i359ian,i359ian,True,Stevenshemwell420,t3_tu9hbp,https://www.reddit.com/r/Clarksville/comments/tu9hbp/lol/,Lol,/r/Clarksville/comments/tu9hbp/lol/i359ian/,2,r/Clarksville,0,2
I think the senate fucks it up,t2_2hyy28uo,cloud9flyerr,0,1648912910.0,0,t1_i347gxv,i347gxv,True,Stevenshemwell420,t3_tuazqd,https://www.reddit.com/r/Clarksville/comments/tuazqd/house_sends_bill_to_senate_whats_your_thoughts/,House sends bill to senate !what’s your thoughts ?,/r/Clarksville/comments/tuazqd/house_sends_bill_to_senate_whats_your_thoughts/i347gxv/,3,r/Clarksville,0,3
Thank you.,t2_kezov8ro,Stunning-Annual-2898,0,1648911619.0,0,t1_i344mtu,i344mtu,False,[deleted],t3_tujxrk,https://www.reddit.com/r/Clarksville/comments/tujxrk/to_the_soldier_driving_recklessly_on_maliki_and/,To the soldier driving recklessly on Maliki and Horsheshoe Cave.,/r/Clarksville/comments/tujxrk/to_the_soldier_driving_recklessly_on_maliki_and/i344mtu/,1,r/Clarksville,0,1
"You may contact me directly through here. I am also at the same bus stop every morning dropping my daughter off for the same bus. Feel free to speak to me in person. The same way I spoke to who I can only imagine the same parents of the girl that consistently teased, bullied, and assaulted my daughter on the bus. In any case, I am a reasonable adult and will keep your concern in mind now that I am aware that it's an issue.",t2_8ejy0,acarro84,0,1648911409.0,0,t1_i3446th,i3446th,True,[deleted],t3_tujxrk,https://www.reddit.com/r/Clarksville/comments/tujxrk/to_the_soldier_driving_recklessly_on_maliki_and/,To the soldier driving recklessly on Maliki and Horsheshoe Cave.,/r/Clarksville/comments/tujxrk/to_the_soldier_driving_recklessly_on_maliki_and/i3446th/,1,r/Clarksville,0,1
"I know… I know… I at least want to say I tried to solve it at the lowest level. Monday will be the official judgement day.

Let’s call it respect for his service from a retired soldier.",t2_kezov8ro,Stunning-Annual-2898,0,1648910573.0,0,t1_i342ex3,i342ex3,False,[deleted],t3_tujxrk,https://www.reddit.com/r/Clarksville/comments/tujxrk/to_the_soldier_driving_recklessly_on_maliki_and/,To the soldier driving recklessly on Maliki and Horsheshoe Cave.,/r/Clarksville/comments/tujxrk/to_the_soldier_driving_recklessly_on_maliki_and/i342ex3/,1,r/Clarksville,0,1
"I gotta side with this person. Highly unlikely his chain of command cares, or will take any action beyond a counseling statement or a firm talking to. If its that serious go to CPD.",t2_kvbbx,ducktapevoodoo,0,1648910367.0,0,t1_i341zaf,i341zaf,False,[deleted],t3_tujxrk,https://www.reddit.com/r/Clarksville/comments/tujxrk/to_the_soldier_driving_recklessly_on_maliki_and/,To the soldier driving recklessly on Maliki and Horsheshoe Cave.,/r/Clarksville/comments/tujxrk/to_the_soldier_driving_recklessly_on_maliki_and/i341zaf/,6,r/Clarksville,0,6
"IMO, you're being far too kind. If you have footage just go to the regular police and let that guy get ticketed at the very least. Why risk your child's safety any longer?",t2_9o48xkgj,BabaYagasChickenFeet,0,1648909899.0,0,t1_i340zlq,i340zlq,True,[deleted],t3_tujxrk,https://www.reddit.com/r/Clarksville/comments/tujxrk/to_the_soldier_driving_recklessly_on_maliki_and/,To the soldier driving recklessly on Maliki and Horsheshoe Cave.,/r/Clarksville/comments/tujxrk/to_the_soldier_driving_recklessly_on_maliki_and/i340zlq/,10,r/Clarksville,0,10
"Best thing would be to decriminalize at the federal level. Medical only is a money grab. In Florida we have to recertify every 210 days at $75. Plus you have to be seen by a doctor. So whatever it cost for that doctors visit. Then you have to buy meds which are right around the same prices as the ""guy"".  
They should decriminalize at a federal level and let the people grow or buy their own meds.",t2_31kf1f6r,McZell,0,1648907579.0,0,t1_i33wav1,i33wav1,True,Stevenshemwell420,t3_tuazqd,https://www.reddit.com/r/Clarksville/comments/tuazqd/house_sends_bill_to_senate_whats_your_thoughts/,House sends bill to senate !what’s your thoughts ?,/r/Clarksville/comments/tuazqd/house_sends_bill_to_senate_whats_your_thoughts/i33wav1/,6,r/Clarksville,0,6
"Republicans and Democrats both love money. They see all the revenue generated in other states. Sin taxes are an easy pass. If this passes, they will tax the hell out of it.",t2_w5gb6,deadmhz,0,1648903040.0,0,t1_i33o781,i33o781,True,Stevenshemwell420,t3_tuazqd,https://www.reddit.com/r/Clarksville/comments/tuazqd/house_sends_bill_to_senate_whats_your_thoughts/,House sends bill to senate !what’s your thoughts ?,/r/Clarksville/comments/tuazqd/house_sends_bill_to_senate_whats_your_thoughts/i33o781/,1,r/Clarksville,0,1
Weed good,t2_gzbrn7zs,SeanBucsFan,0,1648902110.0,0,t1_i33mqa9,i33mqa9,True,Stevenshemwell420,t3_tuazqd,https://www.reddit.com/r/Clarksville/comments/tuazqd/house_sends_bill_to_senate_whats_your_thoughts/,House sends bill to senate !what’s your thoughts ?,/r/Clarksville/comments/tuazqd/house_sends_bill_to_senate_whats_your_thoughts/i33mqa9/,5,r/Clarksville,0,5
Please contact your state reps to tell them not to vote for the delta 8 ban,t2_13n78y,Grateone20,0,1648901630.0,0,t1_i33lzng,i33lzng,True,Stevenshemwell420,t3_tuazqd,https://www.reddit.com/r/Clarksville/comments/tuazqd/house_sends_bill_to_senate_whats_your_thoughts/,House sends bill to senate !what’s your thoughts ?,/r/Clarksville/comments/tuazqd/house_sends_bill_to_senate_whats_your_thoughts/i33lzng/,6,r/Clarksville,0,6
Republicans will kill it,t2_bcss7nwa,HisCromulency,0,1648894744.0,0,t1_i33cwex,i33cwex,True,Stevenshemwell420,t3_tuazqd,https://www.reddit.com/r/Clarksville/comments/tuazqd/house_sends_bill_to_senate_whats_your_thoughts/,House sends bill to senate !what’s your thoughts ?,/r/Clarksville/comments/tuazqd/house_sends_bill_to_senate_whats_your_thoughts/i33cwex/,3,r/Clarksville,0,3
Legalize it,t2_kr0zp787,Living-Ad-4962,0,1648888897.0,0,t1_i336bkz,i336bkz,True,Stevenshemwell420,t3_tuazqd,https://www.reddit.com/r/Clarksville/comments/tuazqd/house_sends_bill_to_senate_whats_your_thoughts/,House sends bill to senate !what’s your thoughts ?,/r/Clarksville/comments/tuazqd/house_sends_bill_to_senate_whats_your_thoughts/i336bkz/,2,r/Clarksville,0,2
"Well I passed, so, good.",t2_tviglqf,1969FordF100,0,1648877216.0,0,t1_i32s7vv,i32s7vv,False,haleighdm,t3_tsxy4x,https://www.reddit.com/r/Clarksville/comments/tsxy4x/does_anyone_know_the_road_test_route_to_get_your/,Does anyone know the road test route to get your license at the Drivers Services Center on Dunbar Cave Rd?,/r/Clarksville/comments/tsxy4x/does_anyone_know_the_road_test_route_to_get_your/i32s7vv/,1,r/Clarksville,0,1
How did it go??,t2_51ii6eua,haleighdm,0,1648876693.0,0,t1_i32rhfx,i32rhfx,False,haleighdm,t3_tsxy4x,https://www.reddit.com/r/Clarksville/comments/tsxy4x/does_anyone_know_the_road_test_route_to_get_your/,Does anyone know the road test route to get your license at the Drivers Services Center on Dunbar Cave Rd?,/r/Clarksville/comments/tsxy4x/does_anyone_know_the_road_test_route_to_get_your/i32rhfx/,2,r/Clarksville,0,2
Installed solar panels about 5 years ago. They offset our bill by about $100 a month.,t2_pb7re,April252,0,1648866926.0,0,t1_i32b4lj,i32b4lj,True,triciac13,t3_ttpy0g,https://www.reddit.com/r/Clarksville/comments/ttpy0g/solar_panels/,solar panels,/r/Clarksville/comments/ttpy0g/solar_panels/i32b4lj/,2,r/Clarksville,0,2
Why you trippin if you ain’t in those groups don’t bitch about it,t2_kp9x0tkc,Perfect-Problem1260,0,1648862932.0,0,t1_i323ftt,i323ftt,False,[deleted],t3_tu09c2,https://www.reddit.com/r/Clarksville/comments/tu09c2/bored_as_shit_no_plans_for_the_weekend_who_trynna/,Bored as shit no plans for the weekend who trynna do sum??,/r/Clarksville/comments/tu09c2/bored_as_shit_no_plans_for_the_weekend_who_trynna/i323ftt/,-1,r/Clarksville,0,-1
"Wait until you see your first hail storm here before you decide to purchase...should be several opportunities in the coming months. Also, tornado season is now Jan-Dec here. Welcome to hell.",t2_6fjfehaj,MovieDesperate3705,0,1648862748.0,0,t1_i3232r7,i3232r7,True,triciac13,t3_ttpy0g,https://www.reddit.com/r/Clarksville/comments/ttpy0g/solar_panels/,solar panels,/r/Clarksville/comments/ttpy0g/solar_panels/i3232r7/,2,r/Clarksville,0,2
Not with a nasty boot who puts dick pics on Reddit,t2_kezov8ro,Stunning-Annual-2898,0,1648861390.0,0,t1_i320ekr,i320ekr,True,[deleted],t3_tu09c2,https://www.reddit.com/r/Clarksville/comments/tu09c2/bored_as_shit_no_plans_for_the_weekend_who_trynna/,Bored as shit no plans for the weekend who trynna do sum??,/r/Clarksville/comments/tu09c2/bored_as_shit_no_plans_for_the_weekend_who_trynna/i320ekr/,5,r/Clarksville,0,5
I dm'd you a pic of dog that looks like yours in the post.  I live down between the marina wicked good sandwiches so it's close to where you think is may have been seen.  I see this dog about 1-2x a week wandering around with a white/gray dog,t2_cc0ixoih,jailbirdlorraine,0,1648859838.0,0,t1_i31xcf1,i31xcf1,True,Oakaydxn,t3_tc1yrd,https://www.reddit.com/r/Clarksville/comments/tc1yrd/missing_service_dog/,Missing service dog!,/r/Clarksville/comments/tc1yrd/missing_service_dog/i31xcf1/,1,r/Clarksville,0,1
"That's a decent paraphrase, well done",t2_d8bseszf,HEMATarget,0,1648857134.0,0,t1_i31rzeq,i31rzeq,False,[deleted],t3_tu09c2,https://www.reddit.com/r/Clarksville/comments/tu09c2/bored_as_shit_no_plans_for_the_weekend_who_trynna/,Bored as shit no plans for the weekend who trynna do sum??,/r/Clarksville/comments/tu09c2/bored_as_shit_no_plans_for_the_weekend_who_trynna/i31rzeq/,3,r/Clarksville,0,3
"I think it says “I haven’t been going out much lately and have no plans for the weekend, would anyone like to make some?”",t2_9qbbz8pf,DismalReplacement784,0,1648856180.0,0,t1_i31q297,i31q297,False,[deleted],t3_tu09c2,https://www.reddit.com/r/Clarksville/comments/tu09c2/bored_as_shit_no_plans_for_the_weekend_who_trynna/,Bored as shit no plans for the weekend who trynna do sum??,/r/Clarksville/comments/tu09c2/bored_as_shit_no_plans_for_the_weekend_who_trynna/i31q297/,4,r/Clarksville,0,4
Can somebody translate this to geriatric millennial?,t2_bcss7nwa,HisCromulency,0,1648853359.0,0,t1_i31k8x7,i31k8x7,True,[deleted],t3_tu09c2,https://www.reddit.com/r/Clarksville/comments/tu09c2/bored_as_shit_no_plans_for_the_weekend_who_trynna/,Bored as shit no plans for the weekend who trynna do sum??,/r/Clarksville/comments/tu09c2/bored_as_shit_no_plans_for_the_weekend_who_trynna/i31k8x7/,4,r/Clarksville,0,4
Fortera Credit Union,t2_36sh737a,johnc08902,0,1648838281.0,0,t1_i30ldfe,i30ldfe,True,Unusual-Maize3429,t3_ttdeva,https://www.reddit.com/r/Clarksville/comments/ttdeva/jobs/,jobs,/r/Clarksville/comments/ttdeva/jobs/i30ldfe/,2,r/Clarksville,0,2
"We did a cost analysis years ago and figured it would take 14 years to offset the price of solar panels in a 2400 square foot house with two adults. This was also before the ban on Chinese solar panels, so the prices have just gotten more expensive.",t2_g013w,AngelInThePit,0,1648834701.0,0,t1_i30cj65,i30cj65,True,triciac13,t3_ttpy0g,https://www.reddit.com/r/Clarksville/comments/ttpy0g/solar_panels/,solar panels,/r/Clarksville/comments/ttpy0g/solar_panels/i30cj65/,4,r/Clarksville,0,4
"I believe my friend mentioned a private EMT company across from MapCo on Wilma looking for drivers. Just drivers, not necessarily EMT or paramedic (but a great stepping stone if you want to go that path).",t2_1zig84uw,skiddle656,0,1648832565.0,0,t1_i3070sl,i3070sl,True,Unusual-Maize3429,t3_ttdeva,https://www.reddit.com/r/Clarksville/comments/ttdeva/jobs/,jobs,/r/Clarksville/comments/ttdeva/jobs/i3070sl/,2,r/Clarksville,0,2
"Kings Automotive in Ashland City, John Deason is who you can speak with. Cheap work and very very good quality. They'll paint, detail, paint correction, you name it!",t2_16v3hx,Toasted_Potooooooo,0,1648818734.0,0,t1_i2z9gp2,i2z9gp2,True,rsjimenez602,t3_tt7wtr,https://www.reddit.com/r/Clarksville/comments/tt7wtr/paint_jobs/,Paint jobs,/r/Clarksville/comments/tt7wtr/paint_jobs/i2z9gp2/,1,r/Clarksville,0,1
Trane is on a hiring bonanza right now,t2_bcss7nwa,HisCromulency,0,1648802752.0,0,t1_i2yl6d9,i2yl6d9,True,Unusual-Maize3429,t3_ttdeva,https://www.reddit.com/r/Clarksville/comments/ttdeva/jobs/,jobs,/r/Clarksville/comments/ttdeva/jobs/i2yl6d9/,1,r/Clarksville,0,1
TK Auto Works on Crossland is the shop of one of the most highly regarded Subaru tuners in TN. He's treated me well in the past.,t2_mrqet,meowcaat,0,1648796227.0,0,t1_i2ydakn,i2ydakn,True,Umbra29,t3_tje590,https://www.reddit.com/r/Clarksville/comments/tje590/wyatt_johnson_subaru_mechanics/,Wyatt Johnson Subaru mechanics,/r/Clarksville/comments/tje590/wyatt_johnson_subaru_mechanics/i2ydakn/,1,r/Clarksville,0,1
I know someone who tested in Dickson. They started the car drove around the dealership across the street along a backroad and came back. They came back so quick we thought he failed the test badly but no from what I hear it’s too easy to pass.,t2_sbgafo1,cll1out,0,1648784026.0,0,t1_i2xu5ll,i2xu5ll,False,haleighdm,t3_tsxy4x,https://www.reddit.com/r/Clarksville/comments/tsxy4x/does_anyone_know_the_road_test_route_to_get_your/,Does anyone know the road test route to get your license at the Drivers Services Center on Dunbar Cave Rd?,/r/Clarksville/comments/tsxy4x/does_anyone_know_the_road_test_route_to_get_your/i2xu5ll/,1,r/Clarksville,0,1
"EMS.

1 semester at Vol State, the classes are 4 hours a night 4 nights a week, on the APSU campus.

Total cost under 2K.

Entry requirements are super low and no other college classes required.",t2_hjphm,SickBag,0,1648772810.0,0,t1_i2x63zl,i2x63zl,True,Unusual-Maize3429,t3_ttdeva,https://www.reddit.com/r/Clarksville/comments/ttdeva/jobs/,jobs,/r/Clarksville/comments/ttdeva/jobs/i2x63zl/,4,r/Clarksville,0,4
