body,author_fullname,author.name,controversiality,created,downs,fullname,id,is_root,link_author,link_id,link_permalink,link_title,permalink,score,subreddit_name_prefixed,total_awards_received,ups
"The oil stocks went down after the announcement today. Why? Not sure. I'm not big into stocks, tbh

I'm EV all the way anyways. When I can afford it, I'm switching to electric.",t2_bnq00mc2,CollectorMaster,0,1646765146.0,0,t1_hzvd6qv,hzvd6qv,False,CollectorMaster,t3_t9mtnd,https://www.reddit.com/r/Clarksville/comments/t9mtnd/rip_gas_prices/,Rip gas prices,/r/Clarksville/comments/t9mtnd/rip_gas_prices/hzvd6qv/,3,r/Clarksville,0,3
"Why don't you just buy oil stocks?  If oil companies were just rolling in profits higher than other businesses, any dumbass like me could get super rich by just becoming a partial owner.    There's a reason why investment portfolios aren't just all oil companies.

&#x200B;

Oil prices are high because supply is limited, the future of oil businesses has been put in the crosshairs of government and activists, production and processing and transporting has been inhibited and protested against and delayed... and most of all because people are finally starting to realize buying oil from Russia is financing our own nightmare.",t2_j2l7y,chainsawx72,0,1646765016.0,0,t1_hzvctwv,hzvctwv,True,CollectorMaster,t3_t9mtnd,https://www.reddit.com/r/Clarksville/comments/t9mtnd/rip_gas_prices/,Rip gas prices,/r/Clarksville/comments/t9mtnd/rip_gas_prices/hzvctwv/,1,r/Clarksville,0,1
"**ATTENTION**  
Due to the very short age of your account, this post has been automatically filtered.  
The moderators will be along shortly to make sure this is not spam!  
If more than 24 hours pass without an alert, please message the moderators via modmail!

*I am a bot, and this action was performed automatically. Please [contact the moderators of this subreddit](/message/compose/?to=/r/Clarksville) if you have any questions or concerns.*",t2_6l4z3,AutoModerator,0,1646762203.0,0,t1_hzv5910,hzv5910,True,pelhoon,t3_t9mnnb,https://www.reddit.com/r/Clarksville/comments/t9mnnb/looking_for_fun_people_to_hangout_with/,Looking for fun people to hangout with!,/r/Clarksville/comments/t9mnnb/looking_for_fun_people_to_hangout_with/hzv5910/,1,r/Clarksville,0,1
"I didn't hear about this, when did they vote to do that?",t2_f53ig,DoctaMario,0,1646758977.0,0,t1_hzuwf3a,hzuwf3a,True,Stevenshemwell420,t3_t9c4ia,https://www.reddit.com/r/Clarksville/comments/t9c4ia/flower_to_the_people/,Flower to the people,/r/Clarksville/comments/t9c4ia/flower_to_the_people/hzuwf3a/,1,r/Clarksville,0,1
What did they do to thca?,t2_bf7np,Saint3Love,0,1646748881.0,0,t1_hzu7gnq,hzu7gnq,True,Stevenshemwell420,t3_t9c4ia,https://www.reddit.com/r/Clarksville/comments/t9c4ia/flower_to_the_people/,Flower to the people,/r/Clarksville/comments/t9c4ia/flower_to_the_people/hzu7gnq/,1,r/Clarksville,0,1
I like wax!,t2_2hyy28uo,cloud9flyerr,0,1646744388.0,0,t1_hztyolk,hztyolk,True,Stevenshemwell420,t3_t9c4ia,https://www.reddit.com/r/Clarksville/comments/t9c4ia/flower_to_the_people/,Flower to the people,/r/Clarksville/comments/t9c4ia/flower_to_the_people/hztyolk/,2,r/Clarksville,0,2
What's the THC amount in your edibles?,t2_z9npt,ridethedirt,0,1646744214.0,0,t1_hztydh4,hztydh4,True,Stevenshemwell420,t3_t9c4ia,https://www.reddit.com/r/Clarksville/comments/t9c4ia/flower_to_the_people/,Flower to the people,/r/Clarksville/comments/t9c4ia/flower_to_the_people/hztydh4/,1,r/Clarksville,0,1
Idk bout Liquor  but 373 Dover rd the holistic connection has the best cannabis  in town!,t2_jbd71myq,Stevenshemwell420,0,1646727865.0,0,t1_hztcwx4,hztcwx4,True,Creative_Corner_2836,t3_s894bj,https://www.reddit.com/r/Clarksville/comments/s894bj/most_affordable_place_to_buy_liquor/,Most affordable place to buy liquor?,/r/Clarksville/comments/s894bj/most_affordable_place_to_buy_liquor/hztcwx4/,1,r/Clarksville,0,1
Come hang out at the dab bar at the holistic connection 373 Dover rd Clarksville tn craft cannibals great vibes !,t2_jbd71myq,Stevenshemwell420,0,1646727751.0,0,t1_hztcryh,hztcryh,True,[deleted],t3_sao2a8,https://www.reddit.com/r/Clarksville/comments/sao2a8/where_do_i_go_to_make_friends/,Where do I go to make friends?,/r/Clarksville/comments/sao2a8/where_do_i_go_to_make_friends/hztcryh/,1,r/Clarksville,0,1
"If you’re going to scalp them, go ahead and put your prices here so you can get all the hate here instead of in your PMs lol",t2_cemkak08,UseWhatever,0,1646664116.0,0,t1_hzphmy5,hzphmy5,True,[deleted],t3_t80t1u,https://www.reddit.com/r/Clarksville/comments/t80t1u/anybody_looking_for_a_ps5_digital_version/,Anybody Looking for a Ps5 Digital Version ? Clarksville/OakGrove area,/r/Clarksville/comments/t80t1u/anybody_looking_for_a_ps5_digital_version/hzphmy5/,1,r/Clarksville,0,1
How much.?,t2_kb6fmnzb,Alone-Accountant469,0,1646614833.0,0,t1_hzn9paa,hzn9paa,True,[deleted],t3_t80t1u,https://www.reddit.com/r/Clarksville/comments/t80t1u/anybody_looking_for_a_ps5_digital_version/,Anybody Looking for a Ps5 Digital Version ? Clarksville/OakGrove area,/r/Clarksville/comments/t80t1u/anybody_looking_for_a_ps5_digital_version/hzn9paa/,1,r/Clarksville,0,1
How much.?,t2_kb6fmnzb,Alone-Accountant469,0,1646614823.0,0,t1_hzn9ojr,hzn9ojr,True,[deleted],t3_t80t1u,https://www.reddit.com/r/Clarksville/comments/t80t1u/anybody_looking_for_a_ps5_digital_version/,Anybody Looking for a Ps5 Digital Version ? Clarksville/OakGrove area,/r/Clarksville/comments/t80t1u/anybody_looking_for_a_ps5_digital_version/hzn9ojr/,1,r/Clarksville,0,1
Blackhorse is crap. The owner of this place has been milking money from the city (us taxpayers) for a supposed “promise” a mayor made to him over 10 years ago (nothing to do with the current administration). If you support this business you’re basically taking from the city.,t2_dk9e4iuf,ChargeHorror,0,1646578375.0,0,t1_hzkx2my,hzkx2my,False,SixDemonBlues,t3_t35h6f,https://www.reddit.com/r/Clarksville/comments/t35h6f/lunchbeer_spots_in_clarksville/,Lunch/Beer Spots in Clarksville,/r/Clarksville/comments/t35h6f/lunchbeer_spots_in_clarksville/hzkx2my/,1,r/Clarksville,0,1
Chinese Restaurant.. lol..,t2_9ak2ka2a,Smooth_Success_6956,0,1646526236.0,0,t1_hziledy,hziledy,True,Coal_Bee,t3_szxl4q,https://www.reddit.com/r/Clarksville/comments/szxl4q/any_low_cost_vets_for_spaying_a_cat/,Any low cost vets for spaying a cat?,/r/Clarksville/comments/szxl4q/any_low_cost_vets_for_spaying_a_cat/hziledy/,0,r/Clarksville,0,0
"First of all.. When you making a status.. Please learn how to make a proper sentence. Lead with Stole Snacks.. 

Hooked on Phonics is still available. Mabey try Rosetta Stone.",t2_9ak2ka2a,Smooth_Success_6956,0,1646526153.0,0,t1_hzil85b,hzil85b,True,ontheoffgrid,t3_t7jbqv,https://www.reddit.com/r/Clarksville/comments/t7jbqv/why_lead_with_stole_snacks_and_have_no_context_on/,Why lead with stole snacks and have no context on why there was a shooting?,/r/Clarksville/comments/t7jbqv/why_lead_with_stole_snacks_and_have_no_context_on/hzil85b/,-18,r/Clarksville,0,-18
Yeah but it doesn't say that.   And it's just strange that they lead with theft of a couple bucks when referring to the deal of a man.   Just seems like either the reporting on this is lazy or there is something else going on is all.,t2_9gk3nk3w,ontheoffgrid,0,1646519121.0,0,t1_hzi65b8,hzi65b8,False,ontheoffgrid,t3_t7jbqv,https://www.reddit.com/r/Clarksville/comments/t7jbqv/why_lead_with_stole_snacks_and_have_no_context_on/,Why lead with stole snacks and have no context on why there was a shooting?,/r/Clarksville/comments/t7jbqv/why_lead_with_stole_snacks_and_have_no_context_on/hzi65b8/,1,r/Clarksville,0,1
"Sounds like victim just tried to stop the guy from shoplifting, and expected it to be a wrestling match. Unfortunately, crazy people in Walmart after midnight carry guns and don’t hesitate to ruin lives.",t2_3op4q,Autoground,0,1646518490.0,0,t1_hzi4qth,hzi4qth,True,ontheoffgrid,t3_t7jbqv,https://www.reddit.com/r/Clarksville/comments/t7jbqv/why_lead_with_stole_snacks_and_have_no_context_on/,Why lead with stole snacks and have no context on why there was a shooting?,/r/Clarksville/comments/t7jbqv/why_lead_with_stole_snacks_and_have_no_context_on/hzi4qth/,2,r/Clarksville,0,2
It is all the Yankees moving into town.,t2_e9huzt3i,Comfortable-Heron450,0,1646443165.0,0,t1_hze7tih,hze7tih,True,XXXtrogdorXX,t3_t65d2j,https://www.reddit.com/r/Clarksville/comments/t65d2j/clarksville_you_have_to_start_using_your_turn/,"Clarksville, you have to start using your turn signals.",/r/Clarksville/comments/t65d2j/clarksville_you_have_to_start_using_your_turn/hze7tih/,1,r/Clarksville,0,1
No,t2_7ljv02qy,Ecstatic-Ordinary136,0,1646417929.0,0,t1_hzcgyk5,hzcgyk5,True,XXXtrogdorXX,t3_t65d2j,https://www.reddit.com/r/Clarksville/comments/t65d2j/clarksville_you_have_to_start_using_your_turn/,"Clarksville, you have to start using your turn signals.",/r/Clarksville/comments/t65d2j/clarksville_you_have_to_start_using_your_turn/hzcgyk5/,2,r/Clarksville,0,2
"It's not the locals fault, we were taught to drive correctly.",t2_116zuv,Architect_omega,0,1646402601.0,0,t1_hzbfe14,hzbfe14,True,XXXtrogdorXX,t3_t65d2j,https://www.reddit.com/r/Clarksville/comments/t65d2j/clarksville_you_have_to_start_using_your_turn/,"Clarksville, you have to start using your turn signals.",/r/Clarksville/comments/t65d2j/clarksville_you_have_to_start_using_your_turn/hzbfe14/,2,r/Clarksville,0,2
Unless the dumpster is posted or area it's housed in or locked and chained off for no trespassing then go ahead,t2_56h5x4pq,Spazzzy007,0,1646395829.0,0,t1_hzb2tmv,hzb2tmv,True,throwaway234rr,t3_t67hsh,https://www.reddit.com/r/Clarksville/comments/t67hsh/dumpster_diving_legal/,"Dumpster diving , legal?",/r/Clarksville/comments/t67hsh/dumpster_diving_legal/hzb2tmv/,3,r/Clarksville,0,3
It’s insane how easy it is for people to get their licenses here and it shows. I moved from out of state where the process was WAY more thorough,t2_34ihlnqs,knifeazz,0,1646383928.0,0,t1_hzanpnr,hzanpnr,True,XXXtrogdorXX,t3_t65d2j,https://www.reddit.com/r/Clarksville/comments/t65d2j/clarksville_you_have_to_start_using_your_turn/,"Clarksville, you have to start using your turn signals.",/r/Clarksville/comments/t65d2j/clarksville_you_have_to_start_using_your_turn/hzanpnr/,2,r/Clarksville,0,2
And 4 way stops.,t2_frwxl,yelafath,0,1646382964.0,0,t1_hzamj8j,hzamj8j,False,XXXtrogdorXX,t3_t65d2j,https://www.reddit.com/r/Clarksville/comments/t65d2j/clarksville_you_have_to_start_using_your_turn/,"Clarksville, you have to start using your turn signals.",/r/Clarksville/comments/t65d2j/clarksville_you_have_to_start_using_your_turn/hzamj8j/,1,r/Clarksville,0,1
New here aren't you?,t2_9s5htrpc,harleybone,0,1646369234.0,0,t1_hza1y8z,hza1y8z,True,XXXtrogdorXX,t3_t65d2j,https://www.reddit.com/r/Clarksville/comments/t65d2j/clarksville_you_have_to_start_using_your_turn/,"Clarksville, you have to start using your turn signals.",/r/Clarksville/comments/t65d2j/clarksville_you_have_to_start_using_your_turn/hza1y8z/,3,r/Clarksville,0,3
Yup. Some sort of refresher course,t2_4she6hgs,XXXtrogdorXX,0,1646366597.0,0,t1_hz9wy2r,hz9wy2r,False,XXXtrogdorXX,t3_t65d2j,https://www.reddit.com/r/Clarksville/comments/t65d2j/clarksville_you_have_to_start_using_your_turn/,"Clarksville, you have to start using your turn signals.",/r/Clarksville/comments/t65d2j/clarksville_you_have_to_start_using_your_turn/hz9wy2r/,2,r/Clarksville,0,2
"Everyone with a TN license, mandatory drivers Ed, written and practical recertification training to earn your driving rights back.",t2_gehk04ww,tkendall707,0,1646366202.0,0,t1_hz9w5uu,hz9w5uu,True,XXXtrogdorXX,t3_t65d2j,https://www.reddit.com/r/Clarksville/comments/t65d2j/clarksville_you_have_to_start_using_your_turn/,"Clarksville, you have to start using your turn signals.",/r/Clarksville/comments/t65d2j/clarksville_you_have_to_start_using_your_turn/hz9w5uu/,5,r/Clarksville,0,5
And watch for motorcycles! I almost died twice yesterday.,t2_6fjfehaj,MovieDesperate3705,0,1646360481.0,0,t1_hz9kvv7,hz9kvv7,True,XXXtrogdorXX,t3_t65d2j,https://www.reddit.com/r/Clarksville/comments/t65d2j/clarksville_you_have_to_start_using_your_turn/,"Clarksville, you have to start using your turn signals.",/r/Clarksville/comments/t65d2j/clarksville_you_have_to_start_using_your_turn/hz9kvv7/,4,r/Clarksville,0,4
Preach!,t2_4she6hgs,XXXtrogdorXX,0,1646360448.0,0,t1_hz9kt64,hz9kt64,False,XXXtrogdorXX,t3_t65d2j,https://www.reddit.com/r/Clarksville/comments/t65d2j/clarksville_you_have_to_start_using_your_turn/,"Clarksville, you have to start using your turn signals.",/r/Clarksville/comments/t65d2j/clarksville_you_have_to_start_using_your_turn/hz9kt64/,0,r/Clarksville,0,0
"And horns, and slow the fuck down. Also watch videos on how to merge.",t2_af8oo,edgyusernameguy,0,1646359733.0,0,t1_hz9j90v,hz9j90v,True,XXXtrogdorXX,t3_t65d2j,https://www.reddit.com/r/Clarksville/comments/t65d2j/clarksville_you_have_to_start_using_your_turn/,"Clarksville, you have to start using your turn signals.",/r/Clarksville/comments/t65d2j/clarksville_you_have_to_start_using_your_turn/hz9j90v/,6,r/Clarksville,0,6
Bills package!,t2_3wkmb86z,babymotha,0,1646334551.0,0,t1_hz7wa2t,hz7wa2t,True,Creative_Corner_2836,t3_s894bj,https://www.reddit.com/r/Clarksville/comments/s894bj/most_affordable_place_to_buy_liquor/,Most affordable place to buy liquor?,/r/Clarksville/comments/s894bj/most_affordable_place_to_buy_liquor/hz7wa2t/,1,r/Clarksville,0,1
"I really like Ravenwood. It's a loosely Harry Potter-themed coffee place, and I think they have two (or three?) locations. One is on Ft Campbell Blvd, just past Airport Rd and another is inside Furniture Connection I think on Wilma Rudolph (I haven't been to this location). 

It is small inside with only minimal seating (they used to own a bigger place with a huge dining area for seating), but it's never super busy for sitting customers and I've never had a problem sitting. The staff are super friendly and they have a billion coffee options and a few food bits.  

I also recommend the Mad Herbalist that others have mentioned.",t2_3iuf3ctp,tinabelcher182,0,1646324114.0,0,t1_hz750fl,hz750fl,True,hereforfun55679,t3_t5gjp6,https://www.reddit.com/r/Clarksville/comments/t5gjp6/hot_teacoffee_places_to_relax_and_read/,Hot tea/coffee places to relax and read?,/r/Clarksville/comments/t5gjp6/hot_teacoffee_places_to_relax_and_read/hz750fl/,1,r/Clarksville,0,1
I agree! The Mad Herbalist has great indoor and outdoor areas.,t2_7xf1z7oy,Interesting_Warthog9,0,1646313544.0,0,t1_hz6gily,hz6gily,False,hereforfun55679,t3_t5gjp6,https://www.reddit.com/r/Clarksville/comments/t5gjp6/hot_teacoffee_places_to_relax_and_read/,Hot tea/coffee places to relax and read?,/r/Clarksville/comments/t5gjp6/hot_teacoffee_places_to_relax_and_read/hz6gily/,2,r/Clarksville,0,2
Mad herbalist is hands down the best tea place! No one else even compares haha,t2_jhfenx59,minervasbiggestfan,0,1646312285.0,0,t1_hz6e69n,hz6e69n,False,hereforfun55679,t3_t5gjp6,https://www.reddit.com/r/Clarksville/comments/t5gjp6/hot_teacoffee_places_to_relax_and_read/,Hot tea/coffee places to relax and read?,/r/Clarksville/comments/t5gjp6/hot_teacoffee_places_to_relax_and_read/hz6e69n/,3,r/Clarksville,0,3
Get Some Coffee was always really good off Trenton and Tiny Town.,t2_kzsk8,Caboose816,0,1646286102.0,0,t1_hz5dhv7,hz5dhv7,True,hereforfun55679,t3_t5gjp6,https://www.reddit.com/r/Clarksville/comments/t5gjp6/hot_teacoffee_places_to_relax_and_read/,Hot tea/coffee places to relax and read?,/r/Clarksville/comments/t5gjp6/hot_teacoffee_places_to_relax_and_read/hz5dhv7/,3,r/Clarksville,0,3
My porch.,t2_ww82r,Pubtroll,0,1646282879.0,0,t1_hz57x0l,hz57x0l,True,hereforfun55679,t3_t5gjp6,https://www.reddit.com/r/Clarksville/comments/t5gjp6/hot_teacoffee_places_to_relax_and_read/,Hot tea/coffee places to relax and read?,/r/Clarksville/comments/t5gjp6/hot_teacoffee_places_to_relax_and_read/hz57x0l/,-2,r/Clarksville,0,-2
I will try them out!,t2_eeh6urxs,hereforfun55679,0,1646277525.0,0,t1_hz4xko9,hz4xko9,False,hereforfun55679,t3_t5gjp6,https://www.reddit.com/r/Clarksville/comments/t5gjp6/hot_teacoffee_places_to_relax_and_read/,Hot tea/coffee places to relax and read?,/r/Clarksville/comments/t5gjp6/hot_teacoffee_places_to_relax_and_read/hz4xko9/,1,r/Clarksville,0,1
Lasaters coffee and tea. Wilma Rudolph Blvd and sango on the connector road,t2_9s5htrpc,harleybone,0,1646275709.0,0,t1_hz4ttki,hz4ttki,True,hereforfun55679,t3_t5gjp6,https://www.reddit.com/r/Clarksville/comments/t5gjp6/hot_teacoffee_places_to_relax_and_read/,Hot tea/coffee places to relax and read?,/r/Clarksville/comments/t5gjp6/hot_teacoffee_places_to_relax_and_read/hz4ttki/,3,r/Clarksville,0,3
Awesome I will check them out!,t2_eeh6urxs,hereforfun55679,0,1646273867.0,0,t1_hz4pzgd,hz4pzgd,False,hereforfun55679,t3_t5gjp6,https://www.reddit.com/r/Clarksville/comments/t5gjp6/hot_teacoffee_places_to_relax_and_read/,Hot tea/coffee places to relax and read?,/r/Clarksville/comments/t5gjp6/hot_teacoffee_places_to_relax_and_read/hz4pzgd/,1,r/Clarksville,0,1
100% the mad herbalist. It is so so so cute and the tea is really great. Plumb line near the college is very nice as well.,t2_jf1p5,stickkim,0,1646273719.0,0,t1_hz4pogt,hz4pogt,True,hereforfun55679,t3_t5gjp6,https://www.reddit.com/r/Clarksville/comments/t5gjp6/hot_teacoffee_places_to_relax_and_read/,Hot tea/coffee places to relax and read?,/r/Clarksville/comments/t5gjp6/hot_teacoffee_places_to_relax_and_read/hz4pogt/,9,r/Clarksville,0,9
The Tri-Star looks off.,t2_16mzfy,MeanMrMaxwell,0,1646229331.0,0,t1_hz1ru3p,hz1ru3p,True,[deleted],t3_t4zrtz,https://www.reddit.com/r/Clarksville/comments/t4zrtz/what_are_your_opinions_on_a_friends_new_venture/,What are your opinions on a friends new venture in Clarksville? A locally focused branding company.,/r/Clarksville/comments/t4zrtz/what_are_your_opinions_on_a_friends_new_venture/hz1ru3p/,2,r/Clarksville,0,2
"I’ve been to every brewery in Clarksville. Kings bluff is the best, and there is a really nice Korean place next door. Strawberry alley’s been mentioned a couple times but their food is weird, and the beers are very unimpressive. Thirsty Goat is cute and rustic, but it is on the way out of town headed south towards Nashville, and is also not a brewery but a beer garden/coffee shop/pizza joint hybrid. Check it Blackhorse is open when you come through as it’s the oldest brewery in town and had pretty good food, they had a fire a while back and have been closed at their Clarksville location for several months, but it is downtown near strawberry alley and certainly worth a try if open.",t2_jf1p5,stickkim,0,1646085671.0,0,t1_hyu1i3h,hyu1i3h,True,SixDemonBlues,t3_t35h6f,https://www.reddit.com/r/Clarksville/comments/t35h6f/lunchbeer_spots_in_clarksville/,Lunch/Beer Spots in Clarksville,/r/Clarksville/comments/t35h6f/lunchbeer_spots_in_clarksville/hyu1i3h/,3,r/Clarksville,0,3
Johnny's for a burger and fries. no beer though but you can have one nearby,t2_bf7np,Saint3Love,0,1646068718.0,0,t1_hystf97,hystf97,True,SixDemonBlues,t3_t35h6f,https://www.reddit.com/r/Clarksville/comments/t35h6f/lunchbeer_spots_in_clarksville/,Lunch/Beer Spots in Clarksville,/r/Clarksville/comments/t35h6f/lunchbeer_spots_in_clarksville/hystf97/,6,r/Clarksville,0,6
Pbodys is very good for lunch and desserts. Not sure about the beer.,t2_e9huzt3i,Comfortable-Heron450,0,1646059381.0,0,t1_hys6dgm,hys6dgm,True,SixDemonBlues,t3_t35h6f,https://www.reddit.com/r/Clarksville/comments/t35h6f/lunchbeer_spots_in_clarksville/,Lunch/Beer Spots in Clarksville,/r/Clarksville/comments/t35h6f/lunchbeer_spots_in_clarksville/hys6dgm/,2,r/Clarksville,0,2
"Thirsty Goat, Kings Bluff Brewery, Strawberry Alley, Gladiator Brewing Co, Star Spangled Brewing Co. I think thats it. Blackhorse is the best but they are still closed for renovations.",t2_5bwwg,clb923,0,1646057011.0,0,t1_hys1b7k,hys1b7k,True,SixDemonBlues,t3_t35h6f,https://www.reddit.com/r/Clarksville/comments/t35h6f/lunchbeer_spots_in_clarksville/,Lunch/Beer Spots in Clarksville,/r/Clarksville/comments/t35h6f/lunchbeer_spots_in_clarksville/hys1b7k/,8,r/Clarksville,0,8
Wicked Good Sandwiches,t2_142a0l,Green_and_Lonely,0,1646036615.0,0,t1_hyr7myq,hyr7myq,True,SixDemonBlues,t3_t35h6f,https://www.reddit.com/r/Clarksville/comments/t35h6f/lunchbeer_spots_in_clarksville/,Lunch/Beer Spots in Clarksville,/r/Clarksville/comments/t35h6f/lunchbeer_spots_in_clarksville/hyr7myq/,2,r/Clarksville,0,2
May want to lower price as an Xbox series S is only $300,t2_if8l6yk3,Healthy-Relative606,0,1646035109.0,0,t1_hyr5mml,hyr5mml,True,FlowDirect,t3_t345kt,https://www.reddit.com/r/Clarksville/comments/t345kt/selling/,Selling,/r/Clarksville/comments/t345kt/selling/hyr5mml/,5,r/Clarksville,0,5
I’m gonna second Thirsty Goat. It’s my favorite. And all the beers are brews from Tennessee.,t2_5gac0o9e,famous_shaymus,0,1646019866.0,0,t1_hyqg9nd,hyqg9nd,False,SixDemonBlues,t3_t35h6f,https://www.reddit.com/r/Clarksville/comments/t35h6f/lunchbeer_spots_in_clarksville/,Lunch/Beer Spots in Clarksville,/r/Clarksville/comments/t35h6f/lunchbeer_spots_in_clarksville/hyqg9nd/,5,r/Clarksville,0,5
I'll be honest the desserts are pretty small lol. If you want a decent dessert you can go to B's Cheesecake right around the corner from Strawberry Alley or Golly Gs Ice cream if you go to the Thirsty Goat. As for beer I am honestly not sure lol. I don't drink.but I usually go with friends who do. Usually the waitress or the bartenders can reccomend something good based on what you like.,t2_4dtf19n,lushfaye,0,1646019017.0,0,t1_hyqeh79,hyqeh79,False,SixDemonBlues,t3_t35h6f,https://www.reddit.com/r/Clarksville/comments/t35h6f/lunchbeer_spots_in_clarksville/,Lunch/Beer Spots in Clarksville,/r/Clarksville/comments/t35h6f/lunchbeer_spots_in_clarksville/hyqeh79/,2,r/Clarksville,0,2
Mason jar full of pie is a pretty strong sell :).  How's the beer @ Strawberry Alley and what would be your go-to?,t2_1dqipzey,SixDemonBlues,0,1646018820.0,0,t1_hyqe28h,hyqe28h,False,SixDemonBlues,t3_t35h6f,https://www.reddit.com/r/Clarksville/comments/t35h6f/lunchbeer_spots_in_clarksville/,Lunch/Beer Spots in Clarksville,/r/Clarksville/comments/t35h6f/lunchbeer_spots_in_clarksville/hyqe28h/,1,r/Clarksville,0,1
"Gladiator Brewing Co- James Pradke (owner, vet and brewmaster) and crew there are awesome and food and beer 🍺 is amazing-Tiny Town Rd - Clarksville- a must stop!",t2_j7v6pca2,Imaginary_Voices,0,1646018512.0,0,t1_hyqdefa,hyqdefa,True,SixDemonBlues,t3_t35h6f,https://www.reddit.com/r/Clarksville/comments/t35h6f/lunchbeer_spots_in_clarksville/,Lunch/Beer Spots in Clarksville,/r/Clarksville/comments/t35h6f/lunchbeer_spots_in_clarksville/hyqdefa/,2,r/Clarksville,0,2
Thirsty Goat or Strawberry Alley,t2_4dtf19n,lushfaye,0,1646018307.0,0,t1_hyqcyp9,hyqcyp9,True,SixDemonBlues,t3_t35h6f,https://www.reddit.com/r/Clarksville/comments/t35h6f/lunchbeer_spots_in_clarksville/,Lunch/Beer Spots in Clarksville,/r/Clarksville/comments/t35h6f/lunchbeer_spots_in_clarksville/hyqcyp9/,10,r/Clarksville,0,10
I’m sorry to hear that :( I have never had a problem with them in all of the dogs I’ve owned since living here!,t2_h2g5ops3,roundishroch,0,1645772435.0,0,t1_hycp65g,hycp65g,False,Coal_Bee,t3_szxl4q,https://www.reddit.com/r/Clarksville/comments/szxl4q/any_low_cost_vets_for_spaying_a_cat/,Any low cost vets for spaying a cat?,/r/Clarksville/comments/szxl4q/any_low_cost_vets_for_spaying_a_cat/hycp65g/,1,r/Clarksville,0,1
"Shidd, y’all in Clarksville, Wyoming?",t2_gehk04ww,tkendall707,0,1645760603.0,0,t1_hyc4fdt,hyc4fdt,True,XXXtrogdorXX,t3_t0j7tl,https://www.reddit.com/r/Clarksville/comments/t0j7tl/that_snooze_button/,That snooze button.,/r/Clarksville/comments/t0j7tl/that_snooze_button/hyc4fdt/,1,r/Clarksville,0,1
"Additionally female cats can go into heat and reproduce as young as 4 months old. The Humane Society can fix them as long as they are 2-3lbs. If she ends up pregnant they can fix the cat as long as she has not given birth or in the process of giving birth. You can make an appointment online but if you call you can also ask for any openings they may have pop open as they can get booked up quite a few months in advance. You generally drop off at around 7am and pick up around 4:30pm, along with you and possibly up to 30 other people. They can fix almost up to 40 pets a day.",t2_4dtf19n,lushfaye,0,1645747348.0,0,t1_hybaskl,hybaskl,False,Coal_Bee,t3_szxl4q,https://www.reddit.com/r/Clarksville/comments/szxl4q/any_low_cost_vets_for_spaying_a_cat/,Any low cost vets for spaying a cat?,/r/Clarksville/comments/szxl4q/any_low_cost_vets_for_spaying_a_cat/hybaskl/,1,r/Clarksville,0,1
"Humane Society is the cheapest you will find. Anyone else that says they are cheaper do not include the cost of medicine or anesthesia. Humane Society is also one of the cheapest places to get a microchip. If you are low income you may be able to reach out to People For Animals for a voucher to cover some cost. 

I worked at the Human Society for a few months on the office side. The ladies that run this place are great. They have fixed all 3 of my cats and my parent's two dogs. I highly recommend them.",t2_4dtf19n,lushfaye,0,1645746787.0,0,t1_hyb9hku,hyb9hku,False,Coal_Bee,t3_szxl4q,https://www.reddit.com/r/Clarksville/comments/szxl4q/any_low_cost_vets_for_spaying_a_cat/,Any low cost vets for spaying a cat?,/r/Clarksville/comments/szxl4q/any_low_cost_vets_for_spaying_a_cat/hyb9hku/,1,r/Clarksville,0,1
I don't trust Eastview.,t2_4dtf19n,lushfaye,0,1645746468.0,0,t1_hyb8qcj,hyb8qcj,False,Coal_Bee,t3_szxl4q,https://www.reddit.com/r/Clarksville/comments/szxl4q/any_low_cost_vets_for_spaying_a_cat/,Any low cost vets for spaying a cat?,/r/Clarksville/comments/szxl4q/any_low_cost_vets_for_spaying_a_cat/hyb8qcj/,1,r/Clarksville,0,1
