body,author_fullname,author.name,controversiality,created,downs,fullname,id,is_root,link_author,link_id,link_permalink,link_title,permalink,score,subreddit_name_prefixed,total_awards_received,ups
"Good day. Well I moved here in May of 2012. I heard all the same things that you’re hearing. So before I even had a chance to find out for my self. I heard negative things. Things like there’s nothing to do, way to many drugs, lots of crime etc. Well with those things being said I thought hmmm I come from ritual NB and those things are running rampant there as well. So it’s not a Fort McMurray issue it’s a world wide issue. Now let me give a few of my selling points. And some of what I will mention was before the pandemic which who knows what any place is going to be any time soon. 

Personally I LOVE it here. And when I knew that this was in fact home for me was when I was back east during evacuation of the 2016 wild fire that swept threw town. And when it started opening back up and the part of town I lived in we received our time table. I said to my family I can’t wait to go home. And that’s what this place has become to me.

As far as a affordable, I had this conversation last month when I was back in NB for a visit with family. My sisters son was looking for work in Fredericton and she said how expensive it was. Then she said to me but it’s still cheaper then where you live. I said well let’s compare apples to apples. Once we did that and I am in walking distance to move theatre, several places to eat, dentist, and lots of other amenities. I pay less per month then what he was looking at in NB with nothing in walking distance. Now mind you I don’t walk to those often but used it as a measuring stick. And tried to find buildings in comparison. I can live other parts of town that’s not near as nice for 400-600 a month cheaper then I do now.

So when I hear people say the famous ole “ there’s NOTHING  to do” I always start off by asking them:
What is it that you did where you come from that you can’t do here? 
Of course there’s things that you can’t but over all I ask them…
Have you been to Keyano Theatre  for any of the plays, concerts, comedy or even film festival movie nights?
Most people don’t even know that’s a thing here. And I have seen some great shows, concerts and more.

Mac Island is a great place as far as rock climbing, water slides, pool, golfing etc depends on your kids ages. 
There’s a golf course out at Vista Ridge as well as a climbing park with it being built 3 storey high, zip line across to the next phase etc the golf course is fun for families and the holes are bigger then your standard. It’s a great place to get started and have fun learning the game. I never golfed until this summer and I’ve been out 3 times. Because it’s such a laid back difference in contrast to what most places are.

There’s bowling and laser tag down town. Haven’t been to the laser tag it just opened. But bowling is good. If you wanna go out with friends and bowl the one up town is more geared to that. But during the day until 8 at night I believe the bowling at Banquet is open for  families. 

There is a dirt bike race track just south of town and a car race track that is just getting its legs under it this year. In fact there’s two days of racing this weekend.

** sorry as I just scrolled up I see you said your child is 1.5 so a bit young yet for some of this stuff** 


It is much more family friendly. I have friends with younger kids and they have told me there’s lots of programs and things for kids. They say how much it has changed and is changing to be more family friendly.

The condo I live in has its own park, it also has its own gym, carwash, game room with pool table & air hockey. As well as a short walk to some really great trails. 

I have my favourite go to places to eat depending on what I am craving. 

There’s more to list and talk about but I will cut it off now lol

I hope this has been helpful and any questions to feel free to ask. 

Have a great day!",t2_dk2rskvq,Majestic_Ad6791,0,1631905235.0,0,t1_hd8oqgp,hd8oqgp,True,MFondue,t3_pprete,https://www.reddit.com/r/FortMcMurray/comments/pprete/whats_it_like_living_in_fort_mcmurray/,What's it like living in Fort McMurray?,/r/FortMcMurray/comments/pprete/whats_it_like_living_in_fort_mcmurray/hd8oqgp/,7,r/FortMcMurray,0,7
"The resturants are really bad. And shopping is almost non existent, but its got a little ski hill for the winter and lots to do in the summer. It's a decent town. Less crime and drugs than lethbridge surprisingly.",t2_5yna8,Zebleblic,0,1631897988.0,0,t1_hd87lsw,hd87lsw,True,MFondue,t3_pprete,https://www.reddit.com/r/FortMcMurray/comments/pprete/whats_it_like_living_in_fort_mcmurray/,What's it like living in Fort McMurray?,/r/FortMcMurray/comments/pprete/whats_it_like_living_in_fort_mcmurray/hd87lsw/,2,r/FortMcMurray,0,2
It's the world's ass hole and we mine it for crusties,t2_dmd09opm,Smart-Comment6926,0,1631886452.0,0,t1_hd7gdt1,hd7gdt1,True,MFondue,t3_pprete,https://www.reddit.com/r/FortMcMurray/comments/pprete/whats_it_like_living_in_fort_mcmurray/,What's it like living in Fort McMurray?,/r/FortMcMurray/comments/pprete/whats_it_like_living_in_fort_mcmurray/hd7gdt1/,-6,r/FortMcMurray,0,-6
"I lived in Fort McMurray 1999 to 2002 (graduated in 2000), and returned for summers and holidays for a few years later until moving out East. My parents and extended family are largely still in the Mac. Your summary of the city really felt like an echo of that past life. Coming up in a time when the city was booming and it was filled with transient workers, more ready access to drugs. Although I only felt unsafe in parts of downtown, never in the burbs.

Strange to think that time was 20 years ago, and not 5 years ago (like it feels).

edit: for OP, I would say that the Mac is quite safe for families, has more of a ""community"" feel to it, than any big Canadian city. A scary street in the Mac has nothing on a less than safe feeling street in Edmonton.",t2_95uqt,rhinonyssus,0,1631882384.0,0,t1_hd784c9,hd784c9,False,MFondue,t3_pprete,https://www.reddit.com/r/FortMcMurray/comments/pprete/whats_it_like_living_in_fort_mcmurray/,What's it like living in Fort McMurray?,/r/FortMcMurray/comments/pprete/whats_it_like_living_in_fort_mcmurray/hd784c9/,8,r/FortMcMurray,0,8
"Thanks! I will have to look into those parks you mentioned. Would love to have some larger park spaces around if we end up in a condo/townhouse situation where there is no yard for the little guy to play. Otherwise, we are pretty comfortable with limited services like shopping etc. and love outdoor rec so that's promising.",t2_3h53jkmd,MFondue,0,1631848370.0,0,t1_hd5wu65,hd5wu65,False,MFondue,t3_pprete,https://www.reddit.com/r/FortMcMurray/comments/pprete/whats_it_like_living_in_fort_mcmurray/,What's it like living in Fort McMurray?,/r/FortMcMurray/comments/pprete/whats_it_like_living_in_fort_mcmurray/hd5wu65/,3,r/FortMcMurray,0,3
"Living here is like riding a bike. Except the bike is on fire. And you're on fire. And everything is on fire. And you're in hell.

Seriously though, the city has developed a greater sense of community since the down-turn, fire, flood, plague and whatnot. Housing is much more affordable, property taxes are low and city services are spectacular (be sure to check out Mac Island, the waterfront, community parks and trails, etc.) If you can handle slightly limited shopping, dining and entertainment - and especially if you love outdoor recreation - you'll likely be very comfortable here.

Fort McMurray still has real problems with substance abuse and homelessness. Violent crime definitely still occurs, but the general sense is that the city is much safer now. I personally live downtown and have never feared for my safety, but then I'm also a white male. The city was a rougher place back when the mines hired more transient workers - the stereotypical roid-head douchebag roughneck with no roots in the area, but a lot of those guys left with the layoffs.

Demographically it's a very young and diverse community. You'll see fewer seniors but more kids and minorities. You pay more for everything from groceries to oil changes here - particularly professional services like accountants or mechanics, but I honestly doubt you're in for many big financial surprises. Be prepared to spend a little for travel back to civilization from time to time.",t2_hvc0g,NuclearToad,0,1631847824.0,0,t1_hd5vqrf,hd5vqrf,True,MFondue,t3_pprete,https://www.reddit.com/r/FortMcMurray/comments/pprete/whats_it_like_living_in_fort_mcmurray/,What's it like living in Fort McMurray?,/r/FortMcMurray/comments/pprete/whats_it_like_living_in_fort_mcmurray/hd5vqrf/,8,r/FortMcMurray,0,8
It still fits haha,t2_dgs7aijx,DeGeldheart,0,1631821164.0,0,t1_hd49jws,hd49jws,False,davehutch1984,t3_ppfq5r,https://www.reddit.com/r/FortMcMurray/comments/ppfq5r/does_the_starter_pack_get_better_than_this/,Does the starter pack get better than this?,/r/FortMcMurray/comments/ppfq5r/does_the_starter_pack_get_better_than_this/hd49jws/,2,r/FortMcMurray,0,2
I thought this was r/cringe for a second.,t2_5yna8,Zebleblic,0,1631815900.0,0,t1_hd3wmz2,hd3wmz2,True,davehutch1984,t3_ppfq5r,https://www.reddit.com/r/FortMcMurray/comments/ppfq5r/does_the_starter_pack_get_better_than_this/,Does the starter pack get better than this?,/r/FortMcMurray/comments/ppfq5r/does_the_starter_pack_get_better_than_this/hd3wmz2/,2,r/FortMcMurray,0,2
I had no real filters but I also was doing this in February to May.,t2_6h1c9,andrewisgood,0,1631802554.0,0,t1_hd2zj4v,hd2zj4v,False,OnceWholeSoul,t3_pp9yke,https://www.reddit.com/r/FortMcMurray/comments/pp9yke/hostel_in_fort_mcmurray/,Hostel in Fort McMurray?,/r/FortMcMurray/comments/pp9yke/hostel_in_fort_mcmurray/hd2zj4v/,2,r/FortMcMurray,0,2
"Hmm 🤔  they seem more expensive then hotels , Maybe it’s the filters I have set up",t2_akv5914c,OnceWholeSoul,0,1631802485.0,0,t1_hd2zd3i,hd2zd3i,False,OnceWholeSoul,t3_pp9yke,https://www.reddit.com/r/FortMcMurray/comments/pp9yke/hostel_in_fort_mcmurray/,Hostel in Fort McMurray?,/r/FortMcMurray/comments/pp9yke/hostel_in_fort_mcmurray/hd2zd3i/,2,r/FortMcMurray,0,2
Your only real chance of a cheap spot is an AirBnB. I stayed at a bunch when I was on 4/10s for a bit so there are some good spots.,t2_6h1c9,andrewisgood,0,1631800724.0,0,t1_hd2v79e,hd2v79e,True,OnceWholeSoul,t3_pp9yke,https://www.reddit.com/r/FortMcMurray/comments/pp9yke/hostel_in_fort_mcmurray/,Hostel in Fort McMurray?,/r/FortMcMurray/comments/pp9yke/hostel_in_fort_mcmurray/hd2v79e/,4,r/FortMcMurray,0,4
"Yeah , I was looking for cheap accommodations till I get settled in my new job.  I’m not quite sure I’ll have enough to rent a room when I get there",t2_akv5914c,OnceWholeSoul,0,1631798239.0,0,t1_hd2psh3,hd2psh3,False,OnceWholeSoul,t3_pp9yke,https://www.reddit.com/r/FortMcMurray/comments/pp9yke/hostel_in_fort_mcmurray/,Hostel in Fort McMurray?,/r/FortMcMurray/comments/pp9yke/hostel_in_fort_mcmurray/hd2psh3/,2,r/FortMcMurray,0,2
"Food yes, gas yes, but not crazy expensive. 
Renting is pretty reasonable.",t2_c5yotdny,Tommy_Douglas_AB,0,1631797033.0,0,t1_hd2nbev,hd2nbev,False,OnceWholeSoul,t3_pnsp9c,https://www.reddit.com/r/FortMcMurray/comments/pnsp9c/anyone_renting_a_room/,Anyone renting a room ?,/r/FortMcMurray/comments/pnsp9c/anyone_renting_a_room/hd2nbev/,1,r/FortMcMurray,0,1
"Eh, not as many transients these days in town though they still exist. Alot of them are in camps. 
It mostly has a work/family town vibe. 

It's worth visiting but to me the top places to see are one of the oil sands mines and six lakes.

  It will be tough to get onto an oil sands site but Suncor does have a family day every year (sans covid). If you find someone willing to sign you up next summer that would be good.  

For Six Lakes (back country camping with nice beaches), you can either rent a quad/trailer and drive yourself in  3 to 5 hours or you could try the Six Lakes or Richardson Back Country Facebook pages and see if someone will let you tag along. Lots of friendly people (newfies)  up here so wouldn't surprise me if someone said yes.",t2_c5yotdny,Tommy_Douglas_AB,0,1631796933.0,0,t1_hd2n483,hd2n483,True,OnceWholeSoul,t3_pp9yke,https://www.reddit.com/r/FortMcMurray/comments/pp9yke/hostel_in_fort_mcmurray/,Hostel in Fort McMurray?,/r/FortMcMurray/comments/pp9yke/hostel_in_fort_mcmurray/hd2n483/,3,r/FortMcMurray,0,3
Yeah and checking indeed as well for that second job.   Is Fort McMurray expensive to live in ?,t2_akv5914c,OnceWholeSoul,0,1631671916.0,0,t1_hcwg10m,hcwg10m,True,OnceWholeSoul,t3_pnsp9c,https://www.reddit.com/r/FortMcMurray/comments/pnsp9c/anyone_renting_a_room/,Anyone renting a room ?,/r/FortMcMurray/comments/pnsp9c/anyone_renting_a_room/hcwg10m/,1,r/FortMcMurray,0,1
Check out the fort mcmurray buy and sell pages on Facebook.,t2_5yna8,Zebleblic,0,1631584432.0,0,t1_hcrod80,hcrod80,True,OnceWholeSoul,t3_pnsp9c,https://www.reddit.com/r/FortMcMurray/comments/pnsp9c/anyone_renting_a_room/,Anyone renting a room ?,/r/FortMcMurray/comments/pnsp9c/anyone_renting_a_room/hcrod80/,3,r/FortMcMurray,0,3
"It’s not hard to get a job here. Jobs from $15-$25 are very easy to find. Up to $35 it might be harder but with some experience still possible. For higher rates it gets harder because you need certain skills or academic credentials and experience.
There is always opportunity because many people come here with 6-months to 3-year plans and stick to them. So there are always openings. Some others like the calm life with high earnings and stay. 
If you check the employment websites of keyano, macisland, municipality, oil industry companies, schools, big industrial companies they are always hiring.",t2_5fou69n6,kaybrave,0,1631508740.0,0,t1_hcnmvuj,hcnmvuj,True,[deleted],t3_pl4bkm,https://www.reddit.com/r/FortMcMurray/comments/pl4bkm/deleted_by_user/,[deleted by user],/r/FortMcMurray/comments/pl4bkm/deleted_by_user/hcnmvuj/,1,r/FortMcMurray,0,1
Thank you for your response :),t2_e4uy5np3,makinsfw,0,1631299132.0,0,t1_hcce3g3,hcce3g3,False,[deleted],t3_pl4bkm,https://www.reddit.com/r/FortMcMurray/comments/pl4bkm/deleted_by_user/,[deleted by user],/r/FortMcMurray/comments/pl4bkm/deleted_by_user/hcce3g3/,1,r/FortMcMurray,0,1
"Not for low paying jobs. Seems like lots of service industry work, like servers, are needed.  Found a parttime service industry job without even applying, they reached out to me.",t2_agsktcl0,CarefulKey6546,0,1631254646.0,0,t1_hca5frx,hca5frx,True,[deleted],t3_pl4bkm,https://www.reddit.com/r/FortMcMurray/comments/pl4bkm/deleted_by_user/,[deleted by user],/r/FortMcMurray/comments/pl4bkm/deleted_by_user/hca5frx/,2,r/FortMcMurray,0,2
Thank you for your response btw it is helpful :),t2_e4uy5np3,makinsfw,0,1631248783.0,0,t1_hc9wrjz,hc9wrjz,False,[deleted],t3_pl4bkm,https://www.reddit.com/r/FortMcMurray/comments/pl4bkm/deleted_by_user/,[deleted by user],/r/FortMcMurray/comments/pl4bkm/deleted_by_user/hc9wrjz/,1,r/FortMcMurray,0,1
I see but do you yourself find it hard getting a job here?,t2_e4uy5np3,makinsfw,0,1631248674.0,0,t1_hc9wl2i,hc9wl2i,False,[deleted],t3_pl4bkm,https://www.reddit.com/r/FortMcMurray/comments/pl4bkm/deleted_by_user/,[deleted by user],/r/FortMcMurray/comments/pl4bkm/deleted_by_user/hc9wl2i/,1,r/FortMcMurray,0,1
"money has been hard throughout covid so people want to come here for work to make more. There has been wage decreases in certain jobs that have made people want to move here to the bubble to make some more cash. I didn't blame these people by any means, wages going down due to not enough money is totally ridiculous.

small business going out of business leaving more without jobs, markets were and potentially still are slow leaving less hiring, some even having hiring freezes, alot of people found markets online (lucky of them to make it), companies laying off employees due to market shortages. I think these are some of the majors events happening within employment now or the past year.",t2_dgs7aijx,DeGeldheart,0,1631237632.0,0,t1_hc99ruy,hc99ruy,True,[deleted],t3_pl4bkm,https://www.reddit.com/r/FortMcMurray/comments/pl4bkm/deleted_by_user/,[deleted by user],/r/FortMcMurray/comments/pl4bkm/deleted_by_user/hc99ruy/,2,r/FortMcMurray,0,2
Aurora Services in Gwire,t2_e4uy5np3,makinsfw,0,1631221803.0,0,t1_hc8a819,hc8a819,True,kaybrave,t3_pl6d0r,https://www.reddit.com/r/FortMcMurray/comments/pl6d0r/are_there_any_reliable_bmw_mechanics_in_town/,Are there any reliable BMW mechanics in town?,/r/FortMcMurray/comments/pl6d0r/are_there_any_reliable_bmw_mechanics_in_town/hc8a819/,1,r/FortMcMurray,0,1
"Go on the rmwb website and search for atv or visit the parks and facilities map. Filter by OHV staging areas. There are 5 in town. 

https://facilities.rmwb.ca/?CategoryIds=&FacilityTypeIds=40986&Keywords=&ScrollTo=scroll-map-list-container&CloseMap=true",t2_5fou69n6,kaybrave,0,1631159225.0,0,t1_hc56cbg,hc56cbg,True,[deleted],t3_pkprch,https://www.reddit.com/r/FortMcMurray/comments/pkprch/atv_trails/,ATV trails?,/r/FortMcMurray/comments/pkprch/atv_trails/hc56cbg/,3,r/FortMcMurray,0,3
I'll message you on here.. I have a similar ride from Kawasaki instead. Vulcan 1600. I believe they share quite a bit between them.,t2_al0psj9w,lord-_-yoda,0,1631122968.0,0,t1_hc31ae6,hc31ae6,False,Dannnymaccc,t3_pb1lqd,https://www.reddit.com/r/FortMcMurray/comments/pb1lqd/wanna_get_out_for_a_good_adventure_what_are_some/,Wanna get out for a good adventure! What are some good places to go visit before i have to pug the bike in storage?,/r/FortMcMurray/comments/pb1lqd/wanna_get_out_for_a_good_adventure_what_are_some/hc31ae6/,1,r/FortMcMurray,0,1
"Hell yeah, i’m tryna ride as much as i can before she has to get put away for winter.",t2_9k7kycxw,Dannnymaccc,0,1631113905.0,0,t1_hc2fe2a,hc2fe2a,False,Dannnymaccc,t3_pb1lqd,https://www.reddit.com/r/FortMcMurray/comments/pb1lqd/wanna_get_out_for_a_good_adventure_what_are_some/,Wanna get out for a good adventure! What are some good places to go visit before i have to pug the bike in storage?,/r/FortMcMurray/comments/pb1lqd/wanna_get_out_for_a_good_adventure_what_are_some/hc2fe2a/,2,r/FortMcMurray,0,2
Heyo you still riding?,t2_al0psj9w,lord-_-yoda,0,1631100236.0,0,t1_hc1o36q,hc1o36q,True,Dannnymaccc,t3_pb1lqd,https://www.reddit.com/r/FortMcMurray/comments/pb1lqd/wanna_get_out_for_a_good_adventure_what_are_some/,Wanna get out for a good adventure! What are some good places to go visit before i have to pug the bike in storage?,/r/FortMcMurray/comments/pb1lqd/wanna_get_out_for_a_good_adventure_what_are_some/hc1o36q/,2,r/FortMcMurray,0,2
What?😂,t2_9k7kycxw,Dannnymaccc,0,1630988573.0,0,t1_hbw6yvo,hbw6yvo,False,Dannnymaccc,t3_pb1lqd,https://www.reddit.com/r/FortMcMurray/comments/pb1lqd/wanna_get_out_for_a_good_adventure_what_are_some/,Wanna get out for a good adventure! What are some good places to go visit before i have to pug the bike in storage?,/r/FortMcMurray/comments/pb1lqd/wanna_get_out_for_a_good_adventure_what_are_some/hbw6yvo/,1,r/FortMcMurray,0,1
Fade 99 in wood buffalo is literally the best. Never messed up any haircut been going for 2 years,t2_6a28jtw5,Right_Protection_584,0,1630898167.0,0,t1_hbrlkty,hbrlkty,True,KBravestone,t3_p7nphl,https://www.reddit.com/r/FortMcMurray/comments/p7nphl/good_barbers_mens_hair_stylists_in_town/,"Good barbers, men's hair stylists in town",/r/FortMcMurray/comments/p7nphl/good_barbers_mens_hair_stylists_in_town/hbrlkty/,1,r/FortMcMurray,0,1
I believe there was a debate tonight (Jagmeet posted about serving poutine before the debate and I saw some clips on TikTok but haven’t fully watched it yet) it should be available in English and French on Global News’ Youtube channel there is most likely also captions and ASL available in the videos themselves. I’m gonna work on the candidates today I honestly might just make a whole google doc for first time voters (and basically anyone but more geared towards first time voters) since I have time and information has been difficult to find since the election is approaching so quickly!,t2_45c2k719,AureolinWandering,0,1630685112.0,0,t1_hbgm8jl,hbgm8jl,False,Winddancer87,t3_pg19kh,https://www.reddit.com/r/FortMcMurray/comments/pg19kh/questions_about_local_candidates_fort/,Questions about Local Candidates (Fort McMurray-Cold Lake Region) for Upcoming Federal Election,/r/FortMcMurray/comments/pg19kh/questions_about_local_candidates_fort/hbgm8jl/,2,r/FortMcMurray,0,2
"That helps thanks. I couldn't find ANYTHING on him. 

I'm open to info on all candidates. I want to be as objective as possible until I know more on each one. Especially the main parties Liberal, CPC and NDP.

Ideally I'd like to hear them all speak. Any debates coming up that you know of?",t2_adlpa,Winddancer87,0,1630674258.0,0,t1_hbfx3dw,hbfx3dw,False,Winddancer87,t3_pg19kh,https://www.reddit.com/r/FortMcMurray/comments/pg19kh/questions_about_local_candidates_fort/,Questions about Local Candidates (Fort McMurray-Cold Lake Region) for Upcoming Federal Election,/r/FortMcMurray/comments/pg19kh/questions_about_local_candidates_fort/hbfx3dw/,1,r/FortMcMurray,0,1
"Had a wild day but managed to get one candidate done wanted to post it now and edit the comment as I get more done that way nobody has to wait for info. Also tried to make it sound fancy and put together but my grammar isn’t the greatest but hopefully it’s legible!

disclaimer: i am an ndp voter and leftist (literally the top left corner on cbc vote compass and about 3 up and 2 over from the bottom left on the political compass) i’ll try to be as unbiased as possible but humans are inherently biased individuals also if anyone would like more in depth answers please let me know i’m just doing very basic ones to get information out asap since the election is rapidly approaching 

NDP: Garnett Robinson
Looks like he most likely lives in Lac La Biche haven’t confirmed though. Appears to support (obviously can’t confirm but this is what i’ve found either said or implied) UBI, Indigenous rights, vaccines, healthcare workers, environmental protections, helping addicts, anti racism, and helping end poverty. Doesn’t have much social media for me to work off of but basically what i expect and want from an NDP candidate. Will try to ask his positions on certain issues if i meet him if i’m able to volunteer if you’d like anything specific asked let me know!",t2_45c2k719,AureolinWandering,0,1630650645.0,0,t1_hbf0oi8,hbf0oi8,True,Winddancer87,t3_pg19kh,https://www.reddit.com/r/FortMcMurray/comments/pg19kh/questions_about_local_candidates_fort/,Questions about Local Candidates (Fort McMurray-Cold Lake Region) for Upcoming Federal Election,/r/FortMcMurray/comments/pg19kh/questions_about_local_candidates_fort/hbf0oi8/,4,r/FortMcMurray,0,4
"Thanks for the info! Yes please update if you can.

Maybe some of them haven't posted anything yet where they just announced the candidates yesterday.",t2_adlpa,Winddancer87,0,1630602798.0,0,t1_hbc7bd8,hbc7bd8,False,Winddancer87,t3_pg19kh,https://www.reddit.com/r/FortMcMurray/comments/pg19kh/questions_about_local_candidates_fort/,Questions about Local Candidates (Fort McMurray-Cold Lake Region) for Upcoming Federal Election,/r/FortMcMurray/comments/pg19kh/questions_about_local_candidates_fort/hbc7bd8/,1,r/FortMcMurray,0,1
I’ve been trying to find info on candidates to find out who lives in the riding and it’s been minimal but I’ll edit my comment when I get some! As for if you wanna find out yourself i usually go to the parties website and then try to find their social media (I’ve found it shows what they stand for a fair bit better than the sites),t2_45c2k719,AureolinWandering,0,1630599660.0,0,t1_hbbzbpr,hbbzbpr,True,Winddancer87,t3_pg19kh,https://www.reddit.com/r/FortMcMurray/comments/pg19kh/questions_about_local_candidates_fort/,Questions about Local Candidates (Fort McMurray-Cold Lake Region) for Upcoming Federal Election,/r/FortMcMurray/comments/pg19kh/questions_about_local_candidates_fort/hbbzbpr/,2,r/FortMcMurray,0,2
Thank you!,t2_11glqb,Bhulagoon,0,1630527460.0,0,t1_hb8bblg,hb8bblg,False,Bhulagoon,t3_p03x7p,https://www.reddit.com/r/FortMcMurray/comments/p03x7p/best_place_to_buy_vegan_groceries_in_fm/,Best place to buy vegan groceries in fm?,/r/FortMcMurray/comments/p03x7p/best_place_to_buy_vegan_groceries_in_fm/hb8bblg/,1,r/FortMcMurray,0,1
Save on foods in Timberlea has the largest selection. The thickwood and downtown locations have reasonable amounts too.,t2_adlpa,Winddancer87,0,1630524684.0,0,t1_hb84fl0,hb84fl0,True,Bhulagoon,t3_p03x7p,https://www.reddit.com/r/FortMcMurray/comments/p03x7p/best_place_to_buy_vegan_groceries_in_fm/,Best place to buy vegan groceries in fm?,/r/FortMcMurray/comments/p03x7p/best_place_to_buy_vegan_groceries_in_fm/hb84fl0/,1,r/FortMcMurray,0,1
I second that! Best selection of craft beers too,t2_adlpa,Winddancer87,0,1630524621.0,0,t1_hb84a46,hb84a46,False,Setscrews,t3_p2mdmw,https://www.reddit.com/r/FortMcMurray/comments/p2mdmw/anyone_know_where_to_find_this_in_fort_mac/,Anyone know where to find this in Fort Mac?,/r/FortMcMurray/comments/p2mdmw/anyone_know_where_to_find_this_in_fort_mac/hb84a46/,2,r/FortMcMurray,0,2
"Mitchell's! And they have a nice outdoor patio to sit on.

They post their special everyday on instagram and facebook (@mitchellscafe)",t2_adlpa,Winddancer87,0,1630524566.0,0,t1_hb845bm,hb845bm,True,MarkyMacoi14,t3_p3ewde,https://www.reddit.com/r/FortMcMurray/comments/p3ewde/what_is_the_best_local_home_grown_coffeehouse/,What is the best local/ home grown coffeehouse/ shop in town.,/r/FortMcMurray/comments/p3ewde/what_is_the_best_local_home_grown_coffeehouse/hb845bm/,1,r/FortMcMurray,0,1
