body,author_fullname,author.name,controversiality,created,downs,fullname,id,is_root,link_author,link_id,link_permalink,link_title,permalink,score,subreddit_name_prefixed,total_awards_received,ups
"Avid Nespresso lover. You cannot buy any of their pods in store, it is exclusive to them. You can set an automatic shipment every month so you don’t have to think about it. You can find the Starbucks for Nespresso pods in the coffee pod section at Sobeys(downtown) and Save on foods (Stoneycreek)when they are in stock but they sell quickly. The locations I mention are those I go to for them.",t2_i6pphzm3,Brigittepierette,0,1643233414.0,0,t1_hucp7u1,hucp7u1,True,YellowBlackBrown,t3_sd6zsw,https://www.reddit.com/r/FortMcMurray/comments/sd6zsw/nespresso_pods/,Nespresso Pods,/r/FortMcMurray/comments/sd6zsw/nespresso_pods/hucp7u1/,1,r/FortMcMurray,0,1
Look up coffee solutions Canada. They've got a pretty sweet selection of stuff online!,t2_i8y9zi6z,cherrykitt,0,1643230190.0,0,t1_hucg7v0,hucg7v0,True,YellowBlackBrown,t3_sd6zsw,https://www.reddit.com/r/FortMcMurray/comments/sd6zsw/nespresso_pods/,Nespresso Pods,/r/FortMcMurray/comments/sd6zsw/nespresso_pods/hucg7v0/,1,r/FortMcMurray,0,1
"well I mean walmart and crappy tire sells those machines no reason for them to carry the pods. less selection obviously than the nice nespresso stores in big cities

just checked, superstore have them too",t2_be57v,alzhang8,0,1643209078.0,0,t1_huatmd0,huatmd0,False,YellowBlackBrown,t3_sd6zsw,https://www.reddit.com/r/FortMcMurray/comments/sd6zsw/nespresso_pods/,Nespresso Pods,/r/FortMcMurray/comments/sd6zsw/nespresso_pods/huatmd0/,1,r/FortMcMurray,0,1
"Is that right, I was just lucking out at grocery stores and assumed it was just exclusive to their Nespresso stores.",t2_14iud4,YellowBlackBrown,0,1643208505.0,0,t1_huas7sv,huas7sv,False,YellowBlackBrown,t3_sd6zsw,https://www.reddit.com/r/FortMcMurray/comments/sd6zsw/nespresso_pods/,Nespresso Pods,/r/FortMcMurray/comments/sd6zsw/nespresso_pods/huas7sv/,1,r/FortMcMurray,0,1
"Canadian tire, Walmart, Amazon , etc

Check online for availability first",t2_be57v,alzhang8,0,1643207032.0,0,t1_huaoqll,huaoqll,True,YellowBlackBrown,t3_sd6zsw,https://www.reddit.com/r/FortMcMurray/comments/sd6zsw/nespresso_pods/,Nespresso Pods,/r/FortMcMurray/comments/sd6zsw/nespresso_pods/huaoqll/,2,r/FortMcMurray,0,2
Lovely pls check your inbox @mig39,t2_iefn0l07,StarAngel2022,0,1643173884.0,0,t1_hu99ykm,hu99ykm,True,mig39,t3_s9dmg5,https://www.reddit.com/r/FortMcMurray/comments/s9dmg5/thickwood_sunrise/,Thickwood sunrise.,/r/FortMcMurray/comments/s9dmg5/thickwood_sunrise/hu99ykm/,1,r/FortMcMurray,0,1
Pls check your inbox @u/tab269,t2_iefn0l07,StarAngel2022,0,1643173855.0,0,t1_hu99wo7,hu99wo7,True,tab269,t3_safw55,https://www.reddit.com/r/FortMcMurray/comments/safw55/old_abbasand/,Old Abbasand,/r/FortMcMurray/comments/safw55/old_abbasand/hu99wo7/,1,r/FortMcMurray,0,1
"More craziness happens downtown at night than any other neighbourhood. Also, some of the apartment down there are rundown. Timberlea is also nice if you go further in instead of staying around Confed and prospect areas. I have explored quite a bit in foot during the summer and I can tell you it makes up for the miserable winter.",t2_i6pphzm3,Brigittepierette,0,1643009794.0,0,t1_htzsa91,htzsa91,False,EskimoCheeks,t3_rx0fzn,https://www.reddit.com/r/FortMcMurray/comments/rx0fzn/pomeroy_hotel_apartments_any_good/,"Pomeroy Hotel apartments, any good?",/r/FortMcMurray/comments/rx0fzn/pomeroy_hotel_apartments_any_good/htzsa91/,2,r/FortMcMurray,0,2
"I get why they had to make the fire break, but it's such a shame to see those areas of Birchwood plowed down. :( Used to walk from timberlea to Dickens field with my dad all the time.",t2_dkss0,engoac,0,1642914280.0,0,t1_htudc8r,htudc8r,True,dxstructivefox,t3_saelh6,https://www.reddit.com/r/FortMcMurray/comments/saelh6/some_photos_i_personally_took_back_in_2016_before/,some photos I personally took back in 2016 before the fire. Locations: Birchwood Trails and Real Martin Drive.,/r/FortMcMurray/comments/saelh6/some_photos_i_personally_took_back_in_2016_before/htudc8r/,4,r/FortMcMurray,0,4
Me too. Console?,t2_13uvy7,mikesphone1979,0,1642899131.0,0,t1_httezan,httezan,False,mikesphone1979,t3_ro1oiq,https://www.reddit.com/r/FortMcMurray/comments/ro1oiq/pubg_pc_call_of_duty_vanguard_warzone_quake/,"PUBG (PC) ? , Call Of Duty Vanguard / Warzone?, Quake Champions? -- What are we playing this week?",/r/FortMcMurray/comments/ro1oiq/pubg_pc_call_of_duty_vanguard_warzone_quake/httezan/,1,r/FortMcMurray,0,1
"Hey everyone's experiences are theirs and completely valid, but may I ask why you disagree?",t2_83ucncb6,AnyAdministration657,0,1642886903.0,0,t1_htskydn,htskydn,False,studbucket,t3_s74ffy,https://www.reddit.com/r/FortMcMurray/comments/s74ffy/best_realtor_in_town/,Best Realtor in Town,/r/FortMcMurray/comments/s74ffy/best_realtor_in_town/htskydn/,2,r/FortMcMurray,0,2
Sorry I strongly disagree,t2_ia73vaq4,No_Opening1636,0,1642880442.0,0,t1_hts54xz,hts54xz,False,studbucket,t3_s74ffy,https://www.reddit.com/r/FortMcMurray/comments/s74ffy/best_realtor_in_town/,Best Realtor in Town,/r/FortMcMurray/comments/s74ffy/best_realtor_in_town/hts54xz/,1,r/FortMcMurray,0,1
Beautiful!,t2_2cgsbq9g,GldnD,0,1642865615.0,0,t1_htr3p73,htr3p73,True,mig39,t3_s9dmg5,https://www.reddit.com/r/FortMcMurray/comments/s9dmg5/thickwood_sunrise/,Thickwood sunrise.,/r/FortMcMurray/comments/s9dmg5/thickwood_sunrise/htr3p73/,2,r/FortMcMurray,0,2
Pubg,t2_goxk0jl0,chhiicc,0,1642811085.0,0,t1_htob4xl,htob4xl,True,mikesphone1979,t3_ro1oiq,https://www.reddit.com/r/FortMcMurray/comments/ro1oiq/pubg_pc_call_of_duty_vanguard_warzone_quake/,"PUBG (PC) ? , Call Of Duty Vanguard / Warzone?, Quake Champions? -- What are we playing this week?",/r/FortMcMurray/comments/ro1oiq/pubg_pc_call_of_duty_vanguard_warzone_quake/htob4xl/,2,r/FortMcMurray,0,2
Nice,t2_goxk0jl0,chhiicc,0,1642810590.0,0,t1_hto9wsh,hto9wsh,True,mig39,t3_s9dmg5,https://www.reddit.com/r/FortMcMurray/comments/s9dmg5/thickwood_sunrise/,Thickwood sunrise.,/r/FortMcMurray/comments/s9dmg5/thickwood_sunrise/hto9wsh/,5,r/FortMcMurray,0,5
Depends on where you are in town. On Bird Cres in Thickwood they don't (didn't?) have Telus fibre so the best you can do is 15mbps (at least this was the case when I swapped to Shaw a few years ago). With shaw we regularly get 325-350mbps with three people streaming video and playing online games at the same time.,t2_1232bz,MELLYVEE,0,1642734884.0,0,t1_htjszwd,htjszwd,True,EskimoCheeks,t3_s26xd7,https://www.reddit.com/r/FortMcMurray/comments/s26xd7/best_internet_provider_in_town/,best internet provider in town?,/r/FortMcMurray/comments/s26xd7/best_internet_provider_in_town/htjszwd/,2,r/FortMcMurray,0,2
I remember 1 year way back there was a sick road gap. Worth scoping out. Maybe after a blizzard when vista isn't open we go have a session!,t2_13uvy7,mikesphone1979,0,1642727660.0,0,t1_htjccuk,htjccuk,False,mikesphone1979,t3_s8ntlq,https://www.reddit.com/r/FortMcMurray/comments/s8ntlq/where_do_the_kids_go_snowboarding_in_town_these/,Where do 'the kids' go snowboarding in town these days?,/r/FortMcMurray/comments/s8ntlq/where_do_the_kids_go_snowboarding_in_town_these/htjccuk/,1,r/FortMcMurray,0,1
I'm surprised no one goes to the hill going down to the gold course. Seems like it would be decent,t2_szjwo,Bravetrail,0,1642715057.0,0,t1_htijc2m,htijc2m,True,mikesphone1979,t3_s8ntlq,https://www.reddit.com/r/FortMcMurray/comments/s8ntlq/where_do_the_kids_go_snowboarding_in_town_these/,Where do 'the kids' go snowboarding in town these days?,/r/FortMcMurray/comments/s8ntlq/where_do_the_kids_go_snowboarding_in_town_these/htijc2m/,2,r/FortMcMurray,0,2
Vista Ridge ski hill,t2_9pwcpn2b,RobinMcGurk,0,1642709830.0,0,t1_hti58rf,hti58rf,True,mikesphone1979,t3_s8ntlq,https://www.reddit.com/r/FortMcMurray/comments/s8ntlq/where_do_the_kids_go_snowboarding_in_town_these/,Where do 'the kids' go snowboarding in town these days?,/r/FortMcMurray/comments/s8ntlq/where_do_the_kids_go_snowboarding_in_town_these/hti58rf/,-2,r/FortMcMurray,0,-2
There's also Beaver trail with a nice steep down hill section. Closest street is Torrie Crescent in Dickensfield,t2_8wqf5c,Coco_Cala,0,1642706831.0,0,t1_hthy1bi,hthy1bi,False,mikesphone1979,t3_s8ntlq,https://www.reddit.com/r/FortMcMurray/comments/s8ntlq/where_do_the_kids_go_snowboarding_in_town_these/,Where do 'the kids' go snowboarding in town these days?,/r/FortMcMurray/comments/s8ntlq/where_do_the_kids_go_snowboarding_in_town_these/hthy1bi/,1,r/FortMcMurray,0,1
Thanks!,t2_13uvy7,mikesphone1979,0,1642702426.0,0,t1_hthm1ky,hthm1ky,False,mikesphone1979,t3_s8ntlq,https://www.reddit.com/r/FortMcMurray/comments/s8ntlq/where_do_the_kids_go_snowboarding_in_town_these/,Where do 'the kids' go snowboarding in town these days?,/r/FortMcMurray/comments/s8ntlq/where_do_the_kids_go_snowboarding_in_town_these/hthm1ky/,1,r/FortMcMurray,0,1
I've seen kids snowboarding and sledding in the Birchwood trails. Right beside the cabin is a trail (squirrel maybe?) That's got a decently steep downhill right at the beginning,t2_irosz,ChildOfTheFence19,0,1642700950.0,0,t1_hthhz27,hthhz27,True,mikesphone1979,t3_s8ntlq,https://www.reddit.com/r/FortMcMurray/comments/s8ntlq/where_do_the_kids_go_snowboarding_in_town_these/,Where do 'the kids' go snowboarding in town these days?,/r/FortMcMurray/comments/s8ntlq/where_do_the_kids_go_snowboarding_in_town_these/hthhz27/,2,r/FortMcMurray,0,2
Also the Public Health clinic next to Tim’s in Thickwood.,t2_4ka6m,Trixxstrr,0,1642655303.0,0,t1_htf6ah4,htf6ah4,True,YellowBlackBrown,t3_s88pnv,https://www.reddit.com/r/FortMcMurray/comments/s88pnv/self_tests/,Self Tests?,/r/FortMcMurray/comments/s88pnv/self_tests/htf6ah4/,2,r/FortMcMurray,0,2
"Right here

Dropped pin
https://maps.app.goo.gl/wmGiqfTWnAWNNaMJ8",t2_5c1jo,SmokeyXIII,0,1642653511.0,0,t1_htf2sla,htf2sla,True,YellowBlackBrown,t3_s88pnv,https://www.reddit.com/r/FortMcMurray/comments/s88pnv/self_tests/,Self Tests?,/r/FortMcMurray/comments/s88pnv/self_tests/htf2sla/,2,r/FortMcMurray,0,2
Hi 600 dpi.,t2_czkaupel,scanmypic,0,1642618123.0,0,t1_htcovfr,htcovfr,False,scanmypic,t3_s27xtm,https://www.reddit.com/r/FortMcMurray/comments/s27xtm/started_a_new_picture_scanning_business_would/,"Started a new picture scanning business, would appreciate your support",/r/FortMcMurray/comments/s27xtm/started_a_new_picture_scanning_business_would/htcovfr/,1,r/FortMcMurray,0,1
"Most of the indoor rinks are booked from minor hockey.
Sometimes the rinks at macisland by the curling rinks are rented by the hour.
We ended up going to the vista ridge i door rink which is not heated. 
Beacon hill arena is usually fully booked too, but i ve seen fsmilies booking birthday parties with ice time so you might find a spot there.",t2_5fou69n6,kaybrave,0,1642567539.0,0,t1_hta1k4e,hta1k4e,True,YYCBROWNIE,t3_s7gzr5,https://www.reddit.com/r/FortMcMurray/comments/s7gzr5/indoor_ice_rinks/,Indoor Ice Rinks?,/r/FortMcMurray/comments/s7gzr5/indoor_ice_rinks/hta1k4e/,1,r/FortMcMurray,0,1
Call MacDonald Island and see if they have free skate days.,t2_i8y9zi6z,cherrykitt,0,1642567103.0,0,t1_hta0pdm,hta0pdm,True,YYCBROWNIE,t3_s7gzr5,https://www.reddit.com/r/FortMcMurray/comments/s7gzr5/indoor_ice_rinks/,Indoor Ice Rinks?,/r/FortMcMurray/comments/s7gzr5/indoor_ice_rinks/hta0pdm/,1,r/FortMcMurray,0,1
"Paige Cyr, Coldwell Banker. She's part of a 3 person team called FM homes that al work tirelessly with their own specialties. $65 mil in sales last year and many many connections!",t2_83ucncb6,AnyAdministration657,0,1642566958.0,0,t1_hta0f6v,hta0f6v,True,studbucket,t3_s74ffy,https://www.reddit.com/r/FortMcMurray/comments/s74ffy/best_realtor_in_town/,Best Realtor in Town,/r/FortMcMurray/comments/s74ffy/best_realtor_in_town/hta0f6v/,1,r/FortMcMurray,0,1
"Lisa Hartigan is the #1 realtor in Canada with Coldwell banker, she’s been great to us so and our friends.",t2_ygopa,KeplerLife,0,1642554972.0,0,t1_ht9a09f,ht9a09f,True,studbucket,t3_s74ffy,https://www.reddit.com/r/FortMcMurray/comments/s74ffy/best_realtor_in_town/,Best Realtor in Town,/r/FortMcMurray/comments/s74ffy/best_realtor_in_town/ht9a09f/,1,r/FortMcMurray,0,1
"Nicole MacMaster, Coldwell Banker",t2_aiazl,Horticus,0,1642549604.0,0,t1_ht8xh8w,ht8xh8w,True,studbucket,t3_s74ffy,https://www.reddit.com/r/FortMcMurray/comments/s74ffy/best_realtor_in_town/,Best Realtor in Town,/r/FortMcMurray/comments/s74ffy/best_realtor_in_town/ht8xh8w/,1,r/FortMcMurray,0,1
"Ethan Rimmer, he is with remax",t2_2kgwxk,GreedRB,0,1642543421.0,0,t1_ht8hw9d,ht8hw9d,True,studbucket,t3_s74ffy,https://www.reddit.com/r/FortMcMurray/comments/s74ffy/best_realtor_in_town/,Best Realtor in Town,/r/FortMcMurray/comments/s74ffy/best_realtor_in_town/ht8hw9d/,1,r/FortMcMurray,0,1
🤣😂🤣😭,t2_epxqsw9k,glitteringhellspawn,0,1642538221.0,0,t1_ht83owk,ht83owk,True,TheNorthNova01,t3_ras8jg,https://www.reddit.com/r/FortMcMurray/comments/ras8jg/wmz_be_like/,WMZ be like,/r/FortMcMurray/comments/ras8jg/wmz_be_like/ht83owk/,2,r/FortMcMurray,0,2
No back in September on Blanchett,t2_10cbdp,tab269,0,1642469151.0,0,t1_ht47qd4,ht47qd4,False,meforthem,t3_s5ts03,https://www.reddit.com/r/FortMcMurray/comments/s5ts03/anybody_know_this_guy_he_took_out_3_cars_drunk/,Anybody know this guy. He took out 3 cars drunk off his ass.,/r/FortMcMurray/comments/s5ts03/anybody_know_this_guy_he_took_out_3_cars_drunk/ht47qd4/,2,r/FortMcMurray,0,2
Was that today?,t2_13uvy7,mikesphone1979,0,1642466570.0,0,t1_ht41qpm,ht41qpm,True,meforthem,t3_s5ts03,https://www.reddit.com/r/FortMcMurray/comments/s5ts03/anybody_know_this_guy_he_took_out_3_cars_drunk/,Anybody know this guy. He took out 3 cars drunk off his ass.,/r/FortMcMurray/comments/s5ts03/anybody_know_this_guy_he_took_out_3_cars_drunk/ht41qpm/,2,r/FortMcMurray,0,2
Nope just a local asshole,t2_10cbdp,tab269,0,1642450439.0,0,t1_ht2xvf5,ht2xvf5,False,meforthem,t3_s5ts03,https://www.reddit.com/r/FortMcMurray/comments/s5ts03/anybody_know_this_guy_he_took_out_3_cars_drunk/,Anybody know this guy. He took out 3 cars drunk off his ass.,/r/FortMcMurray/comments/s5ts03/anybody_know_this_guy_he_took_out_3_cars_drunk/ht2xvf5/,5,r/FortMcMurray,0,5
"The guys at the Petro Canada in Timberlea do detailing, not sure about paint though.

Riverstone Ridge",t2_13uvy7,mikesphone1979,0,1642440088.0,0,t1_ht26ia3,ht26ia3,True,Specialist-Ideal-577,t3_s5vgee,https://www.reddit.com/r/FortMcMurray/comments/s5vgee/car_detailing/,Car detailing?,/r/FortMcMurray/comments/s5vgee/car_detailing/ht26ia3/,2,r/FortMcMurray,0,2
Beyond Detailing,t2_6qp1syzx,Glittering-Yoghurt-4,0,1642431574.0,0,t1_ht1ldp5,ht1ldp5,True,Specialist-Ideal-577,t3_s5vgee,https://www.reddit.com/r/FortMcMurray/comments/s5vgee/car_detailing/,Car detailing?,/r/FortMcMurray/comments/s5vgee/car_detailing/ht1ldp5/,2,r/FortMcMurray,0,2
Isn't he the bad guy from tiger King?,t2_2cgsbq9g,GldnD,0,1642430550.0,0,t1_ht1j4uk,ht1j4uk,True,meforthem,t3_s5ts03,https://www.reddit.com/r/FortMcMurray/comments/s5ts03/anybody_know_this_guy_he_took_out_3_cars_drunk/,Anybody know this guy. He took out 3 cars drunk off his ass.,/r/FortMcMurray/comments/s5ts03/anybody_know_this_guy_he_took_out_3_cars_drunk/ht1j4uk/,6,r/FortMcMurray,0,6
He still hasn't contacted his insurance company so i'm waiting to get my vehicle fixed.,t2_10cbdp,tab269,0,1642401872.0,0,t1_ht0d672,ht0d672,False,meforthem,t3_s5ts03,https://www.reddit.com/r/FortMcMurray/comments/s5ts03/anybody_know_this_guy_he_took_out_3_cars_drunk/,Anybody know this guy. He took out 3 cars drunk off his ass.,/r/FortMcMurray/comments/s5ts03/anybody_know_this_guy_he_took_out_3_cars_drunk/ht0d672/,4,r/FortMcMurray,0,4
"Hi, what ppi do you use to scan the photos?",t2_5fou69n6,kaybrave,0,1642400321.0,0,t1_ht0aqs0,ht0aqs0,True,scanmypic,t3_s27xtm,https://www.reddit.com/r/FortMcMurray/comments/s27xtm/started_a_new_picture_scanning_business_would/,"Started a new picture scanning business, would appreciate your support",/r/FortMcMurray/comments/s27xtm/started_a_new_picture_scanning_business_would/ht0aqs0/,1,r/FortMcMurray,0,1
"Fix Auto in Gregoire might accept your vehicle. Their cleaning is great, even undercarriage (you can ask for steam clean your carpets too) and they will do power polish outside.",t2_5fou69n6,kaybrave,0,1642400013.0,0,t1_ht0a8r9,ht0a8r9,True,Specialist-Ideal-577,t3_s5vgee,https://www.reddit.com/r/FortMcMurray/comments/s5vgee/car_detailing/,Car detailing?,/r/FortMcMurray/comments/s5vgee/car_detailing/ht0a8r9/,1,r/FortMcMurray,0,1
Why would you want to know his name?,t2_c5yotdny,Tommy_Douglas_AB,0,1642399773.0,0,t1_ht09umb,ht09umb,True,meforthem,t3_s5ts03,https://www.reddit.com/r/FortMcMurray/comments/s5ts03/anybody_know_this_guy_he_took_out_3_cars_drunk/,Anybody know this guy. He took out 3 cars drunk off his ass.,/r/FortMcMurray/comments/s5ts03/anybody_know_this_guy_he_took_out_3_cars_drunk/ht09umb/,4,r/FortMcMurray,0,4
"I would like to know his name, the cops wouldn't tell me",t2_10cbdp,tab269,0,1642395583.0,0,t1_ht02gpo,ht02gpo,True,meforthem,t3_s5ts03,https://www.reddit.com/r/FortMcMurray/comments/s5ts03/anybody_know_this_guy_he_took_out_3_cars_drunk/,Anybody know this guy. He took out 3 cars drunk off his ass.,/r/FortMcMurray/comments/s5ts03/anybody_know_this_guy_he_took_out_3_cars_drunk/ht02gpo/,6,r/FortMcMurray,0,6
Thats the POS that hit my Jeep,t2_10cbdp,tab269,0,1642393002.0,0,t1_hszxgth,hszxgth,True,meforthem,t3_s5ts03,https://www.reddit.com/r/FortMcMurray/comments/s5ts03/anybody_know_this_guy_he_took_out_3_cars_drunk/,Anybody know this guy. He took out 3 cars drunk off his ass.,/r/FortMcMurray/comments/s5ts03/anybody_know_this_guy_he_took_out_3_cars_drunk/hszxgth/,10,r/FortMcMurray,0,10
There is back up Cameras. I worked on them At Aurora.  I would assume Suncor has them as well,t2_c03zy6wz,CalgaryJohn87,0,1642316609.0,0,t1_hsvh2v4,hsvh2v4,True,Wilfred_Laurier_69,t3_rxovkr,https://www.reddit.com/r/FortMcMurray/comments/rxovkr/fatality_at_baseplant_involving_2_heavy_haulers/,Fatality at Baseplant involving 2 heavy haulers.,/r/FortMcMurray/comments/rxovkr/fatality_at_baseplant_involving_2_heavy_haulers/hsvh2v4/,1,r/FortMcMurray,0,1
"I'll check it out, thanks!",t2_11rw86,EskimoCheeks,0,1642263193.0,0,t1_hss2ik1,hss2ik1,False,EskimoCheeks,t3_s26xd7,https://www.reddit.com/r/FortMcMurray/comments/s26xd7/best_internet_provider_in_town/,best internet provider in town?,/r/FortMcMurray/comments/s26xd7/best_internet_provider_in_town/hss2ik1/,2,r/FortMcMurray,0,2
"It's like a wifi boost system. Check out ""Google wifi mesh"" and it should explain it a bit better for you.",t2_tlrk8,Fighting_Darwin,0,1642226450.0,0,t1_hsqelyh,hsqelyh,False,EskimoCheeks,t3_s26xd7,https://www.reddit.com/r/FortMcMurray/comments/s26xd7/best_internet_provider_in_town/,best internet provider in town?,/r/FortMcMurray/comments/s26xd7/best_internet_provider_in_town/hsqelyh/,2,r/FortMcMurray,0,2
I didn't review shit but also ended up going with the first ATCO plan I seen.,t2_11rw86,EskimoCheeks,0,1642199154.0,0,t1_hsosoui,hsosoui,False,EskimoCheeks,t3_s3zdvu,https://www.reddit.com/r/FortMcMurray/comments/s3zdvu/which_energy_provider_should_i_choose/,Which energy provider should I choose?,/r/FortMcMurray/comments/s3zdvu/which_energy_provider_should_i_choose/hsosoui/,1,r/FortMcMurray,0,1
"Haha i was going to post the same thing a week ago. And here’s what I did:
I was comparing plans and deals. Just energy seemed convenient with their fixed pricing, direct energy attractive with their google hub deal, but I chose Atco because if you get a plan with them there is no questions asked policy and you can leave without notice and no penalty.
This will give me some time after I move to my new place to evaluate my actual consumption and choose the right plan. Thoughts?",t2_5fou69n6,kaybrave,0,1642189665.0,0,t1_hso49e7,hso49e7,True,EskimoCheeks,t3_s3zdvu,https://www.reddit.com/r/FortMcMurray/comments/s3zdvu/which_energy_provider_should_i_choose/,Which energy provider should I choose?,/r/FortMcMurray/comments/s3zdvu/which_energy_provider_should_i_choose/hso49e7/,5,r/FortMcMurray,0,5
Try this comparison tool https://ucahelps.alberta.ca/cost-comparison-tool.aspx,t2_4ka6m,Trixxstrr,0,1642188467.0,0,t1_hso14tg,hso14tg,True,EskimoCheeks,t3_s3zdvu,https://www.reddit.com/r/FortMcMurray/comments/s3zdvu/which_energy_provider_should_i_choose/,Which energy provider should I choose?,/r/FortMcMurray/comments/s3zdvu/which_energy_provider_should_i_choose/hso14tg/,3,r/FortMcMurray,0,3
"You’re looking too far into it haha, cool video but what a boring place to live!",t2_aywzcq8g,shrmzyyy,0,1642102679.0,0,t1_hsizr86,hsizr86,False,[deleted],t3_rrszih,https://www.reddit.com/r/FortMcMurray/comments/rrszih/hyperlapse_thickwood_boulevard/,Hyperlapse Thickwood Boulevard,/r/FortMcMurray/comments/rrszih/hyperlapse_thickwood_boulevard/hsizr86/,1,r/FortMcMurray,0,1
Nah man I just hate it here lol,t2_aywzcq8g,shrmzyyy,0,1642102269.0,0,t1_hsiyoj4,hsiyoj4,False,EskimoCheeks,t3_rx0fzn,https://www.reddit.com/r/FortMcMurray/comments/rx0fzn/pomeroy_hotel_apartments_any_good/,"Pomeroy Hotel apartments, any good?",/r/FortMcMurray/comments/rx0fzn/pomeroy_hotel_apartments_any_good/hsiyoj4/,2,r/FortMcMurray,0,2
You're just being a dick huh,t2_11rw86,EskimoCheeks,0,1642092685.0,0,t1_hsi8qnk,hsi8qnk,False,EskimoCheeks,t3_rx0fzn,https://www.reddit.com/r/FortMcMurray/comments/rx0fzn/pomeroy_hotel_apartments_any_good/,"Pomeroy Hotel apartments, any good?",/r/FortMcMurray/comments/rx0fzn/pomeroy_hotel_apartments_any_good/hsi8qnk/,3,r/FortMcMurray,0,3
"Luckily I came from Yellowknife NorthWest Territories, so imagine if Fort Mac only had 19.5k or population and it's about another 13 hours drive straight North with nothing in between except Peace River Alberta and Grand Prarie lol.

Up there winter ends at the beginning of June.... winter starts the day September hits. Snow starts to stay on the ground every year on Halloween day exactly and by then the lakes are already starting to get safe to walk on.

Needless to say, I am looking VERY forward to winter ending here in like...what the end of March? Spring and Fall last longer than 2 weeks?! Oh yeah... I'm sooooo ready for summer here!

Looking forward to checking out the lakes and learning to cook outside with cast iron and a camp fire with the fish that I catch. I have no skills but I can't wait to take advantage of the weather down here.",t2_11rw86,EskimoCheeks,0,1642092624.0,0,t1_hsi8kj3,hsi8kj3,False,EskimoCheeks,t3_rx0fzn,https://www.reddit.com/r/FortMcMurray/comments/rx0fzn/pomeroy_hotel_apartments_any_good/,"Pomeroy Hotel apartments, any good?",/r/FortMcMurray/comments/rx0fzn/pomeroy_hotel_apartments_any_good/hsi8kj3/,2,r/FortMcMurray,0,2
