body,author_fullname,author.name,controversiality,created,downs,fullname,id,is_root,link_author,link_id,link_permalink,link_title,permalink,score,subreddit_name_prefixed,total_awards_received,ups
No. Criminal record checks are not required.,t2_615iqska,tdlm40,0,1648763788.0,0,t1_i2wldhg,i2wldhg,False,tdlm40,t3_t7pv06,https://www.reddit.com/r/FortMcMurray/comments/t7pv06/need_casino_volunteers_for_april_11th_and_12th/,Need Casino Volunteers for April 11th and 12th,/r/FortMcMurray/comments/t7pv06/need_casino_volunteers_for_april_11th_and_12th/i2wldhg/,1,r/FortMcMurray,0,1
Do I need criminal record check ?,t2_25x7f25s,nalimoo,0,1648756409.0,0,t1_i2w2afk,i2w2afk,False,tdlm40,t3_t7pv06,https://www.reddit.com/r/FortMcMurray/comments/t7pv06/need_casino_volunteers_for_april_11th_and_12th/,Need Casino Volunteers for April 11th and 12th,/r/FortMcMurray/comments/t7pv06/need_casino_volunteers_for_april_11th_and_12th/i2w2afk/,1,r/FortMcMurray,0,1
"It will be in the count room. You need to be 18+, and all training is provided.  (It is stupidly easy). And yes, we do still need help on the 11th.

Position: Count Room
Count room volunteers take on one of four possible jobs:
1. Sorter: Sorts all cash or chips by denomination
2. Counter: Counts the sorted cash or chips, by denomination
3. Recorder: Records the number of bills, coins, and chips counted
4. Amalgamator: Verifies the cash or chips counted and groups them into bundles and summarizes the cash
and chips with the count room supervisor

Sorter Duties:
empties contents of the drop
box, and shows open box to
camera to ensure that it is
empty;
sorts cash or chips into
denominations and places
them into money bin with a
“Box ID Card,” and passes the
bin to the counter;
witnesses the count by the
counter;
may witness table chip count, if
required, at the close.

Counter Duties:
counts the contents of money
bin using money counting
machine;
places contents of the drop
box back into the money bin
along with the “Box ID Card”
and passes bin to the
amalgamator;
assists sorting of chips and
cash as needed.

Recorder Duties:
enters the table number from
the “Box ID card” into the
CasinoTrack system; and
enters the number of bills,
coins, and chips (if any)
counted by the counter into the
CasinoTrack system.
Amalgamator Duties:
receives cash or chips from
counter in money bin;
verifies that all bills are of the
same denomination;
uses a counting machine to
verify contents of the money
bin and advises count room
supervisor of the amount by
denomination;
amalgamates all cash or
chips in count room by
denomination into bundles of
one hundred after receiving
confirmation from the count
room supervisor that the
totals from both counts
match.",t2_615iqska,tdlm40,0,1648737225.0,0,t1_i2uogrs,i2uogrs,False,tdlm40,t3_t7pv06,https://www.reddit.com/r/FortMcMurray/comments/t7pv06/need_casino_volunteers_for_april_11th_and_12th/,Need Casino Volunteers for April 11th and 12th,/r/FortMcMurray/comments/t7pv06/need_casino_volunteers_for_april_11th_and_12th/i2uogrs/,1,r/FortMcMurray,0,1
"Facebook groups based on your interest. There’s runners, hikers and what not.",t2_i6pphzm3,Brigittepierette,0,1648737130.0,0,t1_i2uo8ht,i2uo8ht,True,OnceWholeSoul,t3_tr6fsa,https://www.reddit.com/r/FortMcMurray/comments/tr6fsa/activities_and_leagues/,Activities and leagues,/r/FortMcMurray/comments/tr6fsa/activities_and_leagues/i2uo8ht/,1,r/FortMcMurray,0,1
Suncor,t2_nadm7,A-Potts,0,1648732198.0,0,t1_i2ud2l9,i2ud2l9,True,[deleted],t3_tsz96c,https://www.reddit.com/r/FortMcMurray/comments/tsz96c/most_recognizable_oil_company_in_fort_mac/,Most recognizable oil company in Fort Mac?,/r/FortMcMurray/comments/tsz96c/most_recognizable_oil_company_in_fort_mac/i2ud2l9/,3,r/FortMcMurray,0,3
Need more help ? What’s the position? I can do 10.30-2.30? I need more detail,t2_25x7f25s,nalimoo,0,1648702705.0,0,t1_i2t84n8,i2t84n8,True,tdlm40,t3_t7pv06,https://www.reddit.com/r/FortMcMurray/comments/t7pv06/need_casino_volunteers_for_april_11th_and_12th/,Need Casino Volunteers for April 11th and 12th,/r/FortMcMurray/comments/t7pv06/need_casino_volunteers_for_april_11th_and_12th/i2t84n8/,1,r/FortMcMurray,0,1
Check out Macdonald Island. They usually have stuff on the go.,t2_162sjm,barackobona,0,1648593976.0,0,t1_i2mpt7o,i2mpt7o,True,OnceWholeSoul,t3_tr6fsa,https://www.reddit.com/r/FortMcMurray/comments/tr6fsa/activities_and_leagues/,Activities and leagues,/r/FortMcMurray/comments/tr6fsa/activities_and_leagues/i2mpt7o/,2,r/FortMcMurray,0,2
Go to a track if you want to race. Get a dirt bike or something. You shouldn't do it on public roads.,t2_5yna8,Zebleblic,0,1648589696.0,0,t1_i2mbp3e,i2mbp3e,False,[deleted],t3_trkkh7,https://www.reddit.com/r/FortMcMurray/comments/trkkh7/i_was_messing_around_with_my_friend_and_went/,I was messing around with my friend and went 125kmh or so on highway 63 (70 zone) on the way back from timberlea at 2:30 pm. Are there any chances I was caught going that fast? And what kind of trouble would I get in?,/r/FortMcMurray/comments/trkkh7/i_was_messing_around_with_my_friend_and_went/i2mbp3e/,1,r/FortMcMurray,0,1
"Depends on the judge. People have lost their liscense for 5 years because of antics like that. Now keep in mind you only have 8 demerits you can lose before immediate suspension. 50 over the limit is 6. You'll get slapped with a reckless driving charge too (because NO cop will be lenient with you) bringing you to a total of 12 points. There's the possibility of jail time too. And if by some sort of mercy and you keep your liscense, your insurance will go through the roof. You wouldn't be able to afford to drive anyways. A rust bucket Camry from the late 90's could cost you 5k a year.",t2_fsy1far,Eulsam-FZ,0,1648589601.0,0,t1_i2mb95v,i2mb95v,False,[deleted],t3_trkkh7,https://www.reddit.com/r/FortMcMurray/comments/trkkh7/i_was_messing_around_with_my_friend_and_went/,I was messing around with my friend and went 125kmh or so on highway 63 (70 zone) on the way back from timberlea at 2:30 pm. Are there any chances I was caught going that fast? And what kind of trouble would I get in?,/r/FortMcMurray/comments/trkkh7/i_was_messing_around_with_my_friend_and_went/i2mb95v/,1,r/FortMcMurray,0,1
Okay so I don’t think I was near any cameras. But I am fully aware of my bad decision. And I definitely will not be doing it again.,t2_5easwyma,The1Rocket1579,0,1648589562.0,0,t1_i2mb52x,i2mb52x,False,[deleted],t3_trkkh7,https://www.reddit.com/r/FortMcMurray/comments/trkkh7/i_was_messing_around_with_my_friend_and_went/,I was messing around with my friend and went 125kmh or so on highway 63 (70 zone) on the way back from timberlea at 2:30 pm. Are there any chances I was caught going that fast? And what kind of trouble would I get in?,/r/FortMcMurray/comments/trkkh7/i_was_messing_around_with_my_friend_and_went/i2mb52x/,2,r/FortMcMurray,0,2
"There are various degrees of dangerous driving. The most serious form is dangerous driving causing death. If convicted of this offence, you could be served a maximum of 14 years imprisonment (punishment in which an individual stay for a specified time period in jail) and your licence will be suspended for 5 years. The second most serious dangerous driving offence is dangerous driving causing bodily harm. If found guilty of this crime you may be sentence with imprisonment not exceeding 10 years and a 5 year licence suspension. Those who do not kill or injure anyone while dangerously driving, but operate their vehicles in a manner dangerous to public safety face a maximum of five years imprisonment and a one year suspension of their licence.",t2_5yna8,Zebleblic,0,1648589457.0,0,t1_i2mavv9,i2mavv9,False,[deleted],t3_trkkh7,https://www.reddit.com/r/FortMcMurray/comments/trkkh7/i_was_messing_around_with_my_friend_and_went/,I was messing around with my friend and went 125kmh or so on highway 63 (70 zone) on the way back from timberlea at 2:30 pm. Are there any chances I was caught going that fast? And what kind of trouble would I get in?,/r/FortMcMurray/comments/trkkh7/i_was_messing_around_with_my_friend_and_went/i2mavv9/,2,r/FortMcMurray,0,2
Oh damn okay. I’m not going to race anymore then haha…,t2_5easwyma,The1Rocket1579,0,1648589218.0,0,t1_i2maans,i2maans,False,[deleted],t3_trkkh7,https://www.reddit.com/r/FortMcMurray/comments/trkkh7/i_was_messing_around_with_my_friend_and_went/,I was messing around with my friend and went 125kmh or so on highway 63 (70 zone) on the way back from timberlea at 2:30 pm. Are there any chances I was caught going that fast? And what kind of trouble would I get in?,/r/FortMcMurray/comments/trkkh7/i_was_messing_around_with_my_friend_and_went/i2maans/,1,r/FortMcMurray,0,1
"Those who do not kill or injure anyone while dangerously driving, but operate their vehicles in a manner dangerous to public safety face a maximum of five years imprisonment and a one year suspension of their licence.",t2_5yna8,Zebleblic,0,1648589178.0,0,t1_i2ma74k,i2ma74k,False,[deleted],t3_trkkh7,https://www.reddit.com/r/FortMcMurray/comments/trkkh7/i_was_messing_around_with_my_friend_and_went/,I was messing around with my friend and went 125kmh or so on highway 63 (70 zone) on the way back from timberlea at 2:30 pm. Are there any chances I was caught going that fast? And what kind of trouble would I get in?,/r/FortMcMurray/comments/trkkh7/i_was_messing_around_with_my_friend_and_went/i2ma74k/,2,r/FortMcMurray,0,2
Oh boy,t2_5easwyma,The1Rocket1579,0,1648588819.0,0,t1_i2m93c1,i2m93c1,False,[deleted],t3_trkkh7,https://www.reddit.com/r/FortMcMurray/comments/trkkh7/i_was_messing_around_with_my_friend_and_went/,I was messing around with my friend and went 125kmh or so on highway 63 (70 zone) on the way back from timberlea at 2:30 pm. Are there any chances I was caught going that fast? And what kind of trouble would I get in?,/r/FortMcMurray/comments/trkkh7/i_was_messing_around_with_my_friend_and_went/i2m93c1/,1,r/FortMcMurray,0,1
"Look at mix103.7 for the camera locations.   
I think you will just get a hefty ticket of the camera caught you
 
If the cops caught you while you were speeding you would have to appear before a judge I believe. Possible suspension of license and probably several tickets.",t2_c5yotdny,Tommy_Douglas_AB,0,1648588798.0,0,t1_i2m91hh,i2m91hh,True,[deleted],t3_trkkh7,https://www.reddit.com/r/FortMcMurray/comments/trkkh7/i_was_messing_around_with_my_friend_and_went/,I was messing around with my friend and went 125kmh or so on highway 63 (70 zone) on the way back from timberlea at 2:30 pm. Are there any chances I was caught going that fast? And what kind of trouble would I get in?,/r/FortMcMurray/comments/trkkh7/i_was_messing_around_with_my_friend_and_went/i2m91hh/,3,r/FortMcMurray,0,3
Do you know for how long? I’m only 17,t2_5easwyma,The1Rocket1579,0,1648588794.0,0,t1_i2m915n,i2m915n,False,[deleted],t3_trkkh7,https://www.reddit.com/r/FortMcMurray/comments/trkkh7/i_was_messing_around_with_my_friend_and_went/,I was messing around with my friend and went 125kmh or so on highway 63 (70 zone) on the way back from timberlea at 2:30 pm. Are there any chances I was caught going that fast? And what kind of trouble would I get in?,/r/FortMcMurray/comments/trkkh7/i_was_messing_around_with_my_friend_and_went/i2m915n/,1,r/FortMcMurray,0,1
They could take your license. It's dangerous driving since you were going over 50km above the speed limit.,t2_5yna8,Zebleblic,0,1648588772.0,0,t1_i2m8z21,i2m8z21,True,[deleted],t3_trkkh7,https://www.reddit.com/r/FortMcMurray/comments/trkkh7/i_was_messing_around_with_my_friend_and_went/,I was messing around with my friend and went 125kmh or so on highway 63 (70 zone) on the way back from timberlea at 2:30 pm. Are there any chances I was caught going that fast? And what kind of trouble would I get in?,/r/FortMcMurray/comments/trkkh7/i_was_messing_around_with_my_friend_and_went/i2m8z21/,1,r/FortMcMurray,0,1
"I think I saw a sign for an archery club by the airport. Probably contact the bowling alley for a club. Curling is probably finishing up, but maybe it goes all year?",t2_5yna8,Zebleblic,0,1648576817.0,0,t1_i2ldhhc,i2ldhhc,True,OnceWholeSoul,t3_tr6fsa,https://www.reddit.com/r/FortMcMurray/comments/tr6fsa/activities_and_leagues/,Activities and leagues,/r/FortMcMurray/comments/tr6fsa/activities_and_leagues/i2ldhhc/,2,r/FortMcMurray,0,2
Omg I am an idiot. I read that as tires. Try Amazon.,t2_e2wk0lwq,ThunderTheUnicorn,0,1648526231.0,0,t1_i2ivuzv,i2ivuzv,False,Ok_Sea_7116,t3_tqizo3,https://www.reddit.com/r/FortMcMurray/comments/tqizo3/anyone_know_who_sells_ties_marks_apparently/,"anyone know who sells ties? Mark's apparently doesn't stock them anymore, and the formal place in the mall is pretty much out of stock",/r/FortMcMurray/comments/tqizo3/anyone_know_who_sells_ties_marks_apparently/i2ivuzv/,5,r/FortMcMurray,0,5
Walmart!,t2_a12oiga3,living_with_less,0,1648523128.0,0,t1_i2iq9rt,i2iq9rt,True,YellowBlackBrown,t3_sev9yo,https://www.reddit.com/r/FortMcMurray/comments/sev9yo/sour_grape_or_big_foot_candy/,Sour Grape or Big Foot candy,/r/FortMcMurray/comments/sev9yo/sour_grape_or_big_foot_candy/i2iq9rt/,1,r/FortMcMurray,0,1
Garage sales are amazing here once it warms up :),t2_a12oiga3,living_with_less,0,1648523063.0,0,t1_i2iq5fh,i2iq5fh,True,EskimoCheeks,t3_t0kayk,https://www.reddit.com/r/FortMcMurray/comments/t0kayk/links_for_marketplace_items/,Links for marketplace items?,/r/FortMcMurray/comments/t0kayk/links_for_marketplace_items/i2iq5fh/,2,r/FortMcMurray,0,2
What about Kal Tire? I went there a few years ago and I found them good.,t2_e2wk0lwq,ThunderTheUnicorn,0,1648510773.0,0,t1_i2i1eld,i2i1eld,True,Ok_Sea_7116,t3_tqizo3,https://www.reddit.com/r/FortMcMurray/comments/tqizo3/anyone_know_who_sells_ties_marks_apparently/,"anyone know who sells ties? Mark's apparently doesn't stock them anymore, and the formal place in the mall is pretty much out of stock",/r/FortMcMurray/comments/tqizo3/anyone_know_who_sells_ties_marks_apparently/i2i1eld/,5,r/FortMcMurray,0,5
"The Sally Ann (Salvation Army)

Is it for 1 event? Maybe someone can lend you one.",t2_13uvy7,mikesphone1979,0,1648503035.0,0,t1_i2hlo1g,i2hlo1g,True,Ok_Sea_7116,t3_tqizo3,https://www.reddit.com/r/FortMcMurray/comments/tqizo3/anyone_know_who_sells_ties_marks_apparently/,"anyone know who sells ties? Mark's apparently doesn't stock them anymore, and the formal place in the mall is pretty much out of stock",/r/FortMcMurray/comments/tqizo3/anyone_know_who_sells_ties_marks_apparently/i2hlo1g/,5,r/FortMcMurray,0,5
Amazon?,t2_be57v,alzhang8,0,1648501712.0,0,t1_i2him9f,i2him9f,True,Ok_Sea_7116,t3_tqizo3,https://www.reddit.com/r/FortMcMurray/comments/tqizo3/anyone_know_who_sells_ties_marks_apparently/,"anyone know who sells ties? Mark's apparently doesn't stock them anymore, and the formal place in the mall is pretty much out of stock",/r/FortMcMurray/comments/tqizo3/anyone_know_who_sells_ties_marks_apparently/i2him9f/,3,r/FortMcMurray,0,3
WalMart?,t2_7vzu1wnj,northbound_down,0,1648500674.0,0,t1_i2hg1wo,i2hg1wo,True,Ok_Sea_7116,t3_tqizo3,https://www.reddit.com/r/FortMcMurray/comments/tqizo3/anyone_know_who_sells_ties_marks_apparently/,"anyone know who sells ties? Mark's apparently doesn't stock them anymore, and the formal place in the mall is pretty much out of stock",/r/FortMcMurray/comments/tqizo3/anyone_know_who_sells_ties_marks_apparently/i2hg1wo/,3,r/FortMcMurray,0,3
My wife and I really enjoy oatcompany.com. They do free local delivery over $25. They make great snacks for work.,t2_dpldh,espizzle,0,1648312744.0,0,t1_i27jief,i27jief,True,EskimoCheeks,t3_tkdjh5,https://www.reddit.com/r/FortMcMurray/comments/tkdjh5/food_prepeasy_meals_for_site_workers/,food prep/easy meals for site workers?,/r/FortMcMurray/comments/tkdjh5/food_prepeasy_meals_for_site_workers/i27jief/,1,r/FortMcMurray,0,1
Check the Fort McMurray Buy and Sell Facebook page. There’s a few sellers who make ready to go meals out of their homes. I haven’t tried them myself but the reviews are great,t2_g6fgr,Moghlannak,0,1647991225.0,0,t1_i1q6ufe,i1q6ufe,True,EskimoCheeks,t3_tkdjh5,https://www.reddit.com/r/FortMcMurray/comments/tkdjh5/food_prepeasy_meals_for_site_workers/,food prep/easy meals for site workers?,/r/FortMcMurray/comments/tkdjh5/food_prepeasy_meals_for_site_workers/i1q6ufe/,2,r/FortMcMurray,0,2
Facebook have some stuff,t2_be57v,alzhang8,0,1647985259.0,0,t1_i1psgqw,i1psgqw,True,EskimoCheeks,t3_tkdjh5,https://www.reddit.com/r/FortMcMurray/comments/tkdjh5/food_prepeasy_meals_for_site_workers/,food prep/easy meals for site workers?,/r/FortMcMurray/comments/tkdjh5/food_prepeasy_meals_for_site_workers/i1psgqw/,2,r/FortMcMurray,0,2
"Dedicate
Eat clean
And for Newfie goodness AT express Meals.",t2_c5yotdny,Tommy_Douglas_AB,0,1647985235.0,0,t1_i1psekt,i1psekt,True,EskimoCheeks,t3_tkdjh5,https://www.reddit.com/r/FortMcMurray/comments/tkdjh5/food_prepeasy_meals_for_site_workers/,food prep/easy meals for site workers?,/r/FortMcMurray/comments/tkdjh5/food_prepeasy_meals_for_site_workers/i1psekt/,5,r/FortMcMurray,0,5
Loc 1325 carpenters is accepting new members.  I hear there is a three year contract with CBS manning up soon. Would be an excellent time to start an apprenticeship.,t2_2cgsbq9g,GldnD,0,1647955549.0,0,t1_i1npglp,i1npglp,True,Potential_Schedule97,t3_tjffyp,https://www.reddit.com/r/FortMcMurray/comments/tjffyp/which_is_the_safest_area_to_live_in_in_fort/,which is the safest area to live in In fort McMurray. Would it be difficult to get a job in the oil sands as a female without any experience?,/r/FortMcMurray/comments/tjffyp/which_is_the_safest_area_to_live_in_in_fort/i1npglp/,3,r/FortMcMurray,0,3
Search up women building future. I think Keyano college have partnerships with oilsand player through that pipeline.,t2_c3yqm,543254447,0,1647921580.0,0,t1_i1me54k,i1me54k,True,Potential_Schedule97,t3_tjffyp,https://www.reddit.com/r/FortMcMurray/comments/tjffyp/which_is_the_safest_area_to_live_in_in_fort/,which is the safest area to live in In fort McMurray. Would it be difficult to get a job in the oil sands as a female without any experience?,/r/FortMcMurray/comments/tjffyp/which_is_the_safest_area_to_live_in_in_fort/i1me54k/,4,r/FortMcMurray,0,4
"Like others have said there isn’t really an unsafe area here but imo thickwood or abasand are great areas. And like others have said the contractors will hire you without experience 
Though you may need a ticket or two before starting such as your construction safety training cert which is an online thing. We’re hiring where I work rn lots of ot and a 7-7 schedule. Dm me for more info if you like",t2_iip0bcm,TheNorthNova01,0,1647896408.0,0,t1_i1kv2i6,i1kv2i6,True,Potential_Schedule97,t3_tjffyp,https://www.reddit.com/r/FortMcMurray/comments/tjffyp/which_is_the_safest_area_to_live_in_in_fort/,which is the safest area to live in In fort McMurray. Would it be difficult to get a job in the oil sands as a female without any experience?,/r/FortMcMurray/comments/tjffyp/which_is_the_safest_area_to_live_in_in_fort/i1kv2i6/,7,r/FortMcMurray,0,7
"I don't think Nina operates in fort McMurray unless that had changed recently, which is possible. 

Add to this list Christina River Construction, Thompson Brothers, KMC, Fort Mckay group of companies, CEDA, Ketek.",t2_c5yotdny,Tommy_Douglas_AB,0,1647887984.0,0,t1_i1ka0z9,i1ka0z9,False,Potential_Schedule97,t3_tjffyp,https://www.reddit.com/r/FortMcMurray/comments/tjffyp/which_is_the_safest_area_to_live_in_in_fort/,which is the safest area to live in In fort McMurray. Would it be difficult to get a job in the oil sands as a female without any experience?,/r/FortMcMurray/comments/tjffyp/which_is_the_safest_area_to_live_in_in_fort/i1ka0z9/,7,r/FortMcMurray,0,7
"I would search to see if any of the sites have special programs for hiring females. I have seen some in the past. 

Also you have a decent chance of being hired as a labourer or truck driver  with a contractor right now. They are looking for employees.  

Most areas are quite safe though I know some females that don't want to love downtown. There is more homelessness and what not but it is still safe.",t2_c5yotdny,Tommy_Douglas_AB,0,1647887308.0,0,t1_i1k8ban,i1k8ban,True,Potential_Schedule97,t3_tjffyp,https://www.reddit.com/r/FortMcMurray/comments/tjffyp/which_is_the_safest_area_to_live_in_in_fort/,which is the safest area to live in In fort McMurray. Would it be difficult to get a job in the oil sands as a female without any experience?,/r/FortMcMurray/comments/tjffyp/which_is_the_safest_area_to_live_in_in_fort/i1k8ban/,5,r/FortMcMurray,0,5
"There's no real ""unsafe"" areas in Fort Mac. Stay away from living downtown maybe, but even that's not so bad.  
You can get jobs in the Oilsands without experience, but it depends on what you want to do. Many companies hire and train workers. For many of the operating jobs, all you need is a driver's license. Certainly try the contract companies; Clearstream, North American, Nuna, etc. They will be easier to get into without previous experience.",t2_bxyn5,slickrick668,0,1647886588.0,0,t1_i1k6fv7,i1k6fv7,True,Potential_Schedule97,t3_tjffyp,https://www.reddit.com/r/FortMcMurray/comments/tjffyp/which_is_the_safest_area_to_live_in_in_fort/,which is the safest area to live in In fort McMurray. Would it be difficult to get a job in the oil sands as a female without any experience?,/r/FortMcMurray/comments/tjffyp/which_is_the_safest_area_to_live_in_in_fort/i1k6fv7/,13,r/FortMcMurray,0,13
"Bears are all around here, havent personally seen any in Abasand. There were some bear traps just outside the building last year so one or 2 definitely got close at some point.",t2_7pqovnv8,Wittyndepressed,0,1647777543.0,0,t1_i1e76ay,i1e76ay,False,CalgaryJohn87,t3_ti7ebo,https://www.reddit.com/r/FortMcMurray/comments/ti7ebo/anyone_in_wildwood_estates/,Anyone in Wildwood estates?,/r/FortMcMurray/comments/ti7ebo/anyone_in_wildwood_estates/i1e76ay/,2,r/FortMcMurray,0,2
You see alot of Bears around there?,t2_c03zy6wz,CalgaryJohn87,0,1647750971.0,0,t1_i1d9vfk,i1d9vfk,False,CalgaryJohn87,t3_ti7ebo,https://www.reddit.com/r/FortMcMurray/comments/ti7ebo/anyone_in_wildwood_estates/,Anyone in Wildwood estates?,/r/FortMcMurray/comments/ti7ebo/anyone_in_wildwood_estates/i1d9vfk/,1,r/FortMcMurray,0,1
Thank you very much,t2_c03zy6wz,CalgaryJohn87,0,1647750961.0,0,t1_i1d9uu3,i1d9uu3,False,CalgaryJohn87,t3_ti7ebo,https://www.reddit.com/r/FortMcMurray/comments/ti7ebo/anyone_in_wildwood_estates/,Anyone in Wildwood estates?,/r/FortMcMurray/comments/ti7ebo/anyone_in_wildwood_estates/i1d9uu3/,1,r/FortMcMurray,0,1
"Im in there with a leveled 1/2 ton, fits easy. A couple GM HDs stock height, they sure look to be pretty close but they can obviously still get in and out",t2_7pqovnv8,Wittyndepressed,0,1647749121.0,0,t1_i1d6t4l,i1d6t4l,True,CalgaryJohn87,t3_ti7ebo,https://www.reddit.com/r/FortMcMurray/comments/ti7ebo/anyone_in_wildwood_estates/,Anyone in Wildwood estates?,/r/FortMcMurray/comments/ti7ebo/anyone_in_wildwood_estates/i1d6t4l/,1,r/FortMcMurray,0,1
Thank you,t2_c03zy6wz,CalgaryJohn87,0,1647745319.0,0,t1_i1d00ci,i1d00ci,False,CalgaryJohn87,t3_ti7ebo,https://www.reddit.com/r/FortMcMurray/comments/ti7ebo/anyone_in_wildwood_estates/,Anyone in Wildwood estates?,/r/FortMcMurray/comments/ti7ebo/anyone_in_wildwood_estates/i1d00ci/,1,r/FortMcMurray,0,1
"A regular truck could fit, I have a couple of dodge rams in my parkade. Anything lifted / levelled won't though!! Had a friend who could not fit his lifted truck.",t2_8mikv1xk,Accomplished-Ear-943,0,1647741768.0,0,t1_i1ct6ou,i1ct6ou,True,CalgaryJohn87,t3_ti7ebo,https://www.reddit.com/r/FortMcMurray/comments/ti7ebo/anyone_in_wildwood_estates/,Anyone in Wildwood estates?,/r/FortMcMurray/comments/ti7ebo/anyone_in_wildwood_estates/i1ct6ou/,2,r/FortMcMurray,0,2
Direct workwear 10 percent off with site ID,t2_83ucncb6,AnyAdministration657,0,1646954012.0,0,t1_i065ppu,i065ppu,True,ineedanativan,t3_tb617p,https://www.reddit.com/r/FortMcMurray/comments/tb617p/site_discounts/,site discounts,/r/FortMcMurray/comments/tb617p/site_discounts/i065ppu/,2,r/FortMcMurray,0,2
"not sure, but

lol @ user name

I took 6 once.",t2_13uvy7,mikesphone1979,0,1646945186.0,0,t1_i05k0se,i05k0se,True,ineedanativan,t3_tb617p,https://www.reddit.com/r/FortMcMurray/comments/tb617p/site_discounts/,site discounts,/r/FortMcMurray/comments/tb617p/site_discounts/i05k0se/,4,r/FortMcMurray,0,4
"This is the advice I was given when I started out of high school and I didn’t take it. 
I just want those who are young and have minimal experience in this type of environment to know what they’re getting themselves into. It’s a lot of money and a ton of stress. When I dropped out at 20 I had gained 40 pounds and felt so incredibly low about myself.  
When I went to keyano we started out with about 70 students and less than 20 graduated.  Nursing is one of the hardest degrees to finish and not because of the content. Just want them going into it with their eyes wide open to what it’s like.

Edit: I think my reaction came off a bit more hostile than it should have been. The remarks about it being easier than biochem hit a nerve because I’ve met plenty of people who think this an easy science program.",t2_84w6lsmm,sjm0111,0,1646846183.0,0,t1_hzzt3he,hzzt3he,False,hardfeed_lol,t3_t0zeof,https://www.reddit.com/r/FortMcMurray/comments/t0zeof/chances_of_getting_into_keyano_college_nursing/,Chances of getting into keyano college nursing,/r/FortMcMurray/comments/t0zeof/chances_of_getting_into_keyano_college_nursing/hzzt3he/,1,r/FortMcMurray,0,1
