body,author_fullname,author.name,controversiality,created,downs,fullname,id,is_root,link_author,link_id,link_permalink,link_title,permalink,score,subreddit_name_prefixed,total_awards_received,ups
Keep pushing your fucking luck bud.,t2_dnp8v0xb,CopPornFart,0,1637256044.0,0,t1_hl55xcq,hl55xcq,False,Canuckistanni,t3_qwac6s,https://www.reddit.com/r/FortMcMurray/comments/qwac6s/this_is_never_going_to_stop/,This is never going to stop,/r/FortMcMurray/comments/qwac6s/this_is_never_going_to_stop/hl55xcq/,1,r/FortMcMurray,0,1
"Watch your mouth, cunt.",t2_dnp8v0xb,CopPornFart,0,1637256008.0,0,t1_hl55u2g,hl55u2g,False,Canuckistanni,t3_qwac6s,https://www.reddit.com/r/FortMcMurray/comments/qwac6s/this_is_never_going_to_stop/,This is never going to stop,/r/FortMcMurray/comments/qwac6s/this_is_never_going_to_stop/hl55u2g/,1,r/FortMcMurray,0,1
Heyy,t2_2oy81bw5,CalgarianSickcunt,0,1637255660.0,0,t1_hl54yam,hl54yam,False,[deleted],t3_qvevxa,https://www.reddit.com/r/FortMcMurray/comments/qvevxa/making_a_friend_group_here_in_fort/,Making a friend group here in Fort,/r/FortMcMurray/comments/qvevxa/making_a_friend_group_here_in_fort/hl54yam/,1,r/FortMcMurray,0,1
"You’re right, it’s never going to end. It’s a new form of flu, just worse. No amount of masking is going to completely stop it. Best of luck bud.",t2_dnp8v0xb,CopPornFart,1,1637255381.0,0,t1_hl548tp,hl548tp,True,Canuckistanni,t3_qwac6s,https://www.reddit.com/r/FortMcMurray/comments/qwac6s/this_is_never_going_to_stop/,This is never going to stop,/r/FortMcMurray/comments/qwac6s/this_is_never_going_to_stop/hl548tp/,1,r/FortMcMurray,0,1
"If you are vaccinated and you have a mask on why should you care?

Oh right, because this post is about self righteousness.",t2_iy1f5,therealjchrist,1,1637253157.0,0,t1_hl4ykdx,hl4ykdx,True,Canuckistanni,t3_qwac6s,https://www.reddit.com/r/FortMcMurray/comments/qwac6s/this_is_never_going_to_stop/,This is never going to stop,/r/FortMcMurray/comments/qwac6s/this_is_never_going_to_stop/hl4ykdx/,2,r/FortMcMurray,0,2
And unvaxxinated.,t2_5yna8,Zebleblic,0,1637252621.0,0,t1_hl4x817,hl4x817,False,Canuckistanni,t3_qwac6s,https://www.reddit.com/r/FortMcMurray/comments/qwac6s/this_is_never_going_to_stop/,This is never going to stop,/r/FortMcMurray/comments/qwac6s/this_is_never_going_to_stop/hl4x817/,3,r/FortMcMurray,0,3
"They may swing in and then get discharged. Every drug has side effects. If you gave any drug to everyone some people are going to have issues with it. Hell, if you gave everyone strawberries some of them would die from it.",t2_5yna8,Zebleblic,0,1637251205.0,0,t1_hl4to5j,hl4to5j,False,Canuckistanni,t3_qwac6s,https://www.reddit.com/r/FortMcMurray/comments/qwac6s/this_is_never_going_to_stop/,This is never going to stop,/r/FortMcMurray/comments/qwac6s/this_is_never_going_to_stop/hl4to5j/,1,r/FortMcMurray,0,1
"Orrr you're retarded. I've talked to many hospital staff about it. The people hospitalized at least up to this point are old, fat, high blood pressure, and diabetes.",t2_5yna8,Zebleblic,0,1637251077.0,0,t1_hl4tcka,hl4tcka,False,Canuckistanni,t3_qwac6s,https://www.reddit.com/r/FortMcMurray/comments/qwac6s/this_is_never_going_to_stop/,This is never going to stop,/r/FortMcMurray/comments/qwac6s/this_is_never_going_to_stop/hl4tcka/,3,r/FortMcMurray,0,3
Hi,t2_1exqxyyy,troglobite45,0,1637251056.0,0,t1_hl4tanb,hl4tanb,True,[deleted],t3_qvevxa,https://www.reddit.com/r/FortMcMurray/comments/qvevxa/making_a_friend_group_here_in_fort/,Making a friend group here in Fort,/r/FortMcMurray/comments/qvevxa/making_a_friend_group_here_in_fort/hl4tanb/,1,r/FortMcMurray,0,1
Or you could read a book and learn not to be a moron.,t2_5yna8,Zebleblic,0,1637248671.0,0,t1_hl4nfjj,hl4nfjj,False,Canuckistanni,t3_qwac6s,https://www.reddit.com/r/FortMcMurray/comments/qwac6s/this_is_never_going_to_stop/,This is never going to stop,/r/FortMcMurray/comments/qwac6s/this_is_never_going_to_stop/hl4nfjj/,4,r/FortMcMurray,0,4
Go talk to the icu staff. That's not what they are seeing at all.,t2_5yna8,Zebleblic,0,1637248623.0,0,t1_hl4nbhc,hl4nbhc,False,Canuckistanni,t3_qwac6s,https://www.reddit.com/r/FortMcMurray/comments/qwac6s/this_is_never_going_to_stop/,This is never going to stop,/r/FortMcMurray/comments/qwac6s/this_is_never_going_to_stop/hl4nbhc/,1,r/FortMcMurray,0,1
You don't know what medicine we will have in the future. We could end up living forever.,t2_5yna8,Zebleblic,0,1637248466.0,0,t1_hl4my5o,hl4my5o,False,Canuckistanni,t3_qwac6s,https://www.reddit.com/r/FortMcMurray/comments/qwac6s/this_is_never_going_to_stop/,This is never going to stop,/r/FortMcMurray/comments/qwac6s/this_is_never_going_to_stop/hl4my5o/,2,r/FortMcMurray,0,2
Leave then nut job,t2_a32aaq62,Solarlace,1,1637247037.0,0,t1_hl4jlh2,hl4jlh2,False,Canuckistanni,t3_qwac6s,https://www.reddit.com/r/FortMcMurray/comments/qwac6s/this_is_never_going_to_stop/,This is never going to stop,/r/FortMcMurray/comments/qwac6s/this_is_never_going_to_stop/hl4jlh2/,1,r/FortMcMurray,0,1
Health mandates is so stupid sheep,t2_a32aaq62,Solarlace,0,1637246976.0,0,t1_hl4jg99,hl4jg99,True,Canuckistanni,t3_qwac6s,https://www.reddit.com/r/FortMcMurray/comments/qwac6s/this_is_never_going_to_stop/,This is never going to stop,/r/FortMcMurray/comments/qwac6s/this_is_never_going_to_stop/hl4jg99/,-3,r/FortMcMurray,0,-3
You can’t escape death my dude. Why are you so afraid?,t2_e81uc31s,nassybemsy,0,1637244440.0,0,t1_hl4dun1,hl4dun1,False,Canuckistanni,t3_qwac6s,https://www.reddit.com/r/FortMcMurray/comments/qwac6s/this_is_never_going_to_stop/,This is never going to stop,/r/FortMcMurray/comments/qwac6s/this_is_never_going_to_stop/hl4dun1/,-1,r/FortMcMurray,0,-1
"Technically 0. We sold at asking. Which is what we bought it for. That is the realistic value in the current downturn.

Unfortunately that is 150-200k less than what we would of hoped. 

On the bright side, we are walking away with quite a bit in equity. We have so many friends that had to take major losses and even bankruptcies. We're counting ourselves lucky.",t2_4kcwzkdw,Canuckistanni,0,1637240696.0,0,t1_hl46iuk,hl46iuk,False,Canuckistanni,t3_qwac6s,https://www.reddit.com/r/FortMcMurray/comments/qwac6s/this_is_never_going_to_stop/,This is never going to stop,/r/FortMcMurray/comments/qwac6s/this_is_never_going_to_stop/hl46iuk/,2,r/FortMcMurray,0,2
How much of a loss did you take on the sale of your home?,t2_4aeaxqk,barryzoey,0,1637237081.0,0,t1_hl40gqk,hl40gqk,True,Canuckistanni,t3_qwac6s,https://www.reddit.com/r/FortMcMurray/comments/qwac6s/this_is_never_going_to_stop/,This is never going to stop,/r/FortMcMurray/comments/qwac6s/this_is_never_going_to_stop/hl40gqk/,1,r/FortMcMurray,0,1
More money than brains in this town.,t2_5yna8,Zebleblic,0,1637233951.0,0,t1_hl3w39v,hl3w39v,True,Canuckistanni,t3_qwac6s,https://www.reddit.com/r/FortMcMurray/comments/qwac6s/this_is_never_going_to_stop/,This is never going to stop,/r/FortMcMurray/comments/qwac6s/this_is_never_going_to_stop/hl3w39v/,5,r/FortMcMurray,0,5
"Your retardedness is cringe, dickfore.",t2_5yna8,Zebleblic,0,1637233764.0,0,t1_hl3vu1e,hl3vu1e,False,Canuckistanni,t3_qwac6s,https://www.reddit.com/r/FortMcMurray/comments/qwac6s/this_is_never_going_to_stop/,This is never going to stop,/r/FortMcMurray/comments/qwac6s/this_is_never_going_to_stop/hl3vu1e/,1,r/FortMcMurray,0,1
"Hey come on, his grand father had his grade 3, his father had his grade 4, and he has his grade 6. A strong lineage or mentally deficiencies.",t2_5yna8,Zebleblic,0,1637233613.0,0,t1_hl3vmxa,hl3vmxa,False,Canuckistanni,t3_qwac6s,https://www.reddit.com/r/FortMcMurray/comments/qwac6s/this_is_never_going_to_stop/,This is never going to stop,/r/FortMcMurray/comments/qwac6s/this_is_never_going_to_stop/hl3vmxa/,1,r/FortMcMurray,0,1
Of course they can still catch it and spread it. It lessens the symptoms and helps stop hospitalizations. It's not a force field thay stops the virus from entering your body.,t2_5yna8,Zebleblic,0,1637233510.0,0,t1_hl3vi1d,hl3vi1d,False,Canuckistanni,t3_qwac6s,https://www.reddit.com/r/FortMcMurray/comments/qwac6s/this_is_never_going_to_stop/,This is never going to stop,/r/FortMcMurray/comments/qwac6s/this_is_never_going_to_stop/hl3vi1d/,2,r/FortMcMurray,0,2
You*,t2_5yna8,Zebleblic,0,1637233426.0,0,t1_hl3ve7d,hl3ve7d,False,Canuckistanni,t3_qwac6s,https://www.reddit.com/r/FortMcMurray/comments/qwac6s/this_is_never_going_to_stop/,This is never going to stop,/r/FortMcMurray/comments/qwac6s/this_is_never_going_to_stop/hl3ve7d/,-3,r/FortMcMurray,0,-3
That's most dumb fuck hicks in alberta.,t2_5yna8,Zebleblic,0,1637233405.0,0,t1_hl3vd9b,hl3vd9b,False,Canuckistanni,t3_qwac6s,https://www.reddit.com/r/FortMcMurray/comments/qwac6s/this_is_never_going_to_stop/,This is never going to stop,/r/FortMcMurray/comments/qwac6s/this_is_never_going_to_stop/hl3vd9b/,1,r/FortMcMurray,0,1
"No, you guys are just pants on head retarded.",t2_5yna8,Zebleblic,0,1637233336.0,0,t1_hl3va39,hl3va39,False,Canuckistanni,t3_qwac6s,https://www.reddit.com/r/FortMcMurray/comments/qwac6s/this_is_never_going_to_stop/,This is never going to stop,/r/FortMcMurray/comments/qwac6s/this_is_never_going_to_stop/hl3va39/,2,r/FortMcMurray,0,2
Look at this small dick hick,t2_5yna8,Zebleblic,0,1637233235.0,0,t1_hl3v5kl,hl3v5kl,False,Canuckistanni,t3_qwac6s,https://www.reddit.com/r/FortMcMurray/comments/qwac6s/this_is_never_going_to_stop/,This is never going to stop,/r/FortMcMurray/comments/qwac6s/this_is_never_going_to_stop/hl3v5kl/,1,r/FortMcMurray,0,1
"oh my....ok first off ""why wear a mask eh?""  I never said don't wear a mask, I do constantly and have two shots you're getting all riled up with someone on your side.

I questioned why OP was worried about kids specifically when we need to worry about everyone equally and if you're gonna cherry pick groups I would start with the ones with the most deaths, and that's a big if, I'm not saying do that but OP did cherry pick that age group.

Ya I looked up quickly and posted anything just to get a ball rolling on some numbers of anything versus us just saying random facts with no bearing on them, I wasn't preaching that link like the gospel.

Ya I questioned your credibility, am I not allowed to?  I have no idea who you are or where you you learned such things.

Yes I read the whole article.  The article didn't go against anything I've been getting at.  In the same article US crossed 700,000 deaths, 520 of them children.  I saw you liked to throw out that 840,000 children contracting number out there.  Well if 699,480 non children died of covid, I wonder what the drastically high number of that same group just contracting it is.

I really don't understand you getting all pissed off and saying fuck you to me, like chill out bud.  You're like confusing me just speaking numbers and logic to thinking that means I don't care about children dying or something, like what the hell.",t2_14iud4,YellowBlackBrown,0,1637217893.0,0,t1_hl3c4xq,hl3c4xq,False,Canuckistanni,t3_qwac6s,https://www.reddit.com/r/FortMcMurray/comments/qwac6s/this_is_never_going_to_stop/,This is never going to stop,/r/FortMcMurray/comments/qwac6s/this_is_never_going_to_stop/hl3c4xq/,1,r/FortMcMurray,0,1
"What I'm trying to show is your argument is the most typical unempathetic argument out there. 

You begin by questioning why the OP would be worried about children in regards to COVID when its seniors who succumb to the virus in comparison. 

Then you begin to post links from a year ago from news outlets that have no credibility to support your narrative. 
Then you begin to question my credibility.

So I posted an article (which I baited you to read) from one of the #1 most reliable news outlets.  You then decided to reject everything in that article except those numbers that support your narrative.
I'm trying to show you that no matter what you read you'll always look for ANYTHING to support your claim. 

Listen no matter what I say you'll never trust it... 
So what I'm trying to say... Is yes.. fuck you.
For trying to create the argument around should people care about kids if only less than 1% are hospitalized. 

Here's what you left out from that article.. cause it didn't fit your argument..

""Her son is one of more than 840,000 children under the age of four to contract COVID-19 in the United States since the beginning of the pandemic""

And 

""By late Tuesday night, he was intubated and heavily sedated, wrapped in his baby blanket with his favorite Paw Patrol stuffed animal at hand.""

Ya....why wear a mask eh?",t2_15sjn3,silverfox5115,0,1637216357.0,0,t1_hl39x4j,hl39x4j,False,Canuckistanni,t3_qwac6s,https://www.reddit.com/r/FortMcMurray/comments/qwac6s/this_is_never_going_to_stop/,This is never going to stop,/r/FortMcMurray/comments/qwac6s/this_is_never_going_to_stop/hl39x4j/,1,r/FortMcMurray,0,1
"Man what are you getting at here, fuck me? why

I know young children die from it and its horrible and I wouldn't wish that on anyone, I wasn't speaking on that at all, I don't even understand why you're bring that up.

I'm just questioning the numbers of how many people get it from each age group.

Your link didn't convey anything about me asking to back up your statement of just saying ""that would be seniors and children""

Hell, in the link you just sent me there is a part saying ""Hospitalizations like Adrian's remain rare: less than 1% of children with reported cases of COVID-19 are hospitalized and children account for 2.5% of all COVID-19 related hospitalizations, according to the American Academy of Pediatrics.""",t2_14iud4,YellowBlackBrown,0,1637214118.0,0,t1_hl36ha5,hl36ha5,False,Canuckistanni,t3_qwac6s,https://www.reddit.com/r/FortMcMurray/comments/qwac6s/this_is_never_going_to_stop/,This is never going to stop,/r/FortMcMurray/comments/qwac6s/this_is_never_going_to_stop/hl36ha5/,0,r/FortMcMurray,0,0
Fak least I ain't scared of a little mask,t2_15sjn3,silverfox5115,0,1637212730.0,0,t1_hl3453v,hl3453v,False,Canuckistanni,t3_qwac6s,https://www.reddit.com/r/FortMcMurray/comments/qwac6s/this_is_never_going_to_stop/,This is never going to stop,/r/FortMcMurray/comments/qwac6s/this_is_never_going_to_stop/hl3453v/,3,r/FortMcMurray,0,3
Scared of your shadow,t2_e81uc31s,nassybemsy,0,1637212641.0,0,t1_hl33zoq,hl33zoq,False,Canuckistanni,t3_qwac6s,https://www.reddit.com/r/FortMcMurray/comments/qwac6s/this_is_never_going_to_stop/,This is never going to stop,/r/FortMcMurray/comments/qwac6s/this_is_never_going_to_stop/hl33zoq/,-2,r/FortMcMurray,0,-2
"https://www.reuters.com/world/us/illinois-toddler-fights-his-life-covid-transmission-rages-2021-10-06/

Here you want to start telling me kids aren't getting it or aren't succumbing to it?? 

2 yr old fighting for his life back in October of 2021... 
You wanna tell me he's 1 out of a million? Fuck you ... He's still a kid... Innocent life. All cause people think they're entitled to their rights. 
Well kids are entitled to their life and health. So people need to shut up stop being pussies and put on a mask.",t2_15sjn3,silverfox5115,0,1637212019.0,0,t1_hl32wnu,hl32wnu,False,Canuckistanni,t3_qwac6s,https://www.reddit.com/r/FortMcMurray/comments/qwac6s/this_is_never_going_to_stop/,This is never going to stop,/r/FortMcMurray/comments/qwac6s/this_is_never_going_to_stop/hl32wnu/,1,r/FortMcMurray,0,1
"I said for what it’s worth, I wasn’t coming out saying those stats were upheld by anyone.

You simply just said “that would be seniors and children”

Ok based on what?  That’s the main point of this entire conversation.",t2_14iud4,YellowBlackBrown,0,1637211889.0,0,t1_hl32ok9,hl32ok9,False,Canuckistanni,t3_qwac6s,https://www.reddit.com/r/FortMcMurray/comments/qwac6s/this_is_never_going_to_stop/,This is never going to stop,/r/FortMcMurray/comments/qwac6s/this_is_never_going_to_stop/hl32ok9/,1,r/FortMcMurray,0,1
"Omg....🤦🏼‍♀️🤦🏼‍♀️🤦🏼‍♀️ Listen of you're going to start posting links for ""stats"" that cater to your god damn narrative... Could you at least not post one from March of 20fucking20...

Jesus I thought I was going to be able to have a nice discussion here.",t2_15sjn3,silverfox5115,0,1637211602.0,0,t1_hl32666,hl32666,False,Canuckistanni,t3_qwac6s,https://www.reddit.com/r/FortMcMurray/comments/qwac6s/this_is_never_going_to_stop/,This is never going to stop,/r/FortMcMurray/comments/qwac6s/this_is_never_going_to_stop/hl32666/,1,r/FortMcMurray,0,1
"I see where you’re coming from and everything but this is all based around the your statement firstly of “that would be seniors and children” okay, where is that coming from? What is that based off?

Doing a quick search for what it’s worth this was the first link that came up for me.

https://www.statnews.com/2020/03/03/who-is-getting-sick-and-how-sick-a-breakdown-of-coronavirus-risk-by-demographic-factors/

That favours pretty heavy on older generations being the easier to get it.

Or would you be getting at kids get, pass it on then become clear of it all within a period of not even knowing or having any symptoms.  I can see that angle.",t2_14iud4,YellowBlackBrown,0,1637211085.0,0,t1_hl3196a,hl3196a,False,Canuckistanni,t3_qwac6s,https://www.reddit.com/r/FortMcMurray/comments/qwac6s/this_is_never_going_to_stop/,This is never going to stop,/r/FortMcMurray/comments/qwac6s/this_is_never_going_to_stop/hl3196a/,0,r/FortMcMurray,0,0
"Ok I didn't ask about ""succumbing"" to the virus but just more susceptible to getting it but I'll take that tid bit and run with it for you. 

Yes, it's shown that Seniors are more susceptible to succumbing to the virus when this all began. 
Children were thought to be ""safe"" in the general terms of things. 

But I asked who's more susceptible... That would be seniors and children. Children have a knack of carrying this virus and spreading it (not their fault), 
Especially when it came to school. Schools were shut down and sent online for ... How long? Half a year? 
That's a long time for a school year to go online.. that's a lot of parents who had to stay home. Not to mention domestic violence went up by 75% during those times.... And don't think people just beat their spouses. Maybe that school was a safe place for that kid or only place they could get food or away from an abusive/neglectful household. 

So it's not just... Think of the children getting the virus and dying when you don't wear that mask and risk them getting it and spreading it.... Think of the whole picture. 

I could have easily gone and talked about the varient but that shit people should understand by now..",t2_15sjn3,silverfox5115,0,1637209842.0,0,t1_hl2ywqb,hl2ywqb,False,Canuckistanni,t3_qwac6s,https://www.reddit.com/r/FortMcMurray/comments/qwac6s/this_is_never_going_to_stop/,This is never going to stop,/r/FortMcMurray/comments/qwac6s/this_is_never_going_to_stop/hl2ywqb/,1,r/FortMcMurray,0,1
"Susceptible to getting and/or succumbing to the virus? Seniors, that’s a fact, it’s not what I “think”",t2_14iud4,YellowBlackBrown,0,1637208936.0,0,t1_hl2x75r,hl2x75r,False,Canuckistanni,t3_qwac6s,https://www.reddit.com/r/FortMcMurray/comments/qwac6s/this_is_never_going_to_stop/,This is never going to stop,/r/FortMcMurray/comments/qwac6s/this_is_never_going_to_stop/hl2x75r/,1,r/FortMcMurray,0,1
"Which age groups do you think are more susceptible to the virus..

Now I'm asking what YOU particularly ""think"" because for 2 years we have been told which age groups that is...",t2_15sjn3,silverfox5115,0,1637208342.0,0,t1_hl2w0vn,hl2w0vn,False,Canuckistanni,t3_qwac6s,https://www.reddit.com/r/FortMcMurray/comments/qwac6s/this_is_never_going_to_stop/,This is never going to stop,/r/FortMcMurray/comments/qwac6s/this_is_never_going_to_stop/hl2w0vn/,1,r/FortMcMurray,0,1
Because I asked why he wants to specifically protect kids out of all age groups means I didn’t pass grade school?…,t2_14iud4,YellowBlackBrown,0,1637208202.0,0,t1_hl2vqvj,hl2vqvj,False,Canuckistanni,t3_qwac6s,https://www.reddit.com/r/FortMcMurray/comments/qwac6s/this_is_never_going_to_stop/,This is never going to stop,/r/FortMcMurray/comments/qwac6s/this_is_never_going_to_stop/hl2vqvj/,2,r/FortMcMurray,0,2
Covidiot...,t2_15sjn3,silverfox5115,0,1637205005.0,0,t1_hl2p78g,hl2p78g,False,Canuckistanni,t3_qwac6s,https://www.reddit.com/r/FortMcMurray/comments/qwac6s/this_is_never_going_to_stop/,This is never going to stop,/r/FortMcMurray/comments/qwac6s/this_is_never_going_to_stop/hl2p78g/,6,r/FortMcMurray,0,6
Dude don't waste your time on these people who barely passed grade school...,t2_15sjn3,silverfox5115,0,1637204898.0,0,t1_hl2oysw,hl2oysw,False,Canuckistanni,t3_qwac6s,https://www.reddit.com/r/FortMcMurray/comments/qwac6s/this_is_never_going_to_stop/,This is never going to stop,/r/FortMcMurray/comments/qwac6s/this_is_never_going_to_stop/hl2oysw/,6,r/FortMcMurray,0,6
I know what you mean ... People here are a special kind of idiot 🤣,t2_15sjn3,silverfox5115,0,1637204765.0,0,t1_hl2ooa8,hl2ooa8,True,Canuckistanni,t3_qwac6s,https://www.reddit.com/r/FortMcMurray/comments/qwac6s/this_is_never_going_to_stop/,This is never going to stop,/r/FortMcMurray/comments/qwac6s/this_is_never_going_to_stop/hl2ooa8/,7,r/FortMcMurray,0,7
"Your fear is cringe, eastcoaster.",t2_e81uc31s,nassybemsy,0,1637202931.0,0,t1_hl2kprv,hl2kprv,True,Canuckistanni,t3_qwac6s,https://www.reddit.com/r/FortMcMurray/comments/qwac6s/this_is_never_going_to_stop/,This is never going to stop,/r/FortMcMurray/comments/qwac6s/this_is_never_going_to_stop/hl2kprv/,-9,r/FortMcMurray,0,-9
She was saying newfies arent all like you are. But newfies generally dont have a grasp of reading comprehension or the english language.,t2_bk6rnw8c,bitchmade95,1,1637201083.0,0,t1_hl2glgo,hl2glgo,False,Canuckistanni,t3_qwac6s,https://www.reddit.com/r/FortMcMurray/comments/qwac6s/this_is_never_going_to_stop/,This is never going to stop,/r/FortMcMurray/comments/qwac6s/this_is_never_going_to_stop/hl2glgo/,-1,r/FortMcMurray,0,-1
 This isnt newfoundland. We dont go bitching and ratting out to our neighbors or the internet here like is common practice in the short bus of canada. You dont like how a buisiness is operating? Dont shop there. But instead you decided to come be a fag on the internet.,t2_bk6rnw8c,bitchmade95,0,1637200835.0,0,t1_hl2g1qm,hl2g1qm,False,Canuckistanni,t3_qwac6s,https://www.reddit.com/r/FortMcMurray/comments/qwac6s/this_is_never_going_to_stop/,This is never going to stop,/r/FortMcMurray/comments/qwac6s/this_is_never_going_to_stop/hl2g1qm/,-5,r/FortMcMurray,0,-5
"Quite true. Best comment in this rant post of mine so far.
Over the years I've spent running jobs in fort mac I can only remember firing two newfies. And very few maritimers in general. Those that come to work, work well. Can't say the same for the local entitled crowd. For every 20 I start a season with, I might keep 4 to the next season/project.",t2_4kcwzkdw,Canuckistanni,0,1637200807.0,0,t1_hl2fzco,hl2fzco,False,Canuckistanni,t3_qwac6s,https://www.reddit.com/r/FortMcMurray/comments/qwac6s/this_is_never_going_to_stop/,This is never going to stop,/r/FortMcMurray/comments/qwac6s/this_is_never_going_to_stop/hl2fzco/,5,r/FortMcMurray,0,5
"Well I’d like to just say something… not all newfies are like that. Yes some are, and I’m not arguing that. But you can’t put us all in that category. I know PLENTY of hard working, successful newfies, hell I’m married to one. 
It’s not fair for anyone to categorize a person based on where they are from.",t2_80a4rcxd,Strong_Discussion486,0,1637199960.0,0,t1_hl2e3pb,hl2e3pb,False,Canuckistanni,t3_qwac6s,https://www.reddit.com/r/FortMcMurray/comments/qwac6s/this_is_never_going_to_stop/,This is never going to stop,/r/FortMcMurray/comments/qwac6s/this_is_never_going_to_stop/hl2e3pb/,2,r/FortMcMurray,0,2
"Ahahah struck a nerve. 
Picturing an high school dropout labourer driving a jacked up rusty diesel ram on oversized bald-mudtires, with dual douche pipes up through the bed blowing black smoke, on its side in the ditch. Arguing with a cop over a suspended licence. Yup, typical uneducated vocal majority. Enjoy your coors light and pay-to-pay life.",t2_4kcwzkdw,Canuckistanni,0,1637199144.0,0,t1_hl2caaf,hl2caaf,False,Canuckistanni,t3_qwac6s,https://www.reddit.com/r/FortMcMurray/comments/qwac6s/this_is_never_going_to_stop/,This is never going to stop,/r/FortMcMurray/comments/qwac6s/this_is_never_going_to_stop/hl2caaf/,6,r/FortMcMurray,0,6
Lol typical nosy ass newfies. If youre not going to mind your own buisiness stay the fuck outta the province. Im sure all your buds are waiting at pogey beach for you to get back and suck em all off again.,t2_bk6rnw8c,bitchmade95,0,1637198169.0,0,t1_hl2a4fx,hl2a4fx,False,Canuckistanni,t3_qwac6s,https://www.reddit.com/r/FortMcMurray/comments/qwac6s/this_is_never_going_to_stop/,This is never going to stop,/r/FortMcMurray/comments/qwac6s/this_is_never_going_to_stop/hl2a4fx/,-9,r/FortMcMurray,0,-9
May you and all your uneducated conspiracy theorist buds jerk each other off till you have a giant snow-cone over your beer gut praising pay cuts that allow more straight time overtime.,t2_4kcwzkdw,Canuckistanni,0,1637196295.0,0,t1_hl2618x,hl2618x,False,Canuckistanni,t3_qwac6s,https://www.reddit.com/r/FortMcMurray/comments/qwac6s/this_is_never_going_to_stop/,This is never going to stop,/r/FortMcMurray/comments/qwac6s/this_is_never_going_to_stop/hl2618x/,6,r/FortMcMurray,0,6
