body,author_fullname,author.name,controversiality,created,downs,fullname,id,is_root,link_author,link_id,link_permalink,link_title,permalink,score,subreddit_name_prefixed,total_awards_received,ups
The Mexican markets are all good. If you want fresh off a grill can always go to Cafe Rio. Think 99 cents for two,t2_jpun2,iLikeAza,0,1644988545.0,0,t1_hx4y3k6,hx4y3k6,True,eclipsedrambler,t3_stez2a,https://www.reddit.com/r/ogden/comments/stez2a/best_tortillas/,Best tortillas?,/r/ogden/comments/stez2a/best_tortillas/hx4y3k6/,1,r/ogden,0,1
I've seriously considered buying up in Logan. People have told me that the inversions are worse there while others say that was true before but it's been cleaned up. Any word on the reality?,t2_5vkerbcl,Akujisun,0,1644985931.0,0,t1_hx4tc0y,hx4tc0y,False,lienad801,t3_ssoufn,https://www.reddit.com/r/ogden/comments/ssoufn/i_love_this_little_city_of_ours/,I love this little city of ours.,/r/ogden/comments/ssoufn/i_love_this_little_city_of_ours/hx4tc0y/,1,r/ogden,0,1
Yes. I have made my own many times before. But every time I get the hankering for a boiga I don't always want to commit to a baking project as well. But if you have a great recipe please share!,t2_81pdpj78,Fun_Echidna903,0,1644985828.0,0,t1_hx4t4u8,hx4t4u8,False,Fun_Echidna903,t3_stgsxm,https://www.reddit.com/r/ogden/comments/stgsxm/anyone_know_where_i_can_get_good_hamburger_buns/,Anyone know where I can get good hamburger buns now that Topper is gone?,/r/ogden/comments/stgsxm/anyone_know_where_i_can_get_good_hamburger_buns/hx4t4u8/,3,r/ogden,0,3
"Promise this is not a ""jerk"" post, but have you considered learning to make your own?  I've found the process to be rather simple, though *slightly* timely. It was also very cheap.",t2_5vkerbcl,Akujisun,0,1644984718.0,0,t1_hx4qz8i,hx4qz8i,True,Fun_Echidna903,t3_stgsxm,https://www.reddit.com/r/ogden/comments/stgsxm/anyone_know_where_i_can_get_good_hamburger_buns/,Anyone know where I can get good hamburger buns now that Topper is gone?,/r/ogden/comments/stgsxm/anyone_know_where_i_can_get_good_hamburger_buns/hx4qz8i/,3,r/ogden,0,3
That looks to be on top of the old demo landfill just west of 21st pond??,t2_ahtz8odl,Coop-dogg,0,1644980550.0,0,t1_hx4i8w6,hx4i8w6,True,lienad801,t3_ssoufn,https://www.reddit.com/r/ogden/comments/ssoufn/i_love_this_little_city_of_ours/,I love this little city of ours.,/r/ogden/comments/ssoufn/i_love_this_little_city_of_ours/hx4i8w6/,2,r/ogden,0,2
Give this [Pastimes](https://www.pastimes.io) app a try.  It's specifically made to help people find others to do outdoor activities with and it's pretty popular in Utah.,t2_96tbc,StyxUT,0,1644977448.0,0,t1_hx4bb9k,hx4bb9k,True,zephyrchaotix,t3_rpgmo9,https://www.reddit.com/r/ogden/comments/rpgmo9/lf_snowboardingskiing_buddy/,LF snowboarding/skiing buddy,/r/ogden/comments/rpgmo9/lf_snowboardingskiing_buddy/hx4bb9k/,1,r/ogden,0,1
Or Anaya’s market on 30th btwn Washington & Grant. I’ve gotten some really good tortillas there.,t2_e9i2em6h,Miserable-Blood-318,0,1644975334.0,0,t1_hx46mig,hx46mig,True,eclipsedrambler,t3_stez2a,https://www.reddit.com/r/ogden/comments/stez2a/best_tortillas/,Best tortillas?,/r/ogden/comments/stez2a/best_tortillas/hx46mig/,4,r/ogden,0,4
"you know what's funny is that today, one day after I posted this comment, there was a shooting in the parking lot of my apartment complex.",t2_ik9mk,Clusterclucked,0,1644975173.0,0,t1_hx469k9,hx469k9,False,sillydustbunny,t3_srywfh,https://www.reddit.com/r/ogden/comments/srywfh/what_are_the_positives_and_negatives_of_living_in/,What are the positives and negatives of living in Ogden?,/r/ogden/comments/srywfh/what_are_the_positives_and_negatives_of_living_in/hx469k9/,3,r/ogden,0,3
El Rancho,t2_9xww0jni,ActualWait8584,0,1644964715.0,0,t1_hx3i4w2,hx3i4w2,True,eclipsedrambler,t3_stez2a,https://www.reddit.com/r/ogden/comments/stez2a/best_tortillas/,Best tortillas?,/r/ogden/comments/stez2a/best_tortillas/hx3i4w2/,7,r/ogden,0,7
Great shot.,t2_pg8xq,otters4everyone,0,1644960740.0,0,t1_hx37op2,hx37op2,True,lienad801,t3_ssoufn,https://www.reddit.com/r/ogden/comments/ssoufn/i_love_this_little_city_of_ours/,I love this little city of ours.,/r/ogden/comments/ssoufn/i_love_this_little_city_of_ours/hx37op2/,1,r/ogden,0,1
Logan’s view is amazing since we’re in a mountain bowl,t2_4rjkt3uf,wellyesbutnofuckoff2,0,1644941584.0,0,t1_hx1tavu,hx1tavu,True,lienad801,t3_ssoufn,https://www.reddit.com/r/ogden/comments/ssoufn/i_love_this_little_city_of_ours/,I love this little city of ours.,/r/ogden/comments/ssoufn/i_love_this_little_city_of_ours/hx1tavu/,1,r/ogden,0,1
"AirBnBs have gotten so expensive, it’s honestly cheaper to stay in a hotel again. The problem here is not like Park City, Moab, or Springdale. Those places are geographically limited and they basically ruined their communities by letting short term rentals go unabated. Ogden is too big for that issue, at least currently.",t2_cbdqebom,bob_scratchit,0,1644940768.0,0,t1_hx1ra0o,hx1ra0o,True,roger_roger_32,t3_st2ilg,https://www.reddit.com/r/ogden/comments/st2ilg/ogden_airbnbvrbo_the_goodbadugly/,Ogden Airbnb/VRBO. The good/bad/ugly?,/r/ogden/comments/st2ilg/ogden_airbnbvrbo_the_goodbadugly/hx1ra0o/,3,r/ogden,0,3
"I can’t say that I have a nuanced take on AirBnB’s specific impact on the area…but what I can say is that there’s a massive housing shortage at the moment, with regular folks finding it nearly impossible to find reasonable housing right now. 

So the whole short term rental thing (people buying houses as investment properties) probably isn’t going to be a popular concept to a lot of Ogden locals, especially if they’ve been trying to find housing at any point in the last 1-2 years.",t2_9svtq,Skalariak,0,1644937112.0,0,t1_hx1ic09,hx1ic09,True,roger_roger_32,t3_st2ilg,https://www.reddit.com/r/ogden/comments/st2ilg/ogden_airbnbvrbo_the_goodbadugly/,Ogden Airbnb/VRBO. The good/bad/ugly?,/r/ogden/comments/st2ilg/ogden_airbnbvrbo_the_goodbadugly/hx1ic09/,11,r/ogden,0,11
The best view,t2_4lh5d4hl,devil0o,0,1644929662.0,0,t1_hx12rfd,hx12rfd,True,lienad801,t3_ssoufn,https://www.reddit.com/r/ogden/comments/ssoufn/i_love_this_little_city_of_ours/,I love this little city of ours.,/r/ogden/comments/ssoufn/i_love_this_little_city_of_ours/hx12rfd/,1,r/ogden,0,1
Me too!!! I'm glad they've cleaned it up so much compared to the 90's,t2_7of93k6n,SableSlayer435,0,1644900373.0,0,t1_hwzy84h,hwzy84h,True,lienad801,t3_ssoufn,https://www.reddit.com/r/ogden/comments/ssoufn/i_love_this_little_city_of_ours/,I love this little city of ours.,/r/ogden/comments/ssoufn/i_love_this_little_city_of_ours/hwzy84h/,4,r/ogden,0,4
Ogden is a tremendous place,t2_8ipd1,jdd32,0,1644899792.0,0,t1_hwzx6oi,hwzx6oi,True,lienad801,t3_ssoufn,https://www.reddit.com/r/ogden/comments/ssoufn/i_love_this_little_city_of_ours/,I love this little city of ours.,/r/ogden/comments/ssoufn/i_love_this_little_city_of_ours/hwzx6oi/,3,r/ogden,0,3
Haven’t lived there for years but I still recognize those buildings!,t2_179h0p,Catspaw23,0,1644897364.0,0,t1_hwzsl3m,hwzsl3m,True,lienad801,t3_ssoufn,https://www.reddit.com/r/ogden/comments/ssoufn/i_love_this_little_city_of_ours/,I love this little city of ours.,/r/ogden/comments/ssoufn/i_love_this_little_city_of_ours/hwzsl3m/,1,r/ogden,0,1
"Yeah I figured it was bad, I grew up in Logan and it was terrible.",t2_5i7ogf3p,sillydustbunny,0,1644890795.0,0,t1_hwzezfn,hwzezfn,False,sillydustbunny,t3_srywfh,https://www.reddit.com/r/ogden/comments/srywfh/what_are_the_positives_and_negatives_of_living_in/,What are the positives and negatives of living in Ogden?,/r/ogden/comments/srywfh/what_are_the_positives_and_negatives_of_living_in/hwzezfn/,1,r/ogden,0,1
"Coming back to Utah from the west coast, been gone a long time. Used to live in slc before leaving, loved it but it’s very pricey now.",t2_5i7ogf3p,sillydustbunny,0,1644890657.0,0,t1_hwzeowz,hwzeowz,False,sillydustbunny,t3_srywfh,https://www.reddit.com/r/ogden/comments/srywfh/what_are_the_positives_and_negatives_of_living_in/,What are the positives and negatives of living in Ogden?,/r/ogden/comments/srywfh/what_are_the_positives_and_negatives_of_living_in/hwzeowz/,1,r/ogden,0,1
"Can't say for sure, I don't make it out to SLC that often. I'd imagine the air quality will be worst around airports, air bases, industrial facilities, and, in general, in more densely populated areas. Its especially bad during winter when we get an inversion layer.",t2_xxtjv,Reno83,0,1644889648.0,0,t1_hwzcldt,hwzcldt,False,sillydustbunny,t3_srywfh,https://www.reddit.com/r/ogden/comments/srywfh/what_are_the_positives_and_negatives_of_living_in/,What are the positives and negatives of living in Ogden?,/r/ogden/comments/srywfh/what_are_the_positives_and_negatives_of_living_in/hwzcldt/,1,r/ogden,0,1
"I agree. It’s a wonderful mix of everything here. 

I♥️Otown",t2_i2adv3v7,Repulsive_Hawk963,0,1644889104.0,0,t1_hwzbgr6,hwzbgr6,True,lienad801,t3_ssoufn,https://www.reddit.com/r/ogden/comments/ssoufn/i_love_this_little_city_of_ours/,I love this little city of ours.,/r/ogden/comments/ssoufn/i_love_this_little_city_of_ours/hwzbgr6/,2,r/ogden,0,2
"Where are you coming from?  I’m curious what your current situation is.  Ogden is an interesting town and feels like it should be part of a different state sometimes.  Most of Ogden is pretty accepting in general, especially the schools.  Ogden and Weber canyon both have a pretty consistent morning breeze and help keep the air a little better, particularly in the morning hours if the canyon breeze is in effect.",t2_bbl46bwk,UT_Dave,0,1644887605.0,0,t1_hwz8cvl,hwz8cvl,False,sillydustbunny,t3_srywfh,https://www.reddit.com/r/ogden/comments/srywfh/what_are_the_positives_and_negatives_of_living_in/,What are the positives and negatives of living in Ogden?,/r/ogden/comments/srywfh/what_are_the_positives_and_negatives_of_living_in/hwz8cvl/,1,r/ogden,0,1
Me too!,t2_cidhs85o,Still-Use-7186,0,1644886225.0,0,t1_hwz5il4,hwz5il4,True,lienad801,t3_ssoufn,https://www.reddit.com/r/ogden/comments/ssoufn/i_love_this_little_city_of_ours/,I love this little city of ours.,/r/ogden/comments/ssoufn/i_love_this_little_city_of_ours/hwz5il4/,2,r/ogden,0,2
"Would you say it’s as bad of air quality as slc? Yeah housing is nuts right now. I’m looking to rent, can’t buy a home quite yet. But prices are significantly lower for rent there than slc.",t2_5i7ogf3p,sillydustbunny,0,1644880852.0,0,t1_hwyudpc,hwyudpc,False,sillydustbunny,t3_srywfh,https://www.reddit.com/r/ogden/comments/srywfh/what_are_the_positives_and_negatives_of_living_in/,What are the positives and negatives of living in Ogden?,/r/ogden/comments/srywfh/what_are_the_positives_and_negatives_of_living_in/hwyudpc/,2,r/ogden,0,2
"Overall, I like Ogden (I live in North Ogden), but, after a year of living here, we are ready to move (within the next two years). The deal breaker for us has been the air quality. Other than that though, it's a great place to live. Small town feel, an hour away from SLC for those big city amenities, close to the outdoors, and less than an hour from two great ski resorts. However, one thing I've noticed is that home prices have been skyrocketing. In the last year, our home's value has appreciated by at least 30% (current market value is approx 130% of purchase price), hence why we are planning to move in a few years instead of right now (i.e. to avoid a huge capital gains tax).",t2_xxtjv,Reno83,0,1644880693.0,0,t1_hwyu1pk,hwyu1pk,True,sillydustbunny,t3_srywfh,https://www.reddit.com/r/ogden/comments/srywfh/what_are_the_positives_and_negatives_of_living_in/,What are the positives and negatives of living in Ogden?,/r/ogden/comments/srywfh/what_are_the_positives_and_negatives_of_living_in/hwyu1pk/,3,r/ogden,0,3
I’m from Logan lol not a fan,t2_5i7ogf3p,sillydustbunny,0,1644880396.0,0,t1_hwytg38,hwytg38,False,sillydustbunny,t3_srywfh,https://www.reddit.com/r/ogden/comments/srywfh/what_are_the_positives_and_negatives_of_living_in/,What are the positives and negatives of living in Ogden?,/r/ogden/comments/srywfh/what_are_the_positives_and_negatives_of_living_in/hwytg38/,1,r/ogden,0,1
Thinking about it as well. I’m in Logan and rent is insane here!! I heard Ogden is cheap af,t2_70a2cwqj,OddHold1207,0,1644879955.0,0,t1_hwysk79,hwysk79,True,sillydustbunny,t3_srywfh,https://www.reddit.com/r/ogden/comments/srywfh/what_are_the_positives_and_negatives_of_living_in/,What are the positives and negatives of living in Ogden?,/r/ogden/comments/srywfh/what_are_the_positives_and_negatives_of_living_in/hwysk79/,1,r/ogden,0,1
"Thank you for the feedback! I have a job, the home office is in Utah which is also part of why I’m moving back.",t2_5i7ogf3p,sillydustbunny,0,1644867782.0,0,t1_hwy2lrr,hwy2lrr,False,sillydustbunny,t3_srywfh,https://www.reddit.com/r/ogden/comments/srywfh/what_are_the_positives_and_negatives_of_living_in/,What are the positives and negatives of living in Ogden?,/r/ogden/comments/srywfh/what_are_the_positives_and_negatives_of_living_in/hwy2lrr/,1,r/ogden,0,1
"Uhm... Little Davinci? 

http://www.davinciacademy.org/

Dr.Donaldson is a great guy who has been there for my kids through a lot. 

My son went to New bridge here in Ogden and HATED it. He had like 34 kids in his class. And I love my son, but he is stupid and needs one on one time he could not get. I wish I would have tried to get him into Davinci elementary.",t2_axftn,donfather2k,0,1644867384.0,0,t1_hwy1mjw,hwy1mjw,False,sillydustbunny,t3_srywfh,https://www.reddit.com/r/ogden/comments/srywfh/what_are_the_positives_and_negatives_of_living_in/,What are the positives and negatives of living in Ogden?,/r/ogden/comments/srywfh/what_are_the_positives_and_negatives_of_living_in/hwy1mjw/,4,r/ogden,0,4
Yeah .. I said sketchy and uncomfortable because you see the occasional homeless person or drug dealer. This is nothing to scary for me.,t2_axftn,donfather2k,0,1644866502.0,0,t1_hwxzflz,hwxzflz,False,sillydustbunny,t3_srywfh,https://www.reddit.com/r/ogden/comments/srywfh/what_are_the_positives_and_negatives_of_living_in/,What are the positives and negatives of living in Ogden?,/r/ogden/comments/srywfh/what_are_the_positives_and_negatives_of_living_in/hwxzflz/,2,r/ogden,0,2
"I'm a transplant that lived in Layton for a year, then Ogden for the last 5. 

Weber County is the most racially diverse area in Utah (backed by census data). That being said, I wouldn't necessarily say it's not racist. It's still Utah, unfortunately. There's also great LGBTQ+ support. 

The public schools are also rated very poorly across most of the area, particularly beyond elementary. The best are charter/private schools, so have fun with that.

Housing. What can we say about housing. As someone that is in process of selling, I'm really happy to be getting out right now. My house doubled in value in five years. Ogden and SLC are both in the top ten of overvalued housing markets in the US; Ogden at 3, SLC at 9. You're likely to find more house for your money up here, but depending on what you're looking for, potentially more ""value"" in SLC. I work on the north side of SLC, with a 38 mi one way commute. Even with bad traffic, the trip is rarely over an hour. The train can also be very convenient if you need to use it. 

As far as jobs go, Utah wages are getting better depending on where you look, but they're largely not on track with the exploding inflation for the area. There's a lot of growth in the area depending on what you do. The base, Ogden Business Depot, and outer areas have a lot coming in and always looking for people.",t2_5azvo,animal7979,0,1644861575.0,0,t1_hwxnbck,hwxnbck,True,sillydustbunny,t3_srywfh,https://www.reddit.com/r/ogden/comments/srywfh/what_are_the_positives_and_negatives_of_living_in/,What are the positives and negatives of living in Ogden?,/r/ogden/comments/srywfh/what_are_the_positives_and_negatives_of_living_in/hwxnbck/,4,r/ogden,0,4
I live in this exact area and if this is what passes for a rough area at night in ogden then that says some pretty good things about it. I've lived here a year and a few months; used to live in mississippi in an area a whole lot rougher. Relative to other 'rough areas at night' ogden has it pretty good!,t2_ik9mk,Clusterclucked,0,1644859359.0,0,t1_hwxhz8i,hwxhz8i,False,sillydustbunny,t3_srywfh,https://www.reddit.com/r/ogden/comments/srywfh/what_are_the_positives_and_negatives_of_living_in/,What are the positives and negatives of living in Ogden?,/r/ogden/comments/srywfh/what_are_the_positives_and_negatives_of_living_in/hwxhz8i/,7,r/ogden,0,7
No bur he cute tho,t2_8px989cr,DontTouchMyNut9000,0,1644853607.0,0,t1_hwx3tyo,hwx3tyo,True,onehiguy,t3_srnril,https://www.reddit.com/r/ogden/comments/srnril/here_is_a_pic_of_the_dog_i_found_yesterday/,Here is a pic of the dog I found yesterday. Anybody know him?,/r/ogden/comments/srnril/here_is_a_pic_of_the_dog_i_found_yesterday/hwx3tyo/,1,r/ogden,0,1
Awesome feedback thx! What about for elementary schools? Anything similar to davinci?,t2_5i7ogf3p,sillydustbunny,0,1644850438.0,0,t1_hwwwlep,hwwwlep,False,sillydustbunny,t3_srywfh,https://www.reddit.com/r/ogden/comments/srywfh/what_are_the_positives_and_negatives_of_living_in/,What are the positives and negatives of living in Ogden?,/r/ogden/comments/srywfh/what_are_the_positives_and_negatives_of_living_in/hwwwlep/,2,r/ogden,0,2
"I can't remember the details, but I think Weber State campus housing is available if you meet certain criteria. I've known a few interns that have stayed there over the summer.",t2_54bno,Cunundrum,0,1644850316.0,0,t1_hwwwc3k,hwwwc3k,True,PlsRecycleCondoms,t3_srwb5p,https://www.reddit.com/r/ogden/comments/srwb5p/summer_housing_options/,Summer housing options?,/r/ogden/comments/srwb5p/summer_housing_options/hwwwc3k/,3,r/ogden,0,3
Looking forward to seeing you there!,t2_cdxxs2qc,IndieOgdenDan,0,1644849812.0,0,t1_hwwvebp,hwwvebp,False,IndieOgdenDan,t3_srl9j8,https://www.reddit.com/r/ogden/comments/srl9j8/come_get_bizarre_with_us_sunday_february_20th_at/,Come Get Bizarre with us Sunday February 20th at The Marshall White Center 11am-4pm,/r/ogden/comments/srl9j8/come_get_bizarre_with_us_sunday_february_20th_at/hwwvebp/,1,r/ogden,0,1
Raptors and dogs are natural friends.,t2_r0jps,PelonMusk,0,1644847948.0,0,t1_hwwrrh9,hwwrrh9,False,onehiguy,t3_srnril,https://www.reddit.com/r/ogden/comments/srnril/here_is_a_pic_of_the_dog_i_found_yesterday/,Here is a pic of the dog I found yesterday. Anybody know him?,/r/ogden/comments/srnril/here_is_a_pic_of_the_dog_i_found_yesterday/hwwrrh9/,2,r/ogden,0,2
Yeah he seems like such a nice doggo. I hope you can reunite with his fam.,t2_e9i2em6h,Miserable-Blood-318,0,1644828709.0,0,t1_hww0o9u,hww0o9u,False,onehiguy,t3_srnril,https://www.reddit.com/r/ogden/comments/srnril/here_is_a_pic_of_the_dog_i_found_yesterday/,Here is a pic of the dog I found yesterday. Anybody know him?,/r/ogden/comments/srnril/here_is_a_pic_of_the_dog_i_found_yesterday/hww0o9u/,1,r/ogden,0,1
What's the song featured in this?,t2_gzd263rp,SAtANIC_PANIC_666,0,1644826118.0,0,t1_hwvxlag,hwvxlag,True,IndieOgdenDan,t3_srl9j8,https://www.reddit.com/r/ogden/comments/srl9j8/come_get_bizarre_with_us_sunday_february_20th_at/,Come Get Bizarre with us Sunday February 20th at The Marshall White Center 11am-4pm,/r/ogden/comments/srl9j8/come_get_bizarre_with_us_sunday_february_20th_at/hwvxlag/,1,r/ogden,0,1
"Take ya a whole year to come up with that? I’m talking about the pandemic that the majority of Utahns don’t want to admit is a problem. Admitting it’s ruining people financially isn’t helping your point here bud. Yeah it’s got a decent survival rate. Doesn’t mean the people who have survived aren’t still effected by medical conditions or medical bills. Not taking something seriously makes you an asshole, not a patriot. Chill out.",t2_1qa3k9qr,bialaloooo,0,1644822984.0,0,t1_hwvtnlu,hwvtnlu,False,drae_annx,t3_l42zgv,https://www.reddit.com/r/ogden/comments/l42zgv/ghost_bar_next_to_lucky_slice/,Ghost bar next to Lucky Slice,/r/ogden/comments/l42zgv/ghost_bar_next_to_lucky_slice/hwvtnlu/,1,r/ogden,0,1
"SLC is great but super expensive & only going up. 

Ogden is chill. Food scene is great & have really seen improvement in recreation options. Know a lot of people who visited or were brought here for work that decided to stay for good. IMO Ogden is preferable to anywhere between Otown & SLC. There are some Davis County areas that aren't very friendly to those outside the church.",t2_jpun2,iLikeAza,0,1644821660.0,0,t1_hwvrwav,hwvrwav,True,sillydustbunny,t3_srywfh,https://www.reddit.com/r/ogden/comments/srywfh/what_are_the_positives_and_negatives_of_living_in/,What are the positives and negatives of living in Ogden?,/r/ogden/comments/srywfh/what_are_the_positives_and_negatives_of_living_in/hwvrwav/,5,r/ogden,0,5
I live in a neighborhood between wash/wall that I bet most would seem dangerous (not one you mentioned) It is def not. That being said I *hate* the street noise.,t2_1rr9onx3,Mtnrunnr,0,1644820652.0,0,t1_hwvqhwr,hwvqhwr,False,sillydustbunny,t3_srywfh,https://www.reddit.com/r/ogden/comments/srywfh/what_are_the_positives_and_negatives_of_living_in/,What are the positives and negatives of living in Ogden?,/r/ogden/comments/srywfh/what_are_the_positives_and_negatives_of_living_in/hwvqhwr/,2,r/ogden,0,2
"At night? 24th to 30th on Adams. Nothing too bad, but I've seen drug deals and lookouts. And along Harrison, Washington, and Wall it gets loud due to traffic. Over by lantern house can get uncomfortable late at night. 

All these places are uncomfortable more than unsafe.",t2_axftn,donfather2k,0,1644820565.0,0,t1_hwvqde6,hwvqde6,False,sillydustbunny,t3_srywfh,https://www.reddit.com/r/ogden/comments/srywfh/what_are_the_positives_and_negatives_of_living_in/,What are the positives and negatives of living in Ogden?,/r/ogden/comments/srywfh/what_are_the_positives_and_negatives_of_living_in/hwvqde6/,6,r/ogden,0,6
"Echoing the praise for Davinci! Great school for artsy or techy kids, and outcasts of all kinds.",t2_6fxuqrj3,usrname123456,0,1644819624.0,0,t1_hwvp0fh,hwvp0fh,False,sillydustbunny,t3_srywfh,https://www.reddit.com/r/ogden/comments/srywfh/what_are_the_positives_and_negatives_of_living_in/,What are the positives and negatives of living in Ogden?,/r/ogden/comments/srywfh/what_are_the_positives_and_negatives_of_living_in/hwvp0fh/,3,r/ogden,0,3
Really? What blocks?,t2_1rr9onx3,Mtnrunnr,0,1644816816.0,0,t1_hwvkq77,hwvkq77,False,sillydustbunny,t3_srywfh,https://www.reddit.com/r/ogden/comments/srywfh/what_are_the_positives_and_negatives_of_living_in/,What are the positives and negatives of living in Ogden?,/r/ogden/comments/srywfh/what_are_the_positives_and_negatives_of_living_in/hwvkq77/,2,r/ogden,0,2
"The composites program is solid. I have not been involved with them over the past two years due to pandemic restrictions, but it's hard to believe too much has changed. The added benefit is that there are a ton of jobs in that field locally that offer competitive pay including aerospace, civilian Air Force, and firearms.",t2_5vkerbcl,Akujisun,0,1644815682.0,0,t1_hwvizey,hwvizey,True,jimmyroberts_cats94,t3_shdw58,https://www.reddit.com/r/ogden/comments/shdw58/moving_back_to_ogden_area_this_spring_opinions_on/,Moving back to Ogden area this spring. Opinions on OWATC,/r/ogden/comments/shdw58/moving_back_to_ogden_area_this_spring_opinions_on/hwvizey/,2,r/ogden,0,2
Stray dogs do love that Dinosaur Park... had three of them run up on me and my dog the other day.,t2_5vkerbcl,Akujisun,0,1644815469.0,0,t1_hwvin97,hwvin97,False,onehiguy,t3_srnril,https://www.reddit.com/r/ogden/comments/srnril/here_is_a_pic_of_the_dog_i_found_yesterday/,Here is a pic of the dog I found yesterday. Anybody know him?,/r/ogden/comments/srnril/here_is_a_pic_of_the_dog_i_found_yesterday/hwvin97/,1,r/ogden,0,1
He's on all the sites I can think of. I really hope I can find his people before tomorrow. I might have to take him to the shelter. I really don't want to take him there.,t2_8qa4wmjb,onehiguy,0,1644813328.0,0,t1_hwvf36i,hwvf36i,False,onehiguy,t3_srnril,https://www.reddit.com/r/ogden/comments/srnril/here_is_a_pic_of_the_dog_i_found_yesterday/,Here is a pic of the dog I found yesterday. Anybody know him?,/r/ogden/comments/srnril/here_is_a_pic_of_the_dog_i_found_yesterday/hwvf36i/,1,r/ogden,0,1
North side. By Elmonte Golf Course and Dinosaur Park.,t2_8qa4wmjb,onehiguy,0,1644813120.0,0,t1_hwvepum,hwvepum,False,onehiguy,t3_srnril,https://www.reddit.com/r/ogden/comments/srnril/here_is_a_pic_of_the_dog_i_found_yesterday/,Here is a pic of the dog I found yesterday. Anybody know him?,/r/ogden/comments/srnril/here_is_a_pic_of_the_dog_i_found_yesterday/hwvepum/,1,r/ogden,0,1
Can’t wait!!,t2_2tbclw0m,digitalbearings,0,1644811515.0,0,t1_hwvbsq4,hwvbsq4,True,IndieOgdenDan,t3_srl9j8,https://www.reddit.com/r/ogden/comments/srl9j8/come_get_bizarre_with_us_sunday_february_20th_at/,Come Get Bizarre with us Sunday February 20th at The Marshall White Center 11am-4pm,/r/ogden/comments/srl9j8/come_get_bizarre_with_us_sunday_february_20th_at/hwvbsq4/,1,r/ogden,0,1
"I moved here just over a yr ago. The only drawback I’ve found is the dog food smell from time to time. There’s a few restaurants I miss and my bank is only in SLC but that’s so minor. Overall I’ve liked it. I can’t speak on schools and as far as diversity, depend on your comparison. Less diverse than many places such as the Bay Area but seems more diverse than many others. My parents are in Clinton and it seems much less diverse than Ogden.",t2_e9i2em6h,Miserable-Blood-318,0,1644807153.0,0,t1_hwv27k4,hwv27k4,True,sillydustbunny,t3_srywfh,https://www.reddit.com/r/ogden/comments/srywfh/what_are_the_positives_and_negatives_of_living_in/,What are the positives and negatives of living in Ogden?,/r/ogden/comments/srywfh/what_are_the_positives_and_negatives_of_living_in/hwv27k4/,13,r/ogden,0,13
