body,author_fullname,author.name,controversiality,created,downs,fullname,id,is_root,link_author,link_id,link_permalink,link_title,permalink,score,subreddit_name_prefixed,total_awards_received,ups
i just left them. GL there...,t2_xcrpfu8,UEF_Dawson,0,1649012292.0,0,t1_i398dvr,i398dvr,False,Mos_Def_Fosh_Totes,t3_tlvxdy,https://www.reddit.com/r/ogden/comments/tlvxdy/new_in_town_mid_20s_where_do_i_go/,"new in town, mid 20s where do I go?",/r/ogden/comments/tlvxdy/new_in_town_mid_20s_where_do_i_go/i398dvr/,1,r/ogden,0,1
There's also a Dog park very nearby.,t2_bob26,Minion5051,0,1648917838.0,0,t1_i34ifr7,i34ifr7,False,Pirate_Frank,t3_ttx1nf,https://www.reddit.com/r/ogden/comments/ttx1nf/a_nice_park_to_sit_in_the_sun_picnic_and_watch/,"A nice park to sit in the sun, picnic, and watch ducks or passers by",/r/ogden/comments/ttx1nf/a_nice_park_to_sit_in_the_sun_picnic_and_watch/i34ifr7/,1,r/ogden,0,1
North Ogden has a duck pond right by Lee's Marketplace.,t2_77o0jws4,pooker55,0,1648911933.0,0,t1_i345bgg,i345bgg,True,Pirate_Frank,t3_ttx1nf,https://www.reddit.com/r/ogden/comments/ttx1nf/a_nice_park_to_sit_in_the_sun_picnic_and_watch/,"A nice park to sit in the sun, picnic, and watch ducks or passers by",/r/ogden/comments/ttx1nf/a_nice_park_to_sit_in_the_sun_picnic_and_watch/i345bgg/,1,r/ogden,0,1
Oddly I prefer merc over grounds because grounds is a little to strong for me...,t2_axftn,donfather2k,0,1648875190.0,0,t1_i32p9um,i32p9um,False,Electrical_Lynx_7323,t3_ts7e2k,https://www.reddit.com/r/ogden/comments/ts7e2k/good_coffee/,Good coffee?,/r/ogden/comments/ts7e2k/good_coffee/i32p9um/,1,r/ogden,0,1
"Fort Buenaventura. It's quiet, there's a nice pond, and you don't even feel like you are in the city. 

Located at 2450 A Ave

I'm sorry about your pup",t2_xqr63dq,i_had_ice,0,1648873609.0,0,t1_i32muvq,i32muvq,True,Pirate_Frank,t3_ttx1nf,https://www.reddit.com/r/ogden/comments/ttx1nf/a_nice_park_to_sit_in_the_sun_picnic_and_watch/,"A nice park to sit in the sun, picnic, and watch ducks or passers by",/r/ogden/comments/ttx1nf/a_nice_park_to_sit_in_the_sun_picnic_and_watch/i32muvq/,4,r/ogden,0,4
My dad claims him and his friends used to shoot arrows into the belly.  Couldn’t pass it without him telling the story.,t2_64iga,siteburn,0,1648867636.0,0,t1_i32cgae,i32cgae,True,[deleted],t3_tu22nc,https://www.reddit.com/r/ogden/comments/tu22nc/who_remembers_the_china_nite_statue/,Who remembers The China Nite statue??,/r/ogden/comments/tu22nc/who_remembers_the_china_nite_statue/i32cgae/,2,r/ogden,0,2
I think I remember it.,t2_61ixe6gw,WillySideEye,0,1648862099.0,0,t1_i321svi,i321svi,True,[deleted],t3_tu22nc,https://www.reddit.com/r/ogden/comments/tu22nc/who_remembers_the_china_nite_statue/,Who remembers The China Nite statue??,/r/ogden/comments/tu22nc/who_remembers_the_china_nite_statue/i321svi/,1,r/ogden,0,1
Steagans,t2_xtxi9,hanna_bugz,0,1648861287.0,0,t1_i32076c,i32076c,True,So-Relaxed,t3_tr7ttg,https://www.reddit.com/r/ogden/comments/tr7ttg/affordable_auto_body_shop/,Affordable auto body shop…,/r/ogden/comments/tr7ttg/affordable_auto_body_shop/i32076c/,1,r/ogden,0,1
"The statue,  I'm Olde enough to have eaten there",t2_f9xzkq3u,PERFECT-Dark-64,0,1648859536.0,0,t1_i31wqwc,i31wqwc,True,[deleted],t3_tu22nc,https://www.reddit.com/r/ogden/comments/tu22nc/who_remembers_the_china_nite_statue/,Who remembers The China Nite statue??,/r/ogden/comments/tu22nc/who_remembers_the_china_nite_statue/i31wqwc/,2,r/ogden,0,2
My great grandfather was the creator of it. It's called a hoi toi.,t2_bysqf98q,moon_money21,0,1648858963.0,0,t1_i31vm71,i31vm71,True,[deleted],t3_tu22nc,https://www.reddit.com/r/ogden/comments/tu22nc/who_remembers_the_china_nite_statue/,Who remembers The China Nite statue??,/r/ogden/comments/tu22nc/who_remembers_the_china_nite_statue/i31vm71/,3,r/ogden,0,3
"If you're up for a drive, mabey pond in Clearfield has lots of geese and ducks and usually few if any people. Steed pond also has ducks and usually a few people but not what I'd call crowded.",t2_bysqf98q,moon_money21,0,1648858630.0,0,t1_i31uy9y,i31uy9y,True,Pirate_Frank,t3_ttx1nf,https://www.reddit.com/r/ogden/comments/ttx1nf/a_nice_park_to_sit_in_the_sun_picnic_and_watch/,"A nice park to sit in the sun, picnic, and watch ducks or passers by",/r/ogden/comments/ttx1nf/a_nice_park_to_sit_in_the_sun_picnic_and_watch/i31uy9y/,3,r/ogden,0,3
I’ve heard the statue is in somebodies back yard but could just be an urban legend,t2_wuo43,Rednexican429,0,1648855958.0,0,t1_i31plzl,i31plzl,True,[deleted],t3_tu22nc,https://www.reddit.com/r/ogden/comments/tu22nc/who_remembers_the_china_nite_statue/,Who remembers The China Nite statue??,/r/ogden/comments/tu22nc/who_remembers_the_china_nite_statue/i31plzl/,1,r/ogden,0,1
"I've recently read the China Nite is gone, and it makes me very sad. So many memories of that restaurant.

Miss ya, HoiToi!",t2_amauf1bf,StyreneAddict1965,0,1648852408.0,0,t1_i31i8ki,i31i8ki,True,[deleted],t3_tu22nc,https://www.reddit.com/r/ogden/comments/tu22nc/who_remembers_the_china_nite_statue/,Who remembers The China Nite statue??,/r/ogden/comments/tu22nc/who_remembers_the_china_nite_statue/i31i8ki/,4,r/ogden,0,4
I don’t remember it without arrows in his gut.,t2_5h22hn5n,shlem13,0,1648852148.0,0,t1_i31hogx,i31hogx,True,[deleted],t3_tu22nc,https://www.reddit.com/r/ogden/comments/tu22nc/who_remembers_the_china_nite_statue/,Who remembers The China Nite statue??,/r/ogden/comments/tu22nc/who_remembers_the_china_nite_statue/i31hogx/,10,r/ogden,0,10
Grew up in Ogden and that was my parent’s bowling team’s favorite meeting spot.,t2_179h0p,Catspaw23,0,1648850403.0,0,t1_i31dwnp,i31dwnp,False,[deleted],t3_tu22nc,https://www.reddit.com/r/ogden/comments/tu22nc/who_remembers_the_china_nite_statue/,Who remembers The China Nite statue??,/r/ogden/comments/tu22nc/who_remembers_the_china_nite_statue/i31dwnp/,3,r/ogden,0,3
"I remember when it has arrows in its tummy, shot from a passing car.  And when the robe was green, the ""new"" paint job was not great.",t2_9nds9,Maggiemayday,0,1648848787.0,0,t1_i31abyo,i31abyo,True,[deleted],t3_tu22nc,https://www.reddit.com/r/ogden/comments/tu22nc/who_remembers_the_china_nite_statue/,Who remembers The China Nite statue??,/r/ogden/comments/tu22nc/who_remembers_the_china_nite_statue/i31abyo/,3,r/ogden,0,3
24th and Harrison. Nice park with some foot traffic. No ducks.,t2_wkuxl,KatyClaire,0,1648840663.0,0,t1_i30r5hf,i30r5hf,True,Pirate_Frank,t3_ttx1nf,https://www.reddit.com/r/ogden/comments/ttx1nf/a_nice_park_to_sit_in_the_sun_picnic_and_watch/,"A nice park to sit in the sun, picnic, and watch ducks or passers by",/r/ogden/comments/ttx1nf/a_nice_park_to_sit_in_the_sun_picnic_and_watch/i30r5hf/,3,r/ogden,0,3
Was going to say this is a really nice spot.,t2_9tlru,nyne87,0,1648838714.0,0,t1_i30mf8p,i30mf8p,False,Pirate_Frank,t3_ttx1nf,https://www.reddit.com/r/ogden/comments/ttx1nf/a_nice_park_to_sit_in_the_sun_picnic_and_watch/,"A nice park to sit in the sun, picnic, and watch ducks or passers by",/r/ogden/comments/ttx1nf/a_nice_park_to_sit_in_the_sun_picnic_and_watch/i30mf8p/,4,r/ogden,0,4
"Beus Pond or the Duck Pond at Weber State might be good, too.",t2_3921h,surleigh,0,1648837700.0,0,t1_i30jyoi,i30jyoi,True,Pirate_Frank,t3_ttx1nf,https://www.reddit.com/r/ogden/comments/ttx1nf/a_nice_park_to_sit_in_the_sun_picnic_and_watch/,"A nice park to sit in the sun, picnic, and watch ducks or passers by",/r/ogden/comments/ttx1nf/a_nice_park_to_sit_in_the_sun_picnic_and_watch/i30jyoi/,17,r/ogden,0,17
"The Big Dee park would be good for this. It's the one at the mouth of the canyon off 12th Street, at the end of the little road that goes to the dinosaur park. There's a big open sunny field that usually isn't crowded, and the river pathway runs along one side, with benches where you can sit and watch the water and ducks.

Also, I'm really sorry your time with your friend is ending. I hope you can make his final days happy for both of you.",t2_34um9,shatterly,0,1648836378.0,0,t1_i30gq10,i30gq10,True,Pirate_Frank,t3_ttx1nf,https://www.reddit.com/r/ogden/comments/ttx1nf/a_nice_park_to_sit_in_the_sun_picnic_and_watch/,"A nice park to sit in the sun, picnic, and watch ducks or passers by",/r/ogden/comments/ttx1nf/a_nice_park_to_sit_in_the_sun_picnic_and_watch/i30gq10/,11,r/ogden,0,11
The efficiency of the heater is also a consideration. Some of those older and/or cheaper electric furnaces chug power.,t2_133jvfjj,Pirate_Frank,0,1648836041.0,0,t1_i30fw6a,i30fw6a,False,axhero,t3_tttwt6,https://www.reddit.com/r/ogden/comments/tttwt6/electric_heating/,electric heating,/r/ogden/comments/tttwt6/electric_heating/i30fw6a/,1,r/ogden,0,1
"I would expect under $100 for 700sqft. But that's also completely dependent on the quality of insulation, the windows, and if you turn off the heat when you aren't home.",t2_8ipd1,jdd32,0,1648830295.0,0,t1_i3015pm,i3015pm,True,axhero,t3_tttwt6,https://www.reddit.com/r/ogden/comments/tttwt6/electric_heating/,electric heating,/r/ogden/comments/tttwt6/electric_heating/i3015pm/,3,r/ogden,0,3
"I've been to Kafe Mercantile a few times and I have nothing but great things to say   
about them they've been extremely nice and polite!",t2_7uqcjmim,khaos0914,0,1648800668.0,0,t1_i2yiqkm,i2yiqkm,False,Electrical_Lynx_7323,t3_ts7e2k,https://www.reddit.com/r/ogden/comments/ts7e2k/good_coffee/,Good coffee?,/r/ogden/comments/ts7e2k/good_coffee/i2yiqkm/,1,r/ogden,0,1
"Yes. The pedestal is different now than it is in the street view pic, and the hat is in his hand and not on his head. I wonder if the whole thing had been replaced since the street view image was last taken...",t2_ad825,ladyleisel,0,1648759533.0,0,t1_i2wagx5,i2wagx5,False,Papyrus_Sans,t3_tkf9ep,https://www.reddit.com/r/ogden/comments/tkf9ep/statue_in_the_ogden_cemetery/,Statue in the Ogden Cemetery,/r/ogden/comments/tkf9ep/statue_in_the_ogden_cemetery/i2wagx5/,1,r/ogden,0,1
You know you’re from Ogden if you use your instead of you’re,t2_ca5dyv4x,DisgruntledLabWorker,0,1648758721.0,0,t1_i2w8azw,i2w8azw,False,denoje13,t3_tgki26,https://www.reddit.com/r/ogden/comments/tgki26/if_these_are_your_children_you_failed/,"If these are your children, you failed!",/r/ogden/comments/tgki26/if_these_are_your_children_you_failed/i2w8azw/,1,r/ogden,0,1
Did you?,t2_ca5dyv4x,DisgruntledLabWorker,0,1648758611.0,0,t1_i2w80g6,i2w80g6,False,Papyrus_Sans,t3_tkf9ep,https://www.reddit.com/r/ogden/comments/tkf9ep/statue_in_the_ogden_cemetery/,Statue in the Ogden Cemetery,/r/ogden/comments/tkf9ep/statue_in_the_ogden_cemetery/i2w80g6/,1,r/ogden,0,1
Why? Are there shady business practices or anything else I should know about?,t2_4c46s,KrimsonKing,0,1648739555.0,0,t1_i2uubc3,i2uubc3,False,Electrical_Lynx_7323,t3_ts7e2k,https://www.reddit.com/r/ogden/comments/ts7e2k/good_coffee/,Good coffee?,/r/ogden/comments/ts7e2k/good_coffee/i2uubc3/,1,r/ogden,0,1
"I like them but I like cold brew, lol",t2_8ipd1,jdd32,0,1648731676.0,0,t1_i2uc07y,i2uc07y,False,Electrical_Lynx_7323,t3_ts7e2k,https://www.reddit.com/r/ogden/comments/ts7e2k/good_coffee/,Good coffee?,/r/ogden/comments/ts7e2k/good_coffee/i2uc07y/,1,r/ogden,0,1
Why? I kind of got weird vibes there. Or just weird vibes with the corvette parked out front haha. But I would be curious why.,t2_2hmve8l6,scubyrue,0,1648731357.0,0,t1_i2ubcyh,i2ubcyh,False,Electrical_Lynx_7323,t3_ts7e2k,https://www.reddit.com/r/ogden/comments/ts7e2k/good_coffee/,Good coffee?,/r/ogden/comments/ts7e2k/good_coffee/i2ubcyh/,1,r/ogden,0,1
Coffee links,t2_5q84yfmi,lienad801,0,1648727051.0,0,t1_i2u3kiu,i2u3kiu,True,Electrical_Lynx_7323,t3_ts7e2k,https://www.reddit.com/r/ogden/comments/ts7e2k/good_coffee/,Good coffee?,/r/ogden/comments/ts7e2k/good_coffee/i2u3kiu/,1,r/ogden,0,1
The employees are so fun and kind! They seriously make my day!,t2_iu1zp00l,pantycake123,0,1648726263.0,0,t1_i2u2bjs,i2u2bjs,False,Electrical_Lynx_7323,t3_ts7e2k,https://www.reddit.com/r/ogden/comments/ts7e2k/good_coffee/,Good coffee?,/r/ogden/comments/ts7e2k/good_coffee/i2u2bjs/,2,r/ogden,0,2
Yes! Their chai is amazing too.,t2_iu1zp00l,pantycake123,0,1648726216.0,0,t1_i2u28yd,i2u28yd,False,Electrical_Lynx_7323,t3_ts7e2k,https://www.reddit.com/r/ogden/comments/ts7e2k/good_coffee/,Good coffee?,/r/ogden/comments/ts7e2k/good_coffee/i2u28yd/,1,r/ogden,0,1
Coffee links is AMAZING AMAZING AMAZING! second choice would be la crepe og. They also have amazing food and crazy milkshakes.,t2_16w8ag,eandrus,0,1648717080.0,0,t1_i2tqh40,i2tqh40,True,Electrical_Lynx_7323,t3_ts7e2k,https://www.reddit.com/r/ogden/comments/ts7e2k/good_coffee/,Good coffee?,/r/ogden/comments/ts7e2k/good_coffee/i2tqh40/,1,r/ogden,0,1
Wasatch is kinda scummy though,t2_4tpkfxwz,braydencousins,0,1648714861.0,0,t1_i2tnyvn,i2tnyvn,False,Electrical_Lynx_7323,t3_ts7e2k,https://www.reddit.com/r/ogden/comments/ts7e2k/good_coffee/,Good coffee?,/r/ogden/comments/ts7e2k/good_coffee/i2tnyvn/,1,r/ogden,0,1
Wasatch is kind of dirty though,t2_4tpkfxwz,braydencousins,0,1648714769.0,0,t1_i2tnv0m,i2tnv0m,False,Electrical_Lynx_7323,t3_ts7e2k,https://www.reddit.com/r/ogden/comments/ts7e2k/good_coffee/,Good coffee?,/r/ogden/comments/ts7e2k/good_coffee/i2tnv0m/,1,r/ogden,0,1
Grounds for coffee. I wish kaffe merc’s coffee was good as it’s so close to me but it’s always weak as fuck,t2_74q6e,osmosisjonesin,0,1648708836.0,0,t1_i2tgs4t,i2tgs4t,True,Electrical_Lynx_7323,t3_ts7e2k,https://www.reddit.com/r/ogden/comments/ts7e2k/good_coffee/,Good coffee?,/r/ogden/comments/ts7e2k/good_coffee/i2tgs4t/,1,r/ogden,0,1
Thanks! That's a repulsive response from BRC. It's not like Bux called them out or anything. Ugh.,t2_16iz9u,breeze80,0,1648708324.0,0,t1_i2tg44y,i2tg44y,False,Electrical_Lynx_7323,t3_ts7e2k,https://www.reddit.com/r/ogden/comments/ts7e2k/good_coffee/,Good coffee?,/r/ogden/comments/ts7e2k/good_coffee/i2tg44y/,1,r/ogden,0,1
"In 2017 Starbucks announced they would like to hire 10,000 refugees. Black Rifle Coffee then ran an ad campaign that mocked Starbucks, photoshopping Starbucks cups alongside photos of ISIS fighters.  BRC said they would hire 10,000 veterans instead.  You don't have to be a golden retriever to sniff out that dogwhistle.",t2_6isgz,Vic_Sinclair,0,1648708066.0,0,t1_i2tfs1a,i2tfs1a,False,Electrical_Lynx_7323,t3_ts7e2k,https://www.reddit.com/r/ogden/comments/ts7e2k/good_coffee/,Good coffee?,/r/ogden/comments/ts7e2k/good_coffee/i2tfs1a/,2,r/ogden,0,2
Genuinely curious- how so?,t2_16iz9u,breeze80,0,1648707553.0,0,t1_i2tf3q3,i2tf3q3,False,Electrical_Lynx_7323,t3_ts7e2k,https://www.reddit.com/r/ogden/comments/ts7e2k/good_coffee/,Good coffee?,/r/ogden/comments/ts7e2k/good_coffee/i2tf3q3/,1,r/ogden,0,1
"I’m a native. Lots of group think, just saying. As a person who traveled for business regularly to the Bay Area, I can say that there is no fine dining here, if you’re okay with that, fine. Liquor is a mess, there’s no wine or liquor in the grocery store and the state monopoly doesn’t even jive with the beliefs of the dominant political party.

People always think Utahns are friendly. Yes, they’re trying to recruit you into their religion or MLM/Ponzi scheme. Don’t get me wrong, Utah is indeed a beautiful place, there’s just a lot of messed up people and beliefs here.",t2_5uf2d4e8,Big_Comparison2849,0,1648700953.0,0,t1_i2t586q,i2t586q,True,Howler777,t3_tpcwbe,https://www.reddit.com/r/ogden/comments/tpcwbe/moving_in/,Moving in!,/r/ogden/comments/tpcwbe/moving_in/i2t586q/,1,r/ogden,0,1
"I’ve lived within a half block of the BST for over 20 years and in all that time have been nearly run down on foot by so many bikers, despite the rules posted of bike riders always yielding to hikers. It’s definitely a northern Utah thing, I’ve never had it happen in Moab, Kanab or at my vacation home area in Southern California.",t2_5uf2d4e8,Big_Comparison2849,0,1648700460.0,0,t1_i2t4e6k,i2t4e6k,True,bob_scratchit,t3_tqmfpe,https://www.reddit.com/r/ogden/comments/tqmfpe/mtb_etiquette/,MTB Etiquette?,/r/ogden/comments/tqmfpe/mtb_etiquette/i2t4e6k/,1,r/ogden,0,1
"I haven't been to many coffee places here, but I really like the one right by waffle love.",t2_3j3iqta5,ZernoBrug,0,1648698231.0,0,t1_i2t0ghm,i2t0ghm,True,Electrical_Lynx_7323,t3_ts7e2k,https://www.reddit.com/r/ogden/comments/ts7e2k/good_coffee/,Good coffee?,/r/ogden/comments/ts7e2k/good_coffee/i2t0ghm/,2,r/ogden,0,2
"if anyone here is new to ogden after getting a job at that big corporate down in roy, let me know",t2_tj2ye,yellow_smurf10,0,1648698071.0,0,t1_i2t05uv,i2t05uv,True,Mos_Def_Fosh_Totes,t3_tlvxdy,https://www.reddit.com/r/ogden/comments/tlvxdy/new_in_town_mid_20s_where_do_i_go/,"new in town, mid 20s where do I go?",/r/ogden/comments/tlvxdy/new_in_town_mid_20s_where_do_i_go/i2t05uv/,1,r/ogden,0,1
"""soul city coffee"" if youre looking for a drive through. 

all their drinks are consistently great, and the nitro cold brew is amazing.",t2_6ph6k,Piscea,0,1648697303.0,0,t1_i2sypt9,i2sypt9,True,Electrical_Lynx_7323,t3_ts7e2k,https://www.reddit.com/r/ogden/comments/ts7e2k/good_coffee/,Good coffee?,/r/ogden/comments/ts7e2k/good_coffee/i2sypt9/,1,r/ogden,0,1
Also here for DR,t2_cohkgy7s,MassiveDepartment34,0,1648694533.0,0,t1_i2st6h5,i2st6h5,False,Electrical_Lynx_7323,t3_ts7e2k,https://www.reddit.com/r/ogden/comments/ts7e2k/good_coffee/,Good coffee?,/r/ogden/comments/ts7e2k/good_coffee/i2st6h5/,3,r/ogden,0,3
That shits funny right there.,t2_4c46s,KrimsonKing,0,1648694525.0,0,t1_i2st5wx,i2st5wx,False,Electrical_Lynx_7323,t3_ts7e2k,https://www.reddit.com/r/ogden/comments/ts7e2k/good_coffee/,Good coffee?,/r/ogden/comments/ts7e2k/good_coffee/i2st5wx/,1,r/ogden,0,1
"I love Wasatch Roasters. I’m there every weekend with my son.  I’m greatful we have a good third wave place in town. Other than that, Daily Rise is great and everything else is ok in a pinch. Haven’t tried Cuppa yet though.",t2_4c46s,KrimsonKing,0,1648694438.0,0,t1_i2ssza7,i2ssza7,True,Electrical_Lynx_7323,t3_ts7e2k,https://www.reddit.com/r/ogden/comments/ts7e2k/good_coffee/,Good coffee?,/r/ogden/comments/ts7e2k/good_coffee/i2ssza7/,0,r/ogden,0,0
I like Scooters on Riverdale Road (near Harmons).,t2_a0bmw,fix_dis,0,1648691456.0,0,t1_i2smkbj,i2smkbj,True,Electrical_Lynx_7323,t3_ts7e2k,https://www.reddit.com/r/ogden/comments/ts7e2k/good_coffee/,Good coffee?,/r/ogden/comments/ts7e2k/good_coffee/i2smkbj/,1,r/ogden,0,1
"I agree, my favorite place",t2_45k1jsf3,Wabikemosabi,0,1648687434.0,0,t1_i2sdoay,i2sdoay,False,Electrical_Lynx_7323,t3_ts7e2k,https://www.reddit.com/r/ogden/comments/ts7e2k/good_coffee/,Good coffee?,/r/ogden/comments/ts7e2k/good_coffee/i2sdoay/,1,r/ogden,0,1
WB’s Eatery on 25th,t2_5ukrr8tq,Rice0504,0,1648685782.0,0,t1_i2sa1ou,i2sa1ou,True,Electrical_Lynx_7323,t3_ts7e2k,https://www.reddit.com/r/ogden/comments/ts7e2k/good_coffee/,Good coffee?,/r/ogden/comments/ts7e2k/good_coffee/i2sa1ou/,1,r/ogden,0,1
I'm a veteran and I find Black Rifle's messaging pretty repulsive.,t2_6isgz,Vic_Sinclair,0,1648681643.0,0,t1_i2s12ws,i2s12ws,False,Electrical_Lynx_7323,t3_ts7e2k,https://www.reddit.com/r/ogden/comments/ts7e2k/good_coffee/,Good coffee?,/r/ogden/comments/ts7e2k/good_coffee/i2s12ws/,6,r/ogden,0,6
Cuppa,t2_hsjxy,ILikeChocolateMilk23,0,1648674829.0,0,t1_i2rl97s,i2rl97s,True,Electrical_Lynx_7323,t3_ts7e2k,https://www.reddit.com/r/ogden/comments/ts7e2k/good_coffee/,Good coffee?,/r/ogden/comments/ts7e2k/good_coffee/i2rl97s/,2,r/ogden,0,2
"Kaffe Mercantile and DailyRise for sure. If you want something on the sweeter side, go to DailyRise. They also have the best employees and their energy alone will make your day. The Merc has incredible coffee. Not too sweet, but they don’t burn it so the taste is fantastic",t2_4tpkfxwz,braydencousins,0,1648673667.0,0,t1_i2rie54,i2rie54,True,Electrical_Lynx_7323,t3_ts7e2k,https://www.reddit.com/r/ogden/comments/ts7e2k/good_coffee/,Good coffee?,/r/ogden/comments/ts7e2k/good_coffee/i2rie54/,5,r/ogden,0,5
"It's just sugar... 

Lots of sugar...",t2_4vhk92g2,U_Should_Be_Ashamed,0,1648672856.0,0,t1_i2rgcla,i2rgcla,False,Electrical_Lynx_7323,t3_ts7e2k,https://www.reddit.com/r/ogden/comments/ts7e2k/good_coffee/,Good coffee?,/r/ogden/comments/ts7e2k/good_coffee/i2rgcla/,2,r/ogden,0,2
"Ranked in order for me:

1. Daily Rise
2. Wasatch (I'm a light roast guy, otherwise they're lower)
3. Kaffe Merc
4. Coffee compound
5. Starbucks (consistency is convenient)
6. Coffee links
7. Grounds for Coffee (no one likes burnt Coffee)",t2_6gb9qj8a,cc51beastin,0,1648671770.0,0,t1_i2rdlwk,i2rdlwk,True,Electrical_Lynx_7323,t3_ts7e2k,https://www.reddit.com/r/ogden/comments/ts7e2k/good_coffee/,Good coffee?,/r/ogden/comments/ts7e2k/good_coffee/i2rdlwk/,9,r/ogden,0,9
Vintage Grind in Riverdale/Roy,t2_1x017d5s,elesmnii,0,1648671720.0,0,t1_i2rdhcf,i2rdhcf,True,Electrical_Lynx_7323,t3_ts7e2k,https://www.reddit.com/r/ogden/comments/ts7e2k/good_coffee/,Good coffee?,/r/ogden/comments/ts7e2k/good_coffee/i2rdhcf/,2,r/ogden,0,2
Agreed. The owners are good people too.,t2_6gb9qj8a,cc51beastin,0,1648671475.0,0,t1_i2rcuq4,i2rcuq4,False,Electrical_Lynx_7323,t3_ts7e2k,https://www.reddit.com/r/ogden/comments/ts7e2k/good_coffee/,Good coffee?,/r/ogden/comments/ts7e2k/good_coffee/i2rcuq4/,5,r/ogden,0,5
Starbucks’ secret is somehow sneaking in 100 more mg of caffeine.,t2_1rr9onx3,Mtnrunnr,0,1648668588.0,0,t1_i2r5hw6,i2r5hw6,False,Electrical_Lynx_7323,t3_ts7e2k,https://www.reddit.com/r/ogden/comments/ts7e2k/good_coffee/,Good coffee?,/r/ogden/comments/ts7e2k/good_coffee/i2r5hw6/,3,r/ogden,0,3
I think they must have a bad barista. It’s been bad 1/5th of the times I go. Sometimes unbelievably badly. The other times it’s been great.,t2_1rr9onx3,Mtnrunnr,0,1648668559.0,0,t1_i2r5f67,i2r5f67,False,Electrical_Lynx_7323,t3_ts7e2k,https://www.reddit.com/r/ogden/comments/ts7e2k/good_coffee/,Good coffee?,/r/ogden/comments/ts7e2k/good_coffee/i2r5f67/,2,r/ogden,0,2
Beanacolada in the library in Wasington Terrace,t2_53mjky7o,juxlez,0,1648668506.0,0,t1_i2r5a97,i2r5a97,True,Electrical_Lynx_7323,t3_ts7e2k,https://www.reddit.com/r/ogden/comments/ts7e2k/good_coffee/,Good coffee?,/r/ogden/comments/ts7e2k/good_coffee/i2r5a97/,2,r/ogden,0,2
Coffe Links. Great coffee food and owners,t2_cedpx9tq,TraditionalFarm9567,0,1648667900.0,0,t1_i2r3pm7,i2r3pm7,True,Electrical_Lynx_7323,t3_ts7e2k,https://www.reddit.com/r/ogden/comments/ts7e2k/good_coffee/,Good coffee?,/r/ogden/comments/ts7e2k/good_coffee/i2r3pm7/,1,r/ogden,0,1
I stopped going because I assumed they always burned it after my first three tries. Maybe my timing was just bad.,t2_133jvfjj,Pirate_Frank,0,1648667698.0,0,t1_i2r377s,i2r377s,False,Electrical_Lynx_7323,t3_ts7e2k,https://www.reddit.com/r/ogden/comments/ts7e2k/good_coffee/,Good coffee?,/r/ogden/comments/ts7e2k/good_coffee/i2r377s/,3,r/ogden,0,3
Isn't that Starbucks trade secret? Lol,t2_141av2,RufusCranium,0,1648666194.0,0,t1_i2qzd2j,i2qzd2j,False,Electrical_Lynx_7323,t3_ts7e2k,https://www.reddit.com/r/ogden/comments/ts7e2k/good_coffee/,Good coffee?,/r/ogden/comments/ts7e2k/good_coffee/i2qzd2j/,6,r/ogden,0,6
+1 for daily rise.,t2_14cwft,OfficerBlind91,0,1648663894.0,0,t1_i2qtj1h,i2qtj1h,False,Electrical_Lynx_7323,t3_ts7e2k,https://www.reddit.com/r/ogden/comments/ts7e2k/good_coffee/,Good coffee?,/r/ogden/comments/ts7e2k/good_coffee/i2qtj1h/,4,r/ogden,0,4
"A coffee snob, in this context, is someone that cares if two equivalent cups of coffee are roasted in house and are sourced specifically. I do not. I like coffee that tastes decent and that’s it. I don’t have the pallet to tell a difference (I don’t think there is, so I’ll let people who can tell me what they think). 

Op asked for coffee recs, I’m giving him one with my reasoning. There is no reason to be a dickhead.",t2_1rr9onx3,Mtnrunnr,0,1648662683.0,0,t1_i2qqgl3,i2qqgl3,False,Electrical_Lynx_7323,t3_ts7e2k,https://www.reddit.com/r/ogden/comments/ts7e2k/good_coffee/,Good coffee?,/r/ogden/comments/ts7e2k/good_coffee/i2qqgl3/,9,r/ogden,0,9
You can be a yuppy and drink drink crap coffee. It’s OK there’s nothing wrong with being a yuppie it’s just who you are,t2_cy6v8ko5,Pale_Reason4904,1,1648661839.0,0,t1_i2qoag0,i2qoag0,False,Electrical_Lynx_7323,t3_ts7e2k,https://www.reddit.com/r/ogden/comments/ts7e2k/good_coffee/,Good coffee?,/r/ogden/comments/ts7e2k/good_coffee/i2qoag0/,-4,r/ogden,0,-4
😂 a snob,t2_cy6v8ko5,Pale_Reason4904,0,1648661797.0,0,t1_i2qo6ka,i2qo6ka,False,Electrical_Lynx_7323,t3_ts7e2k,https://www.reddit.com/r/ogden/comments/ts7e2k/good_coffee/,Good coffee?,/r/ogden/comments/ts7e2k/good_coffee/i2qo6ka/,-7,r/ogden,0,-7
"Daily Rise, drive thru location between 28th & 29th, or walk-in location on Washington downtown. 

They have the best coffee, bar none.",t2_2ejnwlgr,iron07maiden,0,1648660249.0,0,t1_i2qk8lu,i2qk8lu,True,Electrical_Lynx_7323,t3_ts7e2k,https://www.reddit.com/r/ogden/comments/ts7e2k/good_coffee/,Good coffee?,/r/ogden/comments/ts7e2k/good_coffee/i2qk8lu/,13,r/ogden,0,13
"Wasatch hit the boy cam up

Edit: aight I guess y’all really hate wasatch",t2_2ufaafv0,troutline9,0,1648659905.0,0,t1_i2qjdpq,i2qjdpq,True,Electrical_Lynx_7323,t3_ts7e2k,https://www.reddit.com/r/ogden/comments/ts7e2k/good_coffee/,Good coffee?,/r/ogden/comments/ts7e2k/good_coffee/i2qjdpq/,-6,r/ogden,0,-6
Gross 😎,t2_9tlru,nyne87,0,1648658440.0,0,t1_i2qfn86,i2qfn86,False,Electrical_Lynx_7323,t3_ts7e2k,https://www.reddit.com/r/ogden/comments/ts7e2k/good_coffee/,Good coffee?,/r/ogden/comments/ts7e2k/good_coffee/i2qfn86/,-2,r/ogden,0,-2
"Yep. The atmosphere is better and the coffee is give or take equivalent. If you’re a snob Wasatch is probably the place for you. If you like a more local feel, and don’t mind decently prepared but not local coffee, I think grounds is the place. 

There’s nothing wrong with being a snob, by the way. But you know who you are.",t2_1rr9onx3,Mtnrunnr,1,1648658422.0,0,t1_i2qfljq,i2qfljq,False,Electrical_Lynx_7323,t3_ts7e2k,https://www.reddit.com/r/ogden/comments/ts7e2k/good_coffee/,Good coffee?,/r/ogden/comments/ts7e2k/good_coffee/i2qfljq/,5,r/ogden,0,5
