body,author_fullname,author.name,controversiality,created,downs,fullname,id,is_root,link_author,link_id,link_permalink,link_title,permalink,score,subreddit_name_prefixed,total_awards_received,ups
"I don’t know who they are….all I know is that in Ogden, once they get you…you’re gone…..for ev ver, for ev ver, for ev ver…..",t2_gp0otmin,Jesup_Christ,0,1646499166.0,0,t1_hzgwgx9,hzgwgx9,False,beginnermodeller1993,t3_t6x8r2,https://www.reddit.com/r/ogden/comments/t6x8r2/moving_to_ogden_ut_rental_suggestions/,"Moving to Ogden, UT. Rental suggestions?",/r/ogden/comments/t6x8r2/moving_to_ogden_ut_rental_suggestions/hzgwgx9/,1,r/ogden,0,1
Missionaries?,t2_8p274owe,the-little-who,0,1646498998.0,0,t1_hzgw2gi,hzgw2gi,False,beginnermodeller1993,t3_t6x8r2,https://www.reddit.com/r/ogden/comments/t6x8r2/moving_to_ogden_ut_rental_suggestions/,"Moving to Ogden, UT. Rental suggestions?",/r/ogden/comments/t6x8r2/moving_to_ogden_ut_rental_suggestions/hzgw2gi/,2,r/ogden,0,2
"I would honestly suggest Layton, West haven (if you can find something in that price range) or Central Ogden (between Harrison and Monroe), the crime has gone down significantly in many pockets of that area. I live on the east bench in a whole house for what would be considered a steal right now. ($1400 for 4 beds, but the owner is selling soon lol) but you won't find a deal like that pretty much anywhere in Ogden right now. Look at some of these new bulidings that are being built, sometimes they throw a bone to people who sign leases and have referrals.",t2_6gb9qj8a,cc51beastin,0,1646498348.0,0,t1_hzgujf5,hzgujf5,True,beginnermodeller1993,t3_t6x8r2,https://www.reddit.com/r/ogden/comments/t6x8r2/moving_to_ogden_ut_rental_suggestions/,"Moving to Ogden, UT. Rental suggestions?",/r/ogden/comments/t6x8r2/moving_to_ogden_ut_rental_suggestions/hzgujf5/,3,r/ogden,0,3
"Yeah, but OP won't find anything reasonable for under 1300 in the areas you've mentioned. Ogden is California expensive now. There are pockets of good stuff in between Harrison and Washington and especially so between Harrison and Monroe. You just have to know where to look. If OP doesn't mind driving, Layton wouldn't be a bad idea.",t2_6gb9qj8a,cc51beastin,0,1646497695.0,0,t1_hzgszaa,hzgszaa,False,beginnermodeller1993,t3_t6x8r2,https://www.reddit.com/r/ogden/comments/t6x8r2/moving_to_ogden_ut_rental_suggestions/,"Moving to Ogden, UT. Rental suggestions?",/r/ogden/comments/t6x8r2/moving_to_ogden_ut_rental_suggestions/hzgszaa/,3,r/ogden,0,3
Roy and West Haven are just as bad now. The view used to be under $1300 for 2 bed 2 bath but it's probably significantly more now right?,t2_6gb9qj8a,cc51beastin,0,1646497474.0,0,t1_hzgsgtb,hzgsgtb,False,beginnermodeller1993,t3_t6x8r2,https://www.reddit.com/r/ogden/comments/t6x8r2/moving_to_ogden_ut_rental_suggestions/,"Moving to Ogden, UT. Rental suggestions?",/r/ogden/comments/t6x8r2/moving_to_ogden_ut_rental_suggestions/hzgsgtb/,1,r/ogden,0,1
Op won't find anything on the bench under $1300 though. Maybe a room lol,t2_6gb9qj8a,cc51beastin,0,1646497261.0,0,t1_hzgryun,hzgryun,False,beginnermodeller1993,t3_t6x8r2,https://www.reddit.com/r/ogden/comments/t6x8r2/moving_to_ogden_ut_rental_suggestions/,"Moving to Ogden, UT. Rental suggestions?",/r/ogden/comments/t6x8r2/moving_to_ogden_ut_rental_suggestions/hzgryun/,6,r/ogden,0,6
It's insanity now.,t2_6gb9qj8a,cc51beastin,0,1646497206.0,0,t1_hzgru40,hzgru40,False,beginnermodeller1993,t3_t6x8r2,https://www.reddit.com/r/ogden/comments/t6x8r2/moving_to_ogden_ut_rental_suggestions/,"Moving to Ogden, UT. Rental suggestions?",/r/ogden/comments/t6x8r2/moving_to_ogden_ut_rental_suggestions/hzgru40/,3,r/ogden,0,3
"Avoid anything from Wall to Harrison(N-S running streets) and 20th to 36th (E-W running streets) in Ogden. While Ogden is making moves in the right direction in that area, crime is still an issue. 

Layton is also close by, and has a lot of rental areas because of the air force base",t2_16iz9u,breeze80,0,1646490068.0,0,t1_hzgcgum,hzgcgum,True,beginnermodeller1993,t3_t6x8r2,https://www.reddit.com/r/ogden/comments/t6x8r2/moving_to_ogden_ut_rental_suggestions/,"Moving to Ogden, UT. Rental suggestions?",/r/ogden/comments/t6x8r2/moving_to_ogden_ut_rental_suggestions/hzgcgum/,3,r/ogden,0,3
Good luck finding any rent under $1300!,t2_emd8h1il,lonesomeutcowboy,0,1646489831.0,0,t1_hzgc07y,hzgc07y,True,beginnermodeller1993,t3_t6x8r2,https://www.reddit.com/r/ogden/comments/t6x8r2/moving_to_ogden_ut_rental_suggestions/,"Moving to Ogden, UT. Rental suggestions?",/r/ogden/comments/t6x8r2/moving_to_ogden_ut_rental_suggestions/hzgc07y/,18,r/ogden,0,18
wow,t2_kd4ecm1u,Financial-Spell286,0,1646488594.0,0,t1_hzg9onl,hzg9onl,True,beginnermodeller1993,t3_t6x8r2,https://www.reddit.com/r/ogden/comments/t6x8r2/moving_to_ogden_ut_rental_suggestions/,"Moving to Ogden, UT. Rental suggestions?",/r/ogden/comments/t6x8r2/moving_to_ogden_ut_rental_suggestions/hzg9onl/,0,r/ogden,0,0
"There aren't too many bad areas in Utah. Good luck finding a place within that price range. I was renting at The View on 20th and it wasn't a bad spot. They did recently raise their rent so it might be out of your price range.

Like others have said, South Ogden is really nice, but it can be pricey. North Ogden is in the same situation. If you don't mind driving, you might want to look at Roy or West Haven. They aren't too far away and tend to be a bit cheaper.",t2_8zj5n,IBelrose,0,1646482195.0,0,t1_hzfzjjf,hzfzjjf,True,beginnermodeller1993,t3_t6x8r2,https://www.reddit.com/r/ogden/comments/t6x8r2/moving_to_ogden_ut_rental_suggestions/,"Moving to Ogden, UT. Rental suggestions?",/r/ogden/comments/t6x8r2/moving_to_ogden_ut_rental_suggestions/hzfzjjf/,3,r/ogden,0,3
"The North Ogden townhouses off W 2700 N & W 2550 N are great. They're quiet, family neighborhoods. I would avoid anything between 1500 N and 4000 S (South end of North Ogden, Harrisville, and most of Ogden) with the exception of the east bench of Ogden as the other commenter noted. Farr west, Plain City, and Pleasant View are also nice quiet areas, but I don't know about townhouses there",t2_f1a1h,riptath,0,1646468117.0,0,t1_hzfhqxa,hzfhqxa,True,beginnermodeller1993,t3_t6x8r2,https://www.reddit.com/r/ogden/comments/t6x8r2/moving_to_ogden_ut_rental_suggestions/,"Moving to Ogden, UT. Rental suggestions?",/r/ogden/comments/t6x8r2/moving_to_ogden_ut_rental_suggestions/hzfhqxa/,2,r/ogden,0,2
You’re never safe…..once you think you are….they get you.,t2_gp0otmin,Jesup_Christ,0,1646456743.0,0,t1_hzf063x,hzf063x,True,beginnermodeller1993,t3_t6x8r2,https://www.reddit.com/r/ogden/comments/t6x8r2/moving_to_ogden_ut_rental_suggestions/,"Moving to Ogden, UT. Rental suggestions?",/r/ogden/comments/t6x8r2/moving_to_ogden_ut_rental_suggestions/hzf063x/,3,r/ogden,0,3
"In My opinion, the East Bench is the best area in ogden. Especially between 24-27th street. 
The homes are older, Well built and full of character and history. Not cookie cutter.  You’re Close to everything yet up and away at Same time. Not to mention the beautiful mountains, trails, waterfall are right behind you.
 The people are more open, artsy, eclectic, professionals, lots of local business owners, various beliefs, not just one type. 
 There  is also a gated community up here.",t2_f8mtho6g,TheRealHouseWife801,0,1646454927.0,0,t1_hzewr3z,hzewr3z,True,beginnermodeller1993,t3_t6x8r2,https://www.reddit.com/r/ogden/comments/t6x8r2/moving_to_ogden_ut_rental_suggestions/,"Moving to Ogden, UT. Rental suggestions?",/r/ogden/comments/t6x8r2/moving_to_ogden_ut_rental_suggestions/hzewr3z/,5,r/ogden,0,5
there are literally no 'college/university party zones' in ogden which tbh sucks.  whatever university you came from was way cooler and way more fun than here.  I really wish there was a 'university zone' in town.,t2_551r2,NBABUCKS1,0,1646443345.0,0,t1_hze87sg,hze87sg,True,beginnermodeller1993,t3_t6x8r2,https://www.reddit.com/r/ogden/comments/t6x8r2/moving_to_ogden_ut_rental_suggestions/,"Moving to Ogden, UT. Rental suggestions?",/r/ogden/comments/t6x8r2/moving_to_ogden_ut_rental_suggestions/hze87sg/,7,r/ogden,0,7
"Can you point to some specifics? Moving from the south, so the prices are a shock!",t2_27vxf61t,beginnermodeller1993,0,1646441106.0,0,t1_hze38uv,hze38uv,False,beginnermodeller1993,t3_t6x8r2,https://www.reddit.com/r/ogden/comments/t6x8r2/moving_to_ogden_ut_rental_suggestions/,"Moving to Ogden, UT. Rental suggestions?",/r/ogden/comments/t6x8r2/moving_to_ogden_ut_rental_suggestions/hze38uv/,3,r/ogden,0,3
I would say those are some good places to look for safety. South Ogden is nice too and you might find something in the price range you are looking for.,t2_5s1tkdj0,-gottalaugh-,0,1646440733.0,0,t1_hze2eiy,hze2eiy,True,beginnermodeller1993,t3_t6x8r2,https://www.reddit.com/r/ogden/comments/t6x8r2/moving_to_ogden_ut_rental_suggestions/,"Moving to Ogden, UT. Rental suggestions?",/r/ogden/comments/t6x8r2/moving_to_ogden_ut_rental_suggestions/hze2eiy/,6,r/ogden,0,6
"Best car was in Weber County, too (for the price)",t2_6gb9qj8a,cc51beastin,0,1646436646.0,0,t1_hzdswq7,hzdswq7,False,boredx100,t3_t6jy1n,https://www.reddit.com/r/ogden/comments/t6jy1n/dog_wash_for_very_large_dog/,Dog wash for very large dog?,/r/ogden/comments/t6jy1n/dog_wash_for_very_large_dog/hzdswq7/,1,r/ogden,0,1
"I've only been a few times and not recently, so weigh accordingly. There's a little of that vibe on the weekend but I wouldn't define it as such.

It's pretty low key otherwise. A bit divey, which isn't a bad thing!",t2_b5y97vw5,MyUtahRedditAccount,0,1646430133.0,0,t1_hzdcrwj,hzdcrwj,False,discover-stuff,t3_t5xt12,https://www.reddit.com/r/ogden/comments/t5xt12/good_bars_with_chill_ambient/,Good bars with chill ambient?,/r/ogden/comments/t5xt12/good_bars_with_chill_ambient/hzdcrwj/,3,r/ogden,0,3
Johnny’s pet and car wash in Kaysville- I take my rotties there for self serve dog wash,t2_6k1snzg,gabismyusername,0,1646423579.0,0,t1_hzcvlz8,hzcvlz8,True,boredx100,t3_t6jy1n,https://www.reddit.com/r/ogden/comments/t6jy1n/dog_wash_for_very_large_dog/,Dog wash for very large dog?,/r/ogden/comments/t6jy1n/dog_wash_for_very_large_dog/hzcvlz8/,2,r/ogden,0,2
"Sorry bout that…😉

Enjoy your trip to Ogden!!!👋🏻",t2_gru2quxt,bmwfreq,0,1646422257.0,0,t1_hzcs56r,hzcs56r,False,_0x0_,t3_t5c39p,https://www.reddit.com/r/ogden/comments/t5c39p/visiting_ogden_for_business_need_hotel_suggestions/,"Visiting Ogden for business, need hotel suggestions",/r/ogden/comments/t5c39p/visiting_ogden_for_business_need_hotel_suggestions/hzcs56r/,1,r/ogden,0,1
"No problem at all! Seeing all those emojis, I am hungry now, though...",t2_cs692,_0x0_,0,1646418235.0,0,t1_hzchqg4,hzchqg4,False,_0x0_,t3_t5c39p,https://www.reddit.com/r/ogden/comments/t5c39p/visiting_ogden_for_business_need_hotel_suggestions/,"Visiting Ogden for business, need hotel suggestions",/r/ogden/comments/t5c39p/visiting_ogden_for_business_need_hotel_suggestions/hzchqg4/,1,r/ogden,0,1
"There’s lots of good restaurants just in the downtown Ogden area alone. My suggestion would be to Google restaurants in the Ogden area, and you’ll be surprised at the number of good places to choose from that come up.

Unfortunately, I do not dine out much, so I wouldn’t be able to personally recommend any restaurants for you. I can say that there appears to be quite a few places to choose from just in the 24th and 25th streets areas between Washington Blvd. and Lincoln Ave.

Wish I could be of more assistance.🍽🥗🍜🍕🍔🌮🌭🌯🥙🥪🍖🍗🥓🍱🥘🧆🍲🍛🍝🍣🍤🥟🍳🥞🧇🍦🍨🍧🍮🥧🍰🎂",t2_gru2quxt,bmwfreq,0,1646416619.0,0,t1_hzcdn4j,hzcdn4j,False,_0x0_,t3_t5c39p,https://www.reddit.com/r/ogden/comments/t5c39p/visiting_ogden_for_business_need_hotel_suggestions/,"Visiting Ogden for business, need hotel suggestions",/r/ogden/comments/t5c39p/visiting_ogden_for_business_need_hotel_suggestions/hzcdn4j/,1,r/ogden,0,1
Cliffs Car Wash in Roy has a self serve dog wash that would handle a dog that size.,t2_7urldi34,Subject-Cupcake-2303,0,1646412927.0,0,t1_hzc49n6,hzc49n6,True,boredx100,t3_t6jy1n,https://www.reddit.com/r/ogden/comments/t6jy1n/dog_wash_for_very_large_dog/,Dog wash for very large dog?,/r/ogden/comments/t6jy1n/dog_wash_for_very_large_dog/hzc49n6/,6,r/ogden,0,6
"Edit: is that Table Twenty Five?

Marked these two! Thanks.",t2_cs692,_0x0_,0,1646412320.0,0,t1_hzc2ppl,hzc2ppl,False,_0x0_,t3_t5c39p,https://www.reddit.com/r/ogden/comments/t5c39p/visiting_ogden_for_business_need_hotel_suggestions/,"Visiting Ogden for business, need hotel suggestions",/r/ogden/comments/t5c39p/visiting_ogden_for_business_need_hotel_suggestions/hzc2ppl/,1,r/ogden,0,1
No problem. Thanks for the suggestion.,t2_cs692,_0x0_,0,1646412306.0,0,t1_hzc2ods,hzc2ods,False,_0x0_,t3_t5c39p,https://www.reddit.com/r/ogden/comments/t5c39p/visiting_ogden_for_business_need_hotel_suggestions/,"Visiting Ogden for business, need hotel suggestions",/r/ogden/comments/t5c39p/visiting_ogden_for_business_need_hotel_suggestions/hzc2ods/,1,r/ogden,0,1
"I absolutely love the Timbermine. Prairie schooner is another. Those are both themed steakhouses.  If you’re looking for pizza and beer slackwater is right across the street from the hotel. I like Ogden river brewing as well.   There’s tona sushi pretty close to the hotel as well. 

As for vegetarian, I kinda suck making recommendations there because I’ve never been vegetarian but most places have some vegetarian options, for instance slackwater has vegetarian pizza.",t2_51dxn9pd,managedinsanity,0,1646408285.0,0,t1_hzbsjac,hzbsjac,False,_0x0_,t3_t5c39p,https://www.reddit.com/r/ogden/comments/t5c39p/visiting_ogden_for_business_need_hotel_suggestions/,"Visiting Ogden for business, need hotel suggestions",/r/ogden/comments/t5c39p/visiting_ogden_for_business_need_hotel_suggestions/hzbsjac/,1,r/ogden,0,1
Table twenty five has a great menu and good wines. Slack water also has some good choices and a wide beer selection.,t2_gk54z,gutrencher,0,1646407000.0,0,t1_hzbpez4,hzbpez4,True,_0x0_,t3_t5c39p,https://www.reddit.com/r/ogden/comments/t5c39p/visiting_ogden_for_business_need_hotel_suggestions/,"Visiting Ogden for business, need hotel suggestions",/r/ogden/comments/t5c39p/visiting_ogden_for_business_need_hotel_suggestions/hzbpez4/,1,r/ogden,0,1
"For food, do you have any recommendations, maybe one place traditional American or italian style, and another vegetarian just in case? We can drive so it doesn't have to be in Ogden exclusively.",t2_cs692,_0x0_,0,1646406349.0,0,t1_hzbnvi8,hzbnvi8,False,_0x0_,t3_t5c39p,https://www.reddit.com/r/ogden/comments/t5c39p/visiting_ogden_for_business_need_hotel_suggestions/,"Visiting Ogden for business, need hotel suggestions",/r/ogden/comments/t5c39p/visiting_ogden_for_business_need_hotel_suggestions/hzbnvi8/,1,r/ogden,0,1
"If you could recommend one vegetarian and another maybe steakhouse or italian that would be great as I am not sure if they are vegetarian or not, but I'll be sure to ask. Hearth was mentioned before, also came across Timbermine, is this a famous spot?  Thanks.",t2_cs692,_0x0_,0,1646405726.0,0,t1_hzbmf40,hzbmf40,False,_0x0_,t3_t5c39p,https://www.reddit.com/r/ogden/comments/t5c39p/visiting_ogden_for_business_need_hotel_suggestions/,"Visiting Ogden for business, need hotel suggestions",/r/ogden/comments/t5c39p/visiting_ogden_for_business_need_hotel_suggestions/hzbmf40/,1,r/ogden,0,1
Some of the Tractor Supply locations have  them. Can't remember if it's the Perry or West Haven location I saw it at though.,t2_54bno,Cunundrum,0,1646404615.0,0,t1_hzbjtw6,hzbjtw6,True,boredx100,t3_t6jy1n,https://www.reddit.com/r/ogden/comments/t6jy1n/dog_wash_for_very_large_dog/,Dog wash for very large dog?,/r/ogden/comments/t6jy1n/dog_wash_for_very_large_dog/hzbjtw6/,3,r/ogden,0,3
Food preference?,t2_51dxn9pd,managedinsanity,0,1646399802.0,0,t1_hzb9qqu,hzb9qqu,False,_0x0_,t3_t5c39p,https://www.reddit.com/r/ogden/comments/t5c39p/visiting_ogden_for_business_need_hotel_suggestions/,"Visiting Ogden for business, need hotel suggestions",/r/ogden/comments/t5c39p/visiting_ogden_for_business_need_hotel_suggestions/hzb9qqu/,1,r/ogden,0,1
"I’m glad I could help, and I hope you have a good time while you’re here. Enjoy your stay!👋🏻",t2_gru2quxt,bmwfreq,0,1646391501.0,0,t1_hzawugm,hzawugm,False,_0x0_,t3_t5c39p,https://www.reddit.com/r/ogden/comments/t5c39p/visiting_ogden_for_business_need_hotel_suggestions/,"Visiting Ogden for business, need hotel suggestions",/r/ogden/comments/t5c39p/visiting_ogden_for_business_need_hotel_suggestions/hzawugm/,1,r/ogden,0,1
Didn't this used to be a biker bar??,t2_f9xzkq3u,PERFECT-Dark-64,0,1646380981.0,0,t1_hzak0so,hzak0so,False,discover-stuff,t3_t5xt12,https://www.reddit.com/r/ogden/comments/t5xt12/good_bars_with_chill_ambient/,Good bars with chill ambient?,/r/ogden/comments/t5xt12/good_bars_with_chill_ambient/hzak0so/,1,r/ogden,0,1
"Thanks, booked Tru.
In the meantime, any suggestions for fancy dinner/nice place to take a client out for evening?",t2_cs692,_0x0_,0,1646375992.0,0,t1_hzad2dm,hzad2dm,False,_0x0_,t3_t5c39p,https://www.reddit.com/r/ogden/comments/t5c39p/visiting_ogden_for_business_need_hotel_suggestions/,"Visiting Ogden for business, need hotel suggestions",/r/ogden/comments/t5c39p/visiting_ogden_for_business_need_hotel_suggestions/hzad2dm/,1,r/ogden,0,1
"Thanks, I am booking Tru by Hilton on 24th, look slike a block away from restaurant and cafes. Sushi sounds great! Thanks for the food suggestions. Any good sandwitch places around there?",t2_cs692,_0x0_,0,1646375935.0,0,t1_hzaczgk,hzaczgk,False,_0x0_,t3_t5c39p,https://www.reddit.com/r/ogden/comments/t5c39p/visiting_ogden_for_business_need_hotel_suggestions/,"Visiting Ogden for business, need hotel suggestions",/r/ogden/comments/t5c39p/visiting_ogden_for_business_need_hotel_suggestions/hzaczgk/,1,r/ogden,0,1
"Tru's price is much better, 149 vs 214 at mariott.
As for other hotels, not in Ogden, are there like mountain hotels/lodges with scenic view/snow that's not too far from Ogden. I love ski lodges, never skii but I love seeing them and if I can visit or stay in one for a night that would also be cool.",t2_cs692,_0x0_,0,1646375702.0,0,t1_hzacn2s,hzacn2s,False,_0x0_,t3_t5c39p,https://www.reddit.com/r/ogden/comments/t5c39p/visiting_ogden_for_business_need_hotel_suggestions/,"Visiting Ogden for business, need hotel suggestions",/r/ogden/comments/t5c39p/visiting_ogden_for_business_need_hotel_suggestions/hzacn2s/,1,r/ogden,0,1
"I don't drink, so I'm often the Designated Driver. This was a while ago, but I was dragged to the Sand Trap by a friend. The bartenders were nice and kept me in Shirley's and sodas all night. Karaoke night was nice too. Even a few years later, a coworker that lived over the bar told me it was still the same kind of vibe.",t2_9042gptm,eGrant03,0,1646375388.0,0,t1_hzac6ct,hzac6ct,True,discover-stuff,t3_t5xt12,https://www.reddit.com/r/ogden/comments/t5xt12/good_bars_with_chill_ambient/,Good bars with chill ambient?,/r/ogden/comments/t5xt12/good_bars_with_chill_ambient/hzac6ct/,2,r/ogden,0,2
"Thanks, I added one more day to my trip so I don't have rush, this is exciting.",t2_cs692,_0x0_,0,1646372801.0,0,t1_hza85jk,hza85jk,False,_0x0_,t3_t5c39p,https://www.reddit.com/r/ogden/comments/t5c39p/visiting_ogden_for_business_need_hotel_suggestions/,"Visiting Ogden for business, need hotel suggestions",/r/ogden/comments/t5c39p/visiting_ogden_for_business_need_hotel_suggestions/hza85jk/,1,r/ogden,0,1
I mean it was my only time there and its been a couple years so could've been a fluke or maybe things have changed and gotten better!,t2_9tlru,nyne87,0,1646364718.0,0,t1_hz9t3v3,hz9t3v3,False,discover-stuff,t3_t5xt12,https://www.reddit.com/r/ogden/comments/t5xt12/good_bars_with_chill_ambient/,Good bars with chill ambient?,/r/ogden/comments/t5xt12/good_bars_with_chill_ambient/hz9t3v3/,2,r/ogden,0,2
Smoking in public parks is prohibited. I think the Lighthouse is a great suggestion though. And it’s right by the Union Station.,t2_6plpp684,thedevilsghost666,0,1646364550.0,0,t1_hz9sro9,hz9sro9,False,Snoo36991,t3_t5v8sy,https://www.reddit.com/r/ogden/comments/t5v8sy/smoking_in_ogden/,Smoking in Ogden?,/r/ogden/comments/t5v8sy/smoking_in_ogden/hz9sro9/,2,r/ogden,0,2
Oh really? Damn. I haven’t been there in a while - sad to hear the service has taken a turn. I really like the atmosphere there.,t2_2g4cmi6s,SteezyRay,0,1646359790.0,0,t1_hz9jdke,hz9jdke,False,discover-stuff,t3_t5xt12,https://www.reddit.com/r/ogden/comments/t5xt12/good_bars_with_chill_ambient/,Good bars with chill ambient?,/r/ogden/comments/t5xt12/good_bars_with_chill_ambient/hz9jdke/,2,r/ogden,0,2
I hear ya. I appreciate and understand the clean air act but I just wish there was some nuance to it. I'd like to go to a public park and not be worried about getting yelled at if a large gathering happens to set up near me while smoking.,t2_hwikr,Uintahwolf,0,1646358923.0,0,t1_hz9hhpf,hz9hhpf,False,Snoo36991,t3_t5v8sy,https://www.reddit.com/r/ogden/comments/t5v8sy/smoking_in_ogden/,Smoking in Ogden?,/r/ogden/comments/t5v8sy/smoking_in_ogden/hz9hhpf/,1,r/ogden,0,1
"Especially awkward with a long-lasting strong cigar which I know not everyone appreciates, thanks for the suggestion!",t2_5tq80k1a,Snoo36991,0,1646357300.0,0,t1_hz9dy5h,hz9dy5h,False,Snoo36991,t3_t5v8sy,https://www.reddit.com/r/ogden/comments/t5v8sy/smoking_in_ogden/,Smoking in Ogden?,/r/ogden/comments/t5v8sy/smoking_in_ogden/hz9dy5h/,1,r/ogden,0,1
"Harp & Hound and Angry Goat both have a nice ambience and I think are good date spots. The Yes Hell is decent too. Go a bit earlier on a weekday to avoid trivia and such, those don't usually start until later.

If you want to get a bite as well then Roosters, Warren's, OGUT, Ogden River Brewing, and Slackwater (can't speak to the new location yet) are all solid choices.",t2_b5y97vw5,MyUtahRedditAccount,0,1646354740.0,0,t1_hz98knp,hz98knp,True,discover-stuff,t3_t5xt12,https://www.reddit.com/r/ogden/comments/t5xt12/good_bars_with_chill_ambient/,Good bars with chill ambient?,/r/ogden/comments/t5xt12/good_bars_with_chill_ambient/hz98knp/,3,r/ogden,0,3
"I used to live on 17th street, down the block from the Ogden Botanical gardens. If you go park at the gardens, and begin walking north on the path alongside the river, there's a couple benches big enough for two. I used to go and smoke my pipe (tobacco) there every other day. Excellent spot.

Smoking in public is difficult and awkward because of the clean air act.",t2_hwikr,Uintahwolf,0,1646354722.0,0,t1_hz98j7t,hz98j7t,True,Snoo36991,t3_t5v8sy,https://www.reddit.com/r/ogden/comments/t5v8sy/smoking_in_ogden/,Smoking in Ogden?,/r/ogden/comments/t5v8sy/smoking_in_ogden/hz98j7t/,2,r/ogden,0,2
Side bar is definitely a good spot.,t2_5ggb5dr7,bythepowerofbeards,0,1646353578.0,0,t1_hz95zkr,hz95zkr,False,discover-stuff,t3_t5xt12,https://www.reddit.com/r/ogden/comments/t5xt12/good_bars_with_chill_ambient/,Good bars with chill ambient?,/r/ogden/comments/t5xt12/good_bars_with_chill_ambient/hz95zkr/,4,r/ogden,0,4
"You're welcome. Roosters is awesome, but I also recommend the Angry Goat.",t2_193afyxk,Reesant,0,1646352187.0,0,t1_hz92ul0,hz92ul0,False,_0x0_,t3_t5c39p,https://www.reddit.com/r/ogden/comments/t5c39p/visiting_ogden_for_business_need_hotel_suggestions/,"Visiting Ogden for business, need hotel suggestions",/r/ogden/comments/t5c39p/visiting_ogden_for_business_need_hotel_suggestions/hz92ul0/,1,r/ogden,0,1
"Can't say I like harp n hound. Had a terrible experience. Waited an hr for a pizza that had raw vegetables on it, beer glasses were warm, poor service in general.",t2_9tlru,nyne87,0,1646352002.0,0,t1_hz92fmb,hz92fmb,False,discover-stuff,t3_t5xt12,https://www.reddit.com/r/ogden/comments/t5xt12/good_bars_with_chill_ambient/,Good bars with chill ambient?,/r/ogden/comments/t5xt12/good_bars_with_chill_ambient/hz92fmb/,4,r/ogden,0,4
"Yes; it is. The Marriott is one block north of where this photo was taken. The photo was taken at 25th and Lincoln. The Marriott is on 24th and Lincoln. So, one block north on Lincoln. Turn right and the Marriott is on your right. I think you’d really enjoy the whole area.

This entire area has a real comfortable feel to it, and it is a safe area.",t2_gru2quxt,bmwfreq,0,1646350402.0,0,t1_hz8yqxf,hz8yqxf,False,_0x0_,t3_t5c39p,https://www.reddit.com/r/ogden/comments/t5c39p/visiting_ogden_for_business_need_hotel_suggestions/,"Visiting Ogden for business, need hotel suggestions",/r/ogden/comments/t5c39p/visiting_ogden_for_business_need_hotel_suggestions/hz8yqxf/,1,r/ogden,0,1
"I came to say The Angry Goat. I've only been there twice in the 3 months I've been here, but can't wait to go again.",t2_6o4dq,horridpineapple,0,1646349974.0,0,t1_hz8xrrc,hz8xrrc,False,discover-stuff,t3_t5xt12,https://www.reddit.com/r/ogden/comments/t5xt12/good_bars_with_chill_ambient/,Good bars with chill ambient?,/r/ogden/comments/t5xt12/good_bars_with_chill_ambient/hz8xrrc/,2,r/ogden,0,2
"Yes on 24th street, right next to historic 25th street and walking distance to the Junction",t2_8la48le2,PineapplePurple1506,0,1646348532.0,0,t1_hz8ufdy,hz8ufdy,False,_0x0_,t3_t5c39p,https://www.reddit.com/r/ogden/comments/t5c39p/visiting_ogden_for_business_need_hotel_suggestions/,"Visiting Ogden for business, need hotel suggestions",/r/ogden/comments/t5c39p/visiting_ogden_for_business_need_hotel_suggestions/hz8ufdy/,1,r/ogden,0,1
Pretty popular suggestion. Thanks!,t2_cs692,_0x0_,0,1646347927.0,0,t1_hz8t01g,hz8t01g,False,_0x0_,t3_t5c39p,https://www.reddit.com/r/ogden/comments/t5c39p/visiting_ogden_for_business_need_hotel_suggestions/,"Visiting Ogden for business, need hotel suggestions",/r/ogden/comments/t5c39p/visiting_ogden_for_business_need_hotel_suggestions/hz8t01g/,1,r/ogden,0,1
