body,author_fullname,author.name,controversiality,created,downs,fullname,id,is_root,link_author,link_id,link_permalink,link_title,permalink,score,subreddit_name_prefixed,total_awards_received,ups
"I paid $257.40 last year for 2 season passes and $380 this year for 2 season passes.  Same amount of shows.  

I think the individual show price went up $5.  Idk about fees.",t2_551r2,NBABUCKS1,0,1647624376.0,0,t1_i16er7c,i16er7c,False,NBABUCKS1,t3_th6ow2,https://www.reddit.com/r/ogden/comments/th6ow2/ogden_twilight_2022_announced/,Ogden Twilight 2022 Announced!,/r/ogden/comments/th6ow2/ogden_twilight_2022_announced/i16er7c/,3,r/ogden,0,3
"Man, $180 for a season pass now. $50 of that is  service fees and taxes.",t2_cbdqebom,bob_scratchit,0,1647624044.0,0,t1_i16dwm2,i16dwm2,True,NBABUCKS1,t3_th6ow2,https://www.reddit.com/r/ogden/comments/th6ow2/ogden_twilight_2022_announced/,Ogden Twilight 2022 Announced!,/r/ogden/comments/th6ow2/ogden_twilight_2022_announced/i16dwm2/,4,r/ogden,0,4
"I filmed this sweet video when I first moved into there in fall of 2016.  I think I paid $1100 in rent and it was like 1700 square feet or something.  It was insane.  If you want to see me say it' YUGE a bunch of times in 2016 here ya go.  

Place was very safe, private parking below.  Can walk around the area but my wife was a bit sketched doing it at night alone but never had any issues.  Things might have changed since then, idk. 

https://www.youtube.com/watch?v=T7R52-odS0c",t2_551r2,NBABUCKS1,0,1647623616.0,0,t1_i16ct4w,i16ct4w,True,Courage-Stable-9713,t3_tgoxgy,https://www.reddit.com/r/ogden/comments/tgoxgy/how_safe_is_downtown_ogden/,How safe is downtown Ogden?,/r/ogden/comments/tgoxgy/how_safe_is_downtown_ogden/i16ct4w/,2,r/ogden,0,2
I recall season passes selling out pretty quick last year so if you want to buy one I'd suggest sooner than later.,t2_551r2,NBABUCKS1,0,1647623425.0,0,t1_i16cbr4,i16cbr4,True,NBABUCKS1,t3_th6ow2,https://www.reddit.com/r/ogden/comments/th6ow2/ogden_twilight_2022_announced/,Ogden Twilight 2022 Announced!,/r/ogden/comments/th6ow2/ogden_twilight_2022_announced/i16cbr4/,3,r/ogden,0,3
"There is some drug use and homeless who wander the park, but as long as you don't go looking for trouble, you'll be fine. It's good to always be aware of your surroundings. I lived a couple blocks away for about 6 years and loved it. 

Fun fact: the city is making that area the arts district. ... so yeah. There's construction going on. But it's a cool area, and it's not a super dangerous area either.",t2_wkuxl,KatyClaire,0,1647616420.0,0,t1_i15ubgk,i15ubgk,True,Courage-Stable-9713,t3_tgoxgy,https://www.reddit.com/r/ogden/comments/tgoxgy/how_safe_is_downtown_ogden/,How safe is downtown Ogden?,/r/ogden/comments/tgoxgy/how_safe_is_downtown_ogden/i15ubgk/,5,r/ogden,0,5
Thanks,t2_9834gklg,Courage-Stable-9713,0,1647616313.0,0,t1_i15u1g2,i15u1g2,False,Courage-Stable-9713,t3_tgoxgy,https://www.reddit.com/r/ogden/comments/tgoxgy/how_safe_is_downtown_ogden/,How safe is downtown Ogden?,/r/ogden/comments/tgoxgy/how_safe_is_downtown_ogden/i15u1g2/,3,r/ogden,0,3
"This is the proof that being friends with your kids never works. I always tell my kids that I am not their friend. I am their parent. Makes me so angry when I see and hear things like this. 100% blame goes to the parents. If my kids ever did anything like this, I would make their life Hell.",t2_j4t7m503,Equivalent-Guest-751,0,1647616164.0,0,t1_i15tnzp,i15tnzp,False,denoje13,t3_tgki26,https://www.reddit.com/r/ogden/comments/tgki26/if_these_are_your_children_you_failed/,"If these are your children, you failed!",/r/ogden/comments/tgki26/if_these_are_your_children_you_failed/i15tnzp/,3,r/ogden,0,3
"Doxing them and pretending to be a badass isn’t going to help anything. They need to fix what they broke, beating the shit out of them is only going to reaffirm more violence for them.",t2_k8e1d,crkspid3r,1,1647609963.0,0,t1_i15ezvd,i15ezvd,False,denoje13,t3_tgki26,https://www.reddit.com/r/ogden/comments/tgki26/if_these_are_your_children_you_failed/,"If these are your children, you failed!",/r/ogden/comments/tgki26/if_these_are_your_children_you_failed/i15ezvd/,3,r/ogden,0,3
I do not have FB but feel free to link this if you want.,t2_12hbb7,denoje13,0,1647608015.0,0,t1_i15azuw,i15azuw,False,denoje13,t3_tgki26,https://www.reddit.com/r/ogden/comments/tgki26/if_these_are_your_children_you_failed/,"If these are your children, you failed!",/r/ogden/comments/tgki26/if_these_are_your_children_you_failed/i15azuw/,1,r/ogden,0,1
I saw someone roasted for mentioning it just a few months ago. 🤷‍♀️,t2_2krjlpv,Jabberwocky613,0,1647607406.0,0,t1_i159t8y,i159t8y,False,denoje13,t3_tgki26,https://www.reddit.com/r/ogden/comments/tgki26/if_these_are_your_children_you_failed/,"If these are your children, you failed!",/r/ogden/comments/tgki26/if_these_are_your_children_you_failed/i159t8y/,2,r/ogden,0,2
"It’s a really cool area. A little sketchy as there seems to be some drug use in the nearby parks. I lived in a complex on 25th and had two addicts arguing under our viaduct one night and it wasn’t unusual to see someone in the dumpster after an apartment was emptied, however I never had any issues with anyone.",t2_5kz1xtte,essjayhey,0,1647606794.0,0,t1_i158nsv,i158nsv,True,Courage-Stable-9713,t3_tgoxgy,https://www.reddit.com/r/ogden/comments/tgoxgy/how_safe_is_downtown_ogden/,How safe is downtown Ogden?,/r/ogden/comments/tgoxgy/how_safe_is_downtown_ogden/i158nsv/,2,r/ogden,0,2
"""I knew someone with a different perspective would comment if I posted this on social media."" Listen to yourself. You've got people in your comments offering to ""take care of"" those kids and listing names and locations. One person says ""what they did was wrong but this isn't how you handle it"" and you're upset with this guy? Come on. That's all I have to say about this mess of a post.",t2_6jiovwhe,StopCallingMeLame,1,1647597531.0,0,t1_i14uvvx,i14uvvx,False,denoje13,t3_tgki26,https://www.reddit.com/r/ogden/comments/tgki26/if_these_are_your_children_you_failed/,"If these are your children, you failed!",/r/ogden/comments/tgki26/if_these_are_your_children_you_failed/i14uvvx/,2,r/ogden,0,2
"My friend lives in that building and it's quite secure, though there is a lot of foot traffic in the area so my advice would be don't keep valuables or really anything in your car. Seats and nothing else visible. If it's not in your trunk, take it inside, and it will hopefully not get messed with. It's not fraught with crime or anything, but petty theft and automotive break-ins do happen when people are walking down the street, snooping in people's windows for something to do pawn or use. 🤷🏼‍♀️ Hope that helps!! I've lived in Ogden my whole life and it's honestly a good city. That's a killer location, too. Loads of stuff in walking distance",t2_16w8ag,eandrus,0,1647592700.0,0,t1_i14pbid,i14pbid,True,Courage-Stable-9713,t3_tgoxgy,https://www.reddit.com/r/ogden/comments/tgoxgy/how_safe_is_downtown_ogden/,How safe is downtown Ogden?,/r/ogden/comments/tgoxgy/how_safe_is_downtown_ogden/i14pbid/,3,r/ogden,0,3
"Nobody cares anymore about the mention of the misspelling, the admin who did hasn't been an admin for years, coming from an admin!",t2_qll1l,Soulharvester87,0,1647589532.0,0,t1_i14loic,i14loic,False,denoje13,t3_tgki26,https://www.reddit.com/r/ogden/comments/tgki26/if_these_are_your_children_you_failed/,"If these are your children, you failed!",/r/ogden/comments/tgki26/if_these_are_your_children_you_failed/i14loic/,2,r/ogden,0,2
"I can’t help but hear “you have a collect call from an inmate at WEBER COUNTRY JAIL, to accept press one…” when I look at them. Sad",t2_72v43qjm,Snoo_69677,1,1647584877.0,0,t1_i14g0c8,i14g0c8,True,denoje13,t3_tgki26,https://www.reddit.com/r/ogden/comments/tgki26/if_these_are_your_children_you_failed/,"If these are your children, you failed!",/r/ogden/comments/tgki26/if_these_are_your_children_you_failed/i14g0c8/,-1,r/ogden,0,-1
Thank you for the input. Is it loud at all at the apartments?,t2_9834gklg,Courage-Stable-9713,0,1647580295.0,0,t1_i149ovn,i149ovn,False,Courage-Stable-9713,t3_tgoxgy,https://www.reddit.com/r/ogden/comments/tgoxgy/how_safe_is_downtown_ogden/,How safe is downtown Ogden?,/r/ogden/comments/tgoxgy/how_safe_is_downtown_ogden/i149ovn/,3,r/ogden,0,3
Thanks,t2_9834gklg,Courage-Stable-9713,0,1647580230.0,0,t1_i149ld9,i149ld9,False,Courage-Stable-9713,t3_tgoxgy,https://www.reddit.com/r/ogden/comments/tgoxgy/how_safe_is_downtown_ogden/,How safe is downtown Ogden?,/r/ogden/comments/tgoxgy/how_safe_is_downtown_ogden/i149ld9/,3,r/ogden,0,3
Thank you.,t2_9834gklg,Courage-Stable-9713,0,1647580187.0,0,t1_i149j4c,i149j4c,False,Courage-Stable-9713,t3_tgoxgy,https://www.reddit.com/r/ogden/comments/tgoxgy/how_safe_is_downtown_ogden/,How safe is downtown Ogden?,/r/ogden/comments/tgoxgy/how_safe_is_downtown_ogden/i149j4c/,3,r/ogden,0,3
Check him out on insta @noise_explosion his name is Leon Araujo,t2_cdxxs2qc,IndieOgdenDan,0,1647579064.0,0,t1_i147rp3,i147rp3,False,IndieOgdenDan,t3_tfhm11,https://www.reddit.com/r/ogden/comments/tfhm11/we_are_excited_to_host_another_ogden_bizarre_this/,We are excited to host another Ogden Bizarre this Sunday 11-4 at the Marshall White Center (222 28th ST Ogden) 80+ vendors (many new) come join us!,/r/ogden/comments/tfhm11/we_are_excited_to_host_another_ogden_bizarre_this/i147rp3/,1,r/ogden,0,1
"The cops might pester you if you are up too late.  You can probably run faster than a drunk homeless person.  The group homes for criminal teens in that neighborhood are always staffed.  The the murders in that neighborhood are  usually solved.   I am 99% certain you will not get killed.

https://gephardtdaily.com/local/police-investigate-another-suspicious-death-in-ogden/",t2_dnelnh8r,pregnanttweeker2,0,1647578920.0,0,t1_i147jan,i147jan,True,Courage-Stable-9713,t3_tgoxgy,https://www.reddit.com/r/ogden/comments/tgoxgy/how_safe_is_downtown_ogden/,How safe is downtown Ogden?,/r/ogden/comments/tgoxgy/how_safe_is_downtown_ogden/i147jan/,4,r/ogden,0,4
If you're not seeking out trouble (i.e. walking up to strangers down a random alley at 2am) you're 100% fine.,t2_4vhk92g2,U_Should_Be_Ashamed,0,1647577723.0,0,t1_i145i6s,i145i6s,True,Courage-Stable-9713,t3_tgoxgy,https://www.reddit.com/r/ogden/comments/tgoxgy/how_safe_is_downtown_ogden/,How safe is downtown Ogden?,/r/ogden/comments/tgoxgy/how_safe_is_downtown_ogden/i145i6s/,16,r/ogden,0,16
Lived in those apartments for 5 years.. I would stay there again and again.. I never felt unsafe. Parked my car on the street every night cause we couldn't afford a second spot in the garage and never had an issue.. walked to work downtown every afternoon and walked home at night.. this was 4 years ago but it was a huge help for me when i didn't have the means to commute anywhere. I loved the Portland building. Only downside was the dirty diaper smell of the Thai curry place lol,t2_6x9db,bgerrard,0,1647576562.0,0,t1_i143gcr,i143gcr,True,Courage-Stable-9713,t3_tgoxgy,https://www.reddit.com/r/ogden/comments/tgoxgy/how_safe_is_downtown_ogden/,How safe is downtown Ogden?,/r/ogden/comments/tgoxgy/how_safe_is_downtown_ogden/i143gcr/,13,r/ogden,0,13
"Then again, if anybody's gonna be a saint who can look down on all of us mere mortals it might as well be a guy named soupypoopyjr. Hail soupy.",t2_4tsgzp,ilyfunnybunny,0,1647572965.0,0,t1_i13wk78,i13wk78,False,denoje13,t3_tgki26,https://www.reddit.com/r/ogden/comments/tgki26/if_these_are_your_children_you_failed/,"If these are your children, you failed!",/r/ogden/comments/tgki26/if_these_are_your_children_you_failed/i13wk78/,1,r/ogden,0,1
"Yeah bro. They make mistakes. And just like everyone else actions have consequences, so like I said fuck them kids and FUCK you",t2_4ngo62my,soupypoopyjr,0,1647572856.0,0,t1_i13wcjc,i13wcjc,False,denoje13,t3_tgki26,https://www.reddit.com/r/ogden/comments/tgki26/if_these_are_your_children_you_failed/,"If these are your children, you failed!",/r/ogden/comments/tgki26/if_these_are_your_children_you_failed/i13wcjc/,9,r/ogden,0,9
You think kids don't make mistakes? lol. dumbest thing I've ever heard.,t2_4tsgzp,ilyfunnybunny,0,1647572794.0,0,t1_i13w85s,i13w85s,False,denoje13,t3_tgki26,https://www.reddit.com/r/ogden/comments/tgki26/if_these_are_your_children_you_failed/,"If these are your children, you failed!",/r/ogden/comments/tgki26/if_these_are_your_children_you_failed/i13w85s/,-10,r/ogden,0,-10
where's the video?,t2_551r2,NBABUCKS1,0,1647572100.0,0,t1_i13uufl,i13uufl,False,denoje13,t3_tgki26,https://www.reddit.com/r/ogden/comments/tgki26/if_these_are_your_children_you_failed/,"If these are your children, you failed!",/r/ogden/comments/tgki26/if_these_are_your_children_you_failed/i13uufl/,8,r/ogden,0,8
"Naw bro you dumb af, fuck them kids and fuck you and your dumbs ass ideology, and fuck whoever told you that train of thought was ok",t2_4ngo62my,soupypoopyjr,0,1647571701.0,0,t1_i13u0rp,i13u0rp,False,denoje13,t3_tgki26,https://www.reddit.com/r/ogden/comments/tgki26/if_these_are_your_children_you_failed/,"If these are your children, you failed!",/r/ogden/comments/tgki26/if_these_are_your_children_you_failed/i13u0rp/,9,r/ogden,0,9
"Sure. They should be held accountable. They can fix it, they can pay for it, they can fix their own mess. It IS NORMAL for kids to fuck shit up and make messes. 

But accountable doesn't mean an adult stranger goes around filming kids in the park, then putting their faces online, and THEN telling the parents that they're failures. My point isn't that the kids are angels. They're not angels. They're dumb kids.  

My point is that you're a creep... I thought that was obvious.",t2_4tsgzp,ilyfunnybunny,1,1647569827.0,0,t1_i13q26u,i13q26u,False,denoje13,t3_tgki26,https://www.reddit.com/r/ogden/comments/tgki26/if_these_are_your_children_you_failed/,"If these are your children, you failed!",/r/ogden/comments/tgki26/if_these_are_your_children_you_failed/i13q26u/,-8,r/ogden,0,-8
"I'm sure a large bill for the costs incurred from their lil precious bastard won't make them very happy, unless they happen to be independently wealthy.",t2_bysqf98q,moon_money21,0,1647567153.0,0,t1_i13ka62,i13ka62,False,denoje13,t3_tgki26,https://www.reddit.com/r/ogden/comments/tgki26/if_these_are_your_children_you_failed/,"If these are your children, you failed!",/r/ogden/comments/tgki26/if_these_are_your_children_you_failed/i13ka62/,2,r/ogden,0,2
"Post it on the two Ogden FB pages."" You know you're from Ogden"" and ""You know your from Ogden"". 

Do not, under any circumstances,  mention the misspelled ""your"".",t2_2krjlpv,Jabberwocky613,0,1647566733.0,0,t1_i13jd8l,i13jd8l,True,denoje13,t3_tgki26,https://www.reddit.com/r/ogden/comments/tgki26/if_these_are_your_children_you_failed/,"If these are your children, you failed!",/r/ogden/comments/tgki26/if_these_are_your_children_you_failed/i13jd8l/,15,r/ogden,0,15
"Mr. Tie dye in your second pic is named jaxson, him and his friends recently vandalized a church. Trust me a ass whooping is the only way they’ll actually learn anything. Their parents are basically their friends so even if you do get ahold of them the parents will either tell you to get bent or act like they care then fist bump their kid when you’re gone",t2_4rjkt3uf,wellyesbutnofuckoff2,0,1647565113.0,0,t1_i13fuyb,i13fuyb,False,denoje13,t3_tgki26,https://www.reddit.com/r/ogden/comments/tgki26/if_these_are_your_children_you_failed/,"If these are your children, you failed!",/r/ogden/comments/tgki26/if_these_are_your_children_you_failed/i13fuyb/,8,r/ogden,0,8
"Like, ever?
.... Jesus Christ",t2_nupgn,12ed12ook,0,1647564964.0,0,t1_i13fj7r,i13fj7r,False,denoje13,t3_tgki26,https://www.reddit.com/r/ogden/comments/tgki26/if_these_are_your_children_you_failed/,"If these are your children, you failed!",/r/ogden/comments/tgki26/if_these_are_your_children_you_failed/i13fj7r/,1,r/ogden,0,1
The picture is from a screenshot of the video posted below.,t2_12hbb7,denoje13,0,1647564128.0,0,t1_i13dpef,i13dpef,False,denoje13,t3_tgki26,https://www.reddit.com/r/ogden/comments/tgki26/if_these_are_your_children_you_failed/,"If these are your children, you failed!",/r/ogden/comments/tgki26/if_these_are_your_children_you_failed/i13dpef/,2,r/ogden,0,2
"Appreciate the offer however, I don't want them beat. I just want them to be ashamed of what they did and to fix it.",t2_12hbb7,denoje13,0,1647563990.0,0,t1_i13degk,i13degk,False,denoje13,t3_tgki26,https://www.reddit.com/r/ogden/comments/tgki26/if_these_are_your_children_you_failed/,"If these are your children, you failed!",/r/ogden/comments/tgki26/if_these_are_your_children_you_failed/i13degk/,6,r/ogden,0,6
This,t2_12hbb7,denoje13,0,1647563754.0,0,t1_i13cw6k,i13cw6k,False,denoje13,t3_tgki26,https://www.reddit.com/r/ogden/comments/tgki26/if_these_are_your_children_you_failed/,"If these are your children, you failed!",/r/ogden/comments/tgki26/if_these_are_your_children_you_failed/i13cw6k/,9,r/ogden,0,9
Did they pose for this? They look like cheap Skyrim vampires.,t2_13841r,smoofwah,0,1647562239.0,0,t1_i139j4m,i139j4m,True,denoje13,t3_tgki26,https://www.reddit.com/r/ogden/comments/tgki26/if_these_are_your_children_you_failed/,"If these are your children, you failed!",/r/ogden/comments/tgki26/if_these_are_your_children_you_failed/i139j4m/,15,r/ogden,0,15
"Are you volunteering to pay the costs associated with what you call ""kids being kids""? This shit isn't cheap to fix.  Their parents should be held accountable.",t2_bysqf98q,moon_money21,0,1647561632.0,0,t1_i1386cd,i1386cd,False,denoje13,t3_tgki26,https://www.reddit.com/r/ogden/comments/tgki26/if_these_are_your_children_you_failed/,"If these are your children, you failed!",/r/ogden/comments/tgki26/if_these_are_your_children_you_failed/i1386cd/,19,r/ogden,0,19
I’m 17 still and don’t stand for that shit. Lmao if you get their names I’ll do the rest,t2_4rjkt3uf,wellyesbutnofuckoff2,1,1647561364.0,0,t1_i137l28,i137l28,True,denoje13,t3_tgki26,https://www.reddit.com/r/ogden/comments/tgki26/if_these_are_your_children_you_failed/,"If these are your children, you failed!",/r/ogden/comments/tgki26/if_these_are_your_children_you_failed/i137l28/,3,r/ogden,0,3
Contact the city and give them this picture. I work for a municipality and we had a real vandalism problem last year. I wish I could have gotten a picture like this of those responsible so they could have been held financially responsible for their bullshit. The amount of money this type of thing costs a city is astounding. There are better uses for your tax dollars.,t2_bysqf98q,moon_money21,0,1647561364.0,0,t1_i137l1u,i137l1u,True,denoje13,t3_tgki26,https://www.reddit.com/r/ogden/comments/tgki26/if_these_are_your_children_you_failed/,"If these are your children, you failed!",/r/ogden/comments/tgki26/if_these_are_your_children_you_failed/i137l1u/,15,r/ogden,0,15
"Real typical, I knew someone would try to defend them if I posted this. You my friend are the problem. Normalizing things like this instead correcting it spirals out of control quickly. These kids should be given community service repairing the damage they caused!",t2_12hbb7,denoje13,0,1647559466.0,0,t1_i1338vr,i1338vr,False,denoje13,t3_tgki26,https://www.reddit.com/r/ogden/comments/tgki26/if_these_are_your_children_you_failed/,"If these are your children, you failed!",/r/ogden/comments/tgki26/if_these_are_your_children_you_failed/i1338vr/,23,r/ogden,0,23
"Teenage kids just destroy shit sometimes. Didn't you, like, ever? They're dumb. Doesn't mean they're monsters. Definitely no need to shame them and their parents online. I mean, jesus lol. Who are you? Call the cops if they're such dangerous criminals.",t2_4tsgzp,ilyfunnybunny,0,1647558710.0,0,t1_i131hrb,i131hrb,True,denoje13,t3_tgki26,https://www.reddit.com/r/ogden/comments/tgki26/if_these_are_your_children_you_failed/,"If these are your children, you failed!",/r/ogden/comments/tgki26/if_these_are_your_children_you_failed/i131hrb/,-36,r/ogden,0,-36
"Given the apparent age/location I'm guessing they attend Ben Lomond HS. Could contact the school administration and see if they can be ID'd.

There is also a couple close by Jr. High schools if BLHS cannot ID them.",t2_9vciyj1i,Strongbeard1143,0,1647558650.0,0,t1_i131cvb,i131cvb,True,denoje13,t3_tgki26,https://www.reddit.com/r/ogden/comments/tgki26/if_these_are_your_children_you_failed/,"If these are your children, you failed!",/r/ogden/comments/tgki26/if_these_are_your_children_you_failed/i131cvb/,11,r/ogden,0,11
"Bonneville Park, 2nd st. and Monroe.  Neighborhoods going to hell...",t2_bzft4,butcherbrinker,1,1647557453.0,0,t1_i12ykls,i12ykls,True,denoje13,t3_tgki26,https://www.reddit.com/r/ogden/comments/tgki26/if_these_are_your_children_you_failed/,"If these are your children, you failed!",/r/ogden/comments/tgki26/if_these_are_your_children_you_failed/i12ykls/,-2,r/ogden,0,-2
I just came across these kids destroying a park bathroom door. They felt vindicated to do so because walking home to use the bathroom  was just too far... A large group of other kids cheered them on and were swearing like sailors in front of much younger kids playing at the park. [just Wow](https://i.imgur.com/dkteJRS.jpg),t2_12hbb7,denoje13,0,1647551908.0,0,t1_i12kts7,i12kts7,True,denoje13,t3_tgki26,https://www.reddit.com/r/ogden/comments/tgki26/if_these_are_your_children_you_failed/,"If these are your children, you failed!",/r/ogden/comments/tgki26/if_these_are_your_children_you_failed/i12kts7/,10,r/ogden,0,10
Thank you.,t2_141av2,RufusCranium,0,1647549821.0,0,t1_i12fe59,i12fe59,False,RufusCranium,t3_te76cu,https://www.reddit.com/r/ogden/comments/te76cu/any_occult_shops_here/,Any occult shops here?,/r/ogden/comments/te76cu/any_occult_shops_here/i12fe59/,2,r/ogden,0,2
Well if I'm ever in the area... thanks.,t2_141av2,RufusCranium,0,1647549775.0,0,t1_i12f9rt,i12f9rt,False,RufusCranium,t3_te76cu,https://www.reddit.com/r/ogden/comments/te76cu/any_occult_shops_here/,Any occult shops here?,/r/ogden/comments/te76cu/any_occult_shops_here/i12f9rt/,1,r/ogden,0,1
"I have narrowed my options down to two. One in Ogden Ut and one right in SLC. 

Neighborhood wise, which do you recommend is a better location?",t2_d37fombx,todesengel911,0,1647532556.0,0,t1_i1166s8,i1166s8,False,todesengel911,t3_tf4p6r,https://www.reddit.com/r/ogden/comments/tf4p6r/moving/,Moving,/r/ogden/comments/tf4p6r/moving/i1166s8/,1,r/ogden,0,1
Around 1300,t2_d37fombx,todesengel911,0,1647532466.0,0,t1_i115yjs,i115yjs,False,todesengel911,t3_tf4p6r,https://www.reddit.com/r/ogden/comments/tf4p6r/moving/,Moving,/r/ogden/comments/tf4p6r/moving/i115yjs/,1,r/ogden,0,1
"There was a white supremacist that started doing it when a black family moved into my neighborhood. He did it for years, almost every morning. One day I was outside when  he drove by honking, I chased after him and got his license plate number. I called OPD and gave them the number. They called me back and said the number didn't exist(I definitely had it right). Then he stopped doing it for a few months and then started up again. It went on for a few more years but then it stopped, I hope he died or something awful happened to him. The family stayed there for a bunch of years after that so I guess they won in the end.",t2_5d7z9bx9,-secondontheleft-,0,1647504677.0,0,t1_i0zt55z,i0zt55z,True,No-Professor-9159,t3_tfq7bq,https://www.reddit.com/r/ogden/comments/tfq7bq/honking_cars/,Honking Cars,/r/ogden/comments/tfq7bq/honking_cars/i0zt55z/,1,r/ogden,0,1
One of my personal goals is to build a community of Indian skiers and create more inclusivity & awareness. DM’ing you,t2_6e842sbx,subreader90,0,1647502110.0,0,t1_i0zq4cj,i0zq4cj,False,beginnermodeller1993,t3_t6x8r2,https://www.reddit.com/r/ogden/comments/t6x8r2/moving_to_ogden_ut_rental_suggestions/,"Moving to Ogden, UT. Rental suggestions?",/r/ogden/comments/t6x8r2/moving_to_ogden_ut_rental_suggestions/i0zq4cj/,1,r/ogden,0,1
lol! Gotta love people of Ogden.,t2_wkuxl,KatyClaire,0,1647486436.0,0,t1_i0z1bs8,i0z1bs8,False,No-Professor-9159,t3_tfq7bq,https://www.reddit.com/r/ogden/comments/tfq7bq/honking_cars/,Honking Cars,/r/ogden/comments/tfq7bq/honking_cars/i0z1bs8/,5,r/ogden,0,5
"I've lived all over and there are random kids who do this sort of thing everywhere. They do need to knock it off, though.",t2_133jvfjj,Pirate_Frank,0,1647481017.0,0,t1_i0ypnou,i0ypnou,True,No-Professor-9159,t3_tfq7bq,https://www.reddit.com/r/ogden/comments/tfq7bq/honking_cars/,Honking Cars,/r/ogden/comments/tfq7bq/honking_cars/i0ypnou/,1,r/ogden,0,1
would love to ski with fellow indians,t2_2wzsezcv,meowlicious99,0,1647480895.0,0,t1_i0ypdyg,i0ypdyg,False,beginnermodeller1993,t3_t6x8r2,https://www.reddit.com/r/ogden/comments/t6x8r2/moving_to_ogden_ut_rental_suggestions/,"Moving to Ogden, UT. Rental suggestions?",/r/ogden/comments/t6x8r2/moving_to_ogden_ut_rental_suggestions/i0ypdyg/,1,r/ogden,0,1
No honks by me Thankfully. Shits annoying and obnoxious.,t2_9tlru,nyne87,0,1647477392.0,0,t1_i0yhl41,i0yhl41,True,No-Professor-9159,t3_tfq7bq,https://www.reddit.com/r/ogden/comments/tfq7bq/honking_cars/,Honking Cars,/r/ogden/comments/tfq7bq/honking_cars/i0yhl41/,1,r/ogden,0,1
"that's what I initial thought, a car pool or picking someone up from work, until I saw them, they just speed through and honk a couple times, no stopping",t2_8sss1252,No-Professor-9159,0,1647468718.0,0,t1_i0xxg4k,i0xxg4k,False,No-Professor-9159,t3_tfq7bq,https://www.reddit.com/r/ogden/comments/tfq7bq/honking_cars/,Honking Cars,/r/ogden/comments/tfq7bq/honking_cars/i0xxg4k/,2,r/ogden,0,2
"That makes perfect sense, I did the same, many years ago. I saw the driver for one of them.  he is early 40s lol",t2_8sss1252,No-Professor-9159,0,1647468635.0,0,t1_i0xx8py,i0xx8py,False,No-Professor-9159,t3_tfq7bq,https://www.reddit.com/r/ogden/comments/tfq7bq/honking_cars/,Honking Cars,/r/ogden/comments/tfq7bq/honking_cars/i0xx8py/,4,r/ogden,0,4
