body,author_fullname,author.name,controversiality,created,downs,fullname,id,is_root,link_author,link_id,link_permalink,link_title,permalink,score,subreddit_name_prefixed,total_awards_received,ups
"Prior VA trooper here and yes LEO’s are supposed to abide by all traffic laws unless emergency equipment active (even then common sense prevails) however I’ve seen what emergency lights do to drivers, especially in heavy traffic.  They do really stupid stuff to move out of the way and it can create undue traffic backups, therefore if responding to a non-injury accident or other call they will go lights off but try to make it there quickly and reasonably.  Pacing a Trooper at 20+ over comes with the consequences.  No matter whether he was in the right or not doesn’t change your outcome and it sounds like he cut you a break at 1-10 over.",t2_9ilfqk0,Pwrdbym,0,1648515921.0,0,t1_i2iblel,i2iblel,True,stewiezone,t3_tqa7kb,https://www.reddit.com/r/okc/comments/tqa7kb/traffic_ticket/,Traffic Ticket,/r/okc/comments/tqa7kb/traffic_ticket/i2iblel/,10,r/okc,0,10
"Yeah you say any of that to a judge and he is gonna tell you ignorance is not an excuse.

Pay the ticket and feel lucky he only did you for 10 over. 20 over and he could have added a reckless driving ticket.

I went down that path. Trust you don’t want to.",t2_ar3ris7w,SparkysJewelry65,0,1648514735.0,0,t1_i2i95rq,i2i95rq,True,stewiezone,t3_tqa7kb,https://www.reddit.com/r/okc/comments/tqa7kb/traffic_ticket/,Traffic Ticket,/r/okc/comments/tqa7kb/traffic_ticket/i2i95rq/,3,r/okc,0,3
"I think you’ll still have to pay the ticket, but it may be worth your time to go to court. I did that once and the judge agreed he’d keep it off my record if I just paid. Which keeps your insurance from going up. This was in a little town in SE Okla tho. I’ve also heard if you go to court and the officer doesn’t show up too, they’ll drop it. Not sure if that’s really true 😉",t2_k5u0rgqk,MandamandaOkc,0,1648514634.0,0,t1_i2i8ycp,i2i8ycp,True,stewiezone,t3_tqa7kb,https://www.reddit.com/r/okc/comments/tqa7kb/traffic_ticket/,Traffic Ticket,/r/okc/comments/tqa7kb/traffic_ticket/i2i8ycp/,1,r/okc,0,1
Dr Ahmad in Norman. I get the Benlysta pen! Delivered to my door.,t2_9zoe1kob,Substantial-River-70,0,1648513697.0,0,t1_i2i719t,i2i719t,False,edchuckndoug,t3_tg4rrm,https://www.reddit.com/r/okc/comments/tg4rrm/adult_sooner_care/,Adult Sooner care,/r/okc/comments/tg4rrm/adult_sooner_care/i2i719t/,1,r/okc,0,1
"There is overlap definitely but you are looking for the term ""Christian Nationalism""- more widespread than just one bill mill.

https://en.wikipedia.org/wiki/Christian_nationalism#United_States

https://en.wikipedia.org/wiki/Project_Blitz

https://www.blitzwatch.org/",t2_e17jbtpw,w3sterday,0,1648511747.0,0,t1_i2i38xa,i2i38xa,False,AHrubik,t3_tk6g47,https://www.reddit.com/r/okc/comments/tk6g47/hb_3890_establishes_the_holy_bible_as_the/,HB 3890 establishes the Holy Bible as the official State of Oklahoma book,/r/okc/comments/tk6g47/hb_3890_establishes_the_holy_bible_as_the/i2i38xa/,1,r/okc,0,1
"Encourage local political participation. Be aware of filing deadlines and see if anyone would be running unopposed, ask someone to run for election.",t2_hightsf,Super_Nisey,0,1648511707.0,0,t1_i2i368j,i2i368j,False,AHrubik,t3_tk6g47,https://www.reddit.com/r/okc/comments/tk6g47/hb_3890_establishes_the_holy_bible_as_the/,HB 3890 establishes the Holy Bible as the official State of Oklahoma book,/r/okc/comments/tk6g47/hb_3890_establishes_the_holy_bible_as_the/i2i368j/,1,r/okc,0,1
"Most southern evangelicals aren't even reading the Bible (any translation) so much, they're reading (and watching iterations of) that drivel by [Tim Lahaye](https://en.wikipedia.org/wiki/Tim_LaHaye) and [Jerry Jenkins.](https://en.wikipedia.org/wiki/Jerry_B._Jenkins)",t2_e17jbtpw,w3sterday,0,1648511560.0,0,t1_i2i2wal,i2i2wal,False,AHrubik,t3_tk6g47,https://www.reddit.com/r/okc/comments/tk6g47/hb_3890_establishes_the_holy_bible_as_the/,HB 3890 establishes the Holy Bible as the official State of Oklahoma book,/r/okc/comments/tk6g47/hb_3890_establishes_the_holy_bible_as_the/i2i2wal/,1,r/okc,0,1
So when they run unopposed and get re-elected by default?,t2_e17jbtpw,w3sterday,0,1648511429.0,0,t1_i2i2nhl,i2i2nhl,False,AHrubik,t3_tk6g47,https://www.reddit.com/r/okc/comments/tk6g47/hb_3890_establishes_the_holy_bible_as_the/,HB 3890 establishes the Holy Bible as the official State of Oklahoma book,/r/okc/comments/tk6g47/hb_3890_establishes_the_holy_bible_as_the/i2i2nhl/,1,r/okc,0,1
Seriously huge! Plus the desserts!,t2_bp1otpxm,duderino_okc,0,1648503458.0,0,t1_i2hmlpo,i2hmlpo,False,sactownbing,t3_tpzl9o,https://www.reddit.com/r/okc/comments/tpzl9o/pastrami_on_rye_recommendations/,Pastrami on rye recommendations,/r/okc/comments/tpzl9o/pastrami_on_rye_recommendations/i2hmlpo/,4,r/okc,0,4
I’ll second this as well. Plus it’s huge portions for sandwiches,t2_4k25obos,reddituser202021,0,1648502279.0,0,t1_i2hjx7v,i2hjx7v,False,sactownbing,t3_tpzl9o,https://www.reddit.com/r/okc/comments/tpzl9o/pastrami_on_rye_recommendations/,Pastrami on rye recommendations,/r/okc/comments/tpzl9o/pastrami_on_rye_recommendations/i2hjx7v/,3,r/okc,0,3
"Definitely Hobby's Hoagies in the Art's District! It is so good the way they toast the bread and they do not skimp on the pastrami, even if it is more thinly cut.",t2_mhre2,12cookie,0,1648501922.0,0,t1_i2hj3iv,i2hj3iv,True,sactownbing,t3_tpzl9o,https://www.reddit.com/r/okc/comments/tpzl9o/pastrami_on_rye_recommendations/,Pastrami on rye recommendations,/r/okc/comments/tpzl9o/pastrami_on_rye_recommendations/i2hj3iv/,3,r/okc,0,3
I'm saving this for later,t2_89syl1dx,WhyDoIHaveAnAccount9,0,1648501774.0,0,t1_i2hirc4,i2hirc4,False,sactownbing,t3_tpzl9o,https://www.reddit.com/r/okc/comments/tpzl9o/pastrami_on_rye_recommendations/,Pastrami on rye recommendations,/r/okc/comments/tpzl9o/pastrami_on_rye_recommendations/i2hirc4/,1,r/okc,0,1
"pretty sure light bars can have just one side on and not the other. he could have had just his fronts on. and I'm not sure if events like that are logged, but as other said, you wouldn't win the fight, especially if he can just say only his front light bar was on.

one time I had an officer with no lights on that I could see tailing me closer than was safe/legal (I was doing the speed limit with everyone else and he just wanted to get around) and when he did pass me, gave me a stink eye and then I noticed the back portion of his light bar was actually on. nothing I could have done to know other than slow down and get out of the way but at least he didn't pull me over and ticket me for impeding an officer or whatever that would have been. 

either way, its good to have a dashcam for situations that you do actually challenge in court. at least then you have some evidence and not just your word vs someone else. (again, not that having a dashcam would benefit you in challenging this instance)",t2_5pl2c,atomriot,0,1648500668.0,0,t1_i2hg1f4,i2hg1f4,True,stewiezone,t3_tqa7kb,https://www.reddit.com/r/okc/comments/tqa7kb/traffic_ticket/,Traffic Ticket,/r/okc/comments/tqa7kb/traffic_ticket/i2hg1f4/,2,r/okc,0,2
Not all cops lie but ACAB.,t2_7u7x0,cardinalsfanokc,1,1648499420.0,0,t1_i2hczl6,i2hczl6,False,stewiezone,t3_tqa7kb,https://www.reddit.com/r/okc/comments/tqa7kb/traffic_ticket/,Traffic Ticket,/r/okc/comments/tqa7kb/traffic_ticket/i2hczl6/,-1,r/okc,0,-1
Not all cops lie.,t2_b7bqp66,dwayitiz,0,1648498227.0,0,t1_i2ha2xu,i2ha2xu,False,stewiezone,t3_tqa7kb,https://www.reddit.com/r/okc/comments/tqa7kb/traffic_ticket/,Traffic Ticket,/r/okc/comments/tqa7kb/traffic_ticket/i2ha2xu/,-2,r/okc,0,-2
Rear facing radar and if you’re on his ass he can pretty much tell you’re keeping his pace.  You have a speedometer for a reason and saying you were just going with his flow was admission of guilt.  Pay the ticket and be a better driver next time.  Don’t screw with the flat hats/brown shirts.,t2_b7bqp66,dwayitiz,0,1648498156.0,0,t1_i2h9wo9,i2h9wo9,True,stewiezone,t3_tqa7kb,https://www.reddit.com/r/okc/comments/tqa7kb/traffic_ticket/,Traffic Ticket,/r/okc/comments/tqa7kb/traffic_ticket/i2h9wo9/,3,r/okc,0,3
"Ah yes he only robbed me of everything I made today for a victimless crime based off his own ego. /s

Cops in okc are the worst. Good luck taking it to the judge. The judges in okc are ego filled douche bags.

I got a ticket for going a speed that my vehicle was physically incapable of even going. I told the cop that it was impossible for my old ass truck to be at that speed when it’s never gone that fast before. 

I went to okc court with a video of my dash as well as documentation of the actual information on the old ass truck. 

The judge demeaned me and shamed me for (checks notes) defending myself in the court of law.

Or system is broken and judges and police operate too close to one another.",t2_k5sx543m,surfngirth,1,1648497298.0,0,t1_i2h7t5h,i2h7t5h,False,stewiezone,t3_tqa7kb,https://www.reddit.com/r/okc/comments/tqa7kb/traffic_ticket/,Traffic Ticket,/r/okc/comments/tqa7kb/traffic_ticket/i2h7t5h/,10,r/okc,0,10
"Also true unfortunately his NP left for some reason, she was awesome.",t2_4zi6fsuc,DortSZN,0,1648497225.0,0,t1_i2h7mq8,i2h7mq8,False,[deleted],t3_tjv9fq,https://www.reddit.com/r/okc/comments/tjv9fq/seeking_recommendations_on_a_compassionate/,"seeking recommendations on a compassionate, primary care physician",/r/okc/comments/tjv9fq/seeking_recommendations_on_a_compassionate/i2h7mq8/,2,r/okc,0,2
Say that you were getting ready to attempt to pull him over and perform a citizens arrest for going 20 over the speed limit. It was your civic duty.,t2_2onxtv60,SnapmareJesus,0,1648496798.0,0,t1_i2h6krf,i2h6krf,True,stewiezone,t3_tqa7kb,https://www.reddit.com/r/okc/comments/tqa7kb/traffic_ticket/,Traffic Ticket,/r/okc/comments/tqa7kb/traffic_ticket/i2h6krf/,7,r/okc,0,7
ND Foods on Britton. You will be hard pressed to find  better in OKC.,t2_bp1otpxm,duderino_okc,0,1648496283.0,0,t1_i2h5bro,i2h5bro,True,sactownbing,t3_tpzl9o,https://www.reddit.com/r/okc/comments/tpzl9o/pastrami_on_rye_recommendations/,Pastrami on rye recommendations,/r/okc/comments/tpzl9o/pastrami_on_rye_recommendations/i2h5bro/,9,r/okc,0,9
"You're not going to win trying to fight it, but when I got a speeding ticket I was able to get it dismissed by doing the Driver Improvement Course through the municipal court website.  Takes about 4 hours of your time and you can do it online if you don't want to do an in-person class.

A little bit cheaper than paying the ticket, and you don't have to worry about it affecting your insurance rates or getting points on your license.

Seems like based on your situation, that would probably be your best option",t2_441ssl7m,Skyreaches,0,1648495946.0,0,t1_i2h4ilp,i2h4ilp,True,stewiezone,t3_tqa7kb,https://www.reddit.com/r/okc/comments/tqa7kb/traffic_ticket/,Traffic Ticket,/r/okc/comments/tqa7kb/traffic_ticket/i2h4ilp/,11,r/okc,0,11
"Agreed, he won't be trying out of it, but it'll still shine a bad light.",t2_mnj6xia,BLUECADETxTHREE,0,1648495946.0,0,t1_i2h4iko,i2h4iko,False,stewiezone,t3_tqa7kb,https://www.reddit.com/r/okc/comments/tqa7kb/traffic_ticket/,Traffic Ticket,/r/okc/comments/tqa7kb/traffic_ticket/i2h4iko/,2,r/okc,0,2
"Hey, fellow Lawrencian! Seconded!  His support staff and associated PAs are super nice too!",t2_33oa6nf5,SparrowAndTheMachine,0,1648495870.0,0,t1_i2h4bxg,i2h4bxg,False,[deleted],t3_tjv9fq,https://www.reddit.com/r/okc/comments/tjv9fq/seeking_recommendations_on_a_compassionate/,"seeking recommendations on a compassionate, primary care physician",/r/okc/comments/tjv9fq/seeking_recommendations_on_a_compassionate/i2h4bxg/,1,r/okc,0,1
The Criterion ruins performances.  I'll never go back.,t2_33oa6nf5,SparrowAndTheMachine,0,1648495658.0,0,t1_i2h3tau,i2h3tau,False,Kate_Gemini,t3_tjmmos,https://www.reddit.com/r/okc/comments/tjmmos/concert_venue_info/,Concert venue info,/r/okc/comments/tjmmos/concert_venue_info/i2h3tau/,1,r/okc,0,1
"Criterion is easily one of the worst sounding venues in OKC and its sight lines suck ass. Avoid at all costs.

Zoo amp, on the other hand, is legendary.",t2_33oa6nf5,SparrowAndTheMachine,0,1648495429.0,0,t1_i2h39bi,i2h39bi,True,Kate_Gemini,t3_tjmmos,https://www.reddit.com/r/okc/comments/tjmmos/concert_venue_info/,Concert venue info,/r/okc/comments/tjmmos/concert_venue_info/i2h39bi/,1,r/okc,0,1
"In the end, it doesn't matter, cops are allowed to lie.  And the cop not following the traffic laws has no bearing on OP speeding.  They need to be self-aware and any judge would laugh this crap out of court.",t2_7u7x0,cardinalsfanokc,0,1648495423.0,0,t1_i2h38t9,i2h38t9,False,stewiezone,t3_tqa7kb,https://www.reddit.com/r/okc/comments/tqa7kb/traffic_ticket/,Traffic Ticket,/r/okc/comments/tqa7kb/traffic_ticket/i2h38t9/,14,r/okc,0,14
"You were speeding despite the fact that you were following him at the speed he was going as well.  That part doesn't matter as two wrongs don't make a right.  

You do have the right to make a claim in court, but keep in mind that it may not go in your favor and you would have still pay the ticket.  If you pointed out that you were going the same speed as the person in front of you and didn't realize it was faster than the speed limit a judge could either pardon your mistake and warn you to monitor you speed in the future, or he could make you pay the fine and also add on that you were driving and not paying attention to the task at hand.  It is a risky chance to take.  Totally up to you.

$100 for speeding is light, pay it and keep your nose clean.  Or fight it and be prepared to to accept a possible worse outcome.  Talking to a lawyer may or may not help depending on the advice they give you and you would probably be paying more than the ticket even if you won.",t2_62qgm,atombomb1945,0,1648495205.0,0,t1_i2h2q59,i2h2q59,True,stewiezone,t3_tqa7kb,https://www.reddit.com/r/okc/comments/tqa7kb/traffic_ticket/,Traffic Ticket,/r/okc/comments/tqa7kb/traffic_ticket/i2h2q59/,18,r/okc,0,18
You are wrong on a lot of things and will definitely loose. The judge might slap you with more shit as well. I would suggest dropping it and deleting this post so you don’t look so stupid.,t2_wmf9d3j,Next-King9958,0,1648495118.0,0,t1_i2h2ipq,i2h2ipq,True,stewiezone,t3_tqa7kb,https://www.reddit.com/r/okc/comments/tqa7kb/traffic_ticket/,Traffic Ticket,/r/okc/comments/tqa7kb/traffic_ticket/i2h2ipq/,-6,r/okc,0,-6
"It's Oklahoma, so we'll probably have to go with the illustrated version",t2_33oa6nf5,SparrowAndTheMachine,0,1648495097.0,0,t1_i2h2gwp,i2h2gwp,False,AHrubik,t3_tk6g47,https://www.reddit.com/r/okc/comments/tk6g47/hb_3890_establishes_the_holy_bible_as_the/,HB 3890 establishes the Holy Bible as the official State of Oklahoma book,/r/okc/comments/tk6g47/hb_3890_establishes_the_holy_bible_as_the/i2h2gwp/,1,r/okc,0,1
Lol,t2_3kjo3ro,_wsmfp_,0,1648495092.0,0,t1_i2h2ggc,i2h2ggc,True,stewiezone,t3_tqa7kb,https://www.reddit.com/r/okc/comments/tqa7kb/traffic_ticket/,Traffic Ticket,/r/okc/comments/tqa7kb/traffic_ticket/i2h2ggc/,5,r/okc,0,5
A cop can pace a car just as well from in front as from behind. OP should learn not to follow cops to closely.,t2_asvqw,LostKnight84,0,1648495039.0,0,t1_i2h2bu0,i2h2bu0,False,stewiezone,t3_tqa7kb,https://www.reddit.com/r/okc/comments/tqa7kb/traffic_ticket/,Traffic Ticket,/r/okc/comments/tqa7kb/traffic_ticket/i2h2bu0/,12,r/okc,0,12
"Ah, a kind of universal sortition. Not a terrible idea.",t2_33oa6nf5,SparrowAndTheMachine,0,1648494936.0,0,t1_i2h22st,i2h22st,False,AHrubik,t3_tk6g47,https://www.reddit.com/r/okc/comments/tk6g47/hb_3890_establishes_the_holy_bible_as_the/,HB 3890 establishes the Holy Bible as the official State of Oklahoma book,/r/okc/comments/tk6g47/hb_3890_establishes_the_holy_bible_as_the/i2h22st/,1,r/okc,0,1
"I had a great one at Jason's Deli in Norman, but I'm looking forward to seeing better ones recommended.",t2_hkhq58m,Kilowog2814,1,1648494856.0,0,t1_i2h1vvj,i2h1vvj,True,sactownbing,t3_tpzl9o,https://www.reddit.com/r/okc/comments/tpzl9o/pastrami_on_rye_recommendations/,Pastrami on rye recommendations,/r/okc/comments/tpzl9o/pastrami_on_rye_recommendations/i2h1vvj/,0,r/okc,0,0
Not saying I wouldn't have ~~tailed~~ followed him either but your speeding is your fault. I don't see anything yo fight here.,t2_7swpg,dimechimes,0,1648494855.0,0,t1_i2h1vs5,i2h1vs5,True,stewiezone,t3_tqa7kb,https://www.reddit.com/r/okc/comments/tqa7kb/traffic_ticket/,Traffic Ticket,/r/okc/comments/tqa7kb/traffic_ticket/i2h1vs5/,9,r/okc,0,9
You were going 20 over and he only wrote you for 10 over. Sounds like a win to me.,t2_dqk78,meissho1,0,1648494834.0,0,t1_i2h1txu,i2h1txu,True,stewiezone,t3_tqa7kb,https://www.reddit.com/r/okc/comments/tqa7kb/traffic_ticket/,Traffic Ticket,/r/okc/comments/tqa7kb/traffic_ticket/i2h1txu/,40,r/okc,0,40
"> I did not realize the speed I was going

> I assumed that a law enforcement officer would be following the traffic laws

Well, neither of those pieces of information will help you in court. You could bring up the fact that you (to your knowledge) never got clocked with a radar gun, but it'll be tough if you don't have dashcam footage to hold up against theirs.",t2_101l3v,Jicd,0,1648494541.0,0,t1_i2h14l4,i2h14l4,True,stewiezone,t3_tqa7kb,https://www.reddit.com/r/okc/comments/tqa7kb/traffic_ticket/,Traffic Ticket,/r/okc/comments/tqa7kb/traffic_ticket/i2h14l4/,33,r/okc,0,33
"I can tell you that I learned during some Oklahoma law classes that if an officer does not have the lights on, he/she must obey by all standards traffic laws. The officer clearly made up the fact that he was in transit to respond to a call. They must also produce a dispatch log if requested, so you guys could easily verify the veracity of said officer's claim.",t2_mnj6xia,BLUECADETxTHREE,0,1648494355.0,0,t1_i2h0owg,i2h0owg,True,stewiezone,t3_tqa7kb,https://www.reddit.com/r/okc/comments/tqa7kb/traffic_ticket/,Traffic Ticket,/r/okc/comments/tqa7kb/traffic_ticket/i2h0owg/,3,r/okc,0,3
"FYI...If it was a state trooper, most of them are outfitted w/rear-facing radar as well.",t2_pfujl1i,Gunslinger327,0,1648494317.0,0,t1_i2h0lk7,i2h0lk7,True,stewiezone,t3_tqa7kb,https://www.reddit.com/r/okc/comments/tqa7kb/traffic_ticket/,Traffic Ticket,/r/okc/comments/tqa7kb/traffic_ticket/i2h0lk7/,22,r/okc,0,22
"Unfortunately you made a lot of wrong assumptions. You can always attempt to fight, but you will not win if your argument is I was just going as fast as the police officer. They quite frequently will pace cars instead of using radar. You admitted to him that you were going the same speed as him, so he will use that against you, doesn't matter if he was speeding. When I was young I had something similar happen to me, and a police officer told me everything I'm saying to you right now. I'd pay the ticket and learn from your mistake, but you do whatever you think is in your best interest. Good luck.",t2_8h7noasn,YellowSquashMedia,0,1648494185.0,0,t1_i2h0a4q,i2h0a4q,True,stewiezone,t3_tqa7kb,https://www.reddit.com/r/okc/comments/tqa7kb/traffic_ticket/,Traffic Ticket,/r/okc/comments/tqa7kb/traffic_ticket/i2h0a4q/,33,r/okc,0,33
"There's nothing to fight.  You were speeding, the cop caught you.  You made lots of assumptions and they were wrong.  Doesn't matter if he was responding to a call or not or why he was speeding.",t2_7u7x0,cardinalsfanokc,0,1648494175.0,0,t1_i2h0997,i2h0997,True,stewiezone,t3_tqa7kb,https://www.reddit.com/r/okc/comments/tqa7kb/traffic_ticket/,Traffic Ticket,/r/okc/comments/tqa7kb/traffic_ticket/i2h0997/,23,r/okc,0,23
">He then told me, (very sarcastically not that it matters), that he was responding to a vehicle accident and asked me if was responding to a vehicle accident.

""Yes, sir. A tanker truck loaded with dumb bitch juice overturned near your mom's house.""",t2_33oa6nf5,SparrowAndTheMachine,0,1648494045.0,0,t1_i2gzxul,i2gzxul,True,stewiezone,t3_tqa7kb,https://www.reddit.com/r/okc/comments/tqa7kb/traffic_ticket/,Traffic Ticket,/r/okc/comments/tqa7kb/traffic_ticket/i2gzxul/,-10,r/okc,0,-10
"Yes-Saturday. They were done by Noon :(

I might try the April 9 event, Highley park is in a REAL bad part of town, they only planted about 10 trees.",t2_s9c0q,A_Guy_Abroad,0,1648489817.0,0,t1_i2gpsql,i2gpsql,False,Foxbox405,t3_tn9ykf,https://www.reddit.com/r/okc/comments/tn9ykf/tree_planting_volunteer_event_at_highly_park_on/,Tree planting volunteer event at Highly park on 3/26 and Oliver Park on 4/09,/r/okc/comments/tn9ykf/tree_planting_volunteer_event_at_highly_park_on/i2gpsql/,1,r/okc,0,1
"I go to the Quail Springs Golds Gym. They have a sauna and steam room but the steam room is always down. They permanently closed the pool and hot tub. 

It’s still a nice gym and I recommend it to anyone if they can afford it.",t2_49a6aaex,LexKing89,0,1648485214.0,0,t1_i2gedd5,i2gedd5,True,horseshoebandit,t3_toj07x,https://www.reddit.com/r/okc/comments/toj07x/what_gym_do_you_guys_use/,What gym do you guys use?,/r/okc/comments/toj07x/what_gym_do_you_guys_use/i2gedd5/,1,r/okc,0,1
"Yay, I have a lot of new excursions to try. Thanks for all the input!",t2_c5pv9js2,Nosexuskitty,0,1648478498.0,0,t1_i2fxwr1,i2fxwr1,True,Nosexuskitty,t3_tpi38q,https://www.reddit.com/r/okc/comments/tpi38q/walking_trails_with_workout_stations/,Walking trails with workout stations,/r/okc/comments/tpi38q/walking_trails_with_workout_stations/i2fxwr1/,1,r/okc,0,1
"Opening in El Reno fall 2022

SOURCE:https://www.elrenobuc-ees.com/",t2_97mzc1pa,Newokie1959,0,1648472915.0,0,t1_i2flwb0,i2flwb0,True,dctr640,t3_gpwvdz,https://www.reddit.com/r/okc/comments/gpwvdz/bucees_in_oklahoma/,Buc-ee's in Oklahoma,/r/okc/comments/gpwvdz/bucees_in_oklahoma/i2flwb0/,1,r/okc,0,1
"There's a workout station at Riversport as well, and of course the trail nearby",t2_2q3h95tt,shawn_dubs,0,1648450969.0,0,t1_i2estvw,i2estvw,True,Nosexuskitty,t3_tpi38q,https://www.reddit.com/r/okc/comments/tpi38q/walking_trails_with_workout_stations/,Walking trails with workout stations,/r/okc/comments/tpi38q/walking_trails_with_workout_stations/i2estvw/,3,r/okc,0,3
"Both are a lot of fun! Enjoyed the shows I saw at them, granted I was seeing my friends play but still lol cool atmosphere",t2_an9og,Jacer4,0,1648444508.0,0,t1_i2ejxkt,i2ejxkt,False,New-Management-2204,t3_tnz32d,https://www.reddit.com/r/okc/comments/tnz32d/live_music_tonight_or_this_weekend/,Live music tonight or this weekend?,/r/okc/comments/tnz32d/live_music_tonight_or_this_weekend/i2ejxkt/,1,r/okc,0,1
Lmao thanks dude,t2_iu9bymn0,New-Management-2204,0,1648442530.0,0,t1_i2egs1t,i2egs1t,False,New-Management-2204,t3_tnz32d,https://www.reddit.com/r/okc/comments/tnz32d/live_music_tonight_or_this_weekend/,Live music tonight or this weekend?,/r/okc/comments/tnz32d/live_music_tonight_or_this_weekend/i2egs1t/,2,r/okc,0,2
"Definitely have to check out vzd’s, it’s pretty close to home, thanks!",t2_iu9bymn0,New-Management-2204,0,1648442510.0,0,t1_i2egqrv,i2egqrv,False,New-Management-2204,t3_tnz32d,https://www.reddit.com/r/okc/comments/tnz32d/live_music_tonight_or_this_weekend/,Live music tonight or this weekend?,/r/okc/comments/tnz32d/live_music_tonight_or_this_weekend/i2egqrv/,2,r/okc,0,2
I’d forgotten about the pigeon museum!,t2_6cd2tyuc,perfectlyniceperson,0,1648434583.0,0,t1_i2e25hk,i2e25hk,False,Nosexuskitty,t3_tpi38q,https://www.reddit.com/r/okc/comments/tpi38q/walking_trails_with_workout_stations/,Walking trails with workout stations,/r/okc/comments/tpi38q/walking_trails_with_workout_stations/i2e25hk/,2,r/okc,0,2
Food was delicious but the portions were skimpy compared to the Cavas I've been to in other states.,t2_rktxk,roflolpter,0,1648428621.0,0,t1_i2dq37y,i2dq37y,True,[deleted],t3_tp0dy9,https://www.reddit.com/r/okc/comments/tp0dy9/free_food_at_cava_on_classen_curve_today/,Free food at Cava on Classen Curve today,/r/okc/comments/tp0dy9/free_food_at_cava_on_classen_curve_today/i2dq37y/,1,r/okc,0,1
I think she has brains and will rebound strongly. she will be biggly.,t2_21xjsfpj,Fauxtura,0,1648427860.0,0,t1_i2doiqi,i2doiqi,True,joesaysso,t3_tnpjmk,https://www.reddit.com/r/okc/comments/tnpjmk/abby_broyles_has_dropped_out_of_the_race_for_5th/,Abby Broyles has dropped out of the race for 5th district seat.,/r/okc/comments/tnpjmk/abby_broyles_has_dropped_out_of_the_race_for_5th/i2doiqi/,2,r/okc,0,2
"VZD's and 51st Street Speakeasy have love shows that are fun to go to, check out Glass or Computer Girl if you happen to see them haha",t2_an9og,Jacer4,0,1648426010.0,0,t1_i2dkmx7,i2dkmx7,True,New-Management-2204,t3_tnz32d,https://www.reddit.com/r/okc/comments/tnz32d/live_music_tonight_or_this_weekend/,Live music tonight or this weekend?,/r/okc/comments/tnz32d/live_music_tonight_or_this_weekend/i2dkmx7/,2,r/okc,0,2
Is it open today?,t2_7rwxge9x,No-Caterpillar-9308,0,1648425598.0,0,t1_i2djrvl,i2djrvl,True,[deleted],t3_tp0dy9,https://www.reddit.com/r/okc/comments/tp0dy9/free_food_at_cava_on_classen_curve_today/,Free food at Cava on Classen Curve today,/r/okc/comments/tp0dy9/free_food_at_cava_on_classen_curve_today/i2djrvl/,1,r/okc,0,1
"yeah, I've seen a couple of flyers from tours where it is announced",t2_e3fbnumb,ngb161mx,0,1648418872.0,0,t1_i2d5yiq,i2d5yiq,False,ngb161mx,t3_tpbel5,https://www.reddit.com/r/okc/comments/tpbel5/in_oklahoma_city_exists_any_rock_bar/,In Oklahoma city exists any rock bar?,/r/okc/comments/tpbel5/in_oklahoma_city_exists_any_rock_bar/i2d5yiq/,2,r/okc,0,2
I will check them thank man!,t2_e3fbnumb,ngb161mx,0,1648418799.0,0,t1_i2d5t2z,i2d5t2z,False,ngb161mx,t3_tpbel5,https://www.reddit.com/r/okc/comments/tpbel5/in_oklahoma_city_exists_any_rock_bar/,In Oklahoma city exists any rock bar?,/r/okc/comments/tpbel5/in_oklahoma_city_exists_any_rock_bar/i2d5t2z/,2,r/okc,0,2
