body,author_fullname,author.name,controversiality,created,downs,fullname,id,is_root,link_author,link_id,link_permalink,link_title,permalink,score,subreddit_name_prefixed,total_awards_received,ups
Atwoods,t2_fefehp5i,shibashiba69,0,1648766612.0,0,t1_i2ws4dl,i2ws4dl,True,plupan,t3_tt4yz2,https://www.reddit.com/r/okc/comments/tt4yz2/where_to_buy_railroad_ties/,Where to buy railroad ties?,/r/okc/comments/tt4yz2/where_to_buy_railroad_ties/i2ws4dl/,1,r/okc,0,1
We do not own a truck unfortunately.,t2_3dd19zzo,briarrosehasthorns,0,1648766431.0,0,t1_i2wrpcd,i2wrpcd,False,briarrosehasthorns,t3_tsyjwn,https://www.reddit.com/r/okc/comments/tsyjwn/any_places_hiring/,Any places hiring?,/r/okc/comments/tsyjwn/any_places_hiring/i2wrpcd/,1,r/okc,0,1
"Man, I went into that Tower Records in Tokyo in \~1999!  I bought a Candyskins minidisc!  Still love that album",t2_21xx0pvx,PlayfulGold2945,0,1648763898.0,0,t1_i2wlnbl,i2wlnbl,True,Thejman5683,t3_tlvyor,https://www.reddit.com/r/okc/comments/tlvyor/anyone_have_any_pictures_of_the_tower_records_in/,Anyone have any pictures of the Tower Records in OKC,/r/okc/comments/tlvyor/anyone_have_any_pictures_of_the_tower_records_in/i2wlnbl/,1,r/okc,0,1
"I'm sure FB has already suggested, but has he been checked for a microchip?",t2_2jxdoo5t,nailgun198,0,1648761928.0,0,t1_i2wgojd,i2wgojd,False,[deleted],t3_tt3d1f,https://www.reddit.com/r/okc/comments/tt3d1f/found_dog_in_twin_lakes_neighborhood_blue_collar/,"Found dog in Twin Lakes neighborhood, blue collar with no tags",/r/okc/comments/tt3d1f/found_dog_in_twin_lakes_neighborhood_blue_collar/i2wgojd/,2,r/okc,0,2
Shoot...,t2_8m31rqf7,1StucknDerplahoma,0,1648759579.0,0,t1_i2walem,i2walem,False,briarrosehasthorns,t3_tsyjwn,https://www.reddit.com/r/okc/comments/tsyjwn/any_places_hiring/,Any places hiring?,/r/okc/comments/tsyjwn/any_places_hiring/i2walem/,1,r/okc,0,1
"No. Not at all unless he needs specific, reasonable requirements to facilitate the job.",t2_8m31rqf7,1StucknDerplahoma,0,1648759557.0,0,t1_i2waj8i,i2waj8i,False,briarrosehasthorns,t3_tsyjwn,https://www.reddit.com/r/okc/comments/tsyjwn/any_places_hiring/,Any places hiring?,/r/okc/comments/tsyjwn/any_places_hiring/i2waj8i/,3,r/okc,0,3
"Ah, I love the ""lawyers"" of Reddit. :/",t2_43y286nc,HairySmokeball,0,1648756477.0,0,t1_i2w2gpq,i2w2gpq,True,stewiezone,t3_tqa7kb,https://www.reddit.com/r/okc/comments/tqa7kb/traffic_ticket/,Traffic Ticket,/r/okc/comments/tqa7kb/traffic_ticket/i2w2gpq/,1,r/okc,0,1
Pacing \*is\* legal in Oklahoma.,t2_43y286nc,HairySmokeball,0,1648756376.0,0,t1_i2w27et,i2w27et,False,stewiezone,t3_tqa7kb,https://www.reddit.com/r/okc/comments/tqa7kb/traffic_ticket/,Traffic Ticket,/r/okc/comments/tqa7kb/traffic_ticket/i2w27et/,1,r/okc,0,1
The quality of stock varies greatly.   Just have the keep checking different locations...,t2_4df1lobt,d_r_gleason,0,1648756189.0,0,t1_i2w1pqr,i2w1pqr,True,plupan,t3_tt4yz2,https://www.reddit.com/r/okc/comments/tt4yz2/where_to_buy_railroad_ties/,Where to buy railroad ties?,/r/okc/comments/tt4yz2/where_to_buy_railroad_ties/i2w1pqr/,1,r/okc,0,1
"Yeah he has worked in grocery stores in inventory, then as a machine operator, and currently inventory for a warehouse. He has machine certifications but they are all for specific machinery for his old company.",t2_3dd19zzo,briarrosehasthorns,0,1648755927.0,0,t1_i2w11f7,i2w11f7,False,briarrosehasthorns,t3_tsyjwn,https://www.reddit.com/r/okc/comments/tsyjwn/any_places_hiring/,Any places hiring?,/r/okc/comments/tsyjwn/any_places_hiring/i2w11f7/,1,r/okc,0,1
What quality are you looking for?,t2_9pgwd,bantuwind,0,1648755749.0,0,t1_i2w0l2l,i2w0l2l,False,plupan,t3_tt4yz2,https://www.reddit.com/r/okc/comments/tt4yz2/where_to_buy_railroad_ties/,Where to buy railroad ties?,/r/okc/comments/tt4yz2/where_to_buy_railroad_ties/i2w0l2l/,1,r/okc,0,1
"What kind of work does he do? I’m relying on stereotypes, but is it technical (because that’s the path I went down).

Edit. I guess I should have fully read your post.",t2_1qoy2n6l,Se777enUP,0,1648755605.0,0,t1_i2w07wp,i2w07wp,False,briarrosehasthorns,t3_tsyjwn,https://www.reddit.com/r/okc/comments/tsyjwn/any_places_hiring/,Any places hiring?,/r/okc/comments/tsyjwn/any_places_hiring/i2w07wp/,1,r/okc,0,1
I usually don't talk about it anyways since it is his business but he truly believes this is why no one will hire him because they assume his diagnosis means he won't be a good worker. I will tell him he doesn't have to disclose it though. Maybe that will help him at least get some interviews.,t2_3dd19zzo,briarrosehasthorns,0,1648755486.0,0,t1_i2vzwxi,i2vzwxi,False,briarrosehasthorns,t3_tsyjwn,https://www.reddit.com/r/okc/comments/tsyjwn/any_places_hiring/,Any places hiring?,/r/okc/comments/tsyjwn/any_places_hiring/i2vzwxi/,3,r/okc,0,3
Apologies. I was thinking of twin bridges. I’ll delete,t2_uf92m4l,18127153,0,1648755376.0,0,t1_i2vzmr9,i2vzmr9,False,[deleted],t3_tt3d1f,https://www.reddit.com/r/okc/comments/tt3d1f/found_dog_in_twin_lakes_neighborhood_blue_collar/,"Found dog in Twin Lakes neighborhood, blue collar with no tags",/r/okc/comments/tt3d1f/found_dog_in_twin_lakes_neighborhood_blue_collar/i2vzmr9/,2,r/okc,0,2
"Reading comprehension. OP said it was highway patrol, not city cops.",t2_43y286nc,HairySmokeball,0,1648755325.0,0,t1_i2vzi15,i2vzi15,False,stewiezone,t3_tqa7kb,https://www.reddit.com/r/okc/comments/tqa7kb/traffic_ticket/,Traffic Ticket,/r/okc/comments/tqa7kb/traffic_ticket/i2vzi15/,1,r/okc,0,1
20 over is NOT a felony in Oklahoma.,t2_43y286nc,HairySmokeball,0,1648755276.0,0,t1_i2vzdje,i2vzdje,False,stewiezone,t3_tqa7kb,https://www.reddit.com/r/okc/comments/tqa7kb/traffic_ticket/,Traffic Ticket,/r/okc/comments/tqa7kb/traffic_ticket/i2vzdje/,1,r/okc,0,1
Understandable. It’s much easier to say as well.,t2_1qoy2n6l,Se777enUP,0,1648755264.0,0,t1_i2vzcgh,i2vzcgh,False,briarrosehasthorns,t3_tsyjwn,https://www.reddit.com/r/okc/comments/tsyjwn/any_places_hiring/,Any places hiring?,/r/okc/comments/tsyjwn/any_places_hiring/i2vzcgh/,1,r/okc,0,1
I know it is now considered part of Autism but my husband prefers to use Aspergers since that is what it was diagnosed as. I just go off of what he prefers.,t2_3dd19zzo,briarrosehasthorns,0,1648755193.0,0,t1_i2vz5ua,i2vz5ua,False,briarrosehasthorns,t3_tsyjwn,https://www.reddit.com/r/okc/comments/tsyjwn/any_places_hiring/,Any places hiring?,/r/okc/comments/tsyjwn/any_places_hiring/i2vz5ua/,7,r/okc,0,7
I also recommend Paycom! There are a ton of different roles and positions. Great benefits and a great company to work for.,t2_yvffw,AmidaRose,0,1648755110.0,0,t1_i2vyy45,i2vyy45,True,briarrosehasthorns,t3_tsyjwn,https://www.reddit.com/r/okc/comments/tsyjwn/any_places_hiring/,Any places hiring?,/r/okc/comments/tsyjwn/any_places_hiring/i2vyy45/,1,r/okc,0,1
"Aspergers is an antiquated term, of which I was initially diagnosed with. It’s now called Autism Spectrum Disorder (Level 1 through 3). Anyways, it’s absolutely false he would have to disclose any health information to an employer.",t2_1qoy2n6l,Se777enUP,0,1648755053.0,0,t1_i2vysu5,i2vysu5,False,briarrosehasthorns,t3_tsyjwn,https://www.reddit.com/r/okc/comments/tsyjwn/any_places_hiring/,Any places hiring?,/r/okc/comments/tsyjwn/any_places_hiring/i2vysu5/,2,r/okc,0,2
They have some thanks for the information!,t2_dq2ciwod,plupan,0,1648754575.0,0,t1_i2vxkc0,i2vxkc0,False,plupan,t3_tt4yz2,https://www.reddit.com/r/okc/comments/tt4yz2/where_to_buy_railroad_ties/,Where to buy railroad ties?,/r/okc/comments/tt4yz2/where_to_buy_railroad_ties/i2vxkc0/,1,r/okc,0,1
I found some at Minick Minerals for 30.75 a pop. Lowes sales some at $25 or something like that. But the quality at Lowes isn’t too good.,t2_dq2ciwod,plupan,0,1648754563.0,0,t1_i2vxj9l,i2vxj9l,False,plupan,t3_tt4yz2,https://www.reddit.com/r/okc/comments/tt4yz2/where_to_buy_railroad_ties/,Where to buy railroad ties?,/r/okc/comments/tt4yz2/where_to_buy_railroad_ties/i2vxj9l/,2,r/okc,0,2
Atc drivetrain on Reno ave and Morgan rd,t2_hfqm0mns,brayNmik420,0,1648754542.0,0,t1_i2vxha7,i2vxha7,True,briarrosehasthorns,t3_tsyjwn,https://www.reddit.com/r/okc/comments/tsyjwn/any_places_hiring/,Any places hiring?,/r/okc/comments/tsyjwn/any_places_hiring/i2vxha7/,1,r/okc,0,1
Yes I am aware but thanks for the heads up. Just a retaining wall non garden use.,t2_dq2ciwod,plupan,0,1648754355.0,0,t1_i2vwzsm,i2vwzsm,False,plupan,t3_tt4yz2,https://www.reddit.com/r/okc/comments/tt4yz2/where_to_buy_railroad_ties/,Where to buy railroad ties?,/r/okc/comments/tt4yz2/where_to_buy_railroad_ties/i2vwzsm/,2,r/okc,0,2
"Blue knight energy partners has two openings in Muskogee, they pay way over 16 an hour",t2_95hggns2,Maximum-Friendship-6,0,1648752692.0,0,t1_i2vsqcc,i2vsqcc,True,briarrosehasthorns,t3_tsyjwn,https://www.reddit.com/r/okc/comments/tsyjwn/any_places_hiring/,Any places hiring?,/r/okc/comments/tsyjwn/any_places_hiring/i2vsqcc/,1,r/okc,0,1
How much do they usually cost?,t2_dzzmlhgq,Ok-Butterscotch-8227,0,1648752176.0,0,t1_i2vredq,i2vredq,True,plupan,t3_tt4yz2,https://www.reddit.com/r/okc/comments/tt4yz2/where_to_buy_railroad_ties/,Where to buy railroad ties?,/r/okc/comments/tt4yz2/where_to_buy_railroad_ties/i2vredq/,1,r/okc,0,1
Thank you! DM sent,t2_3dd19zzo,briarrosehasthorns,0,1648752024.0,0,t1_i2vr08k,i2vr08k,False,briarrosehasthorns,t3_tsyjwn,https://www.reddit.com/r/okc/comments/tsyjwn/any_places_hiring/,Any places hiring?,/r/okc/comments/tsyjwn/any_places_hiring/i2vr08k/,1,r/okc,0,1
Thank you! I sent a dm,t2_3dd19zzo,briarrosehasthorns,0,1648751920.0,0,t1_i2vqqeu,i2vqqeu,False,briarrosehasthorns,t3_tsyjwn,https://www.reddit.com/r/okc/comments/tsyjwn/any_places_hiring/,Any places hiring?,/r/okc/comments/tsyjwn/any_places_hiring/i2vqqeu/,1,r/okc,0,1
"A guy in Warwick used to sell them. Might give a call. Picker's Patch on 66
(405) 249-3074
https://goo.gl/maps/f687TdutQRzSL9A17",t2_9hlo6,oklahomasooner55,0,1648751828.0,0,t1_i2vqhvw,i2vqhvw,True,plupan,t3_tt4yz2,https://www.reddit.com/r/okc/comments/tt4yz2/where_to_buy_railroad_ties/,Where to buy railroad ties?,/r/okc/comments/tt4yz2/where_to_buy_railroad_ties/i2vqhvw/,4,r/okc,0,4
"Yeah they all are, but I had them lining my flower & veg garden for over a decade & they might have poisoned me, but everything grew just fine.",t2_6khkks17,TTigerLilyx,0,1648751220.0,0,t1_i2vox0s,i2vox0s,False,plupan,t3_tt4yz2,https://www.reddit.com/r/okc/comments/tt4yz2/where_to_buy_railroad_ties/,Where to buy railroad ties?,/r/okc/comments/tt4yz2/where_to_buy_railroad_ties/i2vox0s/,1,r/okc,0,1
thats pretty much going to be impossible.,t2_e42c63dj,dizzycarrot7980,0,1648750891.0,0,t1_i2vo26k,i2vo26k,False,plupan,t3_tt4yz2,https://www.reddit.com/r/okc/comments/tt4yz2/where_to_buy_railroad_ties/,Where to buy railroad ties?,/r/okc/comments/tt4yz2/where_to_buy_railroad_ties/i2vo26k/,3,r/okc,0,3
"Giving my free award for better visibility. Good luck, Pups.",t2_ak6u5as,bocepheid,0,1648750485.0,0,t1_i2vmzzx,i2vmzzx,True,[deleted],t3_tt3d1f,https://www.reddit.com/r/okc/comments/tt3d1f/found_dog_in_twin_lakes_neighborhood_blue_collar/,"Found dog in Twin Lakes neighborhood, blue collar with no tags",/r/okc/comments/tt3d1f/found_dog_in_twin_lakes_neighborhood_blue_collar/i2vmzzx/,2,r/okc,0,2
"If you’re using them for a raised garden, make damn sure they haven’t been treated with creosote.",t2_4heb2,putsch80,0,1648750478.0,0,t1_i2vmzd2,i2vmzd2,True,plupan,t3_tt4yz2,https://www.reddit.com/r/okc/comments/tt4yz2/where_to_buy_railroad_ties/,Where to buy railroad ties?,/r/okc/comments/tt4yz2/where_to_buy_railroad_ties/i2vmzd2/,12,r/okc,0,12
"Love's Corporate (almost all in OKC): [https://jobs.loves.com/loves/go/Corporate/401310/](https://jobs.loves.com/loves/go/Corporate/401310/)

Entire state:

[https://jobs.loves.com/search/?createNewAlert=false&q=&optionsFacetsDD\_department=Employee+-+Full+Time&optionsFacetsDD\_state=OK](https://jobs.loves.com/search/?createNewAlert=false&q=&optionsFacetsDD_department=Employee+-+Full+Time&optionsFacetsDD_state=OK)",t2_4aijm,EricRP,0,1648750463.0,0,t1_i2vmxwo,i2vmxwo,True,briarrosehasthorns,t3_tsyjwn,https://www.reddit.com/r/okc/comments/tsyjwn/any_places_hiring/,Any places hiring?,/r/okc/comments/tsyjwn/any_places_hiring/i2vmxwo/,2,r/okc,0,2
Costco!,t2_10dcv7,milehighgranger,0,1648750269.0,0,t1_i2vmfnm,i2vmfnm,True,briarrosehasthorns,t3_tsyjwn,https://www.reddit.com/r/okc/comments/tsyjwn/any_places_hiring/,Any places hiring?,/r/okc/comments/tsyjwn/any_places_hiring/i2vmfnm/,2,r/okc,0,2
"Shelly's Grooming near 29th & Sunnylane. She does a good job, is very sweet with our two dogs (one of whom is so terrified of any place that smells of other pets that she stress-poops at the door), and seems pretty reasonably priced.",t2_80sya10c,Beyond__Words,0,1648750262.0,0,t1_i2vmf1q,i2vmf1q,True,KDubbn_Hard,t3_tt0ttp,https://www.reddit.com/r/okc/comments/tt0ttp/recommendations_for_a_dog_groomer/,Recommendations for a dog groomer,/r/okc/comments/tt0ttp/recommendations_for_a_dog_groomer/i2vmf1q/,1,r/okc,0,1
"Check out the Oklahoma Department of Rehabilitation service. They help people find jobs and often hire people themselves. Mediocre pay, but good benefits. And very stable.",t2_8urefnai,Miata-is-slow,0,1648749956.0,0,t1_i2vlmhf,i2vlmhf,True,briarrosehasthorns,t3_tsyjwn,https://www.reddit.com/r/okc/comments/tsyjwn/any_places_hiring/,Any places hiring?,/r/okc/comments/tsyjwn/any_places_hiring/i2vlmhf/,3,r/okc,0,3
"Definitely get in touch w the health department. If I remember correctly, they only take a certain amount of STI testing appointments each day. Best bet is to call as soon as they open the day that you would like to be seen.",t2_dmak2t8k,metaphysicalmami,0,1648749699.0,0,t1_i2vkxsn,i2vkxsn,True,Amazing-Ad-6666,t3_tsqj01,https://www.reddit.com/r/okc/comments/tsqj01/sti_testing/,STI testing,/r/okc/comments/tsqj01/sti_testing/i2vkxsn/,2,r/okc,0,2
Thanks I’ll do that!,t2_dq2ciwod,plupan,0,1648749109.0,0,t1_i2vjcxq,i2vjcxq,False,plupan,t3_tt4yz2,https://www.reddit.com/r/okc/comments/tt4yz2/where_to_buy_railroad_ties/,Where to buy railroad ties?,/r/okc/comments/tt4yz2/where_to_buy_railroad_ties/i2vjcxq/,1,r/okc,0,1
Yeah I saw them at Lowes the person I was with didn’t like them.,t2_dq2ciwod,plupan,0,1648749097.0,0,t1_i2vjbtz,i2vjbtz,False,plupan,t3_tt4yz2,https://www.reddit.com/r/okc/comments/tt4yz2/where_to_buy_railroad_ties/,Where to buy railroad ties?,/r/okc/comments/tt4yz2/where_to_buy_railroad_ties/i2vjbtz/,1,r/okc,0,1
"Man companies literally hate when you point shit out, especially if it means they have to make a little effort to change something. They would literally love to lose money than put an extra X somewhere.",t2_aat2n,negroiso,0,1648748982.0,0,t1_i2vj0pw,i2vj0pw,False,briarrosehasthorns,t3_tsyjwn,https://www.reddit.com/r/okc/comments/tsyjwn/any_places_hiring/,Any places hiring?,/r/okc/comments/tsyjwn/any_places_hiring/i2vj0pw/,3,r/okc,0,3
Lowe's also sells them,t2_4df1lobt,d_r_gleason,0,1648748807.0,0,t1_i2vijwf,i2vijwf,True,plupan,t3_tt4yz2,https://www.reddit.com/r/okc/comments/tt4yz2/where_to_buy_railroad_ties/,Where to buy railroad ties?,/r/okc/comments/tt4yz2/where_to_buy_railroad_ties/i2vijwf/,3,r/okc,0,3
"My wife, has degree and is a mad genius at excel. She applied to some positions open for a while and literally got auto reject almost less than 5 minutes after submitting.

What’s the key to getting to even speak to somebody?",t2_aat2n,negroiso,0,1648748768.0,0,t1_i2vig3w,i2vig3w,False,briarrosehasthorns,t3_tsyjwn,https://www.reddit.com/r/okc/comments/tsyjwn/any_places_hiring/,Any places hiring?,/r/okc/comments/tsyjwn/any_places_hiring/i2vig3w/,5,r/okc,0,5
"From what I hear about PayCom. If he makes it over 60 days or so, he will damn near be promoted up to management.",t2_aat2n,negroiso,0,1648748690.0,0,t1_i2vi8qw,i2vi8qw,False,briarrosehasthorns,t3_tsyjwn,https://www.reddit.com/r/okc/comments/tsyjwn/any_places_hiring/,Any places hiring?,/r/okc/comments/tsyjwn/any_places_hiring/i2vi8qw/,2,r/okc,0,2
Hobby lobby,t2_4zn0q,sukicat,0,1648748390.0,0,t1_i2vhfwd,i2vhfwd,True,briarrosehasthorns,t3_tsyjwn,https://www.reddit.com/r/okc/comments/tsyjwn/any_places_hiring/,Any places hiring?,/r/okc/comments/tsyjwn/any_places_hiring/i2vhfwd/,1,r/okc,0,1
I feel like I've seen them at Minick Materials but I'm not 100% sure. I'd give them a call.,t2_15g0xx,Ozemba,0,1648748342.0,0,t1_i2vhbe9,i2vhbe9,True,plupan,t3_tt4yz2,https://www.reddit.com/r/okc/comments/tt4yz2/where_to_buy_railroad_ties/,Where to buy railroad ties?,/r/okc/comments/tt4yz2/where_to_buy_railroad_ties/i2vhbe9/,4,r/okc,0,4
"Yeah, I've got type 1 Diabetes and I never tell my employer until it's too late, when I'm past their probationary peorod. But way I see it is, you don't need to tell anyone anything unless, like you're saying, he is looking for accommodation",t2_arwi2oru,GenuineMyth69,0,1648746575.0,0,t1_i2vcpcd,i2vcpcd,False,briarrosehasthorns,t3_tsyjwn,https://www.reddit.com/r/okc/comments/tsyjwn/any_places_hiring/,Any places hiring?,/r/okc/comments/tsyjwn/any_places_hiring/i2vcpcd/,6,r/okc,0,6
DM me! Would love to help.,t2_3pxwgcv,ifitsootsyou,0,1648746409.0,0,t1_i2vc9sm,i2vc9sm,True,briarrosehasthorns,t3_tsyjwn,https://www.reddit.com/r/okc/comments/tsyjwn/any_places_hiring/,Any places hiring?,/r/okc/comments/tsyjwn/any_places_hiring/i2vc9sm/,1,r/okc,0,1
"It is not Edmond. Thank you for allowing me to clarify, Twin Lakes is settled off of 63rd and McCarthur.",t2_oetoy,bbbebee,0,1648746221.0,0,t1_i2vbs4h,i2vbs4h,False,[deleted],t3_tt3d1f,https://www.reddit.com/r/okc/comments/tt3d1f/found_dog_in_twin_lakes_neighborhood_blue_collar/,"Found dog in Twin Lakes neighborhood, blue collar with no tags",/r/okc/comments/tt3d1f/found_dog_in_twin_lakes_neighborhood_blue_collar/i2vbs4h/,5,r/okc,0,5
"Thank you, I hope we do find them. He is a very sweet boy.",t2_oetoy,bbbebee,0,1648745393.0,0,t1_i2v9ltm,i2v9ltm,False,[deleted],t3_tt3d1f,https://www.reddit.com/r/okc/comments/tt3d1f/found_dog_in_twin_lakes_neighborhood_blue_collar/,"Found dog in Twin Lakes neighborhood, blue collar with no tags",/r/okc/comments/tt3d1f/found_dog_in_twin_lakes_neighborhood_blue_collar/i2v9ltm/,3,r/okc,0,3
This is my worst nightmare… keep your pets collared with current phone numbers people! Good luck finding the owners 🍀,t2_dzzmlhgq,Ok-Butterscotch-8227,0,1648745345.0,0,t1_i2v9h3b,i2v9h3b,True,[deleted],t3_tt3d1f,https://www.reddit.com/r/okc/comments/tt3d1f/found_dog_in_twin_lakes_neighborhood_blue_collar/,"Found dog in Twin Lakes neighborhood, blue collar with no tags",/r/okc/comments/tt3d1f/found_dog_in_twin_lakes_neighborhood_blue_collar/i2v9h3b/,4,r/okc,0,4
"Sure-Z-Dogz 
214 N. service rd 
Moore OK 73160

(405)799-9781",t2_83ytdhqh,MisterBiSteven,0,1648745331.0,0,t1_i2v9fq5,i2v9fq5,True,KDubbn_Hard,t3_tt0ttp,https://www.reddit.com/r/okc/comments/tt0ttp/recommendations_for_a_dog_groomer/,Recommendations for a dog groomer,/r/okc/comments/tt0ttp/recommendations_for_a_dog_groomer/i2v9fq5/,1,r/okc,0,1
THe health department of any county will do it for free.,t2_7nslztcg,Rynofskie,0,1648745305.0,0,t1_i2v9daj,i2v9daj,True,Amazing-Ad-6666,t3_tsqj01,https://www.reddit.com/r/okc/comments/tsqj01/sti_testing/,STI testing,/r/okc/comments/tsqj01/sti_testing/i2v9daj/,3,r/okc,0,3
Barks and Bubbles Boutique in Newcastle. Only place I’ll take my golden doodle,t2_aq60h0y3,South_Lake_Garage,0,1648745009.0,0,t1_i2v8kuo,i2v8kuo,True,KDubbn_Hard,t3_tt0ttp,https://www.reddit.com/r/okc/comments/tt0ttp/recommendations_for_a_dog_groomer/,Recommendations for a dog groomer,/r/okc/comments/tt0ttp/recommendations_for_a_dog_groomer/i2v8kuo/,1,r/okc,0,1
"EDIT- FOUND OWNERS! Thank you. Will delete.


He is a boy, maybe Yorkie/terrier mix with a little white in his fur and a couple missing teeth but very energetic and can easily jump a short fence. Found late last night in The Pines adjacent to Twin Lakes. His fur is a little matted and he is thin so he may be far from home. He is not fixed. Has already been posted in neighborhood Facebook group.",t2_oetoy,bbbebee,0,1648743609.0,0,t1_i2v4u3f,i2v4u3f,True,[deleted],t3_tt3d1f,https://www.reddit.com/r/okc/comments/tt3d1f/found_dog_in_twin_lakes_neighborhood_blue_collar/,"Found dog in Twin Lakes neighborhood, blue collar with no tags",/r/okc/comments/tt3d1f/found_dog_in_twin_lakes_neighborhood_blue_collar/i2v4u3f/,2,r/okc,0,2
Anthem brewery is hiring for production,t2_j9g2o4z,allisonpaiiige,0,1648743011.0,0,t1_i2v39sz,i2v39sz,True,briarrosehasthorns,t3_tsyjwn,https://www.reddit.com/r/okc/comments/tsyjwn/any_places_hiring/,Any places hiring?,/r/okc/comments/tsyjwn/any_places_hiring/i2v39sz/,2,r/okc,0,2
+1 for Paycom. Benefits are good and the culture is great if you're in the right dept.,t2_c2m5hv2,Perpetualsnark,0,1648742857.0,0,t1_i2v2vfv,i2v2vfv,False,briarrosehasthorns,t3_tsyjwn,https://www.reddit.com/r/okc/comments/tsyjwn/any_places_hiring/,Any places hiring?,/r/okc/comments/tsyjwn/any_places_hiring/i2v2vfv/,5,r/okc,0,5
I’m guessing they mean sometimes it’s hard for someone with Asperger’s to know when it’s okay to just keep the truth secret,t2_13kdro,adamsflys,0,1648742848.0,0,t1_i2v2ulk,i2v2ulk,False,briarrosehasthorns,t3_tsyjwn,https://www.reddit.com/r/okc/comments/tsyjwn/any_places_hiring/,Any places hiring?,/r/okc/comments/tsyjwn/any_places_hiring/i2v2ulk/,9,r/okc,0,9
"Translation: People with Asperger’s tend to be honest, sometimes to a point of fault.

Being “economical with truth” means leaving out important information, including times when they omission could be considered lying.",t2_155s3n,103948023034,0,1648742824.0,0,t1_i2v2sex,i2v2sex,False,briarrosehasthorns,t3_tsyjwn,https://www.reddit.com/r/okc/comments/tsyjwn/any_places_hiring/,Any places hiring?,/r/okc/comments/tsyjwn/any_places_hiring/i2v2sex/,19,r/okc,0,19
Planned parenthood on nw 23rd as well as county health department offer free STI testing.,t2_gvdn6,LoneStarBandit19,0,1648742498.0,0,t1_i2v1y0a,i2v1y0a,True,Amazing-Ad-6666,t3_tsqj01,https://www.reddit.com/r/okc/comments/tsqj01/sti_testing/,STI testing,/r/okc/comments/tsqj01/sti_testing/i2v1y0a/,11,r/okc,0,11
What do you mean by this?,t2_4j2mdtrx,phloaty,0,1648742431.0,0,t1_i2v1rub,i2v1rub,False,briarrosehasthorns,t3_tsyjwn,https://www.reddit.com/r/okc/comments/tsyjwn/any_places_hiring/,Any places hiring?,/r/okc/comments/tsyjwn/any_places_hiring/i2v1rub/,1,r/okc,0,1
"As of our latest update, they are supposed to reopen in November. Planning on starting to move plants back into the crystal bridge in September.",t2_15g0xx,Ozemba,0,1648741810.0,0,t1_i2v05ni,i2v05ni,False,Nosexuskitty,t3_tru7nb,https://www.reddit.com/r/okc/comments/tru7nb/corpse_flower_at_the_myriad_botanical_gardens/,Corpse Flower at the Myriad Botanical Gardens,/r/okc/comments/tru7nb/corpse_flower_at_the_myriad_botanical_gardens/i2v05ni/,1,r/okc,0,1
[https://youtu.be/XA7kSdHg\_4M](https://youtu.be/XA7kSdHg_4M) and re-relisted it,t2_15g0xx,Ozemba,0,1648741749.0,0,t1_i2uzzzs,i2uzzzs,False,Nosexuskitty,t3_tru7nb,https://www.reddit.com/r/okc/comments/tru7nb/corpse_flower_at_the_myriad_botanical_gardens/,Corpse Flower at the Myriad Botanical Gardens,/r/okc/comments/tru7nb/corpse_flower_at_the_myriad_botanical_gardens/i2uzzzs/,1,r/okc,0,1
"Try Tinker AFB. They are pretty good about working with people and finding them a good fit. 

https://i.imgur.com/DjXtgSd.jpg

The image contains an email address for the resume pool. A lot of positions start at WG-05 step one which is $19.88 an hour.",t2_6cu4mv5,BlackRob97,0,1648741297.0,0,t1_i2uytdb,i2uytdb,True,briarrosehasthorns,t3_tsyjwn,https://www.reddit.com/r/okc/comments/tsyjwn/any_places_hiring/,Any places hiring?,/r/okc/comments/tsyjwn/any_places_hiring/i2uytdb/,10,r/okc,0,10
You can check out the MinuteClinics at CVS also.  They do STI testing and it’s pretty easy to get in - not sure of the pricing though.,t2_k1k5gxl0,okie_dokie2020,0,1648741267.0,0,t1_i2uyqfs,i2uyqfs,True,Amazing-Ad-6666,t3_tsqj01,https://www.reddit.com/r/okc/comments/tsqj01/sti_testing/,STI testing,/r/okc/comments/tsqj01/sti_testing/i2uyqfs/,1,r/okc,0,1
Looks like the sales position was recently filled but there are a couple of support slots open. No real technical requirements posted for that position as we are willing to train people. It's a pretty good company to work for - I wouldn't even offer this up if that weren't the case. Might as well take a shot at it. You never know it could lead to a life altering career change. DM me and I'll send you the link,t2_ba4a26yt,PapaHayseed,0,1648740600.0,0,t1_i2ux0a6,i2ux0a6,False,briarrosehasthorns,t3_tsyjwn,https://www.reddit.com/r/okc/comments/tsyjwn/any_places_hiring/,Any places hiring?,/r/okc/comments/tsyjwn/any_places_hiring/i2ux0a6/,2,r/okc,0,2
I believe the health department does free STI testing.,t2_31kim9ba,poundpups,0,1648740589.0,0,t1_i2uwz9a,i2uwz9a,True,Amazing-Ad-6666,t3_tsqj01,https://www.reddit.com/r/okc/comments/tsqj01/sti_testing/,STI testing,/r/okc/comments/tsqj01/sti_testing/i2uwz9a/,10,r/okc,0,10
Have him check out Petroleum Instruments Company at I35 and 25th. They had an ad in the electric coop newsletter.,t2_e0i77,travlr2010,0,1648740173.0,0,t1_i2uvwea,i2uvwea,True,briarrosehasthorns,t3_tsyjwn,https://www.reddit.com/r/okc/comments/tsyjwn/any_places_hiring/,Any places hiring?,/r/okc/comments/tsyjwn/any_places_hiring/i2uvwea/,1,r/okc,0,1
Is he open to traveling a few days a week and does he own a truck?,t2_406btz8c,Dogschosen,0,1648740002.0,0,t1_i2uvgf9,i2uvgf9,True,briarrosehasthorns,t3_tsyjwn,https://www.reddit.com/r/okc/comments/tsyjwn/any_places_hiring/,Any places hiring?,/r/okc/comments/tsyjwn/any_places_hiring/i2uvgf9/,1,r/okc,0,1
I don't think so. I'd have to ask on that but I really don't think it is.,t2_ba4a26yt,PapaHayseed,0,1648739631.0,0,t1_i2uuieg,i2uuieg,False,briarrosehasthorns,t3_tsyjwn,https://www.reddit.com/r/okc/comments/tsyjwn/any_places_hiring/,Any places hiring?,/r/okc/comments/tsyjwn/any_places_hiring/i2uuieg/,1,r/okc,0,1
