body,author_fullname,author.name,controversiality,created,downs,fullname,id,is_root,link_author,link_id,link_permalink,link_title,permalink,score,subreddit_name_prefixed,total_awards_received,ups
I cannot give to someone that owns better markers than me.,t2_gfcv3he0,alpharamx,0,1649008207.0,0,t1_i38yj2w,i38yj2w,True,WarMaiden666,t3_tmxhvr,https://www.reddit.com/r/okc/comments/tmxhvr/sumner_n_griff_03242022/,Sumner n’ Griff. 03/24/2022,/r/okc/comments/tmxhvr/sumner_n_griff_03242022/i38yj2w/,1,r/okc,0,1
"This sub is much cleaner, it seems, from all of the political BS, that you see in the u/tulsa and u/oklahoma subs. Very refreshing.",t2_gfcv3he0,alpharamx,0,1649008126.0,0,t1_i38ybt3,i38ybt3,True,blacksoxing,t3_tmxz91,https://www.reddit.com/r/okc/comments/tmxz91/off_topic_okcs_sub_is_probably_one_of_the_most/,"Off topic: OKC's sub is probably one of the most ""friendly"" ones around regarding city size.",/r/okc/comments/tmxz91/off_topic_okcs_sub_is_probably_one_of_the_most/i38ybt3/,1,r/okc,0,1
You dont know what people think. You are assuming a lot here.,t2_g5700vcn,GrittyPrettySitty,0,1648953398.0,0,t1_i36dgp4,i36dgp4,False,fitchmt,t3_ttynvy,https://www.reddit.com/r/okc/comments/ttynvy/oklahoma_christian_university_librarian_resigns/,Oklahoma Christian University librarian resigns after 18 years for being denied tenure over pro LGBTQ+ social media post,/r/okc/comments/ttynvy/oklahoma_christian_university_librarian_resigns/i36dgp4/,0,r/okc,0,0
There was a biking marathon or something at Hefner and sooner as well as MLK and 63rd maybe it went that way as well,t2_9hlo6,oklahomasooner55,0,1648953308.0,0,t1_i36da4p,i36da4p,True,[deleted],t3_tuyikp,https://www.reddit.com/r/okc/comments/tuyikp/i_drove_on_east_bound_memorial_today_at_around/,"I drove on east bound memorial today at around 10am. There were tons of people standing on both sides of the road around Chisholm Creek, most of them had cameras. Why?",/r/okc/comments/tuyikp/i_drove_on_east_bound_memorial_today_at_around/i36da4p/,1,r/okc,0,1
That's definitely it,t2_rmw32,HH_YoursTruly,0,1648953240.0,0,t1_i36d584,i36d584,False,[deleted],t3_tuyikp,https://www.reddit.com/r/okc/comments/tuyikp/i_drove_on_east_bound_memorial_today_at_around/,"I drove on east bound memorial today at around 10am. There were tons of people standing on both sides of the road around Chisholm Creek, most of them had cameras. Why?",/r/okc/comments/tuyikp/i_drove_on_east_bound_memorial_today_at_around/i36d584/,1,r/okc,0,1
"Coffee and Cars?
Edit: yes I believe Coffee and Cars had an event today. https://m.facebook.com/CoffeeandCarsOKC/",t2_ar7uk,fangled,0,1648952984.0,0,t1_i36cmjj,i36cmjj,True,[deleted],t3_tuyikp,https://www.reddit.com/r/okc/comments/tuyikp/i_drove_on_east_bound_memorial_today_at_around/,"I drove on east bound memorial today at around 10am. There were tons of people standing on both sides of the road around Chisholm Creek, most of them had cameras. Why?",/r/okc/comments/tuyikp/i_drove_on_east_bound_memorial_today_at_around/i36cmjj/,1,r/okc,0,1
"https://www.google.com/search?q=martin+park+nature+center+bird+viewer&tbm=isch&ved=2ahUKEwjv17rVxPb2AhVLmGoFHdQxAsgQ2-cCegQIABAB&oq=martin+park+nature+center+bird+viewer&gs_lcp=ChJtb2JpbGUtZ3dzLXdpei1pbWcQAzIECB4QCjoFCAAQgAQ6BAgAEBg6BAgAEB46BQghEKsCOgQIIRAKUO4GWItXYJJiaAJwAHgAgAG3AogB6QuSAQgxMy4wLjEuMZgBAKABAcABAQ&sclient=mobile-gws-wiz-img&ei=xdxIYq_hBsuwqtsP1OOIwAw&bih=603&biw=360&client=ms-android-samsung-rvo1&prmd=imnv#imgrc=AI0mlmA3XzkYFM

Sorry for the crappy Google link,  idk how to avoid it. 

 The bird blind at martin park in nw okc is like a super glory hole with 30 holes in a row.",t2_ajkdt24t,randomw0rdz,0,1648942684.0,0,t1_i35z73z,i35z73z,True,Thick_Corner648,t3_tuvy08,https://www.reddit.com/r/okc/comments/tuvy08/anyone_know_of_any_glory_holes/,anyone know of any glory holes?,/r/okc/comments/tuvy08/anyone_know_of_any_glory_holes/i35z73z/,1,r/okc,0,1
Active shooter situation earlier this afternoon.   Check any of the local news outlets.,t2_9bbmevp2,Stratagraphic,0,1648942039.0,0,t1_i35xw2x,i35xw2x,True,BlueBlackCat,t3_tuwaqi,https://www.reddit.com/r/okc/comments/tuwaqi/why_are_the_entrances_onto_the_kilpatrick/,why are the entrances onto the Kilpatrick turnpike closed at i35?,/r/okc/comments/tuwaqi/why_are_the_entrances_onto_the_kilpatrick/i35xw2x/,22,r/okc,0,22
"Nice try, FBI.",t2_y431dzx,PhysicalPear,0,1648941714.0,0,t1_i35x86t,i35x86t,True,Thick_Corner648,t3_tuvy08,https://www.reddit.com/r/okc/comments/tuvy08/anyone_know_of_any_glory_holes/,anyone know of any glory holes?,/r/okc/comments/tuvy08/anyone_know_of_any_glory_holes/i35x86t/,3,r/okc,0,3
April Fools was yesterday.,t2_rfm8g,KingTalis,0,1648941711.0,0,t1_i35x7yj,i35x7yj,True,Thick_Corner648,t3_tuvy08,https://www.reddit.com/r/okc/comments/tuvy08/anyone_know_of_any_glory_holes/,anyone know of any glory holes?,/r/okc/comments/tuvy08/anyone_know_of_any_glory_holes/i35x7yj/,4,r/okc,0,4
Have you checked your mom's house?,t2_918qh,DuckKnuckles,0,1648941098.0,0,t1_i35vyfy,i35vyfy,True,Thick_Corner648,t3_tuvy08,https://www.reddit.com/r/okc/comments/tuvy08/anyone_know_of_any_glory_holes/,anyone know of any glory holes?,/r/okc/comments/tuvy08/anyone_know_of_any_glory_holes/i35vyfy/,11,r/okc,0,11
"Home Maid Better is who I use. I feel great about them, they typically clean when I'm not home.",t2_kh13bk1w,NoLushies,0,1648928398.0,0,t1_i355fja,i355fja,True,littlebit105,t3_ttc1pc,https://www.reddit.com/r/okc/comments/ttc1pc/reputable_house_cleaners/,Reputable house cleaners?,/r/okc/comments/ttc1pc/reputable_house_cleaners/i355fja/,2,r/okc,0,2
"Imagine agreeing to work at OC, wrapping up the final interview like...

""And you're sure you're *only* gonna discriminate against *other* marginalized groups, right?  Not the marginalized groups I'm a part of?""

""Oh yeah, definitely.""",t2_8207y,btaylos,0,1648924727.0,0,t1_i34y472,i34y472,True,fitchmt,t3_ttynvy,https://www.reddit.com/r/okc/comments/ttynvy/oklahoma_christian_university_librarian_resigns/,Oklahoma Christian University librarian resigns after 18 years for being denied tenure over pro LGBTQ+ social media post,/r/okc/comments/ttynvy/oklahoma_christian_university_librarian_resigns/i34y472/,2,r/okc,0,2
"I knew some people that went to that Uni back when I was in college and they would be subject to regular apartment sweeps.  

Literally every month or every few months they would have to open up their apartment at some random and unannounced time and let university representatives go through all their shit.  If they denied them access they would get in serious trouble.  If the Uni reps found anything they deemed ""bad"" they would get in serious trouble.

Something ""bad"" was beer and I'm not talking in underaged dorm room type situation.  No this person was over 21 and lived in an apartment off campus and if these Uni reps found a beer they would get in serious trouble.  And IIRC they were only given one chance, 2nd chance is either suspension or exclusion from the Uni.

I'm not sure why anyone would subject themselves  to such treatment for such a lower tier education at this Uni.  It just boggles my mind.",t2_162ym7,Moto_Davidson,0,1648919610.0,0,t1_i34ml60,i34ml60,True,fitchmt,t3_ttynvy,https://www.reddit.com/r/okc/comments/ttynvy/oklahoma_christian_university_librarian_resigns/,Oklahoma Christian University librarian resigns after 18 years for being denied tenure over pro LGBTQ+ social media post,/r/okc/comments/ttynvy/oklahoma_christian_university_librarian_resigns/i34ml60/,2,r/okc,0,2
"Since she resigned as opposed to them terminating her, probably not. Even if they terminated her, probably not since it’s a private religious institution. About being denied tenure—that’s at the discretion of the school and not legally protected",t2_cd6a0bc8,unteachablebird,0,1648918106.0,0,t1_i34j2lf,i34j2lf,False,fitchmt,t3_ttynvy,https://www.reddit.com/r/okc/comments/ttynvy/oklahoma_christian_university_librarian_resigns/,Oklahoma Christian University librarian resigns after 18 years for being denied tenure over pro LGBTQ+ social media post,/r/okc/comments/ttynvy/oklahoma_christian_university_librarian_resigns/i34j2lf/,1,r/okc,0,1
You dont know what i think. You are assuming a lot here...,t2_2p4ep9z4,PotterRids05,0,1648914630.0,0,t1_i34b7w1,i34b7w1,False,fitchmt,t3_ttynvy,https://www.reddit.com/r/okc/comments/ttynvy/oklahoma_christian_university_librarian_resigns/,Oklahoma Christian University librarian resigns after 18 years for being denied tenure over pro LGBTQ+ social media post,/r/okc/comments/ttynvy/oklahoma_christian_university_librarian_resigns/i34b7w1/,-1,r/okc,0,-1
It’s the Church of Christ. Don’t they have anti-women views. Are they really that Christlike?,t2_ldgvi,DeadFamilyMan,0,1648914607.0,0,t1_i34b62u,i34b62u,False,fitchmt,t3_ttynvy,https://www.reddit.com/r/okc/comments/ttynvy/oklahoma_christian_university_librarian_resigns/,Oklahoma Christian University librarian resigns after 18 years for being denied tenure over pro LGBTQ+ social media post,/r/okc/comments/ttynvy/oklahoma_christian_university_librarian_resigns/i34b62u/,1,r/okc,0,1
People just surprised a school claiming to follow christ do something un christ like.,t2_g5700vcn,GrittyPrettySitty,0,1648914463.0,0,t1_i34augr,i34augr,False,fitchmt,t3_ttynvy,https://www.reddit.com/r/okc/comments/ttynvy/oklahoma_christian_university_librarian_resigns/,Oklahoma Christian University librarian resigns after 18 years for being denied tenure over pro LGBTQ+ social media post,/r/okc/comments/ttynvy/oklahoma_christian_university_librarian_resigns/i34augr/,0,r/okc,0,0
There is quite a bit that was added to the American versions of the Bible. Abortion is another big one.,t2_g5700vcn,GrittyPrettySitty,0,1648914305.0,0,t1_i34ahwr,i34ahwr,False,fitchmt,t3_ttynvy,https://www.reddit.com/r/okc/comments/ttynvy/oklahoma_christian_university_librarian_resigns/,Oklahoma Christian University librarian resigns after 18 years for being denied tenure over pro LGBTQ+ social media post,/r/okc/comments/ttynvy/oklahoma_christian_university_librarian_resigns/i34ahwr/,1,r/okc,0,1
" ... not a pushover, but definitly would be more hippy than you seem to think. 

He would be about driving these people out with a whip.",t2_g5700vcn,GrittyPrettySitty,0,1648914209.0,0,t1_i34aad1,i34aad1,False,fitchmt,t3_ttynvy,https://www.reddit.com/r/okc/comments/ttynvy/oklahoma_christian_university_librarian_resigns/,Oklahoma Christian University librarian resigns after 18 years for being denied tenure over pro LGBTQ+ social media post,/r/okc/comments/ttynvy/oklahoma_christian_university_librarian_resigns/i34aad1/,2,r/okc,0,2
i will never rent from HertZ,t2_esszgu0g,WooLeeKen,0,1648910791.0,0,t1_i342vo3,i342vo3,True,lennonpatton,t3_ttx445,https://www.reddit.com/r/okc/comments/ttx445/hertz_under_fire_by_members_of_congress_over/,"Hertz under fire by members of Congress over customer claims of false arrests ""Bodycam footage on CBS This Morning of an OKCPD Officer saying, “I can take you to the worst county jail in the country…”",/r/okc/comments/ttx445/hertz_under_fire_by_members_of_congress_over/i342vo3/,3,r/okc,0,3
I want to but I don't know how to go about organizing that,t2_12jyxy,fitchmt,0,1648910483.0,0,t1_i34282u,i34282u,False,fitchmt,t3_ttynvy,https://www.reddit.com/r/okc/comments/ttynvy/oklahoma_christian_university_librarian_resigns/,Oklahoma Christian University librarian resigns after 18 years for being denied tenure over pro LGBTQ+ social media post,/r/okc/comments/ttynvy/oklahoma_christian_university_librarian_resigns/i34282u/,1,r/okc,0,1
"[yup](https://www.1946themovie.com/). The Greek word was arsenokoitai, which does not have a direct English translation.",t2_12jyxy,fitchmt,0,1648910138.0,0,t1_i341hoz,i341hoz,False,fitchmt,t3_ttynvy,https://www.reddit.com/r/okc/comments/ttynvy/oklahoma_christian_university_librarian_resigns/,Oklahoma Christian University librarian resigns after 18 years for being denied tenure over pro LGBTQ+ social media post,/r/okc/comments/ttynvy/oklahoma_christian_university_librarian_resigns/i341hoz/,3,r/okc,0,3
Maybe but Christ also isn’t this hippie dippy pushover that people think he is.,t2_2p4ep9z4,PotterRids05,0,1648909676.0,0,t1_i340izj,i340izj,False,fitchmt,t3_ttynvy,https://www.reddit.com/r/okc/comments/ttynvy/oklahoma_christian_university_librarian_resigns/,Oklahoma Christian University librarian resigns after 18 years for being denied tenure over pro LGBTQ+ social media post,/r/okc/comments/ttynvy/oklahoma_christian_university_librarian_resigns/i340izj/,-1,r/okc,0,-1
"My point is that it’s absolutely ridiculous for the school to push for her resignation for showing tolerance and acceptance. 

I’m not an expert, but I’d bet if Christ was walking the earth today he would be nothing like the people running that school.",t2_91nrxy35,dylanthegrower,0,1648909054.0,0,t1_i33z93r,i33z93r,False,fitchmt,t3_ttynvy,https://www.reddit.com/r/okc/comments/ttynvy/oklahoma_christian_university_librarian_resigns/,Oklahoma Christian University librarian resigns after 18 years for being denied tenure over pro LGBTQ+ social media post,/r/okc/comments/ttynvy/oklahoma_christian_university_librarian_resigns/i33z93r/,3,r/okc,0,3
"[rivers and roads OK](https://instagram.com/riversandroadsok?utm_medium=copy_link)

[actual website](https://sites.google.com/view/riversandroadsok/home)",t2_2p4ep9z4,PotterRids05,0,1648906720.0,0,t1_i33umy9,i33umy9,True,Agnus_Deitox,t3_tu9duz,https://www.reddit.com/r/okc/comments/tu9duz/naturecentric_elementary_schools/,Nature-centric elementary schools,/r/okc/comments/tu9duz/naturecentric_elementary_schools/i33umy9/,1,r/okc,0,1
"you have a reference for that?

edit:  I want to make it clear I support people of all genders and sexual orientations.  I am not trying to argue for homosexuality being a sin.  I do not believe the Bible should be used for legal guidance, or even for moral guidance on issues where our understanding has grown, such as women's rights and the biological development of gender.  Take the Bible in the context of the time and place when it was written: the societal mores of the time would have called homosexuality a sin.  I'm legitimately curious to know more about this purported 1940s re-write.",t2_bnxfj,ShoulderChip,0,1648906372.0,0,t1_i33tz8z,i33tz8z,False,fitchmt,t3_ttynvy,https://www.reddit.com/r/okc/comments/ttynvy/oklahoma_christian_university_librarian_resigns/,Oklahoma Christian University librarian resigns after 18 years for being denied tenure over pro LGBTQ+ social media post,/r/okc/comments/ttynvy/oklahoma_christian_university_librarian_resigns/i33tz8z/,3,r/okc,0,3
"Dude rented a car, but 9 months prior Hertz had reported it stolen. Hertz had since gotten it back but it was still listed as stolen in the police database. Dude tried to show the police his rental agreement but there was still confusion and miscommunication over if that agreement specifically listed this car he was in. Officer threatened dude to worst jail in US. Eventually, another officer said he didn't steal it and dude was let go. 

They then interviewed a Hertz manager who had rented from his own company. He has since returned the car but police show up and cuff him wanting to know where the car is. Apparently, Hertz declares a car stolen if it's kept beyond the rental period. Police the  are used as a retrieval method. Plenty of times the cars are returned, the individual fined an overage fee, the  the car rented out again....but the declaration of it stolen still being in police records.",t2_2685rrd7,theinsanityoffence,0,1648905424.0,0,t1_i33s8o6,i33s8o6,False,lennonpatton,t3_ttx445,https://www.reddit.com/r/okc/comments/ttx445/hertz_under_fire_by_members_of_congress_over/,"Hertz under fire by members of Congress over customer claims of false arrests ""Bodycam footage on CBS This Morning of an OKCPD Officer saying, “I can take you to the worst county jail in the country…”",/r/okc/comments/ttx445/hertz_under_fire_by_members_of_congress_over/i33s8o6/,6,r/okc,0,6
Christianity always has been a cult. Filled with hypocrisy.,t2_8h8rh,okc_thunder,0,1648905056.0,0,t1_i33rlfz,i33rlfz,False,fitchmt,t3_ttynvy,https://www.reddit.com/r/okc/comments/ttynvy/oklahoma_christian_university_librarian_resigns/,Oklahoma Christian University librarian resigns after 18 years for being denied tenure over pro LGBTQ+ social media post,/r/okc/comments/ttynvy/oklahoma_christian_university_librarian_resigns/i33rlfz/,11,r/okc,0,11
Jesus fucking Christ.,t2_9i7m0,hiimapril,0,1648905038.0,0,t1_i33rkb1,i33rkb1,True,fitchmt,t3_ttynvy,https://www.reddit.com/r/okc/comments/ttynvy/oklahoma_christian_university_librarian_resigns/,Oklahoma Christian University librarian resigns after 18 years for being denied tenure over pro LGBTQ+ social media post,/r/okc/comments/ttynvy/oklahoma_christian_university_librarian_resigns/i33rkb1/,1,r/okc,0,1
I came here to say this. My Grandson goes there and loves it. All the animals and a very loving vibe. Its a great school.,t2_8jbcm55y,normalnonnie27,0,1648900239.0,0,t1_i33jxss,i33jxss,False,Agnus_Deitox,t3_tu9duz,https://www.reddit.com/r/okc/comments/tu9duz/naturecentric_elementary_schools/,Nature-centric elementary schools,/r/okc/comments/tu9duz/naturecentric_elementary_schools/i33jxss/,2,r/okc,0,2
Lmao based,t2_4769y,tehsloth,0,1648893060.0,0,t1_i33aynd,i33aynd,True,AHrubik,t3_tk6g47,https://www.reddit.com/r/okc/comments/tk6g47/hb_3890_establishes_the_holy_bible_as_the/,HB 3890 establishes the Holy Bible as the official State of Oklahoma book,/r/okc/comments/tk6g47/hb_3890_establishes_the_holy_bible_as_the/i33aynd/,0,r/okc,0,0
Liberal arts majors lol,t2_4769y,tehsloth,0,1648892359.0,0,t1_i33a5ro,i33a5ro,True,lennonpatton,t3_ttu36q,https://www.reddit.com/r/okc/comments/ttu36q/howdy_howard_the_partners_at_nw_36th_and_may_in/,"Howdy, Howard! The partners at NW 36th and May in Oklahoma City are forming a union!",/r/okc/comments/ttu36q/howdy_howard_the_partners_at_nw_36th_and_may_in/i33a5ro/,-9,r/okc,0,-9
"oh my god my old work bestie works there!!! claw back everything you deserve gang, solidarity from (redacted local coffee chain) 💕",t2_4fhjierj,slime__cube,0,1648885936.0,0,t1_i332zyu,i332zyu,True,lennonpatton,t3_ttu36q,https://www.reddit.com/r/okc/comments/ttu36q/howdy_howard_the_partners_at_nw_36th_and_may_in/,"Howdy, Howard! The partners at NW 36th and May in Oklahoma City are forming a union!",/r/okc/comments/ttu36q/howdy_howard_the_partners_at_nw_36th_and_may_in/i332zyu/,3,r/okc,0,3
A friend of mine teaches middle school there and I think both her kids attend.,t2_17an65,acgasp,0,1648878595.0,0,t1_i32u3yd,i32u3yd,False,Agnus_Deitox,t3_tu9duz,https://www.reddit.com/r/okc/comments/tu9duz/naturecentric_elementary_schools/,Nature-centric elementary schools,/r/okc/comments/tu9duz/naturecentric_elementary_schools/i32u3yd/,1,r/okc,0,1
Was going to saw the same thing.  My coworker sent her son there and says he's thriving.,t2_lxkf3,Daniel5000,0,1648878350.0,0,t1_i32trxv,i32trxv,False,Agnus_Deitox,t3_tu9duz,https://www.reddit.com/r/okc/comments/tu9duz/naturecentric_elementary_schools/,Nature-centric elementary schools,/r/okc/comments/tu9duz/naturecentric_elementary_schools/i32trxv/,1,r/okc,0,1
[Keystone Adventure School and Farm](https://www.keystoneadventureschoolandfarm.com/) sounds like what you're looking for!,t2_1fc8ikoa,FrettingFox,0,1648877956.0,0,t1_i32t8p5,i32t8p5,True,Agnus_Deitox,t3_tu9duz,https://www.reddit.com/r/okc/comments/tu9duz/naturecentric_elementary_schools/,Nature-centric elementary schools,/r/okc/comments/tu9duz/naturecentric_elementary_schools/i32t8p5/,9,r/okc,0,9
"I am an alumni. If anyone wants to organize a formal protest, I’ll gladly participate. I hate that toxic place.",t2_j3qzn,celegroz,0,1648877171.0,0,t1_i32s5me,i32s5me,True,fitchmt,t3_ttynvy,https://www.reddit.com/r/okc/comments/ttynvy/oklahoma_christian_university_librarian_resigns/,Oklahoma Christian University librarian resigns after 18 years for being denied tenure over pro LGBTQ+ social media post,/r/okc/comments/ttynvy/oklahoma_christian_university_librarian_resigns/i32s5me/,3,r/okc,0,3
Terra Verde in Norman.,t2_17an65,acgasp,0,1648874571.0,0,t1_i32ocj3,i32ocj3,True,Agnus_Deitox,t3_tu9duz,https://www.reddit.com/r/okc/comments/tu9duz/naturecentric_elementary_schools/,Nature-centric elementary schools,/r/okc/comments/tu9duz/naturecentric_elementary_schools/i32ocj3/,1,r/okc,0,1
I'm sure there's some communes in the outskirts that will teach your child about nature.,t2_atkkvmax,Background_Escape940,1,1648873270.0,0,t1_i32mbqw,i32mbqw,True,Agnus_Deitox,t3_tu9duz,https://www.reddit.com/r/okc/comments/tu9duz/naturecentric_elementary_schools/,Nature-centric elementary schools,/r/okc/comments/tu9duz/naturecentric_elementary_schools/i32mbqw/,0,r/okc,0,0
So if you work at a school and you know it’s a hot topic between some parents not caring and some being very vocal about it why would you put yourself in a position to find out what happens ? People get reprimanded daily for social media posts in companies across America. This in no different.,t2_3ddqkjpc,jparks64,0,1648872508.0,0,t1_i32l31d,i32l31d,True,fitchmt,t3_ttynvy,https://www.reddit.com/r/okc/comments/ttynvy/oklahoma_christian_university_librarian_resigns/,Oklahoma Christian University librarian resigns after 18 years for being denied tenure over pro LGBTQ+ social media post,/r/okc/comments/ttynvy/oklahoma_christian_university_librarian_resigns/i32l31d/,1,r/okc,0,1
"It’s an automated app I have running . Deleted everything every week. 

There you go assuming everything again. Just because I delete something doesn’t mean I’m not right. Or at least don’t have a leg to argue on",t2_2p4ep9z4,PotterRids05,0,1648872219.0,0,t1_i32klsh,i32klsh,False,fitchmt,t3_ttynvy,https://www.reddit.com/r/okc/comments/ttynvy/oklahoma_christian_university_librarian_resigns/,Oklahoma Christian University librarian resigns after 18 years for being denied tenure over pro LGBTQ+ social media post,/r/okc/comments/ttynvy/oklahoma_christian_university_librarian_resigns/i32klsh/,-6,r/okc,0,-6
A public school?,t2_4aijm,EricRP,0,1648872203.0,0,t1_i32kkso,i32kkso,True,Agnus_Deitox,t3_tu9duz,https://www.reddit.com/r/okc/comments/tu9duz/naturecentric_elementary_schools/,Nature-centric elementary schools,/r/okc/comments/tu9duz/naturecentric_elementary_schools/i32kkso/,5,r/okc,0,5
"If you still stand by what you said, why’d you delete the comment?",t2_6jr5n0i5,_hotwingz_,0,1648872141.0,0,t1_i32kgzm,i32kgzm,False,fitchmt,t3_ttynvy,https://www.reddit.com/r/okc/comments/ttynvy/oklahoma_christian_university_librarian_resigns/,Oklahoma Christian University librarian resigns after 18 years for being denied tenure over pro LGBTQ+ social media post,/r/okc/comments/ttynvy/oklahoma_christian_university_librarian_resigns/i32kgzm/,3,r/okc,0,3
"Just a reminder of how terrible they all are, then.",t2_4aijm,EricRP,0,1648872123.0,0,t1_i32kfw4,i32kfw4,False,fitchmt,t3_ttynvy,https://www.reddit.com/r/okc/comments/ttynvy/oklahoma_christian_university_librarian_resigns/,Oklahoma Christian University librarian resigns after 18 years for being denied tenure over pro LGBTQ+ social media post,/r/okc/comments/ttynvy/oklahoma_christian_university_librarian_resigns/i32kfw4/,2,r/okc,0,2
"You are about as intolerant as what you despise. The presumption…

And I still stand by what I said. If you have strong feelings about something you would turn down any amount of money in the world if you had true moral standing I know I would. And I have Turn down money for what I believe in",t2_2p4ep9z4,PotterRids05,0,1648871792.0,0,t1_i32jw1e,i32jw1e,False,fitchmt,t3_ttynvy,https://www.reddit.com/r/okc/comments/ttynvy/oklahoma_christian_university_librarian_resigns/,Oklahoma Christian University librarian resigns after 18 years for being denied tenure over pro LGBTQ+ social media post,/r/okc/comments/ttynvy/oklahoma_christian_university_librarian_resigns/i32jw1e/,-6,r/okc,0,-6
You realize homosexuality was not even added to that verse until the 1940s right? It was mistranslated to fit a homophobic culture.,t2_12jyxy,fitchmt,1,1648871523.0,0,t1_i32jftw,i32jftw,False,fitchmt,t3_ttynvy,https://www.reddit.com/r/okc/comments/ttynvy/oklahoma_christian_university_librarian_resigns/,Oklahoma Christian University librarian resigns after 18 years for being denied tenure over pro LGBTQ+ social media post,/r/okc/comments/ttynvy/oklahoma_christian_university_librarian_resigns/i32jftw/,2,r/okc,0,2
"You sound like the type that would make this a stipulation to access a trust. 

I don’t think being exposed to a religious school that fires staff for loving thy neighbor is a good thing, but hey, to each their own right?",t2_91nrxy35,dylanthegrower,0,1648870295.0,0,t1_i32has8,i32has8,False,fitchmt,t3_ttynvy,https://www.reddit.com/r/okc/comments/ttynvy/oklahoma_christian_university_librarian_resigns/,Oklahoma Christian University librarian resigns after 18 years for being denied tenure over pro LGBTQ+ social media post,/r/okc/comments/ttynvy/oklahoma_christian_university_librarian_resigns/i32has8/,4,r/okc,0,4
And there's a verse in the Gospel where Jesus encourages everyone to be like the apostle Paul and stay single so they can devote their lives to serving God. But if they cannot abstain from sexual immorality then it is better to marry than live in sin,t2_d2es93u0,AlwaysTalk_it_out,0,1648869956.0,0,t1_i32gp5f,i32gp5f,False,fitchmt,t3_ttynvy,https://www.reddit.com/r/okc/comments/ttynvy/oklahoma_christian_university_librarian_resigns/,Oklahoma Christian University librarian resigns after 18 years for being denied tenure over pro LGBTQ+ social media post,/r/okc/comments/ttynvy/oklahoma_christian_university_librarian_resigns/i32gp5f/,1,r/okc,0,1
