body,author_fullname,author.name,controversiality,created,downs,fullname,id,is_root,link_author,link_id,link_permalink,link_title,permalink,score,subreddit_name_prefixed,total_awards_received,ups
Awesome! Thanks,t2_9jiiqn9t,Ecstatic_Assumption5,0,1648986985.0,0,t1_i37pkth,i37pkth,False,Ecstatic_Assumption5,t3_tlvdss,https://www.reddit.com/r/Riverside/comments/tlvdss/any_artists_critique_groups_collectives/,"Any artists, critique groups, collectives…?",/r/Riverside/comments/tlvdss/any_artists_critique_groups_collectives/i37pkth/,1,r/Riverside,0,1
What's up I'm a male 30 years old wanna be friends I lived out here my whole life I can show you around,t2_lguaordx,daddy-1239,0,1648970129.0,0,t1_i374kkk,i374kkk,True,notyourbaby-neverwas,t3_t0t733,https://www.reddit.com/r/Riverside/comments/t0t733/i_moved_to_riverside_last_year_during_the/,I moved to Riverside last year during the pandemic & don’t know a soul — 29/female/single… any ideas on how I can meet people?! Not a fan of dating apps 😕,/r/Riverside/comments/t0t733/i_moved_to_riverside_last_year_during_the/i374kkk/,1,r/Riverside,0,1
Yes are you a male or female,t2_lguaordx,daddy-1239,0,1648969807.0,0,t1_i3745xl,i3745xl,True,idlesails,t3_tlujrx,https://www.reddit.com/r/Riverside/comments/tlujrx/any_lakes_or_places_to_find_fresh_water_fish/,"Any lakes or places to find fresh water fish, fresh water micro fish?",/r/Riverside/comments/tlujrx/any_lakes_or_places_to_find_fresh_water_fish/i3745xl/,1,r/Riverside,0,1
Most public pools in the city of Riverside open the weekend of Memorial Day. But there is some swimming at Shemel Pool. Best bet is to cal Riverside Parks and Recreation.,t2_2m62h9vv,moonkittiecat,0,1648965679.0,0,t1_i36yqnp,i36yqnp,True,RiversideBronzie,t3_tup06k,https://www.reddit.com/r/Riverside/comments/tup06k/any_good_quality_swimming_pools_open_to_the/,Any good quality swimming pools open to the general public in Riverside?,/r/Riverside/comments/tup06k/any_good_quality_swimming_pools_open_to_the/i36yqnp/,2,r/Riverside,0,2
Hunt park,t2_fjlua,alanaristondo13,0,1648925290.0,0,t1_i34z96r,i34z96r,True,RiversideBronzie,t3_tup06k,https://www.reddit.com/r/Riverside/comments/tup06k/any_good_quality_swimming_pools_open_to_the/,Any good quality swimming pools open to the general public in Riverside?,/r/Riverside/comments/tup06k/any_good_quality_swimming_pools_open_to_the/i34z96r/,3,r/Riverside,0,3
"And you aren't the reddit police , just keep scrolling .",t2_yab2b,TurtleManDog,0,1648916134.0,0,t1_i34ej6e,i34ej6e,False,Carambaaa14,t3_tubjua,https://www.reddit.com/r/Riverside/comments/tubjua/cheap_clothes/,Cheap Clothes,/r/Riverside/comments/tubjua/cheap_clothes/i34ej6e/,1,r/Riverside,0,1
"There was a Drink n Draw in Redlands once a month, but nothing since 2020. A few galleries in the area: Artlands in Redlands, and Gramercy and a few others in Riverside. Once you start following a few on IG the rest will pop up.

http://linktr.ee/theartsarea",t2_qgpg5,charmingcactus,0,1648915288.0,0,t1_i34cnwb,i34cnwb,True,Ecstatic_Assumption5,t3_tlvdss,https://www.reddit.com/r/Riverside/comments/tlvdss/any_artists_critique_groups_collectives/,"Any artists, critique groups, collectives…?",/r/Riverside/comments/tlvdss/any_artists_critique_groups_collectives/i34cnwb/,2,r/Riverside,0,2
This isn't Craigslist.,t2_7ijq7,boing757,0,1648914172.0,0,t1_i34a7ig,i34a7ig,True,Carambaaa14,t3_tubjua,https://www.reddit.com/r/Riverside/comments/tubjua/cheap_clothes/,Cheap Clothes,/r/Riverside/comments/tubjua/cheap_clothes/i34a7ig/,3,r/Riverside,0,3
There any recommendations for secluded hiking spots to fool around at around here? Since you brought up hookups.,t2_dj0m9fv7,wondergay76728,0,1648857107.0,0,t1_i31rxcc,i31rxcc,True,WoxicFangel,t3_ttedl4,https://www.reddit.com/r/Riverside/comments/ttedl4/coming_here_to_post_looking_for_a_hookup_post_in/,Coming here to post looking for a hookup? Post in /r/RiversideR4R instead.,/r/Riverside/comments/ttedl4/coming_here_to_post_looking_for_a_hookup_post_in/i31rxcc/,0,r/Riverside,0,0
I got to meet Cesar Chavez briefly when I was a kid.,t2_5qngg,Nyckname,0,1648847500.0,0,t1_i317ew9,i317ew9,True,dodson4boe,t3_tthswc,https://www.reddit.com/r/Riverside/comments/tthswc/chavezhuerta_day/,Chavez-Huerta Day!,/r/Riverside/comments/tthswc/chavezhuerta_day/i317ew9/,2,r/Riverside,0,2
Smokey Canyon BBQ in canyon crest a true hidden gem,t2_dc1h4u1k,Feisty-Witness-4591,0,1648829021.0,0,t1_i2zxx9i,i2zxx9i,True,TGMix7,t3_tsrwqi,https://www.reddit.com/r/Riverside/comments/tsrwqi/ok_folks_who_knows_the_best_bbq_spot_in_riverside/,Ok folks.. Who knows the best BBQ spot in Riverside county? No chains please!,/r/Riverside/comments/tsrwqi/ok_folks_who_knows_the_best_bbq_spot_in_riverside/i2zxx9i/,0,r/Riverside,0,0
I only assumed the water would be crap  but i didn’t realize it was dangerous,t2_brege,pvcpipes,0,1648793884.0,0,t1_i2ya5wc,i2ya5wc,False,weed_refugee,t3_tt5rmr,https://www.reddit.com/r/Riverside/comments/tt5rmr/parvati_riverside_in_bhuntar_india/,"Parvati RIverside in Bhuntar, India.",/r/Riverside/comments/tt5rmr/parvati_riverside_in_bhuntar_india/i2ya5wc/,1,r/Riverside,0,1
Riverside regional park has RV hookups.,t2_52x6g6rp,SonoWook,0,1648787619.0,0,t1_i2y0m6q,i2y0m6q,True,WoxicFangel,t3_ttedl4,https://www.reddit.com/r/Riverside/comments/ttedl4/coming_here_to_post_looking_for_a_hookup_post_in/,Coming here to post looking for a hookup? Post in /r/RiversideR4R instead.,/r/Riverside/comments/ttedl4/coming_here_to_post_looking_for_a_hookup_post_in/i2y0m6q/,21,r/Riverside,0,21
I have a Tesla,t2_a29tsb56,Hungry-Tomatillo-470,0,1648785194.0,0,t1_i2xwcrg,i2xwcrg,True,Arayyn,t3_tt4x1y,https://www.reddit.com/r/Riverside/comments/tt4x1y/any_car_clubs_or_crews_in_the_951_area/,Any car clubs or crews in the 951 area,/r/Riverside/comments/tt4x1y/any_car_clubs_or_crews_in_the_951_area/i2xwcrg/,1,r/Riverside,0,1
"This is what I'm looking for, thanks!",t2_6xa2jqh0,Volksduci,0,1648778139.0,0,t1_i2xhtxq,i2xhtxq,False,Volksduci,t3_tt8096,https://www.reddit.com/r/Riverside/comments/tt8096/quality_youth_soccer_programs/,Quality youth soccer programs...,/r/Riverside/comments/tt8096/quality_youth_soccer_programs/i2xhtxq/,2,r/Riverside,0,2
"Yes, even a meet today hosted by UCR!",t2_476fikvm,VcGalactic,0,1648775039.0,0,t1_i2xb2vr,i2xb2vr,True,Arayyn,t3_tt4x1y,https://www.reddit.com/r/Riverside/comments/tt4x1y/any_car_clubs_or_crews_in_the_951_area/,Any car clubs or crews in the 951 area,/r/Riverside/comments/tt4x1y/any_car_clubs_or_crews_in_the_951_area/i2xb2vr/,1,r/Riverside,0,1
Or literally /r/RiversideR4R,t2_cx10i,WoxicFangel,0,1648774523.0,0,t1_i2x9xqr,i2x9xqr,False,bored656,t3_tsvh6t,https://www.reddit.com/r/Riverside/comments/tsvh6t/whats_the_best_place_to_find_people_to_hookup_with/,what's the best place to find people to hookup with ?,/r/Riverside/comments/tsvh6t/whats_the_best_place_to_find_people_to_hookup_with/i2x9xqr/,1,r/Riverside,0,1
"I have worked for sb county for 7 years, including for cfs where I'm guessing you applied as a social worker.  
Please feel free to dm me",t2_4ud589sr,MerryWifeJezebel,0,1648772758.0,0,t1_i2x5zvg,i2x5zvg,True,daizee3114,t3_tku0qr,https://www.reddit.com/r/Riverside/comments/tku0qr/does_anyone_work_for_san_bernardino_county_social/,Does anyone work for San Bernardino County? (Social Work),/r/Riverside/comments/tku0qr/does_anyone_work_for_san_bernardino_county_social/i2x5zvg/,2,r/Riverside,0,2
"https://www.legendsrec.com/

Legends FC offers a recreational league. 

https://www.ayso47.org/

AYSO is a more affordable optional though.",t2_4dlf8lcy,riversiderrrr,0,1648771266.0,0,t1_i2x2pbs,i2x2pbs,True,Volksduci,t3_tt8096,https://www.reddit.com/r/Riverside/comments/tt8096/quality_youth_soccer_programs/,Quality youth soccer programs...,/r/Riverside/comments/tt8096/quality_youth_soccer_programs/i2x2pbs/,2,r/Riverside,0,2
I second AYSO.,t2_ar7iiwim,Mazzoni_,0,1648770494.0,0,t1_i2x1002,i2x1002,False,Volksduci,t3_tt8096,https://www.reddit.com/r/Riverside/comments/tt8096/quality_youth_soccer_programs/,Quality youth soccer programs...,/r/Riverside/comments/tt8096/quality_youth_soccer_programs/i2x1002/,1,r/Riverside,0,1
AYSO or look for clubs if your child is good and wants to compete,t2_89aodbyo,Difficult-Dog-3349,0,1648768850.0,0,t1_i2wxai5,i2wxai5,True,Volksduci,t3_tt8096,https://www.reddit.com/r/Riverside/comments/tt8096/quality_youth_soccer_programs/,Quality youth soccer programs...,/r/Riverside/comments/tt8096/quality_youth_soccer_programs/i2wxai5/,2,r/Riverside,0,2
"Yea, the water in the Santa Ana River has some bad fecal matter issues. 
https://www.google.com/amp/s/abc7.com/amp/bacteria-outbreak-santa-ana-river-downey-park-jurupa-valley/5456157/",t2_488c7b8r,Doggystyle_Rainbow,0,1648767042.0,0,t1_i2wt4h2,i2wt4h2,False,weed_refugee,t3_tt5rmr,https://www.reddit.com/r/Riverside/comments/tt5rmr/parvati_riverside_in_bhuntar_india/,"Parvati RIverside in Bhuntar, India.",/r/Riverside/comments/tt5rmr/parvati_riverside_in_bhuntar_india/i2wt4h2/,2,r/Riverside,0,2
Omg found it once on accident and I just fell in love. No bbq I’ve ever had has compared!,t2_4vc98s1z,another-sad-gay-bich,0,1648766404.0,0,t1_i2wrn5h,i2wrn5h,False,TGMix7,t3_tsrwqi,https://www.reddit.com/r/Riverside/comments/tsrwqi/ok_folks_who_knows_the_best_bbq_spot_in_riverside/,Ok folks.. Who knows the best BBQ spot in Riverside county? No chains please!,/r/Riverside/comments/tsrwqi/ok_folks_who_knows_the_best_bbq_spot_in_riverside/i2wrn5h/,2,r/Riverside,0,2
"Agreed but I like how intimate it is!!! The people there are so incredibly sweet and have such wonderful customer service, they were super attentive to me the whole time and took such pride in their food!",t2_4vc98s1z,another-sad-gay-bich,0,1648766379.0,0,t1_i2wrl3p,i2wrl3p,False,TGMix7,t3_tsrwqi,https://www.reddit.com/r/Riverside/comments/tsrwqi/ok_folks_who_knows_the_best_bbq_spot_in_riverside/,Ok folks.. Who knows the best BBQ spot in Riverside county? No chains please!,/r/Riverside/comments/tsrwqi/ok_folks_who_knows_the_best_bbq_spot_in_riverside/i2wrl3p/,3,r/Riverside,0,3
did you say Sir?,t2_530uiu86,weed_refugee,0,1648763115.0,0,t1_i2wjop5,i2wjop5,False,weed_refugee,t3_tt5rmr,https://www.reddit.com/r/Riverside/comments/tt5rmr/parvati_riverside_in_bhuntar_india/,"Parvati RIverside in Bhuntar, India.",/r/Riverside/comments/tt5rmr/parvati_riverside_in_bhuntar_india/i2wjop5/,1,r/Riverside,0,1
"Oh, yes, the river eventually makes it to sea. I thought you were talking about the city",t2_dxqynuty,MistaDoge104,0,1648762917.0,0,t1_i2wj6r6,i2wj6r6,False,weed_refugee,t3_tt5rmr,https://www.reddit.com/r/Riverside/comments/tt5rmr/parvati_riverside_in_bhuntar_india/,"Parvati RIverside in Bhuntar, India.",/r/Riverside/comments/tt5rmr/parvati_riverside_in_bhuntar_india/i2wj6r6/,2,r/Riverside,0,2
but it meets the sea eventually? or does it just get sucked into the ground?,t2_530uiu86,weed_refugee,0,1648762822.0,0,t1_i2wiy7y,i2wiy7y,False,weed_refugee,t3_tt5rmr,https://www.reddit.com/r/Riverside/comments/tt5rmr/parvati_riverside_in_bhuntar_india/,"Parvati RIverside in Bhuntar, India.",/r/Riverside/comments/tt5rmr/parvati_riverside_in_bhuntar_india/i2wiy7y/,1,r/Riverside,0,1
"No, it’s about 50 miles from the coast",t2_dxqynuty,MistaDoge104,0,1648762712.0,0,t1_i2wioa8,i2wioa8,False,weed_refugee,t3_tt5rmr,https://www.reddit.com/r/Riverside/comments/tt5rmr/parvati_riverside_in_bhuntar_india/,"Parvati RIverside in Bhuntar, India.",/r/Riverside/comments/tt5rmr/parvati_riverside_in_bhuntar_india/i2wioa8/,2,r/Riverside,0,2
what do homeless people do?,t2_530uiu86,weed_refugee,0,1648761259.0,0,t1_i2weylg,i2weylg,False,weed_refugee,t3_tt5rmr,https://www.reddit.com/r/Riverside/comments/tt5rmr/parvati_riverside_in_bhuntar_india/,"Parvati RIverside in Bhuntar, India.",/r/Riverside/comments/tt5rmr/parvati_riverside_in_bhuntar_india/i2weylg/,1,r/Riverside,0,1
I personally wouldn’t because it’s in the middle of one of the most polluted areas in Southern California. Plus homeless live down there,t2_brege,pvcpipes,0,1648761198.0,0,t1_i2wet13,i2wet13,False,weed_refugee,t3_tt5rmr,https://www.reddit.com/r/Riverside/comments/tt5rmr/parvati_riverside_in_bhuntar_india/,"Parvati RIverside in Bhuntar, India.",/r/Riverside/comments/tt5rmr/parvati_riverside_in_bhuntar_india/i2wet13/,3,r/Riverside,0,3
I second the recc for Charley Rokk’s and Gram’s!,t2_4mahe266,C0MM0NSPELLING,0,1648760920.0,0,t1_i2we3jy,i2we3jy,False,TGMix7,t3_tsrwqi,https://www.reddit.com/r/Riverside/comments/tsrwqi/ok_folks_who_knows_the_best_bbq_spot_in_riverside/,Ok folks.. Who knows the best BBQ spot in Riverside county? No chains please!,/r/Riverside/comments/tsrwqi/ok_folks_who_knows_the_best_bbq_spot_in_riverside/i2we3jy/,3,r/Riverside,0,3
why not?,t2_530uiu86,weed_refugee,0,1648760098.0,0,t1_i2wbyty,i2wbyty,False,weed_refugee,t3_tt5rmr,https://www.reddit.com/r/Riverside/comments/tt5rmr/parvati_riverside_in_bhuntar_india/,"Parvati RIverside in Bhuntar, India.",/r/Riverside/comments/tt5rmr/parvati_riverside_in_bhuntar_india/i2wbyty/,1,r/Riverside,0,1
https://charleyrokkstexasbbq.com/menu/,t2_l048t341,BenjaminRois,0,1648760050.0,0,t1_i2wbu9u,i2wbu9u,True,TGMix7,t3_tsrwqi,https://www.reddit.com/r/Riverside/comments/tsrwqi/ok_folks_who_knows_the_best_bbq_spot_in_riverside/,Ok folks.. Who knows the best BBQ spot in Riverside county? No chains please!,/r/Riverside/comments/tsrwqi/ok_folks_who_knows_the_best_bbq_spot_in_riverside/i2wbu9u/,1,r/Riverside,0,1
Probably not,t2_3qru54ey,Cryptid_Girl,0,1648760050.0,0,t1_i2wbu90,i2wbu90,False,weed_refugee,t3_tt5rmr,https://www.reddit.com/r/Riverside/comments/tt5rmr/parvati_riverside_in_bhuntar_india/,"Parvati RIverside in Bhuntar, India.",/r/Riverside/comments/tt5rmr/parvati_riverside_in_bhuntar_india/i2wbu90/,2,r/Riverside,0,2
is it drinkable,t2_530uiu86,weed_refugee,0,1648760010.0,0,t1_i2wbqj8,i2wbqj8,False,weed_refugee,t3_tt5rmr,https://www.reddit.com/r/Riverside/comments/tt5rmr/parvati_riverside_in_bhuntar_india/,"Parvati RIverside in Bhuntar, India.",/r/Riverside/comments/tt5rmr/parvati_riverside_in_bhuntar_india/i2wbqj8/,2,r/Riverside,0,2
Very little,t2_3qru54ey,Cryptid_Girl,0,1648759981.0,0,t1_i2wbnq8,i2wbnq8,False,weed_refugee,t3_tt5rmr,https://www.reddit.com/r/Riverside/comments/tt5rmr/parvati_riverside_in_bhuntar_india/,"Parvati RIverside in Bhuntar, India.",/r/Riverside/comments/tt5rmr/parvati_riverside_in_bhuntar_india/i2wbnq8/,2,r/Riverside,0,2
no water?,t2_530uiu86,weed_refugee,0,1648759871.0,0,t1_i2wbdcd,i2wbdcd,False,weed_refugee,t3_tt5rmr,https://www.reddit.com/r/Riverside/comments/tt5rmr/parvati_riverside_in_bhuntar_india/,"Parvati RIverside in Bhuntar, India.",/r/Riverside/comments/tt5rmr/parvati_riverside_in_bhuntar_india/i2wbdcd/,2,r/Riverside,0,2
"Oh for sure yeah I’d seen another guy in the is300 subreddit using hubcentric rings, essentially the same solution I assume.",t2_cci15isb,Rude_Warning_5341,0,1648759791.0,0,t1_i2wb5mm,i2wb5mm,False,Arayyn,t3_tt4x1y,https://www.reddit.com/r/Riverside/comments/tt4x1y/any_car_clubs_or_crews_in_the_951_area/,Any car clubs or crews in the 951 area,/r/Riverside/comments/tt4x1y/any_car_clubs_or_crews_in_the_951_area/i2wb5mm/,1,r/Riverside,0,1
Club?,t2_bxrairh7,Roman_00,0,1648759785.0,0,t1_i2wb50w,i2wb50w,True,Volksduci,t3_tt8096,https://www.reddit.com/r/Riverside/comments/tt8096/quality_youth_soccer_programs/,Quality youth soccer programs...,/r/Riverside/comments/tt8096/quality_youth_soccer_programs/i2wb50w/,1,r/Riverside,0,1
Desert. Dry,t2_3qru54ey,Cryptid_Girl,0,1648759772.0,0,t1_i2wb3sn,i2wb3sn,False,weed_refugee,t3_tt5rmr,https://www.reddit.com/r/Riverside/comments/tt5rmr/parvati_riverside_in_bhuntar_india/,"Parvati RIverside in Bhuntar, India.",/r/Riverside/comments/tt5rmr/parvati_riverside_in_bhuntar_india/i2wb3sn/,3,r/Riverside,0,3
Idk who the program was through but my babies mom put my daughter in a program at the nice park off of Victoria and van buren,t2_55xs1n6v,jace92553,0,1648759405.0,0,t1_i2wa4ow,i2wa4ow,True,Volksduci,t3_tt8096,https://www.reddit.com/r/Riverside/comments/tt8096/quality_youth_soccer_programs/,Quality youth soccer programs...,/r/Riverside/comments/tt8096/quality_youth_soccer_programs/i2wa4ow/,1,r/Riverside,0,1
thank you for understanding my dilemma,t2_530uiu86,weed_refugee,0,1648759259.0,0,t1_i2w9qnp,i2w9qnp,False,weed_refugee,t3_tt5rmr,https://www.reddit.com/r/Riverside/comments/tt5rmr/parvati_riverside_in_bhuntar_india/,"Parvati RIverside in Bhuntar, India.",/r/Riverside/comments/tt5rmr/parvati_riverside_in_bhuntar_india/i2w9qnp/,4,r/Riverside,0,4
does the river side also have a sea side?,t2_530uiu86,weed_refugee,0,1648758839.0,0,t1_i2w8mdo,i2w8mdo,False,weed_refugee,t3_tt5rmr,https://www.reddit.com/r/Riverside/comments/tt5rmr/parvati_riverside_in_bhuntar_india/,"Parvati RIverside in Bhuntar, India.",/r/Riverside/comments/tt5rmr/parvati_riverside_in_bhuntar_india/i2w8mdo/,1,r/Riverside,0,1
Thank you,t2_nxry4,Arayyn,0,1648758799.0,0,t1_i2w8ig7,i2w8ig7,False,Arayyn,t3_tt4x1y,https://www.reddit.com/r/Riverside/comments/tt4x1y/any_car_clubs_or_crews_in_the_951_area/,Any car clubs or crews in the 951 area,/r/Riverside/comments/tt4x1y/any_car_clubs_or_crews_in_the_951_area/i2w8ig7/,1,r/Riverside,0,1
"Nah yea I was just looking on offerup and the guy had gotten new wheels for his Tesla so I was there as soon as possible, only problem was I had to open center bore about 3mm at a tire shop which was only like 60$ but yea",t2_nxry4,Arayyn,0,1648758756.0,0,t1_i2w8eec,i2w8eec,False,Arayyn,t3_tt4x1y,https://www.reddit.com/r/Riverside/comments/tt4x1y/any_car_clubs_or_crews_in_the_951_area/,Any car clubs or crews in the 951 area,/r/Riverside/comments/tt4x1y/any_car_clubs_or_crews_in_the_951_area/i2w8eec/,1,r/Riverside,0,1
"It’s wild, I feel like these wheels (with tires) could easily be worth triple that price but hey all good for us haha.",t2_cci15isb,Rude_Warning_5341,0,1648758174.0,0,t1_i2w6uoe,i2w6uoe,False,Arayyn,t3_tt4x1y,https://www.reddit.com/r/Riverside/comments/tt4x1y/any_car_clubs_or_crews_in_the_951_area/,Any car clubs or crews in the 951 area,/r/Riverside/comments/tt4x1y/any_car_clubs_or_crews_in_the_951_area/i2w6uoe/,1,r/Riverside,0,1
"Yessir I got the wheels and tires for 450$ from some guy in lake forest, tires only had 10k miles, couldn’t pass on them",t2_nxry4,Arayyn,0,1648757928.0,0,t1_i2w67u5,i2w67u5,False,Arayyn,t3_tt4x1y,https://www.reddit.com/r/Riverside/comments/tt4x1y/any_car_clubs_or_crews_in_the_951_area/,Any car clubs or crews in the 951 area,/r/Riverside/comments/tt4x1y/any_car_clubs_or_crews_in_the_951_area/i2w67u5/,1,r/Riverside,0,1
empire soccer,t2_633wv9l3,Open-Loan-750,0,1648757329.0,0,t1_i2w4od6,i2w4od6,True,Volksduci,t3_tt8096,https://www.reddit.com/r/Riverside/comments/tt8096/quality_youth_soccer_programs/,Quality youth soccer programs...,/r/Riverside/comments/tt8096/quality_youth_soccer_programs/i2w4od6/,1,r/Riverside,0,1
"Hmm i see. In my expert opinion, this is indeed a side of a river 🧐",t2_5dnkz3yp,AndyPlaysBadly,0,1648757016.0,0,t1_i2w3v4y,i2w3v4y,True,weed_refugee,t3_tt5rmr,https://www.reddit.com/r/Riverside/comments/tt5rmr/parvati_riverside_in_bhuntar_india/,"Parvati RIverside in Bhuntar, India.",/r/Riverside/comments/tt5rmr/parvati_riverside_in_bhuntar_india/i2w3v4y/,9,r/Riverside,0,9
my bad,t2_530uiu86,weed_refugee,0,1648755922.0,0,t1_i2w1112,i2w1112,False,weed_refugee,t3_tt5rmr,https://www.reddit.com/r/Riverside/comments/tt5rmr/parvati_riverside_in_bhuntar_india/,"Parvati RIverside in Bhuntar, India.",/r/Riverside/comments/tt5rmr/parvati_riverside_in_bhuntar_india/i2w1112/,2,r/Riverside,0,2
what about it is different from yours?,t2_530uiu86,weed_refugee,0,1648755892.0,0,t1_i2w0y90,i2w0y90,False,weed_refugee,t3_tt5rmr,https://www.reddit.com/r/Riverside/comments/tt5rmr/parvati_riverside_in_bhuntar_india/,"Parvati RIverside in Bhuntar, India.",/r/Riverside/comments/tt5rmr/parvati_riverside_in_bhuntar_india/i2w0y90/,2,r/Riverside,0,2
"Yes, on insta",t2_dqv47,SeaNoname,0,1648755801.0,0,t1_i2w0ptp,i2w0ptp,False,Arayyn,t3_tt4x1y,https://www.reddit.com/r/Riverside/comments/tt4x1y/any_car_clubs_or_crews_in_the_951_area/,Any car clubs or crews in the 951 area,/r/Riverside/comments/tt4x1y/any_car_clubs_or_crews_in_the_951_area/i2w0ptp/,1,r/Riverside,0,1
"Is300 owner here, also looking to buy a set of model 3 wheels on my car. They look so damn good 👍",t2_cci15isb,Rude_Warning_5341,0,1648755609.0,0,t1_i2w0888,i2w0888,True,Arayyn,t3_tt4x1y,https://www.reddit.com/r/Riverside/comments/tt4x1y/any_car_clubs_or_crews_in_the_951_area/,Any car clubs or crews in the 951 area,/r/Riverside/comments/tt4x1y/any_car_clubs_or_crews_in_the_951_area/i2w0888/,1,r/Riverside,0,1
"Living on the riverside
I’m taking life like a big long ride",t2_11rokt,rayyyce,0,1648755509.0,0,t1_i2vzyyt,i2vzyyt,True,weed_refugee,t3_tt5rmr,https://www.reddit.com/r/Riverside/comments/tt5rmr/parvati_riverside_in_bhuntar_india/,"Parvati RIverside in Bhuntar, India.",/r/Riverside/comments/tt5rmr/parvati_riverside_in_bhuntar_india/i2vzyyt/,3,r/Riverside,0,3
youre welcome thank you for the love 🥰✨🪄,t2_530uiu86,weed_refugee,0,1648754615.0,0,t1_i2vxo28,i2vxo28,False,weed_refugee,t3_tt5rmr,https://www.reddit.com/r/Riverside/comments/tt5rmr/parvati_riverside_in_bhuntar_india/,"Parvati RIverside in Bhuntar, India.",/r/Riverside/comments/tt5rmr/parvati_riverside_in_bhuntar_india/i2vxo28/,6,r/Riverside,0,6
"This is the Riverside, CA sub. Not the “just any random riverside in the world” sub.",t2_g5dudfmh,AmericanHeresy,0,1648753935.0,0,t1_i2vvx5m,i2vvx5m,True,weed_refugee,t3_tt5rmr,https://www.reddit.com/r/Riverside/comments/tt5rmr/parvati_riverside_in_bhuntar_india/,"Parvati RIverside in Bhuntar, India.",/r/Riverside/comments/tt5rmr/parvati_riverside_in_bhuntar_india/i2vvx5m/,11,r/Riverside,0,11
cool,t2_5mm6enqm,Stocky_Racoon,0,1648753919.0,0,t1_i2vvvnh,i2vvvnh,True,weed_refugee,t3_tt5rmr,https://www.reddit.com/r/Riverside/comments/tt5rmr/parvati_riverside_in_bhuntar_india/,"Parvati RIverside in Bhuntar, India.",/r/Riverside/comments/tt5rmr/parvati_riverside_in_bhuntar_india/i2vvvnh/,2,r/Riverside,0,2
"[http://www.socalcarculture.com/events.html](http://www.socalcarculture.com/events.html)

You can try out some different meet ups there. Some of them tend to be geared toward certain types. E.g., the cars and coffee in Brea is strictly segregated between boomers with new corvettes on one side of the lot and grouchy ranfla bros on the other side of the lot. Similarly, the Anaheim cars and coffee in the canyon (55/91) is pretty good if you are into highly modded imports & domestics, drift, a little JDM, and occasional oddities. 

The point being that you kind of have to see for yourself, network, and get in where you fit in.",t2_4075z,rocky6501,0,1648753725.0,0,t1_i2vve2k,i2vve2k,True,Arayyn,t3_tt4x1y,https://www.reddit.com/r/Riverside/comments/tt4x1y/any_car_clubs_or_crews_in_the_951_area/,Any car clubs or crews in the 951 area,/r/Riverside/comments/tt4x1y/any_car_clubs_or_crews_in_the_951_area/i2vve2k/,2,r/Riverside,0,2
If only our riverside looked like this,t2_81cnnoda,GearExisting,0,1648753703.0,0,t1_i2vvbzt,i2vvbzt,True,weed_refugee,t3_tt5rmr,https://www.reddit.com/r/Riverside/comments/tt5rmr/parvati_riverside_in_bhuntar_india/,"Parvati RIverside in Bhuntar, India.",/r/Riverside/comments/tt5rmr/parvati_riverside_in_bhuntar_india/i2vvbzt/,9,r/Riverside,0,9
"I love this post and I live in Riverside, California. Thank you for posting it!",t2_13bjkb,thedykeichotline,0,1648752358.0,0,t1_i2vrv9q,i2vrv9q,False,weed_refugee,t3_tt5rmr,https://www.reddit.com/r/Riverside/comments/tt5rmr/parvati_riverside_in_bhuntar_india/,"Parvati RIverside in Bhuntar, India.",/r/Riverside/comments/tt5rmr/parvati_riverside_in_bhuntar_india/i2vrv9q/,9,r/Riverside,0,9
"I’ll look into it, assuming it’s on IG?",t2_nxry4,Arayyn,0,1648752015.0,0,t1_i2vqzcq,i2vqzcq,False,Arayyn,t3_tt4x1y,https://www.reddit.com/r/Riverside/comments/tt4x1y/any_car_clubs_or_crews_in_the_951_area/,Any car clubs or crews in the 951 area,/r/Riverside/comments/tt4x1y/any_car_clubs_or_crews_in_the_951_area/i2vqzcq/,1,r/Riverside,0,1
Aye man wouldn’t be too far from mine 😂,t2_nxry4,Arayyn,0,1648751997.0,0,t1_i2vqxnm,i2vqxnm,False,Arayyn,t3_tt4x1y,https://www.reddit.com/r/Riverside/comments/tt4x1y/any_car_clubs_or_crews_in_the_951_area/,Any car clubs or crews in the 951 area,/r/Riverside/comments/tt4x1y/any_car_clubs_or_crews_in_the_951_area/i2vqxnm/,1,r/Riverside,0,1
Quit perpetuating the stereotype that stoners are lazy.,t2_5qngg,Nyckname,0,1648751028.0,0,t1_i2voey5,i2voey5,False,weed_refugee,t3_tt5rmr,https://www.reddit.com/r/Riverside/comments/tt5rmr/parvati_riverside_in_bhuntar_india/,"Parvati RIverside in Bhuntar, India.",/r/Riverside/comments/tt5rmr/parvati_riverside_in_bhuntar_india/i2voey5/,4,r/Riverside,0,4
can you please involve a mod?,t2_530uiu86,weed_refugee,1,1648750846.0,0,t1_i2vnxxp,i2vnxxp,False,weed_refugee,t3_tt5rmr,https://www.reddit.com/r/Riverside/comments/tt5rmr/parvati_riverside_in_bhuntar_india/,"Parvati RIverside in Bhuntar, India.",/r/Riverside/comments/tt5rmr/parvati_riverside_in_bhuntar_india/i2vnxxp/,1,r/Riverside,0,1
Please. It'll save the mods the trouble.,t2_5qngg,Nyckname,0,1648750767.0,0,t1_i2vnqer,i2vnqer,False,weed_refugee,t3_tt5rmr,https://www.reddit.com/r/Riverside/comments/tt5rmr/parvati_riverside_in_bhuntar_india/,"Parvati RIverside in Bhuntar, India.",/r/Riverside/comments/tt5rmr/parvati_riverside_in_bhuntar_india/i2vnqer/,5,r/Riverside,0,5
oh okay my bad should i delete the post? :),t2_530uiu86,weed_refugee,0,1648750489.0,0,t1_i2vn0gj,i2vn0gj,False,weed_refugee,t3_tt5rmr,https://www.reddit.com/r/Riverside/comments/tt5rmr/parvati_riverside_in_bhuntar_india/,"Parvati RIverside in Bhuntar, India.",/r/Riverside/comments/tt5rmr/parvati_riverside_in_bhuntar_india/i2vn0gj/,4,r/Riverside,0,4
