body,author_fullname,author.name,controversiality,created,downs,fullname,id,is_root,link_author,link_id,link_permalink,link_title,permalink,score,subreddit_name_prefixed,total_awards_received,ups
Fuck all these lame ass foos telling you to file a police report. I hope you catch him lacking,t2_d9mrw23w,Top-Wolverine2739,0,1645851840.0,0,t1_hyh9k4r,hyh9k4r,True,fuckboysgetcats,t3_t1iv5h,https://www.reddit.com/r/Riverside/comments/t1iv5h/removed_by_reddit/,[ Removed by Reddit ],/r/Riverside/comments/t1iv5h/removed_by_reddit/hyh9k4r/,-8,r/Riverside,0,-8
"These lame ass Redditors would never throw hands. I feel you 100% 
Wtf is a police report going to do?",t2_d9mrw23w,Top-Wolverine2739,0,1645851705.0,0,t1_hyh9bki,hyh9bki,False,fuckboysgetcats,t3_t1iv5h,https://www.reddit.com/r/Riverside/comments/t1iv5h/removed_by_reddit/,[ Removed by Reddit ],/r/Riverside/comments/t1iv5h/removed_by_reddit/hyh9bki/,-4,r/Riverside,0,-4
I think that dude goes to my methadone clinic,t2_gh93xzip,Responsible-Poet-880,0,1645851358.0,0,t1_hyh8p0n,hyh8p0n,True,fuckboysgetcats,t3_t1iv5h,https://www.reddit.com/r/Riverside/comments/t1iv5h/removed_by_reddit/,[ Removed by Reddit ],/r/Riverside/comments/t1iv5h/removed_by_reddit/hyh8p0n/,2,r/Riverside,0,2
Well what kinda interest do you have?,t2_b0zf5w32,Psychological_Win304,0,1645844444.0,0,t1_hygv2yb,hygv2yb,True,notyourbaby-neverwas,t3_t0t733,https://www.reddit.com/r/Riverside/comments/t0t733/i_moved_to_riverside_last_year_during_the/,I moved to Riverside last year during the pandemic & don’t know a soul — 29/female/single… any ideas on how I can meet people?! Not a fan of dating apps 😕,/r/Riverside/comments/t0t733/i_moved_to_riverside_last_year_during_the/hygv2yb/,1,r/Riverside,0,1
That's Felix el Gato.,t2_7ijq7,boing757,0,1645844195.0,0,t1_hyguknr,hyguknr,True,fuckboysgetcats,t3_t1iv5h,https://www.reddit.com/r/Riverside/comments/t1iv5h/removed_by_reddit/,[ Removed by Reddit ],/r/Riverside/comments/t1iv5h/removed_by_reddit/hyguknr/,4,r/Riverside,0,4
All I see is you putting a pic or a guy and his truck. Your side of the story is he hit you but we don’t know. Go to the police. For all we know you might have other beef with him and just wanna know where he lives.,t2_zsq6e,klumze,0,1645843195.0,0,t1_hygsi31,hygsi31,True,fuckboysgetcats,t3_t1iv5h,https://www.reddit.com/r/Riverside/comments/t1iv5h/removed_by_reddit/,[ Removed by Reddit ],/r/Riverside/comments/t1iv5h/removed_by_reddit/hygsi31/,15,r/Riverside,0,15
Does your insurance not cover you going into Mexico?,t2_5gszgk6b,spitefulmotives,0,1645842545.0,0,t1_hygr4kc,hygr4kc,True,fuckboysgetcats,t3_t1iv5h,https://www.reddit.com/r/Riverside/comments/t1iv5h/removed_by_reddit/,[ Removed by Reddit ],/r/Riverside/comments/t1iv5h/removed_by_reddit/hygr4kc/,3,r/Riverside,0,3
Ya you file a police report and let the insurance deal with it.,t2_z2wir,Dmacjames,0,1645841800.0,0,t1_hygpjtb,hygpjtb,False,fuckboysgetcats,t3_t1iv5h,https://www.reddit.com/r/Riverside/comments/t1iv5h/removed_by_reddit/,[ Removed by Reddit ],/r/Riverside/comments/t1iv5h/removed_by_reddit/hygpjtb/,10,r/Riverside,0,10
"Don’t care how I sound, I would act how I want if someone is being disrespectful and not being responsible for his actions.",t2_58ig2o1q,fuckboysgetcats,0,1645841757.0,0,t1_hygpgk0,hygpgk0,False,fuckboysgetcats,t3_t1iv5h,https://www.reddit.com/r/Riverside/comments/t1iv5h/removed_by_reddit/,[ Removed by Reddit ],/r/Riverside/comments/t1iv5h/removed_by_reddit/hygpgk0/,-9,r/Riverside,0,-9
"Yeah just report it to the police, and the insurance company. Hopefully something will come of it. If he hit you and drove off without swapping insurance that's a hit and run.",t2_rymf3,nebulonb,0,1645841752.0,0,t1_hygpg5x,hygpg5x,False,fuckboysgetcats,t3_t1iv5h,https://www.reddit.com/r/Riverside/comments/t1iv5h/removed_by_reddit/,[ Removed by Reddit ],/r/Riverside/comments/t1iv5h/removed_by_reddit/hygpg5x/,5,r/Riverside,0,5
File a police report. You sound like a Karen.,t2_z2wir,Dmacjames,0,1645841658.0,0,t1_hygp8xm,hygp8xm,False,fuckboysgetcats,t3_t1iv5h,https://www.reddit.com/r/Riverside/comments/t1iv5h/removed_by_reddit/,[ Removed by Reddit ],/r/Riverside/comments/t1iv5h/removed_by_reddit/hygp8xm/,10,r/Riverside,0,10
"Yeah, but still takes time and I want people to tell him about how coward he was for leaving the situation. He too old for that.",t2_58ig2o1q,fuckboysgetcats,0,1645840993.0,0,t1_hygnury,hygnury,False,fuckboysgetcats,t3_t1iv5h,https://www.reddit.com/r/Riverside/comments/t1iv5h/removed_by_reddit/,[ Removed by Reddit ],/r/Riverside/comments/t1iv5h/removed_by_reddit/hygnury/,-7,r/Riverside,0,-7
"You’ve got a VIN, plate number, pic of the guy, and you came to Reddit? Call your insurance company. Not the Reddit police.",t2_r1l1qvx,ClutterKitty,0,1645840921.0,0,t1_hygnpcw,hygnpcw,False,fuckboysgetcats,t3_t1iv5h,https://www.reddit.com/r/Riverside/comments/t1iv5h/removed_by_reddit/,[ Removed by Reddit ],/r/Riverside/comments/t1iv5h/removed_by_reddit/hygnpcw/,28,r/Riverside,0,28
His truck is from Riverside. Doesn’t mean he is. Could have driven for a good deal. I bought my car 75 miles from my home. Or he could have bought a used car from someone in Riverside. There are other scenarios where he is not from Riverside.,t2_r1l1qvx,ClutterKitty,0,1645840859.0,0,t1_hygnkli,hygnkli,False,fuckboysgetcats,t3_t1iv5h,https://www.reddit.com/r/Riverside/comments/t1iv5h/removed_by_reddit/,[ Removed by Reddit ],/r/Riverside/comments/t1iv5h/removed_by_reddit/hygnkli/,10,r/Riverside,0,10
Because he was so disrespectful and didn’t want to cooperate. I just want him to be responsible for his action and not just ran away from his problems.,t2_58ig2o1q,fuckboysgetcats,0,1645840850.0,0,t1_hygnjxg,hygnjxg,False,fuckboysgetcats,t3_t1iv5h,https://www.reddit.com/r/Riverside/comments/t1iv5h/removed_by_reddit/,[ Removed by Reddit ],/r/Riverside/comments/t1iv5h/removed_by_reddit/hygnjxg/,-10,r/Riverside,0,-10
Just file police report man. What are you going to John wick him?,t2_ulwwl,Jack_MHoff,0,1645840739.0,0,t1_hygnbgn,hygnbgn,True,fuckboysgetcats,t3_t1iv5h,https://www.reddit.com/r/Riverside/comments/t1iv5h/removed_by_reddit/,[ Removed by Reddit ],/r/Riverside/comments/t1iv5h/removed_by_reddit/hygnbgn/,13,r/Riverside,0,13
if he was going to pay for damages he would have offered already. i don’t understand why you wouldn’t go to the police,t2_9fyc6,SageBait,0,1645840184.0,0,t1_hygm5j1,hygm5j1,False,fuckboysgetcats,t3_t1iv5h,https://www.reddit.com/r/Riverside/comments/t1iv5h/removed_by_reddit/,[ Removed by Reddit ],/r/Riverside/comments/t1iv5h/removed_by_reddit/hygm5j1/,11,r/Riverside,0,11
"It looks like you took the photos on the Mexican side of the border...? If that's the case, there's not much the police or DMV will be able to do for you. He likely realized that and took advantage of the situation. Again, sorry that happened to you.",t2_3m411nw3,Saepod,1,1645838305.0,0,t1_hygi61x,hygi61x,False,fuckboysgetcats,t3_t1iv5h,https://www.reddit.com/r/Riverside/comments/t1iv5h/removed_by_reddit/,[ Removed by Reddit ],/r/Riverside/comments/t1iv5h/removed_by_reddit/hygi61x/,-2,r/Riverside,0,-2
To know if someone knows him. He was rude and I’m still hoping he will just pay the damages instead of me having to report him to the police and dmv.  😄 have a nice day,t2_58ig2o1q,fuckboysgetcats,0,1645838018.0,0,t1_hyghk7o,hyghk7o,False,fuckboysgetcats,t3_t1iv5h,https://www.reddit.com/r/Riverside/comments/t1iv5h/removed_by_reddit/,[ Removed by Reddit ],/r/Riverside/comments/t1iv5h/removed_by_reddit/hyghk7o/,-8,r/Riverside,0,-8
"This is just... what are you hoping will come from this post? No one's going to jump in here to snitch on their uncle Pedro.

I'm sorry your car got hit and I'm sorry he didn't try to make things right. Not much else to do or say here... good luck with repairs.",t2_3m411nw3,Saepod,0,1645837882.0,0,t1_hygh9py,hygh9py,True,fuckboysgetcats,t3_t1iv5h,https://www.reddit.com/r/Riverside/comments/t1iv5h/removed_by_reddit/,[ Removed by Reddit ],/r/Riverside/comments/t1iv5h/removed_by_reddit/hygh9py/,16,r/Riverside,0,16
"Back to Grind downtown, coffee shop often live entertainment, good snacks, smoothies as well as coffee and teas.  Younger and artistic  people had great AA group downstairs meeting small venues room.  Next door Gay Bar, with more conservative bar next door. Across Street two more clubs with different people.  Restaurants all around Main Street University galleries, shops, dance center,  New library,  and theater with live events. Market Street near University Avenue has FOOD LAB several unique restaurants under one roof, game place next door.
  We live in Perris little old fashioned small downtown many Mexican restaurants,  Railroad Museum see and ride steam engines, other trains, electric trolleys from around the world.  Nearby Perris Airport center for skydiving, has verticle wind tunnel to experience free falling or practice without jumping out of plane. Good Bar and restaurant with view of planes and skydivers. Lake Perris and Lake Elsinore only 15 minutes away.  
Riverside is our big city to go for many activities San Diego 90 minutes away but it's a nice drive to city and beaches.",t2_7gw13bjs,Material_Homework_86,0,1645836180.0,0,t1_hygdm1e,hygdm1e,True,notyourbaby-neverwas,t3_t0t733,https://www.reddit.com/r/Riverside/comments/t0t733/i_moved_to_riverside_last_year_during_the/,I moved to Riverside last year during the pandemic & don’t know a soul — 29/female/single… any ideas on how I can meet people?! Not a fan of dating apps 😕,/r/Riverside/comments/t0t733/i_moved_to_riverside_last_year_during_the/hygdm1e/,1,r/Riverside,0,1
[ Removed by Reddit ],t2_58ig2o1q,fuckboysgetcats,1,1645835013.0,0,t1_hygb28q,hygb28q,True,fuckboysgetcats,t3_t1iv5h,https://www.reddit.com/r/Riverside/comments/t1iv5h/removed_by_reddit/,[ Removed by Reddit ],/r/Riverside/comments/t1iv5h/removed_by_reddit/hygb28q/,1,r/Riverside,0,1
He hit me crossing the San Ysidro port of entry and he didn't want to be responsible. He's from Riverside .,t2_58ig2o1q,fuckboysgetcats,1,1645834913.0,0,t1_hygaupd,hygaupd,True,fuckboysgetcats,t3_t1iv5h,https://www.reddit.com/r/Riverside/comments/t1iv5h/removed_by_reddit/,[ Removed by Reddit ],/r/Riverside/comments/t1iv5h/removed_by_reddit/hygaupd/,3,r/Riverside,0,3
Hey me up I live in riverside,t2_j67qosig,Elegant-Guess-5330,0,1645832531.0,0,t1_hyg5h2y,hyg5h2y,True,notyourbaby-neverwas,t3_t0t733,https://www.reddit.com/r/Riverside/comments/t0t733/i_moved_to_riverside_last_year_during_the/,I moved to Riverside last year during the pandemic & don’t know a soul — 29/female/single… any ideas on how I can meet people?! Not a fan of dating apps 😕,/r/Riverside/comments/t0t733/i_moved_to_riverside_last_year_during_the/hyg5h2y/,1,r/Riverside,0,1
Nextdoor for meeting neighbors 😁,t2_5ofdx,illicited,0,1645820674.0,0,t1_hyfc88r,hyfc88r,True,notyourbaby-neverwas,t3_t0t733,https://www.reddit.com/r/Riverside/comments/t0t733/i_moved_to_riverside_last_year_during_the/,I moved to Riverside last year during the pandemic & don’t know a soul — 29/female/single… any ideas on how I can meet people?! Not a fan of dating apps 😕,/r/Riverside/comments/t0t733/i_moved_to_riverside_last_year_during_the/hyfc88r/,1,r/Riverside,0,1
"If you enjoy or want to learn DND games or Warhammer, try Gamer's Haven in Colton. They are on Meetup. Nice group of people and female friendly.

I'd try Meetup for other activities. 

What are your interests?",t2_7vs0f,creakinator,0,1645815213.0,0,t1_hyey8p6,hyey8p6,True,notyourbaby-neverwas,t3_t0t733,https://www.reddit.com/r/Riverside/comments/t0t733/i_moved_to_riverside_last_year_during_the/,I moved to Riverside last year during the pandemic & don’t know a soul — 29/female/single… any ideas on how I can meet people?! Not a fan of dating apps 😕,/r/Riverside/comments/t0t733/i_moved_to_riverside_last_year_during_the/hyey8p6/,1,r/Riverside,0,1
"Try MeetUp, it's not a dating app. It's an app that puts people together with similar interests and there are tons of groups.",t2_ey67c61q,Destiny_girl,0,1645814246.0,0,t1_hyevoqw,hyevoqw,True,notyourbaby-neverwas,t3_t0t733,https://www.reddit.com/r/Riverside/comments/t0t733/i_moved_to_riverside_last_year_during_the/,I moved to Riverside last year during the pandemic & don’t know a soul — 29/female/single… any ideas on how I can meet people?! Not a fan of dating apps 😕,/r/Riverside/comments/t0t733/i_moved_to_riverside_last_year_during_the/hyevoqw/,1,r/Riverside,0,1
we moved here Dec 2020 me and my husband are trying to make friends too! 26F / 26M,t2_6fl3ed4b,eatyourvegetablessss,0,1645814176.0,0,t1_hyevi4m,hyevi4m,False,notyourbaby-neverwas,t3_t0t733,https://www.reddit.com/r/Riverside/comments/t0t733/i_moved_to_riverside_last_year_during_the/,I moved to Riverside last year during the pandemic & don’t know a soul — 29/female/single… any ideas on how I can meet people?! Not a fan of dating apps 😕,/r/Riverside/comments/t0t733/i_moved_to_riverside_last_year_during_the/hyevi4m/,1,r/Riverside,0,1
I usually go to riverside downtown on weekends. The city is alive and you could bar hop or go to arcades. I never have problems meeting new people each night i go. Great place to mingle,t2_e6rkgf1y,eldred_jonas89,0,1645813896.0,0,t1_hyeurav,hyeurav,True,notyourbaby-neverwas,t3_t0t733,https://www.reddit.com/r/Riverside/comments/t0t733/i_moved_to_riverside_last_year_during_the/,I moved to Riverside last year during the pandemic & don’t know a soul — 29/female/single… any ideas on how I can meet people?! Not a fan of dating apps 😕,/r/Riverside/comments/t0t733/i_moved_to_riverside_last_year_during_the/hyeurav/,1,r/Riverside,0,1
If you like live music. There's always local shows around the area.,t2_mih9u0m,blackhole_sonnn,0,1645811181.0,0,t1_hyenhxu,hyenhxu,True,notyourbaby-neverwas,t3_t0t733,https://www.reddit.com/r/Riverside/comments/t0t733/i_moved_to_riverside_last_year_during_the/,I moved to Riverside last year during the pandemic & don’t know a soul — 29/female/single… any ideas on how I can meet people?! Not a fan of dating apps 😕,/r/Riverside/comments/t0t733/i_moved_to_riverside_last_year_during_the/hyenhxu/,2,r/Riverside,0,2
"Try Pixels or some of the other local bars in Downtown Riverside, they're alot more friendlier then most people give em and can be a great place to meet new people.",t2_6dxku3c5,blackbeantalent,0,1645811012.0,0,t1_hyen1u3,hyen1u3,True,notyourbaby-neverwas,t3_t0t733,https://www.reddit.com/r/Riverside/comments/t0t733/i_moved_to_riverside_last_year_during_the/,I moved to Riverside last year during the pandemic & don’t know a soul — 29/female/single… any ideas on how I can meet people?! Not a fan of dating apps 😕,/r/Riverside/comments/t0t733/i_moved_to_riverside_last_year_during_the/hyen1u3/,1,r/Riverside,0,1
"Well, there is a bunch of people there who smoke out back together and normally they have a craft soda on tap. At least it would give you something to sip on while hanging out. I'm sure my wife she I will be there tonight. Friday is a popular day to play corn hole.

There's also Game Labs, I haven't been there enough times to know how well people mingle there. But you could enjoy a bowl and play some video games or pinball.

If something pops into my head I'll be sure to message you.",t2_ylo82,BrandonAmon,0,1645808549.0,0,t1_hyegjil,hyegjil,True,notyourbaby-neverwas,t3_t0t733,https://www.reddit.com/r/Riverside/comments/t0t733/i_moved_to_riverside_last_year_during_the/,I moved to Riverside last year during the pandemic & don’t know a soul — 29/female/single… any ideas on how I can meet people?! Not a fan of dating apps 😕,/r/Riverside/comments/t0t733/i_moved_to_riverside_last_year_during_the/hyegjil/,1,r/Riverside,0,1
My girlfriend uses Bumble to find friends. They have a friend's searching feature that she's had success with.,t2_cx10i,WoxicFangel,0,1645798548.0,0,t1_hydrqtb,hydrqtb,True,notyourbaby-neverwas,t3_t0t733,https://www.reddit.com/r/Riverside/comments/t0t733/i_moved_to_riverside_last_year_during_the/,I moved to Riverside last year during the pandemic & don’t know a soul — 29/female/single… any ideas on how I can meet people?! Not a fan of dating apps 😕,/r/Riverside/comments/t0t733/i_moved_to_riverside_last_year_during_the/hydrqtb/,2,r/Riverside,0,2
"Right here. I'm 29, male, and single. /s (sarcasm yet technically true)",t2_9muily6q,Certain_Chain,0,1645798217.0,0,t1_hydr154,hydr154,True,notyourbaby-neverwas,t3_t0t733,https://www.reddit.com/r/Riverside/comments/t0t733/i_moved_to_riverside_last_year_during_the/,I moved to Riverside last year during the pandemic & don’t know a soul — 29/female/single… any ideas on how I can meet people?! Not a fan of dating apps 😕,/r/Riverside/comments/t0t733/i_moved_to_riverside_last_year_during_the/hydr154/,0,r/Riverside,0,0
"We're kind of a mixed bag all over the IE with various gyms, but most of us are 24 Hour Fitness members & since they let each member take 2 people with them, there is plenty of room for everyone. Mostly we go to either the one in Beastvale or the one on Madison in Riverside. We also do stuff like hiking various spots around here, and indoor rock climbing at Hangar 18, but there's never any pressure to do anything. We started out as a game dev group and that's still our overall theme, but it's really just morphed into a bunch of local people helping each other out in any/all fascists of life.   
&nbsp;  
It's a lot of fun. All shapes & sizes too, the only requirement is a good sense of humor because we like to laugh a lot.  
&nbsp;",t2_8tp6u,Vastlee,0,1645795981.0,0,t1_hydme8b,hydme8b,False,notyourbaby-neverwas,t3_t0t733,https://www.reddit.com/r/Riverside/comments/t0t733/i_moved_to_riverside_last_year_during_the/,I moved to Riverside last year during the pandemic & don’t know a soul — 29/female/single… any ideas on how I can meet people?! Not a fan of dating apps 😕,/r/Riverside/comments/t0t733/i_moved_to_riverside_last_year_during_the/hydme8b/,3,r/Riverside,0,3
I’ve used Bumble BFF and met one cool person haha. We moved here 6 months before the pandemic and need more friends but we also had a baby on Monday so I won’t be fun for a while.,t2_2zq6ed2y,narcolepticadicts,0,1645795807.0,0,t1_hydm23p,hydm23p,True,notyourbaby-neverwas,t3_t0t733,https://www.reddit.com/r/Riverside/comments/t0t733/i_moved_to_riverside_last_year_during_the/,I moved to Riverside last year during the pandemic & don’t know a soul — 29/female/single… any ideas on how I can meet people?! Not a fan of dating apps 😕,/r/Riverside/comments/t0t733/i_moved_to_riverside_last_year_during_the/hydm23p/,2,r/Riverside,0,2
And the island fries are flipping amazing!,t2_ckthnz0q,BreadfruitNational72,0,1645795423.0,0,t1_hydlbi7,hydlbi7,False,Certain_Chain,t3_srtd1h,https://www.reddit.com/r/Riverside/comments/srtd1h/best_burgers_in_town/,Best burgers in town?,/r/Riverside/comments/srtd1h/best_burgers_in_town/hydlbi7/,1,r/Riverside,0,1
I tried that... But I wasn't willing to pay the stupid fee to see who is trying to connect with me or wtvr. Is there a way around this?,t2_ckthnz0q,BreadfruitNational72,0,1645792143.0,0,t1_hydfg76,hydfg76,False,notyourbaby-neverwas,t3_t0t733,https://www.reddit.com/r/Riverside/comments/t0t733/i_moved_to_riverside_last_year_during_the/,I moved to Riverside last year during the pandemic & don’t know a soul — 29/female/single… any ideas on how I can meet people?! Not a fan of dating apps 😕,/r/Riverside/comments/t0t733/i_moved_to_riverside_last_year_during_the/hydfg76/,2,r/Riverside,0,2
"Aww, hope to see you there! Lol 
Sidenote: your post is literally why I joined THAT app, I'm new here too...2 mons on the app, no luck yet :/ reading females profiles is def up there with going thru a man's profile on a dating site 🙄 but my son is a teenager and some of these ladies are trying to have playdates and I'm just not about that life no more!",t2_ckthnz0q,BreadfruitNational72,0,1645791936.0,0,t1_hydf40k,hydf40k,False,notyourbaby-neverwas,t3_t0t733,https://www.reddit.com/r/Riverside/comments/t0t733/i_moved_to_riverside_last_year_during_the/,I moved to Riverside last year during the pandemic & don’t know a soul — 29/female/single… any ideas on how I can meet people?! Not a fan of dating apps 😕,/r/Riverside/comments/t0t733/i_moved_to_riverside_last_year_during_the/hydf40k/,2,r/Riverside,0,2
"I moved away from riverside and found some good people through meetup.com. Just be prepared for some awkwardness in the beginning. Also, bumble BFF is a good option. It's a dating app, but has a friend option. My wife had really great results from that.",t2_q9osh,Dun1naughty,0,1645780834.0,0,t1_hyd086m,hyd086m,True,notyourbaby-neverwas,t3_t0t733,https://www.reddit.com/r/Riverside/comments/t0t733/i_moved_to_riverside_last_year_during_the/,I moved to Riverside last year during the pandemic & don’t know a soul — 29/female/single… any ideas on how I can meet people?! Not a fan of dating apps 😕,/r/Riverside/comments/t0t733/i_moved_to_riverside_last_year_during_the/hyd086m/,2,r/Riverside,0,2
Nah I'm sure you're not a buzzkill plus most drinker love to talk even if you're not listening lol,t2_gc08c,ohxvvt,0,1645778461.0,0,t1_hycx9nm,hycx9nm,False,notyourbaby-neverwas,t3_t0t733,https://www.reddit.com/r/Riverside/comments/t0t733/i_moved_to_riverside_last_year_during_the/,I moved to Riverside last year during the pandemic & don’t know a soul — 29/female/single… any ideas on how I can meet people?! Not a fan of dating apps 😕,/r/Riverside/comments/t0t733/i_moved_to_riverside_last_year_during_the/hycx9nm/,3,r/Riverside,0,3
"HAHAHA you made my night! I mean I will be trying to conceive when I find the ""one"" so its not too far off lolol I am joining!!!",t2_c29y3xd5,notyourbaby-neverwas,0,1645776597.0,0,t1_hycuvak,hycuvak,False,notyourbaby-neverwas,t3_t0t733,https://www.reddit.com/r/Riverside/comments/t0t733/i_moved_to_riverside_last_year_during_the/,I moved to Riverside last year during the pandemic & don’t know a soul — 29/female/single… any ideas on how I can meet people?! Not a fan of dating apps 😕,/r/Riverside/comments/t0t733/i_moved_to_riverside_last_year_during_the/hycuvak/,3,r/Riverside,0,3
I meeeean.... No one on there is auditing it lol you can even join as a 'trying to conceive' and it's fine. Tell them I said so 😅,t2_ckthnz0q,BreadfruitNational72,0,1645774981.0,0,t1_hycsptb,hycsptb,False,notyourbaby-neverwas,t3_t0t733,https://www.reddit.com/r/Riverside/comments/t0t733/i_moved_to_riverside_last_year_during_the/,I moved to Riverside last year during the pandemic & don’t know a soul — 29/female/single… any ideas on how I can meet people?! Not a fan of dating apps 😕,/r/Riverside/comments/t0t733/i_moved_to_riverside_last_year_during_the/hycsptb/,2,r/Riverside,0,2
Hmm really? Maybe I should. I am so lost because I stopped drinking and feel like I’ll be a buzz kill or something if I’m not pounding shots at the table,t2_c29y3xd5,notyourbaby-neverwas,0,1645774579.0,0,t1_hycs69d,hycs69d,False,notyourbaby-neverwas,t3_t0t733,https://www.reddit.com/r/Riverside/comments/t0t733/i_moved_to_riverside_last_year_during_the/,I moved to Riverside last year during the pandemic & don’t know a soul — 29/female/single… any ideas on how I can meet people?! Not a fan of dating apps 😕,/r/Riverside/comments/t0t733/i_moved_to_riverside_last_year_during_the/hycs69d/,2,r/Riverside,0,2
Awwww man I wish I was a mom or expecting to be :( I’m late in this game of life lol,t2_c29y3xd5,notyourbaby-neverwas,0,1645774509.0,0,t1_hycs2tm,hycs2tm,False,notyourbaby-neverwas,t3_t0t733,https://www.reddit.com/r/Riverside/comments/t0t733/i_moved_to_riverside_last_year_during_the/,I moved to Riverside last year during the pandemic & don’t know a soul — 29/female/single… any ideas on how I can meet people?! Not a fan of dating apps 😕,/r/Riverside/comments/t0t733/i_moved_to_riverside_last_year_during_the/hycs2tm/,3,r/Riverside,0,3
a mystery ✨,t2_c29y3xd5,notyourbaby-neverwas,0,1645774448.0,0,t1_hycrzul,hycrzul,False,notyourbaby-neverwas,t3_t0t733,https://www.reddit.com/r/Riverside/comments/t0t733/i_moved_to_riverside_last_year_during_the/,I moved to Riverside last year during the pandemic & don’t know a soul — 29/female/single… any ideas on how I can meet people?! Not a fan of dating apps 😕,/r/Riverside/comments/t0t733/i_moved_to_riverside_last_year_during_the/hycrzul/,0,r/Riverside,0,0
"You’re the best!!! I love fitness & design so I think I will be able to connect with the group :) really appreciate your invitation!!! 

Where do you lift?",t2_c29y3xd5,notyourbaby-neverwas,0,1645774401.0,0,t1_hycrxik,hycrxik,False,notyourbaby-neverwas,t3_t0t733,https://www.reddit.com/r/Riverside/comments/t0t733/i_moved_to_riverside_last_year_during_the/,I moved to Riverside last year during the pandemic & don’t know a soul — 29/female/single… any ideas on how I can meet people?! Not a fan of dating apps 😕,/r/Riverside/comments/t0t733/i_moved_to_riverside_last_year_during_the/hycrxik/,4,r/Riverside,0,4
H,t2_c29y3xd5,notyourbaby-neverwas,0,1645774159.0,0,t1_hycrlag,hycrlag,False,notyourbaby-neverwas,t3_t0t733,https://www.reddit.com/r/Riverside/comments/t0t733/i_moved_to_riverside_last_year_during_the/,I moved to Riverside last year during the pandemic & don’t know a soul — 29/female/single… any ideas on how I can meet people?! Not a fan of dating apps 😕,/r/Riverside/comments/t0t733/i_moved_to_riverside_last_year_during_the/hycrlag/,5,r/Riverside,0,5
