body,author_fullname,author.name,controversiality,created,downs,fullname,id,is_root,link_author,link_id,link_permalink,link_title,permalink,score,subreddit_name_prefixed,total_awards_received,ups
hell yea!!!,t2_12a2il,abe326,0,1648109804.0,0,t1_i1wn5gz,i1wn5gz,True,Stauce52,t3_tlxyj9,https://www.reddit.com/r/Riverside/comments/tlxyj9/randys_donuts_looks_to_expand_to_the_inland/,Randy’s Donuts looks to expand to the Inland Empire with a shop in Riverside,/r/Riverside/comments/tlxyj9/randys_donuts_looks_to_expand_to_the_inland/i1wn5gz/,1,r/Riverside,0,1
Hell yeah,t2_2oca5yom,TheVillian25,0,1648109748.0,0,t1_i1wn349,i1wn349,True,Stauce52,t3_tlxyj9,https://www.reddit.com/r/Riverside/comments/tlxyj9/randys_donuts_looks_to_expand_to_the_inland/,Randy’s Donuts looks to expand to the Inland Empire with a shop in Riverside,/r/Riverside/comments/tlxyj9/randys_donuts_looks_to_expand_to_the_inland/i1wn349/,2,r/Riverside,0,2
"We sold our Pasadena home and moved to Riverside last year to be closer to our family. If I am not working from home and need to commute every day, I would avoid moving here. Not many high paying job opportunities available.
However, I really love living in Riverside. We hang out with family way more often. Housing and neighborhoods here have so much to offer. It's very quiet and our dog loves it too. We saw a lot of rain cross symbols in a lot of houses during house hunting. It really shows the community pride.
Downtown and wood streets are my favorite because of all the charming old houses. (That's one thing I missed about Pasadena) Alessandro Heights and Hawarden Hills neighborhoods have all that old money and new  luxury homes. It's very hot during summer here but if you live in the hills like La Sierra or Lake Hills areas, you get a breeze everyday which is a bit cooler than the rest of the Riverside.",t2_42w5yhq7,yeahastronomy,0,1648108395.0,0,t1_i1wlitm,i1wlitm,True,pizzamann420,t3_tlyucm,https://www.reddit.com/r/Riverside/comments/tlyucm/moving_to_riverside_from_irvine/,Moving to riverside from Irvine?,/r/Riverside/comments/tlyucm/moving_to_riverside_from_irvine/i1wlitm/,3,r/Riverside,0,3
What are the specs. Aka le gth vs longitude bedroom. Anyone can use a fish eye csmera,t2_99rwa38t,seachelemichele,0,1648108391.0,0,t1_i1wlimi,i1wlimi,True,LuzMal,t3_tlxfny,https://www.reddit.com/r/Riverside/comments/tlxfny/bed_room_available_this_riverside_home_seats_just/,"Bed room available! This Riverside Home seats just 7 minutes away from UCR, and Wifi included! Please message me for more information. 👩🏻‍🎓👨🏻‍🎓",/r/Riverside/comments/tlxfny/bed_room_available_this_riverside_home_seats_just/i1wlimi/,1,r/Riverside,0,1
How much?,t2_gzta0v3y,gIockswitch,0,1648107237.0,0,t1_i1wk5vh,i1wk5vh,False,LuzMal,t3_tlxfny,https://www.reddit.com/r/Riverside/comments/tlxfny/bed_room_available_this_riverside_home_seats_just/,"Bed room available! This Riverside Home seats just 7 minutes away from UCR, and Wifi included! Please message me for more information. 👩🏻‍🎓👨🏻‍🎓",/r/Riverside/comments/tlxfny/bed_room_available_this_riverside_home_seats_just/i1wk5vh/,1,r/Riverside,0,1
Do they actually eat what they catch there???,t2_98vjn,skyblueandblack,0,1648104438.0,0,t1_i1wgsaa,i1wgsaa,False,idlesails,t3_tlujrx,https://www.reddit.com/r/Riverside/comments/tlujrx/any_lakes_or_places_to_find_fresh_water_fish/,"Any lakes or places to find fresh water fish, fresh water micro fish?",/r/Riverside/comments/tlujrx/any_lakes_or_places_to_find_fresh_water_fish/i1wgsaa/,1,r/Riverside,0,1
"Look up the Life Arts Center. It's a studio collective and event venue in downtown. They put on the monthly Arts Walk event, which tends to draw a pretty big crowd. Well, I say big... probably pretty tame compared to any event in NYC, but I'm just guessing there.

Anyway, yes -- there's a thriving art scene in Riverside, but it's centered downtown, which is a little way from UCR. Not too far, but not really walking distance, either.

Good luck in your searches -- and welcome in advance!",t2_98vjn,skyblueandblack,0,1648104400.0,0,t1_i1wgqmk,i1wgqmk,True,Ecstatic_Assumption5,t3_tlvdss,https://www.reddit.com/r/Riverside/comments/tlvdss/any_artists_critique_groups_collectives/,"Any artists, critique groups, collectives…?",/r/Riverside/comments/tlvdss/any_artists_critique_groups_collectives/i1wgqmk/,4,r/Riverside,0,4
"It's hot. Be prepared to run your ac a lot in the summer. It's a desert here though you'll find a lot of green in the downtown area.

Downtown is mostly Victorian style housing and Mission style bldgs like a mini Pasadena. La Sierra and Orangecrest have newer planned communities. And the rest is mostly houses from the 70's. 

It's mostly working class here too. Not too many rich folks like you see in Irvine. But that's why I like it here, it feels more laid back and people are pretty easy going. If you want something wealthier you may want to go to nearby cities such as Corona or further away at Chino Hills.",t2_4ynjr8q1,pierfishmarket,0,1648104112.0,0,t1_i1wgdqv,i1wgdqv,True,pizzamann420,t3_tlyucm,https://www.reddit.com/r/Riverside/comments/tlyucm/moving_to_riverside_from_irvine/,Moving to riverside from Irvine?,/r/Riverside/comments/tlyucm/moving_to_riverside_from_irvine/i1wgdqv/,4,r/Riverside,0,4
"Agreed. I'm told the ""woods streets"" area is high-end, but you probably want to avoid the charming Victorians around downtown.",t2_98vjn,skyblueandblack,0,1648103596.0,0,t1_i1wfqhn,i1wfqhn,False,pizzamann420,t3_tlyucm,https://www.reddit.com/r/Riverside/comments/tlyucm/moving_to_riverside_from_irvine/,Moving to riverside from Irvine?,/r/Riverside/comments/tlyucm/moving_to_riverside_from_irvine/i1wfqhn/,4,r/Riverside,0,4
Definitely research the area you want live in. It changes from street to street.,t2_7op4k2eh,Mindless-Salt7566,0,1648102057.0,0,t1_i1wdqb2,i1wdqb2,True,pizzamann420,t3_tlyucm,https://www.reddit.com/r/Riverside/comments/tlyucm/moving_to_riverside_from_irvine/,Moving to riverside from Irvine?,/r/Riverside/comments/tlyucm/moving_to_riverside_from_irvine/i1wdqb2/,5,r/Riverside,0,5
Vamos El Tri !!,t2_mih9u0m,blackhole_sonnn,0,1648101353.0,0,t1_i1wcsro,i1wcsro,True,burnababee,t3_tln9nd,https://www.reddit.com/r/Riverside/comments/tln9nd/anyone_know_a_barrestaurant_that_will_show_the_mx/,Anyone know a bar/restaurant that will show the Mx vs USA game tomorrow?,/r/Riverside/comments/tln9nd/anyone_know_a_barrestaurant_that_will_show_the_mx/i1wcsro/,1,r/Riverside,0,1
Oooooo I actually live right around the corner from dukes that would be perfect. I’ll call tomorrow and ask and lyk!,t2_2evp3czh,burnababee,0,1648101298.0,0,t1_i1wcq5z,i1wcq5z,False,burnababee,t3_tln9nd,https://www.reddit.com/r/Riverside/comments/tln9nd/anyone_know_a_barrestaurant_that_will_show_the_mx/,Anyone know a bar/restaurant that will show the Mx vs USA game tomorrow?,/r/Riverside/comments/tln9nd/anyone_know_a_barrestaurant_that_will_show_the_mx/i1wcq5z/,1,r/Riverside,0,1
Lmk! I’m trying to go watch it too but idk where to go. I’m sure dukes might show it 🤔,t2_jb4hggss,jxnnyjxn,0,1648100938.0,0,t1_i1wc8uu,i1wc8uu,True,burnababee,t3_tln9nd,https://www.reddit.com/r/Riverside/comments/tln9nd/anyone_know_a_barrestaurant_that_will_show_the_mx/,Anyone know a bar/restaurant that will show the Mx vs USA game tomorrow?,/r/Riverside/comments/tln9nd/anyone_know_a_barrestaurant_that_will_show_the_mx/i1wc8uu/,1,r/Riverside,0,1
That would be cool,t2_5tp1ivjq,haz_waste,0,1648100485.0,0,t1_i1wbmgz,i1wbmgz,True,Stauce52,t3_tlxyj9,https://www.reddit.com/r/Riverside/comments/tlxyj9/randys_donuts_looks_to_expand_to_the_inland/,Randy’s Donuts looks to expand to the Inland Empire with a shop in Riverside,/r/Riverside/comments/tlxyj9/randys_donuts_looks_to_expand_to_the_inland/i1wbmgz/,2,r/Riverside,0,2
My guy 😂😭,t2_89aodbyo,Difficult-Dog-3349,0,1648098449.0,0,t1_i1w8qc9,i1w8qc9,False,LuzMal,t3_tlxfny,https://www.reddit.com/r/Riverside/comments/tlxfny/bed_room_available_this_riverside_home_seats_just/,"Bed room available! This Riverside Home seats just 7 minutes away from UCR, and Wifi included! Please message me for more information. 👩🏻‍🎓👨🏻‍🎓",/r/Riverside/comments/tlxfny/bed_room_available_this_riverside_home_seats_just/i1w8qc9/,6,r/Riverside,0,6
🤤,t2_5qngg,Nyckname,0,1648097615.0,0,t1_i1w7hmd,i1w7hmd,True,Stauce52,t3_tlxyj9,https://www.reddit.com/r/Riverside/comments/tlxyj9/randys_donuts_looks_to_expand_to_the_inland/,Randy’s Donuts looks to expand to the Inland Empire with a shop in Riverside,/r/Riverside/comments/tlxyj9/randys_donuts_looks_to_expand_to_the_inland/i1w7hmd/,3,r/Riverside,0,3
https://www.eastsidearthouse.studio/,t2_a0oghv97,deeep-in-thot,0,1648096507.0,0,t1_i1w5qyp,i1w5qyp,True,Ecstatic_Assumption5,t3_tlvdss,https://www.reddit.com/r/Riverside/comments/tlvdss/any_artists_critique_groups_collectives/,"Any artists, critique groups, collectives…?",/r/Riverside/comments/tlvdss/any_artists_critique_groups_collectives/i1w5qyp/,6,r/Riverside,0,6
Do you rent it out by the hour?,t2_ensuz,physhstyx13,0,1648096104.0,0,t1_i1w52jl,i1w52jl,True,LuzMal,t3_tlxfny,https://www.reddit.com/r/Riverside/comments/tlxfny/bed_room_available_this_riverside_home_seats_just/,"Bed room available! This Riverside Home seats just 7 minutes away from UCR, and Wifi included! Please message me for more information. 👩🏻‍🎓👨🏻‍🎓",/r/Riverside/comments/tlxfny/bed_room_available_this_riverside_home_seats_just/i1w52jl/,8,r/Riverside,0,8
"Show up to a bar, tell them to put Univision tomorrow. Pop them a couple bucks. 


There, playing at any bar you want.",t2_89aodbyo,Difficult-Dog-3349,0,1648094766.0,0,t1_i1w2tbt,i1w2tbt,True,burnababee,t3_tln9nd,https://www.reddit.com/r/Riverside/comments/tln9nd/anyone_know_a_barrestaurant_that_will_show_the_mx/,Anyone know a bar/restaurant that will show the Mx vs USA game tomorrow?,/r/Riverside/comments/tln9nd/anyone_know_a_barrestaurant_that_will_show_the_mx/i1w2tbt/,1,r/Riverside,0,1
Check out Pain Sugar gallery and Mind & Mill in downtown. There’s a very bustling art scene around here.,t2_sdezj,TechTheTerrible,0,1648089663.0,0,t1_i1vt2o5,i1vt2o5,True,Ecstatic_Assumption5,t3_tlvdss,https://www.reddit.com/r/Riverside/comments/tlvdss/any_artists_critique_groups_collectives/,"Any artists, critique groups, collectives…?",/r/Riverside/comments/tlvdss/any_artists_critique_groups_collectives/i1vt2o5/,5,r/Riverside,0,5
Name?,t2_hsrtifgj,2Gh0st17,0,1648088975.0,0,t1_i1vrnbo,i1vrnbo,False,burnababee,t3_tln9nd,https://www.reddit.com/r/Riverside/comments/tln9nd/anyone_know_a_barrestaurant_that_will_show_the_mx/,Anyone know a bar/restaurant that will show the Mx vs USA game tomorrow?,/r/Riverside/comments/tln9nd/anyone_know_a_barrestaurant_that_will_show_the_mx/i1vrnbo/,1,r/Riverside,0,1
"Well, there is Fairmont Park. I think I've seen people fishing there.",t2_9muily6q,Certain_Chain,0,1648088533.0,0,t1_i1vqq17,i1vqq17,True,idlesails,t3_tlujrx,https://www.reddit.com/r/Riverside/comments/tlujrx/any_lakes_or_places_to_find_fresh_water_fish/,"Any lakes or places to find fresh water fish, fresh water micro fish?",/r/Riverside/comments/tlujrx/any_lakes_or_places_to_find_fresh_water_fish/i1vqq17/,1,r/Riverside,0,1
Actually I’m not sure if mezcal is going to be open. DTE for sure though I been day drinking there lol. Lake Alice as well,t2_2y6avfvg,mgz09,0,1648084374.0,0,t1_i1vhki7,i1vhki7,False,burnababee,t3_tln9nd,https://www.reddit.com/r/Riverside/comments/tln9nd/anyone_know_a_barrestaurant_that_will_show_the_mx/,Anyone know a bar/restaurant that will show the Mx vs USA game tomorrow?,/r/Riverside/comments/tln9nd/anyone_know_a_barrestaurant_that_will_show_the_mx/i1vhki7/,3,r/Riverside,0,3
"I didn’t know DT experiment and Mezcal were open during the day, I thought they were more like clubs. Good to know! Thanks :)",t2_2evp3czh,burnababee,0,1648080933.0,0,t1_i1v9t3x,i1v9t3x,False,burnababee,t3_tln9nd,https://www.reddit.com/r/Riverside/comments/tln9nd/anyone_know_a_barrestaurant_that_will_show_the_mx/,Anyone know a bar/restaurant that will show the Mx vs USA game tomorrow?,/r/Riverside/comments/tln9nd/anyone_know_a_barrestaurant_that_will_show_the_mx/i1v9t3x/,2,r/Riverside,0,2
"I was planning on watching it in downtown riverside. I’m sure they’ll show it at the bars there. Fire Up, Downtown Experiment, Mezcal just to name a few.",t2_2y6avfvg,mgz09,0,1648080802.0,0,t1_i1v9ifu,i1v9ifu,True,burnababee,t3_tln9nd,https://www.reddit.com/r/Riverside/comments/tln9nd/anyone_know_a_barrestaurant_that_will_show_the_mx/,Anyone know a bar/restaurant that will show the Mx vs USA game tomorrow?,/r/Riverside/comments/tln9nd/anyone_know_a_barrestaurant_that_will_show_the_mx/i1v9ifu/,5,r/Riverside,0,5
"Dude, at least put the link in the comments: https://www.eventbrite.com/e/211-careers-fair-tickets-292742279037",t2_4jx6meoz,Rambos_Beard,0,1648060429.0,0,t1_i1tuhaj,i1tuhaj,True,BettrCallBanner,t3_tkdkzt,https://www.reddit.com/r/Riverside/comments/tkdkzt/thursday_march_31st_2022_job_fair/,"Thursday, March 31st, 2022 Job Fair",/r/Riverside/comments/tkdkzt/thursday_march_31st_2022_job_fair/i1tuhaj/,3,r/Riverside,0,3
I have friends in my msw cohort who’ve worked there. It’s one of the poorest counties in the US and their caseloads are massive.,t2_2f5o7nxg,tacohistorian,0,1648051228.0,0,t1_i1t5ry0,i1t5ry0,True,daizee3114,t3_tku0qr,https://www.reddit.com/r/Riverside/comments/tku0qr/does_anyone_work_for_san_bernardino_county_social/,Does anyone work for San Bernardino County? (Social Work),/r/Riverside/comments/tku0qr/does_anyone_work_for_san_bernardino_county_social/i1t5ry0/,3,r/Riverside,0,3
"Lol...someone HAD TO DO IT.

Someone had to bring race into it.  Funny cuz I live by the DPSS on la Sierra and magnolia and all  I mostly see in the parking lot is white people ...when I'm at the gym.  🤷🏻‍♂️🤷🏻‍♂️🐸☕

But yea... I'd imagine whatever you were dealin with in riverside...amplify it by 10. As san bernadino is one of the poorest and most destitute city's not only in the IE. BUT IN THE STATE and country. 

There are massive social economical issues ... that have plagued the city for decades.  Mostly due to the crooked politicans and people who actually ""run"" the city on a political level.

Which of course trickles down into the streets.  Alot of teen pregnancy.. alot of people out of work .. and Alot of people with health issues.  Common sh* t youd see in under developed city's and neighborhoods across America.   So you'll definitely stay busy.


I can't speak to the politics behind the scenes at the actual social services center as I do not know anyone holding a job there .",t2_71uq4b9p,Aggravating_Ad_8123,0,1648050551.0,0,t1_i1t3zlq,i1t3zlq,False,daizee3114,t3_tku0qr,https://www.reddit.com/r/Riverside/comments/tku0qr/does_anyone_work_for_san_bernardino_county_social/,Does anyone work for San Bernardino County? (Social Work),/r/Riverside/comments/tku0qr/does_anyone_work_for_san_bernardino_county_social/i1t3zlq/,10,r/Riverside,0,10
San Bernardino has a lot of people. A lot of those people need help and even more of them have domestic issues. You’ll be dealing with a lot of Hispanic and Black culture not much different from Riverside. Much of the youth out there has problems due to gang and or drug problems. I know the city of San Bernardino holds a few raves and festivals because they’re aren’t strict on them too much alot of underground raves/actual festivals like rolling loud.,t2_10wxbxaf,topwrastler,0,1648046574.0,0,t1_i1stpq0,i1stpq0,False,daizee3114,t3_tku0qr,https://www.reddit.com/r/Riverside/comments/tku0qr/does_anyone_work_for_san_bernardino_county_social/,Does anyone work for San Bernardino County? (Social Work),/r/Riverside/comments/tku0qr/does_anyone_work_for_san_bernardino_county_social/i1stpq0/,3,r/Riverside,0,3
"If it's anything like Riverside County, you'll have leadership that changes every couple years because the Board of Supervisors makes them quit for ""failing to prevent something egregious"" because there is high-turnover for social work staff, which makes it easier to make things fall through the cracks because everyone is overworked. However, if you can set boundaries for yourself, can manage stress well, and like making OT $$$, you can survive.",t2_fow7t,CloudrunnerOne,0,1648046377.0,0,t1_i1st7rq,i1st7rq,True,daizee3114,t3_tku0qr,https://www.reddit.com/r/Riverside/comments/tku0qr/does_anyone_work_for_san_bernardino_county_social/,Does anyone work for San Bernardino County? (Social Work),/r/Riverside/comments/tku0qr/does_anyone_work_for_san_bernardino_county_social/i1st7rq/,5,r/Riverside,0,5
Can you elaborate?,t2_53djgjdp,daizee3114,0,1648045266.0,0,t1_i1sqfw1,i1sqfw1,False,daizee3114,t3_tku0qr,https://www.reddit.com/r/Riverside/comments/tku0qr/does_anyone_work_for_san_bernardino_county_social/,Does anyone work for San Bernardino County? (Social Work),/r/Riverside/comments/tku0qr/does_anyone_work_for_san_bernardino_county_social/i1sqfw1/,1,r/Riverside,0,1
"You'll be busy if you get the job, no question",t2_8x6hrjrl,Kimpynoslived,0,1648044290.0,0,t1_i1so3if,i1so3if,True,daizee3114,t3_tku0qr,https://www.reddit.com/r/Riverside/comments/tku0qr/does_anyone_work_for_san_bernardino_county_social/,Does anyone work for San Bernardino County? (Social Work),/r/Riverside/comments/tku0qr/does_anyone_work_for_san_bernardino_county_social/i1so3if/,4,r/Riverside,0,4
I don't like Spam.,t2_5qngg,Nyckname,0,1648043767.0,0,t1_i1smv9u,i1smv9u,True,[deleted],t3_tksxrb,https://www.reddit.com/r/Riverside/comments/tksxrb/sunset_over_a_river/,Sunset over a river.,/r/Riverside/comments/tksxrb/sunset_over_a_river/i1smv9u/,1,r/Riverside,0,1
NY Pizza on Cranford and University,t2_3xzk6,tomrose,0,1648013897.0,0,t1_i1rflak,i1rflak,True,Pookyj85,t3_thp6vh,https://www.reddit.com/r/Riverside/comments/thp6vh/best_pizza_in_riverside_ca/,"Best pizza in Riverside, CA?",/r/Riverside/comments/thp6vh/best_pizza_in_riverside_ca/i1rflak/,1,r/Riverside,0,1
This is low-key on the border aka In Corona but it's Called Anthony's Pizza.,t2_i6uo2muz,TinyNeff,0,1648008610.0,0,t1_i1r7gtj,i1r7gtj,True,Pookyj85,t3_thp6vh,https://www.reddit.com/r/Riverside/comments/thp6vh/best_pizza_in_riverside_ca/,"Best pizza in Riverside, CA?",/r/Riverside/comments/thp6vh/best_pizza_in_riverside_ca/i1r7gtj/,1,r/Riverside,0,1
Trying to use her position to punish the person that ran against her.  The other two violations were minor.,t2_52x6g6rp,SonoWook,0,1648000587.0,0,t1_i1qrqy0,i1qrqy0,False,tyw7,t3_tizmmi,https://www.reddit.com/r/Riverside/comments/tizmmi/riverside_county_parent_furious_after_teacher/,Riverside County parent furious after teacher leads political chant involving preschool students,/r/Riverside/comments/tizmmi/riverside_county_parent_furious_after_teacher/i1qrqy0/,1,r/Riverside,0,1
"The maître d’ stops by to say hello to McDermott, then notices we don’t have our complimentary Bellinis, and runs off before any of us can stop him. I’m not sure how McDermott knows Alain so well—maybe Cecelia?—and it slightly pisses me off but I decide to even up the score a little bit by showing everyone my new business card. I pull it out of my gazelleskin wallet (Barney’s, $850) and slap it on the table, waiting for reactions.

___

^(*Bot. Ask me how I’m feeling.* |) [^(Opt out)](https://www.reddit.com/message/compose/?to=botrickbateman&subject=Opt%20out)",t2_2uvjpkkl,botrickbateman,0,1648000262.0,0,t1_i1qr1gi,i1qr1gi,False,tyw7,t3_tizmmi,https://www.reddit.com/r/Riverside/comments/tizmmi/riverside_county_parent_furious_after_teacher/,Riverside County parent furious after teacher leads political chant involving preschool students,/r/Riverside/comments/tizmmi/riverside_county_parent_furious_after_teacher/i1qr1gi/,1,r/Riverside,0,1
"Yeah. How dare she try and fasttrack the approval of the union-made logo on city business cards.

Perhaps if the recall organizers focused less on that, her support of a homeless shelter & enforcing COVID protocol at the height of the pandemic (Which were respectively seconded, supported & introduced by Fierro) and more on the Planning Commission violation, they might've had a better case. Instead, they barely got half of the signatures they needed.",t2_6go8s4j6,GareksApprentice,0,1648000251.0,0,t1_i1qr0mp,i1qr0mp,False,tyw7,t3_tizmmi,https://www.reddit.com/r/Riverside/comments/tizmmi/riverside_county_parent_furious_after_teacher/,Riverside County parent furious after teacher leads political chant involving preschool students,/r/Riverside/comments/tizmmi/riverside_county_parent_furious_after_teacher/i1qr0mp/,1,r/Riverside,0,1
I wanna give a shoutout to University Pizza Company at University Village. They opened up a few months ago and I think they're pretty decent. They've also added a bunch of vegetarian & vegan pizzas on the menu,t2_6go8s4j6,GareksApprentice,0,1647998612.0,0,t1_i1qne81,i1qne81,True,Pookyj85,t3_thp6vh,https://www.reddit.com/r/Riverside/comments/thp6vh/best_pizza_in_riverside_ca/,"Best pizza in Riverside, CA?",/r/Riverside/comments/thp6vh/best_pizza_in_riverside_ca/i1qne81/,1,r/Riverside,0,1
Join us at Sandals Church! There are three campuses in Riverside and our Palm Ave campus is smaller and might be just what you’re looking for.,t2_9j1ruc3d,000000tv,0,1647997975.0,0,t1_i1qlzcu,i1qlzcu,True,ibelieveinukraine,t3_tjw3dq,https://www.reddit.com/r/Riverside/comments/tjw3dq/church_recommendations/,Church Recommendations?,/r/Riverside/comments/tjw3dq/church_recommendations/i1qlzcu/,0,r/Riverside,0,0
I’ve heard good things about [Sandals Church](https://sandalschurch.com/) in Riverside. They have some other locations that broadcast the main church and the pastor rotates through all of the churches iirc or you can watch online. It’s led by a “younger” pastor (in his 40s I think) with a decent-sized following and good socializing opportunities if you join a ministry group.,t2_4dlf8lcy,riversiderrrr,0,1647992776.0,0,t1_i1qaf1b,i1qaf1b,True,ibelieveinukraine,t3_tjw3dq,https://www.reddit.com/r/Riverside/comments/tjw3dq/church_recommendations/,Church Recommendations?,/r/Riverside/comments/tjw3dq/church_recommendations/i1qaf1b/,1,r/Riverside,0,1
"If Luxfer Gas Cylinders is there advertising their job again, do not be fooled! They are horrible to work for, and treat their workers like garbage.",t2_cvychjkm,Posessed_Bird,0,1647989386.0,0,t1_i1q2j4a,i1q2j4a,True,BettrCallBanner,t3_tkdkzt,https://www.reddit.com/r/Riverside/comments/tkdkzt/thursday_march_31st_2022_job_fair/,"Thursday, March 31st, 2022 Job Fair",/r/Riverside/comments/tkdkzt/thursday_march_31st_2022_job_fair/i1q2j4a/,4,r/Riverside,0,4
Down to go if I don't find a shuttle driving job soon lol. Class b over here,t2_89aodbyo,Difficult-Dog-3349,0,1647989172.0,0,t1_i1q20gw,i1q20gw,True,BettrCallBanner,t3_tkdkzt,https://www.reddit.com/r/Riverside/comments/tkdkzt/thursday_march_31st_2022_job_fair/,"Thursday, March 31st, 2022 Job Fair",/r/Riverside/comments/tkdkzt/thursday_march_31st_2022_job_fair/i1q20gw/,3,r/Riverside,0,3
Came out great. Feel free to share more if you like. Thanks!,t2_a8l99,BonafideJohnson,0,1647987424.0,0,t1_i1pxt8y,i1pxt8y,True,BigDickPineApple78,t3_tguqi0,https://www.reddit.com/r/Riverside/comments/tguqi0/fairmont_park/,Fairmont park,/r/Riverside/comments/tguqi0/fairmont_park/i1pxt8y/,1,r/Riverside,0,1
Wouldn't want to recall the person for her ethics violations...,t2_52x6g6rp,SonoWook,0,1647986236.0,0,t1_i1puvy7,i1puvy7,False,tyw7,t3_tizmmi,https://www.reddit.com/r/Riverside/comments/tizmmi/riverside_county_parent_furious_after_teacher/,Riverside County parent furious after teacher leads political chant involving preschool students,/r/Riverside/comments/tizmmi/riverside_county_parent_furious_after_teacher/i1puvy7/,1,r/Riverside,0,1
"The Church has bibles available to all who attend.  In fact, if you need a bible - you can just take one home with you, but many people use their phones for an easy access bible as well.  EHCC is really relaxed and focused on fellowship, so t-shirts and jeans are just as common as dresses and dress shirts.  Everyone is really welcoming, so I can't say that no-one will say hello to you, but for the most part, absolutely - you can stroll in, grab a seat wherever you're comfortable, and not say a word to a single soul if that's how you'd like it.  Hope this fits for you.  If you're uncertain - we live stream service on Youtube every Sunday - you could check it out there first if that's more comfortable for ya.",t2_deo0ooo,-Kreep-,0,1647980001.0,0,t1_i1pf4tc,i1pf4tc,False,ibelieveinukraine,t3_tjw3dq,https://www.reddit.com/r/Riverside/comments/tjw3dq/church_recommendations/,Church Recommendations?,/r/Riverside/comments/tjw3dq/church_recommendations/i1pf4tc/,1,r/Riverside,0,1
"If i go, I can just sit quietly in the back, right? I havent been to church since forever. Do I need to bring my own Bible ?",t2_h542asv9,ibelieveinukraine,0,1647976598.0,0,t1_i1p6bey,i1p6bey,False,ibelieveinukraine,t3_tjw3dq,https://www.reddit.com/r/Riverside/comments/tjw3dq/church_recommendations/,Church Recommendations?,/r/Riverside/comments/tjw3dq/church_recommendations/i1p6bey/,1,r/Riverside,0,1
I’m going to view the past Sunday sermons on the YouTube channel and see if it’s a good fit. So far I like the website and what it says. Thank you,t2_h542asv9,ibelieveinukraine,0,1647976538.0,0,t1_i1p65wd,i1p65wd,False,ibelieveinukraine,t3_tjw3dq,https://www.reddit.com/r/Riverside/comments/tjw3dq/church_recommendations/,Church Recommendations?,/r/Riverside/comments/tjw3dq/church_recommendations/i1p65wd/,1,r/Riverside,0,1
