body,author_fullname,author.name,controversiality,created,downs,fullname,id,is_root,link_author,link_id,link_permalink,link_title,permalink,score,subreddit_name_prefixed,total_awards_received,ups
"Hmmm, maybe got hypothermic and disoriented.  Hiking at night alone on a “day hike” to the summit was an unwise decision. I hope he is found soon. It’s cold at elevation.",t2_eyiy7fe6,HombreSinNombre93,0,1647301163.0,0,t1_i0olhpk,i0olhpk,True,lurker_bee,t3_te9cmu,https://www.reddit.com/r/Riverside/comments/te9cmu/crews_searching_for_missing_57yearold_hiker_near/,Crews searching for missing 57-year-old hiker near San Gorgonio Mountain,/r/Riverside/comments/te9cmu/crews_searching_for_missing_57yearold_hiker_near/i0olhpk/,4,r/Riverside,0,4
"The 2021 Impact Report has been released by the Inland Empire Center for Entrepreneurship (IECE) at California State University, San Bernardino (CSUSB), and the data demonstrates that the IECE continues [",t2_qwcjo,Philoveracity_Design,0,1647283696.0,0,t1_i0nfix2,i0nfix2,True,Philoveracity_Design,t3_te4ofh,https://www.reddit.com/r/Riverside/comments/te4ofh/the_inland_empire_center_for_entrepreneurship/,The Inland Empire Center for Entrepreneurship 2021 Impact Report,/r/Riverside/comments/te4ofh/the_inland_empire_center_for_entrepreneurship/i0nfix2/,2,r/Riverside,0,2
SPAM LINK FARMING REPORTED,t2_7ijq7,boing757,0,1647282263.0,0,t1_i0nbsh8,i0nbsh8,True,[deleted],t3_te3a4u,https://www.reddit.com/r/Riverside/comments/te3a4u/landing_on_src_arena_in_microsoft_flight/,Landing on SRC Arena in Microsoft Flight Simulator 2020,/r/Riverside/comments/te3a4u/landing_on_src_arena_in_microsoft_flight/i0nbsh8/,2,r/Riverside,0,2
I don't like Spam.,t2_5qngg,Nyckname,0,1647281744.0,0,t1_i0nafib,i0nafib,True,[deleted],t3_te3a4u,https://www.reddit.com/r/Riverside/comments/te3a4u/landing_on_src_arena_in_microsoft_flight/,Landing on SRC Arena in Microsoft Flight Simulator 2020,/r/Riverside/comments/te3a4u/landing_on_src_arena_in_microsoft_flight/i0nafib/,2,r/Riverside,0,2
"Best sushi near campus, hands down",t2_8zub0wv,Moon_Wrangler,0,1647278185.0,0,t1_i0n16t8,i0n16t8,False,Certain_Chain,t3_tdfgk5,https://www.reddit.com/r/Riverside/comments/tdfgk5/any_good_places_in_town_to_try_sushi/,Any good places in town to try sushi?,/r/Riverside/comments/tdfgk5/any_good_places_in_town_to_try_sushi/i0n16t8/,2,r/Riverside,0,2
Hi I have a great recommendation she does nails from Temecula to riverside she can do them in hemet or Moreno valley ca her Instagram is baddiegee.nailz  her name is Karina,t2_c1xoe1fd,TimTheToolMan1995,0,1647238101.0,0,t1_i0l54a1,i0l54a1,True,supercheriee,t3_tdjrpj,https://www.reddit.com/r/Riverside/comments/tdjrpj/nail_tech_recommendations/,Nail tech recommendations?,/r/Riverside/comments/tdjrpj/nail_tech_recommendations/i0l54a1/,2,r/Riverside,0,2
Same,t2_19o3t45c,tgunn_shreds,0,1647235331.0,0,t1_i0l1a64,i0l1a64,False,Certain_Chain,t3_tdfgk5,https://www.reddit.com/r/Riverside/comments/tdfgk5/any_good_places_in_town_to_try_sushi/,Any good places in town to try sushi?,/r/Riverside/comments/tdfgk5/any_good_places_in_town_to_try_sushi/i0l1a64/,0,r/Riverside,0,0
Came in to recommend them.,t2_106no8,PissdrunxPreme,0,1647233358.0,0,t1_i0kyad4,i0kyad4,False,Certain_Chain,t3_tdfgk5,https://www.reddit.com/r/Riverside/comments/tdfgk5/any_good_places_in_town_to_try_sushi/,Any good places in town to try sushi?,/r/Riverside/comments/tdfgk5/any_good_places_in_town_to_try_sushi/i0kyad4/,2,r/Riverside,0,2
"Sounds good enough to me.

Edit: to be clear, good enough to not patronize.",t2_4z9va,BLOPES,0,1647232666.0,0,t1_i0kx6ik,i0kx6ik,False,Certain_Chain,t3_tdfgk5,https://www.reddit.com/r/Riverside/comments/tdfgk5/any_good_places_in_town_to_try_sushi/,Any good places in town to try sushi?,/r/Riverside/comments/tdfgk5/any_good_places_in_town_to_try_sushi/i0kx6ik/,2,r/Riverside,0,2
"https://www.pe.com/2021/05/21/no-hot-water-foodborne-illness-complaints-restaurant-closures-inspections-in-riverside-county-may-14-20

13 violations in one visit.  Repeat violation for employees not washing hands
Sushi bar coolers not cold enough
Mold in ice machine

Not washing hands is pretty gross to me.",t2_blxeddzh,PhotocopiedProgram,0,1647232325.0,0,t1_i0kwm18,i0kwm18,False,Certain_Chain,t3_tdfgk5,https://www.reddit.com/r/Riverside/comments/tdfgk5/any_good_places_in_town_to_try_sushi/,Any good places in town to try sushi?,/r/Riverside/comments/tdfgk5/any_good_places_in_town_to_try_sushi/i0kwm18/,4,r/Riverside,0,4
"Meh, I went to Makomae in Diamond Bar and they had 5 violatons, but the food was great and I didn't get sick. 

I don't know what the health code violations mean, and how they refer to food safety, so I'd say let's figure that part out before we start excluding restaurants.",t2_4z9va,BLOPES,0,1647231637.0,0,t1_i0kvgqh,i0kvgqh,False,Certain_Chain,t3_tdfgk5,https://www.reddit.com/r/Riverside/comments/tdfgk5/any_good_places_in_town_to_try_sushi/,Any good places in town to try sushi?,/r/Riverside/comments/tdfgk5/any_good_places_in_town_to_try_sushi/i0kvgqh/,-1,r/Riverside,0,-1
Sushi R91 is awesome,t2_6fsei0fk,_Aconn_,0,1647228582.0,0,t1_i0kq22m,i0kq22m,True,Certain_Chain,t3_tdfgk5,https://www.reddit.com/r/Riverside/comments/tdfgk5/any_good_places_in_town_to_try_sushi/,Any good places in town to try sushi?,/r/Riverside/comments/tdfgk5/any_good_places_in_town_to_try_sushi/i0kq22m/,10,r/Riverside,0,10
I've never seen that roundabout before.,t2_19o3t45c,tgunn_shreds,0,1647224339.0,0,t1_i0khsvw,i0khsvw,False,BigDickPineApple78,t3_tcapwz,https://www.reddit.com/r/Riverside/comments/tcapwz/slippin_into_darkness/,Slippin' into Darkness...,/r/Riverside/comments/tcapwz/slippin_into_darkness/i0khsvw/,1,r/Riverside,0,1
That place is good but they have a lot of health code violations so I stopped going.,t2_blxeddzh,PhotocopiedProgram,0,1647223376.0,0,t1_i0kfv1b,i0kfv1b,False,Certain_Chain,t3_tdfgk5,https://www.reddit.com/r/Riverside/comments/tdfgk5/any_good_places_in_town_to_try_sushi/,Any good places in town to try sushi?,/r/Riverside/comments/tdfgk5/any_good_places_in_town_to_try_sushi/i0kfv1b/,3,r/Riverside,0,3
No not spicy. Id say get California roll and tempura roll. Just the green wasabi paste is spicy.,t2_blxeddzh,PhotocopiedProgram,0,1647223313.0,0,t1_i0kfqf3,i0kfqf3,False,Certain_Chain,t3_tdfgk5,https://www.reddit.com/r/Riverside/comments/tdfgk5/any_good_places_in_town_to_try_sushi/,Any good places in town to try sushi?,/r/Riverside/comments/tdfgk5/any_good_places_in_town_to_try_sushi/i0kfqf3/,1,r/Riverside,0,1
Sushi Asahi on McKinley in Corona,t2_ar7iiwim,Mazzoni_,0,1647222451.0,0,t1_i0kdz4h,i0kdz4h,True,Certain_Chain,t3_tdfgk5,https://www.reddit.com/r/Riverside/comments/tdfgk5/any_good_places_in_town_to_try_sushi/,Any good places in town to try sushi?,/r/Riverside/comments/tdfgk5/any_good_places_in_town_to_try_sushi/i0kdz4h/,8,r/Riverside,0,8
Oishii is really good.  I agree you should start with a baked roll. If you go to oishii the Jessica roll is raw fish but very mild.  Might be another good one to start with.,t2_eilp7v8r,No_Abalone3192,0,1647213716.0,0,t1_i0jvj5x,i0jvj5x,True,Certain_Chain,t3_tdfgk5,https://www.reddit.com/r/Riverside/comments/tdfgk5/any_good_places_in_town_to_try_sushi/,Any good places in town to try sushi?,/r/Riverside/comments/tdfgk5/any_good_places_in_town_to_try_sushi/i0jvj5x/,4,r/Riverside,0,4
No but they do add spicy Mayo to some rolls so I would just stay away from that (although it’s not too spicy),t2_h6fymn7t,Ok-Easyonme,0,1647212120.0,0,t1_i0jrzic,i0jrzic,False,Certain_Chain,t3_tdfgk5,https://www.reddit.com/r/Riverside/comments/tdfgk5/any_good_places_in_town_to_try_sushi/,Any good places in town to try sushi?,/r/Riverside/comments/tdfgk5/any_good_places_in_town_to_try_sushi/i0jrzic/,2,r/Riverside,0,2
"is it a girl or a guy? I know you are saying ""him"" or ""he"" but do you know for sure it's a guy?",t2_7as2qf2j,Minimum-Beat-7439,0,1647211538.0,0,t1_i0jqo2v,i0jqo2v,True,[deleted],t3_tdhuqy,https://www.reddit.com/r/Riverside/comments/tdhuqy/found_small_white_dog_near_forestvictoria/,found! small white dog near forest/Victoria,/r/Riverside/comments/tdhuqy/found_small_white_dog_near_forestvictoria/i0jqo2v/,1,r/Riverside,0,1
Good for you to look after the little guy,t2_ay8xzr5v,sparksmj,0,1647211200.0,0,t1_i0jpvxk,i0jpvxk,True,[deleted],t3_tdhuqy,https://www.reddit.com/r/Riverside/comments/tdhuqy/found_small_white_dog_near_forestvictoria/,found! small white dog near forest/Victoria,/r/Riverside/comments/tdhuqy/found_small_white_dog_near_forestvictoria/i0jpvxk/,1,r/Riverside,0,1
"No tag, no chips, and the shelters are closed today. He was running with a large Chihuahua but I couldn't catch him. Any advice or help would be appreciated... Someone recommended I let him loose back there to find his way home but I don't want him to get hit by a car. Unfortunately I can't keep him until tomorrow (when the shelters are open)",t2_jbvz0,egret-nothing,0,1647209326.0,0,t1_i0jli7w,i0jli7w,True,[deleted],t3_tdhuqy,https://www.reddit.com/r/Riverside/comments/tdhuqy/found_small_white_dog_near_forestvictoria/,found! small white dog near forest/Victoria,/r/Riverside/comments/tdhuqy/found_small_white_dog_near_forestvictoria/i0jli7w/,1,r/Riverside,0,1
They're not spicy are they? I can't stand spicy food.,t2_9muily6q,Certain_Chain,0,1647207877.0,0,t1_i0ji3l7,i0ji3l7,False,Certain_Chain,t3_tdfgk5,https://www.reddit.com/r/Riverside/comments/tdfgk5/any_good_places_in_town_to_try_sushi/,Any good places in town to try sushi?,/r/Riverside/comments/tdfgk5/any_good_places_in_town_to_try_sushi/i0ji3l7/,1,r/Riverside,0,1
"Big tuna in Riverwalk 10/10

I’d recommend any tempura or baked roll for your first time trying sushi too",t2_h6fymn7t,Ok-Easyonme,0,1647207638.0,0,t1_i0jhjjx,i0jhjjx,True,Certain_Chain,t3_tdfgk5,https://www.reddit.com/r/Riverside/comments/tdfgk5/any_good_places_in_town_to_try_sushi/,Any good places in town to try sushi?,/r/Riverside/comments/tdfgk5/any_good_places_in_town_to_try_sushi/i0jhjjx/,3,r/Riverside,0,3
"It is time to pressure our government to focus and prioritize on the [Riverside PACT Project](https://storymaps.arcgis.com/stories/bf82460d87ac44aeafaa3749c4afb60f) which is a citywide plan to make our streets safer for pedestrians and bicycling.

The lack of protected bike lanes without a buffered curb or even bollards in Riverside and in this project is disappointing and people in Riverside should voice this.",t2_n6fgz,damnitruben,0,1647201694.0,0,t1_i0j3rn5,i0j3rn5,True,1138luv,t3_t9tezn,https://www.reddit.com/r/Riverside/comments/t9tezn/teen_riding_his_bicycle_killed_in_riverside_main/,Teen riding his bicycle killed in Riverside Main St hit-and-run,/r/Riverside/comments/t9tezn/teen_riding_his_bicycle_killed_in_riverside_main/i0j3rn5/,1,r/Riverside,0,1
"If you want safer streets, we should be pressuring our government to prioritize and focus on the [Riverside PACT Project](https://storymaps.arcgis.com/stories/bf82460d87ac44aeafaa3749c4afb60f) which is a plan to make our streets safer for pedestrians and bicycling.",t2_n6fgz,damnitruben,0,1647200394.0,0,t1_i0j0t7v,i0j0t7v,False,1138luv,t3_t9tezn,https://www.reddit.com/r/Riverside/comments/t9tezn/teen_riding_his_bicycle_killed_in_riverside_main/,Teen riding his bicycle killed in Riverside Main St hit-and-run,/r/Riverside/comments/t9tezn/teen_riding_his_bicycle_killed_in_riverside_main/i0j0t7v/,1,r/Riverside,0,1
"This Glean was supported by Tree People and Riverside Food Rescue which is supported by the Riverside Food Co-op. We had about 40 volunteers and picked 100 trees. We ended up filling all of our crates, emptied them, and filled them again. The food goes to local food banks and charities that distribute it.

If you are interested in volunteering your labor or your fruit reach out to Riversidefoodrescue@gmail.com

If you want to work with Tree People to help plant trees in Eastside visit https://www.treepeople.org/riverside/
If you live in Eastside and are interested in having a tree reach out as well.

Updated amount is 4,680 pounds",t2_b9ggj4m3,StormAutomatic,0,1647197109.0,0,t1_i0it61c,i0it61c,True,StormAutomatic,t3_tdc3eq,https://www.reddit.com/r/Riverside/comments/tdc3eq/we_picked_approximately_3500_pounds_of_citrus/,"We picked approximately 3,500 pounds of citrus",/r/Riverside/comments/tdc3eq/we_picked_approximately_3500_pounds_of_citrus/i0it61c/,8,r/Riverside,0,8
Glorious! What an amazing glean! <3,t2_13bjkb,thedykeichotline,0,1647195242.0,0,t1_i0ioott,i0ioott,True,StormAutomatic,t3_tdc3eq,https://www.reddit.com/r/Riverside/comments/tdc3eq/we_picked_approximately_3500_pounds_of_citrus/,"We picked approximately 3,500 pounds of citrus",/r/Riverside/comments/tdc3eq/we_picked_approximately_3500_pounds_of_citrus/i0ioott/,3,r/Riverside,0,3
"It was very successful! We gathered over 3500 pounds across nearly 100 trees and had about 40 volunteers. A lot of hands made quick work.

I'll post the next one or you can email and ask to hear about the next. Not everyone can make every Glean and that's fine, the more volunteers we have the more we can pick.",t2_b9ggj4m3,StormAutomatic,0,1647193163.0,0,t1_i0ijklo,i0ijklo,True,StormAutomatic,t3_sy9vdk,https://www.reddit.com/r/Riverside/comments/sy9vdk/first_glean_of_2022/,First Glean of 2022,/r/Riverside/comments/sy9vdk/first_glean_of_2022/i0ijklo/,1,r/Riverside,0,1
"I usually get fish from Sprouts, they usually have something good.",t2_57f96zm6,gohuskys,0,1647151300.0,0,t1_i0gnwav,i0gnwav,True,oumiya,t3_tcwh1s,https://www.reddit.com/r/Riverside/comments/tcwh1s/fresh_fish_market/,Fresh fish market,/r/Riverside/comments/tcwh1s/fresh_fish_market/i0gnwav/,2,r/Riverside,0,2
The Market Broiler had a fish market inside of it the last time i was there. Right across from the plaza.,t2_8t376,Flamethrower75,0,1647149761.0,0,t1_i0gljlw,i0gljlw,True,oumiya,t3_tcwh1s,https://www.reddit.com/r/Riverside/comments/tcwh1s/fresh_fish_market/,Fresh fish market,/r/Riverside/comments/tcwh1s/fresh_fish_market/i0gljlw/,3,r/Riverside,0,3
Check out 99 Ranch market at the Riverside/Corona border off McKinley exit,t2_cci15isb,Rude_Warning_5341,0,1647141750.0,0,t1_i0g7tku,i0g7tku,True,oumiya,t3_tcwh1s,https://www.reddit.com/r/Riverside/comments/tcwh1s/fresh_fish_market/,Fresh fish market,/r/Riverside/comments/tcwh1s/fresh_fish_market/i0g7tku/,5,r/Riverside,0,5
I’m a software engineer in Riverside as well. Pleased to meet you. Let’s keep in touch.,t2_jmcb7r7l,Royal_Midnight_5453,0,1647139963.0,0,t1_i0g4ipm,i0g4ipm,True,Mismatched1,t3_suh1d8,https://www.reddit.com/r/Riverside/comments/suh1d8/jobs/,Jobs,/r/Riverside/comments/suh1d8/jobs/i0g4ipm/,1,r/Riverside,0,1
"Mission Inn is nice, but very pricy. And once you've completed your treatment, there are limited extras. Glen Ivy is in South Corona. It's more of a true getaway spa, one that you can spend several hours at, all included in the price of admission. (Pools, saunas, mineral/mud baths, steam caves, etc.) I would highly recommend it, for the experience you've said you want them to have.",t2_cu2dvvlc,SparklesIB,0,1647117623.0,0,t1_i0eu905,i0eu905,True,introductionvert,t3_tcjxwm,https://www.reddit.com/r/Riverside/comments/tcjxwm/places_in_riverside_to_treat_my_mom_grandma_for_a/,Places in Riverside to treat my mom & grandma for a spa day,/r/Riverside/comments/tcjxwm/places_in_riverside_to_treat_my_mom_grandma_for_a/i0eu905/,9,r/Riverside,0,9
lol definitely mission inn if you’re ok with spending a little more than a basic massage,t2_1lluakj0,SpacieCowboy,0,1647115584.0,0,t1_i0eppju,i0eppju,True,introductionvert,t3_tcjxwm,https://www.reddit.com/r/Riverside/comments/tcjxwm/places_in_riverside_to_treat_my_mom_grandma_for_a/,Places in Riverside to treat my mom & grandma for a spa day,/r/Riverside/comments/tcjxwm/places_in_riverside_to_treat_my_mom_grandma_for_a/i0eppju/,2,r/Riverside,0,2
Glen Ivy.,t2_98vjn,skyblueandblack,0,1647112699.0,0,t1_i0ej25i,i0ej25i,True,introductionvert,t3_tcjxwm,https://www.reddit.com/r/Riverside/comments/tcjxwm/places_in_riverside_to_treat_my_mom_grandma_for_a/,Places in Riverside to treat my mom & grandma for a spa day,/r/Riverside/comments/tcjxwm/places_in_riverside_to_treat_my_mom_grandma_for_a/i0ej25i/,7,r/Riverside,0,7
Mission inn,t2_bcqddivy,Historical-Oil3041,0,1647105578.0,0,t1_i0e116s,i0e116s,True,introductionvert,t3_tcjxwm,https://www.reddit.com/r/Riverside/comments/tcjxwm/places_in_riverside_to_treat_my_mom_grandma_for_a/,Places in Riverside to treat my mom & grandma for a spa day,/r/Riverside/comments/tcjxwm/places_in_riverside_to_treat_my_mom_grandma_for_a/i0e116s/,2,r/Riverside,0,2
"Massage green, massage envy, there’s a Groupon for masssages out in NorCo and Corona for cheap too",t2_10wxbxaf,topwrastler,0,1647105434.0,0,t1_i0e0m2j,i0e0m2j,True,introductionvert,t3_tcjxwm,https://www.reddit.com/r/Riverside/comments/tcjxwm/places_in_riverside_to_treat_my_mom_grandma_for_a/,Places in Riverside to treat my mom & grandma for a spa day,/r/Riverside/comments/tcjxwm/places_in_riverside_to_treat_my_mom_grandma_for_a/i0e0m2j/,1,r/Riverside,0,1
Thank you,t2_5pa07ao9,droogie20,0,1647103938.0,0,t1_i0dwr2y,i0dwr2y,False,StormAutomatic,t3_tb2vyp,https://www.reddit.com/r/Riverside/comments/tb2vyp/bring_what_you_can_take_what_you_need/,"Bring what you can, take what you need.",/r/Riverside/comments/tb2vyp/bring_what_you_can_take_what_you_need/i0dwr2y/,1,r/Riverside,0,1
Segwick and 11th street,t2_iizg3ncy,BigDickPineApple78,0,1647102665.0,0,t1_i0dtpli,i0dtpli,False,BigDickPineApple78,t3_tcapwz,https://www.reddit.com/r/Riverside/comments/tcapwz/slippin_into_darkness/,Slippin' into Darkness...,/r/Riverside/comments/tcapwz/slippin_into_darkness/i0dtpli/,3,r/Riverside,0,3
Where is this?,t2_19o3t45c,tgunn_shreds,0,1647100344.0,0,t1_i0doczu,i0doczu,True,BigDickPineApple78,t3_tcapwz,https://www.reddit.com/r/Riverside/comments/tcapwz/slippin_into_darkness/,Slippin' into Darkness...,/r/Riverside/comments/tcapwz/slippin_into_darkness/i0doczu/,1,r/Riverside,0,1
"You asked cheapest. There’s a government program that gets you basic service for $20/mo. It’s offered by most of the major phone and cable companies. There are guidelines for qualification but they’re not extremely stringent. That would be something to look into.

T-mobile Home Internet Service is $50/mo with unlimited data. My download speeds in Riverside varied between 150-300. I think it’s a bargain. Riverside is big, ymmv depending where you are in town. You can check on their website whether it’s available at your address.",t2_i9icty3,bblickle,0,1647099188.0,0,t1_i0dlrl0,i0dlrl0,True,Available-Grass-6799,t3_tcc2ks,https://www.reddit.com/r/Riverside/comments/tcc2ks/what_is_the_cheapest_home_wifi_company_in/,What is the cheapest home Wi-Fi company in riverside? Thanks in advance!!,/r/Riverside/comments/tcc2ks/what_is_the_cheapest_home_wifi_company_in/i0dlrl0/,1,r/Riverside,0,1
"Not just the city, when are we going to institute collision safety standards for when cars hit bicyclists and pedestrians.",t2_b9ggj4m3,StormAutomatic,0,1647046200.0,0,t1_i0ba7wx,i0ba7wx,False,1138luv,t3_t9tezn,https://www.reddit.com/r/Riverside/comments/t9tezn/teen_riding_his_bicycle_killed_in_riverside_main/,Teen riding his bicycle killed in Riverside Main St hit-and-run,/r/Riverside/comments/t9tezn/teen_riding_his_bicycle_killed_in_riverside_main/i0ba7wx/,1,r/Riverside,0,1
Dont post your google searches here. Keep posts related to Riverside California and only Riverside California.,t2_cx10i,WoxicFangel,0,1647042246.0,0,t1_i0b2000,i0b2000,True,bored656,t3_tai3jk,https://www.reddit.com/r/Riverside/comments/tai3jk/mycology_resources/,mycology resources,/r/Riverside/comments/tai3jk/mycology_resources/i0b2000/,1,r/Riverside,0,1
🚁,t2_5qngg,Nyckname,0,1647022407.0,0,t1_i09pu34,i09pu34,True,helis_database,t3_tbvga7,https://www.reddit.com/r/Riverside/comments/tbvga7/city_of_riverside_police_dept_changing_brand_of/,City of Riverside Police Dept changing brand of helicopter after 42 years,/r/Riverside/comments/tbvga7/city_of_riverside_police_dept_changing_brand_of/i09pu34/,4,r/Riverside,0,4
"Good idea, I can't edit it but I'll do that with next months flier.",t2_b9ggj4m3,StormAutomatic,0,1647008688.0,0,t1_i08rd22,i08rd22,False,StormAutomatic,t3_tb2vyp,https://www.reddit.com/r/Riverside/comments/tb2vyp/bring_what_you_can_take_what_you_need/,"Bring what you can, take what you need.",/r/Riverside/comments/tb2vyp/bring_what_you_can_take_what_you_need/i08rd22/,1,r/Riverside,0,1
Cooooooool. Thanks.,t2_e8l2g1e6,bored656,0,1646987851.0,0,t1_i07wbdc,i07wbdc,False,bored656,t3_tai3jk,https://www.reddit.com/r/Riverside/comments/tai3jk/mycology_resources/,mycology resources,/r/Riverside/comments/tai3jk/mycology_resources/i07wbdc/,1,r/Riverside,0,1
"Would be more useful if you made a better title (add ""people's free market""), so people thinking back on this would be able to find it.",t2_5s6wo,MaximilianKohler,0,1646981212.0,0,t1_i07njk7,i07njk7,True,StormAutomatic,t3_tb2vyp,https://www.reddit.com/r/Riverside/comments/tb2vyp/bring_what_you_can_take_what_you_need/,"Bring what you can, take what you need.",/r/Riverside/comments/tb2vyp/bring_what_you_can_take_what_you_need/i07njk7/,2,r/Riverside,0,2
@lashedpretty_,t2_9amkn1u5,Sad_Statistician2390,0,1646978836.0,0,t1_i07k1lk,i07k1lk,True,burnababee,t3_tb2kia,https://www.reddit.com/r/Riverside/comments/tb2kia/lash_tech_recommendations_please/,Lash tech recommendations please!,/r/Riverside/comments/tb2kia/lash_tech_recommendations_please/i07k1lk/,1,r/Riverside,0,1
"Nothing gets sold, the rule is everything is free. As long as the clothes are seasonally appropriate I wouldn't be surprised if one of the orgs is willing to add them to their collection for distribution. I can't speak for them though.",t2_b9ggj4m3,StormAutomatic,0,1646961055.0,0,t1_i06lbsg,i06lbsg,False,StormAutomatic,t3_tb2vyp,https://www.reddit.com/r/Riverside/comments/tb2vyp/bring_what_you_can_take_what_you_need/,"Bring what you can, take what you need.",/r/Riverside/comments/tb2vyp/bring_what_you_can_take_what_you_need/i06lbsg/,3,r/Riverside,0,3
I have a box of good clothes to donate-nothing wrong with them but I got juicy-Can I bring them for donation or is this more of a marketplace for selling the items?,t2_5pa07ao9,droogie20,0,1646960893.0,0,t1_i06kz3m,i06kz3m,True,StormAutomatic,t3_tb2vyp,https://www.reddit.com/r/Riverside/comments/tb2vyp/bring_what_you_can_take_what_you_need/,"Bring what you can, take what you need.",/r/Riverside/comments/tb2vyp/bring_what_you_can_take_what_you_need/i06kz3m/,1,r/Riverside,0,1
Unite & Win Tattoo in Riverside is the move for traditional style tattoos!,t2_6yvtl00q,whiterhinoactivities,0,1646950668.0,0,t1_i05xsrq,i05xsrq,True,bepner,t3_sr8x45,https://www.reddit.com/r/Riverside/comments/sr8x45/any_tattoo_shops_in_the_area_that_have_well/,Any tattoo shops in the area that have well priced solid artist choice tats?,/r/Riverside/comments/sr8x45/any_tattoo_shops_in_the_area_that_have_well/i05xsrq/,2,r/Riverside,0,2
Wild forging using the app inaturalist its really cool. There’s some banded mottlegill near ucr area and the botanical gardens usually has a few growing. Watch some mycology videos on YouTube people record lectures and stuff and it’s pretty cool to see. Legality wise I believe you can buy spores off many websites legally for research purposes. I know some stores sell mushroom growing kits for oyster mushrooms like at target and stuff. You can also look on Etsy for spores,t2_10wxbxaf,topwrastler,0,1646946150.0,0,t1_i05mhie,i05mhie,True,bored656,t3_tai3jk,https://www.reddit.com/r/Riverside/comments/tai3jk/mycology_resources/,mycology resources,/r/Riverside/comments/tai3jk/mycology_resources/i05mhie/,2,r/Riverside,0,2
@highstandardslashes on IG,t2_kfw40kmo,Berimbully,0,1646939568.0,0,t1_i055qwp,i055qwp,True,burnababee,t3_tb2kia,https://www.reddit.com/r/Riverside/comments/tb2kia/lash_tech_recommendations_please/,Lash tech recommendations please!,/r/Riverside/comments/tb2kia/lash_tech_recommendations_please/i055qwp/,1,r/Riverside,0,1
">if you want to coordinate with the other groups handing out hygiene

More likely this, thank you. I don't have time to distribute, but I do want to contribute.",t2_ddal8ki0,tree24hugger,0,1646933117.0,0,t1_i04ox1x,i04ox1x,False,StormAutomatic,t3_tb2vyp,https://www.reddit.com/r/Riverside/comments/tb2vyp/bring_what_you_can_take_what_you_need/,"Bring what you can, take what you need.",/r/Riverside/comments/tb2vyp/bring_what_you_can_take_what_you_need/i04ox1x/,3,r/Riverside,0,3
"If you want to hand them out on your own, grab bags, but if you want to coordinate with the other groups handing out hygiene probably boxes with some bags to fill or reach out to them. I believe Communt(IE) gives out hygiene kits.

Orgs:
Communit(IE): communit_ie on Instagram

Punks in the Park: https://linktr.ee/Trashcanphobia

Riverside CAT-911: https://linktr.ee/riversidecat911

Cuur 1881: https://uuchurchofriverside.org/justice/cuur/

SJH mutual aid: sjhmutualaid on Instagram

Riverside Food Not Bombs: riverside_food_not_bombs on Instagram",t2_b9ggj4m3,StormAutomatic,0,1646932940.0,0,t1_i04ogj6,i04ogj6,False,StormAutomatic,t3_tb2vyp,https://www.reddit.com/r/Riverside/comments/tb2vyp/bring_what_you_can_take_what_you_need/,"Bring what you can, take what you need.",/r/Riverside/comments/tb2vyp/bring_what_you_can_take_what_you_need/i04ogj6/,7,r/Riverside,0,7
"So if I were to bring several hygiene related products, would it be best to put together a grab-bag with one of each thing in it? Or would it be better to have boxes of each item, for individual taking? I'm talking about tooth brushes, toothpaste, moist towelettes, TP, etc.",t2_ddal8ki0,tree24hugger,0,1646932071.0,0,t1_i04m6sm,i04m6sm,True,StormAutomatic,t3_tb2vyp,https://www.reddit.com/r/Riverside/comments/tb2vyp/bring_what_you_can_take_what_you_need/,"Bring what you can, take what you need.",/r/Riverside/comments/tb2vyp/bring_what_you_can_take_what_you_need/i04m6sm/,6,r/Riverside,0,6
