body,author_fullname,author.name,controversiality,created,downs,fullname,id,is_root,link_author,link_id,link_permalink,link_title,permalink,score,subreddit_name_prefixed,total_awards_received,ups
I’m in Honoka’a I might be able to help you out,t2_aabpo927,Ok_Pay5513,0,1648275797.0,0,t1_i25xxwe,i25xxwe,False,talaxia,t3_toct87,https://www.reddit.com/r/BigIsland/comments/toct87/anybody_know_a_reliable_house_pet_sitter_who/,Anybody know a reliable house / pet sitter who might be available for five days in the 2nd half of April?,/r/BigIsland/comments/toct87/anybody_know_a_reliable_house_pet_sitter_who/i25xxwe/,1,r/BigIsland,0,1
Try care.com,t2_a4mfd7k4,lalehzar,0,1648271909.0,0,t1_i25stap,i25stap,True,talaxia,t3_toct87,https://www.reddit.com/r/BigIsland/comments/toct87/anybody_know_a_reliable_house_pet_sitter_who/,Anybody know a reliable house / pet sitter who might be available for five days in the 2nd half of April?,/r/BigIsland/comments/toct87/anybody_know_a_reliable_house_pet_sitter_who/i25stap/,1,r/BigIsland,0,1
"If the best jab at the tourists you can make is some stuff you had to make up, maybe the tourists aren't the problem?",t2_l5ccnmtk,poidog96720,0,1648271838.0,0,t1_i25spox,i25spox,True,echiflA,t3_tnp5gx,https://www.reddit.com/r/BigIsland/comments/tnp5gx/wheres_my_complimentary_lei_and_drink_that_comes/,“Where’s my complimentary lei and drink that comes in a coconut?”,/r/BigIsland/comments/tnp5gx/wheres_my_complimentary_lei_and_drink_that_comes/i25spox/,-1,r/BigIsland,0,-1
I am a visitor and would love a separate place for questions from visitors. We love the big island but do not want to disrupt this sub,t2_48c2t,TheFudge,0,1648270142.0,0,t1_i25q83q,i25q83q,True,UncleCatDad,t3_tmtwqy,https://www.reddit.com/r/BigIsland/comments/tmtwqy/tourist_recommendation_posts/,Tourist recommendation posts,/r/BigIsland/comments/tmtwqy/tourist_recommendation_posts/i25q83q/,2,r/BigIsland,0,2
"Have you tried Henry from A Bark Above?  He's up around paauilo mauka (pretty close to Hawaiian Vanilla).

Haven't needed his services yet, but he came as a recommendation from a friend who has and raved about him",t2_otogz,siskja,0,1648268661.0,0,t1_i25nuvf,i25nuvf,True,talaxia,t3_toct87,https://www.reddit.com/r/BigIsland/comments/toct87/anybody_know_a_reliable_house_pet_sitter_who/,Anybody know a reliable house / pet sitter who might be available for five days in the 2nd half of April?,/r/BigIsland/comments/toct87/anybody_know_a_reliable_house_pet_sitter_who/i25nuvf/,1,r/BigIsland,0,1
You need it explained further?  They asked a judge in 2021/2022 to delay the release of the vaccine studies for 75 years. He said no.,t2_fuexj,Bikesandkittens,0,1648267598.0,0,t1_i25m2jw,i25m2jw,False,Aggravating_Analyst,t3_tct8ik,https://www.reddit.com/r/BigIsland/comments/tct8ik/big_island_residents_when_the_mask_mandate_goes/,"Big Island residents, when the mask mandate goes away on the 26th, are you hopeful that private businesses will continue to require masks?",/r/BigIsland/comments/tct8ik/big_island_residents_when_the_mask_mandate_goes/i25m2jw/,1,r/BigIsland,0,1
around Honokaa,t2_3d016,talaxia,0,1648267306.0,0,t1_i25lkd0,i25lkd0,False,talaxia,t3_toct87,https://www.reddit.com/r/BigIsland/comments/toct87/anybody_know_a_reliable_house_pet_sitter_who/,Anybody know a reliable house / pet sitter who might be available for five days in the 2nd half of April?,/r/BigIsland/comments/toct87/anybody_know_a_reliable_house_pet_sitter_who/i25lkd0/,1,r/BigIsland,0,1
"75 years? They kept the side effects of a vaccine that emerged in 2019, a secret for 75 whole years, huh? That's talent.

Also, you're citing sigiq as your source? How about Weekly World News while you're at it? I'm sure we would all like to know if Batboy had difficulties with the vaccine!",t2_5gnmh,Gigglemonkey,0,1648267287.0,0,t1_i25lj65,i25lj65,False,Aggravating_Analyst,t3_tct8ik,https://www.reddit.com/r/BigIsland/comments/tct8ik/big_island_residents_when_the_mask_mandate_goes/,"Big Island residents, when the mask mandate goes away on the 26th, are you hopeful that private businesses will continue to require masks?",/r/BigIsland/comments/tct8ik/big_island_residents_when_the_mask_mandate_goes/i25lj65/,1,r/BigIsland,0,1
You can go to the court building in Hilo and talk to the people there.  Lady in the office took me off the list last year; she was accommodating.,t2_16uqw4,Markdd8,0,1648267214.0,0,t1_i25lejw,i25lejw,True,Disgustinghotdog,t3_tmt1cv,https://www.reddit.com/r/BigIsland/comments/tmt1cv/jury_duty_living_hilo_side_but_kona_division/,Jury duty living Hilo side but Kona division summons?,/r/BigIsland/comments/tmt1cv/jury_duty_living_hilo_side_but_kona_division/i25lejw/,2,r/BigIsland,0,2
"https://www.yahoo.com/video/cdc-reports-fewer-covid-19-202913219.html

You should be far more concerned about the side effects on children. Keep in mind the vaccine is still classified as experimental. 

https://sigiq.com/2022/03/13/pfizer-covid-19-vaccine-side-effects-confidential/

Pfizer tried to keep the list of side effects hidden for 75 years, but the courts told them they had to release it. When you see the list you’ll know why they tried to suppress it.",t2_fuexj,Bikesandkittens,0,1648265662.0,0,t1_i25inl5,i25inl5,False,Aggravating_Analyst,t3_tct8ik,https://www.reddit.com/r/BigIsland/comments/tct8ik/big_island_residents_when_the_mask_mandate_goes/,"Big Island residents, when the mask mandate goes away on the 26th, are you hopeful that private businesses will continue to require masks?",/r/BigIsland/comments/tct8ik/big_island_residents_when_the_mask_mandate_goes/i25inl5/,1,r/BigIsland,0,1
Lol looking on Reddit will land you with the same chance of horror.,t2_p4a9n,PARADlSE,0,1648264559.0,0,t1_i25go47,i25go47,False,talaxia,t3_toct87,https://www.reddit.com/r/BigIsland/comments/toct87/anybody_know_a_reliable_house_pet_sitter_who/,Anybody know a reliable house / pet sitter who might be available for five days in the 2nd half of April?,/r/BigIsland/comments/toct87/anybody_know_a_reliable_house_pet_sitter_who/i25go47/,10,r/BigIsland,0,10
How far from Hilo? I might know someone.,t2_8mzub,WXGirl83,0,1648263090.0,0,t1_i25dycl,i25dycl,True,talaxia,t3_toct87,https://www.reddit.com/r/BigIsland/comments/toct87/anybody_know_a_reliable_house_pet_sitter_who/,Anybody know a reliable house / pet sitter who might be available for five days in the 2nd half of April?,/r/BigIsland/comments/toct87/anybody_know_a_reliable_house_pet_sitter_who/i25dycl/,1,r/BigIsland,0,1
I've heard so many horror stories,t2_3d016,talaxia,0,1648261242.0,0,t1_i25aecw,i25aecw,False,talaxia,t3_toct87,https://www.reddit.com/r/BigIsland/comments/toct87/anybody_know_a_reliable_house_pet_sitter_who/,Anybody know a reliable house / pet sitter who might be available for five days in the 2nd half of April?,/r/BigIsland/comments/toct87/anybody_know_a_reliable_house_pet_sitter_who/i25aecw/,2,r/BigIsland,0,2
Try the app rover,t2_c2tfyygo,skimbelruski,0,1648260780.0,0,t1_i259how,i259how,True,talaxia,t3_toct87,https://www.reddit.com/r/BigIsland/comments/toct87/anybody_know_a_reliable_house_pet_sitter_who/,Anybody know a reliable house / pet sitter who might be available for five days in the 2nd half of April?,/r/BigIsland/comments/toct87/anybody_know_a_reliable_house_pet_sitter_who/i259how/,2,r/BigIsland,0,2
Also cheers tapas bar is awesome just went affordable and great pupus!,t2_2e0xecx4,fuckkcross,0,1648253394.0,0,t1_i24uap3,i24uap3,False,yesdog13,t3_tgum6r,https://www.reddit.com/r/BigIsland/comments/tgum6r/costco_trip_to_kona_from_puna_lunch_suggests/,"Costco trip to Kona from Puna, lunch suggests please",/r/BigIsland/comments/tgum6r/costco_trip_to_kona_from_puna_lunch_suggests/i24uap3/,1,r/BigIsland,0,1
"Whoa - winding up in Wahiawa, Waimanalo or some-ting?",t2_luv6s,DDM11,0,1648249015.0,0,t1_i24ku3s,i24ku3s,True,echiflA,t3_tnp5gx,https://www.reddit.com/r/BigIsland/comments/tnp5gx/wheres_my_complimentary_lei_and_drink_that_comes/,“Where’s my complimentary lei and drink that comes in a coconut?”,/r/BigIsland/comments/tnp5gx/wheres_my_complimentary_lei_and_drink_that_comes/i24ku3s/,2,r/BigIsland,0,2
"Oh, my mistake. I thought you meant Waipiʻo Valley. The hike across the gap looks nice though I probably couldn't do the 800 foot climb. Please post your story & photos when you do.",t2_4mvpu,cutelyaware,0,1648247561.0,0,t1_i24hkhe,i24hkhe,False,LaScoundrelle,t3_tjwa8q,https://www.reddit.com/r/BigIsland/comments/tjwa8q/i_read_in_old_blogs_it_should_be_possible_to_take/,"I read in old blogs it should be possible to take a boat to Waimanu Valley. Does anyone know if it's still possible to do this, and how to arrange it?",/r/BigIsland/comments/tjwa8q/i_read_in_old_blogs_it_should_be_possible_to_take/i24hkhe/,1,r/BigIsland,0,1
Nice,t2_97qz77jm,Cute_Syrup_5263,0,1648245441.0,0,t1_i24crmh,i24crmh,True,rbronzan,t3_t1rlx4,https://www.reddit.com/r/BigIsland/comments/t1rlx4/the_sunset_over_kona_tonight_was/,The sunset over Kona tonight was 🔥,/r/BigIsland/comments/t1rlx4/the_sunset_over_kona_tonight_was/i24crmh/,1,r/BigIsland,0,1
Mahalo,t2_7e0nix5l,Mindless_Poet6371,0,1648243521.0,0,t1_i248c66,i248c66,False,Mindless_Poet6371,t3_tnxw0p,https://www.reddit.com/r/BigIsland/comments/tnxw0p/helicopter_kona_side_above_aiopio_fishpond/,helicopter Kona side? above Aiopio Fishpond?,/r/BigIsland/comments/tnxw0p/helicopter_kona_side_above_aiopio_fishpond/i248c66/,0,r/BigIsland,0,0
"Removing cut keawe, they do this often.  It’s a national park so the Feds have the money to do this instead of loading it and trucking it out which would disturb the park environment.",t2_3mhn7buc,jthawaii,0,1648243304.0,0,t1_i247trl,i247trl,True,Mindless_Poet6371,t3_tnxw0p,https://www.reddit.com/r/BigIsland/comments/tnxw0p/helicopter_kona_side_above_aiopio_fishpond/,helicopter Kona side? above Aiopio Fishpond?,/r/BigIsland/comments/tnxw0p/helicopter_kona_side_above_aiopio_fishpond/i247trl/,7,r/BigIsland,0,7
"I was much more interested in hiking through the jungle, myself. Did you hike down there or how did you get there?",t2_8pqqdmp5,LaScoundrelle,0,1648239144.0,0,t1_i23xri0,i23xri0,False,LaScoundrelle,t3_tjwa8q,https://www.reddit.com/r/BigIsland/comments/tjwa8q/i_read_in_old_blogs_it_should_be_possible_to_take/,"I read in old blogs it should be possible to take a boat to Waimanu Valley. Does anyone know if it's still possible to do this, and how to arrange it?",/r/BigIsland/comments/tjwa8q/i_read_in_old_blogs_it_should_be_possible_to_take/i23xri0/,2,r/BigIsland,0,2
"Just circling, but holding something on long tether. Any ideas what's up?",t2_7e0nix5l,Mindless_Poet6371,0,1648238953.0,0,t1_i23xajs,i23xajs,True,Mindless_Poet6371,t3_tnxw0p,https://www.reddit.com/r/BigIsland/comments/tnxw0p/helicopter_kona_side_above_aiopio_fishpond/,helicopter Kona side? above Aiopio Fishpond?,/r/BigIsland/comments/tnxw0p/helicopter_kona_side_above_aiopio_fishpond/i23xajs/,0,r/BigIsland,0,0
"I agree to some extent, an explanatory statement from the vets would have been nice.   Better still would have been for the new owners to step up and deal with the situation, instead of apparently leaving it for the poor stunned receptionists to try and deal with!",t2_g1dq25cc,JRyuu,0,1648236488.0,0,t1_i23r78f,i23r78f,True,JRyuu,t3_te5hun,https://www.reddit.com/r/BigIsland/comments/te5hun/no_aloha_vets_available_until_april/,No Aloha vets available until April!?,/r/BigIsland/comments/te5hun/no_aloha_vets_available_until_april/i23r78f/,1,r/BigIsland,0,1
"We use a speargun, put your catch in a goody bag hang the bag off an inner tube, if a shark comes let the bag go, don’t fight a shark for food.",t2_1ydkqmfj,oldcarnutjag,0,1648234207.0,0,t1_i23lmeh,i23lmeh,True,NotaOstrich,t3_tng0vu,https://www.reddit.com/r/BigIsland/comments/tng0vu/hey_everybody_new_to_reddit_a_few_friends_and_i/,Hey everybody. New to Reddit. A few friends and I are going to Hawaii for the first time this summer and I was wondering if there were any shark cage diving on the Big Island. I’ve looked but haven’t found any. Thanks,/r/BigIsland/comments/tng0vu/hey_everybody_new_to_reddit_a_few_friends_and_i/i23lmeh/,0,r/BigIsland,0,0
"unfortunately the ruts will not fix themselves. we had sweet potato farmers do the same to our property. after 3 years the ruts are still 3 feet deep in some places. you should find a way to bring in materials. luckily youre next to a real road so that wont be too hard. unfortunately this is the reality in hawaii when hiring help. most people are just trying to get the job done and not care about what happens to the soils. do not have heavy machines work your site after continuous rains. i would have just called them to cancel that day, but thats from my own experiences with labor help. ive hired that same company, the first time they did a great job, the second time they dropped trees onto my fruit trees and smashed a roof on a composting structure. i wont hire them again. live and learn",t2_7k0xtk5,spencerwillis,0,1648233524.0,0,t1_i23jw85,i23jw85,True,Evil_Merlin,t3_tk9h4y,https://www.reddit.com/r/BigIsland/comments/tk9h4y/avoid_backyard_monkeys_they_did_this_to_my_yard/,Avoid Backyard Monkeys. They did this to my yard.,/r/BigIsland/comments/tk9h4y/avoid_backyard_monkeys_they_did_this_to_my_yard/i23jw85/,1,r/BigIsland,0,1
I’ll pay you to do this,t2_an8zzub0,NotaOstrich,0,1648232240.0,0,t1_i23gng1,i23gng1,False,NotaOstrich,t3_tng0vu,https://www.reddit.com/r/BigIsland/comments/tng0vu/hey_everybody_new_to_reddit_a_few_friends_and_i/,Hey everybody. New to Reddit. A few friends and I are going to Hawaii for the first time this summer and I was wondering if there were any shark cage diving on the Big Island. I’ve looked but haven’t found any. Thanks,/r/BigIsland/comments/tng0vu/hey_everybody_new_to_reddit_a_few_friends_and_i/i23gng1/,2,r/BigIsland,0,2
I would like it please. Thank you,t2_an8zzub0,NotaOstrich,0,1648232200.0,0,t1_i23gjxk,i23gjxk,False,NotaOstrich,t3_tng0vu,https://www.reddit.com/r/BigIsland/comments/tng0vu/hey_everybody_new_to_reddit_a_few_friends_and_i/,Hey everybody. New to Reddit. A few friends and I are going to Hawaii for the first time this summer and I was wondering if there were any shark cage diving on the Big Island. I’ve looked but haven’t found any. Thanks,/r/BigIsland/comments/tng0vu/hey_everybody_new_to_reddit_a_few_friends_and_i/i23gjxk/,1,r/BigIsland,0,1
u/Brysamo Check my DM; I think I may have found this.,t2_zr6uroy,mugzhawaii,0,1648227296.0,0,t1_i2340ne,i2340ne,False,[deleted],t3_puu1xk,https://www.reddit.com/r/BigIsland/comments/puu1xk/deleted_by_user/,[deleted by user],/r/BigIsland/comments/puu1xk/deleted_by_user/i2340ne/,1,r/BigIsland,0,1
This is the way,t2_4elc5hr6,indimedia,0,1648224265.0,0,t1_i22w4lb,i22w4lb,False,NotaOstrich,t3_tng0vu,https://www.reddit.com/r/BigIsland/comments/tng0vu/hey_everybody_new_to_reddit_a_few_friends_and_i/,Hey everybody. New to Reddit. A few friends and I are going to Hawaii for the first time this summer and I was wondering if there were any shark cage diving on the Big Island. I’ve looked but haven’t found any. Thanks,/r/BigIsland/comments/tng0vu/hey_everybody_new_to_reddit_a_few_friends_and_i/i22w4lb/,2,r/BigIsland,0,2
How much moon that night?,t2_c2tfyygo,skimbelruski,0,1648222981.0,0,t1_i22ssxx,i22ssxx,True,WastingTimeAsUsuaI,t3_tn0l5i,https://www.reddit.com/r/BigIsland/comments/tn0l5i/cancel_mauna_kea_summit_tour/,Cancel Mauna Kea summit tour?,/r/BigIsland/comments/tn0l5i/cancel_mauna_kea_summit_tour/i22ssxx/,1,r/BigIsland,0,1
"If the weather is bad, the tour company will cancel and refund your money.",t2_nevlf,biomajor123,0,1648218450.0,0,t1_i22hh2l,i22hh2l,True,WastingTimeAsUsuaI,t3_tn0l5i,https://www.reddit.com/r/BigIsland/comments/tn0l5i/cancel_mauna_kea_summit_tour/,Cancel Mauna Kea summit tour?,/r/BigIsland/comments/tn0l5i/cancel_mauna_kea_summit_tour/i22hh2l/,1,r/BigIsland,0,1
I use to work for a company that does shark swims. But no cage they just find the sharks and let you swim with them. Let me know if you want the name of the company,t2_e7w21jqx,Gguero_808,0,1648214279.0,0,t1_i227zy3,i227zy3,True,NotaOstrich,t3_tng0vu,https://www.reddit.com/r/BigIsland/comments/tng0vu/hey_everybody_new_to_reddit_a_few_friends_and_i/,Hey everybody. New to Reddit. A few friends and I are going to Hawaii for the first time this summer and I was wondering if there were any shark cage diving on the Big Island. I’ve looked but haven’t found any. Thanks,/r/BigIsland/comments/tng0vu/hey_everybody_new_to_reddit_a_few_friends_and_i/i227zy3/,1,r/BigIsland,0,1
"Nah. In Big Island, if a tourist wants to see sharks, we just tie a bloody steak around their neck and push them off the boat. 🤙",t2_85f9lc7d,Burphel_78,0,1648208899.0,0,t1_i21xz3i,i21xz3i,True,NotaOstrich,t3_tng0vu,https://www.reddit.com/r/BigIsland/comments/tng0vu/hey_everybody_new_to_reddit_a_few_friends_and_i/,Hey everybody. New to Reddit. A few friends and I are going to Hawaii for the first time this summer and I was wondering if there were any shark cage diving on the Big Island. I’ve looked but haven’t found any. Thanks,/r/BigIsland/comments/tng0vu/hey_everybody_new_to_reddit_a_few_friends_and_i/i21xz3i/,5,r/BigIsland,0,5
"Aloha /u/UncleCatDad, and anybody else interested in what to do with visitor questions.

>  I remember there was a weekly or monthly thread for these posts. 

Indeed, you remember correctly. I decided to stop doing this for a while (the last post was for [December 2021](https://www.reddit.com/r/BigIsland/comments/r73enf/please_submit_all_tourism_related_questions_here/) because the volume of these type of questions decreased significantly (hello, omicron), and the ones that we do get are either not answered (if they are made in the correct place), or get answered before I get to move them. I also started getting the impression that the questions asked in the monthly visitor question thread were far less likely to receive interaction than questions posted directly to the subreddit. 

Seeing this topic pop up, and judging from the comments, I am happy to restart the visitor topic again. I think it will be more efficient (mostly less time consuming for me) if I would change the following things compared to the previous series. 

* Make it a yearly topic (comments/questions sorted by ""new"") .
* I completely understand wanting to share your knowledge with visitors, a BIG thanks to all of you who are doing so! Last time around I made sure to copy those responses with username mention when I would move the question. This time around I may skip that sometimes.
* I will delete any comment that is not directly helpful w.r.t the question asked.

#Feedback

This is a local community subreddit and your input strongly guides our decisions on how to moderate it - the more voices the better! I would love to hear your thoughts about the above and of course any suggestion you may have on this topic. 

Mahalo!",t2_6cmzj,lovebigisland,0,1648208029.0,0,t1_i21wkyq,i21wkyq,True,UncleCatDad,t3_tmtwqy,https://www.reddit.com/r/BigIsland/comments/tmtwqy/tourist_recommendation_posts/,Tourist recommendation posts,/r/BigIsland/comments/tmtwqy/tourist_recommendation_posts/i21wkyq/,1,r/BigIsland,0,1
Perfect response. They could also... scroll down 4 posts and see the previous entry. But I don't work here so don't listen to me,t2_6f9jjpd3,Wolfsbane90,0,1648203355.0,0,t1_i21q0cc,i21q0cc,False,UncleCatDad,t3_tmtwqy,https://www.reddit.com/r/BigIsland/comments/tmtwqy/tourist_recommendation_posts/,Tourist recommendation posts,/r/BigIsland/comments/tmtwqy/tourist_recommendation_posts/i21q0cc/,4,r/BigIsland,0,4
"Let's just all agree to only have one comment on those posts referring them to /r/hawaiivisitors

#keepbigislandsublocal",t2_4dbs9,the_glass_gecko,0,1648194763.0,0,t1_i21fwlg,i21fwlg,True,UncleCatDad,t3_tmtwqy,https://www.reddit.com/r/BigIsland/comments/tmtwqy/tourist_recommendation_posts/,Tourist recommendation posts,/r/BigIsland/comments/tmtwqy/tourist_recommendation_posts/i21fwlg/,6,r/BigIsland,0,6
Thank you I will try that,t2_an8zzub0,NotaOstrich,0,1648193857.0,0,t1_i21eu15,i21eu15,False,NotaOstrich,t3_tng0vu,https://www.reddit.com/r/BigIsland/comments/tng0vu/hey_everybody_new_to_reddit_a_few_friends_and_i/,Hey everybody. New to Reddit. A few friends and I are going to Hawaii for the first time this summer and I was wondering if there were any shark cage diving on the Big Island. I’ve looked but haven’t found any. Thanks,/r/BigIsland/comments/tng0vu/hey_everybody_new_to_reddit_a_few_friends_and_i/i21eu15/,2,r/BigIsland,0,2
As far as I know you can only find that on Oʻahu. You can also try searching the dedicated /r/HawaiiVisitors subreddit.,t2_6cmzj,lovebigisland,0,1648193821.0,0,t1_i21esiw,i21esiw,True,NotaOstrich,t3_tng0vu,https://www.reddit.com/r/BigIsland/comments/tng0vu/hey_everybody_new_to_reddit_a_few_friends_and_i/,Hey everybody. New to Reddit. A few friends and I are going to Hawaii for the first time this summer and I was wondering if there were any shark cage diving on the Big Island. I’ve looked but haven’t found any. Thanks,/r/BigIsland/comments/tng0vu/hey_everybody_new_to_reddit_a_few_friends_and_i/i21esiw/,6,r/BigIsland,0,6
What on earth are you smoking? Potato plants look absolutely nothing like kalo. You wouldn't need a lab to distinguish one from the other.,t2_5gnmh,Gigglemonkey,0,1648193346.0,0,t1_i21e7xn,i21e7xn,False,Pulelehua,t3_t5kfkh,https://www.reddit.com/r/BigIsland/comments/t5kfkh/tipping_the_scales_at_50_pounds_this_konagrown/,"Tipping the scales at 50 pounds, this Kona-grown kalo might set a new world record!",/r/BigIsland/comments/t5kfkh/tipping_the_scales_at_50_pounds_this_konagrown/i21e7xn/,1,r/BigIsland,0,1
"Funny, it's anecdotal, but I know at least three little kids who've gotten really sick, and one who's died from covid. I don't know any who've had adverse reactions to the vaccine. 

Care to cite your source for this claim?",t2_5gnmh,Gigglemonkey,0,1648193211.0,0,t1_i21e25q,i21e25q,False,Aggravating_Analyst,t3_tct8ik,https://www.reddit.com/r/BigIsland/comments/tct8ik/big_island_residents_when_the_mask_mandate_goes/,"Big Island residents, when the mask mandate goes away on the 26th, are you hopeful that private businesses will continue to require masks?",/r/BigIsland/comments/tct8ik/big_island_residents_when_the_mask_mandate_goes/i21e25q/,1,r/BigIsland,0,1
It’s a wonderful community. Thanks for all your efforts!,t2_gvbgxfk0,UncleCatDad,0,1648192702.0,0,t1_i21dfi5,i21dfi5,False,UncleCatDad,t3_tmtwqy,https://www.reddit.com/r/BigIsland/comments/tmtwqy/tourist_recommendation_posts/,Tourist recommendation posts,/r/BigIsland/comments/tmtwqy/tourist_recommendation_posts/i21dfi5/,3,r/BigIsland,0,3
"Could be hit or miss, depending on weather. It’s too far out to really tell, but I’d say go for it no matter what. Even if it’s bad weather, things can move out fast up there and you could still catch some open skies. Makes those hot chocolates and hot cider powder drinks from the visitors center store more worth it in bad weather.",t2_16if9h,ConfusedSpaceMonkey,0,1648192403.0,0,t1_i21d2bd,i21d2bd,True,WastingTimeAsUsuaI,t3_tn0l5i,https://www.reddit.com/r/BigIsland/comments/tn0l5i/cancel_mauna_kea_summit_tour/,Cancel Mauna Kea summit tour?,/r/BigIsland/comments/tn0l5i/cancel_mauna_kea_summit_tour/i21d2bd/,1,r/BigIsland,0,1
Mauna lani is the best but also $$$$. Hapuna and Mauna Kea have nicest beach. Orchid has a bigger pool,t2_1amyq44l,Canilive5592,0,1648188890.0,0,t1_i218ns3,i218ns3,True,chasez76,t3_tmrwuh,https://www.reddit.com/r/BigIsland/comments/tmrwuh/hotel_recommendation_for_40th_birthday/,Hotel Recommendation for 40th birthday,/r/BigIsland/comments/tmrwuh/hotel_recommendation_for_40th_birthday/i218ns3/,1,r/BigIsland,0,1
DNA tests showed it was a potato. ;),t2_fuexj,Bikesandkittens,0,1648188223.0,0,t1_i217sry,i217sry,True,Pulelehua,t3_t5kfkh,https://www.reddit.com/r/BigIsland/comments/t5kfkh/tipping_the_scales_at_50_pounds_this_konagrown/,"Tipping the scales at 50 pounds, this Kona-grown kalo might set a new world record!",/r/BigIsland/comments/t5kfkh/tipping_the_scales_at_50_pounds_this_konagrown/i217sry/,1,r/BigIsland,0,1
I’d probably ditch the containers and repack all that in a few huge bags and take them on the plane.,t2_fuexj,Bikesandkittens,0,1648188080.0,0,t1_i217lrq,i217lrq,True,furikakebabe,t3_t90g4a,https://www.reddit.com/r/BigIsland/comments/t90g4a/i_have_this_much_stuff_plus_a_guitar_to_move_to/,I have this much stuff plus a guitar to move to mainland. What’s the most cost effective solution?,/r/BigIsland/comments/t90g4a/i_have_this_much_stuff_plus_a_guitar_to_move_to/i217lrq/,1,r/BigIsland,0,1
"Yup, you are correct.",t2_fuexj,Bikesandkittens,0,1648187105.0,0,t1_i216av0,i216av0,False,Aggravating_Analyst,t3_tcs8qj,https://www.reddit.com/r/BigIsland/comments/tcs8qj/private_business_ownerswhen_mask_mandate_goes/,"Private business owners...when mask mandate goes away on the 26th, will you continue requiring masks?",/r/BigIsland/comments/tcs8qj/private_business_ownerswhen_mask_mandate_goes/i216av0/,1,r/BigIsland,0,1
Is this before or after the CDC lowered their numbers for the actual death rates?,t2_fuexj,Bikesandkittens,0,1648186689.0,0,t1_i215q8e,i215q8e,False,Aggravating_Analyst,t3_tct8ik,https://www.reddit.com/r/BigIsland/comments/tct8ik/big_island_residents_when_the_mask_mandate_goes/,"Big Island residents, when the mask mandate goes away on the 26th, are you hopeful that private businesses will continue to require masks?",/r/BigIsland/comments/tct8ik/big_island_residents_when_the_mask_mandate_goes/i215q8e/,-1,r/BigIsland,0,-1
