body,author_fullname,author.name,controversiality,created,downs,fullname,id,is_root,link_author,link_id,link_permalink,link_title,permalink,score,subreddit_name_prefixed,total_awards_received,ups
Crazy incredible picture!,t2_92l7u8c7,WillieDustice78,0,1647845008.0,0,t1_i1i34qv,i1i34qv,True,rbronzan,t3_tj01bo,https://www.reddit.com/r/BigIsland/comments/tj01bo/turtle_cleaning_station_at_puako_was_poppin_today/,Turtle cleaning station at Puako was poppin’ today!,/r/BigIsland/comments/tj01bo/turtle_cleaning_station_at_puako_was_poppin_today/i1i34qv/,1,r/BigIsland,0,1
"your post made me smile :D

i've only seen ONE coqui frog and that was because he somehow got into my room. i've seen about 8 million geckos.

how you gonna catch em?",t2_c3b4fv8d,pantsonheaditor,0,1647844617.0,0,t1_i1i2ni5,i1i2ni5,True,CoquiEater,t3_tj4wjg,https://www.reddit.com/r/BigIsland/comments/tj4wjg/why_dont_we_just_eat_all_the_coqui_frogs/,Why Don’t We Just Eat All the Coqui Frogs,/r/BigIsland/comments/tj4wjg/why_dont_we_just_eat_all_the_coqui_frogs/i1i2ni5/,3,r/BigIsland,0,3
"This comment made me laugh out loud ;) 

> That’s a great point. Sounds like we need to cure rat lung disease and then we feast

You remind me of another person here on Reddit that is all about eating insects. Let’s see if I can remembah…",t2_tysa0,Pulelehua,0,1647844480.0,0,t1_i1i2hg5,i1i2hg5,False,CoquiEater,t3_tj4wjg,https://www.reddit.com/r/BigIsland/comments/tj4wjg/why_dont_we_just_eat_all_the_coqui_frogs/,Why Don’t We Just Eat All the Coqui Frogs,/r/BigIsland/comments/tj4wjg/why_dont_we_just_eat_all_the_coqui_frogs/i1i2hg5/,2,r/BigIsland,0,2
spectacular shot. is the reef supposed to look like that though?,t2_c3b4fv8d,pantsonheaditor,0,1647844471.0,0,t1_i1i2gyk,i1i2gyk,True,rbronzan,t3_tj01bo,https://www.reddit.com/r/BigIsland/comments/tj01bo/turtle_cleaning_station_at_puako_was_poppin_today/,Turtle cleaning station at Puako was poppin’ today!,/r/BigIsland/comments/tj01bo/turtle_cleaning_station_at_puako_was_poppin_today/i1i2gyk/,1,r/BigIsland,0,1
🤣🤢 This is both hilarious and disgusting.,t2_2q426u1v,Powerful-Context9671,0,1647844337.0,0,t1_i1i2auv,i1i2auv,False,CoquiEater,t3_tj4wjg,https://www.reddit.com/r/BigIsland/comments/tj4wjg/why_dont_we_just_eat_all_the_coqui_frogs/,Why Don’t We Just Eat All the Coqui Frogs,/r/BigIsland/comments/tj4wjg/why_dont_we_just_eat_all_the_coqui_frogs/i1i2auv/,6,r/BigIsland,0,6
That’s a great point. Sounds like we need to cure rat lung disease and then we feast,t2_40azjvy5,CoquiEater,0,1647843792.0,0,t1_i1i1mi8,i1i1mi8,False,CoquiEater,t3_tj4wjg,https://www.reddit.com/r/BigIsland/comments/tj4wjg/why_dont_we_just_eat_all_the_coqui_frogs/,Why Don’t We Just Eat All the Coqui Frogs,/r/BigIsland/comments/tj4wjg/why_dont_we_just_eat_all_the_coqui_frogs/i1i1mi8/,24,r/BigIsland,0,24
"Aloha /u/rambogorillacat.

Your comment is stuck in a Reddit automod filter and won’t be approved as what you’re suggesting is not legal. 

Therefore it is being removed. 

Have any questions, further comments, or concerns? 

Send them to the modmail [here](https://old.reddit.com/message/compose/?to=/r/BigIsland). 

Mahalo!",t2_tysa0,Pulelehua,0,1647843770.0,0,t1_i1i1lhg,i1i1lhg,False,cookiejar327,t3_tj3hc2,https://www.reddit.com/r/BigIsland/comments/tj3hc2/waipio_valley_question/,Waipio Valley - Question,/r/BigIsland/comments/tj3hc2/waipio_valley_question/i1i1lhg/,2,r/BigIsland,0,2
"Aloha and welcome to Reddit and Moku O Keawe /u/CoquiEater.

Your post was caught in a Reddit filter and has been approved just now.

Why don’t we eat tha coqui frogs? 

Cuz they get rat lungworm. Das why.

https://health.hawaii.gov/docd/disease_listing/rat-lungworm-angiostrongyliasis/",t2_tysa0,Pulelehua,0,1647843456.0,0,t1_i1i16ya,i1i16ya,True,CoquiEater,t3_tj4wjg,https://www.reddit.com/r/BigIsland/comments/tj4wjg/why_dont_we_just_eat_all_the_coqui_frogs/,Why Don’t We Just Eat All the Coqui Frogs,/r/BigIsland/comments/tj4wjg/why_dont_we_just_eat_all_the_coqui_frogs/i1i16ya/,28,r/BigIsland,0,28
"Your comment has been removed for not following the clearly stated instructions in the last mod message I just sent to you /u/papa_nurgel.

Aloha!",t2_tysa0,Pulelehua,0,1647843010.0,0,t1_i1i0mii,i1i0mii,False,[deleted],t3_ti0ckn,https://www.reddit.com/r/BigIsland/comments/ti0ckn/canceling_captain_cook_resolution_seeks_to_rename/,Canceling Captain Cook? Resolution seeks to rename South Kona town,/r/BigIsland/comments/ti0ckn/canceling_captain_cook_resolution_seeks_to_rename/i1i0mii/,2,r/BigIsland,0,2
Grass and ancient burial sites,t2_4dbs9,the_glass_gecko,0,1647842517.0,0,t1_i1hzzkm,i1hzzkm,False,Ok_Requirement_7337,t3_tiv6hi,https://www.reddit.com/r/BigIsland/comments/tiv6hi/do_you_need_a_4x4_to_drive_to_green_sand_beach/,Do you need a 4x4 to drive to green sand beach and waipio valley lookout?,/r/BigIsland/comments/tiv6hi/do_you_need_a_4x4_to_drive_to_green_sand_beach/i1hzzkm/,1,r/BigIsland,0,1
"Aloha once again /u/papa_nurgel.

Your comment has been removed for not following this subreddit communities guidelines and rules. Consider this your last warning. 

> Hot take there idiot

You should once again familiarize yourself with this subreddit communities guidelines and rules. If you choose to consciously participate here further, it is in your best interest.

Read this portion of my mod message very carefully. 

Have any questions, further comments, or concerns? 

Send them to the modmail [here](https://old.reddit.com/message/compose/?to=/r/BigIsland). 

Mahalo!

Edit to add ~ To whomever reported my mod message for making a personal attack ~~~ lol!

**Edit numbah 2 ~ stop harassing me in PM’s. It is in your best interest.**",t2_tysa0,Pulelehua,0,1647842375.0,0,t1_i1hzsx9,i1hzsx9,False,[deleted],t3_ti0ckn,https://www.reddit.com/r/BigIsland/comments/ti0ckn/canceling_captain_cook_resolution_seeks_to_rename/,Canceling Captain Cook? Resolution seeks to rename South Kona town,/r/BigIsland/comments/ti0ckn/canceling_captain_cook_resolution_seeks_to_rename/i1hzsx9/,1,r/BigIsland,0,1
"Aloha /u/Nichijo.

I’ve said it before ~ and I will say it clearly once again. You’re an interesting character.

Let it be known, your comment was reported. I will, at this time, let it remain. 

> Oy yass! And with each one, we can have big shame and blame and self-congratulation parties, where we can all remind ourselves of how we have such superior knowledge and morality.
God, we're so PERFECT!!!

As a data analyst, it’s been interesting to note your recent comments made here over the past several weeks since we last communicated on another “controversial” Hawaiian topic. 

As others have mentioned, your characteristics, consistent meltdowns, and unsubdued anger are a bit concerning. 

You should once again familiarize yourself with this subreddit communities guidelines and rules. If you choose to consciously participate here further, it is in your best interest.

Read this portion of my mod message very carefully. 

Have any questions, further comments, or concerns? 

Send them to the modmail [here](https://old.reddit.com/message/compose/?to=/r/BigIsland). 

Mahalo!",t2_tysa0,Pulelehua,0,1647842179.0,0,t1_i1hzjxq,i1hzjxq,False,[deleted],t3_ti0ckn,https://www.reddit.com/r/BigIsland/comments/ti0ckn/canceling_captain_cook_resolution_seeks_to_rename/,Canceling Captain Cook? Resolution seeks to rename South Kona town,/r/BigIsland/comments/ti0ckn/canceling_captain_cook_resolution_seeks_to_rename/i1hzjxq/,2,r/BigIsland,0,2
Thanks!,t2_ipxh4,rbronzan,0,1647842112.0,0,t1_i1hzgrc,i1hzgrc,False,rbronzan,t3_tj01bo,https://www.reddit.com/r/BigIsland/comments/tj01bo/turtle_cleaning_station_at_puako_was_poppin_today/,Turtle cleaning station at Puako was poppin’ today!,/r/BigIsland/comments/tj01bo/turtle_cleaning_station_at_puako_was_poppin_today/i1hzgrc/,1,r/BigIsland,0,1
Dm me,t2_ipxh4,rbronzan,0,1647842066.0,0,t1_i1hzeme,i1hzeme,False,rbronzan,t3_tj01bo,https://www.reddit.com/r/BigIsland/comments/tj01bo/turtle_cleaning_station_at_puako_was_poppin_today/,Turtle cleaning station at Puako was poppin’ today!,/r/BigIsland/comments/tj01bo/turtle_cleaning_station_at_puako_was_poppin_today/i1hzeme/,1,r/BigIsland,0,1
"Aloha /u/The_Internet_iscool.

Welcome to Moku O Keawe. 

> The “native Hawaiians” were a brutal war like people who colonized and enslaved earlier inhabitants and regularly performed human sacrifice. All Hawaiian places and names should be scrubbed from the island because it is the name of genocidal slave owning oppressors. King kamehameha statues should be torn down. The “sacred” heiau of war kamehameha built should be dismantled stone by stone, it was built with forced labor to celebrate the upcoming colonization of the other islands and consecrated with the blood of human sacrifice.

Let it be known, your comment was reported. I will, at this time, let it remain. 

You should however familiarize yourself with this subreddit communities guidelines and rules. If you choose to consciously participate here further, it is in your best interest.

Read this portion of my mod message very carefully. 

Have any questions, further comments, or concerns? 

Send them to the modmail [here](https://old.reddit.com/message/compose/?to=/r/BigIsland). 

Mahalo!",t2_tysa0,Pulelehua,0,1647841995.0,0,t1_i1hzb9e,i1hzb9e,False,[deleted],t3_ti0ckn,https://www.reddit.com/r/BigIsland/comments/ti0ckn/canceling_captain_cook_resolution_seeks_to_rename/,Canceling Captain Cook? Resolution seeks to rename South Kona town,/r/BigIsland/comments/ti0ckn/canceling_captain_cook_resolution_seeks_to_rename/i1hzb9e/,1,r/BigIsland,0,1
"Aloha ahiahi /u/Fun_Yak_5056.

#Welcome to Reddit & Moku O Keawe. 


> #Based. To often, people idealize natives as peaceful when they were actually ruthless warriors. I actually respect Kamehameha the same way that I respect Genghis Khan.

Let it be known, your comment was reported. I will, at this time, let it remain. 

You should however familiarize yourself with this subreddit communities guidelines and rules. If you choose to consciously participate here further, it is in your best interest.

Read this portion of my mod message very carefully…

Do you have any questions, further comments, or concerns? 

Send them to the modmail [here](https://old.reddit.com/message/compose/?to=/r/BigIsland). 

Mahalo!",t2_tysa0,Pulelehua,0,1647841791.0,0,t1_i1hz1pe,i1hz1pe,False,[deleted],t3_ti0ckn,https://www.reddit.com/r/BigIsland/comments/ti0ckn/canceling_captain_cook_resolution_seeks_to_rename/,Canceling Captain Cook? Resolution seeks to rename South Kona town,/r/BigIsland/comments/ti0ckn/canceling_captain_cook_resolution_seeks_to_rename/i1hz1pe/,1,r/BigIsland,0,1
It was pretty loud here in Waimea. We had visitors from the mainland and they thought we were being bombed 🤣,t2_wslc7,Filippopotamus,0,1647841733.0,0,t1_i1hyyxm,i1hyyxm,True,marcelinekinsley,t3_tiqg1r,https://www.reddit.com/r/BigIsland/comments/tiqg1r/lol_okay/,Lol okay 🙃,/r/BigIsland/comments/tiqg1r/lol_okay/i1hyyxm/,1,r/BigIsland,0,1
Beautiful shot!,t2_8h5uc,reigningcatsanddogs,0,1647841035.0,0,t1_i1hy13c,i1hy13c,True,rbronzan,t3_tj01bo,https://www.reddit.com/r/BigIsland/comments/tj01bo/turtle_cleaning_station_at_puako_was_poppin_today/,Turtle cleaning station at Puako was poppin’ today!,/r/BigIsland/comments/tj01bo/turtle_cleaning_station_at_puako_was_poppin_today/i1hy13c/,1,r/BigIsland,0,1
Care to share the exact location or is that a no no on this forum?,t2_9paq4,xoogl3,0,1647841009.0,0,t1_i1hxzsp,i1hxzsp,True,rbronzan,t3_tj01bo,https://www.reddit.com/r/BigIsland/comments/tj01bo/turtle_cleaning_station_at_puako_was_poppin_today/,Turtle cleaning station at Puako was poppin’ today!,/r/BigIsland/comments/tj01bo/turtle_cleaning_station_at_puako_was_poppin_today/i1hxzsp/,1,r/BigIsland,0,1
"Two more quakes happened in the same area later today, both in the 2.0+ range.",t2_8klb7o1a,Millennial_Idiot,0,1647840997.0,0,t1_i1hxz72,i1hxz72,True,konastump,t3_tiq7if,https://www.reddit.com/r/BigIsland/comments/tiq7if/big_island_jolt/,Big Island Jolt,/r/BigIsland/comments/tiq7if/big_island_jolt/i1hxz72/,1,r/BigIsland,0,1
"I don’t understand why more people are not upset with this closure, haven’t seen any real reason why people can’t walk the road.   

If locals start giving tours and driving people up and down that would hurt the road much more than visitors simply walking the road.",t2_c2tfyygo,skimbelruski,0,1647838354.0,0,t1_i1hu734,i1hu734,True,cookiejar327,t3_tj3hc2,https://www.reddit.com/r/BigIsland/comments/tj3hc2/waipio_valley_question/,Waipio Valley - Question,/r/BigIsland/comments/tj3hc2/waipio_valley_question/i1hu734/,15,r/BigIsland,0,15
The calm seas are back! This winter was swelly af,t2_ipxh4,rbronzan,0,1647837039.0,0,t1_i1hs3p7,i1hs3p7,False,rbronzan,t3_tj01bo,https://www.reddit.com/r/BigIsland/comments/tj01bo/turtle_cleaning_station_at_puako_was_poppin_today/,Turtle cleaning station at Puako was poppin’ today!,/r/BigIsland/comments/tj01bo/turtle_cleaning_station_at_puako_was_poppin_today/i1hs3p7/,1,r/BigIsland,0,1
"Why is this a partial list? Police department explanation Originally, the list was for newspapers, which have limited space. The reason we do it in alphabetical order rather than chronological order is that sometimes we have a long list of new names and sometimes that list is short. This is a way we can be consistent with filling a specified amount of space for the newspapers. We realize that space isn’t a factor for a website, but to create a different version for you (Hawaii 24/7) would require doing both versions. Unfortunately, we only have one employee who is responsible for all the police department’s court documents and she is the one who has to prepare the weekly list for the media. It would take away too much time from her primary duties if she had to do both lists.",t2_9jnscwnm,CoffeeShackProds,0,1647834386.0,0,t1_i1hnm7i,i1hnm7i,True,zhamz,t3_thmd9w,https://www.reddit.com/r/BigIsland/comments/thmd9w/the_letter_p/,The letter P,/r/BigIsland/comments/thmd9w/the_letter_p/i1hnm7i/,2,r/BigIsland,0,2
So clear today!,t2_cd7iy,Gikine,0,1647834042.0,0,t1_i1hn056,i1hn056,True,rbronzan,t3_tj01bo,https://www.reddit.com/r/BigIsland/comments/tj01bo/turtle_cleaning_station_at_puako_was_poppin_today/,Turtle cleaning station at Puako was poppin’ today!,/r/BigIsland/comments/tj01bo/turtle_cleaning_station_at_puako_was_poppin_today/i1hn056/,2,r/BigIsland,0,2
Hualalai has been on a 200-ish year cycle for some time. It's due too!,t2_vkk3b,lanclos,0,1647833484.0,0,t1_i1hlzce,i1hlzce,False,OkieFinokie,t3_thiv50,https://www.reddit.com/r/BigIsland/comments/thiv50/when_mauna_loa_eruptskupuna_talk_story/,When Mauna Loa erupts…Kupuna talk story,/r/BigIsland/comments/thiv50/when_mauna_loa_eruptskupuna_talk_story/i1hlzce/,1,r/BigIsland,0,1
Anyone just feel another one? Seems like Madame Pele is stretching today.,t2_8x23n,Full-Paragon,0,1647830118.0,0,t1_i1hfgpw,i1hfgpw,True,Aggravating_Analyst,t3_tiq8ga,https://www.reddit.com/r/BigIsland/comments/tiq8ga/holy_earthquake_how_far_was_that_felt_i_live/,Holy earthquake?! How far was that felt? I live Westside Waimea.,/r/BigIsland/comments/tiq8ga/holy_earthquake_how_far_was_that_felt_i_live/i1hfgpw/,2,r/BigIsland,0,2
Makes me want to set up my own turtle cleaning station,t2_4mvpu,cutelyaware,0,1647826329.0,0,t1_i1h7ozq,i1h7ozq,True,rbronzan,t3_tj01bo,https://www.reddit.com/r/BigIsland/comments/tj01bo/turtle_cleaning_station_at_puako_was_poppin_today/,Turtle cleaning station at Puako was poppin’ today!,/r/BigIsland/comments/tj01bo/turtle_cleaning_station_at_puako_was_poppin_today/i1h7ozq/,3,r/BigIsland,0,3
And watch out on your way to green sands some trails juss drop off like 4 ft so don’t wanna flip,t2_i1ztyad9,Aliensarehere22,0,1647824811.0,0,t1_i1h4kqz,i1h4kqz,True,Ok_Requirement_7337,t3_tiv6hi,https://www.reddit.com/r/BigIsland/comments/tiv6hi/do_you_need_a_4x4_to_drive_to_green_sand_beach/,Do you need a 4x4 to drive to green sand beach and waipio valley lookout?,/r/BigIsland/comments/tiv6hi/do_you_need_a_4x4_to_drive_to_green_sand_beach/i1h4kqz/,0,r/BigIsland,0,0
Not the lookout but yeah for green sands,t2_i1ztyad9,Aliensarehere22,0,1647824767.0,0,t1_i1h4hk5,i1h4hk5,True,Ok_Requirement_7337,t3_tiv6hi,https://www.reddit.com/r/BigIsland/comments/tiv6hi/do_you_need_a_4x4_to_drive_to_green_sand_beach/,Do you need a 4x4 to drive to green sand beach and waipio valley lookout?,/r/BigIsland/comments/tiv6hi/do_you_need_a_4x4_to_drive_to_green_sand_beach/i1h4hk5/,0,r/BigIsland,0,0
"Felt it pretty good here in Waimea, was fairly short but woke my puppy and I up and startled him a bit. Was probably his first earthquake lol",t2_cz1jjq7p,Fluid-Farmer9306,0,1647822589.0,0,t1_i1gzw7w,i1gzw7w,True,konastump,t3_tiq7if,https://www.reddit.com/r/BigIsland/comments/tiq7if/big_island_jolt/,Big Island Jolt,/r/BigIsland/comments/tiq7if/big_island_jolt/i1gzw7w/,1,r/BigIsland,0,1
Green sand is such an easy flat walk. Don’t be a dumbass and fuck up the grass even more. Walk.,t2_75d9w,kebabmybob,0,1647818790.0,0,t1_i1grpsh,i1grpsh,True,Ok_Requirement_7337,t3_tiv6hi,https://www.reddit.com/r/BigIsland/comments/tiv6hi/do_you_need_a_4x4_to_drive_to_green_sand_beach/,Do you need a 4x4 to drive to green sand beach and waipio valley lookout?,/r/BigIsland/comments/tiv6hi/do_you_need_a_4x4_to_drive_to_green_sand_beach/i1grpsh/,8,r/BigIsland,0,8
"If your careful and know how to drive 2 wheel is possible.   


We walked after reading all the threads about needing a 4x4.",t2_zgcn6,Smurk56,0,1647817868.0,0,t1_i1gpnyj,i1gpnyj,True,Ok_Requirement_7337,t3_tiv6hi,https://www.reddit.com/r/BigIsland/comments/tiv6hi/do_you_need_a_4x4_to_drive_to_green_sand_beach/,Do you need a 4x4 to drive to green sand beach and waipio valley lookout?,/r/BigIsland/comments/tiv6hi/do_you_need_a_4x4_to_drive_to_green_sand_beach/i1gpnyj/,-3,r/BigIsland,0,-3
"i’ve seen the advertisements & just laugh. they’re definitely nice apartments but no way i’d ever be able to afford that, especially unfurnished. makes me sad to see how high the housing market is becoming.",t2_b33e8oax,rixnna,0,1647815293.0,0,t1_i1gju7u,i1gju7u,True,WittyAd126,t3_tct5eb,https://www.reddit.com/r/BigIsland/comments/tct5eb/anyone_heard_about_the_lofts_at_waikoloa/,Anyone heard about the Lofts at Waikoloa,/r/BigIsland/comments/tct5eb/anyone_heard_about_the_lofts_at_waikoloa/i1gju7u/,2,r/BigIsland,0,2
Bring 10-15 per person pay the local for the ride spend and hour there and move on.,t2_2ic3k9tc,squintyshrew9,1,1647815272.0,0,t1_i1gjsj2,i1gjsj2,True,Ok_Requirement_7337,t3_tiv6hi,https://www.reddit.com/r/BigIsland/comments/tiv6hi/do_you_need_a_4x4_to_drive_to_green_sand_beach/,Do you need a 4x4 to drive to green sand beach and waipio valley lookout?,/r/BigIsland/comments/tiv6hi/do_you_need_a_4x4_to_drive_to_green_sand_beach/i1gjsj2/,0,r/BigIsland,0,0
There's usually a few trucks for hire at green sand.,t2_4pegm,Sindertone,0,1647814794.0,0,t1_i1gip30,i1gip30,True,Ok_Requirement_7337,t3_tiv6hi,https://www.reddit.com/r/BigIsland/comments/tiv6hi/do_you_need_a_4x4_to_drive_to_green_sand_beach/,Do you need a 4x4 to drive to green sand beach and waipio valley lookout?,/r/BigIsland/comments/tiv6hi/do_you_need_a_4x4_to_drive_to_green_sand_beach/i1gip30/,-1,r/BigIsland,0,-1
"Agree with this! bring lots of water. I did the hike with my dog and it was a great, but long hike. Also, don't listen to music too loud so you can hear cars behind you to get out of their way.",t2_8nxspdro,BTmom5,0,1647814169.0,0,t1_i1gh901,i1gh901,False,Ok_Requirement_7337,t3_tiv6hi,https://www.reddit.com/r/BigIsland/comments/tiv6hi/do_you_need_a_4x4_to_drive_to_green_sand_beach/,Do you need a 4x4 to drive to green sand beach and waipio valley lookout?,/r/BigIsland/comments/tiv6hi/do_you_need_a_4x4_to_drive_to_green_sand_beach/i1gh901/,5,r/BigIsland,0,5
Just park and walk once you hit the parking area. It's a gorgeous walk.,t2_c3zjc,FormerFastCat,0,1647813829.0,0,t1_i1gggd2,i1gggd2,True,Ok_Requirement_7337,t3_tiv6hi,https://www.reddit.com/r/BigIsland/comments/tiv6hi/do_you_need_a_4x4_to_drive_to_green_sand_beach/,Do you need a 4x4 to drive to green sand beach and waipio valley lookout?,/r/BigIsland/comments/tiv6hi/do_you_need_a_4x4_to_drive_to_green_sand_beach/i1gggd2/,11,r/BigIsland,0,11
Or a helicopter. Your call.,t2_7ibqbyqp,Coffee_24-7,0,1647813580.0,0,t1_i1gfuwj,i1gfuwj,True,Ok_Requirement_7337,t3_tiv6hi,https://www.reddit.com/r/BigIsland/comments/tiv6hi/do_you_need_a_4x4_to_drive_to_green_sand_beach/,Do you need a 4x4 to drive to green sand beach and waipio valley lookout?,/r/BigIsland/comments/tiv6hi/do_you_need_a_4x4_to_drive_to_green_sand_beach/i1gfuwj/,-5,r/BigIsland,0,-5
or two abled feet.,t2_9uqcbg6i,Ruzkul,0,1647813445.0,0,t1_i1gfjjl,i1gfjjl,False,Ok_Requirement_7337,t3_tiv6hi,https://www.reddit.com/r/BigIsland/comments/tiv6hi/do_you_need_a_4x4_to_drive_to_green_sand_beach/,Do you need a 4x4 to drive to green sand beach and waipio valley lookout?,/r/BigIsland/comments/tiv6hi/do_you_need_a_4x4_to_drive_to_green_sand_beach/i1gfjjl/,13,r/BigIsland,0,13
Thank you! Is there a point in green sand beach until which we can use all wheel drive and hike the rest?,t2_8fh3fqvo,Ok_Requirement_7337,0,1647812949.0,0,t1_i1gedfd,i1gedfd,False,Ok_Requirement_7337,t3_tiv6hi,https://www.reddit.com/r/BigIsland/comments/tiv6hi/do_you_need_a_4x4_to_drive_to_green_sand_beach/,Do you need a 4x4 to drive to green sand beach and waipio valley lookout?,/r/BigIsland/comments/tiv6hi/do_you_need_a_4x4_to_drive_to_green_sand_beach/i1gedfd/,0,r/BigIsland,0,0
Green sand you’re absolutely toast without four wheel,t2_cdaxj14q,Puzzled-Bet-9470,1,1647812264.0,0,t1_i1gcrbk,i1gcrbk,False,Ok_Requirement_7337,t3_tiv6hi,https://www.reddit.com/r/BigIsland/comments/tiv6hi/do_you_need_a_4x4_to_drive_to_green_sand_beach/,Do you need a 4x4 to drive to green sand beach and waipio valley lookout?,/r/BigIsland/comments/tiv6hi/do_you_need_a_4x4_to_drive_to_green_sand_beach/i1gcrbk/,3,r/BigIsland,0,3
no joke in paauilo,t2_3d016,talaxia,0,1647812126.0,0,t1_i1gcfsu,i1gcfsu,False,konastump,t3_tiq7if,https://www.reddit.com/r/BigIsland/comments/tiq7if/big_island_jolt/,Big Island Jolt,/r/BigIsland/comments/tiq7if/big_island_jolt/i1gcfsu/,1,r/BigIsland,0,1
felt it in fern acres too,t2_7oyhc,morganml,0,1647811795.0,0,t1_i1gbntb,i1gbntb,True,konastump,t3_tiq7if,https://www.reddit.com/r/BigIsland/comments/tiq7if/big_island_jolt/,Big Island Jolt,/r/BigIsland/comments/tiq7if/big_island_jolt/i1gbntb/,2,r/BigIsland,0,2
"Yes green sand beach, no Waipio lookout",t2_hdycyphh,kingbee43,0,1647811449.0,0,t1_i1gauva,i1gauva,True,Ok_Requirement_7337,t3_tiv6hi,https://www.reddit.com/r/BigIsland/comments/tiv6hi/do_you_need_a_4x4_to_drive_to_green_sand_beach/,Do you need a 4x4 to drive to green sand beach and waipio valley lookout?,/r/BigIsland/comments/tiv6hi/do_you_need_a_4x4_to_drive_to_green_sand_beach/i1gauva/,10,r/BigIsland,0,10
Clearly,t2_2zy8hns,home_use,0,1647810602.0,0,t1_i1g8u04,i1g8u04,False,[deleted],t3_ti0ckn,https://www.reddit.com/r/BigIsland/comments/ti0ckn/canceling_captain_cook_resolution_seeks_to_rename/,Canceling Captain Cook? Resolution seeks to rename South Kona town,/r/BigIsland/comments/ti0ckn/canceling_captain_cook_resolution_seeks_to_rename/i1g8u04/,3,r/BigIsland,0,3
Comment purely for instigation.,t2_9jnscwnm,CoffeeShackProds,0,1647808439.0,0,t1_i1g3o0b,i1g3o0b,False,[deleted],t3_ti0ckn,https://www.reddit.com/r/BigIsland/comments/ti0ckn/canceling_captain_cook_resolution_seeks_to_rename/,Canceling Captain Cook? Resolution seeks to rename South Kona town,/r/BigIsland/comments/ti0ckn/canceling_captain_cook_resolution_seeks_to_rename/i1g3o0b/,-1,r/BigIsland,0,-1
"I didn't feel it at all in Hilo, but I was driving, so that could have been why.",t2_cioba,Amelaclya1,0,1647808032.0,0,t1_i1g2pk7,i1g2pk7,True,Aggravating_Analyst,t3_tiq8ga,https://www.reddit.com/r/BigIsland/comments/tiq8ga/holy_earthquake_how_far_was_that_felt_i_live/,Holy earthquake?! How far was that felt? I live Westside Waimea.,/r/BigIsland/comments/tiq8ga/holy_earthquake_how_far_was_that_felt_i_live/i1g2pk7/,2,r/BigIsland,0,2
That’s why the title reads “Living in Hilo now”,t2_84dsouj0,RobsHereAgain,0,1647807879.0,0,t1_i1g2crv,i1g2crv,False,RobsHereAgain,t3_ti3n1f,https://www.reddit.com/r/BigIsland/comments/ti3n1f/living_in_hilo_now/,Living in Hilo now,/r/BigIsland/comments/ti3n1f/living_in_hilo_now/i1g2crv/,1,r/BigIsland,0,1
I live on the big island now. I live in Hilo. Just wanted to share.,t2_84dsouj0,RobsHereAgain,0,1647807843.0,0,t1_i1g29qm,i1g29qm,False,RobsHereAgain,t3_ti3n1f,https://www.reddit.com/r/BigIsland/comments/ti3n1f/living_in_hilo_now/,Living in Hilo now,/r/BigIsland/comments/ti3n1f/living_in_hilo_now/i1g29qm/,1,r/BigIsland,0,1
Oh... you poor thing,t2_2zy8hns,home_use,0,1647807704.0,0,t1_i1g1y8p,i1g1y8p,False,[deleted],t3_ti0ckn,https://www.reddit.com/r/BigIsland/comments/ti0ckn/canceling_captain_cook_resolution_seeks_to_rename/,Canceling Captain Cook? Resolution seeks to rename South Kona town,/r/BigIsland/comments/ti0ckn/canceling_captain_cook_resolution_seeks_to_rename/i1g1y8p/,2,r/BigIsland,0,2
"Cool, change it... we will all still refer to it as CC. Like Hawaii Belt Rd is still  Mamalahoa hwy and I can't help but still call Lavernes 'Lulus'. I think everyone would just have a great ol time redoing their addresses in the multitude of systems they are in. For those who don't live in CC, how about you mind your own. As for those who do, think of all aspects of what an address name change would entail.",t2_9jnscwnm,CoffeeShackProds,0,1647804622.0,0,t1_i1fuslf,i1fuslf,True,[deleted],t3_ti0ckn,https://www.reddit.com/r/BigIsland/comments/ti0ckn/canceling_captain_cook_resolution_seeks_to_rename/,Canceling Captain Cook? Resolution seeks to rename South Kona town,/r/BigIsland/comments/ti0ckn/canceling_captain_cook_resolution_seeks_to_rename/i1fuslf/,-3,r/BigIsland,0,-3
