body,author_fullname,author.name,controversiality,created,downs,fullname,id,is_root,link_author,link_id,link_permalink,link_title,permalink,score,subreddit_name_prefixed,total_awards_received,ups
do you happen to have a before shot? even pull one off satellite? im just curious what it did look like,t2_c3b4fv8d,pantsonheaditor,0,1647980052.0,0,t1_i1pf9i7,i1pf9i7,True,Evil_Merlin,t3_tk9h4y,https://www.reddit.com/r/BigIsland/comments/tk9h4y/avoid_backyard_monkeys_they_did_this_to_my_yard/,Avoid Backyard Monkeys. They did this to my yard.,/r/BigIsland/comments/tk9h4y/avoid_backyard_monkeys_they_did_this_to_my_yard/i1pf9i7/,0,r/BigIsland,0,0
"I can't give you exact farms, but generally, I think Kau and some Puna coffee is just as good as Kona, and almost always cheaper. If you find Kona coffee cheaper, it's almost definitely not actually Kona coffee",t2_11a648,keanenottheband,0,1647979654.0,0,t1_i1pe8tv,i1pe8tv,True,Wide-Visual,t3_tk4d2b,https://www.reddit.com/r/BigIsland/comments/tk4d2b/coffee_the_best_budget_coffee_in_the_island/,coffee? the best budget coffee in the island?,/r/BigIsland/comments/tk4d2b/coffee_the_best_budget_coffee_in_the_island/i1pe8tv/,1,r/BigIsland,0,1
"I mean, they are supposed to be the professionals, not the homeowner. No need to victim-blame. This was some foul shit. Thanks for posting OP!",t2_11a648,keanenottheband,0,1647979126.0,0,t1_i1pcuxs,i1pcuxs,False,Evil_Merlin,t3_tk9h4y,https://www.reddit.com/r/BigIsland/comments/tk9h4y/avoid_backyard_monkeys_they_did_this_to_my_yard/,Avoid Backyard Monkeys. They did this to my yard.,/r/BigIsland/comments/tk9h4y/avoid_backyard_monkeys_they_did_this_to_my_yard/i1pcuxs/,41,r/BigIsland,0,41
Still illegal regardless. I don't agree with offering advice that can land you in legal trouble.,t2_9jnscwnm,CoffeeShackProds,0,1647978860.0,0,t1_i1pc62v,i1pc62v,False,Ok_Pay5513,t3_tjm119,https://www.reddit.com/r/BigIsland/comments/tjm119/has_anyone_had_to_deal_with_a_lot_of_drones/,Has anyone had to deal with a lot of drones flying over them?,/r/BigIsland/comments/tjm119/has_anyone_had_to_deal_with_a_lot_of_drones/i1pc62v/,1,r/BigIsland,0,1
I wouldn't worry about it. Once grass returns the aina will settle and you can return to using a mower.  The dirt here will not stay rutted for long unlike the clay stuff you find in the mainland.,t2_102m67,Second2n0ne,1,1647978623.0,0,t1_i1pbjxp,i1pbjxp,True,Evil_Merlin,t3_tk9h4y,https://www.reddit.com/r/BigIsland/comments/tk9h4y/avoid_backyard_monkeys_they_did_this_to_my_yard/,Avoid Backyard Monkeys. They did this to my yard.,/r/BigIsland/comments/tk9h4y/avoid_backyard_monkeys_they_did_this_to_my_yard/i1pbjxp/,1,r/BigIsland,0,1
Ooh I like it. “My kids were just flying their kites”,t2_aabpo927,Ok_Pay5513,0,1647978466.0,0,t1_i1pb534,i1pb534,False,Ok_Pay5513,t3_tjm119,https://www.reddit.com/r/BigIsland/comments/tjm119/has_anyone_had_to_deal_with_a_lot_of_drones/,Has anyone had to deal with a lot of drones flying over them?,/r/BigIsland/comments/tjm119/has_anyone_had_to_deal_with_a_lot_of_drones/i1pb534/,2,r/BigIsland,0,2
"There was a kid last week at volcano farmers market (early Sunday morning) selling fern shoots and packaged cookies to support a science team. They weren’t hapuʻu ferns though, i think it was warabi.",t2_98i5jabi,Rude_Citron9016,0,1647978082.0,0,t1_i1pa4zn,i1pa4zn,False,OxDriverKuroku,t3_tjstay,https://www.reddit.com/r/BigIsland/comments/tjstay/just_a_friendly_reminder_that_its_kaguma_season/,Just a friendly reminder that it's Kaguma season,/r/BigIsland/comments/tjstay/just_a_friendly_reminder_that_its_kaguma_season/i1pa4zn/,1,r/BigIsland,0,1
"Oooooh, the Valley is closed. This is why honolii is packed with tourists now. All sitting on the beach sun tanning! brah go other beach no crowd up the one surf spot in town. rant pau.",t2_72bdtqu0,IntentionChemical977,0,1647977962.0,0,t1_i1p9tri,i1p9tri,True,cookiejar327,t3_tj3hc2,https://www.reddit.com/r/BigIsland/comments/tj3hc2/waipio_valley_question/,Waipio Valley - Question,/r/BigIsland/comments/tj3hc2/waipio_valley_question/i1p9tri/,1,r/BigIsland,0,1
Woman at early Sunday morning Volcano farmers market sells her Moʻaula Kau coffee from Pahala for $28/pound. It’s not my everyday coffee but it’s excellent and I like her.,t2_98i5jabi,Rude_Citron9016,0,1647977774.0,0,t1_i1p9c7z,i1p9c7z,True,Wide-Visual,t3_tk4d2b,https://www.reddit.com/r/BigIsland/comments/tk4d2b/coffee_the_best_budget_coffee_in_the_island/,coffee? the best budget coffee in the island?,/r/BigIsland/comments/tk4d2b/coffee_the_best_budget_coffee_in_the_island/i1p9c7z/,1,r/BigIsland,0,1
"When we did this we had the kayaks carry all our gear. Split the group up, the hikers could book it to Waimanu with light packs and then we switched coming out. I think you just get a Waimanu permit and then do the rest yourself, but since you can't get into Waipio right now I doubt they are approving Waimanu permits.",t2_4zf7g,djn808,0,1647977512.0,0,t1_i1p8obj,i1p8obj,True,LaScoundrelle,t3_tjwa8q,https://www.reddit.com/r/BigIsland/comments/tjwa8q/i_read_in_old_blogs_it_should_be_possible_to_take/,"I read in old blogs it should be possible to take a boat to Waimanu Valley. Does anyone know if it's still possible to do this, and how to arrange it?",/r/BigIsland/comments/tjwa8q/i_read_in_old_blogs_it_should_be_possible_to_take/i1p8obj/,1,r/BigIsland,0,1
Username checks out,t2_aabpo927,Ok_Pay5513,0,1647976450.0,0,t1_i1p5xtm,i1p5xtm,False,Ok_Pay5513,t3_tjm119,https://www.reddit.com/r/BigIsland/comments/tjm119/has_anyone_had_to_deal_with_a_lot_of_drones/,Has anyone had to deal with a lot of drones flying over them?,/r/BigIsland/comments/tjm119/has_anyone_had_to_deal_with_a_lot_of_drones/i1p5xtm/,1,r/BigIsland,0,1
Yes. Welcome to future. Your new house includes anti-drone defenses.,t2_98i5jabi,Rude_Citron9016,0,1647976439.0,0,t1_i1p5wu8,i1p5wu8,False,Ok_Pay5513,t3_tjm119,https://www.reddit.com/r/BigIsland/comments/tjm119/has_anyone_had_to_deal_with_a_lot_of_drones/,Has anyone had to deal with a lot of drones flying over them?,/r/BigIsland/comments/tjm119/has_anyone_had_to_deal_with_a_lot_of_drones/i1p5wu8/,2,r/BigIsland,0,2
"It might be expensive but you could try contacting Craig Hawk of C Hawk Sea Service to see what he says: 

[https://www.chawkhawaii.com/](https://www.chawkhawaii.com/)",t2_4dg9zcvb,ThrowRA20192019,0,1647976314.0,0,t1_i1p5lf9,i1p5lf9,True,LaScoundrelle,t3_tjwa8q,https://www.reddit.com/r/BigIsland/comments/tjwa8q/i_read_in_old_blogs_it_should_be_possible_to_take/,"I read in old blogs it should be possible to take a boat to Waimanu Valley. Does anyone know if it's still possible to do this, and how to arrange it?",/r/BigIsland/comments/tjwa8q/i_read_in_old_blogs_it_should_be_possible_to_take/i1p5lf9/,1,r/BigIsland,0,1
"You can kayak, but I would not recommend it (or any boat) unless you were experienced and picked a good weather day.

But currently I believe Waimanu is closed.  It requires permits to camp and no permits are being issued.  And if not camping... well its probably not worth the day trip (even though people do it).",t2_hqznc,zhamz,0,1647976271.0,0,t1_i1p5hf7,i1p5hf7,True,LaScoundrelle,t3_tjwa8q,https://www.reddit.com/r/BigIsland/comments/tjwa8q/i_read_in_old_blogs_it_should_be_possible_to_take/,"I read in old blogs it should be possible to take a boat to Waimanu Valley. Does anyone know if it's still possible to do this, and how to arrange it?",/r/BigIsland/comments/tjwa8q/i_read_in_old_blogs_it_should_be_possible_to_take/i1p5hf7/,3,r/BigIsland,0,3
Maybe a kite with Kevlar string and lots of streamers as tails hovering overhead.,t2_7ppxg,FooFatFighters,0,1647976245.0,0,t1_i1p5ewd,i1p5ewd,False,Ok_Pay5513,t3_tjm119,https://www.reddit.com/r/BigIsland/comments/tjm119/has_anyone_had_to_deal_with_a_lot_of_drones/,Has anyone had to deal with a lot of drones flying over them?,/r/BigIsland/comments/tjm119/has_anyone_had_to_deal_with_a_lot_of_drones/i1p5ewd/,3,r/BigIsland,0,3
"Everything thing makes sense in this except:

* They would not accomodate your request to reschedule
* You went ahead and let them

Your original assesment was obviously correct; too wet to do the work.  

I mow \~40 acres and while it is  a challenge to keep up with it in the rainy season, it is best to wait for it to get relatively dry if possible.

Should have stood your ground and trusted yourself.  But you didn't. Thats on you.

Why they wouldn't accomodate a reschedule is on them. Thats wierd.

If you really need to mow when it is super wet, then get some guys to do it with machete and weed trimmers.  Even on 1.5 acres.  I've hacked through 20' tall grass that way.  Sometimes its actually easier than compared with a flail or mower.",t2_hqznc,zhamz,0,1647975639.0,0,t1_i1p3vkj,i1p3vkj,True,Evil_Merlin,t3_tk9h4y,https://www.reddit.com/r/BigIsland/comments/tk9h4y/avoid_backyard_monkeys_they_did_this_to_my_yard/,Avoid Backyard Monkeys. They did this to my yard.,/r/BigIsland/comments/tk9h4y/avoid_backyard_monkeys_they_did_this_to_my_yard/i1p3vkj/,20,r/BigIsland,0,20
hopefully this rain here helps level it out,t2_a2b8mw5,rameshbalsekar,0,1647974903.0,0,t1_i1p1znl,i1p1znl,True,Evil_Merlin,t3_tk9h4y,https://www.reddit.com/r/BigIsland/comments/tk9h4y/avoid_backyard_monkeys_they_did_this_to_my_yard/,Avoid Backyard Monkeys. They did this to my yard.,/r/BigIsland/comments/tk9h4y/avoid_backyard_monkeys_they_did_this_to_my_yard/i1p1znl/,1,r/BigIsland,0,1
"You are not required to use their service, even if they say “no” to coming a different day. It’s your property, without permission to enter it’s trespassing. 

But I’m sure they told you it’d be fine etc

However, you should have told them a day or two before not to come, rather than waiting until day of (or worse, after the crew arrived).",t2_2tbws95v,statsthrower,0,1647974729.0,0,t1_i1p1jjp,i1p1jjp,False,Evil_Merlin,t3_tk9h4y,https://www.reddit.com/r/BigIsland/comments/tk9h4y/avoid_backyard_monkeys_they_did_this_to_my_yard/,Avoid Backyard Monkeys. They did this to my yard.,/r/BigIsland/comments/tk9h4y/avoid_backyard_monkeys_they_did_this_to_my_yard/i1p1jjp/,15,r/BigIsland,0,15
Oof that sucks man. Your probably right about re-leveling your property it’ll be the only way to stop the giant puddles forming. Big companies hardly care about the land they work on as long as they get paid. Sorry you gotta deal with this BS.,t2_5lmndp3i,Hannie_5,0,1647974534.0,0,t1_i1p11nu,i1p11nu,True,Evil_Merlin,t3_tk9h4y,https://www.reddit.com/r/BigIsland/comments/tk9h4y/avoid_backyard_monkeys_they_did_this_to_my_yard/,Avoid Backyard Monkeys. They did this to my yard.,/r/BigIsland/comments/tk9h4y/avoid_backyard_monkeys_they_did_this_to_my_yard/i1p11nu/,5,r/BigIsland,0,5
If you hire someone to bring in big machines they will leave big tracks.,t2_j950u2dt,Vegetable_History767,1,1647974191.0,0,t1_i1p05m6,i1p05m6,False,Evil_Merlin,t3_tk9h4y,https://www.reddit.com/r/BigIsland/comments/tk9h4y/avoid_backyard_monkeys_they_did_this_to_my_yard/,Avoid Backyard Monkeys. They did this to my yard.,/r/BigIsland/comments/tk9h4y/avoid_backyard_monkeys_they_did_this_to_my_yard/i1p05m6/,4,r/BigIsland,0,4
"Good idea actually. It’s illegal as others said to damage drones, so just get one that is good being the one that survives drone collisions. Then chalk it up as an accident.",t2_2tbws95v,statsthrower,0,1647974009.0,0,t1_i1ozoor,i1ozoor,False,Ok_Pay5513,t3_tjm119,https://www.reddit.com/r/BigIsland/comments/tjm119/has_anyone_had_to_deal_with_a_lot_of_drones/,Has anyone had to deal with a lot of drones flying over them?,/r/BigIsland/comments/tjm119/has_anyone_had_to_deal_with_a_lot_of_drones/i1ozoor/,3,r/BigIsland,0,3
"You don't have to be Hawaiian to fish at Halape. You need to be Hawaiian to fish/gather the coast up to near Halape,  Hawaiian from Kalapana specifically, but after that point anyone can fish. See National Park info - [https://www.nps.gov/havo/planyourvisit/hike\_halape.htm](https://www.nps.gov/havo/planyourvisit/hike_halape.htm) *Fishing - Fishing along the coastline from the park's eastern boundary to a point midway between Keauhou and Halapē is restricted to Native Hawaiian residents of the Kalapana area. It is your responsibility to understand and obey all fishing regulations.*",t2_j950u2dt,Vegetable_History767,0,1647973888.0,0,t1_i1ozdkt,i1ozdkt,False,punabear,t3_tjq1oc,https://www.reddit.com/r/BigIsland/comments/tjq1oc/hiking_to_halape/,Hiking to Halape,/r/BigIsland/comments/tjq1oc/hiking_to_halape/i1ozdkt/,3,r/BigIsland,0,3
TLDR: My side and back yard were destroyed by Backyard Monkeys after an attempt to mow and trim...,t2_hw8kx,Evil_Merlin,0,1647973828.0,0,t1_i1oz7ye,i1oz7ye,False,Evil_Merlin,t3_tk9h4y,https://www.reddit.com/r/BigIsland/comments/tk9h4y/avoid_backyard_monkeys_they_did_this_to_my_yard/,Avoid Backyard Monkeys. They did this to my yard.,/r/BigIsland/comments/tk9h4y/avoid_backyard_monkeys_they_did_this_to_my_yard/i1oz7ye/,8,r/BigIsland,0,8
"he seems confident it’s his neighbor. If it were me I’d be 100% willing to take the ridiculously small risk risk that it’s again said neighbor rather than for some weird fucking reason, on that particular day, over my particular house, the military decided to fly a drone.",t2_2tbws95v,statsthrower,0,1647973783.0,0,t1_i1oz3qe,i1oz3qe,False,Ok_Pay5513,t3_tjm119,https://www.reddit.com/r/BigIsland/comments/tjm119/has_anyone_had_to_deal_with_a_lot_of_drones/,Has anyone had to deal with a lot of drones flying over them?,/r/BigIsland/comments/tjm119/has_anyone_had_to_deal_with_a_lot_of_drones/i1oz3qe/,2,r/BigIsland,0,2
They’re a landscaping/tree service off of volcano road in Mountain View,t2_kgasd41s,charliesheensmentor,0,1647973707.0,0,t1_i1oywmb,i1oywmb,False,Evil_Merlin,t3_tk9h4y,https://www.reddit.com/r/BigIsland/comments/tk9h4y/avoid_backyard_monkeys_they_did_this_to_my_yard/,Avoid Backyard Monkeys. They did this to my yard.,/r/BigIsland/comments/tk9h4y/avoid_backyard_monkeys_they_did_this_to_my_yard/i1oywmb/,1,r/BigIsland,0,1
"So a few months ago we needed our land mowed. The previous owners had not done it in almost 3 years, and my tractor and trimmer were not enough to do much of anything except right around the house. So we asked around and got a bid from Backyard Monkeys. 

When they showed up, it had been raining non stop for 10 days. I asked them if they could come another day after the water had stopped puddling. They said no. 

They brought in a larger power and left this in the yard. All those tracks you see at the top right of the image are tracks up to 16"" deep in some areas. Most of it is 6-8"" deep. So now I have massive ruts on the land, filling with water.

Backyard Monkeys wants to bring in cinder fill... at my cost of course, to ""fix the issue"". Looks like it would need two loads of cinder, but after the first big rain it would all was away anyway.

So now we are stuck. I'm thinking its best to bring in someone with a larger dozer and just re-level the whole of the land. 

This is just shy of 1.8 acres of land now turned into an absolutely horrible condition.

I've reached out to Backyard a few times, and now they are not returning my calls.

So just beware... you could end up with your yard ruined by people who claim to know how to do Hawai'i yards the right way.",t2_hw8kx,Evil_Merlin,0,1647973677.0,0,t1_i1oytr7,i1oytr7,True,Evil_Merlin,t3_tk9h4y,https://www.reddit.com/r/BigIsland/comments/tk9h4y/avoid_backyard_monkeys_they_did_this_to_my_yard/,Avoid Backyard Monkeys. They did this to my yard.,/r/BigIsland/comments/tk9h4y/avoid_backyard_monkeys_they_did_this_to_my_yard/i1oytr7/,69,r/BigIsland,0,69
Kamikaze drone would help here.,t2_14ol15,poweredbytexas,0,1647973548.0,0,t1_i1oyhtc,i1oyhtc,True,Ok_Pay5513,t3_tjm119,https://www.reddit.com/r/BigIsland/comments/tjm119/has_anyone_had_to_deal_with_a_lot_of_drones/,Has anyone had to deal with a lot of drones flying over them?,/r/BigIsland/comments/tjm119/has_anyone_had_to_deal_with_a_lot_of_drones/i1oyhtc/,2,r/BigIsland,0,2
What?,t2_4sh1np8n,disharmony-hellride,0,1647973475.0,0,t1_i1oyavr,i1oyavr,True,Evil_Merlin,t3_tk9h4y,https://www.reddit.com/r/BigIsland/comments/tk9h4y/avoid_backyard_monkeys_they_did_this_to_my_yard/,Avoid Backyard Monkeys. They did this to my yard.,/r/BigIsland/comments/tk9h4y/avoid_backyard_monkeys_they_did_this_to_my_yard/i1oyavr/,-8,r/BigIsland,0,-8
You won't get good coffee for cheap. Look for peaberry and happily pay for it.,t2_4dbs9,the_glass_gecko,0,1647972832.0,0,t1_i1owmb6,i1owmb6,True,Wide-Visual,t3_tk4d2b,https://www.reddit.com/r/BigIsland/comments/tk4d2b/coffee_the_best_budget_coffee_in_the_island/,coffee? the best budget coffee in the island?,/r/BigIsland/comments/tk4d2b/coffee_the_best_budget_coffee_in_the_island/i1owmb6/,3,r/BigIsland,0,3
"Was not aware of the Hawaiian rule.  We wouldn't dare take a chance with the patrol boats every 30, or even 15 minute passes.  The bathroom thing wasn't a problem.  I used to camp every summer down South Point as a kid.  I wrote that for anyone that was interested.  We camped at Keauhou.  Nothing like waking up and walking 20 feet to tidepools filled with fish and LIVE CORAL!!  That was the best part.  That and the fresh water pond at Halape.  I now know where they get those Opihi shell bras from.  Some buggahs was bigger than my hand.",t2_cc7b5,YellIntoWishingWells,0,1647972806.0,0,t1_i1owju1,i1owju1,False,punabear,t3_tjq1oc,https://www.reddit.com/r/BigIsland/comments/tjq1oc/hiking_to_halape/,Hiking to Halape,/r/BigIsland/comments/tjq1oc/hiking_to_halape/i1owju1/,2,r/BigIsland,0,2
"“Best” and “budget” are unfortunately mutually exclusive when it comes to coffee. It probably also depends on what you’re looking for in a coffee. As a local (in that I live here, but I’m not native), I buy cheaper imported stuff for everyday cold brew and espresso and splurge on nice things for pour overs and fancy cold brew. 

Paradise Coffee Roasters is a fantastic local roaster. They do small batches of specialty coffee but some of it is not grown here (the owner has great relationships with the producers in other countries). They do phenomenal stuff with novel fermentation methods (novel to coffee anyway). They have a small storefront in down town Hilo and give samples. They had a fancy cold brew last weekend (don’t remember which) that I wanted to bathe in.

Rusty’s Hawaiian Coffee is very nice and roasts only big island beans.

There’s also a nice coffee shop in Mountain View called Koana that sells coffee and does pour overs. They’re less out there than Paradise, so probably closer to what “coffee” means to some people. It’s also very good and the owner is very knowledgeable. Also try their spiced hot chocolate.",t2_f02cikk8,corgi_data_wrangler,0,1647971696.0,0,t1_i1otnzc,i1otnzc,True,Wide-Visual,t3_tk4d2b,https://www.reddit.com/r/BigIsland/comments/tk4d2b/coffee_the_best_budget_coffee_in_the_island/,coffee? the best budget coffee in the island?,/r/BigIsland/comments/tk4d2b/coffee_the_best_budget_coffee_in_the_island/i1otnzc/,4,r/BigIsland,0,4
Llanes Estates in Holualoha is the best I’ve had…so far. Don’t know what the price is.,t2_63f9cun3,konastump,0,1647970142.0,0,t1_i1opm5y,i1opm5y,True,Wide-Visual,t3_tk4d2b,https://www.reddit.com/r/BigIsland/comments/tk4d2b/coffee_the_best_budget_coffee_in_the_island/,coffee? the best budget coffee in the island?,/r/BigIsland/comments/tk4d2b/coffee_the_best_budget_coffee_in_the_island/i1opm5y/,1,r/BigIsland,0,1
There is more “Kona Coffee” sold than produced…. Let that sink in for a minute. If you truly want Kona coffee go to an actual farm… support the local economy!,t2_6q63g2j9,youkendoit86,0,1647969501.0,0,t1_i1onxc6,i1onxc6,True,Wide-Visual,t3_tk4d2b,https://www.reddit.com/r/BigIsland/comments/tk4d2b/coffee_the_best_budget_coffee_in_the_island/,coffee? the best budget coffee in the island?,/r/BigIsland/comments/tk4d2b/coffee_the_best_budget_coffee_in_the_island/i1onxc6/,10,r/BigIsland,0,10
"> You can't fish or dive there as it's a sanctuary.

You can, but you gotta be Hawaiian.

> There is a bathroom but it's a mile walk from shore.

Agree, this certainly isn't ""glamping"".

Did you go to Keauhou too?  It's just a mile or so down the coast, maybe not as classically ""beautiful"" as Halape, but has more shelter.",t2_98frg,spam-musubi,0,1647969004.0,0,t1_i1ommcu,i1ommcu,False,punabear,t3_tjq1oc,https://www.reddit.com/r/BigIsland/comments/tjq1oc/hiking_to_halape/,Hiking to Halape,/r/BigIsland/comments/tjq1oc/hiking_to_halape/i1ommcu/,2,r/BigIsland,0,2
"The Hawaii grown coffee market is insanely competitive, all of the beans grown will be sold, no discounts necessary. Kind of like oil. 

Locals buy the usual name brand suspects you'll find in any target, costco, Walmart in America. Coffee culture isn't really a thing here, it's mostly for tourists and export. Not that many people who live here don't enjoy coffee. 

Unfortunately it's not like papaya. Where tourists and locals alike can buy cheaply because it's abundant. 

Finally, since you're visiting, it would be lovely to hear that you paid full price to support some local businesses. 

Have a great trip.",t2_oycjo,000066,0,1647968745.0,0,t1_i1olxk8,i1olxk8,True,Wide-Visual,t3_tk4d2b,https://www.reddit.com/r/BigIsland/comments/tk4d2b/coffee_the_best_budget_coffee_in_the_island/,coffee? the best budget coffee in the island?,/r/BigIsland/comments/tk4d2b/coffee_the_best_budget_coffee_in_the_island/i1olxk8/,12,r/BigIsland,0,12
"I don't know much about kayaking, but wouldnt it have been WAY easier if they had just swum the kayak past the break? Waves aren't that big",t2_3hc2fvsk,Krispythecat,0,1647968326.0,0,t1_i1oku0h,i1oku0h,False,LaScoundrelle,t3_tjwa8q,https://www.reddit.com/r/BigIsland/comments/tjwa8q/i_read_in_old_blogs_it_should_be_possible_to_take/,"I read in old blogs it should be possible to take a boat to Waimanu Valley. Does anyone know if it's still possible to do this, and how to arrange it?",/r/BigIsland/comments/tjwa8q/i_read_in_old_blogs_it_should_be_possible_to_take/i1oku0h/,1,r/BigIsland,0,1
I know Kauai isn’t “local” in this case but the big bags of Kauai Coffee Co at Costco are pretty good.,t2_kwur08pf,AdamISOS,0,1647967810.0,0,t1_i1ojgw8,i1ojgw8,False,Wide-Visual,t3_tk4d2b,https://www.reddit.com/r/BigIsland/comments/tk4d2b/coffee_the_best_budget_coffee_in_the_island/,coffee? the best budget coffee in the island?,/r/BigIsland/comments/tk4d2b/coffee_the_best_budget_coffee_in_the_island/i1ojgw8/,2,r/BigIsland,0,2
"In my opinion, it really wasn't.  The heiau's and palm tree carvings were neat, great scuba diving but, all in all, not worth an 11 mile hike.  You can't fish or dive there as it's a sanctuary.  There is a bathroom but it's a mile walk from shore.  Quite a bit of centipedes, too.  I am glad I did it for the experience, though.",t2_cc7b5,YellIntoWishingWells,0,1647967619.0,0,t1_i1oiysz,i1oiysz,False,punabear,t3_tjq1oc,https://www.reddit.com/r/BigIsland/comments/tjq1oc/hiking_to_halape/,Hiking to Halape,/r/BigIsland/comments/tjq1oc/hiking_to_halape/i1oiysz/,1,r/BigIsland,0,1
My friend found it at a booth at the Hilo market. I think the guy was self publishing and vending in Hilo so I don’t think it’s online.,t2_jldkv4w,ray_wathers,0,1647966438.0,0,t1_i1ofv1n,i1ofv1n,False,CoquiEater,t3_tj4wjg,https://www.reddit.com/r/BigIsland/comments/tj4wjg/why_dont_we_just_eat_all_the_coqui_frogs/,Why Don’t We Just Eat All the Coqui Frogs,/r/BigIsland/comments/tj4wjg/why_dont_we_just_eat_all_the_coqui_frogs/i1ofv1n/,1,r/BigIsland,0,1
Costco,t2_4dfgpn31,aajensen14,0,1647966419.0,0,t1_i1oft92,i1oft92,True,Wide-Visual,t3_tk4d2b,https://www.reddit.com/r/BigIsland/comments/tk4d2b/coffee_the_best_budget_coffee_in_the_island/,coffee? the best budget coffee in the island?,/r/BigIsland/comments/tk4d2b/coffee_the_best_budget_coffee_in_the_island/i1oft92/,5,r/BigIsland,0,5
"I got talked into a ""camping trip to a remote beach"" by some friends back in high school. It was hot. Steep. Long. There was no beach. Still a cool experience that I get to bitch about a few decades later though.",t2_t7k9d,sckego,0,1647964046.0,0,t1_i1o9o6u,i1o9o6u,True,punabear,t3_tjq1oc,https://www.reddit.com/r/BigIsland/comments/tjq1oc/hiking_to_halape/,Hiking to Halape,/r/BigIsland/comments/tjq1oc/hiking_to_halape/i1o9o6u/,2,r/BigIsland,0,2
"I second this. Although locally grown and roasted beans doesn't usually go with ""budget"", but I really hope I'm wrong!",t2_dyk0ubax,frothycoffee_45,0,1647962449.0,0,t1_i1o5nu3,i1o5nu3,True,Wide-Visual,t3_tk4d2b,https://www.reddit.com/r/BigIsland/comments/tk4d2b/coffee_the_best_budget_coffee_in_the_island/,coffee? the best budget coffee in the island?,/r/BigIsland/comments/tk4d2b/coffee_the_best_budget_coffee_in_the_island/i1o5nu3/,-2,r/BigIsland,0,-2
"I wouldn't wanna be caught with the 'weapon' let alone off my property. If by chance it's recording or streaming it could possibly record/stream me leaving my property w a mask. Its federally illegal to destroy, damage or interfere with a drone. That takes some confidence you are certain it isn't any sort of law enforcement practicing in your neighborhood. A friend of mine in the military (cannot remember which affiliation) told me about a week ago or so that they have been practicing flying drones at night mostly here on the big island. Then there's this https://www.civilbeat.org/2021/09/military-practices-using-drones-for-maritime-surveillance-in-hawaii/",t2_9jnscwnm,CoffeeShackProds,0,1647962290.0,0,t1_i1o59g1,i1o59g1,False,Ok_Pay5513,t3_tjm119,https://www.reddit.com/r/BigIsland/comments/tjm119/has_anyone_had_to_deal_with_a_lot_of_drones/,Has anyone had to deal with a lot of drones flying over them?,/r/BigIsland/comments/tjm119/has_anyone_had_to_deal_with_a_lot_of_drones/i1o59g1/,0,r/BigIsland,0,0
