body,author_fullname,author.name,controversiality,created,downs,fullname,id,is_root,link_author,link_id,link_permalink,link_title,permalink,score,subreddit_name_prefixed,total_awards_received,ups
"Yea I was thinking the same. A flow across Saddle Rd or east, south, or west across Hwy 11 could make a normally short drive an extremely long drive. KOA sits on Hualalai’s last lava flow so I think it’s safe but would probably cause a major disruption to air travel. Having two solid airports and harbors is comforting.",t2_rb57u,OkieFinokie,0,1647651908.0,0,t1_i187bw8,i187bw8,False,OkieFinokie,t3_thiv50,https://www.reddit.com/r/BigIsland/comments/thiv50/when_mauna_loa_eruptskupuna_talk_story/,When Mauna Loa erupts…Kupuna talk story,/r/BigIsland/comments/thiv50/when_mauna_loa_eruptskupuna_talk_story/i187bw8/,2,r/BigIsland,0,2
"This is the way. Or, if you want something more substantial, Pine Tree Cafe is just a little further down the highway. Order off their specials board or get the hamburger deluxe.",t2_98i5jabi,Rude_Citron9016,0,1647651478.0,0,t1_i186fkj,i186fkj,False,yesdog13,t3_tgum6r,https://www.reddit.com/r/BigIsland/comments/tgum6r/costco_trip_to_kona_from_puna_lunch_suggests/,"Costco trip to Kona from Puna, lunch suggests please",/r/BigIsland/comments/tgum6r/costco_trip_to_kona_from_puna_lunch_suggests/i186fkj/,2,r/BigIsland,0,2
"T-Mobile has both home internet and Hotspots. As far as coverage in Hawi it depends on what part of Hawi if you're going wireless. You can test with this program for free: [https://www.t-mobile.com/offers/free-trial](https://www.t-mobile.com/offers/free-trial)

I've used my T-Mobile phone easy up the the county cemetery just South of entering Hawi town. But someplace like Mookini Heiau I got no signal a few years ago. Coverage changes for all cellphone providers, usually for the better, over time.",t2_7ppxg,FooFatFighters,0,1647650064.0,0,t1_i183hi0,i183hi0,True,blackwatch42,t3_tfy51p,https://www.reddit.com/r/BigIsland/comments/tfy51p/moving_to_big_island_what_does_everyone_do_for/,"Moving to Big Island, what does everyone do for wifi and internet options near hawi?",/r/BigIsland/comments/tfy51p/moving_to_big_island_what_does_everyone_do_for/i183hi0/,2,r/BigIsland,0,2
"Interested to see what kind of stories you wind up with.

No matter which way it goes, it'll change somebody's life. The path taken by the lava has a huge impact on the urgency of our response; the steeper the slope, the quicker to the shore it'll be.

Beyond the potential insanity of the moment: what if it wipes out the saddle road? Or cuts off access to KOA, from the south _or_ from the north? A big chunk of the island's population could have ""normal"" disrupted for years.",t2_vkk3b,lanclos,0,1647648860.0,0,t1_i180y0b,i180y0b,True,OkieFinokie,t3_thiv50,https://www.reddit.com/r/BigIsland/comments/thiv50/when_mauna_loa_eruptskupuna_talk_story/,When Mauna Loa erupts…Kupuna talk story,/r/BigIsland/comments/thiv50/when_mauna_loa_eruptskupuna_talk_story/i180y0b/,6,r/BigIsland,0,6
"Better go for a real degree at a real school.

https://www.usnews.com/best-graduate-schools/top-fine-arts-schools/photography-rankings",t2_hg6qu4uk,rambogorillacat,0,1647648559.0,0,t1_i180atc,i180atc,False,iNT3LL,t3_tgp75l,https://www.reddit.com/r/BigIsland/comments/tgp75l/photography_jobs_on_the_big_island/,Photography Jobs on the Big Island,/r/BigIsland/comments/tgp75l/photography_jobs_on_the_big_island/i180atc/,1,r/BigIsland,0,1
"I've been staring at it from the lower highway for the longest time, so I finally found a way to get to it and this is the result.",t2_6j1ny,murder_nectar,0,1647647049.0,0,t1_i17x3bg,i17x3bg,False,murder_nectar,t3_thg5y1,https://www.reddit.com/r/BigIsland/comments/thg5y1/1801_hualalai/,"1801, Hualalai",/r/BigIsland/comments/thg5y1/1801_hualalai/i17x3bg/,1,r/BigIsland,0,1
It is a short walk from spencer's beach,t2_aogmk,Metoke,0,1647645828.0,0,t1_i17ugp7,i17ugp7,True,purpleddit,t3_thh3vp,https://www.reddit.com/r/BigIsland/comments/thh3vp/mauna_kea_beach/,Mauna Kea beach,/r/BigIsland/comments/thh3vp/mauna_kea_beach/i17ugp7/,1,r/BigIsland,1,1
"The Governor of Hawaii flew Lawrence Rockefeller in a Brand new helicopter, no one knows exactly what was said, but legend is, “if you build a Hotel there I will build a highway” I tell people go to the gate, ask for a parking pass, if they are out go to Hapuna. There are no private beaches in Hawaii, but parking and access is getting difficult.",t2_1ydkqmfj,oldcarnutjag,0,1647644547.0,0,t1_i17rpnc,i17rpnc,True,purpleddit,t3_thh3vp,https://www.reddit.com/r/BigIsland/comments/thh3vp/mauna_kea_beach/,Mauna Kea beach,/r/BigIsland/comments/thh3vp/mauna_kea_beach/i17rpnc/,2,r/BigIsland,0,2
"Keep in mind that on a weekend, the locals will be flocking as well.

If you can, better to do it on a weekday.",t2_4huex,KaneHau,0,1647643626.0,0,t1_i17poq0,i17poq0,True,purpleddit,t3_thh3vp,https://www.reddit.com/r/BigIsland/comments/thh3vp/mauna_kea_beach/,Mauna Kea beach,/r/BigIsland/comments/thh3vp/mauna_kea_beach/i17poq0/,14,r/BigIsland,0,14
"7:30am works most of the time.   The beach is nice but to me the beauty there lies with the hotel.   It has such a wonderful, old school elegance to it.    Make sure to walk around and check it out.   

Good luck.",t2_c2tfyygo,skimbelruski,0,1647643420.0,0,t1_i17p8dd,i17p8dd,True,purpleddit,t3_thh3vp,https://www.reddit.com/r/BigIsland/comments/thh3vp/mauna_kea_beach/,Mauna Kea beach,/r/BigIsland/comments/thh3vp/mauna_kea_beach/i17p8dd/,8,r/BigIsland,0,8
Nice! I've never been up there so thanks for the views.,t2_4mvpu,cutelyaware,0,1647643140.0,0,t1_i17olv0,i17olv0,True,murder_nectar,t3_thg5y1,https://www.reddit.com/r/BigIsland/comments/thg5y1/1801_hualalai/,"1801, Hualalai",/r/BigIsland/comments/thg5y1/1801_hualalai/i17olv0/,2,r/BigIsland,0,2
"https://www.airbnb.com/users/show/72883414
I have stayed with these folks on 2 seperate trips to the BI. They are amazing hosts and also do a lot of long term stays. I've stayed for 14 days at most, so I don't know the discounts they give for months or longer but you should give them a look and contact and see if it fits your budget. Extremely laid back hosts that will chat with you or just leave you be, but they are always available if you need them.",t2_9pru11rb,Pale-Helicopter-6140,0,1647642984.0,0,t1_i17o9gk,i17o9gk,True,puffinssuck27,t3_tecono,https://www.reddit.com/r/BigIsland/comments/tecono/staying_in_kona/,Staying in Kona?,/r/BigIsland/comments/tecono/staying_in_kona/i17o9gk/,1,r/BigIsland,0,1
did you get keys to the gates,t2_6u8ch,frapawhack,0,1647641588.0,0,t1_i17l3vl,i17l3vl,True,DroneyMak,t3_tgyqe5,https://www.reddit.com/r/BigIsland/comments/tgyqe5/the_magic_of_mana_road/,The Magic of Mana Road,/r/BigIsland/comments/tgyqe5/the_magic_of_mana_road/i17l3vl/,2,r/BigIsland,0,2
"Big island pizza isn’t too expensive IF you split a large between two people and just get a beer or two. It’s right next to the Costco and their pizza is fantastic. Check the hours before you go, it’s only open like five hours a day.",t2_97thcyfy,folieadeuxxmachinae,0,1647640302.0,0,t1_i17i4nw,i17i4nw,True,yesdog13,t3_tgum6r,https://www.reddit.com/r/BigIsland/comments/tgum6r/costco_trip_to_kona_from_puna_lunch_suggests/,"Costco trip to Kona from Puna, lunch suggests please",/r/BigIsland/comments/tgum6r/costco_trip_to_kona_from_puna_lunch_suggests/i17i4nw/,3,r/BigIsland,0,3
Can we really not keep anything a secret anymore?,t2_kmw0zsis,Ok-Year7600,0,1647632657.0,0,t1_i16zd44,i16zd44,True,DroneyMak,t3_tgyqe5,https://www.reddit.com/r/BigIsland/comments/tgyqe5/the_magic_of_mana_road/,The Magic of Mana Road,/r/BigIsland/comments/tgyqe5/the_magic_of_mana_road/i16zd44/,2,r/BigIsland,0,2
Came here looking for this. We are back on the big island in August and this is our first stop.,t2_48c2t,TheFudge,0,1647632459.0,0,t1_i16yw16,i16yw16,False,h2ogurlie,t3_tg2fpb,https://www.reddit.com/r/BigIsland/comments/tg2fpb/local_must_eats/,Local Must Eats?,/r/BigIsland/comments/tg2fpb/local_must_eats/i16yw16/,1,r/BigIsland,0,1
Pine Tree Cafe is nearby and has great good.,t2_1g0g7aaq,QuackedUp99,0,1647630212.0,0,t1_i16tgpo,i16tgpo,True,yesdog13,t3_tgum6r,https://www.reddit.com/r/BigIsland/comments/tgum6r/costco_trip_to_kona_from_puna_lunch_suggests/,"Costco trip to Kona from Puna, lunch suggests please",/r/BigIsland/comments/tgum6r/costco_trip_to_kona_from_puna_lunch_suggests/i16tgpo/,5,r/BigIsland,0,5
Also another cool place to check out is Papa’aloa Store. They were able to preserved a lot of aspects of the old general store. They still have the roller system that would take the cattle from the entrance area to the back butcher area. It’s really neat to see a piece of old Hawaii from the plantation era.,t2_f18il2th,ShoBigIsland,0,1647630121.0,0,t1_i16t8oh,i16t8oh,False,yesdog13,t3_tgum6r,https://www.reddit.com/r/BigIsland/comments/tgum6r/costco_trip_to_kona_from_puna_lunch_suggests/,"Costco trip to Kona from Puna, lunch suggests please",/r/BigIsland/comments/tgum6r/costco_trip_to_kona_from_puna_lunch_suggests/i16t8oh/,3,r/BigIsland,0,3
"Earl’s is known for their bento rolls which is basically a bento in a sushi roll. They have a steam table where you can select choices for their plate lunch. It’s a real local place. If your going Hamakua way stop by and have a look you can always go someplace else. If you go on Saturdays there are a lot of food trucks at the Waimea farmers markets.

Back in the plantation days Earl had general stores in Honokaa and Pauilo. People really lived pay check to pay check. Earl would let them buy the food they needed on store credit (no credit cards back then) so they wont starve. When we would go to Waimea my grandpa would always stop by and pick up a snack or soda. He never forgot how much that family helped others out.",t2_f18il2th,ShoBigIsland,0,1647629899.0,0,t1_i16sp50,i16sp50,False,yesdog13,t3_tgum6r,https://www.reddit.com/r/BigIsland/comments/tgum6r/costco_trip_to_kona_from_puna_lunch_suggests/,"Costco trip to Kona from Puna, lunch suggests please",/r/BigIsland/comments/tgum6r/costco_trip_to_kona_from_puna_lunch_suggests/i16sp50/,3,r/BigIsland,0,3
I'll pack the leafblower 😂,t2_fh6c1wwk,iNT3LL,0,1647629756.0,0,t1_i16scis,i16scis,False,iNT3LL,t3_tgp75l,https://www.reddit.com/r/BigIsland/comments/tgp75l/photography_jobs_on_the_big_island/,Photography Jobs on the Big Island,/r/BigIsland/comments/tgp75l/photography_jobs_on_the_big_island/i16scis/,1,r/BigIsland,0,1
"Depending on where you are going on the island, you may not be getting away from the mold.  
On the wet side, the mold/mildew battle is daily.",t2_j40vsxv,theislandhomestead,0,1647629663.0,0,t1_i16s44k,i16s44k,False,iNT3LL,t3_tgp75l,https://www.reddit.com/r/BigIsland/comments/tgp75l/photography_jobs_on_the_big_island/,Photography Jobs on the Big Island,/r/BigIsland/comments/tgp75l/photography_jobs_on_the_big_island/i16s44k/,3,r/BigIsland,0,3
"FYI Açaí has nothing to do with Hawai'i. It's an Amazonian plant and doesn't grow here, except for a few small farms. 99.9% of Açaí used across Hawai'i is imported from over 7,000 miles away.

I recommend looking for places with food not only locally made, but also made from local ingredients.

Designed in Hawai'i. Assembled in Hawai'i. With ingredients from Hawai'i.

One of the biggest issues here is that more than 85% of our food is imported, the local agriculture is pushed back, not enough subsidized, and can't sustain the islands anymore. This is not only a terrible natural (or human) disaster prevention strategy but also extremely harmful to our environment.

Another important thing to keep in mind: the vast majority of animal meat is imported because there are no local slaughterhouses that could produce enough meat to meet the demand. Caution when you read ""local beef."" It is mostly not local. The vast majority of cows born on Hawai'i Island are shipped off-island (either by plane or ship, which has an enormous carbon footprint) to the mainland, then raised with corn and soy (think of deforestation for soy and the issue with monocropping and GMO to meet the livestock corn demand), then transported to be slaughtered, then packaged (massive loads of styrofoam and plastic), then shipped back to the islands.",t2_kgwuv4m2,MusicForWorldPeace,0,1647629618.0,0,t1_i16s05j,i16s05j,True,h2ogurlie,t3_tg2fpb,https://www.reddit.com/r/BigIsland/comments/tg2fpb/local_must_eats/,Local Must Eats?,/r/BigIsland/comments/tg2fpb/local_must_eats/i16s05j/,3,r/BigIsland,0,3
"Oh no haha

We get a solid 4ish month season out here, and then the gross weather and mold does you in lol",t2_fh6c1wwk,iNT3LL,0,1647629566.0,0,t1_i16rvkz,i16rvkz,False,iNT3LL,t3_tgp75l,https://www.reddit.com/r/BigIsland/comments/tgp75l/photography_jobs_on_the_big_island/,Photography Jobs on the Big Island,/r/BigIsland/comments/tgp75l/photography_jobs_on_the_big_island/i16rvkz/,1,r/BigIsland,0,1
"Thanks.  
Here, it's more about fighting the jungle away from the garden!  
The plants grow easy.  
Fighting the weeds is the hard part.",t2_j40vsxv,theislandhomestead,0,1647629272.0,0,t1_i16r5a0,i16r5a0,False,iNT3LL,t3_tgp75l,https://www.reddit.com/r/BigIsland/comments/tgp75l/photography_jobs_on_the_big_island/,Photography Jobs on the Big Island,/r/BigIsland/comments/tgp75l/photography_jobs_on_the_big_island/i16r5a0/,3,r/BigIsland,0,3
"Good call, and thank you!

Also, your gardens and exotic fruits look very, very cool!",t2_fh6c1wwk,iNT3LL,0,1647629177.0,0,t1_i16qwq1,i16qwq1,False,iNT3LL,t3_tgp75l,https://www.reddit.com/r/BigIsland/comments/tgp75l/photography_jobs_on_the_big_island/,Photography Jobs on the Big Island,/r/BigIsland/comments/tgp75l/photography_jobs_on_the_big_island/i16qwq1/,1,r/BigIsland,0,1
"No.  
I have a full time position as an I.T. Admin at a local factory.  
Be sure to watch internet availability.  
It's not available everywhere on the island.",t2_j40vsxv,theislandhomestead,0,1647629013.0,0,t1_i16qi58,i16qi58,False,iNT3LL,t3_tgp75l,https://www.reddit.com/r/BigIsland/comments/tgp75l/photography_jobs_on_the_big_island/,Photography Jobs on the Big Island,/r/BigIsland/comments/tgp75l/photography_jobs_on_the_big_island/i16qi58/,4,r/BigIsland,0,4
"I’ll add it to the try list, thanks.",t2_16if9h,ConfusedSpaceMonkey,0,1647628961.0,0,t1_i16qdgv,i16qdgv,False,h2ogurlie,t3_tg2fpb,https://www.reddit.com/r/BigIsland/comments/tg2fpb/local_must_eats/,Local Must Eats?,/r/BigIsland/comments/tg2fpb/local_must_eats/i16qdgv/,1,r/BigIsland,0,1
"Wow! These comments definitely do a good job of representing yourself and the attitude Hawaii doesn’t take kindly to. Just FYI…

This isn’t just some other tourist destination, it’s a pretty unique place with unique local residents that are getting priced out of there home because you decided to move to paradise without understanding the intricacies of place. That you think your touristy ski-resort is in anyway representative of Hawaii is just ignorant. Unless you want to talk about which Native Americans got kicked out of that ski resort hundreds of years ago your point is mute.

I wish you luck here, but you gotta change your attitude. Calling locals ‘entitled’ for bringing up the fact they don’t want you moving here and raising the cost of living only illustrates how ignorant and entitled you are. Thinking that locals will be just as nice to you as a new resident and eagerly ignorant ‘Kamaaina’ (apply for your Mahalo rewards card now!) as they were as a tourist is wrong. 

Peace out and enjoy your overpriced brews!",t2_2cgksqap,asaaue,0,1647628196.0,0,t1_i16ogi7,i16ogi7,False,iNT3LL,t3_tgp75l,https://www.reddit.com/r/BigIsland/comments/tgp75l/photography_jobs_on_the_big_island/,Photography Jobs on the Big Island,/r/BigIsland/comments/tgp75l/photography_jobs_on_the_big_island/i16ogi7/,3,r/BigIsland,0,3
Thanks everyone! You all are great! We have a long list of delicious places to try. I'm going to keep the list and hopefully over time try them all. Woot woot!,t2_5uk6w2a2,yesdog13,0,1647628090.0,0,t1_i16o6tb,i16o6tb,True,yesdog13,t3_tgum6r,https://www.reddit.com/r/BigIsland/comments/tgum6r/costco_trip_to_kona_from_puna_lunch_suggests/,"Costco trip to Kona from Puna, lunch suggests please",/r/BigIsland/comments/tgum6r/costco_trip_to_kona_from_puna_lunch_suggests/i16o6tb/,1,r/BigIsland,0,1
"Thank you, appreciate it! DDD ruined a few fantastic places in my home town too hahaha haven't heard of Earl's, now I'm curious about that place",t2_5uk6w2a2,yesdog13,0,1647627842.0,0,t1_i16nkc7,i16nkc7,False,yesdog13,t3_tgum6r,https://www.reddit.com/r/BigIsland/comments/tgum6r/costco_trip_to_kona_from_puna_lunch_suggests/,"Costco trip to Kona from Puna, lunch suggests please",/r/BigIsland/comments/tgum6r/costco_trip_to_kona_from_puna_lunch_suggests/i16nkc7/,1,r/BigIsland,0,1
Do they do lunch? Whenever we drive pass they have a line outside. Must be good!,t2_5uk6w2a2,yesdog13,0,1647627700.0,0,t1_i16n7l5,i16n7l5,False,yesdog13,t3_tgum6r,https://www.reddit.com/r/BigIsland/comments/tgum6r/costco_trip_to_kona_from_puna_lunch_suggests/,"Costco trip to Kona from Puna, lunch suggests please",/r/BigIsland/comments/tgum6r/costco_trip_to_kona_from_puna_lunch_suggests/i16n7l5/,1,r/BigIsland,0,1
Mmmmmmm....yum!,t2_5uk6w2a2,yesdog13,0,1647627547.0,0,t1_i16mtwd,i16mtwd,False,yesdog13,t3_tgum6r,https://www.reddit.com/r/BigIsland/comments/tgum6r/costco_trip_to_kona_from_puna_lunch_suggests/,"Costco trip to Kona from Puna, lunch suggests please",/r/BigIsland/comments/tgum6r/costco_trip_to_kona_from_puna_lunch_suggests/i16mtwd/,1,r/BigIsland,0,1
Wow! Thanks. I've been curious about almost all the places you mentioned! Appreciate it!,t2_5uk6w2a2,yesdog13,0,1647627435.0,0,t1_i16mjqd,i16mjqd,False,yesdog13,t3_tgum6r,https://www.reddit.com/r/BigIsland/comments/tgum6r/costco_trip_to_kona_from_puna_lunch_suggests/,"Costco trip to Kona from Puna, lunch suggests please",/r/BigIsland/comments/tgum6r/costco_trip_to_kona_from_puna_lunch_suggests/i16mjqd/,1,r/BigIsland,0,1
Their cider is off the hook. Great idea for me since husband is driving 🤣,t2_5uk6w2a2,yesdog13,0,1647626983.0,0,t1_i16let8,i16let8,False,yesdog13,t3_tgum6r,https://www.reddit.com/r/BigIsland/comments/tgum6r/costco_trip_to_kona_from_puna_lunch_suggests/,"Costco trip to Kona from Puna, lunch suggests please",/r/BigIsland/comments/tgum6r/costco_trip_to_kona_from_puna_lunch_suggests/i16let8/,2,r/BigIsland,0,2
"That makes sense!

Do you find most of your work is remote?

My fiance is going to stick with her job and work remotely, which she's definitely looking forward to haha",t2_fh6c1wwk,iNT3LL,0,1647626038.0,0,t1_i16j0ew,i16j0ew,False,iNT3LL,t3_tgp75l,https://www.reddit.com/r/BigIsland/comments/tgp75l/photography_jobs_on_the_big_island/,Photography Jobs on the Big Island,/r/BigIsland/comments/tgp75l/photography_jobs_on_the_big_island/i16j0ew/,1,r/BigIsland,0,1
"Hey, the first time I've been called that as well! You're on a roll! 😂

Might be hard to imagine, but in all of the years we've been coming, we've met all sorts of people, from all over the island, native Hawaiians and expats alike

We have only ever found the same authenticity and kindness that we've shown returned to us in full

We understand living in an area that gets taken over by tourists man - We live in a ski town that literally will not stop building fucking hotels and chain restaurants. For better or worse, our economy depends on it - Sound familiar? 

And it's a problem. But we can't change that - Those are the choices that get made above our paygrade. We don't love it here, so we're choosing to pursue something that makes us happy. That's life!

I really wish you luck with being less entitled and miserable about people coming and going, because I have a feeling it isn't going to stop any time soon - And I still hope to buy you that beer 🤙",t2_fh6c1wwk,iNT3LL,0,1647625827.0,0,t1_i16ih0s,i16ih0s,False,iNT3LL,t3_tgp75l,https://www.reddit.com/r/BigIsland/comments/tgp75l/photography_jobs_on_the_big_island/,Photography Jobs on the Big Island,/r/BigIsland/comments/tgp75l/photography_jobs_on_the_big_island/i16ih0s/,1,r/BigIsland,0,1
Grab some cold beers at Ola brewing.,t2_cv1wnkn,EmbraceStardumb,0,1647625741.0,0,t1_i16i94k,i16i94k,False,yesdog13,t3_tgum6r,https://www.reddit.com/r/BigIsland/comments/tgum6r/costco_trip_to_kona_from_puna_lunch_suggests/,"Costco trip to Kona from Puna, lunch suggests please",/r/BigIsland/comments/tgum6r/costco_trip_to_kona_from_puna_lunch_suggests/i16i94k/,1,r/BigIsland,0,1
"I'm a computer technician.  
The job market is tough.   
Finding a job is not hard, but finding one that pays well enough is.",t2_j40vsxv,theislandhomestead,0,1647624825.0,0,t1_i16fwoc,i16fwoc,False,iNT3LL,t3_tgp75l,https://www.reddit.com/r/BigIsland/comments/tgp75l/photography_jobs_on_the_big_island/,Photography Jobs on the Big Island,/r/BigIsland/comments/tgp75l/photography_jobs_on_the_big_island/i16fwoc/,3,r/BigIsland,0,3
You probably only met and talked to other expats and tourists. Ask anyone whose family has been living here for generations if they want yet another haole wedding photographer living their dream in paradise. No thank you!,t2_hg6qu4uk,rambogorillacat,0,1647624075.0,0,t1_i16dzip,i16dzip,False,iNT3LL,t3_tgp75l,https://www.reddit.com/r/BigIsland/comments/tgp75l/photography_jobs_on_the_big_island/,Photography Jobs on the Big Island,/r/BigIsland/comments/tgp75l/photography_jobs_on_the_big_island/i16dzip/,4,r/BigIsland,0,4
They moved back to the old location.,t2_f18il2th,ShoBigIsland,0,1647623376.0,0,t1_i16c77b,i16c77b,False,yesdog13,t3_tgum6r,https://www.reddit.com/r/BigIsland/comments/tgum6r/costco_trip_to_kona_from_puna_lunch_suggests/,"Costco trip to Kona from Puna, lunch suggests please",/r/BigIsland/comments/tgum6r/costco_trip_to_kona_from_puna_lunch_suggests/i16c77b/,1,r/BigIsland,0,1
They have since moved back to their original spot in the old industrial!,t2_60w92ol5,mrsnihilist,0,1647623094.0,0,t1_i16bhdf,i16bhdf,False,yesdog13,t3_tgum6r,https://www.reddit.com/r/BigIsland/comments/tgum6r/costco_trip_to_kona_from_puna_lunch_suggests/,"Costco trip to Kona from Puna, lunch suggests please",/r/BigIsland/comments/tgum6r/costco_trip_to_kona_from_puna_lunch_suggests/i16bhdf/,1,r/BigIsland,0,1
Winner winner.,t2_x605g,mxg67,0,1647620027.0,0,t1_i163jdh,i163jdh,False,yesdog13,t3_tgum6r,https://www.reddit.com/r/BigIsland/comments/tgum6r/costco_trip_to_kona_from_puna_lunch_suggests/,"Costco trip to Kona from Puna, lunch suggests please",/r/BigIsland/comments/tgum6r/costco_trip_to_kona_from_puna_lunch_suggests/i163jdh/,0,r/BigIsland,0,0
I second this. Shaka tacoz is amazing. Hands down best taco place in the island.,t2_57scocuv,MyUnassignedUsername,0,1647619662.0,0,t1_i162lbt,i162lbt,False,yesdog13,t3_tgum6r,https://www.reddit.com/r/BigIsland/comments/tgum6r/costco_trip_to_kona_from_puna_lunch_suggests/,"Costco trip to Kona from Puna, lunch suggests please",/r/BigIsland/comments/tgum6r/costco_trip_to_kona_from_puna_lunch_suggests/i162lbt/,2,r/BigIsland,0,2
"Hey man!

I spotted your last comment, and just want to say, congrats on being the first person on the Islands we've come across that has been anything less than amazing, it's taken a while to find you!

As far as needing to learn something real - We currently own a hotel renovations business that operates nationwide, and THAT'S actually how we're able to move, in our late twenties and early thirties and not in retirement age, to an island in the middle of the ocean - Pretty cool, huh?

Believe it or not, someone having the opportunity to pursue their passions and wanting to move in a different direction in life doesn't actually mean you know anything, at all, about what we know how to do

As far as telling us to please not move there, besides being exceptionally lame, the short of it is that we didn't choose to live where we're at - We were born here. We're going to explore and follow where our hearts take us while we are young enough to enjoy it and have the opportunity. And to be painfully upfront, we can move with our first year of rent covered and still get a year of salary - We're coming.

I hope to catch you at Ola someday to buy you a beer man, and I hope you have a great day 🤙",t2_fh6c1wwk,iNT3LL,0,1647619041.0,0,t1_i160zjs,i160zjs,False,iNT3LL,t3_tgp75l,https://www.reddit.com/r/BigIsland/comments/tgp75l/photography_jobs_on_the_big_island/,Photography Jobs on the Big Island,/r/BigIsland/comments/tgp75l/photography_jobs_on_the_big_island/i160zjs/,2,r/BigIsland,0,2
"I thought that might be the case!

Do you happen to know if there are a lot of opportunities for people willing to work as second shooters, to build a portfolio and get a start?

We've been looking into Oahu and Maui, and different options on those islands as well, but I've got to say, having never been to Honolulu, it doesn't look quite as enjoyable, and Maui didn't really hit us the same way as the Big Island, it's just kinda where our hearts are at",t2_fh6c1wwk,iNT3LL,0,1647614256.0,0,t1_i15oy9q,i15oy9q,False,iNT3LL,t3_tgp75l,https://www.reddit.com/r/BigIsland/comments/tgp75l/photography_jobs_on_the_big_island/,Photography Jobs on the Big Island,/r/BigIsland/comments/tgp75l/photography_jobs_on_the_big_island/i15oy9q/,1,r/BigIsland,0,1
"That was how I was guessing it may look at the moment!

All the same, where there's a will, there's gotta be a way, right?

What do you do for work on the Island, if you don't mind me asking? Your username caught my eye!",t2_fh6c1wwk,iNT3LL,0,1647613457.0,0,t1_i15n0on,i15n0on,False,iNT3LL,t3_tgp75l,https://www.reddit.com/r/BigIsland/comments/tgp75l/photography_jobs_on_the_big_island/,Photography Jobs on the Big Island,/r/BigIsland/comments/tgp75l/photography_jobs_on_the_big_island/i15n0on/,1,r/BigIsland,0,1
