body,author_fullname,author.name,controversiality,created,downs,fullname,id,is_root,link_author,link_id,link_permalink,link_title,permalink,score,subreddit_name_prefixed,total_awards_received,ups
The seniors may be going to bed at 7pm but they are probably up long before 9am!,t2_4xrkv87,jk_arundel,0,1646445695.0,0,t1_hzedfc9,hzedfc9,False,pussb0i42O,t3_t6futa,https://www.reddit.com/r/comoxvalley/comments/t6futa/anything_open_247/,anything open 24/7?,/r/comoxvalley/comments/t6futa/anything_open_247/hzedfc9/,5,r/comoxvalley,0,5
Nothing other than McDicks and some gas stations. This town is geared towards seniors who fall asleep at 7pm and get up at 9.,t2_8d1onrf2,For_sure_a_bot,0,1646433509.0,0,t1_hzdlcr8,hzdlcr8,True,pussb0i42O,t3_t6futa,https://www.reddit.com/r/comoxvalley/comments/t6futa/anything_open_247/,anything open 24/7?,/r/comoxvalley/comments/t6futa/anything_open_247/hzdlcr8/,5,r/comoxvalley,0,5
PetroCan on corner of Cliffe & 17th is but you have to order through a window.,t2_ibcec,Ryanduck93,0,1646420958.0,0,t1_hzcoqqu,hzcoqqu,True,pussb0i42O,t3_t6futa,https://www.reddit.com/r/comoxvalley/comments/t6futa/anything_open_247/,anything open 24/7?,/r/comoxvalley/comments/t6futa/anything_open_247/hzcoqqu/,1,r/comoxvalley,0,1
I hate midnight fridge spills! Spaghetti sauce all over the place and no sudsy to clean it up with!,t2_2gehn6sf,DedReerConformist,0,1646409354.0,0,t1_hzbv77h,hzbv77h,False,pussb0i42O,t3_t6futa,https://www.reddit.com/r/comoxvalley/comments/t6futa/anything_open_247/,anything open 24/7?,/r/comoxvalley/comments/t6futa/anything_open_247/hzbv77h/,1,r/comoxvalley,0,1
I think the time hortons on Ryan rd and veterans is!,t2_apqrn2qh,Particular_Policy_41,0,1646405645.0,0,t1_hzbm8cb,hzbm8cb,True,pussb0i42O,t3_t6futa,https://www.reddit.com/r/comoxvalley/comments/t6futa/anything_open_247/,anything open 24/7?,/r/comoxvalley/comments/t6futa/anything_open_247/hzbm8cb/,4,r/comoxvalley,0,4
last I heard both Seven-Elevens are no longer 24 hour. I Think they open at 5:00 but that may have changed since I last checked.,t2_7h2c8416,blacksheepgreenleaf,0,1646404143.0,0,t1_hzbisb9,hzbisb9,False,pussb0i42O,t3_t6futa,https://www.reddit.com/r/comoxvalley/comments/t6futa/anything_open_247/,anything open 24/7?,/r/comoxvalley/comments/t6futa/anything_open_247/hzbisb9/,4,r/comoxvalley,0,4
Outta sudsy?,t2_a23izgvi,RollDBud,0,1646403288.0,0,t1_hzbgvqg,hzbgvqg,True,pussb0i42O,t3_t6futa,https://www.reddit.com/r/comoxvalley/comments/t6futa/anything_open_247/,anything open 24/7?,/r/comoxvalley/comments/t6futa/anything_open_247/hzbgvqg/,0,r/comoxvalley,0,0
"7-Eleven on Cliffe Ave is, to my knowledge. Most convenience stores are to a limited extent.",t2_15k6c0,Falom,0,1646390147.0,0,t1_hzav6fd,hzav6fd,True,pussb0i42O,t3_t6futa,https://www.reddit.com/r/comoxvalley/comments/t6futa/anything_open_247/,anything open 24/7?,/r/comoxvalley/comments/t6futa/anything_open_247/hzav6fd/,4,r/comoxvalley,0,4
Start one?,t2_4d417,bradmont,0,1646350506.0,0,t1_hz8yzgn,hz8yzgn,False,lorzilla,t3_t5ekcf,https://www.reddit.com/r/comoxvalley/comments/t5ekcf/bike_tune_up/,Bike Tune Up,/r/comoxvalley/comments/t5ekcf/bike_tune_up/hz8yzgn/,0,r/comoxvalley,0,0
https://www.reddit.com/r/alberta/comments/t5cq41/pretty_much_how_i_see_this_whole_situation_right/?utm_source=share&utm_medium=ios_app&utm_name=iossmf,t2_2s2799ja,johnggarland,0,1646320710.0,0,t1_hz6wg0m,hz6wg0m,True,evade26,t3_sln8g9,https://www.reddit.com/r/comoxvalley/comments/sln8g9/jesus_christ_the_freedom_convoy_in_town_is_peak/,Jesus Christ the “Freedom convoy” in town is peak knuckle dragging cringe.,/r/comoxvalley/comments/sln8g9/jesus_christ_the_freedom_convoy_in_town_is_peak/hz6wg0m/,1,r/comoxvalley,0,1
"YouTube.com

Sounds silly, but there are some great tutorials on there.",t2_aynv526b,larstheelephant2,0,1646286065.0,0,t1_hz5dfmp,hz5dfmp,True,lorzilla,t3_t5ekcf,https://www.reddit.com/r/comoxvalley/comments/t5ekcf/bike_tune_up/,Bike Tune Up,/r/comoxvalley/comments/t5ekcf/bike_tune_up/hz5dfmp/,4,r/comoxvalley,0,4
"Talk to the people at trail bikes, they are great, best shop in the valley. They might know of someone who can teach you. Or the gravity mtb folks",t2_mzjy6,HSpears,0,1646283785.0,0,t1_hz59jlg,hz59jlg,True,lorzilla,t3_t5ekcf,https://www.reddit.com/r/comoxvalley/comments/t5ekcf/bike_tune_up/,Bike Tune Up,/r/comoxvalley/comments/t5ekcf/bike_tune_up/hz59jlg/,3,r/comoxvalley,0,3
"That's a great idea! I'll definitely implement both those features in the future! 

Thank you!",t2_dpq2kfgq,campvi,0,1646281014.0,0,t1_hz54gpe,hz54gpe,False,campvi,t3_t4or68,https://www.reddit.com/r/comoxvalley/comments/t4or68/new_vancouver_island_camping_resource_website/,New Vancouver Island Camping Resource Website,/r/comoxvalley/comments/t4or68/new_vancouver_island_camping_resource_website/hz54gpe/,1,r/comoxvalley,0,1
"Would it be worth your time to head to Nanaimo?

https://www.hubcitycycles.ca/get-involved/co-op/

https://www.hubcitycycles.ca/products-services/education/",t2_92rjz,parkleswife,0,1646275456.0,0,t1_hz4tayv,hz4tayv,True,lorzilla,t3_t5ekcf,https://www.reddit.com/r/comoxvalley/comments/t5ekcf/bike_tune_up/,Bike Tune Up,/r/comoxvalley/comments/t5ekcf/bike_tune_up/hz4tayv/,1,r/comoxvalley,0,1
 Gravity MTB does classes!!,t2_1348tm,subeditrix,0,1646275005.0,0,t1_hz4scy7,hz4scy7,True,lorzilla,t3_t5ekcf,https://www.reddit.com/r/comoxvalley/comments/t5ekcf/bike_tune_up/,Bike Tune Up,/r/comoxvalley/comments/t5ekcf/bike_tune_up/hz4scy7/,2,r/comoxvalley,0,2
On Cumberland road near Arden. Koodo/Telus. Nothing. No service. Completely reliant on wifi calling.,t2_203gyx4c,GolfWhiskeyGolf,0,1646274276.0,0,t1_hz4qu6n,hz4qu6n,True,A_Sneaky_Walrus,t3_t4dl74,https://www.reddit.com/r/comoxvalley/comments/t4dl74/cell_phone_service_in_puntledge_area/,Cell phone service in Puntledge area,/r/comoxvalley/comments/t4dl74/cell_phone_service_in_puntledge_area/hz4qu6n/,1,r/comoxvalley,0,1
Blacks cycles doesn't do any classes but they are super great guys,t2_a3juep23,OldEducated,0,1646268224.0,0,t1_hz4eg2c,hz4eg2c,True,lorzilla,t3_t5ekcf,https://www.reddit.com/r/comoxvalley/comments/t5ekcf/bike_tune_up/,Bike Tune Up,/r/comoxvalley/comments/t5ekcf/bike_tune_up/hz4eg2c/,1,r/comoxvalley,0,1
I always went to Trail Bicycles (they’re beside Comox Valley Inn now I’m pretty sure) and they have never screwed me over.,t2_15k6c0,Falom,0,1646267783.0,0,t1_hz4dki6,hz4dki6,True,lorzilla,t3_t5ekcf,https://www.reddit.com/r/comoxvalley/comments/t5ekcf/bike_tune_up/,Bike Tune Up,/r/comoxvalley/comments/t5ekcf/bike_tune_up/hz4dki6/,6,r/comoxvalley,0,6
"Crowdsourcing it could help, I have scanned maps of the Pacheedaht campground I'd be happy to upload if I had an option.  I totally agree with ""submit a correction"" button on each campsite, or comments from users, as I would then mention that Pacheedaht doesn't have picnic tables in all sites, only some and they move around so you have to nab one when you see no one is using a site with one, or that the North end sites are WAY better than the South end sites, etc.

Happy to find the your site though, nice work!",t2_5c7a46ia,doctorplasmatron,0,1646260140.0,0,t1_hz3x2u1,hz3x2u1,False,campvi,t3_t4or68,https://www.reddit.com/r/comoxvalley/comments/t4or68/new_vancouver_island_camping_resource_website/,New Vancouver Island Camping Resource Website,/r/comoxvalley/comments/t4or68/new_vancouver_island_camping_resource_website/hz3x2u1/,2,r/comoxvalley,0,2
Pretty much.,t2_10iuji82,throwieowieowieohawa,0,1646249739.0,0,t1_hz378z3,hz378z3,False,throwieowieowieohawa,t3_t420z3,https://www.reddit.com/r/comoxvalley/comments/t420z3/i_hate_my_kids_day_care/,I hate my kids day care,/r/comoxvalley/comments/t420z3/i_hate_my_kids_day_care/hz378z3/,2,r/comoxvalley,0,2
"I have a laptop that I was using to fiddle around with Linux. It's currently bricked, and has a hard drive that's gonna give out any day, but you can have it if you want.",t2_exlu4wsw,Obvious_Conflict457,0,1646249131.0,0,t1_hz35o25,hz35o25,True,Fail_Sandwich,t3_t4hg5l,https://www.reddit.com/r/comoxvalley/comments/t4hg5l/comox_resident_here_anyone_got_an_old_desktop/,Comox resident here - anyone got an old desktop computer lying around?,/r/comoxvalley/comments/t4hg5l/comox_resident_here_anyone_got_an_old_desktop/hz35o25/,2,r/comoxvalley,0,2
"Ugh, this is so demoralizing to hear about. My wife was offered a job at this place a few years ago, but she turned them down because of how *super weird* they were. This was well before the pandemic. I'm glad to hear that she dodged a bullet. I'm so sorry that you have to deal with these mouthbreathing idiots.",t2_7dhqepal,Leutkeana,0,1646247474.0,0,t1_hz31ctt,hz31ctt,True,throwieowieowieohawa,t3_t420z3,https://www.reddit.com/r/comoxvalley/comments/t420z3/i_hate_my_kids_day_care/,I hate my kids day care,/r/comoxvalley/comments/t420z3/i_hate_my_kids_day_care/hz31ctt/,3,r/comoxvalley,0,3
"Great idea, I'll include a caution/advisory/disclaimer message on all campsite pages. 

Thank you!",t2_dpq2kfgq,campvi,0,1646246230.0,0,t1_hz2y2zt,hz2y2zt,False,campvi,t3_t4or68,https://www.reddit.com/r/comoxvalley/comments/t4or68/new_vancouver_island_camping_resource_website/,New Vancouver Island Camping Resource Website,/r/comoxvalley/comments/t4or68/new_vancouver_island_camping_resource_website/hz2y2zt/,2,r/comoxvalley,0,2
"I just updated the Pacheedaht campsite, thanks for pointing that out!

It can be tough to get all of the information 100% accurate. I should add a ""Submit Correction"" button on the campsite pages.

Offering different maps would be nice, but unfortunately collecting and uploading data takes a long time to do, so there's a limit to how much I can offer. I'll add a disclaimer to the campsite pages encouraging users to do further research on campsites they're interested in.

Thanks again!",t2_dpq2kfgq,campvi,0,1646246161.0,0,t1_hz2xwfk,hz2xwfk,False,campvi,t3_t4or68,https://www.reddit.com/r/comoxvalley/comments/t4or68/new_vancouver_island_camping_resource_website/,New Vancouver Island Camping Resource Website,/r/comoxvalley/comments/t4or68/new_vancouver_island_camping_resource_website/hz2xwfk/,1,r/comoxvalley,0,1
But what does that have to do with discrimination?,t2_9n73orsc,boutta_call_bo_vice,0,1646243953.0,0,t1_hz2s33z,hz2s33z,False,throwieowieowieohawa,t3_t420z3,https://www.reddit.com/r/comoxvalley/comments/t420z3/i_hate_my_kids_day_care/,I hate my kids day care,/r/comoxvalley/comments/t420z3/i_hate_my_kids_day_care/hz2s33z/,0,r/comoxvalley,0,0
"BuT I rEaD oN FaCEbOoK !!! Vaccines ArE BhAaD!
This is there evidence.",t2_4xeohnmt,BruceSpaklesLu,0,1646243742.0,0,t1_hz2rihd,hz2rihd,False,throwieowieowieohawa,t3_t420z3,https://www.reddit.com/r/comoxvalley/comments/t420z3/i_hate_my_kids_day_care/,I hate my kids day care,/r/comoxvalley/comments/t420z3/i_hate_my_kids_day_care/hz2rihd/,3,r/comoxvalley,0,3
"Yes. Kids in daycare and school should be immunized so the children that can’t be vaccinated due to compromised immune systems don’t have to worry. It’s not rocket science it’s called being a community, thinking of others and seeing the greater good.",t2_4xeohnmt,BruceSpaklesLu,0,1646243545.0,0,t1_hz2qznr,hz2qznr,False,throwieowieowieohawa,t3_t420z3,https://www.reddit.com/r/comoxvalley/comments/t420z3/i_hate_my_kids_day_care/,I hate my kids day care,/r/comoxvalley/comments/t420z3/i_hate_my_kids_day_care/hz2qznr/,2,r/comoxvalley,0,2
I hope people actually click the website links and not just go based off this map. Feels like it makes recreation sites seem simple when they aren’t accessible for everyone. Maybe a caution/advisory on the rec sites?,t2_5lgg8l4,WendyPortledge,0,1646243470.0,0,t1_hz2qsg4,hz2qsg4,True,campvi,t3_t4or68,https://www.reddit.com/r/comoxvalley/comments/t4or68/new_vancouver_island_camping_resource_website/,New Vancouver Island Camping Resource Website,/r/comoxvalley/comments/t4or68/new_vancouver_island_camping_resource_website/hz2qsg4/,2,r/comoxvalley,0,2
"https://www.rogers.com/support/mobility/extended-network-coverage

I haven't been on Rogers or Fido in quite some time, but it used to be enabled just by turning on roaming. The danger of that is if you are living close to the US border you will roam in the US and have some terrible charges.",t2_spix4,LeakySkylight,0,1646239413.0,0,t1_hz2g52x,hz2g52x,False,A_Sneaky_Walrus,t3_t4dl74,https://www.reddit.com/r/comoxvalley/comments/t4dl74/cell_phone_service_in_puntledge_area/,Cell phone service in Puntledge area,/r/comoxvalley/comments/t4dl74/cell_phone_service_in_puntledge_area/hz2g52x/,2,r/comoxvalley,0,2
"Between my spouse and I, we have tried everything. We are close to Puntledge Park. Wifi calling is no better because our wifi is also glitchy, even though we have called for support with both companies, numerous times. 

They can get cell service in remote areas of the province, but not here?? I just don't get it. 

And a landline isn't an option because I used a work cell from home too. It's ridiculous.",t2_dxh4jj1s,Fabulous-Brilliant68,0,1646237418.0,0,t1_hz2ay61,hz2ay61,True,A_Sneaky_Walrus,t3_t4dl74,https://www.reddit.com/r/comoxvalley/comments/t4dl74/cell_phone_service_in_puntledge_area/,Cell phone service in Puntledge area,/r/comoxvalley/comments/t4dl74/cell_phone_service_in_puntledge_area/hz2ay61/,1,r/comoxvalley,0,1
"nice!  how do people submit corrections? For example the Pacheedaht campsite in port renfrew is listed as being in bamfield with no amenities, but it is very definitely in port renfrew and has full showers, a general store, outhouses as well as bathrooms, water available... would also be nice to know which are run by First Nations vs. private vs. govt.

It would be good to start to also offer campsite maps as the north end of Pacheedaht and south end are in different places and have different layouts, plus they have RV, tenting, but also walk in sites to camp right on the beach.",t2_5c7a46ia,doctorplasmatron,0,1646233230.0,0,t1_hz20iu0,hz20iu0,True,campvi,t3_t4or68,https://www.reddit.com/r/comoxvalley/comments/t4or68/new_vancouver_island_camping_resource_website/,New Vancouver Island Camping Resource Website,/r/comoxvalley/comments/t4or68/new_vancouver_island_camping_resource_website/hz20iu0/,2,r/comoxvalley,0,2
It’s also a fairly well known insult used to call someone stupid.,t2_8d1onrf2,For_sure_a_bot,0,1646207474.0,0,t1_hz0w2n7,hz0w2n7,False,throwieowieowieohawa,t3_t420z3,https://www.reddit.com/r/comoxvalley/comments/t420z3/i_hate_my_kids_day_care/,I hate my kids day care,/r/comoxvalley/comments/t420z3/i_hate_my_kids_day_care/hz0w2n7/,1,r/comoxvalley,0,1
"Ugh I’m done with you, I know you know what means because I’m guessing you hear it several times a day.",t2_10iuji82,throwieowieowieohawa,0,1646205095.0,0,t1_hz0sqni,hz0sqni,False,throwieowieowieohawa,t3_t420z3,https://www.reddit.com/r/comoxvalley/comments/t420z3/i_hate_my_kids_day_care/,I hate my kids day care,/r/comoxvalley/comments/t420z3/i_hate_my_kids_day_care/hz0sqni/,2,r/comoxvalley,0,2
I don’t know what any of that means,t2_9n73orsc,boutta_call_bo_vice,0,1646204921.0,0,t1_hz0shks,hz0shks,False,throwieowieowieohawa,t3_t420z3,https://www.reddit.com/r/comoxvalley/comments/t420z3/i_hate_my_kids_day_care/,I hate my kids day care,/r/comoxvalley/comments/t420z3/i_hate_my_kids_day_care/hz0shks/,1,r/comoxvalley,0,1
Shocking! A gaming reference! Which even doesn’t sting in Second Life as much as you think it does.,t2_10iuji82,throwieowieowieohawa,0,1646204894.0,0,t1_hz0sg6a,hz0sg6a,False,throwieowieowieohawa,t3_t420z3,https://www.reddit.com/r/comoxvalley/comments/t420z3/i_hate_my_kids_day_care/,I hate my kids day care,/r/comoxvalley/comments/t420z3/i_hate_my_kids_day_care/hz0sg6a/,3,r/comoxvalley,0,3
What the fuck are you talking about.. 5G. You are a true NPC,t2_9n73orsc,boutta_call_bo_vice,0,1646204514.0,0,t1_hz0rw6y,hz0rw6y,False,throwieowieowieohawa,t3_t420z3,https://www.reddit.com/r/comoxvalley/comments/t420z3/i_hate_my_kids_day_care/,I hate my kids day care,/r/comoxvalley/comments/t420z3/i_hate_my_kids_day_care/hz0rw6y/,1,r/comoxvalley,0,1
"Thanks for the incoherent word salad!   Better double up on the tin foil hat tonight, wouldn’t want that 5G frying your brain before your big health policy dissertation defence!",t2_10iuji82,throwieowieowieohawa,0,1646204228.0,0,t1_hz0rh6i,hz0rh6i,False,throwieowieowieohawa,t3_t420z3,https://www.reddit.com/r/comoxvalley/comments/t420z3/i_hate_my_kids_day_care/,I hate my kids day care,/r/comoxvalley/comments/t420z3/i_hate_my_kids_day_care/hz0rh6i/,3,r/comoxvalley,0,3
I live near in puntledge area and my cell reception is so bad I got a landline.,t2_idslzfkj,Useful-Host8289,0,1646203709.0,0,t1_hz0qpqy,hz0qpqy,True,A_Sneaky_Walrus,t3_t4dl74,https://www.reddit.com/r/comoxvalley/comments/t4dl74/cell_phone_service_in_puntledge_area/,Cell phone service in Puntledge area,/r/comoxvalley/comments/t4dl74/cell_phone_service_in_puntledge_area/hz0qpqy/,1,r/comoxvalley,0,1
It’s funny too because a lepton is a fucking 1/2 spin multiple subatomic particle 😂,t2_9n73orsc,boutta_call_bo_vice,0,1646200320.0,0,t1_hz0lgua,hz0lgua,False,throwieowieowieohawa,t3_t420z3,https://www.reddit.com/r/comoxvalley/comments/t420z3/i_hate_my_kids_day_care/,I hate my kids day care,/r/comoxvalley/comments/t420z3/i_hate_my_kids_day_care/hz0lgua/,-1,r/comoxvalley,0,-1
"Your kids were never going to be on that chart. If you are worried about your kids health there’s about 100 things more important. Problem is, you don’t get to feel automatically good about yourself from saving them from any of the other ones. The media only gives you pats on the back for doing this one thing",t2_9n73orsc,boutta_call_bo_vice,0,1646200265.0,0,t1_hz0ldlp,hz0ldlp,False,throwieowieowieohawa,t3_t420z3,https://www.reddit.com/r/comoxvalley/comments/t420z3/i_hate_my_kids_day_care/,I hate my kids day care,/r/comoxvalley/comments/t420z3/i_hate_my_kids_day_care/hz0ldlp/,1,r/comoxvalley,0,1
"Virtue virtue virtue. So virtuous and good the government is. The choices they make are correct so the principles are secondary. I get it: safety and security over principles. None of that was my point. My point was consistency. You want to argue from principles but ultimately take the position of “my outcome wins.” You can’t have it both ways. Either medical history is a personal matter and grounds for discrimination or it is a social good and may be regulated. But then you can’t go in and cry discrimination when that is precisely the point.

What you appear to want is a law stating that the vaccinated for covid 19 may do as they please and those who don’t can’t do shit. Which is quite a popular position, obviously. Congrats. But it’s not borne of the same spirit that minority rights was… that those making the unpopular decision are shielded from the wrath of the majority. You’d do well in an authoritarian state. Things seem to be going that way so all I can wish is for you is that you stay on the side of the majority! Be well",t2_9n73orsc,boutta_call_bo_vice,0,1646200027.0,0,t1_hz0kz5z,hz0kz5z,False,throwieowieowieohawa,t3_t420z3,https://www.reddit.com/r/comoxvalley/comments/t420z3/i_hate_my_kids_day_care/,I hate my kids day care,/r/comoxvalley/comments/t420z3/i_hate_my_kids_day_care/hz0kz5z/,1,r/comoxvalley,0,1
"Pretty cold to look share charts and say, look the potentially preventable deaths in Canada actually aren't that bad! I'm trying to keep myself, my kids, and those around us off of those charts, are you?",t2_10iuji82,throwieowieowieohawa,0,1646199981.0,0,t1_hz0kwfe,hz0kwfe,False,throwieowieowieohawa,t3_t420z3,https://www.reddit.com/r/comoxvalley/comments/t420z3/i_hate_my_kids_day_care/,I hate my kids day care,/r/comoxvalley/comments/t420z3/i_hate_my_kids_day_care/hz0kwfe/,3,r/comoxvalley,0,3
"Still waiting on that evidence......  if you can't see the difference between  separating someone who is knowingly and willfully putting other people's live potentially at risk, versus someone who is doing their part to protect those around them because of something along the lines of misinformation, ignorance, or spite, then I pity you.  People's medical status barely is *not* a protected class for discrimination (mental and physical statuses are), but I still maintain there is an argument to be made for, again, unreasonably punishing someone for doing the right thing on the grounds of their medical status. Is a vaccine passport a punishment for the unvaccinated? Absolutely, but it is in place to protect those around them. Have people lost their jobs because of their choice not to receive a vaccine, yes, but see: choice. Do I have a choice in child care in this community?  Technically yes, and if you know of an open spot I'd be interested in hearing about it.",t2_10iuji82,throwieowieowieohawa,0,1646199719.0,0,t1_hz0kghz,hz0kghz,False,throwieowieowieohawa,t3_t420z3,https://www.reddit.com/r/comoxvalley/comments/t420z3/i_hate_my_kids_day_care/,I hate my kids day care,/r/comoxvalley/comments/t420z3/i_hate_my_kids_day_care/hz0kghz/,3,r/comoxvalley,0,3
"Wow you sure got a lot from my reply. Honestly, I'm done with it all, if less than 10% don't get the poke I'm not concerned. We have to face the fact that we can never hit 100%. 

We have been pretty lucky with our numbers in Canada.


https://i.imgur.com/cF2y4Oz.jpg

https://www.statista.com/statistics/1228632/number-covid-deaths-canada-by-age/",t2_57zg8,betadan,0,1646199705.0,0,t1_hz0kfm0,hz0kfm0,False,throwieowieowieohawa,t3_t420z3,https://www.reddit.com/r/comoxvalley/comments/t420z3/i_hate_my_kids_day_care/,I hate my kids day care,/r/comoxvalley/comments/t420z3/i_hate_my_kids_day_care/hz0kfm0/,2,r/comoxvalley,0,2
There are some dead zones like those around.,t2_spix4,LeakySkylight,0,1646199583.0,0,t1_hz0k84d,hz0k84d,False,A_Sneaky_Walrus,t3_t4dl74,https://www.reddit.com/r/comoxvalley/comments/t4dl74/cell_phone_service_in_puntledge_area/,Cell phone service in Puntledge area,/r/comoxvalley/comments/t4dl74/cell_phone_service_in_puntledge_area/hz0k84d/,2,r/comoxvalley,0,2
"Do I sign up for this extended network thing? I'm going to have to do some googling. I thought maybe getting a new phone would help, but, I just did that... didn't help.",t2_4hclfgt0,smokylimbs,0,1646199514.0,0,t1_hz0k3ua,hz0k3ua,False,A_Sneaky_Walrus,t3_t4dl74,https://www.reddit.com/r/comoxvalley/comments/t4dl74/cell_phone_service_in_puntledge_area/,Cell phone service in Puntledge area,/r/comoxvalley/comments/t4dl74/cell_phone_service_in_puntledge_area/hz0k3ua/,2,r/comoxvalley,0,2
"Rogers is abysmal in rural areas. They have just started trying to improve that in the last year.

Many of the stores in Campbell River stopped selling Rogers because it was so horrible.

Telus has the best rural coverage, and they just spent a huge amount of money stretching fiber around the island so that even more places have coverage.

If you're on rogers, you could try to use your extended Network, and see if that improves things.  The service will allow you to roam on Telus and Bell towers for free.  It's not universal, so you still may not have coverage, and especially if Koodo on Telus does not have coverage in the area anyway.",t2_spix4,LeakySkylight,0,1646199331.0,0,t1_hz0js9r,hz0js9r,False,A_Sneaky_Walrus,t3_t4dl74,https://www.reddit.com/r/comoxvalley/comments/t4dl74/cell_phone_service_in_puntledge_area/,Cell phone service in Puntledge area,/r/comoxvalley/comments/t4dl74/cell_phone_service_in_puntledge_area/hz0js9r/,3,r/comoxvalley,0,3
Yes! It felt like it was super necessary! Let me know if you have any other features you'd like to see! The feedback and suggestions I've received have been great,t2_dpq2kfgq,campvi,0,1646198963.0,0,t1_hz0j4x7,hz0j4x7,False,campvi,t3_t4or68,https://www.reddit.com/r/comoxvalley/comments/t4or68/new_vancouver_island_camping_resource_website/,New Vancouver Island Camping Resource Website,/r/comoxvalley/comments/t4or68/new_vancouver_island_camping_resource_website/hz0j4x7/,3,r/comoxvalley,0,3
Saved,t2_4453wy4,derek_foreel,0,1646198950.0,0,t1_hz0j42u,hz0j42u,True,campvi,t3_t4or68,https://www.reddit.com/r/comoxvalley/comments/t4or68/new_vancouver_island_camping_resource_website/,New Vancouver Island Camping Resource Website,/r/comoxvalley/comments/t4or68/new_vancouver_island_camping_resource_website/hz0j42u/,1,r/comoxvalley,0,1
"Oh, good, so you then you agree you should ""get the poke"" and keep masking to reduce, not just the severity, but the likelihood of catching COVID, and therefore spreading COVID, which will ultimately mutate into additional variants that will reduce, *reduce,* the effectiveness of the vaccine resulting in a continued pandemic and the greater chance of hospitalization and burden on our health care system by the unequivocal majority of unvaxxed patients and the increased likelihood of deaths of the immunocompromised; good I'm glad you came to the conclusion on our own.",t2_10iuji82,throwieowieowieohawa,0,1646198186.0,0,t1_hz0hr1u,hz0hr1u,False,throwieowieowieohawa,t3_t420z3,https://www.reddit.com/r/comoxvalley/comments/t420z3/i_hate_my_kids_day_care/,I hate my kids day care,/r/comoxvalley/comments/t420z3/i_hate_my_kids_day_care/hz0hr1u/,2,r/comoxvalley,0,2
Ugh that’s horrendous. Our family is currently reliving the hell that is finding daycare in this province… it’s hard out there for working parents :(,t2_e1o8wmyi,cookie_tong,0,1646193786.0,0,t1_hz095mk,hz095mk,True,throwieowieowieohawa,t3_t420z3,https://www.reddit.com/r/comoxvalley/comments/t420z3/i_hate_my_kids_day_care/,I hate my kids day care,/r/comoxvalley/comments/t420z3/i_hate_my_kids_day_care/hz095mk/,5,r/comoxvalley,0,5
So they can call people inbred leptons? That’s fine?,t2_8d1onrf2,For_sure_a_bot,0,1646192876.0,0,t1_hz0781m,hz0781m,False,throwieowieowieohawa,t3_t420z3,https://www.reddit.com/r/comoxvalley/comments/t420z3/i_hate_my_kids_day_care/,I hate my kids day care,/r/comoxvalley/comments/t420z3/i_hate_my_kids_day_care/hz0781m/,2,r/comoxvalley,0,2
