body,author_fullname,author.name,controversiality,created,downs,fullname,id,is_root,link_author,link_id,link_permalink,link_title,permalink,score,subreddit_name_prefixed,total_awards_received,ups
They're stopping in PA too lol,t2_diyahcsg,LittleTribuneMayor,0,1648276292.0,0,t1_i25yjzo,i25yjzo,False,LittleTribuneMayor,t3_tntt60,https://www.reddit.com/r/comoxvalley/comments/tntt60/freedom_convoy/,Freedom Convoy,/r/comoxvalley/comments/tntt60/freedom_convoy/i25yjzo/,1,r/comoxvalley,0,1
The Fucking Loser Convoy of Douche Bags and Whiney Ass Punk Bitches.,t2_70qa9ns2,MyOtherCarIsAHippo,0,1648275393.0,0,t1_i25xfhu,i25xfhu,True,LittleTribuneMayor,t3_tntt60,https://www.reddit.com/r/comoxvalley/comments/tntt60/freedom_convoy/,Freedom Convoy,/r/comoxvalley/comments/tntt60/freedom_convoy/i25xfhu/,0,r/comoxvalley,0,0
A lot of them are so far gone they actually are pro Russia and think Putin is liberating Ukraine from the deep state… things are going great,t2_7wedkw6j,DoctorTobogganMD3,0,1648272780.0,0,t1_i25u10q,i25u10q,False,LittleTribuneMayor,t3_tntt60,https://www.reddit.com/r/comoxvalley/comments/tntt60/freedom_convoy/,Freedom Convoy,/r/comoxvalley/comments/tntt60/freedom_convoy/i25u10q/,0,r/comoxvalley,0,0
"Why go from Victoria to Campbell river though? Seems even stupider than protesting in Victoria.

Might as well protest in Port Alberni 😂",t2_7fxhapwn,lwalker5414,0,1648267148.0,0,t1_i25ladu,i25ladu,True,LittleTribuneMayor,t3_tntt60,https://www.reddit.com/r/comoxvalley/comments/tntt60/freedom_convoy/,Freedom Convoy,/r/comoxvalley/comments/tntt60/freedom_convoy/i25ladu/,3,r/comoxvalley,0,3
"More like Freedum, ammirite.",t2_ccps1xr3,thebearjames,0,1648255234.0,0,t1_i24y48a,i24y48a,True,LittleTribuneMayor,t3_tntt60,https://www.reddit.com/r/comoxvalley/comments/tntt60/freedom_convoy/,Freedom Convoy,/r/comoxvalley/comments/tntt60/freedom_convoy/i24y48a/,2,r/comoxvalley,0,2
Seat belt mandate?   Ooo maybe the mandate to drive on the RHS!  I hate being told where to drive!,t2_16onx6,doesthislookoktoyou,0,1648255008.0,0,t1_i24xndz,i24xndz,False,LittleTribuneMayor,t3_tntt60,https://www.reddit.com/r/comoxvalley/comments/tntt60/freedom_convoy/,Freedom Convoy,/r/comoxvalley/comments/tntt60/freedom_convoy/i24xndz/,1,r/comoxvalley,0,1
Ohhh the delusions are strong with this group.,t2_e81kakne,Whatshername_Stew,0,1648254529.0,0,t1_i24wnh1,i24wnh1,False,LittleTribuneMayor,t3_tntt60,https://www.reddit.com/r/comoxvalley/comments/tntt60/freedom_convoy/,Freedom Convoy,/r/comoxvalley/comments/tntt60/freedom_convoy/i24wnh1/,4,r/comoxvalley,0,4
"Thanks for the laugh on my Friday afternoon. \*puts in earplugs to block out all the bloody annoying honking for absolutely no reason\*

Have fun at your Nazi party",t2_e81kakne,Whatshername_Stew,0,1648254398.0,0,t1_i24wdpw,i24wdpw,False,LittleTribuneMayor,t3_tntt60,https://www.reddit.com/r/comoxvalley/comments/tntt60/freedom_convoy/,Freedom Convoy,/r/comoxvalley/comments/tntt60/freedom_convoy/i24wdpw/,16,r/comoxvalley,0,16
Many stop thinking. You're making yourself look worse.,t2_3uz94,ScubaJes,0,1648254347.0,0,t1_i24w9xe,i24w9xe,False,LittleTribuneMayor,t3_tntt60,https://www.reddit.com/r/comoxvalley/comments/tntt60/freedom_convoy/,Freedom Convoy,/r/comoxvalley/comments/tntt60/freedom_convoy/i24w9xe/,8,r/comoxvalley,0,8
Yep. And then you have people like u/lauralee66 saying they don't harass anyone.,t2_3uz94,ScubaJes,0,1648254281.0,0,t1_i24w56r,i24w56r,False,LittleTribuneMayor,t3_tntt60,https://www.reddit.com/r/comoxvalley/comments/tntt60/freedom_convoy/,Freedom Convoy,/r/comoxvalley/comments/tntt60/freedom_convoy/i24w56r/,7,r/comoxvalley,0,7
Oh that's rich.,t2_3uz94,ScubaJes,0,1648254130.0,0,t1_i24vtxt,i24vtxt,False,LittleTribuneMayor,t3_tntt60,https://www.reddit.com/r/comoxvalley/comments/tntt60/freedom_convoy/,Freedom Convoy,/r/comoxvalley/comments/tntt60/freedom_convoy/i24vtxt/,7,r/comoxvalley,0,7
That's a convoy I would join. Love winter but this one is dragging haha,t2_fh1b9grd,SirLanceATwat,0,1648253101.0,0,t1_i24tovh,i24tovh,False,LittleTribuneMayor,t3_tntt60,https://www.reddit.com/r/comoxvalley/comments/tntt60/freedom_convoy/,Freedom Convoy,/r/comoxvalley/comments/tntt60/freedom_convoy/i24tovh/,4,r/comoxvalley,0,4
They keep changing their minds. They just need to turn on the tv and see what’s happening in Ukraine and then try to talk about freedom.,t2_khcqq15s,Maggiemay78,0,1648252768.0,0,t1_i24szkm,i24szkm,False,LittleTribuneMayor,t3_tntt60,https://www.reddit.com/r/comoxvalley/comments/tntt60/freedom_convoy/,Freedom Convoy,/r/comoxvalley/comments/tntt60/freedom_convoy/i24szkm/,9,r/comoxvalley,0,9
They want winter to end and spring to come……. Oh wait….,t2_cpy50ih4,SuriderBC,0,1648252349.0,0,t1_i24s3xk,i24s3xk,False,LittleTribuneMayor,t3_tntt60,https://www.reddit.com/r/comoxvalley/comments/tntt60/freedom_convoy/,Freedom Convoy,/r/comoxvalley/comments/tntt60/freedom_convoy/i24s3xk/,1,r/comoxvalley,0,1
"I support of the right to protest, whatever the cause",t2_4tjvw7j7,LittleChuchiFace,0,1648251443.0,0,t1_i24q5xs,i24q5xs,True,LittleTribuneMayor,t3_tntt60,https://www.reddit.com/r/comoxvalley/comments/tntt60/freedom_convoy/,Freedom Convoy,/r/comoxvalley/comments/tntt60/freedom_convoy/i24q5xs/,3,r/comoxvalley,0,3
“I’m a big trucker” “I want attention” “don’t believe the fear mongering” “freedom has a price” “I’m gonna drive my hemi for miles and miles and spend my life savings on gas” “I have undiagnosed autism” like literally anyone with a fucking brain can tell the difference between “I want attention” and “I want freedom!” Freedom from what bro? Your old ball and chain… man I saw a guy with this giant sticker on his back windshield “I don’t raise sheep I raise wolves” like yea bro your askin to get your tires slashed and you deserve every dollar of gas you spend. Might as well throw 100$ out your back window while your driving cause that’s the only thing your good for.,t2_apsdonx6,LawConscious9255,0,1648250817.0,0,t1_i24ospr,i24ospr,True,LittleTribuneMayor,t3_tntt60,https://www.reddit.com/r/comoxvalley/comments/tntt60/freedom_convoy/,Freedom Convoy,/r/comoxvalley/comments/tntt60/freedom_convoy/i24ospr/,5,r/comoxvalley,0,5
Sigh. Have a good time at your protest this weekend.,t2_caqm1,Satchmocoltrane,0,1648250748.0,0,t1_i24oncj,i24oncj,False,LittleTribuneMayor,t3_tntt60,https://www.reddit.com/r/comoxvalley/comments/tntt60/freedom_convoy/,Freedom Convoy,/r/comoxvalley/comments/tntt60/freedom_convoy/i24oncj/,11,r/comoxvalley,0,11
What facts are you referring too?,t2_5cu2ra3p,lauralee66,0,1648250225.0,0,t1_i24nhza,i24nhza,False,LittleTribuneMayor,t3_tntt60,https://www.reddit.com/r/comoxvalley/comments/tntt60/freedom_convoy/,Freedom Convoy,/r/comoxvalley/comments/tntt60/freedom_convoy/i24nhza/,-22,r/comoxvalley,0,-22
Lmaoo yea that’s exactly what he meant 💀🤨,t2_apsdonx6,LawConscious9255,0,1648249761.0,0,t1_i24mhjy,i24mhjy,False,LittleTribuneMayor,t3_tntt60,https://www.reddit.com/r/comoxvalley/comments/tntt60/freedom_convoy/,Freedom Convoy,/r/comoxvalley/comments/tntt60/freedom_convoy/i24mhjy/,3,r/comoxvalley,0,3
If only the freedumb convoy could get their facts straight then we wouldn’t have to deal with this idiocy every weekend.,t2_caqm1,Satchmocoltrane,0,1648249646.0,0,t1_i24m8h9,i24m8h9,False,LittleTribuneMayor,t3_tntt60,https://www.reddit.com/r/comoxvalley/comments/tntt60/freedom_convoy/,Freedom Convoy,/r/comoxvalley/comments/tntt60/freedom_convoy/i24m8h9/,12,r/comoxvalley,0,12
"They are not stopping, just meeting the convoy going to Campbell. Get your facts straight and stop with the fear-mongering!  If you dont know just admit it 😊",t2_5cu2ra3p,lauralee66,0,1648249411.0,0,t1_i24lpul,i24lpul,False,LittleTribuneMayor,t3_tntt60,https://www.reddit.com/r/comoxvalley/comments/tntt60/freedom_convoy/,Freedom Convoy,/r/comoxvalley/comments/tntt60/freedom_convoy/i24lpul/,-22,r/comoxvalley,0,-22
This.  The best thing we can do is not feed into it.  They want to cause a scene and create confrontation.  They won't listen to logic.,t2_spix4,LeakySkylight,0,1648248194.0,0,t1_i24izii,i24izii,False,LittleTribuneMayor,t3_tntt60,https://www.reddit.com/r/comoxvalley/comments/tntt60/freedom_convoy/,Freedom Convoy,/r/comoxvalley/comments/tntt60/freedom_convoy/i24izii/,6,r/comoxvalley,0,6
I think it's about the politicians and the federal mandates,t2_5cu2ra3p,lauralee66,1,1648247122.0,0,t1_i24gkuz,i24gkuz,False,LittleTribuneMayor,t3_tntt60,https://www.reddit.com/r/comoxvalley/comments/tntt60/freedom_convoy/,Freedom Convoy,/r/comoxvalley/comments/tntt60/freedom_convoy/i24gkuz/,0,r/comoxvalley,0,0
They are not going to harass anyone 🤦🏼‍♀️,t2_5cu2ra3p,lauralee66,0,1648247056.0,0,t1_i24gfhl,i24gfhl,False,LittleTribuneMayor,t3_tntt60,https://www.reddit.com/r/comoxvalley/comments/tntt60/freedom_convoy/,Freedom Convoy,/r/comoxvalley/comments/tntt60/freedom_convoy/i24gfhl/,-24,r/comoxvalley,0,-24
I'm hoping it's limited to the parking lot and they won't actually be going in there to harass innocent workers. Who knows though lol,t2_diyahcsg,LittleTribuneMayor,0,1648244908.0,0,t1_i24bjht,i24bjht,False,LittleTribuneMayor,t3_tntt60,https://www.reddit.com/r/comoxvalley/comments/tntt60/freedom_convoy/,Freedom Convoy,/r/comoxvalley/comments/tntt60/freedom_convoy/i24bjht/,9,r/comoxvalley,0,9
Based.,t2_5hf9x,Human_Techne,0,1648244640.0,0,t1_i24axlt,i24axlt,True,LittleTribuneMayor,t3_tntt60,https://www.reddit.com/r/comoxvalley/comments/tntt60/freedom_convoy/,Freedom Convoy,/r/comoxvalley/comments/tntt60/freedom_convoy/i24axlt/,-8,r/comoxvalley,0,-8
I think they’re protesting the “basically done” part since they set it for a month after the masks dropped out of spite.,t2_kv65ta5y,EarlyFile3326,0,1648243905.0,0,t1_i2498d9,i2498d9,False,LittleTribuneMayor,t3_tntt60,https://www.reddit.com/r/comoxvalley/comments/tntt60/freedom_convoy/,Freedom Convoy,/r/comoxvalley/comments/tntt60/freedom_convoy/i2498d9/,5,r/comoxvalley,0,5
Attention.,t2_4h2af,UnsubstantiatedClaim,0,1648241562.0,0,t1_i243op4,i243op4,False,LittleTribuneMayor,t3_tntt60,https://www.reddit.com/r/comoxvalley/comments/tntt60/freedom_convoy/,Freedom Convoy,/r/comoxvalley/comments/tntt60/freedom_convoy/i243op4/,29,r/comoxvalley,0,29
"Assholes gonna asshole.

Seriously, some significant social stupidity succumbs several shitheads.",t2_96schm72,TheRealKeshoZeto,0,1648238515.0,0,t1_i23w7f7,i23w7f7,True,LittleTribuneMayor,t3_tntt60,https://www.reddit.com/r/comoxvalley/comments/tntt60/freedom_convoy/,Freedom Convoy,/r/comoxvalley/comments/tntt60/freedom_convoy/i23w7f7/,20,r/comoxvalley,0,20
"\- Hey Freedum Fighters, should we really convoy?   -Ya Fight the system!

\-Can't you go maskless now though?  -We will wear them!

\-They are getting rid of the mandates soon though? -Don't believe the media!

\-But gas is really expensive?  -Freedum has a price!

\-Why Canadian Tire?  -We got intel from Facebook, we won't look like morons for sure this time!",t2_kqjx4,HardButter,0,1648237853.0,0,t1_i23ujr3,i23ujr3,True,LittleTribuneMayor,t3_tntt60,https://www.reddit.com/r/comoxvalley/comments/tntt60/freedom_convoy/,Freedom Convoy,/r/comoxvalley/comments/tntt60/freedom_convoy/i23ujr3/,11,r/comoxvalley,0,11
"Why though? Seriously WHAT freedoms are they not getting? Masks are no longer mandatory, passports are being lifted, even the border restrictions are being eased gradually. 

A few weeks back, these morons were honking their way through 5th street, and one of them leaned out his window and yelled ""YOU'RE OVERWEIGHT!"" at me. 

Um thanks bud, I had no idea. <Roll eyes> Making your fellow convoyers look REAL Mature. This is the level of intellect I imagine they are all sitting at. They're protesting absolutely nothing, and supporting grifters and white supremist groups.",t2_e81kakne,Whatshername_Stew,0,1648237597.0,0,t1_i23tws7,i23tws7,True,LittleTribuneMayor,t3_tntt60,https://www.reddit.com/r/comoxvalley/comments/tntt60/freedom_convoy/,Freedom Convoy,/r/comoxvalley/comments/tntt60/freedom_convoy/i23tws7/,30,r/comoxvalley,0,30
"What “freedom” is protest requesting? Masks are dropped, vaccine requirements are basically done… what do they want?",t2_5lgg8l4,WendyPortledge,0,1648236194.0,0,t1_i23qhmq,i23qhmq,True,LittleTribuneMayor,t3_tntt60,https://www.reddit.com/r/comoxvalley/comments/tntt60/freedom_convoy/,Freedom Convoy,/r/comoxvalley/comments/tntt60/freedom_convoy/i23qhmq/,35,r/comoxvalley,0,35
These dumb pricks are still driving around?  How many Fuck Trudeau flags are they going to fly this time while saying this isn't about politics.,t2_b2c2p,Gregnor,0,1648235968.0,0,t1_i23py0o,i23py0o,True,LittleTribuneMayor,t3_tntt60,https://www.reddit.com/r/comoxvalley/comments/tntt60/freedom_convoy/,Freedom Convoy,/r/comoxvalley/comments/tntt60/freedom_convoy/i23py0o/,23,r/comoxvalley,0,23
You mean the heroic patriots? /s,t2_diyahcsg,LittleTribuneMayor,0,1648235598.0,0,t1_i23p1r9,i23p1r9,False,LittleTribuneMayor,t3_tntt60,https://www.reddit.com/r/comoxvalley/comments/tntt60/freedom_convoy/,Freedom Convoy,/r/comoxvalley/comments/tntt60/freedom_convoy/i23p1r9/,9,r/comoxvalley,0,9
What a bunch of losers.,t2_n3i04,DumbleForeSkin,0,1648232517.0,0,t1_i23hd6f,i23hd6f,True,LittleTribuneMayor,t3_tntt60,https://www.reddit.com/r/comoxvalley/comments/tntt60/freedom_convoy/,Freedom Convoy,/r/comoxvalley/comments/tntt60/freedom_convoy/i23hd6f/,35,r/comoxvalley,0,35
Gross,t2_2iyj3bv7,lordofmyrings,0,1648232333.0,0,t1_i23gw0l,i23gw0l,True,LittleTribuneMayor,t3_tntt60,https://www.reddit.com/r/comoxvalley/comments/tntt60/freedom_convoy/,Freedom Convoy,/r/comoxvalley/comments/tntt60/freedom_convoy/i23gw0l/,38,r/comoxvalley,0,38
"I totally agree, and usually something at a church would be volunteer run, and what training do these people have? It's totally unreasonable to put that type of burden/expectations on volunteers. 

Honestly I think the old hyundai dealership would be a great shelter. Lots of space for personal belongings/carts, very central.",t2_mzjy6,HSpears,0,1648141933.0,0,t1_i1ycj5p,i1ycj5p,False,Stunning-Caregiver54,t3_tljo7n,https://www.reddit.com/r/comoxvalley/comments/tljo7n/homeless_in_comox_valley/,Homeless in Comox Valley,/r/comoxvalley/comments/tljo7n/homeless_in_comox_valley/i1ycj5p/,1,r/comoxvalley,0,1
"A single homeless person can be managed, and could be trustworthy.  A group of homeless people is another story all together.  Homeless shelters are designed to manage this and have staff.  Throwing a bunch of people in a chruch building is not a solution.",t2_dh9z6h50,WonderfulSpecific601,0,1648138551.0,0,t1_i1y3owe,i1y3owe,False,Stunning-Caregiver54,t3_tljo7n,https://www.reddit.com/r/comoxvalley/comments/tljo7n/homeless_in_comox_valley/,Homeless in Comox Valley,/r/comoxvalley/comments/tljo7n/homeless_in_comox_valley/i1y3owe/,2,r/comoxvalley,0,2
"Just some perspective from someone who works in building design:

A church building is not suitable for use as a long term homeless shelter for several reasons; most of them relating to sanitation, fire safety, and the organized use of space.  I'll go over a few points:

A homeless shelter requires discrete spaces for sleeping, congregating, eating, and washroom facilities.  The spaces for each are determined in Part 3 of the BC Building Code, [https://free.bcpublications.ca/civix/content/public/bcbc2018/465649652/2121247527/?xsl=/templates/browse.xsl](https://free.bcpublications.ca/civix/content/public/bcbc2018/465649652/2121247527/?xsl=/templates/browse.xsl), to determine the building's maximum occupancy and the facilities required to serve that occupancy.

A church's occupancy rating is a [Group A assembly occupancy](https://free.bcpublications.ca/civix/document/id/public/bcbc2018/bcbc_2018dap1s13), where as a homeless shelter is a [Groub C, residential occupancy](https://free.bcpublications.ca/civix/document/id/public/bcbc2018/bcbc_2018dap1s13) (or maybe a group B)  I don't have time to pull up all the specific differences such as area per person permitted and required washroom facilities, but you can comb through the codes if you like.

A church, being an assembly building, has washroom facilities to service a crowd for a 2-3 hour service or event, but not for a population of homeless people.  There are little to no showers, and the number of water closets (toilets) could be insufficient for that use.  These types of buildings also have to have plumbing systems designed to meet the type of demand the occupancy places on the building's and the city's systems, but that stuff is way over my head.

A church building's fire safety plan is designed for evacuating a crowd that is attending an event, not a population of residents who are sleeping at night.  There are large open spaces for fire to spread quickly and usually a lack of fire spread barriers like fire doors that you would see in an apartment building.  The church also lacks designated sleeping rooms that have mandatory egress openings (a window you can climb through) directly to the exterior.  Unless the building is sprinklered, this would not serve as any sort of residential occupancy and the bylaw officers would be obligated to shut down any homeless housing due to risk of physical harm or death.  The risk of fire is only going to increase when you populate a building with a lot of desparate, down and out people who have no hope and might be prone to risky behaviour.

Eating: Do the kitchen facilities have enough capacity to feed these people?  Perhaps, but what about staff and supplies?  Or staff in general to manage the population and keep order?  How about an individual having security of person and belongings?  Having no dorm rooms at minimum with a locker, people will feel less secure.  People who feel less secure are prone to more defensive, aggressive behaviour.  These buildings are also designed to be inward focused, towards a center of worship, teaching, etc.  They often lack the kind of outdoor access for light and recreation, at least in a way that makes sense for a long term residential facility.

These and many factors add up to a situation where the population's morale and mental health could be more severely impacted over the long term.  Not to mention you are displacing any of the uses the building was designed for.  I am not saying anything here out of lack of care or empathy for the homeless, I'm saying it for the exact opposite.  Putting a group of people inside a buiding to use it in a way that it was not designed for would be more harmful than good.  Churches make good post disaster relief buildings for the short term, but are not a good long term housing solution for a homeless population.  We need dedicated long term homeless housing, and way more affordable housing.

Right now the City of Courtenay is dragging its feet on a lot of changes that are necessary to make affordable housing more available.  A lot of subdivisions are being dragged through council at a pace that makes a snail look like its going light speed.  I have worked on low income housing that took 2 years to get through the Development Permit process while the city tried everything to avoid upgrading the septic system.  And right now, the City of Courtenay does not allow secondary suites or carriage houses in many of its residential zones.  Cumberland's R1a zone allows for a suite in the home and a detached carriage house.  The best use of your energy might be to harass city council to get it's ass moving on this problem.  The less affordable housing we have, the more that lower income families fall out of the rental market as prices go up and their landlords sell from under them.

TL:DR

Buildings are designed around their intended use.  Human nature, psychology, health and well being is a MAJOR factor into how they are designed and why the codes, bylaws and regulations govern their design and use.  Using a building for a purpose it was not designed for could be disastrous for people's safety and mental health, and these issues could spill over into the community, making the problem worse.  We need to petition the city counsel to get working on making affordable housing easier to access/build, and support the increase in dedicated homeless shelters.",t2_dh9z6h50,WonderfulSpecific601,0,1648138491.0,0,t1_i1y3jad,i1y3jad,True,Stunning-Caregiver54,t3_tljo7n,https://www.reddit.com/r/comoxvalley/comments/tljo7n/homeless_in_comox_valley/,Homeless in Comox Valley,/r/comoxvalley/comments/tljo7n/homeless_in_comox_valley/i1y3jad/,5,r/comoxvalley,0,5
Got mine from Raincoast Farms up in Merville - great strawberry plants too!,t2_2kagxci3,ccolbs,0,1648129329.0,0,t1_i1xgrxr,i1xgrxr,True,Bodyjoy,t3_tfou38,https://www.reddit.com/r/comoxvalley/comments/tfou38/vermicomposting_getting_red_wigglers_locally/,"Vermicomposting, getting red wigglers locally.",/r/comoxvalley/comments/tfou38/vermicomposting_getting_red_wigglers_locally/i1xgrxr/,1,r/comoxvalley,0,1
"Previous conservative governments over saw the selling off of government entities like CN, Royal Bank, Telus etc whilst selling off our natural resources that could be used to fund social welfare programs for Canadians. Blame the government, but only blaming one party is foolish.",t2_70qa9ns2,MyOtherCarIsAHippo,0,1648104933.0,0,t1_i1wheil,i1wheil,False,Stunning-Caregiver54,t3_tljo7n,https://www.reddit.com/r/comoxvalley/comments/tljo7n/homeless_in_comox_valley/,Homeless in Comox Valley,/r/comoxvalley/comments/tljo7n/homeless_in_comox_valley/i1wheil/,15,r/comoxvalley,0,15
"Supporting housing and poverty initiatives in social and political realms goes a long way! Eg: who/what you vote for at all 3 levels of government, letter/email writing, shutting down harmful talk related to homelessness or poor bashing, check in with what the [Coalition to End Homelessness](https://www.cvhousing.ca/) is up to or what info they have.",t2_8bym91w0,False_Pen8611,0,1648093790.0,0,t1_i1w1372,i1w1372,False,Stunning-Caregiver54,t3_tljo7n,https://www.reddit.com/r/comoxvalley/comments/tljo7n/homeless_in_comox_valley/,Homeless in Comox Valley,/r/comoxvalley/comments/tljo7n/homeless_in_comox_valley/i1w1372/,10,r/comoxvalley,0,10
Thanks so much. You will know if we do strike - it would be visible all over.,t2_d2sk91g5,Interesting_Math3257,0,1648087308.0,0,t1_i1vo3ee,i1vo3ee,False,Interesting_Math3257,t3_tedw5b,https://www.reddit.com/r/comoxvalley/comments/tedw5b/i_belong_to_the_heu_union_and_there_is_serious/,I belong to the HEU union and there is serious talk a strike,/r/comoxvalley/comments/tedw5b/i_belong_to_the_heu_union_and_there_is_serious/i1vo3ee/,2,r/comoxvalley,0,2
"To be fair its hardly Justin’s fault.  I have a lot of nasty things to say about him, but this is a global issue.  The rich are getting richer and the poor are getting poorer.",t2_35c9orv4,Hexxenya,0,1648085126.0,0,t1_i1vj8x3,i1vj8x3,False,Stunning-Caregiver54,t3_tljo7n,https://www.reddit.com/r/comoxvalley/comments/tljo7n/homeless_in_comox_valley/,Homeless in Comox Valley,/r/comoxvalley/comments/tljo7n/homeless_in_comox_valley/i1vj8x3/,21,r/comoxvalley,0,21
"Canadian taxpayers' money is being given away to other countries like Ukraine and pharmaceutical companies for COVID vaccines.  Instead, it could be used to help Canadiens in real meaningful positive ways.  It's sad to see Justin Trudeau treatise Canadians like this, but even worse, people are OK with all of this happening...our kids and their future will be very hard.",t2_5ug2y788,davegcr420,0,1648083154.0,0,t1_i1vetmg,i1vetmg,True,Stunning-Caregiver54,t3_tljo7n,https://www.reddit.com/r/comoxvalley/comments/tljo7n/homeless_in_comox_valley/,Homeless in Comox Valley,/r/comoxvalley/comments/tljo7n/homeless_in_comox_valley/i1vetmg/,-36,r/comoxvalley,0,-36
"And then I think, ya know i have space in my yard, but then I'm terrified of the extra stress it would bring. I know not all homeless are untrustworthy, and if they aren't, usually it's addiction and mental health issues driving that train. I want to help, but I'm scared to, and I'm strapped for cash.",t2_mzjy6,HSpears,0,1648081905.0,0,t1_i1vc0di,i1vc0di,True,Stunning-Caregiver54,t3_tljo7n,https://www.reddit.com/r/comoxvalley/comments/tljo7n/homeless_in_comox_valley/,Homeless in Comox Valley,/r/comoxvalley/comments/tljo7n/homeless_in_comox_valley/i1vc0di/,16,r/comoxvalley,0,16
This is what happens when housing goes unchecked for years. People can’t afford places to live. Sadly it doesn’t look like it will be getting better anytime soon.,t2_kv65ta5y,EarlyFile3326,0,1648077214.0,0,t1_i1v1a7m,i1v1a7m,True,Stunning-Caregiver54,t3_tljo7n,https://www.reddit.com/r/comoxvalley/comments/tljo7n/homeless_in_comox_valley/,Homeless in Comox Valley,/r/comoxvalley/comments/tljo7n/homeless_in_comox_valley/i1v1a7m/,27,r/comoxvalley,0,27
Thanks for the info.,t2_a2g2r2cw,Automatic-Security-7,0,1647977710.0,0,t1_i1p96d9,i1p96d9,False,Automatic-Security-7,t3_tk3x9m,https://www.reddit.com/r/comoxvalley/comments/tk3x9m/pest_control_firm_recommendations/,Pest Control Firm Recommendations,/r/comoxvalley/comments/tk3x9m/pest_control_firm_recommendations/i1p96d9/,1,r/comoxvalley,0,1
Kroetschs pest control!!,t2_4q3awje1,thenoodlelover21,0,1647972952.0,0,t1_i1owxgy,i1owxgy,True,Automatic-Security-7,t3_tk3x9m,https://www.reddit.com/r/comoxvalley/comments/tk3x9m/pest_control_firm_recommendations/,Pest Control Firm Recommendations,/r/comoxvalley/comments/tk3x9m/pest_control_firm_recommendations/i1owxgy/,1,r/comoxvalley,0,1
Absolute solidarity from me. Update thw thread if you do and I'll bring food to you at the picket lines.,t2_7dhqepal,Leutkeana,0,1647969578.0,0,t1_i1oo4o8,i1oo4o8,True,Interesting_Math3257,t3_tedw5b,https://www.reddit.com/r/comoxvalley/comments/tedw5b/i_belong_to_the_heu_union_and_there_is_serious/,I belong to the HEU union and there is serious talk a strike,/r/comoxvalley/comments/tedw5b/i_belong_to_the_heu_union_and_there_is_serious/i1oo4o8/,2,r/comoxvalley,0,2
