body,author_fullname,author.name,controversiality,created,downs,fullname,id,is_root,link_author,link_id,link_permalink,link_title,permalink,score,subreddit_name_prefixed,total_awards_received,ups
"Mandates = Genocide is under the second red line.  It even talks about weather modification.  I actually did read all of it and it is crazy talk.  But I never said that you believe that.  You self assigned that.  In fact you self assigned a bunch of beliefs.  Do you really have that great of a need to be persecuted? 

If you have faith that Canadians in general will do the right thing for their neighbors then explain why these protestors are blaring train horns 24hrs a day until a court injunction.  Why are they blockading borders, traping fellow Canadians, and costing other truckers jobs?

But hey, you apparently believe that the government has manipulated data for a paradigm of control.  Like really?  I mean you can fudge them a bit but this is a global pandemic.  Even if they were fudging they could not take it too far because things wouldn't line up with the data out of other countries.",t2_b2c2p,Gregnor,0,1645163757.0,0,t1_hxewo13,hxewo13,False,a_strange_girl,t3_sv3tob,https://www.reddit.com/r/comoxvalley/comments/sv3tob/crazy_people_posting_crazy_crap/,Crazy people posting crazy crap,/r/comoxvalley/comments/sv3tob/crazy_people_posting_crazy_crap/hxewo13/,11,r/comoxvalley,0,11
The spelling alone is atrocious. At least run that manifesto through Microsoft Word first.,t2_5c2ot,papershoes,0,1645163664.0,0,t1_hxewirh,hxewirh,False,a_strange_girl,t3_sv3tob,https://www.reddit.com/r/comoxvalley/comments/sv3tob/crazy_people_posting_crazy_crap/,Crazy people posting crazy crap,/r/comoxvalley/comments/sv3tob/crazy_people_posting_crazy_crap/hxewirh/,12,r/comoxvalley,0,12
"Ok so my question/ comment didn’t show up ha. My kiddos love feeding ducks and I don’t know of any reliable places to take them. We, of course, feed ducks a healthy duck seed feed, not bread. Thanks in advance!",t2_4xv8t16d,bluepink1216,0,1645163065.0,0,t1_hxevjbm,hxevjbm,True,bluepink1216,t3_sva9vz,https://www.reddit.com/r/comoxvalley/comments/sva9vz/ducks/,Ducks!🦆,/r/comoxvalley/comments/sva9vz/ducks/hxevjbm/,6,r/comoxvalley,0,6
"Boy do people who sure seem to like fascists love to call everything they don't like ""communism"". Every time I don't get whatever I want, whenever I want it? Baby, that's communism.",t2_7wedkw6j,DoctorTobogganMD3,0,1645162449.0,0,t1_hxeuif1,hxeuif1,True,a_strange_girl,t3_sv3tob,https://www.reddit.com/r/comoxvalley/comments/sv3tob/crazy_people_posting_crazy_crap/,Crazy people posting crazy crap,/r/comoxvalley/comments/sv3tob/crazy_people_posting_crazy_crap/hxeuif1/,18,r/comoxvalley,0,18
Nice list. Even has the 5G.,t2_35zxk1lk,tompeij,0,1645162440.0,0,t1_hxeuhtt,hxeuhtt,True,a_strange_girl,t3_sv3tob,https://www.reddit.com/r/comoxvalley/comments/sv3tob/crazy_people_posting_crazy_crap/,Crazy people posting crazy crap,/r/comoxvalley/comments/sv3tob/crazy_people_posting_crazy_crap/hxeuhtt/,8,r/comoxvalley,0,8
"I do not like the mandates, but I am vaccinated and I wear my mask everywhere I go. Its not about that for me, its about our government not respecting that Canadians in general will do what is right for each other without being forced to. And its about the manipulation of data to spin a narrative that creates a paradigm of control.  

Where did I or this paper say mandates are genocide? How come people are so quick to attach beliefs to others that they have no evidence for? Why do you assume so much about me without any provocation? What would make you feel less personally attacked by people speaking out against corporate malfeasance?

I understand that there are morons out there crying “genocide” and “5g causes covid” etc. I am not spouting ANY of that, I am simply asking people to stop dismissing people as crazy and investigate information for themselves rather than trust government bought media.",t2_8d1onrf2,For_sure_a_bot,1,1645161300.0,0,t1_hxesjhy,hxesjhy,False,a_strange_girl,t3_sv3tob,https://www.reddit.com/r/comoxvalley/comments/sv3tob/crazy_people_posting_crazy_crap/,Crazy people posting crazy crap,/r/comoxvalley/comments/sv3tob/crazy_people_posting_crazy_crap/hxesjhy/,-2,r/comoxvalley,0,-2
"Then go to Ottowa and protest for higher taxes on the rich, housing affordability, reformating the fine systems, cutting large corporation subsidies, greater money laundering powers, taxation on capital gains, more taxes on natural resources, equal treatment under the law for the rich, stronger union-busting rules, more employee rights, equal access to education, closing tax loopholes, investigating the Panama Papers, and more!

But it's not about that though is it?  It's about pandemic mandates.  Something that you are being asked to do for the greater good of us all.  Calling vaccines ""Forced Medical Experiments"" and calling mandates ""genocide""?  That's really is crazy talk...",t2_b2c2p,Gregnor,0,1645159484.0,0,t1_hxep980,hxep980,False,a_strange_girl,t3_sv3tob,https://www.reddit.com/r/comoxvalley/comments/sv3tob/crazy_people_posting_crazy_crap/,Crazy people posting crazy crap,/r/comoxvalley/comments/sv3tob/crazy_people_posting_crazy_crap/hxep980/,18,r/comoxvalley,0,18
"You'll never change the mind of someone that supports the level of government control we have today. Bill c-10 and Bill c-36 will control what we say and how we say it soon. 

Couple of hundred people constitutes the war act!?

It blows my mind how easy it is to manipulate people these days!",t2_7erg4bx1,Big_Positive9928,1,1645159120.0,0,t1_hxeokqd,hxeokqd,False,a_strange_girl,t3_sv3tob,https://www.reddit.com/r/comoxvalley/comments/sv3tob/crazy_people_posting_crazy_crap/,Crazy people posting crazy crap,/r/comoxvalley/comments/sv3tob/crazy_people_posting_crazy_crap/hxeokqd/,-2,r/comoxvalley,0,-2
"But this has, for the most part, actually happened. You think the government isn’t working on a digital ID? You think the central bank isn’t working on a digital currency? You think Justin Trudeau doesn’t admire communist dictatorship? You think we aren’t being dragged into a war for profit right now? 
The craziest thing I see on there is a reference to Infowars, but even Alex Jones is proven right about a lot of things he says over time. 
Instead of dismissing your neighbours as “crazy”, maybe try actually investigating the information for yourself.  Turn the government-bought media off and do some actual research. Go look at the CDC website and use a first principles perspective. Its propaganda, not science. 

I am starting to feel like a lot of people are unreachable. And I guess I can understand why, its terrifying to think that our government works for corporate and global interests, not for the people of Canada. And I don’t think the conservatives would be any better. We need reform FAST or we are doomed. 

How come we are so poor as a nation while corporations pull billions of dollars of natural resources out of our country every year? Why are our politicians still arguing about a Nazi flag at a protest instead of discussing, oh I don’t know.... how to get us out of a nearly 2 trillion dollar deficit. 

Please please please stop dismissing anything that makes you uncomfortable as crazy, or conspiracy and realize that we need to unite and stand up for each other or our country will continue to be sold to foreign corporate interest at our expense..
How can you look at housing prices and gas prices, the horrible spending sprees of this government and say “well the people who are speaking out against it are misogynistic and racist because the PM said so”.
How can you seriously think that these lockdowns persisting STILL are okay?
Look at India, they have a massively lower vaccination rate, less severe lockdowns, higher population, and they have way less covid.",t2_8d1onrf2,For_sure_a_bot,0,1645158152.0,0,t1_hxemppa,hxemppa,True,a_strange_girl,t3_sv3tob,https://www.reddit.com/r/comoxvalley/comments/sv3tob/crazy_people_posting_crazy_crap/,Crazy people posting crazy crap,/r/comoxvalley/comments/sv3tob/crazy_people_posting_crazy_crap/hxemppa/,-19,r/comoxvalley,0,-19
Are you though?,t2_6cm18qmp,BlameThePeacock,0,1645154559.0,0,t1_hxefdm7,hxefdm7,False,a_strange_girl,t3_sv3tob,https://www.reddit.com/r/comoxvalley/comments/sv3tob/crazy_people_posting_crazy_crap/,Crazy people posting crazy crap,/r/comoxvalley/comments/sv3tob/crazy_people_posting_crazy_crap/hxefdm7/,2,r/comoxvalley,0,2
Yeah I ripped one of those down this morning at the corner of England and 5th.,t2_ag5b8,el_canelo,0,1645150465.0,0,t1_hxe6dyu,hxe6dyu,True,a_strange_girl,t3_sv3tob,https://www.reddit.com/r/comoxvalley/comments/sv3tob/crazy_people_posting_crazy_crap/,Crazy people posting crazy crap,/r/comoxvalley/comments/sv3tob/crazy_people_posting_crazy_crap/hxe6dyu/,22,r/comoxvalley,0,22
"if all these crazies are so against communism, maybe there's something to it",t2_exlu4wsw,Obvious_Conflict457,0,1645148858.0,0,t1_hxe2ug1,hxe2ug1,True,a_strange_girl,t3_sv3tob,https://www.reddit.com/r/comoxvalley/comments/sv3tob/crazy_people_posting_crazy_crap/,Crazy people posting crazy crap,/r/comoxvalley/comments/sv3tob/crazy_people_posting_crazy_crap/hxe2ug1/,27,r/comoxvalley,0,27
I am shocked they don’t understand how insane they sound,t2_iapel82a,Zdravstvootye,0,1645148349.0,0,t1_hxe1py7,hxe1py7,True,a_strange_girl,t3_sv3tob,https://www.reddit.com/r/comoxvalley/comments/sv3tob/crazy_people_posting_crazy_crap/,Crazy people posting crazy crap,/r/comoxvalley/comments/sv3tob/crazy_people_posting_crazy_crap/hxe1py7/,17,r/comoxvalley,0,17
Maybe ask the French School in Comox ? They might know. There are lots of Québécois and French speaking people in the valley ! Bomme chance !,t2_6ahzqayk,Cestbonlespatates,0,1645147452.0,0,t1_hxdzqxu,hxdzqxu,True,comcanada78,t3_suv9x4,https://www.reddit.com/r/comoxvalley/comments/suv9x4/local_french_lessons/,Local French lessons?,/r/comoxvalley/comments/suv9x4/local_french_lessons/hxdzqxu/,3,r/comoxvalley,0,3
"If you do, use a knife, because it’s somewhat common for people to stick razor blades or broken glass behind posters and stickers like this, so be careful",t2_7y3eht51,Got10_fingers_left,0,1645145777.0,0,t1_hxdw1h9,hxdw1h9,False,a_strange_girl,t3_sv3tob,https://www.reddit.com/r/comoxvalley/comments/sv3tob/crazy_people_posting_crazy_crap/,Crazy people posting crazy crap,/r/comoxvalley/comments/sv3tob/crazy_people_posting_crazy_crap/hxdw1h9/,16,r/comoxvalley,0,16
That one was by Graham’s. it was good for a laugh.,t2_5qojqe8m,a_strange_girl,0,1645144739.0,0,t1_hxdtpx0,hxdtpx0,False,a_strange_girl,t3_sv3tob,https://www.reddit.com/r/comoxvalley/comments/sv3tob/crazy_people_posting_crazy_crap/,Crazy people posting crazy crap,/r/comoxvalley/comments/sv3tob/crazy_people_posting_crazy_crap/hxdtpx0/,4,r/comoxvalley,0,4
gonna have to wander around taking these down over the weekend if they're still up.,t2_mm23nqz,BitterReference,0,1645144126.0,0,t1_hxdsc8a,hxdsc8a,True,a_strange_girl,t3_sv3tob,https://www.reddit.com/r/comoxvalley/comments/sv3tob/crazy_people_posting_crazy_crap/,Crazy people posting crazy crap,/r/comoxvalley/comments/sv3tob/crazy_people_posting_crazy_crap/hxdsc8a/,31,r/comoxvalley,0,31
I've been self taught (highschool doesn't really count here). I did a self assessment and got B1 but I'd say A2 to be safe.,t2_5ft0hyzj,comcanada78,0,1645143197.0,0,t1_hxdq7td,hxdq7td,False,comcanada78,t3_suv9x4,https://www.reddit.com/r/comoxvalley/comments/suv9x4/local_french_lessons/,Local French lessons?,/r/comoxvalley/comments/suv9x4/local_french_lessons/hxdq7td/,2,r/comoxvalley,0,2
">They were waving confederate flags in front of parliament.

So? There was a guy at my own high school here on the island who had a confederate flag on the back of his truck. Is that supposed to make me think this is America's fault? When the Proud Boys (who were started by a Canadian) waved a British colonial era flag at a protest in Halifax a few years ago, was that England's fault? When Central Park Karen called the police on the African American bird watcher last year, was it Canada's fault because she is a Canadian born/raised in Ontario who was just living out her racist tendencies in NYC? 

I hate to have to point this out to you but the confederate flag being used by Canadians is nothing new. It's like the red Trump MAGA hat, which I've seen twice in the last year here in the valley. It's been appropriated by many groups to signify many things.

[https://www.cbc.ca/news/canada/ottawa/confederate-flags-ontario-1.5607598](https://www.cbc.ca/news/canada/ottawa/confederate-flags-ontario-1.5607598)

[https://nationalpost.com/news/canada/why-the-confederate-flag-is-surprisingly-abundant-in-canada](https://nationalpost.com/news/canada/why-the-confederate-flag-is-surprisingly-abundant-in-canada) 

[https://www.vice.com/en/article/needpk/hey-canadians-why-the-fuck-are-you-flying-the-confederate-flag](https://www.vice.com/en/article/needpk/hey-canadians-why-the-fuck-are-you-flying-the-confederate-flag)",t2_gmvu2igg,Apart-Fan-5658,0,1645140363.0,0,t1_hxdjl6v,hxdjl6v,False,evade26,t3_sln8g9,https://www.reddit.com/r/comoxvalley/comments/sln8g9/jesus_christ_the_freedom_convoy_in_town_is_peak/,Jesus Christ the “Freedom convoy” in town is peak knuckle dragging cringe.,/r/comoxvalley/comments/sln8g9/jesus_christ_the_freedom_convoy_in_town_is_peak/hxdjl6v/,1,r/comoxvalley,0,1
What level is your French?,t2_55jpk7pm,Alo_Beirut,0,1645137225.0,0,t1_hxdbuwa,hxdbuwa,True,comcanada78,t3_suv9x4,https://www.reddit.com/r/comoxvalley/comments/suv9x4/local_french_lessons/,Local French lessons?,/r/comoxvalley/comments/suv9x4/local_french_lessons/hxdbuwa/,2,r/comoxvalley,0,2
You could cross post to salt spring island.,t2_8qhr9f78,Sewers_folly,0,1645136660.0,0,t1_hxdaf9u,hxdaf9u,True,UVicBRAINLab,t3_suvpo3,https://www.reddit.com/r/comoxvalley/comments/suvpo3/participants_needed_for_covid19_rural_and_remote/,"Participants Needed for COVID-19 Rural and Remote (population <10,000) BC Residents Study",/r/comoxvalley/comments/suvpo3/participants_needed_for_covid19_rural_and_remote/hxdaf9u/,1,r/comoxvalley,0,1
"There is literally nowhere in the province or country for that matter with no Yahoos, I wouldn't get too down about it.",t2_diyahcsg,LittleTribuneMayor,0,1645124210.0,0,t1_hxcdm9r,hxcdm9r,False,parkleswife,t3_sti8up,https://www.reddit.com/r/comoxvalley/comments/sti8up/crossposted_what_the_heck_is_going_on/,Crossposted- What the heck is going on?,/r/comoxvalley/comments/sti8up/crossposted_what_the_heck_is_going_on/hxcdm9r/,2,r/comoxvalley,0,2
"It's pretty unsettling, honestly. I keep expecting better from my hometown, and just keep getting let down.",t2_5pre1,maybe_sparrow,0,1645123490.0,0,t1_hxcbnpr,hxcbnpr,False,parkleswife,t3_sti8up,https://www.reddit.com/r/comoxvalley/comments/sti8up/crossposted_what_the_heck_is_going_on/,Crossposted- What the heck is going on?,/r/comoxvalley/comments/sti8up/crossposted_what_the_heck_is_going_on/hxcbnpr/,2,r/comoxvalley,0,2
"Looks like they're sold out now, thanks for the resource though. I'll keep an eye on it for restocking.",t2_mm23nqz,BitterReference,0,1645121411.0,0,t1_hxc5zwl,hxc5zwl,False,BitterReference,t3_su7mk9,https://www.reddit.com/r/comoxvalley/comments/su7mk9/covid_rapid_test_availability/,COVID Rapid Test Availability?,/r/comoxvalley/comments/su7mk9/covid_rapid_test_availability/hxc5zwl/,2,r/comoxvalley,0,2
I bought mine on the Canadian Shield website $10 each and you get a five pack. They shipped yesterday,t2_3za4ye1x,bcqt1,0,1645121197.0,0,t1_hxc5fb5,hxc5fb5,True,BitterReference,t3_su7mk9,https://www.reddit.com/r/comoxvalley/comments/su7mk9/covid_rapid_test_availability/,COVID Rapid Test Availability?,/r/comoxvalley/comments/su7mk9/covid_rapid_test_availability/hxc5fb5/,1,r/comoxvalley,0,1
"Awesome, thanks so much!",t2_mm23nqz,BitterReference,0,1645119340.0,0,t1_hxc0es8,hxc0es8,False,BitterReference,t3_su7mk9,https://www.reddit.com/r/comoxvalley/comments/su7mk9/covid_rapid_test_availability/,COVID Rapid Test Availability?,/r/comoxvalley/comments/su7mk9/covid_rapid_test_availability/hxc0es8/,1,r/comoxvalley,0,1
"That's a tricky situation, but good on you for attacking it head on! I'm sure things will begin to get more and more positive in the weeks/months to come.",t2_diyahcsg,LittleTribuneMayor,0,1645097240.0,0,t1_hxanh7e,hxanh7e,False,Interesting_Math3257,t3_rgxer2,https://www.reddit.com/r/comoxvalley/comments/rgxer2/feel_like_ending_it_all/,Feel like ending it all.,/r/comoxvalley/comments/rgxer2/feel_like_ending_it_all/hxanh7e/,1,r/comoxvalley,0,1
"As many Yahoo's as we may have here, I'm glad it's not like the Okanagan... They seem to have a monopoly on that sort of thing for BC",t2_diyahcsg,LittleTribuneMayor,0,1645096950.0,0,t1_hxan3k3,hxan3k3,False,parkleswife,t3_sti8up,https://www.reddit.com/r/comoxvalley/comments/sti8up/crossposted_what_the_heck_is_going_on/,Crossposted- What the heck is going on?,/r/comoxvalley/comments/sti8up/crossposted_what_the_heck_is_going_on/hxan3k3/,4,r/comoxvalley,0,4
"Thanks. Hopefully something positive emerges soon. There are not a lot of jobs which pay enough to live on here. I am in school working hard to shift this though. 

I have to remain on the island somewhere close to here as I share custody of a 12 year and moving away would mean more court, no one wins.",t2_d2sk91g5,Interesting_Math3257,0,1645086190.0,0,t1_hxa9n6b,hxa9n6b,False,Interesting_Math3257,t3_rgxer2,https://www.reddit.com/r/comoxvalley/comments/rgxer2/feel_like_ending_it_all/,Feel like ending it all.,/r/comoxvalley/comments/rgxer2/feel_like_ending_it_all/hxa9n6b/,1,r/comoxvalley,0,1
"Reddit is anonymous (which is something I love about it) but if and when we start meetings up again (probably on zoom) I'll find you on this message board and give you directions on how to find more cv peace society info. Or if we have an event I'll throw it here in your direction and you could possibly come and introduce yourself to the group. It's a small group of mostly cool, somewhat eccentric, elderly activists. We used to run the local food not bombs until we lost one of our prominent members to conspiracy theories. He was great and we still love him; just can't work with the guy anymore. He was the lifeblood of food not bombs and now he's not allowed to run a kitchen. 
I totally agree with the media literacy comment. In combination with poor political theory.  It's been baffling and kinda sad.",t2_idslzfkj,Useful-Host8289,0,1645082986.0,0,t1_hxa5j17,hxa5j17,False,parkleswife,t3_sti8up,https://www.reddit.com/r/comoxvalley/comments/sti8up/crossposted_what_the_heck_is_going_on/,Crossposted- What the heck is going on?,/r/comoxvalley/comments/sti8up/crossposted_what_the_heck_is_going_on/hxa5j17/,1,r/comoxvalley,0,1
Proud to be Canadian,t2_9rd20rpw,tim5oclock,0,1645082469.0,0,t1_hxa4uob,hxa4uob,False,[deleted],t3_sud7j6,https://www.reddit.com/r/comoxvalley/comments/sud7j6/boycott_cameron_contracting/,Boycott Cameron Contracting,/r/comoxvalley/comments/sud7j6/boycott_cameron_contracting/hxa4uob/,0,r/comoxvalley,0,0
Put that flag high in the sky,t2_9rd20rpw,tim5oclock,0,1645082440.0,0,t1_hxa4ta3,hxa4ta3,False,[deleted],t3_sud7j6,https://www.reddit.com/r/comoxvalley/comments/sud7j6/boycott_cameron_contracting/,Boycott Cameron Contracting,/r/comoxvalley/comments/sud7j6/boycott_cameron_contracting/hxa4ta3/,0,r/comoxvalley,0,0
Put that flag high in the air,t2_9rd20rpw,tim5oclock,0,1645082334.0,0,t1_hxa4o4x,hxa4o4x,False,[deleted],t3_sud7j6,https://www.reddit.com/r/comoxvalley/comments/sud7j6/boycott_cameron_contracting/,Boycott Cameron Contracting,/r/comoxvalley/comments/sud7j6/boycott_cameron_contracting/hxa4o4x/,-1,r/comoxvalley,0,-1
This post has been removed; this is not the place to be raising boycotts,t2_5hrd2,karkaran117,0,1645082177.0,0,t1_hxa4glw,hxa4glw,True,[deleted],t3_sud7j6,https://www.reddit.com/r/comoxvalley/comments/sud7j6/boycott_cameron_contracting/,Boycott Cameron Contracting,/r/comoxvalley/comments/sud7j6/boycott_cameron_contracting/hxa4glw/,0,r/comoxvalley,0,0
"Doctor, heal thyself.",t2_caukh93e,um_ok_try_again,0,1645081583.0,0,t1_hxa3nsg,hxa3nsg,False,meagski,t3_soz0fa,https://www.reddit.com/r/comoxvalley/comments/soz0fa/road_rage_on_island_highway_by_courtenay_returnit/,Road Rage on Island Highway by Courtenay Return-it Depot????,/r/comoxvalley/comments/soz0fa/road_rage_on_island_highway_by_courtenay_returnit/hxa3nsg/,2,r/comoxvalley,0,2
This crap shouldn't ever be about politics,t2_33rhx0lq,Youngladyloo,0,1645080738.0,0,t1_hxa2hxo,hxa2hxo,False,evade26,t3_sln8g9,https://www.reddit.com/r/comoxvalley/comments/sln8g9/jesus_christ_the_freedom_convoy_in_town_is_peak/,Jesus Christ the “Freedom convoy” in town is peak knuckle dragging cringe.,/r/comoxvalley/comments/sln8g9/jesus_christ_the_freedom_convoy_in_town_is_peak/hxa2hxo/,3,r/comoxvalley,0,3
They were waving confederate flags in front of parliament.,t2_caukh93e,um_ok_try_again,0,1645080628.0,0,t1_hxa2cgm,hxa2cgm,False,evade26,t3_sln8g9,https://www.reddit.com/r/comoxvalley/comments/sln8g9/jesus_christ_the_freedom_convoy_in_town_is_peak/,Jesus Christ the “Freedom convoy” in town is peak knuckle dragging cringe.,/r/comoxvalley/comments/sln8g9/jesus_christ_the_freedom_convoy_in_town_is_peak/hxa2cgm/,1,r/comoxvalley,0,1
"Oh that's really cool with the peace society, that definitely sounds like my sort of people. I've been looking to get involved and show solidarity with the indigenous community up here, it's just been hard with moving up here during Covid and all but I'll have to keep an eye out for events.

But yes, I definitely am with you on having some push back against those who are white supremacists and those who are willing to be in concert with white supremacists because they're tired of or flat out refusing to acknowledge that we are in a pandemic. There's such bad media literacy in this country that a few people I grew up with in the prairies are all in on the convoy and getting excited about rebel media and I would have historically considered them measured and decent people. But yeah, a lot of the alt right, white supremacists, anti vax, Qanon adjacent, sovereign citizen etc are all coalescing along with people who are just confused and entitled and it's leading to some ugly responses. It'd be nice to try and reach to people that can be saved and also show some solidarity and support for health care workers, eldlery, immunocompromised etc while also conveying its not okay to be proudly walking around with fascists.",t2_7wedkw6j,DoctorTobogganMD3,0,1645080460.0,0,t1_hxa23ye,hxa23ye,False,parkleswife,t3_sti8up,https://www.reddit.com/r/comoxvalley/comments/sti8up/crossposted_what_the_heck_is_going_on/,Crossposted- What the heck is going on?,/r/comoxvalley/comments/sti8up/crossposted_what_the_heck_is_going_on/hxa23ye/,1,r/comoxvalley,0,1
Just moved here :) really love it.,t2_caukh93e,um_ok_try_again,0,1645080400.0,0,t1_hxa20y8,hxa20y8,False,evade26,t3_sln8g9,https://www.reddit.com/r/comoxvalley/comments/sln8g9/jesus_christ_the_freedom_convoy_in_town_is_peak/,Jesus Christ the “Freedom convoy” in town is peak knuckle dragging cringe.,/r/comoxvalley/comments/sln8g9/jesus_christ_the_freedom_convoy_in_town_is_peak/hxa20y8/,0,r/comoxvalley,0,0
"never stand with racism, not matter how small the connection. look around at who are sitting at the table with.",t2_9nc4juh2,Street-Strike1837,0,1645080208.0,0,t1_hxa1r3i,hxa1r3i,False,[deleted],t3_sud7j6,https://www.reddit.com/r/comoxvalley/comments/sud7j6/boycott_cameron_contracting/,Boycott Cameron Contracting,/r/comoxvalley/comments/sud7j6/boycott_cameron_contracting/hxa1r3i/,6,r/comoxvalley,0,6
Disgusting. Its amazing how brazen some people/companies are with supporting white supremacy in clear view. Don't forget.,t2_9nc4juh2,Street-Strike1837,0,1645080037.0,0,t1_hxa1i73,hxa1i73,True,[deleted],t3_sud7j6,https://www.reddit.com/r/comoxvalley/comments/sud7j6/boycott_cameron_contracting/,Boycott Cameron Contracting,/r/comoxvalley/comments/sud7j6/boycott_cameron_contracting/hxa1i73/,6,r/comoxvalley,0,6
We are. They are the exception to the rule.,t2_caukh93e,um_ok_try_again,0,1645079841.0,0,t1_hxa181w,hxa181w,False,evade26,t3_sln8g9,https://www.reddit.com/r/comoxvalley/comments/sln8g9/jesus_christ_the_freedom_convoy_in_town_is_peak/,Jesus Christ the “Freedom convoy” in town is peak knuckle dragging cringe.,/r/comoxvalley/comments/sln8g9/jesus_christ_the_freedom_convoy_in_town_is_peak/hxa181w/,3,r/comoxvalley,0,3
Well said neighbor 👏,t2_caukh93e,um_ok_try_again,0,1645079686.0,0,t1_hxa0zzs,hxa0zzs,True,evade26,t3_sln8g9,https://www.reddit.com/r/comoxvalley/comments/sln8g9/jesus_christ_the_freedom_convoy_in_town_is_peak/,Jesus Christ the “Freedom convoy” in town is peak knuckle dragging cringe.,/r/comoxvalley/comments/sln8g9/jesus_christ_the_freedom_convoy_in_town_is_peak/hxa0zzs/,2,r/comoxvalley,0,2
They aren't wrong.,t2_6tnrp,Chowderhead1,0,1645079213.0,0,t1_hxa0b07,hxa0b07,False,[deleted],t3_sud7j6,https://www.reddit.com/r/comoxvalley/comments/sud7j6/boycott_cameron_contracting/,Boycott Cameron Contracting,/r/comoxvalley/comments/sud7j6/boycott_cameron_contracting/hxa0b07/,4,r/comoxvalley,0,4
Here here!,t2_35c9orv4,Hexxenya,0,1645079113.0,0,t1_hxa05i3,hxa05i3,False,[deleted],t3_sud7j6,https://www.reddit.com/r/comoxvalley/comments/sud7j6/boycott_cameron_contracting/,Boycott Cameron Contracting,/r/comoxvalley/comments/sud7j6/boycott_cameron_contracting/hxa05i3/,-5,r/comoxvalley,0,-5
