body,author_fullname,author.name,controversiality,created,downs,fullname,id,is_root,link_author,link_id,link_permalink,link_title,permalink,score,subreddit_name_prefixed,total_awards_received,ups
"Havent looked at Victoria, but I think it's all Island Health. I've heard of a few doctors that have left the island in the past 6 months.",t2_fh1b9grd,SirLanceATwat,0,1644348879.0,0,t1_hw4fevp,hw4fevp,False,Superb_Mongoose2718,t3_snsjxh,https://www.reddit.com/r/comoxvalley/comments/snsjxh/how_hard_is_it_to_find_a_family_doctor_in_comox/,How hard is it to find a family doctor in Comox valley?,/r/comoxvalley/comments/snsjxh/how_hard_is_it_to_find_a_family_doctor_in_comox/hw4fevp/,3,r/comoxvalley,0,3
"Damn, 2 years! That's crazy. I'm glad it worked out for you though.",t2_12n9hw,truegothlove,0,1644348800.0,0,t1_hw4f7cs,hw4f7cs,False,truegothlove,t3_smxpih,https://www.reddit.com/r/comoxvalley/comments/smxpih/daycare_hw_do_people_make_it_work/,Daycare - hw do people make it work?,/r/comoxvalley/comments/smxpih/daycare_hw_do_people_make_it_work/hw4f7cs/,2,r/comoxvalley,0,2
Wonderful... so about as bad as Victoria?,t2_hwgo80h2,Superb_Mongoose2718,0,1644348690.0,0,t1_hw4ewt6,hw4ewt6,False,Superb_Mongoose2718,t3_snsjxh,https://www.reddit.com/r/comoxvalley/comments/snsjxh/how_hard_is_it_to_find_a_family_doctor_in_comox/,How hard is it to find a family doctor in Comox valley?,/r/comoxvalley/comments/snsjxh/how_hard_is_it_to_find_a_family_doctor_in_comox/hw4ewt6/,1,r/comoxvalley,0,1
"There's 40,000 people on the wait list last time I checked health link BC",t2_fh1b9grd,SirLanceATwat,0,1644348584.0,0,t1_hw4emi3,hw4emi3,True,Superb_Mongoose2718,t3_snsjxh,https://www.reddit.com/r/comoxvalley/comments/snsjxh/how_hard_is_it_to_find_a_family_doctor_in_comox/,How hard is it to find a family doctor in Comox valley?,/r/comoxvalley/comments/snsjxh/how_hard_is_it_to_find_a_family_doctor_in_comox/hw4emi3/,13,r/comoxvalley,0,13
">waiting 

Thanks! My wife is a part of that group and it is very supportive",t2_12n9hw,truegothlove,0,1644346315.0,0,t1_hw48ewn,hw48ewn,False,truegothlove,t3_smxpih,https://www.reddit.com/r/comoxvalley/comments/smxpih/daycare_hw_do_people_make_it_work/,Daycare - hw do people make it work?,/r/comoxvalley/comments/smxpih/daycare_hw_do_people_make_it_work/hw48ewn/,2,r/comoxvalley,0,2
I would just say that nobody has ever asked me to produce my baby as proof to get on a list.  For our second child he was on the waitlist as “Baby (Last Name)” until later when I called to update them.,t2_5izucebp,LilBrownieTootToot,0,1644341822.0,0,t1_hw3vui0,hw3vui0,False,truegothlove,t3_smxpih,https://www.reddit.com/r/comoxvalley/comments/smxpih/daycare_hw_do_people_make_it_work/,Daycare - hw do people make it work?,/r/comoxvalley/comments/smxpih/daycare_hw_do_people_make_it_work/hw3vui0/,2,r/comoxvalley,0,2
Mr. J's is pretty damn good.,t2_diyahcsg,LittleTribuneMayor,0,1644329935.0,0,t1_hw3182t,hw3182t,True,flyaway1775,t3_sj7cpp,https://www.reddit.com/r/comoxvalley/comments/sj7cpp/best_pizza_in_the_area/,Best pizza in the area?,/r/comoxvalley/comments/sj7cpp/best_pizza_in_the_area/hw3182t/,1,r/comoxvalley,0,1
"To the point about the cops, I love how they seem to pick and choose as when their outnumbered and thus can't seem to do anything, and the other times...",t2_diyahcsg,LittleTribuneMayor,0,1644329570.0,0,t1_hw30f2c,hw30f2c,False,evade26,t3_sln8g9,https://www.reddit.com/r/comoxvalley/comments/sln8g9/jesus_christ_the_freedom_convoy_in_town_is_peak/,Jesus Christ the “Freedom convoy” in town is peak knuckle dragging cringe.,/r/comoxvalley/comments/sln8g9/jesus_christ_the_freedom_convoy_in_town_is_peak/hw30f2c/,4,r/comoxvalley,0,4
Bergen has come out in support,t2_diyahcsg,LittleTribuneMayor,0,1644329346.0,0,t1_hw2zxhi,hw2zxhi,False,evade26,t3_sln8g9,https://www.reddit.com/r/comoxvalley/comments/sln8g9/jesus_christ_the_freedom_convoy_in_town_is_peak/,Jesus Christ the “Freedom convoy” in town is peak knuckle dragging cringe.,/r/comoxvalley/comments/sln8g9/jesus_christ_the_freedom_convoy_in_town_is_peak/hw2zxhi/,4,r/comoxvalley,0,4
Lol this has taught us more science classes for all kids lol,t2_diyahcsg,LittleTribuneMayor,0,1644329321.0,0,t1_hw2zveb,hw2zveb,False,evade26,t3_sln8g9,https://www.reddit.com/r/comoxvalley/comments/sln8g9/jesus_christ_the_freedom_convoy_in_town_is_peak/,Jesus Christ the “Freedom convoy” in town is peak knuckle dragging cringe.,/r/comoxvalley/comments/sln8g9/jesus_christ_the_freedom_convoy_in_town_is_peak/hw2zveb/,3,r/comoxvalley,0,3
"This might be a silly question, but are you allowed to get on a waitlist if you’re not expecting yet or do not have a child?",t2_6dcjqlhr,224map13,0,1644306749.0,0,t1_hw22om4,hw22om4,False,truegothlove,t3_smxpih,https://www.reddit.com/r/comoxvalley/comments/smxpih/daycare_hw_do_people_make_it_work/,Daycare - hw do people make it work?,/r/comoxvalley/comments/smxpih/daycare_hw_do_people_make_it_work/hw22om4/,1,r/comoxvalley,0,1
I couldn't find any in stock a few months ago when I was looking so I put in to be notified on adafruit and was surprised how quick it was. Shipping took some time as well but overall I think it was less than I month from requesting the notification to having it in hand,t2_jp07j,brody5895,0,1644303115.0,0,t1_hw1xnej,hw1xnej,True,Crocker-Speedway,t3_smuq0w,https://www.reddit.com/r/comoxvalley/comments/smuq0w/raspberry_pi_and_smart_mirrors/,Raspberry pi and smart mirrors,/r/comoxvalley/comments/smuq0w/raspberry_pi_and_smart_mirrors/hw1xnej/,1,r/comoxvalley,0,1
"I usually use CanaKit for raspberry pis https://www.canakit.com/
They are located around Vancouver and have good prices.",t2_6ahzqayk,Cestbonlespatates,0,1644293418.0,0,t1_hw1gl4e,hw1gl4e,True,Crocker-Speedway,t3_smuq0w,https://www.reddit.com/r/comoxvalley/comments/smuq0w/raspberry_pi_and_smart_mirrors/,Raspberry pi and smart mirrors,/r/comoxvalley/comments/smuq0w/raspberry_pi_and_smart_mirrors/hw1gl4e/,1,r/comoxvalley,0,1
"It’s a real shame there isn’t more customers for it, tho I do know there is a want for it.",t2_9g4ujj0a,KaijuTea,0,1644276468.0,0,t1_hw0e6n7,hw0e6n7,False,ArmyDouche,t3_sjft9f,https://www.reddit.com/r/comoxvalley/comments/sjft9f/what_kind_of_business_do_you_think_would_thrive/,What kind of business do you think would thrive in the Valley/Mid Island?,/r/comoxvalley/comments/sjft9f/what_kind_of_business_do_you_think_would_thrive/hw0e6n7/,1,r/comoxvalley,0,1
"Of all all the protesting I’ve witnessed, now and I’m the past, it seems like noise is the best case scenario to invoke change.",t2_gszg5,Trad33,0,1644271391.0,0,t1_hw01tnj,hw01tnj,False,evade26,t3_sln8g9,https://www.reddit.com/r/comoxvalley/comments/sln8g9/jesus_christ_the_freedom_convoy_in_town_is_peak/,Jesus Christ the “Freedom convoy” in town is peak knuckle dragging cringe.,/r/comoxvalley/comments/sln8g9/jesus_christ_the_freedom_convoy_in_town_is_peak/hw01tnj/,-1,r/comoxvalley,0,-1
I'd suggest North Island Drywall,t2_3za4ye1x,bcqt1,0,1644271222.0,0,t1_hw01eke,hw01eke,True,A_Sneaky_Walrus,t3_smhf12,https://www.reddit.com/r/comoxvalley/comments/smhf12/can_you_recommend_us_a_drywaller_please/,Can you recommend us a Drywaller please,/r/comoxvalley/comments/smhf12/can_you_recommend_us_a_drywaller_please/hw01eke/,1,r/comoxvalley,0,1
"Unprofessional conduct.  Blaring a 90db truck horn and it stops being a peaceful protest, it inflicts pain. Go in your car and see how long you can handle it, and remember it's not nearly as loud as a truck horn. Go ahead and have a peaceful protest but the second you harm others it has to stop. Encouraging it does nothing but embolden the fringe fanatics (an arson attack has happened now). I do disagree with the politics but believe in the right to peaceful protest. To encourage what now is an occupation is very unprofessional. Are the tactics used here a good way to protest? Would you support and encourage something that uses noise as a weapon?",t2_kqjx4,HardButter,0,1644270253.0,0,t1_hvzyy0t,hvzyy0t,False,evade26,t3_sln8g9,https://www.reddit.com/r/comoxvalley/comments/sln8g9/jesus_christ_the_freedom_convoy_in_town_is_peak/,Jesus Christ the “Freedom convoy” in town is peak knuckle dragging cringe.,/r/comoxvalley/comments/sln8g9/jesus_christ_the_freedom_convoy_in_town_is_peak/hvzyy0t/,7,r/comoxvalley,0,7
"It’s very difficult to find a spot especially for child under 18mths. The wait lists are bogus in many cases. I’ve heard of people that get in from “knowing someone”. 
Stay on all the wait lists and call the centres to check in from time to time. Take the first spot that comes up even if it’s not full time. Often it will turn into full time (if you need that). 
Look on the Comox Valley Child Care Share page on Facebook, and make a posting there. 

I got on all waitlists when I was 3 mths pregnant and I just got offered a part time (4 days) spot at a centre. (Child is 22 months old). 

I’m sure you’re on the list with Comox Valley Children’s Daycare Society? They have a new centre opening up this spring. 

Good luck. It’s very stressful. I feel your pain.",t2_5izucebp,LilBrownieTootToot,0,1644267603.0,0,t1_hvzs1ei,hvzs1ei,True,truegothlove,t3_smxpih,https://www.reddit.com/r/comoxvalley/comments/smxpih/daycare_hw_do_people_make_it_work/,Daycare - hw do people make it work?,/r/comoxvalley/comments/smxpih/daycare_hw_do_people_make_it_work/hvzs1ei/,6,r/comoxvalley,0,6
"We waited 2 years for each kid and that was getting our names on a waitlist the same week we found out we were pregnant, only advice is of you can get a ""part time"" spot absolutely take it, it's a pain in the ass but once your kid is in then it seems you get first dibs on a full time spot, we had our youngest in part time with a great daycare and part time with a lady with a license for a few kids. Not ideal but with 2 working parents it was our only hope!",t2_8ehkspr5,NorthIslandAdventure,0,1644267534.0,0,t1_hvzruus,hvzruus,True,truegothlove,t3_smxpih,https://www.reddit.com/r/comoxvalley/comments/smxpih/daycare_hw_do_people_make_it_work/,Daycare - hw do people make it work?,/r/comoxvalley/comments/smxpih/daycare_hw_do_people_make_it_work/hvzruus/,6,r/comoxvalley,0,6
"Not too sure how to help you, it’s a waiting game mixed with luck. But, if you haven’t yet, try joining local moms groups on Facebook. They seem like strong communitys who are always willing to help 🤷‍♂️",t2_gszg5,Trad33,0,1644266776.0,0,t1_hvzpuw8,hvzpuw8,True,truegothlove,t3_smxpih,https://www.reddit.com/r/comoxvalley/comments/smxpih/daycare_hw_do_people_make_it_work/,Daycare - hw do people make it work?,/r/comoxvalley/comments/smxpih/daycare_hw_do_people_make_it_work/hvzpuw8/,3,r/comoxvalley,0,3
"What was the review? Was it of the work they have done, or because they support something you disagree with?",t2_gszg5,Trad33,0,1644265787.0,0,t1_hvznb17,hvznb17,False,evade26,t3_sln8g9,https://www.reddit.com/r/comoxvalley/comments/sln8g9/jesus_christ_the_freedom_convoy_in_town_is_peak/,Jesus Christ the “Freedom convoy” in town is peak knuckle dragging cringe.,/r/comoxvalley/comments/sln8g9/jesus_christ_the_freedom_convoy_in_town_is_peak/hvznb17/,1,r/comoxvalley,0,1
"I’m away from town, and will be for a while, but holy shit, really? They’re finally done?",t2_4gh4non6,galvanized_steelies,0,1644265336.0,0,t1_hvzm4r8,hvzm4r8,False,isle_say,t3_slmpn8,https://www.reddit.com/r/comoxvalley/comments/slmpn8/im_thinking_of_coming_into_courtenay_on_sunday_to/,I'm thinking of coming into Courtenay on Sunday to run a few errands. Will traffic be crazy? I've heard the bridge was blocked today.,/r/comoxvalley/comments/slmpn8/im_thinking_of_coming_into_courtenay_on_sunday_to/hvzm4r8/,2,r/comoxvalley,0,2
Good job OP. Amazon is poison to our existence.,t2_fh1b9grd,SirLanceATwat,0,1644258843.0,0,t1_hvz5ga6,hvz5ga6,False,Crocker-Speedway,t3_smuq0w,https://www.reddit.com/r/comoxvalley/comments/smuq0w/raspberry_pi_and_smart_mirrors/,Raspberry pi and smart mirrors,/r/comoxvalley/comments/smuq0w/raspberry_pi_and_smart_mirrors/hvz5ga6/,5,r/comoxvalley,0,5
"Btw, if anybody has a used 24in+ hdmi monitor they’re looking to flog, looking for one.",t2_2ztg5c3,Crocker-Speedway,0,1644257487.0,0,t1_hvz1yzo,hvz1yzo,True,Crocker-Speedway,t3_smuq0w,https://www.reddit.com/r/comoxvalley/comments/smuq0w/raspberry_pi_and_smart_mirrors/,Raspberry pi and smart mirrors,/r/comoxvalley/comments/smuq0w/raspberry_pi_and_smart_mirrors/hvz1yzo/,2,r/comoxvalley,0,2
2 VR businesses failed here pre-pandemic so I really wonder if there is enough of a customer base in the valley. I would open up a space instantly if I thought it would work but the cost of renting a space large enough for VR is pretty prohibitive right off the bat. Add in console/GPU supply problems and getting something set-up seems cost-prohibitive at this point.,t2_d5bv1sq1,NewtotheCV,0,1644257365.0,0,t1_hvz1nqg,hvz1nqg,False,ArmyDouche,t3_sjft9f,https://www.reddit.com/r/comoxvalley/comments/sjft9f/what_kind_of_business_do_you_think_would_thrive/,What kind of business do you think would thrive in the Valley/Mid Island?,/r/comoxvalley/comments/sjft9f/what_kind_of_business_do_you_think_would_thrive/hvz1nqg/,2,r/comoxvalley,0,2
Thx!  Will check them out.,t2_2ztg5c3,Crocker-Speedway,0,1644257189.0,0,t1_hvz17cc,hvz17cc,False,Crocker-Speedway,t3_smuq0w,https://www.reddit.com/r/comoxvalley/comments/smuq0w/raspberry_pi_and_smart_mirrors/,Raspberry pi and smart mirrors,/r/comoxvalley/comments/smuq0w/raspberry_pi_and_smart_mirrors/hvz17cc/,1,r/comoxvalley,0,1
"I linked to BC Robotics in my other comment, I've bought a few microcontrollers and prototyping stuff from them. They're in Nanaimo",t2_5hrd2,karkaran117,0,1644256907.0,0,t1_hvz0hn7,hvz0hn7,False,Crocker-Speedway,t3_smuq0w,https://www.reddit.com/r/comoxvalley/comments/smuq0w/raspberry_pi_and_smart_mirrors/,Raspberry pi and smart mirrors,/r/comoxvalley/comments/smuq0w/raspberry_pi_and_smart_mirrors/hvz0hn7/,3,r/comoxvalley,0,3
"There's a company in Nanaimo, https://bc-robotics.com/

They have all sorts of great stuff. Pis themselves are hard to keep in stock of course",t2_5hrd2,karkaran117,0,1644256754.0,0,t1_hvz03ed,hvz03ed,True,Crocker-Speedway,t3_smuq0w,https://www.reddit.com/r/comoxvalley/comments/smuq0w/raspberry_pi_and_smart_mirrors/,Raspberry pi and smart mirrors,/r/comoxvalley/comments/smuq0w/raspberry_pi_and_smart_mirrors/hvz03ed/,5,r/comoxvalley,0,5
"Strathcon is great for wires, fuses and lots of connectors and other bits. For actual electronic modules I think online is the way",t2_69bdjhds,Gaiaecosia,0,1644256510.0,0,t1_hvyzgfn,hvyzgfn,True,Crocker-Speedway,t3_smuq0w,https://www.reddit.com/r/comoxvalley/comments/smuq0w/raspberry_pi_and_smart_mirrors/,Raspberry pi and smart mirrors,/r/comoxvalley/comments/smuq0w/raspberry_pi_and_smart_mirrors/hvyzgfn/,5,r/comoxvalley,0,5
"I loathe Amazon and try to avoid them if I can.  If nothing local, I’ll be ordering from this place.  https://www.rpelectronics.com",t2_2ztg5c3,Crocker-Speedway,0,1644255544.0,0,t1_hvywwrp,hvywwrp,False,Crocker-Speedway,t3_smuq0w,https://www.reddit.com/r/comoxvalley/comments/smuq0w/raspberry_pi_and_smart_mirrors/,Raspberry pi and smart mirrors,/r/comoxvalley/comments/smuq0w/raspberry_pi_and_smart_mirrors/hvywwrp/,10,r/comoxvalley,0,10
"Honestly best is Amazon around here, I heard best buy might have the π but not worth it to go. If I'm missing the place to go for electrical components I'd like to know also lmao",t2_4jp6d8r8,Pronto_Alpha,1,1644254608.0,0,t1_hvyug8g,hvyug8g,True,Crocker-Speedway,t3_smuq0w,https://www.reddit.com/r/comoxvalley/comments/smuq0w/raspberry_pi_and_smart_mirrors/,Raspberry pi and smart mirrors,/r/comoxvalley/comments/smuq0w/raspberry_pi_and_smart_mirrors/hvyug8g/,0,r/comoxvalley,0,0
"I heard a Mary browns is coming in, Popeyes or Lee's chicken would be better thou",t2_4jp6d8r8,Pronto_Alpha,0,1644254172.0,0,t1_hvytbwb,hvytbwb,False,ArmyDouche,t3_sjft9f,https://www.reddit.com/r/comoxvalley/comments/sjft9f/what_kind_of_business_do_you_think_would_thrive/,What kind of business do you think would thrive in the Valley/Mid Island?,/r/comoxvalley/comments/sjft9f/what_kind_of_business_do_you_think_would_thrive/hvytbwb/,3,r/comoxvalley,0,3
">I’m thinking a counter-protest is in order

Please don’t feed the trolls, just ignore them and they’ll eventually realize that nobody cares",t2_4gh4non6,galvanized_steelies,0,1644250961.0,0,t1_hvylc0f,hvylc0f,False,evade26,t3_sln8g9,https://www.reddit.com/r/comoxvalley/comments/sln8g9/jesus_christ_the_freedom_convoy_in_town_is_peak/,Jesus Christ the “Freedom convoy” in town is peak knuckle dragging cringe.,/r/comoxvalley/comments/sln8g9/jesus_christ_the_freedom_convoy_in_town_is_peak/hvylc0f/,3,r/comoxvalley,0,3
"This guy drywalls!


Thanks for a genuine laugh This morning.",t2_ajqt6,meagski,0,1644248860.0,0,t1_hvyg180,hvyg180,False,A_Sneaky_Walrus,t3_smhf12,https://www.reddit.com/r/comoxvalley/comments/smhf12/can_you_recommend_us_a_drywaller_please/,Can you recommend us a Drywaller please,/r/comoxvalley/comments/smhf12/can_you_recommend_us_a_drywaller_please/hvyg180/,3,r/comoxvalley,0,3
Specifics would help.  Are you looking for sweatpants wearing? What addiction? You’re not going to find a good drywaller without these things!,t2_35c9orv4,Hexxenya,0,1644247730.0,0,t1_hvyd80s,hvyd80s,True,A_Sneaky_Walrus,t3_smhf12,https://www.reddit.com/r/comoxvalley/comments/smhf12/can_you_recommend_us_a_drywaller_please/,Can you recommend us a Drywaller please,/r/comoxvalley/comments/smhf12/can_you_recommend_us_a_drywaller_please/hvyd80s/,6,r/comoxvalley,0,6
"I used Steven Brown from Avari development last year for my kitchen Reno. He was great at communicating. Did impeccable work and price was reasonable. Highly recommend him. 
Here’s his contact info.  Cheers
	250-650-5575 | Avaridevelopments@gmail.com",t2_4rywy125,longboatlarry,0,1644240323.0,0,t1_hvxwxi2,hvxwxi2,True,A_Sneaky_Walrus,t3_smhf12,https://www.reddit.com/r/comoxvalley/comments/smhf12/can_you_recommend_us_a_drywaller_please/,Can you recommend us a Drywaller please,/r/comoxvalley/comments/smhf12/can_you_recommend_us_a_drywaller_please/hvxwxi2/,2,r/comoxvalley,0,2
The struggle is real,t2_6cedw,psymunn,0,1644223932.0,0,t1_hvx9qvt,hvx9qvt,False,ArmyDouche,t3_sjft9f,https://www.reddit.com/r/comoxvalley/comments/sjft9f/what_kind_of_business_do_you_think_would_thrive/,What kind of business do you think would thrive in the Valley/Mid Island?,/r/comoxvalley/comments/sjft9f/what_kind_of_business_do_you_think_would_thrive/hvx9qvt/,1,r/comoxvalley,0,1
The roys town pub in Royston,t2_9t7ult0w,knifes_and_molasses,0,1644223049.0,0,t1_hvx8n5f,hvx8n5f,True,flyaway1775,t3_sj7cpp,https://www.reddit.com/r/comoxvalley/comments/sj7cpp/best_pizza_in_the_area/,Best pizza in the area?,/r/comoxvalley/comments/sj7cpp/best_pizza_in_the_area/hvx8n5f/,1,r/comoxvalley,0,1
">I think you missed my point. This isn't ""shitty American political influences"" at play. Yes, American politics influence Canada, no question there. But these demonstrations are occurring all over the world, and referencing American politics just because what's happening in Europe and the US is also happening here comes off as generic anti-Americanism. Hope you can consider this! Now I'll wait to get downvoted some more by my fellow Canadians who don't like it when we're called out for xenophobia...

Gotta say, I agree with you here, and I'm a dual citizen living in Comox. I see both sides of it, and hear the anti-Americanism among Canadians who don't realize I'm Canadian and American. It's everyhwere, and though it got much worse during/since Trump, it was bad even 10+ years ago. American politics do suck, and they do influence politics here, but the fact is that these demonstrations are literally occurring all over the world. No need to reference American politics in a discussion about demonstrations in Courtenay unless, well, your go-to response is to blame America for everything. Which we definitely tend to do here.",t2_6ppi6bce,pcg87,0,1644217104.0,0,t1_hvx0ily,hvx0ily,False,evade26,t3_sln8g9,https://www.reddit.com/r/comoxvalley/comments/sln8g9/jesus_christ_the_freedom_convoy_in_town_is_peak/,Jesus Christ the “Freedom convoy” in town is peak knuckle dragging cringe.,/r/comoxvalley/comments/sln8g9/jesus_christ_the_freedom_convoy_in_town_is_peak/hvx0ily/,5,r/comoxvalley,0,5
Matrix in Duncan will deliver and install in the Comox Valley. Their marble is all from their island quarries as well.,t2_aynv526b,larstheelephant2,0,1644215147.0,0,t1_hvwxjiw,hvwxjiw,False,Automatic-Security-7,t3_s7g1fs,https://www.reddit.com/r/comoxvalley/comments/s7g1fs/recommendations_for_granite_counters_in_the_comox/,Recommendations for granite counters in the Comox Valley.,/r/comoxvalley/comments/s7g1fs/recommendations_for_granite_counters_in_the_comox/hvwxjiw/,1,r/comoxvalley,0,1
">'m a Canadian in the US and my partner is American. None of the Americans I know here think it's anti-American to complain about shitty American political influences. This convoy thing definitely has ties to America, there's news articles mentioning that a lot of the money funding it came from American donors. You can check for yourself, sorry I don't have a link handy.  
>  
>Decent Americans know the complaints aren't about the

I think you missed my point. This isn't ""shitty American political influences"" at play. Yes, American politics influence Canada, no question there. But these demonstrations are occurring all over the world, and referencing American politics just because what's happening in Europe and the US is also happening here comes off as generic anti-Americanism. Hope you can consider this! Now I'll wait to get downvoted some more by my fellow Canadians who don't like it when we're called out for xenophobia...",t2_gmvu2igg,Apart-Fan-5658,0,1644214671.0,0,t1_hvwws54,hvwws54,False,evade26,t3_sln8g9,https://www.reddit.com/r/comoxvalley/comments/sln8g9/jesus_christ_the_freedom_convoy_in_town_is_peak/,Jesus Christ the “Freedom convoy” in town is peak knuckle dragging cringe.,/r/comoxvalley/comments/sln8g9/jesus_christ_the_freedom_convoy_in_town_is_peak/hvwws54/,0,r/comoxvalley,0,0
"I'm a Canadian in the US and my partner is American. None of the Americans I know here think it's anti-American to complain about shitty American political influences. This convoy thing definitely has ties to America, there's news articles mentioning that a lot of the money funding it came from American donors. You can check for yourself, sorry I don't have a link handy.

Decent Americans know the complaints aren't about them, and they're complaining about it too. Idk if you're American, but I hope you can consider this!",t2_ilcg0kdl,blankspace215,0,1644208513.0,0,t1_hvwlw6n,hvwlw6n,False,evade26,t3_sln8g9,https://www.reddit.com/r/comoxvalley/comments/sln8g9/jesus_christ_the_freedom_convoy_in_town_is_peak/,Jesus Christ the “Freedom convoy” in town is peak knuckle dragging cringe.,/r/comoxvalley/comments/sln8g9/jesus_christ_the_freedom_convoy_in_town_is_peak/hvwlw6n/,7,r/comoxvalley,0,7
"I've never been so glad to be away from home. What a mess. My condolences for all of you having to drive through that nonsense. The bridges are already tight spots for traffic without that.

Also, the people I know here who support the convoy or generally are anti-mandate etc, haven't had to actually change their habits at all. They just kept seeing friends and partying and going out and grocery shopping and driving around all over and going to stores like before. They're doing a lot of mental gymnastics to feel oppressed here.",t2_ilcg0kdl,blankspace215,0,1644207790.0,0,t1_hvwkhw7,hvwkhw7,True,evade26,t3_sln8g9,https://www.reddit.com/r/comoxvalley/comments/sln8g9/jesus_christ_the_freedom_convoy_in_town_is_peak/,Jesus Christ the “Freedom convoy” in town is peak knuckle dragging cringe.,/r/comoxvalley/comments/sln8g9/jesus_christ_the_freedom_convoy_in_town_is_peak/hvwkhw7/,9,r/comoxvalley,0,9
Good to know! Thanks!,t2_ophhnzi,iChriz23,0,1644202685.0,0,t1_hvw9w42,hvw9w42,False,iChriz23,t3_skv9i9,https://www.reddit.com/r/comoxvalley/comments/skv9i9/where_to_find_fruit_trees/,Where to find fruit trees?,/r/comoxvalley/comments/skv9i9/where_to_find_fruit_trees/hvw9w42/,2,r/comoxvalley,0,2
"Costco will start selling fruit trees soon! Such a great price....and if they die you can return them. (Trust me, I worked there.)",t2_hgxjaal3,Elegantly_never,0,1644201736.0,0,t1_hvw7uw7,hvw7uw7,False,iChriz23,t3_skv9i9,https://www.reddit.com/r/comoxvalley/comments/skv9i9/where_to_find_fruit_trees/,Where to find fruit trees?,/r/comoxvalley/comments/skv9i9/where_to_find_fruit_trees/hvw7uw7/,1,r/comoxvalley,0,1
Great little Cafe.,t2_spix4,LeakySkylight,0,1644194194.0,0,t1_hvvrjmi,hvvrjmi,False,ArmyDouche,t3_sjft9f,https://www.reddit.com/r/comoxvalley/comments/sjft9f/what_kind_of_business_do_you_think_would_thrive/,What kind of business do you think would thrive in the Valley/Mid Island?,/r/comoxvalley/comments/sjft9f/what_kind_of_business_do_you_think_would_thrive/hvvrjmi/,1,r/comoxvalley,0,1
Seconded,t2_spix4,LeakySkylight,0,1644194013.0,0,t1_hvvr594,hvvr594,False,ArmyDouche,t3_sjft9f,https://www.reddit.com/r/comoxvalley/comments/sjft9f/what_kind_of_business_do_you_think_would_thrive/,What kind of business do you think would thrive in the Valley/Mid Island?,/r/comoxvalley/comments/sjft9f/what_kind_of_business_do_you_think_would_thrive/hvvr594/,3,r/comoxvalley,0,3
