body,author_fullname,author.name,controversiality,created,downs,fullname,id,is_root,link_author,link_id,link_permalink,link_title,permalink,score,subreddit_name_prefixed,total_awards_received,ups
I took the plunge and applied to FBI. It's not Hamilton County specific but theor next event is in Fishers.,t2_ba0mzrlf,DesultoryBrewing,0,1648233375.0,0,t1_i23jitv,i23jitv,False,DesultoryBrewing,t3_tncsea,https://www.reddit.com/r/Fishers/comments/tncsea/fishershamilton_county_homebrew_clubs/,Fishers/Hamilton County homebrew clubs,/r/Fishers/comments/tncsea/fishershamilton_county_homebrew_clubs/i23jitv/,1,r/Fishers,0,1
"I am in SW Pendleton (essentially 1 country block from Fishers) and would be interested in meeting some homebrewers. I was really into the hobby until a few years ago when I moved here and didn't really have anyone to brew with.

Send me a PM if you like!",t2_4au7k,generalchaos316,0,1648233218.0,0,t1_i23j4gi,i23j4gi,True,DesultoryBrewing,t3_tncsea,https://www.reddit.com/r/Fishers/comments/tncsea/fishershamilton_county_homebrew_clubs/,Fishers/Hamilton County homebrew clubs,/r/Fishers/comments/tncsea/fishershamilton_county_homebrew_clubs/i23j4gi/,1,r/Fishers,0,1
"I moved to Fishers from Jersey City NJ, it took a while to get use to things. But after being here 20 years now I have to say I love it!",t2_l1s483s0,RAFSpitfire79,0,1648221559.0,0,t1_i22p6h8,i22p6h8,True,Acrobatic_Fruit143,t3_tibadv,https://www.reddit.com/r/Fishers/comments/tibadv/relocating_fishers_from_nyc/,Relocating Fishers from NYC!,/r/Fishers/comments/tibadv/relocating_fishers_from_nyc/i22p6h8/,1,r/Fishers,0,1
"I've used that list before. Unfortunately,  there's not a quick way of seeing which are still in operation. Both of the Fishers clubs seem to be defunct.",t2_ba0mzrlf,DesultoryBrewing,0,1648217194.0,0,t1_i22ehcr,i22ehcr,False,DesultoryBrewing,t3_tncsea,https://www.reddit.com/r/Fishers/comments/tncsea/fishershamilton_county_homebrew_clubs/,Fishers/Hamilton County homebrew clubs,/r/Fishers/comments/tncsea/fishershamilton_county_homebrew_clubs/i22ehcr/,1,r/Fishers,0,1
"I looked up clubs on the [AHA's website](https://www.homebrewersassociation.org/homebrew-clubs/find-a-homebrew-club/), and here's what I found. 

FISHERS, IN  
Sunblest Brewers Association  
Email  
Fermenters United  
(317) 596-0980 | Email

INDIANAPOLIS, IN  
Foam Blowers of Indiana, Inc (FBI)  
(317) 500-3699 | Email  
Midwestern Order of Nin-Kasi (M.O.N.K.)  
(317) 353-4323 | Email  
Circle City Zymurgy  
(317) 590-5944 | Email  
Indiana Brewers Union (IBU)  
Email",t2_dt9tk,Parkus65,0,1648215652.0,0,t1_i22aygp,i22aygp,True,DesultoryBrewing,t3_tncsea,https://www.reddit.com/r/Fishers/comments/tncsea/fishershamilton_county_homebrew_clubs/,Fishers/Hamilton County homebrew clubs,/r/Fishers/comments/tncsea/fishershamilton_county_homebrew_clubs/i22aygp/,1,r/Fishers,0,1
"I know Great Fermentations occasionally does events, but outside of that I haven't been able to find anything either.",t2_7acyvoa,3letterusername,0,1648205152.0,0,t1_i21sdoy,i21sdoy,True,DesultoryBrewing,t3_tncsea,https://www.reddit.com/r/Fishers/comments/tncsea/fishershamilton_county_homebrew_clubs/,Fishers/Hamilton County homebrew clubs,/r/Fishers/comments/tncsea/fishershamilton_county_homebrew_clubs/i21sdoy/,2,r/Fishers,0,2
"If I still lived in the area I'd join you. Been brewing for 10 years now. Nobody in Fishers had any idea on what that meant when I lived there. Now I'm in Chicago with lots of guilds and clubs all around. Put up a few posters at the local bars and such. Might find a few that will want to meet up and join. If you get something going, let me know. I'll join in on occasion when I visit friends and family.",t2_yhbjl,AndrewSS02,0,1648188645.0,0,t1_i218cgh,i218cgh,True,DesultoryBrewing,t3_tncsea,https://www.reddit.com/r/Fishers/comments/tncsea/fishershamilton_county_homebrew_clubs/,Fishers/Hamilton County homebrew clubs,/r/Fishers/comments/tncsea/fishershamilton_county_homebrew_clubs/i218cgh/,1,r/Fishers,0,1
"The Iron Pointe neighborhood doesn't exist yet. Other neighborhoods in the area are around 80% white. I would guess the Indian percentage is around 2-3%, but I'm not certain. There is enough of a community in the area to support a couple of Indian grocery stores within 5 miles and several Indian restaurants. In the typical Fishers neighborhood, you would probably be the only Indian family on your street, but it wouldn't be difficult to find other families in the area.",t2_cuey8,randommillenium,0,1647895034.0,0,t1_i1krn0k,i1krn0k,False,No_Resource_1988,t3_thr5mj,https://www.reddit.com/r/Fishers/comments/thr5mj/desi_indians_in_fishers/,Desi Indians in Fishers,/r/Fishers/comments/thr5mj/desi_indians_in_fishers/i1krn0k/,1,r/Fishers,0,1
"Thank You so very much u/randommillenium. This is super helpful. Since you live near that project site, can you please share some insights on diversity in that neighborhood(Esp. Indian community), if that's ok with you? 

Once again, Thank You for your response...!!!",t2_8jhkn4tp,No_Resource_1988,0,1647885522.0,0,t1_i1k3nzm,i1k3nzm,False,No_Resource_1988,t3_thr5mj,https://www.reddit.com/r/Fishers/comments/thr5mj/desi_indians_in_fishers/,Desi Indians in Fishers,/r/Fishers/comments/thr5mj/desi_indians_in_fishers/i1k3nzm/,0,r/Fishers,0,0
"One note about the Iron Pointe. I'm guessing it will be at least 6 months before the first home is ready. It's a brand new neighborhood and I don't think any homes have been started yet.   
Homes in that part of Fishers have been selling very quickly and I expect the lots to be snatched up fast once they are available. So if that's where you want to be, the plan would probably be to get on a waiting list and expect to rent for 6 months.   


Alternatives would be to look to slightly north to Noblesville, or to new construction to the east.  Noblesville has very good schools, but ranked slightly lower than the Fishers area. Slightly east puts you just a few miles farther from Indy with shopping, groceries, etc.. slightly farther away. The other option is to look for an existing home going up for sale in the area and snatch it up before it's sold. I think like a lot of areas, the market is very competitive right now.  


I live near Iron Pointe and like the area a lot. Great schools, friendly neighborhoods, convenient to shopping, food and entertainment. Hope to see you in Fishers soon!",t2_cuey8,randommillenium,0,1647881430.0,0,t1_i1jt6bh,i1jt6bh,True,No_Resource_1988,t3_thr5mj,https://www.reddit.com/r/Fishers/comments/thr5mj/desi_indians_in_fishers/,Desi Indians in Fishers,/r/Fishers/comments/thr5mj/desi_indians_in_fishers/i1jt6bh/,1,r/Fishers,0,1
"The taxes are definitely lower than what you were used to in Brooklyn but there’s still a state income tax, county income tax, and property taxes of course. You won’t pay property tax on your car here though & there’s zero toll roads in Indy. On average, we anticipate our taxes amounting to at least 10-15K less than we were paying on the east coast. That’s **definitely** not nothing but it’s not enough to make up for the wage gap either. It’s possible that if you added up all living costs it *could* make up for the gap, I’m not sure. But I know you’ll for sure have a hard time finding anyone to pay you here what you’re (presumably) making in NYC & if you do find someone who’ll do so, please reply to this thread & let us know too :P",t2_cbizt4uf,caitmacmaz,0,1647879039.0,0,t1_i1jmyzv,i1jmyzv,False,Acrobatic_Fruit143,t3_tibadv,https://www.reddit.com/r/Fishers/comments/tibadv/relocating_fishers_from_nyc/,Relocating Fishers from NYC!,/r/Fishers/comments/tibadv/relocating_fishers_from_nyc/i1jmyzv/,2,r/Fishers,0,2
Thanks for the recommendations! I guess a little bit of both. Mostly want to know upcoming tech sectors or businesses. Trying to understand how friendly the place is to software engineers and tech overall and see how I can see myself grow/transition as I live here.,t2_7tdgnojv,Acrobatic_Fruit143,0,1647877424.0,0,t1_i1jivix,i1jivix,False,Acrobatic_Fruit143,t3_tibadv,https://www.reddit.com/r/Fishers/comments/tibadv/relocating_fishers_from_nyc/,Relocating Fishers from NYC!,/r/Fishers/comments/tibadv/relocating_fishers_from_nyc/i1jivix/,1,r/Fishers,0,1
Good to know. Thanks.,t2_7tdgnojv,Acrobatic_Fruit143,0,1647877223.0,0,t1_i1jidl1,i1jidl1,False,Acrobatic_Fruit143,t3_tibadv,https://www.reddit.com/r/Fishers/comments/tibadv/relocating_fishers_from_nyc/,Relocating Fishers from NYC!,/r/Fishers/comments/tibadv/relocating_fishers_from_nyc/i1jidl1/,1,r/Fishers,0,1
Hello! Thanks for the detailed reply. Yes I'd be keeping my job working remotely for awhile. What are your thoughts on taxes? I would assume even with slightly less pay because of lower taxes after tax pay would even out but I am curious to know how it actually is.,t2_7tdgnojv,Acrobatic_Fruit143,0,1647877192.0,0,t1_i1jiavz,i1jiavz,False,Acrobatic_Fruit143,t3_tibadv,https://www.reddit.com/r/Fishers/comments/tibadv/relocating_fishers_from_nyc/,Relocating Fishers from NYC!,/r/Fishers/comments/tibadv/relocating_fishers_from_nyc/i1jiavz/,2,r/Fishers,0,2
Thank You u/dachshunddo,t2_8jhkn4tp,No_Resource_1988,0,1647845526.0,0,t1_i1i3r5m,i1i3r5m,False,No_Resource_1988,t3_thr5mj,https://www.reddit.com/r/Fishers/comments/thr5mj/desi_indians_in_fishers/,Desi Indians in Fishers,/r/Fishers/comments/thr5mj/desi_indians_in_fishers/i1i3r5m/,1,r/Fishers,0,1
Thank You u/ivegotitalmost,t2_8jhkn4tp,No_Resource_1988,0,1647845510.0,0,t1_i1i3qfq,i1i3qfq,False,No_Resource_1988,t3_thr5mj,https://www.reddit.com/r/Fishers/comments/thr5mj/desi_indians_in_fishers/,Desi Indians in Fishers,/r/Fishers/comments/thr5mj/desi_indians_in_fishers/i1i3qfq/,1,r/Fishers,0,1
"It depends on the company, I moved from Chicago and kept my salary, even got a promotion.",t2_8etye,excalibrax,0,1647826938.0,0,t1_i1h8ycn,i1h8ycn,False,Acrobatic_Fruit143,t3_tibadv,https://www.reddit.com/r/Fishers/comments/tibadv/relocating_fishers_from_nyc/,Relocating Fishers from NYC!,/r/Fishers/comments/tibadv/relocating_fishers_from_nyc/i1h8ycn/,1,r/Fishers,0,1
"Are you looking for a job, or just people to hang with, I know there are plenty of tech companies around.   


If you are interested in Linux there is a Linux Users Group.  
[https://www.meetup.com/CINLUG/](https://www.meetup.com/CINLUG/)

  


If your geeky for fun is [Doughnuts and Dragons](https://www.google.com/search?client=firefox-b-1-d&q=doughnuts+and+dragons) a board game cafe.   


and theres a good group for Boardgames 

[https://www.meetup.com/Indianapolis-Board-Games/](https://www.meetup.com/Indianapolis-Board-Games/)",t2_8etye,excalibrax,0,1647826875.0,0,t1_i1h8tlb,i1h8tlb,True,Acrobatic_Fruit143,t3_tibadv,https://www.reddit.com/r/Fishers/comments/tibadv/relocating_fishers_from_nyc/,Relocating Fishers from NYC!,/r/Fishers/comments/tibadv/relocating_fishers_from_nyc/i1h8tlb/,1,r/Fishers,0,1
"I generally agree but Salesforce has offices throughout the USA and they pay their Indy employees the lowest of all (by a LOT). This is not non-profit work, no one should take a 30% pay cut if they don’t have to—we have no loyalty to Salesforce & they have none to us. Pay should be commiserate with skill & not dependent on where you lay your head at night. As work has become more remote over the years, more companies are going to have to pay better if they want to keep talented folks staffed. This is a good thing for employees & for cities that have, traditionally, been unable to attract newcomers due to low wages (like Indianapolis).",t2_cbizt4uf,caitmacmaz,0,1647814896.0,0,t1_i1gixgv,i1gixgv,False,Acrobatic_Fruit143,t3_tibadv,https://www.reddit.com/r/Fishers/comments/tibadv/relocating_fishers_from_nyc/,Relocating Fishers from NYC!,/r/Fishers/comments/tibadv/relocating_fishers_from_nyc/i1gixgv/,0,r/Fishers,0,0
"While I agree that remote is best, it’s less common to be paid NY salaries in Indy. Companies usually pay according to geographic location or everyone would want to work only for Cali companies. Salesforce pays according to geo location of employee’s residence.",t2_1k1mkr4,bkabab,0,1647808966.0,0,t1_i1g4xo3,i1g4xo3,False,Acrobatic_Fruit143,t3_tibadv,https://www.reddit.com/r/Fishers/comments/tibadv/relocating_fishers_from_nyc/,Relocating Fishers from NYC!,/r/Fishers/comments/tibadv/relocating_fishers_from_nyc/i1g4xo3/,3,r/Fishers,0,3
it actually do be ruining fishers tho i’ve lived here all my life and this place has been gentrified all to shit,t2_35ic1df1,evenlyroasted,0,1647808046.0,0,t1_i1g2qpw,i1g2qpw,False,LAPG3,t3_scknjz,https://www.reddit.com/r/Fishers/comments/scknjz/can_some_locals_chime_in/,Can some locals chime in?,/r/Fishers/comments/scknjz/can_some_locals_chime_in/i1g2qpw/,1,r/Fishers,0,1
i used to live on 96th and allisonville; it wasn’t so bad smell-wise but our sinkwater smelled ATROCIOUS,t2_35ic1df1,evenlyroasted,0,1647807980.0,0,t1_i1g2l6s,i1g2l6s,False,ironmonkey78,t3_szridd,https://www.reddit.com/r/Fishers/comments/szridd/96th_and_allisonville_development_approved/,96th and Allisonville development approved.,/r/Fishers/comments/szridd/96th_and_allisonville_development_approved/i1g2l6s/,1,r/Fishers,0,1
You’re better off living in Marion county.  It will resemble more what you’re looking fours,t2_apm8086n,Doug_Muler42497,0,1647799010.0,0,t1_i1fhioc,i1fhioc,True,Acrobatic_Fruit143,t3_tibadv,https://www.reddit.com/r/Fishers/comments/tibadv/relocating_fishers_from_nyc/,Relocating Fishers from NYC!,/r/Fishers/comments/tibadv/relocating_fishers_from_nyc/i1fhioc/,-5,r/Fishers,0,-5
There are a number of insurance companies in Indy that all need developers. You can also look for consulting companies like Fusion Alliance that contract you out to other companies and pay benefits and all that.,t2_4aywp,Victory33,0,1647784674.0,0,t1_i1ejgjq,i1ejgjq,True,Acrobatic_Fruit143,t3_tibadv,https://www.reddit.com/r/Fishers/comments/tibadv/relocating_fishers_from_nyc/,Relocating Fishers from NYC!,/r/Fishers/comments/tibadv/relocating_fishers_from_nyc/i1ejgjq/,1,r/Fishers,0,1
"Welcome! Honestly - keep your NYC job & have them let you go remote if possible. We moved here last Fall from the tri-state also (Stamford, CT but both my husband & I worked in NYC for a while), husband is a software architect & his company let him go permanently remote once covid hit (which is how we were able to leave). He looked around here for a bit but nothing even comes close to his east coast salary. Salesforce is the largest tech employer here & their highest salary range for his skillset is $50K less than he makes & would require a lot more responsibilities than he currently has. The cost of living is low here but there’s a reason for it - wages are also **low**. Go remote & if you miss seeing people on the daily then there are several cool co-working spaces to join. We are loving it here so far - DM me if you have any other newbie questions, happy to help!",t2_cbizt4uf,caitmacmaz,1,1647761713.0,0,t1_i1do647,i1do647,True,Acrobatic_Fruit143,t3_tibadv,https://www.reddit.com/r/Fishers/comments/tibadv/relocating_fishers_from_nyc/,Relocating Fishers from NYC!,/r/Fishers/comments/tibadv/relocating_fishers_from_nyc/i1do647/,1,r/Fishers,0,1
Do your parents belong to the Purdue FB group for you graduating class?  I would guess you would get more traction there if they post something for you.,t2_m98hdi4,climber_pilot,0,1647758828.0,0,t1_i1dkr9c,i1dkr9c,True,AsideConsistent3792,t3_tia5zr,https://www.reddit.com/r/Fishers/comments/tia5zr/looking_for_a_place_to_rent_during_the_summer/,Looking for a place to rent during the summer.,/r/Fishers/comments/tia5zr/looking_for_a_place_to_rent_during_the_summer/i1dkr9c/,2,r/Fishers,0,2
Salesforce,t2_k24m5936,Jayswilly2016,0,1647757242.0,0,t1_i1disar,i1disar,True,Acrobatic_Fruit143,t3_tibadv,https://www.reddit.com/r/Fishers/comments/tibadv/relocating_fishers_from_nyc/,Relocating Fishers from NYC!,/r/Fishers/comments/tibadv/relocating_fishers_from_nyc/i1disar/,7,r/Fishers,0,7
"I feel especially qualified to pipe in on this as we just moved here (we’re off Geist, not in a McMansion but it’s a well-built, older large home) from the east coast (CT/NYC area) after basically a two year long multi state search. Yes, home prices have gone up everywhere - my hometown of Austin sees a 15-30% increase each year. The home I sold there for $350K in 2016 is now valued at over $700K. It’s less than 1000 sqft, needs a lot of work, and not even in a great area. When it sells again, it’ll be knocked down & 4 homes will be built in its place. In comparison, we purchased our home here for under $700K, it’s a MUCH better home in every single way possible. In our search, we looked into Chicagoland, Colorado, Portland, Seattle, & moving back to Texas. Everywhere was more expensive than here (some by multitudes) & each came with their own set of unique problems which, at times, felt like major dealbreakers. Of course there is a trade off in everything; Indiana is arguably the least beautiful state we looked at (although I do believe there is a lot of beauty to be found here), and the job market here was the weakest (we both work remotely though so that didn’t matter). We have some family here but also have family/friends spread out amongst the other areas as well. Ultimately, it came down to friendliness (I love humble, kind midwestern folks), cost of living, flexibility/ease of travel, and I believe the Indianapolis area is a solid long-term investment due to climate change issues. There are definitely times I miss living in a bluer part of the country but having lived in both a staunchly red state (TX) & a firmly blue state (CT) I much more prefer a middle ground with varying opinions & backgrounds. Indianapolis is a very practical choice - I highly doubt anyone grows up dreaming to move here some day (I hated visiting family here as a kid), but the city has done a lot to improve its position & invest in arts & lifestyle. Not discouraging you from looking elsewhere, no one should ever feel stuck living somewhere they no longer find joy in. Just hoping to share how our experience led us here if it helps at all.",t2_cbizt4uf,caitmacmaz,0,1647753622.0,0,t1_i1ddxfo,i1ddxfo,True,Competitive-Fucker,t3_thosy4,https://www.reddit.com/r/Fishers/comments/thosy4/housing_prices_are_up_3040_over_the_past_3_years/,"Housing prices are up 30-40% over the past 3 years, One-bedrooms are $1300 minimum",/r/Fishers/comments/thosy4/housing_prices_are_up_3040_over_the_past_3_years/i1ddxfo/,1,r/Fishers,0,1
http://www.indyhackers.org/ is a good place to look.  The slack is pretty active depending non the channel.  A lot of rubyists for sure.,t2_6mzxc,xagut,0,1647750863.0,0,t1_i1d9p45,i1d9p45,True,Acrobatic_Fruit143,t3_tibadv,https://www.reddit.com/r/Fishers/comments/tibadv/relocating_fishers_from_nyc/,Relocating Fishers from NYC!,/r/Fishers/comments/tibadv/relocating_fishers_from_nyc/i1d9p45/,1,r/Fishers,0,1
There are few good companies here. salesforce n few,t2_o930u,sivatronics,1,1647747087.0,0,t1_i1d38an,i1d38an,True,Acrobatic_Fruit143,t3_tibadv,https://www.reddit.com/r/Fishers/comments/tibadv/relocating_fishers_from_nyc/,Relocating Fishers from NYC!,/r/Fishers/comments/tibadv/relocating_fishers_from_nyc/i1d38an/,2,r/Fishers,0,2
"Welcome to fishers. I wouldn't say reddit is the place to find your rental of a single bedroom, or as you said, for someone to approach you. Younger families on here won't have rooms, and older families that do aren't on here. Join fishers chatter on FB, ask there for a possible lead. GL.",t2_2ug8k3s0,robboo66,0,1647745828.0,0,t1_i1d0xvl,i1d0xvl,True,AsideConsistent3792,t3_tia5zr,https://www.reddit.com/r/Fishers/comments/tia5zr/looking_for_a_place_to_rent_during_the_summer/,Looking for a place to rent during the summer.,/r/Fishers/comments/tia5zr/looking_for_a_place_to_rent_during_the_summer/i1d0xvl/,2,r/Fishers,0,2
You can message me and I’ll try my best to answer questions.,t2_bqx0qhy,dachshunddo,0,1647735746.0,0,t1_i1ch89s,i1ch89s,False,No_Resource_1988,t3_thr5mj,https://www.reddit.com/r/Fishers/comments/thr5mj/desi_indians_in_fishers/,Desi Indians in Fishers,/r/Fishers/comments/thr5mj/desi_indians_in_fishers/i1ch89s/,1,r/Fishers,0,1
No no . It was a gal who oddly looked just like nicolle Wallace from MSNBC .,t2_eugcug5,WishIWasYounger,0,1647732681.0,0,t1_i1cax0q,i1cax0q,False,Competitive-Fucker,t3_thosy4,https://www.reddit.com/r/Fishers/comments/thosy4/housing_prices_are_up_3040_over_the_past_3_years/,"Housing prices are up 30-40% over the past 3 years, One-bedrooms are $1300 minimum",/r/Fishers/comments/thosy4/housing_prices_are_up_3040_over_the_past_3_years/i1cax0q/,2,r/Fishers,0,2
Welcome to fishers!,t2_54jrli8k,ivegotitalmost,0,1647730543.0,0,t1_i1c6cs7,i1c6cs7,True,No_Resource_1988,t3_thr5mj,https://www.reddit.com/r/Fishers/comments/thr5mj/desi_indians_in_fishers/,Desi Indians in Fishers,/r/Fishers/comments/thr5mj/desi_indians_in_fishers/i1c6cs7/,1,r/Fishers,0,1
"I would be happy to chat, but I am not actually desi. I work for a local school and we collect data on the languages students speak at home in the county.",t2_czuyle9h,CalledStretch,0,1647719784.0,0,t1_i1bhu29,i1bhu29,False,No_Resource_1988,t3_thr5mj,https://www.reddit.com/r/Fishers/comments/thr5mj/desi_indians_in_fishers/,Desi Indians in Fishers,/r/Fishers/comments/thr5mj/desi_indians_in_fishers/i1bhu29/,1,r/Fishers,0,1
Thank You Very Much u/Individual_Section_6,t2_8jhkn4tp,No_Resource_1988,0,1647717072.0,0,t1_i1bbok7,i1bbok7,False,No_Resource_1988,t3_thr5mj,https://www.reddit.com/r/Fishers/comments/thr5mj/desi_indians_in_fishers/,Desi Indians in Fishers,/r/Fishers/comments/thr5mj/desi_indians_in_fishers/i1bbok7/,1,r/Fishers,0,1
Thank You u/dachshunddo. I'll join that group. If you don't have any issues is there is any way we can connect with you.,t2_8jhkn4tp,No_Resource_1988,0,1647716677.0,0,t1_i1baqwb,i1baqwb,False,No_Resource_1988,t3_thr5mj,https://www.reddit.com/r/Fishers/comments/thr5mj/desi_indians_in_fishers/,Desi Indians in Fishers,/r/Fishers/comments/thr5mj/desi_indians_in_fishers/i1baqwb/,1,r/Fishers,0,1
“Fishers chatter”,t2_3xgm1qc1,Individual_Section_6,0,1647716628.0,0,t1_i1bamgu,i1bamgu,False,No_Resource_1988,t3_thr5mj,https://www.reddit.com/r/Fishers/comments/thr5mj/desi_indians_in_fishers/,Desi Indians in Fishers,/r/Fishers/comments/thr5mj/desi_indians_in_fishers/i1bamgu/,1,r/Fishers,0,1
Thank You u/Individual_Section_6 for your response. Can you please share the name of the group?,t2_8jhkn4tp,No_Resource_1988,0,1647716094.0,0,t1_i1b9d9l,i1b9d9l,False,No_Resource_1988,t3_thr5mj,https://www.reddit.com/r/Fishers/comments/thr5mj/desi_indians_in_fishers/,Desi Indians in Fishers,/r/Fishers/comments/thr5mj/desi_indians_in_fishers/i1b9d9l/,1,r/Fishers,0,1
Thank You u/boilers11lp for your response.,t2_8jhkn4tp,No_Resource_1988,0,1647716059.0,0,t1_i1b9aae,i1b9aae,False,No_Resource_1988,t3_thr5mj,https://www.reddit.com/r/Fishers/comments/thr5mj/desi_indians_in_fishers/,Desi Indians in Fishers,/r/Fishers/comments/thr5mj/desi_indians_in_fishers/i1b9aae/,1,r/Fishers,0,1
"Thank You u/CalledStretch for your response. Is there any way I can connect with you? We are from Delhi,  India.",t2_8jhkn4tp,No_Resource_1988,0,1647716036.0,0,t1_i1b98ft,i1b98ft,False,No_Resource_1988,t3_thr5mj,https://www.reddit.com/r/Fishers/comments/thr5mj/desi_indians_in_fishers/,Desi Indians in Fishers,/r/Fishers/comments/thr5mj/desi_indians_in_fishers/i1b98ft/,1,r/Fishers,0,1
Thank You u/thesupermikey for your response.,t2_8jhkn4tp,No_Resource_1988,0,1647715842.0,0,t1_i1b8rsk,i1b8rsk,False,No_Resource_1988,t3_thr5mj,https://www.reddit.com/r/Fishers/comments/thr5mj/desi_indians_in_fishers/,Desi Indians in Fishers,/r/Fishers/comments/thr5mj/desi_indians_in_fishers/i1b8rsk/,2,r/Fishers,0,2
"Thank You u/bkabab. If you don't have any issues, can you please share the community name?",t2_8jhkn4tp,No_Resource_1988,0,1647715806.0,0,t1_i1b8oml,i1b8oml,False,No_Resource_1988,t3_thr5mj,https://www.reddit.com/r/Fishers/comments/thr5mj/desi_indians_in_fishers/,Desi Indians in Fishers,/r/Fishers/comments/thr5mj/desi_indians_in_fishers/i1b8oml/,1,r/Fishers,0,1
Thank You u/CalledStretch for your response.,t2_8jhkn4tp,No_Resource_1988,0,1647715738.0,0,t1_i1b8iw1,i1b8iw1,False,No_Resource_1988,t3_thr5mj,https://www.reddit.com/r/Fishers/comments/thr5mj/desi_indians_in_fishers/,Desi Indians in Fishers,/r/Fishers/comments/thr5mj/desi_indians_in_fishers/i1b8iw1/,1,r/Fishers,0,1
Thank You u/AndrewSS02 for your response.,t2_8jhkn4tp,No_Resource_1988,0,1647715703.0,0,t1_i1b8fvd,i1b8fvd,False,No_Resource_1988,t3_thr5mj,https://www.reddit.com/r/Fishers/comments/thr5mj/desi_indians_in_fishers/,Desi Indians in Fishers,/r/Fishers/comments/thr5mj/desi_indians_in_fishers/i1b8fvd/,1,r/Fishers,0,1
"Thank You u/Beautiful_Ordinary40 for your response. If you don't have any issues, Can you please share the neighborhood name?",t2_8jhkn4tp,No_Resource_1988,0,1647715682.0,0,t1_i1b8e3g,i1b8e3g,False,No_Resource_1988,t3_thr5mj,https://www.reddit.com/r/Fishers/comments/thr5mj/desi_indians_in_fishers/,Desi Indians in Fishers,/r/Fishers/comments/thr5mj/desi_indians_in_fishers/i1b8e3g/,1,r/Fishers,0,1
Was it a staff member at Murphys?,t2_cfpm632h,QuestionNo9276,0,1647715593.0,0,t1_i1b86rt,i1b86rt,False,Competitive-Fucker,t3_thosy4,https://www.reddit.com/r/Fishers/comments/thosy4/housing_prices_are_up_3040_over_the_past_3_years/,"Housing prices are up 30-40% over the past 3 years, One-bedrooms are $1300 minimum",/r/Fishers/comments/thosy4/housing_prices_are_up_3040_over_the_past_3_years/i1b86rt/,2,r/Fishers,0,2
