body,author_fullname,author.name,controversiality,created,downs,fullname,id,is_root,link_author,link_id,link_permalink,link_title,permalink,score,subreddit_name_prefixed,total_awards_received,ups
"I own a lot of stock in this company , so I had to participate …",t2_eugcug5,WishIWasYounger,0,1643441979.0,0,t1_hup1gkv,hup1gkv,True,Malonhol000,t3_sf0rwh,https://www.reddit.com/r/Fishers/comments/sf0rwh/hi_i_am_a_senior_at_hamilton_southeastern_high/,Hi! I am a senior at hamilton southeastern high school and I would appreciate if you would take a quick survey for me for my AP research class project. Your response and identity will be anonymous. The first question is a letter of intent about my project and the terms of the project. Thank you!,/r/Fishers/comments/sf0rwh/hi_i_am_a_senior_at_hamilton_southeastern_high/hup1gkv/,1,r/Fishers,0,1
I would have helped but the fine print says I have to live in Hamilton County.  I live near Hamilton County.,t2_61dmr,MonyMony,0,1643433075.0,0,t1_huonrju,huonrju,True,Malonhol000,t3_sf0rwh,https://www.reddit.com/r/Fishers/comments/sf0rwh/hi_i_am_a_senior_at_hamilton_southeastern_high/,Hi! I am a senior at hamilton southeastern high school and I would appreciate if you would take a quick survey for me for my AP research class project. Your response and identity will be anonymous. The first question is a letter of intent about my project and the terms of the project. Thank you!,/r/Fishers/comments/sf0rwh/hi_i_am_a_senior_at_hamilton_southeastern_high/huonrju/,1,r/Fishers,0,1
It's fun to see that they offer a research methods course to you all now! (I really liked Mrs. Carson in HS too; it's fun to see that she's teaching this!),t2_ozx4l,bmswg,0,1643417308.0,0,t1_hunquja,hunquja,True,Malonhol000,t3_sf0rwh,https://www.reddit.com/r/Fishers/comments/sf0rwh/hi_i_am_a_senior_at_hamilton_southeastern_high/,Hi! I am a senior at hamilton southeastern high school and I would appreciate if you would take a quick survey for me for my AP research class project. Your response and identity will be anonymous. The first question is a letter of intent about my project and the terms of the project. Thank you!,/r/Fishers/comments/sf0rwh/hi_i_am_a_senior_at_hamilton_southeastern_high/hunquja/,2,r/Fishers,0,2
"Got you, but my brain wasn’t prepared for all of those big words at the end of a Friday…haha",t2_4hjvj,mysoulishome,0,1643415093.0,0,t1_hunlurh,hunlurh,True,Malonhol000,t3_sf0rwh,https://www.reddit.com/r/Fishers/comments/sf0rwh/hi_i_am_a_senior_at_hamilton_southeastern_high/,Hi! I am a senior at hamilton southeastern high school and I would appreciate if you would take a quick survey for me for my AP research class project. Your response and identity will be anonymous. The first question is a letter of intent about my project and the terms of the project. Thank you!,/r/Fishers/comments/sf0rwh/hi_i_am_a_senior_at_hamilton_southeastern_high/hunlurh/,3,r/Fishers,0,3
Barkefellers has been wonderful with my pets.,t2_8h7uy,offleashgirl,0,1643315365.0,0,t1_huhjqby,huhjqby,True,Kangaroo-,t3_sdlrez,https://www.reddit.com/r/Fishers/comments/sdlrez/what_are_some_good_doggie_daycares_around_here/,What are some good doggie daycares around here?,/r/Fishers/comments/sdlrez/what_are_some_good_doggie_daycares_around_here/huhjqby/,1,r/Fishers,0,1
"One of the nicest places to live in Central Indiana.  Low crime, excellent schools, and friendly people.  I’ve had opportunities to live elsewhere, but I still call Fishers home because of this.",t2_rxw4z,IndyScan,0,1643307342.0,0,t1_hugxn6e,hugxn6e,True,LAPG3,t3_scknjz,https://www.reddit.com/r/Fishers/comments/scknjz/can_some_locals_chime_in/,Can some locals chime in?,/r/Fishers/comments/scknjz/can_some_locals_chime_in/hugxn6e/,1,r/Fishers,0,1
More interesting than most posts in this sub…,t2_rxw4z,IndyScan,0,1643307090.0,0,t1_hugwxtg,hugwxtg,True,cheesecakedecona,t3_sdrso0,https://www.reddit.com/r/Fishers/comments/sdrso0/fisheries_in_mediterranean_algeriatunisia/,Fisheries in Mediterranean - Algeria&Tunisia,/r/Fishers/comments/sdrso0/fisheries_in_mediterranean_algeriatunisia/hugwxtg/,0,r/Fishers,0,0
Meijer was giving out 3 free per person. I stopped in and Tuesday and got some. Not sure of their stock now though.,t2_2ax3fx2h,rollybingo,0,1643304468.0,0,t1_hugpitv,hugpitv,True,legendofcaro,t3_sdyzle,https://www.reddit.com/r/Fishers/comments/sdyzle/does_anyone_know_where_i_can_buy_kn95_masks_in/,Does anyone know where I can buy KN-95 masks in person?,/r/Fishers/comments/sdyzle/does_anyone_know_where_i_can_buy_kn95_masks_in/hugpitv/,2,r/Fishers,0,2
"You may find some on an end cap at Menards in the paint section towards back of store. Not in the same section where all the masks and coveralls are, so sometimes they go unnoticed back there.",t2_16ggt1,AchEn35,0,1643300383.0,0,t1_huge4k0,huge4k0,True,legendofcaro,t3_sdyzle,https://www.reddit.com/r/Fishers/comments/sdyzle/does_anyone_know_where_i_can_buy_kn95_masks_in/,Does anyone know where I can buy KN-95 masks in person?,/r/Fishers/comments/sdyzle/does_anyone_know_where_i_can_buy_kn95_masks_in/huge4k0/,2,r/Fishers,0,2
4 Paws Lodge just past Fishers High School.,t2_ix65xctq,lrose40,0,1643299280.0,0,t1_hugb6le,hugb6le,True,Kangaroo-,t3_sdlrez,https://www.reddit.com/r/Fishers/comments/sdlrez/what_are_some_good_doggie_daycares_around_here/,What are some good doggie daycares around here?,/r/Fishers/comments/sdlrez/what_are_some_good_doggie_daycares_around_here/hugb6le/,2,r/Fishers,0,2
"Ace had some last time I was in there, over by the dust masks and other stuff. They were 3m n-95.",t2_3j09rmtx,pnutjam,0,1643298251.0,0,t1_hug8fqy,hug8fqy,True,legendofcaro,t3_sdyzle,https://www.reddit.com/r/Fishers/comments/sdyzle/does_anyone_know_where_i_can_buy_kn95_masks_in/,Does anyone know where I can buy KN-95 masks in person?,/r/Fishers/comments/sdyzle/does_anyone_know_where_i_can_buy_kn95_masks_in/hug8fqy/,1,r/Fishers,0,1
No I ordered them online. Sorry! The New York Times has a recommended website with legitimate ones if you get desperate. That’s the one I ended up using,t2_c8ckv,Murmokos,0,1643294183.0,0,t1_hufy6ky,hufy6ky,True,legendofcaro,t3_sdyzle,https://www.reddit.com/r/Fishers/comments/sdyzle/does_anyone_know_where_i_can_buy_kn95_masks_in/,Does anyone know where I can buy KN-95 masks in person?,/r/Fishers/comments/sdyzle/does_anyone_know_where_i_can_buy_kn95_masks_in/hufy6ky/,3,r/Fishers,0,3
"Sir, this is a city.",t2_fdocqofs,objective-steve,0,1643283031.0,0,t1_hufd4of,hufd4of,True,cheesecakedecona,t3_sdrso0,https://www.reddit.com/r/Fishers/comments/sdrso0/fisheries_in_mediterranean_algeriatunisia/,Fisheries in Mediterranean - Algeria&Tunisia,/r/Fishers/comments/sdrso0/fisheries_in_mediterranean_algeriatunisia/hufd4of/,6,r/Fishers,0,6
Bruh,t2_9pfijl4a,Tigguswolly,0,1643265140.0,0,t1_huepeoy,huepeoy,True,cheesecakedecona,t3_sdrso0,https://www.reddit.com/r/Fishers/comments/sdrso0/fisheries_in_mediterranean_algeriatunisia/,Fisheries in Mediterranean - Algeria&Tunisia,/r/Fishers/comments/sdrso0/fisheries_in_mediterranean_algeriatunisia/huepeoy/,12,r/Fishers,0,12
Grand Canine :),t2_5hczyi2n,bella-ay-ay,0,1643260289.0,0,t1_hueh1gs,hueh1gs,True,Kangaroo-,t3_sdlrez,https://www.reddit.com/r/Fishers/comments/sdlrez/what_are_some_good_doggie_daycares_around_here/,What are some good doggie daycares around here?,/r/Fishers/comments/sdlrez/what_are_some_good_doggie_daycares_around_here/hueh1gs/,1,r/Fishers,0,1
Beverly's .,t2_tmqgt5x,scary-murphy,0,1643259055.0,0,t1_hueenhi,hueenhi,True,Kangaroo-,t3_sdlrez,https://www.reddit.com/r/Fishers/comments/sdlrez/what_are_some_good_doggie_daycares_around_here/,What are some good doggie daycares around here?,/r/Fishers/comments/sdlrez/what_are_some_good_doggie_daycares_around_here/hueenhi/,2,r/Fishers,0,2
I LOVE Lucky Dog Retreat off Binford. They have webcams so you can watch your dog while they are there which is comforting!,t2_7fx18f4y,justalotoffeelings,0,1643251429.0,0,t1_hudy06n,hudy06n,True,Kangaroo-,t3_sdlrez,https://www.reddit.com/r/Fishers/comments/sdlrez/what_are_some_good_doggie_daycares_around_here/,What are some good doggie daycares around here?,/r/Fishers/comments/sdlrez/what_are_some_good_doggie_daycares_around_here/hudy06n/,2,r/Fishers,0,2
"We take our dogs to Bev’s and are very happy. BUT like everywhere right now, they are having sporadic staffing problems so sometimes have to limit numbers. We’ve taken our dogs there for years. Love the dog park there too.",t2_c8ckv,Murmokos,0,1643247225.0,0,t1_hudnw93,hudnw93,True,Kangaroo-,t3_sdlrez,https://www.reddit.com/r/Fishers/comments/sdlrez/what_are_some_good_doggie_daycares_around_here/,What are some good doggie daycares around here?,/r/Fishers/comments/sdlrez/what_are_some_good_doggie_daycares_around_here/hudnw93/,5,r/Fishers,0,5
"OP, please ignore this person. There is a diversity of belief in Fishers, and if you have children, the local schools are fantastic and educating the kids well. I've found the people to be friendly regardless of political alignment. My family moved here in 2015 from Las Vegas and we love it here. As others have mentioned, great parks, lots of local activities, plenty of good restaurants and shopping, and friendly people.",t2_tmqgt5x,scary-murphy,0,1643217724.0,0,t1_hubh09x,hubh09x,False,LAPG3,t3_scknjz,https://www.reddit.com/r/Fishers/comments/scknjz/can_some_locals_chime_in/,Can some locals chime in?,/r/Fishers/comments/scknjz/can_some_locals_chime_in/hubh09x/,5,r/Fishers,0,5
If you are a crazy Liberal.  You won't fit in at all.  Please stay in Oregon,t2_gubu9pxx,CorvetteWorld,1,1643216384.0,0,t1_hubd7mf,hubd7mf,True,LAPG3,t3_scknjz,https://www.reddit.com/r/Fishers/comments/scknjz/can_some_locals_chime_in/,Can some locals chime in?,/r/Fishers/comments/scknjz/can_some_locals_chime_in/hubd7mf/,-1,r/Fishers,0,-1
"Just tell the boss you have *REALLY BAD DIARRHEA.*

You’ll get a pass immediately.",t2_6bvua,Melankewlia,0,1643211596.0,0,t1_hub02nm,hub02nm,True,[deleted],t3_sd75ss,https://www.reddit.com/r/Fishers/comments/sd75ss/positive_covid_test_result_pic/,Positive covid test result pic,/r/Fishers/comments/sd75ss/positive_covid_test_result_pic/hub02nm/,1,r/Fishers,0,1
"Kind of. Felt sick and took an at-home test which provided me a positive result. Ended up taking a few days off work as a precaution until I felt better. After I got back to the office, HR calls me and tells me they don't care and need a positive test from a testing site. I go and get tested and now it's negative because - obviously, I don't have it anymore. HR could not care less about the logic or the humanity behind it.",t2_ekjrs,TheHapster,0,1643210566.0,0,t1_huaxdtc,huaxdtc,False,[deleted],t3_sd75ss,https://www.reddit.com/r/Fishers/comments/sd75ss/positive_covid_test_result_pic/,Positive covid test result pic,/r/Fishers/comments/sd75ss/positive_covid_test_result_pic/huaxdtc/,2,r/Fishers,0,2
Mans trynna get of work,t2_imejlfsh,dogcunt3000,0,1643209711.0,0,t1_huav73f,huav73f,True,[deleted],t3_sd75ss,https://www.reddit.com/r/Fishers/comments/sd75ss/positive_covid_test_result_pic/,Positive covid test result pic,/r/Fishers/comments/sd75ss/positive_covid_test_result_pic/huav73f/,8,r/Fishers,0,8
Yep. Last I saw it was ranked in the top 10. It is a mountain biker heaven.,t2_5000i9fi,Sooner613,0,1643203314.0,0,t1_huagqii,huagqii,False,LAPG3,t3_scknjz,https://www.reddit.com/r/Fishers/comments/scknjz/can_some_locals_chime_in/,Can some locals chime in?,/r/Fishers/comments/scknjz/can_some_locals_chime_in/huagqii/,1,r/Fishers,0,1
"The people are great but it really is a get back what you put into it kind of thing.  It is excellent for families with young children.  There are just so many young families with similar aged kids as us (1,4,6).  We have a bunch of friends we have made just meeting at the park or in class/daycare.  We have multiple playdates a week (although with the pandemic we have limited to a select number of people ).  

&#x200B;

Also, there is the trifecta of annual passes you can get for activities to do with kids (Conner Prairie, Children's Museum, Zoo) that keep you busy with kids.  The Children's Museum is the largest in the world and it's lots of fun.  Oh yeah and as someone else mentioned there are great parks in Fishers and Carmel and they are only building more.

&#x200B;

As far as bugs go, I don't know if I've even had a mosquito bite since I've been here.  I'm from the DC area, which is a swamp, so bugs are nothing here.  I guess it really depends where you hangout though.  If you are in your back yard in a suburban neighborhood desert there wont be that many but if you are more near the woods and near standing water there will be some.",t2_5ywxj,hoguemr,0,1643203231.0,0,t1_huagkjf,huagkjf,True,LAPG3,t3_scknjz,https://www.reddit.com/r/Fishers/comments/scknjz/can_some_locals_chime_in/,Can some locals chime in?,/r/Fishers/comments/scknjz/can_some_locals_chime_in/huagkjf/,2,r/Fishers,0,2
Woah I'm guessing you mean Griffin Bike Park in TH?  I didn't realize it was so good.  My friend and their family headed up making that park.  I haven't been there since they were building it so I'm going to have to check it out.,t2_5ywxj,hoguemr,0,1643202666.0,0,t1_huafh9b,huafh9b,False,LAPG3,t3_scknjz,https://www.reddit.com/r/Fishers/comments/scknjz/can_some_locals_chime_in/,Can some locals chime in?,/r/Fishers/comments/scknjz/can_some_locals_chime_in/huafh9b/,3,r/Fishers,0,3
A lot of traffic- like why is there so much traffic and bad drivers. Otherwise ok. Other options in Hamilton county.,t2_8cesgafq,Few-Situation-3126,0,1643199368.0,0,t1_hua9mkl,hua9mkl,True,LAPG3,t3_scknjz,https://www.reddit.com/r/Fishers/comments/scknjz/can_some_locals_chime_in/,Can some locals chime in?,/r/Fishers/comments/scknjz/can_some_locals_chime_in/hua9mkl/,-1,r/Fishers,0,-1
"I've been in Fishers over 20 years and would still consider it Midwest nice. It's more suburban and more a little status conscious than the typical Midwest, but only a little. For example: we know the names of the cashiers and deli workers of our favorite grocery story. They go out of their way to say hello when we are shopping and we do the same. We were concerned that we hadn't seen our favorite deli lady for several months last year and when my wife ran into her again it was a 15 minute conversation to catch up.  


But it is like a typical suburb, in that you may only see some of your neighbors when they pull in or out of their garage. But it's normal to know at least a few neighbors well enough to borrow tools, help each other on projects, etc..  


We tend to spend most evenings outside in the summer. A screened in porch is nice in late summer because mosquitos can be a nuisance around dusk. Usually just annoying, nothing severe.

But one tradition you are expected to follow if you move to Fishers: Three months after moving here, you must start complaining about how all the construction and growth is ruining Fishers. That it's an absolute travesty that they are turning a field into another neighborhood and making the traffic even worse! (bonus points if your home is less than 5 years old).   


Actually for a suburb growing from 7,500 to about 100,000 in 30 years I'm amazed at how well it has gone. Not pain free, but really pretty impressive.",t2_cuey8,randommillenium,0,1643161521.0,0,t1_hu8isgp,hu8isgp,True,LAPG3,t3_scknjz,https://www.reddit.com/r/Fishers/comments/scknjz/can_some_locals_chime_in/,Can some locals chime in?,/r/Fishers/comments/scknjz/can_some_locals_chime_in/hu8isgp/,14,r/Fishers,0,14
"From Philly and lived in Hong Kong prior to moving to Fishers. People here are great. No issues at all. 

While central IN is pretty flat, there is lots to do outside. Two of the top 25 mountain bike parks in the WORLD are within a 1 1/2 hour drive if that tells you anything (Terre Haute and Brown County). 

Yes winters can be cold, but I still get out and ride the bike with a group for a few hours every weekend.  You just need the right clothes.",t2_5000i9fi,Sooner613,0,1643161439.0,0,t1_hu8ilou,hu8ilou,True,LAPG3,t3_scknjz,https://www.reddit.com/r/Fishers/comments/scknjz/can_some_locals_chime_in/,Can some locals chime in?,/r/Fishers/comments/scknjz/can_some_locals_chime_in/hu8ilou/,3,r/Fishers,0,3
"People are very warm and friendly in Fishers! I’ve lived here about 15 years and it’s my favorite place I’ve ever lived. The cost of living is low, there’s plenty to do with kids and the schools are top notch. I know my neighbors, and we get together to hold street picnics and shoot off fireworks on the 4th. I have a network of friends and when I’ve needed help (like a flat bike tire) people stop to help. 
Is it as pretty as Oregon? Well, no not really. The state has a much more subtle beauty that you learn to appreciate over time. The state parks are great, as is the IN Dunes National Park. You can get to Chicago in just a few hours if you are missing the big city.",t2_4thae2v5,MontytheBold,0,1643150881.0,0,t1_hu7sxtp,hu7sxtp,True,LAPG3,t3_scknjz,https://www.reddit.com/r/Fishers/comments/scknjz/can_some_locals_chime_in/,Can some locals chime in?,/r/Fishers/comments/scknjz/can_some_locals_chime_in/hu7sxtp/,7,r/Fishers,0,7
"Moved here from Orange County in Southern California...

Outdoor activities are more limited.  Some nice lakes, rivers, and forests...but things are mostly flat unless you are in southern indiana.  Winter sports are unheard of.  Plan on being mostly inside Dec-March.",t2_1rnjz5dm,Spu12nky,0,1643141738.0,0,t1_hu757rr,hu757rr,True,LAPG3,t3_scknjz,https://www.reddit.com/r/Fishers/comments/scknjz/can_some_locals_chime_in/,Can some locals chime in?,/r/Fishers/comments/scknjz/can_some_locals_chime_in/hu757rr/,1,r/Fishers,0,1
"Wife and I moved to Fishers in 2014. We lived on the west side of Indy before that (Avon). 

We love it here. Everything is close.  
Shops: Hamilton Town Center is a great outdoor mall.   
Parks: There are many. MANY.  
Geist Reservoir is great if you enjoy the water, and they are making a public beach area on 100?? acres, can't remember the size.  
Connor Prarie is a good place to take the kiddos. 

And the schools are good. Hope you find your place.",t2_wlnki,leftturney,0,1643141264.0,0,t1_hu73y2d,hu73y2d,True,LAPG3,t3_scknjz,https://www.reddit.com/r/Fishers/comments/scknjz/can_some_locals_chime_in/,Can some locals chime in?,/r/Fishers/comments/scknjz/can_some_locals_chime_in/hu73y2d/,3,r/Fishers,0,3
Thanks for the input!,t2_9gbc0yub,LAPG3,0,1643138716.0,0,t1_hu6x4en,hu6x4en,False,LAPG3,t3_scknjz,https://www.reddit.com/r/Fishers/comments/scknjz/can_some_locals_chime_in/,Can some locals chime in?,/r/Fishers/comments/scknjz/can_some_locals_chime_in/hu6x4en/,1,r/Fishers,0,1
Thanks!,t2_9gbc0yub,LAPG3,0,1643138661.0,0,t1_hu6wz06,hu6wz06,False,LAPG3,t3_scknjz,https://www.reddit.com/r/Fishers/comments/scknjz/can_some_locals_chime_in/,Can some locals chime in?,/r/Fishers/comments/scknjz/can_some_locals_chime_in/hu6wz06/,1,r/Fishers,0,1
"Fishers is still growing but you will find the traditional midwestern hospitality here - people are generally friendly and will usually greet you back. It is an average suburb though where folks typically keep to themselves (for the most part), but you can still find a sense of community if you look.

As for bugs - yep, we got 'em. All sorts, spring through fall. You can still run into the troublesome ones (ticks and such) but it's not like some places in the south where you'll pick them up just walking across the lawn. There's a state park extremely close (Ft. Ben Harrison) and a bunch of others within a 1-2 hour drive. The environment is definitely different from the PNW, but there is a nice variation from north to south sides of the state, with Fishers being pretty centrally located.",t2_9sg0v,TheWiredDJ,0,1643138439.0,0,t1_hu6wdz7,hu6wdz7,True,LAPG3,t3_scknjz,https://www.reddit.com/r/Fishers/comments/scknjz/can_some_locals_chime_in/,Can some locals chime in?,/r/Fishers/comments/scknjz/can_some_locals_chime_in/hu6wdz7/,4,r/Fishers,0,4
"Yes - nice parks near to hike in Eagle Creek and Fort Harris State Park less than 30 minutes away.  Brown County and Turkey Run within 1.5 hours and very nice as well.  No Deet required lol.

Fishers. Noblesville, Carmel all nice areas with different plusses and minuses.",t2_m98hdi4,climber_pilot,0,1643137861.0,0,t1_hu6uuu9,hu6uuu9,False,LAPG3,t3_scknjz,https://www.reddit.com/r/Fishers/comments/scknjz/can_some_locals_chime_in/,Can some locals chime in?,/r/Fishers/comments/scknjz/can_some_locals_chime_in/hu6uuu9/,3,r/Fishers,0,3
"Looks a bit chilly. We're experiencing some warm 50-60 degree weather currently, but we've been down in the teens as well. Difference is we don't have much humidity.

So you're telling me I can go walk in a forest and not have to spray my entire body and douse my clothes in DEET? :)

How are the people? I know there's been an influx of transplants, which can be good or bad, depending on who is moving there. Warm? Friendly?",t2_9gbc0yub,LAPG3,0,1643137617.0,0,t1_hu6u80o,hu6u80o,False,LAPG3,t3_scknjz,https://www.reddit.com/r/Fishers/comments/scknjz/can_some_locals_chime_in/,Can some locals chime in?,/r/Fishers/comments/scknjz/can_some_locals_chime_in/hu6u80o/,1,r/Fishers,0,1
Bugs not an issue never heard of anyone treating their clothes - but did you check out weather for today and tomorrow!! Yikes cold!!,t2_m98hdi4,climber_pilot,0,1643137450.0,0,t1_hu6tsg6,hu6tsg6,True,LAPG3,t3_scknjz,https://www.reddit.com/r/Fishers/comments/scknjz/can_some_locals_chime_in/,Can some locals chime in?,/r/Fishers/comments/scknjz/can_some_locals_chime_in/hu6tsg6/,6,r/Fishers,0,6
"It’s gotten really bad over the past couple of years. They are expanding Noblesville, too. I live over by Morse Reservoir and the whole route thru Noblesville to Fishers has been under construction for the past year. They are turning the old Meijer area into a nice apartment building with various amenities & they’ve got to widen all the streets first. Now you see a lot more construction near Carmel (141st St area) and on 37. I feel like the bulk of it took place last spring, though, and it’s not as bad now. Especially now that they’ve gotten most of the 37 construction done it’s not as bad. It’s growing really, really fast. Come on back! If we don’t have room yet, we will soon lol!",t2_9jh2ceg7,Ok_Spot_2457,0,1643045749.0,0,t1_hu1l8i0,hu1l8i0,False,smewthies,t3_s4vfv6,https://www.reddit.com/r/Fishers/comments/s4vfv6/i_had_a_lovely_time_here/,I had a lovely time here!,/r/Fishers/comments/s4vfv6/i_had_a_lovely_time_here/hu1l8i0/,1,r/Fishers,0,1
Pizza hut or Puccini’s,t2_bcznqy79,alecboi77,0,1642905780.0,0,t1_httudaf,httudaf,True,DaydenDreiser,t3_rxdr8e,https://www.reddit.com/r/Fishers/comments/rxdr8e/fishers_pizza_places/,Fishers Pizza Places?,/r/Fishers/comments/rxdr8e/fishers_pizza_places/httudaf/,1,r/Fishers,0,1
"Used to be in Lantern Woods neighborhood, now in a hotel.",t2_bcznqy79,alecboi77,0,1642905711.0,0,t1_httu7nt,httu7nt,True,Turoknroll,t3_s46aw6,https://www.reddit.com/r/Fishers/comments/s46aw6/sunblest_neighborhood/,Sunblest neighborhood,/r/Fishers/comments/s46aw6/sunblest_neighborhood/httu7nt/,1,r/Fishers,0,1
"I went to Bagel Fair for the first time this last weekend. Really disappointed. Cashier was very short and rude. I got a plain bagel with cream cheese and wasn't impressed. Wife got a sausage and egg sandwich, also no very good.   


Big Apple Bagels was better and I wasn't very impressed with that place either.",t2_12fszk,TheMachRider,0,1642694251.0,0,t1_htgzn4b,htgzn4b,False,Teddy-No-Chainz,t3_rxf5gk,https://www.reddit.com/r/Fishers/comments/rxf5gk/fishers_bagel_places/,Fishers bagel places?,/r/Fishers/comments/rxf5gk/fishers_bagel_places/htgzn4b/,1,r/Fishers,0,1
I didn't seem to notice any! Meanwhile I-75 in the cincy area has been under construction literally my entire life lol,t2_10yu6b,smewthies,0,1642599304.0,0,t1_htbdd03,htbdd03,False,smewthies,t3_s4vfv6,https://www.reddit.com/r/Fishers/comments/s4vfv6/i_had_a_lovely_time_here/,I had a lovely time here!,/r/Fishers/comments/s4vfv6/i_had_a_lovely_time_here/htbdd03/,2,r/Fishers,0,2
"https://www.globalgranite.com//

The best! You grace endless amounts of slabs to walk through and touch. They make the process easy and answer all questions in real time. You’ll need to make an appointment. Good luck! https://www.globalgranite.com//",t2_6kqty8o2,petite_skincare,0,1642459285.0,0,t1_ht3khgt,ht3khgt,True,Piney630,t3_s6d5sr,https://www.reddit.com/r/Fishers/comments/s6d5sr/any_suggestions_on_granite_companies_for_kitchen/,Any suggestions on granite companies for kitchen counters?,/r/Fishers/comments/s6d5sr/any_suggestions_on_granite_companies_for_kitchen/ht3khgt/,2,r/Fishers,0,2
"I used [Granite America.](https://graniteamerica.com/indianapolis/). They are on the south side.   Happy with results.  I ordered the sink through them and they installed it, but they don’t hook up the plumbing afterwards.  You just have to hire a plumber for plumbing and garbage disposal.  It was a good time to replace the fixtures too.  I just bought some at Home Depot and plumber installed it as well.",t2_92hag,I_Love_McRibs,0,1642456013.0,0,t1_ht3c9em,ht3c9em,True,Piney630,t3_s6d5sr,https://www.reddit.com/r/Fishers/comments/s6d5sr/any_suggestions_on_granite_companies_for_kitchen/,Any suggestions on granite companies for kitchen counters?,/r/Fishers/comments/s6d5sr/any_suggestions_on_granite_companies_for_kitchen/ht3c9em/,3,r/Fishers,0,3
My parents live in Southern California.  They tried to schedule a PCR test through the state this past weekend.  The first availability was January 26.,t2_92hag,I_Love_McRibs,0,1642455597.0,0,t1_ht3b6i0,ht3b6i0,True,GenerationXChick,t3_s6230d,https://www.reddit.com/r/Fishers/comments/s6230d/covid19_testing/,Covid-19 Testing,/r/Fishers/comments/s6230d/covid19_testing/ht3b6i0/,1,r/Fishers,0,1
