body,author_fullname,author.name,controversiality,created,downs,fullname,id,is_root,link_author,link_id,link_permalink,link_title,permalink,score,subreddit_name_prefixed,total_awards_received,ups
"Try Firestone by target.  I took a car to Firestone for a PPI but it was on the northwest side of town (as was the dealership).  They only charged me $9.99.

https://i.imgur.com/eApgwKH.jpg",t2_92hag,I_Love_McRibs,0,1628630417.0,0,t1_h8giskt,h8giskt,True,HeinrichHein,t3_p1y4qp,https://www.reddit.com/r/Fishers/comments/p1y4qp/looking_to_buy_a_used_car_know_any_good_local/,"Looking to buy a used car, know any good local mechanics to do a pre-purchase inspection?",/r/Fishers/comments/p1y4qp/looking_to_buy_a_used_car_know_any_good_local/h8giskt/,0,r/Fishers,0,0
/r/lostredditors,t2_6mzxc,xagut,0,1628610333.0,0,t1_h8f7afm,h8f7afm,True,eymen5608,t3_p1rkfh,https://www.reddit.com/r/Fishers/comments/p1rkfh/amazing_cast_net_fishing_the_in_river/,Amazing Cast Net Fishing The in River,/r/Fishers/comments/p1rkfh/amazing_cast_net_fishing_the_in_river/h8f7afm/,6,r/Fishers,0,6
"Only 1 for now , until I figure out if this actually fixes my problem. If it does, probably 3-4 total. You tell me how much you would charge.",t2_6z2fnxxu,skrrtdirt,0,1628437029.0,0,t1_h86g7c7,h86g7c7,False,skrrtdirt,t3_p071bh,https://www.reddit.com/r/Fishers/comments/p071bh/looking_for_someone_local_to_do_a_small_soldering/,"Looking for someone local to do a small soldering job like pictured (paid, of course). Details in comments.",/r/Fishers/comments/p071bh/looking_for_someone_local_to_do_a_small_soldering/h86g7c7/,2,r/Fishers,0,2
"I can do this, how many and what are you paying?",t2_81apjx1u,BikeGuyIndy,0,1628396366.0,0,t1_h84uyvw,h84uyvw,True,skrrtdirt,t3_p071bh,https://www.reddit.com/r/Fishers/comments/p071bh/looking_for_someone_local_to_do_a_small_soldering/,"Looking for someone local to do a small soldering job like pictured (paid, of course). Details in comments.",/r/Fishers/comments/p071bh/looking_for_someone_local_to_do_a_small_soldering/h84uyvw/,1,r/Fishers,0,1
"The picture is pulled from an Arduino forum. Apparently to update the latest firmware on this board requires a direct USB connection to the modem (rather poor design), so a USB cable needs to be soldered as shown in the pic. I'm not capable of such precise soldering so looking for some local help.

More details of the specific soldering schematic here: https://forum.arduino.cc/t/firmware-upgrade-for-ublox-sara-r410m-02b-on-the-mkr-nb-1500-2/699292/2",t2_6z2fnxxu,skrrtdirt,0,1628392402.0,0,t1_h84oav6,h84oav6,True,skrrtdirt,t3_p071bh,https://www.reddit.com/r/Fishers/comments/p071bh/looking_for_someone_local_to_do_a_small_soldering/,"Looking for someone local to do a small soldering job like pictured (paid, of course). Details in comments.",/r/Fishers/comments/p071bh/looking_for_someone_local_to_do_a_small_soldering/h84oav6/,2,r/Fishers,0,2
sounds amazing! wish I could ride my time-bike back in time and hit those trails!,t2_6z2fnxxu,skrrtdirt,0,1628259373.0,0,t1_h7xreu4,h7xreu4,False,I_Love_McRibs,t3_oyfhxs,https://www.reddit.com/r/Fishers/comments/oyfhxs/fishers_buys_white_river_land_on_96th_street_with/,Fishers buys White River land on 96th Street with plans to make a park,/r/Fishers/comments/oyfhxs/fishers_buys_white_river_land_on_96th_street_with/h7xreu4/,1,r/Fishers,0,1
I remember riding those trails.  Probably mid-90s?  It was when 96th ended at Allisonville.  Hard to imagine that section of 96th between Allisonville and Keystone not existing.,t2_92hag,I_Love_McRibs,0,1628242092.0,0,t1_h7wzts7,h7wzts7,False,I_Love_McRibs,t3_oyfhxs,https://www.reddit.com/r/Fishers/comments/oyfhxs/fishers_buys_white_river_land_on_96th_street_with/,Fishers buys White River land on 96th Street with plans to make a park,/r/Fishers/comments/oyfhxs/fishers_buys_white_river_land_on_96th_street_with/h7wzts7/,2,r/Fishers,0,2
Oh man. That’s the OG 96th street trails back before the bridge was built. About a six? mile loop. Climbs. Downhills. Creeks. Night riding. Through an old cemetery. Was so much fun.,t2_12dsz6,chinese__monk,0,1628221309.0,0,t1_h7w7roq,h7w7roq,False,I_Love_McRibs,t3_oyfhxs,https://www.reddit.com/r/Fishers/comments/oyfhxs/fishers_buys_white_river_land_on_96th_street_with/,Fishers buys White River land on 96th Street with plans to make a park,/r/Fishers/comments/oyfhxs/fishers_buys_white_river_land_on_96th_street_with/h7w7roq/,1,r/Fishers,0,1
I have always thought that area looks ripe to build MTB trails.,t2_6z2fnxxu,skrrtdirt,0,1628217065.0,0,t1_h7vzcz7,h7vzcz7,False,I_Love_McRibs,t3_oyfhxs,https://www.reddit.com/r/Fishers/comments/oyfhxs/fishers_buys_white_river_land_on_96th_street_with/,Fishers buys White River land on 96th Street with plans to make a park,/r/Fishers/comments/oyfhxs/fishers_buys_white_river_land_on_96th_street_with/h7vzcz7/,2,r/Fishers,0,2
That area had the best mountain bike trails back in the day!,t2_12dsz6,chinese__monk,0,1628216384.0,0,t1_h7vxyib,h7vxyib,True,I_Love_McRibs,t3_oyfhxs,https://www.reddit.com/r/Fishers/comments/oyfhxs/fishers_buys_white_river_land_on_96th_street_with/,Fishers buys White River land on 96th Street with plans to make a park,/r/Fishers/comments/oyfhxs/fishers_buys_white_river_land_on_96th_street_with/h7vxyib/,1,r/Fishers,0,1
"Wildflower salon, at hamilton town center, run by Megan Justak

https://meganjustak.glossgenius.com",t2_lib66,Rwburge96,0,1628205001.0,0,t1_h7vas2u,h7vas2u,True,DevAdobo,t3_nkyyiu,https://www.reddit.com/r/Fishers/comments/nkyyiu/best_salon_in_fishers/,Best salon in fishers,/r/Fishers/comments/nkyyiu/best_salon_in_fishers/h7vas2u/,1,r/Fishers,0,1
flirt salon & spa! always recommend them :-) kaylee there is awesome,t2_psr18,gucciflipflopbitch,0,1628133674.0,0,t1_h7rg3i3,h7rg3i3,True,[deleted],t3_oweqpz,https://www.reddit.com/r/Fishers/comments/oweqpz/wheres_the_best_salon_to_get_hair_color/,Where's the best salon to get hair color?,/r/Fishers/comments/oweqpz/wheres_the_best_salon_to_get_hair_color/h7rg3i3/,1,r/Fishers,0,1
Troy Perkins Salon Lofts Keystone,t2_bkiwk7ld,MostFrosting514,0,1627963198.0,0,t1_h7iiq19,h7iiq19,True,[deleted],t3_oweqpz,https://www.reddit.com/r/Fishers/comments/oweqpz/wheres_the_best_salon_to_get_hair_color/,Where's the best salon to get hair color?,/r/Fishers/comments/oweqpz/wheres_the_best_salon_to_get_hair_color/h7iiq19/,1,r/Fishers,0,1
My wife how to KKBB and loves it. Been going there for years.,t2_6z2fnxxu,skrrtdirt,0,1627957810.0,0,t1_h7i8omw,h7i8omw,False,[deleted],t3_oweqpz,https://www.reddit.com/r/Fishers/comments/oweqpz/wheres_the_best_salon_to_get_hair_color/,Where's the best salon to get hair color?,/r/Fishers/comments/oweqpz/wheres_the_best_salon_to_get_hair_color/h7i8omw/,1,r/Fishers,0,1
I went to Ping at Radiate 60 Hair Collective. Best hair coloring I’ve ever gotten and she’s super attentive,t2_jf0tr,toomanyblocks,0,1627942392.0,0,t1_h7hcbtx,h7hcbtx,True,[deleted],t3_oweqpz,https://www.reddit.com/r/Fishers/comments/oweqpz/wheres_the_best_salon_to_get_hair_color/,Where's the best salon to get hair color?,/r/Fishers/comments/oweqpz/wheres_the_best_salon_to_get_hair_color/h7hcbtx/,1,r/Fishers,0,1
Kiss kiss bang bang.  116th st!!,t2_8wn1mlxn,dabomb90,0,1627935995.0,0,t1_h7gxyv9,h7gxyv9,True,[deleted],t3_oweqpz,https://www.reddit.com/r/Fishers/comments/oweqpz/wheres_the_best_salon_to_get_hair_color/,Where's the best salon to get hair color?,/r/Fishers/comments/oweqpz/wheres_the_best_salon_to_get_hair_color/h7gxyv9/,2,r/Fishers,0,2
I need my red touched up. I’m a natural brunette and my roots are coming in hot,t2_cbanzj8l,Such_Silver_4138,0,1627918995.0,0,t1_h7fupcj,h7fupcj,False,[deleted],t3_oweqpz,https://www.reddit.com/r/Fishers/comments/oweqpz/wheres_the_best_salon_to_get_hair_color/,Where's the best salon to get hair color?,/r/Fishers/comments/oweqpz/wheres_the_best_salon_to_get_hair_color/h7fupcj/,3,r/Fishers,0,3
Flipped out Hair Salon on olio has a bunch of great people.,t2_a9hx8,jenxos,0,1627915856.0,0,t1_h7fnq5o,h7fnq5o,True,[deleted],t3_oweqpz,https://www.reddit.com/r/Fishers/comments/oweqpz/wheres_the_best_salon_to_get_hair_color/,Where's the best salon to get hair color?,/r/Fishers/comments/oweqpz/wheres_the_best_salon_to_get_hair_color/h7fnq5o/,1,r/Fishers,0,1
"I was LITERALLY about to ask this same question, I think that makes us friends",t2_cbanzj8l,Such_Silver_4138,0,1627914413.0,0,t1_h7fkm4t,h7fkm4t,True,[deleted],t3_oweqpz,https://www.reddit.com/r/Fishers/comments/oweqpz/wheres_the_best_salon_to_get_hair_color/,Where's the best salon to get hair color?,/r/Fishers/comments/oweqpz/wheres_the_best_salon_to_get_hair_color/h7fkm4t/,3,r/Fishers,0,3
"They're called ""Ghost Bikes"" and are a memorial as in the other reply.

[http://ghostbikes.org/](http://ghostbikes.org/)",t2_cg6j1,mnemonicmonkey,0,1627842445.0,0,t1_h7c9c44,h7c9c44,True,cmgww,t3_ovgzk7,https://www.reddit.com/r/Fishers/comments/ovgzk7/whats_the_story_with_the_old_white_sometimes/,What’s the story with the old white (sometimes other color) bike on Brooks School Rd just past the elementary school?,/r/Fishers/comments/ovgzk7/whats_the_story_with_the_old_white_sometimes/h7c9c44/,1,r/Fishers,0,1
"Never been but actually does look like a good option, as long as you beat everybody else there.",t2_9loiv,aerostar193,0,1627829944.0,0,t1_h7bif0e,h7bif0e,False,MattChicago1871,t3_oviphk,https://www.reddit.com/r/Fishers/comments/oviphk/best_place_to_hang_out_at_night_after_phish/,Best Place to Hang out at Night after Phish?,/r/Fishers/comments/oviphk/best_place_to_hang_out_at_night_after_phish/h7bif0e/,1,r/Fishers,0,1
There’s a new place that just opened up this weekend called Parks place pub…it’s in downtown fishers and is open until 2am Friday and Saturday nights.,t2_9uqbj,ironmonkey78,0,1627827390.0,0,t1_h7bdbex,h7bdbex,True,MattChicago1871,t3_oviphk,https://www.reddit.com/r/Fishers/comments/oviphk/best_place_to_hang_out_at_night_after_phish/,Best Place to Hang out at Night after Phish?,/r/Fishers/comments/oviphk/best_place_to_hang_out_at_night_after_phish/h7bdbex/,3,r/Fishers,0,3
Joe's Grille is open late.,t2_356i44w4,rubberducky75,0,1627826017.0,0,t1_h7baqcs,h7baqcs,True,MattChicago1871,t3_oviphk,https://www.reddit.com/r/Fishers/comments/oviphk/best_place_to_hang_out_at_night_after_phish/,Best Place to Hang out at Night after Phish?,/r/Fishers/comments/oviphk/best_place_to_hang_out_at_night_after_phish/h7baqcs/,1,r/Fishers,0,1
"No thoughts on Britton, but I wrote an answer before seeing this. Completely agree with this response. Late night in the area is Mass Ave, but it's almost downtown Indianapolis, so it'll be a drive. Fishers/Noblesville are set up for families, so things die down around 10.",t2_b7mz5,Zebov3,0,1627825057.0,0,t1_h7b8x40,h7b8x40,False,MattChicago1871,t3_oviphk,https://www.reddit.com/r/Fishers/comments/oviphk/best_place_to_hang_out_at_night_after_phish/,Best Place to Hang out at Night after Phish?,/r/Fishers/comments/oviphk/best_place_to_hang_out_at_night_after_phish/h7b8x40/,1,r/Fishers,0,1
"(This is all dependent on the show being at Deer Creek/Verizon/Some mortgage company - whatever it's called this year.)

Depends on your age. Ale emporium is the best wings I've ever had and probably the best beer selection in the area. I highly recommend it for that alone. But it's very much a pub. It's always packed, but there's two of them. The one on Olio Rd is family-friendly and set up almost exactly like a BW3 - mostly tables with a small bar. The one on Allisonville and 465 is 21+ and is more of a bar with some tables around it.

As someone else mentioned, Britton tavern (at least when I was there last, YEARS ago) was a mid-20s pub that turned into a club scene the later it got.

The area around top golf (116th & 69) has quite a few places. At that time of night, I'm not 100% what will be open.

Finally, right outside of the venue is Hamilton Town Center. It has quite a few restaurants that I would suspect would stay open longer on concert nights as the entire area sprung up solely because of the concerts.",t2_b7mz5,Zebov3,0,1627824870.0,0,t1_h7b8job,h7b8job,True,MattChicago1871,t3_oviphk,https://www.reddit.com/r/Fishers/comments/oviphk/best_place_to_hang_out_at_night_after_phish/,Best Place to Hang out at Night after Phish?,/r/Fishers/comments/oviphk/best_place_to_hang_out_at_night_after_phish/h7b8job/,1,r/Fishers,0,1
Wow. Only two years.  For killing someone. I wonder how much time she actually served.,t2_92hag,I_Love_McRibs,0,1627824149.0,0,t1_h7b77mz,h7b77mz,False,cmgww,t3_ovgzk7,https://www.reddit.com/r/Fishers/comments/ovgzk7/whats_the_story_with_the_old_white_sometimes/,What’s the story with the old white (sometimes other color) bike on Brooks School Rd just past the elementary school?,/r/Fishers/comments/ovgzk7/whats_the_story_with_the_old_white_sometimes/h7b77mz/,1,r/Fishers,0,1
"Fishers resident here. Most of the bars open late are chill places for beers. I’d recommend [Joe’s ](http://www.joesgrillefishers.com/)over Britton Tavern or Main Event. If you’re looking for more and aren’t worried about a trip into Indy, you need to go to [the Trap](https://trapindy.com/) and have yourselves a great time.",t2_985va,eetzaboyee,0,1627820620.0,0,t1_h7b1hep,h7b1hep,True,MattChicago1871,t3_oviphk,https://www.reddit.com/r/Fishers/comments/oviphk/best_place_to_hang_out_at_night_after_phish/,Best Place to Hang out at Night after Phish?,/r/Fishers/comments/oviphk/best_place_to_hang_out_at_night_after_phish/h7b1hep/,4,r/Fishers,0,4
Last time I was there I walked back out. Somehow still allowed smoking.,t2_1rk9pox5,sea-fog,0,1627812570.0,0,t1_h7aroyi,h7aroyi,False,MattChicago1871,t3_oviphk,https://www.reddit.com/r/Fishers/comments/oviphk/best_place_to_hang_out_at_night_after_phish/,Best Place to Hang out at Night after Phish?,/r/Fishers/comments/oviphk/best_place_to_hang_out_at_night_after_phish/h7aroyi/,1,r/Fishers,0,1
Haven't been there myself. But most places on 96th street are decent bars/restaurants all around.,t2_yhbjl,AndrewSS02,0,1627802962.0,0,t1_h7agzbq,h7agzbq,False,MattChicago1871,t3_oviphk,https://www.reddit.com/r/Fishers/comments/oviphk/best_place_to_hang_out_at_night_after_phish/,Best Place to Hang out at Night after Phish?,/r/Fishers/comments/oviphk/best_place_to_hang_out_at_night_after_phish/h7agzbq/,1,r/Fishers,0,1
Last question: Main Event on 96th?,t2_39dumujo,MattChicago1871,0,1627794853.0,0,t1_h7a6vcc,h7a6vcc,False,MattChicago1871,t3_oviphk,https://www.reddit.com/r/Fishers/comments/oviphk/best_place_to_hang_out_at_night_after_phish/,Best Place to Hang out at Night after Phish?,/r/Fishers/comments/oviphk/best_place_to_hang_out_at_night_after_phish/h7a6vcc/,1,r/Fishers,0,1
Britton Tavern is a decent place with a large beer selection. Just be aware any typical weekend there is roughly a club experience more so than a bar. They close at 3.,t2_yhbjl,AndrewSS02,0,1627794300.0,0,t1_h7a63uq,h7a63uq,False,MattChicago1871,t3_oviphk,https://www.reddit.com/r/Fishers/comments/oviphk/best_place_to_hang_out_at_night_after_phish/,Best Place to Hang out at Night after Phish?,/r/Fishers/comments/oviphk/best_place_to_hang_out_at_night_after_phish/h7a63uq/,3,r/Fishers,0,3
Thoughts on Britton Tavern?,t2_39dumujo,MattChicago1871,0,1627794099.0,0,t1_h7a5tp9,h7a5tp9,False,MattChicago1871,t3_oviphk,https://www.reddit.com/r/Fishers/comments/oviphk/best_place_to_hang_out_at_night_after_phish/,Best Place to Hang out at Night after Phish?,/r/Fishers/comments/oviphk/best_place_to_hang_out_at_night_after_phish/h7a5tp9/,1,r/Fishers,0,1
Thanks for the info!! Thoughts on Britton Tavern?,t2_39dumujo,MattChicago1871,0,1627794090.0,0,t1_h7a5t9o,h7a5t9o,False,MattChicago1871,t3_oviphk,https://www.reddit.com/r/Fishers/comments/oviphk/best_place_to_hang_out_at_night_after_phish/,Best Place to Hang out at Night after Phish?,/r/Fishers/comments/oviphk/best_place_to_hang_out_at_night_after_phish/h7a5t9o/,1,r/Fishers,0,1
Honestly your best bet is going to be to drive down to Broad Ripple. I can't think of any place up here open past midnight.,t2_9loiv,aerostar193,0,1627793146.0,0,t1_h7a4gqn,h7a4gqn,True,MattChicago1871,t3_oviphk,https://www.reddit.com/r/Fishers/comments/oviphk/best_place_to_hang_out_at_night_after_phish/,Best Place to Hang out at Night after Phish?,/r/Fishers/comments/oviphk/best_place_to_hang_out_at_night_after_phish/h7a4gqn/,-1,r/Fishers,0,-1
"Great question. I'm sort.of wracking my brain here because I don't know many things open late in Noblesville/Fishers. That's a three day show, right? I think they usually end around 11pm. I work at the fire station just down the street from the venue.  There's Books and Brews in Hamilton Town Center, which is just down the street, but I think they close at midnight. 1933 Lounge at The Yard is open until midnight. Across the street is Top Golf which is open late.  Ale Emporium on Olio road is another choice. Go to downtown Noblesville to Syd's for a dive bar experience.  Open late but a drive from the concert.  If you want to be out after midnight you'd have more luck heading to Broadripple or Mass Ave in Indy.  Hopefully someone else has more ideas.",t2_1rk9pox5,sea-fog,0,1627784634.0,0,t1_h79qqut,h79qqut,True,MattChicago1871,t3_oviphk,https://www.reddit.com/r/Fishers/comments/oviphk/best_place_to_hang_out_at_night_after_phish/,Best Place to Hang out at Night after Phish?,/r/Fishers/comments/oviphk/best_place_to_hang_out_at_night_after_phish/h79qqut/,2,r/Fishers,0,2
"Thank you. I now recall that happening, I had just forgotten. Terrible tragedy.",t2_bjm5zn3,cmgww,0,1627773460.0,0,t1_h796fok,h796fok,False,cmgww,t3_ovgzk7,https://www.reddit.com/r/Fishers/comments/ovgzk7/whats_the_story_with_the_old_white_sometimes/,What’s the story with the old white (sometimes other color) bike on Brooks School Rd just past the elementary school?,/r/Fishers/comments/ovgzk7/whats_the_story_with_the_old_white_sometimes/h796fok/,1,r/Fishers,0,1
"It’s a memorial for a biker who was killed by a drunk driver June 2018.

https://www.indystar.com/story/news/crime/2018/10/23/driver-crash-killed-fishers-cyclist-charged-driving-drunk/1738508002/",t2_2mizn,daecrist,0,1627772798.0,0,t1_h7957h5,h7957h5,True,cmgww,t3_ovgzk7,https://www.reddit.com/r/Fishers/comments/ovgzk7/whats_the_story_with_the_old_white_sometimes/,What’s the story with the old white (sometimes other color) bike on Brooks School Rd just past the elementary school?,/r/Fishers/comments/ovgzk7/whats_the_story_with_the_old_white_sometimes/h7957h5/,2,r/Fishers,0,2
"I once worked with a woman who admitted that, as a newlywed, she wouldn't do her business in the marital home because she didn't want to do that sort of thing around her new husband.. she would come to work to poop on her days off or go to a restaurant or a gas station. Just a guess, but this could be a similar situation.",t2_dx1jx,Deeply_Thinking,0,1627408517.0,0,t1_h6qdmnr,h6qdmnr,True,I_Love_McRibs,t3_opbubq,https://www.reddit.com/r/Fishers/comments/opbubq/fishers_police_investigating_woman_caught_on/,Fishers police investigating woman caught on camera relieving herself in yards,/r/Fishers/comments/opbubq/fishers_police_investigating_woman_caught_on/h6qdmnr/,1,r/Fishers,0,1
Trie Center hands down.,t2_488vx0h0,Bangkok-Baby,0,1627366776.0,0,t1_h6ofxly,h6ofxly,True,[deleted],t3_os1vs1,https://www.reddit.com/r/Fishers/comments/os1vs1/budgetfriendly_oil_change_places/,Budget-friendly oil change places?,/r/Fishers/comments/os1vs1/budgetfriendly_oil_change_places/h6ofxly/,1,r/Fishers,0,1
Requires a membership but the Costco only charges $25 for a rotation. I do my own oil so can't help you there.,t2_pq2jj,iacrotty,0,1627358915.0,0,t1_h6o4wti,h6o4wti,True,[deleted],t3_os1vs1,https://www.reddit.com/r/Fishers/comments/os1vs1/budgetfriendly_oil_change_places/,Budget-friendly oil change places?,/r/Fishers/comments/os1vs1/budgetfriendly_oil_change_places/h6o4wti/,2,r/Fishers,0,2
"The Pep Boys on 96th typically charges me roughly $45 for an oil change. Had to go to Jiffy Lube near HTC last time just out of convenience and paid $70. It was quick for sure, but yikes.",t2_9te4b,incredebell,0,1627340752.0,0,t1_h6n6ax9,h6n6ax9,True,[deleted],t3_os1vs1,https://www.reddit.com/r/Fishers/comments/os1vs1/budgetfriendly_oil_change_places/,Budget-friendly oil change places?,/r/Fishers/comments/os1vs1/budgetfriendly_oil_change_places/h6n6ax9/,2,r/Fishers,0,2
"I went to valvoline on 116 twice and I had a bad experience both times. If you have even a little complicated car, do not take it there. They are great for regular civics and camrys though",t2_lhj1z,BoiledBanana,0,1627334954.0,0,t1_h6mu2ib,h6mu2ib,True,[deleted],t3_os1vs1,https://www.reddit.com/r/Fishers/comments/os1vs1/budgetfriendly_oil_change_places/,Budget-friendly oil change places?,/r/Fishers/comments/os1vs1/budgetfriendly_oil_change_places/h6mu2ib/,2,r/Fishers,0,2
"I know! I should have said ""Goodyear"" myself.. thanks for pointing it out. Tire Central must be the name. I haven't been there yet but I will for my next time.",t2_3p90vl3,aintSaintPeter,0,1627328985.0,0,t1_h6mgnbn,h6mgnbn,False,[deleted],t3_os1vs1,https://www.reddit.com/r/Fishers/comments/os1vs1/budgetfriendly_oil_change_places/,Budget-friendly oil change places?,/r/Fishers/comments/os1vs1/budgetfriendly_oil_change_places/h6mgnbn/,1,r/Fishers,0,1
"as an FYI, they arent called Goodyear, even though thats the large sign outside. They are called Tire Central i think. I always try to look them up as Goodyear.",t2_eper0,Dramaticnoise,0,1627326493.0,0,t1_h6mb2bd,h6mb2bd,False,[deleted],t3_os1vs1,https://www.reddit.com/r/Fishers/comments/os1vs1/budgetfriendly_oil_change_places/,Budget-friendly oil change places?,/r/Fishers/comments/os1vs1/budgetfriendly_oil_change_places/h6mb2bd/,2,r/Fishers,0,2
The folks at the Valvoline on 116th have always been great.,t2_4ipwa,thesupermikey,0,1627325996.0,0,t1_h6m9xzm,h6m9xzm,True,[deleted],t3_os1vs1,https://www.reddit.com/r/Fishers/comments/os1vs1/budgetfriendly_oil_change_places/,Budget-friendly oil change places?,/r/Fishers/comments/os1vs1/budgetfriendly_oil_change_places/h6m9xzm/,5,r/Fishers,0,5
You're the third person to recommend the Goodyear outlet to me this month!,t2_3p90vl3,aintSaintPeter,0,1627324999.0,0,t1_h6m7mtv,h6m7mtv,False,[deleted],t3_os1vs1,https://www.reddit.com/r/Fishers/comments/os1vs1/budgetfriendly_oil_change_places/,Budget-friendly oil change places?,/r/Fishers/comments/os1vs1/budgetfriendly_oil_change_places/h6m7mtv/,2,r/Fishers,0,2
yep!,t2_eper0,Dramaticnoise,0,1627324770.0,0,t1_h6m73zx,h6m73zx,False,[deleted],t3_os1vs1,https://www.reddit.com/r/Fishers/comments/os1vs1/budgetfriendly_oil_change_places/,Budget-friendly oil change places?,/r/Fishers/comments/os1vs1/budgetfriendly_oil_change_places/h6m73zx/,1,r/Fishers,0,1
The place by CVS?,t2_3p90vl3,aintSaintPeter,0,1627323566.0,0,t1_h6m4ckp,h6m4ckp,False,[deleted],t3_os1vs1,https://www.reddit.com/r/Fishers/comments/os1vs1/budgetfriendly_oil_change_places/,Budget-friendly oil change places?,/r/Fishers/comments/os1vs1/budgetfriendly_oil_change_places/h6m4ckp/,1,r/Fishers,0,1
Why do you hate to say it? That's what I do too.,t2_5wh3v,Braddo4417,0,1627323500.0,0,t1_h6m46ys,h6m46ys,False,[deleted],t3_os1vs1,https://www.reddit.com/r/Fishers/comments/os1vs1/budgetfriendly_oil_change_places/,Budget-friendly oil change places?,/r/Fishers/comments/os1vs1/budgetfriendly_oil_change_places/h6m46ys/,5,r/Fishers,0,5
"I can never remember the name, but there is a service center on the south west corner of 116th and allisonville. Im always shocked how little they charge me when I do an oil change. I've had a fair amount of car work done there and they have always been great.",t2_eper0,Dramaticnoise,0,1627321103.0,0,t1_h6lynmx,h6lynmx,True,[deleted],t3_os1vs1,https://www.reddit.com/r/Fishers/comments/os1vs1/budgetfriendly_oil_change_places/,Budget-friendly oil change places?,/r/Fishers/comments/os1vs1/budgetfriendly_oil_change_places/h6lynmx/,4,r/Fishers,0,4
"I hate to say it,  it I have had a lot of success buying a Groupon and then immediately using it at Valvoline",t2_cwkuty2u,pm_me_milf_boobz,0,1627316637.0,0,t1_h6loan9,h6loan9,True,[deleted],t3_os1vs1,https://www.reddit.com/r/Fishers/comments/os1vs1/budgetfriendly_oil_change_places/,Budget-friendly oil change places?,/r/Fishers/comments/os1vs1/budgetfriendly_oil_change_places/h6loan9/,6,r/Fishers,0,6
"If you just have a normal, every-day car, I’ve always had good service at the Jiffy on 116th at Allisonville for my wife’s equinox. They’re cheap and quick. 

I take my BMW to a specialist or dealer though.

Edit: I understand that BMWs aren’t special. They’re just weird and it’s not worth risking it.",t2_67k8g,glgallow,0,1627316478.0,0,t1_h6lnxki,h6lnxki,True,[deleted],t3_os1vs1,https://www.reddit.com/r/Fishers/comments/os1vs1/budgetfriendly_oil_change_places/,Budget-friendly oil change places?,/r/Fishers/comments/os1vs1/budgetfriendly_oil_change_places/h6lnxki/,4,r/Fishers,0,4
I’ll toast to that.,t2_92hag,I_Love_McRibs,0,1627179696.0,0,t1_h6fkkf4,h6fkkf4,False,b33flu,t3_oqtt55,https://www.reddit.com/r/Fishers/comments/oqtt55/these_are_real_huh/,These are real? Huh.,/r/Fishers/comments/oqtt55/these_are_real_huh/h6fkkf4/,2,r/Fishers,0,2
cheers to the crazy shitter lady who brought a community together,t2_2y4o1cg9,oax195,0,1627161897.0,0,t1_h6enzk5,h6enzk5,True,b33flu,t3_oqtt55,https://www.reddit.com/r/Fishers/comments/oqtt55/these_are_real_huh/,These are real? Huh.,/r/Fishers/comments/oqtt55/these_are_real_huh/h6enzk5/,1,r/Fishers,0,1
Look at the third post in this sub.,t2_92hag,I_Love_McRibs,0,1627151175.0,0,t1_h6e2udr,h6e2udr,False,b33flu,t3_oqtt55,https://www.reddit.com/r/Fishers/comments/oqtt55/these_are_real_huh/,These are real? Huh.,/r/Fishers/comments/oqtt55/these_are_real_huh/h6e2udr/,5,r/Fishers,0,5
