body,author_fullname,author.name,controversiality,created,downs,fullname,id,is_root,link_author,link_id,link_permalink,link_title,permalink,score,subreddit_name_prefixed,total_awards_received,ups
Your cat looks big boned,t2_fdyge58k,AdMost3735,0,1636154814.0,0,t1_hjhejyq,hjhejyq,True,Tia_Pia,t3_q57esa,https://www.reddit.com/r/Fishers/comments/q57esa/whats_that_noise_is_now_on_kickstarter_im_a_local/,“What’s That Noise” is now on Kickstarter! I’m a local here in Fishers and I just finished my 2nd children’s book,/r/Fishers/comments/q57esa/whats_that_noise_is_now_on_kickstarter_im_a_local/hjhejyq/,1,r/Fishers,0,1
"Just want to point out that while FHS has stellar equipment, talented student leaders, and skilled instructors, it lacks a compassionate, mentally stable director. The director of FHS bands, Chad Kohler, is known to openly mock and insult students that make simple mistakes. He berates students for asking questions, and he becomes aggressive when his inappropriate behavior is criticized. I would definitely recommend you look more into the HSE directors to determine whether their directors will bully and harass them or help them develop their musical, physical, and social skills.",t2_9dvtdpd5,Temporary-Complex751,0,1636149013.0,0,t1_hjh082o,hjh082o,False,I_Love_McRibs,t3_bercbh,https://www.reddit.com/r/Fishers/comments/bercbh/i_know_most_people_wont_care_but_just_wanted_to/,I know most people won’t care but just wanted to shout out to both Fishers High School Winter Guard and Percussion groups for coming in first place at WGI World Championships. This is a national level contest.,/r/Fishers/comments/bercbh/i_know_most_people_wont_care_but_just_wanted_to/hjh082o/,1,r/Fishers,0,1
Ha. At least it's consistent.,t2_cg6j1,mnemonicmonkey,0,1635988825.0,0,t1_hj87co8,hj87co8,False,doctor-ouz,t3_qfupf8,https://www.reddit.com/r/Fishers/comments/qfupf8/anyone_else_lose_wifi_today/,Anyone else lose WiFi today?,/r/Fishers/comments/qfupf8/anyone_else_lose_wifi_today/hj87co8/,1,r/Fishers,0,1
Neighbor was actually digging around in our shared side yard and didn’t call 811. AT&T came out fairly early the next day but it did stink not having WiFi for a day,t2_5505gs38,doctor-ouz,0,1635982228.0,0,t1_hj7scqw,hj7scqw,False,doctor-ouz,t3_qfupf8,https://www.reddit.com/r/Fishers/comments/qfupf8/anyone_else_lose_wifi_today/,Anyone else lose WiFi today?,/r/Fishers/comments/qfupf8/anyone_else_lose_wifi_today/hj7scqw/,2,r/Fishers,0,2
Please let me know if you have any questions about the interest form!,t2_6h74k7a0,snootypoodlepoo,0,1635625267.0,0,t1_hionj0g,hionj0g,True,[deleted],t3_qj8zzc,https://www.reddit.com/r/Fishers/comments/qj8zzc/deleted_by_user/,[deleted by user],/r/Fishers/comments/qj8zzc/deleted_by_user/hionj0g/,0,r/Fishers,0,0
"Should legalize! Catering to a costumed charachter is dumb.  McGruff the Crime dog, he will never be…nor Smokey The Bear….",t2_8sb8zpqf,Alarming_Jicama2979,0,1635602420.0,0,t1_hin6jkt,hin6jkt,True,Alarming_Jicama2979,t3_qg9ug1,https://www.reddit.com/r/Fishers/comments/qg9ug1/why_indiana_struggles_to_legalize/,Why Indiana Struggles To Legalize,/r/Fishers/comments/qg9ug1/why_indiana_struggles_to_legalize/hin6jkt/,1,r/Fishers,0,1
"I am aware and have already waitlisted the ones I can, which is why I’m not asking about Marion Co here.",t2_9xlwepsn,amarensta,0,1635383725.0,0,t1_hibor75,hibor75,False,amarensta,t3_qh4jzn,https://www.reddit.com/r/Fishers/comments/qh4jzn/section_42_apartments/,Section 42 Apartments,/r/Fishers/comments/qh4jzn/section_42_apartments/hibor75/,3,r/Fishers,0,3
Marion County has plenty,t2_apm8086n,Doug_Muler42497,1,1635383620.0,0,t1_hiboipj,hiboipj,True,amarensta,t3_qh4jzn,https://www.reddit.com/r/Fishers/comments/qh4jzn/section_42_apartments/,Section 42 Apartments,/r/Fishers/comments/qh4jzn/section_42_apartments/hiboipj/,-2,r/Fishers,0,-2
Cumberland Crossing and Greystone and Noble Manor,t2_cwh6cpmo,Opening-Flower-4892,0,1635382493.0,0,t1_hiblzru,hiblzru,True,amarensta,t3_qh4jzn,https://www.reddit.com/r/Fishers/comments/qh4jzn/section_42_apartments/,Section 42 Apartments,/r/Fishers/comments/qh4jzn/section_42_apartments/hiblzru/,4,r/Fishers,0,4
thats my cat bro,t2_x1rnh,trent999,0,1635374201.0,0,t1_hib3cys,hib3cys,True,Worldly-Ad3907,t3_qe4yt6,https://www.reddit.com/r/Fishers/comments/qe4yt6/running_around_no_collar_sunblest_neighborhood/,Running around no collar. Sunblest neighborhood.,/r/Fishers/comments/qe4yt6/running_around_no_collar_sunblest_neighborhood/hib3cys/,1,r/Fishers,0,1
"No, Section 8 works differently.",t2_9xlwepsn,amarensta,0,1635364809.0,0,t1_hiafqus,hiafqus,False,amarensta,t3_qh4jzn,https://www.reddit.com/r/Fishers/comments/qh4jzn/section_42_apartments/,Section 42 Apartments,/r/Fishers/comments/qh4jzn/section_42_apartments/hiafqus/,3,r/Fishers,0,3
Is that the same as Section 8?,t2_c8ckv,Murmokos,0,1635364768.0,0,t1_hiafn1z,hiafn1z,True,amarensta,t3_qh4jzn,https://www.reddit.com/r/Fishers/comments/qh4jzn/section_42_apartments/,Section 42 Apartments,/r/Fishers/comments/qh4jzn/section_42_apartments/hiafn1z/,1,r/Fishers,0,1
Thanks for the details. This is helpful.,t2_pu878iz,PaxtonsPa,0,1635353616.0,0,t1_hi9mxlc,hi9mxlc,False,PaxtonsPa,t3_qgjci9,https://www.reddit.com/r/Fishers/comments/qgjci9/fishers_childcare_costs/,Fishers Childcare Costs?,/r/Fishers/comments/qgjci9/fishers_childcare_costs/hi9mxlc/,1,r/Fishers,0,1
Child Care is expensive.  350 a week seems low for a newborn for 5 days full time but probably not off by much.  My youngest is 3 so i'm a bit out of the newborn care.  For most of your preschools (3+) you're looking at 300ish a week for full time up to some that will be 600 a week.  I recommend looking at some of the churches rather than some of the bigger names as the churches tend to be cheaper and just as good (IMO).  Good luck either way and congrats!,t2_81yiij8n,nouseridfound1,0,1635351726.0,0,t1_hi9i64d,hi9i64d,True,PaxtonsPa,t3_qgjci9,https://www.reddit.com/r/Fishers/comments/qgjci9/fishers_childcare_costs/,Fishers Childcare Costs?,/r/Fishers/comments/qgjci9/fishers_childcare_costs/hi9i64d/,3,r/Fishers,0,3
Just fill out the form and they will email you the cost. Expect to pay at least 350 for a newborn. Playschool was one of the more affordable options I saw. I think the YMCA has a daycare that is pretty affordable w a family membership too. I ended up opting to work very part time And stay home.,t2_6uhq2,potatoewedges,0,1635302516.0,0,t1_hi77axu,hi77axu,True,PaxtonsPa,t3_qgjci9,https://www.reddit.com/r/Fishers/comments/qgjci9/fishers_childcare_costs/,Fishers Childcare Costs?,/r/Fishers/comments/qgjci9/fishers_childcare_costs/hi77axu/,1,r/Fishers,0,1
Thank you! I’ll have to ask around my neighborhood. All of our neighbors have elementary school aged kids but we haven’t shared the news yet. Thanks for the reply.,t2_pu878iz,PaxtonsPa,0,1635297709.0,0,t1_hi6wrh9,hi6wrh9,False,PaxtonsPa,t3_qgjci9,https://www.reddit.com/r/Fishers/comments/qgjci9/fishers_childcare_costs/,Fishers Childcare Costs?,/r/Fishers/comments/qgjci9/fishers_childcare_costs/hi6wrh9/,2,r/Fishers,0,2
"With an in-home facility—More like $200-250/wk. Congratulations! My theory is they want you to take a tour to size you up and see how much they can get away with charging you. Kinda joking, kinda not. An in-home daycare will be more forthcoming with info, but you have to usually know someone or have a referral to find out about them.",t2_c8ckv,Murmokos,0,1635296944.0,0,t1_hi6v2z9,hi6v2z9,True,PaxtonsPa,t3_qgjci9,https://www.reddit.com/r/Fishers/comments/qgjci9/fishers_childcare_costs/,Fishers Childcare Costs?,/r/Fishers/comments/qgjci9/fishers_childcare_costs/hi6v2z9/,4,r/Fishers,0,4
Thanks for the info.,t2_pu878iz,PaxtonsPa,0,1635294519.0,0,t1_hi6pri6,hi6pri6,False,PaxtonsPa,t3_qgjci9,https://www.reddit.com/r/Fishers/comments/qgjci9/fishers_childcare_costs/,Fishers Childcare Costs?,/r/Fishers/comments/qgjci9/fishers_childcare_costs/hi6pri6/,1,r/Fishers,0,1
For a newborn at a center expect $350+ weekly,t2_6ledqk1j,Beautiful_Ordinary40,0,1635293884.0,0,t1_hi6odcu,hi6odcu,True,PaxtonsPa,t3_qgjci9,https://www.reddit.com/r/Fishers/comments/qgjci9/fishers_childcare_costs/,Fishers Childcare Costs?,/r/Fishers/comments/qgjci9/fishers_childcare_costs/hi6odcu/,4,r/Fishers,0,4
Are they 420 friendly?,t2_8sb8zpqf,Alarming_Jicama2979,0,1635272629.0,0,t1_hi58ujp,hi58ujp,False,Alarming_Jicama2979,t3_qg9ug1,https://www.reddit.com/r/Fishers/comments/qg9ug1/why_indiana_struggles_to_legalize/,Why Indiana Struggles To Legalize,/r/Fishers/comments/qg9ug1/why_indiana_struggles_to_legalize/hi58ujp/,1,r/Fishers,0,1
"Government

* Governor: Eric Holcomb (R)
* Lieutenant Governor: Suzanne Crouch (R)

U.S. senators

* Todd Young (R)
* Mike Braun (R)

U.S. House delegation

* 7 Republicans
* 2 Democrats",t2_96gnw,cjthomp,1,1635266146.0,0,t1_hi4sc50,hi4sc50,True,Alarming_Jicama2979,t3_qg9ug1,https://www.reddit.com/r/Fishers/comments/qg9ug1/why_indiana_struggles_to_legalize/,Why Indiana Struggles To Legalize,/r/Fishers/comments/qg9ug1/why_indiana_struggles_to_legalize/hi4sc50/,1,r/Fishers,0,1
I think it’s a woof,t2_92hag,I_Love_McRibs,0,1635255207.0,0,t1_hi41xei,hi41xei,False,Worldly-Ad3907,t3_qe4yt6,https://www.reddit.com/r/Fishers/comments/qe4yt6/running_around_no_collar_sunblest_neighborhood/,Running around no collar. Sunblest neighborhood.,/r/Fishers/comments/qe4yt6/running_around_no_collar_sunblest_neighborhood/hi41xei/,2,r/Fishers,0,2
"We're on at&t fiber. No problems today.

Every problem we've ever had with it was a cut line in our own back yard.",t2_cg6j1,mnemonicmonkey,0,1635212034.0,0,t1_hi27zsl,hi27zsl,True,doctor-ouz,t3_qfupf8,https://www.reddit.com/r/Fishers/comments/qfupf8/anyone_else_lose_wifi_today/,Anyone else lose WiFi today?,/r/Fishers/comments/qfupf8/anyone_else_lose_wifi_today/hi27zsl/,2,r/Fishers,0,2
Adding you too,t2_5505gs38,doctor-ouz,0,1635209199.0,0,t1_hi21ul6,hi21ul6,False,slothystudios,t3_q9p7b6,https://www.reddit.com/r/Fishers/comments/q9p7b6/pokémon_go/,Pokémon GO,/r/Fishers/comments/q9p7b6/pokémon_go/hi21ul6/,1,r/Fishers,0,1
Smoother rode ways built with rebar and chicken wire and self road anti ice warming pipe under city roads and make new houses better intellagent and insulated walls with free technology and make everyone happy,t2_fu70nlk3,Electrical_While8609,0,1635117443.0,0,t1_hhx7zwf,hhx7zwf,True,SEXKING29,t3_pqatx0,https://www.reddit.com/r/Fishers/comments/pqatx0/people_of_fishers_new_idea/,people of fishers new idea.....,/r/Fishers/comments/pqatx0/people_of_fishers_new_idea/hhx7zwf/,1,r/Fishers,0,1
That's good progress for detailed information,t2_fu70nlk3,Electrical_While8609,0,1635116722.0,0,t1_hhx6iy6,hhx6iy6,True,ironmonkey78,t3_pssyxu,https://www.reddit.com/r/Fishers/comments/pssyxu/interesting_analysis_on_redistricting_maps_for/,Interesting analysis on redistricting maps for Indiana.,/r/Fishers/comments/pssyxu/interesting_analysis_on_redistricting_maps_for/hhx6iy6/,1,r/Fishers,0,1
That is a beautiful dog,t2_foquh4kr,Flat-Tadpole8304,0,1635099211.0,0,t1_hhw156j,hhw156j,True,Worldly-Ad3907,t3_qe4yt6,https://www.reddit.com/r/Fishers/comments/qe4yt6/running_around_no_collar_sunblest_neighborhood/,Running around no collar. Sunblest neighborhood.,/r/Fishers/comments/qe4yt6/running_around_no_collar_sunblest_neighborhood/hhw156j/,1,r/Fishers,0,1
Do you guys have a life and do you have nothing else more to b**** about my gosh go f****** clean your house get your f****** face all the f****** phone,t2_foquh4kr,Flat-Tadpole8304,0,1635098879.0,0,t1_hhw0ajz,hhw0ajz,True,I_Love_McRibs,t3_oec1r2,https://www.reddit.com/r/Fishers/comments/oec1r2/if_youre_making_the_effort_to_actually_drive_to/,"If you’re making the effort to actually drive to the paper recycle bin, please don’t throw non-paper in it. It could have easily been thrown out at your house. (Location- Fishers High School)",/r/Fishers/comments/oec1r2/if_youre_making_the_effort_to_actually_drive_to/hhw0ajz/,1,r/Fishers,0,1
Yea there are trash trucks for that shit,t2_foquh4kr,Flat-Tadpole8304,0,1635098726.0,0,t1_hhvzwit,hhvzwit,True,I_Love_McRibs,t3_oec1r2,https://www.reddit.com/r/Fishers/comments/oec1r2/if_youre_making_the_effort_to_actually_drive_to/,"If you’re making the effort to actually drive to the paper recycle bin, please don’t throw non-paper in it. It could have easily been thrown out at your house. (Location- Fishers High School)",/r/Fishers/comments/oec1r2/if_youre_making_the_effort_to_actually_drive_to/hhvzwit/,0,r/Fishers,0,0
Fertilizer dumb ass,t2_foquh4kr,Flat-Tadpole8304,0,1635098659.0,0,t1_hhvzqe3,hhvzqe3,True,b33flu,t3_oqtt55,https://www.reddit.com/r/Fishers/comments/oqtt55/these_are_real_huh/,These are real? Huh.,/r/Fishers/comments/oqtt55/these_are_real_huh/hhvzqe3/,0,r/Fishers,0,0
Sylvia on 16 and Irvington av,t2_foquh4kr,Flat-Tadpole8304,0,1635098474.0,0,t1_hhvz9it,hhvz9it,True,[deleted],t3_oweqpz,https://www.reddit.com/r/Fishers/comments/oweqpz/wheres_the_best_salon_to_get_hair_color/,Where's the best salon to get hair color?,/r/Fishers/comments/oweqpz/wheres_the_best_salon_to_get_hair_color/hhvz9it/,0,r/Fishers,0,0
It’s very clearly a wolf,t2_4hjvj,mysoulishome,0,1635045653.0,0,t1_hhtja35,hhtja35,False,Worldly-Ad3907,t3_qe4yt6,https://www.reddit.com/r/Fishers/comments/qe4yt6/running_around_no_collar_sunblest_neighborhood/,Running around no collar. Sunblest neighborhood.,/r/Fishers/comments/qe4yt6/running_around_no_collar_sunblest_neighborhood/hhtja35/,1,r/Fishers,0,1
Moved form uVerse & love it.  Great bandwidth for the money.,t2_rxw4z,IndyScan,0,1635021680.0,0,t1_hhs4ylp,hhs4ylp,True,Impossible_Ad3939,t3_qdh9sc,https://www.reddit.com/r/Fishers/comments/qdh9sc/metronet_vs_xfinity/,Metronet Vs Xfinity,/r/Fishers/comments/qdh9sc/metronet_vs_xfinity/hhs4ylp/,1,r/Fishers,0,1
Update. I was just driving home from Home Depot and saw the pup enjoying a car ride.,t2_b0ijx9jp,Worldly-Ad3907,0,1635019503.0,0,t1_hhs01zn,hhs01zn,True,Worldly-Ad3907,t3_qe4yt6,https://www.reddit.com/r/Fishers/comments/qe4yt6/running_around_no_collar_sunblest_neighborhood/,Running around no collar. Sunblest neighborhood.,/r/Fishers/comments/qe4yt6/running_around_no_collar_sunblest_neighborhood/hhs01zn/,1,r/Fishers,0,1
That’s a German Shepard it belongs to the brick house right beside the house where this picture was taken. It is always running around loose.,t2_6hj9rmvw,ResonantBanjo,0,1635009150.0,0,t1_hhrcsju,hhrcsju,True,Worldly-Ad3907,t3_qe4yt6,https://www.reddit.com/r/Fishers/comments/qe4yt6/running_around_no_collar_sunblest_neighborhood/,Running around no collar. Sunblest neighborhood.,/r/Fishers/comments/qe4yt6/running_around_no_collar_sunblest_neighborhood/hhrcsju/,3,r/Fishers,0,3
that might be a coyote.,t2_3j09rmtx,pnutjam,0,1635002741.0,0,t1_hhqyzvp,hhqyzvp,True,Worldly-Ad3907,t3_qe4yt6,https://www.reddit.com/r/Fishers/comments/qe4yt6/running_around_no_collar_sunblest_neighborhood/,Running around no collar. Sunblest neighborhood.,/r/Fishers/comments/qe4yt6/running_around_no_collar_sunblest_neighborhood/hhqyzvp/,-3,r/Fishers,0,-3
POS cops like that give the rest a horrendous name especially if they participate in illegal government run programs etc..,t2_fke6uzgv,Chicken_Tenders447,0,1634969179.0,0,t1_hhpqnxn,hhpqnxn,True,[deleted],t3_q7dee6,https://www.reddit.com/r/Fishers/comments/q7dee6/deleted_by_user/,[deleted by user],/r/Fishers/comments/q7dee6/deleted_by_user/hhpqnxn/,1,r/Fishers,0,1
"Metronet is not perfect, but they are SO much better than Comcast/Xfinity.  I am the definition of a painful customer to have - I demand consistent speeds, ping and connectivity, and I complain and tear up companies on social media if they aren't responsive.  Metronet has been well worth it.",t2_31yew,techtoy,0,1634936461.0,0,t1_hho2n4p,hho2n4p,True,Impossible_Ad3939,t3_qdh9sc,https://www.reddit.com/r/Fishers/comments/qdh9sc/metronet_vs_xfinity/,Metronet Vs Xfinity,/r/Fishers/comments/qdh9sc/metronet_vs_xfinity/hho2n4p/,1,r/Fishers,0,1
"Just to add. 

We have the  megabit service. At the night of lockdown last year, we had 5 kids and some times 4 adults all on and off video calls, streaming, playing games with no  noticeable slow downs. 

We have an eero pro and 3 becons for home network.",t2_4ipwa,thesupermikey,0,1634921228.0,0,t1_hhn1qmg,hhn1qmg,True,Impossible_Ad3939,t3_qdh9sc,https://www.reddit.com/r/Fishers/comments/qdh9sc/metronet_vs_xfinity/,Metronet Vs Xfinity,/r/Fishers/comments/qdh9sc/metronet_vs_xfinity/hhn1qmg/,3,r/Fishers,0,3
"Had Metronet for a little over 2 years now.  There have been 2 outages (that weren’t scheduled maintenance) in that time.  And service was restored in under 2 hours.

I have gigabit service, and see those speeds routinely.  You’re behind a CGNAT, so if you want to run services or otherwise have an internet reachable IP address, you’ll have to pay for a dedicated IP.  Congestion is occasionally an issue, but even at its worst, I still see speeds 700-800mbit.",t2_d7xgr,realrkennedy,0,1634917723.0,0,t1_hhmt265,hhmt265,True,Impossible_Ad3939,t3_qdh9sc,https://www.reddit.com/r/Fishers/comments/qdh9sc/metronet_vs_xfinity/,Metronet Vs Xfinity,/r/Fishers/comments/qdh9sc/metronet_vs_xfinity/hhmt265/,2,r/Fishers,0,2
I love Metronet. We’ve had it for a couple years now as long as we’ve been able. We did not want to give more money to Comcast a day longer than necessary.,t2_c8ckv,Murmokos,0,1634917032.0,0,t1_hhmrclo,hhmrclo,True,Impossible_Ad3939,t3_qdh9sc,https://www.reddit.com/r/Fishers/comments/qdh9sc/metronet_vs_xfinity/,Metronet Vs Xfinity,/r/Fishers/comments/qdh9sc/metronet_vs_xfinity/hhmrclo/,6,r/Fishers,0,6
Metronet is awesome,t2_5it4z,Bauggh,0,1634913546.0,0,t1_hhmipzq,hhmipzq,True,Impossible_Ad3939,t3_qdh9sc,https://www.reddit.com/r/Fishers/comments/qdh9sc/metronet_vs_xfinity/,Metronet Vs Xfinity,/r/Fishers/comments/qdh9sc/metronet_vs_xfinity/hhmipzq/,5,r/Fishers,0,5
"MetroNet is great.

The only time I have ever had a problem was when a Comcast contractor working at my neighbor's cut the line from the box to my house.",t2_4ipwa,thesupermikey,0,1634913182.0,0,t1_hhmhtcl,hhmhtcl,True,Impossible_Ad3939,t3_qdh9sc,https://www.reddit.com/r/Fishers/comments/qdh9sc/metronet_vs_xfinity/,Metronet Vs Xfinity,/r/Fishers/comments/qdh9sc/metronet_vs_xfinity/hhmhtcl/,5,r/Fishers,0,5
"I switched to metro net. If you switch have sure to do paperless billing or they charge you every month for it. There's a technical fee every month which is meant to pay for any visit or changes to you wiring. I actually moved all my stuff to another room and called them to come and remove all the wire in the ground and re dig the line to a new area and it was all covered under the $fee you pay a month. The speed is usually sitting at 400-500mpbs consistently. The customer service is good. I am glad I made the switch, faster internet for a cheaper price. Nothing is perfect but they're not bad. Better than comcast for sure.",t2_9mdue,lilman21,0,1634911503.0,0,t1_hhmdr83,hhmdr83,True,Impossible_Ad3939,t3_qdh9sc,https://www.reddit.com/r/Fishers/comments/qdh9sc/metronet_vs_xfinity/,Metronet Vs Xfinity,/r/Fishers/comments/qdh9sc/metronet_vs_xfinity/hhmdr83/,11,r/Fishers,0,11
"I recently switched to MetroNet from Comcast (Xfinity). I had the 150Mbps from Comcast and have the 500Mbps from MetroNet.

I'm in an area just south of 96th St that got MetroNet earlier this year.

I already had my own hardware, all Gigabit.

The switch was easy, there were some hiccups with getting my install scheduled but once I called them about it they got it resolved pretty quick. I was one of the first people on my street to get MetroNet so some stuff apparently wasn't setup in the area and that was my delay.

Once the install people came out I had MetroNet is less than 3 hours and some folks came by to bury the cable about a week later.

Speeds are far better, it's also 500Mbps up and down where I had about 150Mbps down and 20Mbps up.

As far as service issues, there was one outage their site said was fixed but was still ongoing for me. I called their tech support and the person confirmed right there on the phone he saw the issue still going on for me. He couldn't give me an ETA on a fix, but it ended up being about 2 hours.

Their support team are all based in the US as far as I know and have been helpful the few times I have called.

I only have internet service, nothing else.",t2_imhk6,jb88373,0,1634911257.0,0,t1_hhmd62d,hhmd62d,True,Impossible_Ad3939,t3_qdh9sc,https://www.reddit.com/r/Fishers/comments/qdh9sc/metronet_vs_xfinity/,Metronet Vs Xfinity,/r/Fishers/comments/qdh9sc/metronet_vs_xfinity/hhmd62d/,6,r/Fishers,0,6
It isn't 👍🏻 we're trying this weird thing where we actually put good coffee in our drinks instead of trying to hide crappy coffee under a bunch of artificial flavorings and overly scalded milk,t2_5di1bel2,PhilOfTheRightNow,0,1634828137.0,0,t1_hhhwvvu,hhhwvvu,False,[deleted],t3_qc6gjj,https://www.reddit.com/r/Fishers/comments/qc6gjj/deleted_by_user/,[deleted by user],/r/Fishers/comments/qc6gjj/deleted_by_user/hhhwvvu/,1,r/Fishers,0,1
Thanks! We do our best,t2_5di1bel2,PhilOfTheRightNow,0,1634828086.0,0,t1_hhhwrkc,hhhwrkc,False,[deleted],t3_qc6gjj,https://www.reddit.com/r/Fishers/comments/qc6gjj/deleted_by_user/,[deleted by user],/r/Fishers/comments/qc6gjj/deleted_by_user/hhhwrkc/,1,r/Fishers,0,1
"Seconding this, the coffee there is fantastic",t2_2nti5vky,GeeseEnPointe,0,1634791766.0,0,t1_hhgfmea,hhgfmea,False,[deleted],t3_qc6gjj,https://www.reddit.com/r/Fishers/comments/qc6gjj/deleted_by_user/,[deleted by user],/r/Fishers/comments/qc6gjj/deleted_by_user/hhgfmea/,1,r/Fishers,0,1
"And... it doesn't taste burnt, like SB",t2_a6cm5,Ron_Swansons_wood,0,1634776588.0,0,t1_hhflmv4,hhflmv4,False,[deleted],t3_qc6gjj,https://www.reddit.com/r/Fishers/comments/qc6gjj/deleted_by_user/,[deleted by user],/r/Fishers/comments/qc6gjj/deleted_by_user/hhflmv4/,5,r/Fishers,0,5
"Not to totally be an opportunist about it, but The Well Coffeeshop in Fishers is still open till 4:00 everyday and we have something for everybody. We have the sweet frou frou drinks (yes pumpkin spice too), traditional espresso drinks, single origin pour overs, and good old diner style drip coffee. We use high quality coffee, housemade syrups, and we take pride in our craft! We're also a nonprofit that donates to water projects across the world, so your money is *well* spent!",t2_5di1bel2,PhilOfTheRightNow,0,1634765968.0,0,t1_hhey4cc,hhey4cc,True,[deleted],t3_qc6gjj,https://www.reddit.com/r/Fishers/comments/qc6gjj/deleted_by_user/,[deleted by user],/r/Fishers/comments/qc6gjj/deleted_by_user/hhey4cc/,18,r/Fishers,0,18
Staffing has been the biggest issue with Starbucks in the area but they’re also encountering some items missing.,t2_ob4sgka,t67443,0,1634761863.0,0,t1_hhenzzf,hhenzzf,True,[deleted],t3_qc6gjj,https://www.reddit.com/r/Fishers/comments/qc6gjj/deleted_by_user/,[deleted by user],/r/Fishers/comments/qc6gjj/deleted_by_user/hhenzzf/,1,r/Fishers,0,1
The one at 116th and 69 has been closing early due to staffing.  They have several new employees in training so hopefully will be back to normal hours soon,t2_mmv96,Dietcokeofevil73,0,1634757011.0,0,t1_hhebmh6,hhebmh6,True,[deleted],t3_qc6gjj,https://www.reddit.com/r/Fishers/comments/qc6gjj/deleted_by_user/,[deleted by user],/r/Fishers/comments/qc6gjj/deleted_by_user/hhebmh6/,1,r/Fishers,0,1
I think it's a staffing issue. The one off allisonville is only drive through but doesn't look like anything is happening in the lobby. At least from what I see when in line.,t2_cageu,yro23323,0,1634755469.0,0,t1_hhe7s9e,hhe7s9e,True,[deleted],t3_qc6gjj,https://www.reddit.com/r/Fishers/comments/qc6gjj/deleted_by_user/,[deleted by user],/r/Fishers/comments/qc6gjj/deleted_by_user/hhe7s9e/,2,r/Fishers,0,2
"It's happening on the southside as well. 

&#x200B;

Wondering if it's lack of staff or business.",t2_1rz7mnid,crunchbum,0,1634752656.0,0,t1_hhe0sqj,hhe0sqj,True,[deleted],t3_qc6gjj,https://www.reddit.com/r/Fishers/comments/qc6gjj/deleted_by_user/,[deleted by user],/r/Fishers/comments/qc6gjj/deleted_by_user/hhe0sqj/,1,r/Fishers,0,1
I've been wondering the same thing. The Starbucks in Fishers Gateway is closed on Mondays now.,t2_kcjz9,sd_glokta,0,1634752191.0,0,t1_hhdzmhv,hhdzmhv,True,[deleted],t3_qc6gjj,https://www.reddit.com/r/Fishers/comments/qc6gjj/deleted_by_user/,[deleted by user],/r/Fishers/comments/qc6gjj/deleted_by_user/hhdzmhv/,3,r/Fishers,0,3
"Downtown Fishers has a lot of people playing during community days and other in-game events.

There is an Indianapolis [discord group](https://discord.gg/yZm6uDhXKC) you can get friend codes at and talk to other local players.",t2_8slpp,Kangaroo-,0,1634587399.0,0,t1_hh5dow6,hh5dow6,True,slothystudios,t3_q9p7b6,https://www.reddit.com/r/Fishers/comments/q9p7b6/pokémon_go/,Pokémon GO,/r/Fishers/comments/q9p7b6/pokémon_go/hh5dow6/,2,r/Fishers,0,2
7090 6662 5872,t2_6eey3et6,slothystudios,0,1634574718.0,0,t1_hh4ipyp,hh4ipyp,False,slothystudios,t3_q9p7b6,https://www.reddit.com/r/Fishers/comments/q9p7b6/pokémon_go/,Pokémon GO,/r/Fishers/comments/q9p7b6/pokémon_go/hh4ipyp/,2,r/Fishers,0,2
Send me your friend code and I’ll add you!,t2_9lri3hqu,What_A_Dork,0,1634574683.0,0,t1_hh4imzf,hh4imzf,True,slothystudios,t3_q9p7b6,https://www.reddit.com/r/Fishers/comments/q9p7b6/pokémon_go/,Pokémon GO,/r/Fishers/comments/q9p7b6/pokémon_go/hh4imzf/,1,r/Fishers,0,1
"Take it to Tiffanys Lawn and Garden in Noblesville. Its free to dump yard waste there. Just check-in at the trailer/office and they will tell you where to put it. Be sure to call first because I believe its seasonal and I do not know when they stop. Also, if you don't own a truck to haul it, pick one up cheap at Menards, Home Depot or uHaul.",t2_hcsqs,KW1Z,0,1634567662.0,0,t1_hh423g0,hh423g0,True,RealMoonBoy,t3_qa76o4,https://www.reddit.com/r/Fishers/comments/qa76o4/yard_waste_disposal/,Yard waste disposal,/r/Fishers/comments/qa76o4/yard_waste_disposal/hh423g0/,1,r/Fishers,0,1
