body,author_fullname,author.name,controversiality,created,downs,fullname,id,is_root,link_author,link_id,link_permalink,link_title,permalink,score,subreddit_name_prefixed,total_awards_received,ups
es arī :D,t2_6apxote3,quod_tenToria,0,1648110192.0,0,t1_i1wnlnx,i1wnlnx,False,ilikecartoonwomen,t3_k00ujg,https://www.reddit.com/r/livonia/comments/k00ujg/reddit_is_confused_about_livonia/,Reddit is confused about Livonia?,/r/livonia/comments/k00ujg/reddit_is_confused_about_livonia/i1wnlnx/,1,r/livonia,0,1
I stayed at Deerfield woods for a few months when our house was being built and it was decent. It’s at 7 and Farmington so you are only a couple miles away.  If you want to be a little closer to a downtown area look in Farmington which still puts you within 15 min of work.,t2_doenr0,1995droptopz,0,1648067418.0,0,t1_i1ucrbz,i1ucrbz,True,johnfred4,t3_tkv570,https://www.reddit.com/r/livonia/comments/tkv570/moving_to_livonia_recommendations_near_st_mary/,Moving to Livonia; recommendations near St. Mary Mercy Hospital?,/r/livonia/comments/tkv570/moving_to_livonia_recommendations_near_st_mary/i1ucrbz/,1,r/livonia,0,1
"Plymouth Heritage Apartments in Plymouth runs about $1100 for a 1br. I used to live in livonia so I would say easily 10-15 min drive in the mornings, maybe 20 to get home. The apartments are about a 2 minute drive from downtown Plymouth too, a really nice area to do things.",t2_4oqc45rk,strwbrryc0w,0,1648059210.0,0,t1_i1tr91t,i1tr91t,True,johnfred4,t3_tkv570,https://www.reddit.com/r/livonia/comments/tkv570/moving_to_livonia_recommendations_near_st_mary/,Moving to Livonia; recommendations near St. Mary Mercy Hospital?,/r/livonia/comments/tkv570/moving_to_livonia_recommendations_near_st_mary/i1tr91t/,1,r/livonia,0,1
"Some brand new appartments just opened not far from there on Haggerty, south of 8 mile. They are called Liv livonia. Can't speak to pricing or quality I just know they look nice when I am waiting in line at the costco gas station next door.

https://www.livlivonia.com/",t2_100k6c,popedumich,0,1648052377.0,0,t1_i1t8tzx,i1t8tzx,True,johnfred4,t3_tkv570,https://www.reddit.com/r/livonia/comments/tkv570/moving_to_livonia_recommendations_near_st_mary/,Moving to Livonia; recommendations near St. Mary Mercy Hospital?,/r/livonia/comments/tkv570/moving_to_livonia_recommendations_near_st_mary/i1t8tzx/,2,r/livonia,0,2
"Couple options: Livonia is limited on apartments but is surrounded by Cities who have lots of apartments, all of which are within your driving parameter:

5 Mile/E of Middlebelt - Franklin Sq $800+ (Livonia)

Merriman/S of Joy Rd. - Hawthorne Club $800+ (Westland)

Ann Arbor Trail/AA Road - Arbor Woods $1,040+ (Plymouth)

Plymouth Rd/W of I-275 - Plymouth Woods $1,295+ (Plymouth)

Schoolcraft & M14 - Princeton Court Apts $775+ (Plymouth)

St. Mary's is within a 15 minute drive to Plymouth, Westland, Northville, Farmington Hills.  Very accessible to lots of restaurants, grocery stores, etc.  Easy to get around and many things to do. Hines Park is awesome with lakes and trails; bikes only on Saturday's during the summer. Plymouth & Northville are quaint old towns, parking is a pain though. Just had my daughter in SM Psych ER a week ago (again).  Everyone there is so nice.  Good luck with your move.",t2_178969,smutmuffin1978,0,1648050675.0,0,t1_i1t4bbi,i1t4bbi,True,johnfred4,t3_tkv570,https://www.reddit.com/r/livonia/comments/tkv570/moving_to_livonia_recommendations_near_st_mary/,Moving to Livonia; recommendations near St. Mary Mercy Hospital?,/r/livonia/comments/tkv570/moving_to_livonia_recommendations_near_st_mary/i1t4bbi/,4,r/livonia,0,4
"Cruz Clinic has both and I would definitely recommend going there.They have offices in Livonia and Ann Arbor, and do telehealth appointments.",t2_8ian0xy,cthulhukiss,0,1647208363.0,0,t1_i0jj8w1,i0jj8w1,True,Claytonius_Funk,t3_sh2dmb,https://www.reddit.com/r/livonia/comments/sh2dmb/any_recommendations_for_psychiatrists/,Any recommendations for psychiatrists / psychologists in the area?,/r/livonia/comments/sh2dmb/any_recommendations_for_psychiatrists/i0jj8w1/,1,r/livonia,0,1
I'm curious to see what goes in there.,t2_7qdyuug4,AbibliophobicSloth,0,1647189732.0,0,t1_i0ibbrg,i0ibbrg,True,SupremoZanne,t3_td9koc,https://www.reddit.com/r/livonia/comments/td9koc/montgomery_ward_wards_at_the_livonia_mall_in_1964/,"Montgomery Ward (Wards) at the Livonia Mall in 1964, became Sears later on, now Sears is gone too!",/r/livonia/comments/td9koc/montgomery_ward_wards_at_the_livonia_mall_in_1964/i0ibbrg/,2,r/livonia,0,2
"You asked about the most generic two desserts, that I've seen almost in every corner cafe.😅 Your best bet of finding the one with berries and fruits is to go to ""Mārtiņa Beķereja"" or, if you want a more luxurious experience go to ""Lage"".👍",t2_5lpzth6a,hariboberts,0,1646805654.0,0,t1_hzxw0hw,hzxw0hw,True,[deleted],t3_t9rjjt,https://www.reddit.com/r/livonia/comments/t9rjjt/can_anyone_help_me_out_i_got_these_a_while_ago/,Can anyone help me out? I got these a while ago and don’t remember where I got them! And they sound so good right now!,/r/livonia/comments/t9rjjt/can_anyone_help_me_out_i_got_these_a_while_ago/hzxw0hw/,2,r/livonia,0,2
"I used to see Dr Donat, who was out of Beaumont, but most of his offices are in Macomb county I believe. He may still have an office in Rochester",t2_9qvqhtdt,ccsteph_1,0,1646775088.0,0,t1_hzw39el,hzw39el,True,stop_making_sense,t3_t95bva,https://www.reddit.com/r/livonia/comments/t95bva/crosspost_from_rdetroit_gastroenterologists_to/,crosspost from r/Detroit: Gastroenterologists to recommend or to avoid in Oakland County?,/r/livonia/comments/t95bva/crosspost_from_rdetroit_gastroenterologists_to/hzw39el/,2,r/livonia,0,2
"I'll repost what I posted over in r/Detroit

So, we (white guy, Japanese wife and 6 year old daughter) bought a housein Livonia in summer 2020 after moving from out of state in 2019 (Werented for a year in Farmington). Livonia was not our first choice - welooked hard at Farmington Hills, Novi and Berkley but couldn't findanything in our price range or were outbid when putting in offers. Aftera few months of not finding a place we decided to give Livonia a secondlook and settled in on the 6 mile area between Farmington Rd andNewburgh Rd. We love this area. Excellent access to Detroit and AnnArbor, plus my wife and I both work in Novi. Schools in Livonia aresolid (underrated I'd argue), it's quite safe and becoming more diverse(albeit slowly). We really like living off 6 mile and having quickaccess to Northville and Novi as well. We were a bit hesitant to move atfirst due to the history of racism and lack of diversity, but afterliving here it's nice to be a part of a changing Livonia. I feel likethings are trending in the right direction here.",t2_178fcx,willisread,0,1645320312.0,0,t1_hxneglf,hxneglf,True,Nastradamus12,t3_svw7d5,https://www.reddit.com/r/livonia/comments/svw7d5/buying_a_house_in_livonia/,Buying a House in Livonia,/r/livonia/comments/svw7d5/buying_a_house_in_livonia/hxneglf/,2,r/livonia,0,2
"Yes, it's racist. The city is over 90% white, but in 2020 data came out that is publicly available that around half of LPD's traffic stops were made against nonwhites. 

I've grew up both in and around Livonia and live here currently. It is changing. Slowly. But ive been called everyword under the son here as a kid. As an adult I've had offhanded rascist remakes made against me and my family. Rascist notes left by former neighbors, people mean mugging me at the park with my son. Outside of incidents in highschool I've never felt like I was going to be assaulted or lynched or anything. 

I don't spend enough time in Novi to say anything about it racially. People saying move to northville are basing this I think solely on crime stats. Northville is VERY rascist. The flavor is just different. NPD, while I haven't seen the stats, I'm sure based on my experience is just as if not more rascist than LPD. You're paying fat premium for your racism in Northville as well. 

In my decades of life experience you don't really get to move away from rascism, you just change the flavor. 



All that said I live in Livonia, on the south end. I have good relationships with all of my current neighbors. My street is becoming more diverse with younger people moving in.  most older people around me ,while they've said ignorant thing's, aren't actively malicious, but more the ""I know who you voted for type."" They are nice enough and have even have gone out of there way to buy special gifts specifically for my kids on Halloween during trick r treating.

East end of Livonia isn't what it was but it's not a slum by any means. I'm happy to answer anything more specific.",t2_njv2m,Uneasy_Half-Literate,0,1645269045.0,0,t1_hxkdodl,hxkdodl,True,Nastradamus12,t3_svw7d5,https://www.reddit.com/r/livonia/comments/svw7d5/buying_a_house_in_livonia/,Buying a House in Livonia,/r/livonia/comments/svw7d5/buying_a_house_in_livonia/hxkdodl/,2,r/livonia,0,2
"Hi so currently a Livonia resident for 2 years now. We moved here because this is the area my boyfriend wanted to be. Let me tell you this man does his research. He does say to move a bit farther west if you can because where you are looking at isn’t the best area if only do to that area being close to Redford and he says you don’t want to be there because crime is worse the closer to Redford you get.

I (and my boyfriend) are both curious about the others that posted here about Livonia being openly racist, as neither of us really see any racism. The store I frequent is full of all kinds of different ethnicities.and I’ve never heard or seen any form of racism. I admit sometimes I’m pretty oblivious to things around me. That’s why I asked my boyfriend if he’s ever felt like he wasn’t welcome here. If you haven’t guessed it he is a black man. I wondered if he felt our neighbors didn’t welcome him or if he felt he was ever followed in a store either with me or without. He said no he didn’t and didn’t feel our neighbors are racist either. He says yes Livonia has ties to racism in its past, but it’s changed in the last few decades.
He also adds if you can afford it and want to be nearer to people of Asian background Novi is a good choice but it is more expensive.",t2_j30sx,Auradria,0,1645254362.0,0,t1_hxjvl0b,hxjvl0b,True,Nastradamus12,t3_svw7d5,https://www.reddit.com/r/livonia/comments/svw7d5/buying_a_house_in_livonia/,Buying a House in Livonia,/r/livonia/comments/svw7d5/buying_a_house_in_livonia/hxjvl0b/,2,r/livonia,0,2
"I can only repeat what the other two have said, it's been 16 years since I lived in Livonia but I'm still in the area and it has only gotten worse.  

Back then people weren't openly racist, but the kids in schools proved that most parents were racist at home.  

There are new subdivisions going up in better cities, Northfield, Novi, and Canton come to mind.",t2_4svlt,popups4life,0,1645248184.0,0,t1_hxjmj94,hxjmj94,True,Nastradamus12,t3_svw7d5,https://www.reddit.com/r/livonia/comments/svw7d5/buying_a_house_in_livonia/,Buying a House in Livonia,/r/livonia/comments/svw7d5/buying_a_house_in_livonia/hxjmj94/,3,r/livonia,0,3
"I’m a Chinese person who grew up in Livonia and went to Livonia Public Schools, many folks are openly racist and I encountered it during school a lot. I think a bigger Asian presence here would be appreciated but it’s going to be a few more decades until these problems improve.

Consider Novi or Northville if it’s not too far.

I don’t know if it’s changed that much since I graduated, which was appropriately 7 years ago but people are still saying some of the most insane things in public forums like the local Facebook groups and Nextdoor.

Feel free to message me or ask me more questions if you have any concerns.",t2_52n5a,Reppoy,0,1645244354.0,0,t1_hxjfyom,hxjfyom,True,Nastradamus12,t3_svw7d5,https://www.reddit.com/r/livonia/comments/svw7d5/buying_a_house_in_livonia/,Buying a House in Livonia,/r/livonia/comments/svw7d5/buying_a_house_in_livonia/hxjfyom/,5,r/livonia,0,5
"I haven’t been over in that area of Livonia in a while, but it’s not the nicest side of Livonia. That said, no matter what section in Livonia you’re in, you’re right that it’s pretty racist. I would have argued that fact a couple of years ago, but the past couple of years people haven’t exactly been shy about showing their true colors. It’s been a super big disappointment. Also, while your child has a little ways to go before you start thinking of school, if you’re going to choose public, I’d choose somewhere else. I don’t know what the heck happened, but I am very unhappy with how downhill LPS has gone in the past decade. I’ll be thrilled once my kid has graduated. I love the tiny village we’ve created, and my child has certainly thrived, but I credit that more to the people we choose to allow into our lives and his strength than to the city and district as a whole. My opinion, look elsewhere. You’ll be much happier in the long run, I think - and it really breaks my heart to say so, because I’ve lived here for most of my life. 

On the other hand, because it used to be a placed I loved so much, I desperately wish more diverse people moved in, and change was forced upon the racist twats. But that’s an exhausting life to live, and an awful lot to put onto people.",t2_15pgy3,JaJaJaJaded3806,0,1645238328.0,0,t1_hxj4be3,hxj4be3,True,Nastradamus12,t3_svw7d5,https://www.reddit.com/r/livonia/comments/svw7d5/buying_a_house_in_livonia/,Buying a House in Livonia,/r/livonia/comments/svw7d5/buying_a_house_in_livonia/hxj4be3/,2,r/livonia,0,2
"City in Michigan, even though reddit literally says communities near you and im Latvian",t2_2vj6alui,Latvian_playz,0,1644846799.0,0,t1_hwwping,hwwping,False,StonkStoic,t3_nwpxm7,https://www.reddit.com/r/livonia/comments/nwpxm7/this_is_latgalian_subreddit_now/,This is Latgalian subreddit now!,/r/livonia/comments/nwpxm7/this_is_latgalian_subreddit_now/hwwping/,2,r/livonia,0,2
"Fuck I legit thought this sub section is about the one true Livonia. The Livonian order. 

Disappointing",t2_gpzkxnfj,Suitable-Presence-92,0,1644520446.0,0,t1_hweltow,hweltow,True,CallMeB30,t3_sn9zyw,https://www.reddit.com/r/livonia/comments/sn9zyw/possibly_moving_to_livonia/,Possibly moving to Livonia,/r/livonia/comments/sn9zyw/possibly_moving_to_livonia/hweltow/,1,r/livonia,0,1
Stupid,t2_9c1ltea5,Stretch_Round,0,1644514636.0,0,t1_hwe5thm,hwe5thm,True,Toukaloop,t3_s87axa,https://www.reddit.com/r/livonia/comments/s87axa/combat_archery_coming_to_livonia/,Combat Archery Coming to Livonia!,/r/livonia/comments/s87axa/combat_archery_coming_to_livonia/hwe5thm/,1,r/livonia,0,1
"Dropped Spectrum because of the service interruptions and went to WoW, dropped WoW because of data caps, went back to spectrum, went back to WoW after less that a week.

That should tell you everything you need to know.",t2_6sg0x,jestr6,0,1644381337.0,0,t1_hw6n9uq,hw6n9uq,True,[deleted],t3_si6sv2,https://www.reddit.com/r/livonia/comments/si6sv2/spectrum_wifi_any_good_in_livonia/,Spectrum WiFi any good in Livonia ?,/r/livonia/comments/si6sv2/spectrum_wifi_any_good_in_livonia/hw6n9uq/,1,r/livonia,0,1
I’m not surprised 🥲 they’re going up here as well because of the ridiculous school bond they passed. (Taylor),t2_702eiyji,CallMeB30,0,1644347040.0,0,t1_hw4af77,hw4af77,False,CallMeB30,t3_sn9zyw,https://www.reddit.com/r/livonia/comments/sn9zyw/possibly_moving_to_livonia/,Possibly moving to Livonia,/r/livonia/comments/sn9zyw/possibly_moving_to_livonia/hw4af77/,1,r/livonia,0,1
Taxes going up!,t2_2n0wkne,AtomicCo,0,1644346918.0,0,t1_hw4a363,hw4a363,True,CallMeB30,t3_sn9zyw,https://www.reddit.com/r/livonia/comments/sn9zyw/possibly_moving_to_livonia/,Possibly moving to Livonia,/r/livonia/comments/sn9zyw/possibly_moving_to_livonia/hw4a363/,1,r/livonia,0,1
Water bill has a fixed rate of just under $70. Our average is about $150 every 3 months for a family of 3. Half our bill is the fixed rate and the other half is what we use.,t2_lcb9q,KaptainKinns,0,1644321035.0,0,t1_hw2kp70,hw2kp70,True,CallMeB30,t3_sn9zyw,https://www.reddit.com/r/livonia/comments/sn9zyw/possibly_moving_to_livonia/,Possibly moving to Livonia,/r/livonia/comments/sn9zyw/possibly_moving_to_livonia/hw2kp70/,3,r/livonia,0,3
They have some of the lowest taxes? 😳 i had no idea. I used to live out there for awhile with my family and loved the area! I would love to make my own family (kids) out there.,t2_702eiyji,CallMeB30,0,1644295347.0,0,t1_hw1kgwx,hw1kgwx,False,CallMeB30,t3_sn9zyw,https://www.reddit.com/r/livonia/comments/sn9zyw/possibly_moving_to_livonia/,Possibly moving to Livonia,/r/livonia/comments/sn9zyw/possibly_moving_to_livonia/hw1kgwx/,1,r/livonia,0,1
Great place to raise a family.  Big suburb with a small city feel.  Lowest taxes in Wayne County outside of Romulus.,t2_5d2jw,capndetroit,0,1644294970.0,0,t1_hw1jqd3,hw1jqd3,True,CallMeB30,t3_sn9zyw,https://www.reddit.com/r/livonia/comments/sn9zyw/possibly_moving_to_livonia/,Possibly moving to Livonia,/r/livonia/comments/sn9zyw/possibly_moving_to_livonia/hw1jqd3/,2,r/livonia,0,2
I will never use spectrum. I have Wow and one time a Spectrum van parked at my neighbors house and went around back to my house and cut the cable for my internet. I had to pay Wow to come out and fix it.,t2_7mrzs,Dolamite,0,1643834631.0,0,t1_hvbq12d,hvbq12d,True,[deleted],t3_si6sv2,https://www.reddit.com/r/livonia/comments/si6sv2/spectrum_wifi_any_good_in_livonia/,Spectrum WiFi any good in Livonia ?,/r/livonia/comments/si6sv2/spectrum_wifi_any_good_in_livonia/hvbq12d/,1,r/livonia,0,1
"I was just talking to a therapist friend of mine about finding a therapist, and he recommended using https://www.psychologytoday.com/us. Apparently most mental health professionals are on there and they have profiles you can read which really help with finding a good fit for you.",t2_5bnja,TheBizness,0,1643833558.0,0,t1_hvbn3xn,hvbn3xn,True,Claytonius_Funk,t3_sh2dmb,https://www.reddit.com/r/livonia/comments/sh2dmb/any_recommendations_for_psychiatrists/,Any recommendations for psychiatrists / psychologists in the area?,/r/livonia/comments/sh2dmb/any_recommendations_for_psychiatrists/hvbn3xn/,1,r/livonia,0,1
"I have WOW and it's been pretty spotty for the last few weeks, but I've been thinking of switching anyway. Most providers have introductory prices that are much cheaper for the first year or two so it just makes sense to switch every so often.",t2_5bnja,TheBizness,0,1643833339.0,0,t1_hvbmj0k,hvbmj0k,True,[deleted],t3_si6sv2,https://www.reddit.com/r/livonia/comments/si6sv2/spectrum_wifi_any_good_in_livonia/,Spectrum WiFi any good in Livonia ?,/r/livonia/comments/si6sv2/spectrum_wifi_any_good_in_livonia/hvbmj0k/,2,r/livonia,0,2
Where do you live and how far can you travel?  I love my Psychiatrist but he is in Livonia.,t2_9mwq0,sassyprofessor,0,1643679437.0,0,t1_hv2pcg0,hv2pcg0,True,Claytonius_Funk,t3_sh2dmb,https://www.reddit.com/r/livonia/comments/sh2dmb/any_recommendations_for_psychiatrists/,Any recommendations for psychiatrists / psychologists in the area?,/r/livonia/comments/sh2dmb/any_recommendations_for_psychiatrists/hv2pcg0/,1,r/livonia,0,1
">  also if theres Riga in USA, there can be multiple states having Riga or Livonia..

actually, I was near a town in Michigan called Riga when driving down 223.",t2_wqwoj,SupremoZanne,0,1642812385.0,0,t1_htoeb9y,htoeb9y,False,SupremoZanne,t3_s1tis7,https://www.reddit.com/r/livonia/comments/s1tis7/one_year_later_this_subreddit_grows_to_over_10/,"One year later, this subreddit grows to over 10 times it's subscriber count!",/r/livonia/comments/s1tis7/one_year_later_this_subreddit_grows_to_over_10/htoeb9y/,1,r/livonia,0,1
"theres multople livonias in usa, so state needs to be added. Real Livonia history https://www.reddit.com/r/livonia/comments/qxv2a0/comment/htnlxyw/?utm_source=reddit&utm_medium=web2x&context=3",t2_40hfd,kangarooo,0,1642801718.0,0,t1_htnmv7v,htnmv7v,False,GodsKalpotLatvijai,t3_qxv2a0,https://www.reddit.com/r/livonia/comments/qxv2a0/i_think_this_sub_got_recomended_to_me_because_im/,I think this sub got recomended to me because im from baltics lol,/r/livonia/comments/qxv2a0/i_think_this_sub_got_recomended_to_me_because_im/htnmv7v/,1,r/livonia,0,1
"Can you rename LivoniaMI since Livonia is a whole historic country. Now its Latvia. Theres some confusion, also if theres Riga in USA, there can be multiple states having Riga or Livonia.. Google it.. https://en.wikipedia.org/wiki/Livonia
So for each state in USA it should be LivoniaST
https://eu.hometownlife.com/story/news/local/livonia/2017/10/09/michigan-not-only-state-livonia/734722001/

Americans education from where they got the name..

46. Livonia 
The area that is now Livonia was known for its rich soil and abundant 
harvests, attracting pioneers from New England. It’s believed they named
 the area after cities of similar names in New York state, Pennsylvania 
and, possibly, after a region near the Baltic sea comprising present day
 Estonia and Latvia.
https://www.michigan.org/article/trip-idea/how-did-michigan-cities-get-their-names

Yes.. soo..",t2_40hfd,kangarooo,0,1642801382.0,0,t1_htnlxyw,htnlxyw,True,GodsKalpotLatvijai,t3_qxv2a0,https://www.reddit.com/r/livonia/comments/qxv2a0/i_think_this_sub_got_recomended_to_me_because_im/,I think this sub got recomended to me because im from baltics lol,/r/livonia/comments/qxv2a0/i_think_this_sub_got_recomended_to_me_because_im/htnlxyw/,1,r/livonia,0,1
"Can you rename LivoniaMI since Livonia is a whole historic country. Now its Latvia. Theres some confusion, also if theres Riga in USA, there can be multiple states having Riga or Livonia.. Google it.. https://en.wikipedia.org/wiki/Livonia
So for each state in USA it should be LivoniaST
https://eu.hometownlife.com/story/news/local/livonia/2017/10/09/michigan-not-only-state-livonia/734722001/

Americans education from where they got the name..
46. Livonia 
The area that is now Livonia was known for its rich soil and abundant 
harvests, attracting pioneers from New England. It’s believed they named
 the area after cities of similar names in New York state, Pennsylvania 
and, possibly, after a region near the Baltic sea comprising present day
 Estonia and Latvia.
https://www.michigan.org/article/trip-idea/how-did-michigan-cities-get-their-names

Yes.. soo..",t2_40hfd,kangarooo,0,1642801176.0,0,t1_htnldkd,htnldkd,True,SupremoZanne,t3_s1tis7,https://www.reddit.com/r/livonia/comments/s1tis7/one_year_later_this_subreddit_grows_to_over_10/,"One year later, this subreddit grows to over 10 times it's subscriber count!",/r/livonia/comments/s1tis7/one_year_later_this_subreddit_grows_to_over_10/htnldkd/,2,r/livonia,0,2
I would love to help you learn more about this! There are several really interesting modern genetic markers of roman ancestry 🙂,t2_6h74k7a0,snootypoodlepoo,0,1642618270.0,0,t1_htcp9y6,htcp9y6,False,snootypoodlepoo,t3_qj5nvg,https://www.reddit.com/r/livonia/comments/qj5nvg/livonia_family_history/,livonia family history,/r/livonia/comments/qj5nvg/livonia_family_history/htcp9y6/,1,r/livonia,0,1
Sound Hella fun. I always thought I have Roman heratige due to jaw line. Military blood line I reckon since those helmets over generations changed shape of face 😅,t2_ba0fez4i,Own-Math6482,0,1642617642.0,0,t1_htcnk6h,htcnk6h,True,snootypoodlepoo,t3_qj5nvg,https://www.reddit.com/r/livonia/comments/qj5nvg/livonia_family_history/,livonia family history,/r/livonia/comments/qj5nvg/livonia_family_history/htcnk6h/,2,r/livonia,0,2
tehniski taisnība,t2_4d153day,ik_kraukl,0,1642616813.0,0,t1_htclaa5,htclaa5,False,8Turtles,t3_msrrho,https://www.reddit.com/r/livonia/comments/msrrho/the_mods_are_asleep_lets_upvote_them_livonian/,"The mods are asleep, let’s upvote them livonian order bros",/r/livonia/comments/msrrho/the_mods_are_asleep_lets_upvote_them_livonian/htclaa5/,1,r/livonia,0,1
"So I've recently gotten into genealogy lately and I've been able to link my family pretty far BUT I've run into a snag and I don't know how to verify this one person within the tree. I thought I'd reach out for tips and tricks? 

Here's why I want to dispute it. Apparently, this one link would mean that I am a descendant of John Rolfe/Pocahontas but it just doesn't seem right. I've tracked down a lot of material validating his family line up to this one person and I've validated all of my family line up to this very same person. I cannot find census records, marriage records, or anything. The closest item I have is a will, and one book. I could provide you names if you're curious but I would have to look them up.",t2_7becdfn7,Acrobatic_Classic_13,0,1642392967.0,0,t1_hszxe8a,hszxe8a,True,snootypoodlepoo,t3_qj5nvg,https://www.reddit.com/r/livonia/comments/qj5nvg/livonia_family_history/,livonia family history,/r/livonia/comments/qj5nvg/livonia_family_history/hszxe8a/,1,r/livonia,0,1
I need waxing my body,t2_60p9oew5,Jonnywellman1,0,1641497784.0,0,t1_hrj6bai,hrj6bai,True,lik-a-do-da-cha-cha,t3_943mjl,https://www.reddit.com/r/livonia/comments/943mjl/waxing_for_men/,Waxing for men,/r/livonia/comments/943mjl/waxing_for_men/hrj6bai/,1,r/livonia,0,1
I think there's a group that collects them after Halloween and they put them down there for the wildlife.,t2_178969,smutmuffin1978,0,1641179834.0,0,t1_hr0xm8z,hr0xm8z,True,Uneasy_Half-Literate,t3_rupgiq,https://www.reddit.com/r/livonia/comments/rupgiq/pumpkins_all_along_hines_drive/,Pumpkins All Along Hines Drive,/r/livonia/comments/rupgiq/pumpkins_all_along_hines_drive/hr0xm8z/,9,r/livonia,0,9
lol That’s hilarious and weird. Maybe there was a punkin’ chunkin’ event?,t2_15pgy3,JaJaJaJaded3806,0,1641179232.0,0,t1_hr0w8w9,hr0w8w9,True,Uneasy_Half-Literate,t3_rupgiq,https://www.reddit.com/r/livonia/comments/rupgiq/pumpkins_all_along_hines_drive/,Pumpkins All Along Hines Drive,/r/livonia/comments/rupgiq/pumpkins_all_along_hines_drive/hr0w8w9/,3,r/livonia,0,3
