body,author_fullname,author.name,controversiality,created,downs,fullname,id,is_root,link_author,link_id,link_permalink,link_title,permalink,score,subreddit_name_prefixed,total_awards_received,ups
"When I was in public hs and working at the mall I asked a girl out that went to Ladywood. She told me verbatim ""I only date CC guys"" I was speechless.",t2_df9h4,depsmith,0,1516331046.0,0,t1_dswhk7q,dswhk7q,True,[deleted],t3_7kir3d,https://www.reddit.com/r/livonia/comments/7kir3d/ladywood_high_school_in_livonia_closing_in_spring/,Ladywood High School in Livonia closing in spring; cite drop in enrollment,/r/livonia/comments/7kir3d/ladywood_high_school_in_livonia_closing_in_spring/dswhk7q/,2,r/livonia,0,2
"Yes it is. Right next to Riverside Arena, about a half mile west of Levan on Plymouth Road.",t2_3pdcn,BigGreenYamo,0,1514211779.0,0,t1_drqmxz8,drqmxz8,False,BigGreenYamo,t3_7d7ek4,https://www.reddit.com/r/livonia/comments/7d7ek4/supernatural_is_finally_open/,Supernatural is finally open!!!,/r/livonia/comments/7d7ek4/supernatural_is_finally_open/drqmxz8/,2,r/livonia,0,2
Is this a new brewery?,t2_7g1fr,DoodleDew,0,1514170287.0,0,t1_drq5fxd,drq5fxd,True,BigGreenYamo,t3_7d7ek4,https://www.reddit.com/r/livonia/comments/7d7ek4/supernatural_is_finally_open/,Supernatural is finally open!!!,/r/livonia/comments/7d7ek4/supernatural_is_finally_open/drq5fxd/,1,r/livonia,0,1
The Livonia mall is long gone so I doubt it.  ,t2_9pkh5,diito,0,1512360454.0,0,t1_dqqgma7,dqqgma7,True,[deleted],t3_7hdfvj,https://www.reddit.com/r/livonia/comments/7hdfvj/does_anyone_remember_the_christmas_tree/,Does anyone remember the Christmas tree decorating contest at Livonia Mall?,/r/livonia/comments/7hdfvj/does_anyone_remember_the_christmas_tree/dqqgma7/,1,r/livonia,0,1
Glad you gave it a shot! Maybe I'll see you there sometime!,t2_c9l7q,AFellowStooge,0,1511908927.0,0,t1_dqh7she,dqh7she,False,BigGreenYamo,t3_7d7ek4,https://www.reddit.com/r/livonia/comments/7d7ek4/supernatural_is_finally_open/,Supernatural is finally open!!!,/r/livonia/comments/7d7ek4/supernatural_is_finally_open/dqh7she/,2,r/livonia,0,2
"Took your advice. While I like it, I'm still just coming around to liking stouts. 

I still love the 10, though.",t2_3pdcn,BigGreenYamo,0,1511827232.0,0,t1_dqfidki,dqfidki,False,BigGreenYamo,t3_7d7ek4,https://www.reddit.com/r/livonia/comments/7d7ek4/supernatural_is_finally_open/,Supernatural is finally open!!!,/r/livonia/comments/7d7ek4/supernatural_is_finally_open/dqfidki/,2,r/livonia,0,2
Give it a shot! You won't regret it!,t2_c9l7q,AFellowStooge,0,1510956068.0,0,t1_dpz8xff,dpz8xff,False,BigGreenYamo,t3_7d7ek4,https://www.reddit.com/r/livonia/comments/7d7ek4/supernatural_is_finally_open/,Supernatural is finally open!!!,/r/livonia/comments/7d7ek4/supernatural_is_finally_open/dpz8xff/,3,r/livonia,0,3
"That's one I haven't tried yet. I was there last night, and I actually went to lunch there this afternoon, too.",t2_3pdcn,BigGreenYamo,0,1510861727.0,0,t1_dpx8tui,dpx8tui,False,BigGreenYamo,t3_7d7ek4,https://www.reddit.com/r/livonia/comments/7d7ek4/supernatural_is_finally_open/,Supernatural is finally open!!!,/r/livonia/comments/7d7ek4/supernatural_is_finally_open/dpx8tui/,2,r/livonia,0,2
"The Supernatural 10 is probably my favorite beer ever. The other 4 I had were great, too. ",t2_3pdcn,BigGreenYamo,0,1510861686.0,0,t1_dpx8s7z,dpx8s7z,False,BigGreenYamo,t3_7d7ek4,https://www.reddit.com/r/livonia/comments/7d7ek4/supernatural_is_finally_open/,Supernatural is finally open!!!,/r/livonia/comments/7d7ek4/supernatural_is_finally_open/dpx8s7z/,3,r/livonia,0,3
"Was just there last night! Place is awesome, people are awesome, and the beers are awesome! Kickkamocha stout ftw!",t2_c9l7q,AFellowStooge,0,1510847152.0,0,t1_dpwtpdt,dpwtpdt,True,BigGreenYamo,t3_7d7ek4,https://www.reddit.com/r/livonia/comments/7d7ek4/supernatural_is_finally_open/,Supernatural is finally open!!!,/r/livonia/comments/7d7ek4/supernatural_is_finally_open/dpwtpdt/,2,r/livonia,0,2
How were the beers?,t2_47jz4,xfloormattx,0,1510832091.0,0,t1_dpwj86l,dpwj86l,True,BigGreenYamo,t3_7d7ek4,https://www.reddit.com/r/livonia/comments/7d7ek4/supernatural_is_finally_open/,Supernatural is finally open!!!,/r/livonia/comments/7d7ek4/supernatural_is_finally_open/dpwj86l/,2,r/livonia,0,2
"Found him at Farmington and 5 Mile, thanks anyone that kept an eye out.",t2_4pw21,BadInPlaid,0,1510066417.0,0,t1_dph3ujd,dph3ujd,True,BadInPlaid,t3_7bbykw,https://www.reddit.com/r/livonia/comments/7bbykw/lost_dog_chocolate_lab_red_collar_last_seen_on/,"Lost Dog - Chocolate lab, red collar, last seen on Beatrice off Schoolcraft.",/r/livonia/comments/7bbykw/lost_dog_chocolate_lab_red_collar_last_seen_on/dph3ujd/,1,r/livonia,0,1
"Our chocolate lab Riley got out tonight, we've been looking for the past 3 hours but can't find him. Please help us find him. Has a ""needs medicine"" tag on his collar.",t2_4pw21,BadInPlaid,0,1510044475.0,0,t1_dpgsw4r,dpgsw4r,True,BadInPlaid,t3_7bbykw,https://www.reddit.com/r/livonia/comments/7bbykw/lost_dog_chocolate_lab_red_collar_last_seen_on/,"Lost Dog - Chocolate lab, red collar, last seen on Beatrice off Schoolcraft.",/r/livonia/comments/7bbykw/lost_dog_chocolate_lab_red_collar_last_seen_on/dpgsw4r/,1,r/livonia,0,1
"^(Hi, I'm a bot for linking direct images of albums with only 1 image)

**https://i.imgur.com/MiVaOR9.jpg**

^^[Source](https://github.com/AUTplayed/imguralbumbot) ^^| ^^[Why?](https://github.com/AUTplayed/imguralbumbot/blob/master/README.md) ^^| ^^[Creator](https://np.reddit.com/user/AUTplayed/) ^^| ^^[ignoreme](https://np.reddit.com/message/compose/?to=imguralbumbot&subject=ignoreme&message=ignoreme) ^^| ^^[deletthis](https://np.reddit.com/message/compose/?to=imguralbumbot&subject=delet%20this&message=delet%20this%20dpgsucr) ",t2_180i376,imguralbumbot,0,1510044330.0,0,t1_dpgsucr,dpgsucr,True,BadInPlaid,t3_7bbykw,https://www.reddit.com/r/livonia/comments/7bbykw/lost_dog_chocolate_lab_red_collar_last_seen_on/,"Lost Dog - Chocolate lab, red collar, last seen on Beatrice off Schoolcraft.",/r/livonia/comments/7bbykw/lost_dog_chocolate_lab_red_collar_last_seen_on/dpgsucr/,1,r/livonia,0,1
"Thanks dawg, I knew someone would remember.

What were all the things he did? I heard he pooped in a book in the library, smeared it in the stall in the bathroom neat the lunchroom, and some other bathrooms. ",t2_h69bls3,WhiteyHarrison,0,1507933691.0,0,t1_doc193p,doc193p,False,WhiteyHarrison,t3_762ea1,https://www.reddit.com/r/livonia/comments/762ea1/rufus_was_framed/,Rufus was Framed!,/r/livonia/comments/762ea1/rufus_was_framed/doc193p/,2,r/livonia,0,2
"I don't have any info myself, but I went to CHS during those PP years...",t2_eptb0,_zombi,0,1507890959.0,0,t1_dob2sub,dob2sub,True,WhiteyHarrison,t3_762ea1,https://www.reddit.com/r/livonia/comments/762ea1/rufus_was_framed/,Rufus was Framed!,/r/livonia/comments/762ea1/rufus_was_framed/dob2sub/,3,r/livonia,0,3
And Blooms Pharmacy on Middlebelt is the best. ,t2_15yx7z,mcrazingwill,0,1505187997.0,0,t1_dmvysfz,dmvysfz,True,Ipharmacy,t3_6zkcvr,https://www.reddit.com/r/livonia/comments/6zkcvr/ipharmacy_livonia/,Ipharmacy livonia,/r/livonia/comments/6zkcvr/ipharmacy_livonia/dmvysfz/,1,r/livonia,0,1
Idon't get your point? ,t2_15yx7z,mcrazingwill,0,1505187969.0,0,t1_dmvyrsi,dmvyrsi,True,Ipharmacy,t3_6zkcvr,https://www.reddit.com/r/livonia/comments/6zkcvr/ipharmacy_livonia/,Ipharmacy livonia,/r/livonia/comments/6zkcvr/ipharmacy_livonia/dmvyrsi/,1,r/livonia,0,1
Las Palapas is one of my favorites. ,t2_47jz4,xfloormattx,0,1500562307.0,0,t1_dkh63ak,dkh63ak,True,[deleted],t3_6obbwu,https://www.reddit.com/r/livonia/comments/6obbwu/best_restaurants_in_the_area/,Best restaurants in the area?,/r/livonia/comments/6obbwu/best_restaurants_in_the_area/dkh63ak/,1,r/livonia,0,1
"I'd say Luigi's Pizza Cafe is my favorite food in Livonia.
",t2_9e1oq,mollieflynn,0,1500518175.0,0,t1_dkgj2ho,dkgj2ho,True,[deleted],t3_6obbwu,https://www.reddit.com/r/livonia/comments/6obbwu/best_restaurants_in_the_area/,Best restaurants in the area?,/r/livonia/comments/6obbwu/best_restaurants_in_the_area/dkgj2ho/,1,r/livonia,0,1
"day 5: water is back, have not shower in 12 days",t2_4xklz,Swobes,0,1497466878.0,0,t1_diwku5f,diwku5f,True,[deleted],t3_6h8v1x,https://www.reddit.com/r/livonia/comments/6h8v1x/livonias_boilwater_advisory_lifted/,Livonia’s boil-water advisory lifted,/r/livonia/comments/6h8v1x/livonias_boilwater_advisory_lifted/diwku5f/,2,r/livonia,0,2
"Thanks for the heads up, I just told my parents and I wouldn't have known unless you posted it.",t2_52n5a,Reppoy,0,1497307202.0,0,t1_ditfdoq,ditfdoq,True,Cowpork,t3_6giqjs,https://www.reddit.com/r/livonia/comments/6giqjs/boil_water_advisory_livonia_farmington_hills/,"Boil water advisory: Livonia, Farmington Hills",/r/livonia/comments/6giqjs/boil_water_advisory_livonia_farmington_hills/ditfdoq/,1,r/livonia,0,1
I got the alert from NIXLE.  Text your zip code to 888777 for alerts from your local police.,t2_9mwq0,sassyprofessor,0,1497226593.0,0,t1_dirwpd0,dirwpd0,True,Cowpork,t3_6giqjs,https://www.reddit.com/r/livonia/comments/6giqjs/boil_water_advisory_livonia_farmington_hills/,"Boil water advisory: Livonia, Farmington Hills",/r/livonia/comments/6giqjs/boil_water_advisory_livonia_farmington_hills/dirwpd0/,2,r/livonia,0,2
"Not to mention the Facebook and Twitter pages of local organizations like the police. In fact, I'm not sure how else they could have informed people, outside of a megaphone and a trailer",t2_cccks,Hitz365,0,1497224427.0,0,t1_dirv47a,dirv47a,False,Cowpork,t3_6giqjs,https://www.reddit.com/r/livonia/comments/6giqjs/boil_water_advisory_livonia_farmington_hills/,"Boil water advisory: Livonia, Farmington Hills",/r/livonia/comments/6giqjs/boil_water_advisory_livonia_farmington_hills/dirv47a/,3,r/livonia,0,3
"So this was announced on local TV and radio, as well as on the Livonia Twitter feed, facebook page, and via mass emails.   You should probably go to the City of Livonia web page to sign up for their distribution list.   ",t2_adpyp,Cowpork,0,1497217411.0,0,t1_dirpvd2,dirpvd2,False,Cowpork,t3_6giqjs,https://www.reddit.com/r/livonia/comments/6giqjs/boil_water_advisory_livonia_farmington_hills/,"Boil water advisory: Livonia, Farmington Hills",/r/livonia/comments/6giqjs/boil_water_advisory_livonia_farmington_hills/dirpvd2/,3,r/livonia,0,3
What the fuck.  Why am I just hearing this now? Does the city really have no way of informing residents?,t2_ykew4,TheReformedBadger,0,1497213378.0,0,t1_dirmw12,dirmw12,True,Cowpork,t3_6giqjs,https://www.reddit.com/r/livonia/comments/6giqjs/boil_water_advisory_livonia_farmington_hills/,"Boil water advisory: Livonia, Farmington Hills",/r/livonia/comments/6giqjs/boil_water_advisory_livonia_farmington_hills/dirmw12/,1,r/livonia,0,1
"Eh, it was karma that the owner had coming. I feel bad for the stolen reptiles though and hope that they  haven't suffered too much trauma. 

The owner of this store was very rude because my 7 year old was in a wheelchair - saying he couldn't be in the store. I don't feel bad for them at all. ",t2_15yx7z,mcrazingwill,0,1496619181.0,0,t1_digowyo,digowyo,True,metalzim,t3_62eygn,https://www.reddit.com/r/livonia/comments/62eygn/reptile_theft_in_livonia_michigan_please_help_us/,"Reptile Theft in Livonia, Michigan. Please help us catch this thief and save these reptiles.",/r/livonia/comments/62eygn/reptile_theft_in_livonia_michigan_please_help_us/digowyo/,1,r/livonia,0,1
There are day passes see http://www.ci.livonia.mi.us/Departments/ParksandRecreation/KirkseyRecreationCenter/KirkseyRecreationCenterMembershipInformation.aspx. for more details,t2_11qgsr,The_Cat_Is_Maybe,0,1495902308.0,0,t1_di45zjt,di45zjt,False,The_Cat_Is_Maybe,t3_5risla,https://www.reddit.com/r/livonia/comments/5risla/rock_climbing_partner_needed/,Rock climbing partner needed,/r/livonia/comments/5risla/rock_climbing_partner_needed/di45zjt/,1,r/livonia,0,1
Yep we would both belay for the other. The price of membership for one adult out of town is $434.00/year.  There is no additional cost to use the wall (provided you have someone to belay)  Planet rock is too expensive for me at this time in life :(,t2_11qgsr,The_Cat_Is_Maybe,0,1495807491.0,0,t1_di2k9a7,di2k9a7,False,The_Cat_Is_Maybe,t3_5risla,https://www.reddit.com/r/livonia/comments/5risla/rock_climbing_partner_needed/,Rock climbing partner needed,/r/livonia/comments/5risla/rock_climbing_partner_needed/di2k9a7/,1,r/livonia,0,1
Unfortunately non residents get charged larger amounts and I don't know of a way to get you in with my pass at the in city rate,t2_11qgsr,The_Cat_Is_Maybe,0,1494592623.0,0,t1_dhgogco,dhgogco,False,The_Cat_Is_Maybe,t3_5risla,https://www.reddit.com/r/livonia/comments/5risla/rock_climbing_partner_needed/,Rock climbing partner needed,/r/livonia/comments/5risla/rock_climbing_partner_needed/dhgogco/,1,r/livonia,0,1
"Location, public safety, and hines park.",t2_df9h4,depsmith,0,1493324665.0,0,t1_dgu5sof,dgu5sof,True,jordand30,t3_64h1wl,https://www.reddit.com/r/livonia/comments/64h1wl/im_moving_to_livonia_whats_the_best_thing_about/,I'm moving to Livonia. What's the best thing about living here?,/r/livonia/comments/64h1wl/im_moving_to_livonia_whats_the_best_thing_about/dgu5sof/,1,r/livonia,0,1
"UPDATE:
7 out of the 9 reptiles have been found and returned back to the store. They were in rough shape, but are making speedy recoveries. Also, the man who broke in and stole them has been arrested and is in police custody. He is being very silent and not cooperating with police. With that said, sadly the two bearded dragons that were pets of the shop owners are still missing. We are hoping he will come clean and tell the police where they are.

THANK YOU to everyone who helped spread the word of this incident and help catch this criminal. We couldn't have done it without all the support!!!",t2_9hdcx,metalzim,0,1492877448.0,0,t1_dgltxkh,dgltxkh,True,metalzim,t3_62eygn,https://www.reddit.com/r/livonia/comments/62eygn/reptile_theft_in_livonia_michigan_please_help_us/,"Reptile Theft in Livonia, Michigan. Please help us catch this thief and save these reptiles.",/r/livonia/comments/62eygn/reptile_theft_in_livonia_michigan_please_help_us/dgltxkh/,1,r/livonia,0,1
Man even our subreddit is losing people to south lyon! ,t2_df9h4,depsmith,0,1492785134.0,0,t1_dgk8km8,dgk8km8,True,EmeraldWeapon911,t3_65kkhy,https://www.reddit.com/r/livonia/comments/65kkhy/2b2ba_1115ft_975_short_term_sublet_new_hudson/,[2B2Ba 1115Ft $975] Short Term Sublet - New Hudson,/r/livonia/comments/65kkhy/2b2ba_1115ft_975_short_term_sublet_new_hudson/dgk8km8/,1,r/livonia,0,1
Yeah I have actually gained quite a few replies from Craiglist already.  Figured I would express all possible outlets.  It seems most subreddits besides like Detroit are pretty dead.,t2_9c02a,EmeraldWeapon911,0,1492550714.0,0,t1_dgftmzr,dgftmzr,False,EmeraldWeapon911,t3_65kkhy,https://www.reddit.com/r/livonia/comments/65kkhy/2b2ba_1115ft_975_short_term_sublet_new_hudson/,[2B2Ba 1115Ft $975] Short Term Sublet - New Hudson,/r/livonia/comments/65kkhy/2b2ba_1115ft_975_short_term_sublet_new_hudson/dgftmzr/,1,r/livonia,0,1
"=) Thanks!

Looking to transfer my lease to someone else.  We are in the process of buying a house.  It appears there may be a few months overlap from when we get the house to when the apartment rent ends (8/31).  It would be a lease transfter from Mid June ish until 8/31.  On 7/31 you can give the apartment a notice if you want to renew for 12 months, 3 months, month to month, or not renew the lease.

",t2_9c02a,EmeraldWeapon911,0,1492442495.0,0,t1_dgdm1ui,dgdm1ui,False,EmeraldWeapon911,t3_65kkhy,https://www.reddit.com/r/livonia/comments/65kkhy/2b2ba_1115ft_975_short_term_sublet_new_hudson/,[2B2Ba 1115Ft $975] Short Term Sublet - New Hudson,/r/livonia/comments/65kkhy/2b2ba_1115ft_975_short_term_sublet_new_hudson/dgdm1ui/,2,r/livonia,0,2
Hines park is definitely a highlight of the area.  I grew up in a more rural part of michigan and it helps keep me sane.,t2_adpyp,Cowpork,0,1491878052.0,0,t1_dg3pzb0,dg3pzb0,False,jordand30,t3_64h1wl,https://www.reddit.com/r/livonia/comments/64h1wl/im_moving_to_livonia_whats_the_best_thing_about/,I'm moving to Livonia. What's the best thing about living here?,/r/livonia/comments/64h1wl/im_moving_to_livonia_whats_the_best_thing_about/dg3pzb0/,2,r/livonia,0,2
The archery range is incredibly affordable when compared to what's available at the private stores. $4 per day for resident adults and $6 for non (children are welcome too),t2_9z5kw,FlapJackSam,0,1491877193.0,0,t1_dg3pa3z,dg3pa3z,False,jordand30,t3_64h1wl,https://www.reddit.com/r/livonia/comments/64h1wl/im_moving_to_livonia_whats_the_best_thing_about/,I'm moving to Livonia. What's the best thing about living here?,/r/livonia/comments/64h1wl/im_moving_to_livonia_whats_the_best_thing_about/dg3pa3z/,3,r/livonia,0,3
I've lived here in Livonia 22 years now and this is spot on,t2_9z5kw,FlapJackSam,0,1491877086.0,0,t1_dg3p6yg,dg3p6yg,False,jordand30,t3_64h1wl,https://www.reddit.com/r/livonia/comments/64h1wl/im_moving_to_livonia_whats_the_best_thing_about/,I'm moving to Livonia. What's the best thing about living here?,/r/livonia/comments/64h1wl/im_moving_to_livonia_whats_the_best_thing_about/dg3p6yg/,1,r/livonia,0,1
"The biggest appeal of Livonia is it being a suburb equidistant to the cultural hubs of the area- AA, Detroit. Other than that, getting stoned and sitting at the Looney is always a pleasant afternoon. ",t2_90c6f,thesekindoficeskates,0,1491874984.0,0,t1_dg3nfor,dg3nfor,True,jordand30,t3_64h1wl,https://www.reddit.com/r/livonia/comments/64h1wl/im_moving_to_livonia_whats_the_best_thing_about/,I'm moving to Livonia. What's the best thing about living here?,/r/livonia/comments/64h1wl/im_moving_to_livonia_whats_the_best_thing_about/dg3nfor/,5,r/livonia,0,5
If you like Apple Fritters then Loony Baker has really good ones the size of your head.  Farmington & Schoolcraft,t2_4btzv,zdrvr,0,1491870990.0,0,t1_dg3k913,dg3k913,True,jordand30,t3_64h1wl,https://www.reddit.com/r/livonia/comments/64h1wl/im_moving_to_livonia_whats_the_best_thing_about/,I'm moving to Livonia. What's the best thing about living here?,/r/livonia/comments/64h1wl/im_moving_to_livonia_whats_the_best_thing_about/dg3k913/,5,r/livonia,0,5
"Little things to note: 

the greasy spoon burger joint is called Bates, and is in the dead center of the city. Farmington and 5 mile. 

There's a phoenix theater tucked away in an office complex next to Laurel Park mall. It doesn't get much traffic, and has big comfy seats. It does get lines when big movies come out. 

The industrial park is between 275 and Plymouth spanning pretty much all of Livonia. The waste disposal for things like used oil and other things you can't just trash is down there off of Farmington. There's also an archery range down there. 

Hines park stretches from northville, down and around the southern edge of Livonia, and over to dearborn. Hines drive follows the park with minimal stoplights and a lot of scenery. It's a nice drive. There's also a lot of picnic areas, a dog park, and a frisbee golf course. Also Segway tour of nankin mills. 
During the winter there's a winter light show setup along the road. 

Let me know if you got questions. ",t2_d8csi,HelloGoodbye63,0,1491854422.0,0,t1_dg36bf9,dg36bf9,True,jordand30,t3_64h1wl,https://www.reddit.com/r/livonia/comments/64h1wl/im_moving_to_livonia_whats_the_best_thing_about/,I'm moving to Livonia. What's the best thing about living here?,/r/livonia/comments/64h1wl/im_moving_to_livonia_whats_the_best_thing_about/dg36bf9/,3,r/livonia,0,3
Your perspective is incredibly helpful. I appreciate you taking the time.,t2_tltni,jordand30,0,1491847657.0,0,t1_dg2ztlc,dg2ztlc,False,jordand30,t3_64h1wl,https://www.reddit.com/r/livonia/comments/64h1wl/im_moving_to_livonia_whats_the_best_thing_about/,I'm moving to Livonia. What's the best thing about living here?,/r/livonia/comments/64h1wl/im_moving_to_livonia_whats_the_best_thing_about/dg2ztlc/,1,r/livonia,0,1
"No, but it's the standard WOW offerings they have been rolling out other places.  The 1Gb top tier is like 1Gb down 50Mb up, the next tier is 600/50.  1GB is definitely coming but I don't think it will be initially offered in Livonia. I believe the 600/50 package is like $75 a month just for internet but there is a bundle or their full cable lineup + HBO and internet for $95 on a two year contract.  That's $100 less a month for cable+HBO+200/30 service that I pay for Spectrum right now. 

That being said it's WOW.  They are looking for someone to come and buy them out so who knows what happens to the no caps and decent pricing if someone does.  They also don't have the best peering.  I know someone that has the 600/50 service a few towns over and he says he gets the full speed but latency is a little high. I'd much rather have rocket or lightspeed build out their fiber to the home and full 1Gb synchronous service but until then it's good to have a viable 2nd option. ",t2_9pkh5,diito,0,1491842255.0,0,t1_dg2uqgd,dg2uqgd,False,jordand30,t3_64h1wl,https://www.reddit.com/r/livonia/comments/64h1wl/im_moving_to_livonia_whats_the_best_thing_about/,I'm moving to Livonia. What's the best thing about living here?,/r/livonia/comments/64h1wl/im_moving_to_livonia_whats_the_best_thing_about/dg2uqgd/,1,r/livonia,0,1
"Whoa, do you have more details or a link about the WOW buildout?",t2_chhd2,not_that_guy_either,0,1491826916.0,0,t1_dg2iltz,dg2iltz,False,jordand30,t3_64h1wl,https://www.reddit.com/r/livonia/comments/64h1wl/im_moving_to_livonia_whats_the_best_thing_about/,I'm moving to Livonia. What's the best thing about living here?,/r/livonia/comments/64h1wl/im_moving_to_livonia_whats_the_best_thing_about/dg2iltz/,1,r/livonia,0,1
"Livonia is pretty large so where you are at makes a big difference.  The better side of town is the Northwest, west of Farmington, north of 5 mile.  

Boring suburb is accurate. There's no downtown to speak of, so really no nightlife at all.  Most all the decent restaurants are west of 275 along Haggerty road or in that general area.  Those are all chains though, there's really not any places to eat, do, or stores that are unique to Livonia that stand out.  

The main benefit of Livonia is the (super convenient) location.  You can switch jobs and pretty much still have a short commute.  You've got Ann Arbor, Detroit, Royal Oak, the airport etc all within 25 minutes, and Plymouth/Northville/Novi within 15 as well.  There's plenty to do in those areas.  It's a very stable, safe area, with decent schools (although Northville would be better).  Despite it almost all being built from the 1950's to the 1970's people tend to take care of things and there wasn't a huge number of empty houses when the 2008 crisis hit. You have a mix of older original owners and a lot more young families moving in.  On my street the houses have been  getting 5+ offers and selling at/over asking in less than a week.  City services are pretty good and the taxes are low.  I don't belong to it because the hours don't work for me but the rec center is pretty impressive.  The Library has some good stuff going on for the kids.  Greenmead is nice, and there are a good number of parks.  It's not a Comcast area which is a plus. It's Spectrum (Brighthouse after Charter buy out), which has no caps and generally never gave me any issues.  WOW is in the process of building out here will be offering up to 1Gbit for like half the price without caps.

It's not a bad place to live, great if you have kids, it's just not a destination itself.",t2_9pkh5,diito,0,1491803847.0,0,t1_dg2a3sh,dg2a3sh,True,jordand30,t3_64h1wl,https://www.reddit.com/r/livonia/comments/64h1wl/im_moving_to_livonia_whats_the_best_thing_about/,I'm moving to Livonia. What's the best thing about living here?,/r/livonia/comments/64h1wl/im_moving_to_livonia_whats_the_best_thing_about/dg2a3sh/,12,r/livonia,0,12
"We play ball hockey (orange hockey ball). We'll play 4-on-4  or 5-on-5 plus a goalie depending on how many show up.
Running in shoes. Regular sticks.
Equipment is optional. Gloves and shinpads are recommended. Some where head/eye protection..
We play at the ice rink outside the Livonia Rec Center (5 mile and hubbard, south east side)",t2_6q1v3,tranam,0,1491023241.0,0,t1_dfol1kc,dfol1kc,False,tranam,t3_62nm64,https://www.reddit.com/r/livonia/comments/62nm64/free_dropin_ball_hockey_sunday_24_in_livonia/,"Free drop-in ball hockey, Sunday, 2-4 in Livonia",/r/livonia/comments/62nm64/free_dropin_ball_hockey_sunday_24_in_livonia/dfol1kc/,1,r/livonia,0,1
"Not on Facebook, can you provide details here?",t2_4so0t,ffejeroni,0,1491013897.0,0,t1_dfofg8u,dfofg8u,True,tranam,t3_62nm64,https://www.reddit.com/r/livonia/comments/62nm64/free_dropin_ball_hockey_sunday_24_in_livonia/,"Free drop-in ball hockey, Sunday, 2-4 in Livonia",/r/livonia/comments/62nm64/free_dropin_ball_hockey_sunday_24_in_livonia/dfofg8u/,1,r/livonia,0,1
