body,author_fullname,author.name,controversiality,created,downs,fullname,id,is_root,link_author,link_id,link_permalink,link_title,permalink,score,subreddit_name_prefixed,total_awards_received,ups
"this happened really close to the house i used to live at. Blocks away, in fact.",t2_3x2l1yn9,Gunnery_SgtHartman,0,1578005429.0,0,t1_fcvmqdh,fcvmqdh,True,[deleted],t3_ed2pgd,https://www.reddit.com/r/livonia/comments/ed2pgd/drive_by_shooting_in_livonia_bol_blue_ford_taurus/,"Drive by shooting in Livonia, BOL blue Ford Taurus with duct tape on front passenger side",/r/livonia/comments/ed2pgd/drive_by_shooting_in_livonia_bol_blue_ford_taurus/fcvmqdh/,2,r/livonia,0,2
that would be sweet.,t2_3x2l1yn9,Gunnery_SgtHartman,0,1578005210.0,0,t1_fcvmdqd,fcvmdqd,False,Gunnery_SgtHartman,t3_ef7l4c,https://www.reddit.com/r/livonia/comments/ef7l4c/i_have_arrived_here_because_all_things_livonia_is/,I have arrived here because All Things Livonia is closed for the holidays,/r/livonia/comments/ef7l4c/i_have_arrived_here_because_all_things_livonia_is/fcvmdqd/,2,r/livonia,0,2
Wouldn’t it be sweet if more than 1 person weekly posted to r/Livonia,t2_4qal5,3PointOneFour,0,1577337268.0,0,t1_fc220ao,fc220ao,True,Gunnery_SgtHartman,t3_ef7l4c,https://www.reddit.com/r/livonia/comments/ef7l4c/i_have_arrived_here_because_all_things_livonia_is/,I have arrived here because All Things Livonia is closed for the holidays,/r/livonia/comments/ef7l4c/i_have_arrived_here_because_all_things_livonia_is/fc220ao/,5,r/livonia,0,5
"No you left out my personal favorite ""what bug is this?""",t2_kqgum,overengineered,0,1577300092.0,0,t1_fc0unrn,fc0unrn,False,Gunnery_SgtHartman,t3_ef7l4c,https://www.reddit.com/r/livonia/comments/ef7l4c/i_have_arrived_here_because_all_things_livonia_is/,I have arrived here because All Things Livonia is closed for the holidays,/r/livonia/comments/ef7l4c/i_have_arrived_here_because_all_things_livonia_is/fc0unrn/,4,r/livonia,0,4
I s Primo's open today?,t2_2o1r00ph,ted5011c,0,1577291155.0,0,t1_fc0htkk,fc0htkk,True,Gunnery_SgtHartman,t3_ef7l4c,https://www.reddit.com/r/livonia/comments/ef7l4c/i_have_arrived_here_because_all_things_livonia_is/,I have arrived here because All Things Livonia is closed for the holidays,/r/livonia/comments/ef7l4c/i_have_arrived_here_because_all_things_livonia_is/fc0htkk/,2,r/livonia,0,2
"Had to leave it last year because of all the ""my internet is out, anyone else?""",t2_47jz4,xfloormattx,0,1577289061.0,0,t1_fc0eyd5,fc0eyd5,False,Gunnery_SgtHartman,t3_ef7l4c,https://www.reddit.com/r/livonia/comments/ef7l4c/i_have_arrived_here_because_all_things_livonia_is/,I have arrived here because All Things Livonia is closed for the holidays,/r/livonia/comments/ef7l4c/i_have_arrived_here_because_all_things_livonia_is/fc0eyd5/,3,r/livonia,0,3
Hahaha in Livonia for the holidays too lol. Watching movies.,t2_t7zl9,stenuine,0,1577288975.0,0,t1_fc0euqb,fc0euqb,True,Gunnery_SgtHartman,t3_ef7l4c,https://www.reddit.com/r/livonia/comments/ef7l4c/i_have_arrived_here_because_all_things_livonia_is/,I have arrived here because All Things Livonia is closed for the holidays,/r/livonia/comments/ef7l4c/i_have_arrived_here_because_all_things_livonia_is/fc0euqb/,3,r/livonia,0,3
Help. I'm stuck in Livonia and my husband is forcing me to watch Hallmark movies ALL DAY - commercial free!,t2_178969,smutmuffin1978,0,1577280780.0,0,t1_fc06km9,fc06km9,True,Gunnery_SgtHartman,t3_ef7l4c,https://www.reddit.com/r/livonia/comments/ef7l4c/i_have_arrived_here_because_all_things_livonia_is/,I have arrived here because All Things Livonia is closed for the holidays,/r/livonia/comments/ef7l4c/i_have_arrived_here_because_all_things_livonia_is/fc06km9/,3,r/livonia,0,3
"Top Ten Things you will hear about in an All Things Livonia Posting.

10. “Anyone else hear that loud noise just now?”

9. Essential oil or other MLM posting until the one mod that actually enforces these postings removes them.

8. “Not in my neighborhood!”

7. “I just saw a suspicious car drive down my street, the driver was black”

6. “They should really turn  *empty building* into a new shopping center.”

5. We are better than the suburbs to the south.

4. We wish we were as cool as the suburbs to the north and west.

3. “Livonia PD can do no wrong and are the heart and soul of our community, did you hear they “partnered” with Ring Doorbells.”

2. “Is today trash day?”

1. “I think some teenagers just rang my door bell, here is some security camera footage of them running away”",t2_4qal5,3PointOneFour,0,1577259363.0,0,t1_fbzslu8,fbzslu8,True,Gunnery_SgtHartman,t3_ef7l4c,https://www.reddit.com/r/livonia/comments/ef7l4c/i_have_arrived_here_because_all_things_livonia_is/,I have arrived here because All Things Livonia is closed for the holidays,/r/livonia/comments/ef7l4c/i_have_arrived_here_because_all_things_livonia_is/fbzslu8/,6,r/livonia,0,6
So rare ✨✨✨,t2_5808wckc,fatobato,0,1577229018.0,0,t1_fbyxhx3,fbyxhx3,True,ripjohnmcain,t3_edurh2,https://www.reddit.com/r/livonia/comments/edurh2/clear_blue_sky_today/,Clear blue sky today,/r/livonia/comments/edurh2/clear_blue_sky_today/fbyxhx3/,1,r/livonia,0,1
Help make Everything Livonia a top notch place... Recently started up,t2_hvvqs,karate134,0,1577225748.0,0,t1_fbytam3,fbytam3,True,Gunnery_SgtHartman,t3_ef7l4c,https://www.reddit.com/r/livonia/comments/ef7l4c/i_have_arrived_here_because_all_things_livonia_is/,I have arrived here because All Things Livonia is closed for the holidays,/r/livonia/comments/ef7l4c/i_have_arrived_here_because_all_things_livonia_is/fbytam3/,3,r/livonia,0,3
Go-to Facebook and 'for the love of Louie's page if you haven't.... Lots of eyes on that page,t2_hvvqs,karate134,0,1575773932.0,0,t1_fa1sxko,fa1sxko,True,Heromanv1,t3_e7nbli,https://www.reddit.com/r/livonia/comments/e7nbli/cat_finding_mania_happened_to_me_looking_for/,Cat finding mania happened to me. Looking for Calico cat.,/r/livonia/comments/e7nbli/cat_finding_mania_happened_to_me_looking_for/fa1sxko/,1,r/livonia,0,1
"In all likelihood it was just financial. They may have decided it wasn't making enough to be sustainable/profitable in the long run, and that the lease expiration was a logical time to get out without owing the landlord anything for breaking it. It's a shame because I liked that place. Still, while there may be more to the story, it probably just comes down to money.",t2_jxhsa,strangeattractor0,0,1575762848.0,0,t1_fa10juh,fa10juh,False,KevIntensity,t3_e7a06h,https://www.reddit.com/r/livonia/comments/e7a06h/what_happened_to_claddagh/,What happened to Claddagh??,/r/livonia/comments/e7a06h/what_happened_to_claddagh/fa10juh/,2,r/livonia,0,2
"I read the article. But that reason seems less than complete given the abruptness of the closure and that the pub had events scheduled out into the future.

It seems like we aren’t getting the whole story.",t2_bwftb,KevIntensity,0,1575728886.0,0,t1_f9yhwpk,f9yhwpk,False,KevIntensity,t3_e7a06h,https://www.reddit.com/r/livonia/comments/e7a06h/what_happened_to_claddagh/,What happened to Claddagh??,/r/livonia/comments/e7a06h/what_happened_to_claddagh/f9yhwpk/,1,r/livonia,0,1
"""Justin O'Driscoll, the operations director for Claddagh Irish Pubs based in Cleveland, said the restaurant's lease was up at the end of the month and they decided not to renew it.""",t2_15jf00,hTOKJTRHMdw,0,1575708260.0,0,t1_f9xbd9h,f9xbd9h,True,KevIntensity,t3_e7a06h,https://www.reddit.com/r/livonia/comments/e7a06h/what_happened_to_claddagh/,What happened to Claddagh??,/r/livonia/comments/e7a06h/what_happened_to_claddagh/f9xbd9h/,2,r/livonia,0,2
ripjohnmcain - Not sure the point of your comments???,t2_486ljsf8,LIvResident,0,1569444676.0,0,t1_f1fhnfx,f1fhnfx,True,LIvResident,t3_d1ij07,https://www.reddit.com/r/livonia/comments/d1ij07/2019_mstep_and_sat_scores/,2019 M-Step and SAT Scores,/r/livonia/comments/d1ij07/2019_mstep_and_sat_scores/f1fhnfx/,1,r/livonia,0,1
my dad works as a professor at madonna!,t2_33aozhqt,ripjohnmcain,0,1569354868.0,0,t1_f1ccr2k,f1ccr2k,True,nerd-dftba,t3_bjjwi3,https://www.reddit.com/r/livonia/comments/bjjwi3/questions_about_livonia/,Questions About Livonia,/r/livonia/comments/bjjwi3/questions_about_livonia/f1ccr2k/,1,r/livonia,0,1
8rd?,t2_33aozhqt,ripjohnmcain,0,1569354640.0,0,t1_f1ccdgp,f1ccdgp,True,LIvResident,t3_d1ij07,https://www.reddit.com/r/livonia/comments/d1ij07/2019_mstep_and_sat_scores/,2019 M-Step and SAT Scores,/r/livonia/comments/d1ij07/2019_mstep_and_sat_scores/f1ccdgp/,1,r/livonia,0,1
no please no more!,t2_33aozhqt,ripjohnmcain,0,1569354516.0,0,t1_f1cc68r,f1cc68r,True,LIvResident,t3_d1ij07,https://www.reddit.com/r/livonia/comments/d1ij07/2019_mstep_and_sat_scores/,2019 M-Step and SAT Scores,/r/livonia/comments/d1ij07/2019_mstep_and_sat_scores/f1cc68r/,1,r/livonia,0,1
I live in the same city I just found it funny,t2_33aozhqt,ripjohnmcain,0,1568416207.0,0,t1_f05ptfv,f05ptfv,False,[deleted],t3_d3vpvx,https://www.reddit.com/r/livonia/comments/d3vpvx/why_is_there_a_whole_subreddit_about_a_suburb_in/,Why is there a whole subreddit about a suburb in Michigan,/r/livonia/comments/d3vpvx/why_is_there_a_whole_subreddit_about_a_suburb_in/f05ptfv/,1,r/livonia,0,1
"Because it’s a big, interesting suburb of Detroit. And perhaps, just perhaps we happen to really like it here. Ok?",t2_1fikmu5x,heythatsmysong,0,1568414379.0,0,t1_f05nhex,f05nhex,True,[deleted],t3_d3vpvx,https://www.reddit.com/r/livonia/comments/d3vpvx/why_is_there_a_whole_subreddit_about_a_suburb_in/,Why is there a whole subreddit about a suburb in Michigan,/r/livonia/comments/d3vpvx/why_is_there_a_whole_subreddit_about_a_suburb_in/f05nhex/,1,r/livonia,0,1
"Wow that's pretty sad, not a surprise though coming from someone who was in LPS all of public school.",t2_b158d,MiittchXD,0,1567988727.0,0,t1_ezm9fdj,ezm9fdj,True,LIvResident,t3_d1ij07,https://www.reddit.com/r/livonia/comments/d1ij07/2019_mstep_and_sat_scores/,2019 M-Step and SAT Scores,/r/livonia/comments/d1ij07/2019_mstep_and_sat_scores/ezm9fdj/,1,r/livonia,0,1
Jim Jordan’s Barber Shop on Merriman in between Joy Road & Ann Arbor Trail.,t2_47ml9aaz,gault_timothy,0,1567559020.0,0,t1_eyxp5zf,eyxp5zf,True,burnedflag,t3_cj0c33,https://www.reddit.com/r/livonia/comments/cj0c33/good_barber_shops_in_livoniawestland/,Good Barber shops in Livonia/Westland?,/r/livonia/comments/cj0c33/good_barber_shops_in_livoniawestland/eyxp5zf/,1,r/livonia,0,1
" Spread the word to your neighbors to mark calendars for September 26, 2019, 7 pm, Livonia City Hall. Mayoral and Council candidates will be in attendance to answer your questions. Bring your concerns and comments for our candidates and make them work for us. These are PAID positions and this election business should operate like a job interview. An educated, active populace makes for a strong city!",t2_42d5wl9e,loubens_mirth,0,1566217359.0,0,t1_exejgh5,exejgh5,True,LIvResident,t3_chdquc,https://www.reddit.com/r/livonia/comments/chdquc/livonia_aug_2019_election_information/,Livonia Aug 2019 Election Information,/r/livonia/comments/chdquc/livonia_aug_2019_election_information/exejgh5/,1,r/livonia,0,1
Post primary sightings around Livonia show lots of Green Brosnan for Mayor signs.,t2_42d5wl9e,loubens_mirth,0,1565615209.0,0,t1_ewodsro,ewodsro,True,LIvResident,t3_chdquc,https://www.reddit.com/r/livonia/comments/chdquc/livonia_aug_2019_election_information/,Livonia Aug 2019 Election Information,/r/livonia/comments/chdquc/livonia_aug_2019_election_information/ewodsro/,1,r/livonia,0,1
anyone find out anything?,t2_zwxia23,allofthechai93,0,1564612545.0,0,t1_evmsd8m,evmsd8m,True,Stuntman222,t3_ck53hk,https://www.reddit.com/r/livonia/comments/ck53hk/anyone_know_what_happens_to_the_guy_paralyzed_at/,Anyone know what happens to the guy paralyzed at Walmart?,/r/livonia/comments/ck53hk/anyone_know_what_happens_to_the_guy_paralyzed_at/evmsd8m/,1,r/livonia,0,1
It was on Sunday sometime after 8pm,t2_x66x5,Stuntman222,0,1564595730.0,0,t1_evlkbre,evlkbre,False,Stuntman222,t3_ck53hk,https://www.reddit.com/r/livonia/comments/ck53hk/anyone_know_what_happens_to_the_guy_paralyzed_at/,Anyone know what happens to the guy paralyzed at Walmart?,/r/livonia/comments/ck53hk/anyone_know_what_happens_to_the_guy_paralyzed_at/evlkbre/,2,r/livonia,0,2
When was this?,t2_1fikmu5x,heythatsmysong,0,1564570430.0,0,t1_evjv4mv,evjv4mv,True,Stuntman222,t3_ck53hk,https://www.reddit.com/r/livonia/comments/ck53hk/anyone_know_what_happens_to_the_guy_paralyzed_at/,Anyone know what happens to the guy paralyzed at Walmart?,/r/livonia/comments/ck53hk/anyone_know_what_happens_to_the_guy_paralyzed_at/evjv4mv/,2,r/livonia,0,2
Carsons on Wayne and Ann Arbor trail is my personal favorite,t2_q5hgo,Xudda,0,1564547555.0,0,t1_eviqyhg,eviqyhg,True,burnedflag,t3_cj0c33,https://www.reddit.com/r/livonia/comments/cj0c33/good_barber_shops_in_livoniawestland/,Good Barber shops in Livonia/Westland?,/r/livonia/comments/cj0c33/good_barber_shops_in_livoniawestland/eviqyhg/,1,r/livonia,0,1
"The Spartan’s place on six and Farmington. Great haircuts, family owned, only like 17 bucks for a cut, and the guys there are the nicest. My family had gone there for 30+ years and never had a problem.",t2_22k7ash6,Andrewdaghost,0,1564373626.0,0,t1_evbdlo2,evbdlo2,True,burnedflag,t3_cj0c33,https://www.reddit.com/r/livonia/comments/cj0c33/good_barber_shops_in_livoniawestland/,Good Barber shops in Livonia/Westland?,/r/livonia/comments/cj0c33/good_barber_shops_in_livoniawestland/evbdlo2/,1,r/livonia,0,1
"Ford Road Barbers, near the NE corner of Ford and Middlebelt in Garden City.",t2_akvtr,abscondo63,0,1564368109.0,0,t1_evb7gu1,evb7gu1,True,burnedflag,t3_cj0c33,https://www.reddit.com/r/livonia/comments/cj0c33/good_barber_shops_in_livoniawestland/,Good Barber shops in Livonia/Westland?,/r/livonia/comments/cj0c33/good_barber_shops_in_livoniawestland/evb7gu1/,1,r/livonia,0,1
"Oh, I’ve never had that problem before. I don’t know about the other barbers, either, as I the first one who did mine did a great job so I just ask for her.",t2_3cidfckd,MoonbliWoF2,0,1564358169.0,0,t1_evav8bm,evav8bm,False,burnedflag,t3_cj0c33,https://www.reddit.com/r/livonia/comments/cj0c33/good_barber_shops_in_livoniawestland/,Good Barber shops in Livonia/Westland?,/r/livonia/comments/cj0c33/good_barber_shops_in_livoniawestland/evav8bm/,1,r/livonia,0,1
"Barber Post at Middlebelt and 8 mile is pretty good, although it’s been 8 years since I’ve moved but they have 4.7 stars on google reviews so I’m sure they’re still awesome",t2_8td8b,GArbAGeMAn113,0,1564357898.0,0,t1_evauwdb,evauwdb,True,burnedflag,t3_cj0c33,https://www.reddit.com/r/livonia/comments/cj0c33/good_barber_shops_in_livoniawestland/,Good Barber shops in Livonia/Westland?,/r/livonia/comments/cj0c33/good_barber_shops_in_livoniawestland/evauwdb/,1,r/livonia,0,1
Mecanix on Eight Mile does a great job with mine!,t2_3cidfckd,MoonbliWoF2,0,1564349670.0,0,t1_evak06p,evak06p,True,burnedflag,t3_cj0c33,https://www.reddit.com/r/livonia/comments/cj0c33/good_barber_shops_in_livoniawestland/,Good Barber shops in Livonia/Westland?,/r/livonia/comments/cj0c33/good_barber_shops_in_livoniawestland/evak06p/,1,r/livonia,0,1
"Scores on Plymouth. Never had a bad cut there. The only do same day appointments but take walk ins too, and they have a nice waiting area. Ask for Donna, she rocks!",t2_6aw8c,Galloughs,0,1564344034.0,0,t1_evac4fi,evac4fi,True,burnedflag,t3_cj0c33,https://www.reddit.com/r/livonia/comments/cj0c33/good_barber_shops_in_livoniawestland/,Good Barber shops in Livonia/Westland?,/r/livonia/comments/cj0c33/good_barber_shops_in_livoniawestland/evac4fi/,3,r/livonia,0,3
This looks great! Thank you for putting all of this together! I really hope people take this into consideration because Livonia needs a shake-up. Our government needs a younger/newer/more realistic group of people at the helm and hopefully people will turn up like the last election to make that happen!,t2_zwxia23,allofthechai93,0,1564027325.0,0,t1_eutksvt,eutksvt,True,LIvResident,t3_chdquc,https://www.reddit.com/r/livonia/comments/chdquc/livonia_aug_2019_election_information/,Livonia Aug 2019 Election Information,/r/livonia/comments/chdquc/livonia_aug_2019_election_information/eutksvt/,2,r/livonia,0,2
"To clarify, our current mayor, is very conservative and the front running candidate, Laura Toy is also very conservative.  Educate yourselves, the primary is on AUGUST 6th.",t2_42d5wl9e,loubens_mirth,0,1563892208.0,0,t1_eukrg0s,eukrg0s,False,SaintNerdyPants,t3_c2o1pj,https://www.reddit.com/r/livonia/comments/c2o1pj/relocating_to_livonia/,Relocating to Livonia,/r/livonia/comments/c2o1pj/relocating_to_livonia/eukrg0s/,1,r/livonia,0,1
"Livonia is a good community.  We need more progressive, open minded people moving to our city.  Best of luck to you and your family!",t2_42d5wl9e,loubens_mirth,0,1563890637.0,0,t1_eukn9v5,eukn9v5,True,SaintNerdyPants,t3_c2o1pj,https://www.reddit.com/r/livonia/comments/c2o1pj/relocating_to_livonia/,Relocating to Livonia,/r/livonia/comments/c2o1pj/relocating_to_livonia/eukn9v5/,1,r/livonia,0,1
"Something for all to consider as you head to the polls in August.

In April, 2019 our building department in Livonia issued PO19-0102 for a business on 8 Mile near Milburn.  The stated purpose for this building is as ""a growth facility of marijuana, no dispensary allowed.""

In the November election 55% of voters in Livonia voted in favor of Prop 1.  Immediately after the election without any thoughtful discussion or research, our city government opted Livonia out of any and all marijuana business prospects.

So, the question I want Laura Toy to answer is how this building was given a permit in April, 2019 to operate as a grow operation in the city of Livonia when your council unanimously opted us out of the industry in late 2018?

I have confirmation that this building and it's operators do NOT possess a cannabis license from the state, yet our city has granted them a grow permit.   Who is this person growing for and why are they allowed to do it without licensing?  Why is Livonia giving this building a special consideration?  

Join me tonight at city hall to try and get an answer to these questions and more from those begging for our votes.",t2_42d5wl9e,loubens_mirth,0,1563887607.0,0,t1_eukfhma,eukfhma,True,3PointOneFour,t3_c6sra4,https://www.reddit.com/r/livonia/comments/c6sra4/livonia_mayoral_election_in_november/,Livonia Mayoral Election in November,/r/livonia/comments/c6sra4/livonia_mayoral_election_in_november/eukfhma/,1,r/livonia,0,1
"  I attended the Mayoral Primary Candidate Forum last Wednesday night at the library.  I was stunned to see that only two of the three candidates were in attendance.  While her contenders were on the hot seat answering questions on the fly from the voting audience, Ms. Laura Toy chose to not attend this forum.  I understand that there was a City Council meeting that was scheduled for the same time as this public forum and that is why Ms. Toy was not in attendance.  Does Laura Toy feel these types of public forums are beneath her that she is a shoo-in for the primary vote?

As voters are we to understand that Ms. Toy doesn’t consider it important to address public forum questions BEFORE the primary?  The forum is available via twitter and the chamber of commerce site.  I believe the voters deserve Ms. Toy’s input on the questions posed last Wednesday in order to make a fully informed decision on Primary voting day next month.",t2_42d5wl9e,loubens_mirth,0,1563886721.0,0,t1_eukd8wf,eukd8wf,True,3PointOneFour,t3_c6sra4,https://www.reddit.com/r/livonia/comments/c6sra4/livonia_mayoral_election_in_november/,Livonia Mayoral Election in November,/r/livonia/comments/c6sra4/livonia_mayoral_election_in_november/eukd8wf/,1,r/livonia,0,1
:),t2_svq1azp,deliquent_portal,0,1562169879.0,0,t1_esolg3j,esolg3j,True,Dead_RobotLT,t3_c8pjxm,https://www.reddit.com/r/livonia/comments/c8pjxm/idk/,Idk,/r/livonia/comments/c8pjxm/idk/esolg3j/,0,r/livonia,0,0
They didn't come back so I just went back to sleep. Still lost about an hour or two because of it but I at least fell back asleep.,t2_25mp998,Lefdety,0,1562040694.0,0,t1_esjsfyk,esjsfyk,False,[deleted],t3_c6frxy,https://www.reddit.com/r/livonia/comments/c6frxy/2_1617_year_olds_set_off_fireworks_on_the_corner/,2 16-17 year olds set off fireworks on the corner of Melrose and Lyndon. What should I do?,/r/livonia/comments/c6frxy/2_1617_year_olds_set_off_fireworks_on_the_corner/esjsfyk/,1,r/livonia,0,1
What did you end up doing?,t2_4qal5,3PointOneFour,0,1562027034.0,0,t1_esj6mxe,esj6mxe,True,[deleted],t3_c6frxy,https://www.reddit.com/r/livonia/comments/c6frxy/2_1617_year_olds_set_off_fireworks_on_the_corner/,2 16-17 year olds set off fireworks on the corner of Melrose and Lyndon. What should I do?,/r/livonia/comments/c6frxy/2_1617_year_olds_set_off_fireworks_on_the_corner/esj6mxe/,1,r/livonia,0,1
"Livonia Observer published this [article](https://www.hometownlife.com/story/news/local/livonia/2019/05/30/heres-everyone-running-elected-office-livonia/1285139001) in May.

There are 3 candidates running. 

Maureen Miller Brosnan - Former City Council President 

Bruce Tenniswood - Former firefighter new to Livonia politics

Laura Toy - Current city council president


You can follow both Toy and Miller-Brosnan’s prior voting record or lack thereof for whatever causes might be important to you using the cities council meeting minutes, if you tune into the tv broadcast feed you can watch Laura Toy in action.",t2_4qal5,3PointOneFour,0,1562021633.0,0,t1_esiwlyr,esiwlyr,True,3PointOneFour,t3_c6sra4,https://www.reddit.com/r/livonia/comments/c6sra4/livonia_mayoral_election_in_november/,Livonia Mayoral Election in November,/r/livonia/comments/c6sra4/livonia_mayoral_election_in_november/esiwlyr/,1,r/livonia,0,1
Is there anywhere we can get info on the candidates,t2_zwxia23,allofthechai93,0,1562009927.0,0,t1_esiah37,esiah37,True,3PointOneFour,t3_c6sra4,https://www.reddit.com/r/livonia/comments/c6sra4/livonia_mayoral_election_in_november/,Livonia Mayoral Election in November,/r/livonia/comments/c6sra4/livonia_mayoral_election_in_november/esiah37/,1,r/livonia,0,1
"if you're still concerned, I'm a POC who grew up in livonia and overall it's been pretty good. It's safe, which is why my parents moved us here. Yes, people have a certain expectation of how you maintain the status quo imo. By that I mean, like any suburban area, people expect you to maintain a certain decorum, maintain your yard etc, but I appreciate that. The people are friendly and one of my favorite things is taking evening walks in my neighborhood, you see all sorts of people out and about and we all wave and move on with our days. There are bound to be racists \[for the longest time there was this one huge ass truck/float with a Trump memorial on it being driven around and parked in front of the library, which was weird af\] But I def have seen a shift in demographics from when I was growing up. It's more diverse and I'm seeing a lot more POC around. The schools are also good, your kids won't have trouble.",t2_zwxia23,allofthechai93,0,1562009746.0,0,t1_esia5cj,esia5cj,True,SaintNerdyPants,t3_c2o1pj,https://www.reddit.com/r/livonia/comments/c2o1pj/relocating_to_livonia/,Relocating to Livonia,/r/livonia/comments/c2o1pj/relocating_to_livonia/esia5cj/,1,r/livonia,0,1
It is happening in my neighborhood too.  Will end around July 15th.,t2_9mwq0,sassyprofessor,0,1561934434.0,0,t1_esft8ao,esft8ao,True,[deleted],t3_c6frxy,https://www.reddit.com/r/livonia/comments/c6frxy/2_1617_year_olds_set_off_fireworks_on_the_corner/,2 16-17 year olds set off fireworks on the corner of Melrose and Lyndon. What should I do?,/r/livonia/comments/c6frxy/2_1617_year_olds_set_off_fireworks_on_the_corner/esft8ao/,1,r/livonia,0,1
Is there any resources on candidates and who is running?,t2_cn7fv,Defmachines88,0,1561820977.0,0,t1_esc4sax,esc4sax,True,3PointOneFour,t3_c6sra4,https://www.reddit.com/r/livonia/comments/c6sra4/livonia_mayoral_election_in_november/,Livonia Mayoral Election in November,/r/livonia/comments/c6sra4/livonia_mayoral_election_in_november/esc4sax/,1,r/livonia,0,1
You are saying mayor Dennis Wright is a Democrat? I didn’t think any elected officials in Livonia were anything but republican leaning,t2_4qal5,3PointOneFour,0,1561771552.0,0,t1_esax8ll,esax8ll,False,SaintNerdyPants,t3_c2o1pj,https://www.reddit.com/r/livonia/comments/c2o1pj/relocating_to_livonia/,Relocating to Livonia,/r/livonia/comments/c2o1pj/relocating_to_livonia/esax8ll/,1,r/livonia,0,1
We can all do our part by posting regularly — I live for the day we see 50+ posts a day in r/Livonia,t2_4qal5,3PointOneFour,0,1561771002.0,0,t1_esawlpv,esawlpv,False,[deleted],t3_c6frxy,https://www.reddit.com/r/livonia/comments/c6frxy/2_1617_year_olds_set_off_fireworks_on_the_corner/,2 16-17 year olds set off fireworks on the corner of Melrose and Lyndon. What should I do?,/r/livonia/comments/c6frxy/2_1617_year_olds_set_off_fireworks_on_the_corner/esawlpv/,2,r/livonia,0,2
Stay classy,t2_4qal5,3PointOneFour,0,1561770814.0,0,t1_esawdwv,esawdwv,False,SaintNerdyPants,t3_c2o1pj,https://www.reddit.com/r/livonia/comments/c2o1pj/relocating_to_livonia/,Relocating to Livonia,/r/livonia/comments/c2o1pj/relocating_to_livonia/esawdwv/,2,r/livonia,0,2
Go buy some bigger ones and set them off in the same location to assert your dominance.,t2_ykew4,TheReformedBadger,0,1561724477.0,0,t1_es91phs,es91phs,True,[deleted],t3_c6frxy,https://www.reddit.com/r/livonia/comments/c6frxy/2_1617_year_olds_set_off_fireworks_on_the_corner/,2 16-17 year olds set off fireworks on the corner of Melrose and Lyndon. What should I do?,/r/livonia/comments/c6frxy/2_1617_year_olds_set_off_fireworks_on_the_corner/es91phs/,3,r/livonia,0,3
