body,author_fullname,author.name,controversiality,created,downs,fullname,id,is_root,link_author,link_id,link_permalink,link_title,permalink,score,subreddit_name_prefixed,total_awards_received,ups
"7 renown toxicologists have given their medical findings and only one of them has found not enough evidence to blame the death on asphyxiation. Now we are legitimately seeing if the US system will protect its citizens or ultimately reinforce this system of class and racial bias when carrying out the law. 

This is a corrupt system, only to see a man get choked to death while pleading for his life because he’s a black non violent criminal is unforgivable. It’s something you’re supposed to see in 3rd world countries with dictators. So are they dictators?

It’s either him or us now. And if they chose him get ready.",t2_a7h2kuxs,lokilockeddown,0,1617933366.0,0,t1_gtvtue5,gtvtue5,False,dooddad,t3_mmikc6,https://www.reddit.com/r/livonia/comments/mmikc6/if_derrick_chauvin_is_not_found_guilty_will_you/,If Derrick Chauvin is not found guilty will you go to a protest?,/r/livonia/comments/mmikc6/if_derrick_chauvin_is_not_found_guilty_will_you/gtvtue5/,3,r/livonia,0,3
You're not alone from what I hear.,t2_4r1cyi5b,dooddad,0,1617932981.0,0,t1_gtvt41o,gtvt41o,False,dooddad,t3_mmikc6,https://www.reddit.com/r/livonia/comments/mmikc6/if_derrick_chauvin_is_not_found_guilty_will_you/,If Derrick Chauvin is not found guilty will you go to a protest?,/r/livonia/comments/mmikc6/if_derrick_chauvin_is_not_found_guilty_will_you/gtvt41o/,1,r/livonia,0,1
I might burn some shit,t2_a7h2kuxs,lokilockeddown,0,1617932940.0,0,t1_gtvt16y,gtvt16y,True,dooddad,t3_mmikc6,https://www.reddit.com/r/livonia/comments/mmikc6/if_derrick_chauvin_is_not_found_guilty_will_you/,If Derrick Chauvin is not found guilty will you go to a protest?,/r/livonia/comments/mmikc6/if_derrick_chauvin_is_not_found_guilty_will_you/gtvt16y/,3,r/livonia,0,3
Thank you!,t2_45qol8z,bluekatt24,0,1617904402.0,0,t1_gtu3xg8,gtu3xg8,False,[deleted],t3_mmd664,https://www.reddit.com/r/livonia/comments/mmd664/dies_anyone_know_of_some_good_hair_stylists/,Dies anyone know of some good hair stylists around this area?,/r/livonia/comments/mmd664/dies_anyone_know_of_some_good_hair_stylists/gtu3xg8/,2,r/livonia,0,2
Absolutely,t2_bdh3jm4,Evmechanic,0,1617888426.0,0,t1_gtt3db0,gtt3db0,False,dooddad,t3_mmikc6,https://www.reddit.com/r/livonia/comments/mmikc6/if_derrick_chauvin_is_not_found_guilty_will_you/,If Derrick Chauvin is not found guilty will you go to a protest?,/r/livonia/comments/mmikc6/if_derrick_chauvin_is_not_found_guilty_will_you/gtt3db0/,2,r/livonia,0,2
I wouldn't go out in that either 🤣,t2_4r1cyi5b,dooddad,0,1617885867.0,0,t1_gtsyh0w,gtsyh0w,False,dooddad,t3_mmikc6,https://www.reddit.com/r/livonia/comments/mmikc6/if_derrick_chauvin_is_not_found_guilty_will_you/,If Derrick Chauvin is not found guilty will you go to a protest?,/r/livonia/comments/mmikc6/if_derrick_chauvin_is_not_found_guilty_will_you/gtsyh0w/,2,r/livonia,0,2
And it's good to see other cops testifying for the prosecution.,t2_4r1cyi5b,dooddad,0,1617885808.0,0,t1_gtsyd7q,gtsyd7q,False,dooddad,t3_mmikc6,https://www.reddit.com/r/livonia/comments/mmikc6/if_derrick_chauvin_is_not_found_guilty_will_you/,If Derrick Chauvin is not found guilty will you go to a protest?,/r/livonia/comments/mmikc6/if_derrick_chauvin_is_not_found_guilty_will_you/gtsyd7q/,3,r/livonia,0,3
Can someone break down what actually is being limited by these new bills? In what way do they limit voting rights?,t2_4c0eptmi,KylerFurray,0,1617883966.0,0,t1_gtsux26,gtsux26,True,MemesForTheLeft69,t3_mmbpu9,https://www.reddit.com/r/livonia/comments/mmbpu9/there_are_a_lot_of_bills_to_limit_voting_rights/,there are a lot of bills to limit voting rights in the state government right now but together Michigan can make a difference! tell reps Jones and Pohutsky to protect voting rights,/r/livonia/comments/mmbpu9/there_are_a_lot_of_bills_to_limit_voting_rights/gtsux26/,1,r/livonia,0,1
Nice,t2_bdh3jm4,Evmechanic,0,1617877403.0,0,t1_gtsktx1,gtsktx1,True,MemesForTheLeft69,t3_mmbpu9,https://www.reddit.com/r/livonia/comments/mmbpu9/there_are_a_lot_of_bills_to_limit_voting_rights/,there are a lot of bills to limit voting rights in the state government right now but together Michigan can make a difference! tell reps Jones and Pohutsky to protect voting rights,/r/livonia/comments/mmbpu9/there_are_a_lot_of_bills_to_limit_voting_rights/gtsktx1/,1,r/livonia,0,1
"At least the prosecution is trying. A lot of times the prosecutor doesn't try on police trials, that's what makes people mad",t2_bdh3jm4,Evmechanic,0,1617874588.0,0,t1_gtshcf6,gtshcf6,True,dooddad,t3_mmikc6,https://www.reddit.com/r/livonia/comments/mmikc6/if_derrick_chauvin_is_not_found_guilty_will_you/,If Derrick Chauvin is not found guilty will you go to a protest?,/r/livonia/comments/mmikc6/if_derrick_chauvin_is_not_found_guilty_will_you/gtshcf6/,6,r/livonia,0,6
"I want D.Chauvin go to jail, but I can’t go outside because it’s -3c° here 💀",t2_bahd8k63,TelevisionPrevious34,0,1617861403.0,0,t1_gts29tf,gts29tf,True,dooddad,t3_mmikc6,https://www.reddit.com/r/livonia/comments/mmikc6/if_derrick_chauvin_is_not_found_guilty_will_you/,If Derrick Chauvin is not found guilty will you go to a protest?,/r/livonia/comments/mmikc6/if_derrick_chauvin_is_not_found_guilty_will_you/gts29tf/,1,r/livonia,0,1
"Saranda Salon in Westland!
They have a Facebook page where they post a lot of headshots of clients, so you can browse the work of the different stylists at that salon.",t2_6basehry,murpheyslawisabitch,0,1617851976.0,0,t1_gtrobfw,gtrobfw,True,[deleted],t3_mmd664,https://www.reddit.com/r/livonia/comments/mmd664/dies_anyone_know_of_some_good_hair_stylists/,Dies anyone know of some good hair stylists around this area?,/r/livonia/comments/mmd664/dies_anyone_know_of_some_good_hair_stylists/gtrobfw/,1,r/livonia,0,1
"Pohutsky is on it. Not that we shouldn't still call and show our support. 

I don't know anything about Jones.",t2_4r1cyi5b,dooddad,0,1617849924.0,0,t1_gtrkkwe,gtrkkwe,True,MemesForTheLeft69,t3_mmbpu9,https://www.reddit.com/r/livonia/comments/mmbpu9/there_are_a_lot_of_bills_to_limit_voting_rights/,there are a lot of bills to limit voting rights in the state government right now but together Michigan can make a difference! tell reps Jones and Pohutsky to protect voting rights,/r/livonia/comments/mmbpu9/there_are_a_lot_of_bills_to_limit_voting_rights/gtrkkwe/,2,r/livonia,0,2
Dīvainas vietas. Galīgi neizklausās pēc Livonijas.,t2_4ek6ute2,9-Volt-Battery,0,1617830298.0,0,t1_gtqhfmb,gtqhfmb,True,MemesForTheLeft69,t3_mmbpu9,https://www.reddit.com/r/livonia/comments/mmbpu9/there_are_a_lot_of_bills_to_limit_voting_rights/,there are a lot of bills to limit voting rights in the state government right now but together Michigan can make a difference! tell reps Jones and Pohutsky to protect voting rights,/r/livonia/comments/mmbpu9/there_are_a_lot_of_bills_to_limit_voting_rights/gtqhfmb/,0,r/livonia,0,0
Hope all is well! DMs are always open to new friends!,t2_c9l7q,AFellowStooge,0,1617559671.0,0,t1_gtdb1u3,gtdb1u3,True,[deleted],t3_mjix9c,https://www.reddit.com/r/livonia/comments/mjix9c/friends/,friends?,/r/livonia/comments/mjix9c/friends/gtdb1u3/,1,r/livonia,0,1
Hi!,t2_7qdyuug4,AbibliophobicSloth,0,1617548291.0,0,t1_gtcowql,gtcowql,True,[deleted],t3_mjix9c,https://www.reddit.com/r/livonia/comments/mjix9c/friends/,friends?,/r/livonia/comments/mjix9c/friends/gtcowql/,1,r/livonia,0,1
Hines? What's that?,t2_uez9n,Ghost2326,0,1617479705.0,0,t1_gt9zmyr,gt9zmyr,False,Ghost2326,t3_mjd3vd,https://www.reddit.com/r/livonia/comments/mjd3vd/any_good_smooth_and_preferably_flat_trails_in_the/,"Any good, smooth, and preferably flat trails in the area for longboarding",/r/livonia/comments/mjd3vd/any_good_smooth_and_preferably_flat_trails_in_the/gt9zmyr/,1,r/livonia,0,1
"I went to St. Joe’s. It was a stormy week and there were more births than normal, so it wasn’t perfect, but overall a good experience",t2_37p2u327,MinnieGoo,0,1617475262.0,0,t1_gt9qldf,gt9qldf,True,Evmechanic,t3_mizw64,https://www.reddit.com/r/livonia/comments/mizw64/good_hospital_for_giving_birth/,Good hospital for giving birth,/r/livonia/comments/mizw64/good_hospital_for_giving_birth/gt9qldf/,2,r/livonia,0,2
When they open up Hines on Saturdays during the summer it would probably be good for longboarding.,t2_8w22a9jl,original_orange_cat,0,1617474170.0,0,t1_gt9of76,gt9of76,True,Ghost2326,t3_mjd3vd,https://www.reddit.com/r/livonia/comments/mjd3vd/any_good_smooth_and_preferably_flat_trails_in_the/,"Any good, smooth, and preferably flat trails in the area for longboarding",/r/livonia/comments/mjd3vd/any_good_smooth_and_preferably_flat_trails_in_the/gt9of76/,1,r/livonia,0,1
"Oh, lol",t2_bdh3jm4,Evmechanic,0,1617465993.0,0,t1_gt98i6a,gt98i6a,False,Evmechanic,t3_mizw64,https://www.reddit.com/r/livonia/comments/mizw64/good_hospital_for_giving_birth/,Good hospital for giving birth,/r/livonia/comments/mizw64/good_hospital_for_giving_birth/gt98i6a/,2,r/livonia,0,2
"Oh no, I'm sorry to hear that.",t2_3n7dt,chet_lemon_party,0,1617464992.0,0,t1_gt96ls0,gt96ls0,False,Evmechanic,t3_mizw64,https://www.reddit.com/r/livonia/comments/mizw64/good_hospital_for_giving_birth/,Good hospital for giving birth,/r/livonia/comments/mizw64/good_hospital_for_giving_birth/gt96ls0/,1,r/livonia,0,1
"What happened to it, it looks awesome.",t2_8w22a9jl,original_orange_cat,0,1617464092.0,0,t1_gt94wmf,gt94wmf,False,Pikajane,t3_lthw0c,https://www.reddit.com/r/livonia/comments/lthw0c/beverly_park_i_miss_it_so_much/,Beverly Park. I miss it so much,/r/livonia/comments/lthw0c/beverly_park_i_miss_it_so_much/gt94wmf/,3,r/livonia,0,3
"No, sorry -  I just keep accidentally calling it Beaumont instead of Providence",t2_15pgy3,JaJaJaJaded3806,0,1617455783.0,0,t1_gt8qmsb,gt8qmsb,False,Evmechanic,t3_mizw64,https://www.reddit.com/r/livonia/comments/mizw64/good_hospital_for_giving_birth/,Good hospital for giving birth,/r/livonia/comments/mizw64/good_hospital_for_giving_birth/gt8qmsb/,1,r/livonia,0,1
Is Beaumont bad?,t2_bdh3jm4,Evmechanic,0,1617451945.0,0,t1_gt8l7ik,gt8l7ik,False,Evmechanic,t3_mizw64,https://www.reddit.com/r/livonia/comments/mizw64/good_hospital_for_giving_birth/,Good hospital for giving birth,/r/livonia/comments/mizw64/good_hospital_for_giving_birth/gt8l7ik/,1,r/livonia,0,1
"We unfortunately had a bad experience there, so we're avoiding it this time",t2_bdh3jm4,Evmechanic,0,1617451898.0,0,t1_gt8l5hd,gt8l5hd,False,Evmechanic,t3_mizw64,https://www.reddit.com/r/livonia/comments/mizw64/good_hospital_for_giving_birth/,Good hospital for giving birth,/r/livonia/comments/mizw64/good_hospital_for_giving_birth/gt8l5hd/,2,r/livonia,0,2
We had our daughter at Providence in Novi and had a really good experience.,t2_3n7dt,chet_lemon_party,0,1617425838.0,0,t1_gt7u1cp,gt7u1cp,True,Evmechanic,t3_mizw64,https://www.reddit.com/r/livonia/comments/mizw64/good_hospital_for_giving_birth/,Good hospital for giving birth,/r/livonia/comments/mizw64/good_hospital_for_giving_birth/gt7u1cp/,1,r/livonia,0,1
"St Mary's, Livonia; ~~Beaumont~~Providence, Novi",t2_15pgy3,JaJaJaJaded3806,0,1617419288.0,0,t1_gt7kfqr,gt7kfqr,True,Evmechanic,t3_mizw64,https://www.reddit.com/r/livonia/comments/mizw64/good_hospital_for_giving_birth/,Good hospital for giving birth,/r/livonia/comments/mizw64/good_hospital_for_giving_birth/gt7kfqr/,3,r/livonia,0,3
Wooooo! me in livonia,t2_6oczi,ThatGuyHasaHugePenis,0,1616982000.0,0,t1_gsn4ixt,gsn4ixt,True,netcityvega,t3_mev2lp,https://www.reddit.com/r/livonia/comments/mev2lp/livonia_named_one_of_the_most_livable_small/,Livonia named one of the most livable small cities in the nation,/r/livonia/comments/mev2lp/livonia_named_one_of_the_most_livable_small/gsn4ixt/,1,r/livonia,0,1
Bates Burgers is located at the NW corner of 5 Mile & Farmington (the heart of downtown),t2_13ehqq,Rosierose109,0,1616975259.0,0,t1_gsmsp9g,gsmsp9g,True,netcityvega,t3_mev2lp,https://www.reddit.com/r/livonia/comments/mev2lp/livonia_named_one_of_the_most_livable_small/,Livonia named one of the most livable small cities in the nation,/r/livonia/comments/mev2lp/livonia_named_one_of_the_most_livable_small/gsmsp9g/,1,r/livonia,0,1
isn't Livonia one of the biggest cities in Michigan?,t2_79039yr6,BlueWrecker,0,1616966476.0,0,t1_gsmcdlr,gsmcdlr,True,netcityvega,t3_mev2lp,https://www.reddit.com/r/livonia/comments/mev2lp/livonia_named_one_of_the_most_livable_small/,Livonia named one of the most livable small cities in the nation,/r/livonia/comments/mev2lp/livonia_named_one_of_the_most_livable_small/gsmcdlr/,4,r/livonia,0,4
Congratulations!,t2_8r4xrmhi,ilikecartoonwomen,0,1616954673.0,0,t1_gslomfq,gslomfq,True,netcityvega,t3_mev2lp,https://www.reddit.com/r/livonia/comments/mev2lp/livonia_named_one_of_the_most_livable_small/,Livonia named one of the most livable small cities in the nation,/r/livonia/comments/mev2lp/livonia_named_one_of_the_most_livable_small/gslomfq/,3,r/livonia,0,3
If you're white.,t2_4r1cyi5b,dooddad,1,1616950018.0,0,t1_gslejyx,gslejyx,True,netcityvega,t3_mev2lp,https://www.reddit.com/r/livonia/comments/mev2lp/livonia_named_one_of_the_most_livable_small/,Livonia named one of the most livable small cities in the nation,/r/livonia/comments/mev2lp/livonia_named_one_of_the_most_livable_small/gslejyx/,1,r/livonia,0,1
Lol. A lot of livonia gov thinks it's the 1920's. I think it's Donovic and Jolly that want a dry city.,t2_4r1cyi5b,dooddad,0,1616684991.0,0,t1_gs6fphq,gs6fphq,False,[deleted],t3_kh96gk,https://www.reddit.com/r/livonia/comments/kh96gk/deleted_by_user/,[deleted by user],/r/livonia/comments/kh96gk/deleted_by_user/gs6fphq/,1,r/livonia,0,1
"Are they still trying, it's the twenties, but not the nineteen twenties",t2_bdh3jm4,Evmechanic,0,1616684877.0,0,t1_gs6ffe8,gs6ffe8,False,[deleted],t3_kh96gk,https://www.reddit.com/r/livonia/comments/kh96gk/deleted_by_user/,[deleted by user],/r/livonia/comments/kh96gk/deleted_by_user/gs6ffe8/,2,r/livonia,0,2
Whose road is it parked on?,t2_bdh3jm4,Evmechanic,0,1616684631.0,0,t1_gs6eubv,gs6eubv,True,[deleted],t3_mcc0n7,https://www.reddit.com/r/livonia/comments/mcc0n7/how_long_can_a_car_be_parked_outside_my_house/,How long can a car be parked outside my house before it can be reported as abandoned?,/r/livonia/comments/mcc0n7/how_long_can_a_car_be_parked_outside_my_house/gs6eubv/,1,r/livonia,0,1
"What a scumbag. 2 days? What were they thinking? Shitty neighbor.


Of course I'm talking about you, u/pmarilley025",t2_12pnf2,johnzischeme,0,1616678248.0,0,t1_gs60rc9,gs60rc9,True,[deleted],t3_mcc0n7,https://www.reddit.com/r/livonia/comments/mcc0n7/how_long_can_a_car_be_parked_outside_my_house/,How long can a car be parked outside my house before it can be reported as abandoned?,/r/livonia/comments/mcc0n7/how_long_can_a_car_be_parked_outside_my_house/gs60rc9/,1,r/livonia,0,1
"Only four days? There's a pandemic going on. I'm lucky if I get in my car once every couple of weeks!

If it's really bothering you that bad, you should go talk to them before you involve the city. A little neighborly discussion can go a long way.",t2_3n7dt,chet_lemon_party,0,1616648332.0,0,t1_gs4z7wb,gs4z7wb,True,[deleted],t3_mcc0n7,https://www.reddit.com/r/livonia/comments/mcc0n7/how_long_can_a_car_be_parked_outside_my_house/,How long can a car be parked outside my house before it can be reported as abandoned?,/r/livonia/comments/mcc0n7/how_long_can_a_car_be_parked_outside_my_house/gs4z7wb/,6,r/livonia,0,6
I believe city code states 48 hours without it moving at all. I called on my former neighbor across the street after he left his car in front of my house for 2 weeks. The city inspector will come out and put a citation on the car or on their front door. Make sure to let the city know their address.,t2_lcb9q,KaptainKinns,0,1616621806.0,0,t1_gs3kcw3,gs3kcw3,True,[deleted],t3_mcc0n7,https://www.reddit.com/r/livonia/comments/mcc0n7/how_long_can_a_car_be_parked_outside_my_house/,How long can a car be parked outside my house before it can be reported as abandoned?,/r/livonia/comments/mcc0n7/how_long_can_a_car_be_parked_outside_my_house/gs3kcw3/,1,r/livonia,0,1
you can also post this in /r/RetroDetroit.,t2_wqwoj,SupremoZanne,0,1615160690.0,0,t1_gq5kr3e,gq5kr3e,True,smooth_grooves,t3_la6357,https://www.reddit.com/r/livonia/comments/la6357/ive_curated_a_playlist_dedicated_to_remembering/,I've curated a playlist dedicated to remembering the instrumentals of the classic V98.7 FM Detroit (1995-2009) while also introducing listeners to the latest in Smooth Jazz,/r/livonia/comments/la6357/ive_curated_a_playlist_dedicated_to_remembering/gq5kr3e/,1,r/livonia,0,1
"I used to live next door! A dream come true. Chances were pretty high that if you went to Beverly Park in the late 90s-early 2000s, I asked you if you wanted to play tag!",t2_78ph9,Pikajane,0,1614448952.0,0,t1_gp1o63f,gp1o63f,False,Pikajane,t3_lthw0c,https://www.reddit.com/r/livonia/comments/lthw0c/beverly_park_i_miss_it_so_much/,Beverly Park. I miss it so much,/r/livonia/comments/lthw0c/beverly_park_i_miss_it_so_much/gp1o63f/,3,r/livonia,0,3
The fck is this spam,t2_171zix,sir_axe,0,1613589279.0,0,t1_gnsp859,gnsp859,True,[deleted],t3_l0oy7b,https://www.reddit.com/r/livonia/comments/l0oy7b/anyone_know_whats_going_on/,Anyone know what’s going on?,/r/livonia/comments/l0oy7b/anyone_know_whats_going_on/gnsp859/,0,r/livonia,0,0
In about 2 weeks,t2_66rnjpmf,Seldom-right,0,1612493484.0,0,t1_gm2kt3q,gm2kt3q,False,Seldom-right,t3_lan1t5,https://www.reddit.com/r/livonia/comments/lan1t5/workshop_for_rent/,Workshop for rent?,/r/livonia/comments/lan1t5/workshop_for_rent/gm2kt3q/,1,r/livonia,0,1
"I guess by time frame, are you talking immediately, or 6 months for now, etc...?",t2_dqhba,NoRemorse920,0,1612485449.0,0,t1_gm23t9v,gm23t9v,False,Seldom-right,t3_lan1t5,https://www.reddit.com/r/livonia/comments/lan1t5/workshop_for_rent/,Workshop for rent?,/r/livonia/comments/lan1t5/workshop_for_rent/gm23t9v/,1,r/livonia,0,1
"10x10 would be the smallest, and it would be only to apply the finish to the furniture so about an hour every day for a week. I would need to be able to leave my furniture overnight.",t2_66rnjpmf,Seldom-right,0,1612483036.0,0,t1_gm1ypci,gm1ypci,False,Seldom-right,t3_lan1t5,https://www.reddit.com/r/livonia/comments/lan1t5/workshop_for_rent/,Workshop for rent?,/r/livonia/comments/lan1t5/workshop_for_rent/gm1ypci/,1,r/livonia,0,1
How much space and what time frame are you thinking?,t2_dqhba,NoRemorse920,0,1612324247.0,0,t1_gltlu88,gltlu88,True,Seldom-right,t3_lan1t5,https://www.reddit.com/r/livonia/comments/lan1t5/workshop_for_rent/,Workshop for rent?,/r/livonia/comments/lan1t5/workshop_for_rent/gltlu88/,1,r/livonia,0,1
"She has a freaky good memory so I don't usually doubt her, but since I have like NO memory, she could tell me just about anything and I'd probably believe her, lol",t2_15pgy3,JaJaJaJaded3806,0,1611974683.0,0,t1_glbpupl,glbpupl,False,macabre_trout,t3_l7kjca,https://www.reddit.com/r/livonia/comments/l7kjca/did_anyone_attend_franklin_high_school_in_the/,Did anyone attend Franklin High School in the mid-90s?,/r/livonia/comments/l7kjca/did_anyone_attend_franklin_high_school_in_the/glbpupl/,1,r/livonia,0,1
"I could swear their death dates were in the mid to late 1980s, but she may be right.",t2_il6ax,macabre_trout,0,1611973444.0,0,t1_glbnc6d,glbnc6d,False,macabre_trout,t3_l7kjca,https://www.reddit.com/r/livonia/comments/l7kjca/did_anyone_attend_franklin_high_school_in_the/,Did anyone attend Franklin High School in the mid-90s?,/r/livonia/comments/l7kjca/did_anyone_attend_franklin_high_school_in_the/glbnc6d/,1,r/livonia,0,1
"Arthur Copeland, either Marvin Dicks or Craig Dix, and Daniel Keith, she thinks.",t2_15pgy3,JaJaJaJaded3806,0,1611972672.0,0,t1_glblskk,glblskk,False,macabre_trout,t3_l7kjca,https://www.reddit.com/r/livonia/comments/l7kjca/did_anyone_attend_franklin_high_school_in_the/,Did anyone attend Franklin High School in the mid-90s?,/r/livonia/comments/l7kjca/did_anyone_attend_franklin_high_school_in_the/glblskk/,1,r/livonia,0,1
"The only deaths I remember from Franklin were the two girls who died in car accidents (separate ones), and the boy who was hit and killed walking to school.

Edit: I asked a friend with a better memory. She remembers the plaque, and thinks they were killed in Vietnam.",t2_15pgy3,JaJaJaJaded3806,0,1611970735.0,0,t1_glbhuu9,glbhuu9,True,macabre_trout,t3_l7kjca,https://www.reddit.com/r/livonia/comments/l7kjca/did_anyone_attend_franklin_high_school_in_the/,Did anyone attend Franklin High School in the mid-90s?,/r/livonia/comments/l7kjca/did_anyone_attend_franklin_high_school_in_the/glbhuu9/,1,r/livonia,0,1
The only thing I can say is that it wasn't there in the early 80's when I was there.,t2_42724o65,RMMacFru,0,1611954420.0,0,t1_glahhxp,glahhxp,True,macabre_trout,t3_l7kjca,https://www.reddit.com/r/livonia/comments/l7kjca/did_anyone_attend_franklin_high_school_in_the/,Did anyone attend Franklin High School in the mid-90s?,/r/livonia/comments/l7kjca/did_anyone_attend_franklin_high_school_in_the/glahhxp/,1,r/livonia,0,1
Same! Buy And hold GME tho! And best wishes to all!,t2_8wee0uti,PretendImpress6697,0,1611857939.0,0,t1_gl4jlm9,gl4jlm9,False,[deleted],t3_l0oy7b,https://www.reddit.com/r/livonia/comments/l0oy7b/anyone_know_whats_going_on/,Anyone know what’s going on?,/r/livonia/comments/l0oy7b/anyone_know_whats_going_on/gl4jlm9/,2,r/livonia,0,2
Why did I get a notification about this post in a sub that I have never heard of,t2_785fdm9w,badmemegeneratorv2,0,1611690741.0,0,t1_gkuzssq,gkuzssq,True,[deleted],t3_l0oy7b,https://www.reddit.com/r/livonia/comments/l0oy7b/anyone_know_whats_going_on/,Anyone know what’s going on?,/r/livonia/comments/l0oy7b/anyone_know_whats_going_on/gkuzssq/,2,r/livonia,0,2
Okupējam šo subreddit,t2_179mg9zq,ceko_lv,0,1611658407.0,0,t1_gkt8ji6,gkt8ji6,True,ilikecartoonwomen,t3_k00ujg,https://www.reddit.com/r/livonia/comments/k00ujg/reddit_is_confused_about_livonia/,Reddit is confused about Livonia?,/r/livonia/comments/k00ujg/reddit_is_confused_about_livonia/gkt8ji6/,3,r/livonia,0,3
Yes,t2_6basehry,murpheyslawisabitch,0,1611114421.0,0,t1_gjwpwyd,gjwpwyd,False,[deleted],t3_l0oy7b,https://www.reddit.com/r/livonia/comments/l0oy7b/anyone_know_whats_going_on/,Anyone know what’s going on?,/r/livonia/comments/l0oy7b/anyone_know_whats_going_on/gjwpwyd/,1,r/livonia,0,1
Isn't this the Westland post office on Wayne road?,t2_47jz4,xfloormattx,0,1611111751.0,0,t1_gjwl86t,gjwl86t,True,[deleted],t3_l0oy7b,https://www.reddit.com/r/livonia/comments/l0oy7b/anyone_know_whats_going_on/,Anyone know what’s going on?,/r/livonia/comments/l0oy7b/anyone_know_whats_going_on/gjwl86t/,2,r/livonia,0,2
"So I'm going to bring my curonian brothers and fight y'all with swords for our lands name usage.

- curonian from Courland (Livonia)",t2_rf9jq0s,OSHeenius,0,1610925818.0,0,t1_gjnuz8v,gjnuz8v,True,ilikecartoonwomen,t3_k00ujg,https://www.reddit.com/r/livonia/comments/k00ujg/reddit_is_confused_about_livonia/,Reddit is confused about Livonia?,/r/livonia/comments/k00ujg/reddit_is_confused_about_livonia/gjnuz8v/,2,r/livonia,0,2
eating a lot of dried apricots could be bad for relationships though,t2_79039yr6,BlueWrecker,0,1610057328.0,0,t1_gih2o6q,gih2o6q,True,[deleted],t3_ksk8ak,https://www.reddit.com/r/livonia/comments/ksk8ak/nutritional_benefits_of_apricots_how_to_use_it/,Nutritional Benefits Of Apricots - How To Use It - Fruits.,/r/livonia/comments/ksk8ak/nutritional_benefits_of_apricots_how_to_use_it/gih2o6q/,1,r/livonia,0,1
Weird. I guess I never really noticed before.,t2_3pdcn,BigGreenYamo,0,1608608095.0,0,t1_ggno7uu,ggno7uu,False,[deleted],t3_kh96gk,https://www.reddit.com/r/livonia/comments/kh96gk/deleted_by_user/,[deleted by user],/r/livonia/comments/kh96gk/deleted_by_user/ggno7uu/,1,r/livonia,0,1
"You can’t buy spirits at either Costco in Livonia, only beer and wine. It’s the same for Kroger, Busch’s, and Meijer. The issue is sort of explained here: https://www.hometownlife.com/story/news/local/livonia/2016/07/20/kroger-denied-liquor-license/87328902/",t2_tltni,jordand30,0,1608584130.0,0,t1_ggmfo0d,ggmfo0d,False,[deleted],t3_kh96gk,https://www.reddit.com/r/livonia/comments/kh96gk/deleted_by_user/,[deleted by user],/r/livonia/comments/kh96gk/deleted_by_user/ggmfo0d/,4,r/livonia,0,4
Yes you acn buy Liquor at costco.,t2_53oh6ir3,Termanator1234,0,1608582270.0,0,t1_ggmbyx6,ggmbyx6,False,[deleted],t3_kh96gk,https://www.reddit.com/r/livonia/comments/kh96gk/deleted_by_user/,[deleted by user],/r/livonia/comments/kh96gk/deleted_by_user/ggmbyx6/,-1,r/livonia,0,-1
"Livonia has a law banning liquor sales at grocery stores.

Some on the council are trying to make Livonia a dry city.",t2_4r1cyi5b,dooddad,0,1608570251.0,0,t1_gglnpql,gglnpql,True,[deleted],t3_kh96gk,https://www.reddit.com/r/livonia/comments/kh96gk/deleted_by_user/,[deleted by user],/r/livonia/comments/kh96gk/deleted_by_user/gglnpql/,2,r/livonia,0,2
"Yes, but you can get ""Costco Liquor"" -- that is, Kirkland brand, at the Wine Palace on the other side of the freeway (north side?)",t2_7qdyuug4,AbibliophobicSloth,0,1608558827.0,0,t1_ggl3e7n,ggl3e7n,False,[deleted],t3_kh96gk,https://www.reddit.com/r/livonia/comments/kh96gk/deleted_by_user/,[deleted by user],/r/livonia/comments/kh96gk/deleted_by_user/ggl3e7n/,3,r/livonia,0,3
This is correct.,t2_tltni,jordand30,0,1608528230.0,0,t1_ggk5ldx,ggk5ldx,False,[deleted],t3_kh96gk,https://www.reddit.com/r/livonia/comments/kh96gk/deleted_by_user/,[deleted by user],/r/livonia/comments/kh96gk/deleted_by_user/ggk5ldx/,2,r/livonia,0,2
