body,author_fullname,author.name,controversiality,created,downs,fullname,id,is_root,link_author,link_id,link_permalink,link_title,permalink,score,subreddit_name_prefixed,total_awards_received,ups
">What are you top three ideas to help give Lynnwood a greater sense of place?

1.	Walkability – As mentioned by my post and a commenter who sees Lynnwood in a positive light, a car is necessary to get anywhere in town. Unless you are planning to live AT the mall there isn’t really a good feel anywhere in Lynwood to walk around, window-shop, or just get a feel of being out and about. Bike lanes are almost nonexistent as well. Yes, I am aware of the project being underway on 196th now to improve that area of Lynnwood for this exact purpose but it also is a couple years away and nothing was ever done before this point leaving this town way behind imho as compared to Edmonds, Bothell, Woodinville, and things even Everett has begun implementing downtown and around the waterfront.

2. Public transport – Currently there is a single line that passes by my house, and I have to take a 45-minute ride on it to get to the transit center… So even without the walking again I am left with little option but to drive to a destination.  The light rail is great for getting to Seattle and Swift line is great as a direct shot to another town but there is little option available if you are anywhere off from those thoroughfares.

3. Fewer strip malls and big box stores – The city has repeatedly echoed that it wants to develop and become a denser population but continues to build these hollow large parking lot facilities as if that’s going to do anything in creating a real feel for the town. I hate the parking lot aesthetic and that new Costco and Home Depot being shoehorned into an area that was already congested only makes things feel worse. Bring in more local eateries and hangout kind of places. We have a number of blue-collar sports dives in town but off the top of my head only Indigo comes to mind as a places with a real chill feel to it, no gimmick, in town. How about a brewery or two in the, “downtown” area? Or a popular café that isn’t a Starbucks? I was in Seattle the other day and stopped off at Elliot Bay books, that place was amazing, and we only have Barnes and Noble (Another large chain store) with no soul in it.  

I get the need for the box stores in a general sense but the planning of this city to put them in the center was poorly planned how I see it and those should be the kind of places you find on the edges of town, not your main economic district.

Edit: Just a small edit while thinking about it, I'd like to mention a lot of the general places you could hangout in the area have disappeared over the years, one of which I used to frequent as a kid was Walt's Card Shop behind the Taco Time. Can't really say there are many places around like that anymore.",t2_6q1vy,StoicAthos,0,1640917097.0,0,t1_hqmp0eg,hqmp0eg,False,StoicAthos,t3_rrninx,https://www.reddit.com/r/LynnwoodWA/comments/rrninx/i_dont_think_im_alone_here_but_i_think_lynnwood/,I don't think I'm alone here but I think Lynnwood kind of sucks.,/r/LynnwoodWA/comments/rrninx/i_dont_think_im_alone_here_but_i_think_lynnwood/hqmp0eg/,2,r/LynnwoodWA,0,2
Thanks. That one has popped up on my list of potentials.,t2_bp43hc4v,zombuca,0,1640909730.0,0,t1_hqm887i,hqm887i,False,[deleted],t3_rs5bti,https://www.reddit.com/r/LynnwoodWA/comments/rs5bti/apartment_recommendations/,Apartment recommendations,/r/LynnwoodWA/comments/rs5bti/apartment_recommendations/hqm887i/,2,r/LynnwoodWA,0,2
"I had a good experience with A'Capella apts - maintenance ppl were responsive & quick, pretty trees, gated w/security, and lots of little community events. Lots of families live there, so if you're not a fan of kids there's that, and it's by 99 so there is crime adjacent but I had no issues the 2+ years I was there.

Parking is dumb crowded though. Very stressful until I gave in and paid for an assigned covered spot. They will assign one based on which spots open up first but are great about reaching back out when one closer to your unit opens up until you're happy with where you are.",t2_ihszoft,SnailySyrup,0,1640905710.0,0,t1_hqlyh50,hqlyh50,True,[deleted],t3_rs5bti,https://www.reddit.com/r/LynnwoodWA/comments/rs5bti/apartment_recommendations/,Apartment recommendations,/r/LynnwoodWA/comments/rs5bti/apartment_recommendations/hqlyh50/,2,r/LynnwoodWA,0,2
What are you top three ideas to help give Lynnwood a greater sense of place?,t2_4grha,invno1,0,1640904923.0,0,t1_hqlwjsv,hqlwjsv,True,StoicAthos,t3_rrninx,https://www.reddit.com/r/LynnwoodWA/comments/rrninx/i_dont_think_im_alone_here_but_i_think_lynnwood/,I don't think I'm alone here but I think Lynnwood kind of sucks.,/r/LynnwoodWA/comments/rrninx/i_dont_think_im_alone_here_but_i_think_lynnwood/hqlwjsv/,2,r/LynnwoodWA,0,2
There's a complex behind the old Teds sporting goods on 156th and 99...don't go there. I see a police car at the complex every day and just this week swat had to deal with a hostage situation.,t2_8my0rymb,pbcmini,0,1640901512.0,0,t1_hqlo2kg,hqlo2kg,True,[deleted],t3_rs5bti,https://www.reddit.com/r/LynnwoodWA/comments/rs5bti/apartment_recommendations/,Apartment recommendations,/r/LynnwoodWA/comments/rs5bti/apartment_recommendations/hqlo2kg/,1,r/LynnwoodWA,0,1
"Lynnwood garden village has been mostly good
They're not new, but maintained fairly well. My rent for a 2bed 800sq is $1355, in 5 years it's never gone up",t2_46v7e9np,gun_decker,0,1640884906.0,0,t1_hqkh3du,hqkh3du,True,[deleted],t3_rs5bti,https://www.reddit.com/r/LynnwoodWA/comments/rs5bti/apartment_recommendations/,Apartment recommendations,/r/LynnwoodWA/comments/rs5bti/apartment_recommendations/hqkh3du/,3,r/LynnwoodWA,0,3
"Used to live in the Martha lake apartments myself, and yeah they had an abundance of dumpsters!",t2_duygzg5d,IskaralPustFanClub,0,1640882962.0,0,t1_hqkbz4c,hqkbz4c,False,IskaralPustFanClub,t3_rrlkn2,https://www.reddit.com/r/LynnwoodWA/comments/rrlkn2/trash_piling_up_at_millwood_estates/,Trash piling up at Millwood Estates.,/r/LynnwoodWA/comments/rrlkn2/trash_piling_up_at_millwood_estates/hqkbz4c/,2,r/LynnwoodWA,0,2
Looks like Urban Center Apartments every other month when their compactor breaks..,t2_5scdwpv4,Oroh_Marblemoss,0,1640877723.0,0,t1_hqjz1zt,hqjz1zt,True,IskaralPustFanClub,t3_rrlkn2,https://www.reddit.com/r/LynnwoodWA/comments/rrlkn2/trash_piling_up_at_millwood_estates/,Trash piling up at Millwood Estates.,/r/LynnwoodWA/comments/rrlkn2/trash_piling_up_at_millwood_estates/hqjz1zt/,1,r/LynnwoodWA,0,1
Amazing they ditched all the dumpsters! Here at Martha Lake acriss the street we're overflowing even with the dang things here!,t2_60lfc,elswankador,0,1640877670.0,0,t1_hqjyxgg,hqjyxgg,False,IskaralPustFanClub,t3_rrlkn2,https://www.reddit.com/r/LynnwoodWA/comments/rrlkn2/trash_piling_up_at_millwood_estates/,Trash piling up at Millwood Estates.,/r/LynnwoodWA/comments/rrlkn2/trash_piling_up_at_millwood_estates/hqjyxgg/,1,r/LynnwoodWA,0,1
"Bullet dodged for you, I reckon!",t2_duygzg5d,IskaralPustFanClub,0,1640873601.0,0,t1_hqjq2a6,hqjq2a6,False,IskaralPustFanClub,t3_rrlkn2,https://www.reddit.com/r/LynnwoodWA/comments/rrlkn2/trash_piling_up_at_millwood_estates/,Trash piling up at Millwood Estates.,/r/LynnwoodWA/comments/rrlkn2/trash_piling_up_at_millwood_estates/hqjq2a6/,2,r/LynnwoodWA,0,2
Yikes. I almost moved in there.,t2_60lfc,elswankador,0,1640865438.0,0,t1_hqjc8pi,hqjc8pi,True,IskaralPustFanClub,t3_rrlkn2,https://www.reddit.com/r/LynnwoodWA/comments/rrlkn2/trash_piling_up_at_millwood_estates/,Trash piling up at Millwood Estates.,/r/LynnwoodWA/comments/rrlkn2/trash_piling_up_at_millwood_estates/hqjc8pi/,2,r/LynnwoodWA,0,2
"Yeah we came from greenwood when I was real little, now some 30 years later... Unfortunately it's not really any cheaper up here anymore and just don't get much for it.",t2_6q1vy,StoicAthos,0,1640843914.0,0,t1_hqij1ny,hqij1ny,False,StoicAthos,t3_rrninx,https://www.reddit.com/r/LynnwoodWA/comments/rrninx/i_dont_think_im_alone_here_but_i_think_lynnwood/,I don't think I'm alone here but I think Lynnwood kind of sucks.,/r/LynnwoodWA/comments/rrninx/i_dont_think_im_alone_here_but_i_think_lynnwood/hqij1ny/,5,r/LynnwoodWA,0,5
"Lynnwood's main attraction back in the day was that it was cheaper than Seattle but not super far away. We'll see what happens after the light rail station is done.

My parents moved to Lynnwood/Mountlake Terrace when I was young because at that time it was very affordable. I could be wrong but I don't think there was ever a plan to make a proper downtown.",t2_v0n5ud3,79GreenOnion,0,1640842654.0,0,t1_hqigtuo,hqigtuo,True,StoicAthos,t3_rrninx,https://www.reddit.com/r/LynnwoodWA/comments/rrninx/i_dont_think_im_alone_here_but_i_think_lynnwood/,I don't think I'm alone here but I think Lynnwood kind of sucks.,/r/LynnwoodWA/comments/rrninx/i_dont_think_im_alone_here_but_i_think_lynnwood/hqigtuo/,2,r/LynnwoodWA,0,2
Back when Lynnwood was made out of real wood.  Old coworkers spoke of 405 being a gravel two lane road with no traffic.  Skagit county elsewhere have that rural feel but it's hard to imagine that life so close to a city.,t2_e4n2o,B-ert,0,1640841606.0,0,t1_hqiey4m,hqiey4m,False,StoicAthos,t3_rrninx,https://www.reddit.com/r/LynnwoodWA/comments/rrninx/i_dont_think_im_alone_here_but_i_think_lynnwood/,I don't think I'm alone here but I think Lynnwood kind of sucks.,/r/LynnwoodWA/comments/rrninx/i_dont_think_im_alone_here_but_i_think_lynnwood/hqiey4m/,6,r/LynnwoodWA,0,6
"Huh. I’d noticed a bunch of construction there, but hadn’t seen the official plans.",t2_pgvxn,lizardmatriarch,0,1640841421.0,0,t1_hqiem04,hqiem04,False,StoicAthos,t3_rrninx,https://www.reddit.com/r/LynnwoodWA/comments/rrninx/i_dont_think_im_alone_here_but_i_think_lynnwood/,I don't think I'm alone here but I think Lynnwood kind of sucks.,/r/LynnwoodWA/comments/rrninx/i_dont_think_im_alone_here_but_i_think_lynnwood/hqiem04/,1,r/LynnwoodWA,0,1
"I’ve lived in Lynnwood for about 3 years now, work in SLU (when not wfh). Prior to that I was in Lake City and Northgate for a couple years, and downtown Tacoma for a couple years before that.

Lynnwood is definitely the burbs. We moved up here in search of a house we could afford, I think that’s most peoples story lol. 

Lynnwood definitely lacks the charm of downtown Edmonds, but I think it’s not too bad. Im looking forward to the new development by the transit center, looks promising. And honestly, overall with the light rail I feel like most of the Seattle area has become so much more accessible to me even living out in Lynnwood.

Edit: I’m also not far from the Meadowdale Beach Park which is a surprisingly nice park, and it’s also got some cool development in progress to restore the salmon habitat area and make the beach more accessible.",t2_13zhpzct,MrMeiko,0,1640841330.0,0,t1_hqieg1g,hqieg1g,True,StoicAthos,t3_rrninx,https://www.reddit.com/r/LynnwoodWA/comments/rrninx/i_dont_think_im_alone_here_but_i_think_lynnwood/,I don't think I'm alone here but I think Lynnwood kind of sucks.,/r/LynnwoodWA/comments/rrninx/i_dont_think_im_alone_here_but_i_think_lynnwood/hqieg1g/,6,r/LynnwoodWA,0,6
"Mentioned in another comment - https://www.northlinevillage.com/ is Lynnwood’s plan to address the lack of a city center or downtown area. How well it succeeds at that, we’ll see!",t2_13zhpzct,MrMeiko,0,1640840987.0,0,t1_hqidt4b,hqidt4b,False,StoicAthos,t3_rrninx,https://www.reddit.com/r/LynnwoodWA/comments/rrninx/i_dont_think_im_alone_here_but_i_think_lynnwood/,I don't think I'm alone here but I think Lynnwood kind of sucks.,/r/LynnwoodWA/comments/rrninx/i_dont_think_im_alone_here_but_i_think_lynnwood/hqidt4b/,6,r/LynnwoodWA,0,6
Lynnwood is trying to address this with the [Northline Village development](https://www.northlinevillage.com/) currently in progress,t2_13zhpzct,MrMeiko,0,1640840900.0,0,t1_hqidn91,hqidn91,False,StoicAthos,t3_rrninx,https://www.reddit.com/r/LynnwoodWA/comments/rrninx/i_dont_think_im_alone_here_but_i_think_lynnwood/,I don't think I'm alone here but I think Lynnwood kind of sucks.,/r/LynnwoodWA/comments/rrninx/i_dont_think_im_alone_here_but_i_think_lynnwood/hqidn91/,5,r/LynnwoodWA,0,5
"Imagine walking the gravel roads 60 years ago with your dog in the early afternoon, bugs flying about and snakes crossing the road. The only traffic will be your local delivery men that know you by name. Man I miss those days",t2_14oculjg,HomininofSeattle,0,1640839803.0,0,t1_hqibjov,hqibjov,True,StoicAthos,t3_rrninx,https://www.reddit.com/r/LynnwoodWA/comments/rrninx/i_dont_think_im_alone_here_but_i_think_lynnwood/,I don't think I'm alone here but I think Lynnwood kind of sucks.,/r/LynnwoodWA/comments/rrninx/i_dont_think_im_alone_here_but_i_think_lynnwood/hqibjov/,6,r/LynnwoodWA,1,6
"Having grown up in the Auburn/Tacoma area and then moving up here is like night and day in terms of people, food, diversity, and culture. Just depends on what you’re exposed to.",t2_15njyz,bunnyoutsidepie,0,1640838792.0,0,t1_hqi9k5l,hqi9k5l,True,StoicAthos,t3_rrninx,https://www.reddit.com/r/LynnwoodWA/comments/rrninx/i_dont_think_im_alone_here_but_i_think_lynnwood/,I don't think I'm alone here but I think Lynnwood kind of sucks.,/r/LynnwoodWA/comments/rrninx/i_dont_think_im_alone_here_but_i_think_lynnwood/hqi9k5l/,3,r/LynnwoodWA,0,3
"Lynwood definitely doesn’t have a “center” or “downtown” in the same way other city-units do, but I end up spending most of my time *in* Lynnwood for general life/errands stuff. 

Plus, the Lynnwood pool and library are way more convenient (and nicer!) than the Edmonds ones.

I don’t think there’s much nightlife in Lynnwood… but I don’t think a mainly commuter ‘burb wants that anyway?

It’ll be interesting to see how a big pedestrian transportation hub changes a very car-centric designed city.",t2_pgvxn,lizardmatriarch,0,1640835126.0,0,t1_hqi1uly,hqi1uly,True,StoicAthos,t3_rrninx,https://www.reddit.com/r/LynnwoodWA/comments/rrninx/i_dont_think_im_alone_here_but_i_think_lynnwood/,I don't think I'm alone here but I think Lynnwood kind of sucks.,/r/LynnwoodWA/comments/rrninx/i_dont_think_im_alone_here_but_i_think_lynnwood/hqi1uly/,9,r/LynnwoodWA,0,9
Pretty much sums it up. Everyone I met living in Lynnwood works either near UW or downtown Seattle.,t2_a6ak0,azdood85,0,1640834490.0,0,t1_hqi0gjt,hqi0gjt,False,StoicAthos,t3_rrninx,https://www.reddit.com/r/LynnwoodWA/comments/rrninx/i_dont_think_im_alone_here_but_i_think_lynnwood/,I don't think I'm alone here but I think Lynnwood kind of sucks.,/r/LynnwoodWA/comments/rrninx/i_dont_think_im_alone_here_but_i_think_lynnwood/hqi0gjt/,10,r/LynnwoodWA,0,10
"Thank you, this is what I meant to convey",t2_6q1vy,StoicAthos,0,1640830261.0,0,t1_hqhqymg,hqhqymg,False,StoicAthos,t3_rrninx,https://www.reddit.com/r/LynnwoodWA/comments/rrninx/i_dont_think_im_alone_here_but_i_think_lynnwood/,I don't think I'm alone here but I think Lynnwood kind of sucks.,/r/LynnwoodWA/comments/rrninx/i_dont_think_im_alone_here_but_i_think_lynnwood/hqhqymg/,8,r/LynnwoodWA,0,8
"Idk, I feel like Edmonds and Bothell avoid it well enough",t2_6q1vy,StoicAthos,0,1640830202.0,0,t1_hqhqts8,hqhqts8,False,StoicAthos,t3_rrninx,https://www.reddit.com/r/LynnwoodWA/comments/rrninx/i_dont_think_im_alone_here_but_i_think_lynnwood/,I don't think I'm alone here but I think Lynnwood kind of sucks.,/r/LynnwoodWA/comments/rrninx/i_dont_think_im_alone_here_but_i_think_lynnwood/hqhqts8/,2,r/LynnwoodWA,0,2
"Lynnwood exists for convenient commuting. It works to get to both Seattle and Bellevue due to being at the junction of 405 and I-5. 

Not really sure what you were expecting?",t2_k7j7k,Nateorade,0,1640828368.0,0,t1_hqhmpef,hqhmpef,True,StoicAthos,t3_rrninx,https://www.reddit.com/r/LynnwoodWA/comments/rrninx/i_dont_think_im_alone_here_but_i_think_lynnwood/,I don't think I'm alone here but I think Lynnwood kind of sucks.,/r/LynnwoodWA/comments/rrninx/i_dont_think_im_alone_here_but_i_think_lynnwood/hqhmpef/,31,r/LynnwoodWA,0,31
Yes it’s awful. So much rubbish.,t2_duygzg5d,IskaralPustFanClub,0,1640827015.0,0,t1_hqhjn15,hqhjn15,False,IskaralPustFanClub,t3_rrlkn2,https://www.reddit.com/r/LynnwoodWA/comments/rrlkn2/trash_piling_up_at_millwood_estates/,Trash piling up at Millwood Estates.,/r/LynnwoodWA/comments/rrlkn2/trash_piling_up_at_millwood_estates/hqhjn15/,2,r/LynnwoodWA,0,2
"Makes you realize just how much of that we messy, wasteful humans generate every day, doesn't it?",t2_a69jc,Cliff669,0,1640826588.0,0,t1_hqhiol7,hqhiol7,True,IskaralPustFanClub,t3_rrlkn2,https://www.reddit.com/r/LynnwoodWA/comments/rrlkn2/trash_piling_up_at_millwood_estates/,Trash piling up at Millwood Estates.,/r/LynnwoodWA/comments/rrlkn2/trash_piling_up_at_millwood_estates/hqhiol7/,7,r/LynnwoodWA,0,7
How cheap and disgusting. That's not a very good image. Wouldn't want to live there.,t2_bg0vqcit,Few_Membership_8392,0,1640825924.0,0,t1_hqhh689,hqhh689,True,IskaralPustFanClub,t3_rrlkn2,https://www.reddit.com/r/LynnwoodWA/comments/rrlkn2/trash_piling_up_at_millwood_estates/,Trash piling up at Millwood Estates.,/r/LynnwoodWA/comments/rrlkn2/trash_piling_up_at_millwood_estates/hqhh689/,4,r/LynnwoodWA,0,4
"Update 12/29/21 4:30 PM

It’s parked on 188th & 46th in front of the church. No one around. Weird.",t2_3yynepyf,Jclyde27,0,1640824911.0,0,t1_hqheuqx,hqheuqx,True,fleshamalgamate,t3_rq2rg7,https://www.reddit.com/r/LynnwoodWA/comments/rq2rg7/suspicious_black_bus/,Suspicious Black Bus,/r/LynnwoodWA/comments/rq2rg7/suspicious_black_bus/hqheuqx/,3,r/LynnwoodWA,0,3
"I mean, you're not wrong. But isn't that pretty much every suburb. . .everywhere?",t2_ej886ika,TheSkinny06,0,1640824431.0,0,t1_hqhdqav,hqhdqav,True,StoicAthos,t3_rrninx,https://www.reddit.com/r/LynnwoodWA/comments/rrninx/i_dont_think_im_alone_here_but_i_think_lynnwood/,I don't think I'm alone here but I think Lynnwood kind of sucks.,/r/LynnwoodWA/comments/rrninx/i_dont_think_im_alone_here_but_i_think_lynnwood/hqhdqav/,40,r/LynnwoodWA,0,40
The city might have to step in soon. That’s gonna be a health hazard if it remains that way . Thanks for sharing,t2_eu0kztoq,beetsmehunny,0,1640823126.0,0,t1_hqhaod7,hqhaod7,False,IskaralPustFanClub,t3_rrlkn2,https://www.reddit.com/r/LynnwoodWA/comments/rrlkn2/trash_piling_up_at_millwood_estates/,Trash piling up at Millwood Estates.,/r/LynnwoodWA/comments/rrlkn2/trash_piling_up_at_millwood_estates/hqhaod7/,9,r/LynnwoodWA,0,9
"‘Valet Trash’. Basically they limit each apartment to a single small trash bag per week, and their ‘valets’ (basically two people in a truck) pick them up. This is the trash piling up at the overflow site I guess.",t2_duygzg5d,IskaralPustFanClub,0,1640822391.0,0,t1_hqh8yak,hqh8yak,False,IskaralPustFanClub,t3_rrlkn2,https://www.reddit.com/r/LynnwoodWA/comments/rrlkn2/trash_piling_up_at_millwood_estates/,Trash piling up at Millwood Estates.,/r/LynnwoodWA/comments/rrlkn2/trash_piling_up_at_millwood_estates/hqh8yak/,11,r/LynnwoodWA,0,11
Valet for what exactly? If you know,t2_eu0kztoq,beetsmehunny,0,1640820615.0,0,t1_hqh4qer,hqh4qer,True,IskaralPustFanClub,t3_rrlkn2,https://www.reddit.com/r/LynnwoodWA/comments/rrlkn2/trash_piling_up_at_millwood_estates/,Trash piling up at Millwood Estates.,/r/LynnwoodWA/comments/rrlkn2/trash_piling_up_at_millwood_estates/hqh4qer/,4,r/LynnwoodWA,0,4
"This is the garbage piling up at the Millwood Estates apartments since they deemed it appropriate to remove their dumpsters for a valet service. I am not a resident here, but know people who are and this is what they get to wake up to each morning.",t2_duygzg5d,IskaralPustFanClub,0,1640819253.0,0,t1_hqh1g00,hqh1g00,True,IskaralPustFanClub,t3_rrlkn2,https://www.reddit.com/r/LynnwoodWA/comments/rrlkn2/trash_piling_up_at_millwood_estates/,Trash piling up at Millwood Estates.,/r/LynnwoodWA/comments/rrlkn2/trash_piling_up_at_millwood_estates/hqh1g00/,11,r/LynnwoodWA,0,11
It is BTZ7492.,t2_3somi5fk,fleshamalgamate,0,1640742231.0,0,t1_hqcsja2,hqcsja2,False,fleshamalgamate,t3_rq2rg7,https://www.reddit.com/r/LynnwoodWA/comments/rq2rg7/suspicious_black_bus/,Suspicious Black Bus,/r/LynnwoodWA/comments/rq2rg7/suspicious_black_bus/hqcsja2/,3,r/LynnwoodWA,0,3
I’ve also seen it on the north side of the WinCo parking lot.,t2_15njyz,bunnyoutsidepie,0,1640740144.0,0,t1_hqcnwyw,hqcnwyw,True,fleshamalgamate,t3_rq2rg7,https://www.reddit.com/r/LynnwoodWA/comments/rq2rg7/suspicious_black_bus/,Suspicious Black Bus,/r/LynnwoodWA/comments/rq2rg7/suspicious_black_bus/hqcnwyw/,3,r/LynnwoodWA,0,3
If anyone can provide the license plate number I might be able to dog a little.,t2_4yzf1bkc,mindfulminnow,0,1640736396.0,0,t1_hqcfhhd,hqcfhhd,True,fleshamalgamate,t3_rq2rg7,https://www.reddit.com/r/LynnwoodWA/comments/rq2rg7/suspicious_black_bus/,Suspicious Black Bus,/r/LynnwoodWA/comments/rq2rg7/suspicious_black_bus/hqcfhhd/,6,r/LynnwoodWA,0,6
"Yes. She purposely drove in circles to see if it was following her. It went in the same circle as her twice before she decided to turn down a street, park, and turn her lights off. It turned as well, but the white truck didn’t.",t2_3somi5fk,fleshamalgamate,0,1640728068.0,0,t1_hqbvuza,hqbvuza,False,fleshamalgamate,t3_rq2rg7,https://www.reddit.com/r/LynnwoodWA/comments/rq2rg7/suspicious_black_bus/,Suspicious Black Bus,/r/LynnwoodWA/comments/rq2rg7/suspicious_black_bus/hqbvuza/,6,r/LynnwoodWA,0,6
I've seen that creepy bus around town in various places even parked by my shop. Last time I saw it was at Freddies on 196th.,t2_8my0rymb,pbcmini,0,1640724276.0,0,t1_hqbmmfa,hqbmmfa,True,fleshamalgamate,t3_rq2rg7,https://www.reddit.com/r/LynnwoodWA/comments/rq2rg7/suspicious_black_bus/,Suspicious Black Bus,/r/LynnwoodWA/comments/rq2rg7/suspicious_black_bus/hqbmmfa/,3,r/LynnwoodWA,0,3
"Uhhh not sure about driving, but if you don't mind a walk you could check the Port of Edmonds out. People put lights on their boats and it's good fun.",t2_r6p8nvf,CabbagePatched,0,1640722175.0,0,t1_hqbhfox,hqbhfox,True,Content-Plum4020,t3_rn9hs6,https://www.reddit.com/r/LynnwoodWA/comments/rn9hs6/anyone_know_of_any_candy_cane_lane_neighborhoods/,Anyone know of any “candy cane lane” neighborhoods with Christmas lights nearby?,/r/LynnwoodWA/comments/rn9hs6/anyone_know_of_any_candy_cane_lane_neighborhoods/hqbhfox/,1,r/LynnwoodWA,0,1
Saw it parked on 188th St SW just east of the Filipino church near 46th Ave W. This was about ten days ago. Was there for 1/2 day then moved on.,t2_3yynepyf,Jclyde27,0,1640720186.0,0,t1_hqbchux,hqbchux,True,fleshamalgamate,t3_rq2rg7,https://www.reddit.com/r/LynnwoodWA/comments/rq2rg7/suspicious_black_bus/,Suspicious Black Bus,/r/LynnwoodWA/comments/rq2rg7/suspicious_black_bus/hqbchux/,3,r/LynnwoodWA,0,3
"I believe that this bus that was sitting on 52nd Ave, close to the mobile home park, just north of 186th.

I have not seen it since Whispering Pines Apartments were shut down, so I'm assuming that either someone who lived there owned it or had a relationship with whomever owns it.",t2_p1l89qn,M_A_X_77,0,1640715463.0,0,t1_hqb0jvn,hqb0jvn,True,fleshamalgamate,t3_rq2rg7,https://www.reddit.com/r/LynnwoodWA/comments/rq2rg7/suspicious_black_bus/,Suspicious Black Bus,/r/LynnwoodWA/comments/rq2rg7/suspicious_black_bus/hqb0jvn/,3,r/LynnwoodWA,0,3
"To be clear, when she was driving around in circles, we’re they following her while she was doing so?",t2_86f70c1y,throwsrug,0,1640704141.0,0,t1_hqa8nta,hqa8nta,True,fleshamalgamate,t3_rq2rg7,https://www.reddit.com/r/LynnwoodWA/comments/rq2rg7/suspicious_black_bus/,Suspicious Black Bus,/r/LynnwoodWA/comments/rq2rg7/suspicious_black_bus/hqa8nta/,10,r/LynnwoodWA,0,10
"I suspect a meth or oxy connection — the brake check thing may have just been coincidental and felt suspiciously connected. My parents had a similar RV parked on their street for a long time, there were always stacks of bicycles around. My mom thought this must be someone collecting bikes for kids in need…",t2_900pr,311TruthMovement,0,1640687412.0,0,t1_hq9hd44,hq9hd44,True,fleshamalgamate,t3_rq2rg7,https://www.reddit.com/r/LynnwoodWA/comments/rq2rg7/suspicious_black_bus/,Suspicious Black Bus,/r/LynnwoodWA/comments/rq2rg7/suspicious_black_bus/hq9hd44/,2,r/LynnwoodWA,0,2
Please keep us updated OP,t2_b6hbm9z2,mo4r-pow4,0,1640679532.0,0,t1_hq97skx,hq97skx,True,fleshamalgamate,t3_rq2rg7,https://www.reddit.com/r/LynnwoodWA/comments/rq2rg7/suspicious_black_bus/,Suspicious Black Bus,/r/LynnwoodWA/comments/rq2rg7/suspicious_black_bus/hq97skx/,4,r/LynnwoodWA,0,4
Sorry to hear about your experience.  Thanks for sharing.  Will keep a look out,t2_b6hbm9z2,mo4r-pow4,0,1640674628.0,0,t1_hq91a4a,hq91a4a,False,fleshamalgamate,t3_rq2rg7,https://www.reddit.com/r/LynnwoodWA/comments/rq2rg7/suspicious_black_bus/,Suspicious Black Bus,/r/LynnwoodWA/comments/rq2rg7/suspicious_black_bus/hq91a4a/,3,r/LynnwoodWA,0,3
"My husband said he saw several adult males getting into it a few weeks ago on the road in front of the Fred Meyer on 164th, where the semi trucks used to park along that fence. He doesn't know what they looked like/didn't get a view of their faces.",t2_11mjrv,puppetbird,0,1640673241.0,0,t1_hq8za11,hq8za11,True,fleshamalgamate,t3_rq2rg7,https://www.reddit.com/r/LynnwoodWA/comments/rq2rg7/suspicious_black_bus/,Suspicious Black Bus,/r/LynnwoodWA/comments/rq2rg7/suspicious_black_bus/hq8za11/,9,r/LynnwoodWA,0,9
It’s impossible to know for sure. My personal theory was that they thought no one was in the vehicle as you cannot peer in. Even the front windshield is black.,t2_3somi5fk,fleshamalgamate,0,1640673195.0,0,t1_hq8z7j1,hq8z7j1,False,fleshamalgamate,t3_rq2rg7,https://www.reddit.com/r/LynnwoodWA/comments/rq2rg7/suspicious_black_bus/,Suspicious Black Bus,/r/LynnwoodWA/comments/rq2rg7/suspicious_black_bus/hq8z7j1/,3,r/LynnwoodWA,0,3
