body,author_fullname,author.name,controversiality,created,downs,fullname,id,is_root,link_author,link_id,link_permalink,link_title,permalink,score,subreddit_name_prefixed,total_awards_received,ups
Yes but you have to know someone with dmv access,t2_2zbaw6ag,Red69black22,0,1629646386.0,0,t1_h9x3o05,h9x3o05,True,YeahItsJustCamille,t3_p8ekfg,https://www.reddit.com/r/LynnwoodWA/comments/p8ekfg/some_pos_keyed_my_car_any_way_to_look_someone_up/,Some POS keyed my car. Any way to look someone up through license plate or VIN?,/r/LynnwoodWA/comments/p8ekfg/some_pos_keyed_my_car_any_way_to_look_someone_up/h9x3o05/,3,r/LynnwoodWA,0,3
I would gladly sign a petition for stiffer noise laws and more patrols on popular street racing streets.,t2_7pfut,ChetRipley,0,1629573058.0,0,t1_h9tke5q,h9tke5q,True,500ls,t3_p2ywr7,https://www.reddit.com/r/LynnwoodWA/comments/p2ywr7/drag_racing_247/,Drag racing 24/7,/r/LynnwoodWA/comments/p2ywr7/drag_racing_247/h9tke5q/,3,r/LynnwoodWA,0,3
Namaste is really authentic: https://yelp.to/o8Zrp3k6Sib,t2_ndqrh61,uriejejejdjbejxijehd,0,1629502117.0,0,t1_h9q50l8,h9q50l8,True,Glorious-Sunshine,t3_ow5wos,https://www.reddit.com/r/LynnwoodWA/comments/ow5wos/indian_restaurant_recommendations/,Indian restaurant recommendations,/r/LynnwoodWA/comments/ow5wos/indian_restaurant_recommendations/h9q50l8/,1,r/LynnwoodWA,0,1
West of Highway 99 is the more dicey part of Lynnwood.,t2_3yynepyf,Jclyde27,0,1629074915.0,0,t1_h93kxs2,h93kxs2,True,CliftonForce,t3_p5157p,https://www.reddit.com/r/LynnwoodWA/comments/p5157p/saturday_shooting_at_james_village/,Saturday Shooting at James Village,/r/LynnwoodWA/comments/p5157p/saturday_shooting_at_james_village/h93kxs2/,1,r/LynnwoodWA,0,1
"Yes, racing is an issue. However, most of what we are all hearing are said “race cars” driving 5 over on their way home. It has recently become fashionable to advance the exhaust valve timing of 4 cylinder cars, which lets fire and high pressure out of the cylinder prematurely. This is fuck’n loud. On top of that, they are cutting out their catalytic inverters and removing the baffles inside their mufflers. 
These modifications actually refuse the performance of the engine and make them worse for racing. They are JUST loud and annoying. 
What we need to do is petition the city to put speed camera style ticketing poles in on key routs that activate at a certain decibel level after a specific time. In Snohomish County, that noise ordinance goes into effect at 9:00pm. 
If these pricks get so many tickets they lose their licenses, the problem will go away pretty quickly.",t2_9nzge,jedihooker,0,1629046002.0,0,t1_h91rsnv,h91rsnv,True,500ls,t3_p2ywr7,https://www.reddit.com/r/LynnwoodWA/comments/p2ywr7/drag_racing_247/,Drag racing 24/7,/r/LynnwoodWA/comments/p2ywr7/drag_racing_247/h91rsnv/,7,r/LynnwoodWA,0,7
I’d agree with this.,t2_13noi381,chas1ng_euphor1a,0,1628925722.0,0,t1_h8vwj5l,h8vwj5l,False,firelitdrgn,t3_lzkusr,https://www.reddit.com/r/LynnwoodWA/comments/lzkusr/just_moved_to_lynnwood_tell_me_your_most_and/,Just Moved to Lynnwood: tell me your most and least favorite thing!,/r/LynnwoodWA/comments/lzkusr/just_moved_to_lynnwood_tell_me_your_most_and/h8vwj5l/,1,r/LynnwoodWA,0,1
We probably live in the same area. Sounds about right.,t2_13noi381,chas1ng_euphor1a,0,1628925487.0,0,t1_h8vw8ph,h8vw8ph,False,MagicMan703,t3_n1cjkp,https://www.reddit.com/r/LynnwoodWA/comments/n1cjkp/living_near_manor_way/,Living near Manor Way,/r/LynnwoodWA/comments/n1cjkp/living_near_manor_way/h8vw8ph/,1,r/LynnwoodWA,0,1
We’ve had our cars rummaged through quite a few times. There’s a very rough area smack in the middle of a few regular nicer developments that really degrades the area—people nearby will probably know what I’m talking about.,t2_13noi381,chas1ng_euphor1a,0,1628925386.0,0,t1_h8vw4a0,h8vw4a0,True,MagicMan703,t3_n1cjkp,https://www.reddit.com/r/LynnwoodWA/comments/n1cjkp/living_near_manor_way/,Living near Manor Way,/r/LynnwoodWA/comments/n1cjkp/living_near_manor_way/h8vw4a0/,1,r/LynnwoodWA,0,1
Also literally right now lol,t2_dqn34x2,500ls,0,1628823573.0,0,t1_h8qlwbb,h8qlwbb,False,500ls,t3_p2ywr7,https://www.reddit.com/r/LynnwoodWA/comments/p2ywr7/drag_racing_247/,Drag racing 24/7,/r/LynnwoodWA/comments/p2ywr7/drag_racing_247/h8qlwbb/,1,r/LynnwoodWA,0,1
I always hear the drag racers on 99 every other night.,t2_u0c64,DammieIsAwesome,0,1628822769.0,0,t1_h8qk8d6,h8qk8d6,True,500ls,t3_p2ywr7,https://www.reddit.com/r/LynnwoodWA/comments/p2ywr7/drag_racing_247/,Drag racing 24/7,/r/LynnwoodWA/comments/p2ywr7/drag_racing_247/h8qk8d6/,1,r/LynnwoodWA,0,1
"Genuine question but how would you go about petitioning speed bumps or something else to deter it? We have drag racers on ash way almost every night and with windows open in summer forget sleeping.

In the past month had a car get T boned by a racer.",t2_3om427ag,bruseido,0,1628804699.0,0,t1_h8phb0w,h8phb0w,True,500ls,t3_p2ywr7,https://www.reddit.com/r/LynnwoodWA/comments/p2ywr7/drag_racing_247/,Drag racing 24/7,/r/LynnwoodWA/comments/p2ywr7/drag_racing_247/h8phb0w/,6,r/LynnwoodWA,0,6
"On top of the drag racing teens, 188th has fuel tankers, the entire costco box truck fleet, giant motorcycle trains going to HD, and the emergency vehicle route. The city doesn't give a shit. I'm moving next month, its the only way I can fix the never ending noise.",t2_3cjyk8e0,Hexagon_Ron,0,1628797917.0,0,t1_h8p08i0,h8p08i0,True,500ls,t3_p2ywr7,https://www.reddit.com/r/LynnwoodWA/comments/p2ywr7/drag_racing_247/,Drag racing 24/7,/r/LynnwoodWA/comments/p2ywr7/drag_racing_247/h8p08i0/,2,r/LynnwoodWA,0,2
Ichi Teriyaki,t2_dqkwhall,YellowMellow37,0,1628795435.0,0,t1_h8oucrn,h8oucrn,True,the_ranting_swede,t3_or12zd,https://www.reddit.com/r/LynnwoodWA/comments/or12zd/whats_your_favorite_teriyaki_place_in_lynnwood/,"What's your favorite Teriyaki place in Lynnwood, and what's your go-to order?",/r/LynnwoodWA/comments/or12zd/whats_your_favorite_teriyaki_place_in_lynnwood/h8oucrn/,2,r/LynnwoodWA,0,2
On 148th.. around 1AM-2AM..,t2_cypc349i,yoosh_C,0,1628781650.0,0,t1_h8nx284,h8nx284,True,500ls,t3_p2ywr7,https://www.reddit.com/r/LynnwoodWA/comments/p2ywr7/drag_racing_247/,Drag racing 24/7,/r/LynnwoodWA/comments/p2ywr7/drag_racing_247/h8nx284/,1,r/LynnwoodWA,0,1
(This post brought to you by Next Door),t2_5nc46,m_y,0,1628781461.0,0,t1_h8nwlsa,h8nwlsa,True,500ls,t3_p2ywr7,https://www.reddit.com/r/LynnwoodWA/comments/p2ywr7/drag_racing_247/,Drag racing 24/7,/r/LynnwoodWA/comments/p2ywr7/drag_racing_247/h8nwlsa/,18,r/LynnwoodWA,0,18
Every night.,t2_e4n2o,B-ert,0,1628781110.0,0,t1_h8nvrnc,h8nvrnc,False,500ls,t3_p2ywr7,https://www.reddit.com/r/LynnwoodWA/comments/p2ywr7/drag_racing_247/,Drag racing 24/7,/r/LynnwoodWA/comments/p2ywr7/drag_racing_247/h8nvrnc/,1,r/LynnwoodWA,0,1
I'd avoid Tasty Indian Bistro. It was really good in restaurant. But on Door Dash they sent me Tikka Masala that was straight up the jar sauce they sell at Fred Meyer.,t2_dqn34x2,500ls,0,1628770326.0,0,t1_h8n91hx,h8n91hx,True,Glorious-Sunshine,t3_ow5wos,https://www.reddit.com/r/LynnwoodWA/comments/ow5wos/indian_restaurant_recommendations/,Indian restaurant recommendations,/r/LynnwoodWA/comments/ow5wos/indian_restaurant_recommendations/h8n91hx/,0,r/LynnwoodWA,0,0
It was the very best,t2_dqn34x2,500ls,0,1628770224.0,0,t1_h8n8vaf,h8n8vaf,False,Glorious-Sunshine,t3_ow5wos,https://www.reddit.com/r/LynnwoodWA/comments/ow5wos/indian_restaurant_recommendations/,Indian restaurant recommendations,/r/LynnwoodWA/comments/ow5wos/indian_restaurant_recommendations/h8n8vaf/,1,r/LynnwoodWA,0,1
Are they going to mount the cops up on the traffic lights?,t2_14e3rd,EightPieceBox,1,1628730366.0,0,t1_h8luep7,h8luep7,True,jzgs18,t3_p2gtj2,https://www.reddit.com/r/LynnwoodWA/comments/p2gtj2/lynnwood_police_are_getting_body_cameras/,Lynnwood police are getting body cameras | HeraldNet.com,/r/LynnwoodWA/comments/p2gtj2/lynnwood_police_are_getting_body_cameras/h8luep7/,1,r/LynnwoodWA,0,1
"Having just done that super fun house hunt myself, I completely understand. That is a hell I do not wish to revisit for as long as possible. 

I honestly thought you must have been there for a LOT longer than a month if you already got a commitment to remove the bench and shelter. 

If your neighbor has a fence, maybe you can push for an exemption based on that? You might want that fence no matter what happens to the bus stop. 

I think patience and persistence is going to be what it takes. Do look into a window tint too - a lot of them will actually help keep your house cooler in the summer too. That and there should be some landscaping tricks you can do. Maybe consult with a couple of companies and have them give you ideas. You don’t have to have them do all or any of the work, but their expertise could be exactly what you need. Both of these will make you feel better living there whether or not there is a bus stop.

The primary just happened as well, so you know who is competing for re-election/ election. Make a point to talk to those lawmakers because now is the time. The more neighbors you can involve, the better your chances of success. 

I think you would have gotten a different response (at least from me) if you had included the empathetic information from the start. Your initial post made it seem like you didn’t care at all. 

Good luck!",t2_7z9ay960,OutrageousVariation7,0,1628616707.0,0,t1_h8fmiua,h8fmiua,False,[deleted],t3_p1fngg,https://www.reddit.com/r/LynnwoodWA/comments/p1fngg/how_do_i_get_a_bus_stop_removed/,How do I get a bus stop removed?,/r/LynnwoodWA/comments/p1fngg/how_do_i_get_a_bus_stop_removed/h8fmiua/,1,r/LynnwoodWA,0,1
"I do have sympathy. My first house was on a busier corner and I thought I would be fine with it because we had some trees, etc. 

Turns out I wasn’t. I hated it. I didn’t like doing anything in my front yard. And I would hate having my front windows face a bus stop too. It would make me feel constantly agitated. I don’t know that removing the stop will actually resolve the issue for you because you will still feel like people are walking by your house all the time. 

You have learned something about yourself, and eventually you will move, and when you do you will end up moving to a house that isn’t anywhere near a bus stop or a heavily trafficked street. And when you do, you will get a locking mailbox as one of your first agenda items (speaking from experience).

Now, you did not explain any of the things you vaguely mention here. Did removing the bench help? 

It sounds like your best option (other than moving) is to recruit neighbors to your cause. And showing sympathy for the riders/ system users will help you make a compelling case to the city. Look for reasons as to why removing the stop would make the bus riding experience better for them. 

I would still start looking into what it would take to move and how you can build some quick sweat equity to make that happen. Or, if it really makes you crazy, maybe you can rent the house out and find a condo that you can rent to live in while you build up enough equity and savings to purchase another home. It would likely be a great rental property.",t2_7z9ay960,OutrageousVariation7,0,1628608472.0,0,t1_h8f2x38,h8f2x38,False,[deleted],t3_p1fngg,https://www.reddit.com/r/LynnwoodWA/comments/p1fngg/how_do_i_get_a_bus_stop_removed/,How do I get a bus stop removed?,/r/LynnwoodWA/comments/p1fngg/how_do_i_get_a_bus_stop_removed/h8f2x38/,1,r/LynnwoodWA,0,1
"Lol, talk about entitlement. It's a public bus stop in the public right of way that was there before you moved in.",t2_j56us,ggrrqq,0,1628586406.0,0,t1_h8e2ejf,h8e2ejf,True,[deleted],t3_p1fngg,https://www.reddit.com/r/LynnwoodWA/comments/p1fngg/how_do_i_get_a_bus_stop_removed/,How do I get a bus stop removed?,/r/LynnwoodWA/comments/p1fngg/how_do_i_get_a_bus_stop_removed/h8e2ejf/,2,r/LynnwoodWA,0,2
"You knew about the bus stop when you bought the house, and it seems pretty selfish to think the “best option” is to have it removed. Is that the “best option” for the people who regularly use that bus stop? People who used that stop before you moved in?

I doubt you will get it removed, so modifications to YOUR lifestyle are in order. Your first option would be to sell the house and find one that is not by a bus stop. If that is not feasible for you then get a mailbox that locks, use a PO Box, put up the fence you can put up, put a mirror tent on your windows, etc. until it is a possibility.

You could also look into ways to make the bus stop not face your front door. Is there a way to reconfigure the seats or upgrade the shelter that would redirect attention from your house?

Ultimately, the chances of getting that stop removed are not great. You seem to be the only one upset by it, and there a greater number of people who rely on the stop than just one family. I imagine you haven’t got a cadre of neighbors to agree with you or you wouldn’t be posting here.",t2_7z9ay960,OutrageousVariation7,0,1628574991.0,0,t1_h8dp02f,h8dp02f,True,[deleted],t3_p1fngg,https://www.reddit.com/r/LynnwoodWA/comments/p1fngg/how_do_i_get_a_bus_stop_removed/,How do I get a bus stop removed?,/r/LynnwoodWA/comments/p1fngg/how_do_i_get_a_bus_stop_removed/h8dp02f/,10,r/LynnwoodWA,0,10
"My main suggestion is to never mail anything from your own mailbox.  Drop it at a mail box at a supermarket or by the library.  Try and get as much as you can on autopay and choose paper free statements.  I barely get any mail, less chance of theft and fraud.",t2_kykmg9y,CobraPony67,0,1628563604.0,0,t1_h8d6i1y,h8d6i1y,True,[deleted],t3_p1fngg,https://www.reddit.com/r/LynnwoodWA/comments/p1fngg/how_do_i_get_a_bus_stop_removed/,How do I get a bus stop removed?,/r/LynnwoodWA/comments/p1fngg/how_do_i_get_a_bus_stop_removed/h8d6i1y/,9,r/LynnwoodWA,0,9
"The legal system in the US makes building rail lines in urban/suburban areas incredibly expensive. The constitutional protections on private property make buying up land a difficult process compared to a similarly developed country as the US.

This is why almost every high speed rail project in the US keeps going incredibly over budget and is years behind schedule. People can't be forced off their land by another party. Personally I think that's a good thing.",t2_8km0q,the_ranting_swede,0,1628398193.0,0,t1_h84xt1a,h84xt1a,False,SharpBeat,t3_ozxsho,https://www.reddit.com/r/LynnwoodWA/comments/ozxsho/sound_transit_board_approves_realignment_plan/,"Sound Transit Board approves realignment plan, Everett Link impacted",/r/LynnwoodWA/comments/ozxsho/sound_transit_board_approves_realignment_plan/h84xt1a/,2,r/LynnwoodWA,0,2
Why the hell did the king county crisis team refuse to show? At least the Snohomish one was going to show up until he was out of their county. What was king county’s excuse?,t2_8tvcg,tigress666,0,1628388029.0,0,t1_h84gjbf,h84gjbf,True,SharpBeat,t3_ozzfxv,https://www.reddit.com/r/LynnwoodWA/comments/ozzfxv/i5_southbound_shutdown_near_mountlake_terrace_for/,I-5 southbound shutdown near Mountlake Terrace for person on the interstate,/r/LynnwoodWA/comments/ozzfxv/i5_southbound_shutdown_near_mountlake_terrace_for/h84gjbf/,10,r/LynnwoodWA,0,10
"2 hours until the mental health response team could arrive. 

What the fuck do we pay state patrol for?",t2_a6ak0,azdood85,0,1628385064.0,0,t1_h84b42g,h84b42g,True,SharpBeat,t3_ozzfxv,https://www.reddit.com/r/LynnwoodWA/comments/ozzfxv/i5_southbound_shutdown_near_mountlake_terrace_for/,I-5 southbound shutdown near Mountlake Terrace for person on the interstate,/r/LynnwoodWA/comments/ozzfxv/i5_southbound_shutdown_near_mountlake_terrace_for/h84b42g/,5,r/LynnwoodWA,0,5
"Isnt odd that we approved several taxes... yet they still didnt have enough. Its not like they missed a couple million or anything and you cant tell me hundreds of thousands refused to get their license plate tags renewed. How do you end up short several BILLION! 

Then the excuse of ""oh rising costs"". Hello? Fucking buy the land you said you would and get the shit now before costs go higher.",t2_a6ak0,azdood85,0,1628381688.0,0,t1_h844yjn,h844yjn,True,SharpBeat,t3_ozxsho,https://www.reddit.com/r/LynnwoodWA/comments/ozxsho/sound_transit_board_approves_realignment_plan/,"Sound Transit Board approves realignment plan, Everett Link impacted",/r/LynnwoodWA/comments/ozxsho/sound_transit_board_approves_realignment_plan/h844yjn/,0,r/LynnwoodWA,0,0
The 512 I was on...oh god. Passenger got off to piss in the blackberry brambles along the on ramp. It's been a day,t2_gc2oz,aeroartist,0,1628371708.0,0,t1_h83ljoe,h83ljoe,True,SharpBeat,t3_ozzfxv,https://www.reddit.com/r/LynnwoodWA/comments/ozzfxv/i5_southbound_shutdown_near_mountlake_terrace_for/,I-5 southbound shutdown near Mountlake Terrace for person on the interstate,/r/LynnwoodWA/comments/ozzfxv/i5_southbound_shutdown_near_mountlake_terrace_for/h83ljoe/,4,r/LynnwoodWA,0,4
"For a slightly different take on Indian (plus good traditional options) try Tasty Curry Restaurant and Pizza in Everett. 

Butter chicken pizza is amazing. I was skeptical but WOW",t2_7z9ay960,OutrageousVariation7,0,1628302068.0,0,t1_h80cjar,h80cjar,True,Glorious-Sunshine,t3_ow5wos,https://www.reddit.com/r/LynnwoodWA/comments/ow5wos/indian_restaurant_recommendations/,Indian restaurant recommendations,/r/LynnwoodWA/comments/ow5wos/indian_restaurant_recommendations/h80cjar/,2,r/LynnwoodWA,0,2
I think Rasoi is closed. But it was very good.,t2_geg6l,garbage_love,0,1628145212.0,0,t1_h7ryfy2,h7ryfy2,True,Glorious-Sunshine,t3_ow5wos,https://www.reddit.com/r/LynnwoodWA/comments/ow5wos/indian_restaurant_recommendations/,Indian restaurant recommendations,/r/LynnwoodWA/comments/ow5wos/indian_restaurant_recommendations/h7ryfy2/,1,r/LynnwoodWA,0,1
This post made me realize I cannot vote for mayor because I live one block outside of Lynnwood’s city limits. I thought my ballot seemed a little unexciting 😅,t2_76yh3,mrbloober,0,1628062148.0,0,t1_h7nhy6m,h7nhy6m,True,[deleted],t3_ox9goj,https://www.reddit.com/r/LynnwoodWA/comments/ox9goj/who_are_you_voting_for_mayor_and_why/,Who are you voting for mayor and why?,/r/LynnwoodWA/comments/ox9goj/who_are_you_voting_for_mayor_and_why/h7nhy6m/,5,r/LynnwoodWA,0,5
"Disclaimer: I no longer live in lynnwood, but I did for years. 

Hands down Christine Frizzell. 

I have personal experience with her (years of using her as our accountant). It sounds made up but this woman has been donating her time and resources to the county for longer than I’ve been alive. She’s been a very impactful city council worker and is endorsed by so many important folks that it’s really no brainer. Very hardworking person who values equality on all fronts.",t2_1chmdqx4,unsower,0,1628025660.0,0,t1_h7lnm0y,h7lnm0y,True,[deleted],t3_ox9goj,https://www.reddit.com/r/LynnwoodWA/comments/ox9goj/who_are_you_voting_for_mayor_and_why/,Who are you voting for mayor and why?,/r/LynnwoodWA/comments/ox9goj/who_are_you_voting_for_mayor_and_why/h7lnm0y/,8,r/LynnwoodWA,0,8
"Rasoi \[12926 Mukilteo Speedway e15, Lynnwood, WA 98087\]

Samburna \[20806 Bothell Everett Hwy UNIT 100, Bothell, WA 98021\]",t2_el0ujkk,rahulnitk,0,1627946284.0,0,t1_h7hkn8y,h7hkn8y,True,Glorious-Sunshine,t3_ow5wos,https://www.reddit.com/r/LynnwoodWA/comments/ow5wos/indian_restaurant_recommendations/,Indian restaurant recommendations,/r/LynnwoodWA/comments/ow5wos/indian_restaurant_recommendations/h7hkn8y/,1,r/LynnwoodWA,0,1
Came here to say this.,t2_11hjbg,8_millimeter,0,1627936772.0,0,t1_h7gzqg7,h7gzqg7,False,Glorious-Sunshine,t3_ow5wos,https://www.reddit.com/r/LynnwoodWA/comments/ow5wos/indian_restaurant_recommendations/,Indian restaurant recommendations,/r/LynnwoodWA/comments/ow5wos/indian_restaurant_recommendations/h7gzqg7/,3,r/LynnwoodWA,0,3
This!!  Favorite place hands down,t2_140k83,medusaQto,0,1627918159.0,0,t1_h7fssxb,h7fssxb,False,Glorious-Sunshine,t3_ow5wos,https://www.reddit.com/r/LynnwoodWA/comments/ow5wos/indian_restaurant_recommendations/,Indian restaurant recommendations,/r/LynnwoodWA/comments/ow5wos/indian_restaurant_recommendations/h7fssxb/,4,r/LynnwoodWA,0,4
"We like Cafe India on 44th Ave W, they could use some support!",t2_3yynepyf,Jclyde27,0,1627915328.0,0,t1_h7fmka9,h7fmka9,True,Glorious-Sunshine,t3_ow5wos,https://www.reddit.com/r/LynnwoodWA/comments/ow5wos/indian_restaurant_recommendations/,Indian restaurant recommendations,/r/LynnwoodWA/comments/ow5wos/indian_restaurant_recommendations/h7fmka9/,5,r/LynnwoodWA,0,5
Also recommend Curries.,t2_cypc349i,yoosh_C,0,1627882539.0,0,t1_h7ecxtc,h7ecxtc,False,Glorious-Sunshine,t3_ow5wos,https://www.reddit.com/r/LynnwoodWA/comments/ow5wos/indian_restaurant_recommendations/,Indian restaurant recommendations,/r/LynnwoodWA/comments/ow5wos/indian_restaurant_recommendations/h7ecxtc/,3,r/LynnwoodWA,0,3
Curries - in Everett tho.. but worth the trip,t2_16cdsrla,heidimeowww,0,1627878808.0,0,t1_h7e7n6y,h7e7n6y,True,Glorious-Sunshine,t3_ow5wos,https://www.reddit.com/r/LynnwoodWA/comments/ow5wos/indian_restaurant_recommendations/,Indian restaurant recommendations,/r/LynnwoodWA/comments/ow5wos/indian_restaurant_recommendations/h7e7n6y/,5,r/LynnwoodWA,0,5
"Royal India on 196th. Great place, best I’ve found in the entire Seattle area!",t2_dkulj,nucklenix,0,1627874575.0,0,t1_h7e0kpd,h7e0kpd,True,Glorious-Sunshine,t3_ow5wos,https://www.reddit.com/r/LynnwoodWA/comments/ow5wos/indian_restaurant_recommendations/,Indian restaurant recommendations,/r/LynnwoodWA/comments/ow5wos/indian_restaurant_recommendations/h7e0kpd/,13,r/LynnwoodWA,0,13
Yesterday's was crazy... Or was this from yesterday?,t2_n05u4,Sam_the_Engineer,0,1627619923.0,0,t1_h71pjlw,h71pjlw,True,[deleted],t3_ou9437,https://www.reddit.com/r/LynnwoodWA/comments/ou9437/power_outage_that_is_all/,Power Outage. That is all.,/r/LynnwoodWA/comments/ou9437/power_outage_that_is_all/h71pjlw/,2,r/LynnwoodWA,0,2
This is the correct answer. We always get an order or two of gyoza as well.,t2_a1xoj,WilliestyleR79,0,1627255139.0,0,t1_h6iyi9p,h6iyi9p,False,the_ranting_swede,t3_or12zd,https://www.reddit.com/r/LynnwoodWA/comments/or12zd/whats_your_favorite_teriyaki_place_in_lynnwood/,"What's your favorite Teriyaki place in Lynnwood, and what's your go-to order?",/r/LynnwoodWA/comments/or12zd/whats_your_favorite_teriyaki_place_in_lynnwood/h6iyi9p/,3,r/LynnwoodWA,0,3
"Martha Lake teriyaki, best chicken katsu around",t2_e213u,TystickUW85,0,1627239773.0,0,t1_h6i3qaj,h6i3qaj,True,the_ranting_swede,t3_or12zd,https://www.reddit.com/r/LynnwoodWA/comments/or12zd/whats_your_favorite_teriyaki_place_in_lynnwood/,"What's your favorite Teriyaki place in Lynnwood, and what's your go-to order?",/r/LynnwoodWA/comments/or12zd/whats_your_favorite_teriyaki_place_in_lynnwood/h6i3qaj/,2,r/LynnwoodWA,0,2
"Ichi teriyaki for sure has my vote. Great tasting food with decent portions too. Always lasts 2 meals for me. 

I usually go to the teriyaki place by the 196th Fred Meyer but I always feel slightly disappointed, ichi has me spoiled",t2_ypjrz,OOBERRAMPAGE,0,1627236879.0,0,t1_h6hxq7k,h6hxq7k,True,the_ranting_swede,t3_or12zd,https://www.reddit.com/r/LynnwoodWA/comments/or12zd/whats_your_favorite_teriyaki_place_in_lynnwood/,"What's your favorite Teriyaki place in Lynnwood, and what's your go-to order?",/r/LynnwoodWA/comments/or12zd/whats_your_favorite_teriyaki_place_in_lynnwood/h6hxq7k/,5,r/LynnwoodWA,0,5
"Ours went out of businesss, wok teriyaki. :(. No place else has compared.",t2_8tvcg,tigress666,0,1627222426.0,0,t1_h6h4nka,h6h4nka,True,the_ranting_swede,t3_or12zd,https://www.reddit.com/r/LynnwoodWA/comments/or12zd/whats_your_favorite_teriyaki_place_in_lynnwood/,"What's your favorite Teriyaki place in Lynnwood, and what's your go-to order?",/r/LynnwoodWA/comments/or12zd/whats_your_favorite_teriyaki_place_in_lynnwood/h6h4nka/,2,r/LynnwoodWA,0,2
Ichi teriyaki. General Tso,t2_10onz4,ScornfulWindbag,0,1627217944.0,0,t1_h6gx5eb,h6gx5eb,True,the_ranting_swede,t3_or12zd,https://www.reddit.com/r/LynnwoodWA/comments/or12zd/whats_your_favorite_teriyaki_place_in_lynnwood/,"What's your favorite Teriyaki place in Lynnwood, and what's your go-to order?",/r/LynnwoodWA/comments/or12zd/whats_your_favorite_teriyaki_place_in_lynnwood/h6gx5eb/,6,r/LynnwoodWA,0,6
Toshi Teriyaki in Millcreek is run by an old couple credited for laying the foundations for making teriyaki a big hit in Seattle--their chicken katsu and spicy teriyaki are amazing.,t2_5ua9jxek,yenya123456779,0,1627194594.0,0,t1_h6g6bbu,h6g6bbu,True,the_ranting_swede,t3_or12zd,https://www.reddit.com/r/LynnwoodWA/comments/or12zd/whats_your_favorite_teriyaki_place_in_lynnwood/,"What's your favorite Teriyaki place in Lynnwood, and what's your go-to order?",/r/LynnwoodWA/comments/or12zd/whats_your_favorite_teriyaki_place_in_lynnwood/h6g6bbu/,13,r/LynnwoodWA,0,13
"Highway teriyaki’s beef teriyaki with fried rice is a major comfort food!

For chicken, I’m a hundred percent about Teriyaki Grill over by Meadowdale. Their macaroni salad is weirdly addictive.

Misora on Mukilteo speedway has really good hella marinated chicken. Teriyaki Garden down in Mill Creek has amazing chicken breast.

Don’t forget to make a trip down to Toshi’s Teriyaki in Mill Creek to get some teriyaki chicken cooked by Toshi himself, the man who brought Seattle style teriyaki to the area.

https://youtu.be/AjBeXJqN-ik",t2_7bkpl,malytwotails,0,1627193049.0,0,t1_h6g4fx0,h6g4fx0,False,the_ranting_swede,t3_or12zd,https://www.reddit.com/r/LynnwoodWA/comments/or12zd/whats_your_favorite_teriyaki_place_in_lynnwood/,"What's your favorite Teriyaki place in Lynnwood, and what's your go-to order?",/r/LynnwoodWA/comments/or12zd/whats_your_favorite_teriyaki_place_in_lynnwood/h6g4fx0/,6,r/LynnwoodWA,0,6
