body,author_fullname,author.name,controversiality,created,downs,fullname,id,is_root,link_author,link_id,link_permalink,link_title,permalink,score,subreddit_name_prefixed,total_awards_received,ups
"Ok other then that being super narrow minded and trolling just by itself, u guys are literally taking shots at me fir something u THINK I had nun w no proof to the contrary or even before u got any more info on myself my claims or anything else, how bout before u go doing this kinda b.s thing again to someone in need of help you actually get up from ur golden computer chair and out from behind that digital curtain and find some evidence to support ur thoughts. Its already bad enough my girl ended up NOT being truthful bout him having passed, he WAS in the hospital and it wasn't looking good... 2nd of all my grandma the woman that fucking raised me and is the only reason I was given a chance at life passed this last December right before Xmas and u kno what? Because of quarantine protocol on interstate travel the only option I was given was to do a zoom call but that didn't even get to happen and I'm still torn on which is worse that fact I wasn't able to at least hug her and tell her what I needed to and allow her to do the same due to a stupid fucking illness that the world's leaders knew about and decided not to act until it was to late or that the only FUCKING OPTION WE WERE STILL UNABLE TO ACCOMPLISH WAS TO TALK ON A FUCKING COMPUTER SCREEN.... it might be ok fir u and u could very well be fine  and well adjusted to human interaction thru a computer screen but u should FUCKING KEEP IT TO URSELF U FUCKING PRICK U KNO NUN BOUT ME, MY GIRL, HER FAMILY, MY FAMILY, AND IF U WANNA JUST KEEP ON WIRH THE MINDSET ohhhb well he opened himself to bullshit responses like mine just by posting his request.... NO thats exactly what I or no one else is doing or intending attempting to request a genuine fucking act of human kindness I didn't ask fir ANY fucking personal info I didn't say I needed NUN INSANE I OFFERES WHAT I COULD WHEN I COULD THINK OF IT SO FUCK U & FUCK ALL THE PEOPLE THAT REAPONDED TO ME CAUSE THE ONLY FUCKONG 1 THAT DESERVES THE SHIT YALL SO PROUDLY REPLY TO ME WITH IS YOU... NOT 1 PERSON  RESP9NDED WITH A GENUINE RESPONSE, ALL OF U WERE HAPPY TO TROLL LIKE U WAS A FUCKONG 90S NEON HEADED HASBRO DOLL... AND 1 MORE THING BUD HOW BOUT U ZOOM UR DIEING RELATIVE INSTEAD OF DO WHAT YOU COULD TO TRY AND GET TO THEM... AS FIR ME? ILL CONTINUE TO FUCKING EVEN LOOK INTO JOINING A CHARTER BOAT CLUB TO RENT A FUCKING BOAT IN ORDER TO GET TO A FAMILY MEMBERS LAST BIT OF TIME ON THIS EARTH AND TRY AND OVERPAY UP THE ASS TO GET A CAR TO COMFORT MY SIGNIFICANT OTHER AND GICE THEM THE MOST COMFORT POSSIBLE WHILE THEYRE DEALING WITH LOOSING THE PERSON THAT RAISED THEM AND WAS CLOSEST TO ON IN THIS WORLD..... ZOOM THESE NUTTS bitch.....",t2_8wvv2ln1,EskimoJbruh-IGHO-,0,1620446249.0,0,t1_gxcqldj,gxcqldj,False,EskimoJbruh-IGHO-,t3_n1bb84,https://www.reddit.com/r/LynnwoodWA/comments/n1bb84/really_in_need_of_a_car_rental_and_some_good/,"Really in need of a car rental and some good karma points cashed in, hoping?,,",/r/LynnwoodWA/comments/n1bb84/really_in_need_of_a_car_rental_and_some_good/gxcqldj/,1,r/LynnwoodWA,0,1
Attend the grandpa’s funeral via Zoom. Problem solved bud!,t2_3yynepyf,Jclyde27,0,1620398822.0,0,t1_gxa1zgf,gxa1zgf,True,EskimoJbruh-IGHO-,t3_n1bb84,https://www.reddit.com/r/LynnwoodWA/comments/n1bb84/really_in_need_of_a_car_rental_and_some_good/,"Really in need of a car rental and some good karma points cashed in, hoping?,,",/r/LynnwoodWA/comments/n1bb84/really_in_need_of_a_car_rental_and_some_good/gxa1zgf/,1,r/LynnwoodWA,0,1
I love Mel & Mia’s! Happy to spread support.,t2_11kpd5,thefrenchswerve,0,1620255172.0,0,t1_gx32jjp,gx32jjp,True,ocular18,t3_n59h2q,https://www.reddit.com/r/LynnwoodWA/comments/n59h2q/help_support_local_business_mel_and_mias_cafe_in/,HELP SUPPORT LOCAL BUSINESS - Mel and Mia’s Cafe in Perrinville,/r/LynnwoodWA/comments/n59h2q/help_support_local_business_mel_and_mias_cafe_in/gx32jjp/,2,r/LynnwoodWA,0,2
Woot,t2_sy9jv,justin9020,0,1620236397.0,0,t1_gx1ushd,gx1ushd,True,ocular18,t3_n59h2q,https://www.reddit.com/r/LynnwoodWA/comments/n59h2q/help_support_local_business_mel_and_mias_cafe_in/,HELP SUPPORT LOCAL BUSINESS - Mel and Mia’s Cafe in Perrinville,/r/LynnwoodWA/comments/n59h2q/help_support_local_business_mel_and_mias_cafe_in/gx1ushd/,2,r/LynnwoodWA,0,2
Hey! Great job 😍,t2_34e85ug5,that_average,0,1620235784.0,0,t1_gx1tcde,gx1tcde,True,ocular18,t3_n59h2q,https://www.reddit.com/r/LynnwoodWA/comments/n59h2q/help_support_local_business_mel_and_mias_cafe_in/,HELP SUPPORT LOCAL BUSINESS - Mel and Mia’s Cafe in Perrinville,/r/LynnwoodWA/comments/n59h2q/help_support_local_business_mel_and_mias_cafe_in/gx1tcde/,3,r/LynnwoodWA,0,3
Great job!,t2_89bad,I_Makes_tuff,0,1620233615.0,0,t1_gx1o1qh,gx1o1qh,True,ocular18,t3_n59h2q,https://www.reddit.com/r/LynnwoodWA/comments/n59h2q/help_support_local_business_mel_and_mias_cafe_in/,HELP SUPPORT LOCAL BUSINESS - Mel and Mia’s Cafe in Perrinville,/r/LynnwoodWA/comments/n59h2q/help_support_local_business_mel_and_mias_cafe_in/gx1o1qh/,1,r/LynnwoodWA,0,1
The final result is awesome! Nice work,t2_2rcqgm1e,feackzera,0,1620229011.0,0,t1_gx1co0x,gx1co0x,True,ocular18,t3_n59h2q,https://www.reddit.com/r/LynnwoodWA/comments/n59h2q/help_support_local_business_mel_and_mias_cafe_in/,HELP SUPPORT LOCAL BUSINESS - Mel and Mia’s Cafe in Perrinville,/r/LynnwoodWA/comments/n59h2q/help_support_local_business_mel_and_mias_cafe_in/gx1co0x/,3,r/LynnwoodWA,0,3
Not at all why would you spend so much $ on uber? See this is so dumb u n stupid claims like this are JUST AS BAD AS SCAMMERS & SCREW U WHAT WOULD U SAY IF U POSTED SOMETHIMG N SAID THIS GUYS A DICK HIS FAM ISNT REAL HES A SCAM...P.S-DICK,t2_8wvv2ln1,EskimoJbruh-IGHO-,0,1620174275.0,0,t1_gwyvr8r,gwyvr8r,False,EskimoJbruh-IGHO-,t3_n1bb84,https://www.reddit.com/r/LynnwoodWA/comments/n1bb84/really_in_need_of_a_car_rental_and_some_good/,"Really in need of a car rental and some good karma points cashed in, hoping?,,",/r/LynnwoodWA/comments/n1bb84/really_in_need_of_a_car_rental_and_some_good/gwyvr8r/,1,r/LynnwoodWA,0,1
"I live just north of 164th, nearAsh Way. Close to manor way. I live in a neighborhood that is newly built, large houses and really nobody except the residents walk around in our neighborhood during the day. Anybody would call it a nice neighborhood. However, there has been once or twice where I or another family member has forgotten to lock their car doors and we have come out the next morning to find that our cars had been rummaged through and items have been stolen.",t2_bqyol4y,midnightbiscuit1,0,1620069128.0,0,t1_gwtfy4r,gwtfy4r,True,MagicMan703,t3_n1cjkp,https://www.reddit.com/r/LynnwoodWA/comments/n1cjkp/living_near_manor_way/,Living near Manor Way,/r/LynnwoodWA/comments/n1cjkp/living_near_manor_way/gwtfy4r/,1,r/LynnwoodWA,0,1
Whats going on my guy?,t2_8wvv2ln1,EskimoJbruh-IGHO-,0,1619915777.0,0,t1_gwlueji,gwlueji,False,EskimoJbruh-IGHO-,t3_n1bb84,https://www.reddit.com/r/LynnwoodWA/comments/n1bb84/really_in_need_of_a_car_rental_and_some_good/,"Really in need of a car rental and some good karma points cashed in, hoping?,,",/r/LynnwoodWA/comments/n1bb84/really_in_need_of_a_car_rental_and_some_good/gwlueji/,0,r/LynnwoodWA,0,0
doesn't lake stickney fall within the odyssey/voyager/mariner school radius(?)?,t2_2dt42wln,_and_there_it_is_,0,1619840164.0,0,t1_gwi6xbx,gwi6xbx,False,MagicMan703,t3_n1cjkp,https://www.reddit.com/r/LynnwoodWA/comments/n1cjkp/living_near_manor_way/,Living near Manor Way,/r/LynnwoodWA/comments/n1cjkp/living_near_manor_way/gwi6xbx/,1,r/LynnwoodWA,0,1
"We moved in to a neighborhood 1 mile north of 164 on Manor Way 4 years ago, and in the past 4 years we have not experienced any crime activity ourselves, or heard of any major incident in our immediate neighborhood. There were some porch pirate thefts, which I think is difficult to avoid just about anywhere, but that was about it.\\

The location of Manor off 164 in relation to surrounding businesses and convenience is great. The Alderwood shopping circle and restaurants in this area are continuously developing, and we're always finding gems.

The overall demographic on Manor Way seems to be shifting to younger people and new families. There are more and more developments happening on Manor Way, so I am optimistic that things will continue to improve.

That said, it's not all rainbows and unicorns:

* There are some houses, or congregates, or shared living houses that are very sketchy. I use the word sketchy because I don't know exactly what goes on in there, but there have been occasional police raids at night. It's concerning to me, but I haven't been personally impacted.
* Litters everywhere, shopping carts everywhere.
* That area of woods across from Fred Meyer hosts... people.

Do I regret buying a house in this area? No.

Do I feel safe walking on Manor Way by myself (mid 30's male)? 90% of the time.

Would I feel safe letting my kids play on the streets (off Manor) under my supervision? Yes.

Would I feel safe letting my kids ride their bike by themselves for 30 minutes? I probably wouldn't.

&#x200B;

Because everyone has different backgrounds and different concerns, I can only try to provide some colors from my perspective. YMMV.",t2_o74v7,cartey,0,1619810317.0,0,t1_gwgkjwu,gwgkjwu,True,MagicMan703,t3_n1cjkp,https://www.reddit.com/r/LynnwoodWA/comments/n1cjkp/living_near_manor_way/,Living near Manor Way,/r/LynnwoodWA/comments/n1cjkp/living_near_manor_way/gwgkjwu/,2,r/LynnwoodWA,0,2
Lol,t2_13zhpzct,MrMeiko,0,1619790533.0,0,t1_gwfb5x6,gwfb5x6,True,EskimoJbruh-IGHO-,t3_n1bb84,https://www.reddit.com/r/LynnwoodWA/comments/n1bb84/really_in_need_of_a_car_rental_and_some_good/,"Really in need of a car rental and some good karma points cashed in, hoping?,,",/r/LynnwoodWA/comments/n1bb84/really_in_need_of_a_car_rental_and_some_good/gwfb5x6/,1,r/LynnwoodWA,0,1
"On 164th I wouldn't **buy** anything West of Martha Lake. But that area changes from amazing to sketchy every few hundred yards though, you'd need to go there in person and see.",t2_dqn34x2,500ls,0,1619757424.0,0,t1_gwe0bi5,gwe0bi5,True,MagicMan703,t3_n1cjkp,https://www.reddit.com/r/LynnwoodWA/comments/n1cjkp/living_near_manor_way/,Living near Manor Way,/r/LynnwoodWA/comments/n1cjkp/living_near_manor_way/gwe0bi5/,3,r/LynnwoodWA,0,3
">I've been told stay away from highway 99, casino road, and Mariner high school but not sure how much weight I should be giving those recommendations.    


How much weight? All the weight and then some. Especially Casino Rd.",t2_10iy8,blindrage,0,1619741282.0,0,t1_gwd4f0i,gwd4f0i,False,MagicMan703,t3_n1cjkp,https://www.reddit.com/r/LynnwoodWA/comments/n1cjkp/living_near_manor_way/,Living near Manor Way,/r/LynnwoodWA/comments/n1cjkp/living_near_manor_way/gwd4f0i/,9,r/LynnwoodWA,0,9
"We recently bought a home near Lake Stickney as well and we're stricken by some of the same concerns while buying. So far it's been quite good--we moved from a pretty suburban part of Bothell so I feel were doing a bit of pearl clutching initially but we have so far had nothing to complain about. Lots of young families and walking around the neighborhoods, lake stickney park is nice and feels safe.

That said we were initially a tad concerned seeing quite a few of unhoused congregate near where Airport rd and 99  meet but even that seems to have improved as this year has gone on, I'm not sure if there was a camp cleanup there recently. 

Living close to Alderwood has been great and it's nice to be close to mukilteo, mill creek, woodinville etc. I also am really over the moon with the food scene here lots of amazing, hole-in-the-wall like gems near by from all over the world.

With the light link inching towards northgate, then lynnwood hopefully in 2024 and then Ashway (god knows when?!) It seems like a good time to buy. It's crazy how much the prices have gone up just this year compared to when we were looking last spring.",t2_5ua9jxek,yenya123456779,0,1619739501.0,0,t1_gwd0pz0,gwd0pz0,True,MagicMan703,t3_n1cjkp,https://www.reddit.com/r/LynnwoodWA/comments/n1cjkp/living_near_manor_way/,Living near Manor Way,/r/LynnwoodWA/comments/n1cjkp/living_near_manor_way/gwd0pz0/,5,r/LynnwoodWA,0,5
"I have a few times yeah, looking around Lynnwood/Everett for a townhouse or single family home. Really just trying to find a quieter neighborhood with good, or at least good enough, schools. I've been told stay away from highway 99, casino road, and Mariner high school but not sure how much weight I should be giving those recommendations.",t2_ivp5a,MagicMan703,0,1619734150.0,0,t1_gwcpfg6,gwcpfg6,False,MagicMan703,t3_n1cjkp,https://www.reddit.com/r/LynnwoodWA/comments/n1cjkp/living_near_manor_way/,Living near Manor Way,/r/LynnwoodWA/comments/n1cjkp/living_near_manor_way/gwcpfg6/,3,r/LynnwoodWA,0,3
have you driven up here to look for yourself? what are you looking for in an area?,t2_1ho1gcgo,Storm_Raider_007,0,1619733757.0,0,t1_gwcojso,gwcojso,False,MagicMan703,t3_n1cjkp,https://www.reddit.com/r/LynnwoodWA/comments/n1cjkp/living_near_manor_way/,Living near Manor Way,/r/LynnwoodWA/comments/n1cjkp/living_near_manor_way/gwcojso/,3,r/LynnwoodWA,0,3
Yup that was my post lol. Going through house hunting now and trying to get the best feel that I can for each of the specific neighborhoods.,t2_ivp5a,MagicMan703,0,1619733617.0,0,t1_gwco8fe,gwco8fe,False,MagicMan703,t3_n1cjkp,https://www.reddit.com/r/LynnwoodWA/comments/n1cjkp/living_near_manor_way/,Living near Manor Way,/r/LynnwoodWA/comments/n1cjkp/living_near_manor_way/gwco8fe/,4,r/LynnwoodWA,0,4
"[https://www.reddit.com/r/everett/comments/mrnjqm/moving\_to\_lake\_stickney/](https://www.reddit.com/r/everett/comments/mrnjqm/moving_to_lake_stickney/)

a recent post on r/everett basically the same area.

&#x200B;

Edit: LOL just realized this was by you too. LMAO .. whops.",t2_1ho1gcgo,Storm_Raider_007,0,1619733520.0,0,t1_gwco0px,gwco0px,True,MagicMan703,t3_n1cjkp,https://www.reddit.com/r/LynnwoodWA/comments/n1cjkp/living_near_manor_way/,Living near Manor Way,/r/LynnwoodWA/comments/n1cjkp/living_near_manor_way/gwco0px/,7,r/LynnwoodWA,0,7
"There is an addict/homeless community in the area, mostly northwest of Fred Meyer, I think. Your concern would be property crime. Primary concerns are car break-ins, and certain items left outside including bikes, propane tanks, and anything a homeless community could cart back to their campsite and put to use.",t2_5tfh6zmq,Eruditerer,0,1619728934.0,0,t1_gwcd924,gwcd924,True,MagicMan703,t3_n1cjkp,https://www.reddit.com/r/LynnwoodWA/comments/n1cjkp/living_near_manor_way/,Living near Manor Way,/r/LynnwoodWA/comments/n1cjkp/living_near_manor_way/gwcd924/,6,r/LynnwoodWA,0,6
"i delivered mail in that area as a CCA for the USPS. half of manor way near 164th seems quiet, quaint, and rural; the other half closer to 99 is rougher--cars get broken into, and there was a murder in one of the trailer parks nearby recently. don't just take my word for it, though, since i don't actually live there. many of the homeless appear to hang out in the woods by 36th and 164th, where i live. 😣",t2_2dt42wln,_and_there_it_is_,0,1619728116.0,0,t1_gwcb938,gwcb938,True,MagicMan703,t3_n1cjkp,https://www.reddit.com/r/LynnwoodWA/comments/n1cjkp/living_near_manor_way/,Living near Manor Way,/r/LynnwoodWA/comments/n1cjkp/living_near_manor_way/gwcb938/,5,r/LynnwoodWA,0,5
"If you have a WA driver’s license, you can report it lost/stolen online and print out a temporary paper license from home. 

Also, if you supposedly have the $$, use Uber instead of the set up for a common scam.",t2_pgvxn,lizardmatriarch,0,1619727612.0,0,t1_gwca0vi,gwca0vi,True,EskimoJbruh-IGHO-,t3_n1bb84,https://www.reddit.com/r/LynnwoodWA/comments/n1bb84/really_in_need_of_a_car_rental_and_some_good/,"Really in need of a car rental and some good karma points cashed in, hoping?,,",/r/LynnwoodWA/comments/n1bb84/really_in_need_of_a_car_rental_and_some_good/gwca0vi/,4,r/LynnwoodWA,0,4
"I believe there is a big Ethiopian/Christian church across from the Convention Center, near/behind Lamps Plus. There is also a new Ethiopian Grocer (small) that opened up on 44th, near terminal end of the light rail. We have a community here, apparently.

I believe that protest started at Lynnwood City Hall, then proceeded west along 196th before heading south on 99.",t2_5tfh6zmq,Eruditerer,0,1619580806.0,0,t1_gw4t07h,gw4t07h,False,Eruditerer,t3_mxo27f,https://www.reddit.com/r/LynnwoodWA/comments/mxo27f/war_protest_at_city_hall_right_now/,War protest at City Hall right now,/r/LynnwoodWA/comments/mxo27f/war_protest_at_city_hall_right_now/gw4t07h/,3,r/LynnwoodWA,0,3
"Yep a pastry! The ones they made were different than what the other poster linked, they were long and skinny and glazed in a hard icing. They had cinnamon inside too. 

I called them unicorn horns at the time actually lol. 
There may be another name for them actually, not sure. I found them at another cafe where they called them butter horns so I stuck with that.",t2_b14iv5xt,spicytomatojuice87,0,1619466583.0,0,t1_gvyuqbi,gvyuqbi,False,spicytomatojuice87,t3_myf6vk,https://www.reddit.com/r/LynnwoodWA/comments/myf6vk/help_remembering_a_coffee_shop_from_23_years_ago/,Help remembering a coffee shop from 23 years ago,/r/LynnwoodWA/comments/myf6vk/help_remembering_a_coffee_shop_from_23_years_ago/gvyuqbi/,1,r/LynnwoodWA,0,1
"Not OP, but they’re a [pastry.](https://images.app.goo.gl/nv9DztyFQFFFUGoY8)",t2_1z6ib2o0,StrawberryMoonPie,0,1619418641.0,0,t1_gvwit03,gvwit03,False,spicytomatojuice87,t3_myf6vk,https://www.reddit.com/r/LynnwoodWA/comments/myf6vk/help_remembering_a_coffee_shop_from_23_years_ago/,Help remembering a coffee shop from 23 years ago,/r/LynnwoodWA/comments/myf6vk/help_remembering_a_coffee_shop_from_23_years_ago/gvwit03/,2,r/LynnwoodWA,0,2
What are butter horns?,t2_3gxx4rqp,dragoneyethai,0,1619416072.0,0,t1_gvwfmyp,gvwfmyp,True,spicytomatojuice87,t3_myf6vk,https://www.reddit.com/r/LynnwoodWA/comments/myf6vk/help_remembering_a_coffee_shop_from_23_years_ago/,Help remembering a coffee shop from 23 years ago,/r/LynnwoodWA/comments/myf6vk/help_remembering_a_coffee_shop_from_23_years_ago/gvwfmyp/,2,r/LynnwoodWA,0,2
"Huh, didn't know Lynnwood had a sizable Ethiopian community. Interesting.",t2_65x9aowb,Big-Effort-186,0,1619331657.0,0,t1_gvskkl5,gvskkl5,True,Eruditerer,t3_mxo27f,https://www.reddit.com/r/LynnwoodWA/comments/mxo27f/war_protest_at_city_hall_right_now/,War protest at City Hall right now,/r/LynnwoodWA/comments/mxo27f/war_protest_at_city_hall_right_now/gvskkl5/,1,r/LynnwoodWA,0,1
Ethiopian community. War in Tigray. Lots of people. Some shouting/chanting. Didn't want to take pictures of people. Very peaceful & orderly.,t2_5tfh6zmq,Eruditerer,0,1619283844.0,0,t1_gvq6suy,gvq6suy,True,Eruditerer,t3_mxo27f,https://www.reddit.com/r/LynnwoodWA/comments/mxo27f/war_protest_at_city_hall_right_now/,War protest at City Hall right now,/r/LynnwoodWA/comments/mxo27f/war_protest_at_city_hall_right_now/gvq6suy/,7,r/LynnwoodWA,0,7
Why are you getting vaccinated?,t2_12r3kz,shatteringreality,0,1619080024.0,0,t1_gvf8tcd,gvf8tcd,True,[deleted],t3_mvrdyi,https://www.reddit.com/r/LynnwoodWA/comments/mvrdyi/hows_parking_at_ash_way_with_the_new_vaccination/,How's parking at Ash Way with the new vaccination site?,/r/LynnwoodWA/comments/mvrdyi/hows_parking_at_ash_way_with_the_new_vaccination/gvf8tcd/,1,r/LynnwoodWA,0,1
But be a good place to live.,t2_2vvu7x12,Savagefish24,0,1618891008.0,0,t1_gv5yl3q,gv5yl3q,False,western-mittin,t3_mm5lb3,https://www.reddit.com/r/LynnwoodWA/comments/mm5lb3/duet_apartments/,Duet Apartments,/r/LynnwoodWA/comments/mm5lb3/duet_apartments/gv5yl3q/,1,r/LynnwoodWA,0,1
"The apartments are pretty good, there is a recreation room upstairs in the office building, it is closed due to Covid-19.

Other than that it is calm and relaxed, there is a fire station up the street so I hear fire trucks often. Also there is a Walmart° right there and a grocery outlet across the street.",t2_2vvu7x12,Savagefish24,0,1618890986.0,0,t1_gv5yjrf,gv5yjrf,True,western-mittin,t3_mm5lb3,https://www.reddit.com/r/LynnwoodWA/comments/mm5lb3/duet_apartments/,Duet Apartments,/r/LynnwoodWA/comments/mm5lb3/duet_apartments/gv5yjrf/,2,r/LynnwoodWA,0,2
"Yep, same here. Also interrupted my 1st grader’s Zoom school.",t2_m9fyh,jsorge,0,1618855670.0,0,t1_gv3xdj4,gv3xdj4,False,jsorge,t3_mu4ndj,https://www.reddit.com/r/LynnwoodWA/comments/mu4ndj/power_outage/,Power Outage,/r/LynnwoodWA/comments/mu4ndj/power_outage/gv3xdj4/,4,r/LynnwoodWA,0,4
Oh dang,t2_m9fyh,jsorge,0,1618855642.0,0,t1_gv3xb6g,gv3xb6g,False,jsorge,t3_mu4ndj,https://www.reddit.com/r/LynnwoodWA/comments/mu4ndj/power_outage/,Power Outage,/r/LynnwoodWA/comments/mu4ndj/power_outage/gv3xb6g/,3,r/LynnwoodWA,0,3
DUI driver took out a pole,t2_gcwfio,joykilled,0,1618855207.0,0,t1_gv3wa4s,gv3wa4s,False,jsorge,t3_mu4ndj,https://www.reddit.com/r/LynnwoodWA/comments/mu4ndj/power_outage/,Power Outage,/r/LynnwoodWA/comments/mu4ndj/power_outage/gv3wa4s/,7,r/LynnwoodWA,0,7
 [(1) Lynnwood Police (@LynnwoodPD) / Twitter](https://twitter.com/lynnwoodpd),t2_gcwfio,joykilled,0,1618855190.0,0,t1_gv3w8mp,gv3w8mp,True,jsorge,t3_mu4ndj,https://www.reddit.com/r/LynnwoodWA/comments/mu4ndj/power_outage/,Power Outage,/r/LynnwoodWA/comments/mu4ndj/power_outage/gv3w8mp/,9,r/LynnwoodWA,0,9
Interrupting my WFH setup but glad to not be dealing with flashlights at night or anything!,t2_13zhpzct,MrMeiko,0,1618854695.0,0,t1_gv3v1vk,gv3v1vk,True,jsorge,t3_mu4ndj,https://www.reddit.com/r/LynnwoodWA/comments/mu4ndj/power_outage/,Power Outage,/r/LynnwoodWA/comments/mu4ndj/power_outage/gv3v1vk/,4,r/LynnwoodWA,0,4
A neighborhood near the WalMart on 164th.,t2_hb7ob,FairOphelia,0,1618724803.0,0,t1_guxxe9y,guxxe9y,False,[deleted],t3_mt6nyv,https://www.reddit.com/r/LynnwoodWA/comments/mt6nyv/maude_is_missing_info_in_comments/,Maude is missing. Info in comments.,/r/LynnwoodWA/comments/mt6nyv/maude_is_missing_info_in_comments/guxxe9y/,2,r/LynnwoodWA,0,2
Can i ask where specifically in Lynnwood?,t2_3cbeubvf,jamdannad,0,1618724728.0,0,t1_guxxb3g,guxxb3g,False,[deleted],t3_mt6nyv,https://www.reddit.com/r/LynnwoodWA/comments/mt6nyv/maude_is_missing_info_in_comments/,Maude is missing. Info in comments.,/r/LynnwoodWA/comments/mt6nyv/maude_is_missing_info_in_comments/guxxb3g/,1,r/LynnwoodWA,0,1
"This is my grandma's cat, Maude. She went missing in Lynnwood, WA where my grandma lives. She's an indoor cat and is timid, but likes people. She is microchipped. She's all black with gold eyes. If you see her, please PM me and/or take her to a shelter to have her chip scanned. 

Thank you!",t2_hb7ob,FairOphelia,0,1618722944.0,0,t1_guxv1uq,guxv1uq,True,[deleted],t3_mt6nyv,https://www.reddit.com/r/LynnwoodWA/comments/mt6nyv/maude_is_missing_info_in_comments/,Maude is missing. Info in comments.,/r/LynnwoodWA/comments/mt6nyv/maude_is_missing_info_in_comments/guxv1uq/,2,r/LynnwoodWA,0,2
" Markup is also a thing. Even for things like transfer station fees. 20% is standard, but I've seen much higher.",t2_9b6qx,widdershins13,0,1618307753.0,0,t1_gucrltj,gucrltj,False,[deleted],t3_mozw8l,https://www.reddit.com/r/LynnwoodWA/comments/mozw8l/question_regarding_snohomish_county_dump_fees_and/,Question regarding Snohomish County dump fees and a landscaper I'm dealing with,/r/LynnwoodWA/comments/mozw8l/question_regarding_snohomish_county_dump_fees_and/gucrltj/,1,r/LynnwoodWA,0,1
How very sad. My thoughts are with his loved ones.,t2_l6c6m,bantamwaning,0,1618288724.0,0,t1_guc6lf2,guc6lf2,True,[deleted],t3_mpup7k,https://www.reddit.com/r/LynnwoodWA/comments/mpup7k/lynnwood_police_officer_mark_brinkman_passed_away/,"Lynnwood Police Officer Mark Brinkman passed away last night after collapsing while at home. Rest In Peace, Officer.",/r/LynnwoodWA/comments/mpup7k/lynnwood_police_officer_mark_brinkman_passed_away/guc6lf2/,5,r/LynnwoodWA,0,5
May your family find peace in time.,t2_a9l4cdcc,blacksmithingbro,0,1618286749.0,0,t1_guc3n8p,guc3n8p,True,[deleted],t3_mpup7k,https://www.reddit.com/r/LynnwoodWA/comments/mpup7k/lynnwood_police_officer_mark_brinkman_passed_away/,"Lynnwood Police Officer Mark Brinkman passed away last night after collapsing while at home. Rest In Peace, Officer.",/r/LynnwoodWA/comments/mpup7k/lynnwood_police_officer_mark_brinkman_passed_away/guc3n8p/,5,r/LynnwoodWA,0,5
"I would also say you need to factor the time he’s taking to drive down and back to the transfer station, his labor loading and unloading the debris, and the gas / wear n tear on his vehicle. 

Seems like a reasonable price when adding those to the equation.",t2_3yynepyf,Jclyde27,0,1618251851.0,0,t1_gua6842,gua6842,True,[deleted],t3_mozw8l,https://www.reddit.com/r/LynnwoodWA/comments/mozw8l/question_regarding_snohomish_county_dump_fees_and/,Question regarding Snohomish County dump fees and a landscaper I'm dealing with,/r/LynnwoodWA/comments/mozw8l/question_regarding_snohomish_county_dump_fees_and/gua6842/,1,r/LynnwoodWA,0,1
"Keep in mind, the county always charges by weight, as they weigh the vehicle entering and exiting. They have no way to charge by volume. 

That being said, if you're pleased with this guy's work and want to continue to use his services, just talk to him. Be respectful, but clear with your concerns. Not everybody is a scammer. Not every situation has to be adversarial. Communication goes a long way towards fixing problems.",t2_10iy8,blindrage,0,1618212089.0,0,t1_gu8c8a8,gu8c8a8,True,[deleted],t3_mozw8l,https://www.reddit.com/r/LynnwoodWA/comments/mozw8l/question_regarding_snohomish_county_dump_fees_and/,Question regarding Snohomish County dump fees and a landscaper I'm dealing with,/r/LynnwoodWA/comments/mozw8l/question_regarding_snohomish_county_dump_fees_and/gu8c8a8/,2,r/LynnwoodWA,0,2
