body,author_fullname,author.name,controversiality,created,downs,fullname,id,is_root,link_author,link_id,link_permalink,link_title,permalink,score,subreddit_name_prefixed,total_awards_received,ups
"There’s a live cam of the cherry blossoms at the UW quad!

https://www.washington.edu/news/2022/03/10/uw-welcomes-community-to-view-cherry-blossoms-peak-bloom-expected-mid-march/",t2_pgvxn,lizardmatriarch,0,1648262503.0,0,t1_i25cu77,i25cu77,True,Paul--Bufano,t3_tnn487,https://www.reddit.com/r/LynnwoodWA/comments/tnn487/where_is_the_best_place_to_look_at_the_cherry/,Where is the best place to look at the cherry blossoms?,/r/LynnwoodWA/comments/tnn487/where_is_the_best_place_to_look_at_the_cherry/i25cu77/,2,r/LynnwoodWA,0,2
"UW, but if you can go during the weekday or before 10 on the weekend. Otherwise it can get super crowded (still worth it though just don’t expect an empty background shot)",t2_be49o,firelitdrgn,0,1648229477.0,0,t1_i239mqy,i239mqy,True,Paul--Bufano,t3_tnn487,https://www.reddit.com/r/LynnwoodWA/comments/tnn487/where_is_the_best_place_to_look_at_the_cherry/,Where is the best place to look at the cherry blossoms?,/r/LynnwoodWA/comments/tnn487/where_is_the_best_place_to_look_at_the_cherry/i239mqy/,5,r/LynnwoodWA,0,5
"UW main campus, in the “quad”. Just google it.",t2_8xg8u4k1,HolyCrappolla123,0,1648222721.0,0,t1_i22s5be,i22s5be,True,Paul--Bufano,t3_tnn487,https://www.reddit.com/r/LynnwoodWA/comments/tnn487/where_is_the_best_place_to_look_at_the_cherry/,Where is the best place to look at the cherry blossoms?,/r/LynnwoodWA/comments/tnn487/where_is_the_best_place_to_look_at_the_cherry/i22s5be/,9,r/LynnwoodWA,0,9
"In Lynnwood? Or in general? I somewhat recently moved here, but I do know that UW and the arboretum are good spots",t2_128rpr,BEHayley,0,1648220554.0,0,t1_i22moep,i22moep,True,Paul--Bufano,t3_tnn487,https://www.reddit.com/r/LynnwoodWA/comments/tnn487/where_is_the_best_place_to_look_at_the_cherry/,Where is the best place to look at the cherry blossoms?,/r/LynnwoodWA/comments/tnn487/where_is_the_best_place_to_look_at_the_cherry/i22moep/,5,r/LynnwoodWA,0,5
UW,t2_zfspu,northwestxroger,0,1648220006.0,0,t1_i22lb6y,i22lb6y,True,Paul--Bufano,t3_tnn487,https://www.reddit.com/r/LynnwoodWA/comments/tnn487/where_is_the_best_place_to_look_at_the_cherry/,Where is the best place to look at the cherry blossoms?,/r/LynnwoodWA/comments/tnn487/where_is_the_best_place_to_look_at_the_cherry/i22lb6y/,11,r/LynnwoodWA,0,11
"I am, I live off 148th by the Safeway.",t2_jd0e8,bitch-ass_ho,0,1647888815.0,0,t1_i1kc582,i1kc582,False,WASADHa206,t3_tj1t4g,https://www.reddit.com/r/LynnwoodWA/comments/tj1t4g/dawood_been_dead_lately/,DaWood been dead lately,/r/LynnwoodWA/comments/tj1t4g/dawood_been_dead_lately/i1kc582/,1,r/LynnwoodWA,0,1
"👋 

I may have misinterpreted OPs initial post to mean this sub is dead. Turns out they were talking about the town. Lol",t2_3yynepyf,Jclyde27,0,1647866109.0,0,t1_i1iu6t0,i1iu6t0,False,WASADHa206,t3_tj1t4g,https://www.reddit.com/r/LynnwoodWA/comments/tj1t4g/dawood_been_dead_lately/,DaWood been dead lately,/r/LynnwoodWA/comments/tj1t4g/dawood_been_dead_lately/i1iu6t0/,6,r/LynnwoodWA,0,6
I am! Reddit for the win.,t2_7mrqzlju,Great-Opportunity970,0,1647862901.0,0,t1_i1iow1v,i1iow1v,False,WASADHa206,t3_tj1t4g,https://www.reddit.com/r/LynnwoodWA/comments/tj1t4g/dawood_been_dead_lately/,DaWood been dead lately,/r/LynnwoodWA/comments/tj1t4g/dawood_been_dead_lately/i1iow1v/,3,r/LynnwoodWA,0,3
More less,t2_hsutfljy,WASADHa206,0,1647836853.0,0,t1_i1hrsv9,i1hrsv9,False,WASADHa206,t3_tj1t4g,https://www.reddit.com/r/LynnwoodWA/comments/tj1t4g/dawood_been_dead_lately/,DaWood been dead lately,/r/LynnwoodWA/comments/tj1t4g/dawood_been_dead_lately/i1hrsv9/,1,r/LynnwoodWA,0,1
Was this English?,t2_6q1vy,StoicAthos,1,1647836751.0,0,t1_i1hrms5,i1hrms5,False,WASADHa206,t3_tj1t4g,https://www.reddit.com/r/LynnwoodWA/comments/tj1t4g/dawood_been_dead_lately/,DaWood been dead lately,/r/LynnwoodWA/comments/tj1t4g/dawood_been_dead_lately/i1hrms5/,0,r/LynnwoodWA,0,0
"I’m at the other FM on 164 even walking is far from everywhere, driving has nowhere to go cause of the weather cold af lol",t2_hsutfljy,WASADHa206,0,1647835736.0,0,t1_i1hpxgi,i1hpxgi,False,WASADHa206,t3_tj1t4g,https://www.reddit.com/r/LynnwoodWA/comments/tj1t4g/dawood_been_dead_lately/,DaWood been dead lately,/r/LynnwoodWA/comments/tj1t4g/dawood_been_dead_lately/i1hpxgi/,3,r/LynnwoodWA,0,3
People who live in Lynnwood aren’t on Reddit is my guess? (I live off 196th by the FM),t2_3yynepyf,Jclyde27,0,1647835276.0,0,t1_i1hp5jk,i1hp5jk,True,WASADHa206,t3_tj1t4g,https://www.reddit.com/r/LynnwoodWA/comments/tj1t4g/dawood_been_dead_lately/,DaWood been dead lately,/r/LynnwoodWA/comments/tj1t4g/dawood_been_dead_lately/i1hp5jk/,6,r/LynnwoodWA,0,6
Sent you a dm,t2_i4hniysu,HunterPuzzled6413,0,1647707867.0,0,t1_i1apx5w,i1apx5w,False,HunterPuzzled6413,t3_tfthil,https://www.reddit.com/r/LynnwoodWA/comments/tfthil/rental_house_available_starting_april_18th/,Rental house available starting April 18th,/r/LynnwoodWA/comments/tfthil/rental_house_available_starting_april_18th/i1apx5w/,1,r/LynnwoodWA,0,1
Is there a listing somewhere? Pictures?,t2_10v24,Isvara,0,1647706072.0,0,t1_i1allh4,i1allh4,True,HunterPuzzled6413,t3_tfthil,https://www.reddit.com/r/LynnwoodWA/comments/tfthil/rental_house_available_starting_april_18th/,Rental house available starting April 18th,/r/LynnwoodWA/comments/tfthil/rental_house_available_starting_april_18th/i1allh4/,1,r/LynnwoodWA,0,1
"Yeah, read this today.. That's super, not cool. Gkad the couple was okay",t2_ip1dmp8y,vibrator_chipt_toof,0,1647590108.0,0,t1_i14mczs,i14mczs,True,justin9020,t3_tguwar,https://www.reddit.com/r/LynnwoodWA/comments/tguwar/lynnwood_couple_tied_up_while_suspects_burglarize/,Lynnwood couple tied up while suspects burglarize home,/r/LynnwoodWA/comments/tguwar/lynnwood_couple_tied_up_while_suspects_burglarize/i14mczs/,5,r/LynnwoodWA,0,5
"Hi, appreciate the reply. Yeah CPE was the first place I called but I didn't ask about maintenance team. They redirected me to local libraries which was also a dead end. Actually, the libraries said I should try social media lol, so I just might include classmates.com. thanks again!",t2_bymyzr62,VacationExisting1816,0,1647216753.0,0,t1_i0k2370,i0k2370,False,VacationExisting1816,t3_t4kk5c,https://www.reddit.com/r/LynnwoodWA/comments/t4kk5c/old_yearbook/,Old Yearbook?,/r/LynnwoodWA/comments/t4kk5c/old_yearbook/i0k2370/,1,r/LynnwoodWA,0,1
"I suspect the school district isn't necessarily synced with the school itself — if you just called the front desk of CPE, the person working there probably has a pretty good idea of what's in most of the spare rooms. Maybe ask them to check with the maintenance team and give you a call back. You can also check on [classmates.com](https://classmates.com) — you might recognize an old classmate and see if they have the book. Maybe they'd be so kind as to just send you a couple phone shots or scans of it.",t2_900pr,311TruthMovement,0,1647087552.0,0,t1_i0d0ohf,i0d0ohf,True,VacationExisting1816,t3_t4kk5c,https://www.reddit.com/r/LynnwoodWA/comments/t4kk5c/old_yearbook/,Old Yearbook?,/r/LynnwoodWA/comments/t4kk5c/old_yearbook/i0d0ohf/,2,r/LynnwoodWA,0,2
"Lynnwood has turned into a real border zone of Seattle culture vs. Snohomish-Lake Stevens-Arlington-ish culture. Lots of thin blue line stickers, lots of rainbow flag stickers.",t2_900pr,311TruthMovement,0,1647087227.0,0,t1_i0d08v1,i0d08v1,True,StoicAthos,t3_t95s56,https://www.reddit.com/r/LynnwoodWA/comments/t95s56/sure_are_a_bunch_of_trashy_people_waving_their/,Sure are a bunch of trashy people waving their big flags on their trucks/cars lately.,/r/LynnwoodWA/comments/t95s56/sure_are_a_bunch_of_trashy_people_waving_their/i0d08v1/,1,r/LynnwoodWA,0,1
"I totally agree. When I see an American riding his American truck with an American flag attached in America I think, ""Wow, what utter trash. I bet he's alt-right for supporting America, and fascist too (despite the high change that his grandpa probably fought the Nazis).""

This comment here come off as disrespectful and high and mighty.",t2_7r3to8t9,ClassicK777,0,1646930198.0,0,t1_i04hank,i04hank,True,StoicAthos,t3_t95s56,https://www.reddit.com/r/LynnwoodWA/comments/t95s56/sure_are_a_bunch_of_trashy_people_waving_their/,Sure are a bunch of trashy people waving their big flags on their trucks/cars lately.,/r/LynnwoodWA/comments/t95s56/sure_are_a_bunch_of_trashy_people_waving_their/i04hank/,1,r/LynnwoodWA,0,1
"Me, too. Turn over those rocks so we know what’s there.",t2_84ugq5fj,JohnExcrement,0,1646791367.0,0,t1_hzx41lf,hzx41lf,False,StoicAthos,t3_t95s56,https://www.reddit.com/r/LynnwoodWA/comments/t95s56/sure_are_a_bunch_of_trashy_people_waving_their/,Sure are a bunch of trashy people waving their big flags on their trucks/cars lately.,/r/LynnwoodWA/comments/t95s56/sure_are_a_bunch_of_trashy_people_waving_their/hzx41lf/,1,r/LynnwoodWA,0,1
They definitely feel bolder. I'd rather have them out and proud so I know who to avoid.,t2_9plzg,Finemind,0,1646790712.0,0,t1_hzx2l04,hzx2l04,False,StoicAthos,t3_t95s56,https://www.reddit.com/r/LynnwoodWA/comments/t95s56/sure_are_a_bunch_of_trashy_people_waving_their/,Sure are a bunch of trashy people waving their big flags on their trucks/cars lately.,/r/LynnwoodWA/comments/t95s56/sure_are_a_bunch_of_trashy_people_waving_their/hzx2l04/,2,r/LynnwoodWA,0,2
"Make a post on Buy Nothing, they have microwaves on there all the time.",t2_6q1vy,StoicAthos,0,1646783407.0,0,t1_hzwmfvk,hzwmfvk,False,StoicAthos,t3_t95s56,https://www.reddit.com/r/LynnwoodWA/comments/t95s56/sure_are_a_bunch_of_trashy_people_waving_their/,Sure are a bunch of trashy people waving their big flags on their trucks/cars lately.,/r/LynnwoodWA/comments/t95s56/sure_are_a_bunch_of_trashy_people_waving_their/hzwmfvk/,2,r/LynnwoodWA,0,2
"I get it, sorry I tried to argue with y’all. 

I just moved away from Lynnwood because I couldn’t stand my cars getting broken into all the time, there seems to be a community of people living in the woods off ash way that I couldn’t tolerate. I tried calling the city, I tried talking to enforcement but nothing ever changed so I ended up moving. Lynnwood is great, people are cool, there’s a great mall and H mart was my favorite place to shop.",t2_duayt5sj,Tickditties69,0,1646771678.0,0,t1_hzvuui0,hzvuui0,False,StoicAthos,t3_t95s56,https://www.reddit.com/r/LynnwoodWA/comments/t95s56/sure_are_a_bunch_of_trashy_people_waving_their/,Sure are a bunch of trashy people waving their big flags on their trucks/cars lately.,/r/LynnwoodWA/comments/t95s56/sure_are_a_bunch_of_trashy_people_waving_their/hzvuui0/,2,r/LynnwoodWA,0,2
"Overt nationalism is a key tenant of Fascism. Ingroup social dynamic is key of Conservatism, which tracks with the willingness to shun/attack/offend outgroups.",t2_16wfs,nikdahl,0,1646771281.0,0,t1_hzvtrqc,hzvtrqc,False,StoicAthos,t3_t95s56,https://www.reddit.com/r/LynnwoodWA/comments/t95s56/sure_are_a_bunch_of_trashy_people_waving_their/,Sure are a bunch of trashy people waving their big flags on their trucks/cars lately.,/r/LynnwoodWA/comments/t95s56/sure_are_a_bunch_of_trashy_people_waving_their/hzvtrqc/,4,r/LynnwoodWA,0,4
"yeah bro, sometimes when i’m driving home from the gym i see a dude or two wearing a safety vest and carrying an american flag over their shoulder and in my head i’m like ‘what’s the point?’",t2_wvhfi,neomortal,0,1646767145.0,0,t1_hzviqiy,hzviqiy,True,StoicAthos,t3_t95s56,https://www.reddit.com/r/LynnwoodWA/comments/t95s56/sure_are_a_bunch_of_trashy_people_waving_their/,Sure are a bunch of trashy people waving their big flags on their trucks/cars lately.,/r/LynnwoodWA/comments/t95s56/sure_are_a_bunch_of_trashy_people_waving_their/hzviqiy/,7,r/LynnwoodWA,0,7
Their baked spaghetti! ❤️❤️❤️,t2_84ugq5fj,JohnExcrement,0,1646757275.0,0,t1_hzurspl,hzurspl,False,Geistmenn,t3_qsk0j0,https://www.reddit.com/r/LynnwoodWA/comments/qsk0j0/restaurant_recommendations/,Restaurant recommendations?,/r/LynnwoodWA/comments/qsk0j0/restaurant_recommendations/hzurspl/,2,r/LynnwoodWA,0,2
"Ohana Teriyaki on Filbert, near the 7-Eleven, is my favorite. Wild Wasabi is my pick for sushi.",t2_84ugq5fj,JohnExcrement,0,1646757225.0,0,t1_hzurnyi,hzurnyi,True,Geistmenn,t3_qsk0j0,https://www.reddit.com/r/LynnwoodWA/comments/qsk0j0/restaurant_recommendations/,Restaurant recommendations?,/r/LynnwoodWA/comments/qsk0j0/restaurant_recommendations/hzurnyi/,1,r/LynnwoodWA,0,1
Walkability would be my dream come true. I remember years ago when Jim Smith campaigned and one of his hopes was to put sidewalks in all over. I sure wish that had happened.,t2_84ugq5fj,JohnExcrement,0,1646756981.0,0,t1_hzur0m2,hzur0m2,False,StoicAthos,t3_rrninx,https://www.reddit.com/r/LynnwoodWA/comments/rrninx/i_dont_think_im_alone_here_but_i_think_lynnwood/,I don't think I'm alone here but I think Lynnwood kind of sucks.,/r/LynnwoodWA/comments/rrninx/i_dont_think_im_alone_here_but_i_think_lynnwood/hzur0m2/,1,r/LynnwoodWA,0,1
"I’m wondering if there are more of these folks now, or if they just feel bolder about showing their true colors. I worked in Lynnwood on the 1970s, AKA the Reagan Era (didn’t live here until the ‘90s) and there was plenty of overt racism in my workplace. This was a community bank that no longer exists - the president was very outspoken about not lending to certain people and how other certain people allegedly never paid their rent etc. That kind of attitude seemed to go diminish in the community over time but it seems there’s been a resurgence, or the recent political climate has made people braver about it again.",t2_84ugq5fj,JohnExcrement,0,1646756687.0,0,t1_hzuq8kh,hzuq8kh,True,StoicAthos,t3_t95s56,https://www.reddit.com/r/LynnwoodWA/comments/t95s56/sure_are_a_bunch_of_trashy_people_waving_their/,Sure are a bunch of trashy people waving their big flags on their trucks/cars lately.,/r/LynnwoodWA/comments/t95s56/sure_are_a_bunch_of_trashy_people_waving_their/hzuq8kh/,10,r/LynnwoodWA,0,10
"And yet those people are wanting to threaten other people’s lifestyles. Tolerating intolerance does not lead to tolerance. It leads to intolerance growing. And why should some one move? I’d rather see it spoken out against then all the decent people moving.

Oh, and a free country does not mean you get no consequences. If you want to act trashy, people are going to judge you and call you out. They are just as free to express their view as well.",t2_8tvcg,tigress666,0,1646753602.0,0,t1_hzuieqv,hzuieqv,False,StoicAthos,t3_t95s56,https://www.reddit.com/r/LynnwoodWA/comments/t95s56/sure_are_a_bunch_of_trashy_people_waving_their/,Sure are a bunch of trashy people waving their big flags on their trucks/cars lately.,/r/LynnwoodWA/comments/t95s56/sure_are_a_bunch_of_trashy_people_waving_their/hzuieqv/,6,r/LynnwoodWA,0,6
There’s been a lot more of these alt righter anti masker types and a lot more crime than usual. I hope something can be done for our growing homelessness too. It’s getting rough out there.,t2_odeu1,phoenixliv,0,1646739876.0,0,t1_hztrhcp,hztrhcp,True,StoicAthos,t3_t95s56,https://www.reddit.com/r/LynnwoodWA/comments/t95s56/sure_are_a_bunch_of_trashy_people_waving_their/,Sure are a bunch of trashy people waving their big flags on their trucks/cars lately.,/r/LynnwoodWA/comments/t95s56/sure_are_a_bunch_of_trashy_people_waving_their/hztrhcp/,9,r/LynnwoodWA,0,9
"Aren't judged by others, hah!

Born and raised here, so don't go around making things up. I'd tell you to do the same, then maybe figure out why you believe these people should be left to intimidate others, or why you're so bothered to worry about them being called trashy for doing so.

Then try to walk back your, ""why this state is so great"" exceptionalism and realize things always need to be improved upon in a society for it to grow. Racist and nationalists shouldn't be able to feel so comfortable in any society.",t2_6q1vy,StoicAthos,0,1646717972.0,0,t1_hzszcm6,hzszcm6,False,StoicAthos,t3_t95s56,https://www.reddit.com/r/LynnwoodWA/comments/t95s56/sure_are_a_bunch_of_trashy_people_waving_their/,Sure are a bunch of trashy people waving their big flags on their trucks/cars lately.,/r/LynnwoodWA/comments/t95s56/sure_are_a_bunch_of_trashy_people_waving_their/hzszcm6/,13,r/LynnwoodWA,0,13
"It’s just odd to me, that your so upset about it 🤣

I dunno if your forgetting what makes this state so great but it’s the fact that lifestyles and and peoples opinions aren’t judged by others, it’s obvious you must not be from here but if I were you I’d sit down and take a look around at what makes this state so great before you start complaining.",t2_duayt5sj,Tickditties69,0,1646717563.0,0,t1_hzsyou3,hzsyou3,False,StoicAthos,t3_t95s56,https://www.reddit.com/r/LynnwoodWA/comments/t95s56/sure_are_a_bunch_of_trashy_people_waving_their/,Sure are a bunch of trashy people waving their big flags on their trucks/cars lately.,/r/LynnwoodWA/comments/t95s56/sure_are_a_bunch_of_trashy_people_waving_their/hzsyou3/,-11,r/LynnwoodWA,0,-11
"Who gives a fuck are the people these sorts of acts are meant to intimidate. Especially in flying the thin blue line flag so openly, it's clearly their new confederate flag, which isn't sold in stores anymore. Once again you may be open to their viewpoints, but it's trashy. It is important to note when both nationalists and racists start to become more visible in the area before they become a normality.

I don't need to move to call it for what it is and it's odd you feel the need to defend such actions.",t2_6q1vy,StoicAthos,0,1646717255.0,0,t1_hzsy6wo,hzsy6wo,False,StoicAthos,t3_t95s56,https://www.reddit.com/r/LynnwoodWA/comments/t95s56/sure_are_a_bunch_of_trashy_people_waving_their/,Sure are a bunch of trashy people waving their big flags on their trucks/cars lately.,/r/LynnwoodWA/comments/t95s56/sure_are_a_bunch_of_trashy_people_waving_their/hzsy6wo/,21,r/LynnwoodWA,0,21
"Move closer to Seattle if it rattles your cage so much. 

Like I get it, but at the end of the day, who gives a fuck.",t2_duayt5sj,Tickditties69,0,1646716328.0,0,t1_hzswn4p,hzswn4p,False,StoicAthos,t3_t95s56,https://www.reddit.com/r/LynnwoodWA/comments/t95s56/sure_are_a_bunch_of_trashy_people_waving_their/,Sure are a bunch of trashy people waving their big flags on their trucks/cars lately.,/r/LynnwoodWA/comments/t95s56/sure_are_a_bunch_of_trashy_people_waving_their/hzswn4p/,-17,r/LynnwoodWA,0,-17
Thank you.,t2_duayt5sj,Tickditties69,1,1646716251.0,0,t1_hzswib2,hzswib2,False,StoicAthos,t3_t95s56,https://www.reddit.com/r/LynnwoodWA/comments/t95s56/sure_are_a_bunch_of_trashy_people_waving_their/,Sure are a bunch of trashy people waving their big flags on their trucks/cars lately.,/r/LynnwoodWA/comments/t95s56/sure_are_a_bunch_of_trashy_people_waving_their/hzswib2/,-5,r/LynnwoodWA,0,-5
"Lynnwood has never been conservative, always been a blue voting bloc. Seeing the guys out there rolling coal and attaching giant flags on their vehicles is not something that has ever been a thing until recently. It's trashy. Maybe you're cool with the growing nationalistic vibe of the area, but I find it concerning and definitely worth making note of.",t2_6q1vy,StoicAthos,0,1646713992.0,0,t1_hzssii0,hzssii0,False,StoicAthos,t3_t95s56,https://www.reddit.com/r/LynnwoodWA/comments/t95s56/sure_are_a_bunch_of_trashy_people_waving_their/,Sure are a bunch of trashy people waving their big flags on their trucks/cars lately.,/r/LynnwoodWA/comments/t95s56/sure_are_a_bunch_of_trashy_people_waving_their/hzssii0/,24,r/LynnwoodWA,0,24
"I’m not sure what your goal is here.

Name calling puts people on the defensive, so they obviously won’t listen to anything you have to say. Did you just feel like complaining? 

It’s pretty well known that the further north you go from Seattle the more conservative the population becomes. This isn’t a new thing. 

If you’d like to see a change, take an action that will move things in that direction.",t2_1tcl,tanglisha,1,1646712860.0,0,t1_hzsqeqj,hzsqeqj,True,StoicAthos,t3_t95s56,https://www.reddit.com/r/LynnwoodWA/comments/t95s56/sure_are_a_bunch_of_trashy_people_waving_their/,Sure are a bunch of trashy people waving their big flags on their trucks/cars lately.,/r/LynnwoodWA/comments/t95s56/sure_are_a_bunch_of_trashy_people_waving_their/hzsqeqj/,-6,r/LynnwoodWA,0,-6
Just making note of the changing demographics of the area. Specifically the note that there seems to be a growing number of radicalized trashy individuals.,t2_6q1vy,StoicAthos,0,1646712191.0,0,t1_hzsp453,hzsp453,False,StoicAthos,t3_t95s56,https://www.reddit.com/r/LynnwoodWA/comments/t95s56/sure_are_a_bunch_of_trashy_people_waving_their/,Sure are a bunch of trashy people waving their big flags on their trucks/cars lately.,/r/LynnwoodWA/comments/t95s56/sure_are_a_bunch_of_trashy_people_waving_their/hzsp453/,15,r/LynnwoodWA,0,15
What is the point of this post?,t2_duayt5sj,Tickditties69,1,1646711559.0,0,t1_hzsntrp,hzsntrp,True,StoicAthos,t3_t95s56,https://www.reddit.com/r/LynnwoodWA/comments/t95s56/sure_are_a_bunch_of_trashy_people_waving_their/,Sure are a bunch of trashy people waving their big flags on their trucks/cars lately.,/r/LynnwoodWA/comments/t95s56/sure_are_a_bunch_of_trashy_people_waving_their/hzsntrp/,-8,r/LynnwoodWA,0,-8
"3 years later, why is this being spammed now? Sad story, I just don't get the reasoning.",t2_6q1vy,StoicAthos,0,1646611681.0,0,t1_hzn320w,hzn320w,True,HipHop_Local_Legends,t3_t85mkq,https://www.reddit.com/r/LynnwoodWA/comments/t85mkq/18_year_old_alyssa_noceda_died_from_an_overdose/,"18 year old Alyssa Noceda died from an overdose while snorting pills laced with fentanyl. Instead of calling for help, 20 year old Brian Varela raped her while she was on the ground dying!",/r/LynnwoodWA/comments/t85mkq/18_year_old_alyssa_noceda_died_from_an_overdose/hzn320w/,6,r/LynnwoodWA,0,6
He’s been out of jail,t2_3sw5ayzf,moefooo,0,1646595111.0,0,t1_hzm0zzs,hzm0zzs,True,HipHop_Local_Legends,t3_t85mkq,https://www.reddit.com/r/LynnwoodWA/comments/t85mkq/18_year_old_alyssa_noceda_died_from_an_overdose/,"18 year old Alyssa Noceda died from an overdose while snorting pills laced with fentanyl. Instead of calling for help, 20 year old Brian Varela raped her while she was on the ground dying!",/r/LynnwoodWA/comments/t85mkq/18_year_old_alyssa_noceda_died_from_an_overdose/hzm0zzs/,3,r/LynnwoodWA,0,3
