body,author_fullname,author.name,controversiality,created,downs,fullname,id,is_root,link_author,link_id,link_permalink,link_title,permalink,score,subreddit_name_prefixed,total_awards_received,ups
"TMobile 5g is great here, just switched from Verizon. Utilities are high. Traffic sux. But you're in the country so...",t2_5r41zedu,Bindyourselfandwait,0,1582411810.0,0,t1_fihluk0,fihluk0,True,HeyFuckFace4,t3_eoww6y,https://www.reddit.com/r/Maricopa/comments/eoww6y/debating_on_moving_to_maricopa/,Debating on moving to Maricopa,/r/Maricopa/comments/eoww6y/debating_on_moving_to_maricopa/fihluk0/,1,r/Maricopa,0,1
"The utilities are very high.  Water bill is $100/mo.  HOA is 75+/mo.  Electric is $200-400/mo for your typical house.

Internet options are limited, and they're both painfully slow compared to what you can get in Chandler.

Cell phone signal is pretty disappointing.  Cell data is VERY disappointing.

There's one way in/out of town, so commuting would be a serious pain.  Unfortunately, commuting is just about the only way to get a white collar job.

Honestly... not as many upsides as there used to be.  As they continue to pump more and more houses into this town, the infrastructure to support them all is waaaaay overtaxed.",t2_40fpmi4e,ithp,0,1579804355.0,0,t1_ffcpcna,ffcpcna,True,HeyFuckFace4,t3_eoww6y,https://www.reddit.com/r/Maricopa/comments/eoww6y/debating_on_moving_to_maricopa/,Debating on moving to Maricopa,/r/Maricopa/comments/eoww6y/debating_on_moving_to_maricopa/ffcpcna/,1,r/Maricopa,0,1
Yeah I saw that. I was talking more along the lines of not a rent to own type place and that had more than Ashley quality furniture.,t2_11npfm,Chrisjung2079,0,1579662799.0,0,t1_ff80hkh,ff80hkh,True,Chrisjung2079,t3_es4a5q,https://www.reddit.com/r/Maricopa/comments/es4a5q/furniture/,Furniture?,/r/Maricopa/comments/es4a5q/furniture/ff80hkh/,1,r/Maricopa,0,1
There's an Aaron's.,t2_1pb6ywm,EasilyAmusedQuilter,0,1579662486.0,0,t1_ff80230,ff80230,True,Chrisjung2079,t3_es4a5q,https://www.reddit.com/r/Maricopa/comments/es4a5q/furniture/,Furniture?,/r/Maricopa/comments/es4a5q/furniture/ff80230/,3,r/Maricopa,0,3
"No, not in Maricopa. Casa Grande or Ahwatukee/Chandler are the closest.",t2_20k3mlka,lmantrom,0,1579659570.0,0,t1_ff7vub9,ff7vub9,True,Chrisjung2079,t3_es4a5q,https://www.reddit.com/r/Maricopa/comments/es4a5q/furniture/,Furniture?,/r/Maricopa/comments/es4a5q/furniture/ff7vub9/,2,r/Maricopa,0,2
"I just moved a few months ago and don't remember anything like that there, other than, say, Walmart with some basics. Maybe some more basics at Fry's Marketplace. But nothing with a good selection, or I would have gone.",t2_pnb2dpo,dizzlemcshizzle,0,1579655529.0,0,t1_ff7pz8w,ff7pz8w,True,Chrisjung2079,t3_es4a5q,https://www.reddit.com/r/Maricopa/comments/es4a5q/furniture/,Furniture?,/r/Maricopa/comments/es4a5q/furniture/ff7pz8w/,3,r/Maricopa,0,3
Congrats man keep up the good work!,t2_jamoc,Smoke_Me_When_i_Die,0,1579581900.0,0,t1_ff56tru,ff56tru,False,CrossmenX,t3_ebi5v2,https://www.reddit.com/r/Maricopa/comments/ebi5v2/5760_x_1080_oc_sunset_in_maricopa_az/,"[5760 x 1080] OC - Sunset in Maricopa, AZ",/r/Maricopa/comments/ebi5v2/5760_x_1080_oc_sunset_in_maricopa_az/ff56tru/,1,r/Maricopa,0,1
Still a long time! I've been here since 03.,t2_jamoc,Smoke_Me_When_i_Die,0,1579581549.0,0,t1_ff56evo,ff56evo,False,msearthmuffin,t3_ehplqx,https://www.reddit.com/r/Maricopa/comments/ehplqx/watch_the_city_of_maricopa_on_youtube/,"Watch ""The City of Maricopa"" on YouTube",/r/Maricopa/comments/ehplqx/watch_the_city_of_maricopa_on_youtube/ff56evo/,1,r/Maricopa,0,1
"Not OG, but 12 years now.",t2_4fmqr,CrossmenX,0,1579571442.0,0,t1_ff4sl79,ff4sl79,False,msearthmuffin,t3_ehplqx,https://www.reddit.com/r/Maricopa/comments/ehplqx/watch_the_city_of_maricopa_on_youtube/,"Watch ""The City of Maricopa"" on YouTube",/r/Maricopa/comments/ehplqx/watch_the_city_of_maricopa_on_youtube/ff4sl79/,2,r/Maricopa,0,2
"Thanks, and yes, looking west! 
I just signed up to the local Honeycutt coffee small business event where I'll have some of my other work on display next month.",t2_4fmqr,CrossmenX,0,1579570934.0,0,t1_ff4ruo0,ff4ruo0,False,CrossmenX,t3_ebi5v2,https://www.reddit.com/r/Maricopa/comments/ebi5v2/5760_x_1080_oc_sunset_in_maricopa_az/,"[5760 x 1080] OC - Sunset in Maricopa, AZ",/r/Maricopa/comments/ebi5v2/5760_x_1080_oc_sunset_in_maricopa_az/ff4ruo0/,1,r/Maricopa,0,1
"Ah man it's been crazy seeing the city spring up, even in just the last year. You another OG Copan like I am?",t2_jamoc,Smoke_Me_When_i_Die,0,1579562023.0,0,t1_ff4ezj1,ff4ezj1,False,msearthmuffin,t3_ehplqx,https://www.reddit.com/r/Maricopa/comments/ehplqx/watch_the_city_of_maricopa_on_youtube/,"Watch ""The City of Maricopa"" on YouTube",/r/Maricopa/comments/ehplqx/watch_the_city_of_maricopa_on_youtube/ff4ezj1/,2,r/Maricopa,0,2
"Nice Patrick lol. What is that, black construction paper?",t2_jamoc,Smoke_Me_When_i_Die,0,1579561677.0,0,t1_ff4egu4,ff4egu4,True,Daisyal17,t3_dut7fi,https://www.reddit.com/r/Maricopa/comments/dut7fi/art_class/,Art class ❤️,/r/Maricopa/comments/dut7fi/art_class/ff4egu4/,1,r/Maricopa,0,1
"Damn. Well, if you can get in contact with anyone from the HS you might be able to form a group. I know when I was there they had some cool ones (like a robotics club).",t2_jamoc,Smoke_Me_When_i_Die,0,1579561605.0,0,t1_ff4ecwt,ff4ecwt,False,dyslexicdoodlebob123,t3_eenw6t,https://www.reddit.com/r/Maricopa/comments/eenw6t/dnd_players_in_maricopa_im_looking_for_a_dnd/,Dnd players in maricopa I'm looking for a dnd party to start my first dnd story,/r/Maricopa/comments/eenw6t/dnd_players_in_maricopa_im_looking_for_a_dnd/ff4ecwt/,1,r/Maricopa,0,1
"Incredible! This is looking west, yes?",t2_jamoc,Smoke_Me_When_i_Die,0,1579561504.0,0,t1_ff4e7iu,ff4e7iu,True,CrossmenX,t3_ebi5v2,https://www.reddit.com/r/Maricopa/comments/ebi5v2/5760_x_1080_oc_sunset_in_maricopa_az/,"[5760 x 1080] OC - Sunset in Maricopa, AZ",/r/Maricopa/comments/ebi5v2/5760_x_1080_oc_sunset_in_maricopa_az/ff4e7iu/,2,r/Maricopa,0,2
You can't do that at my school,t2_44trljum,dyslexicdoodlebob123,0,1579561470.0,0,t1_ff4e5o4,ff4e5o4,False,dyslexicdoodlebob123,t3_eenw6t,https://www.reddit.com/r/Maricopa/comments/eenw6t/dnd_players_in_maricopa_im_looking_for_a_dnd/,Dnd players in maricopa I'm looking for a dnd party to start my first dnd story,/r/Maricopa/comments/eenw6t/dnd_players_in_maricopa_im_looking_for_a_dnd/ff4e5o4/,1,r/Maricopa,0,1
"Have you considered forming a club at your school? It's not so hard to do, me and my friend created the anime and chess clubs at the high school. Not sure if they even still exist though to be honest.

*Edited my post to fix some things.",t2_jamoc,Smoke_Me_When_i_Die,0,1579561410.0,0,t1_ff4e2gq,ff4e2gq,True,dyslexicdoodlebob123,t3_eenw6t,https://www.reddit.com/r/Maricopa/comments/eenw6t/dnd_players_in_maricopa_im_looking_for_a_dnd/,Dnd players in maricopa I'm looking for a dnd party to start my first dnd story,/r/Maricopa/comments/eenw6t/dnd_players_in_maricopa_im_looking_for_a_dnd/ff4e2gq/,1,r/Maricopa,0,1
My school doesn't do clubs,t2_44trljum,dyslexicdoodlebob123,0,1579561373.0,0,t1_ff4e0g2,ff4e0g2,False,dyslexicdoodlebob123,t3_eenw6t,https://www.reddit.com/r/Maricopa/comments/eenw6t/dnd_players_in_maricopa_im_looking_for_a_dnd/,Dnd players in maricopa I'm looking for a dnd party to start my first dnd story,/r/Maricopa/comments/eenw6t/dnd_players_in_maricopa_im_looking_for_a_dnd/ff4e0g2/,1,r/Maricopa,0,1
The biggest problems I would say are the smell from agriculture and the commute into the Valley. But it's not so bad - you get used to the smell. And there's more and more jobs in Copa so you might not even have to commute. And honestly even with the long drive the traffic isn't as crazy as you would see even just in Tukee.,t2_jamoc,Smoke_Me_When_i_Die,0,1579561072.0,0,t1_ff4dk1r,ff4dk1r,True,HeyFuckFace4,t3_eoww6y,https://www.reddit.com/r/Maricopa/comments/eoww6y/debating_on_moving_to_maricopa/,Debating on moving to Maricopa,/r/Maricopa/comments/eoww6y/debating_on_moving_to_maricopa/ff4dk1r/,1,r/Maricopa,0,1
"I lived a year up in chandler before moving to copa. In general I found my electric bill's went up about $100 at peak season compared to Chandler. About $350 for 79 degree set temp. Water here is also about double what I paid in town. Global water chargers upfront so minium payment is like $90 a month for water and sewer but the water is cheap so I water the lawn all summer for like maybe $20-30 a month more.  
Just s note most of Maricopa is getting to be about 10 years old so look for places with new AC units and water heaters so you hopefully don't have to replace one of those bc that's spendy. Oh and new exterior paint.",t2_m19sk,YesterEve,0,1579146029.0,0,t1_feisfu9,feisfu9,True,HeyFuckFace4,t3_eoww6y,https://www.reddit.com/r/Maricopa/comments/eoww6y/debating_on_moving_to_maricopa/,Debating on moving to Maricopa,/r/Maricopa/comments/eoww6y/debating_on_moving_to_maricopa/feisfu9/,3,r/Maricopa,0,3
I'm running CenturyLink with 80down 10up for $55 a month. Haven't had a problem with stability yet. Knock on wood.,t2_m19sk,YesterEve,0,1579145554.0,0,t1_feirrh4,feirrh4,False,HeyFuckFace4,t3_eoww6y,https://www.reddit.com/r/Maricopa/comments/eoww6y/debating_on_moving_to_maricopa/,Debating on moving to Maricopa,/r/Maricopa/comments/eoww6y/debating_on_moving_to_maricopa/feirrh4/,1,r/Maricopa,0,1
"Chimmimg in late here :)

Lived in the Copa for 10+ years now and it's definitely got its pros and cons.

I don't know of anyone with power bills anywhere close to $1,000.  We're in a 2,600 sq ft home with a pool.  Highest summer bills run $300 - $350, depending on weather conditions, visitors, traveling, mood, etc.  ED-3 is our only electric option which does make one scratch their head.  The water utility is the same, only one option, and it's approximately $100-$120 per month, every month, regardless of time of year (the majority is for their 'services' and the least for actual usage).  We used Oribtel 40M services for the majority of our tenure here and it worked well, no major complaints.  CenturyLink installed fiber in many developments a few years ago when they rolled out Prism TV.  We just recently switched to CenturyLink 140M DSL service and it's been pretty fantastic, so far.

The commute does suck but, rush hours sucks all over the Valley too.  My spouse works in Tempe and loathes the daily commute, especially during snow bird season.  On rare occasion, a fatal accident can shut down a section of the 347 highway and cause quite a disruption.  In the years we've lived here, it's happened about 1/2 dozen times where it affected our commute.  I mostly work in the field (traveling all over the Valley and State) and I actually chose Maricopa (over the other sprawl cities at the time like Laveen and Queek Creek) because it is kind of central to Valley and closer to Tucson.  Lastly, Maricopa is still used as a by-pass/shortcut for folks traveling from I-10E to I-8W which can make for strangely thick traffic in town at times.

The night's sky out here can be beautiful, especially looking South.  We have a North-facing balcony so we get to see all of the fireworks in Chandler and other towns too.  Being 'remote', we do see some wicked sand storms out here.  Something to consider if you have breathing issues (which applies to most of AZ but, a little worse sitting in the middle of the desert).  It's also ever so slightly cooler out here than in the Valley with less urban heat island effect.  It is still a relatively small town, still growing with new and exciting things from time to time.",t2_5hmiu,msearthmuffin,0,1579145173.0,0,t1_feir7qn,feir7qn,True,HeyFuckFace4,t3_eoww6y,https://www.reddit.com/r/Maricopa/comments/eoww6y/debating_on_moving_to_maricopa/,Debating on moving to Maricopa,/r/Maricopa/comments/eoww6y/debating_on_moving_to_maricopa/feir7qn/,2,r/Maricopa,0,2
"I lived in 'Copa for five year ending last 4th of July, now back in the valley. I had an 1850 sqft 2 story, no pool, no solar. I kept the AC at 82 during the day in the summer, 76 at night. My electric bills were never over $300 in the summer, and as low as $90 during the winter.

I now live in Phoenix Metro on APS, 1600 sqft one story with pool, no solar, brand new AC, same temps as before. My highest summer bill was $330, and my lowest winter bill so far is $165, I think due to the pool more than anything.

I did enjoy Maricopa in general and have no regrets about living there, where the low cost of home ownership helped during difficult times. That said, I'm happy to be back in the valley now, too.",t2_pnb2dpo,dizzlemcshizzle,0,1579131299.0,0,t1_fei6eew,fei6eew,True,HeyFuckFace4,t3_eoww6y,https://www.reddit.com/r/Maricopa/comments/eoww6y/debating_on_moving_to_maricopa/,Debating on moving to Maricopa,/r/Maricopa/comments/eoww6y/debating_on_moving_to_maricopa/fei6eew/,2,r/Maricopa,0,2
"Yeah, sounded like a great idea 5 years ago. Insert Homer Simpson ""D'oh"".",t2_1l7hu8k,PokUrOwnFace,0,1579065242.0,0,t1_fefu3g3,fefu3g3,False,HeyFuckFace4,t3_eoww6y,https://www.reddit.com/r/Maricopa/comments/eoww6y/debating_on_moving_to_maricopa/,Debating on moving to Maricopa,/r/Maricopa/comments/eoww6y/debating_on_moving_to_maricopa/fefu3g3/,3,r/Maricopa,0,3
"I mean that’s not that bad.. Okay, so I have another question. I know people really dislike the 347 highway but what would be some of your pros and cons for living there?",t2_1eamc7qi,HeyFuckFace4,0,1579064253.0,0,t1_fefsyav,fefsyav,False,HeyFuckFace4,t3_eoww6y,https://www.reddit.com/r/Maricopa/comments/eoww6y/debating_on_moving_to_maricopa/,Debating on moving to Maricopa,/r/Maricopa/comments/eoww6y/debating_on_moving_to_maricopa/fefsyav/,2,r/Maricopa,0,2
"So I currently have CenturyLink for the sake of stability. It hasn't let me down yet, and I'm an internet whore. I don't have cable TV. Went with YoutubeTV and it's great. Streams on 4 TVs no problem but the fastest internet I could get with CenturyLink at my house was 60mbps.",t2_sia40,Laser313,0,1579063739.0,0,t1_fefsc8c,fefsc8c,False,HeyFuckFace4,t3_eoww6y,https://www.reddit.com/r/Maricopa/comments/eoww6y/debating_on_moving_to_maricopa/,Debating on moving to Maricopa,/r/Maricopa/comments/eoww6y/debating_on_moving_to_maricopa/fefsc8c/,3,r/Maricopa,0,3
But aren’t solar panels like 20k?,t2_1eamc7qi,HeyFuckFace4,0,1579063680.0,0,t1_fefs9m8,fefs9m8,False,HeyFuckFace4,t3_eoww6y,https://www.reddit.com/r/Maricopa/comments/eoww6y/debating_on_moving_to_maricopa/,Debating on moving to Maricopa,/r/Maricopa/comments/eoww6y/debating_on_moving_to_maricopa/fefs9m8/,2,r/Maricopa,0,2
"And is Centurylink the same down there also? I recently just had a baby with my wife and she’s not working so knowing her, she would really enjoy her Netflix without being shit. Lol",t2_1eamc7qi,HeyFuckFace4,0,1579063539.0,0,t1_fefs37m,fefs37m,False,HeyFuckFace4,t3_eoww6y,https://www.reddit.com/r/Maricopa/comments/eoww6y/debating_on_moving_to_maricopa/,Debating on moving to Maricopa,/r/Maricopa/comments/eoww6y/debating_on_moving_to_maricopa/fefs37m/,2,r/Maricopa,0,2
"Orbitel is the cable company down here. A very slummy, gives every excuse on the planet why their internet goes out during the summer months all the time due to the heat and their systems not being able to function just like every other cable company out there. They're a mess but they do offer cable TV and cable internet. They have the copper locked out here for a while from what I've heard. Cox won't be here for a long time.",t2_sia40,Laser313,0,1579063145.0,0,t1_fefrl4b,fefrl4b,False,HeyFuckFace4,t3_eoww6y,https://www.reddit.com/r/Maricopa/comments/eoww6y/debating_on_moving_to_maricopa/,Debating on moving to Maricopa,/r/Maricopa/comments/eoww6y/debating_on_moving_to_maricopa/fefrl4b/,3,r/Maricopa,0,3
What’s Orbital exactly? I’ve never heard of it.,t2_1eamc7qi,HeyFuckFace4,0,1579062960.0,0,t1_fefrchk,fefrchk,False,HeyFuckFace4,t3_eoww6y,https://www.reddit.com/r/Maricopa/comments/eoww6y/debating_on_moving_to_maricopa/,Debating on moving to Maricopa,/r/Maricopa/comments/eoww6y/debating_on_moving_to_maricopa/fefrchk/,2,r/Maricopa,0,2
I hate the 347!!,t2_1l7hu8k,PokUrOwnFace,0,1579062265.0,0,t1_fefqfmr,fefqfmr,False,HeyFuckFace4,t3_eoww6y,https://www.reddit.com/r/Maricopa/comments/eoww6y/debating_on_moving_to_maricopa/,Debating on moving to Maricopa,/r/Maricopa/comments/eoww6y/debating_on_moving_to_maricopa/fefqfmr/,3,r/Maricopa,0,3
"We have a two story house, approximately 3,700sq ft. We have leased solar panels from Tesla (Solar City). In the summer we pay about $300. The thermostat is around 76. Before solar panels we paid about $600. We also have a pool, and that sucker eats up electricity. In the winter we pay $35, plus $145 for the panels for a total of $180. I make the wife and kids wear sweaters. The electric company is called ED3 (Electrical District 3).

Hope that helps a bit.",t2_1l7hu8k,PokUrOwnFace,0,1579062069.0,0,t1_fefq6cm,fefq6cm,True,HeyFuckFace4,t3_eoww6y,https://www.reddit.com/r/Maricopa/comments/eoww6y/debating_on_moving_to_maricopa/,Debating on moving to Maricopa,/r/Maricopa/comments/eoww6y/debating_on_moving_to_maricopa/fefq6cm/,3,r/Maricopa,0,3
"So this is true. Somewhat. So I have an 1800sq ft house. 4bd 2ba. I keep my AC at 76 during the summer, pretty much all year round. As soon as it's heater weather we like it around 70. I have a wife and 2 kids who don't know how to turn anything off and I've never seen a $500 electric bill. Now, damn close at $470 but I was turning it down to 75 and having friends say my house was cold as hell during the summer. ED3 is the company (Electrical District No. 3). It's bullshit, but it is what it is to get cheaper, nicer housing. The drive sucks into and from town, I work in tempe and it's about 40 minutes in the morning and 40-60 mins home. We moved 2 and a half years ago down here and we haven't had any intentions of moving back to the city. Love it down here. Feel free to DM me if you have more questions. I'd be glad to answer. P.S. the internet out here sucks, just be prepared for that. CenturyLink or orbitel. That's it. Both suck, but hey it's internet. I can stream Netflix and shit so it's good enough. I was spoiled by Cox gigablast before I moved so I am roughing it.",t2_sia40,Laser313,0,1579061844.0,0,t1_fefpvip,fefpvip,True,HeyFuckFace4,t3_eoww6y,https://www.reddit.com/r/Maricopa/comments/eoww6y/debating_on_moving_to_maricopa/,Debating on moving to Maricopa,/r/Maricopa/comments/eoww6y/debating_on_moving_to_maricopa/fefpvip/,7,r/Maricopa,0,7
"Thanks for posting, that was great to see all the things that were not here 15 years ago.",t2_4fmqr,CrossmenX,0,1577747194.0,0,t1_fclgf8p,fclgf8p,True,msearthmuffin,t3_ehplqx,https://www.reddit.com/r/Maricopa/comments/ehplqx/watch_the_city_of_maricopa_on_youtube/,"Watch ""The City of Maricopa"" on YouTube",/r/Maricopa/comments/ehplqx/watch_the_city_of_maricopa_on_youtube/fclgf8p/,5,r/Maricopa,0,5
OK thx,t2_44trljum,dyslexicdoodlebob123,0,1577134769.0,0,t1_fbvqvxc,fbvqvxc,False,dyslexicdoodlebob123,t3_eenw6t,https://www.reddit.com/r/Maricopa/comments/eenw6t/dnd_players_in_maricopa_im_looking_for_a_dnd/,Dnd players in maricopa I'm looking for a dnd party to start my first dnd story,/r/Maricopa/comments/eenw6t/dnd_players_in_maricopa_im_looking_for_a_dnd/fbvqvxc/,2,r/Maricopa,0,2
"The public Library hosts regular D&D adventure league sessions.   They're on a break right now for the Holidays, but should be picking back up in the new year.",t2_4fmqr,CrossmenX,0,1577133750.0,0,t1_fbvofnl,fbvofnl,True,dyslexicdoodlebob123,t3_eenw6t,https://www.reddit.com/r/Maricopa/comments/eenw6t/dnd_players_in_maricopa_im_looking_for_a_dnd/,Dnd players in maricopa I'm looking for a dnd party to start my first dnd story,/r/Maricopa/comments/eenw6t/dnd_players_in_maricopa_im_looking_for_a_dnd/fbvofnl/,1,r/Maricopa,0,1
I'll let you know what happens and weekends work fine.,t2_374ln8hf,Winter-King,0,1577128178.0,0,t1_fbvaz24,fbvaz24,False,dyslexicdoodlebob123,t3_eenw6t,https://www.reddit.com/r/Maricopa/comments/eenw6t/dnd_players_in_maricopa_im_looking_for_a_dnd/,Dnd players in maricopa I'm looking for a dnd party to start my first dnd story,/r/Maricopa/comments/eenw6t/dnd_players_in_maricopa_im_looking_for_a_dnd/fbvaz24/,1,r/Maricopa,0,1
Thx I'll see what I can do,t2_44trljum,dyslexicdoodlebob123,0,1577127855.0,0,t1_fbva5xu,fbva5xu,False,dyslexicdoodlebob123,t3_eenw6t,https://www.reddit.com/r/Maricopa/comments/eenw6t/dnd_players_in_maricopa_im_looking_for_a_dnd/,Dnd players in maricopa I'm looking for a dnd party to start my first dnd story,/r/Maricopa/comments/eenw6t/dnd_players_in_maricopa_im_looking_for_a_dnd/fbva5xu/,1,r/Maricopa,0,1
Yep that’s the one,t2_dtnpa,joshuakmcclain,0,1577127720.0,0,t1_fbv9uln,fbv9uln,False,dyslexicdoodlebob123,t3_eenw6t,https://www.reddit.com/r/Maricopa/comments/eenw6t/dnd_players_in_maricopa_im_looking_for_a_dnd/,Dnd players in maricopa I'm looking for a dnd party to start my first dnd story,/r/Maricopa/comments/eenw6t/dnd_players_in_maricopa_im_looking_for_a_dnd/fbv9uln/,1,r/Maricopa,0,1
Is it Mr. E comics the new one that opened recently,t2_44trljum,dyslexicdoodlebob123,0,1577127493.0,0,t1_fbv99wl,fbv99wl,False,dyslexicdoodlebob123,t3_eenw6t,https://www.reddit.com/r/Maricopa/comments/eenw6t/dnd_players_in_maricopa_im_looking_for_a_dnd/,Dnd players in maricopa I'm looking for a dnd party to start my first dnd story,/r/Maricopa/comments/eenw6t/dnd_players_in_maricopa_im_looking_for_a_dnd/fbv99wl/,1,r/Maricopa,0,1
Yes but I can do weekends only,t2_44trljum,dyslexicdoodlebob123,0,1577127289.0,0,t1_fbv8s3k,fbv8s3k,False,dyslexicdoodlebob123,t3_eenw6t,https://www.reddit.com/r/Maricopa/comments/eenw6t/dnd_players_in_maricopa_im_looking_for_a_dnd/,Dnd players in maricopa I'm looking for a dnd party to start my first dnd story,/r/Maricopa/comments/eenw6t/dnd_players_in_maricopa_im_looking_for_a_dnd/fbv8s3k/,1,r/Maricopa,0,1
"I'm planning to look for a regular group soon. I to desire to be a player. At least when it comes to D&D. I also want to play a number of different systems. If I chance upon something, would you be interested still? Making no promises.",t2_374ln8hf,Winter-King,0,1577127201.0,0,t1_fbv8kkp,fbv8kkp,False,dyslexicdoodlebob123,t3_eenw6t,https://www.reddit.com/r/Maricopa/comments/eenw6t/dnd_players_in_maricopa_im_looking_for_a_dnd/,Dnd players in maricopa I'm looking for a dnd party to start my first dnd story,/r/Maricopa/comments/eenw6t/dnd_players_in_maricopa_im_looking_for_a_dnd/fbv8kkp/,1,r/Maricopa,0,1
Thanks but I can't do wensday i get home at 4 from school and have to go to bed at 8 because I get up at 4,t2_44trljum,dyslexicdoodlebob123,0,1577127199.0,0,t1_fbv8kc5,fbv8kc5,False,dyslexicdoodlebob123,t3_eenw6t,https://www.reddit.com/r/Maricopa/comments/eenw6t/dnd_players_in_maricopa_im_looking_for_a_dnd/,Dnd players in maricopa I'm looking for a dnd party to start my first dnd story,/r/Maricopa/comments/eenw6t/dnd_players_in_maricopa_im_looking_for_a_dnd/fbv8kc5/,1,r/Maricopa,0,1
Player,t2_44trljum,dyslexicdoodlebob123,0,1577126939.0,0,t1_fbv7w16,fbv7w16,False,dyslexicdoodlebob123,t3_eenw6t,https://www.reddit.com/r/Maricopa/comments/eenw6t/dnd_players_in_maricopa_im_looking_for_a_dnd/,Dnd players in maricopa I'm looking for a dnd party to start my first dnd story,/r/Maricopa/comments/eenw6t/dnd_players_in_maricopa_im_looking_for_a_dnd/fbv7w16/,1,r/Maricopa,0,1
Are you looking to GM or player?,t2_374ln8hf,Winter-King,0,1577126824.0,0,t1_fbv7mjn,fbv7mjn,True,dyslexicdoodlebob123,t3_eenw6t,https://www.reddit.com/r/Maricopa/comments/eenw6t/dnd_players_in_maricopa_im_looking_for_a_dnd/,Dnd players in maricopa I'm looking for a dnd party to start my first dnd story,/r/Maricopa/comments/eenw6t/dnd_players_in_maricopa_im_looking_for_a_dnd/fbv7mjn/,1,r/Maricopa,0,1
Wednesday nights at the comic book store in town they run a kids only D&D campaign. Most of the Bunch are 11-14. Could be a great place to find like minded kids wanting to do a separate campaign.,t2_dtnpa,joshuakmcclain,0,1577126774.0,0,t1_fbv7ilv,fbv7ilv,True,dyslexicdoodlebob123,t3_eenw6t,https://www.reddit.com/r/Maricopa/comments/eenw6t/dnd_players_in_maricopa_im_looking_for_a_dnd/,Dnd players in maricopa I'm looking for a dnd party to start my first dnd story,/r/Maricopa/comments/eenw6t/dnd_players_in_maricopa_im_looking_for_a_dnd/fbv7ilv/,2,r/Maricopa,0,2
Beautiful,t2_c6dhh,PettyNiwa,0,1576592690.0,0,t1_fb7kj7l,fb7kj7l,True,CrossmenX,t3_ebi5v2,https://www.reddit.com/r/Maricopa/comments/ebi5v2/5760_x_1080_oc_sunset_in_maricopa_az/,"[5760 x 1080] OC - Sunset in Maricopa, AZ",/r/Maricopa/comments/ebi5v2/5760_x_1080_oc_sunset_in_maricopa_az/fb7kj7l/,1,r/Maricopa,0,1
Taken on Friday from the top of the Harrah's parking garage.,t2_4fmqr,CrossmenX,0,1576517399.0,0,t1_fb4xw97,fb4xw97,True,CrossmenX,t3_ebi5v2,https://www.reddit.com/r/Maricopa/comments/ebi5v2/5760_x_1080_oc_sunset_in_maricopa_az/,"[5760 x 1080] OC - Sunset in Maricopa, AZ",/r/Maricopa/comments/ebi5v2/5760_x_1080_oc_sunset_in_maricopa_az/fb4xw97/,5,r/Maricopa,0,5
👃👃,t2_ibqzika,dylantheblob,0,1573772180.0,0,t1_f7j7ni2,f7j7ni2,False,[deleted],t3_dw2pks,https://www.reddit.com/r/Maricopa/comments/dw2pks/outiside_mhs/,Outiside MHS,/r/Maricopa/comments/dw2pks/outiside_mhs/f7j7ni2/,0,r/Maricopa,0,0
Oooookay?,t2_c6dhh,PettyNiwa,0,1573769658.0,0,t1_f7j2rfe,f7j2rfe,True,[deleted],t3_dw2pks,https://www.reddit.com/r/Maricopa/comments/dw2pks/outiside_mhs/,Outiside MHS,/r/Maricopa/comments/dw2pks/outiside_mhs/f7j2rfe/,1,r/Maricopa,0,1
"I""m a single dad.  :)  Nice to mee you.",t2_3gn2bv4l,MaricopaSingles,0,1560389419.0,0,t1_eqyu3zy,eqyu3zy,False,MaricopaSingles,t3_b4boz4,https://www.reddit.com/r/Maricopa/comments/b4boz4/maricopa_singles/,Maricopa Singles,/r/Maricopa/comments/b4boz4/maricopa_singles/eqyu3zy/,1,r/Maricopa,0,1
