body,author_fullname,author.name,controversiality,created,downs,fullname,id,is_root,link_author,link_id,link_permalink,link_title,permalink,score,subreddit_name_prefixed,total_awards_received,ups
Shame really. Should have it’s’ own sub.,t2_jyvsd,TorrenceMightingale,0,1647693643.0,0,t1_i19vq5o,i19vq5o,False,limbermind,t3_l3gql0,https://www.reddit.com/r/Maricopa/comments/l3gql0/friendly_reminder_to_newcomers_this_sub_pertains/,"Friendly reminder to newcomers: This sub pertains to Maricopa, Arizona which lies within Pinal county. :-)",/r/Maricopa/comments/l3gql0/friendly_reminder_to_newcomers_this_sub_pertains/i19vq5o/,1,r/Maricopa,0,1
If she's being abused then just call the police 🧐,t2_2vlllibo,CobBerry,0,1647589103.0,0,t1_i14l617,i14l617,True,chileheadd,t3_pp5prk,https://www.reddit.com/r/Maricopa/comments/pp5prk/help_needed/,Help needed.,/r/Maricopa/comments/pp5prk/help_needed/i14l617/,1,r/Maricopa,0,1
"Hi, my wife and I would love to grab a drink with ya'll, I'm 37 she's 34. Let's hang out get to know each other 👍",t2_akb3t6h4,Brilliant_Menu6195,0,1646755225.0,0,t1_hzumh7h,hzumh7h,True,cakeless,t3_sdquf8,https://www.reddit.com/r/Maricopa/comments/sdquf8/looking_for_adult_friends/,Looking for adult friends.,/r/Maricopa/comments/sdquf8/looking_for_adult_friends/hzumh7h/,1,r/Maricopa,0,1
"Is that the miniature (1/2, 1/3 scale?) museum?",t2_ihjd1,singlejeff,0,1645239696.0,0,t1_hxj72ym,hxj72ym,False,zaki2004,t3_suddqd,https://www.reddit.com/r/Maricopa/comments/suddqd/bored/,Bored,/r/Maricopa/comments/suddqd/bored/hxj72ym/,1,r/Maricopa,0,1
There’s a classic car museum south of Maricopa you may want to check out.,t2_2n7tto44,Fernweh5717,0,1645094907.0,0,t1_hxakfmg,hxakfmg,True,zaki2004,t3_suddqd,https://www.reddit.com/r/Maricopa/comments/suddqd/bored/,Bored,/r/Maricopa/comments/suddqd/bored/hxakfmg/,1,r/Maricopa,0,1
No. no it's not at all.,t2_3z2srcet,zaki2004,0,1645064642.0,0,t1_hx9a1mz,hx9a1mz,False,Smoke_Me_When_i_Die,t3_p2re45,https://www.reddit.com/r/Maricopa/comments/p2re45/ram_country/,Ram Country,/r/Maricopa/comments/p2re45/ram_country/hx9a1mz/,1,r/Maricopa,0,1
"https://www.inmaricopa.com/arizona-favorite-to-join-maricopa-restaurant-lineup/

The news finally came out about it.",t2_dx7bz,AmateurEarthling,0,1644773256.0,0,t1_hwst49q,hwst49q,True,AmateurEarthling,t3_pw0h3u,https://www.reddit.com/r/Maricopa/comments/pw0h3u/bosa_donuts_in_2022/,Bosa Donuts in 2022,/r/Maricopa/comments/pw0h3u/bosa_donuts_in_2022/hwst49q/,1,r/Maricopa,0,1
My grandmother called me asking if I was okay or what happened 😂😂,t2_icvi9dte,No_Seaweed_6983,0,1644297563.0,0,t1_hw1on07,hw1on07,False,[deleted],t3_sn4zoi,https://www.reddit.com/r/Maricopa/comments/sn4zoi/whats_on_fire_south_of_maricopa/,What's on fire South of Maricopa?,/r/Maricopa/comments/sn4zoi/whats_on_fire_south_of_maricopa/hw1on07/,1,r/Maricopa,0,1
Me and my family noticed it too and we’re curious,t2_7rygrm95,Deousidous,0,1644278687.0,0,t1_hw0jc8f,hw0jc8f,True,[deleted],t3_sn4zoi,https://www.reddit.com/r/Maricopa/comments/sn4zoi/whats_on_fire_south_of_maricopa/,What's on fire South of Maricopa?,/r/Maricopa/comments/sn4zoi/whats_on_fire_south_of_maricopa/hw0jc8f/,2,r/Maricopa,0,2
Hey there hoping to move in the coming months! Husband and I would love some friends.,t2_5f1nv1ls,JustNoInternet,0,1643938164.0,0,t1_hvi3965,hvi3965,True,cakeless,t3_sdquf8,https://www.reddit.com/r/Maricopa/comments/sdquf8/looking_for_adult_friends/,Looking for adult friends.,/r/Maricopa/comments/sdquf8/looking_for_adult_friends/hvi3965/,1,r/Maricopa,0,1
Maricopa is the safest town in Arizona,t2_88jwwcmx,Significant-Knee-150,0,1643825520.0,0,t1_hvb1s3x,hvb1s3x,False,Smoke_Me_When_i_Die,t3_rwtmsj,https://www.reddit.com/r/Maricopa/comments/rwtmsj/what_brought_you_to_maricopa/,What brought you to Maricopa?,/r/Maricopa/comments/rwtmsj/what_brought_you_to_maricopa/hvb1s3x/,1,r/Maricopa,0,1
"Use /s after a phrase to show sarcasm, in case you aren’t aware",t2_4yd98via,asdf2739,0,1643434233.0,0,t1_huoprnl,huoprnl,False,Smoke_Me_When_i_Die,t3_pjd0e6,https://www.reddit.com/r/Maricopa/comments/pjd0e6/maricopa_when_the_water_park_jimmy_johns_and/,"Maricopa when the water park, Jimmy John's, and Filiberto's open",/r/Maricopa/comments/pjd0e6/maricopa_when_the_water_park_jimmy_johns_and/huoprnl/,2,r/Maricopa,0,2
It's hard to show sarcasm. Lol. I'll take cold beer and cheeseburgers over chillis anyday.,t2_7p7p7uio,im0nTH3bruteSquad,0,1643411755.0,0,t1_hundz6h,hundz6h,False,Smoke_Me_When_i_Die,t3_pjd0e6,https://www.reddit.com/r/Maricopa/comments/pjd0e6/maricopa_when_the_water_park_jimmy_johns_and/,"Maricopa when the water park, Jimmy John's, and Filiberto's open",/r/Maricopa/comments/pjd0e6/maricopa_when_the_water_park_jimmy_johns_and/hundz6h/,1,r/Maricopa,0,1
"Sometimes checking out websites of places too helps! I agree to finding places you love, I hope you do find something! I can - I’ll add you now!",t2_4kqvmwmt,kave1021,0,1643408652.0,0,t1_hun6f0p,hun6f0p,False,cakeless,t3_sdquf8,https://www.reddit.com/r/Maricopa/comments/sdquf8/looking_for_adult_friends/,Looking for adult friends.,/r/Maricopa/comments/sdquf8/looking_for_adult_friends/hun6f0p/,1,r/Maricopa,0,1
Oh nice! SoCal!  Yeah I have been looking online for jobs just to get an idea. I am not too worried. I just want us to find something we both love. Thanks for reaching out. Maybe you can add me on ig? If u have one?  I really want to make friends! And it’s so hard as an adult. My user name is alisrsym,t2_52lwa,cakeless,0,1643408538.0,0,t1_hun64su,hun64su,False,cakeless,t3_sdquf8,https://www.reddit.com/r/Maricopa/comments/sdquf8/looking_for_adult_friends/,Looking for adult friends.,/r/Maricopa/comments/sdquf8/looking_for_adult_friends/hun64su/,2,r/Maricopa,0,2
"Ah! That’s so cool, there’s so many animal shelters in AZ - you might find a good place here! I hope he’s able to find something, there’s lots of jobs out here right now. He’s from Pasadena!",t2_4kqvmwmt,kave1021,0,1643407522.0,0,t1_hun3lr7,hun3lr7,False,cakeless,t3_sdquf8,https://www.reddit.com/r/Maricopa/comments/sdquf8/looking_for_adult_friends/,Looking for adult friends.,/r/Maricopa/comments/sdquf8/looking_for_adult_friends/hun3lr7/,1,r/Maricopa,0,1
My husband works for usps as a mail man but will probably have to find a new job when we move. I currently work in finance at an animal shelter. We both love our jobs so much so it totally sucks to leave our jobs. Where was your husband from? And nice to meet u!,t2_52lwa,cakeless,0,1643406667.0,0,t1_hun1fgj,hun1fgj,False,cakeless,t3_sdquf8,https://www.reddit.com/r/Maricopa/comments/sdquf8/looking_for_adult_friends/,Looking for adult friends.,/r/Maricopa/comments/sdquf8/looking_for_adult_friends/hun1fgj/,1,r/Maricopa,0,1
"If it’s any consolation, Cold Beers and Cheeseburgers is coming soon if everything goes smoothly.",t2_4yd98via,asdf2739,0,1643391019.0,0,t1_hulw0us,hulw0us,False,Smoke_Me_When_i_Die,t3_pjd0e6,https://www.reddit.com/r/Maricopa/comments/pjd0e6/maricopa_when_the_water_park_jimmy_johns_and/,"Maricopa when the water park, Jimmy John's, and Filiberto's open",/r/Maricopa/comments/pjd0e6/maricopa_when_the_water_park_jimmy_johns_and/hulw0us/,2,r/Maricopa,0,2
My whole year is now ruined...,t2_7p7p7uio,im0nTH3bruteSquad,0,1643360293.0,0,t1_huk7ffs,huk7ffs,False,Smoke_Me_When_i_Die,t3_pjd0e6,https://www.reddit.com/r/Maricopa/comments/pjd0e6/maricopa_when_the_water_park_jimmy_johns_and/,"Maricopa when the water park, Jimmy John's, and Filiberto's open",/r/Maricopa/comments/pjd0e6/maricopa_when_the_water_park_jimmy_johns_and/huk7ffs/,1,r/Maricopa,0,1
Hi! Welcome! My husband and I (28-29) live in Maricopa. He’s from CA too! What do you both do for work?,t2_4kqvmwmt,kave1021,0,1643347796.0,0,t1_hujoidp,hujoidp,True,cakeless,t3_sdquf8,https://www.reddit.com/r/Maricopa/comments/sdquf8/looking_for_adult_friends/,Looking for adult friends.,/r/Maricopa/comments/sdquf8/looking_for_adult_friends/hujoidp/,2,r/Maricopa,0,2
"I work for the city, and so far nothing I’ve seen about a chilis :(",t2_4yd98via,asdf2739,0,1643341418.0,0,t1_hujbr8x,hujbr8x,False,Smoke_Me_When_i_Die,t3_pjd0e6,https://www.reddit.com/r/Maricopa/comments/pjd0e6/maricopa_when_the_water_park_jimmy_johns_and/,"Maricopa when the water park, Jimmy John's, and Filiberto's open",/r/Maricopa/comments/pjd0e6/maricopa_when_the_water_park_jimmy_johns_and/hujbr8x/,2,r/Maricopa,0,2
"Yep, I believe they will come into a new multi-tenant building in the Walmart area",t2_4yd98via,asdf2739,0,1643341267.0,0,t1_hujbf99,hujbf99,True,AmateurEarthling,t3_pw0h3u,https://www.reddit.com/r/Maricopa/comments/pw0h3u/bosa_donuts_in_2022/,Bosa Donuts in 2022,/r/Maricopa/comments/pw0h3u/bosa_donuts_in_2022/hujbf99/,2,r/Maricopa,0,2
"There’s a lot of new apartment developments coming in, I’ll tell you that.",t2_4yd98via,asdf2739,0,1643340924.0,0,t1_hujanv1,hujanv1,False,Smoke_Me_When_i_Die,t3_rwtmsj,https://www.reddit.com/r/Maricopa/comments/rwtmsj/what_brought_you_to_maricopa/,What brought you to Maricopa?,/r/Maricopa/comments/rwtmsj/what_brought_you_to_maricopa/hujanv1/,1,r/Maricopa,0,1
I can understand that. The people who are ruining the state are the ones who lived here long enough to snatch up the property while it was cheap and are now charging insane prices to buy or rent those properties. My generation can't afford to live here or survive keeping up with the joneses. Everyone wants to blame the social programs but the people who would benefit from those programs can't afford to stay here either.,t2_3dkc1ezr,murklore,0,1643323129.0,0,t1_hui4h7i,hui4h7i,False,cakeless,t3_sdquf8,https://www.reddit.com/r/Maricopa/comments/sdquf8/looking_for_adult_friends/,Looking for adult friends.,/r/Maricopa/comments/sdquf8/looking_for_adult_friends/hui4h7i/,2,r/Maricopa,0,2
This is super helpful. I keep hearing how bad the commute is out of Maricopa. My husband currently drives an hour in the morning to work and sometimes an hour and half on his commute home. We want to move to Arizona to avoid him doing all that lol. Thirty minutes is nothing for him.  I didn’t realize those other cities were within a reasonable commute time. He currently works for the usps but since transferring feels nearly impossible he will have to look for a new job. I am hoping to get remote work.,t2_52lwa,cakeless,0,1643295911.0,0,t1_hug2fbr,hug2fbr,False,cakeless,t3_sdquf8,https://www.reddit.com/r/Maricopa/comments/sdquf8/looking_for_adult_friends/,Looking for adult friends.,/r/Maricopa/comments/sdquf8/looking_for_adult_friends/hug2fbr/,1,r/Maricopa,0,1
Totally agree with this statement.,t2_52lwa,cakeless,0,1643295678.0,0,t1_hug1ujn,hug1ujn,False,cakeless,t3_sdquf8,https://www.reddit.com/r/Maricopa/comments/sdquf8/looking_for_adult_friends/,Looking for adult friends.,/r/Maricopa/comments/sdquf8/looking_for_adult_friends/hug1ujn/,3,r/Maricopa,0,3
People dont want other people moving from a failing state just to vote for the same crap where they move to. Chances are that is why you are finding hostility.,t2_1exe3sw0,kingdiamond42c,0,1643288615.0,0,t1_hufm8bt,hufm8bt,False,cakeless,t3_sdquf8,https://www.reddit.com/r/Maricopa/comments/sdquf8/looking_for_adult_friends/,Looking for adult friends.,/r/Maricopa/comments/sdquf8/looking_for_adult_friends/hufm8bt/,2,r/Maricopa,0,2
If you enjoy your new found freedoms and cheaper prices here in AZ and Maricopa be sure to vote accordingly. This will keep AZ from becoming CA. Thank you.,t2_1exe3sw0,kingdiamond42c,0,1643288352.0,0,t1_huflqj9,huflqj9,False,cakeless,t3_sdquf8,https://www.reddit.com/r/Maricopa/comments/sdquf8/looking_for_adult_friends/,Looking for adult friends.,/r/Maricopa/comments/sdquf8/looking_for_adult_friends/huflqj9/,4,r/Maricopa,0,4
"Thank you for saying this. As someone born and raised in CA but looking for a more affordable life in a place with better people, it is disheartening how hostile and unwelcoming people have been.",t2_3dkc1ezr,murklore,0,1643269336.0,0,t1_huevkk1,huevkk1,False,cakeless,t3_sdquf8,https://www.reddit.com/r/Maricopa/comments/sdquf8/looking_for_adult_friends/,Looking for adult friends.,/r/Maricopa/comments/sdquf8/looking_for_adult_friends/huevkk1/,0,r/Maricopa,0,0
"Yeah you’ll definitely get a small town vibe, but with housing prices you can actually afford. Not sure what you do, but if you work in Chandler, Ahwatukee, or Tempe, it wont be bad for you. Also South Gilbert would be an easy commute too.",t2_e3cofq6t,MrMortgageLoan,0,1643267160.0,0,t1_huesi37,huesi37,False,cakeless,t3_sdquf8,https://www.reddit.com/r/Maricopa/comments/sdquf8/looking_for_adult_friends/,Looking for adult friends.,/r/Maricopa/comments/sdquf8/looking_for_adult_friends/huesi37/,2,r/Maricopa,0,2
"Yeah so my bother moved to Arizona about three years ago. His gf went to college in az and decided to stay. We live in Silicon Valley but we aren’t in tech and we are so poor here it hurts lol.  Despite having decent jobs and college education.  So, we wanna move out of state and chose Arizona to be near my brother. He is in chandler but unfortunately even chandler is getting expensive.  I stumbled upon Maricopa and it looks like a sweet small town which I totally love. I do worry about the job market and the traffic if having to commute but I don’t think anything would be as bad as Bay Area traffic. So yes, Maricopa because it’s affordable but also because it seems safe and I like a smaller town vibe.",t2_52lwa,cakeless,0,1643265190.0,0,t1_huephmy,huephmy,False,cakeless,t3_sdquf8,https://www.reddit.com/r/Maricopa/comments/sdquf8/looking_for_adult_friends/,Looking for adult friends.,/r/Maricopa/comments/sdquf8/looking_for_adult_friends/huephmy/,0,r/Maricopa,0,0
Ha! Most people coming from California don’t. That’s why they come here. Nothing wrong with that! Maricopa is a great community! Is affordability a reason for coming here or is it something else?,t2_e3cofq6t,MrMortgageLoan,0,1643264176.0,0,t1_huenvsf,huenvsf,False,cakeless,t3_sdquf8,https://www.reddit.com/r/Maricopa/comments/sdquf8/looking_for_adult_friends/,Looking for adult friends.,/r/Maricopa/comments/sdquf8/looking_for_adult_friends/huenvsf/,1,r/Maricopa,0,1
"We are moving from California. Don’t hate us, lol. We are not rich and do not have California money.",t2_52lwa,cakeless,0,1643264057.0,0,t1_huenork,huenork,False,cakeless,t3_sdquf8,https://www.reddit.com/r/Maricopa/comments/sdquf8/looking_for_adult_friends/,Looking for adult friends.,/r/Maricopa/comments/sdquf8/looking_for_adult_friends/huenork/,2,r/Maricopa,0,2
I live in the East Valley and so does my GF. Where are you moving from?,t2_e3cofq6t,MrMortgageLoan,0,1643263142.0,0,t1_huem5oi,huem5oi,True,cakeless,t3_sdquf8,https://www.reddit.com/r/Maricopa/comments/sdquf8/looking_for_adult_friends/,Looking for adult friends.,/r/Maricopa/comments/sdquf8/looking_for_adult_friends/huem5oi/,1,r/Maricopa,0,1
That's what I figured. I have Orbitel 200/20. After 3pm and weekends I get a lot of latency issues. Centurylink only offers 100/10 in my area and charges more. It's terrible compared to having fiber 900/40 for years...,t2_1lqn92wu,Dissolved14,0,1642884821.0,0,t1_htsfv1u,htsfv1u,False,AdMurky6693,t3_s3cdqd,https://www.reddit.com/r/Maricopa/comments/s3cdqd/internet/,Internet,/r/Maricopa/comments/s3cdqd/internet/htsfv1u/,2,r/Maricopa,0,2
I finally got centurylink and from what I can tell no you can have 2 without getting a second network line put in. Each house has one network cable to the house and each company uses different converter boxes for the same line. One to DSL/Ethernet and the the other coaxial(cable). I have a centurylink box while my neighbor has Orbitol so I got to look at both converters.,t2_2cqmui7t,OptionalMoron,0,1642884400.0,0,t1_htsetna,htsetna,False,AdMurky6693,t3_s3cdqd,https://www.reddit.com/r/Maricopa/comments/s3cdqd/internet/,Internet,/r/Maricopa/comments/s3cdqd/internet/htsetna/,2,r/Maricopa,0,2
I've been wondering myself. Possibly getting 2 separate orbitel lines. Did you ever find out?,t2_1lqn92wu,Dissolved14,0,1642883007.0,0,t1_htsbf2j,htsbf2j,False,AdMurky6693,t3_s3cdqd,https://www.reddit.com/r/Maricopa/comments/s3cdqd/internet/,Internet,/r/Maricopa/comments/s3cdqd/internet/htsbf2j/,2,r/Maricopa,0,2
"I couldn’t tell you, century link says im too far in the boonies",t2_bdt09co9,AdMurky6693,0,1642176089.0,0,t1_hsn4zgd,hsn4zgd,False,AdMurky6693,t3_s3cdqd,https://www.reddit.com/r/Maricopa/comments/s3cdqd/internet/,Internet,/r/Maricopa/comments/s3cdqd/internet/hsn4zgd/,2,r/Maricopa,0,2
To piggyback on this question can I have both CenturyLink and Orbitel at the same time? Or do they use the same line with a different converter? I recently moved to Maricopa and CenturyLink has been hard to contact due to poor cell reception in the burbs so I wanted to see if Orbitel can pull through on this.,t2_2cqmui7t,OptionalMoron,0,1642174459.0,0,t1_hsn0tki,hsn0tki,True,AdMurky6693,t3_s3cdqd,https://www.reddit.com/r/Maricopa/comments/s3cdqd/internet/,Internet,/r/Maricopa/comments/s3cdqd/internet/hsn0tki/,2,r/Maricopa,0,2
I'm in rural Maricopa and I use Airebeam. Warning- they are fairly backed up on setting up new clients.,t2_401u7tth,Omgerd1234,0,1642120420.0,0,t1_hsk9okp,hsk9okp,True,AdMurky6693,t3_s3cdqd,https://www.reddit.com/r/Maricopa/comments/s3cdqd/internet/,Internet,/r/Maricopa/comments/s3cdqd/internet/hsk9okp/,3,r/Maricopa,0,3
"[https://www.orbitelcom.com/](https://www.orbitelcom.com/)

[https://www.centurylink.com/](https://www.centurylink.com/)

[https://www.cox.com/](https://www.cox.com/)

Those are the main 3 you could get depending on where you are in maricopa. T-mobile might be another, and possibly Starlink if you sign up and wait.",t2_1lqn92wu,Dissolved14,0,1642115908.0,0,t1_hsjyobf,hsjyobf,True,AdMurky6693,t3_s3cdqd,https://www.reddit.com/r/Maricopa/comments/s3cdqd/internet/,Internet,/r/Maricopa/comments/s3cdqd/internet/hsjyobf/,1,r/Maricopa,0,1
It smells like shit 24/7,t2_ekcveplo,Silent-Analyst3474,0,1641956370.0,0,t1_hsase4i,hsase4i,True,Dumb_but_nice,t3_s1lw7q,https://www.reddit.com/r/Maricopa/comments/s1lw7q/anything_someone_from_california_moving_to/,Anything someone from California moving to Maricopa county(possibly Buckeye or Avondale)should know/be prepared for beforehand? Very possibly moving there this summer.,/r/Maricopa/comments/s1lw7q/anything_someone_from_california_moving_to/hsase4i/,-2,r/Maricopa,0,-2
The issue isn't a matter of getting along. The issue is all the influx of people from California that's raising property taxes. Mine just shot up more than 200. Luckily I refinanced in time. That and I personally don't see eye to eye with most Californians,t2_8ptz9fth,Shadow1304,0,1641950627.0,0,t1_hsaf0xi,hsaf0xi,False,Dumb_but_nice,t3_s1lw7q,https://www.reddit.com/r/Maricopa/comments/s1lw7q/anything_someone_from_california_moving_to/,Anything someone from California moving to Maricopa county(possibly Buckeye or Avondale)should know/be prepared for beforehand? Very possibly moving there this summer.,/r/Maricopa/comments/s1lw7q/anything_someone_from_california_moving_to/hsaf0xi/,-2,r/Maricopa,0,-2
Yes plz stay in California.  Arizonans dont get along with people from another state. That includes Texas.,t2_8vnwvthi,Jays4life602,0,1641943558.0,0,t1_hs9yfde,hs9yfde,False,Dumb_but_nice,t3_s1lw7q,https://www.reddit.com/r/Maricopa/comments/s1lw7q/anything_someone_from_california_moving_to/,Anything someone from California moving to Maricopa county(possibly Buckeye or Avondale)should know/be prepared for beforehand? Very possibly moving there this summer.,/r/Maricopa/comments/s1lw7q/anything_someone_from_california_moving_to/hs9yfde/,-6,r/Maricopa,0,-6
"Funny enough the city of Maricopa is actually in Pinal County, you will be in western Maricopa county.  (we are still pretty much a Phx suburb tho)",t2_iukn0,McLurkleton,0,1641942431.0,0,t1_hs9vo82,hs9vo82,True,Dumb_but_nice,t3_s1lw7q,https://www.reddit.com/r/Maricopa/comments/s1lw7q/anything_someone_from_california_moving_to/,Anything someone from California moving to Maricopa county(possibly Buckeye or Avondale)should know/be prepared for beforehand? Very possibly moving there this summer.,/r/Maricopa/comments/s1lw7q/anything_someone_from_california_moving_to/hs9vo82/,5,r/Maricopa,0,5
Finally. Thanks man. Appreciate the input.,t2_e0yoman6,Dumb_but_nice,0,1641937163.0,0,t1_hs9hve1,hs9hve1,False,Dumb_but_nice,t3_s1lw7q,https://www.reddit.com/r/Maricopa/comments/s1lw7q/anything_someone_from_california_moving_to/,Anything someone from California moving to Maricopa county(possibly Buckeye or Avondale)should know/be prepared for beforehand? Very possibly moving there this summer.,/r/Maricopa/comments/s1lw7q/anything_someone_from_california_moving_to/hs9hve1/,2,r/Maricopa,0,2
"I mostly came to Maricopa for the quiet. But if housing had been more affordable I would have probably stayed in Chandler or Gilbert. I work from home, but occasionally travel for work, so I need to be close enough to an airport to do that. The housing price and the neighborhood are what brought me here in 2019. It was nice in Gilbert to have so many conveniences nearby, but I think the trade off is worth it.",t2_85l6p,mailman-zero,0,1641936361.0,0,t1_hs9fnmc,hs9fnmc,True,Smoke_Me_When_i_Die,t3_rwtmsj,https://www.reddit.com/r/Maricopa/comments/rwtmsj/what_brought_you_to_maricopa/,What brought you to Maricopa?,/r/Maricopa/comments/rwtmsj/what_brought_you_to_maricopa/hs9fnmc/,1,r/Maricopa,0,1
"Summer is hot.  Fall starts in January, ends in February.  If you are going to be working in Phoenix. Plan on moving getting closer to the city.  Stay out of Maryvale.  Go to the circle Ks during the daytime only.  QT pizza isnt bad.  Travel the 18 only if your life depends on it.  Don't be a dumbass and go hiking in the afternoon in the summertime.   Always carry a bottle of water.  Get someone else to do your yardwork.  Don't judge traffic based on a Friday.",t2_cq8exui4,WalrusIll1043,0,1641935838.0,0,t1_hs9e83h,hs9e83h,True,Dumb_but_nice,t3_s1lw7q,https://www.reddit.com/r/Maricopa/comments/s1lw7q/anything_someone_from_california_moving_to/,Anything someone from California moving to Maricopa county(possibly Buckeye or Avondale)should know/be prepared for beforehand? Very possibly moving there this summer.,/r/Maricopa/comments/s1lw7q/anything_someone_from_california_moving_to/hs9e83h/,3,r/Maricopa,0,3
Thank you!,t2_e0yoman6,Dumb_but_nice,0,1641934640.0,0,t1_hs9awfg,hs9awfg,False,Dumb_but_nice,t3_s1lw7q,https://www.reddit.com/r/Maricopa/comments/s1lw7q/anything_someone_from_california_moving_to/,Anything someone from California moving to Maricopa county(possibly Buckeye or Avondale)should know/be prepared for beforehand? Very possibly moving there this summer.,/r/Maricopa/comments/s1lw7q/anything_someone_from_california_moving_to/hs9awfg/,1,r/Maricopa,0,1
"Gee man, thanks for the solid input. Keep on keepin on.",t2_e0yoman6,Dumb_but_nice,0,1641934606.0,0,t1_hs9at27,hs9at27,False,Dumb_but_nice,t3_s1lw7q,https://www.reddit.com/r/Maricopa/comments/s1lw7q/anything_someone_from_california_moving_to/,Anything someone from California moving to Maricopa county(possibly Buckeye or Avondale)should know/be prepared for beforehand? Very possibly moving there this summer.,/r/Maricopa/comments/s1lw7q/anything_someone_from_california_moving_to/hs9at27/,6,r/Maricopa,0,6
Or just stay out of our state,t2_8ptz9fth,Shadow1304,0,1641932915.0,0,t1_hs9669e,hs9669e,True,Dumb_but_nice,t3_s1lw7q,https://www.reddit.com/r/Maricopa/comments/s1lw7q/anything_someone_from_california_moving_to/,Anything someone from California moving to Maricopa county(possibly Buckeye or Avondale)should know/be prepared for beforehand? Very possibly moving there this summer.,/r/Maricopa/comments/s1lw7q/anything_someone_from_california_moving_to/hs9669e/,-10,r/Maricopa,0,-10
Go to the Phoenix subreddit,t2_iahnxz0x,kindanicelady,0,1641932078.0,0,t1_hs93wii,hs93wii,True,Dumb_but_nice,t3_s1lw7q,https://www.reddit.com/r/Maricopa/comments/s1lw7q/anything_someone_from_california_moving_to/,Anything someone from California moving to Maricopa county(possibly Buckeye or Avondale)should know/be prepared for beforehand? Very possibly moving there this summer.,/r/Maricopa/comments/s1lw7q/anything_someone_from_california_moving_to/hs93wii/,5,r/Maricopa,0,5
Same.,t2_73oe1nhm,StevenKrinchar,0,1641456109.0,0,t1_hrgsoy4,hrgsoy4,False,Smoke_Me_When_i_Die,t3_rwtmsj,https://www.reddit.com/r/Maricopa/comments/rwtmsj/what_brought_you_to_maricopa/,What brought you to Maricopa?,/r/Maricopa/comments/rwtmsj/what_brought_you_to_maricopa/hrgsoy4/,2,r/Maricopa,0,2
bought a house to have more space. moved from a 1300sq foot condo that was sold from my old landlady to a new California investor and he raised the rent 55%. I stayed for 2 months during my house hunting and landed an amazing 2800sq foot house in rancho. I love it here.,t2_7cdyh,radraze2kx,0,1641449707.0,0,t1_hrgj25l,hrgj25l,True,Smoke_Me_When_i_Die,t3_rwtmsj,https://www.reddit.com/r/Maricopa/comments/rwtmsj/what_brought_you_to_maricopa/,What brought you to Maricopa?,/r/Maricopa/comments/rwtmsj/what_brought_you_to_maricopa/hrgj25l/,2,r/Maricopa,0,2
