body,author_fullname,author.name,controversiality,created,downs,fullname,id,is_root,link_author,link_id,link_permalink,link_title,permalink,score,subreddit_name_prefixed,total_awards_received,ups
"Yeah I usually get drive through, so I don't know about the inside machine. But I don't think I have ever had a bad DP from there. Maybe once when the syrup was running low.",t2_y9b0h,Cat_Marshal,0,1616906463.0,0,t1_gsjvd7y,gsjvd7y,False,Cat_Marshal,t3_mer7dp,https://www.reddit.com/r/Maricopa/comments/mer7dp/taco_bell_stopped_selling_dr_pepper/,Taco Bell stopped selling Dr. Pepper,/r/Maricopa/comments/mer7dp/taco_bell_stopped_selling_dr_pepper/gsjvd7y/,1,r/Maricopa,0,1
"I ride! I have a Honda Africa Twin. What do you ride?

If you're on Facebook, there is a group. 

[https://www.facebook.com/groups/maricopamotorcycle](https://www.facebook.com/groups/maricopamotorcycle)",t2_67w433wx,testsubject1137,0,1616906437.0,0,t1_gsjvbtm,gsjvbtm,True,AmateurEarthling,t3_m8z5lt,https://www.reddit.com/r/Maricopa/comments/m8z5lt/anyone_here_ride_motorcycles/,Anyone here ride motorcycles?,/r/Maricopa/comments/m8z5lt/anyone_here_ride_motorcycles/gsjvbtm/,1,r/Maricopa,0,1
"Yeah she gets it. I plan on asking them every time I go, see if I can bug them enough to bring it back.",t2_y9b0h,Cat_Marshal,0,1616906417.0,0,t1_gsjvapv,gsjvapv,False,Cat_Marshal,t3_mer7dp,https://www.reddit.com/r/Maricopa/comments/mer7dp/taco_bell_stopped_selling_dr_pepper/,Taco Bell stopped selling Dr. Pepper,/r/Maricopa/comments/mer7dp/taco_bell_stopped_selling_dr_pepper/gsjvapv/,2,r/Maricopa,0,2
"Really? I feel like every time I get a drink there, the water makes it taste like shit. The worst place to get a drink in my opinion. Maybe the machine in the lobby just never gets cleaned or something.",t2_67w433wx,testsubject1137,0,1616906270.0,0,t1_gsjv2kv,gsjv2kv,True,Cat_Marshal,t3_mer7dp,https://www.reddit.com/r/Maricopa/comments/mer7dp/taco_bell_stopped_selling_dr_pepper/,Taco Bell stopped selling Dr. Pepper,/r/Maricopa/comments/mer7dp/taco_bell_stopped_selling_dr_pepper/gsjv2kv/,1,r/Maricopa,0,1
I think they just made it with a higher concentration of syrup. My wife would sometimes go to Taco Bell just to get Dr. Pepper. She is not happy with this development.,t2_85l6p,mailman-zero,0,1616900086.0,0,t1_gsjkae0,gsjkae0,True,Cat_Marshal,t3_mer7dp,https://www.reddit.com/r/Maricopa/comments/mer7dp/taco_bell_stopped_selling_dr_pepper/,Taco Bell stopped selling Dr. Pepper,/r/Maricopa/comments/mer7dp/taco_bell_stopped_selling_dr_pepper/gsjkae0/,1,r/Maricopa,0,1
You could always ask them where they got it from or how they made it ig :v,t2_bwho7,WolfBV,0,1616899776.0,0,t1_gsjjqd8,gsjjqd8,True,Cat_Marshal,t3_mer7dp,https://www.reddit.com/r/Maricopa/comments/mer7dp/taco_bell_stopped_selling_dr_pepper/,Taco Bell stopped selling Dr. Pepper,/r/Maricopa/comments/mer7dp/taco_bell_stopped_selling_dr_pepper/gsjjqd8/,1,r/Maricopa,0,1
"18 is pretty old for a sophomore, did you get held back?",t2_y9b0h,Cat_Marshal,0,1616893931.0,0,t1_gsj7w4h,gsj7w4h,True,[deleted],t3_mazqmm,https://www.reddit.com/r/Maricopa/comments/mazqmm/anyone_go_to_mhs/,Anyone go to mhs?,/r/Maricopa/comments/mazqmm/anyone_go_to_mhs/gsj7w4h/,1,r/Maricopa,0,1
☝,t2_a9ncratb,Western-Evening-8113,0,1616631653.0,0,t1_gs456au,gs456au,True,weeb_not_weaboo,t3_ma80je,https://www.reddit.com/r/Maricopa/comments/ma80je/who_here_lives_in_homestead/,Who here lives in Homestead?,/r/Maricopa/comments/ma80je/who_here_lives_in_homestead/gs456au/,1,r/Maricopa,0,1
"I asked because my old friend is the teacher haha feels weird. 

Was wondering if you could check out the science/biology section of the library. There's this big, thick book on evolution that I want to reread but can't remember the name.",t2_jamoc,Smoke_Me_When_i_Die,0,1616519023.0,0,t1_gry5st9,gry5st9,False,[deleted],t3_mazqmm,https://www.reddit.com/r/Maricopa/comments/mazqmm/anyone_go_to_mhs/,Anyone go to mhs?,/r/Maricopa/comments/mazqmm/anyone_go_to_mhs/gry5st9/,1,r/Maricopa,0,1
Sure and no I’m not taking photography,t2_4nxbog6i,no-ahhhhhhhhhh,0,1616518734.0,0,t1_gry54q5,gry54q5,False,[deleted],t3_mazqmm,https://www.reddit.com/r/Maricopa/comments/mazqmm/anyone_go_to_mhs/,Anyone go to mhs?,/r/Maricopa/comments/mazqmm/anyone_go_to_mhs/gry54q5/,1,r/Maricopa,0,1
I used to. You taking photography by any chance? Oh and can I ask you a favor?,t2_jamoc,Smoke_Me_When_i_Die,0,1616518643.0,0,t1_gry4x1l,gry4x1l,True,[deleted],t3_mazqmm,https://www.reddit.com/r/Maricopa/comments/mazqmm/anyone_go_to_mhs/,Anyone go to mhs?,/r/Maricopa/comments/mazqmm/anyone_go_to_mhs/gry4x1l/,1,r/Maricopa,0,1
18 and looking for HS girls??? Sounds like Maricopa for sureeee.,t2_4waea05f,Wildcat-Jim,0,1616475509.0,0,t1_grwamza,grwamza,True,[deleted],t3_mazqmm,https://www.reddit.com/r/Maricopa/comments/mazqmm/anyone_go_to_mhs/,Anyone go to mhs?,/r/Maricopa/comments/mazqmm/anyone_go_to_mhs/grwamza/,-2,r/Maricopa,0,-2
Noice,t2_4nxbog6i,no-ahhhhhhhhhh,0,1616474808.0,0,t1_grw9oeo,grw9oeo,False,[deleted],t3_mazqmm,https://www.reddit.com/r/Maricopa/comments/mazqmm/anyone_go_to_mhs/,Anyone go to mhs?,/r/Maricopa/comments/mazqmm/anyone_go_to_mhs/grw9oeo/,1,r/Maricopa,0,1
M,t2_836n3nuk,rtity,0,1616474777.0,0,t1_grw9mv3,grw9mv3,True,[deleted],t3_mazqmm,https://www.reddit.com/r/Maricopa/comments/mazqmm/anyone_go_to_mhs/,Anyone go to mhs?,/r/Maricopa/comments/mazqmm/anyone_go_to_mhs/grw9mv3/,1,r/Maricopa,0,1
M or f lol,t2_4nxbog6i,no-ahhhhhhhhhh,0,1616474697.0,0,t1_grw9iyi,grw9iyi,False,[deleted],t3_mazqmm,https://www.reddit.com/r/Maricopa/comments/mazqmm/anyone_go_to_mhs/,Anyone go to mhs?,/r/Maricopa/comments/mazqmm/anyone_go_to_mhs/grw9iyi/,1,r/Maricopa,0,1
9th,t2_836n3nuk,rtity,0,1616474648.0,0,t1_grw9gj8,grw9gj8,True,[deleted],t3_mazqmm,https://www.reddit.com/r/Maricopa/comments/mazqmm/anyone_go_to_mhs/,Anyone go to mhs?,/r/Maricopa/comments/mazqmm/anyone_go_to_mhs/grw9gj8/,1,r/Maricopa,0,1
Nice lol what grade ?,t2_4nxbog6i,no-ahhhhhhhhhh,0,1616474630.0,0,t1_grw9fo3,grw9fo3,False,[deleted],t3_mazqmm,https://www.reddit.com/r/Maricopa/comments/mazqmm/anyone_go_to_mhs/,Anyone go to mhs?,/r/Maricopa/comments/mazqmm/anyone_go_to_mhs/grw9fo3/,1,r/Maricopa,0,1
Me,t2_836n3nuk,rtity,0,1616474549.0,0,t1_grw9bk0,grw9bk0,True,[deleted],t3_mazqmm,https://www.reddit.com/r/Maricopa/comments/mazqmm/anyone_go_to_mhs/,Anyone go to mhs?,/r/Maricopa/comments/mazqmm/anyone_go_to_mhs/grw9bk0/,1,r/Maricopa,0,1
"Hi OP.  This happens once in a while, but this sub pertains to Maricopa, Arizona, a city within Pinal County.  Not a big deal and I hope you get what you're after.",t2_4sag7,limbermind,0,1616447670.0,0,t1_gruuk7d,gruuk7d,True,Aggravating_Use_3192,t3_m9lhxs,https://www.reddit.com/r/Maricopa/comments/m9lhxs/hi_all_anyone_here_want_to_lend_advice_on/,Hi All! Anyone here want to lend advice on residential permitting of sea / shipping containers?,/r/Maricopa/comments/m9lhxs/hi_all_anyone_here_want_to_lend_advice_on/gruuk7d/,1,r/Maricopa,0,1
Indeed it is.,t2_4sag7,limbermind,0,1616447611.0,0,t1_gruufr0,gruufr0,False,Aggravating_Use_3192,t3_m9lhxs,https://www.reddit.com/r/Maricopa/comments/m9lhxs/hi_all_anyone_here_want_to_lend_advice_on/,Hi All! Anyone here want to lend advice on residential permitting of sea / shipping containers?,/r/Maricopa/comments/m9lhxs/hi_all_anyone_here_want_to_lend_advice_on/gruufr0/,1,r/Maricopa,0,1
"I thought this was Maricopa city sub, not county",t2_r66nn4b,Sombersai,0,1616380845.0,0,t1_grrrqnm,grrrqnm,True,Aggravating_Use_3192,t3_m9lhxs,https://www.reddit.com/r/Maricopa/comments/m9lhxs/hi_all_anyone_here_want_to_lend_advice_on/,Hi All! Anyone here want to lend advice on residential permitting of sea / shipping containers?,/r/Maricopa/comments/m9lhxs/hi_all_anyone_here_want_to_lend_advice_on/grrrqnm/,2,r/Maricopa,0,2
Me.  North.,t2_ieu4s,bobvex,0,1616366711.0,0,t1_grr07cy,grr07cy,True,weeb_not_weaboo,t3_ma80je,https://www.reddit.com/r/Maricopa/comments/ma80je/who_here_lives_in_homestead/,Who here lives in Homestead?,/r/Maricopa/comments/ma80je/who_here_lives_in_homestead/grr07cy/,3,r/Maricopa,0,3
me. mostly quads tho,t2_9p70tlra,weeb_not_weaboo,0,1616366046.0,0,t1_grqyvif,grqyvif,True,AmateurEarthling,t3_m8z5lt,https://www.reddit.com/r/Maricopa/comments/m8z5lt/anyone_here_ride_motorcycles/,Anyone here ride motorcycles?,/r/Maricopa/comments/m8z5lt/anyone_here_ride_motorcycles/grqyvif/,1,r/Maricopa,0,1
Our HOA would probably have an issue with that since it is taller than the fence. It would need to match the aesthetics of the house to get approved.,t2_y9b0h,Cat_Marshal,0,1616344357.0,0,t1_grpquiq,grpquiq,True,Aggravating_Use_3192,t3_m9lhxs,https://www.reddit.com/r/Maricopa/comments/m9lhxs/hi_all_anyone_here_want_to_lend_advice_on/,Hi All! Anyone here want to lend advice on residential permitting of sea / shipping containers?,/r/Maricopa/comments/m9lhxs/hi_all_anyone_here_want_to_lend_advice_on/grpquiq/,2,r/Maricopa,0,2
Absolutely. Especially since I don't think any of it benefits the tribe directly.,t2_m19sk,YesterEve,0,1616206994.0,0,t1_grjupoj,grjupoj,False,YesterEve,t3_m8lgub,https://www.reddit.com/r/Maricopa/comments/m8lgub/riggs347_overpass_alternative/,Riggs/347 Overpass Alternative,/r/Maricopa/comments/m8lgub/riggs347_overpass_alternative/grjupoj/,1,r/Maricopa,0,1
"An issue is land usage.  Asking the tribe to dedicate more land for a third lane in each direction is almost impossible, let alone a whole new road.",t2_4fmqr,CrossmenX,0,1616204208.0,0,t1_grjputm,grjputm,True,YesterEve,t3_m8lgub,https://www.reddit.com/r/Maricopa/comments/m8lgub/riggs347_overpass_alternative/,Riggs/347 Overpass Alternative,/r/Maricopa/comments/m8lgub/riggs347_overpass_alternative/grjputm/,3,r/Maricopa,0,3
"I agree.  

There is no doubt in my mind the backup will now be that first light into town, which was pretty bad already.

It's kind of like the over pass for the train....instead of occasionally getting stopped by a train, I now get stopped at 2 stop lights, every time, without fail, both ways.

I might have to start going to these city planning meetings.

&#x200B;

Don't even get me started with the Vice Mayor and her crap about marijuana dispensaries and all her fears about ODOR.....Maricopa Monitor....heavy reading!",t2_76nsw4gx,drwho_who,0,1616172983.0,0,t1_grhyeeq,grhyeeq,True,YesterEve,t3_m8lgub,https://www.reddit.com/r/Maricopa/comments/m8lgub/riggs347_overpass_alternative/,Riggs/347 Overpass Alternative,/r/Maricopa/comments/m8lgub/riggs347_overpass_alternative/grhyeeq/,2,r/Maricopa,0,2
"I love it! I go to Mesa daily though, but I really enjoy the drive. I don't really go many places and just kick back inside my house playing VR, games, working out or watching TV. Feel free to PM me!",t2_7cdyh,radraze2kx,0,1615992975.0,0,t1_gr8qz4j,gr8qz4j,False,radraze2kx,t3_jjaedb,https://www.reddit.com/r/Maricopa/comments/jjaedb/say_hello_to_your_newest_redditor_neighbor/,Say hello to your newest Redditor neighbor!,/r/Maricopa/comments/jjaedb/say_hello_to_your_newest_redditor_neighbor/gr8qz4j/,1,r/Maricopa,0,1
Some of the best things in life haha. How do you like the city and neighborhood so far? I realized I’m in the villages of Rancho so just right across the street haha.,t2_dx7bz,AmateurEarthling,0,1615990448.0,0,t1_gr8lrzw,gr8lrzw,False,radraze2kx,t3_jjaedb,https://www.reddit.com/r/Maricopa/comments/jjaedb/say_hello_to_your_newest_redditor_neighbor/,Say hello to your newest Redditor neighbor!,/r/Maricopa/comments/jjaedb/say_hello_to_your_newest_redditor_neighbor/gr8lrzw/,1,r/Maricopa,0,1
"Just stalked your reddit profile, I see we both like tower defense and gardening. Eyyyy :)",t2_7cdyh,radraze2kx,0,1615951710.0,0,t1_gr78e19,gr78e19,False,radraze2kx,t3_jjaedb,https://www.reddit.com/r/Maricopa/comments/jjaedb/say_hello_to_your_newest_redditor_neighbor/,Say hello to your newest Redditor neighbor!,/r/Maricopa/comments/jjaedb/say_hello_to_your_newest_redditor_neighbor/gr78e19/,2,r/Maricopa,0,2
I moved into Rancho :),t2_7cdyh,radraze2kx,0,1615951546.0,0,t1_gr7849h,gr7849h,False,radraze2kx,t3_jjaedb,https://www.reddit.com/r/Maricopa/comments/jjaedb/say_hello_to_your_newest_redditor_neighbor/,Say hello to your newest Redditor neighbor!,/r/Maricopa/comments/jjaedb/say_hello_to_your_newest_redditor_neighbor/gr7849h/,1,r/Maricopa,0,1
Which sub neighborhood are you in? I’m In Vista,t2_dx7bz,AmateurEarthling,0,1615937863.0,0,t1_gr6it4v,gr6it4v,False,radraze2kx,t3_jjaedb,https://www.reddit.com/r/Maricopa/comments/jjaedb/say_hello_to_your_newest_redditor_neighbor/,Say hello to your newest Redditor neighbor!,/r/Maricopa/comments/jjaedb/say_hello_to_your_newest_redditor_neighbor/gr6it4v/,1,r/Maricopa,0,1
Howdy neighbor!,t2_7cdyh,radraze2kx,0,1615849915.0,0,t1_gr2d0vw,gr2d0vw,False,radraze2kx,t3_jjaedb,https://www.reddit.com/r/Maricopa/comments/jjaedb/say_hello_to_your_newest_redditor_neighbor/,Say hello to your newest Redditor neighbor!,/r/Maricopa/comments/jjaedb/say_hello_to_your_newest_redditor_neighbor/gr2d0vw/,2,r/Maricopa,0,2
I just got mine yesterday! tagged along with a buddy and was able to get the only extra of the day. Arm hurts and body tired but so happy I got it.,t2_hv5i4,angelkatomuah,0,1615832934.0,0,t1_gr1g84i,gr1g84i,True,drwho_who,t3_m5km0y,https://www.reddit.com/r/Maricopa/comments/m5km0y/getting_your_coronavirus_vaccine/,Getting your Corona-Virus Vaccine?,/r/Maricopa/comments/m5km0y/getting_your_coronavirus_vaccine/gr1g84i/,3,r/Maricopa,0,3
Had my first shot last week.  Second shot in early April.  No ill effects thus far.  Registered via Walgreens website.,t2_4sag7,limbermind,0,1615831168.0,0,t1_gr1cb0g,gr1cb0g,True,drwho_who,t3_m5km0y,https://www.reddit.com/r/Maricopa/comments/m5km0y/getting_your_coronavirus_vaccine/,Getting your Corona-Virus Vaccine?,/r/Maricopa/comments/m5km0y/getting_your_coronavirus_vaccine/gr1cb0g/,2,r/Maricopa,0,2
"Eventually. I'm somewhat young, work from home and have already had covid so I'm basically last on the list of those who will be able to get it, which is fine by me. I'll probably get it at some point.",t2_4s3cbwx7,Abrookspug,0,1615829563.0,0,t1_gr18n1k,gr18n1k,True,drwho_who,t3_m5km0y,https://www.reddit.com/r/Maricopa/comments/m5km0y/getting_your_coronavirus_vaccine/,Getting your Corona-Virus Vaccine?,/r/Maricopa/comments/m5km0y/getting_your_coronavirus_vaccine/gr18n1k/,2,r/Maricopa,0,2
Hey got my house 6 months ago in the same neighborhood,t2_dx7bz,AmateurEarthling,0,1615824915.0,0,t1_gr0y45o,gr0y45o,True,radraze2kx,t3_jjaedb,https://www.reddit.com/r/Maricopa/comments/jjaedb/say_hello_to_your_newest_redditor_neighbor/,Say hello to your newest Redditor neighbor!,/r/Maricopa/comments/jjaedb/say_hello_to_your_newest_redditor_neighbor/gr0y45o/,2,r/Maricopa,0,2
Can idk be an option,t2_r66nn4b,Sombersai,0,1615824052.0,0,t1_gr0w6eq,gr0w6eq,True,drwho_who,t3_m5km0y,https://www.reddit.com/r/Maricopa/comments/m5km0y/getting_your_coronavirus_vaccine/,Getting your Corona-Virus Vaccine?,/r/Maricopa/comments/m5km0y/getting_your_coronavirus_vaccine/gr0w6eq/,2,r/Maricopa,0,2
"Oh Jesus, sounds like a pain",t2_r66nn4b,Sombersai,0,1615477440.0,0,t1_gqkzwt5,gqkzwt5,False,Sombersai,t3_m25xse,https://www.reddit.com/r/Maricopa/comments/m25xse/wtf_is_up_with_meadows/,Wtf is up with Meadows?,/r/Maricopa/comments/m25xse/wtf_is_up_with_meadows/gqkzwt5/,1,r/Maricopa,0,1
"5 new members were voted in, but  According to the hoa management company there were not enough votes to make it a legal count. So the 5 people that were already in seats that did not win stayed in power. The new people that were voted in did not move into office",t2_8vwv8ydm,soapydope9,0,1615458924.0,0,t1_gqk4m6e,gqk4m6e,True,Sombersai,t3_m25xse,https://www.reddit.com/r/Maricopa/comments/m25xse/wtf_is_up_with_meadows/,Wtf is up with Meadows?,/r/Maricopa/comments/m25xse/wtf_is_up_with_meadows/gqk4m6e/,2,r/Maricopa,0,2
"I think there is a group of members who feel the board is wasting money and keeping our rates higher than necessary. I don’t know if it is accurate or not, they sent out the budget a month or two ago and everything seemed fine. People don’t realize how much grass there is in our HOA, it costs money to keep it nice. 

That being said, we are paying a fraction of what some HOAs in Chandler pay and it is not clear if that is all due to the grass or what.",t2_y9b0h,Cat_Marshal,0,1615417969.0,0,t1_gqi8llp,gqi8llp,True,Sombersai,t3_m25xse,https://www.reddit.com/r/Maricopa/comments/m25xse/wtf_is_up_with_meadows/,Wtf is up with Meadows?,/r/Maricopa/comments/m25xse/wtf_is_up_with_meadows/gqi8llp/,3,r/Maricopa,0,3
Lived there for years. Interested to hear what's going on.,t2_pnb2dpo,dizzlemcshizzle,0,1615407366.0,0,t1_gqhl1kj,gqhl1kj,True,Sombersai,t3_m25xse,https://www.reddit.com/r/Maricopa/comments/m25xse/wtf_is_up_with_meadows/,Wtf is up with Meadows?,/r/Maricopa/comments/m25xse/wtf_is_up_with_meadows/gqhl1kj/,2,r/Maricopa,0,2
This!,t2_r66nn4b,Sombersai,0,1615403647.0,0,t1_gqhc9uc,gqhc9uc,False,halsey74,t3_m1lhyo,https://www.reddit.com/r/Maricopa/comments/m1lhyo/property_taxes_17_in_rancho_mirage/,Property taxes 1.7% in Rancho Mirage?,/r/Maricopa/comments/m1lhyo/property_taxes_17_in_rancho_mirage/gqhc9uc/,2,r/Maricopa,0,2
"lol, I'm crying over here.",t2_4sag7,limbermind,0,1615401377.0,0,t1_gqh6pnu,gqh6pnu,False,Gregory0550,t3_m1qg25,https://www.reddit.com/r/Maricopa/comments/m1qg25/warning_to_residents/,Warning to residents,/r/Maricopa/comments/m1qg25/warning_to_residents/gqh6pnu/,4,r/Maricopa,0,4
"**amazing, this is.** 

*-Teddy_Bear_Junction*

***



^(Commands: 'opt out', 'delete')",t2_a8ixlqv0,IamYodaBot,0,1615374115.0,0,t1_gqfmo5p,gqfmo5p,False,Gregory0550,t3_m1qg25,https://www.reddit.com/r/Maricopa/comments/m1qg25/warning_to_residents/,Warning to residents,/r/Maricopa/comments/m1qg25/warning_to_residents/gqfmo5p/,0,r/Maricopa,0,0
This is amazing,t2_17b56y,Teddy_Bear_Junction,0,1615374089.0,0,t1_gqfmn3c,gqfmn3c,True,Gregory0550,t3_m1qg25,https://www.reddit.com/r/Maricopa/comments/m1qg25/warning_to_residents/,Warning to residents,/r/Maricopa/comments/m1qg25/warning_to_residents/gqfmn3c/,2,r/Maricopa,0,2
Does she just catch them off guard or something?,t2_y9b0h,Cat_Marshal,0,1615364312.0,0,t1_gqfchl6,gqfchl6,True,Gregory0550,t3_m1qg25,https://www.reddit.com/r/Maricopa/comments/m1qg25/warning_to_residents/,Warning to residents,/r/Maricopa/comments/m1qg25/warning_to_residents/gqfchl6/,5,r/Maricopa,0,5
"Here is a random tax record for this year from a home in Rancho Mirage. This should help you make sense of things. 

https://treasurer.pinalcountyaz.gov/ParcelInquiry/Reporting/TaxBill?parcelNumber=5025521500&taxYear=2020",t2_85l6p,mailman-zero,0,1615346718.0,0,t1_gqeoz8f,gqeoz8f,True,halsey74,t3_m1lhyo,https://www.reddit.com/r/Maricopa/comments/m1lhyo/property_taxes_17_in_rancho_mirage/,Property taxes 1.7% in Rancho Mirage?,/r/Maricopa/comments/m1lhyo/property_taxes_17_in_rancho_mirage/gqeoz8f/,3,r/Maricopa,0,3
"My home that I purchased for $375,000 is currently worth about $425,000 according to Zillow. I was billed  $2,500 plus $700 as secondary taxes for 2020. Assessed value is $157,000. Now here is where it gets weird. The “ratio” is 10%. So all the taxes are calculated off of $15,700. And of that my total taxes assessed are just a hair more than 16% plus about 4% for other taxes.",t2_85l6p,mailman-zero,0,1615346259.0,0,t1_gqeo6cr,gqeo6cr,True,halsey74,t3_m1lhyo,https://www.reddit.com/r/Maricopa/comments/m1lhyo/property_taxes_17_in_rancho_mirage/,Property taxes 1.7% in Rancho Mirage?,/r/Maricopa/comments/m1lhyo/property_taxes_17_in_rancho_mirage/gqeo6cr/,3,r/Maricopa,0,3
Your assessed value is not your market value.,t2_85l6p,mailman-zero,0,1615344699.0,0,t1_gqelei1,gqelei1,True,halsey74,t3_m1lhyo,https://www.reddit.com/r/Maricopa/comments/m1lhyo/property_taxes_17_in_rancho_mirage/,Property taxes 1.7% in Rancho Mirage?,/r/Maricopa/comments/m1lhyo/property_taxes_17_in_rancho_mirage/gqelei1/,4,r/Maricopa,0,4
">half of them live in Tukee or Chandler anyway.

I feel that

https://i.imgur.com/9J0oiGD.png",t2_jamoc,Smoke_Me_When_i_Die,0,1615094585.0,0,t1_gq2jbgq,gq2jbgq,False,Calicrimdeflawyer,t3_ls72r7,https://www.reddit.com/r/Maricopa/comments/ls72r7/any_regrets/,Any regrets?,/r/Maricopa/comments/ls72r7/any_regrets/gq2jbgq/,3,r/Maricopa,0,3
"Can't say I'm disappointed honestly, from my perspective this town has been getting better and better. I moved out here in 02 and we didn't have Walmart, Bashas', Goodwill, nothing. Just 3 gas stations and a small supermarket.",t2_jamoc,Smoke_Me_When_i_Die,0,1615094337.0,0,t1_gq2ixpz,gq2ixpz,True,Calicrimdeflawyer,t3_ls72r7,https://www.reddit.com/r/Maricopa/comments/ls72r7/any_regrets/,Any regrets?,/r/Maricopa/comments/ls72r7/any_regrets/gq2ixpz/,5,r/Maricopa,0,5
I hope you found your beautiful black dog 😕,t2_112wul,Calicrimdeflawyer,0,1614944016.0,0,t1_gprh48q,gprh48q,False,Calicrimdeflawyer,t3_ls72r7,https://www.reddit.com/r/Maricopa/comments/ls72r7/any_regrets/,Any regrets?,/r/Maricopa/comments/ls72r7/any_regrets/gprh48q/,1,r/Maricopa,0,1
"I moved here and couldn’t find work and to keep my family from starving made the decision to work in phx 25 days a month for almost two years I did that 25 days straight come back home and sleep for 3-5 days . Finally decided I want to go home no matter what I had to do I was going to do it so I could be with the family . Came home and it didn’t take long to find out my wife had become the town whore . Upon a closer look of all my belongings and I’m missing like 50,000 dollars worth of tools ! Wtf ....! Come to find out she was and still is fucking one of the home builders in maricopa and they like dressing up like babies in diapers and spanking each other or some weird shit . Apparently his name is posted on quite a few new home signs out here in the new track homes . But wait it gets better , my wife was in a accident a few years back where she was electrocuted with a sting enough current it should have killed her . So mentally she is not right and never will be . It’s messed up because it’s like she is stuck at the age of 9 years old and does not ever mentally mature beyond that  and this sick old fucking man straight took advantage of her . So ya I regret ever coming here .",t2_7hhagrhq,Gregory0550,0,1614923356.0,0,t1_gpqteh5,gpqteh5,True,Calicrimdeflawyer,t3_ls72r7,https://www.reddit.com/r/Maricopa/comments/ls72r7/any_regrets/,Any regrets?,/r/Maricopa/comments/ls72r7/any_regrets/gpqteh5/,2,r/Maricopa,1,2
They just completed the audit. It found no vote switching or hacking.,t2_6y7soh5g,FlamingoConsistent72,0,1614362828.0,0,t1_gouyl8n,gouyl8n,True,dark_prophet,t3_kfvwic,https://www.reddit.com/r/Maricopa/comments/kfvwic/maricopa_county_supervisors_refused_to_provide/,"Maricopa county supervisors refused to provide voting machines for forensic audit, they are a bunch of crooks",/r/Maricopa/comments/kfvwic/maricopa_county_supervisors_refused_to_provide/gouyl8n/,1,r/Maricopa,0,1
"Bob doesn't give a damn if a marijuana shop opens again in Maricopa.

That's all I need to know!  Where some other christian ladies running for office were absolutely horrified by the idea.",t2_76nsw4gx,drwho_who,0,1614338572.0,0,t1_gotgw5t,gotgw5t,False,Calicrimdeflawyer,t3_ls72r7,https://www.reddit.com/r/Maricopa/comments/ls72r7/any_regrets/,Any regrets?,/r/Maricopa/comments/ls72r7/any_regrets/gotgw5t/,4,r/Maricopa,0,4
"Bob had the greatest campaign of all time, I loved everything about his posters on the side of the road. I know nothing about his politics though.",t2_y9b0h,Cat_Marshal,0,1614303557.0,0,t1_gos3pnv,gos3pnv,False,Calicrimdeflawyer,t3_ls72r7,https://www.reddit.com/r/Maricopa/comments/ls72r7/any_regrets/,Any regrets?,/r/Maricopa/comments/ls72r7/any_regrets/gos3pnv/,6,r/Maricopa,0,6
"As a teenager, there’s nothing to do here. All I have in Maricopa is a couple of parks and a movie theatre that I can’t go to anymore because of COVID. Lived here all my life as an only child, and it’s only gotten more boring as I’ve grown older. I regret asking my parents to stay in Maricopa so I could keep my friends because half of them live in Tukee or Chandler anyway.",t2_4kjeb5q5,GabeGabeBruh,0,1614301109.0,0,t1_goryu4o,goryu4o,True,Calicrimdeflawyer,t3_ls72r7,https://www.reddit.com/r/Maricopa/comments/ls72r7/any_regrets/,Any regrets?,/r/Maricopa/comments/ls72r7/any_regrets/goryu4o/,4,r/Maricopa,0,4
"This isn't a small town. And the cost of living isn't low any more. It's overcrowded, and the infrastructure isn't keeping up with the growth (internet, cell towers, etc.). Can't go anywhere on a Saturday morning without a long line. One road in and out. No local jobs that pay well. 

While I don't regret it, the things that brought me here don't exist anymore.",t2_40fpmi4e,ithp,0,1614295818.0,0,t1_goro3ys,goro3ys,True,Calicrimdeflawyer,t3_ls72r7,https://www.reddit.com/r/Maricopa/comments/ls72r7/any_regrets/,Any regrets?,/r/Maricopa/comments/ls72r7/any_regrets/goro3ys/,13,r/Maricopa,0,13
"right wing racists tend to group up around here, if you are one, you will love it!  trump and confederate flags aplenty.  I think the leader of AZs KKK is here as well. 

Like cow killing and torture? Again, Maricopa is great!! Flies aplenty!!

lower cost of living? not so sure about that unless you are looking at a double wide out in the maricopa boonies

the drive back to the city. the proliferation of fast food crap. not great things, unless you like that.

but maricopa is rising, we are getting a Trader Joes! and Bob got elected to the City Council beating out some right wing religious nut cases.

Overall, no regrets, I am far removed from most people now, so that's been great and I can see the milky way if I look South West!",t2_76nsw4gx,drwho_who,0,1614262234.0,0,t1_gopfnoq,gopfnoq,True,Calicrimdeflawyer,t3_ls72r7,https://www.reddit.com/r/Maricopa/comments/ls72r7/any_regrets/,Any regrets?,/r/Maricopa/comments/ls72r7/any_regrets/gopfnoq/,8,r/Maricopa,0,8
