body,author_fullname,author.name,controversiality,created,downs,fullname,id,is_root,link_author,link_id,link_permalink,link_title,permalink,score,subreddit_name_prefixed,total_awards_received,ups
"Great, more unhealthy crap to choose from.",t2_c3hiyrwk,DapperDowner,0,1628108107.0,0,t1_h7px3wq,h7px3wq,True,testsubject1137,t3_obwii4,https://www.reddit.com/r/Maricopa/comments/obwii4/cold_beers_cheeseburgers_is_coming_to_maricopa/,Cold Beers & Cheeseburgers is coming to Maricopa!,/r/Maricopa/comments/obwii4/cold_beers_cheeseburgers_is_coming_to_maricopa/h7px3wq/,0,r/Maricopa,0,0
Stop eating cows. Less cow to torture.,t2_c3hiyrwk,DapperDowner,0,1628108077.0,0,t1_h7px1az,h7px1az,True,[deleted],t3_or1qd2,https://www.reddit.com/r/Maricopa/comments/or1qd2/the_cow_smell_is_ridiculous/,The cow smell is ridiculous,/r/Maricopa/comments/or1qd2/the_cow_smell_is_ridiculous/h7px1az/,1,r/Maricopa,0,1
"Ordered and waiting.

Try 'Airebeam' as an alternative, it's what I use.",t2_c3hiyrwk,DapperDowner,0,1628108024.0,0,t1_h7pwwqp,h7pwwqp,True,jpc273,t3_or44mx,https://www.reddit.com/r/Maricopa/comments/or44mx/anyone_in_copa_have_starlink/,Anyone in Copa have Starlink?,/r/Maricopa/comments/or44mx/anyone_in_copa_have_starlink/h7pwwqp/,1,r/Maricopa,0,1
Stop eating meat.  Less torture farms = less smell.,t2_c3hiyrwk,DapperDowner,0,1628107958.0,0,t1_h7pwr51,h7pwr51,True,[deleted],t3_orl9u5,https://www.reddit.com/r/Maricopa/comments/orl9u5/deleted_by_user/,[deleted by user],/r/Maricopa/comments/orl9u5/deleted_by_user/h7pwr51/,1,r/Maricopa,0,1
"Stop drinking milk, it will kill you. And stop eating cow meat, that will kill you too.

That would mean dairy farms could close, which are just horrible torture parks anyway.

Otherwise, enjoy your smell as many cows are kept in the sun with no shade at all during thes summer months.

Milky Way Farms...FUCK YOU!",t2_c3hiyrwk,DapperDowner,0,1628107915.0,0,t1_h7pwnge,h7pwnge,True,[deleted],t3_orla5g,https://www.reddit.com/r/Maricopa/comments/orla5g/deleted_by_user/,[deleted by user],/r/Maricopa/comments/orla5g/deleted_by_user/h7pwnge/,1,r/Maricopa,0,1
"I know I've met other trans folk in town but it's been a while and i don't have any way of contacting them, so now it's just a question of whether the Maricopian trans folk on both on Reddit and apart of this sub lol",t2_6gm3u320,Cowboy_Lesbian,0,1627945590.0,0,t1_h7hj7ex,h7hj7ex,False,Cowboy_Lesbian,t3_owlpqb,https://www.reddit.com/r/Maricopa/comments/owlpqb/hey_yall_any_other_trans_folk_here/,"Hey y'all, any other trans folk here?",/r/Maricopa/comments/owlpqb/hey_yall_any_other_trans_folk_here/h7hj7ex/,4,r/Maricopa,0,4
"Welcome to the sub!

Off hand I'm not aware of any other trans folks, but they may simply not be making it know.  Statistically there must be others!",t2_4sag7,limbermind,0,1627939284.0,0,t1_h7h5f7a,h7h5f7a,True,Cowboy_Lesbian,t3_owlpqb,https://www.reddit.com/r/Maricopa/comments/owlpqb/hey_yall_any_other_trans_folk_here/,"Hey y'all, any other trans folk here?",/r/Maricopa/comments/owlpqb/hey_yall_any_other_trans_folk_here/h7h5f7a/,4,r/Maricopa,0,4
Heyo,t2_6gm3u320,Cowboy_Lesbian,0,1627931791.0,0,t1_h7god6x,h7god6x,True,nekovina,t3_o2ub4s,https://www.reddit.com/r/Maricopa/comments/o2ub4s/i_just_wanna_know_how_many_cool_people_live_near/,I just wanna know how many cool people live near me 😎,/r/Maricopa/comments/o2ub4s/i_just_wanna_know_how_many_cool_people_live_near/h7god6x/,1,r/Maricopa,0,1
"Lol this is true. I hope you enjoy Maricopa, we do. :)",t2_1j5jw03k,HeathV404,0,1627604090.0,0,t1_h70u9de,h70u9de,False,[deleted],t3_orl9u5,https://www.reddit.com/r/Maricopa/comments/orl9u5/deleted_by_user/,[deleted by user],/r/Maricopa/comments/orl9u5/deleted_by_user/h70u9de/,3,r/Maricopa,0,3
I built my home here. I knew what I was getting into. OP is 16 years old and is not benefitting from the housing boom. They didn’t sign up for this. 😄,t2_85l6p,mailman-zero,0,1627604037.0,0,t1_h70u5h0,h70u5h0,False,[deleted],t3_orl9u5,https://www.reddit.com/r/Maricopa/comments/orl9u5/deleted_by_user/,[deleted by user],/r/Maricopa/comments/orl9u5/deleted_by_user/h70u5h0/,3,r/Maricopa,0,3
Every once in a while it smells like a petting zoo but then again at 1 point so did Chandler and Gilbert.. My house is up 88% I really don't mind the smell as long as it's not constant.,t2_1j5jw03k,HeathV404,0,1627603920.0,0,t1_h70twq7,h70twq7,False,[deleted],t3_orl9u5,https://www.reddit.com/r/Maricopa/comments/orl9u5/deleted_by_user/,[deleted by user],/r/Maricopa/comments/orl9u5/deleted_by_user/h70twq7/,1,r/Maricopa,0,1
"Complaining, yes. But I wouldn’t call it absolutely nothing.",t2_85l6p,mailman-zero,0,1627603703.0,0,t1_h70tglk,h70tglk,False,[deleted],t3_orl9u5,https://www.reddit.com/r/Maricopa/comments/orl9u5/deleted_by_user/,[deleted by user],/r/Maricopa/comments/orl9u5/deleted_by_user/h70tglk/,1,r/Maricopa,0,1
Still complaining over absolutely nothing.,t2_1j5jw03k,HeathV404,0,1627603660.0,0,t1_h70tdie,h70tdie,False,[deleted],t3_orl9u5,https://www.reddit.com/r/Maricopa/comments/orl9u5/deleted_by_user/,[deleted by user],/r/Maricopa/comments/orl9u5/deleted_by_user/h70tdie/,1,r/Maricopa,0,1
Your wish is granted. You will not have any Internet access or electricity. Bust out the solar panels and the Starlink.,t2_85l6p,mailman-zero,0,1627603151.0,0,t1_h70sb9b,h70sb9b,False,[deleted],t3_or1qd2,https://www.reddit.com/r/Maricopa/comments/or1qd2/the_cow_smell_is_ridiculous/,The cow smell is ridiculous,/r/Maricopa/comments/or1qd2/the_cow_smell_is_ridiculous/h70sb9b/,0,r/Maricopa,0,0
The smell right after all that rain really was something different.,t2_85l6p,mailman-zero,0,1627603081.0,0,t1_h70s60i,h70s60i,True,[deleted],t3_orl9u5,https://www.reddit.com/r/Maricopa/comments/orl9u5/deleted_by_user/,[deleted by user],/r/Maricopa/comments/orl9u5/deleted_by_user/h70s60i/,1,r/Maricopa,0,1
OP is too young to be a Millennial. Something something Boomer.,t2_85l6p,mailman-zero,0,1627603052.0,0,t1_h70s3x3,h70s3x3,False,[deleted],t3_orl9u5,https://www.reddit.com/r/Maricopa/comments/orl9u5/deleted_by_user/,[deleted by user],/r/Maricopa/comments/orl9u5/deleted_by_user/h70s3x3/,2,r/Maricopa,0,2
"Exactly, entitled millennials know no bounds.",t2_1j5jw03k,HeathV404,0,1627333897.0,0,t1_h6mrr0o,h6mrr0o,False,[deleted],t3_orl9u5,https://www.reddit.com/r/Maricopa/comments/orl9u5/deleted_by_user/,[deleted by user],/r/Maricopa/comments/orl9u5/deleted_by_user/h6mrr0o/,1,r/Maricopa,0,1
That's the smell of money.,t2_1j5jw03k,HeathV404,0,1627333854.0,0,t1_h6mrno8,h6mrno8,True,[deleted],t3_orl9u5,https://www.reddit.com/r/Maricopa/comments/orl9u5/deleted_by_user/,[deleted by user],/r/Maricopa/comments/orl9u5/deleted_by_user/h6mrno8/,1,r/Maricopa,0,1
"You moved to an area that is next door to Pinal Feeding Co.  One of the largest cattle feeding facilities in the southwest with capacity for over 150,000 head of cattle.  

Even if they stopped using the 'organic' fertilizer generated from said cattle and spent more money for industrial fertilizer, you'd still have all that cow poop around.  And just an FYI, the industrial stuff doesn't smell that great either.",t2_4fmqr,CrossmenX,0,1627320056.0,0,t1_h6lw7k1,h6lw7k1,True,[deleted],t3_orla5g,https://www.reddit.com/r/Maricopa/comments/orla5g/deleted_by_user/,[deleted by user],/r/Maricopa/comments/orla5g/deleted_by_user/h6lw7k1/,3,r/Maricopa,0,3
"Who was there first, the farm or you?",t2_34ite,darthgarlic,0,1627315010.0,0,t1_h6lklo5,h6lklo5,True,[deleted],t3_orla5g,https://www.reddit.com/r/Maricopa/comments/orla5g/deleted_by_user/,[deleted by user],/r/Maricopa/comments/orla5g/deleted_by_user/h6lklo5/,3,r/Maricopa,0,3
Alot of that smell also comes from the dairy farm,t2_5ig75cow,IamTheViz,0,1627311359.0,0,t1_h6lcdec,h6lcdec,True,[deleted],t3_orla5g,https://www.reddit.com/r/Maricopa/comments/orla5g/deleted_by_user/,[deleted by user],/r/Maricopa/comments/orla5g/deleted_by_user/h6lcdec/,4,r/Maricopa,0,4
Count yourself lucky. Used to be WAY worse.,t2_1b1xut8u,i-am-10-ply,0,1627279438.0,0,t1_h6k3q8y,h6k3q8y,True,[deleted],t3_orl9u5,https://www.reddit.com/r/Maricopa/comments/orl9u5/deleted_by_user/,[deleted by user],/r/Maricopa/comments/orl9u5/deleted_by_user/h6k3q8y/,4,r/Maricopa,0,4
"I'd rather live next to 100,000 cows than 10,000 people.",t2_kmfra,Baldy3,0,1627275195.0,0,t1_h6jxy35,h6jxy35,True,[deleted],t3_or1qd2,https://www.reddit.com/r/Maricopa/comments/or1qd2/the_cow_smell_is_ridiculous/,The cow smell is ridiculous,/r/Maricopa/comments/or1qd2/the_cow_smell_is_ridiculous/h6jxy35/,1,r/Maricopa,0,1
My wife and I would be interested!,t2_826uu4kr,kravengemper,0,1627267222.0,0,t1_h6jku05,h6jku05,True,kave1021,t3_or6bsh,https://www.reddit.com/r/Maricopa/comments/or6bsh/dungeons_dragons/,Dungeons & Dragons,/r/Maricopa/comments/or6bsh/dungeons_dragons/h6jku05/,2,r/Maricopa,0,2
Edward fucking temple! Stop posting your bullshit here! This is not maricopa county. Mods need to start banning this guy and others.,t2_4waea05f,Wildcat-Jim,0,1627266391.0,0,t1_h6jjbza,h6jjbza,True,edwardtemple,t3_orpf0e,https://www.reddit.com/r/Maricopa/comments/orpf0e/will_a_marker_flip_the_election/,Will a marker flip the election?,/r/Maricopa/comments/orpf0e/will_a_marker_flip_the_election/h6jjbza/,6,r/Maricopa,0,6
Thank you 😭,t2_2vlllibo,CobBerry,0,1627258747.0,0,t1_h6j598z,h6j598z,False,[deleted],t3_orl9u5,https://www.reddit.com/r/Maricopa/comments/orl9u5/deleted_by_user/,[deleted by user],/r/Maricopa/comments/orl9u5/deleted_by_user/h6j598z/,-2,r/Maricopa,0,-2
Hang in there,t2_4waea05f,Wildcat-Jim,0,1627258727.0,0,t1_h6j57wv,h6j57wv,False,[deleted],t3_orl9u5,https://www.reddit.com/r/Maricopa/comments/orl9u5/deleted_by_user/,[deleted by user],/r/Maricopa/comments/orl9u5/deleted_by_user/h6j57wv/,-1,r/Maricopa,0,-1
You gonna take a fat sniff and say it doesn't affect you you nasty,t2_2vlllibo,CobBerry,0,1627257921.0,0,t1_h6j3qds,h6j3qds,False,[deleted],t3_orl9u5,https://www.reddit.com/r/Maricopa/comments/orl9u5/deleted_by_user/,[deleted by user],/r/Maricopa/comments/orl9u5/deleted_by_user/h6j3qds/,-1,r/Maricopa,0,-1
"16, can't move. Forced to suffer",t2_2vlllibo,CobBerry,0,1627257381.0,0,t1_h6j2q5y,h6j2q5y,False,[deleted],t3_orl9u5,https://www.reddit.com/r/Maricopa/comments/orl9u5/deleted_by_user/,[deleted by user],/r/Maricopa/comments/orl9u5/deleted_by_user/h6j2q5y/,-4,r/Maricopa,0,-4
In their case cow shit,t2_2vlllibo,CobBerry,0,1627257322.0,0,t1_h6j2m9h,h6j2m9h,False,[deleted],t3_orla5g,https://www.reddit.com/r/Maricopa/comments/orla5g/deleted_by_user/,[deleted by user],/r/Maricopa/comments/orla5g/deleted_by_user/h6j2m9h/,0,r/Maricopa,0,0
Do you know what Fertilizer is?,t2_cwjal5gp,CarmineGTS,0,1627257053.0,0,t1_h6j24bp,h6j24bp,True,[deleted],t3_orla5g,https://www.reddit.com/r/Maricopa/comments/orla5g/deleted_by_user/,[deleted by user],/r/Maricopa/comments/orla5g/deleted_by_user/h6j24bp/,10,r/Maricopa,0,10
Awww poor baby.,t2_17aiq3,Athletics365,0,1627256594.0,0,t1_h6j191o,h6j191o,True,[deleted],t3_orl9u5,https://www.reddit.com/r/Maricopa/comments/orl9u5/deleted_by_user/,[deleted by user],/r/Maricopa/comments/orl9u5/deleted_by_user/h6j191o/,6,r/Maricopa,0,6
"You must be new to Maricopa, some may say its the smell of money, and lots of it. If it bothers you that bad you can move out of Maricopa also.",t2_4waea05f,Wildcat-Jim,0,1627256293.0,0,t1_h6j0oda,h6j0oda,True,[deleted],t3_orl9u5,https://www.reddit.com/r/Maricopa/comments/orl9u5/deleted_by_user/,[deleted by user],/r/Maricopa/comments/orl9u5/deleted_by_user/h6j0oda/,8,r/Maricopa,0,8
😭😭😭,t2_2vlllibo,CobBerry,0,1627254270.0,0,t1_h6iwumv,h6iwumv,False,[deleted],t3_orl9u5,https://www.reddit.com/r/Maricopa/comments/orl9u5/deleted_by_user/,[deleted by user],/r/Maricopa/comments/orl9u5/deleted_by_user/h6iwumv/,-1,r/Maricopa,0,-1
Embrace the smell.,t2_bwho7,WolfBV,0,1627254205.0,0,t1_h6iwq0e,h6iwq0e,True,[deleted],t3_orl9u5,https://www.reddit.com/r/Maricopa/comments/orl9u5/deleted_by_user/,[deleted by user],/r/Maricopa/comments/orl9u5/deleted_by_user/h6iwq0e/,5,r/Maricopa,0,5
Lol I meant the cow shit,t2_2vlllibo,CobBerry,0,1627252057.0,0,t1_h6isjel,h6isjel,False,[deleted],t3_orl9u5,https://www.reddit.com/r/Maricopa/comments/orl9u5/deleted_by_user/,[deleted by user],/r/Maricopa/comments/orl9u5/deleted_by_user/h6isjel/,-5,r/Maricopa,0,-5
Would recommend deodorant and showering more often.,t2_2n7tto44,Fernweh5717,0,1627251897.0,0,t1_h6is8c9,h6is8c9,True,[deleted],t3_orl9u5,https://www.reddit.com/r/Maricopa/comments/orl9u5/deleted_by_user/,[deleted by user],/r/Maricopa/comments/orl9u5/deleted_by_user/h6is8c9/,9,r/Maricopa,0,9
Lol,t2_r66nn4b,Sombersai,0,1627245459.0,0,t1_h6ifdku,h6ifdku,True,[deleted],t3_oriqay,https://www.reddit.com/r/Maricopa/comments/oriqay/this_town_smell_like_ass/,this town smell like ass,/r/Maricopa/comments/oriqay/this_town_smell_like_ass/h6ifdku/,1,r/Maricopa,0,1
You Must be new to town.,t2_4waea05f,Wildcat-Jim,0,1627243591.0,0,t1_h6ibknd,h6ibknd,True,[deleted],t3_oriqay,https://www.reddit.com/r/Maricopa/comments/oriqay/this_town_smell_like_ass/,this town smell like ass,/r/Maricopa/comments/oriqay/this_town_smell_like_ass/h6ibknd/,1,r/Maricopa,0,1
"When the city grows it’ll get better. There’s two cow farms nearby that I know of that cause the smell. The city seems to be growing faster every year. My father did some work here in the 90’s and there was nothing here according to him, when he saw it this year he was amazed how much has been built since he was here in the 90’s",t2_dx7bz,AmateurEarthling,0,1627243591.0,0,t1_h6ibkn9,h6ibkn9,True,[deleted],t3_oriqay,https://www.reddit.com/r/Maricopa/comments/oriqay/this_town_smell_like_ass/,this town smell like ass,/r/Maricopa/comments/oriqay/this_town_smell_like_ass/h6ibkn9/,2,r/Maricopa,0,2
"That’s fair, I’m willing to pay damn near anything cause no ISP is gonna do anything for my neighborhood",t2_31sd6ct,jpc273,0,1627240057.0,0,t1_h6i4bkg,h6i4bkg,False,jpc273,t3_or44mx,https://www.reddit.com/r/Maricopa/comments/or44mx/anyone_in_copa_have_starlink/,Anyone in Copa have Starlink?,/r/Maricopa/comments/or44mx/anyone_in_copa_have_starlink/h6i4bkg/,1,r/Maricopa,0,1
"I would never use Starlink, not because it’s a bad service, but because it could bad for our future in space.",t2_dx7bz,AmateurEarthling,0,1627239728.0,0,t1_h6i3n17,h6i3n17,True,jpc273,t3_or44mx,https://www.reddit.com/r/Maricopa/comments/or44mx/anyone_in_copa_have_starlink/,Anyone in Copa have Starlink?,/r/Maricopa/comments/or44mx/anyone_in_copa_have_starlink/h6i3n17/,3,r/Maricopa,0,3
Same I have been on the waitlist since February. I can’t wait to never give CL or Orbital a dime ever again.,t2_31sd6ct,jpc273,0,1627217415.0,0,t1_h6gwcyx,h6gwcyx,False,jpc273,t3_or44mx,https://www.reddit.com/r/Maricopa/comments/or44mx/anyone_in_copa_have_starlink/,Anyone in Copa have Starlink?,/r/Maricopa/comments/or44mx/anyone_in_copa_have_starlink/h6gwcyx/,2,r/Maricopa,0,2
The library has adventures league every other Sat - and Mr Es Comics just had a Ravnica campaign event last night and have occasional get togethers on the same nights the do MTG commander drafts. Probably the best place to start and meet other like minded folks.,t2_5ulogolj,giant_desert_lobster,0,1627198424.0,0,t1_h6gatee,h6gatee,True,kave1021,t3_or6bsh,https://www.reddit.com/r/Maricopa/comments/or6bsh/dungeons_dragons/,Dungeons & Dragons,/r/Maricopa/comments/or6bsh/dungeons_dragons/h6gatee/,5,r/Maricopa,0,5
I wish I had Starlink. I am on the waiting list. I know at least one person in the area has Starlink.,t2_85l6p,mailman-zero,0,1627188815.0,0,t1_h6fyu48,h6fyu48,True,jpc273,t3_or44mx,https://www.reddit.com/r/Maricopa/comments/or44mx/anyone_in_copa_have_starlink/,Anyone in Copa have Starlink?,/r/Maricopa/comments/or44mx/anyone_in_copa_have_starlink/h6fyu48/,1,r/Maricopa,0,1
It is not a common smell.,t2_bwho7,WolfBV,0,1627185194.0,0,t1_h6fthol,h6fthol,True,[deleted],t3_or1qd2,https://www.reddit.com/r/Maricopa/comments/or1qd2/the_cow_smell_is_ridiculous/,The cow smell is ridiculous,/r/Maricopa/comments/or1qd2/the_cow_smell_is_ridiculous/h6fthol/,3,r/Maricopa,0,3
"I drive by the farm on casa grande freeway and it’s awful but my house on the north side of the city almost never gets the smell, maybe once a month or every other month. As the city grows more it’ll disappear eventually, that’s how Gilbert used to be.",t2_dx7bz,AmateurEarthling,0,1627183753.0,0,t1_h6fr7sm,h6fr7sm,True,[deleted],t3_or1qd2,https://www.reddit.com/r/Maricopa/comments/or1qd2/the_cow_smell_is_ridiculous/,The cow smell is ridiculous,/r/Maricopa/comments/or1qd2/the_cow_smell_is_ridiculous/h6fr7sm/,6,r/Maricopa,0,6
"I *think* it's gotten better.  We moved here 10+ years ago, and back then it was really, really strong and came on often.  

I imagine the rains have amped up the potency a bit.  Smelled it yesterday and it sort of surprised me.  It's been a while since I've had to uncurl my nose hairs.

To answer your question: No, it's not that often anymore.  Not where I live at least.

Edit: added sentence.",t2_4sag7,limbermind,0,1627183465.0,0,t1_h6fqrhp,h6fqrhp,True,[deleted],t3_or1qd2,https://www.reddit.com/r/Maricopa/comments/or1qd2/the_cow_smell_is_ridiculous/,The cow smell is ridiculous,/r/Maricopa/comments/or1qd2/the_cow_smell_is_ridiculous/h6fqrhp/,2,r/Maricopa,0,2
It was really bad last night with the humidity,t2_7rygrm95,Deousidous,0,1627176956.0,0,t1_h6ffosq,h6ffosq,True,[deleted],t3_or1qd2,https://www.reddit.com/r/Maricopa/comments/or1qd2/the_cow_smell_is_ridiculous/,The cow smell is ridiculous,/r/Maricopa/comments/or1qd2/the_cow_smell_is_ridiculous/h6ffosq/,2,r/Maricopa,0,2
I live in the south part of town and only smell cows in the spring time when they fertilize the crops.,t2_2n7tto44,Fernweh5717,0,1627176893.0,0,t1_h6ffkte,h6ffkte,True,[deleted],t3_or1qd2,https://www.reddit.com/r/Maricopa/comments/or1qd2/the_cow_smell_is_ridiculous/,The cow smell is ridiculous,/r/Maricopa/comments/or1qd2/the_cow_smell_is_ridiculous/h6ffkte/,2,r/Maricopa,0,2
You’re smoking crack! 😂🤣😂,t2_a2u7w9cn,WWilson17,0,1626732079.0,0,t1_h5syolx,h5syolx,False,WWilson17,t3_onnpkk,https://www.reddit.com/r/Maricopa/comments/onnpkk/busted_more_evidence_shows_up_for_the_maricopa/,🚨BUSTED! 🚨 More evidence shows up for the Maricopa Forensic Audit!!,/r/Maricopa/comments/onnpkk/busted_more_evidence_shows_up_for_the_maricopa/h5syolx/,-2,r/Maricopa,0,-2
"I hate to break it to you, but they did a hand count and found no -- as in zero -- differences in the vote count.",t2_3mj5w,jpristel,0,1626732020.0,0,t1_h5syjz0,h5syjz0,True,WWilson17,t3_onnpkk,https://www.reddit.com/r/Maricopa/comments/onnpkk/busted_more_evidence_shows_up_for_the_maricopa/,🚨BUSTED! 🚨 More evidence shows up for the Maricopa Forensic Audit!!,/r/Maricopa/comments/onnpkk/busted_more_evidence_shows_up_for_the_maricopa/h5syjz0/,3,r/Maricopa,0,3
Get the fuck outta here asshole. Its not like bitch ass Trump will become president anyway. Its curtains bitch. Let it go like the others did in 2016.,t2_17aiq3,Athletics365,0,1626731169.0,0,t1_h5swobe,h5swobe,False,WWilson17,t3_onnpkk,https://www.reddit.com/r/Maricopa/comments/onnpkk/busted_more_evidence_shows_up_for_the_maricopa/,🚨BUSTED! 🚨 More evidence shows up for the Maricopa Forensic Audit!!,/r/Maricopa/comments/onnpkk/busted_more_evidence_shows_up_for_the_maricopa/h5swobe/,5,r/Maricopa,0,5
"Well, it did it’s part by gaining your attention.",t2_a2u7w9cn,WWilson17,0,1626730495.0,0,t1_h5sv6d0,h5sv6d0,False,WWilson17,t3_onnpkk,https://www.reddit.com/r/Maricopa/comments/onnpkk/busted_more_evidence_shows_up_for_the_maricopa/,🚨BUSTED! 🚨 More evidence shows up for the Maricopa Forensic Audit!!,/r/Maricopa/comments/onnpkk/busted_more_evidence_shows_up_for_the_maricopa/h5sv6d0/,-7,r/Maricopa,0,-7
"Ok so, while interesting, this isn't really relevant for this sub since it's Maricopa County....this sub is for Maricopa the city, which is in Pinal County.",t2_84qei,Vongman,0,1626730296.0,0,t1_h5suq20,h5suq20,True,WWilson17,t3_onnpkk,https://www.reddit.com/r/Maricopa/comments/onnpkk/busted_more_evidence_shows_up_for_the_maricopa/,🚨BUSTED! 🚨 More evidence shows up for the Maricopa Forensic Audit!!,/r/Maricopa/comments/onnpkk/busted_more_evidence_shows_up_for_the_maricopa/h5suq20/,4,r/Maricopa,0,4
"Excuse me, China is panicked. Biden doesn’t even know where he is #ChinaJoe aka #DementiaJoe",t2_a2u7w9cn,WWilson17,0,1626445286.0,0,t1_h5eero2,h5eero2,False,edwardtemple,t3_ol11sz,https://www.reddit.com/r/Maricopa/comments/ol11sz/174000_invalid_ballots/,"174,000 invalid ballots",/r/Maricopa/comments/ol11sz/174000_invalid_ballots/h5eero2/,1,r/Maricopa,0,1
GA and AZ have biden panicked. Expect the communication blackouts!  Trump Won BIG!,t2_a2u7w9cn,WWilson17,0,1626389221.0,0,t1_h5bxt9e,h5bxt9e,True,edwardtemple,t3_ol11sz,https://www.reddit.com/r/Maricopa/comments/ol11sz/174000_invalid_ballots/,"174,000 invalid ballots",/r/Maricopa/comments/ol11sz/174000_invalid_ballots/h5bxt9e/,-1,r/Maricopa,0,-1
Source: me,t2_rxfto,chemicalinhalation,0,1626387271.0,0,t1_h5btryi,h5btryi,True,edwardtemple,t3_ol11sz,https://www.reddit.com/r/Maricopa/comments/ol11sz/174000_invalid_ballots/,"174,000 invalid ballots",/r/Maricopa/comments/ol11sz/174000_invalid_ballots/h5btryi/,2,r/Maricopa,0,2
Wrong sub my G.,t2_4waea05f,Wildcat-Jim,0,1626381178.0,0,t1_h5bgaa8,h5bgaa8,True,edwardtemple,t3_ol11sz,https://www.reddit.com/r/Maricopa/comments/ol11sz/174000_invalid_ballots/,"174,000 invalid ballots",/r/Maricopa/comments/ol11sz/174000_invalid_ballots/h5bgaa8/,2,r/Maricopa,0,2
">This is a place for discussion. You posted this, I responded

So, discuss.

I've stated my views rather thoroughly. By my post history, you can pretty much see my views. By *your* post history, I can see you like bourbon (having lived for 3 years in KY after being a HUGE single malt Scotch fan, I can agree - good bourbon is now my drink of choice), but that's about it. I see no deeply held beliefs, for good or bad.

So, discuss. Are you atheist, Christian, Muslim, Buddhist, Hindu, something else? Are you gay, straight, bi, something else? 

I'd like to 

>speak to people on Reddit.

so, speak.",t2_6y0aa,chileheadd,0,1626310364.0,0,t1_h57xydq,h57xydq,False,Deousidous,t3_nf39sf,https://www.reddit.com/r/Maricopa/comments/nf39sf/anybody_know_when_were_getting_a_chickfila/,Anybody know when we’re getting a chick-fil-a?,/r/Maricopa/comments/nf39sf/anybody_know_when_were_getting_a_chickfila/h57xydq/,1,r/Maricopa,0,1
"Not a troll. Just seems people are so big and bad telling christians to fuck themselves over differences of views on life. These same people never say a word to the muslim community for the belief of killing people for being gay TO THIS DAY. But no, we all gotta hear how some guy wont make a cake for someone looking to be a victim. 

This is a place for discussion. You posted this, I responded. That is all. If you dont wish to speak to people on Reddit then don't post?",t2_1exe3sw0,kingdiamond42c,0,1626309544.0,0,t1_h57wdfq,h57wdfq,False,Deousidous,t3_nf39sf,https://www.reddit.com/r/Maricopa/comments/nf39sf/anybody_know_when_were_getting_a_chickfila/,Anybody know when we’re getting a chick-fil-a?,/r/Maricopa/comments/nf39sf/anybody_know_when_were_getting_a_chickfila/h57wdfq/,1,r/Maricopa,0,1
"No bias; I disdain all religions (BTW, Catholics ***are*** Christians). Islam, Buddhism, Hinduism, Taoism, Paganism, Wiccan, and *all* others, they're all bullshit. 

You done trying to poke me with a stick, or can we move on?

Let's hear **your** views, **your** likes and dislikes, **your** prejudices, **your** religious and moral views, or are you just a troll?",t2_6y0aa,chileheadd,0,1626309037.0,0,t1_h57ve8q,h57ve8q,False,Deousidous,t3_nf39sf,https://www.reddit.com/r/Maricopa/comments/nf39sf/anybody_know_when_were_getting_a_chickfila/,Anybody know when we’re getting a chick-fil-a?,/r/Maricopa/comments/nf39sf/anybody_know_when_were_getting_a_chickfila/h57ve8q/,1,r/Maricopa,0,1
"Your bias is showing. Your post clearly focuses on your disdain for catholics and christians. Do you ever show this kind of outrage towards anyone else and their religion or just towards those who turn the other cheek? Religion is like anything else. Good people and bad people based off your individual moral compass. Your beef sounds personal to me. 

To quote Colonel Sanders, ""Im too drunk to taste this chicken.""",t2_1exe3sw0,kingdiamond42c,0,1626307681.0,0,t1_h57ss80,h57ss80,False,Deousidous,t3_nf39sf,https://www.reddit.com/r/Maricopa/comments/nf39sf/anybody_know_when_were_getting_a_chickfila/,Anybody know when we’re getting a chick-fil-a?,/r/Maricopa/comments/nf39sf/anybody_know_when_were_getting_a_chickfila/h57ss80/,1,r/Maricopa,0,1
