body,author_fullname,author.name,controversiality,created,downs,fullname,id,is_root,link_author,link_id,link_permalink,link_title,permalink,score,subreddit_name_prefixed,total_awards_received,ups
That's the one. I am so glad I own a house now. I think I am permanently scarred from my experience renting from his company.,t2_3i68uq36,baesicscience,0,1648275060.0,0,t1_i25x05y,i25x05y,False,Gently_55,t3_su6zua,https://www.reddit.com/r/MoscowIdaho/comments/su6zua/great_rental_companies_ones_to_avoid/,Great rental companies? Ones to avoid?,/r/MoscowIdaho/comments/su6zua/great_rental_companies_ones_to_avoid/i25x05y/,1,r/MoscowIdaho,0,1
"Matt Becker is like, kirker adjacent. Not technically, but definitely has connections.",t2_8w3iltew,Mental-Pollution-92,0,1648265175.0,0,t1_i25hs27,i25hs27,False,zioxusOne,t3_shjsez,https://www.reddit.com/r/MoscowIdaho/comments/shjsez/downtown/,Downtown,/r/MoscowIdaho/comments/shjsez/downtown/i25hs27/,1,r/MoscowIdaho,0,1
"Lol, probably because Doug has literally spoken out about taking over Moscow and other church members have said the same thing as well as talking about how much y'all own. So. You know. That's probably why.",t2_8w3iltew,Mental-Pollution-92,0,1648265039.0,0,t1_i25hjdw,i25hjdw,False,brockfack,t3_spfqe5,https://www.reddit.com/r/MoscowIdaho/comments/spfqe5/searching_for_interview_subjects_regarding_christ/,Searching for Interview Subjects Regarding Christ Church,/r/MoscowIdaho/comments/spfqe5/searching_for_interview_subjects_regarding_christ/i25hjdw/,1,r/MoscowIdaho,0,1
Reach out to the owner of Cafe Artista. Her and her daughter were neighbors of Doug Wilson and have many many stories. They're more than willing to talk about it.,t2_8w3iltew,Mental-Pollution-92,0,1648264873.0,0,t1_i25h8lh,i25h8lh,True,brockfack,t3_spfqe5,https://www.reddit.com/r/MoscowIdaho/comments/spfqe5/searching_for_interview_subjects_regarding_christ/,Searching for Interview Subjects Regarding Christ Church,/r/MoscowIdaho/comments/spfqe5/searching_for_interview_subjects_regarding_christ/i25h8lh/,1,r/MoscowIdaho,0,1
"They need to open soon, they'll lose their liquor license here soon if they don't. Not even kidding, I heard from someone who works from the owner about it.",t2_8w3iltew,Mental-Pollution-92,0,1648264790.0,0,t1_i25h36c,i25h36c,True,BlondHippie21,t3_sr5zhv,https://www.reddit.com/r/MoscowIdaho/comments/sr5zhv/the_gardensangriabloom/,The Garden/Sangria/Bloom,/r/MoscowIdaho/comments/sr5zhv/the_gardensangriabloom/i25h36c/,1,r/MoscowIdaho,0,1
Is Moscow One owned by Matt Becker? I know his rental company has changed names a few times because of how terrible they are.,t2_8w3iltew,Mental-Pollution-92,0,1648264686.0,0,t1_i25gweo,i25gweo,False,Gently_55,t3_su6zua,https://www.reddit.com/r/MoscowIdaho/comments/su6zua/great_rental_companies_ones_to_avoid/,Great rental companies? Ones to avoid?,/r/MoscowIdaho/comments/su6zua/great_rental_companies_ones_to_avoid/i25gweo/,2,r/MoscowIdaho,0,2
I rented from them. Lived near East city park.... Was not great. But we made it work. Lost our checks a few times... Blamed us.,t2_8w3iltew,Mental-Pollution-92,0,1648264641.0,0,t1_i25gtgp,i25gtgp,False,Gently_55,t3_su6zua,https://www.reddit.com/r/MoscowIdaho/comments/su6zua/great_rental_companies_ones_to_avoid/,Great rental companies? Ones to avoid?,/r/MoscowIdaho/comments/su6zua/great_rental_companies_ones_to_avoid/i25gtgp/,1,r/MoscowIdaho,0,1
There's also the recycling center. They have a whole big bin of them you can put them.,t2_8w3iltew,Mental-Pollution-92,0,1648264420.0,0,t1_i25gf4k,i25gf4k,True,misslolomarie,t3_tiok4m,https://www.reddit.com/r/MoscowIdaho/comments/tiok4m/where_to_drop_off_magazines/,where to drop off magazines?,/r/MoscowIdaho/comments/tiok4m/where_to_drop_off_magazines/i25gf4k/,1,r/MoscowIdaho,0,1
I assume they meant to crosspost this: https://www.reddit.com/r/nottheonion/comments/tnbp01/idaho_house_republicans_kill_library_budget,t2_g1osj,JuDGe3690,0,1648260847.0,0,t1_i259miw,i259miw,False,Turd_P_Ferguson,t3_to6hsa,https://www.reddit.com/r/MoscowIdaho/comments/to6hsa/from_rnottheonion/,From r/nottheonion,/r/MoscowIdaho/comments/to6hsa/from_rnottheonion/i259miw/,2,r/MoscowIdaho,0,2
I'm confused?,t2_626en,lowbatteries,0,1648256638.0,0,t1_i2510ev,i2510ev,True,Turd_P_Ferguson,t3_to6hsa,https://www.reddit.com/r/MoscowIdaho/comments/to6hsa/from_rnottheonion/,From r/nottheonion,/r/MoscowIdaho/comments/to6hsa/from_rnottheonion/i2510ev/,1,r/MoscowIdaho,0,1
"Moscow Tattoo Co. Matt did the best tattoo I’ve had. Super clean lines, least pain I’ve ever had getting inked.",t2_ecawt,Turd_P_Ferguson,0,1648251460.0,0,t1_i24q78h,i24q78h,True,xialzkie,t3_s54xh1,https://www.reddit.com/r/MoscowIdaho/comments/s54xh1/good_and_reasonably_priced_tattoo_place/,Good and reasonably priced tattoo place?,/r/MoscowIdaho/comments/s54xh1/good_and_reasonably_priced_tattoo_place/i24q78h/,1,r/MoscowIdaho,0,1
"I know one personally, but don’t wanna put his info on Reddit without permission. Send me a DM and I’ll see if I can connect.",t2_ecawt,Turd_P_Ferguson,0,1648251348.0,0,t1_i24pyp3,i24pyp3,True,wildstubbs,t3_sg32cq,https://www.reddit.com/r/MoscowIdaho/comments/sg32cq/is_there_a_luthier_in_town/,Is there a luthier in town?,/r/MoscowIdaho/comments/sg32cq/is_there_a_luthier_in_town/i24pyp3/,1,r/MoscowIdaho,0,1
They already did send one like 15 days ago but i missed it but i don't know if they'll send one again. I have mailed them but they haven't responded back yet,t2_7nkvcv94,Top-Faithlessness-97,0,1648067967.0,0,t1_i1ue6mw,i1ue6mw,False,Top-Faithlessness-97,t3_tj58uy,https://www.reddit.com/r/MoscowIdaho/comments/tj58uy/travelling_to_lewiston/,travelling to Lewiston,/r/MoscowIdaho/comments/tj58uy/travelling_to_lewiston/i1ue6mw/,1,r/MoscowIdaho,0,1
"Yeah, the ipo did send one like 15 days ago but unfortunately i couldn't book it cause it was full. I have emailed the ipo regarding the topic but they haven't responded back yet",t2_7nkvcv94,Top-Faithlessness-97,0,1648067912.0,0,t1_i1ue1pc,i1ue1pc,False,Top-Faithlessness-97,t3_tj58uy,https://www.reddit.com/r/MoscowIdaho/comments/tj58uy/travelling_to_lewiston/,travelling to Lewiston,/r/MoscowIdaho/comments/tj58uy/travelling_to_lewiston/i1ue1pc/,1,r/MoscowIdaho,0,1
"Looks like they are out running again today. What happens when they need to cross a street? I saw 3 piled up like they needed to cross the street, sort of hogging up the sidewalk.",t2_l15uuptz,jolly_canoe,0,1648062135.0,0,t1_i1tyy1j,i1tyy1j,True,AtOurGates,t3_sh8mpo,https://www.reddit.com/r/MoscowIdaho/comments/sh8mpo/food_delivery_robots_come_to_the_u_of_i_campus/,Food Delivery Robots Come to the U of I Campus,/r/MoscowIdaho/comments/sh8mpo/food_delivery_robots_come_to_the_u_of_i_campus/i1tyy1j/,1,r/MoscowIdaho,0,1
"I haven't been to Moscow in a decade. When I learned The Beach and CJ's closed I was sad, and now The Garden is gone. I wonder what else is gone. I probably wouldn't even recognize the place.",t2_77wtjk2j,KuKuIsland,0,1648060533.0,0,t1_i1tur4m,i1tur4m,False,HerbLikesCats6669,t3_te5r8w,https://www.reddit.com/r/MoscowIdaho/comments/te5r8w/best_bar_in_town/,Best bar in town?,/r/MoscowIdaho/comments/te5r8w/best_bar_in_town/i1tur4m/,1,r/MoscowIdaho,0,1
Thanks! I am too!,t2_16yhq8wj,Dialectologist,0,1648038032.0,0,t1_i1sauq6,i1sauq6,False,Dialectologist,t3_tk511c,https://www.reddit.com/r/MoscowIdaho/comments/tk511c/idaho_english_survey/,Idaho English survey,/r/MoscowIdaho/comments/tk511c/idaho_english_survey/i1sauq6/,1,r/MoscowIdaho,0,1
I’m excited to see what comes of it.,t2_htb4c4yh,Buggz229,0,1647998544.0,0,t1_i1qn8vb,i1qn8vb,True,Dialectologist,t3_tk511c,https://www.reddit.com/r/MoscowIdaho/comments/tk511c/idaho_english_survey/,Idaho English survey,/r/MoscowIdaho/comments/tk511c/idaho_english_survey/i1qn8vb/,1,r/MoscowIdaho,0,1
Paradise Ridge is *not* CC. Neither is Pecks.,t2_4c0f4,heyheythrowitaway,0,1647992995.0,0,t1_i1qawsd,i1qawsd,False,AtOurGates,t3_rmj9oj,https://www.reddit.com/r/MoscowIdaho/comments/rmj9oj/downtown_3rd_main_building_bought_by_andrew/,"Downtown 3rd & Main Building Bought by Andrew Crapuchettes, Aaron Rench and Nate Wilson",/r/MoscowIdaho/comments/rmj9oj/downtown_3rd_main_building_bought_by_andrew/i1qawsd/,1,r/MoscowIdaho,0,1
I’ll do what I can to make a publicly available version of the results. I have a website where I post results like that.,t2_16yhq8wj,Dialectologist,0,1647991973.0,0,t1_i1q8ksf,i1q8ksf,False,Dialectologist,t3_tk511c,https://www.reddit.com/r/MoscowIdaho/comments/tk511c/idaho_english_survey/,Idaho English survey,/r/MoscowIdaho/comments/tk511c/idaho_english_survey/i1q8ksf/,2,r/MoscowIdaho,0,2
"Will your research be published anywhere publicly viewable? 

Also I’d love to help but despite being born in Idaho I spent the majority of my language learning years outside the PNW. Best of luck on your study",t2_7cmae,sinisterspud,0,1647982383.0,0,t1_i1pl7xz,i1pl7xz,True,Dialectologist,t3_tk511c,https://www.reddit.com/r/MoscowIdaho/comments/tk511c/idaho_english_survey/,Idaho English survey,/r/MoscowIdaho/comments/tk511c/idaho_english_survey/i1pl7xz/,2,r/MoscowIdaho,0,2
"They also require any of their new hires to ""be of the faith"" or some shit and can get away with it by being a non profit. A ""non profit"" that marks up bullshit vinyl for $10 and nonfunctioning cameras for $75 now. Kind of wild. That place has definitely changed.

Their employee requirements:
• Growing as a Christian with a passion for making a difference in our community 
• Actively involved in a local church or home fellowship",t2_4c0f4,heyheythrowitaway,0,1647979451.0,0,t1_i1pdpv0,i1pdpv0,False,zioxusOne,t3_tc60zp,https://www.reddit.com/r/MoscowIdaho/comments/tc60zp/donating_stuff/,Donating Stuff,/r/MoscowIdaho/comments/tc60zp/donating_stuff/i1pdpv0/,1,r/MoscowIdaho,0,1
Honestly it’s nicer than half the houses falling apart in the shambling parts of moscow with zero HOA. Half of the people and even have respect for there front yard. So this is actually refreshing,t2_9ju5slpd,Aggravating_Big_3174,0,1647921464.0,0,t1_i1mdxva,i1mdxva,True,zecarebear,t3_tiyeic,https://www.reddit.com/r/MoscowIdaho/comments/tiyeic/anyone_know_this_viewkilling_house/,Anyone know this view-killing house?,/r/MoscowIdaho/comments/tiyeic/anyone_know_this_viewkilling_house/i1mdxva/,3,r/MoscowIdaho,0,3
IPO usually send a bus down there for free a couple times each semester. Email them and see when they are next heading down,t2_cqy9wsgb,tunafish3453,0,1647908680.0,0,t1_i1lndok,i1lndok,True,Top-Faithlessness-97,t3_tj58uy,https://www.reddit.com/r/MoscowIdaho/comments/tj58uy/travelling_to_lewiston/,travelling to Lewiston,/r/MoscowIdaho/comments/tj58uy/travelling_to_lewiston/i1lndok/,2,r/MoscowIdaho,0,2
"I agree with your dislike of hilltop building and I think it happens too much around Moscow. I have only lived in one place that was willing to pass zoning to prohibit it though and doubt Moscow would do anything right now with its pro-building Council, Mayor and P&Z",t2_h13ntjvf,TFarnworthK,0,1647902751.0,0,t1_i1l9v92,i1l9v92,False,zecarebear,t3_tiyeic,https://www.reddit.com/r/MoscowIdaho/comments/tiyeic/anyone_know_this_viewkilling_house/,Anyone know this view-killing house?,/r/MoscowIdaho/comments/tiyeic/anyone_know_this_viewkilling_house/i1l9v92/,2,r/MoscowIdaho,0,2
https://www.uidaho.edu/infrastructure/parking/alternative-transportation/regional-transit,t2_jggct4bf,RtDefense88,0,1647884799.0,0,t1_i1k1sby,i1k1sby,True,Top-Faithlessness-97,t3_tj58uy,https://www.reddit.com/r/MoscowIdaho/comments/tj58uy/travelling_to_lewiston/,travelling to Lewiston,/r/MoscowIdaho/comments/tj58uy/travelling_to_lewiston/i1k1sby/,1,r/MoscowIdaho,0,1
Have u tried contacting the U of I IPO? They might help you with the car pooling too if there are enough students. Ig the bus service to Lewiston takes around 19 bucks for a single trip!!!,t2_i372jgxh,lovethgir,0,1647846994.0,0,t1_i1i5gyz,i1i5gyz,True,Top-Faithlessness-97,t3_tj58uy,https://www.reddit.com/r/MoscowIdaho/comments/tj58uy/travelling_to_lewiston/,travelling to Lewiston,/r/MoscowIdaho/comments/tj58uy/travelling_to_lewiston/i1i5gyz/,10,r/MoscowIdaho,0,10
"Don't really understand the issue.  There are plenty of ridges and hills in this region with views that don't have any buildings on them.  If you live in or near a city, you're gonna have houses around you.  If someone wants to build on top of a hill and listen to the wind all the time, that's their life.",t2_2tqgnw51,captainkirk767,0,1647836599.0,0,t1_i1hrdss,i1hrdss,True,zecarebear,t3_tiyeic,https://www.reddit.com/r/MoscowIdaho/comments/tiyeic/anyone_know_this_viewkilling_house/,Anyone know this view-killing house?,/r/MoscowIdaho/comments/tiyeic/anyone_know_this_viewkilling_house/i1hrdss/,6,r/MoscowIdaho,0,6
"No, it will just drive up housing costs. Fuck that.",t2_568sm5hy,Hot-Error,1,1647831995.0,0,t1_i1hj5yn,i1hj5yn,False,zecarebear,t3_tiyeic,https://www.reddit.com/r/MoscowIdaho/comments/tiyeic/anyone_know_this_viewkilling_house/,Anyone know this view-killing house?,/r/MoscowIdaho/comments/tiyeic/anyone_know_this_viewkilling_house/i1hj5yn/,-1,r/MoscowIdaho,0,-1
"Thanks for this. Forgot about the ID rule. I'll investigate. If we don't have one, I think Moscow could use a ridge law -- prevents building on hilltops like this.",t2_dmt5go73,zecarebear,1,1647831647.0,0,t1_i1hihcy,i1hihcy,False,zecarebear,t3_tiyeic,https://www.reddit.com/r/MoscowIdaho/comments/tiyeic/anyone_know_this_viewkilling_house/,Anyone know this view-killing house?,/r/MoscowIdaho/comments/tiyeic/anyone_know_this_viewkilling_house/i1hihcy/,1,r/MoscowIdaho,0,1
You could use OnX Maps to figure out who owns it. 7 day free trial.,t2_5ax25gso,beanflicka42069,0,1647831461.0,0,t1_i1hi3yb,i1hi3yb,True,zecarebear,t3_tiyeic,https://www.reddit.com/r/MoscowIdaho/comments/tiyeic/anyone_know_this_viewkilling_house/,Anyone know this view-killing house?,/r/MoscowIdaho/comments/tiyeic/anyone_know_this_viewkilling_house/i1hi3yb/,3,r/MoscowIdaho,0,3
"Great, thanks!",t2_ocia3,misslolomarie,0,1647826490.0,0,t1_i1h8129,i1h8129,False,misslolomarie,t3_tiok4m,https://www.reddit.com/r/MoscowIdaho/comments/tiok4m/where_to_drop_off_magazines/,where to drop off magazines?,/r/MoscowIdaho/comments/tiok4m/where_to_drop_off_magazines/i1h8129/,1,r/MoscowIdaho,0,1
"If you really want to find out who the homeowner is, you could look it up on the Latah County GIS, but if you chose to do that, please don’t share the info here, since that would be a violation of Reddit’s TOS regarding personally identifiable info. 

In any case, blaming the person who built their house where city/county codes allow them to isn’t going to help anything. There are tons of (IMO) ugly and poorly placed homes in town.  Blame building codes that allow this (or the lack of them).  

If you want to make any kind of change you can: 

1) Talk to city council, and encourage them to improve the city’s building codes to allow for less ugly buildings.

2) Support the [Palouse Land Trust](https://www.palouselandtrust.org), that preserves open spaces from development in and around Moscow.",t2_3gddl,AtOurGates,0,1647823614.0,0,t1_i1h22t3,i1h22t3,True,zecarebear,t3_tiyeic,https://www.reddit.com/r/MoscowIdaho/comments/tiyeic/anyone_know_this_viewkilling_house/,Anyone know this view-killing house?,/r/MoscowIdaho/comments/tiyeic/anyone_know_this_viewkilling_house/i1h22t3/,16,r/MoscowIdaho,0,16
"I've never seen it, but I imagine the wind is tearing it to bits...",t2_cw5ao,FrnakRowbers,0,1647822933.0,0,t1_i1h0ms0,i1h0ms0,True,zecarebear,t3_tiyeic,https://www.reddit.com/r/MoscowIdaho/comments/tiyeic/anyone_know_this_viewkilling_house/,Anyone know this view-killing house?,/r/MoscowIdaho/comments/tiyeic/anyone_know_this_viewkilling_house/i1h0ms0/,4,r/MoscowIdaho,0,4
This is Northeast of town -- Curious who would slice off the top of a hill to build this monstrosity?  And do Moscow codes still allow this to happen? And who on Earth would want to live there? Anyone who knows the background of it -- I'd love to hear it.,t2_dmt5go73,zecarebear,0,1647820728.0,0,t1_i1gvxv7,i1gvxv7,True,zecarebear,t3_tiyeic,https://www.reddit.com/r/MoscowIdaho/comments/tiyeic/anyone_know_this_viewkilling_house/,Anyone know this view-killing house?,/r/MoscowIdaho/comments/tiyeic/anyone_know_this_viewkilling_house/i1gvxv7/,1,r/MoscowIdaho,0,1
"The library takes them and has a ""free"" bin that teachers, students, and crafters often pick up magazines for projects. You can just take them in and ask the staff where to put them (I think they're under some computers in the kids section, but I'm not sure if that's still where they're housed)",t2_q0lwm,lizziemeg,0,1647813857.0,0,t1_i1ggirv,i1ggirv,True,misslolomarie,t3_tiok4m,https://www.reddit.com/r/MoscowIdaho/comments/tiok4m/where_to_drop_off_magazines/,where to drop off magazines?,/r/MoscowIdaho/comments/tiok4m/where_to_drop_off_magazines/i1ggirv/,3,r/MoscowIdaho,0,3
Recycling center near Rosauers.,t2_5q7v9a3b,TellingHandshake,0,1647793239.0,0,t1_i1f2xrp,i1f2xrp,True,misslolomarie,t3_tiok4m,https://www.reddit.com/r/MoscowIdaho/comments/tiok4m/where_to_drop_off_magazines/,where to drop off magazines?,/r/MoscowIdaho/comments/tiok4m/where_to_drop_off_magazines/i1f2xrp/,7,r/MoscowIdaho,0,7
Not that I know of. Anytime has a punching bag haha,t2_9ju5slpd,Aggravating_Big_3174,0,1647668361.0,0,t1_i1910la,i1910la,True,LagerNotAle,t3_t8hxv6,https://www.reddit.com/r/MoscowIdaho/comments/t8hxv6/boxing_gym/,Boxing gym?,/r/MoscowIdaho/comments/t8hxv6/boxing_gym/i1910la/,1,r/MoscowIdaho,0,1
"Sunset Mart also does, air hose is over by the smaller pump island.",t2_d91owkyc,ZealousidealMarket66,0,1647647036.0,0,t1_i17x2a6,i17x2a6,True,[deleted],t3_thfyu4,https://www.reddit.com/r/MoscowIdaho/comments/thfyu4/any_free_air_pumps_for_car_tires_in_town/,Any free air pumps for car tires in town?,/r/MoscowIdaho/comments/thfyu4/any_free_air_pumps_for_car_tires_in_town/i17x2a6/,3,r/MoscowIdaho,0,3
"Stinker store, and Palouse auto country have diy air pumps. If you go to les Schwab and ask them to fill your tires they’ll do it for free.",t2_13rgg48b,SuperStupids7,0,1647647018.0,0,t1_i17x0w1,i17x0w1,True,[deleted],t3_thfyu4,https://www.reddit.com/r/MoscowIdaho/comments/thfyu4/any_free_air_pumps_for_car_tires_in_town/,Any free air pumps for car tires in town?,/r/MoscowIdaho/comments/thfyu4/any_free_air_pumps_for_car_tires_in_town/i17x0w1/,2,r/MoscowIdaho,0,2
"Cost $70 but the Michelin tire inflator from Costco is super easy.  Plug into lighter, set the psi you want, turn on, turns off automatically.",t2_ag2um4rf,SutttonTacoma,0,1647641623.0,0,t1_i17l6so,i17l6so,True,[deleted],t3_thfyu4,https://www.reddit.com/r/MoscowIdaho/comments/thfyu4/any_free_air_pumps_for_car_tires_in_town/,Any free air pumps for car tires in town?,/r/MoscowIdaho/comments/thfyu4/any_free_air_pumps_for_car_tires_in_town/i17l6so/,-2,r/MoscowIdaho,0,-2
The two gas pumps across the street from Les Schwab Tires has free air. It's on the side of the building of the auto repair.,t2_1jondice,outdoors1442,0,1647640295.0,0,t1_i17i43n,i17i43n,True,[deleted],t3_thfyu4,https://www.reddit.com/r/MoscowIdaho/comments/thfyu4/any_free_air_pumps_for_car_tires_in_town/,Any free air pumps for car tires in town?,/r/MoscowIdaho/comments/thfyu4/any_free_air_pumps_for_car_tires_in_town/i17i43n/,9,r/MoscowIdaho,0,9
Stinker Station has a free air pump.,t2_5xnrr,WTF_Bengals,0,1647640262.0,0,t1_i17i19f,i17i19f,True,[deleted],t3_thfyu4,https://www.reddit.com/r/MoscowIdaho/comments/thfyu4/any_free_air_pumps_for_car_tires_in_town/,Any free air pumps for car tires in town?,/r/MoscowIdaho/comments/thfyu4/any_free_air_pumps_for_car_tires_in_town/i17i19f/,7,r/MoscowIdaho,0,7
"If you’re looking to shoot pool, Mingles. If you want classy I’d say Nectar. I also heard that there is an nicer bar in Troy that just opened that has some nectar vibes",t2_b0h6u6yk,New_Chipmunk_1056,0,1647616402.0,0,t1_i15u9qd,i15u9qd,True,HerbLikesCats6669,t3_te5r8w,https://www.reddit.com/r/MoscowIdaho/comments/te5r8w/best_bar_in_town/,Best bar in town?,/r/MoscowIdaho/comments/te5r8w/best_bar_in_town/i15u9qd/,1,r/MoscowIdaho,0,1
"Nope, it’s literally a rock pit on public land in the woods.",t2_13rgg48b,SuperStupids7,0,1647597225.0,0,t1_i14uimv,i14uimv,False,CluelessChicken767,t3_t7q78r,https://www.reddit.com/r/MoscowIdaho/comments/t7q78r/public_gravel_pits/,Public gravel pits?,/r/MoscowIdaho/comments/t7q78r/public_gravel_pits/i14uimv/,1,r/MoscowIdaho,0,1
"Would i need a licence or membership to go shoot here? sorry, new to the area and new to firearm ownership, any reply is appreciated :)",t2_3covhib0,Call_Me_Kilo,0,1647568748.0,0,t1_i13nres,i13nres,False,CluelessChicken767,t3_t7q78r,https://www.reddit.com/r/MoscowIdaho/comments/t7q78r/public_gravel_pits/,Public gravel pits?,/r/MoscowIdaho/comments/t7q78r/public_gravel_pits/i13nres/,1,r/MoscowIdaho,0,1
This sub never disappoints,t2_4s3bb3fi,ds1776,0,1647559071.0,0,t1_i132bj7,i132bj7,True,[deleted],t3_tglfkk,https://www.reddit.com/r/MoscowIdaho/comments/tglfkk/moscow_name_change/,Moscow Name Change,/r/MoscowIdaho/comments/tglfkk/moscow_name_change/i132bj7/,2,r/MoscowIdaho,0,2
"This is unnecessary. However, Kyiv Idaho would be an insanely funny place to live in",t2_7vigdzk4,MANTA-Star,0,1647557149.0,0,t1_i12xutd,i12xutd,True,[deleted],t3_tglfkk,https://www.reddit.com/r/MoscowIdaho/comments/tglfkk/moscow_name_change/,Moscow Name Change,/r/MoscowIdaho/comments/tglfkk/moscow_name_change/i12xutd/,3,r/MoscowIdaho,0,3
"also, the pronunciation is different. Even though as a person from the midwest, COW is COW all day long, not COE as the locals say. But i digress, yeah also......i mean... it's not like there arent unsavory folks operating in MOSCOW, ID..."" cough"" Christ Church that was for you.",t2_bc7b020j,justakidfromstlouis,0,1647555801.0,0,t1_i12umoo,i12umoo,True,[deleted],t3_tglfkk,https://www.reddit.com/r/MoscowIdaho/comments/tglfkk/moscow_name_change/,Moscow Name Change,/r/MoscowIdaho/comments/tglfkk/moscow_name_change/i12umoo/,4,r/MoscowIdaho,0,4
https://mobile.twitter.com/terriforidaho/,t2_h64wmrqy,Cookie_Cutter_Cook,0,1647555511.0,0,t1_i12txht,i12txht,True,Cookie_Cutter_Cook,t3_tfsab0,https://www.reddit.com/r/MoscowIdaho/comments/tfsab0/manweiler_runs_for_idaho_lt_governor/,Manweiler runs for Idaho lt. governor,/r/MoscowIdaho/comments/tfsab0/manweiler_runs_for_idaho_lt_governor/i12txht/,1,r/MoscowIdaho,0,1
This is not necessary. Our town name doesn’t imply support of the other Moscow.,t2_45a5ek0p,classysax4,0,1647554782.0,0,t1_i12s5jb,i12s5jb,True,[deleted],t3_tglfkk,https://www.reddit.com/r/MoscowIdaho/comments/tglfkk/moscow_name_change/,Moscow Name Change,/r/MoscowIdaho/comments/tglfkk/moscow_name_change/i12s5jb/,7,r/MoscowIdaho,0,7
https://ballotpedia.org/Terri_Pickens_Manweiler,t2_h64wmrqy,Cookie_Cutter_Cook,0,1647466020.0,0,t1_i0xql4b,i0xql4b,True,Cookie_Cutter_Cook,t3_tdrkml,https://www.reddit.com/r/MoscowIdaho/comments/tdrkml/guest_opinion_north_central_idaho_why_are/,Guest Opinion: North Central Idaho - Why are politicians making life harder?,/r/MoscowIdaho/comments/tdrkml/guest_opinion_north_central_idaho_why_are/i0xql4b/,1,r/MoscowIdaho,0,1
https://ballotpedia.org/Terri_Pickens_Manweiler,t2_h64wmrqy,Cookie_Cutter_Cook,0,1647465951.0,0,t1_i0xqehh,i0xqehh,True,Cookie_Cutter_Cook,t3_tfsab0,https://www.reddit.com/r/MoscowIdaho/comments/tfsab0/manweiler_runs_for_idaho_lt_governor/,Manweiler runs for Idaho lt. governor,/r/MoscowIdaho/comments/tfsab0/manweiler_runs_for_idaho_lt_governor/i0xqehh/,1,r/MoscowIdaho,0,1
I’m Chelsey 30 me and my wife just moved to Moscow and smoke as well.,t2_d3k0qaqg,Due_Payment8796,0,1647381132.0,0,t1_i0t0ghb,i0t0ghb,True,amyboxedwinehouse,t3_rmbefc,https://www.reddit.com/r/MoscowIdaho/comments/rmbefc/i_need_friends_lol/,I need friends lol,/r/MoscowIdaho/comments/rmbefc/i_need_friends_lol/i0t0ghb/,1,r/MoscowIdaho,0,1
"From my general understanding when they started remodeling they discovered the leviathan that is the state of a 100 year old building wiring, mold, that kind of stuff. Along from what I have heard through the grape vine I have heard about continual additions to their remodel. So by my guess 2053.

The Garden when and if they ever do reopen from what I've heard will not be the same type of place as well. More upscale from what I've heard.",t2_9t2r9,CarlDen,0,1647376809.0,0,t1_i0sp7f5,i0sp7f5,False,HerbLikesCats6669,t3_te5r8w,https://www.reddit.com/r/MoscowIdaho/comments/te5r8w/best_bar_in_town/,Best bar in town?,/r/MoscowIdaho/comments/te5r8w/best_bar_in_town/i0sp7f5/,3,r/MoscowIdaho,0,3
"Oil is at $96 a barrel right now, yet the cost at the pump hasn’t fallen one penny. Who is making all of this excess money?  The price goes up everywhere on the same day, yet takes months and months to fall back down to market prices. If you’re such an expert, maybe you could explain that to me?",t2_bvd2bck,ALinIndy,0,1647366238.0,0,t1_i0rxuya,i0rxuya,False,just_an_old_lady,t3_tdahdc,https://www.reddit.com/r/MoscowIdaho/comments/tdahdc/gouging_at_the_gas_pump/,Gouging at the gas pump?,/r/MoscowIdaho/comments/tdahdc/gouging_at_the_gas_pump/i0rxuya/,5,r/MoscowIdaho,0,5
Any word on when the Garden Lounge reopens? I keep popping by and there's no sign on finishing up renovations.,t2_3a4b84ee,LongSyllabus,0,1647364522.0,0,t1_i0rtffx,i0rtffx,False,HerbLikesCats6669,t3_te5r8w,https://www.reddit.com/r/MoscowIdaho/comments/te5r8w/best_bar_in_town/,Best bar in town?,/r/MoscowIdaho/comments/te5r8w/best_bar_in_town/i0rtffx/,2,r/MoscowIdaho,0,2
johns or bust. if ur college age and cool you go to johns,t2_5ecagfk5,poofykit,0,1647332161.0,0,t1_i0q51e6,i0q51e6,True,HerbLikesCats6669,t3_te5r8w,https://www.reddit.com/r/MoscowIdaho/comments/te5r8w/best_bar_in_town/,Best bar in town?,/r/MoscowIdaho/comments/te5r8w/best_bar_in_town/i0q51e6/,3,r/MoscowIdaho,0,3
