body,author_fullname,author.name,controversiality,created,downs,fullname,id,is_root,link_author,link_id,link_permalink,link_title,permalink,score,subreddit_name_prefixed,total_awards_received,ups
Or the Idaho rockhounding group. There's some locals and I've seen posts about metal detecting in there,t2_40jey03y,pipeann,0,1641000669.0,0,t1_hqr6ljo,hqr6ljo,False,Ashamed-Ad-8232,t3_rt2t6b,https://www.reddit.com/r/MoscowIdaho/comments/rt2t6b/metal_detector_needed_2050_12_hour_job/,Metal detector needed 20-50$ 1-2 hour job,/r/MoscowIdaho/comments/rt2t6b/metal_detector_needed_2050_12_hour_job/hqr6ljo/,3,r/MoscowIdaho,0,3
are you on facebook? this sub is too dead for this kind of thing but if you post on a local b/s/t group you'll have a response inside of an hour,t2_hvyzx,JohnFinnsWife,0,1640987774.0,0,t1_hqqeoo5,hqqeoo5,True,Ashamed-Ad-8232,t3_rt2t6b,https://www.reddit.com/r/MoscowIdaho/comments/rt2t6b/metal_detector_needed_2050_12_hour_job/,Metal detector needed 20-50$ 1-2 hour job,/r/MoscowIdaho/comments/rt2t6b/metal_detector_needed_2050_12_hour_job/hqqeoo5/,7,r/MoscowIdaho,0,7
">You want the pedophile to change. But not the homosexual? I understand why: you believe one is wrong, and the other not. Think about that. 

I have thought about it, and reached the same conclusion that modern society has: homosexuality is not a sin, it is not harmful to those involved nor harmful to society. You disagree out of what you think is love for your fellow man. To see them delivered from sin. But that, right there, is not truly from love; it's selfishness and the desire to control people.

>Just the sins you think are sins? What is sin anyway? 

Sin, to you, is what *your* religion defines as sins. That's it, sins are what a religion defines them as. Other religions will have different definitions of sin. People without religion will look for the harm sins cause to those involved. If they don't actually cause harm to anyone, why does it need to be considered a sin? You believe that is because they are sins, and that's the end of it. But that's just the problem: _you_ believe, but others don't. Sins are what you define them as, and everyone else is wrong  *This is the height of selfishness*. Others must do as you ask because you say so.

>What I do agree with is that we should obviously support the victims of sin. And we do. I know quite a few, though you wouldn’t know their story from looking at them today.

You only support them when it is convenient.



We will never change each other's minds. Your arguments only serve to reinforce your own beliefs and keep you in the church; they won't convince others.",t2_8tixl,qeomash,0,1640967477.0,0,t1_hqp1v4l,hqp1v4l,False,AtOurGates,t3_rmj9oj,https://www.reddit.com/r/MoscowIdaho/comments/rmj9oj/downtown_3rd_main_building_bought_by_andrew/,"Downtown 3rd & Main Building Bought by Andrew Crapuchettes, Aaron Rench and Nate Wilson",/r/MoscowIdaho/comments/rmj9oj/downtown_3rd_main_building_bought_by_andrew/hqp1v4l/,4,r/MoscowIdaho,0,4
"You want the pedophile to change. But not the homosexual? I understand why: you believe one is wrong, and the other not. Think about that. 

Do you think the father of 3 small kids who runs off with his secretary is wrong? How about lying? Unjust anger or violence, or greed, or covetousness, or…you know, sin. 

Just the sins you think are sins? What is sin anyway? 

What I do agree with is that we should obviously support the victims of sin. And we do. I know quite a few, though you wouldn’t know their story from looking at them today.",t2_fm9ts1l3,moscuvite_idaho,0,1640959010.0,0,t1_hqojjv0,hqojjv0,False,AtOurGates,t3_rmj9oj,https://www.reddit.com/r/MoscowIdaho/comments/rmj9oj/downtown_3rd_main_building_bought_by_andrew/,"Downtown 3rd & Main Building Bought by Andrew Crapuchettes, Aaron Rench and Nate Wilson",/r/MoscowIdaho/comments/rmj9oj/downtown_3rd_main_building_bought_by_andrew/hqojjv0/,0,r/MoscowIdaho,0,0
"This right here is why I can _never_ agree with your beliefs. Forgiving pedophiles is all well and good, as long as they actually are reformed and the church _supports_ the victims of those pedophiles. Tend to the needy first, then go after the perpetrators.

Your church's views on homosexuality is, however, where we can never see eye to eye. ""Hate the sin, forgive the sinner"" is not a healthy way to build relationships with anyone, let alone your friends and family who are gay. The bottom line is there is nothing wrong with homosexuality. There isn't anything that needs reforming or forgiving. You say you love and welcome all ""sinners"" into your church? Only if they _change_ a fundamental part of themselves.

Forcing someone to change to fit your beliefs is not love, it is selfishness.",t2_8tixl,qeomash,0,1640936520.0,0,t1_hqnotke,hqnotke,False,AtOurGates,t3_rmj9oj,https://www.reddit.com/r/MoscowIdaho/comments/rmj9oj/downtown_3rd_main_building_bought_by_andrew/,"Downtown 3rd & Main Building Bought by Andrew Crapuchettes, Aaron Rench and Nate Wilson",/r/MoscowIdaho/comments/rmj9oj/downtown_3rd_main_building_bought_by_andrew/hqnotke/,6,r/MoscowIdaho,0,6
Man I'm really glad I can cook; soon there will be no restaurants left that aren't owned by a cult or are a threat to public health.,t2_3i68uq36,baesicscience,0,1640927640.0,0,t1_hqnaova,hqnaova,True,Mental-Pollution-92,t3_rdjw1d,https://www.reddit.com/r/MoscowIdaho/comments/rdjw1d/mad_greek/,Mad Greek,/r/MoscowIdaho/comments/rdjw1d/mad_greek/hqnaova/,3,r/MoscowIdaho,0,3
"Prices dropped,  sure.  The market still moved and recovered quickly.

That impacted the whole region, and Moscow was still more expensive.

It’s not hard to understand.

As I stated before,  you go ahead and have the last word.  You’ve obviously figured it all out.

Good luck.",t2_4s3bb3fi,ds1776,0,1640830673.0,0,t1_hqhrwk2,hqhrwk2,False,[deleted],t3_rqyc0m,https://www.reddit.com/r/MoscowIdaho/comments/rqyc0m/moscow_is_headed_for_a_housing_crash_median_price/,Moscow is headed for a housing crash: Median price higher than Boise & Spokane,/r/MoscowIdaho/comments/rqyc0m/moscow_is_headed_for_a_housing_crash_median_price/hqhrwk2/,1,r/MoscowIdaho,0,1
"I’m just going to let you have the last word here.

Good luck.",t2_4s3bb3fi,ds1776,0,1640830423.0,0,t1_hqhrc4w,hqhrc4w,False,[deleted],t3_rqyc0m,https://www.reddit.com/r/MoscowIdaho/comments/rqyc0m/moscow_is_headed_for_a_housing_crash_median_price/,Moscow is headed for a housing crash: Median price higher than Boise & Spokane,/r/MoscowIdaho/comments/rqyc0m/moscow_is_headed_for_a_housing_crash_median_price/hqhrc4w/,1,r/MoscowIdaho,0,1
"I read this again.  It’s very clear that you don’t know how money works,  let alone how to leverage it.

If you are stashing more than an emergency fund in a savings acct you are losing.  Especially today. 

You pretend to understand economics,  yet you’ve barely participated, let alone leveraged money to work for you instead of the other way around.

I’m hoping you’re in your early 20’s,  and have much yet to learn.  Otherwise you are way,  way behind.

And no-  in your situation,  *you* should not buy a home in Moscow right now.  It’s clear you can’t afford the market. 

However,  that situation does not apply to everyone.  It obvious others have the means and ability to purchase homes in Moscow,  otherwise it wouldn’t be happening.

As someone else said-  many of those sales on the higher end side are cash..

Maybe change your situation instead of trying to change everyone else’s.",t2_4s3bb3fi,ds1776,0,1640828547.0,0,t1_hqhn3vp,hqhn3vp,False,[deleted],t3_rqyc0m,https://www.reddit.com/r/MoscowIdaho/comments/rqyc0m/moscow_is_headed_for_a_housing_crash_median_price/,Moscow is headed for a housing crash: Median price higher than Boise & Spokane,/r/MoscowIdaho/comments/rqyc0m/moscow_is_headed_for_a_housing_crash_median_price/hqhn3vp/,0,r/MoscowIdaho,0,0
"I wasn't saying there was no downturn.  I'm saying it didn't make an appreciable difference.  I.E. several places in Southern California where homes lost half their value overnight, and folks were stuck with massive upside down/interest only loans.  Those areas never recovered fully. 

That didn't happen here.

Also,  I'm not the one bitching.",t2_4s3bb3fi,ds1776,0,1640827248.0,0,t1_hqhk641,hqhk641,False,[deleted],t3_rqyc0m,https://www.reddit.com/r/MoscowIdaho/comments/rqyc0m/moscow_is_headed_for_a_housing_crash_median_price/,Moscow is headed for a housing crash: Median price higher than Boise & Spokane,/r/MoscowIdaho/comments/rqyc0m/moscow_is_headed_for_a_housing_crash_median_price/hqhk641/,0,r/MoscowIdaho,0,0
"Wrong again.. At least you're good at something.

Those years were fantastic times to buy for those who had the capital.",t2_4s3bb3fi,ds1776,0,1640826752.0,0,t1_hqhj1pp,hqhj1pp,False,[deleted],t3_rqyc0m,https://www.reddit.com/r/MoscowIdaho/comments/rqyc0m/moscow_is_headed_for_a_housing_crash_median_price/,Moscow is headed for a housing crash: Median price higher than Boise & Spokane,/r/MoscowIdaho/comments/rqyc0m/moscow_is_headed_for_a_housing_crash_median_price/hqhj1pp/,0,r/MoscowIdaho,0,0
"Home is payed off.  3 other properties in Moscow and Troy are paid off.  1 in Julietta as well. 

We have land outside of Lewiston that is not yet paid off, and that is doing nothing but appreciating.   Why pay off early at 2.5% when I'm making over 10% with that money elsewhere?

All I have is equity sweetheart. 

You're fear mongering post doesn't scare me.   Actually, I hope for a crash- I can buy up more rentals then.  Unfortunately for me,  I don't think it's going to be as bad as you're putting on.

You're just sour because you can't buy a house in Moscow.  That's all.",t2_4s3bb3fi,ds1776,0,1640826600.0,0,t1_hqhipmp,hqhipmp,False,[deleted],t3_rqyc0m,https://www.reddit.com/r/MoscowIdaho/comments/rqyc0m/moscow_is_headed_for_a_housing_crash_median_price/,Moscow is headed for a housing crash: Median price higher than Boise & Spokane,/r/MoscowIdaho/comments/rqyc0m/moscow_is_headed_for_a_housing_crash_median_price/hqhipmp/,1,r/MoscowIdaho,0,1
"Maybe, just maybe, I've been buying and selling real estate in Moscow for some time..

Ever think of that?",t2_4s3bb3fi,ds1776,0,1640826234.0,0,t1_hqhhvfh,hqhhvfh,False,[deleted],t3_rqyc0m,https://www.reddit.com/r/MoscowIdaho/comments/rqyc0m/moscow_is_headed_for_a_housing_crash_median_price/,Moscow is headed for a housing crash: Median price higher than Boise & Spokane,/r/MoscowIdaho/comments/rqyc0m/moscow_is_headed_for_a_housing_crash_median_price/hqhhvfh/,1,r/MoscowIdaho,0,1
"*downpayment*

Again,  I’m sorry.  

Also,  if that downpayment is sitting in a USAA savings account,  you’re wrong. 

You sound like you’re just pissed because you can’t afford a home.",t2_4s3bb3fi,ds1776,0,1640821386.0,0,t1_hqh6k8m,hqh6k8m,False,[deleted],t3_rqyc0m,https://www.reddit.com/r/MoscowIdaho/comments/rqyc0m/moscow_is_headed_for_a_housing_crash_median_price/,Moscow is headed for a housing crash: Median price higher than Boise & Spokane,/r/MoscowIdaho/comments/rqyc0m/moscow_is_headed_for_a_housing_crash_median_price/hqh6k8m/,0,r/MoscowIdaho,0,0
"I’ve been here since 79.  You?

You should chill with the assumptions,  you aren’t very good at making them.

I’ve been involved with real estate in the Moscow area since the early 90’s.

Real talk? I suspect the market will decrease and slow down when interest rates rise in the coming year(s).  As a matter of fact,  I’m betting on it.   I don’t expect values to drop more than 15 - 20% though.

But you do you.",t2_4s3bb3fi,ds1776,0,1640821112.0,0,t1_hqh5wsy,hqh5wsy,False,[deleted],t3_rqyc0m,https://www.reddit.com/r/MoscowIdaho/comments/rqyc0m/moscow_is_headed_for_a_housing_crash_median_price/,Moscow is headed for a housing crash: Median price higher than Boise & Spokane,/r/MoscowIdaho/comments/rqyc0m/moscow_is_headed_for_a_housing_crash_median_price/hqh5wsy/,1,r/MoscowIdaho,0,1
"Nah.  I’m doing just fine.

Sorry you are poor and so angry about it.",t2_4s3bb3fi,ds1776,0,1640819953.0,0,t1_hqh354u,hqh354u,False,[deleted],t3_rqyc0m,https://www.reddit.com/r/MoscowIdaho/comments/rqyc0m/moscow_is_headed_for_a_housing_crash_median_price/,Moscow is headed for a housing crash: Median price higher than Boise & Spokane,/r/MoscowIdaho/comments/rqyc0m/moscow_is_headed_for_a_housing_crash_median_price/hqh354u/,1,r/MoscowIdaho,0,1
"I sold Moscow property in 2009 and 2010 for much more than I purchased in 2005, so did many others.

Now all you have is personal attacks because you can't back up your theory that spawned from a single metric from a single source.  

I'm sorry you missed/are missing the boat.  I'd suggest more thorough research.

Oh- quite honestly, I'd be happy if you were right.  That'd be a nice opportunity.

This is a pointless argument in a pointless thread.   I'll let you waste other peoples time.  Later.",t2_4s3bb3fi,ds1776,0,1640819234.0,0,t1_hqh1e9y,hqh1e9y,False,[deleted],t3_rqyc0m,https://www.reddit.com/r/MoscowIdaho/comments/rqyc0m/moscow_is_headed_for_a_housing_crash_median_price/,Moscow is headed for a housing crash: Median price higher than Boise & Spokane,/r/MoscowIdaho/comments/rqyc0m/moscow_is_headed_for_a_housing_crash_median_price/hqh1e9y/,1,r/MoscowIdaho,0,1
"I did look at the data.

Are the houses selling? yes.

You understand what a ""median"" is, right?  Yes?  Great.  Now go and look at those current ~46 listings and tell me what you see. 

Then, when you are done, come back and tell me the housing market in Moscow is going to crash, and how you came to that conclusion (hopefully supported by more data points than a graph built from realtor.com).

This entire post is idiotic.  WTF is your point?",t2_4s3bb3fi,ds1776,0,1640818489.0,0,t1_hqgzko4,hqgzko4,False,[deleted],t3_rqyc0m,https://www.reddit.com/r/MoscowIdaho/comments/rqyc0m/moscow_is_headed_for_a_housing_crash_median_price/,Moscow is headed for a housing crash: Median price higher than Boise & Spokane,/r/MoscowIdaho/comments/rqyc0m/moscow_is_headed_for_a_housing_crash_median_price/hqgzko4/,0,r/MoscowIdaho,0,0
"""And many others before that. ""

&#x200B;

Can you read or is your goal to simply be an a--hole?",t2_cj2iypow,Explosive-0-Diarrhea,0,1640817443.0,0,t1_hqgwzu7,hqgwzu7,False,[deleted],t3_rqyc0m,https://www.reddit.com/r/MoscowIdaho/comments/rqyc0m/moscow_is_headed_for_a_housing_crash_median_price/,Moscow is headed for a housing crash: Median price higher than Boise & Spokane,/r/MoscowIdaho/comments/rqyc0m/moscow_is_headed_for_a_housing_crash_median_price/hqgwzu7/,1,r/MoscowIdaho,0,1
"Evidence? I have purchased and sold dozens of residential and commercial properties in Latah County over 20 years. And many others before that. I have a very good grasp of the microeconomics driving real estate here. Tossing out macroeconomic Fed data is completely irrelevant. Factors like land use ordinances are lost on the Fed, but have very serious implications on supply and demand at the micro level. Go visit Latah Title or Moscow Title. They'll provide you a boat load of ""evidence."" Talk to builders. You won't find a single builder in town who sees the market tanking anytime soon. Building will eventually slow, but prices will level off and not decline.

You keep chasing down those probate lawyers and waiting for the bubble to burst. I wish you luck, as it's going to be a very long wait.",t2_cj2iypow,Explosive-0-Diarrhea,0,1640814877.0,0,t1_hqgqjqc,hqgqjqc,False,[deleted],t3_rqyc0m,https://www.reddit.com/r/MoscowIdaho/comments/rqyc0m/moscow_is_headed_for_a_housing_crash_median_price/,Moscow is headed for a housing crash: Median price higher than Boise & Spokane,/r/MoscowIdaho/comments/rqyc0m/moscow_is_headed_for_a_housing_crash_median_price/hqgqjqc/,1,r/MoscowIdaho,0,1
"The ""crash"" didn't make much of a difference to housing prices in Moscow.",t2_4s3bb3fi,ds1776,0,1640814505.0,0,t1_hqgplfw,hqgplfw,False,[deleted],t3_rqyc0m,https://www.reddit.com/r/MoscowIdaho/comments/rqyc0m/moscow_is_headed_for_a_housing_crash_median_price/,Moscow is headed for a housing crash: Median price higher than Boise & Spokane,/r/MoscowIdaho/comments/rqyc0m/moscow_is_headed_for_a_housing_crash_median_price/hqgplfw/,0,r/MoscowIdaho,0,0
"I'm comparing Moscow to surrounding areas that more closely match the demographics.  Like Pullman, for example.

As long as people are buying, the prices will stand.  \~70 days avg time on market, currently.

You are also discounting that many people moving in that don't actually work in Moscow, have higher than median incomes, etc.",t2_4s3bb3fi,ds1776,0,1640814336.0,0,t1_hqgp6a0,hqgp6a0,False,[deleted],t3_rqyc0m,https://www.reddit.com/r/MoscowIdaho/comments/rqyc0m/moscow_is_headed_for_a_housing_crash_median_price/,Moscow is headed for a housing crash: Median price higher than Boise & Spokane,/r/MoscowIdaho/comments/rqyc0m/moscow_is_headed_for_a_housing_crash_median_price/hqgp6a0/,0,r/MoscowIdaho,0,0
"Just an FYI. Data is derived from Realtor's research unit.

[Realtor Forecast 2022](http://www.realtor.com/research/top-housing-markets-2022/)",t2_cj2iypow,Explosive-0-Diarrhea,0,1640814245.0,0,t1_hqgoxpa,hqgoxpa,False,[deleted],t3_rqyc0m,https://www.reddit.com/r/MoscowIdaho/comments/rqyc0m/moscow_is_headed_for_a_housing_crash_median_price/,Moscow is headed for a housing crash: Median price higher than Boise & Spokane,/r/MoscowIdaho/comments/rqyc0m/moscow_is_headed_for_a_housing_crash_median_price/hqgoxpa/,1,r/MoscowIdaho,0,1
"Read the two paragraphs starting with ""What this holds for the future...."" I'm curious why you are so argumentative? Supply is nearly non-existent and is not going to magically appear given current land ordinances. It is what it is. You're foolish to think prices in Moscow will decline next year. Too much capital is available, and in inflationary markets real estate nearly always increases in price since it is an inflation hedge. Again, Moscow is not Boise or Spokane.",t2_cj2iypow,Explosive-0-Diarrhea,0,1640812573.0,0,t1_hqgkl0k,hqgkl0k,False,[deleted],t3_rqyc0m,https://www.reddit.com/r/MoscowIdaho/comments/rqyc0m/moscow_is_headed_for_a_housing_crash_median_price/,Moscow is headed for a housing crash: Median price higher than Boise & Spokane,/r/MoscowIdaho/comments/rqyc0m/moscow_is_headed_for_a_housing_crash_median_price/hqgkl0k/,1,r/MoscowIdaho,0,1
"They quote an economist who researches the market. Read the entire article. He basically states that there are distortions in the market. There were a ton of complaints 20 years ago when the county commissioners passed the land use ordinances. Many people complained that it would eventually lead to a lack of supply. It's finally come to fruition. Until there are changes to land use laws, you will not see an increase in supply to meet demand. Econ 101.",t2_cj2iypow,Explosive-0-Diarrhea,0,1640810976.0,0,t1_hqggfzr,hqggfzr,False,[deleted],t3_rqyc0m,https://www.reddit.com/r/MoscowIdaho/comments/rqyc0m/moscow_is_headed_for_a_housing_crash_median_price/,Moscow is headed for a housing crash: Median price higher than Boise & Spokane,/r/MoscowIdaho/comments/rqyc0m/moscow_is_headed_for_a_housing_crash_median_price/hqggfzr/,2,r/MoscowIdaho,0,2
"Bubble implies market prices will tank in Moscow. I wouldn't bank on that idea at all given the excessive demand for housing in the Moscow market and the scant supply. Price appreciation will slow down, but prices are highly unlikely to decline unless there is a major change in zoning and land use ordinances - that's what is constraining supply.",t2_cj2iypow,Explosive-0-Diarrhea,0,1640810636.0,0,t1_hqgfjv7,hqgfjv7,False,[deleted],t3_rqyc0m,https://www.reddit.com/r/MoscowIdaho/comments/rqyc0m/moscow_is_headed_for_a_housing_crash_median_price/,Moscow is headed for a housing crash: Median price higher than Boise & Spokane,/r/MoscowIdaho/comments/rqyc0m/moscow_is_headed_for_a_housing_crash_median_price/hqgfjv7/,1,r/MoscowIdaho,0,1
"""Moscow’s Housing Crisis Tightens the Market""

December 7, 2021

https://www.uiargonaut.com/2021/12/07/moscows-housing-crisis-tightens-the-market/",t2_cj2iypow,Explosive-0-Diarrhea,0,1640804269.0,0,t1_hqfz3il,hqfz3il,True,[deleted],t3_rqyc0m,https://www.reddit.com/r/MoscowIdaho/comments/rqyc0m/moscow_is_headed_for_a_housing_crash_median_price/,Moscow is headed for a housing crash: Median price higher than Boise & Spokane,/r/MoscowIdaho/comments/rqyc0m/moscow_is_headed_for_a_housing_crash_median_price/hqfz3il/,1,r/MoscowIdaho,0,1
"Fort Russell is north of 3rd, not south. Try again.",t2_cj2iypow,Explosive-0-Diarrhea,0,1640804171.0,0,t1_hqfyue7,hqfyue7,False,[deleted],t3_rqyc0m,https://www.reddit.com/r/MoscowIdaho/comments/rqyc0m/moscow_is_headed_for_a_housing_crash_median_price/,Moscow is headed for a housing crash: Median price higher than Boise & Spokane,/r/MoscowIdaho/comments/rqyc0m/moscow_is_headed_for_a_housing_crash_median_price/hqfyue7/,1,r/MoscowIdaho,0,1
140 < 176,t2_cj2iypow,Explosive-0-Diarrhea,0,1640803734.0,0,t1_hqfxp44,hqfxp44,False,[deleted],t3_rqyc0m,https://www.reddit.com/r/MoscowIdaho/comments/rqyc0m/moscow_is_headed_for_a_housing_crash_median_price/,Moscow is headed for a housing crash: Median price higher than Boise & Spokane,/r/MoscowIdaho/comments/rqyc0m/moscow_is_headed_for_a_housing_crash_median_price/hqfxp44/,2,r/MoscowIdaho,0,2
How can I contact them? I found an old Facebook page but they don't post and haven't messaged me back. I can't find anything else about them online. I'd love to inquire!,t2_45a5ek0p,classysax4,0,1640803665.0,0,t1_hqfxinv,hqfxinv,False,classysax4,t3_qc99t2,https://www.reddit.com/r/MoscowIdaho/comments/qc99t2/raw_milk_sources/,Raw milk sources?,/r/MoscowIdaho/comments/qc99t2/raw_milk_sources/hqfxinv/,2,r/MoscowIdaho,0,2
"""If Spokane has a housing crisis, why isn’t it being more urgently addressed?""  
April 4, 2021  
[https://www.spokesman.com/stories/2021/apr/04/if-spokane-has-a-housing-crisis-why-isnt-it-being-/](https://www.spokesman.com/stories/2021/apr/04/if-spokane-has-a-housing-crisis-why-isnt-it-being-/)  


Seems this article is 180 degrees opposite of your Econ 101 theory.....",t2_cj2iypow,Explosive-0-Diarrhea,0,1640803594.0,0,t1_hqfxc20,hqfxc20,False,[deleted],t3_rqyc0m,https://www.reddit.com/r/MoscowIdaho/comments/rqyc0m/moscow_is_headed_for_a_housing_crash_median_price/,Moscow is headed for a housing crash: Median price higher than Boise & Spokane,/r/MoscowIdaho/comments/rqyc0m/moscow_is_headed_for_a_housing_crash_median_price/hqfxc20/,1,r/MoscowIdaho,0,1
"Crapuchettes was buying houses south of Sixth Street, not the Fort Russell neighborhood. There have been no homes sold in Fort Russell for $140k in the past two decades. None.",t2_cj2iypow,Explosive-0-Diarrhea,0,1640802930.0,0,t1_hqfvll3,hqfvll3,False,[deleted],t3_rqyc0m,https://www.reddit.com/r/MoscowIdaho/comments/rqyc0m/moscow_is_headed_for_a_housing_crash_median_price/,Moscow is headed for a housing crash: Median price higher than Boise & Spokane,/r/MoscowIdaho/comments/rqyc0m/moscow_is_headed_for_a_housing_crash_median_price/hqfvll3/,2,r/MoscowIdaho,0,2
"Fred data is one metric in a much larger story.

The crash of 08 didn’t impact the real estate market much around here.  Moscow has *always* been more expensive than the surrounding areas.

Why are you comparing completely different “cities”, with different demographics, economics, and populations?  It’s a very simplistic viewpoint.",t2_4s3bb3fi,ds1776,0,1640802777.0,0,t1_hqfv7ag,hqfv7ag,False,[deleted],t3_rqyc0m,https://www.reddit.com/r/MoscowIdaho/comments/rqyc0m/moscow_is_headed_for_a_housing_crash_median_price/,Moscow is headed for a housing crash: Median price higher than Boise & Spokane,/r/MoscowIdaho/comments/rqyc0m/moscow_is_headed_for_a_housing_crash_median_price/hqfv7ag/,1,r/MoscowIdaho,0,1
"There won't be much of a crash except in the mid-range housing market. Many higher end homes are selling for all cash and quick closing - no mortgage. Talk to the title folks, they're the best barometer of the market. Is the current rate of increase unsustainable. Yes. Prices will increase, just at a slower rate. My guess is a 15% increase in 2022 - nothing like 2021. Slightly less if the Fed is very aggressive in tackling inflation, which currently does not look probable.",t2_cj2iypow,Explosive-0-Diarrhea,0,1640802622.0,0,t1_hqfusp5,hqfusp5,False,[deleted],t3_rqyc0m,https://www.reddit.com/r/MoscowIdaho/comments/rqyc0m/moscow_is_headed_for_a_housing_crash_median_price/,Moscow is headed for a housing crash: Median price higher than Boise & Spokane,/r/MoscowIdaho/comments/rqyc0m/moscow_is_headed_for_a_housing_crash_median_price/hqfusp5/,1,r/MoscowIdaho,0,1
"No fundamental economic change in Moscow over the last 5 years?  

Where have you been?  

Moscow has always been priced higher than the surrounding areas.   In 2005 it was impossible to find a decent house for under $250k that wasn't almost a century old. 

""New homeowners"" are not the market makers in Moscow, they never have been.",t2_4s3bb3fi,ds1776,0,1640799795.0,0,t1_hqfnf5y,hqfnf5y,False,[deleted],t3_rqyc0m,https://www.reddit.com/r/MoscowIdaho/comments/rqyc0m/moscow_is_headed_for_a_housing_crash_median_price/,Moscow is headed for a housing crash: Median price higher than Boise & Spokane,/r/MoscowIdaho/comments/rqyc0m/moscow_is_headed_for_a_housing_crash_median_price/hqfnf5y/,1,r/MoscowIdaho,0,1
