body,author_fullname,author.name,controversiality,created,downs,fullname,id,is_root,link_author,link_id,link_permalink,link_title,permalink,score,subreddit_name_prefixed,total_awards_received,ups
It’s apparently a chronic problem random subreddits are having within the standard Reddit app and Reddit isn’t fixing it for some reason. The only fix I found was using the Apollo app instead.,t2_43h8jr7h,dignifiedbagel,0,1643688857.0,0,t1_hv3abzz,hv3abzz,False,wildstubbs,t3_sg32cq,https://www.reddit.com/r/MoscowIdaho/comments/sg32cq/is_there_a_luthier_in_town/,Is there a luthier in town?,/r/MoscowIdaho/comments/sg32cq/is_there_a_luthier_in_town/hv3abzz/,2,r/MoscowIdaho,0,2
"Yeah, sad.  shitty situation.",t2_4s3bb3fi,ds1776,0,1643688846.0,0,t1_hv3ab72,hv3ab72,False,AtOurGates,t3_sgroll,https://www.reddit.com/r/MoscowIdaho/comments/sgroll/patient_dies_in_gritman_er_unable_to_find/,"Patient Dies in Gritman ER, Unable to Find Specialized ICU Care During COVID Surge",/r/MoscowIdaho/comments/sgroll/patient_dies_in_gritman_er_unable_to_find/hv3ab72/,1,r/MoscowIdaho,0,1
Reading the Spokesman article the issue was the dialysis bed. Typically Tri-state in Clarkston or St. Joe's in Lewiston( staffed by tristate dialysis nurses) would have dialysis ICU beds but due to staffing shortages they discontinued that a few months ago. Which is quite frankly terrifying.,t2_s2faf7e,thatot,0,1643688455.0,0,t1_hv39ihx,hv39ihx,False,AtOurGates,t3_sgroll,https://www.reddit.com/r/MoscowIdaho/comments/sgroll/patient_dies_in_gritman_er_unable_to_find/,"Patient Dies in Gritman ER, Unable to Find Specialized ICU Care During COVID Surge",/r/MoscowIdaho/comments/sgroll/patient_dies_in_gritman_er_unable_to_find/hv39ihx/,2,r/MoscowIdaho,0,2
In remission also according to the obit,t2_s2faf7e,thatot,0,1643687963.0,0,t1_hv38i51,hv38i51,False,AtOurGates,t3_sgroll,https://www.reddit.com/r/MoscowIdaho/comments/sgroll/patient_dies_in_gritman_er_unable_to_find/,"Patient Dies in Gritman ER, Unable to Find Specialized ICU Care During COVID Surge",/r/MoscowIdaho/comments/sgroll/patient_dies_in_gritman_er_unable_to_find/hv38i51/,1,r/MoscowIdaho,0,1
Thanks for that. My guess is the story I heard was circulating because people were butthurt about being called out for being unvaxxed.,t2_boapisbu,crazyidahopuglady,0,1643687706.0,0,t1_hv37yqr,hv37yqr,False,AtOurGates,t3_sgroll,https://www.reddit.com/r/MoscowIdaho/comments/sgroll/patient_dies_in_gritman_er_unable_to_find/,"Patient Dies in Gritman ER, Unable to Find Specialized ICU Care During COVID Surge",/r/MoscowIdaho/comments/sgroll/patient_dies_in_gritman_er_unable_to_find/hv37yqr/,7,r/MoscowIdaho,0,7
She had sepsis(pneumonia). Her cancer was in remission.,t2_s2faf7e,thatot,0,1643687622.0,0,t1_hv37sbp,hv37sbp,False,AtOurGates,t3_sgroll,https://www.reddit.com/r/MoscowIdaho/comments/sgroll/patient_dies_in_gritman_er_unable_to_find/,"Patient Dies in Gritman ER, Unable to Find Specialized ICU Care During COVID Surge",/r/MoscowIdaho/comments/sgroll/patient_dies_in_gritman_er_unable_to_find/hv37sbp/,2,r/MoscowIdaho,0,2
"There was a follow up article in the Lewiston Tribune about what actually happened.https://lmtribune.com/northwest/a-pandemic-casualty/article_13a3256b-b05b-5cf7-bfbe-e45dc13e9e2a.html

It's behind a paywall.

So here is the gist:

She did not die of cancer. She died of sepsis more specifically pneumonia. They couldn't find the type of ICU bed she needed in three states.

There is absolutely nothing about her being on hospice or palliative care.",t2_s2faf7e,thatot,0,1643687567.0,0,t1_hv37o6k,hv37o6k,False,AtOurGates,t3_sgroll,https://www.reddit.com/r/MoscowIdaho/comments/sgroll/patient_dies_in_gritman_er_unable_to_find/,"Patient Dies in Gritman ER, Unable to Find Specialized ICU Care During COVID Surge",/r/MoscowIdaho/comments/sgroll/patient_dies_in_gritman_er_unable_to_find/hv37o6k/,7,r/MoscowIdaho,0,7
"Oh no, the Thai place is closed for good? I heard Champions was bought. Tapped peeps bought the old music store building (rumor is lots of work needs to be done there) and the Maialina owners are still working on the Garden remodel. I would guess it takes times to remodel? Maybe waiting for spring reopening? Maybe too many employees sick?",t2_4i2ojgsm,sramella2000,0,1643684807.0,0,t1_hv31omt,hv31omt,True,zioxusOne,t3_shjsez,https://www.reddit.com/r/MoscowIdaho/comments/shjsez/downtown/,Downtown,/r/MoscowIdaho/comments/shjsez/downtown/hv31omt/,7,r/MoscowIdaho,0,7
Got it!  Fixed.,t2_3gddl,AtOurGates,0,1643672173.0,0,t1_hv292s4,hv292s4,False,AtOurGates,t3_sh8mpo,https://www.reddit.com/r/MoscowIdaho/comments/sh8mpo/food_delivery_robots_come_to_the_u_of_i_campus/,Food Delivery Robots Come to the U of I Campus,/r/MoscowIdaho/comments/sh8mpo/food_delivery_robots_come_to_the_u_of_i_campus/hv292s4/,1,r/MoscowIdaho,0,1
"That's midterms then spring break, not finals.",t2_31snc,Nuttyguy,0,1643671126.0,0,t1_hv26lti,hv26lti,False,AtOurGates,t3_sh8mpo,https://www.reddit.com/r/MoscowIdaho/comments/sh8mpo/food_delivery_robots_come_to_the_u_of_i_campus/,Food Delivery Robots Come to the U of I Campus,/r/MoscowIdaho/comments/sh8mpo/food_delivery_robots_come_to_the_u_of_i_campus/hv26lti/,1,r/MoscowIdaho,0,1
I saw the one when driving through campus this weekend,t2_yyoec,digikookie,0,1643670490.0,0,t1_hv2520x,hv2520x,True,AtOurGates,t3_sh8mpo,https://www.reddit.com/r/MoscowIdaho/comments/sh8mpo/food_delivery_robots_come_to_the_u_of_i_campus/,Food Delivery Robots Come to the U of I Campus,/r/MoscowIdaho/comments/sh8mpo/food_delivery_robots_come_to_the_u_of_i_campus/hv2520x/,1,r/MoscowIdaho,0,1
Is that wrong?   Was just going off of [this](https://www.uidaho.edu/events/academic-calendar).,t2_3gddl,AtOurGates,0,1643661492.0,0,t1_hv1hv1r,hv1hv1r,False,AtOurGates,t3_sh8mpo,https://www.reddit.com/r/MoscowIdaho/comments/sh8mpo/food_delivery_robots_come_to_the_u_of_i_campus/,Food Delivery Robots Come to the U of I Campus,/r/MoscowIdaho/comments/sh8mpo/food_delivery_robots_come_to_the_u_of_i_campus/hv1hv1r/,1,r/MoscowIdaho,0,1
">before finals begin"", which start on March 7th

As a UI senior, that's news to me",t2_olprw,Jordaneer,0,1643660118.0,0,t1_hv1e7uh,hv1e7uh,True,AtOurGates,t3_sh8mpo,https://www.reddit.com/r/MoscowIdaho/comments/sh8mpo/food_delivery_robots_come_to_the_u_of_i_campus/,Food Delivery Robots Come to the U of I Campus,/r/MoscowIdaho/comments/sh8mpo/food_delivery_robots_come_to_the_u_of_i_campus/hv1e7uh/,2,r/MoscowIdaho,0,2
"It's entirely possible my source was wrong and she had more time left had she been able to get treatment. When a loved one is dying, you still want as much time with them as you can. I wasn't going for callous disregard.",t2_boapisbu,crazyidahopuglady,0,1643658952.0,0,t1_hv1b4b7,hv1b4b7,False,AtOurGates,t3_sgroll,https://www.reddit.com/r/MoscowIdaho/comments/sgroll/patient_dies_in_gritman_er_unable_to_find/,"Patient Dies in Gritman ER, Unable to Find Specialized ICU Care During COVID Surge",/r/MoscowIdaho/comments/sgroll/patient_dies_in_gritman_er_unable_to_find/hv1b4b7/,1,r/MoscowIdaho,0,1
"I'm only going by what's in the article, and certainly she was facing complicated health challenges. 

The article says: 

> It’s not clear whether Ripley would have survived had the services she needed been available.

> “Maybe she would have lived, maybe she wouldn’t have,” Eiselein said. “But she didn’t even have a chance.”

With the clear disclaimer that I'm not a physician or have any medical training, it sounds like what she needed was CRRT, Continuous renal replacement therapy, or KRT, Kidney Replacement therapy, from the article, which says: 

> What she needed now was an intensive-care unit bed that provided continuous dialysis, said her father, Kai Eiselein – something Gritman does not have.

It looks like CRRT is something that a percentage of Covid-patients require.  [Here's an article](https://www.frontiersin.org/articles/10.3389/fmed.2020.604182/full) in a peer-reviewed medical journal about strategies for optimizing CRRT during the pandemic, which notes: 

> The unprecedented surge of nephrology inpatients needing kidney replacement therapy placed hospital systems under extreme stress during the COVID-19 pandemic. 

So yes, certainly, this wasn't an otherwise healthy person who just needed some kind of minor care.  On the other hand, it seems very credible that the care she needed was unavailable because (likely unvaccinated) COVID-19 patients were using up the available ICU beds with CRRT capabilities in the region.",t2_3gddl,AtOurGates,0,1643650132.0,0,t1_hv0n8y8,hv0n8y8,False,AtOurGates,t3_sgroll,https://www.reddit.com/r/MoscowIdaho/comments/sgroll/patient_dies_in_gritman_er_unable_to_find/,"Patient Dies in Gritman ER, Unable to Find Specialized ICU Care During COVID Surge",/r/MoscowIdaho/comments/sgroll/patient_dies_in_gritman_er_unable_to_find/hv0n8y8/,3,r/MoscowIdaho,0,3
"I'm super pro-vaccine and very COVID cautious, but my understanding was that she was on hospice and had only opted for palliative care so she could die at home. There was really nothing an ICU bed could have accomplished.

That being said, the fact remains that we were out of ICU beds, regardless of what they were needed for.",t2_boapisbu,crazyidahopuglady,0,1643646543.0,0,t1_hv0dklo,hv0dklo,True,AtOurGates,t3_sgroll,https://www.reddit.com/r/MoscowIdaho/comments/sgroll/patient_dies_in_gritman_er_unable_to_find/,"Patient Dies in Gritman ER, Unable to Find Specialized ICU Care During COVID Surge",/r/MoscowIdaho/comments/sgroll/patient_dies_in_gritman_er_unable_to_find/hv0dklo/,1,r/MoscowIdaho,0,1
"She had ""beat it into remission"" but I'm not sure if she had been clear long enough to get it.",t2_q0lwm,lizziemeg,0,1643636177.0,0,t1_huzp172,huzp172,False,AtOurGates,t3_sgroll,https://www.reddit.com/r/MoscowIdaho/comments/sgroll/patient_dies_in_gritman_er_unable_to_find/,"Patient Dies in Gritman ER, Unable to Find Specialized ICU Care During COVID Surge",/r/MoscowIdaho/comments/sgroll/patient_dies_in_gritman_er_unable_to_find/huzp172/,2,r/MoscowIdaho,0,2
Stage 4 according to the obit.,t2_4s3bb3fi,ds1776,0,1643631990.0,0,t1_huzhfq0,huzhfq0,False,AtOurGates,t3_sgroll,https://www.reddit.com/r/MoscowIdaho/comments/sgroll/patient_dies_in_gritman_er_unable_to_find/,"Patient Dies in Gritman ER, Unable to Find Specialized ICU Care During COVID Surge",/r/MoscowIdaho/comments/sgroll/patient_dies_in_gritman_er_unable_to_find/huzhfq0/,-1,r/MoscowIdaho,0,-1
She may have been in a battle with cancer according to the obituary. Rest in peace. Truly sad.,t2_onl2x,biggreen96,0,1643615691.0,0,t1_huyw37e,huyw37e,False,AtOurGates,t3_sgroll,https://www.reddit.com/r/MoscowIdaho/comments/sgroll/patient_dies_in_gritman_er_unable_to_find/,"Patient Dies in Gritman ER, Unable to Find Specialized ICU Care During COVID Surge",/r/MoscowIdaho/comments/sgroll/patient_dies_in_gritman_er_unable_to_find/huyw37e/,2,r/MoscowIdaho,0,2
Was she vaccinated? I hope peace on her family in the tragic time.,t2_97irg,babb4214,0,1643612261.0,0,t1_huyrc4o,huyrc4o,False,AtOurGates,t3_sgroll,https://www.reddit.com/r/MoscowIdaho/comments/sgroll/patient_dies_in_gritman_er_unable_to_find/,"Patient Dies in Gritman ER, Unable to Find Specialized ICU Care During COVID Surge",/r/MoscowIdaho/comments/sgroll/patient_dies_in_gritman_er_unable_to_find/huyrc4o/,2,r/MoscowIdaho,0,2
"I've been listening to my roommate for the past hour explain, among other things, how COVID isn't really that dangerous and the vaccine shouldn't be required.

Fucking idiots, all of them.",t2_4ayot121,TheCardgageCurse,0,1643603955.0,0,t1_huydeha,huydeha,False,AtOurGates,t3_sgroll,https://www.reddit.com/r/MoscowIdaho/comments/sgroll/patient_dies_in_gritman_er_unable_to_find/,"Patient Dies in Gritman ER, Unable to Find Specialized ICU Care During COVID Surge",/r/MoscowIdaho/comments/sgroll/patient_dies_in_gritman_er_unable_to_find/huydeha/,14,r/MoscowIdaho,0,14
"The first paragraph of her [obituary](https://lmtribune.com/obituaries/katherine-jane-eiselein-ripley/article_92b7eb34-c13b-59d0-824d-635e8dd12501.html) is direct and needfully blunt, written by her father: 

>	Katherine Jane Ripley, 33, died Friday, Jan. 7, 2022, in the ER of Gritman Medical Center surrounded by family members after spending more than 20 hours waiting for an ICU bed to open up somewhere in Idaho, Montana or Washington. There were no beds available, thanks to unvaccinated COVID-19 patients.

[…]

>	Please, get vaccinated against COVID-19 — your actions really do affect others.",t2_3gddl,AtOurGates,0,1643601734.0,0,t1_huy8xcp,huy8xcp,True,AtOurGates,t3_sgroll,https://www.reddit.com/r/MoscowIdaho/comments/sgroll/patient_dies_in_gritman_er_unable_to_find/,"Patient Dies in Gritman ER, Unable to Find Specialized ICU Care During COVID Surge",/r/MoscowIdaho/comments/sgroll/patient_dies_in_gritman_er_unable_to_find/huy8xcp/,23,r/MoscowIdaho,0,23
"Yes, I’m on mobile (on iOS). It still didn’t work! I also tried uninstalling and reinstalling the app. This is so weird, it only does it with this subreddit",t2_5ecagfk5,poofykit,0,1643579238.0,0,t1_huwogmo,huwogmo,False,wildstubbs,t3_sg32cq,https://www.reddit.com/r/MoscowIdaho/comments/sg32cq/is_there_a_luthier_in_town/,Is there a luthier in town?,/r/MoscowIdaho/comments/sg32cq/is_there_a_luthier_in_town/huwogmo/,1,r/MoscowIdaho,0,1
"Not a mod, but the subreddit loads fine for me in both Old and New Reddit on desktop, and RIF on Android. Are you using an app? If so, might try clearing your cache.",t2_g1osj,JuDGe3690,0,1643571383.0,0,t1_huw3ese,huw3ese,False,wildstubbs,t3_sg32cq,https://www.reddit.com/r/MoscowIdaho/comments/sg32cq/is_there_a_luthier_in_town/,Is there a luthier in town?,/r/MoscowIdaho/comments/sg32cq/is_there_a_luthier_in_town/huw3ese/,1,r/MoscowIdaho,0,1
Thanks!,t2_pchi3,wildstubbs,0,1643570983.0,0,t1_huw2cv3,huw2cv3,False,wildstubbs,t3_sg32cq,https://www.reddit.com/r/MoscowIdaho/comments/sg32cq/is_there_a_luthier_in_town/,Is there a luthier in town?,/r/MoscowIdaho/comments/sg32cq/is_there_a_luthier_in_town/huw2cv3/,2,r/MoscowIdaho,0,2
"Looks promising, thanks so much!",t2_pchi3,wildstubbs,0,1643570831.0,0,t1_huw1ype,huw1ype,False,wildstubbs,t3_sg32cq,https://www.reddit.com/r/MoscowIdaho/comments/sg32cq/is_there_a_luthier_in_town/,Is there a luthier in town?,/r/MoscowIdaho/comments/sg32cq/is_there_a_luthier_in_town/huw1ype/,2,r/MoscowIdaho,0,2
"Hey @Mods, unrelated to this post unfortunately, but I cannot even load the main group page. I have to go on browser and Google “r/MoscowIdaho” and click on individual posts to see things. Do y’all have any advice?",t2_5ecagfk5,poofykit,0,1643564635.0,0,t1_huvlmjv,huvlmjv,True,wildstubbs,t3_sg32cq,https://www.reddit.com/r/MoscowIdaho/comments/sg32cq/is_there_a_luthier_in_town/,Is there a luthier in town?,/r/MoscowIdaho/comments/sg32cq/is_there_a_luthier_in_town/huvlmjv/,1,r/MoscowIdaho,0,1
Not sure if this guy is still active. http://dastringedinstruments.com/,t2_1kbq5y6w,MercurialManatee,0,1643531043.0,0,t1_hutw6c1,hutw6c1,True,wildstubbs,t3_sg32cq,https://www.reddit.com/r/MoscowIdaho/comments/sg32cq/is_there_a_luthier_in_town/,Is there a luthier in town?,/r/MoscowIdaho/comments/sg32cq/is_there_a_luthier_in_town/hutw6c1/,3,r/MoscowIdaho,0,3
I don't think there's one in moscow but you could try Atom Heart Music in Pullman? On their website it looks like they do repairs for violins.,t2_6etzdoss,Cat-Clawz,0,1643525269.0,0,t1_huto6kc,huto6kc,True,wildstubbs,t3_sg32cq,https://www.reddit.com/r/MoscowIdaho/comments/sg32cq/is_there_a_luthier_in_town/,Is there a luthier in town?,/r/MoscowIdaho/comments/sg32cq/is_there_a_luthier_in_town/huto6kc/,7,r/MoscowIdaho,0,7
"""He is married to a woman who was Christ Church (her family is still there). As a boss, he's known for being demanding to outright abusive to his employees (angry texts in the middle of the night, often fires his workers). To his tenants, he's known to be a heavy drinker who doesn't always hold up his end of the lease agreement. As someone who went to church with him and had conversations with him, I think he is a baby Christian who severely lacks self control and has an ego problem.""

To add to this: he's a born again Christian. Sucked in by a Bible study that basically paid his way out of alcoholism -(sounds like that's ati a problem though). He is a landlord but he's terrible at business and just as bad at being a landlord. His rental company has changed names a few times due to the absolute shit reviews it has recieved from angry tenants—a while back his brother took off with most of the money he made from the rental company cause, you guessed it! He's also pos. 

He's known for not taking care of rentals and making new tenants pay for the shit they recieved and not giving back their deposits. In short, he's a slum lord. In my opinion, he's one of the worst— walking around saying he's a Christian when he's a pos. 

One of his businesses (Sliced I think it was/is called) had a trans (f to m) employee who basically held the business together. To this day he calls them by their dead name, refuses to use they/them and goes out of his way to do so. 

A while ago his wife (and him) publicly said they were pro-lifers on Slice and biscuit's Facebook page. Not only that, they basically called anyone who is in a situation where they may need an abortion sluts/whores. It was a giant mess and they deleted the post but then dug their heels in more when there was a public backlash. 

Long story short, he's a pos.",t2_8w3iltew,Mental-Pollution-92,0,1643410368.0,0,t1_hunamxl,hunamxl,False,-Sobrietist-,t3_s06fp2,https://www.reddit.com/r/MoscowIdaho/comments/s06fp2/if_i_shouldnt_go_to_christ_church_what_are_the/,"If I shouldn't go to Christ Church, what are the best bible believing churches in Moscow?",/r/MoscowIdaho/comments/s06fp2/if_i_shouldnt_go_to_christ_church_what_are_the/hunamxl/,2,r/MoscowIdaho,0,2
"He is married to a woman who was Christ Church (her family is still there). As a boss, he's known for being demanding to outright abusive to his employees (angry texts in the middle of the night, often fires his workers). To his tenants, he's known to be a heavy drinker who doesn't always hold up his end of the lease agreement. As someone who went to church with him and had conversations with him, I think he is a baby Christian who severely lacks self control and has an ego problem.",t2_efw8ck4z,bomdigitee,0,1643407167.0,0,t1_hun2p4p,hun2p4p,False,-Sobrietist-,t3_s06fp2,https://www.reddit.com/r/MoscowIdaho/comments/s06fp2/if_i_shouldnt_go_to_christ_church_what_are_the/,"If I shouldn't go to Christ Church, what are the best bible believing churches in Moscow?",/r/MoscowIdaho/comments/s06fp2/if_i_shouldnt_go_to_christ_church_what_are_the/hun2p4p/,4,r/MoscowIdaho,0,4
What is Matt's reputation? I got a weird vibe from him and don't know anyone that can tell me the local history.,t2_tbfr36,screenprinting_guy,0,1643406577.0,0,t1_hun172d,hun172d,False,-Sobrietist-,t3_s06fp2,https://www.reddit.com/r/MoscowIdaho/comments/s06fp2/if_i_shouldnt_go_to_christ_church_what_are_the/,"If I shouldn't go to Christ Church, what are the best bible believing churches in Moscow?",/r/MoscowIdaho/comments/s06fp2/if_i_shouldnt_go_to_christ_church_what_are_the/hun172d/,1,r/MoscowIdaho,0,1
What is Matt's reputation? I got a weird vibe from him and don't know anyone that can tell me the local history.,t2_tbfr36,screenprinting_guy,0,1643406561.0,0,t1_hun15oe,hun15oe,False,-Sobrietist-,t3_s06fp2,https://www.reddit.com/r/MoscowIdaho/comments/s06fp2/if_i_shouldnt_go_to_christ_church_what_are_the/,"If I shouldn't go to Christ Church, what are the best bible believing churches in Moscow?",/r/MoscowIdaho/comments/s06fp2/if_i_shouldnt_go_to_christ_church_what_are_the/hun15oe/,2,r/MoscowIdaho,0,2
7 Devils burger at Zoe’s in Pullman!,t2_a7oet5op,Stunning-Trade5316,0,1643350678.0,0,t1_hujtggh,hujtggh,True,QuinterBoopson,t3_sazuyi,https://www.reddit.com/r/MoscowIdaho/comments/sazuyi/fair_burger_in_town/,Fair burger in town?,/r/MoscowIdaho/comments/sazuyi/fair_burger_in_town/hujtggh/,1,r/MoscowIdaho,0,1
I heard someone knocked down or ran into a cell tower hence all the trucks,t2_6cmmvwqa,kybanz,0,1643340028.0,0,t1_huj8mys,huj8mys,True,Jordaneer,t3_sb4ib9,https://www.reddit.com/r/MoscowIdaho/comments/sb4ib9/is_verizon_down_for_yall/,Is Verizon down for y'all?,/r/MoscowIdaho/comments/sb4ib9/is_verizon_down_for_yall/huj8mys/,1,r/MoscowIdaho,0,1
Best burgers are at Tapped.,t2_b3ar7,tekhak,0,1643254061.0,0,t1_hue44t8,hue44t8,True,QuinterBoopson,t3_sazuyi,https://www.reddit.com/r/MoscowIdaho/comments/sazuyi/fair_burger_in_town/,Fair burger in town?,/r/MoscowIdaho/comments/sazuyi/fair_burger_in_town/hue44t8/,2,r/MoscowIdaho,0,2
We're just being inundated with right wing Christian supremacists so I had to question.,t2_7kuhjhts,Mosiedog,0,1643171462.0,0,t1_hu95acw,hu95acw,False,Particular_Alfalfa_2,t3_scduzq,https://www.reddit.com/r/MoscowIdaho/comments/scduzq/friendly_dog_off_leash_areas_near_moscow/,Friendly Dog Off Leash Areas near Moscow,/r/MoscowIdaho/comments/scduzq/friendly_dog_off_leash_areas_near_moscow/hu95acw/,3,r/MoscowIdaho,0,3
"No, they're still open (off the Jackson Street parking lot near Wells Fargo). They bought that building a while ago and were my landlords before I moved to Boise for law school. Their Instagram pages (White Pine Guides and White Pine Gear) are both pretty active.",t2_g1osj,JuDGe3690,0,1643169554.0,0,t1_hu91azj,hu91azj,False,Particular_Alfalfa_2,t3_scduzq,https://www.reddit.com/r/MoscowIdaho/comments/scduzq/friendly_dog_off_leash_areas_near_moscow/,Friendly Dog Off Leash Areas near Moscow,/r/MoscowIdaho/comments/scduzq/friendly_dog_off_leash_areas_near_moscow/hu91azj/,2,r/MoscowIdaho,0,2
Mountainview Park,t2_3z1jg,SuggestiveMaterial,0,1643161761.0,0,t1_hu8jcjv,hu8jcjv,True,Particular_Alfalfa_2,t3_scduzq,https://www.reddit.com/r/MoscowIdaho/comments/scduzq/friendly_dog_off_leash_areas_near_moscow/,Friendly Dog Off Leash Areas near Moscow,/r/MoscowIdaho/comments/scduzq/friendly_dog_off_leash_areas_near_moscow/hu8jcjv/,2,r/MoscowIdaho,0,2
"I known many of them for 20 years too they just switch gears a little when you bring the dogs around. Plus the ones that mention ”I’m with Friends of Phillips Farm and…” probably aren’t “with” them as much as they just really need to say something about dogs running around. To be fair, I’m one of the many folks who still goes out there multiple times a week who know what the signs say but I still let my dogs run around!",t2_dczj6397,OutsideMoscow,0,1643159765.0,0,t1_hu8emz9,hu8emz9,False,Particular_Alfalfa_2,t3_scduzq,https://www.reddit.com/r/MoscowIdaho/comments/scduzq/friendly_dog_off_leash_areas_near_moscow/,Friendly Dog Off Leash Areas near Moscow,/r/MoscowIdaho/comments/scduzq/friendly_dog_off_leash_areas_near_moscow/hu8emz9/,1,r/MoscowIdaho,0,1
I think White Pine closed? Someone said that at the New Year's party I was at. Anyone know?,t2_hy7nsa1r,IdahoWillCrashFirst,0,1643159583.0,0,t1_hu8e7dr,hu8e7dr,False,Particular_Alfalfa_2,t3_scduzq,https://www.reddit.com/r/MoscowIdaho/comments/scduzq/friendly_dog_off_leash_areas_near_moscow/,Friendly Dog Off Leash Areas near Moscow,/r/MoscowIdaho/comments/scduzq/friendly_dog_off_leash_areas_near_moscow/hu8e7dr/,1,r/MoscowIdaho,0,1
"Hahahahahah! I know many of the Friends of Phillips Farm folks. Never heard those sweet retired hippies called ""confrontational"" before.

Says more about the commenter than the ""Friends"".",t2_hy7nsa1r,IdahoWillCrashFirst,0,1643159453.0,0,t1_hu8dvze,hu8dvze,False,Particular_Alfalfa_2,t3_scduzq,https://www.reddit.com/r/MoscowIdaho/comments/scduzq/friendly_dog_off_leash_areas_near_moscow/,Friendly Dog Off Leash Areas near Moscow,/r/MoscowIdaho/comments/scduzq/friendly_dog_off_leash_areas_near_moscow/hu8dvze/,1,r/MoscowIdaho,0,1
#1 tie: Cougar Country in Pullman or Effie's in Lewiston.,t2_hy7nsa1r,IdahoWillCrashFirst,0,1643159206.0,0,t1_hu8db46,hu8db46,True,QuinterBoopson,t3_sazuyi,https://www.reddit.com/r/MoscowIdaho/comments/sazuyi/fair_burger_in_town/,Fair burger in town?,/r/MoscowIdaho/comments/sazuyi/fair_burger_in_town/hu8db46/,2,r/MoscowIdaho,0,2
Laird park area is accessible and nice. There was a low intensity fire (yay mushrooms!) there last year but most of the area was missed. Unfortunately there is a lot of logging in the easily accessible areas so wildlife and scenery isn't what it used to be. But the palouse ranger district is easily accessible. Also the Potlatch river trail (also being logged in parts :( but cest la vie) is a great accessible area.,t2_tvynk,zelozelos,0,1643138421.0,0,t1_hu6wcb0,hu6wcb0,True,Particular_Alfalfa_2,t3_scduzq,https://www.reddit.com/r/MoscowIdaho/comments/scduzq/friendly_dog_off_leash_areas_near_moscow/,Friendly Dog Off Leash Areas near Moscow,/r/MoscowIdaho/comments/scduzq/friendly_dog_off_leash_areas_near_moscow/hu6wcb0/,2,r/MoscowIdaho,0,2
"You'll be fine, Moscow is a great community! Stop in and talk to Tyler at White spine and he can shoot you in good directions too!",t2_deohy,MockingbirdRambler,0,1643125733.0,0,t1_hu5yd37,hu5yd37,False,Particular_Alfalfa_2,t3_scduzq,https://www.reddit.com/r/MoscowIdaho/comments/scduzq/friendly_dog_off_leash_areas_near_moscow/,Friendly Dog Off Leash Areas near Moscow,/r/MoscowIdaho/comments/scduzq/friendly_dog_off_leash_areas_near_moscow/hu5yd37/,2,r/MoscowIdaho,0,2
Upvote for the updated information. I haven't been in Moscow since 2018.,t2_deohy,MockingbirdRambler,0,1643125684.0,0,t1_hu5y8cb,hu5y8cb,False,Particular_Alfalfa_2,t3_scduzq,https://www.reddit.com/r/MoscowIdaho/comments/scduzq/friendly_dog_off_leash_areas_near_moscow/,Friendly Dog Off Leash Areas near Moscow,/r/MoscowIdaho/comments/scduzq/friendly_dog_off_leash_areas_near_moscow/hu5y8cb/,1,r/MoscowIdaho,0,1
