body,author_fullname,author.name,controversiality,created,downs,fullname,id,is_root,link_author,link_id,link_permalink,link_title,permalink,score,subreddit_name_prefixed,total_awards_received,ups
"First they kick out Bloom, then ruin their final day of business party.. The mental gymnastics involved in the spin on this...",t2_boapisbu,crazyidahopuglady,0,1638906869.0,0,t1_hnmpx4x,hnmpx4x,True,tekhak,t3_rb7jz2,https://www.reddit.com/r/MoscowIdaho/comments/rb7jz2/faithwire_wrote_an_article_about_the_christmas/,FaithWire wrote an article about the Christmas Caroling event this weekend.,/r/MoscowIdaho/comments/rb7jz2/faithwire_wrote_an_article_about_the_christmas/hnmpx4x/,25,r/MoscowIdaho,0,25
"Ok, I dove in.  Here are the lowlights. 

This is an interview with Mike and Kathryn Church (Mike is a Deacon at Christ Church, the owner of Kestrel Realty, Kathryn is the owner of Kathryn Church Designs, a graduate of Logos and NSA, and the daughter of Tom Garfield, former Logos teacher and Superintendant, and the current owner of Heritage Arts Academy), and Andrew Crapuchettes (Elder at Christ Church, Founder and former CEO of EMSI, founder of ""It's OK to be racist"" job board Redballoon, and developer of the new Edington housing development going in across from the Arboretum).  

* 05:15 - Crapuchettes compares New York, Seattle and Portland to East Germany. 
* 05:20 - Crapuchettes says he didn't use a .com domain because com sounds like communists, and ""we are not communists, we are people who work!"" - This is a joke, but illustrative of how anything Doug Wilson and his followers brand anything they don't like as ""communism"" (or more recently Marxism).  
* 05:45 - Crapuchettes: ""Unfortunately, in Amerca today, if you just hire someone off the street, there's a good chance they're going to be a total whiner, especially if they're young and a Gen X or a Gen Z [...] those people are probably going to be a whiner, and that are going to be in your HR department all the time talking about all the things that they really wish that they have, and they don't [...] I want to hire people that are going to focus on the work that needs to be done, and not on all of their snowflake-based complaints""
* 07:10 - Crapuchettes: ""The war for labor is over, and labor has won. You have a systematic government overreach with has caused people to lose their desire to work, or they've been told they're not allowed to work because they don't have the right vaccination status.""
* 10:10 - Crapuchettes: ""I have many thousands of people who follow me on LinkedIn...""   (Not particularly relevant, just, awesome for him to show us how awesome he is.
* 10:40 - Crapuchettes tells the story of a poor persecuted employer who says, ""If they knew my Christian beliefs, I would probably be fired. And it would be for another reason. But I know that that would happen.""  (This group seems to get really confused about what a protected class is and isn't a protected class in this country. Also, love to portray being ""a white male Christian"" as being the most persecuted people in the world. No one suffers more discrimination.) 
* 10:55 - Crapuchettes: ""I've gotten lots of messages from executives around the country who said, I love what you're doing. But I can't like what you're doing if you know what I mean.""  (News alert: many executives are shitty people who would like to exploit their workers)
* 10:58 - Crapuchettes: ""I start getting messages from people, a guy in Florida in particular who works for the Florida government. He said, hey, do you have a list of non-woke businesses because I want to not only work for them, but I want to invest with them, and I want to shop with them.""  (Just to be clear, ""Non-Woke"" is code for ""allow racism and harassment"")

Here's the bit I'm guessing /u/NoCultID is referring to: 

* 11:50 - Crapuchettes: ""I've talked to a number of individuals who are tired of having their money parked in mutual fund. And they say, hey, are there businesses in my community in Moscow that I can invest in with the business that I care about and with people that I care about rather than just parking money in the markets for them to use it for nefarious things.""
* 13:11 - Crapuchettes: ""Editington is the name of the housing development, and it's named after a battle where Alfred the Great beat back the Barbarian hordes to save Christian England. So that's where the name comes from. And the sword and the sword and the whole thing. Yeah. White Horse and King Knight, whatever.
* 19:22 - Crapuchettes makes his same .com / communist joke again, in case we missed it the first time. 
* 21:04 - Crapuchettes: ""We are now at almost a quarter million people have been on Red balloon in two and a half months looking for freedom, right? For freedom, for their work. Freedom where they're going to go. I actually talked to a sorry I'll mention a competitor briefly, but Conservative Move is a huge company based in Texas, and all they do is help people facilitate moving them from blue States to red States. And they have 400 agents, and they help them sell their house in New York and buy one in Tennessee. And it's a concierge service for Conservatives who are sick of it.""
* 22:00 - Crapuchettes talks about ""employee freedom"" which he says liberals stole from conservatives, and promotes Redballoon's employer pledge, which is: 

> By registering for RedBalloon’s Job Board and/or Marketplace services, you as an employer commit to neither discriminate against your employees’ personal beliefs, infringe on their constitutional rights, invade their medical privacy, or make vaccination a condition of employment. Thank you for standing for freedom - for your business, for your employees, and for America.

That's basically it.  I'd like half-an-hour of my life back.  

TL;DR:  Crapuchettes would like to help other people exploit their workforce, bring investment money into Moscow for ""non woke"" businesses and get lots of people to live in his housing development that's a clever reference to Christians defeating ""barbarian hordes.""",t2_3gddl,AtOurGates,0,1638906061.0,0,t1_hnmo45x,hnmo45x,False,NoCultID,t3_rait2i,https://www.reddit.com/r/MoscowIdaho/comments/rait2i/i_guess_the_cult_thinks_we_are_the_barbarian/,I guess the cult thinks we are the Barbarian Hordes they need to vanquish?,/r/MoscowIdaho/comments/rait2i/i_guess_the_cult_thinks_we_are_the_barbarian/hnmo45x/,4,r/MoscowIdaho,2,4
"Beep. Boop. I'm a robot.
Here's a copy of 

###[The Bible](https://snewd.com/ebooks/the-king-james-bible/)

Was I a good bot? | [info](https://www.reddit.com/user/Reddit-Book-Bot/) | [More Books](https://old.reddit.com/user/Reddit-Book-Bot/comments/i15x1d/full_list_of_books_and_commands/)",t2_7hrja4bn,Reddit-Book-Bot,0,1638904682.0,0,t1_hnmkzft,hnmkzft,False,NoCultID,t3_rait2i,https://www.reddit.com/r/MoscowIdaho/comments/rait2i/i_guess_the_cult_thinks_we_are_the_barbarian/,I guess the cult thinks we are the Barbarian Hordes they need to vanquish?,/r/MoscowIdaho/comments/rait2i/i_guess_the_cult_thinks_we_are_the_barbarian/hnmkzft/,0,r/MoscowIdaho,0,0
To my knowledge they only have 1 pullman business.,t2_efw8ck4z,bomdigitee,0,1638903897.0,0,t1_hnmj5e8,hnmj5e8,True,[deleted],t3_rb0j6e,https://www.reddit.com/r/MoscowIdaho/comments/rb0j6e/pullman_influence/,Pullman Influence,/r/MoscowIdaho/comments/rb0j6e/pullman_influence/hnmj5e8/,6,r/MoscowIdaho,0,6
"I know a few years ago when Pullman regional hospital asked the residents of Pullman to weigh in on whether or not they should offer gender reaffirming surgery, CC went all in with campaigns to stop the surgeries. Claiming it was against their own religion.",t2_3z1jg,SuggestiveMaterial,0,1638902311.0,0,t1_hnmfex6,hnmfex6,True,[deleted],t3_rb0j6e,https://www.reddit.com/r/MoscowIdaho/comments/rb0j6e/pullman_influence/,Pullman Influence,/r/MoscowIdaho/comments/rb0j6e/pullman_influence/hnmfex6/,12,r/MoscowIdaho,0,12
Also Andrew Crappy-pants wants the county to fork over money for a million dollar bridge across the waterway. Sounds like government handouts & socialism to me.,t2_df6e1xyd,NoCultID,0,1638900432.0,0,t1_hnmb05i,hnmb05i,False,NoCultID,t3_rait2i,https://www.reddit.com/r/MoscowIdaho/comments/rait2i/i_guess_the_cult_thinks_we_are_the_barbarian/,I guess the cult thinks we are the Barbarian Hordes they need to vanquish?,/r/MoscowIdaho/comments/rait2i/i_guess_the_cult_thinks_we_are_the_barbarian/hnmb05i/,4,r/MoscowIdaho,0,4
Sweet! Thanks for the heads up!,t2_df6e1xyd,NoCultID,0,1638900170.0,0,t1_hnmadst,hnmadst,False,NoCultID,t3_rait2i,https://www.reddit.com/r/MoscowIdaho/comments/rait2i/i_guess_the_cult_thinks_we_are_the_barbarian/,I guess the cult thinks we are the Barbarian Hordes they need to vanquish?,/r/MoscowIdaho/comments/rait2i/i_guess_the_cult_thinks_we_are_the_barbarian/hnmadst/,3,r/MoscowIdaho,0,3
"If you look back through previous episodes you’ll see some of the other guests they’ve had on… historical society, Kenworthy, Rivaura winery, Vin wine bar, the 1912 Center, the former mayor of Moscow, etc. These are not Kirkers. Just because they are on the podcast doesn’t make it so.",t2_35bk0doi,Spudontheside,0,1638899771.0,0,t1_hnm9glw,hnm9glw,False,NoCultID,t3_rait2i,https://www.reddit.com/r/MoscowIdaho/comments/rait2i/i_guess_the_cult_thinks_we_are_the_barbarian/,I guess the cult thinks we are the Barbarian Hordes they need to vanquish?,/r/MoscowIdaho/comments/rait2i/i_guess_the_cult_thinks_we_are_the_barbarian/hnm9glw/,7,r/MoscowIdaho,0,7
"My understanding is not much, but Pullman has/had its own cult with LFF. I don't know if they are still active, but they tried to recruit me when I was in school years ago. I had two ladies that I thought I was building a friendship with, but after about the fifth time I declined an invitation to church events, they dropped me and I never heard from them again.",t2_boapisbu,crazyidahopuglady,0,1638898112.0,0,t1_hnm5nv2,hnm5nv2,True,[deleted],t3_rb0j6e,https://www.reddit.com/r/MoscowIdaho/comments/rb0j6e/pullman_influence/,Pullman Influence,/r/MoscowIdaho/comments/rb0j6e/pullman_influence/hnm5nv2/,14,r/MoscowIdaho,0,14
"That sounds great, I'd enjoy that! If it's alright with you, I'll PM when I get over there and get settled. Never hurts to expand the local CE network.",t2_4lq8gj0o,CougEngineer,0,1638896317.0,0,t1_hnm1n1a,hnm1n1a,False,[deleted],t3_r7v39u,https://www.reddit.com/r/MoscowIdaho/comments/r7v39u/young_professionals/,Young professionals?,/r/MoscowIdaho/comments/r7v39u/young_professionals/hnm1n1a/,2,r/MoscowIdaho,0,2
🤢🤢🤢,t2_dr3t0p4i,No-Patience-7861,0,1638889073.0,0,t1_hnll5uq,hnll5uq,True,NoCultID,t3_radsnp,https://www.reddit.com/r/MoscowIdaho/comments/radsnp/just_got_confirmation_that_the_cult_has_a/,Just got confirmation that the cult has a national church investment scheme.,/r/MoscowIdaho/comments/radsnp/just_got_confirmation_that_the_cult_has_a/hnll5uq/,3,r/MoscowIdaho,0,3
"30F, also a CE living in Moscow. I would love a young professionals meetup. Keep me in the loop if anything comes to fruition. And even if a group gathering didn't happen, it might be nice to grab coffee and talk shop. The Moscow engineering community is a small world.",t2_hq3wj,epcow,0,1638887951.0,0,t1_hnlinor,hnlinor,True,[deleted],t3_r7v39u,https://www.reddit.com/r/MoscowIdaho/comments/r7v39u/young_professionals/,Young professionals?,/r/MoscowIdaho/comments/r7v39u/young_professionals/hnlinor/,3,r/MoscowIdaho,0,3
"Doug Wilson’s nephew works at storm cellar, but not sure that answers any questions.",t2_3oqdbz5c,nuclearsidekick,0,1638885910.0,0,t1_hnlebw1,hnlebw1,False,gArp15,t3_r5zd2n,https://www.reddit.com/r/MoscowIdaho/comments/r5zd2n/does_anyone_have_good_information_or_evidence_on/,"Does anyone have good information or evidence on whether Bucers, Humble Burger, and Storm Cellar are involved with Christ Church or affiliate churches?",/r/MoscowIdaho/comments/r5zd2n/does_anyone_have_good_information_or_evidence_on/hnlebw1/,3,r/MoscowIdaho,0,3
This attorney is a REAL piece of work.,t2_3oqdbz5c,nuclearsidekick,0,1638885342.0,0,t1_hnld6ol,hnld6ol,False,crazyidahopuglady,t3_r794a4,https://www.reddit.com/r/MoscowIdaho/comments/r794a4/wtf_another_amazing_restaurant_being_screwed_over/,"WTF, another amazing restaurant being screwed over.",/r/MoscowIdaho/comments/r794a4/wtf_another_amazing_restaurant_being_screwed_over/hnld6ol/,3,r/MoscowIdaho,0,3
I'm worried because Ampersand is on the Kestrel podcast. Can anyone reassure me that they haven't joined the cult?,t2_df6e1xyd,NoCultID,0,1638861220.0,0,t1_hnkg1ch,hnkg1ch,True,NoCultID,t3_rait2i,https://www.reddit.com/r/MoscowIdaho/comments/rait2i/i_guess_the_cult_thinks_we_are_the_barbarian/,I guess the cult thinks we are the Barbarian Hordes they need to vanquish?,/r/MoscowIdaho/comments/rait2i/i_guess_the_cult_thinks_we_are_the_barbarian/hnkg1ch/,8,r/MoscowIdaho,0,8
"Barbarian hordes? Well, yes. Go Vandals! And they think they're the Romans? LOL, ok. I mean, who killed Jesus?",t2_dmv98nlw,dei0242,0,1638851772.0,0,t1_hnk0v6w,hnk0v6w,True,NoCultID,t3_rait2i,https://www.reddit.com/r/MoscowIdaho/comments/rait2i/i_guess_the_cult_thinks_we_are_the_barbarian/,I guess the cult thinks we are the Barbarian Hordes they need to vanquish?,/r/MoscowIdaho/comments/rait2i/i_guess_the_cult_thinks_we_are_the_barbarian/hnk0v6w/,5,r/MoscowIdaho,0,5
"Yeah, who is this, what is this, why do these people think its scary or relevant at all to our church?",t2_1d5artk4,dactoo,1,1638850582.0,0,t1_hnjyik2,hnjyik2,False,NoCultID,t3_r9xgkn,https://www.reddit.com/r/MoscowIdaho/comments/r9xgkn/cult_member_and_coowner_of_tapped_is_the_chief/,Cult Member and Co-owner of Tapped is the Chief Operating Officer (COO) of Enjin cryptocurrency,/r/MoscowIdaho/comments/r9xgkn/cult_member_and_coowner_of_tapped_is_the_chief/hnjyik2/,2,r/MoscowIdaho,0,2
Or maybe he's like... joking.,t2_1d5artk4,dactoo,1,1638850429.0,0,t1_hnjy6w2,hnjy6w2,False,NoCultID,t3_rait2i,https://www.reddit.com/r/MoscowIdaho/comments/rait2i/i_guess_the_cult_thinks_we_are_the_barbarian/,I guess the cult thinks we are the Barbarian Hordes they need to vanquish?,/r/MoscowIdaho/comments/rait2i/i_guess_the_cult_thinks_we_are_the_barbarian/hnjy6w2/,-5,r/MoscowIdaho,0,-5
"When Crap-N-Shits says conservatives are “keeping their heads down because of their workplace” and not expressing their true Christian values he really means they can’t be openly racist or homophobic in their workplace and get away with it. Such a dumb dumb, it’s hilarious he clearly doesn’t know what communism is and the host is just like yup true true no correction. Then he says young people are snowflakes that will spend all their time in HR!?! WTF is he doing to his younger employees that would make them want to seek out Human Resources, bit of a self report.",t2_152bhvd,declantee,0,1638846712.0,0,t1_hnjpxb7,hnjpxb7,True,NoCultID,t3_rait2i,https://www.reddit.com/r/MoscowIdaho/comments/rait2i/i_guess_the_cult_thinks_we_are_the_barbarian/,I guess the cult thinks we are the Barbarian Hordes they need to vanquish?,/r/MoscowIdaho/comments/rait2i/i_guess_the_cult_thinks_we_are_the_barbarian/hnjpxb7/,8,r/MoscowIdaho,0,8
Then we will need to push back.,t2_3z1jg,SuggestiveMaterial,0,1638838141.0,0,t1_hnj691n,hnj691n,False,NoCultID,t3_rait2i,https://www.reddit.com/r/MoscowIdaho/comments/rait2i/i_guess_the_cult_thinks_we_are_the_barbarian/,I guess the cult thinks we are the Barbarian Hordes they need to vanquish?,/r/MoscowIdaho/comments/rait2i/i_guess_the_cult_thinks_we_are_the_barbarian/hnj691n/,9,r/MoscowIdaho,0,9
He's got 5 kids too... Can you imagine. Raising 5 kids in a church known for pedophilia? Abuse? Marital rape enthusiasts? Racists?,t2_3z1jg,SuggestiveMaterial,0,1638838107.0,0,t1_hnj66dm,hnj66dm,False,NoCultID,t3_rait2i,https://www.reddit.com/r/MoscowIdaho/comments/rait2i/i_guess_the_cult_thinks_we_are_the_barbarian/,I guess the cult thinks we are the Barbarian Hordes they need to vanquish?,/r/MoscowIdaho/comments/rait2i/i_guess_the_cult_thinks_we_are_the_barbarian/hnj66dm/,10,r/MoscowIdaho,0,10
"Sigh. No.

Look if you don't know what's actually going on, refrain from commenting.

You support pedos.",t2_3z1jg,SuggestiveMaterial,0,1638837868.0,0,t1_hnj5nl0,hnj5nl0,False,SuggestiveMaterial,t3_r7i2xt,https://www.reddit.com/r/MoscowIdaho/comments/r7i2xt/i_think_its_time/,I think it's time...,/r/MoscowIdaho/comments/r7i2xt/i_think_its_time/hnj5nl0/,3,r/MoscowIdaho,0,3
It's a pedophile church. It's not a secret either. They are loud and fairly proud of it.,t2_3z1jg,SuggestiveMaterial,0,1638837814.0,0,t1_hnj5jf9,hnj5jf9,False,SuggestiveMaterial,t3_r7i2xt,https://www.reddit.com/r/MoscowIdaho/comments/r7i2xt/i_think_its_time/,I think it's time...,/r/MoscowIdaho/comments/r7i2xt/i_think_its_time/hnj5jf9/,5,r/MoscowIdaho,0,5
You should listen to it. It's to terrifying to describe. Basically Moscow is doomed. Flooding of far right Christians are going to be moving here.,t2_df6e1xyd,NoCultID,0,1638835263.0,0,t1_hnizwxu,hnizwxu,False,NoCultID,t3_rait2i,https://www.reddit.com/r/MoscowIdaho/comments/rait2i/i_guess_the_cult_thinks_we_are_the_barbarian/,I guess the cult thinks we are the Barbarian Hordes they need to vanquish?,/r/MoscowIdaho/comments/rait2i/i_guess_the_cult_thinks_we_are_the_barbarian/hnizwxu/,6,r/MoscowIdaho,0,6
"Would any benevolent, philanthropic soul care to give a basic outline of this cast? I’d very much like to avoid giving their stream support through a listen or wasting half an hour of my time on their blathering.",t2_9q4umaj2,Equivalent_Course_36,0,1638833616.0,0,t1_hniw675,hniw675,True,NoCultID,t3_rait2i,https://www.reddit.com/r/MoscowIdaho/comments/rait2i/i_guess_the_cult_thinks_we_are_the_barbarian/,I guess the cult thinks we are the Barbarian Hordes they need to vanquish?,/r/MoscowIdaho/comments/rait2i/i_guess_the_cult_thinks_we_are_the_barbarian/hniw675/,11,r/MoscowIdaho,0,11
The worst part is he's on the board for the airport,t2_df6e1xyd,NoCultID,0,1638833373.0,0,t1_hnivlx7,hnivlx7,False,NoCultID,t3_rait2i,https://www.reddit.com/r/MoscowIdaho/comments/rait2i/i_guess_the_cult_thinks_we_are_the_barbarian/,I guess the cult thinks we are the Barbarian Hordes they need to vanquish?,/r/MoscowIdaho/comments/rait2i/i_guess_the_cult_thinks_we_are_the_barbarian/hnivlx7/,11,r/MoscowIdaho,0,11
Probably Foucashit and his 20 astroturfing accounts.,t2_df6e1xyd,NoCultID,0,1638833314.0,0,t1_hnivgys,hnivgys,False,NoCultID,t3_rait2i,https://www.reddit.com/r/MoscowIdaho/comments/rait2i/i_guess_the_cult_thinks_we_are_the_barbarian/,I guess the cult thinks we are the Barbarian Hordes they need to vanquish?,/r/MoscowIdaho/comments/rait2i/i_guess_the_cult_thinks_we_are_the_barbarian/hnivgys/,15,r/MoscowIdaho,0,15
Ew it looks like cult members are downvoting any time they are mentioned.,t2_b3mtj4rc,Lovinalove,0,1638832522.0,0,t1_hnitmda,hnitmda,True,NoCultID,t3_rait2i,https://www.reddit.com/r/MoscowIdaho/comments/rait2i/i_guess_the_cult_thinks_we_are_the_barbarian/,I guess the cult thinks we are the Barbarian Hordes they need to vanquish?,/r/MoscowIdaho/comments/rait2i/i_guess_the_cult_thinks_we_are_the_barbarian/hnitmda/,11,r/MoscowIdaho,0,11
The Kestrel Podcast is a who's who of cult businesses...,t2_df6e1xyd,NoCultID,0,1638828304.0,0,t1_hnijfc2,hnijfc2,True,NoCultID,t3_rait2i,https://www.reddit.com/r/MoscowIdaho/comments/rait2i/i_guess_the_cult_thinks_we_are_the_barbarian/,I guess the cult thinks we are the Barbarian Hordes they need to vanquish?,/r/MoscowIdaho/comments/rait2i/i_guess_the_cult_thinks_we_are_the_barbarian/hnijfc2/,10,r/MoscowIdaho,0,10
"I had the family over for dinner once and I'd agree that assessment. But honestly, a lot of the congregants are.",t2_efw8ck4z,bomdigitee,0,1638825481.0,0,t1_hnic5m7,hnic5m7,False,NoCultID,t3_r9xgkn,https://www.reddit.com/r/MoscowIdaho/comments/r9xgkn/cult_member_and_coowner_of_tapped_is_the_chief/,Cult Member and Co-owner of Tapped is the Chief Operating Officer (COO) of Enjin cryptocurrency,/r/MoscowIdaho/comments/r9xgkn/cult_member_and_coowner_of_tapped_is_the_chief/hnic5m7/,5,r/MoscowIdaho,0,5
"Multiple people I've interviewed about him have said, ""He's a narcissistic a-hole."" Their words not mine.",t2_df6e1xyd,NoCultID,0,1638824838.0,0,t1_hniaiko,hniaiko,False,NoCultID,t3_r9xgkn,https://www.reddit.com/r/MoscowIdaho/comments/r9xgkn/cult_member_and_coowner_of_tapped_is_the_chief/,Cult Member and Co-owner of Tapped is the Chief Operating Officer (COO) of Enjin cryptocurrency,/r/MoscowIdaho/comments/r9xgkn/cult_member_and_coowner_of_tapped_is_the_chief/hniaiko/,4,r/MoscowIdaho,0,4
"Don't forget the cult celebrates Robert E Lee Day. Join their festivities on January 19th!

https://www.webpages.uidaho.edu/ngier/wilsonempire.htm",t2_df6e1xyd,NoCultID,0,1638824622.0,0,t1_hni9ynf,hni9ynf,False,NoCultID,t3_radsnp,https://www.reddit.com/r/MoscowIdaho/comments/radsnp/just_got_confirmation_that_the_cult_has_a/,Just got confirmation that the cult has a national church investment scheme.,/r/MoscowIdaho/comments/radsnp/just_got_confirmation_that_the_cult_has_a/hni9ynf/,7,r/MoscowIdaho,0,7
All 3 businesses WERE kirker owned when they opened. NONE of the owners are members of CC currently.,t2_efw8ck4z,bomdigitee,0,1638821452.0,0,t1_hni1p9l,hni1p9l,True,gArp15,t3_r5zd2n,https://www.reddit.com/r/MoscowIdaho/comments/r5zd2n/does_anyone_have_good_information_or_evidence_on/,"Does anyone have good information or evidence on whether Bucers, Humble Burger, and Storm Cellar are involved with Christ Church or affiliate churches?",/r/MoscowIdaho/comments/r5zd2n/does_anyone_have_good_information_or_evidence_on/hni1p9l/,1,r/MoscowIdaho,0,1
"I agree with your posts, I think the confusion is that when these businesses opened originally, they were kirk, but the owners have since left the church. I do know for a fact that people on the kirk train still work at Storm Cellar and have even treated some of my black friends with contempt. I don't give there anymore because of that.",t2_efw8ck4z,bomdigitee,0,1638821328.0,0,t1_hni1e42,hni1e42,False,gArp15,t3_r5zd2n,https://www.reddit.com/r/MoscowIdaho/comments/r5zd2n/does_anyone_have_good_information_or_evidence_on/,"Does anyone have good information or evidence on whether Bucers, Humble Burger, and Storm Cellar are involved with Christ Church or affiliate churches?",/r/MoscowIdaho/comments/r5zd2n/does_anyone_have_good_information_or_evidence_on/hni1e42/,4,r/MoscowIdaho,0,4
yeah I kinda think the hippie presence in moscow anymore is overstated. they're all aging white liberals now.,t2_8zmqk,loftech,0,1638821116.0,0,t1_hni0ujl,hni0ujl,False,SuggestiveMaterial,t3_r7i2xt,https://www.reddit.com/r/MoscowIdaho/comments/r7i2xt/i_think_its_time/,I think it's time...,/r/MoscowIdaho/comments/r7i2xt/i_think_its_time/hni0ujl/,3,r/MoscowIdaho,0,3
"Yes, that guy originally moved his family to Moscow (from CA, I think) and then up to the CDA area where there is another kirk church and ACCS school.",t2_efw8ck4z,bomdigitee,0,1638821044.0,0,t1_hni0o15,hni0o15,True,NoCultID,t3_r9xgkn,https://www.reddit.com/r/MoscowIdaho/comments/r9xgkn/cult_member_and_coowner_of_tapped_is_the_chief/,Cult Member and Co-owner of Tapped is the Chief Operating Officer (COO) of Enjin cryptocurrency,/r/MoscowIdaho/comments/r9xgkn/cult_member_and_coowner_of_tapped_is_the_chief/hni0o15/,5,r/MoscowIdaho,0,5
"Unfortunately it was from a private conversation from someone I absolutely trust who met some of these investors. I'm posting this in hopes of getting more solid evidence and people willing to help research this.

I did however find that ""Covenant Investments"" is owned by a company that owns a company, that owns a company.... in multiple NW states. It looks like it was meant to hide the owners. I hit a dead end at NORTHWEST REGISTERED AGENT LLC. It's going to take some time to see if they are connected.",t2_df6e1xyd,NoCultID,0,1638818673.0,0,t1_hnhumg7,hnhumg7,False,NoCultID,t3_radsnp,https://www.reddit.com/r/MoscowIdaho/comments/radsnp/just_got_confirmation_that_the_cult_has_a/,Just got confirmation that the cult has a national church investment scheme.,/r/MoscowIdaho/comments/radsnp/just_got_confirmation_that_the_cult_has_a/hnhumg7/,7,r/MoscowIdaho,0,7
"[https://www.linkedin.com/in/calebapplegate/](https://www.linkedin.com/in/calebapplegate/)

His LinkedIn lists both Tapped and Enjin.",t2_626en,lowbatteries,0,1638818392.0,0,t1_hnhtwll,hnhtwll,False,NoCultID,t3_r9xgkn,https://www.reddit.com/r/MoscowIdaho/comments/r9xgkn/cult_member_and_coowner_of_tapped_is_the_chief/,Cult Member and Co-owner of Tapped is the Chief Operating Officer (COO) of Enjin cryptocurrency,/r/MoscowIdaho/comments/r9xgkn/cult_member_and_coowner_of_tapped_is_the_chief/hnhtwll/,4,r/MoscowIdaho,0,4
You forgot to link to the evidence that confirms the rumor?,t2_626en,lowbatteries,0,1638818050.0,0,t1_hnht1bp,hnht1bp,True,NoCultID,t3_radsnp,https://www.reddit.com/r/MoscowIdaho/comments/radsnp/just_got_confirmation_that_the_cult_has_a/,Just got confirmation that the cult has a national church investment scheme.,/r/MoscowIdaho/comments/radsnp/just_got_confirmation_that_the_cult_has_a/hnht1bp/,6,r/MoscowIdaho,0,6
"LARPing as the Grinch?

Couldn't hear you over the sounds of Whoville singing.",t2_b3ar7,tekhak,1,1638818049.0,0,t1_hnht19i,hnht19i,False,SuggestiveMaterial,t3_r7i2xt,https://www.reddit.com/r/MoscowIdaho/comments/r7i2xt/i_think_its_time/,I think it's time...,/r/MoscowIdaho/comments/r7i2xt/i_think_its_time/hnht19i/,1,r/MoscowIdaho,0,1
"I didn't know that. going to have to buy some. 

To the moon. 🚀

✋💎✋",t2_b3ar7,tekhak,1,1638817535.0,0,t1_hnhrqle,hnhrqle,True,NoCultID,t3_r9xgkn,https://www.reddit.com/r/MoscowIdaho/comments/r9xgkn/cult_member_and_coowner_of_tapped_is_the_chief/,Cult Member and Co-owner of Tapped is the Chief Operating Officer (COO) of Enjin cryptocurrency,/r/MoscowIdaho/comments/r9xgkn/cult_member_and_coowner_of_tapped_is_the_chief/hnhrqle/,-1,r/MoscowIdaho,0,-1
