body,author_fullname,author.name,controversiality,created,downs,fullname,id,is_root,link_author,link_id,link_permalink,link_title,permalink,score,subreddit_name_prefixed,total_awards_received,ups
"None really but Richardson has a lot of Hookah bars along spring valley that oftentimes turn into clubs at night. There is one in Plano called Turkish Cafe, and one in Addison called Al-Amir. 

Carrollton has a lot of karaoke bars that have a large Asian crowd",t2_3xv74rn4,Amockdfw89,0,1647802236.0,0,t1_i1fpaoa,i1fpaoa,True,Itchy-Distribution83,t3_tia3mt,https://www.reddit.com/r/plano/comments/tia3mt/what_night_clubs_in_planorichardson_area_are/,What night clubs in Plano/Richardson area are popular for university students? Like 18 to early 20s folks. Any night clubs with a large Asian demographic?,/r/plano/comments/tia3mt/what_night_clubs_in_planorichardson_area_are/i1fpaoa/,3,r/plano,0,3
"For music, Texas is more famous for Soul and Country. If you’re into that, plenty of festivals - Soul Flower in the summer. 

Deep Ellum on April 1 is a nationally recognized festival coming up.

If you search art festivals there are many, free and it includes live music.

The Asian community in Plano is huge and welcoming. Enjoy and welcome :)",t2_mjfr2m5,Lyuseefur,0,1647799416.0,0,t1_i1fiit0,i1fiit0,False,Itchy-Distribution83,t3_tia3mt,https://www.reddit.com/r/plano/comments/tia3mt/what_night_clubs_in_planorichardson_area_are/,What night clubs in Plano/Richardson area are popular for university students? Like 18 to early 20s folks. Any night clubs with a large Asian demographic?,/r/plano/comments/tia3mt/what_night_clubs_in_planorichardson_area_are/i1fiit0/,1,r/plano,0,1
There is a place next to 99 ranch in plano that is a karaoke/night clubish type place that caters to chinese crowd. If you go to carrollton at old denton rd and gwb hwy there are some places that are similar with more mix of korean and chinese.,t2_6hel2,Diabetesh,0,1647796526.0,0,t1_i1fbd6t,i1fbd6t,True,Itchy-Distribution83,t3_tia3mt,https://www.reddit.com/r/plano/comments/tia3mt/what_night_clubs_in_planorichardson_area_are/,What night clubs in Plano/Richardson area are popular for university students? Like 18 to early 20s folks. Any night clubs with a large Asian demographic?,/r/plano/comments/tia3mt/what_night_clubs_in_planorichardson_area_are/i1fbd6t/,2,r/plano,0,2
"Do people show up to that group? I added it to my groups but every time there is an event , the participants are usually less than 5",t2_kklnniim,steppingoncracks101,0,1647795803.0,0,t1_i1f9j08,i1f9j08,False,melonkoli,t3_ti671y,https://www.reddit.com/r/plano/comments/ti671y/active_communities_in_plano/,Active communities in Plano?,/r/plano/comments/ti671y/active_communities_in_plano/i1f9j08/,1,r/plano,0,1
You need an id and all sorts of bullshit paperwork to get a job nowadays. Boomers still tgink u can walj in and give a firm handsgake. Worka at maybe 1% of biz. U need two forms of id to get a job. Doubt any of those panhandlers have any of that.,t2_kw6gmtz1,D00msdaydevice666,0,1647795434.0,0,t1_i1f8l88,i1f8l88,False,CityOfPlano,t3_tgi2f6,https://www.reddit.com/r/plano/comments/tgi2f6/what_you_need_to_know_about_pedestrian_safety_in/,What You Need to Know about Pedestrian Safety in Intersections,/r/plano/comments/tgi2f6/what_you_need_to_know_about_pedestrian_safety_in/i1f8l88/,2,r/plano,0,2
Any advice for where to get casual dress shirts that can be worn untucked over jeans or dress pants ?,t2_kklnniim,steppingoncracks101,0,1647795067.0,0,t1_i1f7mzb,i1f7mzb,True,[deleted],t3_thvm21,https://www.reddit.com/r/plano/comments/thvm21/recommendations_for_places_to_buy_professional/,"Recommendations for places to buy ""professional clothes""? (Male)",/r/plano/comments/thvm21/recommendations_for_places_to_buy_professional/i1f7mzb/,1,r/plano,0,1
Check out [Crossbar](https://www.crossbardallas.com/) for pick-up soccer.,t2_5li6y3a3,alikelyscenario,0,1647794700.0,0,t1_i1f6nul,i1f6nul,True,melonkoli,t3_ti671y,https://www.reddit.com/r/plano/comments/ti671y/active_communities_in_plano/,Active communities in Plano?,/r/plano/comments/ti671y/active_communities_in_plano/i1f6nul/,2,r/plano,0,2
"While I get what you are saying, meaning the demographics of plano as a whole, the demographics near downtown plano are young.  You've got UTD a few miles away, cityline to the south, and all the apartments around the downtown area itself, and the DART rail running through the area.  A lot more apartments under construction also, along with the redevelopment of the collen creek mall area, and the new DART silver line under construction directly connecting UTD to downtown plano.

Anyway I'm a middle aged guy myself, but if you walk around in downtown plano the demographics are young.  Already have a few bars and restaurants in the area that are pretty packed.  I thought they were trying to create something interesting with the now failed Hub Street but once it opened it felt more like they were aiming for a family / mature demographic rather than a younger demographic.  Covid put the final nail in their coffin but it wasn't going to be a big success anyway.  Just felt like they didn't realize who lived around here.",t2_7boig,shawnkfox,0,1647787382.0,0,t1_i1ep7lx,i1ep7lx,False,Itchy-Distribution83,t3_tia3mt,https://www.reddit.com/r/plano/comments/tia3mt/what_night_clubs_in_planorichardson_area_are/,What night clubs in Plano/Richardson area are popular for university students? Like 18 to early 20s folks. Any night clubs with a large Asian demographic?,/r/plano/comments/tia3mt/what_night_clubs_in_planorichardson_area_are/i1ep7lx/,1,r/plano,0,1
Workout partner?,t2_fgb6i7lo,SpiritedEmotion4752,0,1647787304.0,0,t1_i1ep1gt,i1ep1gt,True,melonkoli,t3_ti671y,https://www.reddit.com/r/plano/comments/ti671y/active_communities_in_plano/,Active communities in Plano?,/r/plano/comments/ti671y/active_communities_in_plano/i1ep1gt/,2,r/plano,0,2
This is my go-to,t2_15pzmo,apathynext,0,1647785025.0,0,t1_i1ek6f8,i1ek6f8,False,[deleted],t3_thvm21,https://www.reddit.com/r/plano/comments/thvm21/recommendations_for_places_to_buy_professional/,"Recommendations for places to buy ""professional clothes""? (Male)",/r/plano/comments/thvm21/recommendations_for_places_to_buy_professional/i1ek6f8/,1,r/plano,0,1
There’s a place called 32 degrees in downtown Plano. Pretty nice college bar vibe but not a club and kinda small. They do have pizza tho,t2_82m3ke87,Isthatahamburger,0,1647784545.0,0,t1_i1ej7g1,i1ej7g1,True,Itchy-Distribution83,t3_tia3mt,https://www.reddit.com/r/plano/comments/tia3mt/what_night_clubs_in_planorichardson_area_are/,What night clubs in Plano/Richardson area are popular for university students? Like 18 to early 20s folks. Any night clubs with a large Asian demographic?,/r/plano/comments/tia3mt/what_night_clubs_in_planorichardson_area_are/i1ej7g1/,2,r/plano,0,2
Look up DUL on Facebook. It's the Dallas area Ultimate Frisbee group. They have leagues and pickup games. Usually at Bob Woodruff Park in Plano. But they play in Allen and Richardson too,t2_6v8qt,sfa1500,0,1647784030.0,0,t1_i1ei6hv,i1ei6hv,True,melonkoli,t3_ti671y,https://www.reddit.com/r/plano/comments/ti671y/active_communities_in_plano/,Active communities in Plano?,/r/plano/comments/ti671y/active_communities_in_plano/i1ei6hv/,3,r/plano,0,3
"Yeah dude, I think your out of luck in these suburbs for ""night clubs"". They just don't exist here. There's likely a restaurant or something like that you'll find that's popular with people in your crowd. I would agree that Addison is a good place to look for your spot. It's a younger crowd out there and a lot more to do. Also, deep elum in dallas is where everything was going down back in the day. I don't know if people still rock it out there. Best of luck dude.",t2_7iwnbb1j,gfunk333,0,1647783629.0,0,t1_i1ehe7h,i1ehe7h,True,Itchy-Distribution83,t3_tia3mt,https://www.reddit.com/r/plano/comments/tia3mt/what_night_clubs_in_planorichardson_area_are/,What night clubs in Plano/Richardson area are popular for university students? Like 18 to early 20s folks. Any night clubs with a large Asian demographic?,/r/plano/comments/tia3mt/what_night_clubs_in_planorichardson_area_are/i1ehe7h/,5,r/plano,0,5
Lol the thai restaurant?,t2_g3esegrl,corkscrew_uppercut93,0,1647783618.0,0,t1_i1ehdgx,i1ehdgx,False,Itchy-Distribution83,t3_tia3mt,https://www.reddit.com/r/plano/comments/tia3mt/what_night_clubs_in_planorichardson_area_are/,What night clubs in Plano/Richardson area are popular for university students? Like 18 to early 20s folks. Any night clubs with a large Asian demographic?,/r/plano/comments/tia3mt/what_night_clubs_in_planorichardson_area_are/i1ehdgx/,4,r/plano,0,4
City of Plano website - recreation -has tons of groups and activities.  Or pick up brochure at high point tennis center which is a great place for pickle ball.,t2_jex09b9e,Innernetofbling,0,1647783482.0,0,t1_i1eh3yf,i1eh3yf,True,melonkoli,t3_ti671y,https://www.reddit.com/r/plano/comments/ti671y/active_communities_in_plano/,Active communities in Plano?,/r/plano/comments/ti671y/active_communities_in_plano/i1eh3yf/,2,r/plano,0,2
I just thought of someplace else it's called family thrift on avenue k. Every day the clothes are a different price I think Sundays it's a dollar.,t2_3fdowxsr,cantonsmom,0,1647783240.0,0,t1_i1egnew,i1egnew,True,[deleted],t3_thvm21,https://www.reddit.com/r/plano/comments/thvm21/recommendations_for_places_to_buy_professional/,"Recommendations for places to buy ""professional clothes""? (Male)",/r/plano/comments/thvm21/recommendations_for_places_to_buy_professional/i1egnew/,1,r/plano,0,1
Costco on sunday?,t2_hu06ojg3,bersrfuk69,0,1647782679.0,0,t1_i1eflge,i1eflge,True,Itchy-Distribution83,t3_thzcjc,https://www.reddit.com/r/plano/comments/thzcjc/where_to_meet_fellow_asians/,Where to meet fellow Asians ???,/r/plano/comments/thzcjc/where_to_meet_fellow_asians/i1eflge/,1,r/plano,0,1
Thank you so much:),t2_72rdn142,sarakay019,0,1647782645.0,0,t1_i1efj4s,i1efj4s,False,melonkoli,t3_ti671y,https://www.reddit.com/r/plano/comments/ti671y/active_communities_in_plano/,Active communities in Plano?,/r/plano/comments/ti671y/active_communities_in_plano/i1efj4s/,1,r/plano,0,1
Best thing about Plano pacers - you pay for a year ( like $50 or so) and run 12 races every last Sat of month.,t2_7s134lab,Wallfinger,0,1647782562.0,0,t1_i1efdpg,i1efdpg,False,melonkoli,t3_ti671y,https://www.reddit.com/r/plano/comments/ti671y/active_communities_in_plano/,Active communities in Plano?,/r/plano/comments/ti671y/active_communities_in_plano/i1efdpg/,3,r/plano,0,3
"You're totally right, I was caught up the club part, not age",t2_k7k7o66v,like_an_uncle,0,1647782207.0,0,t1_i1eeqeq,i1eeqeq,False,Itchy-Distribution83,t3_tia3mt,https://www.reddit.com/r/plano/comments/tia3mt/what_night_clubs_in_planorichardson_area_are/,What night clubs in Plano/Richardson area are popular for university students? Like 18 to early 20s folks. Any night clubs with a large Asian demographic?,/r/plano/comments/tia3mt/what_night_clubs_in_planorichardson_area_are/i1eeqeq/,1,r/plano,0,1
Sambuca is where to go on a cougar hunt. Not really the place for a college student looking for other college students...,t2_16arb2,TheSpivack,0,1647780731.0,0,t1_i1ec5rv,i1ec5rv,False,Itchy-Distribution83,t3_tia3mt,https://www.reddit.com/r/plano/comments/tia3mt/what_night_clubs_in_planorichardson_area_are/,What night clubs in Plano/Richardson area are popular for university students? Like 18 to early 20s folks. Any night clubs with a large Asian demographic?,/r/plano/comments/tia3mt/what_night_clubs_in_planorichardson_area_are/i1ec5rv/,1,r/plano,0,1
Nordstrom rack,t2_3yodjdkh,oakCliffIndigent,0,1647780476.0,0,t1_i1ebq49,i1ebq49,True,[deleted],t3_thvm21,https://www.reddit.com/r/plano/comments/thvm21/recommendations_for_places_to_buy_professional/,"Recommendations for places to buy ""professional clothes""? (Male)",/r/plano/comments/thvm21/recommendations_for_places_to_buy_professional/i1ebq49/,1,r/plano,0,1
Thanks!,t2_yc9d5,Rickdrizzle,0,1647780424.0,0,t1_i1ebmz5,i1ebmz5,False,Itchy-Distribution83,t3_thzcjc,https://www.reddit.com/r/plano/comments/thzcjc/where_to_meet_fellow_asians/,Where to meet fellow Asians ???,/r/plano/comments/thzcjc/where_to_meet_fellow_asians/i1ebmz5/,1,r/plano,0,1
Try out Zenna's. Not a night club but they have a fantastic happy hour.,t2_994de,naturalborn,0,1647780192.0,0,t1_i1eb9by,i1eb9by,True,Itchy-Distribution83,t3_tia3mt,https://www.reddit.com/r/plano/comments/tia3mt/what_night_clubs_in_planorichardson_area_are/,What night clubs in Plano/Richardson area are popular for university students? Like 18 to early 20s folks. Any night clubs with a large Asian demographic?,/r/plano/comments/tia3mt/what_night_clubs_in_planorichardson_area_are/i1eb9by/,1,r/plano,0,1
Luby’s is the hotspot.,t2_7osqnqs4,lithehammer,0,1647779491.0,0,t1_i1ea4a5,i1ea4a5,True,Itchy-Distribution83,t3_tia3mt,https://www.reddit.com/r/plano/comments/tia3mt/what_night_clubs_in_planorichardson_area_are/,What night clubs in Plano/Richardson area are popular for university students? Like 18 to early 20s folks. Any night clubs with a large Asian demographic?,/r/plano/comments/tia3mt/what_night_clubs_in_planorichardson_area_are/i1ea4a5/,9,r/plano,0,9
"It actually makes perfect sense given the demographics of the area. The entirety of the North Texas area is basically a haven for well to do families and it's reflected in what's available. Plano also tends to have strict zoning laws which probably restrict something like this as well since I would think a club might actually do quite well here. I remember a long time ago when the Hooters off of 75 was going in and the uproar the local community made about how it was going to morally corrupt the city, etc. - LOL",t2_78malznt,Loud_Internet572,0,1647778991.0,0,t1_i1e9bwf,i1e9bwf,False,Itchy-Distribution83,t3_tia3mt,https://www.reddit.com/r/plano/comments/tia3mt/what_night_clubs_in_planorichardson_area_are/,What night clubs in Plano/Richardson area are popular for university students? Like 18 to early 20s folks. Any night clubs with a large Asian demographic?,/r/plano/comments/tia3mt/what_night_clubs_in_planorichardson_area_are/i1e9bwf/,14,r/plano,0,14
It’s a Korean forum for the DFW area,t2_yc9d5,Rickdrizzle,0,1647778867.0,0,t1_i1e94y7,i1e94y7,False,Itchy-Distribution83,t3_thzcjc,https://www.reddit.com/r/plano/comments/thzcjc/where_to_meet_fellow_asians/,Where to meet fellow Asians ???,/r/plano/comments/thzcjc/where_to_meet_fellow_asians/i1e94y7/,1,r/plano,0,1
I’ll add Burlington since I don’t see it mentioned,t2_6i4y5,lizbit3,0,1647762918.0,0,t1_i1dpklz,i1dpklz,True,[deleted],t3_thvm21,https://www.reddit.com/r/plano/comments/thvm21/recommendations_for_places_to_buy_professional/,"Recommendations for places to buy ""professional clothes""? (Male)",/r/plano/comments/thvm21/recommendations_for_places_to_buy_professional/i1dpklz/,1,r/plano,0,1
If any one can specify what clubs in particular that would be great,t2_11hlm9,macaronist,0,1647759287.0,0,t1_i1dlbhf,i1dlbhf,False,Itchy-Distribution83,t3_tia3mt,https://www.reddit.com/r/plano/comments/tia3mt/what_night_clubs_in_planorichardson_area_are/,What night clubs in Plano/Richardson area are popular for university students? Like 18 to early 20s folks. Any night clubs with a large Asian demographic?,/r/plano/comments/tia3mt/what_night_clubs_in_planorichardson_area_are/i1dlbhf/,3,r/plano,0,3
on Arapaho in Richardson there are quite a bit of Hookah bars if thats your thing.,t2_5enygwvp,Perfect_Evidence,0,1647750941.0,0,t1_i1d9tpb,i1d9tpb,True,Itchy-Distribution83,t3_tia3mt,https://www.reddit.com/r/plano/comments/tia3mt/what_night_clubs_in_planorichardson_area_are/,What night clubs in Plano/Richardson area are popular for university students? Like 18 to early 20s folks. Any night clubs with a large Asian demographic?,/r/plano/comments/tia3mt/what_night_clubs_in_planorichardson_area_are/i1d9tpb/,2,r/plano,0,2
"Addison most likely. Some of the fraternities possibly had more of an Asian element than the others. Your other option is car meetups.

I remember bars being more prevalent than clubs. The only majority asian bars I’ve been to were in Austin.",t2_52fvxewb,Versatile_Investor,0,1647750894.0,0,t1_i1d9qx8,i1d9qx8,False,Itchy-Distribution83,t3_tia3mt,https://www.reddit.com/r/plano/comments/tia3mt/what_night_clubs_in_planorichardson_area_are/,What night clubs in Plano/Richardson area are popular for university students? Like 18 to early 20s folks. Any night clubs with a large Asian demographic?,/r/plano/comments/tia3mt/what_night_clubs_in_planorichardson_area_are/i1d9qx8/,8,r/plano,0,8
Los Angeles :). What's dalsam? I know what Kakao is,t2_4gbg0dm2,mad4shirts,0,1647750480.0,0,t1_i1d92gd,i1d92gd,False,Itchy-Distribution83,t3_thzcjc,https://www.reddit.com/r/plano/comments/thzcjc/where_to_meet_fellow_asians/,Where to meet fellow Asians ???,/r/plano/comments/thzcjc/where_to_meet_fellow_asians/i1d92gd/,2,r/plano,0,2
"Carrollton over by Snow City has a happening Asian crowd in the evenings.  Not really a bar scene, but lots of different eateries.",t2_6fysdx2s,hiccupmortician,0,1647750192.0,0,t1_i1d8lmy,i1d8lmy,True,Itchy-Distribution83,t3_tia3mt,https://www.reddit.com/r/plano/comments/tia3mt/what_night_clubs_in_planorichardson_area_are/,What night clubs in Plano/Richardson area are popular for university students? Like 18 to early 20s folks. Any night clubs with a large Asian demographic?,/r/plano/comments/tia3mt/what_night_clubs_in_planorichardson_area_are/i1d8lmy/,10,r/plano,0,10
"Any of the off price places (Ross, TJ, Burlington, etc.) typically have all sizes of dress shirts and slacks on sale. 

For men it is easier to get by with a pair of slacks and wear them a couple of times before washing or dry cleaning so you only need to pickup a few pairs in different colors (black, navy & grey will go a long way). 

If you decide to stay on longer than expected, I would recommend buying a new shirt ever couple of paychecks to keep your wardrobe feeling fresh.",t2_1qifc7a,srl5967,0,1647750117.0,0,t1_i1d8h7f,i1d8h7f,True,[deleted],t3_thvm21,https://www.reddit.com/r/plano/comments/thvm21/recommendations_for_places_to_buy_professional/,"Recommendations for places to buy ""professional clothes""? (Male)",/r/plano/comments/thvm21/recommendations_for_places_to_buy_professional/i1d8h7f/,1,r/plano,0,1
"It's not really a night club, but it's currently the spot the younger asian crowd goes to drink and hangout. 

Yajisang, it's a bar that's connected to singbox karaoke in carrolton",t2_69zzh,hiimaninja,0,1647749807.0,0,t1_i1d7yj8,i1d7yj8,True,Itchy-Distribution83,t3_tia3mt,https://www.reddit.com/r/plano/comments/tia3mt/what_night_clubs_in_planorichardson_area_are/,What night clubs in Plano/Richardson area are popular for university students? Like 18 to early 20s folks. Any night clubs with a large Asian demographic?,/r/plano/comments/tia3mt/what_night_clubs_in_planorichardson_area_are/i1d7yj8/,3,r/plano,0,3
thanks so much. I'm moving to the area soon from out of town and I want to get involved with a group when I get there!,t2_72rdn142,sarakay019,0,1647749598.0,0,t1_i1d7m07,i1d7m07,False,melonkoli,t3_ti671y,https://www.reddit.com/r/plano/comments/ti671y/active_communities_in_plano/,Active communities in Plano?,/r/plano/comments/ti671y/active_communities_in_plano/i1d7m07/,2,r/plano,0,2
"There’s pickup soccer that i play at and it’s always fun, diverse and both men and women play in it. Fastest way is to check on The Meetup app group is : Ex Gladiators Sunday Funday soccer.",t2_c9wd5up,Mansraydar,0,1647748184.0,0,t1_i1d56rq,i1d56rq,True,melonkoli,t3_ti671y,https://www.reddit.com/r/plano/comments/ti671y/active_communities_in_plano/,Active communities in Plano?,/r/plano/comments/ti671y/active_communities_in_plano/i1d56rq/,3,r/plano,0,3
"There really should be a few clubs in the downtown Plano area, makes zero sense that there aren't any.",t2_7boig,shawnkfox,0,1647747942.0,0,t1_i1d4rh4,i1d4rh4,False,Itchy-Distribution83,t3_tia3mt,https://www.reddit.com/r/plano/comments/tia3mt/what_night_clubs_in_planorichardson_area_are/,What night clubs in Plano/Richardson area are popular for university students? Like 18 to early 20s folks. Any night clubs with a large Asian demographic?,/r/plano/comments/tia3mt/what_night_clubs_in_planorichardson_area_are/i1d4rh4/,8,r/plano,0,8
I am not aware of any real nightclubs in Plano.  You'd have to go into Dallas.,t2_63f4jgo7,FrostyLandscape,0,1647746296.0,0,t1_i1d1sk0,i1d1sk0,True,Itchy-Distribution83,t3_tia3mt,https://www.reddit.com/r/plano/comments/tia3mt/what_night_clubs_in_planorichardson_area_are/,What night clubs in Plano/Richardson area are popular for university students? Like 18 to early 20s folks. Any night clubs with a large Asian demographic?,/r/plano/comments/tia3mt/what_night_clubs_in_planorichardson_area_are/i1d1sk0/,17,r/plano,0,17
Good to know.,t2_e33jy,hdmx539,0,1647746261.0,0,t1_i1d1q8u,i1d1q8u,False,apollloo_,t3_thjsqs,https://www.reddit.com/r/plano/comments/thjsqs/cannabis_delta_8/,Cannabis & Delta 8,/r/plano/comments/thjsqs/cannabis_delta_8/i1d1q8u/,1,r/plano,0,1
"TNSR sounds like what you’re looking for; it’s more of a social club with a running component. The group run itself is super casual and there are always people of different running abilities, even folks that walk, so there’s always someone to run with no matter your pace/distance. My girlfriend and I have been running with them on and off for almost a decade and everyone’s very friendly and welcoming to new members.

PRC is pretty casual as well but they meet too early for me haha, I’m not a morning runner by any stretch of the imagination.",t2_bgvld,DJGreenMan,0,1647745814.0,0,t1_i1d0wyf,i1d0wyf,False,melonkoli,t3_ti671y,https://www.reddit.com/r/plano/comments/ti671y/active_communities_in_plano/,Active communities in Plano?,/r/plano/comments/ti671y/active_communities_in_plano/i1d0wyf/,3,r/plano,0,3
Collin County will definitely take you in for any amount of thc or thc related items.,t2_5enygwvp,Perfect_Evidence,0,1647744847.0,0,t1_i1cz4oh,i1cz4oh,False,apollloo_,t3_thjsqs,https://www.reddit.com/r/plano/comments/thjsqs/cannabis_delta_8/,Cannabis & Delta 8,/r/plano/comments/thjsqs/cannabis_delta_8/i1cz4oh/,5,r/plano,0,5
Try the Plano Pacers.,t2_1dtoap76,pantamimecxz,0,1647744404.0,0,t1_i1cyaid,i1cyaid,True,melonkoli,t3_ti671y,https://www.reddit.com/r/plano/comments/ti671y/active_communities_in_plano/,Active communities in Plano?,/r/plano/comments/ti671y/active_communities_in_plano/i1cyaid/,3,r/plano,0,3
"2nd K&G, inexpensive and good value",t2_85i2v,Actuarial,0,1647744308.0,0,t1_i1cy3u1,i1cy3u1,False,[deleted],t3_thvm21,https://www.reddit.com/r/plano/comments/thvm21/recommendations_for_places_to_buy_professional/,"Recommendations for places to buy ""professional clothes""? (Male)",/r/plano/comments/thvm21/recommendations_for_places_to_buy_professional/i1cy3u1/,2,r/plano,0,2
Thursday Night Social Run is very casual. They accept runners of all abilities. I used to attend before I got busy with school and I am a solid speed-walker 🤣🤣🤣,t2_ajf842z,lilibet89,0,1647743942.0,0,t1_i1cxezl,i1cxezl,False,melonkoli,t3_ti671y,https://www.reddit.com/r/plano/comments/ti671y/active_communities_in_plano/,Active communities in Plano?,/r/plano/comments/ti671y/active_communities_in_plano/i1cxezl/,8,r/plano,0,8
"Not sure about ultimate, but Plano has a public disc golf course off of Parker, Shawnee Park. 

Check it out and see if you like disc golf as much as ultimate.",t2_a61z0,Randusnuder,0,1647743875.0,0,t1_i1cxaj9,i1cxaj9,True,melonkoli,t3_ti671y,https://www.reddit.com/r/plano/comments/ti671y/active_communities_in_plano/,Active communities in Plano?,/r/plano/comments/ti671y/active_communities_in_plano/i1cxaj9/,3,r/plano,0,3
It’s a live music artistry desert.,t2_3l9rbvb,hulster,0,1647743830.0,0,t1_i1cx7gs,i1cx7gs,True,Itchy-Distribution83,t3_tia3mt,https://www.reddit.com/r/plano/comments/tia3mt/what_night_clubs_in_planorichardson_area_are/,What night clubs in Plano/Richardson area are popular for university students? Like 18 to early 20s folks. Any night clubs with a large Asian demographic?,/r/plano/comments/tia3mt/what_night_clubs_in_planorichardson_area_are/i1cx7gs/,17,r/plano,0,17
Yeah i am. Any clubs in particular that had a younger Asian crowd?,t2_8pw5dnkq,Itchy-Distribution83,0,1647743774.0,0,t1_i1cx3j8,i1cx3j8,False,Itchy-Distribution83,t3_tia3mt,https://www.reddit.com/r/plano/comments/tia3mt/what_night_clubs_in_planorichardson_area_are/,What night clubs in Plano/Richardson area are popular for university students? Like 18 to early 20s folks. Any night clubs with a large Asian demographic?,/r/plano/comments/tia3mt/what_night_clubs_in_planorichardson_area_are/i1cx3j8/,5,r/plano,0,5
"Are you at UTD? I just remember going to uptown, Addison, and house parties. Especially if under 21.",t2_52fvxewb,Versatile_Investor,0,1647743622.0,0,t1_i1cwsvv,i1cwsvv,True,Itchy-Distribution83,t3_tia3mt,https://www.reddit.com/r/plano/comments/tia3mt/what_night_clubs_in_planorichardson_area_are/,What night clubs in Plano/Richardson area are popular for university students? Like 18 to early 20s folks. Any night clubs with a large Asian demographic?,/r/plano/comments/tia3mt/what_night_clubs_in_planorichardson_area_are/i1cwsvv/,25,r/plano,0,25
So u mean where to meet Asian guys cause all the Asian girls are hanging out with white dudes 😂,t2_eb58uugx,Ambitious_Crab_765,0,1647743551.0,0,t1_i1cwnzw,i1cwnzw,True,Itchy-Distribution83,t3_thzcjc,https://www.reddit.com/r/plano/comments/thzcjc/where_to_meet_fellow_asians/,Where to meet fellow Asians ???,/r/plano/comments/thzcjc/where_to_meet_fellow_asians/i1cwnzw/,-2,r/plano,0,-2
