body,author_fullname,author.name,controversiality,created,downs,fullname,id,is_root,link_author,link_id,link_permalink,link_title,permalink,score,subreddit_name_prefixed,total_awards_received,ups
"Yep, a single impact on my hood. Who you peddling for?",t2_i1jbeeql,ImPattMan,0,1648293195.0,0,t1_i26i0g4,i26i0g4,True,Binx75075,t3_tolsoy,https://www.reddit.com/r/plano/comments/tolsoy/anyones_vehicle_have_haildamage_that_they_need_to/,Anyone's vehicle have #HailDamage that they need to get fixed?,/r/plano/comments/tolsoy/anyones_vehicle_have_haildamage_that_they_need_to/i26i0g4/,1,r/plano,0,1
"Yep. Friend accidentally left an ounce of meth & his gun in the car w/o my knowledge. Got hit w/ man/del & felon in possession of a gun. So to anyone running a background check, they're going to assume I am a violent criminal when in fact I've never fired a gun in my life.",t2_hb097xa2,Binx75075,0,1648291360.0,0,t1_i26fsbm,i26fsbm,False,Ok_Patience_4900,t3_tmc9h1,https://www.reddit.com/r/plano/comments/tmc9h1/apartments_or_homes_accepting_felons/,Apartments or homes accepting felons.,/r/plano/comments/tmc9h1/apartments_or_homes_accepting_felons/i26fsbm/,1,r/plano,0,1
How exactly did he help you? Was he proactive?,t2_hb097xa2,Binx75075,0,1648291178.0,0,t1_i26fkmf,i26fkmf,False,Ok_Patience_4900,t3_tmc9h1,https://www.reddit.com/r/plano/comments/tmc9h1/apartments_or_homes_accepting_felons/,Apartments or homes accepting felons.,/r/plano/comments/tmc9h1/apartments_or_homes_accepting_felons/i26fkmf/,1,r/plano,0,1
I just joined. Also check out Inmate Support Texas.,t2_hb097xa2,Binx75075,0,1648291120.0,0,t1_i26fi5m,i26fi5m,False,Ok_Patience_4900,t3_tmc9h1,https://www.reddit.com/r/plano/comments/tmc9h1/apartments_or_homes_accepting_felons/,Apartments or homes accepting felons.,/r/plano/comments/tmc9h1/apartments_or_homes_accepting_felons/i26fi5m/,1,r/plano,0,1
"I'm in east Allen, all good here.",t2_4gbg0dm2,mad4shirts,0,1648278944.0,0,t1_i261pq4,i261pq4,True,Gh011,t3_toi5ar,https://www.reddit.com/r/plano/comments/toi5ar/anyone_elses_power_just_go_out/,Anyone else’s power just go out?,/r/plano/comments/toi5ar/anyone_elses_power_just_go_out/i261pq4/,1,r/plano,0,1
"Texas Archery operates an indoor archery range off 75 with a wide array of opportunities for classes and whatnot for kids: 

http://texasarchery.info/about

http://texasarchery.info/about/learning-path",t2_7a8yn,Xvash2,0,1648278084.0,0,t1_i260q8d,i260q8d,True,beerl0ver,t3_to3zza,https://www.reddit.com/r/plano/comments/to3zza/need_some_social_activity_ideas_for_my_lonely_12/,Need some social activity ideas for my lonely 12 year old girl,/r/plano/comments/to3zza/need_some_social_activity_ideas_for_my_lonely_12/i260q8d/,1,r/plano,0,1
"We were out for 3 hours last week.

Vote.",t2_2lzueu28,Valblaze,0,1648277773.0,0,t1_i260d1p,i260d1p,True,Gh011,t3_toi5ar,https://www.reddit.com/r/plano/comments/toi5ar/anyone_elses_power_just_go_out/,Anyone else’s power just go out?,/r/plano/comments/toi5ar/anyone_elses_power_just_go_out/i260d1p/,0,r/plano,0,0
There are several good Jiu Jitsu gyms in the Plano area.  Good way to socialize and build confidence.,t2_6uq3b,andybiggs90,0,1648277647.0,0,t1_i2607y8,i2607y8,True,beerl0ver,t3_to3zza,https://www.reddit.com/r/plano/comments/to3zza/need_some_social_activity_ideas_for_my_lonely_12/,Need some social activity ideas for my lonely 12 year old girl,/r/plano/comments/to3zza/need_some_social_activity_ideas_for_my_lonely_12/i2607y8/,1,r/plano,0,1
Here in Allen too yea.,t2_4fpkz851,CollectiveUD,0,1648277365.0,0,t1_i25zvvs,i25zvvs,True,Gh011,t3_toi5ar,https://www.reddit.com/r/plano/comments/toi5ar/anyone_elses_power_just_go_out/,Anyone else’s power just go out?,/r/plano/comments/toi5ar/anyone_elses_power_just_go_out/i25zvvs/,1,r/plano,0,1
I read the title and my first reaction was concern,t2_ibsvnfo4,robbycoffin,0,1648276276.0,0,t1_i25yj9t,i25yj9t,True,fransisco_flores,t3_tnwk9u,https://www.reddit.com/r/plano/comments/tnwk9u/places_to_run/,Places to run?,/r/plano/comments/tnwk9u/places_to_run/i25yj9t/,1,r/plano,0,1
Oncor outage map shows 74 customers affect. Restore by 3:30am.,t2_5q813,olddaad,0,1648274522.0,0,t1_i25wbd6,i25wbd6,True,Gh011,t3_toi5ar,https://www.reddit.com/r/plano/comments/toi5ar/anyone_elses_power_just_go_out/,Anyone else’s power just go out?,/r/plano/comments/toi5ar/anyone_elses_power_just_go_out/i25wbd6/,1,r/plano,0,1
Still on Custer/Spring Creek,t2_5q813,olddaad,0,1648274376.0,0,t1_i25w4ol,i25w4ol,True,Gh011,t3_toi5ar,https://www.reddit.com/r/plano/comments/toi5ar/anyone_elses_power_just_go_out/,Anyone else’s power just go out?,/r/plano/comments/toi5ar/anyone_elses_power_just_go_out/i25w4ol/,1,r/plano,0,1
"Used to live at apartments off dog park and spring creek by Chisholm, you can easily take this trail all the way into downtown Plano, it is so awesome. Few better city/paved running experiences than a beautiful spring day down that trail... may do it again next time I’m in town.",t2_4k2aa,mass922,0,1648269784.0,0,t1_i25po4s,i25po4s,False,fransisco_flores,t3_tnwk9u,https://www.reddit.com/r/plano/comments/tnwk9u/places_to_run/,Places to run?,/r/plano/comments/tnwk9u/places_to_run/i25po4s/,1,r/plano,0,1
Sewing or painting classes! My sister and I did them in middle school and should be available at Michael’s or Joanne’s. Comfy environment to make friends and low pressure,t2_bh88tz80,clunkypie,0,1648269733.0,0,t1_i25pl9e,i25pl9e,True,beerl0ver,t3_to3zza,https://www.reddit.com/r/plano/comments/to3zza/need_some_social_activity_ideas_for_my_lonely_12/,Need some social activity ideas for my lonely 12 year old girl,/r/plano/comments/to3zza/need_some_social_activity_ideas_for_my_lonely_12/i25pl9e/,2,r/plano,0,2
North of Mckinney there is a 5k runners paradise. Ask about las lomas del rio blanco.,t2_kh9tand7,jomacorjr,0,1648269716.0,0,t1_i25pkbh,i25pkbh,True,fransisco_flores,t3_tnwk9u,https://www.reddit.com/r/plano/comments/tnwk9u/places_to_run/,Places to run?,/r/plano/comments/tnwk9u/places_to_run/i25pkbh/,1,r/plano,0,1
"I trained for my marathon by running from my previous home at Independence and McDermott to the Chisholm trail, connected at Jack carter and ran the Bluebonnet until Oak Point and then finished the way there by running Bob Woodruff to Armstrong Middle School and back. I did most of my training mid morning so traffic was never an issue.",t2_52hfc,josephrob123,0,1648268242.0,0,t1_i25n5sr,i25n5sr,False,fransisco_flores,t3_tnwk9u,https://www.reddit.com/r/plano/comments/tnwk9u/places_to_run/,Places to run?,/r/plano/comments/tnwk9u/places_to_run/i25n5sr/,1,r/plano,0,1
Idk what the name of the trail is but Arbor Hills has pretty good pavement trails.,t2_clv5192t,Delani_Murphy,0,1648267058.0,0,t1_i25l4q3,i25l4q3,True,fransisco_flores,t3_tnwk9u,https://www.reddit.com/r/plano/comments/tnwk9u/places_to_run/,Places to run?,/r/plano/comments/tnwk9u/places_to_run/i25l4q3/,1,r/plano,0,1
"I was visiting local and state college campuses at that age, on my own volition.",t2_cfmdj8rn,ragsbags,0,1648265840.0,0,t1_i25iz2a,i25iz2a,True,beerl0ver,t3_to3zza,https://www.reddit.com/r/plano/comments/to3zza/need_some_social_activity_ideas_for_my_lonely_12/,Need some social activity ideas for my lonely 12 year old girl,/r/plano/comments/to3zza/need_some_social_activity_ideas_for_my_lonely_12/i25iz2a/,1,r/plano,0,1
"Chisholm trail is a good flat 10 miles out an back from 15th to legacy.
 Oak point is about the same with a hill in the middle. 
Arbor hills is a bit too far for me but its a  well recommended area",t2_9rk3abwy,Thewiserunner,0,1648264935.0,0,t1_i25hcmy,i25hcmy,True,fransisco_flores,t3_tnwk9u,https://www.reddit.com/r/plano/comments/tnwk9u/places_to_run/,Places to run?,/r/plano/comments/tnwk9u/places_to_run/i25hcmy/,1,r/plano,0,1
"Thanks, should help",t2_30e8p8z3,joremero,0,1648264515.0,0,t1_i25glar,i25glar,False,beerl0ver,t3_to3zza,https://www.reddit.com/r/plano/comments/to3zza/need_some_social_activity_ideas_for_my_lonely_12/,Need some social activity ideas for my lonely 12 year old girl,/r/plano/comments/to3zza/need_some_social_activity_ideas_for_my_lonely_12/i25glar/,1,r/plano,0,1
"There are a couple really good and established BSA all girl troops in Plano. Troops  plan and attend camping trips at least once a month. The BSA really started pushing for more STEM projects in their organization. If the ones in Plano don’t feel like a good fit, then try out the troops in Allen. You may also want to look into 4H. They do more than just livestock or crafts. Good luck.",t2_a7e8c1oz,Chick192910,0,1648263813.0,0,t1_i25faq1,i25faq1,True,beerl0ver,t3_to3zza,https://www.reddit.com/r/plano/comments/to3zza/need_some_social_activity_ideas_for_my_lonely_12/,Need some social activity ideas for my lonely 12 year old girl,/r/plano/comments/to3zza/need_some_social_activity_ideas_for_my_lonely_12/i25faq1/,1,r/plano,0,1
Every Saturday at Madness Games and Comics is board game day. There's usually some kids playing board games there.,t2_4zc93,Edicedi,0,1648263084.0,0,t1_i25dxzi,i25dxzi,True,beerl0ver,t3_to3zza,https://www.reddit.com/r/plano/comments/to3zza/need_some_social_activity_ideas_for_my_lonely_12/,Need some social activity ideas for my lonely 12 year old girl,/r/plano/comments/to3zza/need_some_social_activity_ideas_for_my_lonely_12/i25dxzi/,15,r/plano,0,15
"A lot of my social life comes from my sport activities, i do judo at east side dojo maybe look into that? Or maybe BJJ theres plenty of great places but for price and facilities east side is incomprable",t2_3si7opkv,Lucidonious,0,1648262902.0,0,t1_i25dlnl,i25dlnl,True,beerl0ver,t3_to3zza,https://www.reddit.com/r/plano/comments/to3zza/need_some_social_activity_ideas_for_my_lonely_12/,Need some social activity ideas for my lonely 12 year old girl,/r/plano/comments/to3zza/need_some_social_activity_ideas_for_my_lonely_12/i25dlnl/,1,r/plano,0,1
"Girl Scouts

Audition for a play at North Texas Performing Arts NTPA.org

Soccer team at PSA

Robotics club at school

Summer camp",t2_axcc1lb0,Queasy-Awareness5647,0,1648261946.0,0,t1_i25brlz,i25brlz,True,beerl0ver,t3_to3zza,https://www.reddit.com/r/plano/comments/to3zza/need_some_social_activity_ideas_for_my_lonely_12/,Need some social activity ideas for my lonely 12 year old girl,/r/plano/comments/to3zza/need_some_social_activity_ideas_for_my_lonely_12/i25brlz/,1,r/plano,0,1
Bob Woodruff and Oak Point Nature Preserve connect. I usually walk them because I'm not in shape enough to run very far but I think they would make a nice run to go from one to the other depending on how far you want to go.  All trails says it's 6.10 miles.,t2_66jthxww,okamiokamii,0,1648261543.0,0,t1_i25azh0,i25azh0,True,fransisco_flores,t3_tnwk9u,https://www.reddit.com/r/plano/comments/tnwk9u/places_to_run/,Places to run?,/r/plano/comments/tnwk9u/places_to_run/i25azh0/,1,r/plano,0,1
Nice! Yeah it really builds inner confidence I feel like. Mine seems like a different kid!,t2_1758vxt9,JonClaudeVanDam,0,1648260741.0,0,t1_i259evp,i259evp,False,beerl0ver,t3_to3zza,https://www.reddit.com/r/plano/comments/to3zza/need_some_social_activity_ideas_for_my_lonely_12/,Need some social activity ideas for my lonely 12 year old girl,/r/plano/comments/to3zza/need_some_social_activity_ideas_for_my_lonely_12/i259evp/,2,r/plano,0,2
"That’s true, forgot about them thanks",t2_fvxjh,beerl0ver,0,1648260714.0,0,t1_i259cw7,i259cw7,False,beerl0ver,t3_to3zza,https://www.reddit.com/r/plano/comments/to3zza/need_some_social_activity_ideas_for_my_lonely_12/,Need some social activity ideas for my lonely 12 year old girl,/r/plano/comments/to3zza/need_some_social_activity_ideas_for_my_lonely_12/i259cw7/,2,r/plano,0,2
Thanks,t2_fvxjh,beerl0ver,0,1648260678.0,0,t1_i259ac8,i259ac8,False,beerl0ver,t3_to3zza,https://www.reddit.com/r/plano/comments/to3zza/need_some_social_activity_ideas_for_my_lonely_12/,Need some social activity ideas for my lonely 12 year old girl,/r/plano/comments/to3zza/need_some_social_activity_ideas_for_my_lonely_12/i259ac8/,2,r/plano,0,2
Thanks she tried ballet when she was younger but that’s a good idea,t2_fvxjh,beerl0ver,0,1648260665.0,0,t1_i2599cd,i2599cd,False,beerl0ver,t3_to3zza,https://www.reddit.com/r/plano/comments/to3zza/need_some_social_activity_ideas_for_my_lonely_12/,Need some social activity ideas for my lonely 12 year old girl,/r/plano/comments/to3zza/need_some_social_activity_ideas_for_my_lonely_12/i2599cd/,1,r/plano,0,1
"Very cool, I’m going to bookmark this for when she gets older",t2_fvxjh,beerl0ver,0,1648260617.0,0,t1_i25960x,i25960x,False,beerl0ver,t3_to3zza,https://www.reddit.com/r/plano/comments/to3zza/need_some_social_activity_ideas_for_my_lonely_12/,Need some social activity ideas for my lonely 12 year old girl,/r/plano/comments/to3zza/need_some_social_activity_ideas_for_my_lonely_12/i25960x/,2,r/plano,0,2
Park at Bob Woodruff park. The trail leads to Oak Point Nature reserve. It's beautiful,t2_j7t591ns,Santoveli80,0,1648260543.0,0,t1_i2590mg,i2590mg,True,fransisco_flores,t3_tnwk9u,https://www.reddit.com/r/plano/comments/tnwk9u/places_to_run/,Places to run?,/r/plano/comments/tnwk9u/places_to_run/i2590mg/,1,r/plano,0,1
oak point,t2_9z10shes,VerySaltyScientist,0,1648259155.0,0,t1_i2568wc,i2568wc,True,fransisco_flores,t3_tnwk9u,https://www.reddit.com/r/plano/comments/tnwk9u/places_to_run/,Places to run?,/r/plano/comments/tnwk9u/places_to_run/i2568wc/,1,r/plano,0,1
"Correct, but again not really sketchy.",t2_na4l6,dtxs1r,0,1648259020.0,0,t1_i255yyv,i255yyv,False,fransisco_flores,t3_tnwk9u,https://www.reddit.com/r/plano/comments/tnwk9u/places_to_run/,Places to run?,/r/plano/comments/tnwk9u/places_to_run/i255yyv/,2,r/plano,0,2
"Go to the closest City of Plano recreation center and pickup a catalogue. They have all kinds of activities from martial arts, painting, day camp, sports, theatre etc. Classes for all age groups.",t2_3xv74rn4,Amockdfw89,0,1648258692.0,0,t1_i255am0,i255am0,True,beerl0ver,t3_to3zza,https://www.reddit.com/r/plano/comments/to3zza/need_some_social_activity_ideas_for_my_lonely_12/,Need some social activity ideas for my lonely 12 year old girl,/r/plano/comments/to3zza/need_some_social_activity_ideas_for_my_lonely_12/i255am0/,3,r/plano,0,3
If she likes STEM then consider signing her up for a robotics team. My brother was is an introverted person that would spend all of his time in his room. After he joined the team he began branching out more.,t2_14eu50,spaceface0717,0,1648258587.0,0,t1_i2552v6,i2552v6,True,beerl0ver,t3_to3zza,https://www.reddit.com/r/plano/comments/to3zza/need_some_social_activity_ideas_for_my_lonely_12/,Need some social activity ideas for my lonely 12 year old girl,/r/plano/comments/to3zza/need_some_social_activity_ideas_for_my_lonely_12/i2552v6/,8,r/plano,0,8
"I bought my house off the Chisolm Trail specifically because of it's accessibility, but for my money the best long distance running you're going to get is parking at the Courses at Waters Creek golf course, hopping on the Blue bonnet and running under 75, through Oak Point Park, down to and through Bob Woodruff park (and then back).

It's [about six miles one way](https://www.google.com/maps/dir/33.0730561,-96.6920738/33.0285195,-96.6581123/@33.0508929,-96.6875653,14z/data=!4m14!4m13!1m10!3m4!1m2!1d-96.6772601!2d33.0623552!3s0x864c19ec27db159f:0x29048c21eacaf820!3m4!1m2!1d-96.6652474!2d33.0426696!3s0x864c19871a14b9c7:0x16b6a0468638a8f6!1m0!3e2), but longer if you add loops in Woodruff or Oak Point, and it's a nice mix of forest, lake, and grasslands for change of scenery.

The crossings of major roads are all underpasses (no lights) and it's a great smooth ride.",t2_80uj3,hulking_menace,0,1648257673.0,0,t1_i253669,i253669,True,fransisco_flores,t3_tnwk9u,https://www.reddit.com/r/plano/comments/tnwk9u/places_to_run/,Places to run?,/r/plano/comments/tnwk9u/places_to_run/i253669/,2,r/plano,0,2
Website says 14-24yr olds. Ops is 12. That being said this seems wired.,t2_k7k7o66v,like_an_uncle,0,1648256275.0,0,t1_i25094d,i25094d,False,beerl0ver,t3_to3zza,https://www.reddit.com/r/plano/comments/to3zza/need_some_social_activity_ideas_for_my_lonely_12/,Need some social activity ideas for my lonely 12 year old girl,/r/plano/comments/to3zza/need_some_social_activity_ideas_for_my_lonely_12/i25094d/,3,r/plano,0,3
"Has she thought about dance? This actually sounds a lot like my 8 year old girl, she definitely found more kids like her in dance class.",t2_1758vxt9,JonClaudeVanDam,0,1648255709.0,0,t1_i24z30g,i24z30g,True,beerl0ver,t3_to3zza,https://www.reddit.com/r/plano/comments/to3zza/need_some_social_activity_ideas_for_my_lonely_12/,Need some social activity ideas for my lonely 12 year old girl,/r/plano/comments/to3zza/need_some_social_activity_ideas_for_my_lonely_12/i24z30g/,1,r/plano,0,1
"https://pricelessthrifts-edu.com/

I'd love to help her! Check out the website 🤗",t2_6cv9pkx6,micheleprice76,0,1648255522.0,0,t1_i24ypao,i24ypao,True,beerl0ver,t3_to3zza,https://www.reddit.com/r/plano/comments/to3zza/need_some_social_activity_ideas_for_my_lonely_12/,Need some social activity ideas for my lonely 12 year old girl,/r/plano/comments/to3zza/need_some_social_activity_ideas_for_my_lonely_12/i24ypao/,1,r/plano,0,1
Thank you so much. I have added it to my list.,t2_l74e4k0,fransisco_flores,0,1648255451.0,0,t1_i24yk2e,i24yk2e,False,fransisco_flores,t3_tnwk9u,https://www.reddit.com/r/plano/comments/tnwk9u/places_to_run/,Places to run?,/r/plano/comments/tnwk9u/places_to_run/i24yk2e/,1,r/plano,0,1
Windhaven Meadows park,t2_7kbdn,zerocoke,0,1648254804.0,0,t1_i24x846,i24x846,True,fransisco_flores,t3_tnwk9u,https://www.reddit.com/r/plano/comments/tnwk9u/places_to_run/,Places to run?,/r/plano/comments/tnwk9u/places_to_run/i24x846/,1,r/plano,0,1
"If you start at Los Rios and parker it goes down to the nature center parking lot if you head east past the pond there it will go past the golf course off 75 there is a bit of normal sidewalk but it will continue to a big three way trail. I'll trace a map and put it on imgur and edit this comment

Edit: 13 miles one way. Pretty minimal lights but is split up into some sections being sidewalk https://imgur.com/a/5lJu1iq",t2_8bsbpyu4,Mynplus1throwaway,0,1648254573.0,0,t1_i24wqwd,i24wqwd,True,fransisco_flores,t3_tnwk9u,https://www.reddit.com/r/plano/comments/tnwk9u/places_to_run/,Places to run?,/r/plano/comments/tnwk9u/places_to_run/i24wqwd/,1,r/plano,0,1
"[Legacy Trail](https://goo.gl/maps/v8G8ty4UwEy7CpjS8) (bike route because it stays on the trail)

4.3 miles of continuous trail, passes under roadways. 

You can get a little more length on the north end if you cross a few streets (connects to the even longer Preston Ridge Trail, but it has regular crossings). 

On the south end, gmaps doesn't show it (old aerial photos), but the trail continues past the dog park and has a big loop in Windhaven Meadows Park. Probably good for at least 0.5 mile more. Windhaven also now  has good facilities/parking if you need.


A bit further out, but if you like choose your own loop adventures [Breckinridge Park](https://goo.gl/maps/8dAGmascKg3a7wTs9) in Richardson has lots of connected paths.",t2_8kpyp,epakai,0,1648254210.0,0,t1_i24vzvl,i24vzvl,True,fransisco_flores,t3_tnwk9u,https://www.reddit.com/r/plano/comments/tnwk9u/places_to_run/,Places to run?,/r/plano/comments/tnwk9u/places_to_run/i24vzvl/,1,r/plano,0,1
Damn congratulations. I wanted to that one some day.,t2_l74e4k0,fransisco_flores,0,1648252695.0,0,t1_i24stzp,i24stzp,False,fransisco_flores,t3_tnwk9u,https://www.reddit.com/r/plano/comments/tnwk9u/places_to_run/,Places to run?,/r/plano/comments/tnwk9u/places_to_run/i24stzp/,2,r/plano,0,2
Give him a Lloyd Christmas haircut,t2_3ah84ivt,RelevantArrestedDev,0,1648252420.0,0,t1_i24s9bz,i24s9bz,True,Epsom_Pepper,t3_tns7eb,https://www.reddit.com/r/plano/comments/tns7eb/iso_toddler_haircut/,ISO Toddler Haircut,/r/plano/comments/tns7eb/iso_toddler_haircut/i24s9bz/,2,r/plano,0,2
Thanks!,t2_fvxjh,beerl0ver,0,1648252390.0,0,t1_i24s740,i24s740,False,beerl0ver,t3_to3zza,https://www.reddit.com/r/plano/comments/to3zza/need_some_social_activity_ideas_for_my_lonely_12/,Need some social activity ideas for my lonely 12 year old girl,/r/plano/comments/to3zza/need_some_social_activity_ideas_for_my_lonely_12/i24s740/,1,r/plano,0,1
"See if there is a community maker lab in your area and let her explore the different tools and build something.  This would have to be supervised, but there is a good chance she might meet some like minded kids there.  Likewise if her school has this sort of activity.

Indoor skydiving, there are a few locations around dfw where you can do this.  Always lots of fun.

Have fun!",t2_1qp9c5rv,Iridius1789,0,1648251789.0,0,t1_i24qwmv,i24qwmv,True,beerl0ver,t3_to3zza,https://www.reddit.com/r/plano/comments/to3zza/need_some_social_activity_ideas_for_my_lonely_12/,Need some social activity ideas for my lonely 12 year old girl,/r/plano/comments/to3zza/need_some_social_activity_ideas_for_my_lonely_12/i24qwmv/,13,r/plano,0,13
"Lol, honestly just go to cookie cutters and they’ll give him a balloon.",t2_dv5ov7fa,jesuslovesbyu,0,1648251443.0,0,t1_i24q5xx,i24q5xx,False,Epsom_Pepper,t3_tns7eb,https://www.reddit.com/r/plano/comments/tns7eb/iso_toddler_haircut/,ISO Toddler Haircut,/r/plano/comments/tns7eb/iso_toddler_haircut/i24q5xx/,2,r/plano,0,2
"I like bluebonnet trail. It's really long. There are a few crossings, but most are in residential neighborhoods and cars aren't frequent. And now is a great time cause all the bluebonnets are sprouting :)",t2_65b9c,darthdoro,0,1648251328.0,0,t1_i24px3s,i24px3s,True,fransisco_flores,t3_tnwk9u,https://www.reddit.com/r/plano/comments/tnwk9u/places_to_run/,Places to run?,/r/plano/comments/tnwk9u/places_to_run/i24px3s/,1,r/plano,0,1
NYC in November!,t2_d5deo8ip,Sensitive_Parking99,0,1648251182.0,0,t1_i24plen,i24plen,False,fransisco_flores,t3_tnwk9u,https://www.reddit.com/r/plano/comments/tnwk9u/places_to_run/,Places to run?,/r/plano/comments/tnwk9u/places_to_run/i24plen/,2,r/plano,0,2
Are you talking about the part that gets close to 15th (that gets sketch)?,t2_2ya2ke4o,Cowboysin2019,0,1648248920.0,0,t1_i24kmcl,i24kmcl,False,fransisco_flores,t3_tnwk9u,https://www.reddit.com/r/plano/comments/tnwk9u/places_to_run/,Places to run?,/r/plano/comments/tnwk9u/places_to_run/i24kmcl/,1,r/plano,0,1
"Chisholm is perfect for training. It’s very scenic, and like someone else said it goes under Custer, by Christie elementary and under Parker.",t2_2ya2ke4o,Cowboysin2019,0,1648248827.0,0,t1_i24keyl,i24keyl,False,fransisco_flores,t3_tnwk9u,https://www.reddit.com/r/plano/comments/tnwk9u/places_to_run/,Places to run?,/r/plano/comments/tnwk9u/places_to_run/i24keyl/,5,r/plano,0,5
"Park in the lot at Arbor Hills, then run north to Windhaven Parkway, west to Plano Parkway, north to Destination, north to Headquarters, east to Legacy, south to Corporate, south to Tennyson, south on Tennyson which becomes Midway, Midway south to Parker.

The path is about 8 miles, is along roads but only crosses 3, and does so at lights. It's mostly nature- or at least undeveloped property-adjacent and is a lot more pleasant than running through residential streets.

From Arbor Hills, you can go west along Parker but the north side of the street lacks sidewalks in one stretch and is unnecessarily dangerous for pedestrians, in typical Plano fashion. However, if you weather the danger, run Parker to Plano Parkway and take that north, that's an extra mile or so.

There is a very good hill on Windhaven, beginning at the train tracks just east of Plano Parkway and going up to the apartments at Austin Ranch. It's maybe one of the best hills in all of Plano! There's another good hill on Spring Creek, rising as it moves southeast toward Midway.",t2_8qaob,oldpeculiar,0,1648248653.0,0,t1_i24k0z9,i24k0z9,False,fransisco_flores,t3_tnwk9u,https://www.reddit.com/r/plano/comments/tnwk9u/places_to_run/,Places to run?,/r/plano/comments/tnwk9u/places_to_run/i24k0z9/,1,r/plano,0,1
9.5,t2_316vceg9,CanIHaveSomeHoops,0,1648247486.0,0,t1_i24hef0,i24hef0,False,fransisco_flores,t3_tnwk9u,https://www.reddit.com/r/plano/comments/tnwk9u/places_to_run/,Places to run?,/r/plano/comments/tnwk9u/places_to_run/i24hef0/,2,r/plano,0,2
There’s a group that meets Tuesday evenings at Plano West track as well if you’re an after-work runner like myself,t2_bgvld,DJGreenMan,0,1648245976.0,0,t1_i24dzpm,i24dzpm,False,fransisco_flores,t3_tnwk9u,https://www.reddit.com/r/plano/comments/tnwk9u/places_to_run/,Places to run?,/r/plano/comments/tnwk9u/places_to_run/i24dzpm/,1,r/plano,0,1
+1 for Chisholm and Bluebonnet Trails. I’ve trained for many a race on that pavement.,t2_bgvld,DJGreenMan,0,1648245777.0,0,t1_i24dje9,i24dje9,False,fransisco_flores,t3_tnwk9u,https://www.reddit.com/r/plano/comments/tnwk9u/places_to_run/,Places to run?,/r/plano/comments/tnwk9u/places_to_run/i24dje9/,8,r/plano,0,8
"Agreed, Oak Point connects to lots of trails, you can tie them together for long distance training.",t2_3cpgc,MisterTwo,0,1648244928.0,0,t1_i24bl68,i24bl68,False,fransisco_flores,t3_tnwk9u,https://www.reddit.com/r/plano/comments/tnwk9u/places_to_run/,Places to run?,/r/plano/comments/tnwk9u/places_to_run/i24bl68/,3,r/plano,0,3
Coo coo!,t2_k7k7o66v,like_an_uncle,0,1648244651.0,0,t1_i24ayg2,i24ayg2,False,TinyWhiteElephant,t3_tnyhw7,https://www.reddit.com/r/plano/comments/tnyhw7/looking_for_somewhere_to_live_from_may_to_august/,Looking for somewhere to live from May to August,/r/plano/comments/tnyhw7/looking_for_somewhere_to_live_from_may_to_august/i24ayg2/,1,r/plano,0,1
