body,author_fullname,author.name,controversiality,created,downs,fullname,id,is_root,link_author,link_id,link_permalink,link_title,permalink,score,subreddit_name_prefixed,total_awards_received,ups
All the news sites were live streaming on their websites during the storm...............................,t2_k7k7o66v,like_an_uncle,0,1647974073.0,0,t1_i1ozun7,i1ozun7,False,chaimss,t3_tk6tmp,https://www.reddit.com/r/plano/comments/tk6tmp/future_tornado_tracking/,Future Tornado Tracking,/r/plano/comments/tk6tmp/future_tornado_tracking/i1ozun7/,2,r/plano,0,2
"The government: ""A tornado warning means that there's a tornado happening right now.""

Last night: tornado warnings based not on tornado activity, but radar reports only--and WFAA saying that this was justified.

You did not experience a tornado last night.",t2_32kjm,thephotoman,0,1647974046.0,0,t1_i1ozs2k,i1ozs2k,True,Str8upshowpodcast,t3_tjraal,https://www.reddit.com/r/plano/comments/tjraal/just_in_my_first_tornado_that_was_scary/,Just in my first tornado. That was scary.,/r/plano/comments/tjraal/just_in_my_first_tornado_that_was_scary/i1ozs2k/,-3,r/plano,0,-3
"Go to YouTube, search for ""Texas storm chasers""................................",t2_k7k7o66v,like_an_uncle,0,1647974012.0,0,t1_i1ozp0e,i1ozp0e,False,chaimss,t3_tk6tmp,https://www.reddit.com/r/plano/comments/tk6tmp/future_tornado_tracking/,Future Tornado Tracking,/r/plano/comments/tk6tmp/future_tornado_tracking/i1ozp0e/,7,r/plano,0,7
"I bought in October at “the peak of the market” and the Zillow estimate has gone up 15% since then 

I know Zillow estimate isn’t great but still. Jeez. 

I hope for the sake of others that inventory comes up",t2_h160o4y7,BoardGameComputer,0,1647974009.0,0,t1_i1ozooz,i1ozooz,True,DFW_Realtor_Amy,t3_tk7gs4,https://www.reddit.com/r/plano/comments/tk7gs4/plano_singlefamily_housing_market_indicators/,"Plano Single-Family Housing Market Indicators, updated on 03/21/2022",/r/plano/comments/tk7gs4/plano_singlefamily_housing_market_indicators/i1ozooz/,11,r/plano,0,11
"When it comes out in a drug test, it just appears as thc. The test can't tell the difference between delta 8, delta 9, or delta 10 THC",t2_5n9jxzln,BillyFNbones710,0,1647973994.0,0,t1_i1ozndh,i1ozndh,False,[deleted],t3_tk0xuv,https://www.reddit.com/r/plano/comments/tk0xuv/does_city_of_plano_drug_test_for_pot/,Does City of Plano drug test for pot?,/r/plano/comments/tk0xuv/does_city_of_plano_drug_test_for_pot/i1ozndh/,5,r/plano,0,5
"I'm going to guess if they're paying for a drug test, they're going to want it to be negative.",t2_4q9ub,topcity,0,1647973991.0,0,t1_i1ozn25,i1ozn25,False,[deleted],t3_tk0xuv,https://www.reddit.com/r/plano/comments/tk0xuv/does_city_of_plano_drug_test_for_pot/,Does City of Plano drug test for pot?,/r/plano/comments/tk0xuv/does_city_of_plano_drug_test_for_pot/i1ozn25/,5,r/plano,0,5
I think you're making some unfair assumptions.  The Kremlin might be just fine with people smoking weed.,t2_4q9ub,topcity,0,1647973902.0,0,t1_i1ozeqv,i1ozeqv,False,[deleted],t3_tk0xuv,https://www.reddit.com/r/plano/comments/tk0xuv/does_city_of_plano_drug_test_for_pot/,Does City of Plano drug test for pot?,/r/plano/comments/tk0xuv/does_city_of_plano_drug_test_for_pot/i1ozeqv/,3,r/plano,0,3
"Delta 8 is only legal in Texas now due to a temporary injunction, per Texas Supreme Court in January 2022.",t2_6mxs71hc,MuchTimeWastedAgain,0,1647973882.0,0,t1_i1ozczx,i1ozczx,False,[deleted],t3_tk0xuv,https://www.reddit.com/r/plano/comments/tk0xuv/does_city_of_plano_drug_test_for_pot/,Does City of Plano drug test for pot?,/r/plano/comments/tk0xuv/does_city_of_plano_drug_test_for_pot/i1ozczx/,3,r/plano,0,3
"Well then OP. If all else fails, just claim Delta 8 and deny till you’re hired.",t2_n7ds4,bighunter1313,0,1647973860.0,0,t1_i1ozayg,i1ozayg,False,[deleted],t3_tk0xuv,https://www.reddit.com/r/plano/comments/tk0xuv/does_city_of_plano_drug_test_for_pot/,Does City of Plano drug test for pot?,/r/plano/comments/tk0xuv/does_city_of_plano_drug_test_for_pot/i1ozayg/,0,r/plano,0,0
I think so. The law was that they are supposed to send the stuff they find to Austin to be tested in one of a few labs. But the cost is ridiculous for what I heard and read.,t2_7tdg9,alejandor2411,0,1647973778.0,0,t1_i1oz3b4,i1oz3b4,False,[deleted],t3_tk0xuv,https://www.reddit.com/r/plano/comments/tk0xuv/does_city_of_plano_drug_test_for_pot/,Does City of Plano drug test for pot?,/r/plano/comments/tk0xuv/does_city_of_plano_drug_test_for_pot/i1oz3b4/,1,r/plano,0,1
"congratulations, you just triggered a wave of 'random' drug tests for the police department & other city employees.",t2_9p2vnj7u,__fujoshi,0,1647973672.0,0,t1_i1oyt8u,i1oyt8u,False,[deleted],t3_tk0xuv,https://www.reddit.com/r/plano/comments/tk0xuv/does_city_of_plano_drug_test_for_pot/,Does City of Plano drug test for pot?,/r/plano/comments/tk0xuv/does_city_of_plano_drug_test_for_pot/i1oyt8u/,8,r/plano,0,8
Well this guy definitely sounds like a junior just starting out in the workforce. Best to just refrain for good jobs. Adults should be able to do what they want but companies should be able to enforce their own rules of employment within state and federal guidelines. Is a good job really worth a joint? I smoke every day and I think not. I'm also a chef where being stoned is a prerequisite for most jobs.,t2_665eyjj2,joostadood526,0,1647973562.0,0,t1_i1oyj28,i1oyj28,False,[deleted],t3_tk0xuv,https://www.reddit.com/r/plano/comments/tk0xuv/does_city_of_plano_drug_test_for_pot/,Does City of Plano drug test for pot?,/r/plano/comments/tk0xuv/does_city_of_plano_drug_test_for_pot/i1oyj28/,1,r/plano,0,1
"Lol I never said it was easy. Just that it’s the solution to OPs problem. Archaic state won’t let you do what you want in your free time?  Find a new state.  For being the freedom state, Texas sure is controlling.",t2_n7ds4,bighunter1313,0,1647973513.0,0,t1_i1oyejf,i1oyejf,False,[deleted],t3_tk0xuv,https://www.reddit.com/r/plano/comments/tk0xuv/does_city_of_plano_drug_test_for_pot/,Does City of Plano drug test for pot?,/r/plano/comments/tk0xuv/does_city_of_plano_drug_test_for_pot/i1oyejf/,3,r/plano,0,3
I keep trying to find similar plants on our trails.. still no luck.,t2_5h36i,PaleInTexas,0,1647973478.0,0,t1_i1oyb7k,i1oyb7k,False,[deleted],t3_tk0xuv,https://www.reddit.com/r/plano/comments/tk0xuv/does_city_of_plano_drug_test_for_pot/,Does City of Plano drug test for pot?,/r/plano/comments/tk0xuv/does_city_of_plano_drug_test_for_pot/i1oyb7k/,3,r/plano,0,3
Insurers might require it though,t2_746x2jkt,ryhaltswhiskey,0,1647973444.0,0,t1_i1oy7vv,i1oy7vv,False,[deleted],t3_tk0xuv,https://www.reddit.com/r/plano/comments/tk0xuv/does_city_of_plano_drug_test_for_pot/,Does City of Plano drug test for pot?,/r/plano/comments/tk0xuv/does_city_of_plano_drug_test_for_pot/i1oy7vv/,11,r/plano,0,11
Kids? Yes. Adults should be able to do what they want when not working.,t2_n7ds4,bighunter1313,0,1647973370.0,0,t1_i1oy0x9,i1oy0x9,False,[deleted],t3_tk0xuv,https://www.reddit.com/r/plano/comments/tk0xuv/does_city_of_plano_drug_test_for_pot/,Does City of Plano drug test for pot?,/r/plano/comments/tk0xuv/does_city_of_plano_drug_test_for_pot/i1oy0x9/,4,r/plano,0,4
"Ah yes let me just pack up my car that I don’t have with me and my dogs and my student debt, and use my nonexistent savings to go to a state where I won’t get a job because I have no marketable skills because no one will hire me even though I have a degree.

If getting up and moving was as easy as you think it is, half of the US would mass exodus to other places.",t2_307x9s4,cheese_tits_mobile,0,1647973323.0,0,t1_i1oxwk0,i1oxwk0,False,[deleted],t3_tk0xuv,https://www.reddit.com/r/plano/comments/tk0xuv/does_city_of_plano_drug_test_for_pot/,Does City of Plano drug test for pot?,/r/plano/comments/tk0xuv/does_city_of_plano_drug_test_for_pot/i1oxwk0/,4,r/plano,0,4
Or just find a better job that doesn’t regulate what you put in your body during your off time.,t2_n7ds4,bighunter1313,0,1647973257.0,0,t1_i1oxqca,i1oxqca,False,[deleted],t3_tk0xuv,https://www.reddit.com/r/plano/comments/tk0xuv/does_city_of_plano_drug_test_for_pot/,Does City of Plano drug test for pot?,/r/plano/comments/tk0xuv/does_city_of_plano_drug_test_for_pot/i1oxqca/,2,r/plano,0,2
Ya wait would this work? Stupid laws make for stupid loopholes.,t2_n7ds4,bighunter1313,0,1647973148.0,0,t1_i1oxg3b,i1oxg3b,False,[deleted],t3_tk0xuv,https://www.reddit.com/r/plano/comments/tk0xuv/does_city_of_plano_drug_test_for_pot/,Does City of Plano drug test for pot?,/r/plano/comments/tk0xuv/does_city_of_plano_drug_test_for_pot/i1oxg3b/,2,r/plano,0,2
"Tbf, alcohol is legal for officers and fails the exact same standards set here for marijuana. In fact, I’d argue a drunk officer is much more of a threat than a stoned officer.",t2_n7ds4,bighunter1313,0,1647973085.0,0,t1_i1oxa2p,i1oxa2p,False,[deleted],t3_tk0xuv,https://www.reddit.com/r/plano/comments/tk0xuv/does_city_of_plano_drug_test_for_pot/,Does City of Plano drug test for pot?,/r/plano/comments/tk0xuv/does_city_of_plano_drug_test_for_pot/i1oxa2p/,2,r/plano,0,2
"If that's what they are interested in. There are also some great brewery's in the DFW. 

Why not? Prob a lot more chill of an environment than the city. I worked at a vape distribution warehouse locally and all the people were great to be around. Good vibes no doubt.",t2_1s9t5ify,BunchoRigmarole,0,1647973018.0,0,t1_i1ox3o3,i1ox3o3,False,[deleted],t3_tk0xuv,https://www.reddit.com/r/plano/comments/tk0xuv/does_city_of_plano_drug_test_for_pot/,Does City of Plano drug test for pot?,/r/plano/comments/tk0xuv/does_city_of_plano_drug_test_for_pot/i1ox3o3/,3,r/plano,0,3
100000% agree. I would never even travel to such a authoritarian hell hole,t2_42mxh6ks,The_Mustard_Beholder,1,1647973005.0,0,t1_i1ox2g1,i1ox2g1,False,[deleted],t3_tk0xuv,https://www.reddit.com/r/plano/comments/tk0xuv/does_city_of_plano_drug_test_for_pot/,Does City of Plano drug test for pot?,/r/plano/comments/tk0xuv/does_city_of_plano_drug_test_for_pot/i1ox2g1/,-1,r/plano,0,-1
"The best part, I know multiple plano city employees including one police officer who smoke or take edibles on a regular basis. You can say ""No."" all you want, it's still happening. There are numerous ways to pass drug tests, or people just stay clean for awhile until they get a new job and then they go back to habits.",t2_5gfag,malwareguy,0,1647972988.0,0,t1_i1ox0wl,i1ox0wl,False,[deleted],t3_tk0xuv,https://www.reddit.com/r/plano/comments/tk0xuv/does_city_of_plano_drug_test_for_pot/,Does City of Plano drug test for pot?,/r/plano/comments/tk0xuv/does_city_of_plano_drug_test_for_pot/i1ox0wl/,14,r/plano,0,14
So you would say someone who drinks alcohol would be best suited to work at a distillery or brewery because they have beer or a drink every now and then?,t2_5h36i,PaleInTexas,0,1647972920.0,0,t1_i1owujy,i1owujy,False,[deleted],t3_tk0xuv,https://www.reddit.com/r/plano/comments/tk0xuv/does_city_of_plano_drug_test_for_pot/,Does City of Plano drug test for pot?,/r/plano/comments/tk0xuv/does_city_of_plano_drug_test_for_pot/i1owujy/,8,r/plano,0,8
The problem is you’re in Texas. Come to a state with more freedoms.,t2_n7ds4,bighunter1313,0,1647972903.0,0,t1_i1owsw9,i1owsw9,False,[deleted],t3_tk0xuv,https://www.reddit.com/r/plano/comments/tk0xuv/does_city_of_plano_drug_test_for_pot/,Does City of Plano drug test for pot?,/r/plano/comments/tk0xuv/does_city_of_plano_drug_test_for_pot/i1owsw9/,8,r/plano,0,8
Man what a great movie.,t2_5h36i,PaleInTexas,0,1647972821.0,0,t1_i1owlar,i1owlar,False,[deleted],t3_tk0xuv,https://www.reddit.com/r/plano/comments/tk0xuv/does_city_of_plano_drug_test_for_pot/,Does City of Plano drug test for pot?,/r/plano/comments/tk0xuv/does_city_of_plano_drug_test_for_pot/i1owlar/,2,r/plano,0,2
"I am public school teacher in a legal state, and there is no drug testing for my job. The city reserves it for folks who work with heavy machinery or in security.",t2_3wu3d,koreanforrabbit,0,1647972816.0,0,t1_i1owkt5,i1owkt5,False,[deleted],t3_tk0xuv,https://www.reddit.com/r/plano/comments/tk0xuv/does_city_of_plano_drug_test_for_pot/,Does City of Plano drug test for pot?,/r/plano/comments/tk0xuv/does_city_of_plano_drug_test_for_pot/i1owkt5/,2,r/plano,0,2
Just about a home in Plano and the Redfin estimate has gone up 114k,t2_ccmv1xes,plsfixhahaha,0,1647972705.0,0,t1_i1owa6r,i1owa6r,True,DFW_Realtor_Amy,t3_tk7gs4,https://www.reddit.com/r/plano/comments/tk7gs4/plano_singlefamily_housing_market_indicators/,"Plano Single-Family Housing Market Indicators, updated on 03/21/2022",/r/plano/comments/tk7gs4/plano_singlefamily_housing_market_indicators/i1owa6r/,1,r/plano,0,1
Just counting my lucky stars that I'm in Travis county.,t2_5h36i,PaleInTexas,0,1647972122.0,0,t1_i1ourwg,i1ourwg,True,[deleted],t3_tk0xuv,https://www.reddit.com/r/plano/comments/tk0xuv/does_city_of_plano_drug_test_for_pot/,Does City of Plano drug test for pot?,/r/plano/comments/tk0xuv/does_city_of_plano_drug_test_for_pot/i1ourwg/,-5,r/plano,0,-5
And his lettuce.,t2_c124b,FrenchTicklerOrange,0,1647971352.0,0,t1_i1osrzd,i1osrzd,False,[deleted],t3_tk0xuv,https://www.reddit.com/r/plano/comments/tk0xuv/does_city_of_plano_drug_test_for_pot/,Does City of Plano drug test for pot?,/r/plano/comments/tk0xuv/does_city_of_plano_drug_test_for_pot/i1osrzd/,2,r/plano,0,2
"Shit, I won't even go to visit Texas. They've been backsliding into a theocratic nightmare for decades. Fuck Abbott, fuck Ted Cruz, and fuck all the people who keep voting for them.",t2_7nnie,SpoZo91,1,1647971096.0,0,t1_i1os3w1,i1os3w1,False,[deleted],t3_tk0xuv,https://www.reddit.com/r/plano/comments/tk0xuv/does_city_of_plano_drug_test_for_pot/,Does City of Plano drug test for pot?,/r/plano/comments/tk0xuv/does_city_of_plano_drug_test_for_pot/i1os3w1/,3,r/plano,0,3
Probably if you’re looking to be a lifeguard,t2_c1raoek0,SafemoonDrummer,0,1647971004.0,0,t1_i1orv5s,i1orv5s,True,[deleted],t3_tk0xuv,https://www.reddit.com/r/plano/comments/tk0xuv/does_city_of_plano_drug_test_for_pot/,Does City of Plano drug test for pot?,/r/plano/comments/tk0xuv/does_city_of_plano_drug_test_for_pot/i1orv5s/,0,r/plano,0,0
ITT: People being mad a government employer drug tests. ROFL,t2_6v8qt,sfa1500,0,1647970977.0,0,t1_i1orsk6,i1orsk6,False,[deleted],t3_tk0xuv,https://www.reddit.com/r/plano/comments/tk0xuv/does_city_of_plano_drug_test_for_pot/,Does City of Plano drug test for pot?,/r/plano/comments/tk0xuv/does_city_of_plano_drug_test_for_pot/i1orsk6/,20,r/plano,0,20
Could not agree more. I would never move to a shithole state that doesn't even have legal weed. Just another reason to add to the increasing list of reasons why no one should ever move to texas,t2_42mxh6ks,The_Mustard_Beholder,1,1647970933.0,0,t1_i1orogw,i1orogw,False,[deleted],t3_tk0xuv,https://www.reddit.com/r/plano/comments/tk0xuv/does_city_of_plano_drug_test_for_pot/,Does City of Plano drug test for pot?,/r/plano/comments/tk0xuv/does_city_of_plano_drug_test_for_pot/i1orogw/,-4,r/plano,0,-4
Its harmless,t2_d3t1hwf7,blahblahblahblah1989,0,1647970849.0,0,t1_i1orgg2,i1orgg2,False,[deleted],t3_tk0xuv,https://www.reddit.com/r/plano/comments/tk0xuv/does_city_of_plano_drug_test_for_pot/,Does City of Plano drug test for pot?,/r/plano/comments/tk0xuv/does_city_of_plano_drug_test_for_pot/i1orgg2/,3,r/plano,0,3
You can tell them it's delta8 if test comes out positive. It is legal in Texas. I'd say buy some delta 8 just in case they want proof. For them to test if it really is weed in your system  it would be too expensive to be worth it.,t2_7tdg9,alejandor2411,0,1647970779.0,0,t1_i1or9pb,i1or9pb,False,[deleted],t3_tk0xuv,https://www.reddit.com/r/plano/comments/tk0xuv/does_city_of_plano_drug_test_for_pot/,Does City of Plano drug test for pot?,/r/plano/comments/tk0xuv/does_city_of_plano_drug_test_for_pot/i1or9pb/,-1,r/plano,0,-1
Because a city government follows state and federal mandates? Its not private employment,t2_6v8qt,sfa1500,1,1647970749.0,0,t1_i1or6to,i1or6to,False,[deleted],t3_tk0xuv,https://www.reddit.com/r/plano/comments/tk0xuv/does_city_of_plano_drug_test_for_pot/,Does City of Plano drug test for pot?,/r/plano/comments/tk0xuv/does_city_of_plano_drug_test_for_pot/i1or6to/,-1,r/plano,0,-1
From my understanding a standard drug test cannot tell the difference between THC from delta 8 or delta 9. So yes a positive for employment is a positive when it comes to this. Not speaking for Plano just what I've run across in talking to HR at my job about this very issue.,t2_6v8qt,sfa1500,0,1647970705.0,0,t1_i1or2od,i1or2od,False,[deleted],t3_tk0xuv,https://www.reddit.com/r/plano/comments/tk0xuv/does_city_of_plano_drug_test_for_pot/,Does City of Plano drug test for pot?,/r/plano/comments/tk0xuv/does_city_of_plano_drug_test_for_pot/i1or2od/,4,r/plano,0,4
Where do I find that?,t2_snoln,chaimss,1,1647970626.0,0,t1_i1oqvex,i1oqvex,False,chaimss,t3_tk6tmp,https://www.reddit.com/r/plano/comments/tk6tmp/future_tornado_tracking/,Future Tornado Tracking,/r/plano/comments/tk6tmp/future_tornado_tracking/i1oqvex/,1,r/plano,0,1
Thanks! Do you have a link?,t2_snoln,chaimss,1,1647970605.0,0,t1_i1oqtgj,i1oqtgj,False,chaimss,t3_tk6tmp,https://www.reddit.com/r/plano/comments/tk6tmp/future_tornado_tracking/,Future Tornado Tracking,/r/plano/comments/tk6tmp/future_tornado_tracking/i1oqtgj/,-2,r/plano,0,-2
"Exactly, that's what I'm trying to figure out- the NWS site was way way too vague, as was the siren.",t2_snoln,chaimss,0,1647970584.0,0,t1_i1oqrhd,i1oqrhd,False,chaimss,t3_tk6tmp,https://www.reddit.com/r/plano/comments/tk6tmp/future_tornado_tracking/,Future Tornado Tracking,/r/plano/comments/tk6tmp/future_tornado_tracking/i1oqrhd/,-1,r/plano,0,-1
"I don't have a TV in my inner room, so I'm looking for online sources.",t2_snoln,chaimss,1,1647970514.0,0,t1_i1oql27,i1oql27,False,chaimss,t3_tk6tmp,https://www.reddit.com/r/plano/comments/tk6tmp/future_tornado_tracking/,Future Tornado Tracking,/r/plano/comments/tk6tmp/future_tornado_tracking/i1oql27/,-1,r/plano,0,-1
I’m selling piss by the oz now guys,t2_ykh0q,stvntckr,0,1647970315.0,0,t1_i1oq2cy,i1oq2cy,False,[deleted],t3_tk0xuv,https://www.reddit.com/r/plano/comments/tk0xuv/does_city_of_plano_drug_test_for_pot/,Does City of Plano drug test for pot?,/r/plano/comments/tk0xuv/does_city_of_plano_drug_test_for_pot/i1oq2cy/,2,r/plano,0,2
"Not cool Plano. It’s not funny. Let the poor person work for you! Hahaha she smoked weed get fucked? What are you the Kremlin? Who gives a shit? Maybe if you let your staff smoke a j, they wouldn’t be such a miserable lot. 👎 pay people nine dollars an hour and shame then online for smoking weed. Not cool.",t2_fayio93k,CNH00,1,1647970308.0,0,t1_i1oq1rg,i1oq1rg,False,[deleted],t3_tk0xuv,https://www.reddit.com/r/plano/comments/tk0xuv/does_city_of_plano_drug_test_for_pot/,Does City of Plano drug test for pot?,/r/plano/comments/tk0xuv/does_city_of_plano_drug_test_for_pot/i1oq1rg/,2,r/plano,0,2
"This is a very diplomatic answer, OP can read between the lines.",t2_78dij,wrapped_in_clingfilm,0,1647970228.0,0,t1_i1opuci,i1opuci,False,[deleted],t3_tk0xuv,https://www.reddit.com/r/plano/comments/tk0xuv/does_city_of_plano_drug_test_for_pot/,Does City of Plano drug test for pot?,/r/plano/comments/tk0xuv/does_city_of_plano_drug_test_for_pot/i1opuci/,5,r/plano,0,5
I just go to the NWS site.  They only update a tornado warning like every 5 minutes and is all text but they normally will give you the track.  I have learned for every 10 times the sirens go off that only 1 time does it even come close enough to me for us to get into our shelter.,t2_yhkzs,lordb4,0,1647970063.0,0,t1_i1opeqx,i1opeqx,True,chaimss,t3_tk6tmp,https://www.reddit.com/r/plano/comments/tk6tmp/future_tornado_tracking/,Future Tornado Tracking,/r/plano/comments/tk6tmp/future_tornado_tracking/i1opeqx/,2,r/plano,0,2
Every time something like this gets posted makes me realize how far getting a home is out of my reach and I’m doing good for my age lol 😂,t2_orooz,blakey21,0,1647970046.0,0,t1_i1opd4n,i1opd4n,True,DFW_Realtor_Amy,t3_tk7gs4,https://www.reddit.com/r/plano/comments/tk7gs4/plano_singlefamily_housing_market_indicators/,"Plano Single-Family Housing Market Indicators, updated on 03/21/2022",/r/plano/comments/tk7gs4/plano_singlefamily_housing_market_indicators/i1opd4n/,20,r/plano,0,20
And yet I can't find employment. Because of stigma.,t2_3a07y,roberto1,0,1647969591.0,0,t1_i1oo5xy,i1oo5xy,False,[deleted],t3_tk0xuv,https://www.reddit.com/r/plano/comments/tk0xuv/does_city_of_plano_drug_test_for_pot/,Does City of Plano drug test for pot?,/r/plano/comments/tk0xuv/does_city_of_plano_drug_test_for_pot/i1oo5xy/,9,r/plano,0,9
Must also Fuck co-workers. Or so I’ve heard from drug addled restaurant workers.,t2_4d6go,NightMgr,0,1647969081.0,0,t1_i1omtna,i1omtna,False,[deleted],t3_tk0xuv,https://www.reddit.com/r/plano/comments/tk0xuv/does_city_of_plano_drug_test_for_pot/,Does City of Plano drug test for pot?,/r/plano/comments/tk0xuv/does_city_of_plano_drug_test_for_pot/i1omtna/,2,r/plano,0,2
It's one of the worst places in the nation.  Although Alabama is trying hard.,t2_y0cira6,Lalahartma,1,1647969000.0,0,t1_i1omlyr,i1omlyr,False,[deleted],t3_tk0xuv,https://www.reddit.com/r/plano/comments/tk0xuv/does_city_of_plano_drug_test_for_pot/,Does City of Plano drug test for pot?,/r/plano/comments/tk0xuv/does_city_of_plano_drug_test_for_pot/i1omlyr/,-1,r/plano,0,-1
"Texas storm chasers on YouTube. They are live every storm. They tell you exactly where a tornado is, down to the street its passing.",t2_qcinkj,mikethemekanic,0,1647968882.0,0,t1_i1omarm,i1omarm,True,chaimss,t3_tk6tmp,https://www.reddit.com/r/plano/comments/tk6tmp/future_tornado_tracking/,Future Tornado Tracking,/r/plano/comments/tk6tmp/future_tornado_tracking/i1omarm/,16,r/plano,0,16
L,t2_6bydexek,Maxamvs,0,1647968812.0,0,t1_i1om3ux,i1om3ux,True,[deleted],t3_tk0xuv,https://www.reddit.com/r/plano/comments/tk0xuv/does_city_of_plano_drug_test_for_pot/,Does City of Plano drug test for pot?,/r/plano/comments/tk0xuv/does_city_of_plano_drug_test_for_pot/i1om3ux/,0,r/plano,0,0
Fucking lame. Texas sucks.,t2_7nnie,SpoZo91,1,1647968585.0,0,t1_i1olihn,i1olihn,False,[deleted],t3_tk0xuv,https://www.reddit.com/r/plano/comments/tk0xuv/does_city_of_plano_drug_test_for_pot/,Does City of Plano drug test for pot?,/r/plano/comments/tk0xuv/does_city_of_plano_drug_test_for_pot/i1olihn/,1,r/plano,0,1
Bullshit. I work for my state government. Never had to take a drug test. I smoke pot every single day.,t2_7nnie,SpoZo91,0,1647968487.0,0,t1_i1ol99f,i1ol99f,False,[deleted],t3_tk0xuv,https://www.reddit.com/r/plano/comments/tk0xuv/does_city_of_plano_drug_test_for_pot/,Does City of Plano drug test for pot?,/r/plano/comments/tk0xuv/does_city_of_plano_drug_test_for_pot/i1ol99f/,11,r/plano,0,11
"Restaurants drug test- if you aren’t on drugs you can’t work in a restaurant. 
Fact",t2_jex09b9e,Innernetofbling,0,1647968472.0,0,t1_i1ol7w1,i1ol7w1,False,[deleted],t3_tk0xuv,https://www.reddit.com/r/plano/comments/tk0xuv/does_city_of_plano_drug_test_for_pot/,Does City of Plano drug test for pot?,/r/plano/comments/tk0xuv/does_city_of_plano_drug_test_for_pot/i1ol7w1/,3,r/plano,0,3
"U/CityOfPlano probably has clean urine, but I doubt they would be willing to share with OP",t2_856y2c6p,Prestigious-Ad-6808,0,1647968357.0,0,t1_i1okx09,i1okx09,False,[deleted],t3_tk0xuv,https://www.reddit.com/r/plano/comments/tk0xuv/does_city_of_plano_drug_test_for_pot/,Does City of Plano drug test for pot?,/r/plano/comments/tk0xuv/does_city_of_plano_drug_test_for_pot/i1okx09/,3,r/plano,0,3
Fuck Texas.,t2_69w7s,tonzeejee,1,1647968113.0,0,t1_i1ok9vb,i1ok9vb,True,[deleted],t3_tk0xuv,https://www.reddit.com/r/plano/comments/tk0xuv/does_city_of_plano_drug_test_for_pot/,Does City of Plano drug test for pot?,/r/plano/comments/tk0xuv/does_city_of_plano_drug_test_for_pot/i1ok9vb/,2,r/plano,0,2
"This also makes sense because police officers are driving and using other equipment that shouldn't be used in an impaired state. If you're just working rec concessions or something you might not even get tested. 

Granted, I wouldn't be asking about this on a site that has some of my personal data and possibly pictures of myself.",t2_rv6en1k,adotfree,0,1647967982.0,0,t1_i1ojxbq,i1ojxbq,False,[deleted],t3_tk0xuv,https://www.reddit.com/r/plano/comments/tk0xuv/does_city_of_plano_drug_test_for_pot/,Does City of Plano drug test for pot?,/r/plano/comments/tk0xuv/does_city_of_plano_drug_test_for_pot/i1ojxbq/,0,r/plano,0,0
"Yes, but the question was, ""do they test for weed?"" The good follow up posted was what if it's legal deltaV, delta8, delta10, hhc, thc-O, or any of the other perfectly legal forms of thc that are not at all illegal in texas and not the illegal delta9? There are plenty of people out there who fall into this bucket.",t2_nu8zn,redthump,0,1647967806.0,0,t1_i1ojghp,i1ojghp,False,[deleted],t3_tk0xuv,https://www.reddit.com/r/plano/comments/tk0xuv/does_city_of_plano_drug_test_for_pot/,Does City of Plano drug test for pot?,/r/plano/comments/tk0xuv/does_city_of_plano_drug_test_for_pot/i1ojghp/,2,r/plano,0,2
Pete Delkus does a great job at alerting where tornadoes are.,t2_fnpcn31r,The_Only_Dick_Cheney,0,1647967610.0,0,t1_i1oixyb,i1oixyb,True,chaimss,t3_tk6tmp,https://www.reddit.com/r/plano/comments/tk6tmp/future_tornado_tracking/,Future Tornado Tracking,/r/plano/comments/tk6tmp/future_tornado_tracking/i1oixyb/,32,r/plano,0,32
I watched the Keanu reeves movie last night and saw how lucrative it was.,t2_5wqny,DanetOfTheApes,0,1647967603.0,0,t1_i1oixci,i1oixci,False,[deleted],t3_tk0xuv,https://www.reddit.com/r/plano/comments/tk0xuv/does_city_of_plano_drug_test_for_pot/,Does City of Plano drug test for pot?,/r/plano/comments/tk0xuv/does_city_of_plano_drug_test_for_pot/i1oixci/,6,r/plano,0,6
