body,author_fullname,author.name,controversiality,created,downs,fullname,id,is_root,link_author,link_id,link_permalink,link_title,permalink,score,subreddit_name_prefixed,total_awards_received,ups
"The difference with tvgYOU is that The Vested Group pays for a handful of approved classes that fit our ""curriculum"" but we are also offering a full-time salary and benefits. This program is allowing its recruits to have a chance at having a sought-after career, whereas they might not have had that chance otherwise (home caretaker, low household income, first-generation immigrants, etc.). This really is a life-changing opportunity for people who can't afford to go to college or are looking for other routes to take to grow a career.",t2_oagwcsz,sdawnp,0,1648045582.0,0,t1_i1sr80p,i1sr80p,False,sdawnp,t3_tkfe14,https://www.reddit.com/r/plano/comments/tkfe14/career_opportunity_for_high_school_graduates_in/,Career opportunity for high school graduates in DFW,/r/plano/comments/tkfe14/career_opportunity_for_high_school_graduates_in/i1sr80p/,3,r/plano,0,3
"What is your degree or license?

Working with elderly, in nursing homes or assisted care facilities, the pay is extremely low in Texas, but I don't know about working with younger people who have disabilities.",t2_63f4jgo7,FrostyLandscape,0,1648043877.0,0,t1_i1sn4fq,i1sn4fq,True,nvr_knows_best,t3_tknflq,https://www.reddit.com/r/plano/comments/tknflq/group_home_jobs/,Group home jobs.,/r/plano/comments/tknflq/group_home_jobs/i1sn4fq/,2,r/plano,0,2
"I feel you. Have two of my own. It's a challenge. Storm season happens every year and there are patterns you can recognize. There are also stages that escalate up to the local sirens going off. Start with being prepared for that final stage of sheltering in a closet. Have some emergency supplies but also have some fun things for the kids. Games, snacks, coloring or anything else that will help keep them occupied. Make the whole process a fun drill so they learn and aren't too scared that something bad is going to happen.  You don't need to stay in the stuffy closet for a county wide warning. For the most part, just be prepared and close to your shelter location so you can get everyone in. Awareness is the idea. If something does happen you'll know it's happening.",t2_10tziq,BPCodeMonkey,0,1648043578.0,0,t1_i1smfal,i1smfal,False,chaimss,t3_tk6tmp,https://www.reddit.com/r/plano/comments/tk6tmp/future_tornado_tracking/,Future Tornado Tracking,/r/plano/comments/tk6tmp/future_tornado_tracking/i1smfal/,1,r/plano,0,1
LOL,t2_95q2b,didled,0,1648043023.0,0,t1_i1sl4lb,i1sl4lb,False,[deleted],t3_tk0xuv,https://www.reddit.com/r/plano/comments/tk0xuv/does_city_of_plano_drug_test_for_pot/,Does City of Plano drug test for pot?,/r/plano/comments/tk0xuv/does_city_of_plano_drug_test_for_pot/i1sl4lb/,1,r/plano,0,1
If you are interested in working at a residence camp for people of all ages with disabilities send me a message.,t2_25j5twb,TravelingChick,0,1648041646.0,0,t1_i1si1b9,i1si1b9,True,nvr_knows_best,t3_tknflq,https://www.reddit.com/r/plano/comments/tknflq/group_home_jobs/,Group home jobs.,/r/plano/comments/tknflq/group_home_jobs/i1si1b9/,2,r/plano,0,2
"Yeah ""medical"" doesn't exist here, or not really",t2_cj7cy,itsacalamity,0,1648039812.0,0,t1_i1se814,i1se814,False,[deleted],t3_tk0xuv,https://www.reddit.com/r/plano/comments/tk0xuv/does_city_of_plano_drug_test_for_pot/,Does City of Plano drug test for pot?,/r/plano/comments/tk0xuv/does_city_of_plano_drug_test_for_pot/i1se814/,2,r/plano,0,2
"Thank you, and I appreciate that. The biggest issue for me is that it's not so easy to keep little kids in a fairly enclosed space for an extended period of time without them trying to run out. 5 to 10 minutes should be fine, but much above that and the chances of them staying put are pretty low. That's why I'm trying to find out the best way to know where it is, so we can pick the right moment to make sure they're actually in there, rather than bringing them in immediately and hoping they just sit still for 45 minutes to an hour.",t2_snoln,chaimss,0,1648039049.0,0,t1_i1scquj,i1scquj,False,chaimss,t3_tk6tmp,https://www.reddit.com/r/plano/comments/tk6tmp/future_tornado_tracking/,Future Tornado Tracking,/r/plano/comments/tk6tmp/future_tornado_tracking/i1scquj/,2,r/plano,0,2
My Possibilities?,t2_9fphc,heinzenfeinzen,0,1648038506.0,0,t1_i1sbq8l,i1sbq8l,True,nvr_knows_best,t3_tknflq,https://www.reddit.com/r/plano/comments/tknflq/group_home_jobs/,Group home jobs.,/r/plano/comments/tknflq/group_home_jobs/i1sbq8l/,6,r/plano,0,6
Christians are the real plague here.,t2_50xhb,properdkings,0,1648037781.0,0,t1_i1saean,i1saean,False,apollloo_,t3_thjsqs,https://www.reddit.com/r/plano/comments/thjsqs/cannabis_delta_8/,Cannabis & Delta 8,/r/plano/comments/thjsqs/cannabis_delta_8/i1saean/,2,r/plano,0,2
Not true. If TX employer opts out of WC they are required to provide “like coverage” which is called Texas non-subscriber coverage. Very similar and less expensive generally.,t2_3ve4q2ja,SonOfAMom808,0,1648036848.0,0,t1_i1s8rgi,i1s8rgi,False,[deleted],t3_tk0xuv,https://www.reddit.com/r/plano/comments/tk0xuv/does_city_of_plano_drug_test_for_pot/,Does City of Plano drug test for pot?,/r/plano/comments/tk0xuv/does_city_of_plano_drug_test_for_pot/i1s8rgi/,1,r/plano,0,1
"Say no all you want, everyone still does it. It's a dumb policy to begin with",t2_oa4x3ei,AegisThievenaix,0,1648036411.0,0,t1_i1s80zy,i1s80zy,False,[deleted],t3_tk0xuv,https://www.reddit.com/r/plano/comments/tk0xuv/does_city_of_plano_drug_test_for_pot/,Does City of Plano drug test for pot?,/r/plano/comments/tk0xuv/does_city_of_plano_drug_test_for_pot/i1s80zy/,0,r/plano,0,0
"Yeah, I need back surgery (discectomy) but worker’s comp says data is unclear and didn’t pay for steroid injections",t2_ci4ysa3y,Gunz_R_bad,0,1648036009.0,0,t1_i1s7cxf,i1s7cxf,False,[deleted],t3_tk0xuv,https://www.reddit.com/r/plano/comments/tk0xuv/does_city_of_plano_drug_test_for_pot/,Does City of Plano drug test for pot?,/r/plano/comments/tk0xuv/does_city_of_plano_drug_test_for_pot/i1s7cxf/,1,r/plano,0,1
Good for you? Pre-employment drug screening is still federally mandated?,t2_4dugpw7m,mtwiasted,0,1648035989.0,0,t1_i1s7bt9,i1s7bt9,False,[deleted],t3_tk0xuv,https://www.reddit.com/r/plano/comments/tk0xuv/does_city_of_plano_drug_test_for_pot/,Does City of Plano drug test for pot?,/r/plano/comments/tk0xuv/does_city_of_plano_drug_test_for_pot/i1s7bt9/,1,r/plano,0,1
"Lol…this doesnt mean a shit!!

Mortgage rates have shot to 5% in last 15 days

Wait till fed dumps 3 trillion dollars in MBS starting May.

Housing market n home builders will get a realty check😁",t2_hu06ojg3,bersrfuk69,0,1648033874.0,0,t1_i1s40bj,i1s40bj,True,DFW_Realtor_Amy,t3_tk7gs4,https://www.reddit.com/r/plano/comments/tk7gs4/plano_singlefamily_housing_market_indicators/,"Plano Single-Family Housing Market Indicators, updated on 03/21/2022",/r/plano/comments/tk7gs4/plano_singlefamily_housing_market_indicators/i1s40bj/,4,r/plano,0,4
"All the land along DNT and 75 is zoned office - some of this is being converted to mixed use. 

No one wants a one story that backs up to tollway.",t2_dmhr,unexpected,0,1648028495.0,0,t1_i1rwxx7,i1rwxx7,False,DFW_Realtor_Amy,t3_tk7gs4,https://www.reddit.com/r/plano/comments/tk7gs4/plano_singlefamily_housing_market_indicators/,"Plano Single-Family Housing Market Indicators, updated on 03/21/2022",/r/plano/comments/tk7gs4/plano_singlefamily_housing_market_indicators/i1rwxx7/,2,r/plano,0,2
Are you licensed? I believe you have to be certified to worked with state level disabled people in TX. But I’m sure there are a lot of programs through social work you can find.,t2_k9w9g06z,ConsistentWishbonez,0,1648025539.0,0,t1_i1rtjqk,i1rtjqk,True,nvr_knows_best,t3_tknflq,https://www.reddit.com/r/plano/comments/tknflq/group_home_jobs/,Group home jobs.,/r/plano/comments/tknflq/group_home_jobs/i1rtjqk/,3,r/plano,0,3
"This is kind of a hard argument vs collin colleges IT program that is basically free (1200$ a year tax credit) which is a national accredited IT program. Dallas for sure, but technically your located in Plano.",t2_k9w9g06z,ConsistentWishbonez,0,1648021658.0,0,t1_i1rp4pp,i1rp4pp,True,sdawnp,t3_tkfe14,https://www.reddit.com/r/plano/comments/tkfe14/career_opportunity_for_high_school_graduates_in/,Career opportunity for high school graduates in DFW,/r/plano/comments/tkfe14/career_opportunity_for_high_school_graduates_in/i1rp4pp/,5,r/plano,0,5
Worth in the case of certain public outrages such as this,t2_fd7f45vp,QCDElektraWeek,0,1648019704.0,0,t1_i1rmvhc,i1rmvhc,False,[deleted],t3_tk0xuv,https://www.reddit.com/r/plano/comments/tk0xuv/does_city_of_plano_drug_test_for_pot/,Does City of Plano drug test for pot?,/r/plano/comments/tk0xuv/does_city_of_plano_drug_test_for_pot/i1rmvhc/,1,r/plano,0,1
"Please cancel that phrase from your vocabulary. Surely you can think of a negative descriptor other than ""black""?",t2_fd7f45vp,QCDElektraWeek,0,1648019532.0,0,t1_i1rmof8,i1rmof8,False,[deleted],t3_tk0xuv,https://www.reddit.com/r/plano/comments/tk0xuv/does_city_of_plano_drug_test_for_pot/,Does City of Plano drug test for pot?,/r/plano/comments/tk0xuv/does_city_of_plano_drug_test_for_pot/i1rmof8/,1,r/plano,0,1
"I think there’s a documentary on Roomates on Netflix, see how they found them",t2_251smber,yeah_im_a_leopard2,0,1648017966.0,0,t1_i1rksl6,i1rksl6,True,scroto_gaggins,t3_tk93q0,https://www.reddit.com/r/plano/comments/tk93q0/finding_a_roommate/,Finding a roommate,/r/plano/comments/tk93q0/finding_a_roommate/i1rksl6/,2,r/plano,0,2
"Why? Guarantee you have alcoholics working there who perform worse than someone who likes to smoke some weed in the evenings or on weekends.  

Why does something someone does in their personal time make them ineligible from employment there?",t2_h86h6sdb,juan_epstein-barr,0,1648016893.0,0,t1_i1rjhhj,i1rjhhj,False,[deleted],t3_tk0xuv,https://www.reddit.com/r/plano/comments/tk0xuv/does_city_of_plano_drug_test_for_pot/,Does City of Plano drug test for pot?,/r/plano/comments/tk0xuv/does_city_of_plano_drug_test_for_pot/i1rjhhj/,0,r/plano,0,0
"Nextdoor is a cesspool. 

Radar apps for when storms break - RadarScope, Texas storm chasers

Monitor weather weekly on blogs like Texas storm chasers or other weather sites. Don’t wait for the actual day of. The more you read about how the weather here operates the better off you’ll be.

Have a storm plan in place - forget live tracking a tornado - tornadoes can shift, jump, swerve and expand in size. All you need to know is that if the sirens or  warning goes off you need to get to your safe spot and stay there until the warning expires.",t2_80wym,la-fours,0,1648014980.0,0,t1_i1rh15c,i1rh15c,True,chaimss,t3_tk6tmp,https://www.reddit.com/r/plano/comments/tk6tmp/future_tornado_tracking/,Future Tornado Tracking,/r/plano/comments/tk6tmp/future_tornado_tracking/i1rh15c/,2,r/plano,0,2
This is the way.,t2_cb6k3,Nacho_Papi,0,1648011056.0,0,t1_i1rbh1x,i1rbh1x,False,[deleted],t3_tk0xuv,https://www.reddit.com/r/plano/comments/tk0xuv/does_city_of_plano_drug_test_for_pot/,Does City of Plano drug test for pot?,/r/plano/comments/tk0xuv/does_city_of_plano_drug_test_for_pot/i1rbh1x/,1,r/plano,0,1
Can i do chemistry experiments in the room? I have my own fume hood.,t2_kw6gmtz1,D00msdaydevice666,1,1648009984.0,0,t1_i1r9r9g,i1r9r9g,True,euphoniumhumper,t3_tkiwrq,https://www.reddit.com/r/plano/comments/tkiwrq/rooms_available_for_rent_near_shawnee_park/,Rooms available for Rent near Shawnee Park,/r/plano/comments/tkiwrq/rooms_available_for_rent_near_shawnee_park/i1r9r9g/,2,r/plano,0,2
Lmao in some of those shit counties the christapo trash still prevents you from buying alcohol. What an amazing definition of “freedom” those cowboys have.,t2_jxb1hd2i,Generic_username242,0,1648009637.0,0,t1_i1r96y3,i1r96y3,False,[deleted],t3_tk0xuv,https://www.reddit.com/r/plano/comments/tk0xuv/does_city_of_plano_drug_test_for_pot/,Does City of Plano drug test for pot?,/r/plano/comments/tk0xuv/does_city_of_plano_drug_test_for_pot/i1r96y3/,1,r/plano,0,1
I worked for a summer at the NASA Jet Propulsion Lab and they didn't even drug test me.,t2_z97yw,queensekhmet,0,1648009547.0,0,t1_i1r91pv,i1r91pv,False,[deleted],t3_tk0xuv,https://www.reddit.com/r/plano/comments/tk0xuv/does_city_of_plano_drug_test_for_pot/,Does City of Plano drug test for pot?,/r/plano/comments/tk0xuv/does_city_of_plano_drug_test_for_pot/i1r91pv/,1,r/plano,0,1
"Thank you. We pride ourselves on being open to and with the public, however zany.",t2_coq3fuwg,ShelbyHWilliams,0,1648009221.0,0,t1_i1r8i8o,i1r8i8o,False,sommer_m,t3_tfr691,https://www.reddit.com/r/plano/comments/tfr691/proud_of_our_town/,Proud of our town,/r/plano/comments/tfr691/proud_of_our_town/i1r8i8o/,2,r/plano,0,2
"Its funny, my friend from NZ literally said ""we really like two syllable things down here, gets dicey with any more."" And then was interested that I say ""motherfucker"" in parlance. I think we have a long way to go before we master the language enough to get to the level of y'all.",t2_ff2fozr3,Zealousideal_Leg3268,0,1648008527.0,0,t1_i1r7bpf,i1r7bpf,False,[deleted],t3_tk0xuv,https://www.reddit.com/r/plano/comments/tk0xuv/does_city_of_plano_drug_test_for_pot/,Does City of Plano drug test for pot?,/r/plano/comments/tk0xuv/does_city_of_plano_drug_test_for_pot/i1r7bpf/,0,r/plano,0,0
"Oh, and incidentally, I also do an annual Property Tax 101 seminar when valuations are issued in April/May. I hope to see you at this year's.",t2_coq3fuwg,ShelbyHWilliams,0,1648007970.0,0,t1_i1r6cgr,i1r6cgr,False,ShelbyHWilliams,t3_sce4xq,https://www.reddit.com/r/plano/comments/sce4xq/plano_city_council_recap_january_24_2022/,"Plano City Council Recap - January 24, 2022",/r/plano/comments/sce4xq/plano_city_council_recap_january_24_2022/i1r6cgr/,1,r/plano,0,1
That’s dehumanizing.,t2_gw3wsusy,BuriedMeat,0,1648007947.0,0,t1_i1r6b4s,i1r6b4s,False,[deleted],t3_tk0xuv,https://www.reddit.com/r/plano/comments/tk0xuv/does_city_of_plano_drug_test_for_pot/,Does City of Plano drug test for pot?,/r/plano/comments/tk0xuv/does_city_of_plano_drug_test_for_pot/i1r6b4s/,0,r/plano,0,0
It sounds like you’re judging people who smoke weed. There’s nothing immoral about smoking it.,t2_gw3wsusy,BuriedMeat,0,1648007886.0,0,t1_i1r6784,i1r6784,False,[deleted],t3_tk0xuv,https://www.reddit.com/r/plano/comments/tk0xuv/does_city_of_plano_drug_test_for_pot/,Does City of Plano drug test for pot?,/r/plano/comments/tk0xuv/does_city_of_plano_drug_test_for_pot/i1r6784/,1,r/plano,0,1
"No studying before the test,chief!🤣😂💨💨",t2_9o78xp9g,One_Catch_9173,0,1648007222.0,0,t1_i1r50ac,i1r50ac,True,[deleted],t3_tk0xuv,https://www.reddit.com/r/plano/comments/tk0xuv/does_city_of_plano_drug_test_for_pot/,Does City of Plano drug test for pot?,/r/plano/comments/tk0xuv/does_city_of_plano_drug_test_for_pot/i1r50ac/,0,r/plano,0,0
Yea but usually if it test positive on sight the sample gets sent to a lab for verification,t2_3p6i1ysw,FuzzyCrocks,0,1648006608.0,0,t1_i1r3w76,i1r3w76,False,[deleted],t3_tk0xuv,https://www.reddit.com/r/plano/comments/tk0xuv/does_city_of_plano_drug_test_for_pot/,Does City of Plano drug test for pot?,/r/plano/comments/tk0xuv/does_city_of_plano_drug_test_for_pot/i1r3w76/,1,r/plano,0,1
"Bro youre such a liar man. Why do people make up shit on reddit so often??
In the last week, according to your post history, youve been employed as:
- A screenwriter
- A teacher
- A covid compliance officer
- You're working at a law firm
- You're joining the airforce

Bro just pick one story and stick with it",t2_kcf9y,Nanaman360,0,1648006374.0,0,t1_i1r3gnx,i1r3gnx,False,[deleted],t3_tk0xuv,https://www.reddit.com/r/plano/comments/tk0xuv/does_city_of_plano_drug_test_for_pot/,Does City of Plano drug test for pot?,/r/plano/comments/tk0xuv/does_city_of_plano_drug_test_for_pot/i1r3gnx/,4,r/plano,0,4
Ohhhh boy,t2_3p6i1ysw,FuzzyCrocks,0,1648006056.0,0,t1_i1r2v8r,i1r2v8r,False,[deleted],t3_tk0xuv,https://www.reddit.com/r/plano/comments/tk0xuv/does_city_of_plano_drug_test_for_pot/,Does City of Plano drug test for pot?,/r/plano/comments/tk0xuv/does_city_of_plano_drug_test_for_pot/i1r2v8r/,1,r/plano,0,1
We live to hit up White Rock Lake for kayaking and biking too,t2_hizt2,kevntao,0,1648005881.0,0,t1_i1r2jgw,i1r2jgw,False,Only-Letterhead-4395,t3_tjkmoe,https://www.reddit.com/r/plano/comments/tjkmoe/looking_for_someone_or_group_to_do_activities_on/,"Looking for someone or group to do activities on weekends like Kayak, Running or Hiking",/r/plano/comments/tjkmoe/looking_for_someone_or_group_to_do_activities_on/i1r2jgw/,1,r/plano,0,1
"The trick is to reduce words down to two syllables but keep them understandable, at least in context.

Sunnies = sunglasses.
Jezza = Jeremy
etc.",t2_qp2je,cmdwedge,0,1648004817.0,0,t1_i1r0hvm,i1r0hvm,False,[deleted],t3_tk0xuv,https://www.reddit.com/r/plano/comments/tk0xuv/does_city_of_plano_drug_test_for_pot/,Does City of Plano drug test for pot?,/r/plano/comments/tk0xuv/does_city_of_plano_drug_test_for_pot/i1r0hvm/,0,r/plano,0,0
"You all are magnificent, just throwing Z's and A's on shit and making it work. Jezza is a brilliant nick name.",t2_ff2fozr3,Zealousideal_Leg3268,0,1648003695.0,0,t1_i1qy9jy,i1qy9jy,False,[deleted],t3_tk0xuv,https://www.reddit.com/r/plano/comments/tk0xuv/does_city_of_plano_drug_test_for_pot/,Does City of Plano drug test for pot?,/r/plano/comments/tk0xuv/does_city_of_plano_drug_test_for_pot/i1qy9jy/,0,r/plano,0,0
"The real answer is now to use fake piss, available at any friendly neighborhood head shop. Quick fix is a good brand, I've heard through the grapevine (heard my echo through that bitch because I was high as shit, works great)",t2_ff2fozr3,Zealousideal_Leg3268,0,1648003627.0,0,t1_i1qy4j6,i1qy4j6,False,[deleted],t3_tk0xuv,https://www.reddit.com/r/plano/comments/tk0xuv/does_city_of_plano_drug_test_for_pot/,Does City of Plano drug test for pot?,/r/plano/comments/tk0xuv/does_city_of_plano_drug_test_for_pot/i1qy4j6/,1,r/plano,0,1
"There have been 2 roommate searching posts this week, reach out to them! (I'm too lazy to search)


Edit. I lied. Here's the first


https://www.reddit.com/r/plano/comments/tk93q0/finding_a_roommate/?sort=top


And the second

https://www.reddit.com/r/plano/comments/thlczy/anyone_looking_for_roommates_to_move_to_plano/?sort=top


u/scroto_gaggins

u/vincents_hope",t2_k7k7o66v,like_an_uncle,0,1648003504.0,0,t1_i1qxvon,i1qxvon,True,euphoniumhumper,t3_tkiwrq,https://www.reddit.com/r/plano/comments/tkiwrq/rooms_available_for_rent_near_shawnee_park/,Rooms available for Rent near Shawnee Park,/r/plano/comments/tkiwrq/rooms_available_for_rent_near_shawnee_park/i1qxvon/,8,r/plano,0,8
What's wrong with that name? That was my great-uncle's name.,t2_15g8sm,Madly_Maxie,0,1648003280.0,0,t1_i1qxfca,i1qxfca,False,[deleted],t3_tk0xuv,https://www.reddit.com/r/plano/comments/tk0xuv/does_city_of_plano_drug_test_for_pot/,Does City of Plano drug test for pot?,/r/plano/comments/tk0xuv/does_city_of_plano_drug_test_for_pot/i1qxfca/,1,r/plano,0,1
"Thank you, this made my day.",t2_7wn94,bkwilcox100,0,1648003169.0,0,t1_i1qx71s,i1qx71s,False,[deleted],t3_tk0xuv,https://www.reddit.com/r/plano/comments/tk0xuv/does_city_of_plano_drug_test_for_pot/,Does City of Plano drug test for pot?,/r/plano/comments/tk0xuv/does_city_of_plano_drug_test_for_pot/i1qx71s/,1,r/plano,0,1
Lmao your snoo looks like a hooker,t2_kw6gmtz1,D00msdaydevice666,0,1648002597.0,0,t1_i1qw01s,i1qw01s,False,[deleted],t3_tk0xuv,https://www.reddit.com/r/plano/comments/tk0xuv/does_city_of_plano_drug_test_for_pot/,Does City of Plano drug test for pot?,/r/plano/comments/tk0xuv/does_city_of_plano_drug_test_for_pot/i1qw01s/,-1,r/plano,0,-1
You can also just go to wfaa’s website. They live stream from there as well.,t2_xroda,ShotgunBetty01,0,1648001818.0,0,t1_i1qudbx,i1qudbx,False,chaimss,t3_tk6tmp,https://www.reddit.com/r/plano/comments/tk6tmp/future_tornado_tracking/,Future Tornado Tracking,/r/plano/comments/tk6tmp/future_tornado_tracking/i1qudbx/,1,r/plano,0,1
Username checks out,t2_5594x,eponymouse,0,1648001600.0,0,t1_i1qtwqz,i1qtwqz,False,[deleted],t3_tk0xuv,https://www.reddit.com/r/plano/comments/tk0xuv/does_city_of_plano_drug_test_for_pot/,Does City of Plano drug test for pot?,/r/plano/comments/tk0xuv/does_city_of_plano_drug_test_for_pot/i1qtwqz/,1,r/plano,0,1
"MLS, it has both sales and lease info for single family homes",t2_fv1jxuly,DFW_Realtor_Amy,0,1648001452.0,0,t1_i1qtljc,i1qtljc,False,DFW_Realtor_Amy,t3_tk7gs4,https://www.reddit.com/r/plano/comments/tk7gs4/plano_singlefamily_housing_market_indicators/,"Plano Single-Family Housing Market Indicators, updated on 03/21/2022",/r/plano/comments/tk7gs4/plano_singlefamily_housing_market_indicators/i1qtljc/,2,r/plano,0,2
What’s the source for lease rates? I’m sure MLS is source for sales data.,t2_fjltw,masterscotto,0,1648001367.0,0,t1_i1qtez4,i1qtez4,True,DFW_Realtor_Amy,t3_tk7gs4,https://www.reddit.com/r/plano/comments/tk7gs4/plano_singlefamily_housing_market_indicators/,"Plano Single-Family Housing Market Indicators, updated on 03/21/2022",/r/plano/comments/tk7gs4/plano_singlefamily_housing_market_indicators/i1qtez4/,0,r/plano,0,0
Did you just post this the other day,t2_3xv74rn4,Amockdfw89,0,1648001211.0,0,t1_i1qt30y,i1qt30y,True,[deleted],t3_tk0xuv,https://www.reddit.com/r/plano/comments/tk0xuv/does_city_of_plano_drug_test_for_pot/,Does City of Plano drug test for pot?,/r/plano/comments/tk0xuv/does_city_of_plano_drug_test_for_pot/i1qt30y/,0,r/plano,0,0
They moved to Park and Midway,t2_3xv74rn4,Amockdfw89,0,1648001172.0,0,t1_i1qt022,i1qt022,False,Street_Remote6105,t3_tizxwc,https://www.reddit.com/r/plano/comments/tizxwc/odd_question_but_does_anyone_know_places_to_get/,"Odd question, but does anyone know places to get (hopefully kinda cheap) kinda vintage, vaguely WWII era looking nicknacks?",/r/plano/comments/tizxwc/odd_question_but_does_anyone_know_places_to_get/i1qt022/,2,r/plano,0,2
"Most that I see I don't think are what society defines as homeless. 

Technically yes, couch surfing, staying with family maybe, but not camping under the bridge homeless. 

They likely have 2 forms of ID. But $1 per light cycle is decent money.",t2_138wqm,phycon55,0,1647998953.0,0,t1_i1qo4zd,i1qo4zd,False,CityOfPlano,t3_tgi2f6,https://www.reddit.com/r/plano/comments/tgi2f6/what_you_need_to_know_about_pedestrian_safety_in/,What You Need to Know about Pedestrian Safety in Intersections,/r/plano/comments/tgi2f6/what_you_need_to_know_about_pedestrian_safety_in/i1qo4zd/,1,r/plano,0,1
Privilege?,t2_16r7ie,Nosa2k,0,1647998252.0,0,t1_i1qmloh,i1qmloh,False,[deleted],t3_tk0xuv,https://www.reddit.com/r/plano/comments/tk0xuv/does_city_of_plano_drug_test_for_pot/,Does City of Plano drug test for pot?,/r/plano/comments/tk0xuv/does_city_of_plano_drug_test_for_pot/i1qmloh/,1,r/plano,0,1
"Well because of your comment, now they're going to blow all that cash and drug test everyone.",t2_l1537,selfiejon,0,1647997004.0,0,t1_i1qjud1,i1qjud1,False,[deleted],t3_tk0xuv,https://www.reddit.com/r/plano/comments/tk0xuv/does_city_of_plano_drug_test_for_pot/,Does City of Plano drug test for pot?,/r/plano/comments/tk0xuv/does_city_of_plano_drug_test_for_pot/i1qjud1/,1,r/plano,0,1
Maybe get with the times and stop oppressing people over weed.,t2_aa8rcw5a,Sturrux,0,1647996983.0,0,t1_i1qjslx,i1qjslx,False,[deleted],t3_tk0xuv,https://www.reddit.com/r/plano/comments/tk0xuv/does_city_of_plano_drug_test_for_pot/,Does City of Plano drug test for pot?,/r/plano/comments/tk0xuv/does_city_of_plano_drug_test_for_pot/i1qjslx/,2,r/plano,0,2
Because if someone smokes that's their whole personality now? Silly way to look at life,t2_3gy5hzks,caueisdead,0,1647996663.0,0,t1_i1qj3an,i1qj3an,False,[deleted],t3_tk0xuv,https://www.reddit.com/r/plano/comments/tk0xuv/does_city_of_plano_drug_test_for_pot/,Does City of Plano drug test for pot?,/r/plano/comments/tk0xuv/does_city_of_plano_drug_test_for_pot/i1qj3an/,2,r/plano,0,2
"Plano: I heard you’re related to one of Christina Morris’ ex boyfriends who she had not dated in years. Let me call you in and question you.

Also Plano: Hey, uhm… Pot bad.",t2_jyips5zk,Typical_demoness,0,1647996577.0,0,t1_i1qiwnu,i1qiwnu,False,[deleted],t3_tk0xuv,https://www.reddit.com/r/plano/comments/tk0xuv/does_city_of_plano_drug_test_for_pot/,Does City of Plano drug test for pot?,/r/plano/comments/tk0xuv/does_city_of_plano_drug_test_for_pot/i1qiwnu/,0,r/plano,0,0
This is how I came in,t2_71zrr,shamelessseamus,0,1647996446.0,0,t1_i1qim60,i1qim60,False,[deleted],t3_tk0xuv,https://www.reddit.com/r/plano/comments/tk0xuv/does_city_of_plano_drug_test_for_pot/,Does City of Plano drug test for pot?,/r/plano/comments/tk0xuv/does_city_of_plano_drug_test_for_pot/i1qim60/,-1,r/plano,0,-1
I don't think his name is u/street_remote6105,t2_3gy5hzks,caueisdead,0,1647996151.0,0,t1_i1qhyob,i1qhyob,False,[deleted],t3_tk0xuv,https://www.reddit.com/r/plano/comments/tk0xuv/does_city_of_plano_drug_test_for_pot/,Does City of Plano drug test for pot?,/r/plano/comments/tk0xuv/does_city_of_plano_drug_test_for_pot/i1qhyob/,2,r/plano,0,2
This is like a tame version of that time a girl got an internship at NASA and tweet cussed out her soon to be boss (?),t2_c01c7,sylvezine,0,1647995735.0,0,t1_i1qh1ax,i1qh1ax,True,[deleted],t3_tk0xuv,https://www.reddit.com/r/plano/comments/tk0xuv/does_city_of_plano_drug_test_for_pot/,Does City of Plano drug test for pot?,/r/plano/comments/tk0xuv/does_city_of_plano_drug_test_for_pot/i1qh1ax/,2,r/plano,0,2
Hell yeah!,t2_11z9ew,InBabylonTheyWept,0,1647995277.0,0,t1_i1qg0ns,i1qg0ns,False,[deleted],t3_tk0xuv,https://www.reddit.com/r/plano/comments/tk0xuv/does_city_of_plano_drug_test_for_pot/,Does City of Plano drug test for pot?,/r/plano/comments/tk0xuv/does_city_of_plano_drug_test_for_pot/i1qg0ns/,1,r/plano,0,1
