body,author_fullname,author.name,controversiality,created,downs,fullname,id,is_root,link_author,link_id,link_permalink,link_title,permalink,score,subreddit_name_prefixed,total_awards_received,ups
"You mean the digital ID proposals that have been around since before Covid patient 0? I can remember talk about the idea more than a decade ago. 

Unless you can scientifically prove the existence of a reliable psychic, yes, it IS a coincidence.",t2_nd18d,Skogula,0,1647603395.0,0,t1_i152vt4,i152vt4,False,ResidentEvil0IsOkay,t3_tggpyb,https://www.reddit.com/r/ThunderBay/comments/tggpyb/freedom_protestors_will_be_at_it_again_on/,Freedom 'Protestors' will be at it again on Saturday March 19th,/r/ThunderBay/comments/tggpyb/freedom_protestors_will_be_at_it_again_on/i152vt4/,8,r/ThunderBay,0,8
"The original MOU demanded that the Governor General dissolve the Federal government, and place people selected by the Clownvoy organizers in charge of the nation. 

It wouldn't have **worked** because the GG doesn't have the ability to do that, even if she had been inclined to. But that was the demand they made. 

There are many copies of the MOU floating around, here is NNL publishing what the first one said, before they 'revised' it to make it less... treasonous. 

[https://www.netnewsledger.com/2022/02/05/the-canada-unity-memorandum-of-understanding/](https://www.netnewsledger.com/2022/02/05/the-canada-unity-memorandum-of-understanding/)

&#x200B;

Oh, the truckers were always able to re-enter Canada if they had been permitted to go to the US... What they wanted was an exemption from the requirement to self isolate if they aren't vaccinated.   
SO nobody was preventing them from entering Canada.. They just don't get special treatment the rest of Canada doesn't have access to. 

The second half of your response shows the vastness of the depths of your complete and utter ignorance on science. 

The vaccines absolutely do reduce the chance of a person both becoming infected, and of spreading it if they do get infected. Even with Omicron. The efficacy of the vaccines against Omicron is reduced, NOT eliminated. SO anyone claiming that the vaccines don't impact spread is just plain lying. 

And reduces the chance of spread is not saying it prevents it.. So that claim is nothing more than a straw man fallacy. 

The only flawed assessment here is yours.",t2_nd18d,Skogula,0,1647603174.0,0,t1_i152j7b,i152j7b,False,ResidentEvil0IsOkay,t3_tggpyb,https://www.reddit.com/r/ThunderBay/comments/tggpyb/freedom_protestors_will_be_at_it_again_on/,Freedom 'Protestors' will be at it again on Saturday March 19th,/r/ThunderBay/comments/tggpyb/freedom_protestors_will_be_at_it_again_on/i152j7b/,6,r/ThunderBay,0,6
Sad but what does this have to do with Thunder Bay?,t2_4do6o53x,MilesOfPebbles,0,1647603034.0,0,t1_i152bay,i152bay,True,strongbud82,t3_tgys4d,https://www.reddit.com/r/ThunderBay/comments/tgys4d/its_inhumane_african_refugees_experience_racism/,'It's inhumane.' African refugees experience racism while trying to flee Ukraine,/r/ThunderBay/comments/tgys4d/its_inhumane_african_refugees_experience_racism/i152bay/,1,r/ThunderBay,0,1
"thank you for posting this every week.  I've been wanting to join, but I keep getting called into work for extra shifts. I appreciate you taking the extra time to advertise this so I always know there's the opportunity to join in",t2_6jjziu4l,FibonacciZeppeli,0,1647600636.0,0,t1_i14yus3,i14yus3,True,ResidentEvil0IsOkay,t3_tggpyb,https://www.reddit.com/r/ThunderBay/comments/tggpyb/freedom_protestors_will_be_at_it_again_on/,Freedom 'Protestors' will be at it again on Saturday March 19th,/r/ThunderBay/comments/tggpyb/freedom_protestors_will_be_at_it_again_on/i14yus3/,-3,r/ThunderBay,0,-3
Mind your own business,t2_bv1j,hafetysazard,0,1647584222.0,0,t1_i14f5q2,i14f5q2,False,ResidentEvil0IsOkay,t3_tggpyb,https://www.reddit.com/r/ThunderBay/comments/tggpyb/freedom_protestors_will_be_at_it_again_on/,Freedom 'Protestors' will be at it again on Saturday March 19th,/r/ThunderBay/comments/tggpyb/freedom_protestors_will_be_at_it_again_on/i14f5q2/,-4,r/ThunderBay,0,-4
i hope they destroy their already destroyed 3rd gen dodge ram 1500s on all the fucking potholes there is across town. maybe we should advocate for something fucking HELPFUL?,t2_9rixwc5z,jillb3an,0,1647583890.0,0,t1_i14eq34,i14eq34,True,ResidentEvil0IsOkay,t3_tggpyb,https://www.reddit.com/r/ThunderBay/comments/tggpyb/freedom_protestors_will_be_at_it_again_on/,Freedom 'Protestors' will be at it again on Saturday March 19th,/r/ThunderBay/comments/tggpyb/freedom_protestors_will_be_at_it_again_on/i14eq34/,8,r/ThunderBay,0,8
"I don't recall when we could drink in bars and be face to face with ppl this early on, before the summer, in the past couple years. Before the truckers.. but, I guess it's science ? ...",t2_9gujns2t,Nice_Savings_9160,0,1647582434.0,0,t1_i14crwd,i14crwd,True,ResidentEvil0IsOkay,t3_tggpyb,https://www.reddit.com/r/ThunderBay/comments/tggpyb/freedom_protestors_will_be_at_it_again_on/,Freedom 'Protestors' will be at it again on Saturday March 19th,/r/ThunderBay/comments/tggpyb/freedom_protestors_will_be_at_it_again_on/i14crwd/,-5,r/ThunderBay,0,-5
"For those of you stating that ""they never wanted to put themselves in power"" and other bullshit in support of these LARPers, it's all in their original MOU.  How about you fucking read it?

https://www.netnewsledger.com/2022/02/05/the-canada-unity-memorandum-of-understanding/

Educate yourselves.  All you're doing is making yourself look like an idiot.  You're almost as ignorant as the people who claim Pat King and Tamara Lich were not only government operatives and never had anything to do with the Freedumb Convoy to begin with, but also aren't white supremacists.",t2_15826e,Blue-Thunder,0,1647580605.0,0,t1_i14a5dh,i14a5dh,True,ResidentEvil0IsOkay,t3_tggpyb,https://www.reddit.com/r/ThunderBay/comments/tggpyb/freedom_protestors_will_be_at_it_again_on/,Freedom 'Protestors' will be at it again on Saturday March 19th,/r/ThunderBay/comments/tggpyb/freedom_protestors_will_be_at_it_again_on/i14a5dh/,9,r/ThunderBay,0,9
Put down the bottle and go to bed.  You’re embarrassing yourself.,t2_ha58f,madsounds7,0,1647580108.0,0,t1_i149et5,i149et5,False,ResidentEvil0IsOkay,t3_tggpyb,https://www.reddit.com/r/ThunderBay/comments/tggpyb/freedom_protestors_will_be_at_it_again_on/,Freedom 'Protestors' will be at it again on Saturday March 19th,/r/ThunderBay/comments/tggpyb/freedom_protestors_will_be_at_it_again_on/i149et5/,4,r/ThunderBay,0,4
"Sure. You asked “who said anything about the horrors of anarchy”. I said “check out civil wars and revolutions where governments break down”. Sorry for answering your question. 

I asked my question about freedoms and anarchy because your comment lead to that conclusion; if freedom is not granted by the government then the most free one could be is without government, anarchy. 

Sorry you are having trouble keeping up. It’s hard to stay always right on the internet when you are barely capable of using Wikipedia.",t2_e2nfco7i,Gold_Scholar_4219,0,1647580093.0,0,t1_i149e04,i149e04,False,ResidentEvil0IsOkay,t3_tggpyb,https://www.reddit.com/r/ThunderBay/comments/tggpyb/freedom_protestors_will_be_at_it_again_on/,Freedom 'Protestors' will be at it again on Saturday March 19th,/r/ThunderBay/comments/tggpyb/freedom_protestors_will_be_at_it_again_on/i149e04/,8,r/ThunderBay,0,8
"Except argue with people who have discovered the antidote to hopelessness because they're so awful!

Maybe you're sad because it is comfortable?

https://youtu.be/whNDMnr17yM",t2_bv1j,hafetysazard,0,1647579782.0,0,t1_i148wsb,i148wsb,False,ResidentEvil0IsOkay,t3_tggpyb,https://www.reddit.com/r/ThunderBay/comments/tggpyb/freedom_protestors_will_be_at_it_again_on/,Freedom 'Protestors' will be at it again on Saturday March 19th,/r/ThunderBay/comments/tggpyb/freedom_protestors_will_be_at_it_again_on/i148wsb/,0,r/ThunderBay,0,0
All because people wanted to be too bossy and control people's lives they clnever had a chance of doing in the first place.,t2_bv1j,hafetysazard,0,1647579735.0,0,t1_i148u3t,i148u3t,False,ResidentEvil0IsOkay,t3_tggpyb,https://www.reddit.com/r/ThunderBay/comments/tggpyb/freedom_protestors_will_be_at_it_again_on/,Freedom 'Protestors' will be at it again on Saturday March 19th,/r/ThunderBay/comments/tggpyb/freedom_protestors_will_be_at_it_again_on/i148u3t/,-1,r/ThunderBay,0,-1
You haven't contradicted any notions of where our current set of rights come from and what legal principles they're based off of.  But go ahead on your tangent.,t2_bv1j,hafetysazard,0,1647579673.0,0,t1_i148qik,i148qik,False,ResidentEvil0IsOkay,t3_tggpyb,https://www.reddit.com/r/ThunderBay/comments/tggpyb/freedom_protestors_will_be_at_it_again_on/,Freedom 'Protestors' will be at it again on Saturday March 19th,/r/ThunderBay/comments/tggpyb/freedom_protestors_will_be_at_it_again_on/i148qik/,2,r/ThunderBay,0,2
Did they makeout?,t2_5jl6e6sz,ResidentEvil0IsOkay,0,1647579239.0,0,t1_i1481va,i1481va,False,ResidentEvil0IsOkay,t3_tggpyb,https://www.reddit.com/r/ThunderBay/comments/tggpyb/freedom_protestors_will_be_at_it_again_on/,Freedom 'Protestors' will be at it again on Saturday March 19th,/r/ThunderBay/comments/tggpyb/freedom_protestors_will_be_at_it_again_on/i1481va/,4,r/ThunderBay,0,4
"Not as good a historian as you advertised.  Pity. I thought I’d have an inspiring and educated conversation. 

Best of luck with life. A smidge of advice; underpromise and overdeliver.  

(Also just check out any of the revolutions and civil wars where governments broke down. There are hundreds to choose from throughout western history and the horrors of anarchy are well documented).",t2_e2nfco7i,Gold_Scholar_4219,0,1647578739.0,0,t1_i1478ii,i1478ii,False,ResidentEvil0IsOkay,t3_tggpyb,https://www.reddit.com/r/ThunderBay/comments/tggpyb/freedom_protestors_will_be_at_it_again_on/,Freedom 'Protestors' will be at it again on Saturday March 19th,/r/ThunderBay/comments/tggpyb/freedom_protestors_will_be_at_it_again_on/i1478ii/,7,r/ThunderBay,0,7
"If a person is free to seriously risk their lives by suffocating themselves to have a better orgasm, I don't see why somebody shouldn't have the freedom to not wear a seatbelt.

Shit if you buy an antique car made before seatbelts were a thing, you don't have to wear one.  Because it doesn't actually fucking matter.

People risk their lives all the time.  Following rules, ""because they are the rules,"" is extremely dumb reason to follow the rules.  If there is no rational reason, beyond, ""itnis for your own good,"" then it shouldn't be a fucking rule.",t2_bv1j,hafetysazard,0,1647578684.0,0,t1_i1475ds,i1475ds,False,ResidentEvil0IsOkay,t3_tggpyb,https://www.reddit.com/r/ThunderBay/comments/tggpyb/freedom_protestors_will_be_at_it_again_on/,Freedom 'Protestors' will be at it again on Saturday March 19th,/r/ThunderBay/comments/tggpyb/freedom_protestors_will_be_at_it_again_on/i1475ds/,1,r/ThunderBay,0,1
"Of course it means shit.  When people who make these policies flirt with the idea of making some sort of version permanent for spurious benefit; it is a problem.

Do you want a social credit system like they have in China?  Sorry you voted wrong, you don't get a car loan to get to work.  Oh you used a word deemed unacceptable on social media, now you don't qualify for government assistance.

That is our future, unfortunately.  But hey, I'm sure you think that's wonderful, because those damned unvaccinated people deserved it for some reason...",t2_bv1j,hafetysazard,0,1647578493.0,0,t1_i146tzv,i146tzv,False,ResidentEvil0IsOkay,t3_tggpyb,https://www.reddit.com/r/ThunderBay/comments/tggpyb/freedom_protestors_will_be_at_it_again_on/,Freedom 'Protestors' will be at it again on Saturday March 19th,/r/ThunderBay/comments/tggpyb/freedom_protestors_will_be_at_it_again_on/i146tzv/,-8,r/ThunderBay,0,-8
"Going for a sauna on Saturday, anyone coming?",t2_a4his1j1,Chance-Reporter-2910,0,1647577679.0,0,t1_i145fh8,i145fh8,True,overwhelmedteen,t3_shbnt8,https://www.reddit.com/r/ThunderBay/comments/shbnt8/kangas_sauna/,Kangas sauna,/r/ThunderBay/comments/shbnt8/kangas_sauna/i145fh8/,1,r/ThunderBay,0,1
"Not if the emergency never ends.

Look how easily the government was able to enact unprecendented legislation to gain emergency powers for a protest and blockade that was basically already over.

Germany declares war on Canada, Terrorists kidnap and murder politicians and set bombs off, and neurotic Ottawa residents on edge over honking and protesting.  One of these things is not like the other.

The fact of the matter is that the government enacted emergency powers to punitively punish people
it had zero legal ability to do otherwise.  The government had all the legal means already at their disposal to break up the protest, and send these people home.  

What they didn't have a right to do was interfere in normal Canadians lives without due process, simply because they exercised their fundamental freedoms of expression; seizing property a d bank accounts, under the guise of, ""fighting crime.""

Well guess what, the evidence is in, literally no evidence that anyone who donated to the convoy or any sort of donation to the convoy was illegal or suspicious.  That was the official finding of Finntrac.

The message was clear: if you disagree with Justin Trudeau, don't even think of exercising your right to dissent and democratically protest his decisions, or your life will
be torn apart, and we'll starve you.  That's the kind of shit that goes on in Russia, now we have to face that reality here.  That tyrannical bullshit gets nothing but applause from the rabble who can't see how that could possibly affect them.

I had the exact same qualms about the, ""war on terror,"" when I was in high school because it was obvious those measures would expand and create a new normal in Canada, and boy was I right.  Wandering definition of what a, ""terrorist,"" is and what human and democratic rights they could be denied if they were deemed as such.  Plus, all the intrusion into privacy, ""to fight terrorism,"" and how now basically everything we say or do is monitored and recorded.  The same thing happened, the rabble said, it would never be an issue.  Well guess what?",t2_bv1j,hafetysazard,0,1647577426.0,0,t1_i144ztv,i144ztv,False,ResidentEvil0IsOkay,t3_tggpyb,https://www.reddit.com/r/ThunderBay/comments/tggpyb/freedom_protestors_will_be_at_it_again_on/,Freedom 'Protestors' will be at it again on Saturday March 19th,/r/ThunderBay/comments/tggpyb/freedom_protestors_will_be_at_it_again_on/i144ztv/,-3,r/ThunderBay,0,-3
">The first goal was to overthrow the government and put themselves in power. That was proven in the first version of the MOU.

Show me where it says that.  Explain to me how it was supposed to work.  These truckers were just going to to storm parliament and replace all of our elected MPs and we were all going to just have to agree to it?

Also, it did change from truckers not being able to cross the border, but shortly after Canada implemented its policy, the US followed suit, and non-truckers joined in.  Many of whom opposed compelled vaccination, and the discrimination against unvaccinated people.

The way unvaccinated people were being treated was out of some distopian science fiction novel.  Being treated as if they were, ""dangerous,"" ""unclean,""  or shudras,  when in fact they were simply more vulnerable to suffer from it, and it was the vaccinated who posed a bigger threat to them than they were a threat to anyone else.  People still believe that the vaccine prevents people from catching or spreading covid, and these same idiots were at the forefront of shitting on anyone who didn't agree with their flawed assessment.

Now no masks, no more passports, so are we
supposed to just forget about how horrible and neurotic Canadians acted towards each other?  Maybe not because we're not over it.  All these hardcore cirtue signally knuckleheads are going to be outed soon enough when they're still wearing 3 masks while everyone is back to normal.",t2_bv1j,hafetysazard,0,1647576625.0,0,t1_i143ki1,i143ki1,False,ResidentEvil0IsOkay,t3_tggpyb,https://www.reddit.com/r/ThunderBay/comments/tggpyb/freedom_protestors_will_be_at_it_again_on/,Freedom 'Protestors' will be at it again on Saturday March 19th,/r/ThunderBay/comments/tggpyb/freedom_protestors_will_be_at_it_again_on/i143ki1/,-1,r/ThunderBay,0,-1
"My bad I was full of shit, the new digital ID proposals have nothing to do with the covid vaccine passports.  Just a coincidence.",t2_bv1j,hafetysazard,0,1647576558.0,0,t1_i143g4w,i143g4w,False,ResidentEvil0IsOkay,t3_tggpyb,https://www.reddit.com/r/ThunderBay/comments/tggpyb/freedom_protestors_will_be_at_it_again_on/,Freedom 'Protestors' will be at it again on Saturday March 19th,/r/ThunderBay/comments/tggpyb/freedom_protestors_will_be_at_it_again_on/i143g4w/,-12,r/ThunderBay,0,-12
"Everyone is a minority in Canada in thought and belief, though.",t2_bv1j,hafetysazard,0,1647576525.0,0,t1_i143dyk,i143dyk,False,ResidentEvil0IsOkay,t3_tggpyb,https://www.reddit.com/r/ThunderBay/comments/tggpyb/freedom_protestors_will_be_at_it_again_on/,Freedom 'Protestors' will be at it again on Saturday March 19th,/r/ThunderBay/comments/tggpyb/freedom_protestors_will_be_at_it_again_on/i143dyk/,-2,r/ThunderBay,0,-2
“Talk of” doesn’t mean shit.,t2_gmqzz,PlanetLandon,0,1647576516.0,0,t1_i143dew,i143dew,False,ResidentEvil0IsOkay,t3_tggpyb,https://www.reddit.com/r/ThunderBay/comments/tggpyb/freedom_protestors_will_be_at_it_again_on/,Freedom 'Protestors' will be at it again on Saturday March 19th,/r/ThunderBay/comments/tggpyb/freedom_protestors_will_be_at_it_again_on/i143dew/,9,r/ThunderBay,0,9
"Who says anarchy is horror?  Besides, the First Nations had plenty of personal autonomy and freedom.  They weren't held down by the horrors of a big government dictating their lives until Europeans and their religion arrived.",t2_bv1j,hafetysazard,0,1647575870.0,0,t1_i1426qd,i1426qd,False,ResidentEvil0IsOkay,t3_tggpyb,https://www.reddit.com/r/ThunderBay/comments/tggpyb/freedom_protestors_will_be_at_it_again_on/,Freedom 'Protestors' will be at it again on Saturday March 19th,/r/ThunderBay/comments/tggpyb/freedom_protestors_will_be_at_it_again_on/i1426qd/,1,r/ThunderBay,0,1
Can unvaccinated get in an airplane and fly across the country?,t2_39da5zaj,saucekoss,0,1647575574.0,0,t1_i141mwd,i141mwd,False,ResidentEvil0IsOkay,t3_tggpyb,https://www.reddit.com/r/ThunderBay/comments/tggpyb/freedom_protestors_will_be_at_it_again_on/,Freedom 'Protestors' will be at it again on Saturday March 19th,/r/ThunderBay/comments/tggpyb/freedom_protestors_will_be_at_it_again_on/i141mwd/,-5,r/ThunderBay,0,-5
"Honestly I think that he's right. I wouldn't have known about this if not for the post, same for most of the people on here. These guys are the equivalent of streetcorner preachers telling us that the gays are going to hell. We should all just ignore it and move on (much like these guys should do).",t2_6bcto,CanuckBacon,0,1647571933.0,0,t1_i13ui5i,i13ui5i,False,ResidentEvil0IsOkay,t3_tggpyb,https://www.reddit.com/r/ThunderBay/comments/tggpyb/freedom_protestors_will_be_at_it_again_on/,Freedom 'Protestors' will be at it again on Saturday March 19th,/r/ThunderBay/comments/tggpyb/freedom_protestors_will_be_at_it_again_on/i13ui5i/,3,r/ThunderBay,0,3
"Unfortunately Russia is pushing a lot of conspiracies about Ukraine right now, so it's making its way through many of the anti-vax circles too. Last I heard apparently Putin is the good guy who is trying to target American Biolabs that are located in Ukraine for some reason and Ukraine is filled with Nazis, including the Jewish president.",t2_6bcto,CanuckBacon,0,1647571794.0,0,t1_i13u7r1,i13u7r1,False,ResidentEvil0IsOkay,t3_tggpyb,https://www.reddit.com/r/ThunderBay/comments/tggpyb/freedom_protestors_will_be_at_it_again_on/,Freedom 'Protestors' will be at it again on Saturday March 19th,/r/ThunderBay/comments/tggpyb/freedom_protestors_will_be_at_it_again_on/i13u7r1/,8,r/ThunderBay,0,8
"As a reader of history yourself, what period was the highest for person freedom without the horrors of anarchy?",t2_e2nfco7i,Gold_Scholar_4219,0,1647571372.0,0,t1_i13tc2w,i13tc2w,False,ResidentEvil0IsOkay,t3_tggpyb,https://www.reddit.com/r/ThunderBay/comments/tggpyb/freedom_protestors_will_be_at_it_again_on/,Freedom 'Protestors' will be at it again on Saturday March 19th,/r/ThunderBay/comments/tggpyb/freedom_protestors_will_be_at_it_again_on/i13tc2w/,10,r/ThunderBay,0,10
"That's probably why they keep wearing the yellow star of David, they're just a bit confused.",t2_6bcto,CanuckBacon,0,1647571309.0,0,t1_i13t7g6,i13t7g6,False,ResidentEvil0IsOkay,t3_tggpyb,https://www.reddit.com/r/ThunderBay/comments/tggpyb/freedom_protestors_will_be_at_it_again_on/,Freedom 'Protestors' will be at it again on Saturday March 19th,/r/ThunderBay/comments/tggpyb/freedom_protestors_will_be_at_it_again_on/i13t7g6/,4,r/ThunderBay,0,4
🙌,t2_e2nfco7i,Gold_Scholar_4219,0,1647571289.0,0,t1_i13t5xt,i13t5xt,False,ResidentEvil0IsOkay,t3_tggpyb,https://www.reddit.com/r/ThunderBay/comments/tggpyb/freedom_protestors_will_be_at_it_again_on/,Freedom 'Protestors' will be at it again on Saturday March 19th,/r/ThunderBay/comments/tggpyb/freedom_protestors_will_be_at_it_again_on/i13t5xt/,5,r/ThunderBay,0,5
"It's more like someone in a Ferrari blocking the highway because it keeps beeping, telling them to put on their seat belt.",t2_6bcto,CanuckBacon,0,1647571218.0,0,t1_i13t0lz,i13t0lz,False,ResidentEvil0IsOkay,t3_tggpyb,https://www.reddit.com/r/ThunderBay/comments/tggpyb/freedom_protestors_will_be_at_it_again_on/,Freedom 'Protestors' will be at it again on Saturday March 19th,/r/ThunderBay/comments/tggpyb/freedom_protestors_will_be_at_it_again_on/i13t0lz/,2,r/ThunderBay,0,2
"In Dallas, Texas a few years ago there was an actual ""Straight Pride Parade"". 2 men showed up from Boston and that's it. Not even the organizer showed up.",t2_6bcto,CanuckBacon,0,1647570925.0,0,t1_i13sei0,i13sei0,False,ResidentEvil0IsOkay,t3_tggpyb,https://www.reddit.com/r/ThunderBay/comments/tggpyb/freedom_protestors_will_be_at_it_again_on/,Freedom 'Protestors' will be at it again on Saturday March 19th,/r/ThunderBay/comments/tggpyb/freedom_protestors_will_be_at_it_again_on/i13sei0/,4,r/ThunderBay,0,4
Hugs to you,t2_chvp0r4s,spicycheeto99,0,1647569329.0,0,t1_i13p0gy,i13p0gy,False,ResidentEvil0IsOkay,t3_tggpyb,https://www.reddit.com/r/ThunderBay/comments/tggpyb/freedom_protestors_will_be_at_it_again_on/,Freedom 'Protestors' will be at it again on Saturday March 19th,/r/ThunderBay/comments/tggpyb/freedom_protestors_will_be_at_it_again_on/i13p0gy/,2,r/ThunderBay,0,2
Same - the world is on fire.,t2_4obpubdp,votedforkodos742,0,1647566962.0,0,t1_i13jv4f,i13jv4f,False,ResidentEvil0IsOkay,t3_tggpyb,https://www.reddit.com/r/ThunderBay/comments/tggpyb/freedom_protestors_will_be_at_it_again_on/,Freedom 'Protestors' will be at it again on Saturday March 19th,/r/ThunderBay/comments/tggpyb/freedom_protestors_will_be_at_it_again_on/i13jv4f/,1,r/ThunderBay,0,1
I've argued with literally dozens over the past few weeks.,t2_a2d0t,tjernobyl,0,1647566906.0,0,t1_i13jqs8,i13jqs8,False,ResidentEvil0IsOkay,t3_tggpyb,https://www.reddit.com/r/ThunderBay/comments/tggpyb/freedom_protestors_will_be_at_it_again_on/,Freedom 'Protestors' will be at it again on Saturday March 19th,/r/ThunderBay/comments/tggpyb/freedom_protestors_will_be_at_it_again_on/i13jqs8/,5,r/ThunderBay,0,5
"For what it's worth, I reported that one nine days ago - just before I posted a warning here. Still no action on it.",t2_b0rpe,Jack_Lad,0,1647565918.0,0,t1_i13hldu,i13hldu,False,i-love-big-birds,t3_tfsa0b,https://www.reddit.com/r/ThunderBay/comments/tfsa0b/biiiiig_fucking_pothole_infront_of_the_tims_in/,biiiiig fucking pothole infront of the Tim's in waterloo,/r/ThunderBay/comments/tfsa0b/biiiiig_fucking_pothole_infront_of_the_tims_in/i13hldu/,2,r/ThunderBay,0,2
"Honestly, I’m always sad. Not much to be happy about these days",t2_chvp0r4s,spicycheeto99,0,1647565665.0,0,t1_i13h1x2,i13h1x2,False,ResidentEvil0IsOkay,t3_tggpyb,https://www.reddit.com/r/ThunderBay/comments/tggpyb/freedom_protestors_will_be_at_it_again_on/,Freedom 'Protestors' will be at it again on Saturday March 19th,/r/ThunderBay/comments/tggpyb/freedom_protestors_will_be_at_it_again_on/i13h1x2/,5,r/ThunderBay,0,5
"Glad you admit it’s a minority of Canadians. Beside that, no ones trying to get rid of them they’re just fucking annoying and can’t do an ounce of research to realize they fall for Facebook propaganda",t2_ishs505b,MayoBenzWhip,0,1647565372.0,0,t1_i13gf1o,i13gf1o,False,ResidentEvil0IsOkay,t3_tggpyb,https://www.reddit.com/r/ThunderBay/comments/tggpyb/freedom_protestors_will_be_at_it_again_on/,Freedom 'Protestors' will be at it again on Saturday March 19th,/r/ThunderBay/comments/tggpyb/freedom_protestors_will_be_at_it_again_on/i13gf1o/,9,r/ThunderBay,0,9
How many have you actually talked to,t2_x5mhp,queen_anns_revenge,0,1647564288.0,0,t1_i13e1s4,i13e1s4,False,ResidentEvil0IsOkay,t3_tggpyb,https://www.reddit.com/r/ThunderBay/comments/tggpyb/freedom_protestors_will_be_at_it_again_on/,Freedom 'Protestors' will be at it again on Saturday March 19th,/r/ThunderBay/comments/tggpyb/freedom_protestors_will_be_at_it_again_on/i13e1s4/,1,r/ThunderBay,0,1
I guess the irony in the fact that their freedom to protest “freedom” is lost on them.,t2_ju4zn6dj,Serious-Routine-9482,0,1647563326.0,0,t1_i13byhd,i13byhd,True,ResidentEvil0IsOkay,t3_tggpyb,https://www.reddit.com/r/ThunderBay/comments/tggpyb/freedom_protestors_will_be_at_it_again_on/,Freedom 'Protestors' will be at it again on Saturday March 19th,/r/ThunderBay/comments/tggpyb/freedom_protestors_will_be_at_it_again_on/i13byhd/,6,r/ThunderBay,0,6
