body,author_fullname,author.name,controversiality,created,downs,fullname,id,is_root,link_author,link_id,link_permalink,link_title,permalink,score,subreddit_name_prefixed,total_awards_received,ups
Vote conservative and you won't have to deal with this globalist bull shit.,t2_x5mhp,queen_anns_revenge,0,1648271069.0,0,t1_i25rmgv,i25rmgv,True,partybaconx,t3_to0ni9,https://www.reddit.com/r/ThunderBay/comments/to0ni9/anyone_been_to_duluth_recently/,Anyone been to Duluth recently?,/r/ThunderBay/comments/to0ni9/anyone_been_to_duluth_recently/i25rmgv/,-1,r/ThunderBay,0,-1
Beyond amazing. Thanks - appreciate that info bud. A good friend is about to undergo radiation Monday.,t2_1qo7jnu0,rhet17,0,1648264680.0,0,t1_i25gw00,i25gw00,False,Who_am_I_yesterday,t3_tnv3vv,https://www.reddit.com/r/ThunderBay/comments/tnv3vv/locally_produced_isotopes_now_in_use_in_cancer/,Locally produced isotopes now in use in cancer diagnosis,/r/ThunderBay/comments/tnv3vv/locally_produced_isotopes_now_in_use_in_cancer/i25gw00/,1,r/ThunderBay,0,1
"I went on March 8th and got a free test at the DECC. The hours are 11 to 4 Tuesday to Friday I believe. Super simple, virtually no one in there at 11am. Double check that it's still running though! The CBSA guys didn't even want to see the whole letter, just the email showing a negative result and that the date was no earlier than one day before.",t2_g7wnce21,Upper_Search_7586,0,1648260307.0,0,t1_i258juu,i258juu,False,partybaconx,t3_to0ni9,https://www.reddit.com/r/ThunderBay/comments/to0ni9/anyone_been_to_duluth_recently/,Anyone been to Duluth recently?,/r/ThunderBay/comments/to0ni9/anyone_been_to_duluth_recently/i258juu/,1,r/ThunderBay,0,1
"Yeah, that's one use!  When each atom explodes, it produces its own particular mix of radiation.  Since the radioactive isotopes are chemically *almost* the same as the regular non-explodey isotopes, you can make molecules out of them and they'll get drawn into certain types of tissue.  You can treat cancer with it, or do special kinds of imaging- if you're interested in a certain kind of cell, the radiation can light it up and make it a lot more visible than it would be otherwise.  Since the isotopes are made here instead of being shipped in from elsewhere, there's a lot of useful isotopes that can do great things that would just expire in the mail on the way here.",t2_a2d0t,tjernobyl,0,1648254518.0,0,t1_i24wmmu,i24wmmu,False,Who_am_I_yesterday,t3_tnv3vv,https://www.reddit.com/r/ThunderBay/comments/tnv3vv/locally_produced_isotopes_now_in_use_in_cancer/,Locally produced isotopes now in use in cancer diagnosis,/r/ThunderBay/comments/tnv3vv/locally_produced_isotopes_now_in_use_in_cancer/i24wmmu/,2,r/ThunderBay,0,2
"I'm also  moving to Thunder Bay in the next few months, so I'll piggyback on this post a bit. 

How do people register and insure vehicles in Ontario? Are there locations that do both?

I'd be coming from Manitoba, and our insurance and registration are integrated (there's a monopoly on insurance with only one provider).",t2_6g48ctdv,Zealousideal-Tell547,0,1648254373.0,0,t1_i24wbul,i24wbul,True,Rey-Cao,t3_tlyp0d,https://www.reddit.com/r/ThunderBay/comments/tlyp0d/moving_from_edmonton_to_thunder_bay_any/,"Moving from Edmonton to Thunder Bay, any suggestions?",/r/ThunderBay/comments/tlyp0d/moving_from_edmonton_to_thunder_bay_any/i24wbul/,1,r/ThunderBay,0,1
"If they run this year for a low level league there is the Thunder Bay 5&5 Fun Slo-pitch League.  5&5 refers for fielding 5 girls and 5 guys.  (You'll see 7&3 leagues where it is fielding 7 guys and 3 girls).  Low pitching with a base and mat - 3 balls, 2 strikes with all fouls as strikes.  In pre-Covid times started week after May long weekend and played 1 game per week with a fun tournament and final tournament.  Except for the tournaments you ump your own games.

[https://www.facebook.com/groups/79886613048](https://www.facebook.com/groups/79886613048)

Played in that league on and off for over a couple decades.  Think I might be more suited for the Jack Pine one mentioned by someone else as my age at this point - who knows where I'd land as far as ability.

Wayland bar has or had a Mixed Slo-Pitch league:

[https://www.facebook.com/groups/159382400936853](https://www.facebook.com/groups/159382400936853)

There are other Slo-Pitch (both lob and across) that are more competitive.  No idea their names now.  Used to be a whole bunch under Molson and/or Coors Light name at one point.

There was also some sort of 7&3 league called and/or running out of Kakabeka Falls pre-Covid - knew a few people that played in that one.",t2_ihuixyw,reignoferror00,0,1648254152.0,0,t1_i24vvk5,i24vvk5,True,mrjelloman_,t3_tnpxtl,https://www.reddit.com/r/ThunderBay/comments/tnpxtl/baseball_beer_leagues/,Baseball beer leagues,/r/ThunderBay/comments/tnpxtl/baseball_beer_leagues/i24vvk5/,1,r/ThunderBay,0,1
Thanks --that does help.  And somehow ends up blasting cancer tumours I assume.,t2_1qo7jnu0,rhet17,0,1648253819.0,0,t1_i24v6bw,i24v6bw,False,Who_am_I_yesterday,t3_tnv3vv,https://www.reddit.com/r/ThunderBay/comments/tnv3vv/locally_produced_isotopes_now_in_use_in_cancer/,Locally produced isotopes now in use in cancer diagnosis,/r/ThunderBay/comments/tnv3vv/locally_produced_isotopes_now_in_use_in_cancer/i24v6bw/,1,r/ThunderBay,0,1
"So, every atom is a tiny lump of protons and neutrons.  The number of protons determines what it is.  If there's one proton, it's hydrogen, if there's 6 it's carbon, etc.  Now, there's a number of neutrons in there as well.  If there's 6 protons and 12 neutrons in an atom, it's plain ol' carbon.  If there's 13, it's plain ol' carbon.  If it's 14, it's gonna eventually explode.  Like, if you leave a pound of carbon-14 on your shelf and wandered off for 5,000 years, you'd find that half the atoms have exploded and turned into other atoms.  Carbon-12, carbon-13, and carbon-14 are all isotopes of carbon.  Some isotopes explode quicker than others.  The most interesting ones that the accelerator makes are so explodey that most of the atoms explode within days.",t2_a2d0t,tjernobyl,0,1648252796.0,0,t1_i24t1mt,i24t1mt,False,Who_am_I_yesterday,t3_tnv3vv,https://www.reddit.com/r/ThunderBay/comments/tnv3vv/locally_produced_isotopes_now_in_use_in_cancer/,Locally produced isotopes now in use in cancer diagnosis,/r/ThunderBay/comments/tnv3vv/locally_produced_isotopes_now_in_use_in_cancer/i24t1mt/,2,r/ThunderBay,0,2
1201 Trunk Highway.,t2_mwa1w,Clarksonforcaptain,0,1648251038.0,0,t1_i24pa3u,i24pa3u,False,partybaconx,t3_to0ni9,https://www.reddit.com/r/ThunderBay/comments/to0ni9/anyone_been_to_duluth_recently/,Anyone been to Duluth recently?,/r/ThunderBay/comments/to0ni9/anyone_been_to_duluth_recently/i24pa3u/,0,r/ThunderBay,0,0
"Literally right now on Walgreen's webite: [https://imgur.com/a/h8dmkCI](https://imgur.com/a/h8dmkCI)  
I have done this test at this location every time on a Sunday and I have always gotten my results on Sunday.  
Which location did you go to?",t2_rw9b1,Abootoo,0,1648250859.0,0,t1_i24ow1o,i24ow1o,False,partybaconx,t3_to0ni9,https://www.reddit.com/r/ThunderBay/comments/to0ni9/anyone_been_to_duluth_recently/,Anyone been to Duluth recently?,/r/ThunderBay/comments/to0ni9/anyone_been_to_duluth_recently/i24ow1o/,1,r/ThunderBay,0,1
Hard yes but overworked no,t2_84aqq,fisheystick,0,1648250590.0,0,t1_i24oaua,i24oaua,False,AnyUntalkativeBunny,t3_thjaz0,https://www.reddit.com/r/ThunderBay/comments/thjaz0/thunder_bay_doctor_shortage/,Thunder Bay Doctor Shortage,/r/ThunderBay/comments/thjaz0/thunder_bay_doctor_shortage/i24oaua/,1,r/ThunderBay,0,1
I got back from Duluth last Monday because Walgreen's wouldn't book covid tests on weekends.,t2_mwa1w,Clarksonforcaptain,0,1648250512.0,0,t1_i24o4sf,i24o4sf,False,partybaconx,t3_to0ni9,https://www.reddit.com/r/ThunderBay/comments/to0ni9/anyone_been_to_duluth_recently/,Anyone been to Duluth recently?,/r/ThunderBay/comments/to0ni9/anyone_been_to_duluth_recently/i24o4sf/,0,r/ThunderBay,0,0
"Nope. Walgreens does NAAT tests 7 days a week, 9 am until 5 pm. I've done most of my test on Sundays, before driving home on Sunday night.",t2_rw9b1,Abootoo,0,1648250300.0,0,t1_i24nnxh,i24nnxh,False,partybaconx,t3_to0ni9,https://www.reddit.com/r/ThunderBay/comments/to0ni9/anyone_been_to_duluth_recently/,Anyone been to Duluth recently?,/r/ThunderBay/comments/to0ni9/anyone_been_to_duluth_recently/i24nnxh/,1,r/ThunderBay,0,1
I just booked one with a telehealth company called Azova. They watch you administer your own Canadian approved test virtually (while you are in the Us) and email you the results for $20 US.,t2_5d6plbx7,skiierbarbie,0,1648249871.0,0,t1_i24mq65,i24mq65,True,partybaconx,t3_to0ni9,https://www.reddit.com/r/ThunderBay/comments/to0ni9/anyone_been_to_duluth_recently/,Anyone been to Duluth recently?,/r/ThunderBay/comments/to0ni9/anyone_been_to_duluth_recently/i24mq65/,3,r/ThunderBay,0,3
"Unless I misunderstood your comment, you don't like minimum wage laws?",t2_8m5na,WereRobert,0,1648249767.0,0,t1_i24mi0k,i24mi0k,False,WereRobert,t3_tmz640,https://www.reddit.com/r/ThunderBay/comments/tmz640/parklane_townhomes_property_management_paying/,Parklane Townhomes property management paying minimum wage for do-everything,/r/ThunderBay/comments/tmz640/parklane_townhomes_property_management_paying/i24mi0k/,1,r/ThunderBay,0,1
"When i saw your comment hours after i posted this, i was afraid you would have 20 downvotes.  Glad that is not true (i upvoted plus upvoted toaofbacon who i rarely agree with). Nuclear needs another look. Considering how many people the alternatives has killed",t2_26xi3wa7,Who_am_I_yesterday,0,1648249688.0,0,t1_i24mbpz,i24mbpz,False,Who_am_I_yesterday,t3_tnv3vv,https://www.reddit.com/r/ThunderBay/comments/tnv3vv/locally_produced_isotopes_now_in_use_in_cancer/,Locally produced isotopes now in use in cancer diagnosis,/r/ThunderBay/comments/tnv3vv/locally_produced_isotopes_now_in_use_in_cancer/i24mbpz/,5,r/ThunderBay,0,5
Also worth mentioning that Walgreen's only do tests Monday-Friday.,t2_mwa1w,Clarksonforcaptain,0,1648249290.0,0,t1_i24lg7y,i24lg7y,False,partybaconx,t3_to0ni9,https://www.reddit.com/r/ThunderBay/comments/to0ni9/anyone_been_to_duluth_recently/,Anyone been to Duluth recently?,/r/ThunderBay/comments/to0ni9/anyone_been_to_duluth_recently/i24lg7y/,0,r/ThunderBay,0,0
Hopefully this takes some of the stress from the Brenda lady that was in the paper a while back detoxing people on her couch.,t2_4fn4qoj1,koosopenheimer,0,1648247384.0,0,t1_i24h6ck,i24h6ck,True,MilesOfPebbles,t3_tef75c,https://www.reddit.com/r/ThunderBay/comments/tef75c/ontario_announces_funds_to_expand_addictions/,Ontario announces funds to expand addictions services in Thunder Bay,/r/ThunderBay/comments/tef75c/ontario_announces_funds_to_expand_addictions/i24h6ck/,1,r/ThunderBay,0,1
That Tex was really a police officer at one time,t2_4fn4qoj1,koosopenheimer,0,1648247298.0,0,t1_i24gzch,i24gzch,True,MilesOfPebbles,t3_tf0qib,https://www.reddit.com/r/ThunderBay/comments/tf0qib/what_are_some_of_your_thunder_bay_related/,What are some of your Thunder Bay -related conspiracy theories and/or legends?!,/r/ThunderBay/comments/tf0qib/what_are_some_of_your_thunder_bay_related/i24gzch/,1,r/ThunderBay,0,1
"Look up becoming a designated trade apprentice vs a “regular” apprentice. Some apprenticeships can only be done by licensed apprentices (hairdressers, tin smiths, residential electricians) while others, millrights, ironworkers, cable splicers can be done as long as you get the go ahead from your boss. They will see pretty quick if you have the skills you say you have along with the tools you have to go along with the job.",t2_4fn4qoj1,koosopenheimer,0,1648247180.0,0,t1_i24gpj6,i24gpj6,True,Ad_Versa,t3_thduk5,https://www.reddit.com/r/ThunderBay/comments/thduk5/where_to_find_an_apprenticeship_in_tbay/,Where to find an apprenticeship in TBay?,/r/ThunderBay/comments/thduk5/where_to_find_an_apprenticeship_in_tbay/i24gpj6/,1,r/ThunderBay,0,1
"I applied and was the successful applicant as I worked in a union shop as a “helper” swept floors, emptied bedpans, etc. A different company offered a apprenticeship and I had every hour that I worked along side a trades person documented(by myself, management and payroll)  even if it was not the trade I was applying for. This gave me a “one up” on others applying on the same job as it showed that I did in fact work with trades of all sorts and had the paperwork to prove it. Document anytime you work with a trades fellow and soon you will be the trades fellow who can ask his apprentice why are you not documenting this time working with me ?",t2_4fn4qoj1,koosopenheimer,0,1648246864.0,0,t1_i24g02y,i24g02y,False,Ad_Versa,t3_thduk5,https://www.reddit.com/r/ThunderBay/comments/thduk5/where_to_find_an_apprenticeship_in_tbay/,Where to find an apprenticeship in TBay?,/r/ThunderBay/comments/thduk5/where_to_find_an_apprenticeship_in_tbay/i24g02y/,1,r/ThunderBay,0,1
"Book an NAAT test at Walgreens. Put in any American address, they don’t check. I use Ryden’s address. Go to the drive-thru at the location you book at and self-administer the test. You get the results by email in a few hours. I’ve done this 10 times since April, never had a problem and it’s 100% free. Message me if you want more details.",t2_rw9b1,Abootoo,0,1648246437.0,0,t1_i24f17f,i24f17f,True,partybaconx,t3_to0ni9,https://www.reddit.com/r/ThunderBay/comments/to0ni9/anyone_been_to_duluth_recently/,Anyone been to Duluth recently?,/r/ThunderBay/comments/to0ni9/anyone_been_to_duluth_recently/i24f17f/,6,r/ThunderBay,0,6
"Where does a medical body draw the line? I would like a doctor that has more training than my apprenticeship. Doctors are doctors, they fix humans so maybe they should be held to a higher standard of “hardness”. I don’t know honestly don’t know what the right answer is.",t2_4fn4qoj1,koosopenheimer,0,1648246408.0,0,t1_i24eyu6,i24eyu6,False,AnyUntalkativeBunny,t3_thjaz0,https://www.reddit.com/r/ThunderBay/comments/thjaz0/thunder_bay_doctor_shortage/,Thunder Bay Doctor Shortage,/r/ThunderBay/comments/thjaz0/thunder_bay_doctor_shortage/i24eyu6/,1,r/ThunderBay,0,1
You can get them 5 days a week at the convention centre. But that might be changed now with the restriction lifting soon. When do you intend to go,t2_xwnzv,ThatCanadianGuy88,0,1648246131.0,0,t1_i24ec8g,i24ec8g,True,partybaconx,t3_to0ni9,https://www.reddit.com/r/ThunderBay/comments/to0ni9/anyone_been_to_duluth_recently/,Anyone been to Duluth recently?,/r/ThunderBay/comments/to0ni9/anyone_been_to_duluth_recently/i24ec8g/,1,r/ThunderBay,0,1
He was correct. Buy the man a hot dog,t2_4fn4qoj1,koosopenheimer,0,1648245977.0,0,t1_i24dztg,i24dztg,True,frankiemacdonald1984,t3_tizs9e,https://www.reddit.com/r/ThunderBay/comments/tizs9e/major_snowstorm_to_hit_thunder_bay_ontario_on/,"Major Snowstorm to Hit Thunder Bay Ontario on Tuesday March 22, 2022",/r/ThunderBay/comments/tizs9e/major_snowstorm_to_hit_thunder_bay_ontario_on/i24dztg/,1,r/ThunderBay,0,1
Welcome,t2_4fn4qoj1,koosopenheimer,0,1648245929.0,0,t1_i24dvvw,i24dvvw,True,99Fan,t3_tjm0iy,https://www.reddit.com/r/ThunderBay/comments/tjm0iy/for_anyone_not_driving_more_than_5_over_in_the/,"For anyone not driving more than 5 over in the left lane, please get over to the right",/r/ThunderBay/comments/tjm0iy/for_anyone_not_driving_more_than_5_over_in_the/i24dvvw/,1,r/ThunderBay,0,1
Yeah or neigh,t2_4fn4qoj1,koosopenheimer,0,1648245823.0,0,t1_i24dn2e,i24dn2e,True,NWO_DEM,t3_tk1p62,https://www.reddit.com/r/ThunderBay/comments/tk1p62/lookie_lookie_councils_dirty/,"Lookie Lookie, Council's Dirty",/r/ThunderBay/comments/tk1p62/lookie_lookie_councils_dirty/i24dn2e/,1,r/ThunderBay,0,1
"Business people will always say they can’t pay more, increasing the minimum wage will bankrupt them. They have this on AutoPlay and parrot it at every opportunity. It doesn’t matter what the facts are.  
Many businesses that hire people with limited education, limited skills and limited future prospects are perfectly fine with paying people the lowest amount possible and with treating their employees like dirt. They are fine with this because they are confident that if these people quit there will be other losers to take their place. You can call this the Greater Fool Theory of Employment. A lot of the time they are not wrong.  
The Pandemic yielded a huge insight: There are millions of Canadians who have limited education, limited skills and limited futures who are absolutely ESSENTIAL to the functioning of the Canadian economy. While some of us were lucky to work from home or even quit our jobs, these people took on huge risks working in grocery stores, health settings, slaughterhouses, nursing homes, driving trucks, and many other places so that society could function.   
What do they get for their efforts? Nothing.  
Canada is already deep into a massive demographic crisis that will last for decades. There are already shortages of workers in all types of occupations and that will only get worse. Immigration can only partly address this problem.  
Employers will have to increase their employees’ wages, or they will go out of business.  
Driving around Thunder Bay, I have to wonder how many coffee shops, convenience stores, restaurants, grocery stores, and many other types of businesses do we really need, and how many are really economically viable. I think the real answer is a lot less than we think.  
Do we really want a society in which a significant chunk of our populations are condemned to living in poverty or barely able to survive? I know I don’t.  
We need to get real about what kind of society we want, and stop think that treating people like crap is ok.",t2_k00eurja,AnyUntalkativeBunny,0,1648245791.0,0,t1_i24dkfy,i24dkfy,False,WereRobert,t3_tmz640,https://www.reddit.com/r/ThunderBay/comments/tmz640/parklane_townhomes_property_management_paying/,Parklane Townhomes property management paying minimum wage for do-everything,/r/ThunderBay/comments/tmz640/parklane_townhomes_property_management_paying/i24dkfy/,1,r/ThunderBay,0,1
Peng got more votes than our mayor last election,t2_4fn4qoj1,koosopenheimer,0,1648245615.0,0,t1_i24d5v0,i24d5v0,False,NWO_DEM,t3_tk1p62,https://www.reddit.com/r/ThunderBay/comments/tk1p62/lookie_lookie_councils_dirty/,"Lookie Lookie, Council's Dirty",/r/ThunderBay/comments/tk1p62/lookie_lookie_councils_dirty/i24d5v0/,1,r/ThunderBay,0,1
I cast a line in one on Victoria ave and caught a small sturgeon. Catch and release.,t2_4fn4qoj1,koosopenheimer,0,1648245500.0,0,t1_i24cwgu,i24cwgu,True,WeTheNorth20,t3_tkcax0,https://www.reddit.com/r/ThunderBay/comments/tkcax0/voting_starts_for_caas_worst_roads_in_ontario/,Voting starts for CAA's worst roads In Ontario,/r/ThunderBay/comments/tkcax0/voting_starts_for_caas_worst_roads_in_ontario/i24cwgu/,1,r/ThunderBay,0,1
"Crazy glue and a razor blade if it’s just a bullmark…. Had luck with that. Google on how to repair small windshield bull marks and ideas will some rolling in. May be enough to get yourself another year before doing the swap. Off topic, the egg in the cooking system won’t stop cooling system leaks, and it smells pretty funky.",t2_4fn4qoj1,koosopenheimer,0,1648245441.0,0,t1_i24crl2,i24crl2,True,GLC98,t3_tlb3bk,https://www.reddit.com/r/ThunderBay/comments/tlb3bk/windshield_replacement_where_to_get_it_done/,windshield replacement? where to get it done,/r/ThunderBay/comments/tlb3bk/windshield_replacement_where_to_get_it_done/i24crl2/,1,r/ThunderBay,0,1
"For the hvac part a 313A or 313D is required, just so you don’t fill someone’s home full of some other gas than the ones we breath. I am sure all the pros will apply and show this company how things are going to be run from now on.",t2_4fn4qoj1,koosopenheimer,0,1648245160.0,0,t1_i24c4f1,i24c4f1,True,WereRobert,t3_tmz640,https://www.reddit.com/r/ThunderBay/comments/tmz640/parklane_townhomes_property_management_paying/,Parklane Townhomes property management paying minimum wage for do-everything,/r/ThunderBay/comments/tmz640/parklane_townhomes_property_management_paying/i24c4f1/,1,r/ThunderBay,0,1
"Wanted to know exactly what *isotopes* are so I looked it up. 
""i·so·tope

/ˈīsəˌtōp/

noun

CHEMISTRY

plural noun: isotopes

each of two or more forms of the same element that contain equal numbers of protons but different numbers of neutrons in their nuclei, and hence differ in relative atomic mass but not in chemical properties; in particular, a radioactive form of an element.""some elements have only one stable isotope"".
And it didnt help, not one little bit. But I'm still proud!",t2_1qo7jnu0,rhet17,0,1648245054.0,0,t1_i24bvnf,i24bvnf,True,Who_am_I_yesterday,t3_tnv3vv,https://www.reddit.com/r/ThunderBay/comments/tnv3vv/locally_produced_isotopes_now_in_use_in_cancer/,Locally produced isotopes now in use in cancer diagnosis,/r/ThunderBay/comments/tnv3vv/locally_produced_isotopes_now_in_use_in_cancer/i24bvnf/,2,r/ThunderBay,0,2
"Honestly you might as well wait.  I do believe almost any pharmacy in Duluth will administer the test, but the question is, will they charge you, and if they do, how much.

https://www.solvhealth.com/mn/c/duluth-mn-srv-covid-testing

Looks like RATs vary from $79-$129 USD.",t2_15826e,Blue-Thunder,0,1648244780.0,0,t1_i24b92y,i24b92y,True,partybaconx,t3_to0ni9,https://www.reddit.com/r/ThunderBay/comments/to0ni9/anyone_been_to_duluth_recently/,Anyone been to Duluth recently?,/r/ThunderBay/comments/to0ni9/anyone_been_to_duluth_recently/i24b92y/,3,r/ThunderBay,0,3
Can we finally have a baseball team called the Isotopes please?,t2_397rg27l,Dr-Shanks,0,1648241696.0,0,t1_i24405z,i24405z,True,Who_am_I_yesterday,t3_tnv3vv,https://www.reddit.com/r/ThunderBay/comments/tnv3vv/locally_produced_isotopes_now_in_use_in_cancer/,Locally produced isotopes now in use in cancer diagnosis,/r/ThunderBay/comments/tnv3vv/locally_produced_isotopes_now_in_use_in_cancer/i24405z/,10,r/ThunderBay,0,10
"There is also a Masters League that plays out at Jackpine....you need to be 40 if a male, 35 female to play, but it's pretty chill. Some games I think there are more braces than gloves being worn on the field, so it tends to be just for fun for most of us.

It's also mixed lob ball, so there are some rules that are supposed to even the field a bit....but mostly they just try not to kill them selves or each other during the game (ie no sliding and a safety line at home plate)",t2_5i9rsfze,northerngurl333,0,1648241586.0,0,t1_i243qt3,i243qt3,True,mrjelloman_,t3_tnpxtl,https://www.reddit.com/r/ThunderBay/comments/tnpxtl/baseball_beer_leagues/,Baseball beer leagues,/r/ThunderBay/comments/tnpxtl/baseball_beer_leagues/i243qt3/,1,r/ThunderBay,0,1
What does that have to do with anything?,t2_bv1j,hafetysazard,0,1648240084.0,0,t1_i2402m5,i2402m5,False,WereRobert,t3_tmz640,https://www.reddit.com/r/ThunderBay/comments/tmz640/parklane_townhomes_property_management_paying/,Parklane Townhomes property management paying minimum wage for do-everything,/r/ThunderBay/comments/tmz640/parklane_townhomes_property_management_paying/i2402m5/,1,r/ThunderBay,0,1
Let's get rid of the child labour protections while we're at it too! /s,t2_8m5na,WereRobert,0,1648239543.0,0,t1_i23yqwm,i23yqwm,False,WereRobert,t3_tmz640,https://www.reddit.com/r/ThunderBay/comments/tmz640/parklane_townhomes_property_management_paying/,Parklane Townhomes property management paying minimum wage for do-everything,/r/ThunderBay/comments/tmz640/parklane_townhomes_property_management_paying/i23yqwm/,0,r/ThunderBay,0,0
"Hey, this is wildly awesome news.",t2_bv1j,hafetysazard,0,1648238871.0,0,t1_i23x3hx,i23x3hx,True,Who_am_I_yesterday,t3_tnv3vv,https://www.reddit.com/r/ThunderBay/comments/tnv3vv/locally_produced_isotopes_now_in_use_in_cancer/,Locally produced isotopes now in use in cancer diagnosis,/r/ThunderBay/comments/tnv3vv/locally_produced_isotopes_now_in_use_in_cancer/i23x3hx/,5,r/ThunderBay,0,5
"Yes! The summertime, good weather, beer drinking regular season quickly turned into a rushed, cold, dark, annoying playoffs.",t2_rpeih,YourDadsButtPlug,0,1648237411.0,0,t1_i23tg98,i23tg98,False,mrjelloman_,t3_tnpxtl,https://www.reddit.com/r/ThunderBay/comments/tnpxtl/baseball_beer_leagues/,Baseball beer leagues,/r/ThunderBay/comments/tnpxtl/baseball_beer_leagues/i23tg98/,2,r/ThunderBay,0,2
roll,t2_dz8xa0zj,repeatsWords,0,1648235930.0,0,t1_i23pulj,i23pulj,False,WereRobert,t3_tmz640,https://www.reddit.com/r/ThunderBay/comments/tmz640/parklane_townhomes_property_management_paying/,Parklane Townhomes property management paying minimum wage for do-everything,/r/ThunderBay/comments/tmz640/parklane_townhomes_property_management_paying/i23pulj/,1,r/ThunderBay,0,1
roll,t2_dz8xa0zj,repeatsWords,0,1648235919.0,0,t1_i23ptoo,i23ptoo,False,WereRobert,t3_tmz640,https://www.reddit.com/r/ThunderBay/comments/tmz640/parklane_townhomes_property_management_paying/,Parklane Townhomes property management paying minimum wage for do-everything,/r/ThunderBay/comments/tmz640/parklane_townhomes_property_management_paying/i23ptoo/,1,r/ThunderBay,0,1
Any good nuclear reactor. They’re the pinnacle of clean green and cheap energy.,t2_oodcm,ToaOfBacon,0,1648235433.0,0,t1_i23oncd,i23oncd,False,Who_am_I_yesterday,t3_tnv3vv,https://www.reddit.com/r/ThunderBay/comments/tnv3vv/locally_produced_isotopes_now_in_use_in_cancer/,Locally produced isotopes now in use in cancer diagnosis,/r/ThunderBay/comments/tnv3vv/locally_produced_isotopes_now_in_use_in_cancer/i23oncd/,8,r/ThunderBay,0,8
