body,author_fullname,author.name,controversiality,created,downs,fullname,id,is_root,link_author,link_id,link_permalink,link_title,permalink,score,subreddit_name_prefixed,total_awards_received,ups
That's... Exactly my point... Are you agreeing or disagreeing?,t2_4xaejkfu,Legaltaway12,0,1648056912.0,0,t1_i1tl51u,i1tl51u,False,Flashy_Shock8501,t3_tch28x,https://www.reddit.com/r/ThunderBay/comments/tch28x/public_school_board_asks_health_unit_to_extend/,Public school board asks health unit to extend mask mandate,/r/ThunderBay/comments/tch28x/public_school_board_asks_health_unit_to_extend/i1tl51u/,2,r/ThunderBay,0,2
"And we still see cases of the bubonic plague. Do we still have plague doctors running around? 

Sure it’s an extreme example. But things end, is it too early for covid, probably. But if your worried about it, then keep your mask on. I do at work because I’m seeing 200+ people in a day. And my sister wears one at school, because there will be hundreds of kids without. There will also be an uptick next Christmas, this Easter, and probably every single other holiday this year. Should we just shut the world down every holiday?

It’s a shitty situation. But it’s at the point where we can start leaving it behind. Key word being can. 

We will be seeing covid cases pop up literally for the next several hundred years. You want to keep masks for the next 4 generations? Because if that’s the risk, then it must be justification to keep masks in everything. Not just schools",t2_15whkl,R3aper02,0,1648056491.0,0,t1_i1tk09r,i1tk09r,False,Flashy_Shock8501,t3_tch28x,https://www.reddit.com/r/ThunderBay/comments/tch28x/public_school_board_asks_health_unit_to_extend/,Public school board asks health unit to extend mask mandate,/r/ThunderBay/comments/tch28x/public_school_board_asks_health_unit_to_extend/i1tk09r/,1,r/ThunderBay,0,1
"""The schools are open""... fulfilling the education mandate, teachers be damned!",t2_8nsyj,VirtualRealityCzech,0,1648056449.0,0,t1_i1tjw2n,i1tjw2n,False,ahope1985,t3_tksloy,https://www.reddit.com/r/ThunderBay/comments/tksloy/garbage_pick_up_cancelled/,Garbage pick up cancelled,/r/ThunderBay/comments/tksloy/garbage_pick_up_cancelled/i1tjw2n/,5,r/ThunderBay,0,5
"I see that whenever I leave my little quiet crescent and get onto the nearest main street. Nice that it is plowed first, but no one can get out of their driveway!",t2_8nsyj,VirtualRealityCzech,0,1648056389.0,0,t1_i1tjqc8,i1tjqc8,False,ahope1985,t3_tksloy,https://www.reddit.com/r/ThunderBay/comments/tksloy/garbage_pick_up_cancelled/,Garbage pick up cancelled,/r/ThunderBay/comments/tksloy/garbage_pick_up_cancelled/i1tjqc8/,3,r/ThunderBay,0,3
Thanks for you insightful comment.,t2_6ugmy,BLK_Chedda,0,1648055492.0,0,t1_i1thbal,i1thbal,False,WeTheNorth20,t3_tkcax0,https://www.reddit.com/r/ThunderBay/comments/tkcax0/voting_starts_for_caas_worst_roads_in_ontario/,Voting starts for CAA's worst roads In Ontario,/r/ThunderBay/comments/tkcax0/voting_starts_for_caas_worst_roads_in_ontario/i1thbal/,1,r/ThunderBay,0,1
"I was walking home from the Dew Drop this morning. Sucked enough with everything unplowed and then sheer ice underneath because Red River is iceageddon every spring. Fell a few times but finally made it to the crosswalk by the bubble tea place. Had to wait for a van to pass and while doing so the grader came by and built me a fuckin snowbank right at my feet.

One of those days where you're wondering if you should just yeet yourself across the ice on Superior until you find a soft spot.",t2_db229vj6,stronzoinbiceletta,0,1648055299.0,0,t1_i1tgsqx,i1tgsqx,True,ahope1985,t3_tksloy,https://www.reddit.com/r/ThunderBay/comments/tksloy/garbage_pick_up_cancelled/,Garbage pick up cancelled,/r/ThunderBay/comments/tksloy/garbage_pick_up_cancelled/i1tgsqx/,4,r/ThunderBay,0,4
The schools absolutely shouldn’t have been open though.,t2_f2opb,circa_1984,0,1648053658.0,0,t1_i1tcb84,i1tcb84,False,ahope1985,t3_tksloy,https://www.reddit.com/r/ThunderBay/comments/tksloy/garbage_pick_up_cancelled/,Garbage pick up cancelled,/r/ThunderBay/comments/tksloy/garbage_pick_up_cancelled/i1tcb84/,7,r/ThunderBay,0,7
You sound like you’re on the brink of the old ending and you’re projecting,t2_abfo3c74,Piss_Jug_Ray,0,1648051838.0,0,t1_i1t7ehi,i1t7ehi,False,99Fan,t3_tjm0iy,https://www.reddit.com/r/ThunderBay/comments/tjm0iy/for_anyone_not_driving_more_than_5_over_in_the/,"For anyone not driving more than 5 over in the left lane, please get over to the right",/r/ThunderBay/comments/tjm0iy/for_anyone_not_driving_more_than_5_over_in_the/i1t7ehi/,1,r/ThunderBay,0,1
"Seems to be going that way; schools, city facilities, most stores, the mall, a lot of eateries…",t2_2ixr5jn7,ahope1985,0,1648050059.0,0,t1_i1t2ory,i1t2ory,False,ahope1985,t3_tksloy,https://www.reddit.com/r/ThunderBay/comments/tksloy/garbage_pick_up_cancelled/,Garbage pick up cancelled,/r/ThunderBay/comments/tksloy/garbage_pick_up_cancelled/i1t2ory/,6,r/ThunderBay,0,6
"Maybe so, but I saw many cans outside yesterday evening in anticipation for this morning. And I saw a neighbour dragging it out before leaving for work. So maybe not a priority for you but it was definitely on many other’s minds",t2_2ixr5jn7,ahope1985,0,1648050004.0,0,t1_i1t2jos,i1t2jos,False,ahope1985,t3_tksloy,https://www.reddit.com/r/ThunderBay/comments/tksloy/garbage_pick_up_cancelled/,Garbage pick up cancelled,/r/ThunderBay/comments/tksloy/garbage_pick_up_cancelled/i1t2jos/,3,r/ThunderBay,0,3
Toivo. It’s INSANE.,t2_2ixr5jn7,ahope1985,0,1648049945.0,0,t1_i1t2e7i,i1t2e7i,False,ahope1985,t3_tksloy,https://www.reddit.com/r/ThunderBay/comments/tksloy/garbage_pick_up_cancelled/,Garbage pick up cancelled,/r/ThunderBay/comments/tksloy/garbage_pick_up_cancelled/i1t2e7i/,1,r/ThunderBay,0,1
"**IMPORTANT NOTICE**

Even mild Covid increases the risk of heart attack for at least a year.  If you have had Covid, especially in the last wave, please be *very very* careful shoveling this heavy stuff.  There are a lot of reports of otherwise-healthy athletes dropping dead in 2020.",t2_a2d0t,tjernobyl,0,1648049328.0,0,t1_i1t0sij,i1t0sij,True,ahope1985,t3_tksloy,https://www.reddit.com/r/ThunderBay/comments/tksloy/garbage_pick_up_cancelled/,Garbage pick up cancelled,/r/ThunderBay/comments/tksloy/garbage_pick_up_cancelled/i1t0sij/,17,r/ThunderBay,0,17
"Yeah man for sure. I’m done here. Collect your welfare check and move on. And hey, take a break from reddit, you seem to answer too fast to be holding a job so at least do it for your mental health.",t2_4nuqeyl,99Fan,0,1648048600.0,0,t1_i1syv9u,i1syv9u,False,99Fan,t3_tjm0iy,https://www.reddit.com/r/ThunderBay/comments/tjm0iy/for_anyone_not_driving_more_than_5_over_in_the/,"For anyone not driving more than 5 over in the left lane, please get over to the right",/r/ThunderBay/comments/tjm0iy/for_anyone_not_driving_more_than_5_over_in_the/i1syv9u/,2,r/ThunderBay,0,2
"And you could have killed me in the bushes, thank you for proving my point.",t2_abfo3c74,Piss_Jug_Ray,0,1648048224.0,0,t1_i1sxwqo,i1sxwqo,False,99Fan,t3_tjm0iy,https://www.reddit.com/r/ThunderBay/comments/tjm0iy/for_anyone_not_driving_more_than_5_over_in_the/,"For anyone not driving more than 5 over in the left lane, please get over to the right",/r/ThunderBay/comments/tjm0iy/for_anyone_not_driving_more_than_5_over_in_the/i1sxwqo/,1,r/ThunderBay,0,1
"Oh? You were there? Weird I didn’t see a single car not even in the distance, maybe you were watching from the bushes. Creep.",t2_4nuqeyl,99Fan,0,1648048183.0,0,t1_i1sxt2b,i1sxt2b,False,99Fan,t3_tjm0iy,https://www.reddit.com/r/ThunderBay/comments/tjm0iy/for_anyone_not_driving_more_than_5_over_in_the/,"For anyone not driving more than 5 over in the left lane, please get over to the right",/r/ThunderBay/comments/tjm0iy/for_anyone_not_driving_more_than_5_over_in_the/i1sxt2b/,2,r/ThunderBay,0,2
Yes there were,t2_abfo3c74,Piss_Jug_Ray,0,1648048075.0,0,t1_i1sxj8y,i1sxj8y,False,99Fan,t3_tjm0iy,https://www.reddit.com/r/ThunderBay/comments/tjm0iy/for_anyone_not_driving_more_than_5_over_in_the/,"For anyone not driving more than 5 over in the left lane, please get over to the right",/r/ThunderBay/comments/tjm0iy/for_anyone_not_driving_more_than_5_over_in_the/i1sxj8y/,1,r/ThunderBay,0,1
Ya I’m on Jameson and I got the notification it was cancelled. The amount of snow on the street is crazy!,t2_85lzv7gy,Mangiacakes,0,1648047839.0,0,t1_i1swxsu,i1swxsu,True,ahope1985,t3_tksloy,https://www.reddit.com/r/ThunderBay/comments/tksloy/garbage_pick_up_cancelled/,Garbage pick up cancelled,/r/ThunderBay/comments/tksloy/garbage_pick_up_cancelled/i1swxsu/,1,r/ThunderBay,0,1
I’ve already stated there weren’t any. Now I will ask again. Who am I endangering besides myself?,t2_4nuqeyl,99Fan,0,1648047679.0,0,t1_i1swj6s,i1swj6s,False,99Fan,t3_tjm0iy,https://www.reddit.com/r/ThunderBay/comments/tjm0iy/for_anyone_not_driving_more_than_5_over_in_the/,"For anyone not driving more than 5 over in the left lane, please get over to the right",/r/ThunderBay/comments/tjm0iy/for_anyone_not_driving_more_than_5_over_in_the/i1swj6s/,2,r/ThunderBay,0,2
Other drivers on the road,t2_abfo3c74,Piss_Jug_Ray,0,1648047599.0,0,t1_i1swbpz,i1swbpz,False,99Fan,t3_tjm0iy,https://www.reddit.com/r/ThunderBay/comments/tjm0iy/for_anyone_not_driving_more_than_5_over_in_the/,"For anyone not driving more than 5 over in the left lane, please get over to the right",/r/ThunderBay/comments/tjm0iy/for_anyone_not_driving_more_than_5_over_in_the/i1swbpz/,1,r/ThunderBay,0,1
Nice. Still didn’t answer my question. Who am I endangering beside myself?,t2_4nuqeyl,99Fan,0,1648047538.0,0,t1_i1sw657,i1sw657,False,99Fan,t3_tjm0iy,https://www.reddit.com/r/ThunderBay/comments/tjm0iy/for_anyone_not_driving_more_than_5_over_in_the/,"For anyone not driving more than 5 over in the left lane, please get over to the right",/r/ThunderBay/comments/tjm0iy/for_anyone_not_driving_more_than_5_over_in_the/i1sw657/,2,r/ThunderBay,0,2
"Haha fuck the law, what a loser piece of shit.",t2_abfo3c74,Piss_Jug_Ray,0,1648047479.0,0,t1_i1sw0o0,i1sw0o0,False,99Fan,t3_tjm0iy,https://www.reddit.com/r/ThunderBay/comments/tjm0iy/for_anyone_not_driving_more_than_5_over_in_the/,"For anyone not driving more than 5 over in the left lane, please get over to the right",/r/ThunderBay/comments/tjm0iy/for_anyone_not_driving_more_than_5_over_in_the/i1sw0o0/,1,r/ThunderBay,0,1
"Haha fuck the law, what a loser piece of shit.",t2_abfo3c74,Piss_Jug_Ray,0,1648047473.0,0,t1_i1sw01p,i1sw01p,False,99Fan,t3_tjm0iy,https://www.reddit.com/r/ThunderBay/comments/tjm0iy/for_anyone_not_driving_more_than_5_over_in_the/,"For anyone not driving more than 5 over in the left lane, please get over to the right",/r/ThunderBay/comments/tjm0iy/for_anyone_not_driving_more_than_5_over_in_the/i1sw01p/,1,r/ThunderBay,0,1
Fuck the law. You don’t even understand what im saying. How can me only endangering myself make me a “piece of shit”?,t2_4nuqeyl,99Fan,0,1648047435.0,0,t1_i1svwks,i1svwks,False,99Fan,t3_tjm0iy,https://www.reddit.com/r/ThunderBay/comments/tjm0iy/for_anyone_not_driving_more_than_5_over_in_the/,"For anyone not driving more than 5 over in the left lane, please get over to the right",/r/ThunderBay/comments/tjm0iy/for_anyone_not_driving_more_than_5_over_in_the/i1svwks/,0,r/ThunderBay,0,0
"Please find me this law that the speed limit only applies when you’re not alone, until then you’re a piece of shit.",t2_abfo3c74,Piss_Jug_Ray,0,1648047373.0,0,t1_i1svqvt,i1svqvt,False,99Fan,t3_tjm0iy,https://www.reddit.com/r/ThunderBay/comments/tjm0iy/for_anyone_not_driving_more_than_5_over_in_the/,"For anyone not driving more than 5 over in the left lane, please get over to the right",/r/ThunderBay/comments/tjm0iy/for_anyone_not_driving_more_than_5_over_in_the/i1svqvt/,1,r/ThunderBay,0,1
"What? What does that even mean? Do you know what a speed limit is for? Its to keep OTHERS safe. The only person that could have suffered from me driving 140 on a straight, carless highway was me. I hope you get the help you need, truly. Nobodys taking you seriously when you just call them names and don’t have even the slightest grip on reality and how it works.",t2_4nuqeyl,99Fan,0,1648047318.0,0,t1_i1svlre,i1svlre,False,99Fan,t3_tjm0iy,https://www.reddit.com/r/ThunderBay/comments/tjm0iy/for_anyone_not_driving_more_than_5_over_in_the/,"For anyone not driving more than 5 over in the left lane, please get over to the right",/r/ThunderBay/comments/tjm0iy/for_anyone_not_driving_more_than_5_over_in_the/i1svlre/,1,r/ThunderBay,0,1
So that changes the speed limit? Share your head you piece of shit,t2_abfo3c74,Piss_Jug_Ray,0,1648047078.0,0,t1_i1suzgf,i1suzgf,False,99Fan,t3_tjm0iy,https://www.reddit.com/r/ThunderBay/comments/tjm0iy/for_anyone_not_driving_more_than_5_over_in_the/,"For anyone not driving more than 5 over in the left lane, please get over to the right",/r/ThunderBay/comments/tjm0iy/for_anyone_not_driving_more_than_5_over_in_the/i1suzgf/,1,r/ThunderBay,0,1
Garbage pickup is the last thing I will be worried about right now.,t2_66xxjgfs,Successful_Race_9933,0,1648046396.0,0,t1_i1st9f1,i1st9f1,True,ahope1985,t3_tksloy,https://www.reddit.com/r/ThunderBay/comments/tksloy/garbage_pick_up_cancelled/,Garbage pick up cancelled,/r/ThunderBay/comments/tksloy/garbage_pick_up_cancelled/i1st9f1/,1,r/ThunderBay,0,1
"I went out and shovelled the driveway last night, came in the house and told the wife... ""cheated death again!""",t2_8nsyj,VirtualRealityCzech,0,1648046265.0,0,t1_i1ssxqf,i1ssxqf,False,ahope1985,t3_tksloy,https://www.reddit.com/r/ThunderBay/comments/tksloy/garbage_pick_up_cancelled/,Garbage pick up cancelled,/r/ThunderBay/comments/tksloy/garbage_pick_up_cancelled/i1ssxqf/,3,r/ThunderBay,0,3
You aren’t. You are meaning to tell me you didn’t learn how to avoid hitting potholes?,t2_4nuqeyl,99Fan,0,1648046246.0,0,t1_i1ssw0l,i1ssw0l,False,99Fan,t3_tjm0iy,https://www.reddit.com/r/ThunderBay/comments/tjm0iy/for_anyone_not_driving_more_than_5_over_in_the/,"For anyone not driving more than 5 over in the left lane, please get over to the right",/r/ThunderBay/comments/tjm0iy/for_anyone_not_driving_more_than_5_over_in_the/i1ssw0l/,1,r/ThunderBay,0,1
Your point? I was literally alone on the highway not a car in sight. Know the situation before calling people names.,t2_4nuqeyl,99Fan,0,1648046211.0,0,t1_i1sssrt,i1sssrt,False,99Fan,t3_tjm0iy,https://www.reddit.com/r/ThunderBay/comments/tjm0iy/for_anyone_not_driving_more_than_5_over_in_the/,"For anyone not driving more than 5 over in the left lane, please get over to the right",/r/ThunderBay/comments/tjm0iy/for_anyone_not_driving_more_than_5_over_in_the/i1sssrt/,1,r/ThunderBay,0,1
If the poor kid delivering the morning newspaper could make it through the snow this morning you would think the mailman could... but i doubt it.,t2_8nsyj,VirtualRealityCzech,0,1648046198.0,0,t1_i1ssrnb,i1ssrnb,False,ahope1985,t3_tksloy,https://www.reddit.com/r/ThunderBay/comments/tksloy/garbage_pick_up_cancelled/,Garbage pick up cancelled,/r/ThunderBay/comments/tksloy/garbage_pick_up_cancelled/i1ssrnb/,5,r/ThunderBay,0,5
I've never dealt with them but they import a lot of products via Rydens and I've seen some really nice stuff waiting for them to pick up.,t2_397rg27l,Dr-Shanks,0,1648045562.0,0,t1_i1sr6a6,i1sr6a6,False,Om3gastarx,t3_tkhnd2,https://www.reddit.com/r/ThunderBay/comments/tkhnd2/local_recommendations_for_hardwood_purchaseinstall/,Local recommendations for hardwood purchase/install?,/r/ThunderBay/comments/tkhnd2/local_recommendations_for_hardwood_purchaseinstall/i1sr6a6/,2,r/ThunderBay,0,2
"'Santa so nice, he came twice'",t2_bf2ry6mn,JSupply,0,1648045043.0,0,t1_i1spwce,i1spwce,True,cptomgipwndu,t3_tkmc9f,https://www.reddit.com/r/ThunderBay/comments/tkmc9f/an_interesting_title/,An interesting title,/r/ThunderBay/comments/tkmc9f/an_interesting_title/i1spwce/,1,r/ThunderBay,0,1
You’re,t2_abfo3c74,Piss_Jug_Ray,0,1648044687.0,0,t1_i1sp1cf,i1sp1cf,False,VirtualRealityCzech,t3_tizdne,https://www.reddit.com/r/ThunderBay/comments/tizdne/what_do_you_think_is_going_to_happen_tomorrow/,What do you think is going to happen tomorrow?,/r/ThunderBay/comments/tizdne/what_do_you_think_is_going_to_happen_tomorrow/i1sp1cf/,1,r/ThunderBay,0,1
are you hitting on me?,t2_abfo3c74,Piss_Jug_Ray,0,1648044227.0,0,t1_i1sny64,i1sny64,False,VirtualRealityCzech,t3_tizdne,https://www.reddit.com/r/ThunderBay/comments/tizdne/what_do_you_think_is_going_to_happen_tomorrow/,What do you think is going to happen tomorrow?,/r/ThunderBay/comments/tizdne/what_do_you_think_is_going_to_happen_tomorrow/i1sny64/,1,r/ThunderBay,0,1
But when you do it it's cute right,t2_4e6lsxw9,shiddytclown,0,1648044201.0,0,t1_i1snvzc,i1snvzc,False,VirtualRealityCzech,t3_tizdne,https://www.reddit.com/r/ThunderBay/comments/tizdne/what_do_you_think_is_going_to_happen_tomorrow/,What do you think is going to happen tomorrow?,/r/ThunderBay/comments/tizdne/what_do_you_think_is_going_to_happen_tomorrow/i1snvzc/,0,r/ThunderBay,0,0
Yuppers! But you continue to argue on the internet all day! Wish you the best!,t2_abfo3c74,Piss_Jug_Ray,0,1648043631.0,0,t1_i1smjt8,i1smjt8,False,VirtualRealityCzech,t3_tizdne,https://www.reddit.com/r/ThunderBay/comments/tizdne/what_do_you_think_is_going_to_happen_tomorrow/,What do you think is going to happen tomorrow?,/r/ThunderBay/comments/tizdne/what_do_you_think_is_going_to_happen_tomorrow/i1smjt8/,0,r/ThunderBay,0,0
I used swan for my hardwood install 10 years ago. Mostly good experience.,t2_21sq4fl8,SleepyGs_MuadDib,0,1648043572.0,0,t1_i1smeup,i1smeup,True,Om3gastarx,t3_tkhnd2,https://www.reddit.com/r/ThunderBay/comments/tkhnd2/local_recommendations_for_hardwood_purchaseinstall/,Local recommendations for hardwood purchase/install?,/r/ThunderBay/comments/tkhnd2/local_recommendations_for_hardwood_purchaseinstall/i1smeup/,2,r/ThunderBay,0,2
Na. If you can't use your logic to understand that it's not over and your 10minutes in a store mild inconvenience of covering your face to not spit on groceries is not something you can do then your not being a decent person.,t2_4e6lsxw9,shiddytclown,0,1648043560.0,0,t1_i1smdrp,i1smdrp,False,VirtualRealityCzech,t3_tizdne,https://www.reddit.com/r/ThunderBay/comments/tizdne/what_do_you_think_is_going_to_happen_tomorrow/,What do you think is going to happen tomorrow?,/r/ThunderBay/comments/tizdne/what_do_you_think_is_going_to_happen_tomorrow/i1smdrp/,0,r/ThunderBay,0,0
"There’s a large amount of decent people not wearing masks in the stores now too. If they weren’t when the mandate was on, ya they weren’t decent but many decent people not wearing a mask now.",t2_abfo3c74,Piss_Jug_Ray,0,1648043522.0,0,t1_i1smaj0,i1smaj0,False,VirtualRealityCzech,t3_tizdne,https://www.reddit.com/r/ThunderBay/comments/tizdne/what_do_you_think_is_going_to_happen_tomorrow/,What do you think is going to happen tomorrow?,/r/ThunderBay/comments/tizdne/what_do_you_think_is_going_to_happen_tomorrow/i1smaj0/,0,r/ThunderBay,0,0
Stop licking groceries,t2_abfo3c74,Piss_Jug_Ray,0,1648043455.0,0,t1_i1sm4sc,i1sm4sc,False,VirtualRealityCzech,t3_tizdne,https://www.reddit.com/r/ThunderBay/comments/tizdne/what_do_you_think_is_going_to_happen_tomorrow/,What do you think is going to happen tomorrow?,/r/ThunderBay/comments/tizdne/what_do_you_think_is_going_to_happen_tomorrow/i1sm4sc/,0,r/ThunderBay,0,0
Ok just stay at home,t2_abfo3c74,Piss_Jug_Ray,0,1648043415.0,0,t1_i1sm1db,i1sm1db,False,VirtualRealityCzech,t3_tizdne,https://www.reddit.com/r/ThunderBay/comments/tizdne/what_do_you_think_is_going_to_happen_tomorrow/,What do you think is going to happen tomorrow?,/r/ThunderBay/comments/tizdne/what_do_you_think_is_going_to_happen_tomorrow/i1sm1db/,2,r/ThunderBay,0,2
"You got busted doing 140 in a 90 you piece of shit, better safe than sorry you piece of shit.",t2_abfo3c74,Piss_Jug_Ray,0,1648042967.0,0,t1_i1skzvg,i1skzvg,False,99Fan,t3_tjm0iy,https://www.reddit.com/r/ThunderBay/comments/tjm0iy/for_anyone_not_driving_more_than_5_over_in_the/,"For anyone not driving more than 5 over in the left lane, please get over to the right",/r/ThunderBay/comments/tjm0iy/for_anyone_not_driving_more_than_5_over_in_the/i1skzvg/,3,r/ThunderBay,0,3
You are not bright,t2_abfo3c74,Piss_Jug_Ray,0,1648042881.0,0,t1_i1sksq8,i1sksq8,False,99Fan,t3_tjm0iy,https://www.reddit.com/r/ThunderBay/comments/tjm0iy/for_anyone_not_driving_more_than_5_over_in_the/,"For anyone not driving more than 5 over in the left lane, please get over to the right",/r/ThunderBay/comments/tjm0iy/for_anyone_not_driving_more_than_5_over_in_the/i1sksq8/,1,r/ThunderBay,0,1
Nope we’re one of the worst,t2_abfo3c74,Piss_Jug_Ray,0,1648042790.0,0,t1_i1skl8i,i1skl8i,False,WeTheNorth20,t3_tkcax0,https://www.reddit.com/r/ThunderBay/comments/tkcax0/voting_starts_for_caas_worst_roads_in_ontario/,Voting starts for CAA's worst roads In Ontario,/r/ThunderBay/comments/tkcax0/voting_starts_for_caas_worst_roads_in_ontario/i1skl8i/,1,r/ThunderBay,0,1
Hope the postman is out my weed needs to be delivered,t2_abfo3c74,Piss_Jug_Ray,0,1648042644.0,0,t1_i1sk9ie,i1sk9ie,True,ahope1985,t3_tksloy,https://www.reddit.com/r/ThunderBay/comments/tksloy/garbage_pick_up_cancelled/,Garbage pick up cancelled,/r/ThunderBay/comments/tksloy/garbage_pick_up_cancelled/i1sk9ie/,5,r/ThunderBay,0,5
"What an insulting and untrue thing for him to say. I was part of the basic income pilot until that pile of grissel Ford cancelled it, and in less than a year I mannaged to save up for driving lessons, and while working save up to buy a car.. And then I used my car to get out of retail to more lucrative job prospects..

What a peice of garbage that guy is.",t2_4e6lsxw9,shiddytclown,0,1648042460.0,0,t1_i1sjurz,i1sjurz,False,NWO_DEM,t3_tk1p62,https://www.reddit.com/r/ThunderBay/comments/tk1p62/lookie_lookie_councils_dirty/,"Lookie Lookie, Council's Dirty",/r/ThunderBay/comments/tk1p62/lookie_lookie_councils_dirty/i1sjurz/,5,r/ThunderBay,0,5
Ya the plows need time to imprison us in our own driveways. Shout-out out to all my fellow Tbayers who live on bus routes.,t2_a24wl,bombtrack81,0,1648041141.0,0,t1_i1sgy8l,i1sgy8l,True,ahope1985,t3_tksloy,https://www.reddit.com/r/ThunderBay/comments/tksloy/garbage_pick_up_cancelled/,Garbage pick up cancelled,/r/ThunderBay/comments/tksloy/garbage_pick_up_cancelled/i1sgy8l/,13,r/ThunderBay,0,13
"Heart attack snow is just what the hospital needs right now..

Judging from the weather map it may not stop snowing today..",t2_15826e,Blue-Thunder,0,1648040964.0,0,t1_i1sgkuy,i1sgkuy,False,ahope1985,t3_tksloy,https://www.reddit.com/r/ThunderBay/comments/tksloy/garbage_pick_up_cancelled/,Garbage pick up cancelled,/r/ThunderBay/comments/tksloy/garbage_pick_up_cancelled/i1sgkuy/,4,r/ThunderBay,0,4
"All garbage and recycling collection that should have happened today is postponed until Saturday. 

Careful if you’re driving out there. It’s greasy.",t2_e3v8ab3,Fantastic_Platypus,0,1648040535.0,0,t1_i1sfotw,i1sfotw,True,ahope1985,t3_tksloy,https://www.reddit.com/r/ThunderBay/comments/tksloy/garbage_pick_up_cancelled/,Garbage pick up cancelled,/r/ThunderBay/comments/tksloy/garbage_pick_up_cancelled/i1sfotw/,7,r/ThunderBay,0,7
"Thanks for your response. I'll research those companies. Have you had any experiences, or heard anything about Design Building Center? They seem to carry good quality products!",t2_794jq2v1,Om3gastarx,0,1648040111.0,0,t1_i1setp6,i1setp6,False,Om3gastarx,t3_tkhnd2,https://www.reddit.com/r/ThunderBay/comments/tkhnd2/local_recommendations_for_hardwood_purchaseinstall/,Local recommendations for hardwood purchase/install?,/r/ThunderBay/comments/tkhnd2/local_recommendations_for_hardwood_purchaseinstall/i1setp6/,1,r/ThunderBay,0,1
"Agreed, they do great work!",t2_4amix,invalidmemory,0,1648039210.0,0,t1_i1sd1td,i1sd1td,False,Om3gastarx,t3_tkhnd2,https://www.reddit.com/r/ThunderBay/comments/tkhnd2/local_recommendations_for_hardwood_purchaseinstall/,Local recommendations for hardwood purchase/install?,/r/ThunderBay/comments/tkhnd2/local_recommendations_for_hardwood_purchaseinstall/i1sd1td/,2,r/ThunderBay,0,2
But the schools are open! Likely will be ghost towns today. It'll take a long time for people to dig out - that snow is heavy.,t2_kmfci,hatonmyknee,0,1648038895.0,0,t1_i1scghw,i1scghw,True,ahope1985,t3_tksloy,https://www.reddit.com/r/ThunderBay/comments/tksloy/garbage_pick_up_cancelled/,Garbage pick up cancelled,/r/ThunderBay/comments/tksloy/garbage_pick_up_cancelled/i1scghw/,5,r/ThunderBay,0,5
"You’re going to get downvoted for that sentiment (I have the same sentiment).  All cities in Canada are pretty rough during the thaw but North Bay was one of the worst for me.  Most of the city is built on soft sediment or swamp land and they have a lot of erosion and flooding.  It’s terrible there.

One thing I will give Thunder Bay is I have seen some of the largest and deepest potholes in recent memory.",t2_dl49q,quebecoisejohn,0,1648037429.0,0,t1_i1s9s7f,i1s9s7f,False,WeTheNorth20,t3_tkcax0,https://www.reddit.com/r/ThunderBay/comments/tkcax0/voting_starts_for_caas_worst_roads_in_ontario/,Voting starts for CAA's worst roads In Ontario,/r/ThunderBay/comments/tkcax0/voting_starts_for_caas_worst_roads_in_ontario/i1s9s7f/,2,r/ThunderBay,0,2
"""Hey Doom_Art why do you drive in the left lane""        

Aw jeez guys I dunno what to tell ya",t2_ar3wg,Doom_Art,0,1648036701.0,0,t1_i1s8ijy,i1s8ijy,True,WeTheNorth20,t3_tkcax0,https://www.reddit.com/r/ThunderBay/comments/tkcax0/voting_starts_for_caas_worst_roads_in_ontario/,Voting starts for CAA's worst roads In Ontario,/r/ThunderBay/comments/tkcax0/voting_starts_for_caas_worst_roads_in_ontario/i1s8ijy/,4,r/ThunderBay,0,4
