body,author_fullname,author.name,controversiality,created,downs,fullname,id,is_root,link_author,link_id,link_permalink,link_title,permalink,score,subreddit_name_prefixed,total_awards_received,ups
"If there's enough freezing rain, it will self-level the uneven spots!",t2_a2d0t,tjernobyl,0,1647874725.0,0,t1_i1jccq4,i1jccq4,False,frankiemacdonald1984,t3_tizs9e,https://www.reddit.com/r/ThunderBay/comments/tizs9e/major_snowstorm_to_hit_thunder_bay_ontario_on/,"Major Snowstorm to Hit Thunder Bay Ontario on Tuesday March 22, 2022",/r/ThunderBay/comments/tizs9e/major_snowstorm_to_hit_thunder_bay_ontario_on/i1jccq4/,6,r/ThunderBay,0,6
I just like stats and thought others might as well for nothing other than curiosity’s sake. I’m not making any claims or trying to start any thing.,t2_3a1pti1n,rainawaytheday,0,1647874167.0,0,t1_i1jb0nq,i1jb0nq,False,[deleted],t3_tjcqz6,https://www.reddit.com/r/ThunderBay/comments/tjcqz6/masked_vs_unmasked/,Masked vs unmasked,/r/ThunderBay/comments/tjcqz6/masked_vs_unmasked/i1jb0nq/,2,r/ThunderBay,0,2
"Is Frankie ever wrong? Everytime I see him posted in Toronto or Ottawa areas people are like ""oh fuck"" because he always gets it right.",t2_4gupi,sycho,0,1647873849.0,0,t1_i1ja9ko,i1ja9ko,False,frankiemacdonald1984,t3_tizs9e,https://www.reddit.com/r/ThunderBay/comments/tizs9e/major_snowstorm_to_hit_thunder_bay_ontario_on/,"Major Snowstorm to Hit Thunder Bay Ontario on Tuesday March 22, 2022",/r/ThunderBay/comments/tizs9e/major_snowstorm_to_hit_thunder_bay_ontario_on/i1ja9ko/,6,r/ThunderBay,0,6
"I'm going to continue wearing mine, just you trigger people like trolly mctroll over there. Never worn mine in my vehicle alone but just might start if the prior picks up triggers.",t2_a4his1j1,Chance-Reporter-2910,0,1647873678.0,0,t1_i1j9uw7,i1j9uw7,True,VirtualRealityCzech,t3_tizdne,https://www.reddit.com/r/ThunderBay/comments/tizdne/what_do_you_think_is_going_to_happen_tomorrow/,What do you think is going to happen tomorrow?,/r/ThunderBay/comments/tizdne/what_do_you_think_is_going_to_happen_tomorrow/i1j9uw7/,7,r/ThunderBay,0,7
Oh fuck now its real.  Damn you Frankie!,t2_282rf,el0rg,0,1647873408.0,0,t1_i1j9877,i1j9877,True,frankiemacdonald1984,t3_tizs9e,https://www.reddit.com/r/ThunderBay/comments/tizs9e/major_snowstorm_to_hit_thunder_bay_ontario_on/,"Major Snowstorm to Hit Thunder Bay Ontario on Tuesday March 22, 2022",/r/ThunderBay/comments/tizs9e/major_snowstorm_to_hit_thunder_bay_ontario_on/i1j9877/,3,r/ThunderBay,0,3
Please don't make a big deal of this just let people live their lives and do their own thing.,t2_ktx4lvr5,Ad_Versa,0,1647872138.0,0,t1_i1j6b24,i1j6b24,True,[deleted],t3_tjcqz6,https://www.reddit.com/r/ThunderBay/comments/tjcqz6/masked_vs_unmasked/,Masked vs unmasked,/r/ThunderBay/comments/tjcqz6/masked_vs_unmasked/i1j6b24/,9,r/ThunderBay,0,9
"Anything specific that you are looking for suggestions on, your OP is a little vague.",t2_dl49q,quebecoisejohn,0,1647870917.0,0,t1_i1j3mcd,i1j3mcd,True,arxlxxn21,t3_tj6swl,https://www.reddit.com/r/ThunderBay/comments/tj6swl/lakehead_university/,Lakehead University,/r/ThunderBay/comments/tj6swl/lakehead_university/i1j3mcd/,6,r/ThunderBay,0,6
"You're the man, Frankie!",t2_3qbsvnfy,dont_get_your_jokes,0,1647870541.0,0,t1_i1j2tf9,i1j2tf9,True,frankiemacdonald1984,t3_tizs9e,https://www.reddit.com/r/ThunderBay/comments/tizs9e/major_snowstorm_to_hit_thunder_bay_ontario_on/,"Major Snowstorm to Hit Thunder Bay Ontario on Tuesday March 22, 2022",/r/ThunderBay/comments/tizs9e/major_snowstorm_to_hit_thunder_bay_ontario_on/i1j2tf9/,3,r/ThunderBay,0,3
"You’re not gonna like what’s predicted for Tuesday then, sorry!",t2_8cozz5i,realcanadianbeaver,0,1647869773.0,0,t1_i1j187l,i1j187l,True,Excellent-Steak6368,t3_tiv50c,https://www.reddit.com/r/ThunderBay/comments/tiv50c/spring_fever_2022/,Spring Fever ! 2022,/r/ThunderBay/comments/tiv50c/spring_fever_2022/i1j187l/,7,r/ThunderBay,0,7
"I did see those and looked through them. They have a ward map, but I wanted a neighbourhood map. It was for a work thing, so nothing fancy needed here.",t2_27h3kgr5,Bubbly_Lavishness,0,1647869458.0,0,t1_i1j0kul,i1j0kul,False,Bubbly_Lavishness,t3_th1ien,https://www.reddit.com/r/ThunderBay/comments/th1ien/neighbourhood_map/,Neighbourhood Map,/r/ThunderBay/comments/th1ien/neighbourhood_map/i1j0kul/,1,r/ThunderBay,0,1
More freezing rain! So tired of this my knees don't want to be wrenched by slick uneven ground anymore 😭,t2_4e6lsxw9,shiddytclown,0,1647868167.0,0,t1_i1iy0h3,i1iy0h3,True,frankiemacdonald1984,t3_tizs9e,https://www.reddit.com/r/ThunderBay/comments/tizs9e/major_snowstorm_to_hit_thunder_bay_ontario_on/,"Major Snowstorm to Hit Thunder Bay Ontario on Tuesday March 22, 2022",/r/ThunderBay/comments/tizs9e/major_snowstorm_to_hit_thunder_bay_ontario_on/i1iy0h3/,3,r/ThunderBay,0,3
"I'm going to continue wearing mine. Out of curteosy to others to not put my saliva on groceries. I think dropping mask mandates was a huge mistake and should be adapted seasonally even after this to prevent people from getting colds and growing new pandemic viruses.

It's so disheaetening that people aren't even able to undergo a small inconvenience to potentially save somone elses life.",t2_4e6lsxw9,shiddytclown,0,1647867675.0,0,t1_i1ix2rd,i1ix2rd,True,VirtualRealityCzech,t3_tizdne,https://www.reddit.com/r/ThunderBay/comments/tizdne/what_do_you_think_is_going_to_happen_tomorrow/,What do you think is going to happen tomorrow?,/r/ThunderBay/comments/tizdne/what_do_you_think_is_going_to_happen_tomorrow/i1ix2rd/,24,r/ThunderBay,0,24
"the city opf thunder bay has some map services that might be helpful

https://www.thunderbay.ca/en/city-services/maps.aspx",t2_jzsor,JamesNonstop,0,1647867480.0,0,t1_i1iwpin,i1iwpin,True,Bubbly_Lavishness,t3_th1ien,https://www.reddit.com/r/ThunderBay/comments/th1ien/neighbourhood_map/,Neighbourhood Map,/r/ThunderBay/comments/th1ien/neighbourhood_map/i1iwpin/,1,r/ThunderBay,0,1
"Imagine being such a child, still. After two years",t2_4e6lsxw9,shiddytclown,0,1647867446.0,0,t1_i1iwn5a,i1iwn5a,False,VirtualRealityCzech,t3_tizdne,https://www.reddit.com/r/ThunderBay/comments/tizdne/what_do_you_think_is_going_to_happen_tomorrow/,What do you think is going to happen tomorrow?,/r/ThunderBay/comments/tizdne/what_do_you_think_is_going_to_happen_tomorrow/i1iwn5a/,25,r/ThunderBay,0,25
"I personally love CBC radio 2 in the morning and then again in the afternoon (3-5pm) and CBC 1 when theres a good show on (Q, the current, the debaters, under the influence)",t2_jzsor,JamesNonstop,0,1647867210.0,0,t1_i1iw74e,i1iw74e,True,Excellent-Steak6368,t3_tiv9m8,https://www.reddit.com/r/ThunderBay/comments/tiv9m8/favourite_radio_staions_to_listen_to_in_thunder/,Favourite radio staions to listen to in Thunder Bay,/r/ThunderBay/comments/tiv9m8/favourite_radio_staions_to_listen_to_in_thunder/i1iw74e/,5,r/ThunderBay,0,5
"yeah try 103 or 104. The local stations always shuffle around every few years. They've repeated tried a ""top 40"" style station but it never really sticks.",t2_jzsor,JamesNonstop,0,1647867115.0,0,t1_i1iw0ro,i1iw0ro,False,Excellent-Steak6368,t3_tiv9m8,https://www.reddit.com/r/ThunderBay/comments/tiv9m8/favourite_radio_staions_to_listen_to_in_thunder/,Favourite radio staions to listen to in Thunder Bay,/r/ThunderBay/comments/tiv9m8/favourite_radio_staions_to_listen_to_in_thunder/i1iw0ro/,2,r/ThunderBay,0,2
"every pizza discussion is fascinating, there are 60 different pizza joints and everybody assumes they have it all figured out.

Having lived on the south side my whole life, when it comes to pizza places like Donatos, double double, Stans, etc dont even cross my mind. then sometimes like this example people include grocery store pizza??

Also im shocked every time someone mentions Stans pizza,  I could have sworn that building has been closed up for 30 years",t2_jzsor,JamesNonstop,0,1647866952.0,0,t1_i1ivps5,i1ivps5,True,dsf8a978978,t3_tiv6x9,https://www.reddit.com/r/ThunderBay/comments/tiv6x9/i_hate_how_much_i_like_pizza_hut/,I hate how much I like Pizza Hut,/r/ThunderBay/comments/tiv6x9/i_hate_how_much_i_like_pizza_hut/i1ivps5/,1,r/ThunderBay,0,1
It’s meant to be so warm the day off and days after even if it stays on the ground won’t be long.,t2_xwnzv,ThatCanadianGuy88,0,1647862533.0,0,t1_i1ioca1,i1ioca1,True,frankiemacdonald1984,t3_tizs9e,https://www.reddit.com/r/ThunderBay/comments/tizs9e/major_snowstorm_to_hit_thunder_bay_ontario_on/,"Major Snowstorm to Hit Thunder Bay Ontario on Tuesday March 22, 2022",/r/ThunderBay/comments/tizs9e/major_snowstorm_to_hit_thunder_bay_ontario_on/i1ioca1/,2,r/ThunderBay,0,2
Thanks Frankie!,t2_1n9fbctc,Ylevolym,0,1647841788.0,0,t1_i1hz1kh,i1hz1kh,True,frankiemacdonald1984,t3_tizs9e,https://www.reddit.com/r/ThunderBay/comments/tizs9e/major_snowstorm_to_hit_thunder_bay_ontario_on/,"Major Snowstorm to Hit Thunder Bay Ontario on Tuesday March 22, 2022",/r/ThunderBay/comments/tizs9e/major_snowstorm_to_hit_thunder_bay_ontario_on/i1hz1kh/,3,r/ThunderBay,0,3
"The vocal idiots will bitch and complain about any companies/businesses keeping them.  Some people will continue to wear their masks as they have people they want to protect, and I'm sure there will be insensitive assholes who will try to shame and bully those who continue to wear masks, which when you rationally think about it is odd.  The government told them to wear masks and they complained and called people who complied and wore them sheep.  The government now tells them they no longer have to wear masks, and they'll comply thereby becoming the very sheep they called other people.

Just wear a mask if you want to, and tell anyone who complains you're not a government shill or sheep, or ""My body my choice"", etc.  Use the arguments they used to ignore science, against them, because let's face it, we're not out of the woods yet.

I look forward to all the intelligent replies the ""pure bloods"" will bring forth.",t2_15826e,Blue-Thunder,0,1647838028.0,0,t1_i1htp52,i1htp52,True,VirtualRealityCzech,t3_tizdne,https://www.reddit.com/r/ThunderBay/comments/tizdne/what_do_you_think_is_going_to_happen_tomorrow/,What do you think is going to happen tomorrow?,/r/ThunderBay/comments/tizdne/what_do_you_think_is_going_to_happen_tomorrow/i1htp52/,21,r/ThunderBay,0,21
And spent some time in SK too,t2_jf0p23w5,jonny_doey,0,1647836069.0,0,t1_i1hqhj2,i1hqhj2,False,jonny_doey,t3_taq41s,https://www.reddit.com/r/ThunderBay/comments/taq41s/pedestrian_crossings/,Pedestrian crossings,/r/ThunderBay/comments/taq41s/pedestrian_crossings/i1hqhj2/,1,r/ThunderBay,0,1
But I drove quite a lot through BC as well.,t2_jf0p23w5,jonny_doey,0,1647836034.0,0,t1_i1hqfgg,i1hqfgg,False,jonny_doey,t3_taq41s,https://www.reddit.com/r/ThunderBay/comments/taq41s/pedestrian_crossings/,Pedestrian crossings,/r/ThunderBay/comments/taq41s/pedestrian_crossings/i1hqfgg/,1,r/ThunderBay,0,1
AB,t2_jf0p23w5,jonny_doey,0,1647835805.0,0,t1_i1hq1om,i1hq1om,False,jonny_doey,t3_taq41s,https://www.reddit.com/r/ThunderBay/comments/taq41s/pedestrian_crossings/,Pedestrian crossings,/r/ThunderBay/comments/taq41s/pedestrian_crossings/i1hq1om/,1,r/ThunderBay,0,1
"Most places it's going to be totally fine, maybe a few examples of poor retail workers having to deal with people complaining about things outside their control.",t2_6bcto,CanuckBacon,0,1647831811.0,0,t1_i1hit2e,i1hit2e,True,VirtualRealityCzech,t3_tizdne,https://www.reddit.com/r/ThunderBay/comments/tizdne/what_do_you_think_is_going_to_happen_tomorrow/,What do you think is going to happen tomorrow?,/r/ThunderBay/comments/tizdne/what_do_you_think_is_going_to_happen_tomorrow/i1hit2e/,6,r/ThunderBay,0,6
You better not be right Frankie!,t2_dct04,TapLup,0,1647831008.0,0,t1_i1hh86u,i1hh86u,True,frankiemacdonald1984,t3_tizs9e,https://www.reddit.com/r/ThunderBay/comments/tizs9e/major_snowstorm_to_hit_thunder_bay_ontario_on/,"Major Snowstorm to Hit Thunder Bay Ontario on Tuesday March 22, 2022",/r/ThunderBay/comments/tizs9e/major_snowstorm_to_hit_thunder_bay_ontario_on/i1hh86u/,9,r/ThunderBay,0,9
"Don't kid yourself. You do not possess the intellectual ability for anything resembling ""thinking"". The ONLY think you know how to do is mindlessly gobble up everything you're told to believe by the mainstream media. 

I'm not calling other people stupid. I'm calling stupid people, like you, who have made their stupidity so obvious that they might as well be holding up a sign. In your case it's more like a billboard. 

Go beg for attention somewhere else. I don't teach special ed.",t2_fbw1a4wc,OnionNexus,0,1647829747.0,0,t1_i1hepzg,i1hepzg,False,koosopenheimer,t3_t2tqij,https://www.reddit.com/r/ThunderBay/comments/t2tqij/bill_s233_yeah_or_nay/,Bill S-233. Yeah or nay?,/r/ThunderBay/comments/t2tqij/bill_s233_yeah_or_nay/i1hepzg/,1,r/ThunderBay,0,1
Oh man!!  More snow…. It was melting so nice!!,t2_ju4zn6dj,Serious-Routine-9482,0,1647829124.0,0,t1_i1hdggq,i1hdggq,True,frankiemacdonald1984,t3_tizs9e,https://www.reddit.com/r/ThunderBay/comments/tizs9e/major_snowstorm_to_hit_thunder_bay_ontario_on/,"Major Snowstorm to Hit Thunder Bay Ontario on Tuesday March 22, 2022",/r/ThunderBay/comments/tizs9e/major_snowstorm_to_hit_thunder_bay_ontario_on/i1hdggq/,14,r/ThunderBay,0,14
McDonald's,t2_k9nzzkx1,Secret-Captain-1538,0,1647827742.0,0,t1_i1hamkg,i1hamkg,True,Frosty-Yamm,t3_tewb5i,https://www.reddit.com/r/ThunderBay/comments/tewb5i/favourite_place_to_order_a_burger_in_town_d_ive/,Favourite place to order a burger in town? :D I’ve got a craving,/r/ThunderBay/comments/tewb5i/favourite_place_to_order_a_burger_in_town_d_ive/i1hamkg/,1,r/ThunderBay,0,1
#Frankie!#,t2_6lzox,CatastropheJohn,0,1647827723.0,0,t1_i1hal6o,i1hal6o,True,frankiemacdonald1984,t3_tizs9e,https://www.reddit.com/r/ThunderBay/comments/tizs9e/major_snowstorm_to_hit_thunder_bay_ontario_on/,"Major Snowstorm to Hit Thunder Bay Ontario on Tuesday March 22, 2022",/r/ThunderBay/comments/tizs9e/major_snowstorm_to_hit_thunder_bay_ontario_on/i1hal6o/,11,r/ThunderBay,0,11
Cool,t2_ssh6fjx,MineMyVape,0,1647827451.0,0,t1_i1ha11k,i1ha11k,False,MilesOfPebbles,t3_tf0qib,https://www.reddit.com/r/ThunderBay/comments/tf0qib/what_are_some_of_your_thunder_bay_related/,What are some of your Thunder Bay -related conspiracy theories and/or legends?!,/r/ThunderBay/comments/tf0qib/what_are_some_of_your_thunder_bay_related/i1ha11k/,1,r/ThunderBay,0,1
"I agree, outside of Reddit I don’t think this is a big deal to most people. I’ll keep my mask in my pocket, put it on if required by a business. It wouldn’t even cross my mind to bother a person that still decides to wear a mask.",t2_4di1c27p,hvaced,0,1647827111.0,0,t1_i1h9bb2,i1h9bb2,False,VirtualRealityCzech,t3_tizdne,https://www.reddit.com/r/ThunderBay/comments/tizdne/what_do_you_think_is_going_to_happen_tomorrow/,What do you think is going to happen tomorrow?,/r/ThunderBay/comments/tizdne/what_do_you_think_is_going_to_happen_tomorrow/i1h9bb2/,9,r/ThunderBay,0,9
"Anyone who says “ Canadians with different races, women, and sexual preferences in the same sentence - makes me think this is an old,  lonley man speaking with nothing better to do than call other people stupid. Jeez",t2_7rdym5x2,Aware-Helicopter1864,0,1647826686.0,0,t1_i1h8fgx,i1h8fgx,False,koosopenheimer,t3_t2tqij,https://www.reddit.com/r/ThunderBay/comments/t2tqij/bill_s233_yeah_or_nay/,Bill S-233. Yeah or nay?,/r/ThunderBay/comments/t2tqij/bill_s233_yeah_or_nay/i1h8fgx/,1,r/ThunderBay,0,1
Pizza Hut is the best chain pizza by a country kilometre.    I’ve had some good mom and pop pizzas too but a good pie from the Hut is damn near perfection.,t2_4cufd0dq,Rockterrace,0,1647826600.0,0,t1_i1h894z,i1h894z,True,dsf8a978978,t3_tiv6x9,https://www.reddit.com/r/ThunderBay/comments/tiv6x9/i_hate_how_much_i_like_pizza_hut/,I hate how much I like Pizza Hut,/r/ThunderBay/comments/tiv6x9/i_hate_how_much_i_like_pizza_hut/i1h894z/,-2,r/ThunderBay,0,-2
I used to like 105.3 when it was classic rock.  Nights with Alice Cooper was a pretty good show to get through night shifts at the old saw mill.   Does Rock 94 air that show?,t2_4cufd0dq,Rockterrace,0,1647826489.0,0,t1_i1h80zs,i1h80zs,True,Excellent-Steak6368,t3_tiv9m8,https://www.reddit.com/r/ThunderBay/comments/tiv9m8/favourite_radio_staions_to_listen_to_in_thunder/,Favourite radio staions to listen to in Thunder Bay,/r/ThunderBay/comments/tiv9m8/favourite_radio_staions_to_listen_to_in_thunder/i1h80zs/,2,r/ThunderBay,0,2
Nah,t2_2dbltyny,Geezir,0,1647825378.0,0,t1_i1h5qn6,i1h5qn6,False,VirtualRealityCzech,t3_tizdne,https://www.reddit.com/r/ThunderBay/comments/tizdne/what_do_you_think_is_going_to_happen_tomorrow/,What do you think is going to happen tomorrow?,/r/ThunderBay/comments/tizdne/what_do_you_think_is_going_to_happen_tomorrow/i1h5qn6/,66,r/ThunderBay,2,66
It's really not going to be as big a deal as people think it is. On Reddit some people are making it seem like there's this major conflict but in provinces where the mandates have already been lifted people are just living their lives and minding their own business.,t2_ktx4lvr5,Ad_Versa,0,1647825209.0,0,t1_i1h5eap,i1h5eap,True,VirtualRealityCzech,t3_tizdne,https://www.reddit.com/r/ThunderBay/comments/tizdne/what_do_you_think_is_going_to_happen_tomorrow/,What do you think is going to happen tomorrow?,/r/ThunderBay/comments/tizdne/what_do_you_think_is_going_to_happen_tomorrow/i1h5eap/,30,r/ThunderBay,0,30
"Can you let me know where so I know not to waste my time going there?

e: Libs are hilarious. So mad about someone not wanting to wear a mask when we are no longer required to - after having worn one at all required establishments for the past 2 years, and being double vax'd. 

I'm trying to actively keep my unmasked self away from anybody who may be offended by that. Isn't that what everybody wants?

Clearly masking up isn't about following the rules of public health professionals. It's about following YOUR rules. That's the definition of virtue signalling.",t2_5ktzfulj,your_gfs_other_bf,0,1647824910.0,0,t1_i1h4s61,i1h4s61,False,VirtualRealityCzech,t3_tizdne,https://www.reddit.com/r/ThunderBay/comments/tizdne/what_do_you_think_is_going_to_happen_tomorrow/,What do you think is going to happen tomorrow?,/r/ThunderBay/comments/tizdne/what_do_you_think_is_going_to_happen_tomorrow/i1h4s61/,-67,r/ThunderBay,0,-67
"I think most will scrap it (mainly bigger franchises like Walmart, Metro, etc), and probably a mix of local businesses will scrap it or keep it. I guess we’ll see.",t2_663nqzd1,Norwest_Shooter,0,1647824711.0,0,t1_i1h4de9,i1h4de9,True,VirtualRealityCzech,t3_tizdne,https://www.reddit.com/r/ThunderBay/comments/tizdne/what_do_you_think_is_going_to_happen_tomorrow/,What do you think is going to happen tomorrow?,/r/ThunderBay/comments/tizdne/what_do_you_think_is_going_to_happen_tomorrow/i1h4de9/,5,r/ThunderBay,0,5
I've only seen one business advertising they will still be requiring masks,t2_2dbltyny,Geezir,0,1647824692.0,0,t1_i1h4bxc,i1h4bxc,True,VirtualRealityCzech,t3_tizdne,https://www.reddit.com/r/ThunderBay/comments/tizdne/what_do_you_think_is_going_to_happen_tomorrow/,What do you think is going to happen tomorrow?,/r/ThunderBay/comments/tizdne/what_do_you_think_is_going_to_happen_tomorrow/i1h4bxc/,15,r/ThunderBay,0,15
"I have bad news I don't think Vinyl Tap is coming back to CBC :( Its only coming to these stations. https://www.randybachman.com/vinyl-tap#:\~:text=VINYL%20TAP%20IS%20BACK!&text=After%20the%20program%20with%20CBC,Roll's%20greatest%20stories%20ever%20told.",t2_ssh6fjx,MineMyVape,0,1647823973.0,0,t1_i1h2tth,i1h2tth,True,Excellent-Steak6368,t3_tiv9m8,https://www.reddit.com/r/ThunderBay/comments/tiv9m8/favourite_radio_staions_to_listen_to_in_thunder/,Favourite radio staions to listen to in Thunder Bay,/r/ThunderBay/comments/tiv9m8/favourite_radio_staions_to_listen_to_in_thunder/i1h2tth/,2,r/ThunderBay,0,2
"The worst summer of my life was spent working in an office where 91.5 was played all day every day and the playlist never changed. I can’t listen to mirrors by Justin timber lake, just give me a reason by pink, and blurred lines by robin thicke without getting PTSD.",t2_1n9fbctc,Ylevolym,0,1647823825.0,0,t1_i1h2iot,i1h2iot,True,Excellent-Steak6368,t3_tiv9m8,https://www.reddit.com/r/ThunderBay/comments/tiv9m8/favourite_radio_staions_to_listen_to_in_thunder/,Favourite radio staions to listen to in Thunder Bay,/r/ThunderBay/comments/tiv9m8/favourite_radio_staions_to_listen_to_in_thunder/i1h2iot/,11,r/ThunderBay,0,11
104.9 the wolf,t2_cmncc,TensecondTarvis,0,1647822955.0,0,t1_i1h0ofj,i1h0ofj,True,Excellent-Steak6368,t3_tiv9m8,https://www.reddit.com/r/ThunderBay/comments/tiv9m8/favourite_radio_staions_to_listen_to_in_thunder/,Favourite radio staions to listen to in Thunder Bay,/r/ThunderBay/comments/tiv9m8/favourite_radio_staions_to_listen_to_in_thunder/i1h0ofj/,0,r/ThunderBay,0,0
"Bot or not this Pizza Hut training video is pure gold

https://youtu.be/7HpCJov3Uj0",t2_1a8hzql5,reekingbunsofangels,0,1647822706.0,0,t1_i1h054j,i1h054j,True,dsf8a978978,t3_tiv6x9,https://www.reddit.com/r/ThunderBay/comments/tiv6x9/i_hate_how_much_i_like_pizza_hut/,I hate how much I like Pizza Hut,/r/ThunderBay/comments/tiv6x9/i_hate_how_much_i_like_pizza_hut/i1h054j/,1,r/ThunderBay,0,1
Fuck off bot.,t2_15826e,Blue-Thunder,0,1647819775.0,0,t1_i1gtw5t,i1gtw5t,True,dsf8a978978,t3_tiv6x9,https://www.reddit.com/r/ThunderBay/comments/tiv6x9/i_hate_how_much_i_like_pizza_hut/,I hate how much I like Pizza Hut,/r/ThunderBay/comments/tiv6x9/i_hate_how_much_i_like_pizza_hut/i1gtw5t/,2,r/ThunderBay,0,2
"def walking weather, i got in a 6km walk yesterday after a winter of sloth-life",t2_8nsyj,VirtualRealityCzech,0,1647819455.0,0,t1_i1gt761,i1gt761,True,Excellent-Steak6368,t3_tiv50c,https://www.reddit.com/r/ThunderBay/comments/tiv50c/spring_fever_2022/,Spring Fever ! 2022,/r/ThunderBay/comments/tiv50c/spring_fever_2022/i1gt761/,2,r/ThunderBay,0,2
This exact post...,t2_1lc5r3h1,zakafx,0,1647818036.0,0,t1_i1gq1ge,i1gq1ge,False,dsf8a978978,t3_tiv6x9,https://www.reddit.com/r/ThunderBay/comments/tiv6x9/i_hate_how_much_i_like_pizza_hut/,I hate how much I like Pizza Hut,/r/ThunderBay/comments/tiv6x9/i_hate_how_much_i_like_pizza_hut/i1gq1ge/,1,r/ThunderBay,0,1
"Seconded, fave station is CILU 102.7 fm",t2_httquz4,aaronzemo,0,1647817282.0,0,t1_i1gocyg,i1gocyg,False,Excellent-Steak6368,t3_tiv9m8,https://www.reddit.com/r/ThunderBay/comments/tiv9m8/favourite_radio_staions_to_listen_to_in_thunder/,Favourite radio staions to listen to in Thunder Bay,/r/ThunderBay/comments/tiv9m8/favourite_radio_staions_to_listen_to_in_thunder/i1gocyg/,3,r/ThunderBay,0,3
"I swear this has been posted before, like last week or something",t2_e6c8qbb6,northernlovely,0,1647816168.0,0,t1_i1glug7,i1glug7,True,dsf8a978978,t3_tiv6x9,https://www.reddit.com/r/ThunderBay/comments/tiv6x9/i_hate_how_much_i_like_pizza_hut/,I hate how much I like Pizza Hut,/r/ThunderBay/comments/tiv6x9/i_hate_how_much_i_like_pizza_hut/i1glug7/,3,r/ThunderBay,0,3
Their stuffed crust meat lovers is the best and I will fight anyone that says otherwise….,t2_dl49q,quebecoisejohn,0,1647816025.0,0,t1_i1gliu8,i1gliu8,True,dsf8a978978,t3_tiv6x9,https://www.reddit.com/r/ThunderBay/comments/tiv6x9/i_hate_how_much_i_like_pizza_hut/,I hate how much I like Pizza Hut,/r/ThunderBay/comments/tiv6x9/i_hate_how_much_i_like_pizza_hut/i1gliu8/,1,r/ThunderBay,0,1
"This sounds a little judgy:

people generally don't wanna be friends with shallow ass people",t2_11irra,dfgdfgadf4444,0,1647814837.0,0,t1_i1gisk1,i1gisk1,False,[deleted],t3_tijsm5,https://www.reddit.com/r/ThunderBay/comments/tijsm5/how_can_i_make_friends_at_movati_gym/,How can I make friends at Movati gym?,/r/ThunderBay/comments/tijsm5/how_can_i_make_friends_at_movati_gym/i1gisk1/,1,r/ThunderBay,0,1
It has been so nice! Just warm enough to go climbing outdoors occasionally!,t2_ngxri9h,whygonejin,0,1647813840.0,0,t1_i1gghbl,i1gghbl,True,Excellent-Steak6368,t3_tiv50c,https://www.reddit.com/r/ThunderBay/comments/tiv50c/spring_fever_2022/,Spring Fever ! 2022,/r/ThunderBay/comments/tiv50c/spring_fever_2022/i1gghbl/,3,r/ThunderBay,0,3
You might like Energy 103 104!,t2_7hlfrrg7,Decent_Penalty7763,0,1647813652.0,0,t1_i1gg15l,i1gg15l,False,Excellent-Steak6368,t3_tiv9m8,https://www.reddit.com/r/ThunderBay/comments/tiv9m8/favourite_radio_staions_to_listen_to_in_thunder/,Favourite radio staions to listen to in Thunder Bay,/r/ThunderBay/comments/tiv9m8/favourite_radio_staions_to_listen_to_in_thunder/i1gg15l/,2,r/ThunderBay,0,2
"I don’t know, I just posted the yeah or new question to see what Reddit folk thought(we are a different breed)",t2_4fn4qoj1,koosopenheimer,0,1647813293.0,0,t1_i1gf6jg,i1gf6jg,False,koosopenheimer,t3_t2tqij,https://www.reddit.com/r/ThunderBay/comments/t2tqij/bill_s233_yeah_or_nay/,Bill S-233. Yeah or nay?,/r/ThunderBay/comments/t2tqij/bill_s233_yeah_or_nay/i1gf6jg/,1,r/ThunderBay,0,1
"The LU radio station has some punk stuff I like once in a while. 

*102.7FM*

[http://www.luradio.ca](http://www.luradio.ca)",t2_dl49q,quebecoisejohn,0,1647811943.0,0,t1_i1gc09t,i1gc09t,True,Excellent-Steak6368,t3_tiv9m8,https://www.reddit.com/r/ThunderBay/comments/tiv9m8/favourite_radio_staions_to_listen_to_in_thunder/,Favourite radio staions to listen to in Thunder Bay,/r/ThunderBay/comments/tiv9m8/favourite_radio_staions_to_listen_to_in_thunder/i1gc09t/,9,r/ThunderBay,0,9
Just be yourself and enjoy the experience. Friendships will develop.,t2_ahxmzgt3,Excellent-Steak6368,0,1647810807.0,0,t1_i1g9bjl,i1g9bjl,True,[deleted],t3_tijsm5,https://www.reddit.com/r/ThunderBay/comments/tijsm5/how_can_i_make_friends_at_movati_gym/,How can I make friends at Movati gym?,/r/ThunderBay/comments/tijsm5/how_can_i_make_friends_at_movati_gym/i1g9bjl/,1,r/ThunderBay,0,1
Enjoy !,t2_ahxmzgt3,Excellent-Steak6368,0,1647810680.0,0,t1_i1g90k0,i1g90k0,True,This-_-Justin,t3_timnc1,https://www.reddit.com/r/ThunderBay/comments/timnc1/pa_prancin/,PA Prancin',/r/ThunderBay/comments/timnc1/pa_prancin/i1g90k0/,1,r/ThunderBay,0,1
