body,author_fullname,author.name,controversiality,created,downs,fullname,id,is_root,link_author,link_id,link_permalink,link_title,permalink,score,subreddit_name_prefixed,total_awards_received,ups
r/lostredditors,t2_22knskpq,zeraujc686,0,1648275603.0,0,t1_i25xp7j,i25xp7j,True,Calm-Football6412,t3_toic99,https://www.reddit.com/r/wyoming/comments/toic99/cool_looking_skeletor/,cool looking skeletor,/r/wyoming/comments/toic99/cool_looking_skeletor/i25xp7j/,3,r/wyoming,0,3
"Only thing I've heard about Rock Springs is what my great Aunt told me, and she lived there for a few years a long time ago, she says it's full of Prostitutes and Meth. Now the prostitute thing is new to me, but the meth head rumor has been pretty well known in my corner of Wyoming. 

I got zero helpful info for Rawlins or Green River. I will say driving along on the I-80 Green River is the prettiest of the three towns in my opinion.",t2_4u34kwgy,Patient_Character730,0,1648270537.0,0,t1_i25qtx6,i25qtx6,False,AutoModerator,t3_te3kk5,https://www.reddit.com/r/wyoming/comments/te3kk5/questions_about_moving_to_or_visiting_wyoming_ask/,Questions about moving to or visiting Wyoming? Ask here!,/r/wyoming/comments/te3kk5/questions_about_moving_to_or_visiting_wyoming_ask/i25qtx6/,2,r/wyoming,0,2
I was always proud of Wyoming because it didn’t usually fall for the same stupid bullshit places like Arkansas does. Pearl clutching moral panic was something we were smarter than…. Nope.,t2_c1058,Ankeneering,0,1648265040.0,0,t1_i25hjh7,i25hjh7,True,may_june_july,t3_tnmxh7,https://www.reddit.com/r/wyoming/comments/tnmxh7/some_campbell_county_residents_are_seeking_the/,Some Campbell County residents are seeking the removal of books from the public library,/r/wyoming/comments/tnmxh7/some_campbell_county_residents_are_seeking_the/i25hjh7/,4,r/wyoming,0,4
Same. I'm so ashamed this is happening here.😞,t2_8hnoe8xv,forsureprobablyno,0,1648264441.0,0,t1_i25ggfb,i25ggfb,False,may_june_july,t3_tnmxh7,https://www.reddit.com/r/wyoming/comments/tnmxh7/some_campbell_county_residents_are_seeking_the/,Some Campbell County residents are seeking the removal of books from the public library,/r/wyoming/comments/tnmxh7/some_campbell_county_residents_are_seeking_the/i25ggfb/,2,r/wyoming,0,2
"They clearly made a sign.  But seriously, this joke?  What good is literacy if you're still a dullard?",t2_1mm5emwl,mikemakesreddit,0,1648261877.0,0,t1_i25bmqj,i25bmqj,False,may_june_july,t3_tnmxh7,https://www.reddit.com/r/wyoming/comments/tnmxh7/some_campbell_county_residents_are_seeking_the/,Some Campbell County residents are seeking the removal of books from the public library,/r/wyoming/comments/tnmxh7/some_campbell_county_residents_are_seeking_the/i25bmqj/,3,r/wyoming,0,3
"You do know that not only is this illegal and unconstitutional but also unenforceable.

You can not open someone elses mail.",t2_l4rjzn87,No-Try8583,0,1648261337.0,0,t1_i25al28,i25al28,True,No-Try8583,t3_toeejq,https://www.reddit.com/r/wyoming/comments/toeejq/wyoming_senate_passes_bill_to_prohibit_use_of/,Wyoming Senate passes bill to prohibit use of abortion pill,/r/wyoming/comments/toeejq/wyoming_senate_passes_bill_to_prohibit_use_of/i25al28/,1,r/wyoming,0,1
Hello lawsuits.,t2_l4rjzn87,No-Try8583,0,1648260406.0,0,t1_i258quq,i258quq,True,No-Try8583,t3_todbx8,https://www.reddit.com/r/wyoming/comments/todbx8/wyoming_total_abortion_ban_bill_approved_with_no/,Wyoming Total Abortion Ban Bill Approved With No Rape And Incest Exemption | Cowboy State Daily,/r/wyoming/comments/todbx8/wyoming_total_abortion_ban_bill_approved_with_no/i258quq/,1,r/wyoming,0,1
"Agreed. Hell, let's nationalize the oil industry as well- Keep the oil we produce here. We don't need to line the pockets of the greedy fucks running the oil companies who are taking the opportunity to gouge us because of geopolitics. Oil workers keep their jobs, consumers pay less for gas and we don't have to do business with evil governments like Saudi Arabia. Let the c suite fucks drown their  sorrows in their Dom Perignon and Cheval Blanc.",t2_jvf15wha,_elbarbudo_,0,1648259474.0,0,t1_i256wd6,i256wd6,False,Earthviolet76,t3_tlvlbs,https://www.reddit.com/r/wyoming/comments/tlvlbs/ooh_busted_it_was_me_i_was_the_one_who_raised_the/,Ooh. Busted. It was me. I was the one who raised the gas prices. Sorry everyone.,/r/wyoming/comments/tlvlbs/ooh_busted_it_was_me_i_was_the_one_who_raised_the/i256wd6/,1,r/wyoming,0,1
I lived in Gillette about 20 years ago and used to take my lunch at the library quite often.,t2_jvf15wha,_elbarbudo_,0,1648257489.0,0,t1_i252s6g,i252s6g,False,may_june_july,t3_tnmxh7,https://www.reddit.com/r/wyoming/comments/tnmxh7/some_campbell_county_residents_are_seeking_the/,Some Campbell County residents are seeking the removal of books from the public library,/r/wyoming/comments/tnmxh7/some_campbell_county_residents_are_seeking_the/i252s6g/,3,r/wyoming,0,3
"> which in Gillette is a fantastic one

Only been there a couple of times, but I noticed that they do carry some really good stuff.",t2_xjtix,Raineythereader,0,1648255069.0,0,t1_i24xrw5,i24xrw5,False,may_june_july,t3_tnmxh7,https://www.reddit.com/r/wyoming/comments/tnmxh7/some_campbell_county_residents_are_seeking_the/,Some Campbell County residents are seeking the removal of books from the public library,/r/wyoming/comments/tnmxh7/some_campbell_county_residents_are_seeking_the/i24xrw5/,2,r/wyoming,0,2
This guy gets it 🤌,t2_44cusg9o,landencrews1028,0,1648252574.0,0,t1_i24skz5,i24skz5,False,Aedan3O68,t3_pmm5s2,https://www.reddit.com/r/wyoming/comments/pmm5s2/imo_this_should_pass_medical_legalization_is_a/,IMO this should pass. Medical legalization is a no-brainer and marijuana is still less harmful than alchohol.,/r/wyoming/comments/pmm5s2/imo_this_should_pass_medical_legalization_is_a/i24skz5/,1,r/wyoming,0,1
Not sure why no one has mentioned the crazy cowboy or vacarro loco near Afton. Crazy beautiful,t2_72gcwzyi,dinwoody623,0,1648250704.0,0,t1_i24ojrf,i24ojrf,True,DresserRotation,t3_tksxuk,https://www.reddit.com/r/wyoming/comments/tksxuk/runners_of_wyoming_what_nonmarathon_race_would/,Runners of Wyoming: what (non-marathon) race would you recommend to an out-of-stater?,/r/wyoming/comments/tksxuk/runners_of_wyoming_what_nonmarathon_race_would/i24ojrf/,1,r/wyoming,0,1
Born triple cs’er here. These dipshits are starting to make us look like idiots.,t2_72gcwzyi,dinwoody623,0,1648250240.0,0,t1_i24nj70,i24nj70,True,may_june_july,t3_tnmxh7,https://www.reddit.com/r/wyoming/comments/tnmxh7/some_campbell_county_residents_are_seeking_the/,Some Campbell County residents are seeking the removal of books from the public library,/r/wyoming/comments/tnmxh7/some_campbell_county_residents_are_seeking_the/i24nj70/,5,r/wyoming,0,5
"It's literally one family who shows up to all the library meetings and rants about ""protecting children"" by banning books. Hugh and Susan Bennett are mentioned in this article but their son, Kevin, has been the spokesperson for Mass Resistance in Campbell County in previous articles from WPR and the Star Tribune. My mom regularly attends the library meetings as a citizen who is actually engaged with the library and she has mentioned this one family, especially Kevin, ranting and raving at all of the meetings with the same arguments but always new books to be banned, especially books about LGBTQ+ issues. 

I am going to commit to donating a copy of every book Kevin Bennett tries to get banned in Campbell County to a rural public library in Wyoming in his name. There are probably dozens of us (ha) who grew up in Wyoming and didn't end up a hate-filled asshole and I want other kids in small town Wyoming to know they are ok, just as they are, and it's good for society to try to understand people who might be ""different.""",t2_12bi5y,elizabethreba,0,1648246895.0,0,t1_i24g2gm,i24g2gm,True,may_june_july,t3_tnmxh7,https://www.reddit.com/r/wyoming/comments/tnmxh7/some_campbell_county_residents_are_seeking_the/,Some Campbell County residents are seeking the removal of books from the public library,/r/wyoming/comments/tnmxh7/some_campbell_county_residents_are_seeking_the/i24g2gm/,16,r/wyoming,0,16
"Mass resistance is classified as a hate group. I don't give a damn what their representative says, they should be ignored and shunned.

https://www.splcenter.org/hate-map?state=WY",t2_aqam9du,reelbigchaos,0,1648245480.0,0,t1_i24cuus,i24cuus,True,may_june_july,t3_tnmxh7,https://www.reddit.com/r/wyoming/comments/tnmxh7/some_campbell_county_residents_are_seeking_the/,Some Campbell County residents are seeking the removal of books from the public library,/r/wyoming/comments/tnmxh7/some_campbell_county_residents_are_seeking_the/i24cuus/,11,r/wyoming,0,11
"I mean, the more honest question is if they can read.....",t2_itk7l,WyoPeeps,0,1648244274.0,0,t1_i24a3dm,i24a3dm,False,may_june_july,t3_tnmxh7,https://www.reddit.com/r/wyoming/comments/tnmxh7/some_campbell_county_residents_are_seeking_the/,Some Campbell County residents are seeking the removal of books from the public library,/r/wyoming/comments/tnmxh7/some_campbell_county_residents_are_seeking_the/i24a3dm/,5,r/wyoming,0,5
"What’s most frustrating is the morons who want to ban books, are the same morons who haven’t read a book since they were forced to in high school. Oh and they constantly scream “child pornography” to get other idiots to join their bs movement.",t2_13yzuq,0d0acer,0,1648242919.0,0,t1_i246wrq,i246wrq,True,may_june_july,t3_tnmxh7,https://www.reddit.com/r/wyoming/comments/tnmxh7/some_campbell_county_residents_are_seeking_the/,Some Campbell County residents are seeking the removal of books from the public library,/r/wyoming/comments/tnmxh7/some_campbell_county_residents_are_seeking_the/i246wrq/,10,r/wyoming,0,10
"They aren't worried about _them_ reading the book, they're worried that _someone else_ might read the book...and we can't have that!",t2_3565s,Buelldozer,0,1648242210.0,0,t1_i2458fg,i2458fg,False,may_june_july,t3_tnmxh7,https://www.reddit.com/r/wyoming/comments/tnmxh7/some_campbell_county_residents_are_seeking_the/,Some Campbell County residents are seeking the removal of books from the public library,/r/wyoming/comments/tnmxh7/some_campbell_county_residents_are_seeking_the/i2458fg/,5,r/wyoming,0,5
"For being the equality state, we sure suck at treating different people as equals.    


All these parents freaking out about a book should probably look at the web history for their kids and compare it to their own.",t2_1qk3xlrt,307runner,0,1648237929.0,0,t1_i23uqmb,i23uqmb,True,may_june_july,t3_tnmxh7,https://www.reddit.com/r/wyoming/comments/tnmxh7/some_campbell_county_residents_are_seeking_the/,Some Campbell County residents are seeking the removal of books from the public library,/r/wyoming/comments/tnmxh7/some_campbell_county_residents_are_seeking_the/i23uqmb/,6,r/wyoming,0,6
"Whatever happened to ""freedom""? The real issue here is that so many parents drop their children off at the library and use it as a de-facto babysitter. If you don't want your children to read certain books, then it is your responsibility as a parent and as an adult to stay with them and monitor their selections. The library is not a babysitter nor it is a parent.",t2_8rsdr4mp,Careless_Science5426,0,1648237581.0,0,t1_i23tvaz,i23tvaz,True,may_june_july,t3_tnmxh7,https://www.reddit.com/r/wyoming/comments/tnmxh7/some_campbell_county_residents_are_seeking_the/,Some Campbell County residents are seeking the removal of books from the public library,/r/wyoming/comments/tnmxh7/some_campbell_county_residents_are_seeking_the/i23tvaz/,7,r/wyoming,0,7
So much this. Here. Take my free award!!,t2_2u0t8404,Earthviolet76,0,1648236234.0,0,t1_i23ql1n,i23ql1n,False,Earthviolet76,t3_tlvlbs,https://www.reddit.com/r/wyoming/comments/tlvlbs/ooh_busted_it_was_me_i_was_the_one_who_raised_the/,Ooh. Busted. It was me. I was the one who raised the gas prices. Sorry everyone.,/r/wyoming/comments/tlvlbs/ooh_busted_it_was_me_i_was_the_one_who_raised_the/i23ql1n/,1,r/wyoming,0,1
"This is my conservative family in a nutshell. They talk a good game about freedom but bring up marriage equality or smoking weed or people having the freedom to kneel during the anthem and they lose their shit. ""Well not THAT kind of freedom"" is usually what they say.",t2_ebkkogr,TriscuitBob,0,1648234846.0,0,t1_i23n7mh,i23n7mh,False,may_june_july,t3_tnmxh7,https://www.reddit.com/r/wyoming/comments/tnmxh7/some_campbell_county_residents_are_seeking_the/,Some Campbell County residents are seeking the removal of books from the public library,/r/wyoming/comments/tnmxh7/some_campbell_county_residents_are_seeking_the/i23n7mh/,16,r/wyoming,0,16
That’s good. Sounds like repairs needed to be made.,t2_3t556ma4,Perle1234,0,1648234621.0,0,t1_i23mntv,i23mntv,True,may_june_july,t3_tnmyci,https://www.reddit.com/r/wyoming/comments/tnmyci/northern_arapaho_tribe_renovates_halls_that/,Northern Arapaho tribe renovates halls that double as emergency and community centers,/r/wyoming/comments/tnmyci/northern_arapaho_tribe_renovates_halls_that/i23mntv/,1,r/wyoming,0,1
"you can't see ozone pollution.
But clearly you don't look very hard, there a tons of industrial sites around Wyoming that are polluted.  There are old dump sites, settlement ponds, etc.  There are subdivisions that had to be abandoned because of ground water pollution or toxic gases.  People in Pavillion were lighting their water on fire not too many years ago.  I guess these don't exist to you?",t2_wquc7,K0rby,0,1648233061.0,0,t1_i23iqad,i23iqad,False,NohaNimm,t3_tn30gr,https://www.reddit.com/r/wyoming/comments/tn30gr/best_places_to_move_in_wy/,Best places to move in Wy,/r/wyoming/comments/tn30gr/best_places_to_move_in_wy/i23iqad/,0,r/wyoming,0,0
Believe what you want but those of us who can see clearly know the truth,t2_8v3oynlk,mpayne82941,0,1648232858.0,0,t1_i23i7s0,i23i7s0,False,NohaNimm,t3_tn30gr,https://www.reddit.com/r/wyoming/comments/tn30gr/best_places_to_move_in_wy/,Best places to move in Wy,/r/wyoming/comments/tn30gr/best_places_to_move_in_wy/i23i7s0/,1,r/wyoming,0,1
Yeah why use actual facts?,t2_wquc7,K0rby,0,1648232587.0,0,t1_i23hjey,i23hjey,False,NohaNimm,t3_tn30gr,https://www.reddit.com/r/wyoming/comments/tn30gr/best_places_to_move_in_wy/,Best places to move in Wy,/r/wyoming/comments/tn30gr/best_places_to_move_in_wy/i23hjey/,0,r/wyoming,0,0
Really no surprise there.  Wyoming is always about 50 years or so behind the rest of the nation.,t2_a9m3qdy1,tstramathorn,1,1648232518.0,0,t1_i23hd9y,i23hd9y,True,may_june_july,t3_tnmue2,https://www.reddit.com/r/wyoming/comments/tnmue2/wyoming_voters_supportive_of_oil_and_gas/,"Wyoming voters supportive of oil and gas development, industry poll says",/r/wyoming/comments/tnmue2/wyoming_voters_supportive_of_oil_and_gas/i23hd9y/,2,r/wyoming,0,2
Have you been to Denver? All you have to do is open your eyes. I don’t give two fucks what a bs report says,t2_8v3oynlk,mpayne82941,0,1648232307.0,0,t1_i23gtou,i23gtou,False,NohaNimm,t3_tn30gr,https://www.reddit.com/r/wyoming/comments/tn30gr/best_places_to_move_in_wy/,Best places to move in Wy,/r/wyoming/comments/tn30gr/best_places_to_move_in_wy/i23gtou/,1,r/wyoming,0,1
"https://gispub.epa.gov/airnow/?monitors=ozonepm&xmin=-12481478.549268955&xmax=-11469452.294773271&ymin=5191932.385336138&ymax=5659726.998441394

As I post this now, air quality in the following locations are worse than any readings in metro Denver: Cheyenne, Laramie, Centennial, Wamsutter, Rock Springs, Lander, Riverton, Casper, Newcastle and Basin.  And those are just the towns.  There are rural locations in Campbell, Sublette and Converse counties that have air quality readings higher as well.",t2_wquc7,K0rby,0,1648232243.0,0,t1_i23gnso,i23gnso,False,NohaNimm,t3_tn30gr,https://www.reddit.com/r/wyoming/comments/tn30gr/best_places_to_move_in_wy/,Best places to move in Wy,/r/wyoming/comments/tn30gr/best_places_to_move_in_wy/i23gnso/,0,r/wyoming,0,0
"Disappointing? For sure.

Surprising? Hardly.",t2_5opmtz98,BongRipLarry,0,1648231904.0,0,t1_i23ftl0,i23ftl0,True,may_june_july,t3_tnmxh7,https://www.reddit.com/r/wyoming/comments/tnmxh7/some_campbell_county_residents_are_seeking_the/,Some Campbell County residents are seeking the removal of books from the public library,/r/wyoming/comments/tnmxh7/some_campbell_county_residents_are_seeking_the/i23ftl0/,9,r/wyoming,0,9
You know they don’t even read those books 😂,t2_22knskpq,zeraujc686,0,1648231160.0,0,t1_i23dy8y,i23dy8y,False,may_june_july,t3_tnmxh7,https://www.reddit.com/r/wyoming/comments/tnmxh7/some_campbell_county_residents_are_seeking_the/,Some Campbell County residents are seeking the removal of books from the public library,/r/wyoming/comments/tnmxh7/some_campbell_county_residents_are_seeking_the/i23dy8y/,7,r/wyoming,0,7
I’m surprised he stopped blowing Mitch McConnell long enough to put this together.,t2_633bxfn7,superbee2020,0,1648226054.0,0,t1_i230s9p,i230s9p,True,Earthviolet76,t3_tlvlbs,https://www.reddit.com/r/wyoming/comments/tlvlbs/ooh_busted_it_was_me_i_was_the_one_who_raised_the/,Ooh. Busted. It was me. I was the one who raised the gas prices. Sorry everyone.,/r/wyoming/comments/tlvlbs/ooh_busted_it_was_me_i_was_the_one_who_raised_the/i230s9p/,2,r/wyoming,1,2
It's all about how you crunch the numbers lol,t2_2987do5m,thelma_edith,0,1648224635.0,0,t1_i22x2un,i22x2un,True,may_june_july,t3_tnmt2i,https://www.reddit.com/r/wyoming/comments/tnmt2i/population_growth_in_wyoming_outpaces_national/,Population growth in Wyoming outpaces national average,/r/wyoming/comments/tnmt2i/population_growth_in_wyoming_outpaces_national/i22x2un/,6,r/wyoming,0,6
"Out of their heads! If you destroy the book, you don’t destroy the idea or thought. Mind your own business! 
“Timmy, wish it away to the cornfield! “ Real Twilight Zone stuff out of Wyoming. What a shame.",t2_a33s04et,1CFII2,0,1648224589.0,0,t1_i22wymy,i22wymy,True,may_june_july,t3_tnmxh7,https://www.reddit.com/r/wyoming/comments/tnmxh7/some_campbell_county_residents_are_seeking_the/,Some Campbell County residents are seeking the removal of books from the public library,/r/wyoming/comments/tnmxh7/some_campbell_county_residents_are_seeking_the/i22wymy/,7,r/wyoming,0,7
Again? I thought a judge told them to knock it off the last time they pulled this shit.,t2_121xu6,Comments_Wyoming,0,1648224513.0,0,t1_i22wrlh,i22wrlh,True,may_june_july,t3_tnmxh7,https://www.reddit.com/r/wyoming/comments/tnmxh7/some_campbell_county_residents_are_seeking_the/,Some Campbell County residents are seeking the removal of books from the public library,/r/wyoming/comments/tnmxh7/some_campbell_county_residents_are_seeking_the/i22wrlh/,10,r/wyoming,0,10
"That would be a violation of our professional code of ethics, which we take very seriously.  A librarian would simply never do that.  

Really, the best thing to do in this instance is to compliment the parents on being concerned about their children's welfare, and to start a discussion about the internet and television.",t2_5vvdysle,CrepuscularCrone,0,1648222153.0,0,t1_i22qp4p,i22qp4p,False,may_june_july,t3_tnmxh7,https://www.reddit.com/r/wyoming/comments/tnmxh7/some_campbell_county_residents_are_seeking_the/,Some Campbell County residents are seeking the removal of books from the public library,/r/wyoming/comments/tnmxh7/some_campbell_county_residents_are_seeking_the/i22qp4p/,11,r/wyoming,0,11
"I doubt that it's legal, because of privacy laws, but librarians should pull patron histories of all the meatheads advocating for this, and publicly shame them for not even using the library... and point out that maybe they should use the library before they start regulating it.",t2_47h8j,zombarista,0,1648221254.0,0,t1_i22of5m,i22of5m,True,may_june_july,t3_tnmxh7,https://www.reddit.com/r/wyoming/comments/tnmxh7/some_campbell_county_residents_are_seeking_the/,Some Campbell County residents are seeking the removal of books from the public library,/r/wyoming/comments/tnmxh7/some_campbell_county_residents_are_seeking_the/i22of5m/,12,r/wyoming,0,12
"The people always bitching about cancel culture and free speech, small government and freedom are trying to ban books at the library.

Troglodytes who probably hadn't set foot in the library (which in Gillette is a fantastic one) before last year shouldn't get to decide what books are suitable",t2_jvf15wha,_elbarbudo_,0,1648219528.0,0,t1_i22k4b0,i22k4b0,True,may_june_july,t3_tnmxh7,https://www.reddit.com/r/wyoming/comments/tnmxh7/some_campbell_county_residents_are_seeking_the/,Some Campbell County residents are seeking the removal of books from the public library,/r/wyoming/comments/tnmxh7/some_campbell_county_residents_are_seeking_the/i22k4b0/,47,r/wyoming,0,47
"Let's be real here. They probably already don't read any books, let alone the ones in question",t2_702rzbh,Dradiation,0,1648218467.0,0,t1_i22hiki,i22hiki,False,may_june_july,t3_tnmxh7,https://www.reddit.com/r/wyoming/comments/tnmxh7/some_campbell_county_residents_are_seeking_the/,Some Campbell County residents are seeking the removal of books from the public library,/r/wyoming/comments/tnmxh7/some_campbell_county_residents_are_seeking_the/i22hiki/,42,r/wyoming,0,42
😑 I was talking about a lawsuit California filed against wyoming for our water. I thought that was pretty obvious but apparently no one educates themselves anymore,t2_g5vdlc1z,rosewiththornzzz,0,1648218398.0,0,t1_i22hci0,i22hci0,False,may_june_july,t3_tmdm4i,https://www.reddit.com/r/wyoming/comments/tmdm4i/new_law_protects_groundwater_rights_in_the_wake/,New law protects groundwater rights in the wake of Ogallala fight - WyoFile,/r/wyoming/comments/tmdm4i/new_law_protects_groundwater_rights_in_the_wake/i22hci0/,1,r/wyoming,0,1
This law applies to private parties within the state of Wyoming. It won't have any impact on conflicts between states.,t2_zek68,may_june_july,0,1648218141.0,0,t1_i22gqbu,i22gqbu,False,may_june_july,t3_tmdm4i,https://www.reddit.com/r/wyoming/comments/tmdm4i/new_law_protects_groundwater_rights_in_the_wake/,New law protects groundwater rights in the wake of Ogallala fight - WyoFile,/r/wyoming/comments/tmdm4i/new_law_protects_groundwater_rights_in_the_wake/i22gqbu/,1,r/wyoming,0,1
"Again with these people?  If you don’t want to read a book in the library, don’t!  Nobody is making you check out that book. I doubt half of these people could locate these books in the library, or even the library itself.",t2_4goeppgd,wyo8889,0,1648218054.0,0,t1_i22gisd,i22gisd,True,may_june_july,t3_tnmxh7,https://www.reddit.com/r/wyoming/comments/tnmxh7/some_campbell_county_residents_are_seeking_the/,Some Campbell County residents are seeking the removal of books from the public library,/r/wyoming/comments/tnmxh7/some_campbell_county_residents_are_seeking_the/i22gisd/,61,r/wyoming,0,61
They are updating their plan in response to declining Covid rates.,t2_zek68,may_june_july,0,1648218041.0,0,t1_i22ghml,i22ghml,False,may_june_july,t3_tkvfa3,https://www.reddit.com/r/wyoming/comments/tkvfa3/wyoming_department_of_corrections_introduces/,Wyoming Department of Corrections Introduces Pandemic Response Plan,/r/wyoming/comments/tkvfa3/wyoming_department_of_corrections_introduces/i22ghml/,2,r/wyoming,0,2
"That's *sort of* true, but that's already how water rights work in Wyoming. Senior water rights holders get precedence. If there's not enough water to go around, the most recent water permits get shut off first. So if there's not enough water to go around, you already don't get a right to use the water under your land.

This law mostly just clarifies the standard that should be used when there's a dispute over a new well. It could potentially prove to be pretty onerous to new water users, because they have to prove a negative. It's easier to prove that there will be harm from a new well then to prove that there definitely won't. So the state engineer will have to figure out some sort of reasonable standard.

It's important to note also that these rules are for agricultural and industrial water uses. Residential water always gets priority. I don't think residential wells require a permit either because they are such low capacity.",t2_zek68,may_june_july,0,1648217390.0,0,t1_i22exw0,i22exw0,False,may_june_july,t3_tmdm4i,https://www.reddit.com/r/wyoming/comments/tmdm4i/new_law_protects_groundwater_rights_in_the_wake/,New law protects groundwater rights in the wake of Ogallala fight - WyoFile,/r/wyoming/comments/tmdm4i/new_law_protects_groundwater_rights_in_the_wake/i22exw0/,1,r/wyoming,0,1
❤️,t2_eef3sabo,GilletteEd,0,1648216508.0,0,t1_i22cwcf,i22cwcf,False,thelma_edith,t3_tlnc53,https://www.reddit.com/r/wyoming/comments/tlnc53/casper_estimated_to_see_1000_competitors_for_this/,"Casper estimated to see 1,000 competitors for this week's Wyoming State 8-Ball Pool Tournament",/r/wyoming/comments/tlnc53/casper_estimated_to_see_1000_competitors_for_this/i22cwcf/,1,r/wyoming,0,1
"I guess in that [secret meeting](https://abcnews.go.com/Politics/summit-secret-happened-helsinki-putin-trump/story?id=78273344) Putin must have told him how he poisons all his political rivals.   Not actually legal in the US, so this is the closest thing.",t2_cydwa,genericdude999,0,1648212810.0,0,t1_i22514j,i22514j,True,3rdIQ,t3_tmfb3b,https://www.reddit.com/r/wyoming/comments/tmfb3b/more_than_100_house_republicans_to_cohost/,More than 100 House Republicans to cohost fundraiser for Cheney challenger,/r/wyoming/comments/tmfb3b/more_than_100_house_republicans_to_cohost/i22514j/,2,r/wyoming,0,2
"Lol it is a joke, go to any populated city and it’s noticeably polluted. There’s nowhere in the state of Wyoming that has smog or pollution. The air is fresh and clean everywhere",t2_8v3oynlk,mpayne82941,0,1648211708.0,0,t1_i222wrz,i222wrz,False,NohaNimm,t3_tn30gr,https://www.reddit.com/r/wyoming/comments/tn30gr/best_places_to_move_in_wy/,Best places to move in Wy,/r/wyoming/comments/tn30gr/best_places_to_move_in_wy/i222wrz/,1,r/wyoming,0,1
