body,author_fullname,author.name,controversiality,created,downs,fullname,id,is_root,link_author,link_id,link_permalink,link_title,permalink,score,subreddit_name_prefixed,total_awards_received,ups
Half the time the notary can’t do their part right and the thing (whatever it is) has to be notarized again. Drives me crazy.,t2_7e2q1f4w,iamthatis4536,0,1647907855.0,0,t1_i1llj6b,i1llj6b,True,greynolds17,t3_tjk2k3,https://www.reddit.com/r/wyoming/comments/tjk2k3/why_does_wyoming_require_everything_to_be/,why does Wyoming require everything to be notarized?,/r/wyoming/comments/tjk2k3/why_does_wyoming_require_everything_to_be/i1llj6b/,2,r/wyoming,0,2
Say hi to yours for me.,t2_xjtix,Raineythereader,0,1647907618.0,0,t1_i1ll030,i1ll030,False,Top_Driver_8679,t3_tjnxo6,https://www.reddit.com/r/wyoming/comments/tjnxo6/looks_like_wyoming_cant_handle_the_truth/,Looks like Wyoming can't handle the truth,/r/wyoming/comments/tjnxo6/looks_like_wyoming_cant_handle_the_truth/i1ll030/,3,r/wyoming,0,3
"What are you talking about dude? Where was I suppose to go?!? I coudn’t just “move along” They were blocking my vehicle and in the middle of the road blocking all of the other cars as well. 

Like I said I could have stood there doing nothing, I could have walked past them to get to my car (dangerous), or I could have stood there and took a picture. I choose to take the picture. What would you have done??",t2_4kvngq24,BRGNBeast,1,1647907552.0,0,t1_i1lkuvl,i1lkuvl,False,BRGNBeast,t3_tjh0nf,https://www.reddit.com/r/wyoming/comments/tjh0nf/got_real_close_to_some_big_horn_sheep_and/,Got real close to some big horn sheep and captured this guy jumping over a stream in Jackson.,/r/wyoming/comments/tjh0nf/got_real_close_to_some_big_horn_sheep_and/i1lkuvl/,3,r/wyoming,0,3
"I’ve seen these situations and it’s disappointing to see human group think work like that. Just because they came to you and there were other people there doesn’t make it ok. Move along, let them live, and maybe don’t brag about how close you got to wildlife.",t2_116dyppi,RemembertheABCs,0,1647907244.0,0,t1_i1lk5yr,i1lk5yr,False,BRGNBeast,t3_tjh0nf,https://www.reddit.com/r/wyoming/comments/tjh0nf/got_real_close_to_some_big_horn_sheep_and/,Got real close to some big horn sheep and captured this guy jumping over a stream in Jackson.,/r/wyoming/comments/tjh0nf/got_real_close_to_some_big_horn_sheep_and/i1lk5yr/,4,r/wyoming,0,4
Thank you!,t2_4kvngq24,BRGNBeast,0,1647906605.0,0,t1_i1liqkh,i1liqkh,False,BRGNBeast,t3_tjh0nf,https://www.reddit.com/r/wyoming/comments/tjh0nf/got_real_close_to_some_big_horn_sheep_and/,Got real close to some big horn sheep and captured this guy jumping over a stream in Jackson.,/r/wyoming/comments/tjh0nf/got_real_close_to_some_big_horn_sheep_and/i1liqkh/,-2,r/wyoming,0,-2
Absolutely phenomenal shot!,t2_oksdo,_Triangulum,0,1647906521.0,0,t1_i1lijp4,i1lijp4,True,BRGNBeast,t3_tjh0nf,https://www.reddit.com/r/wyoming/comments/tjh0nf/got_real_close_to_some_big_horn_sheep_and/,Got real close to some big horn sheep and captured this guy jumping over a stream in Jackson.,/r/wyoming/comments/tjh0nf/got_real_close_to_some_big_horn_sheep_and/i1lijp4/,3,r/wyoming,0,3
"WY has about 8% or so of CO's population. Then you have just a couple of people working in any given county's clerk department, that tends to make it more likely to launder a stolen car as opposed to large economies which can put way more resources into prevention. I remember back in the day rural Alabama was a favorite out east to retitle stolen boats, so they may put more scrutiny into legal transactions now. 

WY is cheap but be prepared for things to be less efficient than CO's, road treatment is minimal in the winter, and so on. One of the prices you pay to not have state income taxes.",t2_gi2ef,cavscout43,0,1647904327.0,0,t1_i1ldip9,i1ldip9,True,greynolds17,t3_tjk2k3,https://www.reddit.com/r/wyoming/comments/tjk2k3/why_does_wyoming_require_everything_to_be/,why does Wyoming require everything to be notarized?,/r/wyoming/comments/tjk2k3/why_does_wyoming_require_everything_to_be/i1ldip9/,5,r/wyoming,0,5
"I mean if we’ve learned one thing the last 6 years is that anyone, literally anyone can be a politician.",t2_5l6nj5l5,Immediate_Thought656,0,1647904195.0,0,t1_i1ld7ph,i1ld7ph,True,may_june_july,t3_tjexj5,https://www.reddit.com/r/wyoming/comments/tjexj5/a_man_once_dubbed_the_drugs_wizard_is_now_running/,A man once dubbed the 'Drugs Wizard' is now running for U.S. House in Wyoming,/r/wyoming/comments/tjexj5/a_man_once_dubbed_the_drugs_wizard_is_now_running/i1ld7ph/,7,r/wyoming,0,7
The costs are the same between the two states. Same fuel tax on gasoline (maybe a small variance for diesel).,t2_gi2ef,cavscout43,0,1647904175.0,0,t1_i1ld63f,i1ld63f,False,greynolds17,t3_tjk2k3,https://www.reddit.com/r/wyoming/comments/tjk2k3/why_does_wyoming_require_everything_to_be/,why does Wyoming require everything to be notarized?,/r/wyoming/comments/tjk2k3/why_does_wyoming_require_everything_to_be/i1ld63f/,3,r/wyoming,0,3
Ask for Idahoans over Wyomingites at your own risk.,t2_5l6nj5l5,Immediate_Thought656,0,1647903982.0,0,t1_i1lcq97,i1lcq97,False,Top_Driver_8679,t3_tjnxo6,https://www.reddit.com/r/wyoming/comments/tjnxo6/looks_like_wyoming_cant_handle_the_truth/,Looks like Wyoming can't handle the truth,/r/wyoming/comments/tjnxo6/looks_like_wyoming_cant_handle_the_truth/i1lcq97/,2,r/wyoming,0,2
Sounds like somebody is butt hurt...tell us how you really feel...please o please,t2_a0fjxyku,Consistent-Ebb-2182,0,1647903707.0,0,t1_i1lc3id,i1lc3id,True,Top_Driver_8679,t3_tjnxo6,https://www.reddit.com/r/wyoming/comments/tjnxo6/looks_like_wyoming_cant_handle_the_truth/,Looks like Wyoming can't handle the truth,/r/wyoming/comments/tjnxo6/looks_like_wyoming_cant_handle_the_truth/i1lc3id/,10,r/wyoming,0,10
"Hey so fun feature of Reddit, anyone can look at your profile and see your post and comment history.  I don't usually bother, but your previous post made me curious, so I checked yours out.

After seeing some of the subs you commented in and your comments, (I didn't need to see the post to get this gist) it doesn't really surprise me that you aren't fitting in among the locals of a very small and I'm guessing religious and conservative town.  

Especially in the ag industry, people tend to be a little old fashioned.  This is magnified in tiny towns like Lusk where everyone knows everyone else and thier business and proclivities.  Sometimes there is more to fitting in than who you voted for, or what party you belong to.  

I was just going to DM you this, because I didn't want to seem like I was trying to embarass you or anything.  But then your responses to everyone's comments and this second post pissed me off.",t2_16fp09,kingfisher_42,0,1647903639.0,0,t1_i1lbxpx,i1lbxpx,True,Top_Driver_8679,t3_tjnxo6,https://www.reddit.com/r/wyoming/comments/tjnxo6/looks_like_wyoming_cant_handle_the_truth/,Looks like Wyoming can't handle the truth,/r/wyoming/comments/tjnxo6/looks_like_wyoming_cant_handle_the_truth/i1lbxpx/,19,r/wyoming,0,19
Takes one to know one... you repetitious fuk...I bet your next witty comment will be....wait for it.....fuck off.  Amiright!!!!!!,t2_a0fjxyku,Consistent-Ebb-2182,0,1647903634.0,0,t1_i1lbxam,i1lbxam,False,Top_Driver_8679,t3_tjnxo6,https://www.reddit.com/r/wyoming/comments/tjnxo6/looks_like_wyoming_cant_handle_the_truth/,Looks like Wyoming can't handle the truth,/r/wyoming/comments/tjnxo6/looks_like_wyoming_cant_handle_the_truth/i1lbxam/,12,r/wyoming,0,12
"Nobody fucked me up. It just feels wonderful to say fuck you to the most self-righteous assholes on the planet.


Ps, yall snobby pieces of shit stay in Wyoming. We don't need yall fucking up our states after California overruns this dump.",t2_h87z3ues,Top_Driver_8679,0,1647903367.0,0,t1_i1lbave,i1lbave,False,Top_Driver_8679,t3_tjnxo6,https://www.reddit.com/r/wyoming/comments/tjnxo6/looks_like_wyoming_cant_handle_the_truth/,Looks like Wyoming can't handle the truth,/r/wyoming/comments/tjnxo6/looks_like_wyoming_cant_handle_the_truth/i1lbave/,-1,r/wyoming,0,-1
"Dear God, please burn Wyoming to the FUCKING GROUND this summer, amen.",t2_h87z3ues,Top_Driver_8679,0,1647903253.0,0,t1_i1lb1c7,i1lb1c7,True,Top_Driver_8679,t3_tjnxo6,https://www.reddit.com/r/wyoming/comments/tjnxo6/looks_like_wyoming_cant_handle_the_truth/,Looks like Wyoming can't handle the truth,/r/wyoming/comments/tjnxo6/looks_like_wyoming_cant_handle_the_truth/i1lb1c7/,-6,r/wyoming,0,-6
LOL.,t2_327qf2ui,ckimmerle,0,1647903170.0,0,t1_i1laufr,i1laufr,False,greynolds17,t3_tjk2k3,https://www.reddit.com/r/wyoming/comments/tjk2k3/why_does_wyoming_require_everything_to_be/,why does Wyoming require everything to be notarized?,/r/wyoming/comments/tjk2k3/why_does_wyoming_require_everything_to_be/i1laufr/,1,r/wyoming,0,1
Lmfao. The mod done fucked you up.,t2_5l6nj5l5,Immediate_Thought656,0,1647903162.0,0,t1_i1latsa,i1latsa,False,Top_Driver_8679,t3_tjnxo6,https://www.reddit.com/r/wyoming/comments/tjnxo6/looks_like_wyoming_cant_handle_the_truth/,Looks like Wyoming can't handle the truth,/r/wyoming/comments/tjnxo6/looks_like_wyoming_cant_handle_the_truth/i1latsa/,9,r/wyoming,0,9
How bout the meth problem here in this shithole? Does that fuel the sex crimes?,t2_h87z3ues,Top_Driver_8679,0,1647903000.0,0,t1_i1lag7e,i1lag7e,True,Top_Driver_8679,t3_tjnxo6,https://www.reddit.com/r/wyoming/comments/tjnxo6/looks_like_wyoming_cant_handle_the_truth/,Looks like Wyoming can't handle the truth,/r/wyoming/comments/tjnxo6/looks_like_wyoming_cant_handle_the_truth/i1lag7e/,-4,r/wyoming,0,-4
They're a one way fucked up assbackward state. Bunch of child molesting meth users.,t2_h87z3ues,Top_Driver_8679,1,1647902903.0,0,t1_i1la824,i1la824,False,Top_Driver_8679,t3_tjnxo6,https://www.reddit.com/r/wyoming/comments/tjnxo6/looks_like_wyoming_cant_handle_the_truth/,Looks like Wyoming can't handle the truth,/r/wyoming/comments/tjnxo6/looks_like_wyoming_cant_handle_the_truth/i1la824/,0,r/wyoming,0,0
How come you motherfuckers haven't locked this? Do I need to bring up all the child molestation yall commit up here?,t2_h87z3ues,Top_Driver_8679,0,1647902823.0,0,t1_i1la1cd,i1la1cd,True,Top_Driver_8679,t3_tjnxo6,https://www.reddit.com/r/wyoming/comments/tjnxo6/looks_like_wyoming_cant_handle_the_truth/,Looks like Wyoming can't handle the truth,/r/wyoming/comments/tjnxo6/looks_like_wyoming_cant_handle_the_truth/i1la1cd/,-5,r/wyoming,0,-5
Just wait till they try to tell you it’s a Libertarian state.,t2_5l6nj5l5,Immediate_Thought656,0,1647902806.0,0,t1_i1l9zvj,i1l9zvj,False,Top_Driver_8679,t3_tjnxo6,https://www.reddit.com/r/wyoming/comments/tjnxo6/looks_like_wyoming_cant_handle_the_truth/,Looks like Wyoming can't handle the truth,/r/wyoming/comments/tjnxo6/looks_like_wyoming_cant_handle_the_truth/i1l9zvj/,-2,r/wyoming,0,-2
"Don’t have one, sorry",t2_eubcajky,countrylivin10,0,1647902672.0,0,t1_i1l9on0,i1l9on0,False,Top_Driver_8679,t3_tjnxo6,https://www.reddit.com/r/wyoming/comments/tjnxo6/looks_like_wyoming_cant_handle_the_truth/,Looks like Wyoming can't handle the truth,/r/wyoming/comments/tjnxo6/looks_like_wyoming_cant_handle_the_truth/i1l9on0/,6,r/wyoming,0,6
🤣,t2_39356h3y,PigFarmer1,0,1647902662.0,0,t1_i1l9nt8,i1l9nt8,False,Top_Driver_8679,t3_tjnxo6,https://www.reddit.com/r/wyoming/comments/tjnxo6/looks_like_wyoming_cant_handle_the_truth/,Looks like Wyoming can't handle the truth,/r/wyoming/comments/tjnxo6/looks_like_wyoming_cant_handle_the_truth/i1l9nt8/,5,r/wyoming,0,5
Poke your sister.,t2_h87z3ues,Top_Driver_8679,0,1647902583.0,0,t1_i1l9gyd,i1l9gyd,False,Top_Driver_8679,t3_tjnxo6,https://www.reddit.com/r/wyoming/comments/tjnxo6/looks_like_wyoming_cant_handle_the_truth/,Looks like Wyoming can't handle the truth,/r/wyoming/comments/tjnxo6/looks_like_wyoming_cant_handle_the_truth/i1l9gyd/,-3,r/wyoming,0,-3
Fuck off.,t2_h87z3ues,Top_Driver_8679,0,1647902566.0,0,t1_i1l9fie,i1l9fie,False,Top_Driver_8679,t3_tjnxo6,https://www.reddit.com/r/wyoming/comments/tjnxo6/looks_like_wyoming_cant_handle_the_truth/,Looks like Wyoming can't handle the truth,/r/wyoming/comments/tjnxo6/looks_like_wyoming_cant_handle_the_truth/i1l9fie/,-8,r/wyoming,0,-8
Good luck wherever you end up.  You're going to need it.  🤪,t2_39356h3y,PigFarmer1,0,1647902458.0,0,t1_i1l96g6,i1l96g6,True,Top_Driver_8679,t3_tjnxo6,https://www.reddit.com/r/wyoming/comments/tjnxo6/looks_like_wyoming_cant_handle_the_truth/,Looks like Wyoming can't handle the truth,/r/wyoming/comments/tjnxo6/looks_like_wyoming_cant_handle_the_truth/i1l96g6/,11,r/wyoming,0,11
Go Pokes,t2_eubcajky,countrylivin10,0,1647902454.0,0,t1_i1l964w,i1l964w,True,Top_Driver_8679,t3_tjnxo6,https://www.reddit.com/r/wyoming/comments/tjnxo6/looks_like_wyoming_cant_handle_the_truth/,Looks like Wyoming can't handle the truth,/r/wyoming/comments/tjnxo6/looks_like_wyoming_cant_handle_the_truth/i1l964w/,10,r/wyoming,0,10
You can have this shithole.,t2_h87z3ues,Top_Driver_8679,0,1647902422.0,0,t1_i1l93g3,i1l93g3,False,Top_Driver_8679,t3_tjnxo6,https://www.reddit.com/r/wyoming/comments/tjnxo6/looks_like_wyoming_cant_handle_the_truth/,Looks like Wyoming can't handle the truth,/r/wyoming/comments/tjnxo6/looks_like_wyoming_cant_handle_the_truth/i1l93g3/,-3,r/wyoming,0,-3
Couldn’t agree more! This place is a dumpster fire (literally from June to Sept every summer) but the fishing is good and no state income tax…I think I’ll stay.,t2_5l6nj5l5,Immediate_Thought656,0,1647902383.0,0,t1_i1l8zx1,i1l8zx1,True,Top_Driver_8679,t3_tjnxo6,https://www.reddit.com/r/wyoming/comments/tjnxo6/looks_like_wyoming_cant_handle_the_truth/,Looks like Wyoming can't handle the truth,/r/wyoming/comments/tjnxo6/looks_like_wyoming_cant_handle_the_truth/i1l8zx1/,8,r/wyoming,0,8
Self-awareness apparently isn't your strong suit.,t2_7uyw8et8,SquishyPotato117,0,1647902030.0,0,t1_i1l85dh,i1l85dh,True,Top_Driver_8679,t3_tjnxo6,https://www.reddit.com/r/wyoming/comments/tjnxo6/looks_like_wyoming_cant_handle_the_truth/,Looks like Wyoming can't handle the truth,/r/wyoming/comments/tjnxo6/looks_like_wyoming_cant_handle_the_truth/i1l85dh/,14,r/wyoming,0,14
"No,  you are a douche bag.....seriously",t2_a0fjxyku,Consistent-Ebb-2182,1,1647901804.0,0,t1_i1l7lxp,i1l7lxp,False,greynolds17,t3_tjk2k3,https://www.reddit.com/r/wyoming/comments/tjk2k3/why_does_wyoming_require_everything_to_be/,why does Wyoming require everything to be notarized?,/r/wyoming/comments/tjk2k3/why_does_wyoming_require_everything_to_be/i1l7lxp/,-1,r/wyoming,0,-1
There’s a running list of people who get called when someone hits a moose up here in Alaska. An app would be handy.,t2_4ekxk2if,AC_Unit200,0,1647901766.0,0,t1_i1l7iou,i1l7iou,True,mtn_forester,t3_tibsq4,https://www.reddit.com/r/wyoming/comments/tibsq4/only_one_state_wyoming_has_an_app_for_roadkill/,Only one state - Wyoming - has an app for roadkill,/r/wyoming/comments/tibsq4/only_one_state_wyoming_has_an_app_for_roadkill/i1l7iou/,3,r/wyoming,0,3
"Lighten up, sunshine. Seriously",t2_327qf2ui,ckimmerle,1,1647901108.0,0,t1_i1l5y0r,i1l5y0r,False,greynolds17,t3_tjk2k3,https://www.reddit.com/r/wyoming/comments/tjk2k3/why_does_wyoming_require_everything_to_be/,why does Wyoming require everything to be notarized?,/r/wyoming/comments/tjk2k3/why_does_wyoming_require_everything_to_be/i1l5y0r/,2,r/wyoming,0,2
"Their were about 15 other cars parked on the road around me. The sheep were all out in the field and then they decided to come into the road to lick the salt off. They were not being bothered at all…. It’s not like I ran up to them. They came to US! 

Don’t judge something by one picture and a statement. You were not there in this situation to see how it actually played out.

Edit: WOW! I can’t believe I’m getting down voted… I could have stood there doing nothing while I waited for them to leave (they were blocking my car). Or I could have taken a picture. I chose to take the picture. What was I supposed to do?!?",t2_4kvngq24,BRGNBeast,1,1647901087.0,0,t1_i1l5w69,i1l5w69,False,BRGNBeast,t3_tjh0nf,https://www.reddit.com/r/wyoming/comments/tjh0nf/got_real_close_to_some_big_horn_sheep_and/,Got real close to some big horn sheep and captured this guy jumping over a stream in Jackson.,/r/wyoming/comments/tjh0nf/got_real_close_to_some_big_horn_sheep_and/i1l5w69/,-1,r/wyoming,0,-1
Yeah I was surprised too lol. At least it’s stil easy to vote by mail.,t2_3t556ma4,Perle1234,0,1647900307.0,0,t1_i1l41ws,i1l41ws,True,greynolds17,t3_tjk2k3,https://www.reddit.com/r/wyoming/comments/tjk2k3/why_does_wyoming_require_everything_to_be/,why does Wyoming require everything to be notarized?,/r/wyoming/comments/tjk2k3/why_does_wyoming_require_everything_to_be/i1l41ws/,4,r/wyoming,0,4
Everything's different from where I'm from and has to be the way I want it! rabble rabble rabble,t2_a9m3qdy1,tstramathorn,0,1647897709.0,0,t1_i1kxx08,i1kxx08,False,greynolds17,t3_tjk2k3,https://www.reddit.com/r/wyoming/comments/tjk2k3/why_does_wyoming_require_everything_to_be/,why does Wyoming require everything to be notarized?,/r/wyoming/comments/tjk2k3/why_does_wyoming_require_everything_to_be/i1kxx08/,8,r/wyoming,0,8
Okay...,t2_39356h3y,PigFarmer1,0,1647896981.0,0,t1_i1kw9l7,i1kw9l7,False,Top_Driver_8679,t3_tjg8dg,https://www.reddit.com/r/wyoming/comments/tjg8dg/treatment_of_outsiders_and_transplants/,Treatment of outsiders and transplants,/r/wyoming/comments/tjg8dg/treatment_of_outsiders_and_transplants/i1kw9l7/,7,r/wyoming,0,7
"Ummm…. 

Maybe join a community club or group. Volunteer somewhere and make some friends. You can’t expect people to like you without the opportunity to get to know you. 

I remember learning in elementary school that not everyone is going to like me, and there may be people I don’t like. And that’s okay.",t2_2u0t8404,Earthviolet76,0,1647895761.0,0,t1_i1ktg8a,i1ktg8a,True,Top_Driver_8679,t3_tjg8dg,https://www.reddit.com/r/wyoming/comments/tjg8dg/treatment_of_outsiders_and_transplants/,Treatment of outsiders and transplants,/r/wyoming/comments/tjg8dg/treatment_of_outsiders_and_transplants/i1ktg8a/,9,r/wyoming,0,9
Give wildlife space. It’s not just for your safety. They’re not just there for your viewing pleasure and internet likes.,t2_116dyppi,RemembertheABCs,0,1647895319.0,0,t1_i1kscls,i1kscls,False,BRGNBeast,t3_tjh0nf,https://www.reddit.com/r/wyoming/comments/tjh0nf/got_real_close_to_some_big_horn_sheep_and/,Got real close to some big horn sheep and captured this guy jumping over a stream in Jackson.,/r/wyoming/comments/tjh0nf/got_real_close_to_some_big_horn_sheep_and/i1kscls/,9,r/wyoming,0,9
"I have relatives in NE just a few towns over the border from Lusk.  Small town but heavily agricultural. What you are describing sounds alot like them also.  They are very cliquish, gossipy and in general keep to their inner circle.   You would probably have a better experience in some of the bigger towns.",t2_2987do5m,thelma_edith,0,1647895023.0,0,t1_i1krm2e,i1krm2e,True,Top_Driver_8679,t3_tjg8dg,https://www.reddit.com/r/wyoming/comments/tjg8dg/treatment_of_outsiders_and_transplants/,Treatment of outsiders and transplants,/r/wyoming/comments/tjg8dg/treatment_of_outsiders_and_transplants/i1krm2e/,5,r/wyoming,0,5
Why is it a bad thing to address orphaned wells? How does that make us a laughing stock?,t2_zek68,may_june_july,0,1647894489.0,0,t1_i1kq9sw,i1kq9sw,False,may_june_july,t3_tjeyku,https://www.reddit.com/r/wyoming/comments/tjeyku/bidenharris_administration_releases_draft/,"Biden-Harris Administration Releases Draft Guidance, Invites Public Comment on New Orphaned Well Program",/r/wyoming/comments/tjeyku/bidenharris_administration_releases_draft/i1kq9sw/,5,r/wyoming,0,5
God speed o7,t2_a9m3qdy1,tstramathorn,0,1647893970.0,0,t1_i1koymc,i1koymc,False,Top_Driver_8679,t3_tjg8dg,https://www.reddit.com/r/wyoming/comments/tjg8dg/treatment_of_outsiders_and_transplants/,Treatment of outsiders and transplants,/r/wyoming/comments/tjg8dg/treatment_of_outsiders_and_transplants/i1koymc/,8,r/wyoming,0,8
"Well what I read here today helped me to come to a final conclusion and that conclusion is: fuck Wyoming. And fuck their grandiose opinions of themselves. Fucking lame ass podunk shithole state with no personality and no amenities.. Not to mention, overpriced....




Let's see all the defensive attitudes now...",t2_h87z3ues,Top_Driver_8679,0,1647893519.0,0,t1_i1kntkh,i1kntkh,False,Top_Driver_8679,t3_tjg8dg,https://www.reddit.com/r/wyoming/comments/tjg8dg/treatment_of_outsiders_and_transplants/,Treatment of outsiders and transplants,/r/wyoming/comments/tjg8dg/treatment_of_outsiders_and_transplants/i1kntkh/,-8,r/wyoming,0,-8
Good work. Ignore recommended safe distances for a picture.,t2_5l6nj5l5,Immediate_Thought656,0,1647893462.0,0,t1_i1knock,i1knock,True,BRGNBeast,t3_tjh0nf,https://www.reddit.com/r/wyoming/comments/tjh0nf/got_real_close_to_some_big_horn_sheep_and/,Got real close to some big horn sheep and captured this guy jumping over a stream in Jackson.,/r/wyoming/comments/tjh0nf/got_real_close_to_some_big_horn_sheep_and/i1knock/,13,r/wyoming,0,13
I would if gas wasn't so expensive,t2_3udh50a3,greynolds17,0,1647892433.0,0,t1_i1kl0rc,i1kl0rc,False,greynolds17,t3_tjk2k3,https://www.reddit.com/r/wyoming/comments/tjk2k3/why_does_wyoming_require_everything_to_be/,why does Wyoming require everything to be notarized?,/r/wyoming/comments/tjk2k3/why_does_wyoming_require_everything_to_be/i1kl0rc/,2,r/wyoming,0,2
I'm a transplant and I've never had an issue although I know that vibe is out there for/from some people.,t2_39356h3y,PigFarmer1,0,1647892058.0,0,t1_i1kk1ke,i1kk1ke,True,Top_Driver_8679,t3_tjg8dg,https://www.reddit.com/r/wyoming/comments/tjg8dg/treatment_of_outsiders_and_transplants/,Treatment of outsiders and transplants,/r/wyoming/comments/tjg8dg/treatment_of_outsiders_and_transplants/i1kk1ke/,3,r/wyoming,0,3
"Is today ""transplants complain about Wyoming"" day in this sub or something? Sheesh.",t2_7uyw8et8,SquishyPotato117,0,1647891956.0,0,t1_i1kjsf9,i1kjsf9,True,greynolds17,t3_tjk2k3,https://www.reddit.com/r/wyoming/comments/tjk2k3/why_does_wyoming_require_everything_to_be/,why does Wyoming require everything to be notarized?,/r/wyoming/comments/tjk2k3/why_does_wyoming_require_everything_to_be/i1kjsf9/,11,r/wyoming,0,11
"Wyoming Election Info

[Register to Vote](https://sos.wyo.gov/elections/state/registeringtovote.aspx)",t2_jpimgrm,election_info_bot,0,1647891842.0,0,t1_i1kjid3,i1kjid3,True,may_june_july,t3_tjf0gv,https://www.reddit.com/r/wyoming/comments/tjf0gv/wyoming_lawmaker_under_investigation_for_alleged/,Wyoming lawmaker under investigation for alleged death threats - WyoFile,/r/wyoming/comments/tjf0gv/wyoming_lawmaker_under_investigation_for_alleged/i1kjid3/,6,r/wyoming,0,6
You should move back to Colorado......seriously,t2_a0fjxyku,Consistent-Ebb-2182,1,1647891797.0,0,t1_i1kjekk,i1kjekk,True,greynolds17,t3_tjk2k3,https://www.reddit.com/r/wyoming/comments/tjk2k3/why_does_wyoming_require_everything_to_be/,why does Wyoming require everything to be notarized?,/r/wyoming/comments/tjk2k3/why_does_wyoming_require_everything_to_be/i1kjekk/,6,r/wyoming,0,6
"Fair enough, it can be an acquired taste. Happy trails though",t2_14bpy9,Loeden,0,1647890749.0,0,t1_i1kgxfp,i1kgxfp,False,Top_Driver_8679,t3_tjg8dg,https://www.reddit.com/r/wyoming/comments/tjg8dg/treatment_of_outsiders_and_transplants/,Treatment of outsiders and transplants,/r/wyoming/comments/tjg8dg/treatment_of_outsiders_and_transplants/i1kgxfp/,8,r/wyoming,0,8
You know how you can tell when someone is from Texas?,t2_4fkzj,Brancher,0,1647887848.0,0,t1_i1k9ok0,i1k9ok0,False,Top_Driver_8679,t3_tjg8dg,https://www.reddit.com/r/wyoming/comments/tjg8dg/treatment_of_outsiders_and_transplants/,Treatment of outsiders and transplants,/r/wyoming/comments/tjg8dg/treatment_of_outsiders_and_transplants/i1k9ok0/,6,r/wyoming,0,6
I agree Texas is overpopulated. But it's worth it to me at this point. I won't ever look back either.,t2_h87z3ues,Top_Driver_8679,1,1647887346.0,0,t1_i1k8ewk,i1k8ewk,False,Top_Driver_8679,t3_tjg8dg,https://www.reddit.com/r/wyoming/comments/tjg8dg/treatment_of_outsiders_and_transplants/,Treatment of outsiders and transplants,/r/wyoming/comments/tjg8dg/treatment_of_outsiders_and_transplants/i1k8ewk/,0,r/wyoming,0,0
"I'll trade ya lol I'm heading back home this summer after being in Texas for 6 years. You don't move to Wyoming for the people, you move there for the LACK of people. Lol Texas was just too hot and crowded for me",t2_4hh4zo3a,ktm_motocross420,0,1647887196.0,0,t1_i1k80tx,i1k80tx,False,Top_Driver_8679,t3_tjg8dg,https://www.reddit.com/r/wyoming/comments/tjg8dg/treatment_of_outsiders_and_transplants/,Treatment of outsiders and transplants,/r/wyoming/comments/tjg8dg/treatment_of_outsiders_and_transplants/i1k80tx/,13,r/wyoming,0,13
"Hell, yall can have this place. The more I think about it, the more I resent.",t2_h87z3ues,Top_Driver_8679,0,1647887096.0,0,t1_i1k7rht,i1k7rht,False,Top_Driver_8679,t3_tjg8dg,https://www.reddit.com/r/wyoming/comments/tjg8dg/treatment_of_outsiders_and_transplants/,Treatment of outsiders and transplants,/r/wyoming/comments/tjg8dg/treatment_of_outsiders_and_transplants/i1k7rht/,-7,r/wyoming,0,-7
