body,author_fullname,author.name,controversiality,created,downs,fullname,id,is_root,link_author,link_id,link_permalink,link_title,permalink,score,subreddit_name_prefixed,total_awards_received,ups
"And mining companies as well. They spend a lot more money that you think and permitting takes into account wildlife . 

There is a reason why environmental engineers are a very much needed field in industry in the west.",t2_413ph,one8sevenn,0,1647453123.0,0,t1_i0wtu2l,i0wtu2l,False,may_june_july,t3_tfil4b,https://www.reddit.com/r/wyoming/comments/tfil4b/court_blocks_193_wyoming_oil_and_gas_leases/,Court blocks 193 Wyoming oil and gas leases,/r/wyoming/comments/tfil4b/court_blocks_193_wyoming_oil_and_gas_leases/i0wtu2l/,2,r/wyoming,0,2
They'd probably prefer to bury him so Hageman can go one on one against Cheney.,t2_4kvwy,matty25,0,1647450364.0,0,t1_i0wmy9q,i0wmy9q,False,may_june_july,t3_tfimoo,https://www.reddit.com/r/wyoming/comments/tfimoo/bouchard_could_face_formal_investigation_over/,Bouchard could face formal investigation over intimidation allegations,/r/wyoming/comments/tfimoo/bouchard_could_face_formal_investigation_over/i0wmy9q/,12,r/wyoming,0,12
Can't wait to see nuclear power enter the state,t2_a9m3qdy1,tstramathorn,0,1647449570.0,0,t1_i0wl03h,i0wl03h,True,may_june_july,t3_tfil4b,https://www.reddit.com/r/wyoming/comments/tfil4b/court_blocks_193_wyoming_oil_and_gas_leases/,Court blocks 193 Wyoming oil and gas leases,/r/wyoming/comments/tfil4b/court_blocks_193_wyoming_oil_and_gas_leases/i0wl03h/,10,r/wyoming,0,10
"Note: he's playing BS politics. He wants the optics for his supporters, but doesn't want to be actually responsible.   


>legislation that would ""ban abortion entirely in Wyoming,"" *if the U.S. Supreme Court decides to overturn Roe v. Wade.*",t2_gi2ef,cavscout43,0,1647446360.0,0,t1_i0wd3ye,i0wd3ye,True,wyodrahtlos,t3_tf6if3,https://www.reddit.com/r/wyoming/comments/tf6if3/aclu_governor_gordon_signed_law_that_will_ban/,ACLU: Governor Gordon Signed Law That Will Ban Abortion Entirely in Wyoming,/r/wyoming/comments/tf6if3/aclu_governor_gordon_signed_law_that_will_ban/i0wd3ye/,5,r/wyoming,0,5
"I'm getting a ""thrown under the bus"" feeling about this one, but I've certainly been wrong before.  (And odds are good that someone will try to [""rehabilitate"" him](https://en.wikipedia.org/wiki/Political_rehabilitation) in a few years, after the voters have forgotten.)",t2_xjtix,Raineythereader,0,1647445793.0,0,t1_i0wbpgf,i0wbpgf,False,may_june_july,t3_tfimoo,https://www.reddit.com/r/wyoming/comments/tfimoo/bouchard_could_face_formal_investigation_over/,Bouchard could face formal investigation over intimidation allegations,/r/wyoming/comments/tfimoo/bouchard_could_face_formal_investigation_over/i0wbpgf/,9,r/wyoming,0,9
"Terrible news. But can someone explain to me the structure of this bill? Is it that ""Abortions will be banned if RvW is overturned,"" or is it ""Abortions are banned now, but then if RvW is overturned they will be extra banned?"" Both are terrible prospects.",t2_7bw3f,Waldinian,0,1647445392.0,0,t1_i0wapdi,i0wapdi,True,wyodrahtlos,t3_tf6if3,https://www.reddit.com/r/wyoming/comments/tf6if3/aclu_governor_gordon_signed_law_that_will_ban/,ACLU: Governor Gordon Signed Law That Will Ban Abortion Entirely in Wyoming,/r/wyoming/comments/tf6if3/aclu_governor_gordon_signed_law_that_will_ban/i0wapdi/,1,r/wyoming,0,1
"I don't watch CNN and I can read just fine thanks. 

Caring about the bird as much as it hurts ones bottom line is not the same as the concern of the activist trying to protect it-your original claim.

I'm 40 and at this point I've seen plenty of ecological disasters that have poisoned people, ruined habitats, and killed wildlife the world over by malice or the negligence of oil and gas companies.

Recently Chevron in Ecuador is a prime example of this.",t2_jvf15wha,_elbarbudo_,1,1647445291.0,0,t1_i0wagio,i0wagio,False,may_june_july,t3_tfil4b,https://www.reddit.com/r/wyoming/comments/tfil4b/court_blocks_193_wyoming_oil_and_gas_leases/,Court blocks 193 Wyoming oil and gas leases,/r/wyoming/comments/tfil4b/court_blocks_193_wyoming_oil_and_gas_leases/i0wagio/,-6,r/wyoming,0,-6
"My fiancé and I are currently paying $1,800 plus utilities a month for a 2 bedroom that allows one dog. My prior one bedroom basement apartment was $750 a month and it was terrible. Heating a trailer sucks and the wind will destroy them no matter what time of year, plus in the summer they become unbearably hot. I think lot rent is around $400-$600 in most parks as well so add in trailer rent and utilities and you’re paying the same as a house rental or apartment in town. Also most have breed restrictions to look into.",t2_5gochr1u,squeakerswyo,0,1647444707.0,0,t1_i0w907t,i0w907t,False,AutoModerator,t3_te3kk5,https://www.reddit.com/r/wyoming/comments/te3kk5/questions_about_moving_to_or_visiting_wyoming_ask/,Questions about moving to or visiting Wyoming? Ask here!,/r/wyoming/comments/te3kk5/questions_about_moving_to_or_visiting_wyoming_ask/i0w907t/,3,r/wyoming,0,3
"You should stop believing every thing you see on CNN. I work for an oil and gas company and if you could read you would see that I literally stated why they care about sage grouse. It’s not because they like the bird, it’s because if it goes on the ESL they cannot make new infrastructure for wells.",t2_8wwjmh15,CowPoke307,1,1647444680.0,0,t1_i0w8xv5,i0w8xv5,False,may_june_july,t3_tfil4b,https://www.reddit.com/r/wyoming/comments/tfil4b/court_blocks_193_wyoming_oil_and_gas_leases/,Court blocks 193 Wyoming oil and gas leases,/r/wyoming/comments/tfil4b/court_blocks_193_wyoming_oil_and_gas_leases/i0w8xv5/,4,r/wyoming,0,4
No doubt his fellow party members who will control the investigation will do a bang-up job dismissing the allegations.,t2_graa8,wyskiboat,0,1647444311.0,0,t1_i0w81c7,i0w81c7,True,may_june_july,t3_tfimoo,https://www.reddit.com/r/wyoming/comments/tfimoo/bouchard_could_face_formal_investigation_over/,Bouchard could face formal investigation over intimidation allegations,/r/wyoming/comments/tfimoo/bouchard_could_face_formal_investigation_over/i0w81c7/,19,r/wyoming,0,19
Wow. The one good thing Gordon has done. I thought I’d never see the day since the guy is dumb as fuck. But somebody had to make abortion illegal in wyoming.,t2_g5vdlc1z,rosewiththornzzz,0,1647443981.0,0,t1_i0w77ys,i0w77ys,True,wyodrahtlos,t3_tf6if3,https://www.reddit.com/r/wyoming/comments/tf6if3/aclu_governor_gordon_signed_law_that_will_ban/,ACLU: Governor Gordon Signed Law That Will Ban Abortion Entirely in Wyoming,/r/wyoming/comments/tf6if3/aclu_governor_gordon_signed_law_that_will_ban/i0w77ys/,-18,r/wyoming,0,-18
"“Understand that we hear you and that we’re concerned”. Bullshit. Total bullshit. They aren’t concerned one but. More than likely he was a top athlete in whatever sport he was in and they just couldn’t risk their petty little pride for the sake of justice. Fuck the educational system and fuck these fucking board members. They have no idea what they’re putting their students, both female AND male, through. Here in worland there have been at least 25 girls in the last 4 years (I’m not sure how many boys because the boys don’t report it) who have been raped or molested by other students OR teachers. And whenever they report it, the board has swept it under the rug. If a student raped another student, they try to make it out to be equally the victims fault. If a teacher raped a student…they simply terminated the teacher! Fuck these sons and f bitches. So much for giving students a safe environment",t2_g5vdlc1z,rosewiththornzzz,0,1647443331.0,0,t1_i0w5mku,i0w5mku,True,Buelldozer,t3_tf10c3,https://www.reddit.com/r/wyoming/comments/tf10c3/family_asks_school_board_why_was_student_athlete/,Family asks school board: Why was student athlete allowed to compete after sex crime?,/r/wyoming/comments/tf10c3/family_asks_school_board_why_was_student_athlete/i0w5mku/,3,r/wyoming,0,3
As reported by a local newspaper.  They need our support.,t2_ag2um4rf,SutttonTacoma,0,1647443225.0,0,t1_i0w5d6u,i0w5d6u,True,may_june_july,t3_tfimoo,https://www.reddit.com/r/wyoming/comments/tfimoo/bouchard_could_face_formal_investigation_over/,Bouchard could face formal investigation over intimidation allegations,/r/wyoming/comments/tfimoo/bouchard_could_face_formal_investigation_over/i0w5d6u/,18,r/wyoming,0,18
"Thanks for your advice! I didn't consider the weather when I thought about getting a trailer, but that makes sense. Probably makes it a nightmare to heat, huh? 

What would you consider ""a lot"" for the area? I live in one of the cheapest parts of the country so my sense for this sort of cost is a little skewed",t2_4e1fjsn0,urinetherapymiracle,0,1647442844.0,0,t1_i0w4fg5,i0w4fg5,False,AutoModerator,t3_te3kk5,https://www.reddit.com/r/wyoming/comments/te3kk5/questions_about_moving_to_or_visiting_wyoming_ask/,Questions about moving to or visiting Wyoming? Ask here!,/r/wyoming/comments/te3kk5/questions_about_moving_to_or_visiting_wyoming_ask/i0w4fg5/,1,r/wyoming,0,1
You don’t have to move.  I’m sure you just drive over there real quick.,t2_5wan6n,R0binSage,1,1647442614.0,0,t1_i0w3uz0,i0w3uz0,False,wyodrahtlos,t3_tf6if3,https://www.reddit.com/r/wyoming/comments/tf6if3/aclu_governor_gordon_signed_law_that_will_ban/,ACLU: Governor Gordon Signed Law That Will Ban Abortion Entirely in Wyoming,/r/wyoming/comments/tf6if3/aclu_governor_gordon_signed_law_that_will_ban/i0w3uz0/,-2,r/wyoming,0,-2
"Honestly good luck finding anywhere to rent with 2 dogs. Prepare to pay A LOT if you can find a place that will allow them and it will likely not be nice. Living in a trailer in Wyoming is absolutely the worst thing I have ever done, would not recommend a trailer at all given the wind and climate and the trailer parks around here are…. Not the nicest. Students take up rentals quick, you want a place in n September start looking now. Best advice I have, either prepare to buy a house or live in a very expensive shit hole if you want your dogs to come with.",t2_5gochr1u,squeakerswyo,0,1647442252.0,0,t1_i0w2z5k,i0w2z5k,False,AutoModerator,t3_te3kk5,https://www.reddit.com/r/wyoming/comments/te3kk5/questions_about_moving_to_or_visiting_wyoming_ask/,Questions about moving to or visiting Wyoming? Ask here!,/r/wyoming/comments/te3kk5/questions_about_moving_to_or_visiting_wyoming_ask/i0w2z5k/,5,r/wyoming,0,5
"Sure, sure. Oil companies famously real concerned with human and environmental damage.",t2_jvf15wha,_elbarbudo_,1,1647442079.0,0,t1_i0w2juk,i0w2juk,False,may_june_july,t3_tfil4b,https://www.reddit.com/r/wyoming/comments/tfil4b/court_blocks_193_wyoming_oil_and_gas_leases/,Court blocks 193 Wyoming oil and gas leases,/r/wyoming/comments/tfil4b/court_blocks_193_wyoming_oil_and_gas_leases/i0w2juk/,-6,r/wyoming,0,-6
"Funny enough I have personal experience with this.

I have acreage next to a large sage grouse preserve - it's a little over 12,000 acres. Owned by an oil company. They don't drill this property and never will.",t2_11gdxq,CuttingTheMustard,0,1647441797.0,0,t1_i0w1uu4,i0w1uu4,False,may_june_july,t3_tfil4b,https://www.reddit.com/r/wyoming/comments/tfil4b/court_blocks_193_wyoming_oil_and_gas_leases/,Court blocks 193 Wyoming oil and gas leases,/r/wyoming/comments/tfil4b/court_blocks_193_wyoming_oil_and_gas_leases/i0w1uu4/,12,r/wyoming,0,12
">Oil and gas companies are just as concerned about protecting sage grouse as activist groups.

I don't think so",t2_jvf15wha,_elbarbudo_,1,1647441501.0,0,t1_i0w14yh,i0w14yh,False,may_june_july,t3_tfil4b,https://www.reddit.com/r/wyoming/comments/tfil4b/court_blocks_193_wyoming_oil_and_gas_leases/,Court blocks 193 Wyoming oil and gas leases,/r/wyoming/comments/tfil4b/court_blocks_193_wyoming_oil_and_gas_leases/i0w14yh/,-8,r/wyoming,0,-8
This is just dumb.,t2_1fywp7z4,HayZeusRios,0,1647441234.0,0,t1_i0w0hzk,i0w0hzk,True,wyodrahtlos,t3_tf6if3,https://www.reddit.com/r/wyoming/comments/tf6if3/aclu_governor_gordon_signed_law_that_will_ban/,ACLU: Governor Gordon Signed Law That Will Ban Abortion Entirely in Wyoming,/r/wyoming/comments/tf6if3/aclu_governor_gordon_signed_law_that_will_ban/i0w0hzk/,10,r/wyoming,0,10
"When drilling in sage grouse territory there are special stipulations that have to be followed, effectively eliminating the “damage” done to the species. Oil and gas companies are just as concerned about protecting sage grouse as activist groups. If the bird goes on the endangered list, they can’t drill. A good portion of sage grouse conservation money actually comes from the oil and gas companies.",t2_8wwjmh15,CowPoke307,0,1647440814.0,0,t1_i0vzhy2,i0vzhy2,True,may_june_july,t3_tfil4b,https://www.reddit.com/r/wyoming/comments/tfil4b/court_blocks_193_wyoming_oil_and_gas_leases/,Court blocks 193 Wyoming oil and gas leases,/r/wyoming/comments/tfil4b/court_blocks_193_wyoming_oil_and_gas_leases/i0vzhy2/,16,r/wyoming,0,16
"What a great solution for someone in Cody. No way Utah, Montana, Idaho, or the Dakotas will do the same thing, but at least Colorado is only a 7-hour drive away!",t2_3dc0b,spongebue,0,1647440286.0,0,t1_i0vy8ub,i0vy8ub,False,wyodrahtlos,t3_tf6if3,https://www.reddit.com/r/wyoming/comments/tf6if3/aclu_governor_gordon_signed_law_that_will_ban/,ACLU: Governor Gordon Signed Law That Will Ban Abortion Entirely in Wyoming,/r/wyoming/comments/tf6if3/aclu_governor_gordon_signed_law_that_will_ban/i0vy8ub/,11,r/wyoming,0,11
"My fiancée got a position at the university, so we'll be moving to Laramie some time this fall, no earlier than mid-September.

We live in a big city now, but I grew up in rural Ohio, and I can't wait to get back to somewhere with a little more stretching room, so to speak. 

My biggest concern is finding a place to live. We have two dogs, a beagle mix and an American bull dog, and the rental options are very limited. Any advice? Would it be worth it to start a lease early so that we can beat the UW students to the rental market? Can anyone tell me what the trailer parks are like?",t2_4e1fjsn0,urinetherapymiracle,0,1647440007.0,0,t1_i0vxlai,i0vxlai,True,AutoModerator,t3_te3kk5,https://www.reddit.com/r/wyoming/comments/te3kk5/questions_about_moving_to_or_visiting_wyoming_ask/,Questions about moving to or visiting Wyoming? Ask here!,/r/wyoming/comments/te3kk5/questions_about_moving_to_or_visiting_wyoming_ask/i0vxlai/,1,r/wyoming,0,1
"You should understand this won't erase the sins of the Republicans in Iraq & the failed, immoral War on Terror,  which is the main motivation for this.

The Right always turns to abortion after a great sin.  They did it to compensate for the sins of Nixon & Vietnam & opposing civil rights.
They're doing it again to compensate for the sins of Iraq, Trump & the attempted coup.  *But none will get into Heaven without repenting for these sins*.",t2_13quc3qt,BillHicksScream,0,1647438103.0,0,t1_i0vtb99,i0vtb99,False,wyodrahtlos,t3_tf6if3,https://www.reddit.com/r/wyoming/comments/tf6if3/aclu_governor_gordon_signed_law_that_will_ban/,ACLU: Governor Gordon Signed Law That Will Ban Abortion Entirely in Wyoming,/r/wyoming/comments/tf6if3/aclu_governor_gordon_signed_law_that_will_ban/i0vtb99/,6,r/wyoming,0,6
Oh yeah since packing up and moving is so practical for everyone. Don't be a dick. You can love Wyoming but hate some of the decisions.,t2_a9iax,R1CHARDCRANIUM,0,1647435276.0,0,t1_i0vnh3f,i0vnh3f,False,wyodrahtlos,t3_tf6if3,https://www.reddit.com/r/wyoming/comments/tf6if3/aclu_governor_gordon_signed_law_that_will_ban/,ACLU: Governor Gordon Signed Law That Will Ban Abortion Entirely in Wyoming,/r/wyoming/comments/tf6if3/aclu_governor_gordon_signed_law_that_will_ban/i0vnh3f/,16,r/wyoming,0,16
"Good, before you get angry don’t forget there are plenty of other states to take your business.",t2_jfcwmzgw,Wyo-Heathen,0,1647414912.0,0,t1_i0uvme0,i0uvme0,True,wyodrahtlos,t3_tf6if3,https://www.reddit.com/r/wyoming/comments/tf6if3/aclu_governor_gordon_signed_law_that_will_ban/,ACLU: Governor Gordon Signed Law That Will Ban Abortion Entirely in Wyoming,/r/wyoming/comments/tf6if3/aclu_governor_gordon_signed_law_that_will_ban/i0uvme0/,-36,r/wyoming,0,-36
Crummy bastard,t2_14bpy9,Loeden,0,1647410697.0,0,t1_i0uq7vd,i0uq7vd,True,wyodrahtlos,t3_tf6if3,https://www.reddit.com/r/wyoming/comments/tf6if3/aclu_governor_gordon_signed_law_that_will_ban/,ACLU: Governor Gordon Signed Law That Will Ban Abortion Entirely in Wyoming,/r/wyoming/comments/tf6if3/aclu_governor_gordon_signed_law_that_will_ban/i0uq7vd/,10,r/wyoming,0,10
Down with Governor Gordon!,t2_3thl16sv,Nezte,0,1647400183.0,0,t1_i0u8a7o,i0u8a7o,True,wyodrahtlos,t3_tf6if3,https://www.reddit.com/r/wyoming/comments/tf6if3/aclu_governor_gordon_signed_law_that_will_ban/,ACLU: Governor Gordon Signed Law That Will Ban Abortion Entirely in Wyoming,/r/wyoming/comments/tf6if3/aclu_governor_gordon_signed_law_that_will_ban/i0u8a7o/,20,r/wyoming,0,20
"There are jobs...use the typical search engines like indeed, monster, etc.  Dating scene and making friends - not the easiest place for that but not impossible.  I'd stick to the bigger towns.",t2_2987do5m,thelma_edith,0,1647394242.0,0,t1_i0tv5z7,i0tv5z7,False,AutoModerator,t3_te3kk5,https://www.reddit.com/r/wyoming/comments/te3kk5/questions_about_moving_to_or_visiting_wyoming_ask/,Questions about moving to or visiting Wyoming? Ask here!,/r/wyoming/comments/te3kk5/questions_about_moving_to_or_visiting_wyoming_ask/i0tv5z7/,3,r/wyoming,0,3
">In any case helping Cheney is out of the question, let all her dark money back her up. She will throw us under the bus in a heartbeat, just like she did to her sister. It is a deal with the devil we don’t need to make.

Very much agreed.

> nor will it do anything to change the balance of power in the House if Hageman wins (not that I want that either). I just don’t think it will be the end of the world. Just a different flavor of evil.

Also very much agreed.  I also think it is helpful to have a grotesque person to be the face of grotesque policies.  Cheney voted with Trump more than 93% of the time and yet is viewed as a ""respectable republican"" Its better to have the face of these policies be loons like MTG or Hageman.",t2_jvf15wha,_elbarbudo_,0,1647393138.0,0,t1_i0tsnlb,i0tsnlb,False,3rdIQ,t3_tdym7z,https://www.reddit.com/r/wyoming/comments/tdym7z/liz_cheney_turns_to_democrats_to_save_her_hide/,Liz Cheney turns to Democrats to save her hide,/r/wyoming/comments/tdym7z/liz_cheney_turns_to_democrats_to_save_her_hide/i0tsnlb/,1,r/wyoming,0,1
"Every admin is going to make mistakes. Your talk of ""righting the ship"" is a bit asinine. Your view of how the federal gov't behaves is unrealistic as if its a roller coaster that was headed downward and the moment Trump was elected  it shot skyward only to drop like a stone the moment Biden was elected. The federal gov't changes direction like the Titanic, not like a speed boat- so your claims that Biden has ruined the country in a year are bullshit. Ultimately, because of the structure of our gov't very little change is possible, its all kabuki theatre

Trump's policy set was not much different than Biden's. Cater to the rich and corporations and create soundbites that appeal towards the base. Obama was not much different when rubber meets the road either. As a leftist I can assure you that the Obama administration was a huge disappointment and I'm not a fan of Biden in that regard either.

All this bathhouse Barry is just as dumb and cringey as ""dangerous donald"" Both served their corporate interests well and wanted to hobnob with famous people more than anything. Both are consumed with their image and legacy.",t2_jvf15wha,_elbarbudo_,0,1647392754.0,0,t1_i0trsbs,i0trsbs,False,3rdIQ,t3_tdym7z,https://www.reddit.com/r/wyoming/comments/tdym7z/liz_cheney_turns_to_democrats_to_save_her_hide/,Liz Cheney turns to Democrats to save her hide,/r/wyoming/comments/tdym7z/liz_cheney_turns_to_democrats_to_save_her_hide/i0trsbs/,1,r/wyoming,0,1
Touche.,t2_4vtqftke,TrashPanda_924,0,1647391632.0,0,t1_i0tp9no,i0tp9no,False,3rdIQ,t3_telr9r,https://www.reddit.com/r/wyoming/comments/telr9r/hageman_campaign_creates_cheney_for_virginia/,Hageman Campaign Creates 'Cheney For Virginia' Website,/r/wyoming/comments/telr9r/hageman_campaign_creates_cheney_for_virginia/i0tp9no/,2,r/wyoming,0,2
"Thanks- I knew I got it turned around but didn't look up who had which job. I should've done that before I replied. Either way, they have power in the school district & that's why it was covered up this completely.",t2_z2cmk,lindamay6838,0,1647391147.0,0,t1_i0to63g,i0to63g,False,Buelldozer,t3_tf10c3,https://www.reddit.com/r/wyoming/comments/tf10c3/family_asks_school_board_why_was_student_athlete/,Family asks school board: Why was student athlete allowed to compete after sex crime?,/r/wyoming/comments/tf10c3/family_asks_school_board_why_was_student_athlete/i0to63g/,7,r/wyoming,0,7
He is the son of a middle school teacher (used to be HS) and the nephew of a school admin,t2_k0hzza3a,ZooMaMa1982,0,1647390364.0,0,t1_i0tmduq,i0tmduq,False,Buelldozer,t3_tf10c3,https://www.reddit.com/r/wyoming/comments/tf10c3/family_asks_school_board_why_was_student_athlete/,Family asks school board: Why was student athlete allowed to compete after sex crime?,/r/wyoming/comments/tf10c3/family_asks_school_board_why_was_student_athlete/i0tmduq/,16,r/wyoming,0,16
"It makes me mad that it’s like that there. There’s good people in your town and plenty of them. So irresponsible to let serious issues and offenses slide. It teaches our kids it’s fine to drive drunk, assault, rape etc. Boys will be boys, amirite? (/s)",t2_3t556ma4,Perle1234,0,1647390264.0,0,t1_i0tm5b1,i0tm5b1,False,Buelldozer,t3_tf10c3,https://www.reddit.com/r/wyoming/comments/tf10c3/family_asks_school_board_why_was_student_athlete/,Family asks school board: Why was student athlete allowed to compete after sex crime?,/r/wyoming/comments/tf10c3/family_asks_school_board_why_was_student_athlete/i0tm5b1/,7,r/wyoming,0,7
"You would recognize the name immediately. Everyone did.  As the story goes, it also isn't his 1st time. I'm so glad the grandparents brought this to our attention - we would've never known if they didn't,  That poor girl was victimized over & over again by sweeping it under the rug.",t2_z2cmk,lindamay6838,0,1647390247.0,0,t1_i0tm3v6,i0tm3v6,False,Buelldozer,t3_tf10c3,https://www.reddit.com/r/wyoming/comments/tf10c3/family_asks_school_board_why_was_student_athlete/,Family asks school board: Why was student athlete allowed to compete after sex crime?,/r/wyoming/comments/tf10c3/family_asks_school_board_why_was_student_athlete/i0tm3v6/,5,r/wyoming,0,5
"I’m glad you mentioned the RAPIST, BROCK TURNER. Say his fucking name. Say it often, and always with RAPIST.",t2_3t556ma4,Perle1234,0,1647390090.0,0,t1_i0tlqjp,i0tlqjp,False,Buelldozer,t3_tf10c3,https://www.reddit.com/r/wyoming/comments/tf10c3/family_asks_school_board_why_was_student_athlete/,Family asks school board: Why was student athlete allowed to compete after sex crime?,/r/wyoming/comments/tf10c3/family_asks_school_board_why_was_student_athlete/i0tlqjp/,18,r/wyoming,0,18
"The perpetrator is the son of a school administrator & I believe nephew  of a Highschool Teacher (as the town gossip goes) He's also a star athlete. We all know how this happened. Power, prestige & money make the world go around; it's even more pronounced in a place like WY.  Shameful...",t2_z2cmk,lindamay6838,0,1647390087.0,0,t1_i0tlqav,i0tlqav,True,Buelldozer,t3_tf10c3,https://www.reddit.com/r/wyoming/comments/tf10c3/family_asks_school_board_why_was_student_athlete/,Family asks school board: Why was student athlete allowed to compete after sex crime?,/r/wyoming/comments/tf10c3/family_asks_school_board_why_was_student_athlete/i0tlqav/,21,r/wyoming,0,21
Yeah that comments section is pure Wyoming. That’s where backstory details are. It’s a small place people wise. We know what tf is up.,t2_3t556ma4,Perle1234,0,1647389998.0,0,t1_i0tlinn,i0tlinn,False,Buelldozer,t3_tf10c3,https://www.reddit.com/r/wyoming/comments/tf10c3/family_asks_school_board_why_was_student_athlete/,Family asks school board: Why was student athlete allowed to compete after sex crime?,/r/wyoming/comments/tf10c3/family_asks_school_board_why_was_student_athlete/i0tlinn/,0,r/wyoming,0,0
Yeah that comments section is pure Wyoming. That’s where backstory details are. It’s a small place people wise. We know what tf is up.,t2_3t556ma4,Perle1234,0,1647389991.0,0,t1_i0tli3x,i0tli3x,False,Buelldozer,t3_tf10c3,https://www.reddit.com/r/wyoming/comments/tf10c3/family_asks_school_board_why_was_student_athlete/,Family asks school board: Why was student athlete allowed to compete after sex crime?,/r/wyoming/comments/tf10c3/family_asks_school_board_why_was_student_athlete/i0tli3x/,12,r/wyoming,0,12
Yelp for mile markers.,t2_c4lb5,Nekowulf,0,1647389574.0,0,t1_i0tkjrl,i0tkjrl,True,zsreport,t3_tf3pav,https://www.reddit.com/r/wyoming/comments/tf3pav/roadkill_for_food_one_state_now_has_an_app_for/,Roadkill for food? One state now has an app for that,/r/wyoming/comments/tf3pav/roadkill_for_food_one_state_now_has_an_app_for/i0tkjrl/,2,r/wyoming,0,2
"Oh, no argument there, hypocrisy tends to flourish where small groups have an outsized amount of power. 

Small Town Wyoming is a cesspool of such BS, and it tends to come from self-described 'pillars of the community.'",t2_2ygqotum,cynicismbyproxy,0,1647387556.0,0,t1_i0tg0l1,i0tg0l1,False,Buelldozer,t3_tf10c3,https://www.reddit.com/r/wyoming/comments/tf10c3/family_asks_school_board_why_was_student_athlete/,Family asks school board: Why was student athlete allowed to compete after sex crime?,/r/wyoming/comments/tf10c3/family_asks_school_board_why_was_student_athlete/i0tg0l1/,12,r/wyoming,0,12
