body,author_fullname,author.name,controversiality,created,downs,fullname,id,is_root,link_author,link_id,link_permalink,link_title,permalink,score,subreddit_name_prefixed,total_awards_received,ups
That's a good road.  I'm not sure with the recent snow but ordinarily it's better than a lot of our state's paved roads.,t2_39356h3y,PigFarmer1,0,1647014331.0,0,t1_i094w0j,i094w0j,False,wolfman863,t3_tblh76,https://www.reddit.com/r/wyoming/comments/tblh76/im_getting_conflicting_information_about_pilot/,I'm getting conflicting information about Pilot Butte Wild Horse Scenic Loop. Can I drive the loop in a Nissan Rogue (rented)?,/r/wyoming/comments/tblh76/im_getting_conflicting_information_about_pilot/i094w0j/,3,r/wyoming,0,3
Is this just an effort by republican leadership to push him out and give hageman a better chance against Cheney,t2_a4j9szrk,Remarkable-Way4986,0,1647012190.0,0,t1_i08zkcp,i08zkcp,True,Remarkable-Way4986,t3_tbscq9,https://www.reddit.com/r/wyoming/comments/tbscq9/was_this_justified/,Was this justified?,/r/wyoming/comments/tbscq9/was_this_justified/i08zkcp/,2,r/wyoming,0,2
Do you think the government has any business getting involved in medical decisions? Do you think religious beliefs belong in our government?what does Republicans diatribe scream out all the time? What strict construction reading of the constitution say? Yet here are.,t2_8uxsek35,No_Mathematician764,0,1647012163.0,0,t1_i08zhwu,i08zhwu,True,may_june_july,t3_tbrwzu,https://www.reddit.com/r/wyoming/comments/tbrwzu/legislature_sends_antiabortion_measure_to_the/,Legislature sends anti-abortion measure to the governor,/r/wyoming/comments/tbrwzu/legislature_sends_antiabortion_measure_to_the/i08zhwu/,31,r/wyoming,0,31
"My husband and I are considering moving to Powell or Cody for his work. He's a big hunter and fisherman (I go sometimes too). Overall we like doing stuff outside. I'm a horseback rider (English, eventing) and like to do yoga. We'd be moving from Colorado where we both are government employees. I saw some threads about living in Cody but none really recent (closest was like 4 years ago). Whats the real estate market like? Culture? Ability to find a part time job that makes good tips in the summer?",t2_p93r9dj,charstorm,0,1647011111.0,0,t1_i08wykv,i08wykv,True,AutoModerator,t3_sy1dbt,https://www.reddit.com/r/wyoming/comments/sy1dbt/questions_about_moving_to_or_visiting_wyoming_ask/,Questions about moving to or visiting Wyoming? Ask here!,/r/wyoming/comments/sy1dbt/questions_about_moving_to_or_visiting_wyoming_ask/i08wykv/,2,r/wyoming,0,2
The headline and article should read *Thursday* March 10,t2_zek68,may_june_july,0,1647010244.0,0,t1_i08uwka,i08uwka,True,may_june_july,t3_tbrqnk,https://www.reddit.com/r/wyoming/comments/tbrqnk/governor_gordon_takes_action_on_3_bills_on/,"Governor Gordon Takes Action on 3 Bills on Wednesday, March 10",/r/wyoming/comments/tbrqnk/governor_gordon_takes_action_on_3_bills_on/i08uwka/,3,r/wyoming,0,3
They for sure do this. 100%. Which is fine; people’s vote should matter,t2_74q34syl,lewisiarediviva,0,1647009233.0,0,t1_i08skn1,i08skn1,False,may_june_july,t3_tb0w16,https://www.reddit.com/r/wyoming/comments/tb0w16/crossover_voting_ban_dies_other_election/,"Crossover voting ban dies, other election legislation prevails - WyoFile",/r/wyoming/comments/tb0w16/crossover_voting_ban_dies_other_election/i08skn1/,5,r/wyoming,0,5
"I've driven the loop in an Accord years back-- it really depends on the time of year and the condition of the road and recent weather. In April you run the risk of snow drifts and/or it being quite muddy. Recently, BLM rounded up most of the wild horses and keep some of them corralled on Lionkol Rd in Rock Springs. Lately, there is a very small herd in the wild that can be seen on 191 between Farson and Rock Springs but there is no way to be sure that you'll see them any given day and come spring they'll be moving around more.",t2_y44b3,thisistherevolution,0,1647008725.0,0,t1_i08rg0z,i08rg0z,True,wolfman863,t3_tblh76,https://www.reddit.com/r/wyoming/comments/tblh76/im_getting_conflicting_information_about_pilot/,I'm getting conflicting information about Pilot Butte Wild Horse Scenic Loop. Can I drive the loop in a Nissan Rogue (rented)?,/r/wyoming/comments/tblh76/im_getting_conflicting_information_about_pilot/i08rg0z/,3,r/wyoming,1,3
"That'll definitely be a breach of the rental car contract, as most major companies contracts state their vehicles can only be taken on ""maintained roads.""  Website for the loop recommends ""high clearance 4 wheel drive"" so you'll probably want to skip it. Better to miss a view than to be on the hook for getting a rental car stuck and damaged.",t2_cfkwo8l7,DerpFaceMcGee810,0,1647008176.0,0,t1_i08q8k6,i08q8k6,True,wolfman863,t3_tblh76,https://www.reddit.com/r/wyoming/comments/tblh76/im_getting_conflicting_information_about_pilot/,I'm getting conflicting information about Pilot Butte Wild Horse Scenic Loop. Can I drive the loop in a Nissan Rogue (rented)?,/r/wyoming/comments/tblh76/im_getting_conflicting_information_about_pilot/i08q8k6/,3,r/wyoming,0,3
"Go on the wingnut welfare circuit, painting himself as the real victim?",t2_xjtix,Raineythereader,0,1647007931.0,0,t1_i08ppv0,i08ppv0,False,Kari_Safari,t3_tbglk3,https://www.reddit.com/r/wyoming/comments/tbglk3/senator_bouchard_stripped_of_committee_assignments/,Senator Bouchard stripped of committee assignments,/r/wyoming/comments/tbglk3/senator_bouchard_stripped_of_committee_assignments/i08ppv0/,6,r/wyoming,0,6
"Doubling down on it. Oof.   


>“So, bottom line, it’s a story when I was young, two teenagers, girl gets pregnant,” he said in the Facebook Live video. “You’ve heard those stories before. She was a little younger than me, so it’s like the Romeo and Juliet story.” Bouchard told the Star-Tribune he married the girl when she was 15 and he was 19. At the time, they were both living in Florida.",t2_gi2ef,cavscout43,0,1647004125.0,0,t1_i08i4uc,i08i4uc,False,Kari_Safari,t3_tbglk3,https://www.reddit.com/r/wyoming/comments/tbglk3/senator_bouchard_stripped_of_committee_assignments/,Senator Bouchard stripped of committee assignments,/r/wyoming/comments/tbglk3/senator_bouchard_stripped_of_committee_assignments/i08i4uc/,9,r/wyoming,0,9
"Yep- they don't mind the ""poorly educated"" ( Not my words) But if a person is saddled with kids they weren't ready for ( birth control would certainly help that) and less educated, the cycle of poverty just increases.  As far as I can tell, the real winners are the corporations that build low income housing. They charge the tenant, they charge the government & it goes on & on...",t2_z2cmk,lindamay6838,0,1647002443.0,0,t1_i08f5lm,i08f5lm,False,may_june_july,t3_tb0rax,https://www.reddit.com/r/wyoming/comments/tb0rax/rape_and_incest_exemptions_added_to_abortion_bill/,Rape and incest exemptions added to abortion bill,/r/wyoming/comments/tb0rax/rape_and_incest_exemptions_added_to_abortion_bill/i08f5lm/,3,r/wyoming,0,3
I guess they want to increase the population,t2_e539jmdj,AyWhatITIS,0,1647001870.0,0,t1_i08e7p8,i08e7p8,False,may_june_july,t3_tb0rax,https://www.reddit.com/r/wyoming/comments/tb0rax/rape_and_incest_exemptions_added_to_abortion_bill/,Rape and incest exemptions added to abortion bill,/r/wyoming/comments/tb0rax/rape_and_incest_exemptions_added_to_abortion_bill/i08e7p8/,2,r/wyoming,0,2
Thank you so much!,t2_2mrnmr7v,orchardreddit,0,1646999992.0,0,t1_i08baij,i08baij,False,orchardreddit,t3_tadboe,https://www.reddit.com/r/wyoming/comments/tadboe/my_friend_and_i_started_a_yt_channel_and_we_did_a/,My friend and I started a YT channel and we did a short about the Wyoming State All Stars,/r/wyoming/comments/tadboe/my_friend_and_i_started_a_yt_channel_and_we_did_a/i08baij/,1,r/wyoming,0,1
"Say what you will about the guy, but he ALWAYS slows down in a school zone.",t2_itk7l,WyoPeeps,0,1646982171.0,0,t1_i07owbm,i07owbm,True,Kari_Safari,t3_tbglk3,https://www.reddit.com/r/wyoming/comments/tbglk3/senator_bouchard_stripped_of_committee_assignments/,Senator Bouchard stripped of committee assignments,/r/wyoming/comments/tbglk3/senator_bouchard_stripped_of_committee_assignments/i07owbm/,24,r/wyoming,0,24
Fuck this blowhard asshat.,t2_bbd3d,Cowboy307,0,1646982047.0,0,t1_i07opvz,i07opvz,True,Kari_Safari,t3_tbglk3,https://www.reddit.com/r/wyoming/comments/tbglk3/senator_bouchard_stripped_of_committee_assignments/,Senator Bouchard stripped of committee assignments,/r/wyoming/comments/tbglk3/senator_bouchard_stripped_of_committee_assignments/i07opvz/,16,r/wyoming,0,16
"Sheridan is in the northwest of wyoming, I love the suburbs there.  I don't know much about cody, but when Im searching Georgia(country) for travel there is a City called lanchkhuti when I want to learn about the Town history on Wikipedia, There is a section ""sister cities"", Im shocked how a small City in Georgia🇬🇪 sister with Cody Wyoming. 😅
 Georgia, very close to turkey I been there twice,
 both times I stayed in batumi. my family don't want to go Tbilisi (capital) but they are planning to go there this Spring.",t2_hsnjg0ap,Sweetyreply,0,1646978739.0,0,t1_i07jwbl,i07jwbl,False,Sweetyreply,t3_t9mlyt,https://www.reddit.com/r/wyoming/comments/t9mlyt/i_dont_know_why_as_a_foreign_teenager_cant_come/,"I don't know why, as a foreign teenager, can't come to U.S. - my favorite state is Wyoming my favorite City is Casper. You have a wonderful nature, protect it. greetings from turkey 🇹🇷🇺🇲🇺🇲🇹🇷",/r/wyoming/comments/t9mlyt/i_dont_know_why_as_a_foreign_teenager_cant_come/i07jwbl/,1,r/wyoming,0,1
"Loved this! The rest of your videos look great, too, can't wait to watch those.",t2_535vlkz2,earmares,0,1646978258.0,0,t1_i07j5ji,i07j5ji,True,orchardreddit,t3_tadboe,https://www.reddit.com/r/wyoming/comments/tadboe/my_friend_and_i_started_a_yt_channel_and_we_did_a/,My friend and I started a YT channel and we did a short about the Wyoming State All Stars,/r/wyoming/comments/tadboe/my_friend_and_i_started_a_yt_channel_and_we_did_a/i07j5ji/,2,r/wyoming,0,2
I wonder what he’ll do with all his newly acquired free time…,t2_8fyiqy3k,rgymous,0,1646973986.0,0,t1_i07c1sr,i07c1sr,True,Kari_Safari,t3_tbglk3,https://www.reddit.com/r/wyoming/comments/tbglk3/senator_bouchard_stripped_of_committee_assignments/,Senator Bouchard stripped of committee assignments,/r/wyoming/comments/tbglk3/senator_bouchard_stripped_of_committee_assignments/i07c1sr/,11,r/wyoming,0,11
The same guy who said he’s blow up a bomb in a school?,t2_5wan6n,R0binSage,0,1646973733.0,0,t1_i07blvg,i07blvg,True,Kari_Safari,t3_tbglk3,https://www.reddit.com/r/wyoming/comments/tbglk3/senator_bouchard_stripped_of_committee_assignments/,Senator Bouchard stripped of committee assignments,/r/wyoming/comments/tbglk3/senator_bouchard_stripped_of_committee_assignments/i07blvg/,6,r/wyoming,0,6
"Love the last sentence of the article, 'Last year, his campaign was rocked by his admission that he impregnated a 14-year-old girl when he was 18 and living in Florida.' 

A little gas on the fire.",t2_11ygx1,curiousinthecity,0,1646970367.0,0,t1_i075am8,i075am8,True,Kari_Safari,t3_tbglk3,https://www.reddit.com/r/wyoming/comments/tbglk3/senator_bouchard_stripped_of_committee_assignments/,Senator Bouchard stripped of committee assignments,/r/wyoming/comments/tbglk3/senator_bouchard_stripped_of_committee_assignments/i075am8/,40,r/wyoming,0,40
Who could have thought it would have been [this guy?](https://trib.com/news/state-and-regional/govt-and-politics/us-house-candidate-bouchard-says-he-impregnated-14-year-old-when-he-was-18/article_c3996062-e6ad-5027-96a9-1bcd0f832eda.html),t2_56e49,dos4g,0,1646970318.0,0,t1_i07574j,i07574j,True,Kari_Safari,t3_tbglk3,https://www.reddit.com/r/wyoming/comments/tbglk3/senator_bouchard_stripped_of_committee_assignments/,Senator Bouchard stripped of committee assignments,/r/wyoming/comments/tbglk3/senator_bouchard_stripped_of_committee_assignments/i07574j/,14,r/wyoming,0,14
"It's always the ones you would *never* expect....

&#x200B;

&#x200B;

&#x200B;

&#x200B;

&#x200B;

&#x200B;

&#x200B;

/s",t2_7uyw8et8,SquishyPotato117,0,1646969219.0,0,t1_i072zap,i072zap,True,Kari_Safari,t3_tbglk3,https://www.reddit.com/r/wyoming/comments/tbglk3/senator_bouchard_stripped_of_committee_assignments/,Senator Bouchard stripped of committee assignments,/r/wyoming/comments/tbglk3/senator_bouchard_stripped_of_committee_assignments/i072zap/,26,r/wyoming,0,26
"is that even zoned residential?  does casper have zoning, idk.",t2_551r2,NBABUCKS1,0,1646964667.0,0,t1_i06tbik,i06tbik,True,thelma_edith,t3_tb96yj,https://www.reddit.com/r/wyoming/comments/tb96yj/redneckchic_spread_asks_26m_in_wyoming/,Redneck-chic spread asks $2.6M in Wyoming,/r/wyoming/comments/tb96yj/redneckchic_spread_asks_26m_in_wyoming/i06tbik/,4,r/wyoming,0,4
:),t2_ck2j48fw,Crumpet_is_filthy,0,1646962785.0,0,t1_i06p6ib,i06p6ib,True,Crumpet_is_filthy,t3_tbeqjk,https://www.reddit.com/r/wyoming/comments/tbeqjk/fuck_you/,Fuck you.,/r/wyoming/comments/tbeqjk/fuck_you/i06p6ib/,1,r/wyoming,0,1
" They’ve been living there 28 years. I hope it’s paid for, and the walk away with the 2.6 mil lol!",t2_3t556ma4,Perle1234,0,1646959406.0,0,t1_i06hpz9,i06hpz9,True,thelma_edith,t3_tb96yj,https://www.reddit.com/r/wyoming/comments/tb96yj/redneckchic_spread_asks_26m_in_wyoming/,Redneck-chic spread asks $2.6M in Wyoming,/r/wyoming/comments/tb96yj/redneckchic_spread_asks_26m_in_wyoming/i06hpz9/,7,r/wyoming,0,7
"[""it""](https://c.tenor.com/Tu4ybDGsGfQAAAAC/cannabis-spirituality.gif)

Won't somebody *PLEASE* think of the children?!  ^^^^/s",t2_cydwa,genericdude999,0,1646958540.0,0,t1_i06ftcc,i06ftcc,False,lewisiarediviva,t3_tarz1f,https://www.reddit.com/r/wyoming/comments/tarz1f/bill_that_allows_wyoming_to_issue_own_digital/,Bill That Allows Wyoming To Issue Own Digital Currency Moving Through House,/r/wyoming/comments/tarz1f/bill_that_allows_wyoming_to_issue_own_digital/i06ftcc/,2,r/wyoming,0,2
Right?  What's to stop democrats from becoming registered republicans just because a democratic vote is wasted here in Wyoming.  They may as well register as republican and vote their preferred candidate.,t2_15kzq6,Sandpaper_Pants,0,1646957730.0,0,t1_i06e19y,i06e19y,False,may_june_july,t3_tb0w16,https://www.reddit.com/r/wyoming/comments/tb0w16/crossover_voting_ban_dies_other_election/,"Crossover voting ban dies, other election legislation prevails - WyoFile",/r/wyoming/comments/tb0w16/crossover_voting_ban_dies_other_election/i06e19y/,9,r/wyoming,0,9
Does anyone have a link to the actual bill?,t2_2u0t8404,Earthviolet76,0,1646956798.0,0,t1_i06bzkp,i06bzkp,True,may_june_july,t3_tb0rax,https://www.reddit.com/r/wyoming/comments/tb0rax/rape_and_incest_exemptions_added_to_abortion_bill/,Rape and incest exemptions added to abortion bill,/r/wyoming/comments/tb0rax/rape_and_incest_exemptions_added_to_abortion_bill/i06bzkp/,2,r/wyoming,0,2
"Can confirm about CA. 

The racism in CA was out of control. Wyoming is way more accepting of me (biracial) than most places in CA were.",t2_c0nzgjqp,Sellitall1,0,1646955073.0,0,t1_i0684j8,i0684j8,False,j4w77,t3_tamhu3,https://www.reddit.com/r/wyoming/comments/tamhu3/2_physicians_hoping_to_practice_in_wyoming/,2 physicians hoping to practice in Wyoming,/r/wyoming/comments/tamhu3/2_physicians_hoping_to_practice_in_wyoming/i0684j8/,6,r/wyoming,0,6
Modern day National Enquirer.,t2_5l6nj5l5,Immediate_Thought656,0,1646953774.0,0,t1_i0656q1,i0656q1,False,thelma_edith,t3_tb96yj,https://www.reddit.com/r/wyoming/comments/tb96yj/redneckchic_spread_asks_26m_in_wyoming/,Redneck-chic spread asks $2.6M in Wyoming,/r/wyoming/comments/tb96yj/redneckchic_spread_asks_26m_in_wyoming/i0656q1/,7,r/wyoming,0,7
Hadi bey!,t2_cj77q,catacombpartier,0,1646950963.0,0,t1_i05yigq,i05yigq,False,Sweetyreply,t3_t9mlyt,https://www.reddit.com/r/wyoming/comments/t9mlyt/i_dont_know_why_as_a_foreign_teenager_cant_come/,"I don't know why, as a foreign teenager, can't come to U.S. - my favorite state is Wyoming my favorite City is Casper. You have a wonderful nature, protect it. greetings from turkey 🇹🇷🇺🇲🇺🇲🇹🇷",/r/wyoming/comments/t9mlyt/i_dont_know_why_as_a_foreign_teenager_cant_come/i05yigq/,3,r/wyoming,0,3
Gosh. I'll be sure to scoop up a bunch of those.,t2_7m0nc,2_dam_hi,0,1646948571.0,0,t1_i05siob,i05siob,True,lewisiarediviva,t3_tarz1f,https://www.reddit.com/r/wyoming/comments/tarz1f/bill_that_allows_wyoming_to_issue_own_digital/,Bill That Allows Wyoming To Issue Own Digital Currency Moving Through House,/r/wyoming/comments/tarz1f/bill_that_allows_wyoming_to_issue_own_digital/i05siob/,0,r/wyoming,0,0
"The NYP is pretty much always sensationalist cancer.   


The actual real estate listing is way better and focuses it on being a chunk of land with two active businesses on the property.

&#x200B;

>[Mix business with pleasure in this unique Casper property. Currently, the site offers everything you need to walk in and start operations from day one with two successful businesses already established - Livestock Motel and Tuck It Away Storage. There are 45 paddocks, all a half-acre or larger and with steel pipe fencing. Most paddocks have a lean-to and a spigot with city water and, as of 1/30/2022, there are only two paddocks yet to be rented. Tuck It Away Storage has 36 units](https://www.remax.com/wy/casper/home-details/1470-s-robertson-rd-casper-wy-82604/10183636214486795476)",t2_gi2ef,cavscout43,0,1646948411.0,0,t1_i05s4bg,i05s4bg,False,thelma_edith,t3_tb96yj,https://www.reddit.com/r/wyoming/comments/tb96yj/redneckchic_spread_asks_26m_in_wyoming/,Redneck-chic spread asks $2.6M in Wyoming,/r/wyoming/comments/tb96yj/redneckchic_spread_asks_26m_in_wyoming/i05s4bg/,15,r/wyoming,0,15
Another article written by someone who has clearly never left Manhattan.,t2_593uwhxo,ravenfool1066,0,1646947855.0,0,t1_i05qq4i,i05qq4i,True,thelma_edith,t3_tb96yj,https://www.reddit.com/r/wyoming/comments/tb96yj/redneckchic_spread_asks_26m_in_wyoming/,Redneck-chic spread asks $2.6M in Wyoming,/r/wyoming/comments/tb96yj/redneckchic_spread_asks_26m_in_wyoming/i05qq4i/,16,r/wyoming,0,16
Any bill that had to \*add\* such provisions to the bill was starting off from a very misogynistic place.,t2_1z8beue0,AlanPeery,0,1646947509.0,0,t1_i05pv46,i05pv46,True,may_june_july,t3_tb0rax,https://www.reddit.com/r/wyoming/comments/tb0rax/rape_and_incest_exemptions_added_to_abortion_bill/,Rape and incest exemptions added to abortion bill,/r/wyoming/comments/tb0rax/rape_and_incest_exemptions_added_to_abortion_bill/i05pv46/,14,r/wyoming,0,14
"I've lived all over the country(Cali, Virginia, NC, Texas and others) and never heard any racist remarks directed toward me until Wyoming.    I'm Half Asian, was in Gillette.      I heard similar stories from some other Asians in town.   

Saying that, there were mostly really good people there.",t2_fz6jy,branniganbginagain,0,1646945092.0,0,t1_i05js30,i05js30,True,j4w77,t3_tamhu3,https://www.reddit.com/r/wyoming/comments/tamhu3/2_physicians_hoping_to_practice_in_wyoming/,2 physicians hoping to practice in Wyoming,/r/wyoming/comments/tamhu3/2_physicians_hoping_to_practice_in_wyoming/i05js30/,0,r/wyoming,0,0
There's a position open in Pinedale right now. Hospital construction should break ground this summer.,t2_f07pr,djkuhl,0,1646943380.0,0,t1_i05ff6h,i05ff6h,False,j4w77,t3_tamhu3,https://www.reddit.com/r/wyoming/comments/tamhu3/2_physicians_hoping_to_practice_in_wyoming/,2 physicians hoping to practice in Wyoming,/r/wyoming/comments/tamhu3/2_physicians_hoping_to_practice_in_wyoming/i05ff6h/,2,r/wyoming,0,2
"55 year resident, people who contribute to the community are ALWAYS welcome! My daughter finishes residency this May. Fingers crossed she makes it back to Wyoming.",t2_16sf90,WyoRip,0,1646940438.0,0,t1_i0581c8,i0581c8,True,j4w77,t3_tamhu3,https://www.reddit.com/r/wyoming/comments/tamhu3/2_physicians_hoping_to_practice_in_wyoming/,2 physicians hoping to practice in Wyoming,/r/wyoming/comments/tamhu3/2_physicians_hoping_to_practice_in_wyoming/i0581c8/,1,r/wyoming,0,1
"Cool, thanks for sharing. Casper is extremely windy. Police officers for the most part are all pretty nice throughout the state. What do you think of Sheridan or Cody?",t2_535vlkz2,earmares,0,1646939186.0,0,t1_i054qk5,i054qk5,False,Sweetyreply,t3_t9mlyt,https://www.reddit.com/r/wyoming/comments/t9mlyt/i_dont_know_why_as_a_foreign_teenager_cant_come/,"I don't know why, as a foreign teenager, can't come to U.S. - my favorite state is Wyoming my favorite City is Casper. You have a wonderful nature, protect it. greetings from turkey 🇹🇷🇺🇲🇺🇲🇹🇷",/r/wyoming/comments/t9mlyt/i_dont_know_why_as_a_foreign_teenager_cant_come/i054qk5/,2,r/wyoming,0,2
"Actually here is the truth,😅 because of I can't come there, I looked every City in Wyoming Via Google earth, Gillette seems fine, Cheyenne seems crowded, Im fond of your federal system by the way. I want to search for Casper Wy pd on YouTube😅 and Im shocked, the police officers seems very nice and friendly. Then I go back to Google earth and started exploring Casper. Thats why Casper is my favorite City in Wyoming.",t2_hsnjg0ap,Sweetyreply,0,1646938412.0,0,t1_i052obh,i052obh,False,Sweetyreply,t3_t9mlyt,https://www.reddit.com/r/wyoming/comments/t9mlyt/i_dont_know_why_as_a_foreign_teenager_cant_come/,"I don't know why, as a foreign teenager, can't come to U.S. - my favorite state is Wyoming my favorite City is Casper. You have a wonderful nature, protect it. greetings from turkey 🇹🇷🇺🇲🇺🇲🇹🇷",/r/wyoming/comments/t9mlyt/i_dont_know_why_as_a_foreign_teenager_cant_come/i052obh/,2,r/wyoming,0,2
"Yeah, and we know that nobody who’s into crypto likes weed. Totally separate demographics",t2_74q34syl,lewisiarediviva,0,1646938141.0,0,t1_i051z2w,i051z2w,False,lewisiarediviva,t3_tarz1f,https://www.reddit.com/r/wyoming/comments/tarz1f/bill_that_allows_wyoming_to_issue_own_digital/,Bill That Allows Wyoming To Issue Own Digital Currency Moving Through House,/r/wyoming/comments/tarz1f/bill_that_allows_wyoming_to_issue_own_digital/i051z2w/,2,r/wyoming,0,2
We’ll continue to tell people we’re a libertarian state…which a real example of is just north of us. Last time I was in Montucky I watched some old cowboys roll a joint in a bar and couldn’t help but think that that was not the stoner stereotype I had in mind!,t2_5l6nj5l5,Immediate_Thought656,0,1646938077.0,0,t1_i051t1t,i051t1t,False,lewisiarediviva,t3_tarz1f,https://www.reddit.com/r/wyoming/comments/tarz1f/bill_that_allows_wyoming_to_issue_own_digital/,Bill That Allows Wyoming To Issue Own Digital Currency Moving Through House,/r/wyoming/comments/tarz1f/bill_that_allows_wyoming_to_issue_own_digital/i051t1t/,4,r/wyoming,0,4
"Nooooo, we might make some dirty hippies happy.",t2_74q34syl,lewisiarediviva,0,1646936880.0,0,t1_i04ypfn,i04ypfn,False,lewisiarediviva,t3_tarz1f,https://www.reddit.com/r/wyoming/comments/tarz1f/bill_that_allows_wyoming_to_issue_own_digital/,Bill That Allows Wyoming To Issue Own Digital Currency Moving Through House,/r/wyoming/comments/tarz1f/bill_that_allows_wyoming_to_issue_own_digital/i04ypfn/,5,r/wyoming,0,5
Thanks!,t2_537d7,LHtheXF,0,1646936765.0,0,t1_i04yegj,i04yegj,False,LHtheXF,t3_t5igij,https://www.reddit.com/r/wyoming/comments/t5igij/help_anyone_recognize_this_mug_trying_to_replace/,Help! Anyone recognize this mug? Trying to replace it for a friend.,/r/wyoming/comments/t5igij/help_anyone_recognize_this_mug_trying_to_replace/i04yegj/,2,r/wyoming,0,2
Legalize it if you’re this desperate for revenue.,t2_5l6nj5l5,Immediate_Thought656,0,1646936764.0,0,t1_i04yebk,i04yebk,True,lewisiarediviva,t3_tarz1f,https://www.reddit.com/r/wyoming/comments/tarz1f/bill_that_allows_wyoming_to_issue_own_digital/,Bill That Allows Wyoming To Issue Own Digital Currency Moving Through House,/r/wyoming/comments/tarz1f/bill_that_allows_wyoming_to_issue_own_digital/i04yebk/,5,r/wyoming,0,5
"I go to thrift stores all the time, and I'm in Sheridan (2 hours away) so I'll keep my eye out.",t2_535vlkz2,earmares,0,1646936708.0,0,t1_i04y92t,i04y92t,True,LHtheXF,t3_t5igij,https://www.reddit.com/r/wyoming/comments/t5igij/help_anyone_recognize_this_mug_trying_to_replace/,Help! Anyone recognize this mug? Trying to replace it for a friend.,/r/wyoming/comments/t5igij/help_anyone_recognize_this_mug_trying_to_replace/i04y92t/,2,r/wyoming,0,2
I love seeing how much someone so far away loves Wyoming! 💗 But I have to ask- why is Casper your favorite?,t2_535vlkz2,earmares,0,1646936143.0,0,t1_i04wrsv,i04wrsv,True,Sweetyreply,t3_t9mlyt,https://www.reddit.com/r/wyoming/comments/t9mlyt/i_dont_know_why_as_a_foreign_teenager_cant_come/,"I don't know why, as a foreign teenager, can't come to U.S. - my favorite state is Wyoming my favorite City is Casper. You have a wonderful nature, protect it. greetings from turkey 🇹🇷🇺🇲🇺🇲🇹🇷",/r/wyoming/comments/t9mlyt/i_dont_know_why_as_a_foreign_teenager_cant_come/i04wrsv/,1,r/wyoming,0,1
